,postid,author,created_utc,permalink,score,title,selftext
2453,ky03ar,t2_17ge68,1610733999,/r/wallstreetbets/comments/ky03ar/tried_buying_options_for_the_first_time_this/,1,Tried buying options for the first time this morning when the market opened ,
2454,ky03mz,t2_pcaj2,1610734026,/r/wallstreetbets/comments/ky03mz/i_can_finally_say_im_as_stupid_as_the_rest_of_you/,1,I can finally say I m as stupid as the rest of you Watched CCIV crash and burn and thought it was a perfect time to drop 1k I don t have into a stock that s rising on speculation alone ,
2455,ky03qq,t2_8apc0bm5,1610734032,/r/wallstreetbets/comments/ky03qq/vhc_today/,0,VHC today, removed 
2456,ky04ba,t2_bzr3m,1610734073,/r/wallstreetbets/comments/ky04ba/my_child_support_money_in_amc_i_hope_i_qualify_to/,1,My child support money in AMC I hope I qualify to join wallstreetbets Thank You 9 squeeze to the moooon AMC Entertainment,
2457,ky04bj,t2_xx18j,1610734073,/r/wallstreetbets/comments/ky04bj/playtikas_ipo_pltk_just_hit_the_wire_its_go_time/,1,Playtika s IPO PLTK Just hit the wire it s go time , removed 
2458,ky04gl,t2_4z6oeoth,1610734084,/r/wallstreetbets/comments/ky04gl/show_everyone_what_were_made_of_and_buy_it_back/,1,Show everyone what we re made of and buy it back to green GME is down time buy to the moon ,
2459,ky0598,t2_7ighcqe,1610734144,/r/wallstreetbets/comments/ky0598/asti_blowing_up/,1,ASTI blowing up , removed 
2460,ky05et,t2_4jaiobfr,1610734156,/r/wallstreetbets/comments/ky05et/papa_cohens_value/,1,Papa Cohen s value, removed 
2461,ky05kf,t2_575n7gzc,1610734169,/r/wallstreetbets/comments/ky05kf/gme_history_told_by_internet_historian/,1,GME History told by Internet Historian, removed 
2462,ky05kr,t2_6s1q2,1610734170,/r/wallstreetbets/comments/ky05kr/my_technical_analysis_of_todays_desperate_spammers/,2,My technical analysis of today s desperate spammers,
2463,ky05qi,,1610734186,/r/wallstreetbets/comments/ky05qi/buying_and_selling_at_market_value/,1,Buying and selling at market value ,
2464,ky05uj,t2_cr6x5,1610734196,/r/wallstreetbets/comments/ky05uj/to_the_tendies_town_gme/,34,To the Tendies town GME ,
2465,ky060t,t2_8reoq9ov,1610734209,/r/wallstreetbets/comments/ky060t/nndm_steady_climb_not_stopping/,0,NNDM steady climb not stopping, removed 
2466,ky06gh,t2_og6cj,1610734243,/r/wallstreetbets/comments/ky06gh/bb_gang_holding_out_here/,2, BB gang holding out here ,
2467,ky06i0,t2_8apc0bm5,1610734246,/r/wallstreetbets/comments/ky06i0/apple_lawsuit_released/,0,Apple lawsuit released, removed 
2468,ky06jv,t2_94ohmex9,1610734251,/r/wallstreetbets/comments/ky06jv/ghiv_time_to_beat_down_cokes_out_mat_ishiba/,1,GHIV time to beat down cokes out Mat Ishiba , removed 
2469,ky06ko,t2_3kg4vwcu,1610734253,/r/wallstreetbets/comments/ky06ko/gme_shorts_expiring_in_about_3_hours/,1,GME Shorts expiring in about 3 hours, removed 
2470,ky06l9,t2_5tvki9vy,1610734254,/r/wallstreetbets/comments/ky06l9/gme_insider_activity/,1,GME Insider Activity, removed 
2471,ky06zf,t2_l0tl1,1610734288,/r/wallstreetbets/comments/ky06zf/stay_strong_hold_the_line/,45,Stay strong hold the line ,
2472,ky073q,t2_847p2fvh,1610734298,/r/wallstreetbets/comments/ky073q/gme_gang/,1,GME GANG ,
2473,ky075s,t2_fs1c2,1610734302,/r/wallstreetbets/comments/ky075s/gme_short_interest_is_up_shorts_are_fighting_for/,1,GME SHORT INTEREST IS UP SHORTS ARE FIGHTING FOR THEIR LIVES HOLD THE LINE BLOOMBERG TERMINAL DATA ,
2474,ky07b7,,1610734313,/r/wallstreetbets/comments/ky07b7/how_can_you_make_gain_a_post_without_commiting/,0,How can you make gain a post without commiting market manipulation ,
2475,ky07bp,,1610734315,/r/wallstreetbets/comments/ky07bp/every_other_day/,1,Every other day , deleted 
2476,ky07dp,t2_243xk691,1610734319,/r/wallstreetbets/comments/ky07dp/what_is_the_best_mobile_app_for_buyingtrading/,1,What is the best mobile app for buying trading stocks , removed 
2477,ky07je,t2_2q7v0jm,1610734332,/r/wallstreetbets/comments/ky07je/who_is_f_selling_stay_on_board_gme/,1,Who is f selling STAY ON BOARD GME ,
2478,ky07wf,t2_4yhineqj,1610734358,/r/wallstreetbets/comments/ky07wf/inpx/,1,INPX , removed 
2479,ky082r,t2_99nr5p3,1610734373,/r/wallstreetbets/comments/ky082r/tsmc_just_announced_3nm_chips_for_this_year/,1,TSMC just announced 3nm chips for this year, removed 
2480,ky084a,t2_5h2m1bme,1610734376,/r/wallstreetbets/comments/ky084a/discussion_best_option_play_for_apha_tlry/,3,Discussion best option play for APHA amp TLRY , removed 
2481,ky08e6,t2_1r1isgb,1610734393,/r/wallstreetbets/comments/ky08e6/me_watching_gme_about_to_rocket/,4,Me watching GME about to rocket,
2482,ky08hx,t2_ml0vn2q,1610734401,/r/wallstreetbets/comments/ky08hx/bb_to_the_moon/,2,BB to the moon , removed 
2483,ky08nb,t2_97prk80x,1610734412,/r/wallstreetbets/comments/ky08nb/rwallstreetbets_i_might_have_you_beat_in_the/,1,r wallstreetbets I might have you beat in the retard department ,
2484,ky08vn,,1610734430,/r/wallstreetbets/comments/ky08vn/gme_motivation_tendies_coming_soon/,1,GME Motivation tendies coming soon , deleted 
2485,ky093z,t2_ahc2g,1610734449,/r/wallstreetbets/comments/ky093z/how_many_wsb_dummies_have_convinced_their_friends/,0,How many WSB Dummies have convinced their friends and family to buy GME as well , removed 
2486,ky0978,t2_7yzvu87b,1610734456,/r/wallstreetbets/comments/ky0978/cciv_lucid_new_tesla/,1,CCIV LUCID NEW TESLA,
2487,ky0a27,t2_5xi17iov,1610734523,/r/wallstreetbets/comments/ky0a27/first_invest_was_mrna_11_last_week_hello_fellow/,1,First invest was MRNA 11 last week hello fellow autists ,
2488,ky0a4g,t2_77j5yxdf,1610734527,/r/wallstreetbets/comments/ky0a4g/michael_burry_predicted_the_bursting_of_the/,6,Michael Burry predicted the bursting of the housing bubble as seen in The Big Short buys in to GME to try force a short squeeze, removed 
2489,ky0ad0,t2_ur9jhrn,1610734545,/r/wallstreetbets/comments/ky0ad0/first_time_following_you_guys_on_a_trade_50/,1,First time following you guys on a trade 50 portfolio on BB, removed 
2490,ky0ao2,,1610734569,/r/wallstreetbets/comments/ky0ao2/bloomberg_showing_gme_short_interest_at_712m_hold/,1,Bloomberg showing GME short interest at 71 2m hold your ground friends, deleted 
2491,ky0b2b,t2_90hwtwi0,1610734600,/r/wallstreetbets/comments/ky0b2b/will_these_print_or_am_i_fcked/,1,Will these print or am I F cked ,
2492,ky0bxx,t2_sfmid,1610734668,/r/wallstreetbets/comments/ky0bxx/this_looks_promising_for_plantir/,2,This looks promising for Plantir ,
2493,ky0c71,t2_7y30exzs,1610734690,/r/wallstreetbets/comments/ky0c71/amc_the_next_gme/,1,AMC the next GME , removed 
2494,ky0ckc,t2_1izbemmz,1610734721,/r/wallstreetbets/comments/ky0ckc/the_legend_of_wallstreetbets_and_gamestop/,10,The Legend of Wallstreetbets and Gamestop,
2495,ky0ctf,t2_3gjzf,1610734743,/r/wallstreetbets/comments/ky0ctf/i_will_die_on_this_hill/,48,I will die on this hill,
2496,ky0czb,t2_6an8w,1610734756,/r/wallstreetbets/comments/ky0czb/gonna_find_out_about_bb/,1,Gonna find out about BB ,
2497,ky0dub,t2_3hyv24j0,1610734826,/r/wallstreetbets/comments/ky0dub/fisker/,1,Fisker, removed 
2498,ky0dx0,t2_l8149,1610734832,/r/wallstreetbets/comments/ky0dx0/other_than_pltr_has_there_ever_been_a_wsb_meme/,1,Other than PLTR has there ever been a WSB meme stock that failed and resulted in many of the autists here losing a lot of money , removed 
2499,ky0dyi,t2_u8qux,1610734835,/r/wallstreetbets/comments/ky0dyi/1100_in_pltr_vertical_calls_buying_nakeds_monday/,1, 1 100 in PLTR vertical calls buying nakeds Monday,
2500,ky0dub,t2_3hyv24j0,1610734826,/r/wallstreetbets/comments/ky0dub/fisker/,1,Fisker, removed 
2501,ky0dx0,t2_l8149,1610734832,/r/wallstreetbets/comments/ky0dx0/other_than_pltr_has_there_ever_been_a_wsb_meme/,1,Other than PLTR has there ever been a WSB meme stock that failed and resulted in many of the autists here losing a lot of money , removed 
2502,ky0dyi,t2_u8qux,1610734835,/r/wallstreetbets/comments/ky0dyi/1100_in_pltr_vertical_calls_buying_nakeds_monday/,1, 1 100 in PLTR vertical calls buying nakeds Monday,
2503,ky0dzo,t2_2xmy1hr9,1610734838,/r/wallstreetbets/comments/ky0dzo/a_message_for_cramer/,2,A message for Cramer , removed 
2504,ky0e13,t2_7808baoa,1610734841,/r/wallstreetbets/comments/ky0e13/bb_to_the_moon/,1,BB to the Moon ,
2505,ky0ef9,t2_6ew5x38e,1610734873,/r/wallstreetbets/comments/ky0ef9/isnt_this_one_of_those_crayon_drawings_that_means/,1,Isn t this one of those crayon drawings that means fuck bears ,
2506,ky0ekj,t2_67u9mpby,1610734885,/r/wallstreetbets/comments/ky0ekj/gme_consulting_ideas/,3, GME consulting ideas, removed 
2507,ky0etc,t2_pqccg,1610734903,/r/wallstreetbets/comments/ky0etc/all_aboard_the_bb_rocket_sink/,30,All aboard the BB rocket sink ,
2508,ky0ewa,t2_zxxb9,1610734910,/r/wallstreetbets/comments/ky0ewa/is_gme_done_i_just_dropped_10k_hoping_for/,27,Is GME done I just dropped 10k hoping for afternoon run ,
2509,ky0eyl,t2_z2whw,1610734914,/r/wallstreetbets/comments/ky0eyl/it_is_almost_2_years_since_the_1r0nyman_video_20/,1,It is almost 2 years since the 1R0NYMAN video 20 jan is there any celebration in the making , removed 
2510,ky0ezq,t2_9cb6oa6b,1610734917,/r/wallstreetbets/comments/ky0ezq/make_gme_at_40_or_ill_sell_all_rn/,0,MAKE GME AT 40 OR ILL SELL ALL RN, removed 
2511,ky0flv,t2_3zz1ld43,1610734964,/r/wallstreetbets/comments/ky0flv/noob_where_to_get_better_info/,1,Noob where to get better info , removed 
2512,ky0fs0,t2_au8drr7,1610734977,/r/wallstreetbets/comments/ky0fs0/lucid_insider_cciv_announced_big_meeting_this/,1,Lucid Insider CCIV announced big meeting this morning Stock jumped 20 and Trading was halted , removed 
2513,ky0fu5,t2_90hwtwi0,1610734982,/r/wallstreetbets/comments/ky0fu5/am_i_ok_or_should_i_sell/,0,Am I ok or should I sell ,
2514,ky0gaz,,1610735020,/r/wallstreetbets/comments/ky0gaz/gme_technically_retarded_analysis/,1,GME TECHNICAL LY RETARDED ANALYSIS, deleted 
2515,ky0gcb,t2_n6vf4,1610735023,/r/wallstreetbets/comments/ky0gcb/thats_me_done_bois_im_selling_all_my_gme/,0,THAT S ME DONE BOIS I M SELLING ALL MY GME, removed 
2516,ky0gke,t2_84e98,1610735038,/r/wallstreetbets/comments/ky0gke/bb_needham_growth_webcast_january_15_2021/,26, BB Needham Growth Webcast January 15 2021,Here s the link to the BB Investor webcast for January 15 2021 Eric Cornelius Chief Product Architect Ryan Permeh Chief Security Architect Tim Foote IR https wsw com webcast needham103 bb 1838040 https wsw com webcast needham103 bb 1838040 
2517,ky0h1s,,1610735075,/r/wallstreetbets/comments/ky0h1s/for_a_moment_i_thought_i_made_it/,1,For a moment i thought i made it , deleted 
2518,ky0h6r,t2_146z3e,1610735087,/r/wallstreetbets/comments/ky0h6r/newly_diagnosed_autist_here_bought_my_first_call/,1,Newly diagnosed Autist here bought my first call at market open 12c 1 22 Excited to ride this butt plug to the moon with you ,
2519,ky0hzj,t2_6p1y615n,1610735152,/r/wallstreetbets/comments/ky0hzj/thanks_apha_first_time_investing/,1,Thanks APHA first time investing ,
2520,ky0ia0,t2_vvwsp9r,1610735175,/r/wallstreetbets/comments/ky0ia0/bngo_just_bought_a_call_option_not_sure_if_that/,1,BNGO just bought a call option Not sure if that was the correct move but gains this month have been interesting thoughts ,
2521,ky0ibm,t2_fh8gm,1610735179,/r/wallstreetbets/comments/ky0ibm/keep_up_the_pressure_gme_short_borrowers_are/,1,Keep up the pressure GME short borrowers are paying 11 375 for loaned shares , removed 
2522,ky0itr,,1610735221,/r/wallstreetbets/comments/ky0itr/guru/,1,Guru,
2523,ky0jcv,t2_n7r7921,1610735259,/r/wallstreetbets/comments/ky0jcv/gme_still_has_10s_of_millions_of_shorts_to_cover/,3,GME still has 10s of millions of shorts to cover, removed 
2524,ky0jep,,1610735264,/r/wallstreetbets/comments/ky0jep/will_buy_one_share_of_gme_for_every_10_upvotes_i/,2,Will buy one share of GME for every 10 upvotes I get,
2525,ky0jgb,t2_9t8t08me,1610735267,/r/wallstreetbets/comments/ky0jgb/hello_guys/,1,Hello Guys , removed 
2526,ky0jj9,,1610735275,/r/wallstreetbets/comments/ky0jj9/all_aboard_the_bb_spaceship/,15,All aboard the BB spaceship , deleted 
2527,ky0jq4,,1610735290,/r/wallstreetbets/comments/ky0jq4/cramer_said_it_pltr_is_in_wsbs_hands/,1,Cramer said it PLTR IS IN WSB S HANDS , deleted 
2528,ky0jtg,t2_pcaj2,1610735298,/r/wallstreetbets/comments/ky0jtg/i_can_finally_say_im_as_dog_shit_stupid_as_the/,1,I can finally say I m as dog shit stupid as the rest of you Watched C C I V crash and burn and thought it was a perfect time to drop 1k I don t have into a stock that s rising on speculation alone ,
2529,ky0jts,t2_173xmy,1610735299,/r/wallstreetbets/comments/ky0jts/everything_i_have_left/,1,Everything I have left ,
2530,ky0juc,t2_djgsx,1610735300,/r/wallstreetbets/comments/ky0juc/gme_technically_retarded_analysis/,14,GME TECHNICAL LY RETARDED ANALYSIS,
2531,ky0jwq,,1610735304,/r/wallstreetbets/comments/ky0jwq/amc_due_diligence_bull_case/,0,AMC Due Diligence Bull Case ,
2532,ky0k0i,t2_3kzz0pjl,1610735311,/r/wallstreetbets/comments/ky0k0i/leave_robinhood_they_are_the_largest_mm/,1,Leave Robinhood they are the largest MM, removed 
2533,ky0k1t,t2_5shhtwsd,1610735314,/r/wallstreetbets/comments/ky0k1t/tlry_is_the_next_short_squeeze/,0,TLRY is the next SHORT SQUEEZE,
2534,ky0k9r,t2_6o4hvd3w,1610735331,/r/wallstreetbets/comments/ky0k9r/get_fucked_melvin_i_cant_touch_this_shit_for_30/,1,Get fucked Melvin I can t touch this shit for 30 years that s still sooner than you,
2535,ky0k9y,,1610735332,/r/wallstreetbets/comments/ky0k9y/if_ever_there_was_a_time_to_yolo_on_gme/,20,If ever there was a time to YOLO on GME,
2536,ky0km6,t2_3zw4xldd,1610735362,/r/wallstreetbets/comments/ky0km6/gme_question/,1,GME Question, removed 
2537,ky0kmy,t2_6rwhl,1610735363,/r/wallstreetbets/comments/ky0kmy/doing_my_part_with_my_awesome_17_shares_every_bit/,1,Doing my part with my awesome 17 shares every bit helps I threw my last 175 in Gme we got this ,
2538,ky0kqp,t2_5kbuar62,1610735372,/r/wallstreetbets/comments/ky0kqp/question_about_flow_through_share_tse_osk/,1,Question about flow through share TSE OSK, removed 
2539,ky0kt9,t2_8w27jbpq,1610735378,/r/wallstreetbets/comments/ky0kt9/i_bought_puts_in_gme_make_me_suffer/,1,I bought puts in GME make me suffer , removed 
2540,ky0lf2,t2_64s6gyka,1610735423,/r/wallstreetbets/comments/ky0lf2/pltr_holders_beware_cdc_urges_biden_to_drop/,1,PLTR HOLDERS BEWARE CDC Urges Biden To Drop Palantir s COVID Tracker definitely a warning for call holders short term,
2541,ky0llc,t2_68ykf9bu,1610735434,/r/wallstreetbets/comments/ky0llc/macd_about_to_cross_all_aboard_gme_keep_stacking/,31,MACD about to cross ALL ABOARD GME KEEP STACKING THEM DEEP ,
2542,ky0lok,,1610735441,/r/wallstreetbets/comments/ky0lok/gme_todays_mild_turbulence_has_pleasantly_rocked/,1,GME Todays mild turbulence has pleasantly rocked me to sleep sitting in a first class seat on the GME rocket to Mars , deleted 
2543,ky0lxk,,1610735458,/r/wallstreetbets/comments/ky0lxk/which_one_of_you_beautiful_idiots_did_this/,12,Which one of you beautiful idiots did this , deleted 
2544,ky0m9e,t2_9bzag7zk,1610735483,/r/wallstreetbets/comments/ky0m9e/cnk_due_diligence_bull_case/,0, CNK Due Diligence Bull Case ,Preface The big screen There s something to be said about watching visual storytelling on a three story screen particularly when the film really takes advantage of the format Just think of what it s like to see the Millennium Falcon jump into hyperspace in The Force Awakens or the loving long takes near bodies of water in Moonlight It s tempting to think that sitting in a dark theater staring at a massive white sheet won t matter when everyone has 40 plus inch 4K TVs but scale has a unique ability to sweep you away You get pulled into the sound and color in a way that you don t feel when you re sitting on your couch at home There s nothing inherently wrong with watching Star Wars on your phone tablet laptop or TV It s just that seeing something cinematic blown up big for the eyes to feast on is still a unique worthwhile experience Focus In your own home there are too many things Some of these things are your roommates or family members who talk to you out loud and some of these things are phones computers pets and the temptation to get up and recheck the fridge every 20 minutes Even people who try their hardest to give a movie their undivided attention on a living room screen have fallen victim to temptations like Well I m just sitting here I might as well pay the electric bill In the movie theater all you have is your chair any snacks you brought or bought and the movie you re there to watch You also have an empty bladder because you thought ahead not wanting to have to get up in the middle of the film to climb over people and cause a ruckus Relentlessness Part of the advantage of that kind of focus is that movies that are tense scary or deeply emotional can cast much more of a spell over you when you don t have the option to pause or turn away from the worst then rewind later to catch it safely out of context Watching Get Out at home especially alone it might be tempting to take breaks from time to time to escape the oppressive emotions on the screen In the theater you don t have that option it s going on with or without you which makes everything more intense and insistent and demanding You can t get the same excitement and catharsis from an experience you completely control In the theater it s out of your hands and that loss of control is part of the emotional experience A massive speaker system Is it just me or was there a lot of heavy breathing in Get Out I realized this because I saw it in theaters and if it wasn t in surround sound it was at least a solid C shape Even if you ve got some at home speaker system so fancy it makes you say things like Just listen to those decibels while you re playing a Rush track it s still not as good as the theater s Horror movies in particular benefit from massive movie theater sound the jumps are jumpier the screams more blood curdling But it doesn t hurt to hear a catchy pop song played loud as heck in a romantic comedy s opening credits And now that we ve forced Ryan Gosling to start singing it s on us to listen to his voice in the most dramatic way possible Previews I love a nice music video and in particular a music video that gets me all riled up about Harry Stiles debut film What a nice way to start your evening being reminded of all the movie magic still to come in your life The previews are the perfect time to settle in open your Red Vines and clutch some cutie s shoulder while you shout Oh I want to see that You can always watch trailers on YouTube but the thrill is gone and there s probably no nearby shoulder to clutch Alone time Going to the movies with friends or your significant other can be a cherished pastime especially when you re surrounded by an excited audience But there s nothing quite like being in an empty theater the air conditioning blasting away while you re enjoying a film free from judgment or rude voices Not every film affords this kind of pleasure You certainly wouldn t watch The Rocky Horror Picture Show by yourself because that s a communal experience But the ability to have something as majestic as Princess Mononoke wash over you and you alone is a powerful thrill Disruption No not the kind where the dude in front of you won t stop shouting lame quips or the couple behind you keeps explaining the movie to each other Those disruptions are still annoying I mean disruption in the sense the word has taken on in cultural and professional circles where anything that shakes up the status quo gives you a chance to re evaluate it A problem with watching movies at home is that it makes the film watching experience blur into the same experience as surfing cable channels running a Netflix comedy show in the background while you do dishes or half assedly watching an Adventure Time marathon while stoned Leaving your house and going to a space specifically designed for movies disrupts your mental patterns and primes you for an experience Bragging rights Tell me which one sounds better When I saw A New Hope at midnight at the drive in vs When I watched A New Hope on VHS in 1982 There s no question okay That was just a rhetorical exercise Jordan Peele has succeeded in marketing Get Out as an unmissable event where attendance feels more like getting to go to an enviable concert or one night only stage performance than it does sidling into a matinee because you have nothing better to do I saw it at a sold out showing its opening weekend which was fun not only because everyone was yelling and laughing but also because not everyone in the world got to tl dr The word movie is contained in movie theater Positions 65 contracts of CNK 01 15 2023 65C amp 750 shares of PLTR
2545,ky0mce,t2_7y4lec6c,1610735489,/r/wallstreetbets/comments/ky0mce/weak_market_is_good_for_gme_weak_stocks_more/,1,Weak Market is good for GME Weak Stocks More Margin Calls, removed 
2546,ky0n03,t2_68w1vvdg,1610735541,/r/wallstreetbets/comments/ky0n03/ask_not_what_you_can_do_for_gme_ask_what_gme_can/,1,ASK NOT WHAT YOU CAN DO FOR GME ASK WHAT GME CAN DO FOR YOU ,
2547,ky0na6,t2_851efiz6,1610735562,/r/wallstreetbets/comments/ky0na6/cciv_moonin_ah_today/,1,CCIV MOONIN AH today, removed 
2548,ky0nsy,t2_2ar1lgma,1610735604,/r/wallstreetbets/comments/ky0nsy/bb_to_the/,41,BB to the ,
2549,ky0o7h,t2_4ja5d,1610735634,/r/wallstreetbets/comments/ky0o7h/i_just_put_my_last_1000_into_gme_holding_to_100/,1,I just put my last 1000 into GME holding to 100 , removed 
2550,ky0ocy,t2_6mu40tgu,1610735647,/r/wallstreetbets/comments/ky0ocy/decided_to_go_for_it_pltr_lets_go/,24,Decided to go for it PLTR LET S GO ,
2551,ky0op2,t2_au8drr7,1610735669,/r/wallstreetbets/comments/ky0op2/lucid_insider_announced_big_meeting_today_with/,10,Lucid insider announced Big meeting today with announcement Stock shoots up 20 and trading is halted , removed 
2552,ky0ozw,,1610735693,/r/wallstreetbets/comments/ky0ozw/gme_to_the/,10,GME to the , deleted 
2553,ky0p37,t2_8loh8,1610735699,/r/wallstreetbets/comments/ky0p37/lmf_acquisition_opportunities_filed_for_an_ipo/,9,LMF Acquisition Opportunities filed for an IPO and will trade under the ticker symbol LMAO ,
2554,ky0pkw,t2_12nepn,1610735736,/r/wallstreetbets/comments/ky0pkw/tlry_going_to_bounce_back_hard_this_afternoon_and/,1, TLRY going to bounce back HARD this afternoon and shoot up buy while it s cheap Ur retarded if u don t,
2555,ky0pm0,t2_1k4c7ct6,1610735738,/r/wallstreetbets/comments/ky0pm0/bb/,1,BB, removed 
2556,ky0poj,t2_7o8s4zmo,1610735744,/r/wallstreetbets/comments/ky0poj/board_of_directors_in_a_few_months/,1, board of directors in a few months ,
2557,ky0ppf,t2_37uz4uum,1610735746,/r/wallstreetbets/comments/ky0ppf/gme_motivation_tendies_on_their_way/,60,GME Motivation tendies on their way ,
2558,ky0q5y,t2_7y4lec6c,1610735780,/r/wallstreetbets/comments/ky0q5y/weak_market_is_good_for_gme_weak_stocks_more/,23,Weak Market is good for GME Weak Stocks More Margin Calls, removed 
2559,ky0qeo,t2_7m8yb0kr,1610735797,/r/wallstreetbets/comments/ky0qeo/overdrafting_over_using_marginthe_autist_way/,1,Overdrafting over using margin the autist way , removed 
2560,ky0qu3,t2_hi3ij,1610735831,/r/wallstreetbets/comments/ky0qu3/stop_freaking_out/,1,Stop Freaking Out, removed 
2561,ky0r3s,t2_32ycvkub,1610735852,/r/wallstreetbets/comments/ky0r3s/gme_moass_is_inevitable/,20, GME MOASS Is Inevitable ,
2562,ky0rlq,t2_71d0q56c,1610735891,/r/wallstreetbets/comments/ky0rlq/you_guys_got_me_im_in/,1,You guys got me I m in ,
2563,ky0rr3,t2_2xt15cx4,1610735904,/r/wallstreetbets/comments/ky0rr3/fueling_the_bb_rocket/,1,Fueling the BB rocket ,
2564,ky0rty,t2_966m2w0v,1610735909,/r/wallstreetbets/comments/ky0rty/aitx/,1, AITX, removed 
2565,ky0ryc,,1610735920,/r/wallstreetbets/comments/ky0ryc/melvins_alts_out_in_full_force_today/,1,Melvin s Alts Out In Full Force Today, deleted 
2566,ky0s07,t2_bo8a8,1610735923,/r/wallstreetbets/comments/ky0s07/cciv_is_a_good_play_if_you_havent_looked_at_it_yet/,1,CCIV is a good play if you haven t looked at it yet , removed 
2567,ky0s1s,t2_14dqbj,1610735926,/r/wallstreetbets/comments/ky0s1s/just_starting_out_trading/,1,Just starting out trading ,
2568,ky0s2f,t2_87vo3yra,1610735927,/r/wallstreetbets/comments/ky0s2f/gme_terrible_short_entry_play_holding_for_dear/,1,GME TERRIBLE SHORT ENTRY PLAY HOLDING FOR DEAR LIFE 42 won t get me off my short nor will 100 I WILL WIN THIS PLAY FUCKERS ,
2569,ky0s7p,t2_655n4blt,1610735938,/r/wallstreetbets/comments/ky0s7p/amd_on_discount_today/,2,AMD on discount today , removed 
2570,ky0sbd,,1610735945,/r/wallstreetbets/comments/ky0sbd/maximus_says_hold/,1,Maximus says hold , deleted 
2571,ky0scn,t2_ixand,1610735948,/r/wallstreetbets/comments/ky0scn/kept_seeing_this_ad_on_reddit_and_i_fixed_it_for/,1,Kept seeing this ad on Reddit and I fixed it for accuracy,
2572,ky0sd3,t2_90hwtwi0,1610735949,/r/wallstreetbets/comments/ky0sd3/helpam_i_good_or_should_i_sell/,2,Help Am I good or should I sell ,
2573,ky0sht,t2_8lzatai0,1610735959,/r/wallstreetbets/comments/ky0sht/not_much_but_i_just_joined_the_fight_with_half_a/,1,Not much but I just joined the fight with half a yolo Fuck Melvin this is warrr One of us gooble gobble one of us ,
2574,ky0sic,t2_1cx8pd8f,1610735960,/r/wallstreetbets/comments/ky0sic/amc_next_gme/,1,AMC NEXT GME , removed 
2575,ky0sty,t2_xu772,1610735985,/r/wallstreetbets/comments/ky0sty/2nd_day_in_sub/,1,2nd day in sub, removed 
2576,ky0sva,t2_2aaqcgc7,1610735988,/r/wallstreetbets/comments/ky0sva/amc_next/,1,AMC next , removed 
2577,ky0sxc,t2_7jbeee2s,1610735992,/r/wallstreetbets/comments/ky0sxc/any_good_platforms_for_options_trading_in_the_uk/,1,Any good platforms for options trading in the UK , removed 
2578,ky0t3n,t2_4e66q5fd,1610736005,/r/wallstreetbets/comments/ky0t3n/gme_on_top_100_losers_on_rh_buy_buy_buy/,1,GME on top 100 losers on RH Buy buy buy ,
2579,ky0t79,t2_7nezx63y,1610736013,/r/wallstreetbets/comments/ky0t79/loading_ghsi_40k/,1,Loading GHSI 40k, removed 
