,postid,author,created_utc,permalink,score,title,selftext
0,kxiss1,t2_3yrk1xtx,1610670533,/r/wallstreetbets/comments/kxiss1/ark_buys_500000_shared_of_pltr_its_our_time_to/,1,Ark buys 500 000 shared of PLTR it s our time to shine,
1,kxit03,,1610670554,/r/wallstreetbets/comments/kxit03/ark_bought_more_pltr_lets_goooooo/,1,Ark bought more PLTR Let s goooooo , deleted 
2,kxit5h,t2_xw1cl,1610670566,/r/wallstreetbets/comments/kxit5h/cathie_wood_is_in_pltr_liftoff/,21,Cathie Wood is in PLTR liftoff,
3,kxiti0,t2_489fnkp5,1610670600,/r/wallstreetbets/comments/kxiti0/cathie_added_497100_share_of_pltr_to_arkw_today/,57,Cathie added 497100 share of PLTR to ARKW today you know what that means ,
4,kxitp0,t2_3nx35t2v,1610670616,/r/wallstreetbets/comments/kxitp0/more_pltr_in_arkw/,1,More PLTR in ARKW ,
5,kxityq,t2_8vij812r,1610670636,/r/wallstreetbets/comments/kxityq/cathiewood_has_spoken_pltr_to_the_moon/,1,CathieWood has spoken PLTR to the moon ,
6,kxiu5o,t2_o7i7gsg,1610670654,/r/wallstreetbets/comments/kxiu5o/were_in_control_now_citi_pltr/,1,We re in control now CITI PLTR ,
7,kxiu83,t2_4dmrus5u,1610670660,/r/wallstreetbets/comments/kxiu83/pltr_afterhours/,1,PLTR Afterhours, removed 
8,kxiuak,t2_110d9l,1610670665,/r/wallstreetbets/comments/kxiuak/lady_cathie_today_bought_additional_497k_shares/,1,Lady Cathie today bought additional 497k shares of PLTR to ARKW , removed 
9,kxiuom,t2_37e0dchm,1610670698,/r/wallstreetbets/comments/kxiuom/first_time_listening_to_you_retards_didnt_even/,1,First time listening to you retards Didn t even know BB was trading,
10,kxiuva,,1610670714,/r/wallstreetbets/comments/kxiuva/cathie_woods_buying_pltr/,1,CATHIE WOODS BUYING PLTR , deleted 
11,kxiv17,t2_9to8gt5n,1610670729,/r/wallstreetbets/comments/kxiv17/mvis_microvision/,1,MVIS MicroVision , removed 
12,kxiv7p,t2_14bzfa,1610670744,/r/wallstreetbets/comments/kxiv7p/dd_time_bois/,1,DD Time Bois,
13,kxivki,t2_8h9roges,1610670778,/r/wallstreetbets/comments/kxivki/something_big_happening_at_lucid_tomorrow_cciv/,1,Something big happening at Lucid tomorrow CCIV ,
14,kxivlq,t2_9od72je0,1610670782,/r/wallstreetbets/comments/kxivlq/xiaomi_hebeln/,1,Xiaomi Hebeln , removed 
15,kxivns,t2_6b285tws,1610670788,/r/wallstreetbets/comments/kxivns/gave_into_peer_pressure_will_these_print/,1,Gave into peer pressure Will these print ,
16,kxiw7i,t2_47ifj3i,1610670844,/r/wallstreetbets/comments/kxiw7i/it_was_a_good_week/,1,It was a good week,
17,kxiwx8,t2_633fj,1610670909,/r/wallstreetbets/comments/kxiwx8/so_if_gme_goes_south_you_think_we_can_trade_it/,1,So if GME goes south you think we can trade it all in for store credit , removed 
18,kxiwyf,t2_113ay9yr,1610670913,/r/wallstreetbets/comments/kxiwyf/pltr_here_we_go_boys/,13,PLTR Here we go boys ,
19,kxix0p,t2_109s0n,1610670919,/r/wallstreetbets/comments/kxix0p/when_youre_holding_gme_tilray_aphria_since_monday/,14,When You re holding GME Tilray amp Aphria Since Monday and another Stimulus Is On The Way,
20,kxix2a,t2_8qq6yuv9,1610670923,/r/wallstreetbets/comments/kxix2a/gme_best_customer_service_ever/,1,GME best customer service ever,
21,kxixcw,t2_8h9roges,1610670953,/r/wallstreetbets/comments/kxixcw/something_big_happening_at_lucid_tomorrow/,1, Something big happening at Lucid tomorrow ,
22,kxixfc,t2_2c0pm0ch,1610670959,/r/wallstreetbets/comments/kxixfc/i_was_gonna_pay_my_child_support_but_i_got_high/,1,I was gonna pay my child support but I got high ,
23,kxixfy,t2_2c5xgnky,1610670961,/r/wallstreetbets/comments/kxixfy/biden_to_unveil_19_trillion_covid19_relief_plan/,3,Biden to unveil 1 9 trillion COVID 19 relief plan with more stimulus checks,
24,kxixjn,t2_2aqf612h,1610670971,/r/wallstreetbets/comments/kxixjn/wsb_autistic_etrade_listening_to_biden_like_yeah/,1,Wsb autistic E TRADE listening to Biden like yeah we need the stimulus for rent Ya gme to 100 boys putting 2000 on black berry and gme tomorrow,
25,kxixpk,t2_2aqf612h,1610670987,/r/wallstreetbets/comments/kxixpk/wsb_autistic_rtards_listening_to_biden_like_yeah/,10,Wsb autistic rtards listening to Biden like yeah we need the stimulus for rent Ya gme to 100 boys putting 2000 on black berry and gme tomorrow,
26,kxixzx,t2_68fnoxm0,1610671010,/r/wallstreetbets/comments/kxixzx/legit_finance_professor_does_valuation_of_nio/,1,Legit finance professor does valuation of NIO, removed 
27,kxiy1c,t2_157du4,1610671014,/r/wallstreetbets/comments/kxiy1c/cathie_from_ark_has_joined_the_pltr_gang/,36,Cathie from Ark has joined the PLTR gang,
28,kxiy6v,t2_6euje5mk,1610671029,/r/wallstreetbets/comments/kxiy6v/came_back_from_eating_paint_chips_off_the_side_of/,1,Came back from eating paint chips off the side of my house to some BB gains Not much but plan to be a full retard one day like you guys ,
29,kxiyg8,t2_6y5lvfuj,1610671052,/r/wallstreetbets/comments/kxiyg8/your_next_stock_expr_had_highest_volume_is/,1,YOUR NEXT STOCK EXPR had highest volume is HISTORY today and broke a 3 year trend You want to know the next BIG stock its EXPRESS clothing it s one of the most beaten down retail stocks and people search for Express clothing at 3 5x the rate they search Gucci clothing ,
30,kxiyk9,t2_74yccsd0,1610671062,/r/wallstreetbets/comments/kxiyk9/ooooooo_look_who_just_bought_into_pltr_i_dont/,1,Ooooooo Look who just bought into PLTR I don t think they held any before I have looked but only at their top 20 and buys sells the past week ,
31,kxiyvs,t2_l51rj,1610671093,/r/wallstreetbets/comments/kxiyvs/baba_the_black_sheep/,1,BABA the black sheep, removed 
32,kxiyzk,t2_8qq6yuv9,1610671103,/r/wallstreetbets/comments/kxiyzk/gmebest_customer_service_ever/,1,GME Best customer service ever,
33,kxizcu,t2_72z8yt57,1610671136,/r/wallstreetbets/comments/kxizcu/profit_from_ev_without_buying_ev_market_lack_of/,11,Profit from EV without buying EV Market lack of supply for semiconductors ,If you agree please upvote this Not for me but so that others can see it The EV hype has caused lots of EV stocks to moon Whether or not this will continue no one knows and I don t care There has recently been a large shortage of semiconductors for cars As more and more companies start to produce electronic vehicles and as these stocks get pumped the demand for these semiconductors will go up Already there is a severe shortage in car chips Don t believe me You don t have to https www dw com en chip shortage disrupts global car production a 56224486 https finance yahoo com news daimler cut production over chip 171909050 html https www bloomberg com news articles 2021 01 14 carmakers crying out for chips fuels growth for globalfoundries srnd economics vp https www eenewseurope com news chip shortage forces german carmakers cut production page 0 1Then https sg finance yahoo com news 3 tech stocks that are on fire in 2021 hint one isnt apple 192221790 html https sg finance yahoo com news why semiconductor corp could beat 171005100 html https www businesswire com news home 20210114006044 en ON Semiconductor to Announce Fourth Quarter and 2020 Annual Financial Results Ok so yall aren t boomers so you probably didn t read all those links No problem But at least click this one https eu vocuspr com Publish 3434416 vcsPRAsset 3434416 101495 d41abebd 47b6 4c3b 920a 218dc83abf74 0 png And this one https m youtube com watch v DLzxrzFCyOs You see all those ON semiconductor is not very well known but makes chips in the USA Now out of that big chunk of links I sent read the last three The news has been coming out over the past few days even CNN is carrying a story about it but the mooning fortunately for you hasn t started yet https edition cnn com 2021 01 13 business global chip shortages carmakers index html The EV companies want to beat out their competition and make cars as fast as they can But there are no chips to do it This means they will start to pay absurd prices for these chips since they are at such a crucial moment for the company You can capitalise on this by buying calls or shares before this large shortage and hidden gem of an industry is uncovered RELEVANT Positions ON Feb 5 38 ON Feb 19 38 NIO Call TSLA put lotto play TLDR ON semiconductor will moon with the combined might of Large EV chip shortage and with earnings report coming in along with institutions hyping it up and pumping it Get in first before the others do Obligatory rockets 
34,kxizma,t2_8w8wj3e7,1610671162,/r/wallstreetbets/comments/kxizma/mama_cathie_just_bought_half_a_million_shares_of/,1,Mama Cathie just bought half a million shares of PLTR today ,
35,kxizpd,t2_vbq63,1610671171,/r/wallstreetbets/comments/kxizpd/based_cathie_wood_see_very_bottom_trade/,1,BASED Cathie Wood see very bottom trade ,
36,kxiztv,,1610671183,/r/wallstreetbets/comments/kxiztv/one_day_a_dip_will_come/,1,One day a dip will come, deleted 
37,kxizu5,t2_5qzp96oh,1610671184,/r/wallstreetbets/comments/kxizu5/arkw_just_bought_497100_pltr/,1,Arkw just Bought 497 100 pltr, removed 
38,kxj01q,t2_3lqvwdh8,1610671205,/r/wallstreetbets/comments/kxj01q/can_someone_help_thnx/,1,Can someone help thnx,
39,kxj03n,t2_91jhysuy,1610671209,/r/wallstreetbets/comments/kxj03n/next_to_bb/,1,Next to BB , removed 
40,kxj09z,t2_8wywchk1,1610671223,/r/wallstreetbets/comments/kxj09z/as_an_unofficial_joe_biden_interrupter_for/,1,As an unofficial Joe Biden interrupter for Republicans he is basically saying , removed 
41,kxj0fm,t2_2aqf612h,1610671239,/r/wallstreetbets/comments/kxj0fm/wall_street_bats_autistic_retards_listen_up_biden/,1,Wall Street bats autistic retards listen up Biden says he s giving us more money on the stimulus and guess what we re gonna dump it all on gme and blackberry to the moon baby ,
42,kxj0gn,t2_8xorbjfp,1610671242,/r/wallstreetbets/comments/kxj0gn/day_2_gme_porn_tomorrow_the_slaughter_continues/,24,Day 2 GME porn Tomorrow the slaughter continues DO NOT FUCKING SELL Who s with me GME GANG Yes I m planning to buy Jan15 55c tomorrow 9 30 ,
43,kxj0lg,t2_40es1y4n,1610671254,/r/wallstreetbets/comments/kxj0lg/is_bb_still_a_buy/,1,is BB still a buy , removed 
44,kxj0ov,t2_8ujoom7d,1610671262,/r/wallstreetbets/comments/kxj0ov/ark_bought_more_palantir_pltr/,1, ARK bought more Palantir PLTR,
45,kxj0r5,t2_68qizyof,1610671269,/r/wallstreetbets/comments/kxj0r5/sound_the_war_drums_boys_were_in/,1,Sound the war drums boys We re in ,
46,kxj1a8,t2_7axe5ytc,1610671319,/r/wallstreetbets/comments/kxj1a8/queen_cathie_supporting_the_pltr_cause_baby_added/,35,Queen Cathie supporting the PLTR cause baby added a shit ton of shares to ARKW,
47,kxj1a9,t2_68qizyof,1610671319,/r/wallstreetbets/comments/kxj1a9/sound_the_war_drum_boys_were_in/,1,Sound the war drum boys We re in ,
48,kxj1ng,t2_8pgbiv7x,1610671354,/r/wallstreetbets/comments/kxj1ng/viasat/,1,VIASAT, removed 
49,kxj1td,,1610671372,/r/wallstreetbets/comments/kxj1td/wall_street_bets_traders_are_about_to_be_crushed/,6,Wall Street Bets Traders Are About To Be Crushed By GameStop NYSE GME , deleted 
50,kxj22o,t2_iw1up,1610671397,/r/wallstreetbets/comments/kxj22o/new_to_this_i_will_ivest_1k_in_whatever_you/,1,New to this I will ivest 1k in whatever you retards tell me , removed 
51,kxj290,t2_5g5hwi2n,1610671415,/r/wallstreetbets/comments/kxj290/skillz/,4,sKillz,Skillz SKLZ is up 40 after its merger sell off Everyone kept saying before that it s a pump and dump but this shit has been picked up by so many powerful investors besides WSB Literally everything about this company is great they ve double in revenue in the past year as well I know everyone here keeps saying it s not a good play cause the games suck but they use these games on purpose because they re are fucking addicting to old people They are literally sucking money out of their pockets by making them bet money Also this company is preparing to expand to India which is huge news considering how it s only based in the U S I know this shit is about to blow up next week but once GME s shuttle lands please fucking take me the moon 
52,kxj3ie,t2_mo3dz,1610671525,/r/wallstreetbets/comments/kxj3ie/wsb_will_only_be_relevant_if_it_can_drive/,0,WSB will only be relevant if it can drive JCPenney to 3 50 a share, clap clap clap You losers got on Mad Money again Jim Cramer talked about you Aren t you a big boy Here s a news flash I used to commute out to Englewood Cliffs where the CNBC HQ is and saw Jim Cramer muttering idiotically to himself on the side of Route 9 CONSTANTLY You think his stage persona is an act No the guy s nuts Gamestop and Bed Bath are child s play Ha ha ha you produced a short squeeze on some 90 s early 2000 s retailers that are tanking Ha ha ha Blackberry It s like you are just picking random crap from what was popular during the George W Bush presidency and patting yourselves on the back you losers What s next investing in Limp Bizkit Kevin Federline Well you know what was popular during the George W Bush era You know what boomers who have heard about WSB will want a piece of JC Penney WSB will NEVER be relevant unless it can get JC Penney to 3 50 But it can be done Just look at this bastard CPPRQ It s not even JCP it s Old Copper Company I mean this is fantastic It s at 0 11 No balance sheet with any semblance of accuracy Still a big enough footprint that idiots will start to see this rising and jump onboard If you can get it to 0 40 in the next week you can get it to 3 50 in a month They fired their CEO recently If you play a squeeze the market will say it s a response to that news and it will drive this bad boy up exponentially They still have brand name so anything that triggers news about JC Penney will start exponentially driving the price up It s all there ripe for the picking If you can get this to 0 40 you can get it to 3 50 Read it and weep https ir jcpenney com sec filings all sec filings content 0001166126 20 000092 0001166126 20 000092 pdf https ir jcpenney com sec filings all sec filings content 0001166126 20 000092 0001166126 20 000092 pdf I own a Rolex I know what I m talking about Who wants to make some money 
53,kxj3lw,,1610671533,/r/wallstreetbets/comments/kxj3lw/cathie_bought_another_500k_shares_of_pltr_today/,1,Cathie bought another 500K shares of PLTR today total 2M Strap on it s about time we moon Ask your wife s boyfriend access to your life savings because we re about to take off , deleted 
54,kxj3mq,t2_6yy338wk,1610671536,/r/wallstreetbets/comments/kxj3mq/cramer_should_be_a_mod/,1,Cramer should be a mod, removed 
55,kxj3vw,t2_96k456ng,1610671560,/r/wallstreetbets/comments/kxj3vw/yolo_moon_shot/,1,YOLO MOON SHOT, removed 
56,kxj4bb,t2_15vlhf,1610671601,/r/wallstreetbets/comments/kxj4bb/queen_cathie_bought_more_pltr_is_pltr_gang_next/,1,QUEEN Cathie bought more PLTR Is PLTR Gang next up Obligatory GME position 1000 shares at 16 1 15 40C 1 15 50C 4 15 15call 1 22 15 LEAP ,
57,kxj4bd,,1610671601,/r/wallstreetbets/comments/kxj4bd/cathie_bought_another_500k_shares_of_pltr_today/,1,Cathie bought another 500K shares of PLTR today total 2M Strap on it s about time we moon Ask your wife s boyfriend access to your life savings because we re about to take off , deleted 
58,kxj4br,t2_7qknpv0w,1610671602,/r/wallstreetbets/comments/kxj4br/time_is_nearing_double_position_yuuup/,12,Time is nearing Double position YUUUP,
59,kxj4cg,t2_7qknpv0w,1610671604,/r/wallstreetbets/comments/kxj4cg/time_is_nearing_double_position_yuuup/,1,Time is nearing Double position YUUUP,
60,kxj4tv,,1610671652,/r/wallstreetbets/comments/kxj4tv/reporting_for_duty_got_in_under_40_and_holding/,1,Reporting for duty Got in under 40 and holding, deleted 
61,kxj4wx,t2_10f6jz,1610671661,/r/wallstreetbets/comments/kxj4wx/ark_bought_half_a_million_shares_of_pltr_today/,1,ARK bought half a million shares of PLTR today,
62,kxj540,t2_4ilkjo0m,1610671681,/r/wallstreetbets/comments/kxj540/hey_guys_anyone_heard_of_maiden_holdings_got_in/,1,Hey guys anyone heard of maiden holdings Got in at 54 It s around 2 30 or so New to the thread Just looking for some insight Thanks, removed 
63,kxj565,t2_9to8gt5n,1610671687,/r/wallstreetbets/comments/kxj565/microvision_mvis/,1,MicroVision MVIS, removed 
64,kxj5tn,,1610671748,/r/wallstreetbets/comments/kxj5tn/dedicated_to_the_gme_gang/,1,Dedicated to the GME gang, deleted 
65,kxj5uv,t2_3lqvwdh8,1610671750,/r/wallstreetbets/comments/kxj5uv/options_help/,1,Options help, removed 
66,kxj656,,1610671777,/r/wallstreetbets/comments/kxj656/cramer_gme_bynd_bbby/,1,Cramer GME BYND BBBY , deleted 
67,kxj7fn,t2_5tlvusnc,1610671899,/r/wallstreetbets/comments/kxj7fn/for_the_gme_gang/,1,For the GME Gang,
68,kxj7mu,t2_59to5r,1610671917,/r/wallstreetbets/comments/kxj7mu/ktos_vs_lmt/,1,KTOS vs LMT, removed 
69,kxj7oz,t2_2qbxv1y0,1610671923,/r/wallstreetbets/comments/kxj7oz/if_you_are_still_holding_gme_youre_an_idiot_and_i/,0,If you are still holding GME you re an idiot and I appreciate you ,
70,kxj7sl,t2_454xv4f5,1610671932,/r/wallstreetbets/comments/kxj7sl/bb_getting_ready_for_take_off_today_up_22_and_up/,15,BB getting ready for take off today Up 22 and up big after hours too ,
71,kxj81c,t2_3m33hsgb,1610671952,/r/wallstreetbets/comments/kxj81c/is_it_too_late_to_buy_bb/,1,Is it too late to buy BB, removed 
72,kxj81x,t2_85mwm3lc,1610671954,/r/wallstreetbets/comments/kxj81x/wall_street_bets_traders_are_about_to_be_crushed/,1,Wall Street Bets Traders Are About To Be Crushed By GameStop NYSE GME ,
73,kxj8di,t2_45u4cec5,1610671979,/r/wallstreetbets/comments/kxj8di/cramer_pumping_us_on_the_daily_now/,1,Cramer pumping us on the daily now,
74,kxj93j,t2_8gszjh73,1610672045,/r/wallstreetbets/comments/kxj93j/bb_pltr/,1,BB PLTR, removed 
75,kxj95p,t2_6jwbobwh,1610672051,/r/wallstreetbets/comments/kxj95p/bb_prepare_for_liftoff/,1, BB Prepare For Liftoff ,
76,kxj9c7,t2_5dbxg6qo,1610672068,/r/wallstreetbets/comments/kxj9c7/robinhood_froze_my_account/,1,Robinhood Froze My Account,
77,kxj9lu,t2_7s0j1eyk,1610672091,/r/wallstreetbets/comments/kxj9lu/pltr/,1,PLTR, removed 
78,kxj9mr,t2_zrou0,1610672094,/r/wallstreetbets/comments/kxj9mr/cramer_said_rocket_ship_emojis_on_television/,24, Cramer said rocket ship emojis on television while talking after talking about GME ,
79,kxj9o1,t2_4ed26,1610672098,/r/wallstreetbets/comments/kxj9o1/jim_cramer_breaks_down_the_short_busting_in/,14,Jim Cramer breaks down the short busting in GameStop Bed Bath amp Beyond,
80,kxja3n,t2_2c0pm0ch,1610672141,/r/wallstreetbets/comments/kxja3n/i_was_gonna_pay_my_child_support_but_then_i_got/,1,I was gonna pay my child support but then I got high,
81,kxja5b,t2_ifldi,1610672145,/r/wallstreetbets/comments/kxja5b/robinhood_now_lets_you_purchase_0dte_options_all/,1,Robinhood now let s you purchase 0dte options all the way up til 3pm eastern,
82,kxjabu,t2_92ck4k6a,1610672164,/r/wallstreetbets/comments/kxjabu/intraday_trade_notifications_from_ark/,1,Intraday Trade Notifications from ARK, removed 
83,kxjanc,t2_8nve8,1610672192,/r/wallstreetbets/comments/kxjanc/cnbc_is_now_using_autist_terminology/,6,CNBC is now using autist terminology ,
84,kxjata,t2_4tljkn13,1610672209,/r/wallstreetbets/comments/kxjata/who_the_fuck_is_jackson_call_we_got_our_own_wsb/,1,Who the fuck is Jackson Call We got our own WSB Celeb, removed 
85,kxjavr,,1610672215,/r/wallstreetbets/comments/kxjavr/newspaperreading_boomerbump_inbound/,4,Newspaper reading Boomer bump inbound , deleted 
86,kxjb44,t2_69lvsiq,1610672237,/r/wallstreetbets/comments/kxjb44/pltr_to_the_moon_afer_hours/,1,PLTR TO THE MOON AFER HOURS ,
87,kxjbie,t2_6x8bo71w,1610672273,/r/wallstreetbets/comments/kxjbie/cathy_buys_500k_pltr/,15,Cathy Buys 500K PLTR,
88,kxjbl8,t2_3xic3q9h,1610672281,/r/wallstreetbets/comments/kxjbl8/when_citi_downgraded_pltr_cathie_joined_in/,1,When Citi downgraded PLTR Cathie joined in, removed 
89,kxjblx,t2_ifldi,1610672283,/r/wallstreetbets/comments/kxjblx/robinhood_expands_their_0dte_options/,4,Robinhood expands their 0dte options,
90,kxjbry,,1610672301,/r/wallstreetbets/comments/kxjbry/look_at_666the_sign/,1,LOOK AT 666 The SIGN, deleted 
91,kxjby0,t2_250rg25,1610672318,/r/wallstreetbets/comments/kxjby0/certified_retard_needs_some_yolo_action/,1,Certified retard needs some yolo action, removed 
92,kxjc9s,t2_6o4skhuz,1610672348,/r/wallstreetbets/comments/kxjc9s/et_to_the_moon_pls/,2,ET to the moon pls ,What s good my dudes Been reading a lot on WSB about how the big hedges are finding out that they can be pimp slapped by us WSB retards so I figured I would ask a favor Could we to please stepkid kick ET to like 20 30 sh real quick like Hear me out In the middle of 2020 some old dude named warren buffet bought Dominion Energy s gas pipeline for 9 7b They have about 10 400 miles of pipeline ET has over 90 000 miles of pipeline and the whole lake Charles facility and other interesting and expensive things As of today 1 14 20 their market cap is 19 23b at 7 20 sh which is just sad and lame Using old guys valuations above ET should be valued at about 84b with a share price of 31 11 because math Plus they have a dividend and junk Anyways that s what I got So if there are any WSB rockets leaving the midstream pads anytime soon my official request is ET please and thank you 
93,kxjci7,t2_5eox9fg8,1610672367,/r/wallstreetbets/comments/kxjci7/bb_prepare_for_liftoff/,1, BB Prepare For Liftoff ,
94,kxjcs7,t2_mcj7qb9,1610672392,/r/wallstreetbets/comments/kxjcs7/time_for_tsla_to_return_to_the_moon/,4,Time for TSLA to return to the moon ,
95,kxjcta,t2_93sk9bct,1610672395,/r/wallstreetbets/comments/kxjcta/pltr_to_the_moon_after_hours_cathie_announces/,25, PLTR to the moon after hours Cathie announces buying more shares in ARK ,
96,kxjd1c,,1610672413,/r/wallstreetbets/comments/kxjd1c/gme_gains_rolled_my_profits_from_calls_into/,1, GME GAINS rolled my profits from calls into shares and more calls HODL RETARDS STRONG TOGETHER , deleted 
97,kxjd4s,t2_7btkathp,1610672416,/r/wallstreetbets/comments/kxjd4s/made_this_spreadsheet_what_do_you_think_just_did/,1,made this SpreadSheet What do you think just did the crypto part today,
98,kxjd9m,t2_w3wwdl6,1610672423,/r/wallstreetbets/comments/kxjd9m/wsb_made_the_wsj_newspaperreadingboomerbump/,22,WSB made the WSJ newspaper reading boomer bump imminent ,
99,kxjdgg,t2_7x0yve02,1610672440,/r/wallstreetbets/comments/kxjdgg/666_999_by_tomorrow/,1,666 gt 999 by tomorrow,
100,kxjdgg,t2_7x0yve02,1610672440,/r/wallstreetbets/comments/kxjdgg/666_999_by_tomorrow/,1,666 gt 999 by tomorrow,
101,kxjdw5,t2_954vp3m9,1610672477,/r/wallstreetbets/comments/kxjdw5/25_1016_in_a_month/,1, 25 gt 1016 in a month,
102,kxje83,t2_91hkq2rl,1610672508,/r/wallstreetbets/comments/kxje83/another_mention_lmfao/,14,Another mention lmfao,
103,kxje9g,t2_rvyco,1610672512,/r/wallstreetbets/comments/kxje9g/gme/,1, GME ,
104,kxjen6,t2_5npliauy,1610672545,/r/wallstreetbets/comments/kxjen6/what_would_you_guys_say_is_a_company_that_is/,2,What WOULD YOU GUYS SAY IS A COMPANY THAT IS WORTH JACK S RIGHT NOW AND WILL BE WORTH MORE LATER ON, removed 
105,kxjeom,t2_7yshi8nb,1610672548,/r/wallstreetbets/comments/kxjeom/is_icln_how_were_yes/,10,Is ICLN how we re Yes ,
106,kxjf29,t2_9to8gt5n,1610672584,/r/wallstreetbets/comments/kxjf29/mvis_is_the_play/,1,MVIS is the play, removed 
107,kxjf2k,,1610672585,/r/wallstreetbets/comments/kxjf2k/get_in_now_pltr/,1,GET IN NOW PLTR,
108,kxjfnq,t2_2lfam189,1610672645,/r/wallstreetbets/comments/kxjfnq/srpt_regn_pltr_buys_kathy_went_in_on_these_and/,1,SRPT REGN PLTR buys Kathy went in on these and anything she buys will print the coming days This is the call out GME SHORT IDEX LONG,
109,kxjfpr,t2_dz10nw6,1610672650,/r/wallstreetbets/comments/kxjfpr/arkw_just_picked_up_pltr_to_the_moon_129_25_c/,33,ARKW just picked up PLTR TO THE MOON 1 29 25 C,
110,kxjfww,t2_1qi4one,1610672667,/r/wallstreetbets/comments/kxjfww/im_retarded_for_not_listening_to_you_guys_but_im/,1,I m retarded for not listening to you guys but I m ready to listen now What is the next play , removed 
111,kxjgds,t2_2c0pm0ch,1610672711,/r/wallstreetbets/comments/kxjgds/i_was_gonna_pay_my_child_support_but_then_i_got/,11,I was gonna pay my child support but then I got high,
112,kxjggl,t2_6sr6m,1610672717,/r/wallstreetbets/comments/kxjggl/wsbs_got_a_new_sugar_daddy/,1,WSB s got a new sugar daddy,
113,kxjgjy,t2_252rep2j,1610672724,/r/wallstreetbets/comments/kxjgjy/what_do_you_retards_think_about_penny_stocks/,1,What do you retards think about penny stocks , removed 
114,kxjgr9,t2_12fu3o,1610672738,/r/wallstreetbets/comments/kxjgr9/im_definitely_gloating/,1,I m definitely gloating,
115,kxjgs4,t2_oc9qy,1610672741,/r/wallstreetbets/comments/kxjgs4/you_guys_like_some_penny_stock_gains/,1,You guys like some penny stock gains ,
116,kxjh7y,t2_8tax689h,1610672782,/r/wallstreetbets/comments/kxjh7y/gme_gainz_rolled_my_profits_from_calls_into_716/,9,GME GAINZ rolled my profits from calls into 7 16 39c and bought more shares for the cause RETARDS STRONG TOGETHER,
117,kxjhnl,t2_7btkathp,1610672820,/r/wallstreetbets/comments/kxjhnl/just_started_investing_in_august_2020_this_is/,1,just started investing in august 2020 this is what my spreadsheet has become made by myself any thoughts ,
118,kxjhrv,t2_4ohfeq99,1610672831,/r/wallstreetbets/comments/kxjhrv/gme_and_bb_soft_core_porn_small_buy_and_hold/,1,GME and BB soft core porn small buy and hold positions from recommendations by this sub ,
119,kxji2i,t2_iduc5,1610672859,/r/wallstreetbets/comments/kxji2i/cramer_says_wsb_is_busting_the_shorters_hes_right/,1,Cramer says WSB is busting the shorters amp he s right, removed 
120,kxji6f,t2_4mtc3dgb,1610672868,/r/wallstreetbets/comments/kxji6f/am_i_doing_this_right_gme/,12,Am I doing this right GME,
121,kxjid6,t2_8vnoihqd,1610672885,/r/wallstreetbets/comments/kxjid6/bngo_symposium_on_saphyr_technology/,1,BNGO SYMPOSIUM ON SAPHYR TECHNOLOGY,
122,kxjii9,,1610672897,/r/wallstreetbets/comments/kxjii9/still_holding_my_measly_14_shares_but_gme_to_the/,1,Still holding my measly 14 shares BUT GME TO THE FUCKING MOON , deleted 
123,kxjipk,t2_52th9wjm,1610672915,/r/wallstreetbets/comments/kxjipk/xl_stock_is_worth_70_more_at_6_times_the_present/,1,XL Stock Is Worth 70 More At 6 Times the Present Value of 2024 Sales free only Fans for a month,
