,postid,author,created_utc,permalink,score,title,selftext
730,kxofvn,t2_90jwsqq,1610690564,/r/wallstreetbets/comments/kxofvn/we_must_keep_the_pressure_on_the_shorts_until/,4,WE MUST KEEP THE PRESSURE ON THE SHORTS UNTIL THEY ARE BANKRUPT , Ok soldiers here s the reality We have no idea if the short squeeze on GME has started or not The last legit number we got on short interest was December 31st That means any day now they should be coming out with numbers on where the short interest is Which means we have no idea if the short squeeze has started or not If it has started it is in the early innings We at least know that becasue a few days ago prior to the recent doubling of price the days to cover was at least 6 If this is the short squeeze we have AT LEAST 4 more days left We might not have even gotten there yet Our friend Ihor Dusaniwsky https www barrons com articles gamestop stock soars as short sellers take a hit 51610572262 thinks the market run up yesterday the 13th was in part due to optimism over the future of GME If that were true that would only be good news for us That means we are squeezing the shorts even harder Not to mention Jim Cramer basically put GME shorts on notice because now all his boomer listeners will go out and blindly buy GME because they own all the wealth in the United States and they want to look cool in front of their grandchilden who are too focused on Instagram to spent quality time with them Lets hope that is the case So here is the deal regardless if the squeeze has happened or if we are 1 3 of the way into the squeeze we HAVE to keep the pressure on Which means two things We need to buy shares up in mass OR we use the institutions to our advantage by buying calls We already know those boomer hedge funds are naked shorting these stock becasue how else would there be 100 short interest Dont forget boomers run the market and they run the SEC The government is not here to help us Tomorrow after GME gaps up if you have 1 15 calls take your tendies and if you want to make history roll those tendies into 1 22 or 1 29 calls We force buying demand by using the institutions to buy 100 shares for every out of the money call we buy That is the only way Those boomer hedge funds are not going to get margin called becasue in order for a margin call the boomer banker has to initiate it To think these people dont know each other and are the godparents to each others kids is insane They would love nothing else but to see us burn to burn down in flames But we are the captains now We are in control Dont let up We need to keep the pressure up through the 3 day weekend TL DR Short squeeze may or may not have happened yet If it did then we are only in the early innings If it did not then you better get on the rocket ship Boomers are not going to force margin calls on their boomer friends Only we can protect each other buy maintaining demand Roll your 1 15 tendies into 1 22 calls 
731,kxog5a,t2_2aqf612h,1610690590,/r/wallstreetbets/comments/kxog5a/strap_your_boots_and_put_on_your_condoms/,1,Strap your boots and put on your condoms cosmonauts we re going to the fucking moon some of you are going to ejaculate some of you are going to die but if we succeed If we land on the moon we will be legends for a life time Our kids kids shall be known through the new world GME BB PLTR,
732,kxohn8,,1610690755,/r/wallstreetbets/comments/kxohn8/85hrs_f_tough_yolo/,1,8 5hrs F tough YOLO, deleted 
733,kxoifc,t2_5fl458ps,1610690848,/r/wallstreetbets/comments/kxoifc/can_his_wifes_boyfriend_chime_in_and_let_us_know/,1,Can his wife s boyfriend chime in and let us know how it went ,
734,kxoin4,,1610690870,/r/wallstreetbets/comments/kxoin4/blockbuster_goes_out_of_business_gets_knocked_out/,1,Blockbuster goes out of business gets knocked out by Netflix and shorts and you think that of me , deleted 
735,kxoion,t2_5shcoyol,1610690875,/r/wallstreetbets/comments/kxoion/85hrs_until_lotto_friday_f_tough/,1,8 5hrs until lotto Friday F tough ,
736,kxokf6,t2_zx7huc5,1610691064,/r/wallstreetbets/comments/kxokf6/i_aint_selling/,3,I ain t selling ,
737,kxokhl,t2_t4cw91s,1610691072,/r/wallstreetbets/comments/kxokhl/blockbuster_goes_out_of_business_gets_knocked_out/,2, Blockbuster goes out of business gets knocked out by Netflix and you think that of me GME ,
738,kxokpg,t2_4hbmq8pq,1610691096,/r/wallstreetbets/comments/kxokpg/confused_about_gme_and_bb/,1,confused about gme and bb, removed 
739,kxokwh,t2_ddfz90p,1610691118,/r/wallstreetbets/comments/kxokwh/someone_traded_68m_spy_370_calls_expiring_jan_15/,1,Someone Traded 6 8M SPY 370 Calls Expiring Jan 15 ,Lots of volume happened in SPY Calls today with a short expiry Jerome Powell s friends buying in Options Scanner source https www smartoptions ai https www smartoptions ai https preview redd it sbi9fqp0ufb61 png width 542 amp format png amp auto webp amp s d38940a8f4bcd55a5e654d8a938792ceba6d7875
740,kxol59,t2_6j4g54hr,1610691148,/r/wallstreetbets/comments/kxol59/gamestop_short_sellers_on_the_phone_with_their/,2,GameStop short sellers on the phone with their brokerage,
741,kxolg4,t2_41h8tffx,1610691186,/r/wallstreetbets/comments/kxolg4/saw_this_funny_article_on_yahoo_finance_about/,1,Saw this funny article on yahoo finance about this subreddit Sorry if I cant post this,
742,kxolik,t2_3vsb5zsk,1610691194,/r/wallstreetbets/comments/kxolik/dump_your_checks_into_gme/,3,DUMP YOUR CHECKS INTO GME,Everyone that s gets paid today better dump their Paychecks into GME Shares or Calls nothing else
743,kxolsl,t2_56t3piuh,1610691220,/r/wallstreetbets/comments/kxolsl/the_first_autist/,3,The first autist,
744,kxolvr,t2_12o7k5kq,1610691231,/r/wallstreetbets/comments/kxolvr/does_wsb_actually_have_the_capacity_to_squeeze/,1,Does WSB actually have the capacity to squeeze shorts , removed 
745,kxomq4,t2_5vqnb,1610691333,/r/wallstreetbets/comments/kxomq4/new_to_the_game_but_i_think_tsla_bubble_is_gonna/,1,New to the game but I think TSLA bubble is gonna pop soon, removed 
746,kxomq7,t2_5g3834o,1610691333,/r/wallstreetbets/comments/kxomq7/me_thinking_im_helping_gme_when_im_actually_just/,1,Me thinking I m helping GME when I m actually just here for the ride with my free stoink Thanks all ,
747,kxoms6,t2_1j6w0hj,1610691338,/r/wallstreetbets/comments/kxoms6/gmetards_has_everyone_set_their_sell_limits_to/,1, GMEtards has everyone set their sell limits to 694 20 , removed 
748,kxomx6,t2_7mvso7bk,1610691355,/r/wallstreetbets/comments/kxomx6/its_not_much_but_hopefully_its_a_start/,3,Its not much but hopefully its a start ,
749,kxons6,t2_6obh96rf,1610691446,/r/wallstreetbets/comments/kxons6/operation_bng0/,1,Operation BNG0,TL DR BNG0 future generations won t understand why we consider Wolverine s healing ability as a superpower Position 10 000 shares at 4 45 average First off congrats on GME I didn t think it was possible but you proved everyone wrong However we all know this market is fast and furious and we need to move on to the next big thing or you re no different than a boomer I don t understand the technology and could be wrong but it seems to me like this company got a product that can detect and treat genetic diseases They have a week long symposium going on right now that started this past Monday full of brainiacs talking about how great the product is and even have some sob stories that could melt even the coldest of hearts Imagine being able to identify bad genes early on and treat it before it becomes a problem Who knows years from now they could detect and turn your great great great stepson who originated from your current wife s boyfriend a superhuman Short term they may be able to find and treat the genetic disorder that makes us all retarded I tried to post on Wednesday but the gay auto mod deleted my post because it thought BNG0 was still under 1b market cap They are currently trading at 7ish Rumor has it that Ark may be investing in them Do your own due diligence and don t rely on me 
750,kxooju,t2_qgq6c,1610691529,/r/wallstreetbets/comments/kxooju/just_a_month_ago_our_favorite_bald_cocainefueled/,1,Just a month ago our favorite bald cocaine fueled retard Cramer was bearish on GME, removed 
751,kxoonk,t2_9cr0rjjx,1610691543,/r/wallstreetbets/comments/kxoonk/i_am_about_to_yeet_this_entire_account_into_bb/,9,I am about to yeet this entire account into BB tomorrow see you on the fucking moon retards,
752,kxoosn,t2_6f48aunn,1610691558,/r/wallstreetbets/comments/kxoosn/calls_for_bb/,1,Calls for BB , removed 
753,kxootx,t2_qgq6c,1610691561,/r/wallstreetbets/comments/kxootx/just_a_month_ago_cramer_was_bearish_on_gme/,1,Just a month ago Cramer was bearish on GME, removed 
754,kxooup,t2_weo09yw,1610691564,/r/wallstreetbets/comments/kxooup/cathie_wood_da_queen/,1,Cathie Wood da Queen, removed 
755,kxop3e,t2_dng7a,1610691591,/r/wallstreetbets/comments/kxop3e/todays_the_day_gme/,4,Today s the day GME, removed 
756,kxop4g,,1610691595,/r/wallstreetbets/comments/kxop4g/about_to_make_a_tastyworks_account_and_join_this/,1,About to make a tastyworks account and join this cesspool anyone got a referral code ,
757,kxopik,t2_44v5g8zs,1610691636,/r/wallstreetbets/comments/kxopik/you_all_got_me_confused_af/,1,YOU ALL GOT ME CONFUSED AF, removed 
758,kxopte,t2_qosuo,1610691673,/r/wallstreetbets/comments/kxopte/a_degenerate/,1,A degenerate, removed 
759,kxoqom,,1610691776,/r/wallstreetbets/comments/kxoqom/better_late_than_ever/,1,Better late than ever , deleted 
760,kxoref,t2_5sie5tpe,1610691859,/r/wallstreetbets/comments/kxoref/fb_puts/,1,FB Puts, removed 
761,kxorol,t2_3auxe0p8,1610691892,/r/wallstreetbets/comments/kxorol/bcrx/,1,BCRX, removed 
762,kxorv1,t2_9rrypdn8,1610691912,/r/wallstreetbets/comments/kxorv1/if_bb_goes_over_100_by_feb_1st_i_will_stick_an/,1,If BB goes over 100 by Feb 1st I will stick an actual blackberry in my ass and post the video on pornhub for you degenerates to enjoy , removed 
763,kxosvy,t2_4x39oju,1610692033,/r/wallstreetbets/comments/kxosvy/bb_moon/,1,BB MOON ,
764,kxot2n,t2_x3mv1,1610692058,/r/wallstreetbets/comments/kxot2n/greenfriday_dd_inside_spy_380c/,0, GREEN FRIDAY DD INSIDE SPY 380C,I ve been seeing a lot of negativity about tomorrow but boy oh boy are you little baby cubs wrong I m going to show you why SPY 380C are the best play for tomorrow with pure simple logic So you see I like a lot of you out there have no money let alone any sort of expendable cash HOWEVER I bought a SPY 380C earlier for Jan15 Now here is the kicker that makes absolutely no sense Why would someone buy a 157 call when they have no money to spare Well they wouldn t UNLESS SPY was sure to pop off tomorrow Let me dumb it down a bit Due to two simple facts fact 1 the only reason someone would buy a SPY 380C when they have no money IS IF SPY is going to pop off and fact 2 I bought a SPY 380C and I have no money that means that SPY has to pop off tomorrow Fuck fundamentals I don t understand the Greeks candlesticks are dope as hell but make no sense technical analysis is for nerds Bollinger bands sounds like something old people wear moving averages can t be dependable because they fucking move I got this one with pure unadulterated logic I look forward to getting the heat back on after tomorrow 
765,kxothq,t2_8ds4xbxm,1610692111,/r/wallstreetbets/comments/kxothq/buying_gme_friday_morning/,0,Buying GME Friday Morning, removed 
766,kxotm3,t2_4x39oju,1610692125,/r/wallstreetbets/comments/kxotm3/bb_moon/,1,BB MOON ,
767,kxotp5,t2_sy0cy,1610692136,/r/wallstreetbets/comments/kxotp5/gme_this_guy_is_one_of_us/,1,GME this guy is one of us,
768,kxounc,t2_7o0i56v7,1610692254,/r/wallstreetbets/comments/kxounc/if_bb_goes_up_1000_im_tattooing_this_on_my_arm/,1,IF BB GOES UP 1000 IM TATTOOING THIS ON MY ARM ,
769,kxov5q,t2_3rg78iaq,1610692319,/r/wallstreetbets/comments/kxov5q/what_do_you_think_of_gpro_any_dds/,1,What do you think of GPRO Any DDs , removed 
770,kxovik,t2_6whcqyf,1610692360,/r/wallstreetbets/comments/kxovik/well_make_it_lads_pltr/,1,We ll make it lads PLTR ,
771,kxovop,t2_36ju3rvt,1610692377,/r/wallstreetbets/comments/kxovop/there_has_to_be_that_one_autist_somewhere_in_the/,1,There HAS to be that one autist somewhere in the world that bought GME at this point and still holds ,
772,kxovsq,t2_6c4qfwhg,1610692393,/r/wallstreetbets/comments/kxovsq/is_it_too_late_to_buy_gme_and_bb_during_opening/,1,Is it too late to buy gme and bb during opening times , removed 
773,kxowjo,t2_4e3rc3vd,1610692474,/r/wallstreetbets/comments/kxowjo/gme_gang_theme_song/,1,GME GANG THEME SONG,
774,kxoxw2,t2_3pd6v53g,1610692640,/r/wallstreetbets/comments/kxoxw2/just_for_fun_i_decided_to_make_a_spread_sheet_of/,1,Just for fun I decided to make a spread sheet of how much profit you can potentially make buying LEAPS ,
775,kxoxzf,t2_1cotxs70,1610692652,/r/wallstreetbets/comments/kxoxzf/am_i_retarded_i_sold_my_tsla_share_and_did_this_i/,1,Am I retarded I sold my TSLA share and did this I don t even know what options are How can the lower one be down but the higher one is up ,
776,kxoy0p,t2_677vab1u,1610692656,/r/wallstreetbets/comments/kxoy0p/i_guess_we_go_all_in/,1,I guess we go all in,
777,kxoywi,t2_92lp4sos,1610692759,/r/wallstreetbets/comments/kxoywi/pltr_bout_is_set_for_today_between_cathiedwood/,1, PLTR bout is set for today between CathieDWood and citibank, removed 
778,kxozk1,t2_4jqyx6n2,1610692832,/r/wallstreetbets/comments/kxozk1/love_seeing_this/,1,Love seeing this,Gonna keep it short I grew up really poor Finally taking control of my life in my 20s to make a great future for myself Just started here on this sub and y all are doing amazing work I don t have much money still at all to make all the plays suggested but I m trying and doing my best Thank you all for what you do and the knowledge you spread I m glad to be here Oh and F the 
779,kxozre,t2_526bqjhu,1610692860,/r/wallstreetbets/comments/kxozre/why_and_how_is_bill_ackman_smartdumb/,1,Why and How is Bill Ackman Smart Dumb,I would like to hear both sides why do people consider him smart and why do people consider him dumb 
780,kxozxc,t2_3qy9cltx,1610692877,/r/wallstreetbets/comments/kxozxc/ehang_eh_gang_mr_hu_is_my_daddy/,1,Ehang EH Gang Mr Hu is my daddy,
781,kxp0b5,t2_pyfomec,1610692920,/r/wallstreetbets/comments/kxp0b5/government_wont_let_me_drink_or_go_into_a_casino/,1,Government won t let me drink or go into a casino but they ll let me gamble thousands of dollars on one stonk GME TO THE MOON ,
782,kxp0dm,t2_8504ilpw,1610692929,/r/wallstreetbets/comments/kxp0dm/ex_one/,1,Ex One ,
783,kxp0o2,t2_6n9jgb3a,1610692960,/r/wallstreetbets/comments/kxp0o2/im_watching_you_pltr/,1,I m watching you PLTR,
784,kxp1hk,t2_8504ilpw,1610693052,/r/wallstreetbets/comments/kxp1hk/ex_one/,1,Ex One ,
785,kxp1ob,t2_1cotxs70,1610693075,/r/wallstreetbets/comments/kxp1ob/i_have_no_idea_what_im_doing/,1,I have no idea what I m doing ,https i imgur com 3XbmVfr jpg
786,kxp2e2,t2_4e66q5fd,1610693163,/r/wallstreetbets/comments/kxp2e2/gme_gang_rise_up_get_them_fingers_ready_to_buy/,1, GME Gang rise up Get them fingers ready to buy those shares Let s crush those shorts see you on the moon ,
787,kxp2hb,t2_2q4w83,1610693172,/r/wallstreetbets/comments/kxp2hb/wsb_actual_television_show/,1,WSB actual television show,Hey so I have been around the WSB subreddit for a while just reading and never posting things I have grown my account over 500 this year thanks to you guys and I actually find this subreddit both entertaining and a place where people can learn stuff I think if WSB had a stock entertainment show on Youtube or Twitch it could take off 
788,kxp33o,t2_9s8fs2dm,1610693245,/r/wallstreetbets/comments/kxp33o/palantir_is_trash_change_my_mind/,1,Palantir is TRASH change my mind , removed 
789,kxp3a6,t2_2tbxxk70,1610693266,/r/wallstreetbets/comments/kxp3a6/ameritrade_recognizing_the_power/,1,Ameritrade recognizing the power,
790,kxp4zd,t2_3cdg37j9,1610693480,/r/wallstreetbets/comments/kxp4zd/gme_gains/,1,GME gains,
791,kxp50d,t2_36zqw3ps,1610693484,/r/wallstreetbets/comments/kxp50d/didnt_know_what_options_were_lots_of_missed/,1,Didn t know what options were Lots of missed tendies Pleas fly again GME BB I have PLTR in my retirement account ,
792,kxp5ld,t2_6whcqyf,1610693560,/r/wallstreetbets/comments/kxp5ld/hold_on_lads_pltr/,1,HOLD ON LADS PLTR ,
793,kxp5pr,t2_sncrij,1610693576,/r/wallstreetbets/comments/kxp5pr/bb_to_da_moon_a_quick_dd_apple_car/,1, BB to da moon a quick DD APPLE CAR ,TL DR Apple Car will be using Blackberry QNX Blackberry is no longer a phone company I ll keep this short Apple is teaming up with Hyundai to build the apple car Hyundai s Autopilot program is built on Blackberry s OS called QNX QNX will literally be in every single EV doesn t matter which one you are fucking rooting for Li XPENG NIO CANOO SONY RIVIAN IT DOESNT FUCKING MATTER THEY VE ALREADY SIGNED DEALS WITH BLACKBERRY BB PT 100 EOY 36m short float THAT S EASY There s more to Blackberry than just QNX but a longer DD to come later 
794,kxp5yj,t2_9352rjcp,1610693610,/r/wallstreetbets/comments/kxp5yj/market_correction_biden_laid_out_stimulus/,1,Market correction Biden laid out stimulus yesterday Ya ll said market can t go down because of stimmy Okay then why did the market selloff during his speech Why futures down even more Get ready for the pain Tried to warn you ,
795,kxp5zt,t2_3cdg37j9,1610693615,/r/wallstreetbets/comments/kxp5zt/gme_gains/,1,GME gains,
796,kxp6md,t2_6hjtq6uy,1610693688,/r/wallstreetbets/comments/kxp6md/boom_goes_the_dynamite/,1,Boom Goes The Dynamite ,
797,kxp6yd,t2_869l4,1610693728,/r/wallstreetbets/comments/kxp6yd/i_dont_care_about_making_money_from_gme/,1,I don t care about making money from gme, removed 
798,kxp7m4,t2_9tuy4l2d,1610693810,/r/wallstreetbets/comments/kxp7m4/tsla_call/,1,TSLA call, removed 
799,kxp7mi,t2_2gsfjkfg,1610693812,/r/wallstreetbets/comments/kxp7mi/his_boss_has_21m_in_unrealized_losses_only_for/,1,His boss has 21M in unrealized losses only for KMI what the fuck ,https www reddit com r thetagang comments kxo5f5 21 million unrealized losses can i make it back gt I m looking for advice for my boss 1 7 million shares KMI at a massive 21 MILLION loss gt Proof KMI gives an ok dividend 26 qtr so he s getting a 442k qtr but wants to try to make up the difference somehow if possible through options and eventually close this position gt What do you do gt I m thinking he should sell covered calls puts The volatility of KMI is practically nil I m thinking that if he were to sell some crazy covered calls puts with short weekly expirations he d make the premium and keep his shares as it would likely expire worthless gt Thoughts Would you recommend a different strategy Kids this is proof of what happens if you buy boomer stocks and don t get GME PLTR I hope he s learned his lesson 
800,kxp7m4,t2_9tuy4l2d,1610693810,/r/wallstreetbets/comments/kxp7m4/tsla_call/,1,TSLA call, removed 
801,kxp7mi,t2_2gsfjkfg,1610693812,/r/wallstreetbets/comments/kxp7mi/his_boss_has_21m_in_unrealized_losses_only_for/,1,His boss has 21M in unrealized losses only for KMI what the fuck ,https www reddit com r thetagang comments kxo5f5 21 million unrealized losses can i make it back gt I m looking for advice for my boss 1 7 million shares KMI at a massive 21 MILLION loss gt Proof KMI gives an ok dividend 26 qtr so he s getting a 442k qtr but wants to try to make up the difference somehow if possible through options and eventually close this position gt What do you do gt I m thinking he should sell covered calls puts The volatility of KMI is practically nil I m thinking that if he were to sell some crazy covered calls puts with short weekly expirations he d make the premium and keep his shares as it would likely expire worthless gt Thoughts Would you recommend a different strategy Kids this is proof of what happens if you buy boomer stocks and don t get GME PLTR I hope he s learned his lesson 
802,kxp8u6,t2_pebd9,1610693974,/r/wallstreetbets/comments/kxp8u6/gme_6_start_of_the_day_reporting_in_from_europe/,1,GME 6 start of the day reporting in from Europe,
803,kxp9xj,t2_44wfhwi3,1610694099,/r/wallstreetbets/comments/kxp9xj/my_case_for_bionano_genomics/,1,My Case for Bionano Genomics, removed 
804,kxpc1s,t2_jw1od54,1610694343,/r/wallstreetbets/comments/kxpc1s/today_i_just_realized_that_i_am_a_fucking_wsb/,1,Today I just realized that I am a fucking WSB Autist Retard and I don t know what to do but put my trash money into PLTR GME amp BB instead of wiping my ass with these 100 Bills ,
805,kxpdih,t2_3e1v3kl1,1610694524,/r/wallstreetbets/comments/kxpdih/back_when_i_thought_38_was_high_for_gme/,1,Back when I thought 38 was high for GME ,
806,kxpdns,t2_zgh2t,1610694542,/r/wallstreetbets/comments/kxpdns/im_trusting_you_retards_bbtothemoon/,1,I m trusting you retards BBTOTHEMOON,
807,kxpexg,t2_9tv1kgn1,1610694689,/r/wallstreetbets/comments/kxpexg/pltr/,1, PLTR, removed 
808,kxpf0u,t2_qcdyp,1610694700,/r/wallstreetbets/comments/kxpf0u/lets_take_bb_to_the_moon/,1,Let s take BB to the moon ,Alright retards next short squeeze on the list is blackberry Let s take this to to nebula moon 
809,kxpf9f,t2_147crz,1610694729,/r/wallstreetbets/comments/kxpf9f/trading_options_has_been_a_hell_of_a_ride_the/,1,Trading options has been a hell of a ride the past 3 months ,
810,kxpfko,t2_84p96icy,1610694768,/r/wallstreetbets/comments/kxpfko/gains_on_amat_xom_erx_positions_posted/,1,Gains on AMAT XOM ERX Positions posted ,
811,kxpfrv,t2_449u1b43,1610694792,/r/wallstreetbets/comments/kxpfrv/bb_is_starting_to_lunch_to_the_fk_moon_at_pre/,1, BB is starting to lunch to the fk moon at pre market ,
812,kxpfsa,t2_3e1v3kl1,1610694793,/r/wallstreetbets/comments/kxpfsa/gme_gang/,1,GME Gang,
813,kxpgbb,t2_92l60uot,1610694865,/r/wallstreetbets/comments/kxpgbb/are_we_bubble_creators/,1,Are we bubble creators ,Hello WSB Long time fan first time posting Saw an interesting article online about WSB https finance yahoo com news wall street bets making waves 194707983 html where the headline asks the question are we making waves or creating bubbles Naturally as a degenerat I did not read into it any further rather ask our community about this What do you think 
814,kxpgcl,t2_bbzr0sh,1610694868,/r/wallstreetbets/comments/kxpgcl/dd_on_barstoolfund/,1,DD ON BARSTOOLFUND ,Honestly calls on barstoolfund Shit keeps going up Anyone shifting their GME gainz into this shit 
815,kxpgny,t2_449u1b43,1610694914,/r/wallstreetbets/comments/kxpgny/bb_starting_to_lunch_to_da_moon_pre_market_dont/,1, BB starting to lunch to da moon pre market Don t miss this rocket ,
816,kxpgwd,t2_ngkou,1610694946,/r/wallstreetbets/comments/kxpgwd/fuel_the_printer_jpow/,1,fuel the printer JPOW,
817,kxphv0,t2_50zvvyd7,1610695072,/r/wallstreetbets/comments/kxphv0/anyone_who_is_thinking_about_selling_gme_read_this/,1,Anyone who is thinking about selling GME read this,Don t 
818,kxpi4n,t2_5wzcu7e4,1610695108,/r/wallstreetbets/comments/kxpi4n/mac/,1, MAC, removed 
819,kxpimf,t2_zyldn,1610695176,/r/wallstreetbets/comments/kxpimf/how_to_profit_from_cciv_for_latecoomers/,1,How to profit from CCIV for latecoomers , removed 
820,kxpioa,t2_9afpnfp8,1610695182,/r/wallstreetbets/comments/kxpioa/protecting_wsb/,1,Protecting WSB,Due to all the media attention lately amp the influence we ve had on the market shouldn t we be taking some action to protect this subreddit amp mutually beneficial community 
821,kxpkgp,t2_5n5vmxuw,1610695403,/r/wallstreetbets/comments/kxpkgp/europe_early_morning_sitrep_we_are_calling_for/,1,Europe early morning sitrep We are calling for for support guys Let s make some money ,
822,kxpkv5,t2_8387atn0,1610695457,/r/wallstreetbets/comments/kxpkv5/selling_my_130k_portfolio_for_the_yolo_of_a/,1,Selling my 130k portfolio for the YOLO of a lifetime top upvote wins the move,Tesla rode me up pretty nice the past year but i think it is time to ride a new rocket What is everyone s take on selling all my positions for a split between the new rockets GME BB PLTR My debate is selling my entire portfolio to go for a big play to hang with the boys I ve had my Tesla shares since march of last year with a few good bad options trades on the way Thinking about buying some new GME printed 60 calls split between shares of the rest Top upvote wins my YOLO
823,kxpl3x,t2_4f9biijh,1610695491,/r/wallstreetbets/comments/kxpl3x/i_sold_my_gme_for_pennies_who_knew_we_would_ever/,1,I sold my GME for pennies who knew we would ever see 40 ,
824,kxplkj,t2_7y3wyhsl,1610695552,/r/wallstreetbets/comments/kxplkj/i_cashed_in_my_nio_for_this_to_the/,1,I cashed in my NIO for this To the ,
825,kxplpv,t2_1efpxfjy,1610695573,/r/wallstreetbets/comments/kxplpv/selling_tsla_for_bb_how_autistic_am_i/,1,Selling TSLA for BB How autistic am I ,
826,kxplrh,t2_7mt0lsi0,1610695581,/r/wallstreetbets/comments/kxplrh/ideas_about_dynatrace_inc/,1,Ideas about Dynatrace Inc ,It seems to be highly valued but at the same time they re growing extremely fast 
827,kxpmet,t2_mjheb,1610695662,/r/wallstreetbets/comments/kxpmet/never_have_i_seen_a_clearer_indication_to_buy_bb/,1,Never have I seen a clearer indication to buy BB load up boys,
