,postid,author,created_utc,permalink,score,title,selftext
1306,kxutlu,t2_8b7rzhas,1610718387,/r/wallstreetbets/comments/kxutlu/let_us_thank_the_most_autistic_aspergers_man_on/,2,Let us thank the most autistic Asperger s man on wallstreet Michael Burry for helping pump GME His next play Short TSLA ,
1307,kxuu98,t2_3xk090c4,1610718451,/r/wallstreetbets/comments/kxuu98/crm_love/,1,CRM LOVE , removed 
1308,kxuu99,t2_63vedm7k,1610718451,/r/wallstreetbets/comments/kxuu99/vale/,1,Vale, removed 
1309,kxuujd,t2_4sxpk6yx,1610718480,/r/wallstreetbets/comments/kxuujd/i_sold_my_daughters_nintendo_switch_to_buy_more/,9,I sold my daughter s Nintendo Switch to buy more Gamestop shares,That s right her Christmas present that I regrettably bought from Amazon has now been sold to some 17 year old who s probably already jacked off all over the innocent controller my daughter used to play Mario Party and Sonic and Mario at the Olympic games with I m devastated but I couldn t leave any capital on the board with this short squeeze of epic mind blowing proportions about to go down To my daughter I promise I will buy you another at GAMESTOP and EVERY GAME THEY HAVE FOR IT GME MOON 1 15 47c 65 shares More at open
1310,kxuumu,t2_pji5j,1610718490,/r/wallstreetbets/comments/kxuumu/shorts_coping_hard_right_now_gme_gang/,1,Shorts coping hard right now GME Gang , removed 
1311,kxuvcf,t2_7tax4i9b,1610718559,/r/wallstreetbets/comments/kxuvcf/cant_stop_wont_stop/,4,Can t Stop Won t Stop ,My current play with GME is the same as it always has been GME TO THE MOON I see a lot of people asking wether they should sell or hold Asking what the exit point it etc etc Selling now or even in the immediate future is selling Tesla at 150 pre split It s always been a long play Buy it hold it stare at it all day every day GME is best compared to Tesla in the fact it s volital We re going to see super Green Days and some red days but it s fundementals are still there with Ryan on board It s basically a mini Tesla If you start to loose faith look at chewy A COMPANY THAT OUTSOLD AMAZON ON FREAKING DOG FOOD Chewy has a market cap at something like 40bln GameStop s market cap is about 2bln If you seriously don t think gme can outperform a website that sells dog food then you should go back to att stock with 7 dividends Position shares and some couple month out calls 
1312,kxuvd6,t2_2x84ou3v,1610718561,/r/wallstreetbets/comments/kxuvd6/take_wsb_private_for_2_weeks/,6,Take WSB Private for 2 Weeks,I ve got my tinfoil hat on here fellow retards I made it from my leftover TV dinner Wall Street has been fucked with by autistic retards and they likely had no idea for awhile The last few weeks Cramer and more and more mainstream fucking boomers have started talking about WSB and our retard strength on the markets Now I do believe boomers have upgraded their 56k dial up modems to that s fancy broadband internet that s all the rage They re infiltrating WSB to cause chaos and confusion against the collective group we are retards after all Check their accounts They probably have AOL email addresses Also GME 
1313,kxuvew,t2_jnut5,1610718567,/r/wallstreetbets/comments/kxuvew/wsb_2021_challenge/,2,WSB 2021 Challenge,I just came back from the doctor and he confirmed I am indeed autistic That should give me the permission to enter I am new here so I will cut right to the chase I m gonna put a small amount into the stock that s currently being pumped on this glorious board AFAIK I kinda missed GME and BB seems to be next on the menu I will put about 1k into BB Stocks since I unfortunately cant buy options and keep holding it until the next new big thing pops up on here Then all in on that one etc etc lets see what I can end up with at the end of the year Whats my best indicator on which stock is the current favorite Just front page I guess right 
1314,kxuvfw,,1610718571,/r/wallstreetbets/comments/kxuvfw/coping_hard_right_now_gme_gang/,1, coping hard right now GME Gang , deleted 
1315,kxuvio,t2_5x5ritow,1610718577,/r/wallstreetbets/comments/kxuvio/proof_i_belong_loss_porn/,1,Proof I belong loss porn ,
1316,kxuviy,t2_zklt4m6,1610718578,/r/wallstreetbets/comments/kxuviy/new_autist_in_here_missed_gme_but_put_my_life/,2,NEW AUTIST IN HERE MISSED GME BUT PUT MY LIFE SAVINGS IN BB, removed 
1317,kxuvxp,t2_7328u44y,1610718616,/r/wallstreetbets/comments/kxuvxp/blackberry_nice/,1,BlackBerry Nice, removed 
1318,kxuwbz,t2_5csp446r,1610718653,/r/wallstreetbets/comments/kxuwbz/bngo_up_10_premarket_ready_for_its_covid_seminar/,1, BNGO up 10 pre market ready for its Covid seminar this morning , removed 
1319,kxuwnd,,1610718684,/r/wallstreetbets/comments/kxuwnd/coping_hard_right_now_gme_gang/,1, Coping hard right now GME gang , deleted 
1320,kxuwob,t2_wz93u,1610718686,/r/wallstreetbets/comments/kxuwob/bb_hypergrowth_lets_go/,5,BB Hyper Growth Let s Go ,
1321,kxuwz1,t2_8yxjgyaj,1610718716,/r/wallstreetbets/comments/kxuwz1/tilray_short_squeeze_28m_shorts_need_to_cover/,1,Tilray short squeeze 28m shorts need to cover with 10m volume avg daily Lets burn em bois,
1322,kxux2o,t2_2p8bh2hg,1610718725,/r/wallstreetbets/comments/kxux2o/fcel_hold_or_sell_and_buy_gme/,1,FCEl Hold or Sell and buy GME , removed 
1323,kxuxk0,t2_8nsdnssr,1610718771,/r/wallstreetbets/comments/kxuxk0/power_behind_the_throne/,9,Power behind the throne ,Mad how all these come out the woodwork now who have never commented on WSB before After Cramer s announcements Melvin might have realised where the real power lies We are the power behind DFV s throne Ignore these Melvin Maggots sent to infiltrate the people and spread dissent Melvin has still not covered their positions The short squeeze starts today These is where we fly Autists hold the line We are leaving the stratosphere GME to outer space 
1324,kxuxks,t2_6arhqwnp,1610718773,/r/wallstreetbets/comments/kxuxks/after_a_very_challenging_calculation_i_came_up/,1,After a very challenging calculation I came up with a daily PT of 34 PLTR ,
1325,kxuxlh,t2_4fy761qs,1610718775,/r/wallstreetbets/comments/kxuxlh/infinite_rockers/,1,Infinite rockers , removed 
1326,kxuy44,t2_6espcak7,1610718825,/r/wallstreetbets/comments/kxuy44/bb_to_the_moon/,2,BB TO THE MOON ,I went all in BB Let s get this rocket startet 
1327,kxuy4g,t2_153e5e,1610718826,/r/wallstreetbets/comments/kxuy4g/gme_premarket_dip_timing/,1,GME Pre Market Dip Timing, removed 
1328,kxuy4w,t2_3tshcfpk,1610718827,/r/wallstreetbets/comments/kxuy4w/xl_fleet_announces_they_will_be_attending/,2,XL Fleet announces they will be attending Northland Securities SPAC Conference , https twitter com XLFleet status 1350062803734962177 https twitter com XLFleet status 1350062803734962177 Personally expecting 24 EOD and close to 30 by EOM Chart has formed a beautiful cup and handle and looks ready for a major reversal Its tested the next fib last two days so today will hopefully be the day it breaks through 
1329,kxuymg,t2_7ygp8603,1610718872,/r/wallstreetbets/comments/kxuymg/atlas_technical_consultants/,1,Atlas Technical Consultants, removed 
1330,kxuysg,t2_17ujncs4,1610718889,/r/wallstreetbets/comments/kxuysg/property_costs_irl_stink/,1,property costs IRL stink,
1331,kxuyw1,t2_7jy0hi02,1610718897,/r/wallstreetbets/comments/kxuyw1/gme_115_premkt_sell_off/,1,GME 1 15 premkt sell off , removed 
1332,kxuz36,t2_ugodmy2,1610718914,/r/wallstreetbets/comments/kxuz36/shitron_at_it_again_if_youre_in_lmnd_options/,1,Shitron at it again If you re in LMND options expiring today hold your asses As much as they are not credible they do damage if only for a day That s gonna shit all over your 1 15 options today ,
1333,kxuz9c,t2_6ifqy4mx,1610718929,/r/wallstreetbets/comments/kxuz9c/love_it_or_hate_it_idex_is_going_to_the_moon/,1,Love it or hate it IDEX is going to the moon ,
1334,kxuzy9,t2_4jm50,1610719000,/r/wallstreetbets/comments/kxuzy9/bb_getting_ready_for_the_market_to_open_w_gme_pltr/,1, BB getting ready for the market to open w GME PLTR ,
1335,kxv0aj,t2_9tzvnt3k,1610719034,/r/wallstreetbets/comments/kxv0aj/sndl_been_watching_this_stock_for_a_pretty_long/,1, SNDL been watching this stock for a pretty long time very bullish pre market can go to 1 sndl stocks gains,
1336,kxv0gz,t2_8yxjgyaj,1610719051,/r/wallstreetbets/comments/kxv0gz/tilray_pt_increase_to_26_and_28m_shorts_to_cover/,1,Tilray PT increase to 26 and 28m shorts to cover meeting musk at mars,
1337,kxv0rb,t2_oyw9b,1610719079,/r/wallstreetbets/comments/kxv0rb/together_we_are_more_powerful_than_any/,6,Together we are more powerful than any institution the mighty ,
1338,kxv0rl,t2_10s801,1610719079,/r/wallstreetbets/comments/kxv0rl/should_i_use_trading212_cfd_or_invest_for_gme_now/,1,Should I use trading212 CFD or invest for GME now UK , removed 
1339,kxv10r,t2_11djff,1610719103,/r/wallstreetbets/comments/kxv10r/hold_the_line_boys_how_many_gme_shares_will_you/,3,HOLD THE LINE BOYS How many GME shares will YOU buy today to do your part ,
1340,kxv13i,t2_4q90ccif,1610719109,/r/wallstreetbets/comments/kxv13i/gme_gamestop_give_me_more_hate_ill_be_a_hero_to/,1, GME GameStop Give me more HATE I ll be a hero to those locking gains once this thing crashes The fight is against these players,
1341,kxv1ma,t2_90t3gz8g,1610719161,/r/wallstreetbets/comments/kxv1ma/killing_time/,1,Killing time , amp x200B Curious how all you retards spend your time waiting for the stonk market to ring open with the bell boi Im fuckin meant to be studying but all I can do is look at tickers until there on my engrained on my god damn eye lids amp x200B I understand most of you are probable sleeping in your basements but for those awake what do you do I cant distract myself amp x200B Disclaimer first post plz don t ban new around this rootin tooting shooting parts amp x200B Positions Shares Nio 63 in at 17 PLTR 38 in at 31 fml SPCE 25 in at 26 XPENG 4 in at 54 fml amp x200B Options 1 TLRY 10C 02 19 21 1 TLRY 15C 03 19 21 1 TLRY 25C 01 21 22 1 APHA 15C 01 22 21 amp x200B Disclaimer im poor
1342,kxv1p5,t2_zqfl1,1610719168,/r/wallstreetbets/comments/kxv1p5/out_of_tsla_and_all_in_to_gme_here_we_go/,1,Out of TSLA and all in to GME here we go ,
1343,kxv1sl,t2_onvag,1610719176,/r/wallstreetbets/comments/kxv1sl/cant_stop_wont_stop_gamestop/,4,Can t Stop Won t Stop GameStop,
1344,kxv1x2,t2_2ldyxegh,1610719187,/r/wallstreetbets/comments/kxv1x2/new_here_read_this/,10,New here Read this ,There are a shit ton of fake bears with dying contracts posting fake bearish sentiment on here and places like stocktwits Hell there is this one person spamming the forum every 2 minutes with dogshit amp x200B Buy GME shares and HOLD if you want to start fucking the bears wives boyfriends tonight 
1345,kxv21x,t2_7t5q3rak,1610719201,/r/wallstreetbets/comments/kxv21x/ttcf_new_bynd_more_profit_and_16th_of_market_cap/,1,TTCF NEW BYND MORE PROFIT AND 1 6th of MARKET CAP half of BYND sales YTD ROCKET MOOON , removed 
1346,kxv23h,t2_1394c438,1610719204,/r/wallstreetbets/comments/kxv23h/34_minutes_to_holding_the_gme_wall_and_buying_the/,1,34 minutes to HOLDING THE GME WALL AND BUYING THE DIP , removed 
1347,kxv251,t2_1dzqq9hw,1610719206,/r/wallstreetbets/comments/kxv251/if_you_buy_options_and_the_price_goes_down_at/,1,If you buy options and the price goes down at expiry what happens , removed 
1348,kxv2r3,t2_7v2rbygn,1610719248,/r/wallstreetbets/comments/kxv2r3/tuesday_morning/,2,Tuesday morning,
1349,kxv2ru,t2_e6exi2,1610719250,/r/wallstreetbets/comments/kxv2ru/sold_my_boomersafetm_vanguard_value_index_shares/,1,Sold my BoomerSafe tm Vanguard Value Index shares for PLTR Jan 2022 35c ,
1350,kxv2wd,t2_8851qcos,1610719260,/r/wallstreetbets/comments/kxv2wd/gme/,1,GME , removed 
1351,kxv2y4,t2_9trphxpt,1610719264,/r/wallstreetbets/comments/kxv2y4/bb/,1,bb, removed 
1352,kxv340,t2_3nf30ord,1610719278,/r/wallstreetbets/comments/kxv340/imagine_getting_paid_14_billion_dollars_to/,3,Imagine getting paid 1 4 billion dollars to underperform the market and post a 16 gain in 2020 ,
1353,kxv3gx,t2_e6novgw,1610719314,/r/wallstreetbets/comments/kxv3gx/can_someone_with_tendies_explain_options_like_im_5/,1,Can someone with tendies explain options like I m 5 , removed 
1354,kxv3y4,t2_851wbiqv,1610719355,/r/wallstreetbets/comments/kxv3y4/today_is_a_red_dildo_after_biden_speech/,1,Today is a red dildo after Biden speech, removed 
1355,kxv403,t2_1n19jijq,1610719360,/r/wallstreetbets/comments/kxv403/life_savings_in_bb_good_luck_me/,13,Life savings in BB Good luck me,
1356,kxv4gw,t2_cb06h,1610719402,/r/wallstreetbets/comments/kxv4gw/why_im_favoring_cnrg_instead_of_icln/,1,Why I m favoring CNRG instead of ICLN, removed 
1357,kxv4i3,,1610719405,/r/wallstreetbets/comments/kxv4i3/used_my_moms_bank_account_and_invested_her_lifes/,1,Used my mom s bank account and invested her life s savings into GME ,
1358,kxv5cp,t2_vxqux,1610719484,/r/wallstreetbets/comments/kxv5cp/my_fellow_autist_with_my_first_post_here_i_shall/,1,My fellow Autist with my first Post here I shall seek ur assitance to challenge JPMorgan we got the Power ,
1359,kxv5mo,t2_5rbdy,1610719510,/r/wallstreetbets/comments/kxv5mo/filtered_by_dd_read_top_5_posts_and_bought_tiny/,1,Filtered by DD Read Top 5 Posts and Bought Tiny Positions Because I Can t Leave Papa Elon ,
1360,kxv5py,t2_5e76e,1610719519,/r/wallstreetbets/comments/kxv5py/are_these_fundamentals_saying_buy_more_gme/,5,Are these fundamentals saying buy more GME ,
1361,kxv6r3,t2_wmm3omy,1610719614,/r/wallstreetbets/comments/kxv6r3/wsb_raises_bb_and_gme_target_price_100/,1,WSB raises BB and GME target price 100 , removed 
1362,kxv6yw,t2_5a69ikqi,1610719635,/r/wallstreetbets/comments/kxv6yw/gme_stock_or_option/,1,GME stock or option , removed 
1363,kxv71q,t2_952rp9hr,1610719643,/r/wallstreetbets/comments/kxv71q/bb_going_to_andromeda_bois/,1, BB Going to andromeda bois , removed 
1364,kxv77w,t2_9tx2x7c2,1610719658,/r/wallstreetbets/comments/kxv77w/im_new_to_trading_any_advices_or_anything_i/,1,I m new to trading any advices or anything I should know about before I start , removed 
1365,kxv7na,t2_g81s0,1610719699,/r/wallstreetbets/comments/kxv7na/how_i_sleep_every_night_knowing_i_invested_money/,1,How I sleep every night knowing I invested money into Meme stocks listening to a bunch of Autists online ,
1366,kxv7pw,t2_2t5ug5rd,1610719704,/r/wallstreetbets/comments/kxv7pw/bb_to_the/,1,BB to the , removed 
1367,kxv7ww,t2_wv9ufa8,1610719718,/r/wallstreetbets/comments/kxv7ww/empty_my_bankaccount_and_put_them_all_in_gme/,1,Empty my Bankaccount and put them all in GME Shares today , removed 
1368,kxv7wz,t2_jvkxk,1610719718,/r/wallstreetbets/comments/kxv7wz/pltr_big_premarket_action/,1,PLTR big premarket action , removed 
1369,kxv80w,t2_wn2dj,1610719728,/r/wallstreetbets/comments/kxv80w/gme_promohypememe_pic/,1,GME promo hype meme pic ,
1370,kxv89t,t2_8mysnpcr,1610719746,/r/wallstreetbets/comments/kxv89t/which_fking_broker_do_u_use_for_options_not_rh_i/,1,Which fking Broker do u use for options not RH I am from Germany and we only have shit brokers, removed 
1371,kxv8re,t2_6ifqy4mx,1610719794,/r/wallstreetbets/comments/kxv8re/to_the_moon/,2,To the moon ,
1372,kxv97t,,1610719836,/r/wallstreetbets/comments/kxv97t/niceeee/,1,Niceeee,
1373,kxv9f3,t2_7qknpv0w,1610719854,/r/wallstreetbets/comments/kxv9f3/good_morning_cramer/,1,Good morning Cramer,
1374,kxv9mr,t2_lom8r,1610719873,/r/wallstreetbets/comments/kxv9mr/work_in_fintech_and_had_previously_heard_about/,3,Work in FinTech and had previously heard about WSB finally started taking this glorious sub seriously this week I am now a true believer Thank you ,
1375,kxv9sw,t2_8yxjgyaj,1610719887,/r/wallstreetbets/comments/kxv9sw/tilray_28m_shorts_need_to_cover_and_we_only_at_15/,1,Tilray 28m shorts need to cover and we only at 15 at 4m volume Huge short squeeze coming,
1376,kxv9t2,t2_jn5py6,1610719887,/r/wallstreetbets/comments/kxv9t2/i_thought_you_all_were_crazy_now_im_the_true/,11,I thought you all were crazy Now I m the true retard ,I should have listened I looked at everyone putting their entire net worth into GME shares and calls and I thought they were crazy GameStop is a failing company it ll be out of business sooner or later their stock isn t going up like that Then it happened I was sitting there counting my puny gains and saw the copious amounts of success you all were having here I had the chance to buy in at 4 but I didn t grasp it I should have trusted you all but I didn t Therefore I will be putting any money I can muster on whatever we choose next Please let me know early because this time I want to be able to post my thousands with you guys 
1377,kxvacs,t2_9tzoxwtx,1610719939,/r/wallstreetbets/comments/kxvacs/anyone_ever_seen_or_anyone_knows_because_im/,1,Anyone ever seen or anyone knows because I m curious 2 know what s the of an asset that has market cap above 50million not gonna say in what currency that just went through a major breakout gt 50 can be up or down and consolidated in the opposite direction of the breakout in lt 3 days , removed 
1378,kxvaik,t2_6n2lcsb,1610719952,/r/wallstreetbets/comments/kxvaik/gme_giving_back/,30,GME Giving Back,After selling some 1 15 30 calls for less than I potentially could have but I was ready for them to expire worthless I wanted to give something back This is basically found money as this is a casino and I am retarded obviously National ROPE Prevention Hotline https i imgur com QDdQKrK jpg Immediate family member ROPED many years ago They do difficult work and have helped several others that I ve spoken with out of a difficult time You may need them when your GME puts expire worthless Global Down s Syndrome Foundation https i imgur com v85dHCy jpg Always donate to them any winnings in Fantasy Football as they are the favored charity of my top player Christian McCaffrey We probably all could benefit from this Foundation for Prader Willi Research https i imgur com HEWRbu3 jpg A dear family friend lived with Prader Willi Syndrome and unfortunately recently passed from COVID at the age of 38 She was very much a kind soul and cared for others immensely She has done more with what she had than most I know who hit the genetic lottery If any of you are inspired by this post to donate any of your GME gains please send it here post in this thread and I ll pass it along to her family Positions 10 4 15 2021 30c 500 shares and I m never fucking selling 
1379,kxvaws,t2_8u2bweh2,1610719987,/r/wallstreetbets/comments/kxvaws/bb_to_the_moon/,1,BB TO THE MOON, removed 
1380,kxvbfe,t2_8p97b,1610720034,/r/wallstreetbets/comments/kxvbfe/icln_dumping/,0,ICLN dumping ,After losing 10 of the top I think its time to protect some gains and wait for a lower entry since this down turn doesn t seem to be stopping any time soon with a lack of specifics from Biden and this new Tesla news that they don t need some inverters anymore Fuck me Anyone else have better opinions Is the whole thing going to turn around next week It probably will since I have shit timing so get in at the low today afternoon 
1381,kxvbow,t2_6225puo5,1610720057,/r/wallstreetbets/comments/kxvbow/the_next_step_we_need_to_take_as_wsb_i_commit/,11,The next step we need to take as WSB I commit 100k to whatever it is ,Hello Retards We are in de middle of a big battle with the shorts in GME There portfolio s of the shorts will have other short position that can be attacks in the same time for maximum effect and margin calls Even the idea that we can do the things with other stock where they are short will at least make them jump and will be a big blow to there legs I commit 100k to a stock to chose from the leaders of WSB to let this happen and let the other short position burn together and win this war Send them bankrupt It is not about the money It is about sending a message Please do it today let it be coordinated at certain time that the stock is posted and we I with at least 100k go allin and give them the final blow 
1382,kxvc10,t2_8nsdnssr,1610720086,/r/wallstreetbets/comments/kxvc10/battle_of_pelennor_fields/,1,Battle of Pelennor Fields, removed 
1383,kxvc8m,t2_812hj0vp,1610720106,/r/wallstreetbets/comments/kxvc8m/how_did_i_even_manage_to_buy_it_at_the_highest/,1,How did I even manage to buy it at the highest point lets fly high ,
1384,kxvcj0,t2_cv09z,1610720130,/r/wallstreetbets/comments/kxvcj0/traders_on_wsb_forum_called_gamestop_stock_of_the/,9,Traders on WSB forum called GameStop stock of the year ,
1385,kxvd0p,t2_4r10eobt,1610720168,/r/wallstreetbets/comments/kxvd0p/thank_you_all/,1,Thank you all, removed 
1386,kxve46,t2_8nsdnssr,1610720269,/r/wallstreetbets/comments/kxve46/battle_of_pelennor_fields_gme/,5,Battle of Pelennor Fields GME,A fellow autist with more brain cells than myself we need a Pelennor Fields GME rallying call Th oden is DFV Gothmog is Melvin Arise Arise Riders of DFV Calls will be made shares will be bought A historic day a green day when the sun rises Buy now buy now Buy Buy for your futures and for Melvin s ending Buy Buy Buy Forth Autists Oh and GME to the 
1387,kxve6f,t2_5jzw3z3l,1610720274,/r/wallstreetbets/comments/kxve6f/fyi_for_those_who_think_an_insider_sold_his/,8,FYI for those who think an insider sold his shares because he didn t believe in the company anymore GME MOOOONNNNNNNNNNNNNNN , amp x200B https preview redd it 1ioytt3o8ib61 png width 1420 amp format png amp auto webp amp s 004bbe57cf10e7d1c0d7f4ee87aae9374ee37572
1388,kxvea6,t2_1up5ihmj,1610720285,/r/wallstreetbets/comments/kxvea6/worlds_richest_man_from_wsb_gme/,5,WORLDS RICHEST MAN FROM WSB GME ,
1389,kxvelm,t2_vf956,1610720314,/r/wallstreetbets/comments/kxvelm/bb_stock/,1,BB stock, removed 
1390,kxvemv,t2_31g71a62,1610720317,/r/wallstreetbets/comments/kxvemv/apha_or_tlry/,1,APHA or TLRY, removed 
1391,kxvery,t2_2f7u0qaq,1610720333,/r/wallstreetbets/comments/kxvery/chart_with_wsb_stock_interest/,1,Chart with WSB stock interest, removed 
1392,kxvf25,t2_7z02iip6,1610720357,/r/wallstreetbets/comments/kxvf25/gme_europoor_reporting/,1,GME Europoor reporting, removed 
1393,kxvfbv,t2_8ykqrivd,1610720381,/r/wallstreetbets/comments/kxvfbv/one_of_us/,4,One of us,
1394,kxvfi9,t2_kdxbvha,1610720396,/r/wallstreetbets/comments/kxvfi9/if_bb_goes/,1,If BB goes , removed 
1395,kxvfln,t2_2uwdj7hx,1610720405,/r/wallstreetbets/comments/kxvfln/ta_gma_premarket/,1,TA GMA Premarket, removed 
1396,kxvfnv,t2_k1r3s,1610720410,/r/wallstreetbets/comments/kxvfnv/gme_was_fun_but_short_squeezes_dont_last_forever/,0, GME was fun but short squeezes don t last forever BB is here to stay,Imagine this it s July of 2019 and you just rode the Autist rocket of BYND to 240 You had two options hop off and buy TSLA or stay on and become a bag holder for years to come This is the decision we all face right now GameStop has been fun but we know she s not staying here she s not the next TSLA PLTR AMD or NFLX We did good buds time to turn to BlackBerry What is it 2008 already Fuck yes it is Except this time they re invested in future technologies UEM UES Cybersecurity to sum it up because you fuckheads don t know what that means But that s all cool and all but what s the meat of this stock Their recent 50 50 AMZN partnership on BlackBerry IVY This thing is a sleeping GIANT Subscription based model unlimited potential Why would car companies partner with BlackBerry Well they bought QNX a few years ago the only OS safety certified in insert qualification here that no one cares about but are actually important and it s currently used in over 175 million cars on the road today Okay okay but I know TSLA uses Linux so if TSLA won t use this then who cares BlackBerry thought of this too they made IVY OS and Cloud agnostic an obvious ploy to get Tesla on board and my god if you miss that announcement and 1000 approx gains Who know why you ll do I don t expect you fucks to understand all of this but it s up over 40 in 2 days and I m making fucking bank so join me and let s make bank together 
1397,kxvfr0,t2_4hhxh9ni,1610720418,/r/wallstreetbets/comments/kxvfr0/avinger/,1,Avinger, removed 
1398,kxvfzx,t2_4ot3zsm2,1610720440,/r/wallstreetbets/comments/kxvfzx/the_next_stock_to_short_squeeze_is_big_c_its_the/,1,The next stock to short squeeze is Big c it s the 3rd most shorted stocks, removed 
1399,kxvg0k,t2_oyw9b,1610720442,/r/wallstreetbets/comments/kxvg0k/mod_dd_how_is_gme_the_mighty/,13,Mod DD How is GME The Mighty ,
1400,kxvfzx,t2_4ot3zsm2,1610720440,/r/wallstreetbets/comments/kxvfzx/the_next_stock_to_short_squeeze_is_big_c_its_the/,1,The next stock to short squeeze is Big c it s the 3rd most shorted stocks, removed 
1401,kxvg0k,t2_oyw9b,1610720442,/r/wallstreetbets/comments/kxvg0k/mod_dd_how_is_gme_the_mighty/,13,Mod DD How is GME The Mighty ,
1402,kxvg7b,t2_7a86dis1,1610720460,/r/wallstreetbets/comments/kxvg7b/since_we_are_talking_to_cnbc_now/,5,Since we are talking to CNBC now,That s fine you guys don t see it Short sellers at institutional investors are the heroes of the world and we are the losers That s fine Yes it is like the 90s Problem is some of us were watching back then too Cash grab We watched in the 2000s as well Cash grab Are you watching in the 2020s Cash grab Hopefully we can also screw over some of the good ole boys as an unintended side effect You don t seem to appreciate the anger Okay game on 
1403,kxvg7r,t2_rn87l,1610720462,/r/wallstreetbets/comments/kxvg7r/after_not_thinking_about_stocks_for_years_i/,13,After not thinking about stocks for years I bought my first options ever in December GME Thank you WSB It ll always be this easy right ,
1404,kxvg9u,t2_5d70w0j1,1610720467,/r/wallstreetbets/comments/kxvg9u/just_giving_out_support/,1,Just giving out support , removed 
1405,kxvgki,t2_9o4wfl98,1610720494,/r/wallstreetbets/comments/kxvgki/live_footage_of_wsb_getting_ready_to_destroy_the/,1,Live footage of WSB getting ready to destroy the GME shorts,
