,postid,author,created_utc,permalink,score,title,selftext
863,nased7,t2_5ucpmx7j,1620835765,/r/wallstreetbets/comments/nased7/i_am_not_paper_handed_i_am_not_a_hedge_fund_i_am/,1,I AM NOT PAPER HANDED I AM NOT A HEDGE FUND I AM Diamond Handed Roaring Kitty ,
864,nasef4,t2_a4azsvnh,1620835768,/r/wallstreetbets/comments/nasef4/im_out_selling_2100_shares_of_tesla_dont_trust/,1,I m out Selling 2 100 shares of TESLA Don t trust Elon anymore Q2 Deliveries and Earnings will be shitshow I will buy back under 300 my current cost basis of 285 ,
865,nasexi,t2_p42akf,1620835803,/r/wallstreetbets/comments/nasexi/wen/,1,Wen ,
866,nasfei,t2_a0d2oozq,1620835833,/r/wallstreetbets/comments/nasfei/nok_wins_case_against_ericsson_who_has_to_pay_nok/,1,NOK wins case against Ericsson who has to pay NOK 97 Million, May 12 2021 Technology https www reuters com technology Ericsson to pay 97 Million to Nokia for after settling damages claim Reuters he Ericsson logo is seen at the Ericsson s headquarters in Stockholm Sweden June 14 2018 Picture taken June 14 2018 REUTERS Olof Swahnberg Telecoms gear maker Ericsson ERICb ST https www reuters com companies ERICb ST has reached an agreement with Finland s Nokia to pay a damages claim of 80 million euros 97 million it said on Wednesday Ericsson said the settlement followed investigations by the U S Department of Justice DoJ into corruption including the bribing of government officials It settled with the DoJ in 2019 and agreed to pay over 1 billion in penalties The DoJ had said https www reuters com article us usa ericsson idUSKBN1YA2HU that Ericsson admitted to conspiring with others to violate the Foreign Corrupt Practices Act from at least 2000 to 2016 by engaging in a scheme to pay bribes and to falsify books and records and by failing to implement reasonable internal accounting controls Ericsson said on Wednesday the settlement would impact operating profit EBIT by 80 million euros and cashflow by 26 million euros in the second quarter The amount reflects uncertainty risk expense and potential distraction from business focus associated with a potentially lengthy and complex litigation it said in a statement The Swedish company added that the remainder of the settlement amount would be made in similar instalments in 2022 and 2023 impacting cash flow Nokia can confirm that the information in Ericsson s press release is accurate We have no further comment a spokeswoman said Ericsson did not immediately respond to requests for further comment 
867,nasfv7,t2_ah3ej,1620835864,/r/wallstreetbets/comments/nasfv7/shiba/,1,Shiba, removed 
868,nasgjo,t2_8d2g7koi,1620835910,/r/wallstreetbets/comments/nasgjo/reopening_stocks_is_a_made_up_category_in_order/,1, ReOpeNinG StOcKs is a made up category in order to trick noobs into selling their tech for a loss Change my mind ,We reopened in January Staright up Only massive liberal cities didn t but even they re open now and have been for quite a while All those ReOpeNiNg StoCkS have already recovered from their corona dips and then some The Dow was at an all time high a week ago What more recovery do you want Its just buzz trying to get you to sell off your tech so whales can gobble em up for cheap Don t be fooled by this utter sham If you think we haven t reopened you re living under a rock 
869,nashxe,t2_aa20u6gw,1620836001,/r/wallstreetbets/comments/nashxe/shiba_inus_going_wild_if_everyone_joins_in/,1,Shiba Inu s going wild if everyone joins in,
870,nasiah,t2_3sf4i8xc,1620836027,/r/wallstreetbets/comments/nasiah/setting_up_to_protect_my_wealth/,1,Setting Up To Protect My Wealth, Markets in absolute chaos Smart money taking money out of retail hands and taking the profits It s time to protect our wealth Inflation skyrocketing and continuing Smart money moving into hard assets It means it s time for me to move into hard assets and reap the benefits SILVER GOLD and some miners PSLV PHYS
871,nasj25,t2_6g3kcbgu,1620836087,/r/wallstreetbets/comments/nasj25/i_lost_2k_in_the_last_2_days/,1,I lost 2k in the last 2 days,I inherited 20k last month I wanted to start investing to make profits 10k went into crypt0 and are now up 500 10k went into stocks and well they went miserably the last days Then I started trading the nasdaq with leverage I made 300 profit and was amazed I put more into higher leverages and lost 2k the last two days On top of that I was under constant pressure and had to watch the chart 24 7 I slept 4h the last night out of fear to miss something And the worst thing is that I can t stop I still have some trades open keep watching and are scared to lose more But I want to get those 2k back I feel like a total failure 
872,nasjeh,t2_32k7ba30,1620836110,/r/wallstreetbets/comments/nasjeh/who_thought_this_was_a_good_idea/,1, who thought this was a good idea ,
873,nasjsl,t2_62d3sh0j,1620836135,/r/wallstreetbets/comments/nasjsl/guess_the_company_short_squeeze_potential/,1,Guess the company Short Squeeze Potential,Dear Sirs and Madams I was browsing Michael Burry s portfolio and came across a deep value opportunity First of all the shorts are in this stock Y https preview redd it 0bc1o8n1rpy61 png width 428 amp format png amp auto webp amp s 2043299792673bd8776f013b5584cf7ae04ecaea The company is a pureplay in providing incarceration and resocialization services to the government Not a sexy business but I want to earn money and not become the Mother Theresa of Stocks The stock got slashed because the operating environment was fundamentally altered when President Biden issued the Executive Order on Reforming Our Incarceration System to Eliminate the Use of Privately Operated Criminal Detention Facilities on January 26 2021 Therefore the business fundamentals have changed and the stock got hammered Since the company is listed as an REIT it had a high dividend yield However they have cancelled dividends and they will perhaps change the structure Looking at their balance sheet they own a ton of real estate that is financed long term Short term assets outweigh the short term liabilities so the probability of bankruptcy is close to zero near term They have been highly leveraged forever Also will they use cash on hands to repay debt For a detailed valuation I fully support the latest analysis from Seeking Alpha by Hugh Akston Investments Taking the value of the highly specific real estate and one chooses a comparative approach or valuing the company at replacement costs equity value is around 15 presenting a 150 upside with in my opinion no further downside since this is heavily protected by the fair value of the assets Management needs to implement strategic change and I believe that over the next 1 5 2 years the company can generate shareholder value by selling or leasing out profitable assets and adapt their services to the new circumstances I am jumping at it Guess the stock because unfortunately WSB got sand in his vagina and requires market cap of 1 25bn the company has a 725m MC 
874,naske3,t2_a1jqzvju,1620836184,/r/wallstreetbets/comments/naske3/nice_group_what_you_think_guys/,1,NICE GROUP What you think guys ,
875,nasm5b,t2_a0bgq67x,1620836305,/r/wallstreetbets/comments/nasm5b/uwmc_ultimate_dd/,1, UWMC ULTIMATE DD,The time has come Reddit Army By now most of us are familiar with UWMC The massive 5 75 dividend Their insanely LOW P E of about 3 9 and their insane income growth 4 200 increase in net income No that s not a typo So why should we all flood into this stock right now The CEO is a beast And not only did they reaffirm their dividend ex date in June and just make 860M in the first quarter they announced the approval of a 300M stock buy back That s big money But let s dive deeper The 300M share buy back is of the class A shares that are in the float UWMC has a very small float 104M shares 300M 6 70 45M That means at current prices they can buy back nearly 44 of the entire F kin float You have never heard of that before and you probably never will again On earnings call yesterday CEO says We can start buying shares tomorrow and I am a buyer at this price So that leaves 60M shares left in the float Institutions own 23M of them I bet it s higher short interest is close to 13M based on latest data This just caused the borrow rate to increase by 5X new data shows short borrow rates just hit 25 Apes there are less than 35M shares freely traded in this stock right now And I know a few of my fellow Redditors are sitting on seriously blocks of stock like me So how many shares are there available to trade hands 5M 10M If everyone on this sub owned just 6 shares we would own the entire public float Can you idiots buy and hold a stock On top of all this we still have Russelll Inclusion to be announced in June and another blow out 2Q is in the works Think of a reason why you shouldn t park a few dollars behind a highly profitable stock trading at all time lows paying a 6 divided with a current p e under 4 I don t know how to add pictures I had some nice screen shots for you apes Because I know you are more visual learners So I made a TL DR in emojis My position 83 000 shares 7 90 220 7 50 Puts sold hoping to own them TL DR UWMC 
876,nasnxk,t2_a382b3wy,1620836425,/r/wallstreetbets/comments/nasnxk/buy_teslatsla/,1,Buy Tesla TSLA ,
877,naso1r,t2_a4853giv,1620836432,/r/wallstreetbets/comments/naso1r/new_controlling_owner_of_hiru_filed_new_8k/,1,New controlling owner of HIRU filed new 8 K yesterday Lots of good action this morning ,
878,naso3i,t2_aa3yajpn,1620836435,/r/wallstreetbets/comments/naso3i/cowi/,1, COWI, COWI to the moon 
879,nasodb,t2_bswxqu0n,1620836452,/r/wallstreetbets/comments/nasodb/is_this_short_squeezing_i_jumped_on_a_few_minutes/,1,Is this short squeezing I jumped on a few minutes ago MZEIQ,
880,nasof4,t2_bf9my0j2,1620836456,/r/wallstreetbets/comments/nasof4/steve_weiss_is_shorting_arkk_short_squeeze_on_arkk/,1,Steve Weiss is shorting ARKK SHORT SQUEEZE ON ARKK ,
881,nasp0t,t2_a4853giv,1620836495,/r/wallstreetbets/comments/nasp0t/new_controlling_owner_of_hiru_filed_new_8k/,1,New controlling owner of HIRU filed new 8 K yesterday Lots of good action this morning , removed 
882,nasq20,t2_4u8d7mjm,1620836569,/r/wallstreetbets/comments/nasq20/this_is_not_financial_advice/,1,This is Not Financial Advice ,
883,nasqpq,t2_c3bki8fe,1620836615,/r/wallstreetbets/comments/nasqpq/how_to_make_friends_101_fwb_friends_with_bloomberg/,1,How to make friends 101 FWB Friends with Bloomberg,
884,nasrh6,t2_ak5slpof,1620836670,/r/wallstreetbets/comments/nasrh6/guys_back_me_up_short_squeezing_atos_lets_make/,1,Guys back me up short squeezing ATOS Let s make some moooooney ,
885,nass6k,t2_6xls9j4r,1620836717,/r/wallstreetbets/comments/nass6k/where_should_i_start/,1,Where should I start ,I ve been following this group for a while trying to learn But I need to start investing to make money I recently found out after multiple losses I will have to do IVF if I want to have children a few of my parts were taken out and I do not have anywhere near that much Interested in anything for maybe less than a year I can do maybe 1k this month and increase as much as I can I work in a government job so I don t have lots to invest nor do I have the benefits of overtime or bonuses Not looking for handouts just advice but I m sure that may be a handout I am doing ok in life just not IVF about 15k per round ok 
886,nassg7,t2_wqlfn,1620836734,/r/wallstreetbets/comments/nassg7/nintendo_ntdoy_is_69_right_now/,1,Nintendo ntdoy is 69 right now,
887,nasso7,t2_91itiala,1620836749,/r/wallstreetbets/comments/nasso7/mother_of_all_short_squeezes_amc/,1,MOTHER OF ALL SHORT SQUEEZES AMC,
888,nasthm,t2_c3bki8fe,1620836802,/r/wallstreetbets/comments/nasthm/how_to_make_friends_101_everyone_needs_a_fwb_a/,1,How to make friends 101 Everyone needs a FWB a Friend With Bloomberg,
889,nastr9,t2_3g8m6,1620836821,/r/wallstreetbets/comments/nastr9/it_doesnt_matter_we_like_the_stock/,1,IT DOESN T MATTER WE LIKE THE STOCK ,
890,nasuet,t2_9m1ygnb4,1620836861,/r/wallstreetbets/comments/nasuet/ayy_who_still_got_those_negative_price_oil/,1,Ayy who still got those negative price oil barrels from last year lmao,I have a great investment opportunity on the East Coast
891,nasvvp,t2_99jdoojr,1620836964,/r/wallstreetbets/comments/nasvvp/pltr/,1,PLTR, removed 
892,naswb7,t2_58uksts0,1620836992,/r/wallstreetbets/comments/naswb7/stellar_lumens_xlm/,1,Stellar Lumens XLM ,Whats your thoughts on XLM 946 65 in the past year Can we get this to the moon too 
893,naswly,t2_a1pwlgev,1620837012,/r/wallstreetbets/comments/naswly/to_the_moon_next_week_or_nothing/,1,To the Moon next week or nothing,
894,nasxfs,t2_h08jf,1620837061,/r/wallstreetbets/comments/nasxfs/safestos_is_going_crazy/,1,SafeSTOS is going crazy, removed 
895,nasy1i,t2_a3h34hb6,1620837098,/r/wallstreetbets/comments/nasy1i/neptune_digital/,1,Neptune Digital, removed 
896,nasym4,t2_62fqld6d,1620837132,/r/wallstreetbets/comments/nasym4/brrr/,1,Brrr ,
897,nasyrp,t2_bcrddcdg,1620837142,/r/wallstreetbets/comments/nasyrp/holy_bias_of_god/,1,Holy Bias of God ,
898,nasytc,t2_9h8gtavi,1620837145,/r/wallstreetbets/comments/nasytc/tribute_to_90s/,1,TRIBUTE TO 90 S, Guys it s time to get serious How about I think BTT BitTorrent has to be sent Ehmm Sent TOO THEEE MOOOOOOOON Since the 90 s BitTorrent is our friend where we download all the files we want pirated It s time to pay tribute to BTT Love u wsb
899,nasz7x,t2_bzttmd3c,1620837173,/r/wallstreetbets/comments/nasz7x/make_money_by_using_following_apps/,1,Make money by using following apps ,
900,nasz7x,t2_bzttmd3c,1620837173,/r/wallstreetbets/comments/nasz7x/make_money_by_using_following_apps/,1,Make money by using following apps ,
901,naszvs,t2_bcrddcdg,1620837218,/r/wallstreetbets/comments/naszvs/holy_freaking_bias_confirmed/,1,Holy Freaking Bias Confirmed,
902,nat0as,t2_c2gr3i39,1620837246,/r/wallstreetbets/comments/nat0as/shib_meme_nice/,1, shib Meme Nice ,
903,nat0bp,t2_8wv15gpl,1620837248,/r/wallstreetbets/comments/nat0bp/havent_had_a_day_this_bad_in_a_while/,1,Haven t had a day this bad in a while,
904,nat0ig,t2_b6zxzk4d,1620837260,/r/wallstreetbets/comments/nat0ig/join_to_make_quick_money_from_our_free_pd_signals/,1,Join to make quick money from our free p amp d signals ,
905,nat0lp,t2_8itl7l0o,1620837267,/r/wallstreetbets/comments/nat0lp/woo_hoo/,1,Woo hoo ,
906,nat0pu,t2_7yicxutu,1620837275,/r/wallstreetbets/comments/nat0pu/gamestop_has_entered_the_chat/,1, Gamestop has entered the chat,
907,nat0sc,t2_7olf1u0r,1620837280,/r/wallstreetbets/comments/nat0sc/yolo_uber_and_tsla_puts/,1,Yolo Uber and TSLA puts,
908,nat250,t2_857h71qa,1620837379,/r/wallstreetbets/comments/nat250/gamestop_right_now/,1,GameStop right now ,
909,nat28w,t2_bfcdgs48,1620837385,/r/wallstreetbets/comments/nat28w/bulls_dow_is_only_down_87_btfd_bears_yes_its_only/,1,Bulls Dow is only down 87 BTFD Bears Yes it s only down 1 100 in 2 days SELL DFV Buying more GME ,
910,nat2bv,t2_3czip,1620837389,/r/wallstreetbets/comments/nat2bv/6_months_later_theyve_caught_on/,1,6 months later they ve caught on,
911,nat2w1,t2_5rkdbz8c,1620837429,/r/wallstreetbets/comments/nat2w1/no_idea_what_im_doing/,1,No idea what I m doing ,
912,nat3ej,t2_c2gr3i39,1620837466,/r/wallstreetbets/comments/nat3ej/shib_yolo_come_on_guys/,1, shib Yolo come on guys ,
913,nat3m7,t2_3m9zlsrz,1620837480,/r/wallstreetbets/comments/nat3m7/guys_guys_guys/,1,GUYS GUYS GUYS, amp x200B https preview redd it xg5rgvjewpy61 png width 694 amp format png amp auto webp amp s 610294a6fe7808f7c3f3457d9918dd15b796cd2f
914,nat3xr,t2_7hbq16up,1620837503,/r/wallstreetbets/comments/nat3xr/made_700k_in_gme_in_jan_then_did_this/,1,Made 700k in GME in Jan Then did this,
915,nat4fd,t2_bfcdgs48,1620837540,/r/wallstreetbets/comments/nat4fd/bulls_futures_are_down_only_1_btfd_bears_yes_they/,1,Bulls Futures are down only 1 BTFD Bears Yes they are down over 3 000 in 2 days DFV Buying more ,
916,nat56o,t2_1erm4l55,1620837595,/r/wallstreetbets/comments/nat56o/clov_sale_happening_right_now_just_picked_up/,1, CLOV sale happening right now Just picked up another 2k units ,
917,nat5di,t2_595trve2,1620837608,/r/wallstreetbets/comments/nat5di/wsb_therapy_thread_for_everyone_in_growth_the/,1,WSB therapy thread for everyone in growth the past 3 months,You are loved 
918,nat5u6,t2_48mt122q,1620837640,/r/wallstreetbets/comments/nat5u6/uvxy_to_the_moon/,1,UVXY to the moon,
919,nat66a,t2_58uksts0,1620837662,/r/wallstreetbets/comments/nat66a/stellar_lumens_xlm_to_the_moon/,1,Stellar Lumens XLM to the moon ,
920,nat66y,t2_92vz8vu0,1620837663,/r/wallstreetbets/comments/nat66y/biggest_losers/,1,Biggest loser s,Hi all Does anyone know of a resource that lists the biggest loser s in terms of stock price over the last week month year 
921,nat69z,t2_a2neyj8n,1620837669,/r/wallstreetbets/comments/nat69z/buying_more_physical_silver_on_the_dip_today/,1,BUYING MORE PHYSICAL SILVER ON THE DIP TODAY amp NOTICED THIS NEW OPTION ON THE CHECK OUT ON APMEX NO THANK YOU I WANT TO HOLD IT IN MY HANDS ,
922,nat6wc,t2_6lehcfrv,1620837712,/r/wallstreetbets/comments/nat6wc/nio_to_the_moon/,1,Nio To The Moon , removed 
923,nat6yz,t2_8d2g7koi,1620837716,/r/wallstreetbets/comments/nat6yz/remember_when_you_sold_nasdaq_tech_at_a_huge_loss/,1,Remember when you sold NASDAQ tech at a huge loss to rotate into ReOpEninG StOcKs in the Dow when it was at an ATH ,We reopened in January You got scammed The time to make money from reopening was February Now you sold at a loss to buy stocks that crashed Congrats you played into the whales hands and we all for the moment are losing Remember how many times I told you apes to hold But no your scared asses insisted on selling futures THAT WERE AT ALL TIME LOWS in favor of made up reopening stocks because thats what you heard on NBC Noobs What a joke 
924,nat73q,t2_b6zxzk4d,1620837725,/r/wallstreetbets/comments/nat73q/join_to_make_quick_money_from_our_free_pd_signals/,1,Join to make quick money from our free P amp D signals Link in comments,
925,nat783,t2_5s1mjhhl,1620837734,/r/wallstreetbets/comments/nat783/is_everyone_just_pretending_to_be_wallstreetbets/,1,Is everyone just pretending to be WallStreetBets now ,
926,nat7fb,t2_9q8g6174,1620837747,/r/wallstreetbets/comments/nat7fb/amc_gme_we_need_the_dogg/,1,AMC amp GME WE NEED THE DOGG,
927,nat8cy,t2_b6zxzk4d,1620837814,/r/wallstreetbets/comments/nat8cy/join_to_make_quick_money_from_our_free_pd_signals/,1,Join to make quick money from our free P amp D signals Link in comments, removed 
928,nat8nf,t2_6711wokn,1620837835,/r/wallstreetbets/comments/nat8nf/got_some_nerv/,1,Got some NERV , removed 
929,nat9ru,t2_58uksts0,1620837910,/r/wallstreetbets/comments/nat9ru/can_stellar_lumens_xlm_be_next/,1,Can Stellar Lumens XLM be next ,
930,nata1m,t2_a4ejl5xk,1620837929,/r/wallstreetbets/comments/nata1m/lets_get_this_to_mars/,1,Lets get this to Mars,
931,nata2o,t2_880p8edq,1620837931,/r/wallstreetbets/comments/nata2o/you_retards_should_fucking_kyselves/,1,You retards should fucking kyselves, removed 
932,natadv,t2_iop8y,1620837949,/r/wallstreetbets/comments/natadv/nio_strong_rally_due/,1,NIO strong rally due, removed 
933,natalh,t2_aflt485b,1620837963,/r/wallstreetbets/comments/natalh/buy_high_sell_low/,1,buy high sell low,
934,natb9d,t2_9ye5jpiy,1620838002,/r/wallstreetbets/comments/natb9d/lmnd_can_be_a_worth_it_long_run_would_wait_a/,1,LMND can be a worth it long run Would wait a little longer , amp x200B https preview redd it zh4au89yxpy61 png width 1901 amp format png amp auto webp amp s f14cbdcf59678355ca74417f659d61f4aa4088a2
935,natbcp,t2_58g7ec53,1620838008,/r/wallstreetbets/comments/natbcp/pd/,1,P amp D,I don t mind the P amp D stuff that goes on here on occasion I really don t But just for variety could someone please pick a stock I own Maybe even one with squeeze potential If some of the loss port I ve seen lately were to have been in a stock with low volume we could have retired before summer This is not financial advice and I can t tell you what stocks I own but why are such shit stocks pumped up here every week instead of the good ones 
936,natbed,t2_bf001,1620838010,/r/wallstreetbets/comments/natbed/eli5_why_do_stocks_go_down_with_inflation/,1,ELI5 Why do stocks go down with inflation concerns Shouldn t they go up with inflation ,
937,natbk4,t2_s48a1,1620838020,/r/wallstreetbets/comments/natbk4/late_to_the_party_can_someone_explain_to_me_why/,1,Late to the party Can someone explain to me why GME is still relevant given the steadily dropping price since all the hype ,Can someone please explain this to me I know GME had all this craze a couple months ago but the stock price has been pretty steadily dropping from 160 70ish to 145 as of the time I write this I have a few bucks to throw at some new stock but I have to admit I m not entirely convinced at this point being so late to the party and all 
938,natbvc,t2_a0cjpffa,1620838039,/r/wallstreetbets/comments/natbvc/just_going_to_leave_this_here/,1,Just going to leave this here ,
939,natbwt,t2_97xspm1a,1620838041,/r/wallstreetbets/comments/natbwt/stonks_only_go_up/,1,Stonks Only Go Up,
940,natc42,t2_27w1lmg8,1620838053,/r/wallstreetbets/comments/natc42/si_at_901_on_iborrowdesk_200k_available/,1,SI at 90 1 on Iborrowdesk 200k available,
941,natcsr,t2_a0cjpffa,1620838101,/r/wallstreetbets/comments/natcsr/just_going_to_leave_this_here/,1,Just going to leave this here ,
942,natcwj,t2_a0cjpffa,1620838108,/r/wallstreetbets/comments/natcwj/just_going_to_leave_this_here/,1,Just going to leave this here ,
943,natdf1,t2_a0cjpffa,1620838145,/r/wallstreetbets/comments/natdf1/just_going_to_leave_this_here/,1,Just going to leave this here ,
944,natdlp,t2_a0cjpffa,1620838159,/r/wallstreetbets/comments/natdlp/just_going_to_leave_this_here/,1,Just going to leave this here ,
945,natdrb,t2_6x5ew,1620838171,/r/wallstreetbets/comments/natdrb/vote_gme/,1,VOTE GME, removed 
946,nateiv,t2_99ycvy07,1620838223,/r/wallstreetbets/comments/nateiv/matic_anyone/,0,matic anyone , removed 
947,natfim,t2_b5735prw,1620838291,/r/wallstreetbets/comments/natfim/how_much_short_interest_is_needed_for_a_squeeze/,1,How much short interest is needed for a squeeze ,
948,natgav,t2_2jx5a7oe,1620838351,/r/wallstreetbets/comments/natgav/spy/,1,Spy,Gamestop is having dead cat bounces Spy is just a dip Tsla 560 is the bottom Have a good day
949,natgzn,t2_13gnp6,1620838395,/r/wallstreetbets/comments/natgzn/anyone_else_being_rewarded_today_for_holding/,1,Anyone else being rewarded today for holding Hertz through the dark ages ,Hertz has rebounded nicely today What s the top end looking like 9 
950,natho2,t2_3bfy3mol,1620838447,/r/wallstreetbets/comments/natho2/colonial_pipeline_buying_opportunity/,1,Colonial Pipeline Buying Opportunity ,With Colonial pipeline being shut down this week by a successful cyberattack we are starting to feel the effects of a fragile supply chain reminiscent of the 2020 toilet paper apocalypse Initially I didn t think much of it but now 4 days into it 90 of the gas stations in our area have run out of fuel What is stopping something like this from happening to the power grid Water treatment plants Nuclear plants Nothing Coincidentally on April 20th the feds to keep this apolitical released a 100 day plan on increasing cybersecurity measures to increase protection of what I now realize is a fragile and broken system This was already on their radar and of concern long before the first successful US attack not even 3 weeks after unveiling the plan To the point With the prepper community starting not to look so crazy after all swap out the EMP fears for cyber attacks will this create deeper demand for solar energy generators and associated industries for protection against the now more realistic what if scenarios for businesses and individuals What stocks do you think are poised for growth in these areas 
951,natjmy,t2_a2ibedap,1620838584,/r/wallstreetbets/comments/natjmy/booming/,1,Booming, removed 
952,natk1g,t2_4hnwtskn,1620838612,/r/wallstreetbets/comments/natk1g/pug/,1,Pug, removed 
953,natk8d,t2_a5j1ehbm,1620838627,/r/wallstreetbets/comments/natk8d/meme_stocks/,1, Meme stocks ,
954,natkfq,t2_aa4yw70e,1620838642,/r/wallstreetbets/comments/natkfq/uwmc_is_ripe_for_a_squeezing/,1, UWMC is ripe for a squeezing , removed 
