,postid,author,created_utc,permalink,score,title,selftext
224,ncx7x7,t2_a21s6dwp,1621079813,/r/wallstreetbets/comments/ncx7x7/theres_an_opportunity_to_take_over_the_shiba_inu/,1,There s an opportunity to take over the Shiba Inu price Seems like the original scam plan failed Now they are pivoting The Shiba token has huge potential for us apes to set the price I think its a huge opportunity plus it will help save lives in India Any thoughts , removed 
225,ncx9mp,t2_bfiy13cz,1621079990,/r/wallstreetbets/comments/ncx9mp/buy_fuck_elon_and_short_x125_tesla/,1,BUY FUCK ELON and SHORT x125 TESLA, removed 
226,ncxe98,t2_a23du6wr,1621080411,/r/wallstreetbets/comments/ncxe98/tender_offer/,1, Tender Offer ,
227,ncxj7m,t2_9k6qed8w,1621080889,/r/wallstreetbets/comments/ncxj7m/is_this_a_cybermeatspace_textadventure_that_youd/,1,is this a cyber meatspace text adventure that you d play ,
228,ncxlp8,t2_7zle32jj,1621081119,/r/wallstreetbets/comments/ncxlp8/is_this_the_way/,1,Is this the way ,
229,ncxmzg,t2_8v7sudgk,1621081242,/r/wallstreetbets/comments/ncxmzg/cardano_to_the/,1,cardano to the ,
230,ncxomv,t2_3vcvh711,1621081404,/r/wallstreetbets/comments/ncxomv/peaky_blinders_season_5_episode_1_minute_3019/,1,Peaky Blinders season 5 episode 1 minute 30 19,
231,ncxpor,t2_8wgb645z,1621081505,/r/wallstreetbets/comments/ncxpor/is_etherum_on_etrade/,1,is Etherum on E Trade ,
232,ncxppr,t2_3kz3867l,1621081507,/r/wallstreetbets/comments/ncxppr/hon/,1, HON,
233,ncxrxk,t2_9uia94v6,1621081732,/r/wallstreetbets/comments/ncxrxk/weekend/,1,WEEKEND, removed 
234,ncxtr9,t2_773vn,1621081893,/r/wallstreetbets/comments/ncxtr9/uwmc_i_believe_in_you/,1,UWMC I believe in you,
235,ncxvmy,t2_aoqenvui,1621082055,/r/wallstreetbets/comments/ncxvmy/paper_trading_books_on_trading_and_then_real_life/,1,Paper Trading Books on Trading and then Real Life Trading,
236,ncxwer,t2_a13tcrb5,1621082127,/r/wallstreetbets/comments/ncxwer/we_the_future_need_to_invest_together_into/,1,We The Future need to invest together into projects like this to create liquidity to not only help ourselves but others this is beyond beautiful because of shiba I was able to buy into amc to double down opportunity and reinvest to continue growth Our future to the moon ,
237,ncxwfd,t2_8qmptzr6,1621082128,/r/wallstreetbets/comments/ncxwfd/hype_mode_for_the_weekend/,1,Hype mode for the weekend ,
238,ncxwkn,t2_a0qt7fx5,1621082142,/r/wallstreetbets/comments/ncxwkn/ino_massive_institutional_additions_massive_short/,1, INO MASSIVE INSTITUTIONAL ADDITIONS MASSIVE SHORT VOLUME,Fintels report has released some super encouraging info With the company already held institutionaly at about 45 fintels new report shows additional positions being added to the tune of approx 20 1 million shares not including puts that is about 10 ADDED to already HUGE POSITIONS https fintel io sob us ino That is literally another 10 of entire float So now with Institutions hold around 55 of float that leaves about 85 million shares outstanding of which 54MILLION SHARES ARE BEING SHORTED THIS THING IS PRIMED FOR TAKE OFF TOWER CONTROL ARE WE CLEAR FOR LIFT OFFFFFFF 
239,ncxws4,t2_3hrj3c3s,1621082162,/r/wallstreetbets/comments/ncxws4/help/,1,Help ,
240,ncxyhy,t2_16dwvnnp,1621082315,/r/wallstreetbets/comments/ncxyhy/buying_options_on_margin/,1,Buying Options on Margin,
241,ncy1w8,t2_8khck6z6,1621082614,/r/wallstreetbets/comments/ncy1w8/big_things_seems_comming_up_for_bonfire_token_get/,1,BIG THINGS SEEMS COMMING UP FOR BONFIRE TOKEN GET UPDATED amp STAY COZY, removed 
242,ncy2az,t2_aaxvbla9,1621082652,/r/wallstreetbets/comments/ncy2az/subscibe_my_new_yuo_tube_channel_plz/,1,Subscibe my new yuo tube channel plz,
243,ncy2zc,t2_8khck6z6,1621082710,/r/wallstreetbets/comments/ncy2zc/very_interesting_projects_from_bonfiretokens/,1,VERY INTERESTING PROJECTS FROM BONFIRETOKENS ,
244,ncy3c5,t2_6davh50b,1621082744,/r/wallstreetbets/comments/ncy3c5/to_the_moon_polygon_ankr_cardano_forget_butcoin/,1,To the moon POLYGON ANKR CARDANO forget butcoin its a atmospheric FART machine ,
245,ncy3vq,t2_7mjkpewn,1621082793,/r/wallstreetbets/comments/ncy3vq/help_explain/,1,Help explain,Can someone please explain what OTC stocks are I m investing in vmrsf and just wanna know what I got myself into Going full retard here just trying to not go bankrupt
246,ncy3xh,t2_8pjgkcig,1621082798,/r/wallstreetbets/comments/ncy3xh/pro_tip_dont_let_little_kids_touch_your_stuff/,1,Pro Tip Don t let little kids touch your stuff,
247,ncy5ih,t2_3s17jua,1621082945,/r/wallstreetbets/comments/ncy5ih/the_whole_world_is_watching/,1,The Whole World Is Watching ,So what happened to GME and AMC Naked Shorts and more illegal practices is what happen Its a new level of corruptions within the stock market Citadel and other corrupted HF s are testing the darker waters with their new illegal practices they want to see how far they can push the bar without getting any consequences or legal action against them amp x200B AMC and GME are by all means a trial of INTERGITY for the US stock market if nothing is done to fix it and the government won t punish the corrupted HF s or their illegal actions people will lose all hopes in the US stock market as a whole amp x200B This is NOT a one stock thing AMC GME and few more are just the FIRST victims If they can get away with them even with all the insane amount of publicity around them what prevents them from continue to do so to other stocks nothing basically Is this the future of the US Stock Market amp x200B Honestly I am frustrated and can t understand how they even managed to go that far without any real action against them This is NOT a MEME stock jokes anymore this is a real fight for a real cause this is the difference between RIGHT and WRONG this is JUSTICE amp x200B We must work together and keep pushing recently I ve seen too many apes fight each other for the most stupid reasons this is the corrupted HF s doing this to us with spies fuds manipulators fake news and what not But their REAL method of doing so is making us lose money by making it look like a pump and dump with their illegal naked shorts when we lose money we get frustrated and then we start to blame each other for not hodling even though WE ALL DO when that happen that s why we are here in the first place We fight those we love as they are the only ones who are willing to hear us amp x200B Even in this new dark age do not give up even when its hard justice is on OUR side and GOOD will always PREVAIL at the end The whole world is watching APESTRONK 
248,ncy6tq,t2_64ke5sqs,1621083059,/r/wallstreetbets/comments/ncy6tq/tech_stocks_roundup_jim_cramer_says_to_hold_onto/,1,Tech Stocks Roundup Jim Cramer Says to Hold Onto FAANG Stocks,
249,ncy7dm,t2_7qc59wk5,1621083118,/r/wallstreetbets/comments/ncy7dm/to_my_degenerate_friends_on_wall_calculate_from/,1,To my degenerate friends on wall calculate from 0 92 cents to 2 23 some 10 000 ADAs 10 000usd in a month now imagine 50 100usd per ADAs bye I see you on the moon Cardano,
250,ncy9e1,t2_bmkfgz7l,1621083305,/r/wallstreetbets/comments/ncy9e1/dont_hate_on_the_noob/,1,Don t hate on the NOOB , removed 
251,ncy9lk,t2_a0458w7f,1621083323,/r/wallstreetbets/comments/ncy9lk/nofap_coin_launch_dd/,1,NOFAP COIN LAUNCH DD, removed 
252,ncyh62,t2_w89vu,1621083984,/r/wallstreetbets/comments/ncyh62/otly/,1, OTLY, removed 
253,ncyj1q,t2_c59q85se,1621084156,/r/wallstreetbets/comments/ncyj1q/lets_feed_shiba_cuz_im_in_depths_and_i_wonna_be_a/,1,LETS FEED SHIBA CUZ IM IN DEPTHS AND I WONNA BE A MILIONARE,Basicly i bought shit ton of shiba and i hope you can help me Its cheap as fuuuuk and if we can all pump it we can pump it to a cent at least Plus im in huge depths and this will help me like a loot
254,ncyk0k,t2_c0twllyy,1621084235,/r/wallstreetbets/comments/ncyk0k/moonshot/,1,Moonshot ,
255,ncykq8,t2_c0twllyy,1621084293,/r/wallstreetbets/comments/ncykq8/buy_moonshot/,1,Buy moonshot ,
256,ncysnk,t2_2bhgenmz,1621084997,/r/wallstreetbets/comments/ncysnk/the_sharks_are_with_us/,1,The sharks are with us ,
257,ncyszf,t2_a366e2um,1621085024,/r/wallstreetbets/comments/ncyszf/robinhood_customer_service/,1,Robinhood Customer Service,I m having trouble signing onto my Robinhood account Their only customer service is email Wtf No phone support or chat Anyone else having trouble or have a way to contact Robinhood 
258,ncywyq,t2_9mi3yrlb,1621085382,/r/wallstreetbets/comments/ncywyq/newb_question_on_taxable_events/,1,Newb question on taxable events ,So I started investing small amounts into stocks and coin in march My stocks are down but my coins arw doing well My question is this I know you get taxed when you withdraw your money from an exchange But do you get taxed every time you sell an stock coin even if it doesn t leave the exchange If I sell high and then buy more when it dips to increase my position is that taxable even though I didn t withdraw any money I know day traders buy sell constantly so is every time they do that taxable 
259,ncyyvp,t2_a0zznmap,1621085535,/r/wallstreetbets/comments/ncyyvp/_/,1, ,
260,ncz0fh,t2_5iptuzno,1621085667,/r/wallstreetbets/comments/ncz0fh/shiba_is_literally_saving_lives_in_india_right/,1,SHIBA is literally saving lives in India right now Least we can do is support him ,
261,ncz0x3,t2_7b26r1as,1621085710,/r/wallstreetbets/comments/ncz0x3/_/,1, ,
262,ncz34v,t2_a0p7q9j3,1621085909,/r/wallstreetbets/comments/ncz34v/yolo_or_yodo/,1,YOLO or YODO ,
263,ncz45t,t2_9ulhbi8x,1621085998,/r/wallstreetbets/comments/ncz45t/what_is_short_ladder_attack/,1,What is short ladder attack, removed 
264,ncz5d2,t2_8ygx1gre,1621086096,/r/wallstreetbets/comments/ncz5d2/the_intelligent_investor_by_b_graham_autist/,1,The Intelligent Investor by B Graham Autist Edition , https youtu be 5nkR7DIz MI https youtu be 5nkR7DIz MI Whoever made this Intelligent Investor summary I know you re in here because you said To The Moon at 05 30 Just wanted to say thank you and that because you said To The Moon twice in this video I know you re out there somewhere eating crayons in the corner of a room with a Winnie the Pooh doll clutched in your arms Bless you 
265,ncz8e2,t2_7teh0a99,1621086343,/r/wallstreetbets/comments/ncz8e2/my_technical_analysis_and_trading_this_week/,1,My technical analysis and trading this week,
266,ncz8r9,t2_6ity9b79,1621086374,/r/wallstreetbets/comments/ncz8r9/grand_theft_tendies_ttwo_investors_call_is_on/,1,GRAND THEFT TENDIES TTWO investors call is on Tuesday we ve had a steady dip since last time with no new announcements Analysts price it much higher than current and were due a release date for GTA V on new gen consoles Who s in ,
267,nczb19,t2_vtdoqtg,1621086564,/r/wallstreetbets/comments/nczb19/isnt_this_photo_basically_everything_wsb/,1,isn t this photo basically everything WSB represents , removed 
268,nczd9n,t2_vtdoqtg,1621086742,/r/wallstreetbets/comments/nczd9n/isnt_this_what_wsb_is_all_about/,1,isn t this what WSB is all about , removed 
269,nczfq5,t2_9cqizhpz,1621086951,/r/wallstreetbets/comments/nczfq5/margin_call_question/,1,Margin call question,Can someone help me I received this from Webull after my account dropped below 25k It is now back above that and wonder if this call will be removed on Monday You have received a DT Call because your purchased positions exceeded your day trade buying power on 05 14 2021 Please deposit 5 819 85 before 05 20 2021 to satisfy the call 
270,nczfwh,t2_a1hp49kt,1621086966,/r/wallstreetbets/comments/nczfwh/this_is_how_bacanora_lithium_are_screwing_us/,1,This is how Bacanora Lithium are screwing us small shareholders over,
271,nczgwl,t2_8w28qyun,1621087053,/r/wallstreetbets/comments/nczgwl/i_need_an_answer_im_going_crazy/,1,I need an answer I m going crazy, removed 
272,nczh9r,t2_c5aiae62,1621087084,/r/wallstreetbets/comments/nczh9r/rxt_dd_30x_gain_with_a_margin_of_safety/,1,RXT DD 30x gain with a margin of safety,So we have 6 500 employees about 1 000 less than NFLX yet we probably make more money They are valued at 218 Billion and we are in the same Tech industry and are valued at 3 8 Billion Either NFLX is dropping 98 to its fair value or we are heading north fast in a big way Even a 30x gain would only get us to 114 Billion say there is a 60 Billion margin of safety because I can be wrong Position Buy stock or call options use your good judgment Personally I have bought stock and it is about 20 of my portfolio 
273,nczklo,t2_7cgm08px,1621087348,/r/wallstreetbets/comments/nczklo/tech_crash_possible/,1,Tech crash possible , removed 
274,nczkqr,t2_a0vhiu4j,1621087358,/r/wallstreetbets/comments/nczkqr/focus_your_firepower_amc/,1,Focus your firepower AMC ,Avengers Assemble 
275,nczkvz,t2_a1xci46s,1621087372,/r/wallstreetbets/comments/nczkvz/kabosu_on_can_aspire_to_coinbase/,1,Kabosu on can aspire to Coinbase, Coinbase will open the door to new tokens why not Kabosu On pancakeswap slippage tolerance 12 amp x200B https preview redd it bi13ukz1iaz61 png width 225 amp format png amp auto webp amp s daaf2c0620f9070a52964ae1a4f5e1e8f0ea3c26
276,nczlg1,t2_dgjsg,1621087415,/r/wallstreetbets/comments/nczlg1/this_is_what_tesla_desperation_looks_like/,1,This is what Tesla desperation looks like ,
277,nczm0w,t2_a0zsq8kb,1621087465,/r/wallstreetbets/comments/nczm0w/went_to_the_dmv_for_a_new_tabs_and_was_required/,1,Went to the DMV for a new tabs and was required to get new plates I think it s a sign ,
278,nczn7u,t2_8f5zs6j0,1621087569,/r/wallstreetbets/comments/nczn7u/anyone_else_holding_gnog/,1,Anyone else holding GNOG ,I m down 45 
279,nczn88,t2_9cjltysu,1621087569,/r/wallstreetbets/comments/nczn88/when_you_sell_163700_at_01/,1,When You Sell 163 700 at 01 ,
280,nczo6s,t2_a0qgs8pb,1621087652,/r/wallstreetbets/comments/nczo6s/cardano_energy_efficient_coin_up_over_20_yesterday/,1,Cardano energy efficient coin up over 20 yesterday ,Since Musk s comments about energy efficiency I ve been looking for a coin alternative Cardano was founded in 2015 by the Charles Hoskinson the co founder of Ether Just over 2 easily going to 10 or 20 
281,nczoxp,t2_a0qt7fx5,1621087715,/r/wallstreetbets/comments/nczoxp/ino_dd_update_potential_big_news/,1, INO DD Update POTENTIAL BIG NEWS,
282,nczoz9,t2_adwcnltl,1621087719,/r/wallstreetbets/comments/nczoz9/amp_token/,1,Amp token,
283,nczp7z,t2_ah8he9p6,1621087738,/r/wallstreetbets/comments/nczp7z/mind_medicine/,1,Mind Medicine ,I m new to this forum but I believe that this is a better stock with push towards the moon potential Rather than a turnaround in a video game company or a movie theatre chain with unsustainable overhead costs I believe investing in the future of pharmaceuticals has a higher likelihood of not only value appreciation but changing the world for the better I m currently overweight MNMD amp CMPS Do your research on the potential both are valued at under 1 5 billion gt 10 of Cathy Wood s flagship fund ARKK is in Tesla However these have a feel and makeup like a future ARK Innovation holding I may be completely wrong but I d love to hear your thoughts 
284,nczqig,t2_c5aej8g8,1621087840,/r/wallstreetbets/comments/nczqig/coinbase/,1,Coinbase,The shark will bite this week WATCHOUT will take the food from your mouth
285,nczs6m,t2_a0qt7fx5,1621087979,/r/wallstreetbets/comments/nczs6m/ino_update_potential_huge_news/,1, INO UPDATE Potential HUGE news,
286,nczt56,t2_7v7u71sg,1621088058,/r/wallstreetbets/comments/nczt56/you_beat_the_game_now_what/,1,YOU BEAT THE GAME Now what ,Congratulations fellow millionaire billionaire and trillionaire apes and appettes We did it We beat the game We ve taken all of the power over the stock market and US economy and placed it in our hands AMC reached a height of 6 9 million share and GME reached a height of 69 million a share What are we to do now I believe that the way that we answer this question is very important and crucial to the future of our economy and quality of life First off I believe that the overall stock market is going to tank BIG because of hedgies needing to liquidate their positions Many of these companies that are going to tank are critical to continuing day to day life That is why I believe that it is our job to reinvest our money back into these companies as soon as possible All for the sake of the people that missed out on the squeeze the people who somehow didn t hear about the squeeze the people who are 1 year away from retiring because their 401k has almost reached their goal Let s make this squeeze about making the world more right and fair for THOSE people The squeeze should NOT be all about us because if we all make it all about us the world would remain the same place that it is now Arguably worse because of economic collapse I love seeing the posts of peeps buying switches for kiddos and people talking about paying off their parents mortgage and giving massive tips to waiters waitresses That is what I believe the culture of WallStreetBets apes should be post squeeze Whether in this subreddit or a new one that gets created I would absolutely LOVE to keep up with you all after this I d love to be in a subreddit with a culture of giving and lifting people up that have been screwed over from the moment of their first breath Let s PLEASE make this happen Lastly I just want to point out Warren Buffett s first rule of investing NEVER LOSE MONEY To those of you who have no idea how to keep money and make it work for you I would highly HIGHLY recommend reading the book Rich Dad Poor Dad by Robert Kiyosaki This book will transform your mindset about money and could totally save your ape booty hole from your own ignorance So here is in my own personal opinion the best way to move forward post squeeze 1 Withdraw appropriate amount of tendies to pay your taxes I ll withdraw about 50 2 Reinvest money back into long positions in the stock market 3 Determine what 4 of your portfolio value is And spend no more than this 4 each year 4 Give money away to help people as much as possible You could also do this step before step 3 if you re okay with living off of less money each year It obviously depends on how much your portfolio is worth Lastly this is not financial advice This is all just my personal opinion Good luck everyone 
287,nczzb1,t2_4zewbtuq,1621088557,/r/wallstreetbets/comments/nczzb1/simple_strategy/,1,Simple strategy ,
288,nd0040,t2_8ibinict,1621088621,/r/wallstreetbets/comments/nd0040/gme_all_time_chart_technical_analysis/,1,GME ALL TIME Chart Technical Analysis,
289,nd01r6,t2_a1t056e0,1621088757,/r/wallstreetbets/comments/nd01r6/reposting_for_exposure/,1,Reposting for exposure ,
290,nd02nn,t2_6i4x1v1p,1621088835,/r/wallstreetbets/comments/nd02nn/this_is_not_investment_advice/,1, This is not investment advice ,
291,nd02wd,t2_8ibinict,1621088856,/r/wallstreetbets/comments/nd02wd/gme_all_time_inverse_chart_analysis/,1,GME ALL TIME Inverse Chart Analysis,
292,nd03as,t2_9ti4i0ap,1621088889,/r/wallstreetbets/comments/nd03as/help_this_is_some_bull_shit/,1,Help this is some BULL SHIT,
293,nd04cn,t2_9ragdt1h,1621088973,/r/wallstreetbets/comments/nd04cn/lets_push_docoin_to_the_fucking_moon/,1,LETS PUSH DOCOIN TO THE FUCKING MOON ,
294,nd04kk,t2_9m9ca3sd,1621088991,/r/wallstreetbets/comments/nd04kk/i_am_not_fucking_selling_alibaba_baba_oversold_af/,1,I am not fucking selling Alibaba BABA oversold af and I believe in Munger Shorts will be Squeezed soon and I can get my tendies ,
295,nd053v,t2_8ibinict,1621089034,/r/wallstreetbets/comments/nd053v/gme_all_time_chart_technical_analysis/,1,GME ALL TIME Chart Technical Analysis ,
296,nd05dv,t2_9g84w604,1621089060,/r/wallstreetbets/comments/nd05dv/what_do_you_think_of_this_uwmc_situation/,1,What do you think of this UWMC situation , I honestly don t understand what it means when a company can buy back 40 of the float https twitter com silberschmelzer status 1391855534496788482 s 20 short interest is 13 of float https www marketwatch com investing stock uwmc institutional investors own 25 https whalewisdom com stock ghiv of which many are red not selling and total open interest on options expiring May 21 lt 12 5 strike is 188 572 https finance yahoo com quote UWMC options or 20 of float and is maintaining traction on wsb https wsbtrackers com Y ll think UWMC is a good play for next week 
297,nd085y,t2_8ibinict,1621089270,/r/wallstreetbets/comments/nd085y/gme_all_time_chart_technical_analysis/,1,GME ALL TIME Chart Technical Analysis ,
298,nd0ci1,t2_66x12c8g,1621089604,/r/wallstreetbets/comments/nd0ci1/pray_to_the_short_gods_of_kucoin_alleggsonebasket/,1,Pray to the Short Gods of KuCoin AllEggsOneBasket,
299,nd0g9r,t2_5ocobars,1621089893,/r/wallstreetbets/comments/nd0g9r/its_a_good_day_for_holding_amc_back_in_the_green/,1,It s a good day for holding AMC back in the green and look what dropped through my post today ,
300,nd0g9r,t2_5ocobars,1621089893,/r/wallstreetbets/comments/nd0g9r/its_a_good_day_for_holding_amc_back_in_the_green/,1,It s a good day for holding AMC back in the green and look what dropped through my post today ,
301,nd0h9j,t2_66x12c8g,1621089975,/r/wallstreetbets/comments/nd0h9j/alleggsonebasket_short_gods_will_be_in_my_favor/,1, AllEggsOneBasket Short Gods will be in my favor,
302,nd0hxt,t2_9qdd542j,1621090025,/r/wallstreetbets/comments/nd0hxt/strip_club_that_is_buying_back_its_own_stock_rick/,1,Strip club that is buying back its own stock RICK conference call CEO stated looking to pay 4 5x sales to expand high margin alcohol sale business real value, removed 
303,nd0jf2,t2_b4kj8iyr,1621090137,/r/wallstreetbets/comments/nd0jf2/finally/,1,Finally,
304,nd0jtx,t2_66x12c8g,1621090174,/r/wallstreetbets/comments/nd0jtx/alleggsonebasket_pray_to_the_god_of_tendies/,1, AllEggsOneBasket Pray to the God of Tendies,
305,nd0l1h,t2_c5be61i0,1621090262,/r/wallstreetbets/comments/nd0l1h/amc_is_next_up_guys/,1,AMC is next up guys, removed 
306,nd0mvk,t2_c5achrdv,1621090406,/r/wallstreetbets/comments/nd0mvk/apls_stock_moonshot_monday/,1,APLS stock moonshot monday,APLS just got an their Empaveli drug FDA approval yesterday Empaveli which treat PNH a rare and chronic disease that results an abnormal breakdown of Redblood cells The only current available drug in the market right now is Soliris from Alexion Pharmaceuticals ticker symbol ALXN It is the most expensive drug in the world cost 18000 per shot and 600 000 a year PNH global market size 2 7 Billion a year Alexion Pharmaceuticals sold to Astrazenica for 29 Billion APLS current market cap is 3 5 billion so do your own math how much this will moonshot at current price According to the study Empaveli is far superior drug than Soliris in treating PNH no wonder Alexion Pharmaceuticals just recently sold to AZN they will be losing market share to APLS With 14 SHORT interest it is perfect example of possible SHORT SQUEEZE Goldman Sachs has 130 price target disclaimer im long APLS i maybe wrong with thenumbers and comparison to ALXN so do your own DD before investing 
307,nd0nj7,t2_2frz30mn,1621090460,/r/wallstreetbets/comments/nd0nj7/buy_shib/,1,Buy SHIB, removed 
308,nd0pjy,t2_66x12c8g,1621090616,/r/wallstreetbets/comments/nd0pjy/alleggsonebasket_pray_to_the_short_gods_for_me/,1, AllEggsOneBasket Pray to the Short Gods for me,
309,nd0ptr,t2_c5be61i0,1621090639,/r/wallstreetbets/comments/nd0ptr/last_week_there_was_a_huge_amount_of_buying/,1,Last Week There was a Huge Amount of Buying Activity on AMC,The technicals do look very strong going into Monday I wonder what will happen in the next couple of weeks Is it time 
310,nd0qmd,t2_8f5zs6j0,1621090700,/r/wallstreetbets/comments/nd0qmd/anyone_else_holding_gnog/,1,Anyone else holding GNOG ,
311,nd0r5e,t2_8m4h3ani,1621090744,/r/wallstreetbets/comments/nd0r5e/1_year_in_stonks_vs_crypt0/,1,1 year in stonks vs crypt0,
312,nd0ret,t2_3j0kzt86,1621090767,/r/wallstreetbets/comments/nd0ret/what_im_about_to_tell_you_is_not_financial_advice/,1,WHAT IM ABOUT TO TELL YOU IS NOT FINANCIAL ADVICE CROSSPOSTING FOR EVERY APE TO SEE,Morning apes this is a long ass weekend I m working to make it pass by Plus my girlfriend is working some side job today Let me remind all of you smooth brained apes out there on a little secret GME is going to be a once in a lifetime opportunity I m not telling you to yolo your cash into it I m just stating my opinion PLEASE DONT FORGET if you were to put a shit load of money into gme like idk 50k or 100k and gme fell through and dropped to 0 dollars Yes I said 0 dollars and you lost whatever you put in Our great country has thing called capital losses You can deduct 3k a year until your losses are covered So let me give you apes an example Let s say I yoloed 100k into gme If gme fell through which it won t nfa and I m 25 years old I ll get my money back in 33 years Do the math and think about what I m saying apes I like the stock and I think it s going to the moon If you yoloed your money it s not like your completely fucked So sit on that for the weekend Everything I said here today was not financial advice See you apes on Monday 
313,nd0v26,t2_awrhxs0c,1621091026,/r/wallstreetbets/comments/nd0v26/want_to_help_the_cause_stop_staring_at_your_phone/,1,Want to help the cause Stop staring at your phone take a break for the DD and go to a movie this weekend ,
314,nd0x51,t2_c51j8rb7,1621091189,/r/wallstreetbets/comments/nd0x51/frankly_bigcoin/,1,Frankly BigCoin,Sell Bigcoin says Whaley https preview redd it w7lrx346uaz61 png width 300 amp format png amp auto webp amp s 88fc950165933445aaf76181d09912117bd28ef1
315,nd12mc,t2_6jm9c53p,1621091613,/r/wallstreetbets/comments/nd12mc/we_believe_strongly_that_silver_prices_will_see/,1,We believe strongly that silver prices will see new all time highs by the end of the year We also believe in a high probability for silver prices to reach near triple digit price levels ,
316,nd157i,t2_8vxmkab5,1621091820,/r/wallstreetbets/comments/nd157i/uwmc_zero_borrow_and_almost_100_fee_next_week/,1,UWMC Zero Borrow And almost 100 fee next week will be fun to watch ,
