,postid,author,created_utc,permalink,score,title,selftext
189,ncuhc8,t2_97km5a51,1621069098,/r/wallstreetbets/comments/ncuhc8/hot_stocks_to_buy_next_week_5_reddit_stocks_in/,1,Hot Stocks To Buy Next Week 5 Reddit Stocks In Focus,
190,ncuhcs,t2_c33npoos,1621069099,/r/wallstreetbets/comments/ncuhcs/what_should_i_do_here/,1,What should I do here ,I use etoro to make my trades because it has the virtual money option to test out my strats so I wanted to invest in some gold but the market was closed and the price is kinda high what can I do to profit off gold when I think that the price will drop 
191,ncuhzh,t2_7o2wigxi,1621069170,/r/wallstreetbets/comments/ncuhzh/i_got_banned_on_discord_by_the_bot_mod/,1,I got banned on Discord by the Bot Mod, removed 
192,ncuio6,t2_7o2wigxi,1621069231,/r/wallstreetbets/comments/ncuio6/i_got_banned_accidentally_on_the_wsb_discord/,1,I got banned accidentally on the WSB Discord, removed 
193,ncuo5t,t2_15d5ctlx,1621069854,/r/wallstreetbets/comments/ncuo5t/shiba_inu_to_the_moon/,1,Shiba inu to the moon ,I need to know if its worth investing amp x200B https preview redd it n17155i939z61 png width 642 amp format png amp auto webp amp s a1c2ad0794f07a42f02ac9f2f4343559adf17597
194,ncuxza,t2_an6cn0d3,1621070963,/r/wallstreetbets/comments/ncuxza/etherem_swap_to_tkinu_to_the_moon_let_make_some/,1,etherem swap to TKINU to the moon let make some more millionaires,
195,ncuz76,t2_itvwr,1621071099,/r/wallstreetbets/comments/ncuz76/skrtusdt_to_15_today/,1,SKRT USDT to 15 TODAY ,Expect it 
196,ncv23m,t2_6x27ojzt,1621071429,/r/wallstreetbets/comments/ncv23m/dont_fucking_sell/,1,DON T FUCKING SELL,
197,ncv7nv,t2_5vnqovtq,1621072080,/r/wallstreetbets/comments/ncv7nv/uwmc/,1,UWMC ,
198,ncvas3,t2_8u7q1obm,1621072441,/r/wallstreetbets/comments/ncvas3/cate_to_the_moon/,1, CATE TO THE MOON,
199,ncvcck,t2_5svdtd8r,1621072623,/r/wallstreetbets/comments/ncvcck/uwmc_short_availability_from_ib_biggest_broker/,1,UWMC short availability from IB biggest broker ,
200,ncvcck,t2_5svdtd8r,1621072623,/r/wallstreetbets/comments/ncvcck/uwmc_short_availability_from_ib_biggest_broker/,1,UWMC short availability from IB biggest broker ,
201,ncvcrz,t2_19ijnlpp,1621072680,/r/wallstreetbets/comments/ncvcrz/there_is_only_one_real_greentech_iota/,1,There is only one real greentech IOTA,
202,ncvep6,t2_19ijnlpp,1621072875,/r/wallstreetbets/comments/ncvep6/the_only_real_greentech_iota_made_for_internet_of/,1,The only real greentech IOTA made for Internet of Things made for our environment,
203,ncvgmu,t2_eaak0,1621073098,/r/wallstreetbets/comments/ncvgmu/most_anticipated_earnings_releases_for_the_week/,1,Most Anticipated Earnings Releases for the week beginning May 17th 2021,
204,ncvhii,t2_k1kzzb5,1621073195,/r/wallstreetbets/comments/ncvhii/blew_up_20000_trying_to_buy_the_indexs_dips_in/,1,Blew up 20 000 trying to buy the index s dips in the last on leverage in 2 weeks I use to make fun of people like this I never thought I d be one of you guys I ve totally lost confidence in my ability to daytrade lmao ,
205,ncvj44,t2_iutdy,1621073367,/r/wallstreetbets/comments/ncvj44/a_new_study_points_to_mdma_as_a_powerful/,1,A New Study Points to MDMA as a Powerful Treatment for PTSD MNMD , https time com 6047283 mdma ecstasy ptsd treatment utm source twitter amp utm medium social amp utm campaign editorial amp utm term health mental health amp linkId 118765364 https time com 6047283 mdma ecstasy ptsd treatment utm source twitter amp utm medium social amp utm campaign editorial amp utm term health mental health amp linkId 118765364 
206,ncvjo8,t2_iutdy,1621073420,/r/wallstreetbets/comments/ncvjo8/a_new_study_points_to_mdma_as_a_powerful/,1,A New Study Points to MDMA as a Powerful Treatment for PTSD MNMD , https time com 6047283 mdma ecstasy ptsd treatment https time com 6047283 mdma ecstasy ptsd treatment 
207,ncw1fs,t2_6c1ppbsp,1621075335,/r/wallstreetbets/comments/ncw1fs/genuine_question/,1,Genuine question,Y all I m new to stocks I bought some but I want to delete the app FROM MY PHONE That won t affect my account right I can delete the app and my account will be fine and oh say a year from now when I want to check up on how they re doing I can just redownload and they ll still be there 
208,ncw59x,t2_98skclld,1621075753,/r/wallstreetbets/comments/ncw59x/main_reasons_why_i_would_invest_in_bcrx_before_q2/,1,Main Reasons why I would INVEST in BCRX before Q2 ER,In this article I will shortly explain the main reasons why I would buy BCRX before the Q2 EarningsReport In case you re looking for some deeper DD I suggest you check out the other BCRX DD article https www reddit com r wallstreetbets comments mtzhp2 bcrx dd the embarrassment of riches I wrote amp x200B 2021 Q1 ER Beat On May the 6th 2021 BCRX presented Q1 Earnings Report data managing to Beat Analysts estimates Basically what matters from this Q1 ER is that it was the launch of Orladeyo and Analysts wanted to see a decent amount of money generated by it They were expecting Orladeyo sales to top 3 1MM and Orladeyo actually generated 10 94MM this is a 353 sales beat https preview redd it uppmf8dy09z61 png width 765 amp format png amp auto webp amp s 7215a9fc3d12ae2ead2bb782802742ef8ab998cb The consequence of the ER beat was an increase of 24 06 in the SP amp x200B https preview redd it 3dhmebmo39z61 jpg width 1080 amp format pjpg amp auto webp amp s 8876fcc6c02233d347ec7bab257ef079d5ea74e6 amp x200B It s really important to mention that revenues generated this Q1 only came from the USA This Q2 Orladeyo has been approved in Japan Europe UK aswell adding new sources of revenue amp x200B Orladeyo sales are expected to grow exponentially each quarter Main reason for it is that it has been approved in the countries mentioned above The other reason is that the amount of patients they treat will slowly score up as insurance companies allow their clients to be treated with this drug amp x200B The data displayed below shows the amount of patients using Orladeyo in 3 or 4 pharmacies which provide information to Bloomberg This numbers help us to have an idea of how Orladeyo is doing in terms of gaining new patients but it s not 100 accurate amp x200B https preview redd it qw97n7ga89z61 png width 1257 amp format png amp auto webp amp s 7d353dc8fe919da2f4e10d6c5f68527c7cb7813b If we sum up the numbers from the Q1 we get a total of 43 patients in the first month of Q2 there are 38 new patients already meaning Orladeyo nearly managed to get in a single month all the amount of patients it gathered in the Q1 reasuring the exponential growth This numbers will keep rising now that Orladeyo is approved in additional countries amp x200B amp x200B Orladeyo Berotralstat oral pill amp x200B Basically Biocryst has a drug called Orladeyo which is the first Oral approved treatment used to prevent swelling attacks in people with hereditary angioedema HAE It is estimated that HAE affects 1 in 50 000 people amp x200B Orladeyo was firstly approved in the USA December the 3rd 2020 Q4 Orladeyo received Japan NHI price listing approval April the 14th 2021 Q2 Orladeyo received European approval April the 30th 2021 Q2 Orladeyo received UK approval May the 12th 2021 Q2 amp x200B Orladeyo is ranked https www beckershospitalreview com pharmacy 20 most expensive prescription drugs in 2021 html the 13 most expensive drug in the USA market The price shown below 37 308 is approximately what patients must monthly pay to access the drug amp x200B amp x200B https preview redd it 68per70ny8z61 png width 672 amp format png amp auto webp amp s 9146f6c55c4280ab48b5af36f4a46edaa603807c amp x200B amp x200B USA In the USA there currently are 10 000 patients 7500 diagnosed and treated 1700 diagnosed but not treated 600 treated but not diagnosed Physicians expect to prescribe Orladeyo for over 41 of HAE patients Conservatively thinking taking 7 500 patients the diagnosed and treated ones out of the total 10 000 pool in the USA with over 41 of patients prescription https ir biocryst com static files f093d843 a642 41c6 8a65 1b5d1800f6cd page 16 we would conservatively aim for 3 075 patients amp x200B https preview redd it arh13tkub9z61 png width 1241 amp format png amp auto webp amp s 4cfb70508321842a2123cb2b4fc586343e28dc94 The amount of money that must be yearly paid to access Orladeyo in the USA is equal to 485 000 amp x200B amp x200B Japan On November the 5th Biocryst undergone an agreement with Torii Pharmaceuticals A local Japanese company that will be in charge of getting new patients to be treated with Orladeyo in Japan and commerzialing it Japan has around 2 500 HAE patients and Biocryst conservatively expects to at least reach 500 patients The amount of money that must be yearly paid to access Orladeyo in Japan is equal to 248 500 Approval of Orladeyo in Japan issued a 15MM milestone payment from Torii BioCryst will receive tiered royalties ranging from 20 40 of Japanese sales amp x200B Europe It s estimated to be around 12 000 HAE patients in Europe Following the physician prescription of over 41 of patients to prescribe https ir biocryst com static files f093d843 a642 41c6 8a65 1b5d1800f6cd page 16 for Orladeyo We get a total of 4 920 patients in Europe Since pricings and jurisdictions work in a different way in Europe the amount of money each patient will have to pay for Orladeyo is expected to be around or above Japan s 248 500 year This number should soon be confirmed amp x200B amp x200B With this yearly prices and the amount of patients defined before we get the following results USA 3 075p x 485K 1 491 375 000 Japan 500p x 248 5K 124 250 000 EU 4 920p x 248 5K 1 222 620 000 Summing it all up we get 2 751 270 000 From that number we have to subtract 123 100 000 making it a total of 2 628 170 000 The sustraction happens as a result of the undergone Royalty agreement with Torii Pharmaceuticals and Royalty Pharma amp x200B Having in mind the discussed numbers before Orladeyo alone will be generating 2 628 170 000 a year using the average mid cap Biotech company multiplier x7 We get a total of 18 397 190 000 meaning an increase of 104 46 in the stock price amp x200B CEO himself confirmed multiple times that the company will not need to do offerings anymore As shown in the pic below current cash runaway takes them into 2023 amp x200B https preview redd it 3xehgeq9k9z61 png width 1216 amp format png amp auto webp amp s 74a81e11b1817c7978f786ec3bd159ef52534484 amp x200B Conclusion We are just about to witness how BCRX evolves from being a small cap company to being a high cap one This will mainly happen due to the revenue generated by Orladeyo and the potential of BCX9930 Basically from now on each ER will be a new catalyst for BCRX Considering how Orladeyo is still in an early launch state the revenue it generates will exponentially keep growing so will the SP Orladeyo undoubtly is an awesome asset for BCRX a cash cow But the one drug in BCRX s pipeline that has the most promising future is BCX9930 An Oral inhibitor in PH3 which treats 8 different diseases as of now aimming for a potential 40B market size by 2025 Deeper information about it can be found in the following article BCRX The Embarrassment of Riches https www reddit com r wallstreetbets comments mtzhp2 bcrx dd the embarrassment of riches I currently do have a position in this company my average entry price being around the 4 range In my opinion BCRX probably has the best safe reward ratio in the bio world and I do not plan to sell my shares yet 
209,ncw5by,t2_a04ofgmh,1621075758,/r/wallstreetbets/comments/ncw5by/uwmc_primed_to_squeeze/,1,UWMC primed to squeeze,
