,postid,author,created_utc,permalink,score,title,selftext
0,ncob7v,t2_55gjbjbw,1621043511,/r/wallstreetbets/comments/ncob7v/still_over_1m_long_next_week_will_be_fun_earnings/,1,Still Over 1M Long Next Week Will Be Fun Earnings Monday Morning and Over 43M Institutional Shares Accounted For With 13Fs Filed the Last Two Weeks And 345k Open Calls Expiring Friday,
1,ncocyu,t2_apduxdw1,1621043699,/r/wallstreetbets/comments/ncocyu/amc_to_the_moon/,1,AMC to the moon , removed 
2,ncodoa,t2_8uq8tmrs,1621043775,/r/wallstreetbets/comments/ncodoa/cardano_yes_or_no/,1,Cardano yes or no ,
3,ncodx5,t2_7oouy7in,1621043804,/r/wallstreetbets/comments/ncodx5/look_at_this_monke/,1,Look at this Monke,
4,ncoe0k,t2_c3f0mtkq,1621043815,/r/wallstreetbets/comments/ncoe0k/is_this_true_im_new_to_all_this/,1,Is this true I m new to all this ,57 7 of today s volume 80million was routed through the dark pool All those buys did nothing for the price The dark pool is an underground exchange hedge funds use when they want to buy or sell shares and hide their identity a secret from other hedge funds Nothing illegal about it One of the 2 whistleblowers that came forward brought to light dark wires Which is an algorithm used with fiber optics that routes bought shares of retail investors to the dark pool in quantities that always give hedge funds the upper hand Meaning that when a stock price goes up is because the algorithm allows it either because the hedge fund has a long position or simply done to make the market seem fair AMC stock shot up 1 10 over 14 because 5 million shares were covered let that price action sink in Now imagine if the 80 million shares bought today were not wired by market makers Now imagine how long this has been going on and how high the price would be today and how long ago they would have been forced to cover We could have been millionaires by March Now imagine how rich we would be investing all that into xrp This is something they will not allow to happen SEC is not doing their job 
5,ncofgq,t2_a3qovb8o,1621043974,/r/wallstreetbets/comments/ncofgq/invest_with_coinbase/,1,Invest with coinbase, removed 
6,ncofol,t2_8ddob5ur,1621043997,/r/wallstreetbets/comments/ncofol/milf_token/,1, MILF token, removed 
7,ncog1f,t2_7vzjr74z,1621044023,/r/wallstreetbets/comments/ncog1f/easiest_way_to_become_a_millionaire/,1,Easiest way to become a millionaire , removed 
8,ncogiv,t2_8pj4fd17,1621044072,/r/wallstreetbets/comments/ncogiv/alibaba_hugely_undervalued_tech_giant/,1,Alibaba hugely undervalued tech giant, removed 
9,ncoh5m,t2_xq5pi,1621044139,/r/wallstreetbets/comments/ncoh5m/financial_crisis_can_always_wait/,1,Financial crisis can always wait, removed 
10,ncoig1,t2_a1e31xw2,1621044271,/r/wallstreetbets/comments/ncoig1/theres_a_hedge_fund_official_here/,1,There s a hedge fund official here ,There s a hedge fund official here Don t be fooled by what they say We just need to hold it 
11,ncoj8d,t2_7bvfzidp,1621044354,/r/wallstreetbets/comments/ncoj8d/a_friend_invested_all_his_money_into_gme_thinking/,1,A friend invested all his money into gme thinking it will hit 10k 100k a share this month , removed 
12,ncoju8,t2_8se82p8w,1621044412,/r/wallstreetbets/comments/ncoju8/charles_hoskinson_about_spades_he_knows_whats/,1,Charles Hoskinson about Spades He knows what s coming ,
13,ncokbr,t2_4lngr,1621044461,/r/wallstreetbets/comments/ncokbr/one_of_us_on_jeopardy/,1,One of us on Jeopardy, removed 
14,ncoklk,t2_4ruie,1621044487,/r/wallstreetbets/comments/ncoklk/screw_your_green_portfolio_we_made_it_to_a_tile/,1,Screw your green portfolio We made it to a tile in Jeopardy I ll take To the Fucking Moon for 2000 a share Alex ,
15,ncokwt,t2_aerigix5,1621044516,/r/wallstreetbets/comments/ncokwt/amc_reason_for_price_movement_this_week_companies/,1,AMC Reason for price movement this week Companies in red closing out losing puts and companies in green new to bag holding puts Shitadel still bag holding the hardest Big otm puts on 5 21 and 6 18 More will be otm loosers with price climbing ,
16,ncolo6,t2_aerigix5,1621044592,/r/wallstreetbets/comments/ncolo6/amc_reason_for_price_movement_this_week_companies/,1,AMC Reason for price movement this week Companies in red closing out loosing puts and companies in green new to bag holding puts Shitadel still bag holding the hardest Big otm puts on 5 21 and 6 18 More will be otm loosers with price climbing ,
17,ncon0k,t2_9y4ss3qq,1621044729,/r/wallstreetbets/comments/ncon0k/considering_dumping_money_into_amc_need_help/,1,Considering dumping money into AMC need help ,Hey everyone my very first post on Reddit I have been day swing trading since early December of 2020 and decided to take all my profits from my first month and invest into AMC early in January during all of the hype sadly me and my silly paper hands lost me a good chunk of money after selling for a good loss with intentions of it never going back up again However with the recent interest in the past few days and the skyrocketing volume I have been considering re buying back into it With my past experience of AMC it feels like my heart is telling me not to invest but my brain is telling me to think of the potential gains Thus bringing me to WSB where I hope to receive some advice and updates on the true short interest possibilities of a short squeeze days to cover etc from you apes I have been attempting to keep myself updated very fluently by watching YouTube videos the past few days however I do not want to be misinformed or mislead into buying as I did the exact same thing in early January and impulse bought into AMC leaving me a hefty bag holder I have a very salty opinion on YouTubers as I feel they are really only doing this for the ad revenue and to bring popularity to their channels and I do not consider them a reliable source They can also really pull out of AMC whenever without a loss as many of their average s are considerably low Anyways thanks for listening to my spiel any information on the topic would be greatly appreciated and if the short interest is still very high and shorts are not shown to be covering I will most definitely take a position again at a good entry point Thanks 
18,ncopo6,t2_8lmwqkkq,1621045001,/r/wallstreetbets/comments/ncopo6/i_feel_like_the_joker_every_day/,1,I feel like the joker every day ,
19,ncopx6,t2_51o0xh6i,1621045026,/r/wallstreetbets/comments/ncopx6/amc_lets_talk_technicals_analysis_in_comments/,1, AMC Let s talk technicals analysis in comments ,
20,ncoq0r,t2_3bbd8mis,1621045035,/r/wallstreetbets/comments/ncoq0r/shiba_inu/,1,Shiba Inu ,
21,ncoq9x,t2_bdl1l8bx,1621045061,/r/wallstreetbets/comments/ncoq9x/robinhood/,1,RobinHood ,With everything that has happened with RobinHood I really want to hear people opinions about this application I personally do not use it because of what I ve seen Curious what everyone else s opinions are 
22,ncostz,t2_a3b9zl7q,1621045311,/r/wallstreetbets/comments/ncostz/beginner_buy_suggestions/,1,Beginner Buy Suggestions,I just took a lone of 5K and wanted to know what would be a best place to invest and get returns quickly before loan becomes due Any ideas will be appreciated
23,ncot1t,t2_1yg4slyd,1621045332,/r/wallstreetbets/comments/ncot1t/mining_with_clean_energy_mkty/,1,Mining with clean energy MKTY,
24,ncot1y,t2_qd3k02t,1621045332,/r/wallstreetbets/comments/ncot1y/60_minutes_to_air_specialized_uap_program_ahead/,1,60 Minutes to Air Specialized UAP Program ahead of Govt June Mandate to Release Files , https twitter com 60Minutes status 1393250354133970949 s 20 https twitter com 60Minutes status 1393250354133970949 s 20 Unidentified Aerial Phenomenon Momentum has been building across the world for greater disclosure of government knowledge into UAP s Unidentified Aerial Phenomenon after the New York Times released it s bombshell coverage of encounters by 3 Navy pilots in 2017 and 2019 each reporting to have seen technology that defies the limits of physics with capabilities that far exceed that of any known assets in US Russian or Chinese arsenals Manoeuvres that have been witnessed include rapid deacceleration high velocity to a sudden stop then hover sharp angle high velocity low angle turns right angles or sharper low altitude trans medium travel submerged craft lifting and flying from water and the reverse high altitude trans medium travel craft dropping from above 80 000 ft then coming to a hover at 30 000 ft and the reverse high velocity travel Mach 10 or near instantaneous non aerodynamic aircraft design cubes pyramids cylinders disks acorns top hats and propulsion systems that do not function off of exothermic thrust based physics no thermal heat trail Pressure has been building on the Pentagon to release what it knows which has since resulted in the declassification of those videos and confirmation by the Pentagon that they are authentic as well as new mandates outlined in the 2021 COVID relief bill mandating full government disclosure by June 2021 The Pentagon has also publicly announced the creation of a new UFO taskforce and has been giving closed door briefings to members of the Senate and Congress including the Senate Intelligence Committee on these incursions into American airspace Former Senate Majority Leader Harry Reid has long fought for funding and disclosure and recently when asked the question so are you saying there s information that the public hasn t seen on the subject he responded what I m telling you is that the public hasn t seen most of the information As recently as two weeks ago new videos and pictures have been leaked of UAP s flying in formation over US battle squadrons which include captured images of acorn and pyramid shaped craft hovering at distance The frequency of these incursions has also been alarming prompting several Atlantic based Airforce bases to issue warnings to their pilots of unknown objects in their airspace ahead of every exercise Radar technicians aboard the aircraft carrier Nimitz describe seeing these objects at such a high frequency and in such high numbers that on some days they were described as falling out of the sky Additional alarm has been raised by other members of the military as the frequency of sightings also seems to correlate with proximity to nuclear facilities including missile silos aircraft carriers and submarines with senior officials in charge of these facilities describing anomalies in launch sequences that appear to be intentional These concerns are what prompted Christopher Lemon former Deputy Assistant Secretary of Defense for Intelligence along with Luis Elizondo former director of the Advanced Aerospace Threat Identification Program ATTIP at the Pentagon to leak the videos to the New York Times Speculation of UFO s dates back to World War II where pilots regularly observed bright lights in the sky that would track them into battles At the time these unknown objects were referred to as Foo Fighters but were later termed UFO s Unidentified Flying Objects after the public became enthralled in the crash at Roswell where the government announced it was in possession of an alien aircraft and subsequently retracted the story the following day Public interest was further garnered in the 1980 s when a military contractor Bob Lazar who worked as a physicist on advanced propulsion systems came forward with information that he had worked on 9 crafts in government possession at a military black site called S 4 that matched the descriptions and performance capabilities of the UFO s described by pilots This base was later known as Area 51 and has captured the publics imagination ever since In 2001 a group of concerned senior military leadership and citizens held the first attempt at public disclosure hosting the Citizens Disclosure Project in front of a panel of several sitting US Senators While momentum again began to build that momentum was quickly quashed by the events of September 11 and public interest and only just begun to resurface Article in the New York Times detailing the UAP Task Force and report release here https www nytimes com 2020 07 23 us politics pentagon ufo harry reid navy https www nytimes com 2020 07 23 us politics pentagon ufo harry reid navy Investigative journalism by The New Yorker in its most recent May issue detailing the heightened controversy link below https www newyorker com magazine 2021 05 10 how the pentagon started taking ufos seriously https www newyorker com magazine 2021 05 10 how the pentagon started taking ufos seriously Invest in otherworldly opportunities Procure Space ETF UFO UFO has captured the minds of space themed investing since its inception date April 10 2019 It has performed remarkably in line with peers when benchmarked against the S amp P 1500 Industrials Index as of May 12 2021 As with many funds of its vintage the crash of March 20 effectively served as a stress test to the financial health of its component companies which it passed with flying colours achieving almost a full retracement the fund only recorded a loss in value of 3 64 from 26 37 to 25 41 which was improved by a further 1 from dividends earned during the period Post 2020 similar space ETFs have launched in 2021 in advance of an anticipated flood of investor funds into this emerging sector as Morgan Stanley estimates the global space industry could generate revenue of more than 1 trillion of more in 2040 up from 350 billion currently With roughly half of that increase expected to come from satellite broadband UFO is well positioned to benefit from this influx of capital with 40 71 of fund allocation comprised of a mix of both orbital and surface communication companies Why UFO What s the play here Former Democratic Majority Leader and Nevada Senator Harry Reid as well as other notable ufologists have long claimed that defence contractor Lockheed Martin may have had fragments of a crashed UFO in its possession Many claim that possession of the UFO material is what not only inspired the shapes of many skunkworks aircraft but led to multiple breakthroughs in materials research and stealth technology Employees at Lockheed have gone so far as to make eyewitness reports of alien sightings and direct interactions More broadly speaking any admission by the government of extra terrestrials will naturally be met with fear and the simple play here is to place a long trade on defense and aerospace of which UFO has a significant composition with an allocation of 27 19 including major Pentagon contractors Raytheon Northrop and Boeing Should the evidence provided be less than conclusive interest in UFO the ETF is expected to increase at the bare minimum both from direct key term searches literally the letters UFO searches by retail investors surrounding related investment opportunities and even more generally through social media sentiment The uptick in interest should naturally lead to an increase in volume traded in popular aerospace and defense stocks most of which are held by the fund Defense stocks are a popular benefactor in times of global uncertainty and the sudden interest back to space is likely to exacerbate existing trends toward the militarization of space and a resurgence of Cold War between leading world powers notably between the US China and Russia see this article in Politico below Increased investment into satellite communications is also an expected knock on effect as countries will be focused on boosting their ears and eyes in the skies see below article from C4ISRNET Article links https www politico com story 2019 06 16 war in space trump china 1365842 https www politico com story 2019 06 16 war in space trump china 1365842 https www c4isrnet com battlefield tech space 2021 02 26 report broadens conversation on space militarization and space force satellite defense https www c4isrnet com battlefield tech space 2021 02 26 report broadens conversation on space militarization and space force satellite defense 
25,ncou38,t2_71l0cm9r,1621045430,/r/wallstreetbets/comments/ncou38/dont_worry_guys_ill_save_us/,1,Don t worry guys I ll save us ,
26,ncovtz,t2_2yd4it6h,1621045619,/r/wallstreetbets/comments/ncovtz/did_elon_betray_us/,1,Did Elon betray us ,I feel betrayed
27,ncoxff,t2_nt2mz,1621045796,/r/wallstreetbets/comments/ncoxff/wonderful_loss_porn_watched_a_handful_of_youtube/,1,Wonderful loss porn watched a handful of YouTube vids and lurked around here for weeks before giving options a go Forgot to take my 100 gainz because I was too busy but ended up elevating to become full retard Lotion up and enjoy my bloody red losses ,
28,ncoy61,t2_51df4v6f,1621045871,/r/wallstreetbets/comments/ncoy61/thoughts_on_myov/,1,Thoughts on MYOV , removed 
29,ncozrc,t2_a2vkwoc0,1621046031,/r/wallstreetbets/comments/ncozrc/need_to_bust_a_nut_every_time_you_make_a_move/,1,Need to bust a nut every time you make a move ape Vivelanut, removed 
30,ncp1sy,t2_4zewbtuq,1621046240,/r/wallstreetbets/comments/ncp1sy/meme_stonk_bagholders_until/,1,Meme Stonk Bagholders Until ,
31,ncp2u8,t2_12mhxa,1621046349,/r/wallstreetbets/comments/ncp2u8/me_trying_to_explain_stocks_to_my_coworkers/,1,Me trying to explain stocks to my coworkers,
32,ncp2w5,t2_fi1np,1621046356,/r/wallstreetbets/comments/ncp2w5/getting_back_to_wsbs_roots/,1,Getting back to WSB s roots ,
33,ncp4pz,t2_9nipc2hs,1621046537,/r/wallstreetbets/comments/ncp4pz/how_did_yall_end_this_week_finally_struck_gold/,1,How Did Y all End This Week Finally struck gold after months of red Not much but good enough for me made back my initial investments and excited for next week GainzPorn ,
34,ncp67q,t2_9bh9lyue,1621046695,/r/wallstreetbets/comments/ncp67q/to_the_moon_my_fellow_future_millionaire_retarded/,1,To the moon my fellow future millionaire retarded apes ,
35,ncp75m,t2_fi1np,1621046801,/r/wallstreetbets/comments/ncp75m/getting_back_to_wsbs_roots_no_ragrets/,1,Getting back to WSB s roots NO RAGRETS ,
36,ncp792,t2_6davh50b,1621046810,/r/wallstreetbets/comments/ncp792/polygon_ankr_going_uppppppppp_crpt0/,1,POLYGON ANKR going UPpppppppp CR PT0,
37,ncp7dm,t2_9nipc2hs,1621046822,/r/wallstreetbets/comments/ncp7dm/how_was_yalls_week_i_finally_hit_after_months_of/,1,How Was Y all s Week I finally hit after months of red and made back my initial investments I lost since March Excited to see what next week offers ,
38,ncp8dm,t2_7p1m6kmm,1621046926,/r/wallstreetbets/comments/ncp8dm/apparently_were_all_racist_ridiculous_reaching/,1,Apparently we re all racist ridiculous reaching,
39,ncp9pu,t2_aaqzmmmv,1621047071,/r/wallstreetbets/comments/ncp9pu/to_the_moon/,1,To the moon ,
40,ncpa1b,t2_a0rfriw1,1621047110,/r/wallstreetbets/comments/ncpa1b/moving_to_tiny_town/,1,Moving to tiny town , removed 
41,ncpaym,t2_3tg7z33t,1621047209,/r/wallstreetbets/comments/ncpaym/this_sub_is_sht_now/,1,This sub is sh t now ,This sub made me a lot of money But it sucks ass now Newfags shitting up the board bitching about cramer and hedgefunds instead of doing literally any productive DD that isn t absolute wishful thinking head up your ass ignorant about how the market works TRASH This place used to be great and then GME happened and now its just a place where people lose money on shit stocks and don t learn anything I would rather listen to mad money than browse this board I checked back today to see if the normies had cleared out but you haven t you stuck around and ruined this place Try and actually LEARN please Listen to Cramer He knows more than you Read about how interest rates work how stocks are traditionally valued just spend some time actually reading about finance and markets and understanding how money moves through the financial system economy Learn about game theory and incentives Hit up investopedia and a few intro economics textbooks spend some time thinking deeply about what money is and how it works Just please stop posting shit memes and cringe posts about cramer and short squeezes You are all bagholders If you spend time reading instead you will make money 
42,ncpb1q,t2_1sx67gdp,1621047220,/r/wallstreetbets/comments/ncpb1q/broke_8000_after_putting_5800_in_etfs_and_tsla/,1,Broke 8000 After putting 5800 in ETFs and TSLA back in March last year Not the typical WSB stuff but this sub inspired me to give stocks a shot ,
43,ncpdoo,t2_bq8vlhb4,1621047510,/r/wallstreetbets/comments/ncpdoo/finally_got_my_retard_certificate_in_the_mail/,1,FiNaLlY gOt My ReTaRd CeRtIfIcAtE iN tHe MaIL T0DaY,
44,ncpe3j,t2_a2umiqdn,1621047558,/r/wallstreetbets/comments/ncpe3j/inspiration_for_all/,1,Inspiration for all ,
45,ncpe8t,t2_cwj1k,1621047574,/r/wallstreetbets/comments/ncpe8t/can_you_guys_tell_when_i_discovered_meme_stocks/,1,Can you guys tell when I discovered meme stocks ,
46,ncpfto,t2_6fgcutke,1621047735,/r/wallstreetbets/comments/ncpfto/rich_greenfield_interview_tomorrow_514/,1,Rich Greenfield Interview Tomorrow 5 14,Thru one of my connections I was able to speak to Rich Greenfield today He agreed to do an interview with me either over the phone or thru questions emailed Anything you d like me to ask him I m doing this is a professional manner so nothing pointless attacking too rude or silly please 
47,ncph4a,t2_bz44m4be,1621047881,/r/wallstreetbets/comments/ncph4a/what_to_expect_from_prpo_05202021/,1,What to expect from PRPO 05 20 2021 ,PRPO s Conference Call to be held on Thursday May 20th 2021 at 5 00 PM EST Two huge announcements occurred in the last few weeks that have caused the price of PRPO to spike and then fall back 1 Precipio PRPO Launches its Rapid COVID 19 Antibody test on Amazon Platform May 3 2021 2 Precipio Launches New HemeScreen Panel for AML with an unparalleled 4 hour turnaround time May 14 2021 In this discussion I want to focus only on the first announcement the one in regards to to the COVID 19 antibody test If you visit Precipio s online store https www precipiodx com shop you will notice that the COVID 19 test is the only product not carrying the Precipio Logo The reason for that is that this product is only distributed by Precipio and in fact it is actually a product of a private company called Nirmidas Biotech Inc https www nirmidas com Nirimidas actually received the FDA EUA approval in January 05 2021 and if you check their crapy website https www nirmidas com you will actually see that they list the partnership with Precipio on January 28 2021 https finance yahoo com news precipio launches covid 19 antibody 143000524 html So from all of this we can deduct that the spike on May 3 2021 was only from the Amazon deal My fellow apes let me begin with the fact that I believe in both products and I own a bag of 1000 shares at an average of 4 45 per share I am attracted to the fact Nirimidas is a small private company that has raised so far only 7 000 000 https www crunchbase com organization nirmidas biotech and that PRPO has a current market cap of less than 100 million and still trading on Nasdaq So here is the thing Since the Amazon deal allows only Physicians and other medical facilities to purchase I hope that the following is simply a misunderstanding of how the system works I have tracked the product on Amazon and here it is https www amazon com COVID 19 Antibody Combo Detection Kit dp B08XG2XVSF ref cm cr arp d pl foot top ie UTF8 https www amazon com COVID 19 Antibody Combo Detection Kit dp B08XG2XVSF ref cm cr arp d pl foot top ie UTF8 Can that be all Only 3 reviews How do you thing it will reflect on sales in general 
48,ncphwq,t2_bq8vlhb4,1621047970,/r/wallstreetbets/comments/ncphwq/finally_got_my_retard_certificate_in_the_mail/,1,FiNaLlY gOt My ReTaRd CeRtIfIcAtE iN tHe MaIL T0DaY loss porn ,
49,ncpik6,t2_73jho,1621048047,/r/wallstreetbets/comments/ncpik6/the_stonkmans_tale_original_gme_song/,1,The Stonkman s Tale Original GME Song,
50,ncpkxf,t2_2uyst6ww,1621048293,/r/wallstreetbets/comments/ncpkxf/all_in_on_matic/,1,All in on MATIC,
51,ncpm5s,t2_qhbbs,1621048424,/r/wallstreetbets/comments/ncpm5s/can_we_pour_one_out_for_the_hedgies_plby/,1,Can we pour one out for the hedgies PLBY,
52,ncpm78,t2_a11f22bt,1621048428,/r/wallstreetbets/comments/ncpm78/feg/,1,FEG,Has anyone seen this Ape money
53,ncpp7z,t2_a27045br,1621048745,/r/wallstreetbets/comments/ncpp7z/clov_this_monday_is_earning_report/,1,CLOV this Monday is earning report ,
54,ncpr1z,t2_32wi5y,1621048933,/r/wallstreetbets/comments/ncpr1z/the_stonkmans_tale_original_gme_song/,1,The Stonkman s Tale Original GME Song,
55,ncpsez,t2_8itl7l0o,1621049084,/r/wallstreetbets/comments/ncpsez/alert_insider_buys_600000_shares/,1,Alert Insider buys 600000 shares ,A company director just bought over 3 million in AIV When insiders buy its a big signal 
56,ncpsrr,t2_a4sex7ek,1621049122,/r/wallstreetbets/comments/ncpsrr/heavily_shorted_amyris_cannabinoid_dd/,1,Heavily shorted Amyris cannabinoid DD ,
57,ncptsb,t2_klpg9i6,1621049235,/r/wallstreetbets/comments/ncptsb/anyone_down_to_blow_up_zom_a_little_bit_again_its/,1,Anyone down to blow up Zom a little bit again It s prob at least gonna hit a dollar sometime soon anyway right ,
58,ncpuex,t2_acdeh18z,1621049305,/r/wallstreetbets/comments/ncpuex/hey_do_you_guys_created_a_coin_or_is_just_fake/,1,Hey do you guys created a coin Or is just fake news ,
59,ncpwxv,t2_bipcqznf,1621049591,/r/wallstreetbets/comments/ncpwxv/newinu/,1,newinu,
60,ncq0fu,t2_8s6gxevy,1621049996,/r/wallstreetbets/comments/ncq0fu/amc_monday_we_charge/,1, AMC Monday we charge ,
61,ncq0sy,t2_a5gu6ev4,1621050034,/r/wallstreetbets/comments/ncq0sy/social_network/,1,social network, removed 
62,ncq18r,t2_8gxq0fv7,1621050078,/r/wallstreetbets/comments/ncq18r/low_float_stock_with_good_backround_do_your_dd/,1,LOW FLOAT STOCK WITH GOOD BACKROUND DO YOUR DD BCTX,
63,ncq1mj,t2_5ogyldmf,1621050120,/r/wallstreetbets/comments/ncq1mj/apollo_moon/,1,APOLLO MOON, Launched today buy on Pancakeswap APOLLO MOON APOLLO MOON The next token to the moon LIVE TODAY Already 1 361 holders 1000X Available on Pancakeswap 0x2d80c6411b7af70e8716a62a4060fe81c71c397c
