,postid,author,created_utc,permalink,score,title,selftext
0,nacir3,t2_9agwx58l,1620780881,/r/wallstreetbets/comments/nacir3/yolo_on_nnox_lets_go/,1,YOLO on NNOX Let s go,
1,nacj48,t2_z42nak1,1620780915,/r/wallstreetbets/comments/nacj48/planning_on_investing_in_the_stock_market_for_the/,1,Planning on investing in the Stock Market for the 1st time Anything I should know , removed 
2,nacjh2,t2_7ochn3jl,1620780943,/r/wallstreetbets/comments/nacjh2/this_is_the_way/,1,This is the way,
3,nacjlf,t2_a22mukg0,1620780954,/r/wallstreetbets/comments/nacjlf/too_the/,1,Too the ,
4,nacjqb,t2_b44cijtx,1620780968,/r/wallstreetbets/comments/nacjqb/hold_my_beer/,1,Hold my beer ,
5,nack5v,t2_a184iu6k,1620781006,/r/wallstreetbets/comments/nack5v/am_i_doing_it_right/,1,Am I doing it right ,
6,nackq5,t2_68a6ngqo,1620781058,/r/wallstreetbets/comments/nackq5/yolo_on_shib/,1,YOLO on SHIB, removed 
7,nackum,t2_erp6w,1620781070,/r/wallstreetbets/comments/nackum/i_know_some_apes_need_to_visualize_our_solar/,1,I know some apes need to visualize our solar system You dont see AMC part of it because we are leaving this planetary system Diamond hands ,
8,naclj7,t2_s6isn,1620781131,/r/wallstreetbets/comments/naclj7/my_portfolio_this_week/,1,My portfolio this week ,
9,nacloh,t2_9agwx58l,1620781145,/r/wallstreetbets/comments/nacloh/nnox_yolo/,1,NNOX YOLO ,
10,naclr9,t2_68a6ngqo,1620781151,/r/wallstreetbets/comments/naclr9/shiba_inu_coin_to_the_moon/,1,Shiba Inu coin to the moon ,I just bought 2M shiba Inu coin How do y all think we can get it to 1 
11,naclwm,t2_aqmr7iyb,1620781163,/r/wallstreetbets/comments/naclwm/there_was_a_time_not_too_long_ago_that_i_thought/,1,There was a time not too long ago that I thought dropping 50k on PLTR 65c 8 20 was a good idea ,I must say that I am financially ruined and demoralized Today I saw a 500 return but I m still at 97 32 so On top of this most of my other investments collapsed so I m down from about 250k to about 30k since January I fell for the PLRT to 100 EOM posts I feel for Cathie Woods ape ark flood sanctuary Thought by this time I would be partying with Karp in his tree house There was a time when the YOLO s were so easy so fun I was brave bold and retarded but now all I see is eteneral darkness sigh anways PLTR 65 8 20 THE FIRE RISES 
12,naclxl,t2_a2n9pdge,1620781166,/r/wallstreetbets/comments/naclxl/is_there_something_about_these_figures_im_missing/,1,Is there something about these figures I m missing ,
13,nacmbv,t2_6jm9c53p,1620781198,/r/wallstreetbets/comments/nacmbv/ceo_secrets_master_every_aspect_of_your_business/,1,CEO Secrets Master every aspect of your business ,
14,nacmpe,t2_erp6w,1620781219,/r/wallstreetbets/comments/nacmpe/i_know_some_of_my_apes_need_to_visualize_where/,1,I know some of my apes need to visualize where AMC will be This is our solar system see AMC isnt on it We are headed to the pillars of creation ,
15,naco53,t2_a12174mw,1620781336,/r/wallstreetbets/comments/naco53/biostocks/,1,Biostocks,Whats anyone take on VTGN 
16,naco9v,t2_a0u2iu6j,1620781348,/r/wallstreetbets/comments/naco9v/aht_512_ashford_hospitality_trust_buy_orders/,1, AHT 5 12 Ashford Hospitality Trust Buy Orders Pre Market,Ashford Hospitality Trust is a hotel lodging REIT with a current upscale Luxury portfolio of over 22 500 Hotel rooms under the Hilton and Marriott chain of Brands Ashford has been a heavily shorted name due do its leveraged balance sheet Currently trading at 2 72 per share the portfolio itself has a a value of over 6 5 Billion with only 3 9mm in Debt On a fully diluted Basis todays equity value is 7 8 Per share yet short selling continues to drive this Price to benefit Put Option Buyers and short seller On 5 12 the members of this Forum shall rally together to issue Block orders Pre Market to apply pressure on short positions and wash out the playing field 
17,nacp1e,t2_1344rm,1620781408,/r/wallstreetbets/comments/nacp1e/shiba_inus_are_best_dog/,1,Shiba Inus are best dog,They are very smart and playful Make great investments Borkbork haha amp x200B EM
18,nacrx6,t2_myls4,1620781665,/r/wallstreetbets/comments/nacrx6/gme_dfv_math_hard/,1,GME DFV math hard,
19,nacsa2,t2_anmfeixi,1620781697,/r/wallstreetbets/comments/nacsa2/does_nak_have_a_future_i_think_chances_are_good/,1,Does NAK have a future I think chances are good ,So they have the largest proved gold reserves in the world and are being held up by a clean water permit that s worried the mine will contaminate salmon waters by the Army Corps of Engineers The text of the permitting is super vague and clearly it is at the discretion of whoever is holding the pen and the appeal looks promising Everyone in Alaska is trying to move it forward Biden has stated that he is not opposed to new mining projects in the USA and I wonder if he was talking about these guys I mean if you wanted to make a leveraged play on gold silver copper right now NAK might be the best option out there if this approval goes through they ll blow past a dollar overnight so the real question is do you trust corrupt govt officials to be open to convincing to redefine what they call a preponderance Personally I think corruption is the only thing worth trusting in this nation which makes NAK a solid buy if you think metals are set for another bull run when things re open and the jobs bill hits Brain too smooth to look at fundamentals I do economics not voodoo 
20,nacso7,t2_a1qmpxc8,1620781732,/r/wallstreetbets/comments/nacso7/forth_be_with_you/,1,Forth be with you , removed 
21,nacu2g,t2_myls4,1620781847,/r/wallstreetbets/comments/nacu2g/guess_whos_been_away_for_a_while/,1,guess who s been away for a while ,
22,nacuei,t2_91ewcvzt,1620781879,/r/wallstreetbets/comments/nacuei/market_crash/,1,Market crash, removed 
23,nacvec,t2_c2424mdp,1620781963,/r/wallstreetbets/comments/nacvec/sdc_dd/,1,SDC DD,For you my man u truth2252 I m actually kicking myself slightly SDC popped up on my radar a few weeks ago but I was too lazy to follow up SDC experienced quite a price drop probably mitigated by two main forces that are seen quite often a seemingly strategic interplay between short coverings and option hedging Let s take a look at the past to see the future https preview redd it qc9b2o139ly61 jpg width 1110 amp format pjpg amp auto webp amp s a701def051c9dfd922571a8010df1b5e777fbf9b https preview redd it lrm5w4j79ly61 jpg width 1118 amp format pjpg amp auto webp amp s e265cd292a0f24f7f687f770b234cd2867ffec0a Notice anything The price was steadily dropping since mid January during which time a short squeeze was produced The price drop was also good for covering the shorts that were produced then https preview redd it v0d0yh3l9ly61 jpg width 1115 amp format pjpg amp auto webp amp s be525cbbba60d90014afaa7ef1c4180db4bc5060 This was a stable decline it seems as volatility was decreasing as well with a peaceful glide down Until April when volatility started to rise Did the shorts become difficult to cover due to stalling in price action Did the increase in shorting cause volatility to rise Did someone ask to speak to the manager Who knows A clue is the large chunk of options that are placed at 10 Typically a stock that is shorted with relatively decent amounts and has a large chunk of options at a particular strike further down the slide will glide towards that price point In this case 10 Having over shorted and ITM long calls is a dangerous combo but if the stock can glide down past 10 while keeping volatility low the hedges get covered and the ITM calls become OTM All s well in the option s universe This was disrupted it seems sometime mid april when volatility started to rise causing those ITM calls to have to be hedged via purchasing Not ideal In any case moves were moved decisions made deals with the devil made and the price snapped back below 10 opportunistic hedging lumped into one mass play Who knows I m not fucking nostradomus May the 4th be with you saw a huge price drop 20 and almost complete resolution of liquidity issues IV plummeted Now volatility is nice and minimal option placements indicate healthy environment So I would expect a steady increase back up to at least 10 But that 10 wall 200 000 calls may keep things mellow for the the being TL DR 20210521C8
24,nacw9n,t2_a13u38hc,1620782037,/r/wallstreetbets/comments/nacw9n/tv_program_fbi_on_cbsanyone_watching/,1,TV program FBI on CBS anyone watching ,OMG They literally have a story about an online group of retail investors that are taking on Wall Street The owner of a trading app shuts down trading as a stock tanks 75 At a protest he is shot and killed The FBI investigates They mention GME and other stocks as the catalyst of this movement and they mention other trading platforms like RH Does anyone else feel like they are in a simulation 
25,nacwat,t2_a1qmpxc8,1620782041,/r/wallstreetbets/comments/nacwat/forth_be_with_you_this_is_the_way/,1,Forth be with you This is the way ,
26,nacwcd,t2_a19cgpom,1620782044,/r/wallstreetbets/comments/nacwcd/_/,1, ,
27,nacxs4,t2_3e2h1tly,1620782169,/r/wallstreetbets/comments/nacxs4/xom_unusual_options_activity/,1, XOM unusual options activity, XOM 40c and 45c for 1 21 22 have a combined volume of 205 000 This correlates to about 700 million These are just two strike prices along the entire option chain there is at least 1 2 billion in call options bought Today alone I suspect that the rising tensions in the middle east can fuel gas joke sorry bad relationships and cutoff ties with the United States By doing so we will become increasingly reliant on Exxon Mobil Not sure how high this can push the stock price but it is for sure a catalyst In my opinion this has to be big money hedgefunds that are buying in Tldr big money buy big money sometimes smart we buy 
28,nacy7h,t2_7zzxk7cz,1620782207,/r/wallstreetbets/comments/nacy7h/sold_puts_this_morning_and_bought_calls/,1,Sold puts this morning and bought calls ,
29,nacz2k,t2_7tvnk4vw,1620782283,/r/wallstreetbets/comments/nacz2k/help_new_and_poor/,1,Help New and poor,So I ve been making a living 2000 5000 a month off profits but can t get out of the drain I started with 100 so I don t feel I m doing bad but im running out of cash and flow What kind of investments can I make to move from weekly trader purely providing to something long term I just pulled to pay bills and have 1000 left in the market This has worked for 18 months but now I m stumped i keep missing huge payoffs due to limited funds and inability to risk Whats next How do I get over the hump 
30,naczd6,t2_bsubs994,1620782306,/r/wallstreetbets/comments/naczd6/real_rape_culture_i_got_diamond_hands_and_a_loose/,1,Real Rape Culture I got diamond hands and a loose rectum rip guh,
31,nad04y,t2_1ttn3dli,1620782375,/r/wallstreetbets/comments/nad04y/clov_gamma_squeeze_dd/,1, CLOV Gamma Squeeze DD, removed 
32,nad0og,t2_59t6kkha,1620782417,/r/wallstreetbets/comments/nad0og/buy/,1,Buy , removed 
33,nad1xx,t2_7gyr2atx,1620782521,/r/wallstreetbets/comments/nad1xx/i_didnt_hear_no_bell_added_25_more_shares_since/,1,I Didnt hear no bell added 25 more shares since last post about fisker ,
34,nad21z,t2_a3dfwtgi,1620782529,/r/wallstreetbets/comments/nad21z/cardano_is_killing_it_keep_it_going/,1,Cardano is killing it Keep it going ,
35,nad2ci,t2_a0u2iu6j,1620782551,/r/wallstreetbets/comments/nad2ci/aht_512_ashford_hospitality_trust_block_buy/,1,AHT 5 12 Ashford Hospitality Trust Block Buy Orders Pre Market,Ashford Hospitality Trust is a hotel lodging REIT which owns and operates a portfolio of 22 500 upscale luxury Hotel Keys under the Marriott amp Hilton chain of brands Ashford has been a heavily shorted name by institutions which has driven the price down time and time again Currently trading at 2 72 a share the Portfolio itself has a value in excess of 6 Billion with 3 7 Billion in Debt On a fully diluted basis Ashford is valued between 6 5 8 while short interest drives this price down to benefit Put option holders and strain management On 5 12 I call all members to initiate Pre Market Block orders in an attempt to financially strain short interest and level the playing field for retail investors 
36,nad2l7,t2_1ttn3dli,1620782573,/r/wallstreetbets/comments/nad2l7/clover_health_clov_dd_why_a_gamma_squeeze_is/,1,Clover Health CLOV DD why a Gamma Squeeze is possible, removed 
37,nad2p5,t2_c2wb8lea,1620782584,/r/wallstreetbets/comments/nad2p5/tiddies_just_launched_under_5_hours_1000_holders/,1, TIDDIES JUST LAUNCHED UNDER 5 HOURS 1000 HOLDERS PRIMED FOR MOON, removed 
38,nad2uy,t2_a1qmpxc8,1620782596,/r/wallstreetbets/comments/nad2uy/may_the_forth_be_with_you_all/,1,May the forth be with you all , removed 
39,nad2z9,t2_4fhdk4hz,1620782608,/r/wallstreetbets/comments/nad2z9/robinhood/,1,Robinhood,
40,nad4hz,t2_7nfxu9mb,1620782739,/r/wallstreetbets/comments/nad4hz/cash_app_trouble/,1,Cash app trouble, removed 
41,nad4w3,t2_9v2gh7xx,1620782772,/r/wallstreetbets/comments/nad4w3/blackberry_ai_security_5_years_ahead_of/,1,Blackberry ai security 5 years ahead of , removed 
42,nad58o,t2_a5qpu9x5,1620782802,/r/wallstreetbets/comments/nad58o/educating_myself/,1,Educating myself,Hey everyone Can you recommend any resources websites books or other for me to get a really good understanding of reading the graphs and understanding the different functions e g RSI MAC etc 
43,nad5hi,t2_11by59,1620782824,/r/wallstreetbets/comments/nad5hi/wddd_is_bottoming_lets_buy_in/,1, WDDD is bottoming Let s buy in,Thoughts 
44,nad6y7,t2_83vvsjy6,1620782960,/r/wallstreetbets/comments/nad6y7/httpswwwredditcomrsuckelonscock/,1,https www reddit com r SuckElonsCock ,
45,nad710,t2_a1qmpxc8,1620782967,/r/wallstreetbets/comments/nad710/all_we_need_is_volume_on_forth_lets_get_this/,1,All we need is volume on Forth let s get this thing going it s the most undervalued on coinbase ,
46,nad7nh,t2_dp7t7,1620783016,/r/wallstreetbets/comments/nad7nh/what_building_is_in_the_background_of_the_subs/,1,What building is in the background of the sub s banner , removed 
47,nad8nm,t2_7l4s1905,1620783099,/r/wallstreetbets/comments/nad8nm/hey_im_new_have_0_stocks_and_need_advice/,1,Hey I m new have 0 Stocks and need advice , Where is it best to buy stocks outside of the US Europe but not EU Where should I invest What s the next big thing Next big meme that will take off in your opinion And what are the reasons Thanks 
48,nad93e,t2_2mldhe8j,1620783138,/r/wallstreetbets/comments/nad93e/uhhhh_why_is_the_banner_now_a_picture_of_a/,1,Uhhhh why is the banner now a picture of a citadel Did citadel take over wsb ,
49,nad9b0,t2_bhonb8kv,1620783153,/r/wallstreetbets/comments/nad9b0/not_a_shilli_am_a_former_crayon_eater_turned/,1,Not a shill I am a former crayon eater turned silver back looking at the fundamentals can no longer be trusted information about the stock market is being lied about the hole economy economy,
50,nad9k4,t2_7wviccvy,1620783178,/r/wallstreetbets/comments/nad9k4/nok/,1,NOK,should i buy a lot of NOK calls for jan 2022 
51,nad9rx,t2_9lte13xd,1620783197,/r/wallstreetbets/comments/nad9rx/voted/,1,Voted ,
52,nadc4q,t2_a1qmpxc8,1620783405,/r/wallstreetbets/comments/nadc4q/forth_how_u_guys_are_doing_well/,1,Forth How u guys are doing well, removed 
53,nadcnk,t2_acmew9gs,1620783447,/r/wallstreetbets/comments/nadcnk/ark_casually_buys_another_28m_pltr_shares_today/,1,Ark casually buys another 2 8M PLTR shares today after adding 1 4M yesterday and y all paper selling at 16 ,
54,nadcy9,t2_a10ztfqw,1620783476,/r/wallstreetbets/comments/nadcy9/have_you_been_following_nikolas_updates_lately/,1,Have you been following Nikola s updates lately IMHO I think Nikola deserves a second chance,
55,nadcyx,t2_a1qmpxc8,1620783478,/r/wallstreetbets/comments/nadcyx/may_the_forth_be_with_you_guys_it_could_go_30x/,1,May the forth be with you guys It could go 30x this year,
56,naddff,t2_66lis0b2,1620783518,/r/wallstreetbets/comments/naddff/apes_on_tv/,1,APES on tv ,Though loosely based on recent events you apes made tonight s episode of FBI 
57,naddze,t2_4tewjl9l,1620783566,/r/wallstreetbets/comments/naddze/real_estate_tax_question/,1,Real estate tax question ,I bought home last month after selling our primary home which we lived for 14 years so no taxes there I owned a rental home nearby I listed it for sale after seeing the crazy market i m expecting rental home to sell fast I don t think I cant write a 1031 exchange as i have purchased my primary last month How can I avoid the taxes on the profit of my rental home sale any ideas 
58,nadfdb,t2_7r3pftke,1620783685,/r/wallstreetbets/comments/nadfdb/who_is_still_holding_gme_and_when_will_we_go_to/,1,Who is still holding GME and when will we go to the moon ,
59,nadfoz,t2_124dz1,1620783717,/r/wallstreetbets/comments/nadfoz/tits_too_jacked_to_comprehend/,1,TITS TOO JACKED TO COMPREHEND ,
60,nadfrq,t2_9qfnc50m,1620783725,/r/wallstreetbets/comments/nadfrq/thoughts/,1,thoughts, removed 
61,nadfvd,t2_8ngxd7z3,1620783734,/r/wallstreetbets/comments/nadfvd/calling_upon_fellow_degenrates/,1,Calling upon fellow degenrates,I recently got liquidated on my final short posistion I am 19 and have yoloed basically all my money away Just wondering how other fellow degen fucks have explained to their parents why their savings is at 35 Thanks
62,nadfzf,t2_6jm9c53p,1620783744,/r/wallstreetbets/comments/nadfzf/iron_ore_prices_go_ballistic_as_metals_boom/,1,Iron ore prices go ballistic as metals boom,
63,nadge9,t2_a14ogk68,1620783785,/r/wallstreetbets/comments/nadge9/ccxi_stock_dropped_42_on_friday_stock_was_up/,1,Ccxi Stock dropped 42 on Friday stock was up above 50 now it is at 10 Potential gains are crazy,Bought 1 223 shares holding until July
64,nadgvs,t2_acmew9gs,1620783829,/r/wallstreetbets/comments/nadgvs/ark_casually_buys_another_28m_pltr_shares_today/,1,Ark casually buys another 2 8M PLTR shares today after adding 1 4M yesterday Why do y all hate money ,
65,nadh2u,t2_afwk0,1620783848,/r/wallstreetbets/comments/nadh2u/me_circa_2005_i_want_jessica_alba_to_fuck_me_me/,1,Me circa 2005 I want Jessica Alba to fuck me Me today No not like that ,
66,nadhg4,t2_4rtg6gja,1620783879,/r/wallstreetbets/comments/nadhg4/i_finally_left_robinhood/,1,I finally left Robinhood ,The site crashed during SNL and I couldn t sell my things imaginary money The site never seems to be as functional as it seems it should be and I can t help but think the times it does glitch they re dumping their crap or buying things while they slow me down I do not trust that company and sold all my stocks and put options today I just couldn t take it any more I m not waiting for stocks to transfer or any BS or waiting for options to expire Sold everything before shit hit the fan and I regretted it I have Webull and Etrade I think they both stink too Is TDAmeritrade as good as they say 
67,nadhnn,t2_a3i5lqi4,1620783897,/r/wallstreetbets/comments/nadhnn/decisions_decisions/,1,DECISIONS DECISIONS,
68,nadic4,t2_a1ehuyni,1620783953,/r/wallstreetbets/comments/nadic4/is_may_19th_still_in_play_for_amc/,1,Is May 19th still in play for AMC , removed 
69,nadipl,t2_c05etg1g,1620783986,/r/wallstreetbets/comments/nadipl/qe_and_combat/,1,QE and COMBAT ,QE reduction amp x200B Dallas Federal Reserve Bank Chairman Kaplan believes that it should be sooner rather than later amp x200B San Francisco Fed Chairman Daley said that it is not a discussion yet amp x200B What is this Is the Fed fighting again amp x200B Focused on a series of Chinese economic and the economic sentiment index of the Eurozone amp x200B OPEC will publish a monthly crude oil market report amp x200B EIA will also publish a monthly short term energy outlook report https preview redd it orbsxzu0hly61 png width 977 amp format png amp auto webp amp s 7e8f44cbb7d0b690d55c462570ad080541f01157
70,nadjcb,t2_aqgheuru,1620784044,/r/wallstreetbets/comments/nadjcb/just_trying_to_make_a_little_money/,0,Just trying to make a little money,I lost my ass on dodge coin because I sold I need some heads up for tomorrow any suggestions I got about 5000 to work with
71,nadkod,t2_46zfzofq,1620784162,/r/wallstreetbets/comments/nadkod/im_seein_red/,1,I m seein red,
72,nadla2,t2_a0sw8wfp,1620784217,/r/wallstreetbets/comments/nadla2/tlry_this_week/,1,Tlry this week , removed 
73,nadlc3,t2_a10ztfqw,1620784221,/r/wallstreetbets/comments/nadlc3/palantir_new_headquarter/,1,Palantir new headquarter,
74,nadlsl,t2_9zp3z1ba,1620784259,/r/wallstreetbets/comments/nadlsl/uwmc_is_the_only_stock_i_like_so_i_just_keep/,1,UWMC is the only stock I like so I just keep buying more 9 average and I m completely fine with it ,
75,nadn2a,t2_ab0us7oa,1620784375,/r/wallstreetbets/comments/nadn2a/pltr_hegefunde_trying_to_short_pltr_today_the/,1,PlTR Hegefunde trying to short pltr today the short more than 41000000 M in one day the are secry Let take pltr to the moon Good earnings good company Future I don t understand why trying to kill every stock ,
76,nadn48,t2_ak6ksicb,1620784378,/r/wallstreetbets/comments/nadn48/great_read_on_how_the_government_manipulates_the/,1,Great read on how the Government manipulates the inflation numbers ,
77,nado0y,t2_u6gpn,1620784464,/r/wallstreetbets/comments/nado0y/what_the_hell_has_happened_across_reddit/,1,What the hell has happened across Reddit regarding investing Has it always been this way Was this all spawned from the recent WSB explosion ,I ve been an active investor for a while I benefitted greatly off GME buying the bulk of my shares around October of last year I ve also done quite well off Dogecoinz buying earlier this year and profiting off the recent Elon drama I ve tripled off Ethereumz and I ve also made good money on AMC and BB One thing I ve never really done is read any of the subreddits dedicated to an individual stock or cryptoz Recently curiosity got the best of me and I skimmed through the GME DOGEz AMC cryptoz and ETHz subreddits and I found something really peculiar The communities on these subreddits while being overly fervent about their particular investment seem to hate the other communities as if they re rivals I find this really odd and wonder how this cult like following happened behind each of these different entities Are people really falling into an us vs them mentality based on a single investment What s the end goal Do they think discouraging an unrelated stock cryptoz further justifies their individual investment I find the whole thing super bizarre and honestly think it could be the focus of some type of investment psychology study I suppose I don t have any real points just found this super interesting and odd 
78,nadphv,t2_9cw0dyqs,1620784601,/r/wallstreetbets/comments/nadphv/an_interesting_title_clov_to_the_mooon_gamma/,1,An Interesting title CLOV TO the MOOON Gamma squeeze let s go ,
79,nadqwg,t2_bz44m4be,1620784732,/r/wallstreetbets/comments/nadqwg/clov_will_hindenburg_hedge_fund_win_on_05172021/,1,CLOV Will Hindenburg hedge fund win on 05 17 2021 ,Following WSB for the last 2 months I have noticed many stonks mentioned Among the top 5 is CLOV andHere is the thing about CLOV Clover Health NASDAQ CLOV started trading on the Nasdaq Exchange back in January after completing its merger with special purpose acquisition company SPAC Social Capital Hedosophia Holdings NYSE IPOC Hindenburg Hedge fund had taken a large position against spacs in general Google Hindenburg vs spacs https www google com search q hindenburg hedge fund vs spacs amp bih 698 amp biw 1280 amp hl en amp ei xi2bYJL5MdfY gSE86a4Cw amp oq hindenburg hedge fund vs spacs amp gs lcp Cgdnd3Mtd2l6EAM6BQghEKABOggIIRCgARCLAzoICCEQqwIQiwM6BQghEKsCOggIIRAWEB0QHlC3KFjPNWDINmgBcAB4AIABY4gBpQaSAQE5mAEAoAEBqgEHZ3dzLXdpergBAsABAQ amp sclient gws wiz amp ved 0ahUKEwiS9Pu5 cLwAhVXrJ4KHYS5CbcQ4dUDCA4 amp uact 5 and thus CLOV merger with a SPAC had become one of their targets Hindenburg CLOV report https hindenburgresearch com clover Hindenburg has been shorting CLOV since FEBRUARY 4 2021 and then a law suit against CLOV appeared by Robbins LLP lawyers and guess who hired them Hindenburg Hedge Fund Hindenburg Robbins LLP https www google com search q hindenburg robbins LLP amp hl en amp biw 1280 amp bih 698 amp ei bDCbYK36Dt 90PEP5quV8A8 amp oq hindenburg robbins LLP amp gs lcp Cgdnd3Mtd2l6EAM6BwgAEEcQsAM6CggAEJECEEYQ QE6CwguEMcBEK8BEJECOggILhDHARCjAjoCCAA6BAgAEEM6BQgAEJECOgQILhBDOgIILjoGCAAQFhAeOgUIIRCgAToICCEQoAEQiwM6BQghEKsCOgcIIRAKEKABUMZTWLmtAWCvsAFoBHACeACAAZwBiAHPE5IBBDE2LjmYAQCgAQGqAQdnd3Mtd2l6sAEAyAEIuAECwAEB amp sclient gws wiz amp ved 0ahUKEwit4P78 8LwAhXfHjQIHeZVBf4Q4dUDCA4 amp uact 5 Since then they have been bombarding with press releases of CLOV being under investigation misleading title as if the FBI or SEC is investigating If you read about the lawsuit it s all about the SPAC merger because as far as it comes to CLOV there are no problems The fundamentals are strong with CLOV still growing in the hundreds of millions per quarter not 500 000 like MVIS and the technicals show that it can t get any lower Hindenburg taking a large stance against spacs had made them overlook CLOV as an actual success and they are spending a lot of money to try and cover their shorts CLOV is the real deal when in comes to a squeeze because it actually has value If there is no unity behind this it means that the whole movement stopped with GME and AMC and that is all for stonks at least for me I myself am invested with 1200 shares at an average of 9 20 and it is currently at 7 95 so i am feeling the shit but we shall see on this Monday s earning call who actually won 
80,nadqyr,t2_a11usc33,1620784738,/r/wallstreetbets/comments/nadqyr/scrolling_through_patents_for_fun_and_found_this/,1,Scrolling through patents for fun and found this Patent titled Trading anomaly kill switch Looking for thoughts I feel like maybe this was meant to stay buried amongst the other patents ,
