,postid,author,created_utc,permalink,score,title,selftext
1205,naxc5a,t2_a0srr6g0,1620848193,/r/wallstreetbets/comments/naxc5a/shib_to_the_moon_lets_all_get_rich/,1,Shib to the moon Let s all get rich , removed 
1206,naxd07,t2_a0in9m89,1620848255,/r/wallstreetbets/comments/naxd07/im_buying_coinbase_because_im_retarded/,0,I m buying Coinbase because I m retarded,
1207,naxd0e,t2_9zp3z1ba,1620848255,/r/wallstreetbets/comments/naxd0e/only_1000_shares_left_to_short_10_move_today_even/,1,Only 1000 shares left to short 10 move today Even if this doesn t squeeze it s a good buy because the owners shares are all worth 10 each ,
1208,naxdmo,t2_a0ux2fd6,1620848301,/r/wallstreetbets/comments/naxdmo/what_is_going_on_with_workhorse/,1,What is going on with workhorse ,Big loss
1209,naxdpg,t2_64uw4lzu,1620848306,/r/wallstreetbets/comments/naxdpg/feg_token/,1,FEG token,Hi guys any of you guys have info on FEG token I ve been hearing about it and I wondering if you guys had any info on it I bought 1k should I hold dump it
1210,naxdtv,t2_a0xj2q6v,1620848315,/r/wallstreetbets/comments/naxdtv/what_about_tesla_end_of_the_year_1k/,1,what about tesla end of the year 1k,
1211,naxfda,t2_2k2dhvg5,1620848424,/r/wallstreetbets/comments/naxfda/never_give_up_hope_thank_you_uvxy/,1,Never give up hope thank you UVXY,
1212,naxgbg,t2_a8svq8o2,1620848488,/r/wallstreetbets/comments/naxgbg/thought_i_bought_the_dip_now_i_feel_a_raw_ass/,1,Thought I bought the dip now I feel a raw ass fuck incoming,
1213,naxgz9,t2_a2au4wlv,1620848533,/r/wallstreetbets/comments/naxgz9/rkt_number_of_shareholders_in_a_profitable/,1,RKT Number of shareholders in a profitable position,
1214,naxh23,t2_7o2b528k,1620848537,/r/wallstreetbets/comments/naxh23/dam_thats_tuff_positions_were_all_my_money_in/,1,dam thats tuff positions were all my money in elon s favorite coin at 70 cents then sell all at 49 cents a paper handed bitch then loose a couple k on fd s placed monday on QQQ APPL and DIA,
1215,naxhnr,t2_ijhqq,1620848580,/r/wallstreetbets/comments/naxhnr/market_going_to_hell_confirmed/,1,Market going to hell confirmed ,
1216,naxhsp,t2_a8svq8o2,1620848591,/r/wallstreetbets/comments/naxhsp/thought_i_bought_the_dip_raw_ass_fuck_incoming/,1,Thought I bought the dip Raw ass fuck incoming Gambling seems like a wiser choice than options ,
1217,naxijv,t2_8rf7cxz8,1620848643,/r/wallstreetbets/comments/naxijv/shiba/,1,SHIBA,Sooo SHIBA or no SHIBA 
1218,naxiq3,t2_ijhqq,1620848655,/r/wallstreetbets/comments/naxiq3/market_going_to_hell_confirmed/,1,Market going to hell confirmed ,
1219,naxjm5,t2_a34475nn,1620848714,/r/wallstreetbets/comments/naxjm5/buy_sbib/,1,Buy SBIB,
1220,naxjpx,t2_8rf7cxz8,1620848721,/r/wallstreetbets/comments/naxjpx/shiba/,1,SHIBA,Soooo SHIBA or no SHIBA 
1221,naxlbj,t2_4czlem0h,1620848838,/r/wallstreetbets/comments/naxlbj/creeping_short/,1,Creeping Short, removed 
1222,naxlh7,t2_a1d9lija,1620848849,/r/wallstreetbets/comments/naxlh7/we_miss_u_from_france/,1, we miss U from France,
1223,naxlw1,t2_7s9lzv8u,1620848880,/r/wallstreetbets/comments/naxlw1/when_will_gme_fly_again_om_sitting_with_my/,1,When Will gme fly Again om sitting with my lifesavings ,
1224,naxmn4,t2_a1d9lija,1620848938,/r/wallstreetbets/comments/naxmn4/we_miss_u/,1,We miss U ,
1225,naxmnk,t2_9re47fem,1620848939,/r/wallstreetbets/comments/naxmnk/questions/,1,Questions,What do all of you think about the naked clothing brand 
1226,naxmnx,t2_54xuy0l,1620848940,/r/wallstreetbets/comments/naxmnx/300_37000_amd_puts_is_advanced_money_dispenser/,1,300 gt 37 000 AMD puts is Advanced Money Dispenser,
1227,naxmxw,t2_61z72,1620848960,/r/wallstreetbets/comments/naxmxw/from_ashes_to_the_moon_and_then_back_to_ashes_in/,1,From Ashes To The Moon and then back to ashes in all probability UWMC Gamma Squeeze potential,Okay retards here s the deal we all know UWMC stock has been a shitshow for everyone and this week s earnings report was a mixed bag earnings were down due to thinning margins despite larger loan origination and UWMC even projected a worse Q2 this stock has many upsides such as a notable dividend proven track record in challenging times yadayadayda there s loads of really good DD out there for this stock go read it if you want This DD is about a one time event that may occur sometime in the next 9 days Why 9 days Because on the 21st of May the monthly options expire The numbers Source https finance yahoo com quote UWMC key statistics p UWMC There are 83 72m shares in the float That s small In fact something like 94 of the company is owned by the CEO with those 83 72m representing the other 6 Insiders own 12 85 of that float and institutions own 24 50 which together is 37 35 for those of you who never graduated from elementary school that s 31 27m shares which makes the free float 51 45 million shares Of that 11 88m shares are short as of 04 29 which is 23 of the free float That s important but not in and of itself enough to squeeze Options volume for 05 21 is huge between the 7 5 and 15 strikes there are approx 205 500 calls all out of the money Their average delta is about 10 meaning that if they become ITM 18 5m shares will be automatically bought by brokers to cover those calls This is a gamma ramp it will happen linearly if the stock ticks upwards creating a positive feedback loop of rising price until they are entirely hedged At the same time shorts must cover if the price rises or must they That means that IF the price rises significantly nearly 30 million shares must be bought in the next ten days to cover that s 57 of all the shares available Holy fuck Okay but we need a catalyst this isn t going to magically happen and earnings certainly isn t it As it turns out starting yesterday the company gave itself the right to have a 300 million dollar share buyback That s your catalyst 300 million is nearly 50 of the float The total float not the float excluding insiders and institutions If this isn t a recipe for a squeeze I don t know what is Bear case amp counter points I m not saying this will happen I m saying it could It won t happen if the buyback doesn t do a shit ton of buying in the next 9 days and there is no reason I can see why they would deliberately trigger a squeeze in fact that would be stupid since it would undermine the value of their own buyback because it would cause a massive squeeze although I do note the stock is up nearly 10 today as of writing so something is causing this pressure I also have no way of knowing if or when they actually buy back This 10 increase could be for some other totally unrelated reason and could be temporary Speaking of temporary even if it does squoze it will crash and fucking burn in good order In my view a fair price target for now is 7 and a best case squeeze peak is 15 since by then the gamma ramp is rump and the short squeeze squoze I hope this is a rocket because I need one to get out of the hole UWMC put me in Speaking of which you wouldn t call an intellectually disabled person a retard so calling me a bagholder is a hatecrime 
1228,naxn5r,t2_a0v0gnrd,1620848977,/r/wallstreetbets/comments/naxn5r/bezinga_options/,1,Bezinga Options,Has any tried Bezinga Options and if so what has your experience been 
1229,naxnam,t2_qqlz4,1620848986,/r/wallstreetbets/comments/naxnam/i_aint_scared/,1,I ain t scared,
1230,naxnme,t2_5a9d5qzn,1620849010,/r/wallstreetbets/comments/naxnme/the_moon_made_us_evolve/,1,The moon made us evolve,
1231,naxozk,t2_c1ymgpac,1620849106,/r/wallstreetbets/comments/naxozk/peabody_energy_btu/,1,Peabody Energy BTU ,
1232,naxp78,t2_9zxs1d6o,1620849122,/r/wallstreetbets/comments/naxp78/left_a_reply_for_this/,1,Left a reply for this ,
1233,naxpre,t2_a0fs52vj,1620849157,/r/wallstreetbets/comments/naxpre/got_these_fuckers_two_weeks_ago_was_leaning_on/,1,Got these fuckers two weeks ago was leaning on the inflation not civil wars happening 1 10 split coming in two weeks as well ,
1234,naxpx2,t2_a449a5la,1620849168,/r/wallstreetbets/comments/naxpx2/can_someone_explain_how_this_is_possible_how_is/,1,Can someone explain how this is possible How is there more buying pressure than selling 9 more shares returned than borrowed and the stock is down 13 on the day ,
1235,naxqxf,t2_mjfbgza,1620849241,/r/wallstreetbets/comments/naxqxf/whatever_happened_to_making_our_own_exchange/,1,Whatever happened to making our own exchange ,The posts I am talking about are https www reddit com r wallstreetbets comments l6z1pm lets make our own exchange stonks app https www reddit com r wallstreetbets comments l6z1pm lets make our own exchange stonks app https www reddit com r wallstreetbets comments l71kd0 share and upvote screw wall street we need to https www reddit com r wallstreetbets comments l71kd0 share and upvote screw wall street we need to amp x200B They both seemed really promising I even dmed OP but he never replied Does someone else want to do this 
1236,naxr4j,t2_a449a5la,1620849255,/r/wallstreetbets/comments/naxr4j/can_someone_explain_how_this_is_possible_how_is/,1,Can someone explain how this is possible How is there more buying pressure than selling 9 more shares returned than borrowed and the stock is down 13 on the day ,
1237,naxrl3,t2_9zxs1d6o,1620849290,/r/wallstreetbets/comments/naxrl3/left_a_reply_for_this/,1,Left a reply for this ,
1238,naxro3,t2_b7ok7l49,1620849295,/r/wallstreetbets/comments/naxro3/psychedelics_are_the_future_of_psychiatry_and/,1,Psychedelics are the Future of Psychiatry and Mental Health,When I read everyone s opinion on companies using mushrooms for psychiatric disorders I know that most people don t have medical or neuroscience backgrounds The current work in therapeutic psychedelics has increased over the last ten years Last year there was a record number of academic research articles regarding psychedelics over 5 000 papers That decrease in 2021 is the current number of papers that have been accepted and published I expect the number in 2021 to hit around 7 000 papers amp x200B https app dimensions ai discover publication https preview redd it rge85trbvqy61 png width 768 amp format png amp auto webp amp s c9197c8119cc9118a0321c2f4ffbbf86c7014f2f In 2021 there has already been two big articles published in the New England Journal of Medicine and Nature Medicine two of the biggest academic journals The NEJM article was regarding psilocybin and lexapro and there was an overall decrease in depression score when comparing the two groups The results were not significant statistically but the sample size wasn t that big Small sample sizes affects the statistics greatly especially if 1 or 2 people falls outside 2 3 standard deviations The Nature Medicine article which was posted on the 10th of May involved treating severe PTSD with MDMA ecstasy In this experiment the results were significant This means that the findings showed a statistically significant decrease in PTSD symptoms when conducting a MDMA counseling session amp x200B https www nature com articles s41591 021 01336 3 https preview redd it 8sp5abyivqy61 png width 685 amp format png amp auto webp amp s b9eaa70b6e2a48127d6a1edf9c17e4457e5b74f7 I am a medical student in my psychiatry clerkship and I ve discussed this with all of my attendings and the residents This is the future of psychiatry and mental health Mindmed is currently looking at other areas where psychedelics could beneficial Depression anxiety PTSD chronic pain ADHD substance abuse etc This is just the beginning of areas where psychedelics can be applied Further chemical manipulation can produce more therapeutic drugs For those who are not pharmacologists or chemists all psychedelics have a serotonergic backbone Meaning that they are all similar to serotonin Serotonin is our feel good neurotransmitter and is the clinical target for depression The current medication regimen for depression is selective serotonin reuptake inhibitors SSRIs Their mechanism of action is to increase serotonin by blocking reuptake in our synapses ALL PSYCHEDELICS ARE SEROTONIN ANALOGS This is good Depression and anxiety have not had any new breakthroughs since the 1980s sertraline and fluoxetine Prozac and Zoloft With more and more people being diagnosed with depression and anxiety it is a 4 7 BILLION dollar market Imagine getting into this breakthrough at 3 00 a share The potential of this field of research and the current market is astronomical This treatment will be the future of psychiatry and mental health When including other areas like substance abuse and chronic pain you are looking at an even bigger market These shares in a few years could be at 200 dollars a share I am not a financial expert or a stock broker I am a medical student who is working in this field I am not associated with any company and I have no conflicts of interest I am just stating research that is being produced at an increasing rate 
1239,naxsy3,t2_tiyhwo5,1620849384,/r/wallstreetbets/comments/naxsy3/amc_not_much_but_its_honest_work/,1,AMC Not much but it s honest work,
