,postid,author,created_utc,permalink,score,title,selftext
443,nd57l0,t2_a27sop6a,1621103146,/r/wallstreetbets/comments/nd57l0/its_happening_big_push_in_after_hours_now_at_we/,1,It s happening big push in after hours now at we haven t been at this price in more the 4 year watch it at open Monday earning will play a big part ,
444,nd5859,t2_4dh5cjnq,1621103193,/r/wallstreetbets/comments/nd5859/do_you_idiots_know_about_aqua_goat_yet/,1,Do you idiots know about Aqua Goat yet ,
445,nd5alf,t2_a1usiuyb,1621103387,/r/wallstreetbets/comments/nd5alf/they_gave_me_47000000_in_margin/,1,They gave me 47 000 000 in margin,
446,nd5b8q,t2_8qqcklg6,1621103424,/r/wallstreetbets/comments/nd5b8q/help/,1,Help ,Hello Apes I thought a long time if i do this post or not So when you think its not good you can delete it Sorry for my bad English I am from germany First i must say you do a great job Continue this But my question is Can any of you help me Our job isn t enough We drive to old people at home and helping them My wife has to pay out a house she have now from her parents And we dont really like to pay for years to the Bankers I need 100k to feel free for this Can anyone help us to get free from the bank Write me a message This would be really helpful Greetings from Germany 
447,nd5ek2,t2_c0twllyy,1621103685,/r/wallstreetbets/comments/nd5ek2/buy_moonshot/,1,Buy moonshot,
448,nd5fun,t2_2erfmkrj,1621103787,/r/wallstreetbets/comments/nd5fun/robinhooders_when_they_find_out_how_shitty_their/,1,Robinhooders when they find out how shitty their options are,
449,nd5hk8,t2_qrcl6,1621103923,/r/wallstreetbets/comments/nd5hk8/alright_which_one_of_you_was_it/,1,Alright which one of you was it ,
450,nd5hqz,t2_2erfmkrj,1621103938,/r/wallstreetbets/comments/nd5hqz/robinhooders_when_they_find_out_how_shitty_their/,1,Robinhooders when they find out how shitty their options are,
451,nd5i6e,t2_byiszsfy,1621103974,/r/wallstreetbets/comments/nd5i6e/what_would_michio_do/,1,What Would Michio Do ,QS HYSR and MP TO THE MOON on Blue Origin Galactic or SPACEX 
452,nd5jdt,t2_80chwjr4,1621104067,/r/wallstreetbets/comments/nd5jdt/how_many_of_us_apes_left_robinhood/,1,How many of us Apes left Robinhood ,Robinhood without a doubt briefly paused our efforts to make these hedgies pay and with all the new news we can all agreee that VLAD is in cahoots with Citadel and lied directly to the American people Now that we are building up momentum and getting closer to our goal Moass how many of us have switched brokers and are ready for round 2 Also how many are ready to short Robinhoods IPO or direct listing I don t know about you guys but I want to make VLAD pay bad for not being on our side I will not stop until that company is burned to the ground financially Yea I m still pissed Sorry I m mentally challenged and hold grudges forever LETS GO TEAM 
453,nd5l42,t2_16syfv,1621104195,/r/wallstreetbets/comments/nd5l42/i_dont_understand_stonks/,1,I DON T UNDERSTAND STONKS,
454,nd5lsq,t2_9js0dd4x,1621104250,/r/wallstreetbets/comments/nd5lsq/cant_have_a_conscience_in_the_squeeze_game/,1,Can t have a conscience in the squeeze game,
455,nd5mtr,t2_50plh9jq,1621104333,/r/wallstreetbets/comments/nd5mtr/amc/,1,AMC,
456,nd5obe,t2_4b9ms,1621104455,/r/wallstreetbets/comments/nd5obe/which_one_of_you_autists_am_i_sitting_behind_on/,1,Which one of you autists am I sitting behind on Long Island,
457,nd5of6,t2_arawbqy9,1621104463,/r/wallstreetbets/comments/nd5of6/are_we_paying_gme_shorts_bills_elia_ftd_cycle/,1,Are we paying GME shorts bills ELIA FTD cycle costs ,After four fucking months of DD I can t read or pretend to understand options shit anymore What does the FTD cycle actually cost them Can they run out of ammo this way I just learned that any share we are buying that was a synthetic short which is basically all of current buys at this point right is us handing money directly to the seller aka Citadel and Co That seems like supplying them ammo rather than making them spend it Considering borrow fee over a year is dwarfed by the base price of a share you need 100 borrow fee to break even in a year if someone just gives you the price So a synthetic share bought easily helps pay the borrow fees on multiple non naked shorts pre existing regular short positions Please tell me the FTD cycle is somehow exponential and vastly costly in as stupid a way as you can I don t need a bunch of graphs with lines lining up or deep options speak Because if not the answer to how do they keep dragging this out is US Please tell me us buying the dips isn t paying their bills Should we now that we own the float just be holding and not buying 
458,nd5q0v,t2_bolwsrbe,1621104591,/r/wallstreetbets/comments/nd5q0v/massive_moonshot_launched_2_minutes_ago/,1, MASSIVE MOONSHOT LAUNCHED 2 MINUTES AGO , removed 
459,nd5qlg,t2_73mvyi0a,1621104635,/r/wallstreetbets/comments/nd5qlg/pte_will_skyrocket/,1,PTE will skyrocket, removed 
460,nd5r80,t2_bzaid82g,1621104684,/r/wallstreetbets/comments/nd5r80/thoughts_sell_or_hold_pending_mining_application/,1,Thoughts Sell or Hold Pending mining application approval KOD ,
461,nd5rvk,t2_aayamni2,1621104738,/r/wallstreetbets/comments/nd5rvk/stocks_to_invest_in_to_capitalize_on_current/,1,stocks to invest in to capitalize on current world events ,How does this affect our markets What happens if this issue continues and USA has to get involved what happens when the USA gets involved What happens if we declare war on someone Won t there be a huge crash correction How does one capitalize on current world events Should I invest in like UVXY Oil stocks defense stocks Im not the smartest so that s why I m asking don t play me also this post was denied by a moderator however its not political bullshit its not manipulation its not a pump and dump no scam no advertising no bullshitting just an idea a question to those that see into what could happen if I had posted a similar post in December 2019 asking what could happen if covid hits the usa like it is in china most of y all including me would be millionaires had we made some early wise investments this Is the same thing 
462,nd5s5c,t2_8img072g,1621104758,/r/wallstreetbets/comments/nd5s5c/want_to_get_out_of_tech_for_a_while_try_wood_and/,1,Want to get out of tech for a while Try WOOD and VAW, removed 
463,nd5uju,t2_8ylpnd00,1621104954,/r/wallstreetbets/comments/nd5uju/clover_health_potential_squeeze_monday_premarket/,1,Clover Health Potential Squeeze Monday Premarket earnings , removed 
464,nd5vt1,t2_6jm9c53p,1621105056,/r/wallstreetbets/comments/nd5vt1/inflation_is_everywhere/,1,Inflation is everywhere, The headline CPI year over year increase at 4 2 was the highest since 2008 Energy prices rose 25 and gas prices 50 Rising energy prices filter through to almost everything Used car and truck prices were up 21 Rents rose 2 1 If you substitute home prices for rents that number more than doubled The Fed calls this transitory citing lower prices in April 2020 due to lockdowns in response to the Covid 19 pandemic The mainstream media were quick to point this out Some news added that the rise in prices is because the economic growth is accelerating The problems with these excuses for rising prices are many If these increases are solely based on the low numbers in April 2020 then why have they soared from just one month ago If the economy is doing so well why does the Fed continue to print 120bln a month and keep the Fed Funds rates at essentially zero Why is Government falling all over himself to spend money on everything it seems to the tune of trillions in additional fiscal stimulus No the economy is not booming because if all of these stimuli were ended tomorrow everything would collapse It s that simple The truth is that unemployment remains extremely high the labor participation rate low and we re seeing supply shocks develop across the economy This means fewer people producing fewer goods and providing fewer services At the same time dollars printed out of thin air are being pumped into the system left and right How does giving the unemployed a check once a month while providing nothing in return not create higher prices I apologize for the following patronizing example but just to illustrate the point clearly Say you have 10 cartons of milk and 10 circulating in the economy All else aside what is the price of each carton of milk 1 Now say you increase the amount of money circulating in the economy to 20 What is the price now 2 An inflation rate of 100 from 1 to 2 Now let s say that the number of cartons of milk falls from 10 to 5 What is the price of a carton of milk now It s 4 because now you have 20 chasing 5 cartons An inflation rate of 400 from 1 to 4 The point being that if you create more money out of thin air and at the same time reduce the amount of goods and services to purchase prices soar This is the real reason we re seeing prices rise and it s not transitory As I like to say one just has to look at the performance of commodity futures over the past year or go to Any shop or the grocery store It s not rocket science This will continue until the monetary and fiscal stimulus stops small and medium sized businesses return and employment rises significantly Don t hold your breath imho Negating the transitory nonsense the month over month increases were far higher than expected double in the case of the headline PPI These are the prices that filter through to consumer prices over time i e the CPI is likely going even higher If that were not enough wage inflation is on the rise too as employers struggle to get people off the couch who can otherwise live on their stimulus checks Checks that are unlikely to be inflation indexed Several States have already begun or are considering a return to work bonus in order to get people to go back to work Don t get me started on housing prices The point being Inflation is everywhere So what happened to bond yields when these numbers came out The 10 Year rose from 1 61 to 1 70 The 30 Year rose from 2 33 to 2 42 Now this may not seem like a lot but the market was not buying the Fed s rhetoric ahead of the inflation numbers and much of the impact was already priced in Taking this into account the 10 Year was 1 47 just four days ago and is now at 1 70 That s a huge move for bonds in such a short space of time The 30 Year was 2 16 last Friday the risk to the upside in the 30 Year yield is capped somewhere between 2 75 3 00 imho Assuming inflation not only continues to rise but accelerates to the upside while bond yields are capped we have an asymmetric risk to the downside in real yields Precious metals and miners have long term inverse correlation to real yields Said simply if and when real yields decrease watch the metals soar I estimate the time for that scenario to play out in weeks So the trend is up I am just ape no financial advice Thanks to David Brady for addendum
465,nd5w73,t2_8z87rp9k,1621105086,/r/wallstreetbets/comments/nd5w73/new_jersey_deli_fires_wrestling_coach/,1,New Jersey deli fires wrestling coach,
466,nd5wad,t2_8ylpnd00,1621105092,/r/wallstreetbets/comments/nd5wad/clov_potential_squeeze_monday_premarket_earnings/,1,CLOV Potential Squeeze Monday Premarket earnings See below,
467,nd5wsx,t2_c5fa5yby,1621105134,/r/wallstreetbets/comments/nd5wsx/nas100_trading_technical_analysis_friday_close/,1,NAS100 Trading Technical Analysis Friday Close Legatus,
468,nd5z68,t2_a11xpecf,1621105308,/r/wallstreetbets/comments/nd5z68/hcmc/,1,Hcmc, removed 
469,nd61ip,t2_1qdoz38u,1621105486,/r/wallstreetbets/comments/nd61ip/jim_cramer_out_of_context_honest_when_asked_about/,1,Jim Cramer out of context honest when asked about MNMD , removed 
470,nd61r7,t2_6jm9c53p,1621105502,/r/wallstreetbets/comments/nd61r7/inflation_is_everywhere/,1,Inflation is everywhere, The headline CPI year over year increase at 4 2 was the highest since 2008 Energy prices rose 25 and gas prices 50 Rising energy prices filter through to almost everything Used car and truck prices were up 21 Rents rose 2 1 If you substitute home prices for rents that number more than doubled The Fed calls this transitory citing lower prices in April 2020 due to lockdowns in response to the Covid 19 pandemic The mainstream media were quick to point this out Some news added that the rise in prices is because the economic growth is accelerating The problems with these apologetic excuses for rising prices are many If these increases are solely based on the low numbers in April 2020 then why have they soared from just one month ago If the economy is doing so well why does the Fed continue to print 120bln a month and keep the Fed Funds rates at essentially zero Why is Government falling all over himself to spend money on everything it seems to the tune of trillions in additional fiscal stimulus No the economy is not booming because if all of these stimuli were ended tomorrow everything would collapse It s that simple The truth is that unemployment remains extremely high the labor participation rate low and we re seeing supply shocks develop across the economy This means fewer people producing fewer goods and providing fewer services At the same time dollars printed out of thin air are being pumped into the system left and right How does giving the unemployed a check once a month while providing nothing in return not create higher prices The point being that if you create more money out of thin air and at the same time reduce the amount of goods and services to purchase prices soar This is the real reason we re seeing prices rise and it s not transitory As I like to say one just has to look at the performance of commodity futures over the past year or go to Any shop or the grocery store It s not rocket science This will continue until the monetary and fiscal stimulus stops small and medium sized businesses return and employment rises significantly Don t hold your breath imho Negating the transitory nonsense the month over month increases were far higher than expected double in the case of the headline PPI These are the prices that filter through to consumer prices over time i e the CPI is likely going even higher If that were not enough wage inflation is on the rise too as employers struggle to get people off the couch who can otherwise live on their stimulus checks Checks that are unlikely to be inflation indexed Several States have already begun or are considering a return to work bonus in order to get people to go back to work Don t get me started on housing prices The point being Inflation is everywhere So what happened to bond yields when these numbers came out The 10 Year rose from 1 61 to 1 70 The 30 Year rose from 2 33 to 2 42 Now this may not seem like a lot but the market was not buying the Fed s rhetoric ahead of the inflation numbers and much of the impact was already priced in Taking this into account the 10 Year was 1 47 just four days ago and is now at 1 70 That s a huge move for bonds in such a short space of time The 30 Year was 2 16 last Friday the risk to the upside in the 30 Year yield is capped somewhere between 2 75 3 00 imho Assuming inflation not only continues to rise but accelerates to the upside while bond yields are capped we have an asymmetric risk to the downside in real yields Precious metals and miners have long term inverse correlation to real yields Said simply if and when real yields decrease watch the metals soar I estimate the time for that scenario to play out in weeks So the trend is up This is not financial advice Thanks to David Brady for addendum
471,nd6253,t2_a12d3svz,1621105533,/r/wallstreetbets/comments/nd6253/they_should_have_never_given_yall_money/,1,They should have never given ya ll money,
472,nd62va,t2_1roukori,1621105593,/r/wallstreetbets/comments/nd62va/i_wishreally_really_hard/,1,I wish really really hard ,
473,nd64nr,t2_1qdoz38u,1621105733,/r/wallstreetbets/comments/nd64nr/jim_cramer_summed_up_out_of_context_when_asked/,1,Jim Cramer summed up out of context when asked about MNMD ,
474,nd652x,t2_3bimtqlb,1621105766,/r/wallstreetbets/comments/nd652x/ortex_signals_amc_short_squeeze/,1,ORTEX signals AMC short squeeze,
475,nd65fc,t2_bnaed029,1621105795,/r/wallstreetbets/comments/nd65fc/zip_ipo/,1,ZIP IPO, removed 
476,nd65p7,t2_a4oq9ymr,1621105816,/r/wallstreetbets/comments/nd65p7/banc_sabadell_opinions_of_banco_sabadell_next/,1,BANC SABADELL Opinions of Banco Sabadell next Game Stop ,Opinions of Banco Sabadell next Game Stop 
477,nd66cw,t2_8gzgo8rq,1621105863,/r/wallstreetbets/comments/nd66cw/_/,1, ,
478,nd685f,t2_a4oq9ymr,1621106006,/r/wallstreetbets/comments/nd685f/banco_sabadell_opinions_of_banco_sabadell_next/,1,Banco Sabadell Opinions of Banco Sabadell next Game Stop , removed 
479,nd6cqn,t2_9ksqp0nw,1621106374,/r/wallstreetbets/comments/nd6cqn/ttcf_to_the_mars/,1,TTCF to the mars ,Here some thoughts why I like TTCF stock and I am a big bull The growth is astonishing with and revenue will according to analysts reach 1 billion dollars by 2026 If they achieve it returns should be at least 20 a year If we would assume multiples from a food giant like General Mills GIS their business model creates Cashflow from Operations 4 8 Revenue This would mean roughly around 200mil in Cashflow from Operations for Tattooed Chef General Mills market cap right now trades at roughly 10x Cashflow from Operations and the company doesn t grow for shit 10x Multiple Tattooed Chef would stop growing immediately after 5 years of insane growth which would not make any sense gt Marketcap 2B Right now they are trading at 1 4B That alone means upside of roughly 50 in the next 5 years and because of a higher multiple just to show the potential returns could be amazing amp x200B They did one of the best acquisitions I have ever seen According to Seeking Alpha the short interest is 35 which could create some short squeeze potential considering the last strong upward move momentum Management holds a significant amount of shares what I really like amp x200B I like the stock I am invested and this is no financial advice and only my personal opinion throwing it out there so that my ass doesn t get sued by one of the shorts out there Happy bear hunting season guys 
480,nd6dgs,t2_2xsjzux4,1621106428,/r/wallstreetbets/comments/nd6dgs/shib_is_the_new_dogecoinn/,1,SHIB is the new Dogecoinn,
481,nd6eoq,t2_bzaid82g,1621106521,/r/wallstreetbets/comments/nd6eoq/what_should_i_do_sell_or_hold_please_advise_a_new/,1,What should I do sell or hold Please advise a new investor , removed 
482,nd6fav,t2_nrn6b,1621106567,/r/wallstreetbets/comments/nd6fav/how_is_this_fair/,1,How is this fair ,
483,nd6gex,t2_ad45glne,1621106652,/r/wallstreetbets/comments/nd6gex/httpschartsboggedfinancetoken0x7e8db69dcff9209e486/,1,https charts bogged finance token 0x7e8DB69dcff9209E486a100e611B0af300c3374e,
484,nd6gm5,t2_bzaid82g,1621106671,/r/wallstreetbets/comments/nd6gm5/what_should_i_do_sell_or_hold_please_advise_a_new/,1,What should I do sell or hold Please advise a new investor,Hey I m new to investing in stocks and shares and started at the beginning of this year I looked at the lowest stocks on the AIM market and made sure I did research into them all before even thinking about putting money in The one I went with in the end was Kodal Minerals due to it having the biggest potential out of all the ones I looked into I managed to buy a total of 3 500 worth of shares when they was around 0 0013 and so far this share has been performing really well thanks to a recent interview with the CEO being released with Proactive Investors Now I ve currently more than doubled my initial investment but what should I do now Do I sell some of the shares and get my initial 3500 back so the rest is just a free ride or do I stick to my guts and keep it all in The reason why I m umming and arrghing is because Kodal has so much potential in the video interview the CEO said they ve got some good gold news coming from the gold mines they have and also he mentions updates on a mining license for a new mine they have that once approved will make them the biggest Lithium developer in West Africa With all the news on how Lithium is in huge demand at the moment and how the price of lithium is becoming more and more expensive I keep thinking if I sell some shares to get my initial investment back then I m halfing the number of shares and if this sky rockets then I could of had double the money if I didn t sell This lithium mining application is going to be huge for the company but then there s also the gold mines too What do I do here as i really don t know 
485,nd6hkc,t2_6i8s97x3,1621106746,/r/wallstreetbets/comments/nd6hkc/when_people_say/,1,When people say, removed 
486,nd6hlr,t2_9ksqp0nw,1621106750,/r/wallstreetbets/comments/nd6hlr/ttcf/,1, TTCF, TTCF according to Seeking Alpha 35 Shorted which is insane considering their revenue growth and recent acquisition I like the stock happy hunting https preview redd it sgtis9uy4cz61 png width 2560 amp format png amp auto webp amp s ed32fee78f4abfbed2576f552a940a679b3a1a60 amp x200B Processing img t2xl7on05cz61 https preview redd it sixbw3615cz61 png width 2560 amp format png amp auto webp amp s 606588939f48ff27c55e18cc13de4c9afdab0c76
487,nd6hq5,t2_alx2x0sw,1621106760,/r/wallstreetbets/comments/nd6hq5/uncle_chael_sonnen_talking_about_amc_stock_with/,1,Uncle Chael Sonnen talking about AMC stock with Jake Paul let s fkn goooooo,https youtu be JV8XTHm9TR0 Skip to 17 05 Chael Sonnen UFC legend talking about AMC stock with Jake Paul let s fkn gooooo AMCSqueeze
488,nd6ly2,t2_boj8sp5v,1621107082,/r/wallstreetbets/comments/nd6ly2/as_you_read_this_we_are_about_to_buy_this_new/,1,AS YOU READ THIS WE ARE ABOUT TO BUY THIS NEW DARK CRYPTOCURRENCY SAURON SRNX All you have to do is to join our telegram and get more detalis in the SauronToken Chat Wallet Address 0x0Ab172176dD5f2fFceA55003967A90c1545DE481 https t me saurontokenchat,
489,nd6meo,t2_3c8bbgvs,1621107114,/r/wallstreetbets/comments/nd6meo/i_have_seen_a_lot_of_cool_designs_here_so_i/,1,I have seen a lot of cool designs here so I wanted to give it a try Ready to go to the moon with all my fellow apes ,
490,nd6o7r,t2_9es4epgs,1621107254,/r/wallstreetbets/comments/nd6o7r/elon_the_mastertrader/,1,Elon The MasterTrader,
491,nd6pry,t2_c5cox543,1621107384,/r/wallstreetbets/comments/nd6pry/c3_ai_time_to_load_up/,1,C3 AI time to load up, removed 
492,nd6qqs,t2_bsz40u49,1621107456,/r/wallstreetbets/comments/nd6qqs/the_golden_thumb/,1,The golden thumb,Look gents don t laugh most attractive ratio can be applied to stocks If the chart is appealing you buy I use the golden ratio for this your thumb is the golden ratio let it be your guide to making that paper Heres how it works Look on your phone right now Pick your favorite company use the one week chart Use your right hand make a thumbs up move it to the side and take a look at your screen The tip of your nail is at the first point first point is at a peak find another peak line it up with that golden thumb If your doing this check out the current price on the line chart at the end of your thumb here is the magic If the price is passing the thumb its all but up The price needs to pass through the thumb for a bull run If it doesn t no bull run it s prob dippin I m not a financial advisor I work at Wendy s Very abstract but has helped me make some solid moves Just mess around with it you ll see it Cheers 
493,nd6qzp,t2_btfgj6w7,1621107480,/r/wallstreetbets/comments/nd6qzp/war_on_rugs_is_getting_back_vitalik_buterin_for/,1,War on Rugs is getting back Vitalik Buterin for sinking Shib so much They made a new coin called Rug Ethereu and it is currently bringing Ether down,
494,nd6ral,t2_bhc507p8,1621107504,/r/wallstreetbets/comments/nd6ral/all_in_the_war_machine/,1,All In The War Machine,
495,nd6s96,t2_btfgj6w7,1621107585,/r/wallstreetbets/comments/nd6s96/war_on_rugs_is_getting_back_vitalik_buterin_for/,1,War on Rugs is getting back Vitalik Buterin for sinking Shib so much They made a new coin called Rug Vthereum and it is currently bringing it down,
496,nd6vj0,t2_8re66w80,1621107856,/r/wallstreetbets/comments/nd6vj0/baby_killing_jews_in_israhell/,1,Baby killing Jews in Israhell , removed 
497,nd6vtg,t2_bouunx6c,1621107882,/r/wallstreetbets/comments/nd6vtg/whats_this_i_hear_about_tbev/,1,Whats this I hear about TBEV ,
498,nd6yji,t2_9ecclo0y,1621108119,/r/wallstreetbets/comments/nd6yji/just_a_reminder_for_anybody_interested_in_gme_to/,1,Just a reminder for anybody interested in GME to join r gme and r superstonk, removed 
499,nd70ye,t2_595trve2,1621108331,/r/wallstreetbets/comments/nd70ye/the_largest_healthcare_organization_in_canada_has/,1,The largest healthcare organization in Canada has selected Blackberry Spark as it s cyber security software ,
500,nd70ye,t2_595trve2,1621108331,/r/wallstreetbets/comments/nd70ye/the_largest_healthcare_organization_in_canada_has/,1,The largest healthcare organization in Canada has selected Blackberry Spark as it s cyber security software ,
501,nd71ff,t2_2xsjzux4,1621108371,/r/wallstreetbets/comments/nd71ff/shib/,1,SHIB, removed 
