,postid,author,created_utc,permalink,score,title,selftext
483,namvm5,t2_61ya7dqi,1620820590,/r/wallstreetbets/comments/namvm5/aapl_ew_analysis/,1,AAPL EW analysis,Hi I am a 20 year old student who began studying Elliott wave principle recently in hope that it would improve my trading Is there anyone who could take a look at my analysis of AAPL stock Now I do not know any of the indicators this is purely based on my first impression on the chart employing the EW analysis I have been studying Any opinion will be greatly appreciated please help this boy out Please ignore the small writings as they are basically me rambling to myself so in short I think that the wiggly price action after wave 3 is wave 4 manifesting in a triangle almost coming to an end ready for a breakout to fib extension 1 of wave 1 I did also consider the sharp low after the wave 3 being the wave 4 but since it is too sharp in relation to the wave 2 and it took such a short time to do so I figured it would be more reasonable to consider it wave A of a triangle and so far the trend lines are supporting my theory If it does breakout below C then I would think that it might be the wave A of a correction which could possibly retrace all the way back to somewhere between the extreme of wave 1 and wave 4 and that whole impulse being the wave 1 of a strong uptrend This is my possible anticipation it might sound absolutely stupid to some of you Elliotticians as it has been only three days since I ve started studying EW and I don t know anything else about trading this is the first point of my study So please do give me generous criticism how to improve I tremendously appreciate your time thanks for reading this long ass post https preview redd it axtsyib6goy61 jpg width 1134 amp format pjpg amp auto webp amp s 50b33b7211884eda63ac6ff7b4ac12eac3c5d38a
484,namwhb,t2_3evuz,1620820677,/r/wallstreetbets/comments/namwhb/tking_known_developers_uniswap_v2_locked/,1, TKING Known developers Uniswap V2 Locked Liquidity Only 2 Days Old, removed 
485,namxv9,t2_bug5uqwt,1620820807,/r/wallstreetbets/comments/namxv9/i_like_the_stock_spce/,1,I Like The Stock SPCE ,I think Virgin Galactic SPCE is going to moon I love Sir Richard Branson and space travel Good DD SPCE will resume test flights this summer with Papa Branson flying in the third test flight which should moon the stock The stonk is currently trading near it s one year low so we would be buying at a heavily discounted price The company has fixed its electro magnetic interference issue which caused delays to previously scheduled tests Cathie Wood s space ETF will probs buy more SPCE stonk after successful test flights The space exploration service has high barriers to entry and the company already has many pre orders Government contracts mostly involving training Air Force pilots for space missions will print a pretty penny Government contracts are very reliable and consistent Merica needs to train Air Force astronauts before the Russians and Chinese do ask not what your country can do for you but what you can do for your country SPCE has an epic sexy brand profile similar to Tesla End of good DD Rainbow Bear DD Test flights get delayed for other reasons mothership currently under maintenance for wear and tear issues The test flights fail and Papa Branson dies in glorious flames The reflation scare turns out to be real interest rates increase and growth stonk valuations get discounted using the Discounted Cashflow Model Test flights continue to get delayed or fail the cash burn continues for longer than expected and the company s stock rating gets downgraded End of Rainbow Bear DD It s time for Wallstreetbets to find its place amongst the stars To the moon quite literally May our legacy endure through the ages 
486,namy2h,t2_c0mu7d7p,1620820815,/r/wallstreetbets/comments/namy2h/late_bloomer/,1,late bloomer, removed 
487,namzyy,t2_5petop7x,1620820979,/r/wallstreetbets/comments/namzyy/nndm_at_59_short_float_as_of_05112021_squeeze_play/,1,NNDM at 59 Short Float as of 05 11 2021 Squeeze play , https www reddit com r NNDM comments naj40e short interest at 59 as reported may 11th utm source share amp utm medium web2x amp context 3 https www reddit com r NNDM comments naj40e short interest at 59 as reported may 11th utm source share amp utm medium web2x amp context 3 
488,nan0gs,t2_89a87wr2,1620821014,/r/wallstreetbets/comments/nan0gs/bumble_bmbl_bee_to_the_moon/,1,Bumble BMBL bee to the moon ,
489,nan18q,t2_9v2gh7xx,1620821083,/r/wallstreetbets/comments/nan18q/blackberry_playing_god_or_just_fraud/,1,Blackberry playing god or just Fraud , I m trying to figure out how Blackberry ai cyber security can prevent ransomware before they take place in case of DarkSide recent pipeline hack the BB ai security protected against it 5 years ago How can you create a vaccine against a virus that doesn t exist How is blackberry playing god here while other cybersecurity companies don t go around making this kind of absurd claims or is this a fraud please help Here is the CEO of blackberry and their own threat research team making this exact claim Is this a fraud https blogs blackberry com en 2021 05 blackberry prevents darkside ransomware years before it ever existed https blogs blackberry com en 2021 05 blackberry prevents darkside ransomware years before it ever existed https twitter com JohnChen status 1392215270123573255 s 20 https twitter com JohnChen status 1392215270123573255 s 20 
490,nan1qp,t2_89a87wr2,1620821130,/r/wallstreetbets/comments/nan1qp/bumble_bmbl_bee_to_the_moon/,1,Bumble BMBL bee to the moon ,
491,nan4vs,t2_6aaqpzy8,1620821410,/r/wallstreetbets/comments/nan4vs/gtvh_news_out_golden_triangle_ventures_inc/,1, GTVH News Out Golden Triangle Ventures Inc Announces an Acquisition of a Hennessey Sound Design Professional Audio System and Strategic Partnership with SuperKollider Sound LLC for its Entertainment Division Under Lavish Entertainment Inc , removed 
492,nan7uu,t2_8b0yyjat,1620821679,/r/wallstreetbets/comments/nan7uu/cross_posted_from_ramcstock_a_user_posted_that/,1,Cross posted from r amcstock A user posted that WeBull was lending shares I saw this in my account profile Please check your accounts and disable the feature so the hedge funds have to cover their shorts ,
493,nan82s,t2_aq4brvlc,1620821698,/r/wallstreetbets/comments/nan82s/bought_lrc_on_sunday_now_up_65_pog_the_next/,1,Bought LRC on Sunday now up 65 pog The next mooning ,
494,nan8lc,t2_6aaqpzy8,1620821741,/r/wallstreetbets/comments/nan8lc/canb_news_out_can_b_corp_enters_the_industrial/,1, CANB News Out Can B Corp Enters the Industrial Hemp Business, removed 
495,nan9x0,t2_a152q0nw,1620821863,/r/wallstreetbets/comments/nan9x0/amc_httpsyoutubeqdpxofcdori/,1,Amc https youtu be QdpxoFcdORI,
496,nanbb3,t2_a8bqotym,1620821992,/r/wallstreetbets/comments/nanbb3/psfe_bullbear_hedges_out_of_control/,1, PSFE Bull Bear hedges out of control,Anyone see Paysafe and the ridiculousness Big merger plummeted after Great earnings still tanking Too many Hedges not enough Apes Next GME Anyone else do any DD on it 
497,nanc2v,t2_kc4td,1620822061,/r/wallstreetbets/comments/nanc2v/youtuber_and_investor_jackson_hunter_explains_the/,1,YouTuber And Investor Jackson Hunter Explains The AMC and GME Short Squeeze And What Signals To Watch For Before The Squeeze,
498,nanhsa,t2_8tozoksw,1620822568,/r/wallstreetbets/comments/nanhsa/riot/,1,Riot,We need to pump the stock RIOT 
499,nanhxo,t2_55gp34wm,1620822580,/r/wallstreetbets/comments/nanhxo/mrw_my_friend_alice_asks_wen_moass/,1,MRW my friend Alice asks wen MOASS ,
500,nanhxo,t2_55gp34wm,1620822580,/r/wallstreetbets/comments/nanhxo/mrw_my_friend_alice_asks_wen_moass/,1,MRW my friend Alice asks wen MOASS ,
501,nani2f,t2_93dlz47a,1620822593,/r/wallstreetbets/comments/nani2f/still_holdin_amc_to_the_moon_yoloo/,1,STILL HOLDIN AMC TO THE MOON YOLOO ,
502,nani4d,t2_3dzi4goz,1620822597,/r/wallstreetbets/comments/nani4d/we_just_got_a_dfv_lager_at_my_work_the_owner/,1,We just got a dfv lager at my work The owner doesn t even know the context of why it was made,
503,nanjgi,t2_byqug9nt,1620822715,/r/wallstreetbets/comments/nanjgi/but_i_will_have_proof_i_warned/,1, But I will have proof I warned ,I really wanted to explore the mechanics behind warnings and why we ignore them This is nothing too crazy but I feel like it s couldn t hurt to remind traders and discuss how our minds can sometimes lead us into danger despite warnings amp x200B The Psychology of Warnings https www visualexpert com Resources psychwarnings html gt Warning signs and labels are everywhere Many factors are conspiring to fill the world with more injunctions against our desired behavior Daily life is increasing in complexity while technology continually invents more powerful machines drugs and chemicals Moreover the cost of injury and insurance as well as accompanying litigation is spiraling upward rapidly As a result failures of warning compliance cause costly social and economic impact gt gt Unfortunately warnings often fail to change people s behavior Either the warning goes unnoticed or as increasingly happens the warning is seen but ignored gt gt gt gt Factors Affecting Compliance gt gt 1 Cost of Compliance gt gt Many studies have found that warning signs are more likely to be ineffective if the cost of compliance is high Reducing compliance costs is a very effective way to increase safety but it is necessary to understand where the viewer s costs arise Recall that the viewer has a goal in mind when using a device or navigating an environment The costs relate to the ability to achieve the goal as quickly and as easily as possible gt gt Yachts and tendies NOW amp x200B gt 2 Danger Perception gt gt Viewer history with the product or environment strongly affects danger perception The greater the experience with no negative outcome the lower the level of perceived danger This is the cry wolf or familiarization effect where people quit paying attention to uninformative input The effect can be both specific to a particular product a single drug or can generalize to all similar products same type of drugs or to the warnings source those government do gooders are at it again or The company is just covering itself gt gt One of the ironies of warnings is that the more experienced and skilled the viewer the stronger the familiarization effect and the more likely that the warning will be ignored gt gt Stonks go up Printers go brrr In Powell we trust amp x200B gt Warning Appearance gt gt Marshall McLuhan s famous aphorism the medium is the message applies to warning labels The physical appearance of the warning may inadvertently communicate hazard severity Most people have unconsciously learned the general rule that signs and signals grow in size and vividness with their importance presumably so that they will be more readily seen Viewers will then likely interpret warnings that are small faint or located peripherally as signaling lower risk gt gt We want Michael Burry s tendies but we don t actually want to be anything like Michael Burry amp x200B gt 3 Decision Making gt gt Risk Taking gt gt When the viewer ignores a warning it could be because s he viewed the cost of compliance as very high or because s he underestimated the danger However studies show that some people engage in risky actions across a wide variety of circumstances They likely have a high tolerance for risk rather than a tendency to underestimate danger in specific circumstances Moreover these risk takers were less likely to comply with warnings In fact the prospect of danger may decrease their compliance because the viewer s goal might involve courting danger gt gt GUH amp x200B gt Social Factors gt gt We live in a social context so other people affect individual notions of norms standards and acceptable behavior It is not surprising that degree of viewer behavior may be affected by whether other people are complying with the warning gt gt Bears are amp x200B amp x200B Warnings and Warning Labels https www visualexpert com Resources warnings html gt 1 Notice the warning gt gt 2 Perceive the warning gt gt 3 Understand the warning gt gt 4 Comply with the warning amp x200B amp x200B THE WARNINGS We ve all seen Burry s warning https preview redd it ayle13a8wxi61 png auto webp amp s b6fdf9e18007a1a85311a8c634f1ea2febe92063 gt People say I didn t warn last time I did but no one listened So I warn this time And still no one listens But I will have proof I warned truly regarded Here s https twitter com burryarchive lang en an archive of some of Burry s tweets amp x200B Below are some bits from an article https www gmo com americas research library waiting for the last dance by Jeremy Grantham https en wikipedia org wiki Jeremy Grantham Made 265 mil on MVIS lol so he s only sorta amp x200B gt All bubbles end with near universal acceptance that the current one will not end yet because Because in 1929 the economy had clicked into a permanently high plateau because Greenspan s Fed in 2000 was predicting an enduring improvement in productivity and was pledging its loyalty or moral hazard to the stock market because Bernanke believed in 2006 that U S house prices merely reflect a strong U S economy as he perpetuated the moral hazard if you win you re on your own but if you lose you can count on our support Yellen and now Powell maintained this approach All three of Powell s predecessors claimed that the asset prices they helped inflate in turn aided the economy through the wealth effect Which effect we all admit is real But all three avoided claiming credit for the ensuing market breaks that inevitably followed the equity bust of 2000 and the housing bust of 2008 each replete with the accompanying anti wealth effect that came when we least needed it exaggerating the already guaranteed weakness in the economy This game surely is the ultimate deal with the devil gt gt Now once again the high prices this time will hold because interest rates will be kept around nil forever in the ultimate statement of moral hazard the asymmetrical market risk we have come to know and depend on The mantra of late 2020 was that engineered low rates can prevent a decline in asset prices Forever But of course it was a fallacy in 2000 and it is a fallacy now In the end moral hazard did not stop the Tech bubble decline with the NASDAQ falling 82 Yes 82 Nor in 2008 did it stop U S housing prices declining all the way back to trend and below which in turn guaranteed first a shocking loss of over eight trillion dollars of perceived value in housing second an ensuing weakness in the economy and third a broad rise in risk premia and a broad decline in global asset prices see Exhibit 1 All the promises were in the end worth nothing except for one the Fed did what it could to pick up the pieces and help the markets get into stride for the next round of enhanced prices and ensuing decline And here we are again waiting for the last dance and eventually for the music to stop gt gt gt gt Either way the market is now checking off all the touchy feely characteristics of a major bubble The most impressive features are the intensity and enthusiasm of bulls the breadth of coverage of stocks and the market and above all the rising hostility toward bears In 1929 to be a bear was to risk physical attack and guarantee character assassination For us 1999 was the only experience we have had of clients reacting as if we were deliberately and maliciously depriving them of gains In comparison 2008 was nothing But in the last few months the hostile tone has been rapidly ratcheting up The irony for bears though is that it s exactly what we want to hear It s a classic precursor of the ultimate break together with stocks rising not for their fundamentals but simply because they are rising gt gt gt gt So here we are again I expect once again for my bubble call to meet my modest definition of success at some future date whenever that may be it will have paid for you to have ducked from midsummer of 2020 But few professional or individual investors will have been able to have ducked The combination of timing uncertainty and rapidly accelerating regret on the part of clients means that the career and business risk of fighting the bubble is too great for large commercial enterprises They can never put their full weight behind bearish advice even if the P E goes to 65x as it did in Japan The nearest any of these giant institutions have ever come to offering fully bearish advice in a bubble was UBS in 1999 whose position was nearly identical to ours at GMO That is to say somewhere between brave and foolhardy Luckily for us though they changed their tack and converted to a fully invested growth stock recommendation at UBS Brinson and its subsidiary Phillips amp Drew in February 2000 just before the market peak This took out the 800 pound gorilla that would otherwise have taken most of the rewards for stubborn contrariness So don t wait for the Goldmans and Morgan Stanleys to become bearish it can never happen For them it is a horribly non commercial bet Perhaps it is for anyone Profitable and risk reducing for the clients yes but commercially impractical for advisors Their best policy is clear and simple always be extremely bullish It is good for business and intellectually undemanding It is appealing to most investors who much prefer optimism to realistic appraisal as witnessed so vividly with COVID And when it all ends you will as a persistent bull have overwhelming company This is why you have always had bullish advice in a bubble and always will amp x200B Of course the million tendie question is when My advice Just keep hedging amp x200B positions UVXY 5c 5 14 SRTY 12c 8 20 SDOW 9c 9 17 SQQQ 15c 9 15
504,nankbc,t2_fq5xg,1620822785,/r/wallstreetbets/comments/nankbc/any_hodlers_left/,1,Any HODLers left , removed 
505,nankei,t2_9zedihm8,1620822794,/r/wallstreetbets/comments/nankei/aktuelle_finanznachrichten_und_brseninfos_direkt/,1,Aktuelle Finanznachrichten und B rseninfos direkt von der Quelle,
506,nankhh,t2_6aaqpzy8,1620822800,/r/wallstreetbets/comments/nankhh/smme_say_goodbye_to_pin_numbers_smartmetric/,1, SMME Say Goodbye to PIN Numbers smartmetric Reports Increased Interest in Its Biometric Credit Card in the Age of Demand for No Touch Solutions at the Checkout frontpagestocks, removed 
507,nanlgh,t2_bk93jvf7,1620822885,/r/wallstreetbets/comments/nanlgh/pltr_hello_groupyes_im_self_promoting_but_im_also/,1, pltr Hello group Yes I m self promoting but I m also giving a positive informative recap of earnings under the radar information my own theory amp thoughts i hope mods allow this it s a well thought out and helpful video not just bs click bait meant to help the casual investors amp grow us ,
508,nanod6,t2_3umdslst,1620823133,/r/wallstreetbets/comments/nanod6/cpi_news_dd/,1,CPI NEWS DD, removed 
509,nanp4h,t2_9xtafj55,1620823199,/r/wallstreetbets/comments/nanp4h/catecoin/,1,Catecoin,The first cat of meme coins BUY CATE COIN LET S PUMP IT UP 
510,nanq4y,t2_50lvc0f,1620823284,/r/wallstreetbets/comments/nanq4y/got_lucky_with_250_call_for_coinbase_sell_today/,1,Got lucky with 250 call for Coinbase Sell today or hold through earnings ,
511,nanqdg,t2_5qx2k930,1620823300,/r/wallstreetbets/comments/nanqdg/virgin_for_sale_now/,1,VIRGIN FOR SALE NOW , removed 
512,nanqlt,t2_a0b7rfkq,1620823320,/r/wallstreetbets/comments/nanqlt/apes_fubo_is_primed_for_a_squeeze/,1,APES FUBO IS PRIMED FOR A SQUEEZE,FUBO just had a great ER trending 1 on StockTwits and 2 on yahoo It s been unfairly been beaten down over 70 by the deplorable suit Rich Greenfield We have a chance to take on the suits LETS GO APES STAY HAIRY 
513,nansdn,t2_1gv8voik,1620823477,/r/wallstreetbets/comments/nansdn/ill_suck_your_cock_for_the_big_day_option_win_im/,1,I ll suck your cock for the big day option win I m fucking serious Get me that return greater than 10k and we ll schedule it I ve got 1k daily to play with, removed 
514,nanvn3,t2_rfnjr,1620823769,/r/wallstreetbets/comments/nanvn3/shedding_a_little_litecoin_on_things/,1,Shedding a little Litecoin on things , removed 
515,nanw3x,t2_mwu23,1620823808,/r/wallstreetbets/comments/nanw3x/hey_guys_theres_gonna_be_like_no_fish_soon_and/,1,Hey guys there s gonna be like no fish soon and was wondering whether to buy or short various fish companies,
516,nanw8m,t2_47vm7zjp,1620823818,/r/wallstreetbets/comments/nanw8m/100/,1,100 ,I have 100 what should i buy for a short term yolo
517,nanxla,t2_a1914mef,1620823934,/r/wallstreetbets/comments/nanxla/we_still_calling_amc_a_distraction_to_gme/,1,We still calling AMC a distraction to GME ,
518,nanynr,t2_q15pxyy,1620824027,/r/wallstreetbets/comments/nanynr/i_analyzed_9000_trades_made_by_us_congress/,1,I analyzed 9000 trades made by U S Congress Members in the last two years and benchmarked it against S amp P500 Here are the results , removed 
519,nanysy,t2_a6egf85e,1620824041,/r/wallstreetbets/comments/nanysy/splk_to_the_moonnnnn/,1,SPLK TO THE MOONNNNN , removed 
520,nanzel,t2_3qq012qr,1620824091,/r/wallstreetbets/comments/nanzel/long_term_lurker_first_time_trader_did_i_do_good/,1,Long term lurker first time trader Did I do good ,
521,nao09t,t2_brikzwar,1620824167,/r/wallstreetbets/comments/nao09t/let_me_yolo_12k_into_boomer_stocks_and_etfs_hmmm/,1,Let me YOLO 12k into boomer stocks and ETF s Hmmm this is going well already ,
522,nao15x,t2_6aaqpzy8,1620824246,/r/wallstreetbets/comments/nao15x/gmpr_news_gourmet_provisions_international_corp/,1, GMPR News Gourmet Provisions International Corp is Hungry for Growth Three Near Term Milestones Could Deliver a Serving of Higher Valuations, removed 
523,nao1vr,t2_12iajv,1620824311,/r/wallstreetbets/comments/nao1vr/fbi_s3e13_named_short_squeeze_dramatised_look_at/,1,FBI S3E13 named Short Squeeze Dramatised look at coming months on Wall St Gamestop gets a shoutout ,
524,nao1wa,t2_27ege18h,1620824312,/r/wallstreetbets/comments/nao1wa/mother_wants_me_to_get_into_stock_because_i_have/,1,Mother wants me to get into stock because I have A head for those things and is offering to give me money to start off What do I do ,So to explain Recently turned 18 One of those disgusting young folk who make themselves miserable with the I have no idea what I want to do with my life thing Mother heard about that one thing that happened recently or whatever Some kinda stock going really big or whatever Keeps insisting I should try getting into stock and is offering to give me starting money I don t want to disappoint her but I honestly don t give a fuck about stocks So what is a relatively safe way to go about things that doesn t require a ton of intelligence Hell relatively safe isn t even needed I m fine with risk Otherwise I d stick to the more reasonable stock subs 
525,nao20w,t2_9kn1dfum,1620824323,/r/wallstreetbets/comments/nao20w/any_current_thoughtsintel_on_cvm/,1,any current thoughts intel on cvm ,
526,nao2g2,t2_8q4r5399,1620824364,/r/wallstreetbets/comments/nao2g2/feg_98_market_cap_and_quadruple_digit_gains_last/,1,FEG 98 market cap and quadruple digit gains last couple weeks Get in on the ground floor and ride it to the ,
527,nao2mt,t2_axu7rvq6,1620824380,/r/wallstreetbets/comments/nao2mt/veru_earnings/,1, VERU earnings,
528,nao3ez,t2_6aaqpzy8,1620824427,/r/wallstreetbets/comments/nao3ez/pnnx_pennexx_has_entered_into_a_joint_marketing/,1, PNNX Pennexx Has Entered Into a Joint Marketing Agreement With One of the Fastest Growing Business Solutions Companies in the 74 Billion Worldwide Payment Processing Market Hybrid Business Solutions, removed 
