,postid,author,created_utc,permalink,score,title,selftext
281,kz4bp6,t2_4au5ndyi,1610880413,/r/wallstreetbets/comments/kz4bp6/gme_retards_peak/,1,GME Retard s Peak ,Dear Retards Chers Retards Queridos Retrasados Drogie Niedorozwoje Given that I ve been on vacation since Xmas and haven t written a lengthy patronising email in what feels like forever I figured I might spew out a few words here You see in every large sample of people statistically you will find some special individuals on both sides of the IQ spectrum You have your NASA employee of the month and then the guy who thinks drinking bleach can protect him from COVID We ve become so used to affectionately calling each other retards that we seem to forget that among the 1 9mln WSB degenerates a lot of whom are very smart people there are bound to be some actual full on fucking retards You wouldn t trust them with a pair of scissors and so you certainly shouldn t leave them alone with tricky finance decisions either We are a family though and not the kind that gives a retard up for adoption With that said given the amount of shit posting about how a GME squeeze is bound to happen on Tuesday I feel obligated to stress that in saying so we are all setting ourselves up for disappointment It is much better to chill the fuck out and be pleasantly surprised rather than spend your days posting rocket emojis only to find out that Tuesday brought virtually no change to GME share price while Wednesday actually resulted in a 5 decline I haven t been trading for too long but long enough to notice that the market is full of curveballs and unexpected news And that for every WSB hype train which made everyone money there are ten which went tits up real bad What is more if you genuinely strongly believe that Tuesday is THE DAY you are more likely to end up being a paper handed little bitch and sell if things don t go according to plan If you stop fixating on a particular plan date it s much easier to learn to be a diamond handed badass Now at the risk of sounding like one of them r investing twats it is a lot easier to implement all of the above if you just buy shares Throwing a few thousand bucks into ridiculous FDs for next week only to sell them at a 50 loss when shit hits the fan really doesn t help anyone The same people who will tell you that we will have an unprecedented infinite squeeze on Tuesday will show you a VW squeeze chart and say that we ve had a big decline in price on a Friday before a long weekend Well if it s an unprecedented squeeze it will follow it s own path and the VW chart has fuck all to do with it You believe these things because you ve been fucked by the system or a big company a few times you re hoping to fuck them back It s understandable You will only succeed if you re smart about it though Don t throw money that you cannot afford into risky calls that you will paper hand when you can buy shares and patiently wait to be 10 100 times more rich WHEN THE TIME COMES I strongly believe it will come but I doubt it will be this week Keep in mind that the flacid shorts gagging on that tiny Melvin dick are just as sure of a positive outcome as us bulls with our throbbing foot long towers aka the envy of the showers I therefore think that we will see nothing interesting happen this week in a typical WSB anticlimax Sooner or later though we will ride so hold on to your shares and believe Position 1060 shares 12 32 avg cost TL DR Buy GME shares and hold Try to be less retarded and don t believe anything that s said to be 100 bound to happen 
282,kz4emi,t2_suropry,1610880818,/r/wallstreetbets/comments/kz4emi/schedule_for_the_moon_departure/,1,Schedule for the Moon departure , removed 
283,kz4h73,t2_54zb8rw3,1610881182,/r/wallstreetbets/comments/kz4h73/retard_vs_autist/,1,Retard VS Autist,
284,kz4h99,t2_2ugb5dg4,1610881190,/r/wallstreetbets/comments/kz4h99/buying_gme_on_monday_since_im_not_from_the_us/,1,Buying GME on Monday since I m not from the US, removed 
285,kz4iuw,t2_4z6oeoth,1610881372,/r/wallstreetbets/comments/kz4iuw/for_all_those_educated_on_the_game_plan_for_gme/,1,For all those educated on the game plan for GME what are we doing and how will we achieve success , removed 
286,kz4jep,t2_5f67llge,1610881433,/r/wallstreetbets/comments/kz4jep/i_really_love_this_old_gme_article_when_first/,1,I really love this old gme article when first came out and think it s worth a reread even if you read before , removed 
287,kz4k2e,t2_9ukpkdhk,1610881517,/r/wallstreetbets/comments/kz4k2e/you_guys_neet_to_check_out_the_austrian_oil/,1,You guys neet to check out the Austrian oil supplier sbo if you love pumping up bankrupt companies without solid balance sheets imagine what you could do to an undervalued company with solid financials, removed 
288,kz4njk,t2_2y0752j4,1610881989,/r/wallstreetbets/comments/kz4njk/traders_be_like/,1, traders be like ,
289,kz4sqa,t2_47e010ms,1610882679,/r/wallstreetbets/comments/kz4sqa/some_charts_about_our_glorious_subreddit/,1,Some charts about our glorious subreddit,
290,kz4u1q,t2_2u8ysycb,1610882856,/r/wallstreetbets/comments/kz4u1q/hey_i_am_a_beginning_autistmongoloid_would_you/,1,Hey I am a beginning autist mongoloid would you answer quick question ,https old reddit com user AMZN I am trying to learn to be one of your kind What he actually did He bought TSLA 01 15 1000C 55 contracts 5500 shares Buying a call you only risk to lose money that you used to buy this call right No more Is 1000 a strike price It is also his dreams of TSLA hitting 1000 or past 1000 when 01 15 pass How much he paid for this option Is he loosing all those red numbers Or is it just how much his alleged 5500 shares fell down Please don t ban or hate me 
291,kz4w4i,t2_5rvx0v9j,1610883127,/r/wallstreetbets/comments/kz4w4i/new_here_slightly_retarded_what_should_i_do/,1,New here slightly retarded what should I do ,So I have circa 50 shares in GME and want to buy shed loads more ASAP as long as the price is around 40 or less I ve read so many posts this weekend about holding and shorts and frogs and rockets but I can t understand the clear gameplan Should I be looking to sell if the price gets up to 500 or whatever on Tuesday Wednesday or is that when I m supposed to bite down and hold into the future And if so what are we talking days weeks months Thanks for the advice and heads ups Suds
292,kz4yf7,t2_31cp5b76,1610883443,/r/wallstreetbets/comments/kz4yf7/are_the_americans_betting_on_thescore_or_just_us/,1,Are the Americans betting on TheScore or just us Canucks , removed 
293,kz50rb,t2_9sd3h4cf,1610883769,/r/wallstreetbets/comments/kz50rb/hey_guys_im_new_into_this_shit_and_im_trying_to/,1,Hey guys I m new into this shit And I m trying to understand something on how this GME stuff works And as some guys wrote markets in the us are closed on Monday but in Germany and the eu markets they are open Does this have any impact on the price and How gme will Fall or rise , removed 
294,kz52s1,t2_3mobq2ab,1610884049,/r/wallstreetbets/comments/kz52s1/what_would_happen_if_a_tsla_would_do_this/,1,What would happen if a TSLA would do this ,
295,kz53kn,t2_5c62y1gj,1610884154,/r/wallstreetbets/comments/kz53kn/wall_street_bet/,1,Wall Street bet, removed 
296,kz5412,t2_na6d2,1610884215,/r/wallstreetbets/comments/kz5412/retards_are_buying_the_wrong_signal_stock_im/,1,Retards are buying the wrong Signal stock I m looking at you guys ,
297,kz54di,t2_179ri7,1610884258,/r/wallstreetbets/comments/kz54di/best_way_to_buy_gme_at_market_open_on_tuesday/,1,Best way to buy GME at market open on Tuesday , removed 
298,kz54sv,t2_9cdzwhjd,1610884320,/r/wallstreetbets/comments/kz54sv/cardano_its_not_a_discussion/,1,Cardano its not a discussion, removed 
299,kz56wi,t2_dhw5h,1610884594,/r/wallstreetbets/comments/kz56wi/please_help_me_win_a_bet_and_i_will_send_you_my/,1,Please help me win a bet and I will send you my bottle of Teslaquila I need to maximize a return on 3 000 in the next 30 days If you come up with the idea that helps me win this bottle is yours I will show proof of gain loss for the idea that is chosen ,
300,kz56wi,t2_dhw5h,1610884594,/r/wallstreetbets/comments/kz56wi/please_help_me_win_a_bet_and_i_will_send_you_my/,1,Please help me win a bet and I will send you my bottle of Teslaquila I need to maximize a return on 3 000 in the next 30 days If you come up with the idea that helps me win this bottle is yours I will show proof of gain loss for the idea that is chosen ,
301,kz5b34,t2_7by4429h,1610885095,/r/wallstreetbets/comments/kz5b34/there_probably_is_no_market_bubble_burst_in_the/,1,There probably is no market bubble burst in the near future here s why,Yo retards I study finance and economics and today I ve been reading about macro indexes for comapnies It s nothing new I just thought someone may learn new from this and I also consolidate my knowledge doing that We see massive amount of headlines saying the burst is behind the corner 1one1 on daily basis If you take a look at most popular economy measures everything is alright Let s analyze it together 1 GDP US GPD per capita is still raising There was a dip in 2008 and Q1 2020 for obvious reasons Now we see rising trend and analysts estimate it to keep raise at least for the next few years The simple rule says that if the GPD drops for 2 years or more the recession is coming Processing img yfczasjnnvb61 2 Unemployment it went up drastically last March but it has improved by 8 already The trend is more important in unemployment than the numbers itself the chart flattened in Dec but it still doesn t indicate recession in any means https preview redd it lhpbazs6ovb61 png width 969 amp format png amp auto webp amp s 5dced81a0bea23574894d71a98af5c252a0a4c54 3 Number of job openings recovered since rona panic There was a little decrease in November but nothing serious https preview redd it 8muq8fs5pvb61 png width 756 amp format png amp auto webp amp s b443f5c72bbbdbfaf49276d0935932ceaedb984a 4 Number of new businesses go up means bull s balls are growing Good for economy amp x200B https preview redd it lu34p8h2qvb61 png width 641 amp format png amp auto webp amp s 55a9c3579576489b40ca60672821b4c75b158be6 5 Rent prices rose in all categories besides Studios good for economy I know people say landlords bad but if the prices rise it means that there s demand for it and people are ready to pay that much https preview redd it 699kahgoqvb61 png width 1216 amp format png amp auto webp amp s d33c7aaed7fad4a9d0d0562290e6d10ed9bf504d Trade deficit it s actually bigger and bigger but fuck that Who s gonna execute that from US No one amp x200B https preview redd it rncavbrvrvb61 png width 721 amp format png amp auto webp amp s fc65b553ecee98956f4e42aae431b25d0a508d15 7 Industrial production growth rate rising n1ce https preview redd it xofbwl1osvb61 png width 758 amp format png amp auto webp amp s fb335765f499fac14df88f9b48eab1dc33176305 amp x200B 8 Inflation rates good Everything around 1 2 is demanded There has to be a minimal inflation for economy to grow Processing img arsumas7uvb61 8 SPY is raising STONKS GO UP of course amp x200B Conclusion Fook gay beraz We are going to swim in the fucking money No recession in the near future 
302,kz5lvl,t2_3vcz69mm,1610886495,/r/wallstreetbets/comments/kz5lvl/just_some_analysis_on_udeepfuckingvalue_trades_of/,1,Just some analysis on u DeepFuckingValue trades of GME,Dear retards I have been doing some analysis on how underlying price affects long dated call options price and could not find a better way to go than to look at the trades of u DeepFuckingValue in GME Attached are some of the screenshots of how things moved from month to month Green boxes are the individual positions while black boxes are the overall G L This is the some of my initial screenshots More to follow if people find anything useful in this https preview redd it 8sdzzq9zyvb61 png width 2376 amp format png amp auto webp amp s da86bd52af77cdb370024a7543caccf473d7f36d https preview redd it 7jjhmz9zyvb61 png width 2376 amp format png amp auto webp amp s 874736742626c02d8591f3cddc0d227c03913b08 Processing img 9g5s70azyvb61 
303,kz5nbs,t2_72z8yt57,1610886683,/r/wallstreetbets/comments/kz5nbs/ford_is_latest_carmaker_to_cut_production_due_to/,1,Ford is latest carmaker to cut production due to chip crunch ON gang to the MOON ,
304,kz5tbn,t2_774q1w37,1610887442,/r/wallstreetbets/comments/kz5tbn/cathie_wood_is_among_elon_musk_100_accounts_that/,1,Cathie Wood is among Elon Musk 100 accounts that he follows,Ark Investment recently just bought 497 100 shares of Palantir and Cathie wood is head of this ETF We know that papa musk is very active on twitter and makes stonks whenever he does something over there amp x200B Processing img ntflqkdh1wb61 Let s just wait for some interaction between those two to make tsla pltr baby 
305,kz5y1i,t2_jib7qp,1610888029,/r/wallstreetbets/comments/kz5y1i/saveamc_trending_on_twitter_amc_short_squeeze_is/,1, saveAMC trending on twitter AMC short squeeze is going to be 10x GME ,
306,kz5y5h,t2_14b9v9,1610888043,/r/wallstreetbets/comments/kz5y5h/cciv_cucks_all_aboard_the_skyrail/,1,CCIV CUCKS ALL ABOARD THE SKYRAIL, removed 
307,kz60e5,t2_4d70g,1610888323,/r/wallstreetbets/comments/kz60e5/gme_possible_scenarios_fomo_and_exit_plans/,1,GME possible scenarios FOMO and exit plans ,TL DR No You will have to read this one It took a lot of research and typing to prepare this for you But personally I m a GME believer and it WILL fly So you bought GME shares because strangers online told you to and you begin to ask yourself if you are retarded The answer is yes yes you are But there is a good chance you are a lucky retard If you are FOMO guy you have to decide which scenario is more likely and enter if you believe in happy endings There is a lot of noise regarding GME and there is barely any good DD anymore This is why I decided to put this together You have to keep in mind that I am a retard myself and not an OG GME gang I entered GME in January paper handed in worst possible moment because I thought squeeze has sqoze I am now back in the game and reinvested my profit and more back into GME Only reason why I feel competent to do this is because a I read a lot about GME and shovel through all the noise to find meaningful info b apparently no one else is willing to do it properly So here it goes from the worst case to the best All possible scenarios I can think of If I miss anything or I messed something up please let me know and I will update this list This is not a financial advice You have to make up your own mind and if you can actually read do your own research WE ARE FUCKED scenarios Ryan Cohen played us all In this scenario RC sells or already sold his shares We have been duped and it all has been pump and dump We are all royally fucked For this scenario RC despite what you can read around here is not your actual daddy He is a business man looking to make profit Against this scenario RC is fucking rich and if he wanted he could already retire It would ruin his credibility How do we know it is happening We learn through official paperwork that RC sold his shares price reaches near 0 within minutes My personal opinion Near zero chance this happens But if its does Price Target PT is very low Shorters pull a fast one on us In this scenario institutions find a way to squeeze margin positions outplay options and wait out long positions For this scenario They have written the rules of the game and honestly they know much better how to play it then us Against this scenario If they could do it they would probably have already done it instead of loosing almost a billion in optoions last Friday How do we know it is happening Serious price drop on Tuesday despite short restrictions Price falls in following days below 20 per share and refuses to come back up for a very long time My personal opinion Non zero chance this happens It is possible But IMO unlikely because I believe that if they could save their options they would have done it already PT uncertain but definitely below 20 10 15 if I had to guess Neutral scenarios We are in a deadlock aka neutral but actually bad In this case old shorts are actually covered and we have new shorts on our hands Price volatility and actual price slowly decrease Both sides play a waiting game RC and GME are radio silent for few months For this scenario Institutions has already proven that they are committed to their shorts And they will not admit defeat Shorts have more money and patience If shorts are replaced by new ones they will not bleed but that s unlikely We believe but a lot of us have paper hands and or can t afford to keep cash frozen to wait this out Hype will die down and with it our conviction Against this scenario If the price settles above 30 or even better above 35 shorts will bleed money If the price remains low 30 or below there may come other large investors for a long position after they realize that this is a good value investment This would trigger good scenarios How do we know it is happening Price volatility decreases over next week or two and settles probably somewhere between 25 and 35 My personal opinion Honestly I m mostly afraid of this scenario But at the same time it s not very likely that shorts are replaced Then again if nothing major happens relativly soon this is still a likely scenario PT 25 30 for months to come until one side wins We are in a deadlock aka neutral but actually good In this case price volatility slowly decreases and both sides play a waiting game RC and GME are radio silent for few months But in this scenario we overcome our collective retardation and show how strong we are through our unity Price slowly rises over next months as shorts slowly close their positions For this scenario If the price settles above 30 or even better above 35 shorts will bleed money and will be One should never underestimate autists Against this scenario United retards with diamond hands Retail investors are market makers I want to believe that we have that power but lets keep it real How do we know it is happening Price volatility decreases over next week or two and settles probably somewhere between 25 and 35 But the trend will become upward after that My personal opinion Hard to say I think some actually good scenarios are more likely then this one Good scenario Slow and steady short squeeze We win Shorts are out of ammo Friday dip was their last hail Mary to stop loses on their puts and are forced to close their position GME begins it s burn to the moon For this scenario Shorts are already kind of fucked Big investment firms have proven many times before that they are arrogant and they can be very wrong GME is shorted into oblivion and unless it declares bankruptcy in next weeks or months they will HAVE to exit Any good news will make this only more likely like new investor reveals that they are getting involved for a long position Against this scenario Like I said before we don t exactly know what shorts could have up their sleeve If shorts are replaced by new ones they will not be forced How do we know it is happening Price jumps on Tuesday and continues the trend more slowly later even without short restrictions My personal opinion It s likely and this is my bet PT very hard to say but could be anywhere between 60 and 200 or even way more in next weeks or months Mother of all Short Squeezes We make history It turnes out RC actually is your father In next few days or weeks he reveals his master plan and shorts are royally fucked They will sing songs about us For this scenario All of the good scenarios fors but the good news is actually something big RC or GME reveals that sends shorts running for their life Against this scenario RC signed a document that prohibits him from acquiring more then 20 shares and while float is low compared to shorts it s not enough for MOASS How do we know it is happening Price opens at 200 or 400 and only goes up PT a random number between 420 69 and infinity Sorry FOMO guys the rocket is already past Jupiter My personal opinion I and many others dream that RC drops a bomb before Tuesday but I honestly give this maybe 10 chance of happening My position 254 long shares at 35 90 205 leveraged shares at 36 48 Don t judge me I am europoor 
308,kz66t9,t2_8yrdesds,1610889042,/r/wallstreetbets/comments/kz66t9/latest_short_interest_for_gme/,1,Latest short interest for GME ,
309,kz694g,t2_9n4ctvml,1610889316,/r/wallstreetbets/comments/kz694g/help_an_autist_out_referral_jhatley23_all/,1,Help An Autist Out referral jhatley23 all lowercase ,
310,kz6aj4,t2_6wt5sepj,1610889478,/r/wallstreetbets/comments/kz6aj4/icln_to_the_moon_retards/,1,ICLN TO THE MOON RETARDS ,
311,kz6bye,t2_4qtw14o0,1610889639,/r/wallstreetbets/comments/kz6bye/wsb_recommended_stocks_green_versus_my_picks_red/,1,WSB recommended Stocks green versus my picks red Thanks idiots ,
312,kz6hpv,,1610890329,/r/wallstreetbets/comments/kz6hpv/the_the_sun/,1,The the sun, deleted 
313,kz6k8c,t2_4q471urz,1610890620,/r/wallstreetbets/comments/kz6k8c/this_sub_and_gme/,1,This sub and GME,
314,kz6q5r,t2_4q471urz,1610891306,/r/wallstreetbets/comments/kz6q5r/this_sub_and_gme/,1,This sub and GME,
315,kz6qms,t2_4q471urz,1610891361,/r/wallstreetbets/comments/kz6qms/this_sub_and_gme/,1,This sub and GME,
316,kz6r6d,t2_99d697qt,1610891422,/r/wallstreetbets/comments/kz6r6d/is_it_too_late_to_invest_in_gme/,1,Is it too late to invest in GME , removed 
317,kz6s1t,t2_16dwvnnp,1610891523,/r/wallstreetbets/comments/kz6s1t/squeeze_on_gme_bears_13th_january/,1,Squeeze on GME Bears 13th January,
318,kz6s2y,t2_9n0pnbx1,1610891527,/r/wallstreetbets/comments/kz6s2y/china_water_affairs_group/,1,China Water affairs Group, removed 
319,kz70o6,t2_6nxv6,1610892415,/r/wallstreetbets/comments/kz70o6/new_autist_here/,1,New Autist Here, removed 
320,kz71e5,t2_1pcxqy6x,1610892492,/r/wallstreetbets/comments/kz71e5/a_night_at_the_gmebury/,1,A Night at the GME bury , removed 
321,kz7205,t2_11epmt,1610892556,/r/wallstreetbets/comments/kz7205/htbx_full_dd_summary/,1, HTBX Full DD Summary, removed 
322,kz72dx,t2_1zwc1eee,1610892599,/r/wallstreetbets/comments/kz72dx/a_rwallstreetbets_gme_story_as_told_by_the_black/,1,A r wallstreetbets GME story as told by the Black Eyed Peas,
323,kz72o9,t2_11epmt,1610892627,/r/wallstreetbets/comments/kz72o9/htbx_full_dd_summary/,1, HTBX Full DD Summary, removed 
324,kz73zm,t2_728ob,1610892765,/r/wallstreetbets/comments/kz73zm/have_an_exit_strategy_for_gme/,1,Have an exit strategy for GME,No this is not a post This is a post reminding you that you need to know when to get off the rocket If you look at the short squeeze of VW in 2008 you ll see the massive spike and then a slightly higher trading price than before If you think you ll get off at the peak you re wrong Some will but most won t You ll probably be too busy massaging your wife s bull or driving to the store to pick up more of his condoms to notice that the spike happened It lasted for a day You will watch the price go up and up think about all the lambos you will buy and when you check robinhood again you missed it The price never reached 420 69 Maybe it hit 420 54 Or 419 73 And you fucking missed it Maybe your strategy is to take a week off of work and keep your eyes on the stock Maybe you have a trailing stop set Maybe you re just along for the ride and plan on taking gains after the spike Whichever it is make sure you know when you ll get off 
325,kz7423,t2_33fyx4vg,1610892773,/r/wallstreetbets/comments/kz7423/looking_for_opinions_on_whether_american_airlines/,1,Looking for opinions on whether American Airlines AAL recently approved deal with Jet Blue could rally AAL enough this week and force some of its almost 50 short positions to cover give us a good spike to play ,
326,kz7496,t2_30ivkzgk,1610892797,/r/wallstreetbets/comments/kz7496/although_this_week_goes_to_gme_papa_elon_taking/,1,Although this week goes to GME Papa Elon taking us to Mars An outlook for 2021,
327,kz74g0,t2_16dwvnnp,1610892819,/r/wallstreetbets/comments/kz74g0/squeeze_on_bears_gme_13th_january/,1,Squeeze on Bears GME 13th January,
328,kz74h7,t2_7mmr5ghw,1610892821,/r/wallstreetbets/comments/kz74h7/how_much_buying_power_does_wsb_have/,1,How much buying power does WSB have , removed 
329,kz7779,t2_dnmzd,1610893110,/r/wallstreetbets/comments/kz7779/attack_on_melvin_the_endgame/,1,Attack on Melvin The Endgame,
330,kz77fv,t2_93fijfh4,1610893136,/r/wallstreetbets/comments/kz77fv/stop_comparing_gme_to_vw_or_tsla_every_squeeze_is/,1,Stop comparing GME to VW or TSLA every squeeze is different YOU PROBABLY WONT GET TO QUIT YOUR JOB ON TUESDAY ,Stop the comparing The chances GME hits 420 next week is slim to nine Melvin Capital isn t PORSCHE and you re not VW NEITHER PARTY IN THE BATTLE FOR GME ARE COLD BLOODED GERMAN AUTO MAKERS WITH DIAMOND HANDS This squeeze will play out more like TSLA It will be long and drawn out Might take months or years That s why YOU DONT FUCK WITH FDs because unless your timing is perfect you ll lose Wanna play options Then buy one out a YEAR and hold like DFV Lemme guess you re too impatient Just buy some shares and enjoy the ride shares are equities with no expiration and yes they have that on RH 
331,kz77la,t2_4gkpecyz,1610893155,/r/wallstreetbets/comments/kz77la/mr_beast_is_supporting_gme_as_a_consumer_lets/,1,Mr Beast is supporting GME as a consumer Let s Empty the wallets of GME bears ,
332,kz77pr,t2_4ijro92g,1610893169,/r/wallstreetbets/comments/kz77pr/inorganic_brand_engagement_an_autistic_sah/,1,Inorganic brand engagement An autistic sah, removed 
333,kz788u,t2_xg6xn,1610893223,/r/wallstreetbets/comments/kz788u/tuesday_is_coming_children_gme_gme_gme/,1,TUESDAY IS COMING CHILDREN GME GME GME ROCCCKEKEEETTTSSSSSSSSSSSSS,
334,kz797j,t2_h8lm54w,1610893320,/r/wallstreetbets/comments/kz797j/goev_canoo_dd_its_free_money/,1,GOEV Canoo DD It s free money ,
