,postid,author,created_utc,permalink,score,title,selftext
0,kywoe9,t2_6npjl18t,1610848305,/r/wallstreetbets/comments/kywoe9/we_need_your_buying_power_and_diamond_hands_for/,1, WE NEED YOUR BUYING POWER AND DIAMOND HANDS FOR GME RETARDS ,GME is a once in a lifetime opportunity for unlimited tendies we need and as much shares held by WSB as possible We re gonna make Melvin and the shorts go bankrupt and become rich on their back if this squeezes Buy a bunch of shares not on margin if possible No matter what and set a high sell limit to make big profits if GME squeezes don t lowball your shares TLDR GME Also I have 59 Shares will add at least 30 more on Tuesday I m a broke college student 
1,kywp4p,t2_2c0meyty,1610848372,/r/wallstreetbets/comments/kywp4p/rip_melvin_the/,1,RIP Melvin amp The ,
2,kywpex,t2_yz4hd,1610848400,/r/wallstreetbets/comments/kywpex/bb_has_patentinfringement_claims_on_over2000/,1, BB has patent infringement claims on over 2000 companies, removed 
3,kywpij,t2_y0pz6,1610848409,/r/wallstreetbets/comments/kywpij/actual_irl_autist_just_checking_in_with_my_fellow/,1,Actual IRL Autist just checking in with my fellow retards to make sure you do you part in the GME wars in for 320 36 24 This is my small man YOLO with nothing to eat but Ramen for the next 2 weeks Make it happen boys ,
4,kywprk,t2_h0a3ghu,1610848435,/r/wallstreetbets/comments/kywprk/yolo_in_marking/,1,YOLO In Marking, removed 
5,kywpuy,t2_8wgxi7ly,1610848444,/r/wallstreetbets/comments/kywpuy/gme_new_leadership_analysis/,1,GME New Leadership Analysis, removed 
6,kywr51,t2_2c0meyty,1610848572,/r/wallstreetbets/comments/kywr51/rip_melvin_the/,1,RIP Melvin amp The ,
7,kywri4,t2_y0pz6,1610848606,/r/wallstreetbets/comments/kywri4/actual_irl_autist_just_checking_in_with_my_fellow/,1,Actual IRL Autist just checking in with my fellow retards to make sure you do you part in the GME wars in for 320 36 24 This is my small man YOLO with nothing to eat but Ramen for the next 2 weeks Make it happen boys ,
8,kywrjf,t2_pywez,1610848610,/r/wallstreetbets/comments/kywrjf/i_am_scared/,1,I am Scared, removed 
9,kywrsk,t2_5vuylom2,1610848635,/r/wallstreetbets/comments/kywrsk/gme_to_the_moon/,1,Gme to the moon ,
10,kyws35,t2_3fymuzue,1610848663,/r/wallstreetbets/comments/kyws35/financial_advisor_fees/,1,financial advisor fees, removed 
11,kywste,t2_57owlpbo,1610848731,/r/wallstreetbets/comments/kywste/letsgoooo_tendies/,1,LETSGOOOO TENDIES,
12,kywtxu,t2_57owlpbo,1610848828,/r/wallstreetbets/comments/kywtxu/letsgoooo_tendies/,1,LETSGOOOO TENDIES,
13,kywu0e,t2_83ops9k1,1610848835,/r/wallstreetbets/comments/kywu0e/started_at_500_something_and_now_im_at_900/,1,Started at 500 something and now I m at 900 hopefully I hit 1000 by next week All I did was buy some calls and sold some puts here and there and they worked out in my favor Options still new to me but I m learning little by little hopefully I get this acc to 10k one day,
14,kywu7y,t2_3fymuzue,1610848856,/r/wallstreetbets/comments/kywu7y/financial_advisor/,1,Financial Advisor, removed 
15,kywuyg,t2_bxtjrrg,1610848921,/r/wallstreetbets/comments/kywuyg/almost_out_of_the_hole_im_thinking_of_buying_gme/,1,Almost out of the hole I m thinking of buying GME Tuesday Should I get calls or shares ,
16,kywvvw,t2_7e0y9xg9,1610849008,/r/wallstreetbets/comments/kywvvw/upcoming_yolo_ccl_carnival_cruise_corp/,1,Upcoming YOLO CCL Carnival Cruise Corp ,I need opinions Because in my opinion nuff said Processing img ckixpdr4vsb61 
17,kywwdn,t2_6mdyg,1610849054,/r/wallstreetbets/comments/kywwdn/most_realistic_gme_scenario/,1,Most realistic GME scenario ,I see a bunch of DD and predictions for GME next week and I d like to clear up a few misconceptions I m am expert at TA so I apologise in advance if I lose you Ok here it goes Next week GME will TL DR Thanks for reading and good luck 
18,kywwnw,t2_c1ty1,1610849080,/r/wallstreetbets/comments/kywwnw/let_me_teach_you_boys_what_palantir_actually_does/,1,Let me teach you boys what Palantir actually does, removed 
19,kywxna,t2_57owlpbo,1610849169,/r/wallstreetbets/comments/kywxna/letsgooooo_tendies/,1,LETSGOOOOO TENDIES,
20,kywykh,t2_4dlwn6u2,1610849257,/r/wallstreetbets/comments/kywykh/balls_deep_boys_gme_to_the_moon/,1,Balls deep boys GME to the moon ,
21,kywymk,t2_c1ty1,1610849263,/r/wallstreetbets/comments/kywymk/let_me_teach_you_boys_what_palantir_actually_does/,1,Let me teach you boys what Palantir actually does, removed 
22,kywzfr,t2_9rn79dib,1610849334,/r/wallstreetbets/comments/kywzfr/how_to_trade_a_short_squeeze_thought_this_video/,1,How to Trade a Short Squeeze thought this video was helpful could this be applied for GME ,
23,kywzri,t2_ru71z,1610849365,/r/wallstreetbets/comments/kywzri/melvins_games/,1,Melvin s games, removed 
24,kyx0a8,t2_c1ty1,1610849411,/r/wallstreetbets/comments/kyx0a8/let_me_teach_you_boys_what_palantir_actually_does/,1,Let me teach you boys what Palantir actually does,You see A palant r p l n t r pl palant ri is a fictional magical artefact from J R R Tolkien s Middle earth legendarium A palant r from Quenya palan far tir is described as an indestructible ball of crystal used for communication and to see events in other parts of Arda whether past or future The palant ri were made by the Elves of Valinor in the First Age as told in The Silmarillion By the time of The Lord of the Rings at the end of the Third Age the few palant ri remaining in existence are used in some climactic scenes by major characters Sauron Saruman Denethor the Steward of Gondor and two members of the Fellowship of the Ring Aragorn and Pippin A major theme of palant r usage is that while the stones show real objects or events those using the stones had to possess great strength of will and of mind to direct the stone s gaze to its full capability For others attempting to use the palant r the stones were often an unreliable guide to action since to them it was unclear whether events shown were past or future what was not shown could be more important than what was selectively presented amp x200B Fellow Aut st from this sacred knowledge upon which the foundations of the actual company of Palantir are based upon as suggested by the name we can conclude that we must possess great strength of will an mind to reach the full capability of the artefact or so called financial instruments these days amp x200B It is all so vividly clear now I didn t think I could do it but I actually did some proper DD TLDR PLTR to the moon confirmed by Tolkien long on 69 420 shares
25,kyx1ax,,1610849508,/r/wallstreetbets/comments/kyx1ax/tuesday_here_we_come/,1,Tuesday here we come, deleted 
26,kyx231,t2_41yrir4a,1610849582,/r/wallstreetbets/comments/kyx231/letsgooo_tendies/,1,LETSGOOO TENDIES,
27,kyx3dg,t2_4z6oeoth,1610849704,/r/wallstreetbets/comments/kyx3dg/wsb_shoving_it_right_up_melvin_capital_gme/,1,WSB shoving it right up Melvin Capital GME ,
28,kyx3e7,t2_fqxm8,1610849706,/r/wallstreetbets/comments/kyx3e7/watching_the_big_short_free_with_ads_and_getting/,1,Watching The Big Short free with ads and GETTING PUMPED for Tuesday What will the WSB GME movie be called ,
29,kyx3po,t2_6npjl18t,1610849737,/r/wallstreetbets/comments/kyx3po/we_need_your_buying_power_and_diamond_hands_for/,1, WE NEED YOUR BUYING POWER AND DIAMOND HANDS FOR GME RETARDS ,GME is a once in a lifetime opportunity for unlimited tendies we need and as much shares held by WSB as possible We re gonna make Melvin and the shorts go bankrupt and become rich on their back if this squeezes Buy a bunch of shares not on margin if possible No matter what and set a high sell limit to make big profits if GME squeezes don t lowball your shares TLDR GME Also I have 59 Shares will add at least 30 more on Tuesday I m a broke college student Please don t remove this one mods I can t put a tag on it for some reason 
30,kyx4jf,t2_6hc3g8s,1610849811,/r/wallstreetbets/comments/kyx4jf/urgent_please_help/,1,Urgent please help,I have about 100 a week to yeet at the lord and i suck at it I m in my early 30s with a loveless practically sexless marriage and two small shit kids Land in the middle of nowhere in Alaska is dirt cheap but logistics make it expensive to set up shop there regardless I want to abandon my family and live in the middle of nowhere like Kaczynski I m not a terrorist and wish no harm on anyone I just hate my life and want to die I see all the gain porn here and want someone to help me 
31,kyx5al,t2_8gf6mkxr,1610849885,/r/wallstreetbets/comments/kyx5al/cuomo_pitches_rapid_testing_to_open_restaurants/,1,Cuomo Pitches Rapid Testing to Open Restaurants Theaters AMC,
32,kyx5rc,t2_9dpzve1j,1610849927,/r/wallstreetbets/comments/kyx5rc/what_do_you_like_about_meme_stocks/,1,What do you like about meme stocks , removed 
33,kyx70y,t2_yaqrl,1610850049,/r/wallstreetbets/comments/kyx70y/gf_broke_up_with_me_today_but_shell_never_get_a/,1,GF broke up with me today but she ll never get a piece of this Thank you WSB for everything GME BB ,
34,kyx75t,t2_6x7vbbkz,1610850063,/r/wallstreetbets/comments/kyx75t/yoloing_into_stonks/,1,YOLOING INTO STONKS,
35,kyx7l3,t2_ecpgb,1610850102,/r/wallstreetbets/comments/kyx7l3/gme_the_short_squeeze_is_a_selffulfilling/,1,GME The short squeeze is a self fulfilling prophecy Let s unite and move together with one limit price, removed 
36,kyx7oc,t2_8xemp47f,1610850112,/r/wallstreetbets/comments/kyx7oc/look_ma_i_made_it/,1,Look ma I made it ,
37,kyx7t6,t2_rwz9oic,1610850125,/r/wallstreetbets/comments/kyx7t6/i_want_to_f_you/,1,I Want to F You,
38,kyxa3e,t2_feyni,1610850349,/r/wallstreetbets/comments/kyxa3e/why_are_we_alone_in_gme/,1,Why are we alone in GME , removed 
39,kyxacw,t2_95rfvbsd,1610850376,/r/wallstreetbets/comments/kyxacw/im_new_help/,1,I m new help , removed 
40,kyxblh,t2_7xd125v1,1610850499,/r/wallstreetbets/comments/kyxblh/what_is_your_guys_thoughts_on_cciv/,1,What is your guy s thoughts on CCIV , removed 
41,kyxdtp,t2_14zwnt,1610850723,/r/wallstreetbets/comments/kyxdtp/options_for_an_aspiring_autist/,1,Options for an aspiring autist, removed 
42,kyxeor,t2_6bzez9ia,1610850807,/r/wallstreetbets/comments/kyxeor/i_have_50k_how_do_i_best_help_the_gme_squeeze/,1,I have 50k how do I best help the GME squeeze , removed 
43,kyxeoz,t2_9s4onoym,1610850807,/r/wallstreetbets/comments/kyxeoz/whats_price_target_on_blackberry/,1,What s price target on blackberry, removed 
44,kyxfwy,t2_7uqii3qu,1610850923,/r/wallstreetbets/comments/kyxfwy/real_reason_baba_will_moon/,1,REAL reason BABA will MOON,TLDR There s 1 4 billion people waiting to buy BABA 9988 Alibaba is listed in HK and NYSE Regular Chinese retail investors and funds cannot purchase stocks outside of the mainland exchanges Imagine if Americans couldn t buy AMZN Would its share price even be half of what it is It d be at most 1 10th In September 2020 Alibaba was added to the Hong Kong Composite Index after which it could have been eligible for the Stock Connect program that let s mainland investors buy its HK shares Tencent has seen a large inflow into its HK stock after joining the program That s likely going to be delayed but eventually Alibaba will become accessible to mainland investors That s when the hype train starts My guess is 2021Q3 Alibaba is the safest tenbagger in existence 
45,kyxhfo,t2_7ldv45gv,1610851074,/r/wallstreetbets/comments/kyxhfo/the_unnofficial_wsb_fund_the_rainman_fund_gme/,1,The unnofficial WSB fund The Rainman fund GME PLTR NIO TSLA amp More , removed 
46,kyxkhf,t2_xs4sd,1610851369,/r/wallstreetbets/comments/kyxkhf/dont_forget_to_have_an_exit_strategy_in_case/,1,Don t forget to have an exit strategy in case things go south ,I haven t really been on this sub for long but I ve really enjoyed the discussions DD s YOLOs etc I was part of GME gang but my retarded ass sold my shares at 28 a profit is a profit though I can directly attribute my early sell to a lack of an exit strategy something I m planning on fixing with BB BB gang rise up If you re risk tolerance is retarded high then you can ignore this post because it s not going to change your view To anyone else who s on the sideline watching these crazy gains and are thinking I d love to buy stock XXX but then listen up These stocks are only really high risk if you don t have an exit strategy or don t know what you re doing When GME was going up I should have bought a put I hear you say Calm down you trilobites I was part of GME gang I like the company I want it to succeed But I also want peace of mind that no matter which direction GME goes I am covered GME is a very volatile stock right now Yes I understand the short squeeze hasn t happened yet and it s very likely going to skyrocket What happens when you try and sell the shares but they are illiquid as GME falls back to 20 What happens if the short squeeze happens overnight and you lost 40 of your account Pardon my autistic knowledge I don t know if that s possible or not Not saying it will happen but these are things you need to be cognizant of if you re yoloing 30 000 and that s your savings Wondering if it s too late to get into GME It probably isn t but it would be wise to cap your risk with trailing stops or Puts Let s destroy Melvin responsibly Take my situation with BB 50 shares bought at 10 77 I didn t really know much about the company so I bought a put at 10 for 1 10 because I wanted to protect myself Well my fellow Neanderthals I can sleep well no matter what BB does Tuesday The most I can lose is the 50 77 plus the premium Much better than the 500 I put in to buy the stock BB will only go one of two ways Gloriously up or gloriously down I want to be able to sleep no matter what it does If it goes up ill likely make my money back from the premium If it goes down because the market is controlled by a bunch of crabs then I m still mostly good I know I m advocating puts hard but it can be Trailing Stops or Limit sells or whatever you want Just have an exit strategy TLDR 
47,kyxlu3,t2_73ysr5g1,1610851493,/r/wallstreetbets/comments/kyxlu3/time_to_send_a_lionngato_the_moondaddy_bezos/,1,TIME TO SEND A LION NGA TO THE MOON Daddy Bezos buying , removed 
48,kyxlyr,t2_4wuyr,1610851505,/r/wallstreetbets/comments/kyxlyr/one_of_usone_of_usone_of_us/,1,One of us one of us ONE OF US ,
49,kyxmyy,t2_9ut2didb,1610851604,/r/wallstreetbets/comments/kyxmyy/made_an_website_weekly_fantasy_stock_pick/,1,Made an website Weekly fantasy stock pick competition Purely Entertainment Purposes , removed 
50,kyxn5w,t2_14azfk,1610851623,/r/wallstreetbets/comments/kyxn5w/ccivlucid_motors_merger_confirmed/,1,CCIV Lucid Motors Merger CONFIRMED ,
51,kyxnnz,t2_9a3owrp7,1610851672,/r/wallstreetbets/comments/kyxnnz/bumble_warns_apple_privacy_push_could_hurt/,1,Bumble warns Apple privacy push could hurt business in IPO filing,
52,kyxp10,t2_4dk1v86r,1610851805,/r/wallstreetbets/comments/kyxp10/only_a_matter_of_time_till_we_combine_forces/,1,Only a matter of time till we combine forces Reddit controls the market,
53,kyxpko,t2_2w3c6vt1,1610851859,/r/wallstreetbets/comments/kyxpko/buying_1000_tesla_shares_yolo/,1,Buying 1 000 tesla shares YOLO,
54,kyxqcw,t2_9utgupce,1610851931,/r/wallstreetbets/comments/kyxqcw/am_i_an_idiot_trader_or_am_i_destined_for_riches/,1,Am I An Idiot Trader Or Am I Destined For Riches , removed 
55,kyxqkt,t2_phsonbw,1610851953,/r/wallstreetbets/comments/kyxqkt/why_are_spacs_banned_here_they_are_literally_peak/,1,Why are SPACs banned here They are literally peak WSB fodder , removed 
56,kyxsma,t2_hlmphfz,1610852152,/r/wallstreetbets/comments/kyxsma/you_dont_know_why_palantir_is_tendie_town_haha_ok/,1,You don t know why Palantir IS tendie town Haha ok watch this,You think the U S Gov is ever gonna ditch this Chad Think again 3 21 35C 8 20 45C because premium is 4 20 hehe Processing video bg64kcqi3tb61 
57,kyxsyh,t2_73k9y65e,1610852188,/r/wallstreetbets/comments/kyxsyh/we_are_on_bloomberg_reddit_controls_the_market/,1, We are on Bloomberg Reddit controls the market ,
58,kyxtbb,t2_s7dulc8,1610852225,/r/wallstreetbets/comments/kyxtbb/eng_play/,1, ENG play ,I wanted to get in ENG at 3 and paper handed a 100 shares for a loss It s up over 300 since then and I m not really sure why other than every other AE ticker is I m bullish long term simply because it s an AE Texas ticker bunch of tech HW moving to Texas My 3 19 5c is up 500 and I m not sure if I exercise or sell and pile in GME 
59,kyxuzt,t2_8glvdnx6,1610852398,/r/wallstreetbets/comments/kyxuzt/attention_actual_retards_only_buy_shares_in_gme/,2,ATTENTION ACTUAL RETARDS ONLY BUY SHARES IN GME,Stop giving Melvin and all the short a way out of this squeeze And you wonder why your wife s boyfriend hates you They are throwing all of their tried and true boomer market manipulation tactics at us right now We are closing in on liftoff and every time a tard buys options instead of shares it siphons out a little more rocket fuel There is only one way to hit 420 69 and that is through buying shares Again shares moon tendies 
60,kyxvk0,t2_an45j,1610852439,/r/wallstreetbets/comments/kyxvk0/_/,1, , removed 
61,kyxy8b,t2_2jp2a1ni,1610852691,/r/wallstreetbets/comments/kyxy8b/another_kodak_moment_brought_to_you_bykodk/,1,Another Kodak moment brought to you by KODK, removed 
62,kyxzsc,t2_dec6c,1610852850,/r/wallstreetbets/comments/kyxzsc/i_built_a_website_a_weekly_fantasy_stock_picking/,1,I built a website A weekly fantasy stock picking contest purely for entertainment purposes , amp x200B Hey everyone I ve spent a good week or so developing this website so we have something to look forward to and to fiddle around with during the weekend when the market is closed Goal Achieve highest absolute gains in dollar value in 1 week monday friday Rules 1 Everyone starts out with 100 000 USD 2 The event registration opens every week from Friday 9pm Sunday 9pm During hours when market is closed Event Registration https preview redd it 42q6fja36tb61 png width 2936 amp format png amp auto webp amp s 8b4e2cf956b04ed40afb4d2b5091d80c04246c7d 3 The event goes live starting 4am on Monday and the it will start tracking the gains of each submission Home page when market is open tracking the profit amp loss https preview redd it qm7iqt056tb61 png width 3238 amp format png amp auto webp amp s dd9af9fc8c07676c152d9dee85c0438d01e97ffd TLDR Made a weekly fantasy stock picking website purely for entertainment purposes only All bug reports are very welcome 
63,kyxzui,t2_93gdry6t,1610852855,/r/wallstreetbets/comments/kyxzui/bois_you_know_what_to_do_wall_street_bets_traders/,1,Bois YOU KNOW WHAT TO DO Wall Street Bets Traders Are About To Be Crushed By GameStop , removed 
64,kyy08i,t2_5kkjevv1,1610852893,/r/wallstreetbets/comments/kyy08i/gme_is_the_next_gme/,1,GME is the next GME,
65,kyy3ih,t2_7b22e0oi,1610853203,/r/wallstreetbets/comments/kyy3ih/update_why_consider_bb_and_pltr_plays_rather_than/,1,Update Why consider BB and PLTR plays rather than GME,I bought shares of GME at 19 amd sold at 39 meeskly 4200 approx great profits Last short squeeze happened last monday Few managers and included director started to dump shares in excess of 2 millions or so So update about their shares is James wolf sold 810 000 shares v alued at 21 million dollars Vrabek sold 50 000 shares at 28 usd and still owns 79 537 shares Raul sold 34 619 shares at 35 28 and still owns 33 789 Shares Dunn s old 5 000 shares at 31 34 shares still has 57 258 shares Many others will follow and also Don t trust everyone is going to do what u see here that is posted Even when calls are not to be bought shares is some will just simply buy calls to profit off you There is 5 percent traders who win and 95 percent fail Also there are other people in management who still own shares and been selling throughout I hope not to see lot of wsb 99 percent loss posts in week or so People who are posting 420 69 limit sell guys there are better plays to play such as bb and pltr especially pltr since it has actual business to back it up and short selling squeeze is must in that whereas if you are left bag holding in GME it may not fair well 
66,kyy4s0,t2_wsmb9,1610853328,/r/wallstreetbets/comments/kyy4s0/gme_long_shares_that_can_be_sold_should_include/,1,GME long shares that can be sold should include the 75m short,Maybe I m very retard but when we calculate shares that can be sold shouldn t we consider the shares bought from the short sellers Total positive share 144m total shorted shares 75m total GME shares issued 69m So there are 144m shares longed Minus the 50m https www reddit com r wallstreetbets comments kyocql updated potential holdings of gme utm source share amp utm medium ios app amp utm name iossmf shares in there are still 94m shares can be sold back to the short sellers to cover their position Anything I m missing here Position 3000x shares and july 22C 
67,kyy682,t2_5egh0mus,1610853477,/r/wallstreetbets/comments/kyy682/gme_to_the_moon/,1,GME TO THE MOON ,
68,kyy6w7,t2_6inwrz74,1610853540,/r/wallstreetbets/comments/kyy6w7/what_are_some_stocks_wsb_has_predicted_wildly/,1,What are some stocks WSB has predicted wildly wrong on , removed 
69,kyy6xb,t2_5ip9okk4,1610853544,/r/wallstreetbets/comments/kyy6xb/cciv_got_you_lucid/,1,CCIV got you LUCID, removed 
70,kyy7yi,t2_2ufudjy2,1610853650,/r/wallstreetbets/comments/kyy7yi/wfc_buyback/,1,WFC BUYBACK , removed 
71,kyy8w4,t2_5zesd4h3,1610853737,/r/wallstreetbets/comments/kyy8w4/cron/,1, CRON ,
72,kyy9pb,t2_1347i1,1610853824,/r/wallstreetbets/comments/kyy9pb/ba/,1,BA , removed 
73,kyyag3,t2_2aw5dg4f,1610853894,/r/wallstreetbets/comments/kyyag3/anyone_else_notice_udeepfuckingvalue_removed_his/,1,Anyone else notice u deepfuckingvalue removed his latest posts Looks like someone took their profits and ran Good for him I would have too , removed 
74,kyyeaw,t2_9g84jo0x,1610854283,/r/wallstreetbets/comments/kyyeaw/my_teacher_won_big_but_how_big/,1,My teacher won big but how big , removed 
75,kyyen9,t2_9utczirz,1610854318,/r/wallstreetbets/comments/kyyen9/arkk_the_great_flood_is_coming/,1, ARKK The Great Flood is Coming,
76,kyyeqw,t2_6inwrz74,1610854329,/r/wallstreetbets/comments/kyyeqw/what_are_some_wsb_predictions_that_have_turned/,1,What are some WSB predictions that have turned out hugely wrong Failed bets,We all hear and know of the success stories here But let s talk about the ones that have been super hyped pumped and then tanked and never recovered and ended in absolute losses Do you guys have any stocks that come to mind That or have you personally entered in on a stock at a bad entry that you blame WSB for 
77,kyyf8y,t2_912u9eny,1610854382,/r/wallstreetbets/comments/kyyf8y/apple_gained_average_of_35_per_year_since_ipo/,1,Apple gained average of 35 per year since ipo 1981 Average annual gain of 44 per year since 2000 including com bubble burst now try to beat that,
78,kyyfh1,t2_4oldqpgo,1610854403,/r/wallstreetbets/comments/kyyfh1/amarin_amrn_has_a_lot_going_for_it/,1,Amarin AMRN has a lot going for it ,Amarin AMRN has been creaping up Last year it lost 76 of its value because a judge turned down its patent for its omega 3 cardiovascular medication So generics could duplicate it and under cut them Vascepa is the name of the drug But soon the European Commission will be ruling on whether they approve of it Also Canada too And in China it is moving to phase 3 This drug which is basically modified fish oil has been proven to dramatically reduce heart failure 25 35 reduction Market cap 4 6 billion 6 4 sold short Institutional ownership under 50 No side effects like anal leakage Potential to be a 10 billion dollar drug Have lawsuits against the generics because the have a patented delivery system Was 4 and change two months ago and has moved up to 6 presently 600 million in cash no debt Options are very inexpensive now New data from the REDUCE IT clinical trial REVASC analysis presented at the American Society for Preventive Cardiology Virtual Summit on CVD Prevention showed that the administration of 4 g day of Amarin s NASDAQ AMRN Vascepa icosapent ethyl resulted in a 34 reduction in first coronary revascularizations compared to placebo p lt 0 0001 Drugs are rarely this effective Do some digging 
79,kyyfv6,t2_3yi21n1q,1610854441,/r/wallstreetbets/comments/kyyfv6/obamid/,1,obamid,
80,kyyfyk,t2_5pbhz,1610854447,/r/wallstreetbets/comments/kyyfyk/a_great_flood_is_coming/,1,A Great Flood is Coming,
81,kyyg2o,t2_85ggocr2,1610854458,/r/wallstreetbets/comments/kyyg2o/gme_why_melvin_and_co_will_win/,1, GME Why Melvin and Co Will Win,If I see another fucking post of a screenshot of some retard who purchased GME calls and not shares I swear I will fucking hunt you down Mods should ban you for doing Melvin s work Those of you who have YOLO d and bought calls are going to sink all of us Idiots I ll leave you with a poem are only for are for holding shares Those buying calls will help Fuck you Don t be a fucking 
82,kyyg36,t2_o24n9,1610854459,/r/wallstreetbets/comments/kyyg36/whos_the_dumbest_person_youve_ever_met/,1,Who s the dumbest person you ve ever met , removed 
83,kyyg41,t2_5u8shwdv,1610854461,/r/wallstreetbets/comments/kyyg41/tlry/,1, TLRY ,
84,kyygsq,t2_8v31h902,1610854529,/r/wallstreetbets/comments/kyygsq/experiment_start_with_100_all_in_on_the_most/,1,Experiment Start with 100 All in on the most up voted trade ideas YOLOs and tendies Who s in , removed 
85,kyyhao,t2_983imcz3,1610854579,/r/wallstreetbets/comments/kyyhao/bitcoin_is_about_to_breakout_its_happening_its/,1,Bitcoin is about to breakout It s happening It s been a long wait for the Flagpole Penant Tomorrow morning we will awaken to tendies unlike anything ever seen before ,
86,kyyid4,t2_1dhpe0qk,1610854683,/r/wallstreetbets/comments/kyyid4/was_in_for_a_while_then_out_now_currently_back/,1,Was in for a while then out now currently back all in PLTR since genius MILF Cathy Wood deep dove in All shares clearly Looking forward to keeping you guys posted Should be an interesting week leading up to demo day ,
