,postid,author,created_utc,permalink,score,title,selftext
612,kzdggr,t2_169hb46y,1610912945,/r/wallstreetbets/comments/kzdggr/advice_for_options/,1,Advice for Options,How are we autists Ive been putting alot of time over the last few months studying and understanding the markets and simultaneousy raised my capital to 1k I was wondering if this is sufficient to do options Im sure there are many others wondering this so this would be helpful trading advice cheers
613,kzdgjj,t2_287m433t,1610912951,/r/wallstreetbets/comments/kzdgjj/we_all_know_what_that_means_daddy_cohen_guide_us/,1,We all know what that means daddy Cohen guide us ,
614,kzdgvp,t2_s68k3,1610912980,/r/wallstreetbets/comments/kzdgvp/bb_yahoo_finance_approved/,1, BB YAHOO FINANCE APPROVED , removed 
615,kzdh5r,t2_9gxf1gph,1610913004,/r/wallstreetbets/comments/kzdh5r/the_ideal_rate_scenario_for_tech_is_if_the_fed/,1,The ideal rate scenario for tech is if the Fed tolerates a slow rise in 10 year yields as the economy rebounds The aim would be to let the air out of the more speculative areas,
616,kzdia6,t2_32eqg,1610913099,/r/wallstreetbets/comments/kzdia6/melvin_vs_wsb_2_short_2_squeeze/,1,Melvin vs WSB 2 Short 2 Squeeze ,
617,kzdj0g,t2_k0a0q,1610913160,/r/wallstreetbets/comments/kzdj0g/they_mustnt_know_the_truth/,1,They Mustn t Know the Truth ,
618,kzdk1z,t2_8dn6uy59,1610913244,/r/wallstreetbets/comments/kzdk1z/but_what_does_it_mean/,1,But what does it mean ,
619,kzdk3q,t2_68ykf9bu,1610913248,/r/wallstreetbets/comments/kzdk3q/actual_footage_of_the_market_next_week_gme/,1,Actual footage of the market next week GME ,
620,kzdkl6,t2_92l60uot,1610913290,/r/wallstreetbets/comments/kzdkl6/going_to_the_fucking_moon_with_papa_cohen_fuck/,1,Going to the fucking MOON with papa Cohen FUCK THESE MOTHERFUCKING WALL STREET BITCHES UP ALOT OF FUCKING PR FARMING GOING ON DON T FALL FOR IT This is THE END GAME for THEM not US THEY got greedy NOT FUCKING US WE RE just making THEM PAY ,
621,kzdklx,t2_41brmtzv,1610913292,/r/wallstreetbets/comments/kzdklx/i_took_a_break_from_being_autistic_to_become/,1,I took a break from being autistic to become artistic,
622,kzdkvg,t2_4uvgdg0f,1610913315,/r/wallstreetbets/comments/kzdkvg/lucky_peanuts_gme/,1,Lucky Peanuts GME ,
623,kzdm5s,t2_4p0ab,1610913424,/r/wallstreetbets/comments/kzdm5s/virgin_orbit_successfully_launched_a_rocket_to/,1,Virgin Orbit successfully launched a rocket to orbit , removed 
624,kzdmav,t2_14z8x4l0,1610913436,/r/wallstreetbets/comments/kzdmav/pltr/,1,PLTR ,
625,kzdmms,t2_92l60uot,1610913463,/r/wallstreetbets/comments/kzdmms/were_going_to_the_fucking_moon_with_papa_cohen/,1,WERE GOING TO THE FUCKING MOON WITH PAPA COHEN STAND YOUR FUCKING LINE THE GREEDY WILL PAY THEY GOT GREEDY NOT FUCKING US ,
626,kzdmpa,t2_3yl6wib0,1610913468,/r/wallstreetbets/comments/kzdmpa/remember_when_the_dow_jumped_off_a_building/,1,Remember when the DOW jumped off a building ,
627,kzdmsn,t2_92l60uot,1610913476,/r/wallstreetbets/comments/kzdmsn/going_to_the_fucking_moon_with_papa_cohen_fuck/,1,Going to the fucking MOON with papa Cohen FUCK THESE MOTHERFUCKING WALL STREET BITCHES UP ALOT OF FUCKING PR FARMING GOING ON DON T FALL FOR IT This is THE END GAME for THEM not US THEY got greedy NOT FUCKING US WE RE just making THEM PAY ,
628,kzdn51,t2_92l60uot,1610913507,/r/wallstreetbets/comments/kzdn51/going_to_the_fucking_moon_with_papa_cohen_fuck/,1,Going to the fucking MOON with papa Cohen FUCK THESE MOTHERFUCKING WALL STREET BITCHES UP ALOT OF FUCKING PR FARMING GOING ON DON T FALL FOR IT This is THE END GAME for THEM not US THEY got greedy NOT FUCKING US WE RE just making THEM PAY ,
629,kzdneb,t2_64s1cnsu,1610913530,/r/wallstreetbets/comments/kzdneb/i_dont_really_understand_whats_going_on_but_i/,1,i dont really understand whats going on but i want to get rich on Gamestop with all of ya ll What buttons do I hit in Robinhood , removed 
630,kzdni8,t2_cnz4x,1610913539,/r/wallstreetbets/comments/kzdni8/ive_been_talking_about_gme_too_much_around_my/,1,I ve been talking about GME too much around my parents ,
631,kzdou4,t2_vf956,1610913634,/r/wallstreetbets/comments/kzdou4/bb_to_the_moon_the_video_isnt_mine/,1,BB to the moon the video isn t mine,
632,kzdp14,t2_88tcbjp9,1610913650,/r/wallstreetbets/comments/kzdp14/im_finally_ready_to_do_some_yolo_weeklies/,1,I m finally ready to do some yolo weeklies, removed 
633,kzdp6g,t2_o0gbpbp,1610913662,/r/wallstreetbets/comments/kzdp6g/all_the_dd_you_need/,1,All the DD you need,
634,kzdqlu,t2_1317le,1610913778,/r/wallstreetbets/comments/kzdqlu/spreading_the_word/,1,Spreading the word,
635,kzdqt9,t2_ypi3d,1610913795,/r/wallstreetbets/comments/kzdqt9/virgin_orbit_success_good_for_spce_i_know_its_not/,1,Virgin Orbit success Good for SPCE I know its not the same company ,
636,kzdrw6,t2_l7dy6,1610913881,/r/wallstreetbets/comments/kzdrw6/what_it_feels_like_picking_stocks_in_a_bull_market/,1,What it feels like picking stocks in a bull market,
637,kzds2a,t2_nsm7m,1610913896,/r/wallstreetbets/comments/kzds2a/ryan_cohen_on_twitter_what_does_it_mean/,1,Ryan Cohen on twitter What does it mean ,
638,kzds72,t2_puvee,1610913908,/r/wallstreetbets/comments/kzds72/whats_the_play_for_bb_on_tuesday_im_tryna_double/,1,Whats the play for BB on Tuesday I m tryna DOUBLE DOWN HARD,Are we anticipating the price to rise immediately so we should limit order 10 cents or so above the current price Or we we anticipating some more drop in price and we should limit order a little bit below the current price Or should we just play it by ear and make an order on Tuesday based on how it s looking in the moment 
639,kzdse8,t2_701pb,1610913924,/r/wallstreetbets/comments/kzdse8/inside_the_roblox_ipo/,1,Inside the Roblox IPO,
640,kzdsem,t2_p62g2,1610913925,/r/wallstreetbets/comments/kzdsem/some_autist_might_have_decoded_daddy_cohens_tweet/,1,Some autist might have decoded daddy cohens tweet,
641,kzdslv,t2_11ngl6ed,1610913942,/r/wallstreetbets/comments/kzdslv/i_need_a_steel_daddy_to_tell_me_a_good_buying/,1,I need a steel daddy to tell me a good buying point for CLF or Vale , removed 
642,kzdtk5,t2_dzhdt,1610914021,/r/wallstreetbets/comments/kzdtk5/what_does_rcs_meme_tweet_mean/,1,What does RC s meme tweet mean , removed 
643,kzdtk6,t2_icuh7,1610914021,/r/wallstreetbets/comments/kzdtk6/ask_me_if_i_give_a_flying_fuck/,1,Ask me if I give a flying fuck ,
644,kzdto7,t2_j2si1g2,1610914031,/r/wallstreetbets/comments/kzdto7/gme_gang/,1, GME Gang, removed 
645,kzdun9,t2_2dt8avyg,1610914111,/r/wallstreetbets/comments/kzdun9/gap_down_tues_for_twtr/,1,gap down Tues for TWTR, removed 
646,kzduso,t2_56x37yjt,1610914123,/r/wallstreetbets/comments/kzduso/thoughts_on_blackberry/,1,Thoughts on BlackBerry, tl dr I don t know if it s worth the DD flair Everyone associates Blackberry with those key mobile phones An old company that lost touch with smartphones and was completely defeated by Apple Samsung amp Co But time has changed BB was successful in its business transformation and they managed it to become a software instead of a hardware company Now the focus lies on cybersecurity IoT and embedded systems Along the way BB acquired few companies One of them is Cylance inc with a value of 1 4 billion CEO John Chen said they re going into the world of software As many of you know they partnered with Amazon I also think that BB could be a huge game changer for the more traditional car manufactures because they can t keep up with Tesla s software so they have to outsource some tasks Can t go tits up 
647,kzdvvp,t2_rnkui,1610914213,/r/wallstreetbets/comments/kzdvvp/my_predictions/,1,My predictions,Hey hey so I m new to investing but I did get my major in information science so I would say I found a bunch of different information to make my predictions and my brier score for making predictions is well above averag Albemarle this was first stock I bought aug 31 has raised a lot since then Actc amp Acb not too sure on these but hype because electro vehicles honestly If I had more spare change I would buy as many of these as I could SKM South Korea purchased tons of this and the telecommunications industry is ever improving LGF A forced to innovate due to covid yet lots to offer in its coffers in terms of skill etc X steel and all natural metals ore a good bet Cars will always be steel as you only need one on the road for lighter cars to result in death 1 electric car growth vehicle etc 1 limiting factor is of photovoltaic generators Ok charge your Tesla but have the gas burnt at the power plant instead of the car Supply chains firm I m looking to getting into market analysis etc if anyone has any companies or research they want feel free to ask
648,kzdw0l,t2_175n4v,1610914225,/r/wallstreetbets/comments/kzdw0l/does_anyone_else_want_a_market_crash_after_seeing/,1,Does anyone else want a market crash after seeing this ,
649,kzdx7c,t2_3285clct,1610914320,/r/wallstreetbets/comments/kzdx7c/bb_tommorow_a_big_buy_day_lets_take_this_thing_to/,1,BB tommorow a big buy day Let s take this thing to the moon , removed 
650,kzdxvi,t2_7602g56e,1610914373,/r/wallstreetbets/comments/kzdxvi/gme_discussion_about_short_squeeze_mechanics_and/,1,GME discussion about short squeeze mechanics and why ITM calls are best,Lots of good DD articles about GME with the last being https www reddit com r wallstreetbets comments kz7ygv gme dd one dd to rule them one dd to find them https www reddit com r wallstreetbets comments kz7ygv gme dd one dd to rule them one dd to find them Now this is more of a question about delta hedging and gamma squeezing The overlying belief is that retail investors are buying calls causing MM s to delta hedge leading to price increase and causing ATM calls to have the most increase in delta forcing MM s to buy more e g gamma squeeze This needs to be kicked off by buying up the shares to the ATM OTM level which is why people are suggesting people buy shares but why not buy ITM calls The advantage of ITM calls are that you can get MORE delta effect than just buying shares AND you don t have to be a true retard buying FD s Let s look at some option chain for July amp x200B Processing img mdu16h549yb61 Now let assume you buy at the ASK which is the worst case scenario buying a 20 GME call will be 18 95 If GME is 36 you can buy 1 9 GME calls which translates to 1 9 0 859 which is a delta of 1 63 effectively causing MM s to hedge with 163 shares of GME Additional advantage is that you own 190 shares of GME if it moons instead of 100 The downside is the price paid which is 38 95 but is effectively only a 8 premium to effectively double your buying power and forcing MM s to delta hedge 63 more shares Yes you won t be making as much as FD ing GME 60 calls But you also won t be theta fucked as much and is a better bet than buying shares amp x200B TL DR Instead of buying shares we should mix shares with ITM calls effectively causing MM s to buy more GME shares to delta hedge 
651,kzdy3g,t2_4addtswx,1610914390,/r/wallstreetbets/comments/kzdy3g/nokia_2022_leap_calls/,1,NOKIA 2022 LEAP CALLS, removed 
652,kzdyi3,t2_94ka586t,1610914421,/r/wallstreetbets/comments/kzdyi3/my_2020_year_summarized/,1,My 2020 year summarized , removed 
653,kzdyx0,t2_170u4g,1610914457,/r/wallstreetbets/comments/kzdyx0/weve_all_done_it/,1,We ve all done it ,
654,kzdz8p,t2_8es8flr,1610914486,/r/wallstreetbets/comments/kzdz8p/tsla/,1, TSLA ,
655,kzdzcj,t2_7u7yp,1610914495,/r/wallstreetbets/comments/kzdzcj/fairly_noob_here_wsbers_just_curious_to_know_why/,1,Fairly noob here WSB ers just curious to know why stocks ratings between RH and WSB is like polar opposites take GME PLTR for example , removed 
656,kze05s,t2_5egh0mus,1610914563,/r/wallstreetbets/comments/kze05s/gme_this_week_part_1/,1,GME this week Part 1,
657,kze078,t2_3cwi8c8c,1610914566,/r/wallstreetbets/comments/kze078/wsb_is_hands_down_the_best_internet_community_ever/,1,WSB is hands down the best internet community ever ,All of reddit social media is basically a trash can Too much political talk and plain toxic I love coming here cause we all here for one thing no politics no bullshit If we can print money off it we in we don t care which side Bull gang bear gang whatever gang amp x200B It s impossible for us to be a cult at the end of the day this is the Wild West where everyone for themselves If you don t like the way some people are betting or don t like one of the gangs you re always free bet against them Unlike other online forms I love how most don t care about arguing or proving our point to others cause the proof is in the pudding Either you can make money or you can t I fucking love you all props to the mods never change WSB
658,kze1cc,t2_8ykqrivd,1610914660,/r/wallstreetbets/comments/kze1cc/lets_fly_with_cody_to_the_moon_and_beyond/,1,Let s fly with Cody to the moon and beyond ,
659,kze1j0,t2_4zg3j8fm,1610914677,/r/wallstreetbets/comments/kze1j0/amc/,1,AMC, removed 
660,kze1nf,t2_748jz66a,1610914687,/r/wallstreetbets/comments/kze1nf/low_rocket_ship_is_now_refuelled_launch_to_200_is/,1,LOW rocket ship is now re fuelled launch to 200 is imminent,So listen before I get started I get it this is not TSLA or GME or PLTR which are some of my favorites but somehow our fellow autists have missed the ongoing run up of LOW I believe there is still time to get into this trade and make some serious tendies on both cheap ass calls and stock into earnings and even past IT HAS BEEN UP EVERY SINGLE DAY THIS YEAR WHY STONKS ONLY GO UP 1 Lowes announced a massive stock buy back of 15 billion dollars last month Lowes is going to the market and buying almost 20 of all outstanding shares that s how much money they have think about that for a second They don t buy back stock to lose money they buy back to make their shareholders money by increasing the share price 2 Stimmy the first round of stimmy benefited home retailer companies like LOW and HD in a massive way Papa Joe is sending another 1400 and like it or not many to people who don t need the money and will be going and spending on their homes with this 3 Interest Rates starting to creep up and many people are rushing to refinancing their pads and renovating with extra cash they will be going to HD and LOW for alot of this Here s the current chart of LOW as you can see it has been rocketing forward even when the market has been experiencing a bit of red this week This is a play into earnings and maybe longer if they crush it in Q4 BULL MARKET IS HERE AND BACK UP NEXT WEEK LETS GOOOOOOo https preview redd it ommlbos84yb61 png width 520 amp format png amp auto webp amp s 38c32b0f4c13ee2b6c1708571ff1cd8498832b51
661,kze2zg,t2_5i7rxql5,1610914803,/r/wallstreetbets/comments/kze2zg/elon_and_kahn_academy/,1,Elon and Kahn Academy,
662,kze310,t2_4dxcgrmp,1610914806,/r/wallstreetbets/comments/kze310/good_options_trading_courses/,1,Good Options Trading Courses ,Hi everyone I have been wanting to get into options trading for a while I have watched videos on youtube but are there any good courses that I can take to really understand in more depth Anyone has taken any course before Thanks in advance 
663,kze3hr,t2_k0a0q,1610914846,/r/wallstreetbets/comments/kze3hr/they_mustnt_know_the_truth/,1,They Mustn t Know the Truth ,
664,kze3m7,t2_8ykqrivd,1610914857,/r/wallstreetbets/comments/kze3m7/lets_fly_with_cody_to_the_moon_and_beyond/,1,Let s fly with Cody to the moon and beyond ,
665,kze3u0,t2_6n3latiw,1610914876,/r/wallstreetbets/comments/kze3u0/the_new_reality/,1,The New Reality ,
666,kze4db,t2_4hfjyupz,1610914916,/r/wallstreetbets/comments/kze4db/attention_required_we_retards_about_to_lift_off/,1,ATTENTION REQUIRED WE RETARDS ABOUT TO LIFT OFF ,Do you see that green dildo https www swaggystocks com dashboard wallstreetbets ticker sentiment outstanding right there What the fuck is that little red on top The only red I wanna see is the blood of Melvin Capital Let s make it all green ready to fuck all those negative ass before Tuesday We ready to lift off Papa Cohen just put the gas and we will put some more M I S S I O N S T A R T E D https preview redd it 45zx2cry9yb61 jpg width 1125 amp format pjpg amp auto webp amp s ab86354eca3d7a3ad2b59f737269de6fceb2c280
667,kze75v,t2_9e1edja7,1610915148,/r/wallstreetbets/comments/kze75v/looking_to_buy_more_options/,1,Looking to buy more options , removed 
668,kze7g6,t2_5ikuine8,1610915172,/r/wallstreetbets/comments/kze7g6/the_only_important_dd_on_bbd_ur_gf/,1,The Only important DD on BB D UR GF , Thesis Analysis Methodology Conclusion amp x200B TLDR This is the 67th DD on BB this weekend Here are some more BB Feb 19 2021 14 00 Call 
669,kze83s,t2_13y1s4,1610915225,/r/wallstreetbets/comments/kze83s/the_burn_continues/,1,The Burn Continues,
670,kze86u,t2_2du1yas0,1610915232,/r/wallstreetbets/comments/kze86u/amc_next_gme_short_squeeze/,1,AMC NEXT GME SHORT SQUEEZE , removed 
671,kze88f,t2_2tcifc2s,1610915236,/r/wallstreetbets/comments/kze88f/gme_current_marketcap_is/,2,GME Current Marketcap is , removed 
672,kze9q8,t2_i8ngy,1610915355,/r/wallstreetbets/comments/kze9q8/investhing/,1,Investhing ,
673,kze9zs,t2_2tcifc2s,1610915376,/r/wallstreetbets/comments/kze9zs/gme_current_market_cap_is/,1,GME Current market cap is ,Our lord and savior the one and only Ryan mf Cohen says it himself GME s current market cap is 2 5b that s absolute peanuts Source https twitter com ryancohen status 1350877969816956934 https twitter com ryancohen status 1350877969816956934 Ryan turned pet into a 45b dollar company with Chewy Gaming has a bigger total addressable market We will conservatively be at 100 soon enough whether or not we hit the MOASS GME go 
674,kzea1u,t2_13y1s4,1610915381,/r/wallstreetbets/comments/kzea1u/the_burn_continues/,1,The Burn Continues,
675,kzebpm,t2_5baii,1610915515,/r/wallstreetbets/comments/kzebpm/investment_noob_trying_to_understand_buying/,1,Investment noob trying to understand buying stocks of small companies , I have my traditional retirement accounts set up with standard indexes however I want to roll the dice with some side money on some small medium sized tech companies When I look up stocks on fidelity it seems like every company I can buy is valued at over a billion dollars Is there anyway to buy shares of a company that s valued at 500k but hasn t IPO ed but it is open to people investing in them 
676,kzebwv,t2_169hb46y,1610915531,/r/wallstreetbets/comments/kzebwv/guys_this_is_important_please_can_everyone_leave/,1,Guys this is important Please can everyone leave some nice reviews ,
677,kzedpc,t2_4zwwp1kw,1610915681,/r/wallstreetbets/comments/kzedpc/_/,1, , removed 
678,kzedpt,t2_9rfjxi0h,1610915682,/r/wallstreetbets/comments/kzedpt/anything_other_than_gme/,1,Anything other than GME , removed 
679,kzeg75,t2_rpl5fkj,1610915898,/r/wallstreetbets/comments/kzeg75/ryan_cohen_tweet_analysis_squeeze_coming_soon/,1,Ryan Cohen tweet analysis Squeeze coming soon , removed 
680,kzegvm,t2_5bm3g9t2,1610915956,/r/wallstreetbets/comments/kzegvm/legging_in_to_secure_your_profits_with_a_ghetto/,1,Legging in to secure your profits with a Ghetto Spread , Please do not waste money on awards rather spend that on books and services to further your knowledge like this to get those gains Also special mention to u leobanksjr for explaining and breaking it down with scenarios I come to realize with my recent folly during this bull market how it resembles September rally into October nightmare the recent political disaster on capital hill leading into inauguration day for the new president and most notably the sheer increase in VIX calls amp SPY puts in the options flow services that we need a firm and in depth discussion in persevering and hedging those recent gains Using margin account with at least level 3 available spreads is required Cash accounts will not work with this Explanation of a Ghetto Spread amp Legging in You would let the naked call inflate and as soon as momentum slows or end of day occurs Just sell strike right above it basically creating a bull call spread lock in profits with limited further upside for stocks that may continue to advance or sell that short leg the next day without affecting PDT making it a long naked call again Sell the strike below current naked long call and create a bear call spread if you think the stock has in short term exhausted and has some downside Lock in profits and limited profits on the move down Or if you moved several strikes already sell the current ATM strike and get credited more premium If stock moves above and that spread expires if you choose to hold the locked in profit is yours as well potential the credit received if it expires above or below the sold call depending on type of spread So If I bought KERN at 6 calls and it moved to 8 bucks I can sell an 8 call and it locks current gains If I hold that spread rather than return naked call at the next day into expiration and the price has indeed went under 8 I get to keep the profit I locked in and the premium received from selling the 8 call if I do the same thing but it expires above 8 call I lose the premium but still keep the locked in profits when I created the spread Exact opposite for a bear call spread opening a short call strike below current naked long call WHY NOT USE A CASH ACCOUNT Cash accounts work for larger balances that can position size correctly Smaller accounts use up more settled funds to get a more costly longer dated contracts making it difficult to position with what you may be comfortable with Weeklies time decay only makes their use practical for day trade but risky to guess amp hold for next day movement Might not spot an opportunity until later in the day and then have to choose between giving up an existing trade and a day for funds to settle 
681,kzegw8,t2_7szoh9nw,1610915957,/r/wallstreetbets/comments/kzegw8/why_is_no_one_talking_about_riot/,1,WHY IS NO ONE TALKING ABOUT RIOT ,
682,kzegzd,t2_98nxwgah,1610915965,/r/wallstreetbets/comments/kzegzd/reddit_most_trending_stocks_dashboard_v20/,1,Reddit Most Trending Stocks Dashboard V2 0 ,Hello guys I hope you are doing fine First of all thank you very much for all your support and suggestions during the past week A new version of the most trending stocks in Reddit in online and contains the following updated A new page Reddit Stock Screener In this page you will be able to select a Ticker Subreddit and it will show you the Reddit Score amp Rockets Score over time The Data Points are updated automatically each hour http unbiastock com redditScreener php http unbiastock com redditScreener php In the same page you will also be able to have the first informations you need about the company you are intending to invest on Key Financial Metrics Stock Price over Time Business Area I hope it will help you avoid jumping from tab to tab to get all the informations you need The Most Trending Stocks Table will be now also updated each hour in order to provide you with the most up to dated scores before investing A TLS Encryption of the website has been put in place and you ll be able in the upcoming days to connect only through HTTPS The Different Scores are now recorded in a DataBase and an API will be shortly provided to you if you need to backtest any trading strategy with the Data Again thank you for all your support Do not hesitate to share any suggestions Ideas Comments or Questions Swiss Rock 
683,kzeh1z,t2_5baii,1610915970,/r/wallstreetbets/comments/kzeh1z/investment_noob_trying_to_understand_buying/,1,Investment noob trying to understand buying stocks of small companies , I have my traditional retirement accounts set up with standard indexes however I want to roll the dice with some side money on some small medium sized tech companies When I look up stocks on fidelity it seems like every company I can buy is valued at over a billion dollars Is there anyway to buy shares of a company that s valued at 500k but hasn t IPO ed but it is open to people investing in them 
684,kzeh9h,t2_ityx3,1610915990,/r/wallstreetbets/comments/kzeh9h/gme_protecting_your_shares_against_short_sellers/,1,GME Protecting your shares against short sellers,So we all know that shares of GME that are owned are by default available to short as your broker will lend them out to short sellers and collect a fee I have read in various sources that placing a limit market sell order far above the market say 420 69 locks up your shares and prevents them from being loaned out to short sellers as they need to be immediately available to be sold should that price be reached The information that I ve found online on whether this is actually the case is not definitive one way or the other However I don t think there is any downside to placing an order like this on your shares and there COULD be an upside in preventing them from being loaned to short sellers Therefore I propose that all GME autists immediately place a limit GTC sell order on all of their shares at a price way above the market of their choosing 420 69 1000 1 000 000 etc Potentially lock up shares against short sellers and who knows maybe it ll even get hit 
685,kzehgq,t2_9v87qdf1,1610916008,/r/wallstreetbets/comments/kzehgq/bitcoin_125_lets_go_you_hodling_cucks/,1,Bitcoin 125 lets go you hodling cucks,
686,kzehn2,t2_8180jkmi,1610916025,/r/wallstreetbets/comments/kzehn2/this_is_it_fellas/,1,THIS IS IT FELLAS,
