,postid,author,created_utc,permalink,score,title,selftext
495,kzbc05,t2_4ddn0zcb,1610906606,/r/wallstreetbets/comments/kzbc05/gme_this_cycle_biggest_value_trap_how_retails/,0,GME This Cycle Biggest Value Trap How Retails Will Lose All Their Money Bear Case, I will argue that GME is a value trap because it has no virtuous cycle to improve cash flow as its business model has been disrupted by the digital transformation of online video game sales and discounts GME is set to default in the next 8 months without further cash infusion Business Model GME has margins has always been reselling popular titles They buy low and sell high for popular titles This has worked in the past but the tipping point had arrived in 2019 1 putting severe pressure in the old business model In the next generation console online purchases will continue to be dominant Moreover when popular titles become less popular they are heavily discounted online incentivizing consumers to find deals online rather than holding on to physical media This compression in its high margin and sharp drop in foot traffic to drive sales will continue to impair cash flow in the future leading to a solvency problem Lastly the previous console generation had been saturated It ll be unsustainable for GME to depend on customer selling and buying previous console titles Competitor Advantage There has been excitement about Ryan Cohen trying to transform GME to an online business But the competitor moats are too big to overcome Microsoft and Sony own game studios and will continue to offer better deals on their online platform There is no way for GME to compete with these monopolistic moats It is important to note that Blockbuster tried to shift online once it realize that Netflix had disrupted its business model Blockbuster was unsuccessful because of Netflix s first move advantage ability to raise large debt and operate at massive losses at scale to undercut Blockbuster move online A similar environment is facing GME as it plans its online pivot Microsoft and Sony have massive cash reserves and at scale and lower marginal operating costs compared to GME online business Moreover they control studios and can offer their exclusives first buying opportunities on their platforms before sales move to secondary platforms Value Trap GME has no virtuous cycle Unlike Blue Apron that was able to improve cash flow because of the pandemic and people buying meal kits or TSLA improving production and selling more green credits to improve production GME has no virtuous cycle Market analysis indicates there is a structural shift to online buying and online platform to provide heavily discounted prices of popular titles once their popularity wanes I will argue that GME business model is similar to Blockbuster after it was disrupted by Netflix GME is in a death spiral unable to compete against Microsoft or Sony Cash Flow Problems GME operating loss in October 2020 was 184M They had 450M in cash 2 at the end of October This implies a runway of 2 3 quarters in which they need to raise cash or face default Short Squeeze Mania Explained Much excitement has been made about a possible short squeeze against Melvin Capital People point to the recent 100 rise in GME to argue for a short squeeze Much discussion has been made of it so I won t add to it except to offer another explanation focusing on MM and delta hedging As rumours about an infinite short squeeze on GME rose a sharp rise in call option buying occurred MM as part of their delta hedges would need to buy up shares However encountering few shares to buy MM started buying ITM calls and moving to OTM calls This led to higher prices and MM needing to further buy shares and call options to delta hedge So the steep rise in price wasn t from Melvin Capital but MM delta hedging Furthermore realizing the risky positions MM had taken as part of delta hedging imperfect hedges they decided to eliminate GME margins to slow down the gamma convexity Therefore it is the MM that had been buying shares and not Melvin Capital This is supported by the early evidence that Shorts took on more shorts puts as the price went up Conclusion GME is at risk of default in 6 8 months and a short squeeze may not come In fact what may be happening is that retails have entered a massive value trap that will cause them to lose most of their investment should GME continue to face a cash crunch on weak sales massive operating cash flow losses over the next 8 months without a huge cash injection Even then their business model is structurally problematic Ask yourself would you have invested in Blockbuster when you heard it was moving its business online 1 https screenrant com digital game sales consoles outnumber physical first time 2 https finance yahoo com quote GME financials p GME 3 https finance yahoo com quote GME cash flow p GME
496,kzbd6t,t2_8n31y,1610906701,/r/wallstreetbets/comments/kzbd6t/gme_percent_of_float_short_now_249/,1,GME percent of float short now 249 ,
497,kzbdmu,t2_w8gac,1610906739,/r/wallstreetbets/comments/kzbdmu/i_called_icln_back_in_november/,1,I called ICLN back in November ,https www reddit com r wallstreetbets comments jydje6 the curious case for clean energy utm source share amp utm medium ios app amp utm name iossmf I ll keep this brief as an update and future projections Basically ICLN QCLN and TAN have made nothing short of an impressive runs since the election With the uncertainty surrounding the senate now put to rest the future surrounding electrification is almost a guarantee The remaining questions are how much money will be spent when the stimulus will arrive and how this money will function for these clean energy companies How much money seems to be the primary concern for many investors The going concession seems to be about 2 Trillion in spending with anything under being lack luster and anything over as unrealistic Arguably I believe that if this spending comes with little to no strings attached the number becomes irrelevant The timing of the money could be crucial as well Will it be a lump sum Rolling investments Or something else To those of you who are new to ICLN and are afraid of this recent pullback fret not It did the same thing when it broke 20 and had about a month of consolidation pre election cycle when uncertainty was its highest I can see a similar situation occurring but this is also not the same kind of uncertainty so I do not think it will take as long to begin its climb again Also worth noting last week was a huge expiration date for many options just think of the upcoming news cycle Inauguration of new leadership dedicating a decent part of his platform to renewables He will be judged on the performance thusly His first 100 days in office will define his motivation towards this issue He will rejoin the Paris climate accord day one Show of good will more than anything next he will rollback most environmental deregulation that occurred in the last administration Then he will announce his green bill Within the bill I believe that a high carbon tax penalties for funding future dirty energy projects and cutting big oil subsidies could occur Possibly some more stuff use your imagination think EV personal solar and the grid To rap up my projections for ICLN short term is sideways with decreasing IV A big pop recently happened what more could you want you greedy pigs Long term this will become the envious money printer of the next 4 years By 2021 we will see over 50 a share In 2022 over 100 Why the steep rise Because oil will die in the future and this is just the beginning Those of you in love with short term options go play one of ICLNs holdings you ll find better success if timed right Those of you with long term options y all Gucci But in my opinion shares are the move Positions ICLN 2k shares cost avg sub 20 with plans to execute my 4 16 25c 20x bought at 1 10 I am currently looking for an entry into leaps but want that IV to cool off first Obligatory ItS fReE eNeRgY fRoM tHe SuN bRo By the year 2100 we will have a working dyson swarm by Elon pulling energy from the sun The 2100 price of ICLN is 100 000 a share Yes I m from the future where Elon owns most of mars and has turned its solid metal core into a planet sized battery 
498,kzbe15,t2_skdfy,1610906772,/r/wallstreetbets/comments/kzbe15/a_question_for_wsb/,1,A Question for WSB,Hello fellow retards I am recently new to WSB and investing in general let me start by saying that this sub if nothing else is a national meme treasure But behind all the memes sarcastic name calling wives boyfriend jokes and emojis there is a genuine community of people that are helpful and know what they are doing For this I thank you I feel like i have missed out by not being in this community earlier it is for that reason that I am making this short post I know advice here is taken at my own risk and accept that there is no sure thing But I just wanted to know what the overall track record is for WSB is like I came in at what seems to be an exciting time with this GME hype I cant stop looking at the stock chart on trading days watching investing youtubers and reading articles i previously had no interest in Is this GME type of hype a normal occurance i dont know what else to write but i want to include the obligatory emojis 
499,kzbeoy,t2_877qb,1610906828,/r/wallstreetbets/comments/kzbeoy/jamie_lynn_spears_blames_elon_musk_and_tesla_for/,1,Jamie Lynn Spears blames Elon Musk and Tesla for killing her cats,
500,kzbeoy,t2_877qb,1610906828,/r/wallstreetbets/comments/kzbeoy/jamie_lynn_spears_blames_elon_musk_and_tesla_for/,1,Jamie Lynn Spears blames Elon Musk and Tesla for killing her cats,
501,kzbf15,t2_9v5paagf,1610906855,/r/wallstreetbets/comments/kzbf15/just_remember_the_sacrifices_it_took_to_get_to/,1,Just remember the sacrifices it took to get to here Prove them wrong ,
502,kzbf96,t2_3vr0532a,1610906872,/r/wallstreetbets/comments/kzbf96/why_diamond_hands_will_be_crucial_for_gme/,1,Why Diamond Hands will be crucial for GME , removed 
503,kzbfbu,t2_3k4ai9zw,1610906879,/r/wallstreetbets/comments/kzbfbu/the_dd_case_for_a_657_price_target_gme/,1,The DD case for a 657 price target GME ,Hear me out step by step Cohen wants to Chewy fy GameStop Chewy valued at 44 6B GameStop valued at 2 4B For GameStop to Chewy valuation it would be 44 6 2 4 18 5 times higher 18 5 x 35 5 current price GME 657 price target GME Conclusion disclaimer I m doing based on my DD do whatever you want 650 share GME 
504,kzbgih,t2_5s1arbq1,1610906973,/r/wallstreetbets/comments/kzbgih/gme/,0,GME,
505,kzbi6x,t2_2pw74w9,1610907102,/r/wallstreetbets/comments/kzbi6x/is_wsb_really_in_control_a_gme_thought_experiment/,1,Is WSB Really in Control A GME Thought Experiment,I ve heard a lot of rumblings of WSB autists being the new market makers and us having control over the market now but many of us may ask ourselves is that really true Below is a thought experiment to help quantify this discussion using the current example of GME If ur retarded and can t read theres a TLDR at the bottom and a couple rocket emojis We will begin with a quick history lesson on the VW short squeeze https moxreports com vw infinity squeeze Everyone seems to compare this GME situation with the VW short squeeze but how similar are they The short answer is that on paper they are not similar but in reality they could be VW was viewed as high probability bankruptcy candidate and as such had a short interest of 12 8 of outstanding shares in October 2008 That s not a lot Short interest is the number of shares sold short borrowed that have not yet been covered or closed out Compare that to GME which as of 1 15 apparently has 138 short interest https www reddit com r wallstreetbets comments kyp0q3 gme short interest update 13808 ref share amp ref source link So that s it right Game over because GME has more short interest so its a bigger squeeze than VW No not exactly See its easy to avoid a short squeeze when there are shares available to close the position VW shorts could have easily closed out a measily 12 8 of outstanding shares since in October of 2008 only 55 of VW shares were unavailable At the time Porsche already owned 30 of VW shares Lower Saxony owned 20 and various indexes owned 5 That left 45 of shares available and only 12 8 needed to cover But then under the noses of VW shorts Porsche announced over the weekend that they had increased their stake by an additional 44 of shares meaning that 99 of VW shares were unavailable only 1 of shares were left and shorts had needed 12 8 of the shares to close their position Thats Bad and Thats What Sent The Shorts Scrambling to Cover Later that week VW shares peaked at 1000 What is interesting here is that the shorts weren t even acting irrationally they were just unaware of the extent of which shares were unavailable until it was too late Now lets compare this to GME Previous estimates of the quantity of GME shares unavailable can be found here https www reddit com r wallstreetbets comments kwb827 gme endgame dtc infinity ref share amp ref source link here https www reddit com r wallstreetbets comments kyocql updated potential holdings of gme ref share amp ref source link and here https www morningstar com stocks xnys gme quote For simplicity we will use Morningstar s estimate GME has a float of 27 29 million shares which means that all but 27 29 million shares are tied up due to insiders and institutions So 39 of shares are available that s less than VW before Porsche upped their stake but with far greater short interest Now here is when the thought experiment really begins and we transition from a history lesson to math class So VW shorts got pinned in a situation where only 1 of shares were available but they had 12 8 of shares outstanding GME shorts are in a position where 39 of shares are available and they have 138 of shares outstanding So a short squeeze certainly seems on the horizon but the ratio of shares available and shares needed to cover isn t as extreme as VW But what would happen if less shares became available Well if Ryan Cohen purchases the remaining 7 4 9 million of shares that hes allowed the shares available would drop to 32 further polarizing the ratio But this is what I want you to think about Float shares available does not account for retail investors because the consensus is that we are paper handed bitch bois and are apt to easily sell our holding What if that wasn t true WSB retail investors has 1 9 million members if we all hold an average of 1 share each the true shares available would drop to 29 4 If we hold an average of 3 shares each then shares available drops to 24 With an average of 5 shares each shares available becomes 18 5 10 shares each only 5 of shares are left available So VW had a ratio of 1 of shares available to 12 8 outstanding 12 8x Currently we are sitting at 39 available with 138 outstanding 3 5x If Cohen ups his stake we get 32 available and 138 outstanding 4 3x To match the VW ratio there would need to be 10 8 of shares available with the 138 outstanding 12 8x For that to happen it would mean that WSB alone has to hold an average of 8 shares per member to expect a squeeze of similar strength as the VW squeeze How far can this thought experiment go though What if GME had only 1 of shares available just like VW did Well for that to happen it would mean that WSB holds an average of 11 25 shares and that would get a ratio of well 138x So you guys do the math is retail really in control here It s looking like a maybe To conclude this thought experiment I will present you with a hypothesis that will either prove or disprove this theory If retail investors can hold their shares and reduce the available float then they have control over the market in this particular example The hypothesis will be proved if retail investors can cooperate and act as an institution taking enough shares out of circulation The hypothesis will fail if retail investors do not take shares out of circulation and have no control over the float Now this is a thought experiment so I have to provide some realistic criticism for you to accurately judge the situation Ryan Cohen has no obligation to buy the addition 7 but the consensus is that it seems likely WSB may not have 1 9 million users who are active bullish and dedicated to holding and they certainly may not have an average of 8 shares each this is less likely but possible I am not a financial advisor I am retarded like you guys do not take this thought experiment as the word of god Furthermore I am not advocating that ever member here go and buy 10 shares of GME to force a squeeze this is simply a way to explain the mechanisms behind the VW short squeeze and compare them to the current GME situation Do your own research and make an educated decision on whether or not you believe GME is a wise investment TLDR Thought Experiment If VW squeeze hard cuz very few shares available and too many shares shorted but GME only have moderate shares available and way too many shares shorted then if GME only have very few shares available that mean GME squeeze hard too 
506,kzbi9g,t2_3n61e2i2,1610907108,/r/wallstreetbets/comments/kzbi9g/i_am_a_retard/,1,i am a retard, removed 
507,kzbihx,t2_3w20adh2,1610907127,/r/wallstreetbets/comments/kzbihx/ok_someone_please_explain_to_me_how_this_works/,1,Ok someone please explain to me how this works, removed 
508,kzbio4,t2_216qttv,1610907143,/r/wallstreetbets/comments/kzbio4/advice_for_people_new_to_stocks/,1,Advice for people new to stocks , removed 
509,kzbkmc,t2_pv2wn,1610907307,/r/wallstreetbets/comments/kzbkmc/is_there_a_way_to_omit_gme_from_my_feed_for_this/,1,Is there a way to omit GME from my feed for this subreddit , removed 
510,kzblii,t2_799esibn,1610907383,/r/wallstreetbets/comments/kzblii/the_four_horsemen_of_ocd_investment_returns/,1,The four horsemen of OCD investment returns,
511,kzbmbz,t2_94thhka4,1610907457,/r/wallstreetbets/comments/kzbmbz/gme/,1, GME, removed 
512,kzbmhe,t2_7eiij63v,1610907470,/r/wallstreetbets/comments/kzbmhe/ajax_merge_target/,1,AJAX merge target, removed 
513,kzbmkq,t2_8gsybtpc,1610907476,/r/wallstreetbets/comments/kzbmkq/bulls_across_the_internet_unite/,1,Bulls across the internet unite, removed 
514,kzbo6e,t2_4r16d11h,1610907610,/r/wallstreetbets/comments/kzbo6e/some_lighthearted_dd_for_you_fuckers_lcut/,1,Some lighthearted DD for you fuckers LCUT, removed 
515,kzbote,t2_11d0ioba,1610907665,/r/wallstreetbets/comments/kzbote/which_one_of_you_did_this/,1,Which one of you did this ,
516,kzbp0y,t2_6a1qmopt,1610907684,/r/wallstreetbets/comments/kzbp0y/you_guys_are_really_dumb_gme/,1,You guys are really dumb GME ,Holy shit all of you idiots copping GME calls on margin are retarded Kudos to the WSB family on the squeeze but you guys are asking for too much at this point We re talking about a dying company with 0 potential Everyone besides some of you doofuses knows that nobody buys physical video games anymore Nothing this Cohen fucker or anybody can do Sorry y all XD 
517,kzbqd2,t2_oa4tq,1610907790,/r/wallstreetbets/comments/kzbqd2/new_traders_beware/,1,New Traders Beware,New Traders welcome Please understand that this is not a traditional investment forum The primary focus of WSB is options trading very very risky If you are looking to get started in the stock market or learn the basics of investing you are in the wrong place The recent hype around GME is unusual and it s a very unique situation There are countless losses that have been experienced in this sub because of inexperienced Traders trying to listen to the retards in here I ve seen the following questions in the last week How do I buy stock Is spreading false information about stock to manipulate the price illegal What is Margin trading Just to name a few I appreciate any and all who are seeking out information but I m writing to tell you that if you re asking these questions please please please get out of here until you re ready The memes jokes and general attitude here is based around the personality it takes to watch your account rise to life changing levels then lose it all the next day This sub is not filled with geniuses or tons of DeepFuckingValue players It s filled with gamblers If you re looking to get started investing thats awesome but please go to r stocks or r investing and learn the basics so you can make smart decisions There are people that have lost life savings their families and even taken their own life because they didn t make the right play or didn t understand what they re doing So even though alot of us make it out to be a joke if you re new to the game you don t know enough for it to be funny Educate yourself and learn about the risks at hand For fellow autists and GME gon take us to moon you fucking retards 
518,kzbquh,t2_2zirtmpm,1610907830,/r/wallstreetbets/comments/kzbquh/what_do_you_think/,1,What do you think ,
519,kzbrcf,t2_2ej814rw,1610907869,/r/wallstreetbets/comments/kzbrcf/wise_words_from_our_master/,2,wise words from our master,
520,kzbscv,t2_2ej814rw,1610907957,/r/wallstreetbets/comments/kzbscv/a_couple_of_wise_words_from_our_master/,1,a couple of wise words from our master,
521,kzbsrw,t2_ni2d5,1610907993,/r/wallstreetbets/comments/kzbsrw/gme_supplemental_info/,1,GME Supplemental Info,On Feb 28 2020 Donald A Foss filed that he owns 5 3 of GME Why should you care is why Maybe I don t know SEC Autist Reading https www sec gov Archives edgar data 901185 000110465920030651 tv538831 sc13g htm Foss was the founder of Credit Acceptance car financing company So including Chewie aka RC we now have two former owner operators owning a significant and likely entrenched position in GME Could Foss add financing options experience for GME e g finance PC parts or Xbox or PS No fucking clue from this retard but it doesn t hurt to have his support to dry up liquidity of shares from the s I m too retarded for options but even more retarded to have been long since Bury s 13F 3000 shares 
522,kzbtl8,t2_610uv,1610908061,/r/wallstreetbets/comments/kzbtl8/im_going_straight_to_hell_oh_well_lets_get_those/,1,I m going straight to hell Oh well let s get those tendies ,
523,kzbtrj,t2_qwl7kb8,1610908074,/r/wallstreetbets/comments/kzbtrj/tim_dillon_dd_on_tesla_owners/,1,Tim Dillon DD on Tesla Owners,
524,kzbufh,t2_tbv23,1610908127,/r/wallstreetbets/comments/kzbufh/this_is_what_people_over_at_rinvestments_do/,1,This is what people over at r investments do,
525,kzbvbh,t2_4efwkqup,1610908207,/r/wallstreetbets/comments/kzbvbh/martin_shkrelis_former_company_hgen_is_about_to/,1,Martin Shkreli s former company HGEN is about to drop a blockbuster therapeutic for Covid , removed 
526,kzbvy6,t2_tbv23,1610908257,/r/wallstreetbets/comments/kzbvy6/rinvestments_be_like/,1,r investments be like ,
