,postid,author,created_utc,permalink,score,title,selftext
2339,nmfr24,t2_43y3er8,1622144574,/r/wallstreetbets/comments/nmfr24/amc_short_squeeze_is_different_than_gamestop/,1,AMC Short Squeeze is Different than Gamestop Hedge Funds are buying ,Don t you feel that hedge funds are playing both sides this time I believe there are a ton of hedge funds that are creating the buying pressure as well Hedge funds are master manipulators of price and know how to take advantage of market inefficiencies I believe they create posts on this reddit too They know how to pull the rug out on both sides Agree or disagree https youtu be 3IEPISKl KM https youtu be 3IEPISKl KM 
2340,nmfrd4,t2_7w01do0c,1622144597,/r/wallstreetbets/comments/nmfrd4/pltr_yolo_lets_eat/,1,PLTR YOLO Let s eat ,
2341,nmfrki,t2_6clyir71,1622144613,/r/wallstreetbets/comments/nmfrki/wsb_this_you_at_the_end/,1,wsb this you at the end ,
2342,nmfrmh,t2_cdbyc2bt,1622144617,/r/wallstreetbets/comments/nmfrmh/whats_the_expectation_on_amc_over_500/,1,Whats the expectation on amc Over 500 ,
2343,nmfrof,t2_a34w9lh4,1622144621,/r/wallstreetbets/comments/nmfrof/amc_launch_review/,1,AMC Launch Review ,Let s not forget when many said apes were apes for buying holding AMC TO THE MOON AND BEYOND AMCROCKETSHIP 
2344,nmfrv2,t2_xjod9,1622144634,/r/wallstreetbets/comments/nmfrv2/sold_half_my_position_of_amc_bb_to_the_moon/,1,Sold half my position of AMC BB to the moon , removed 
2345,nmfs8y,t2_5fqx136t,1622144664,/r/wallstreetbets/comments/nmfs8y/lets_go_amc_thats_how_you_perform_babbyyyyyy/,1,LETS GO AMC THATS HOW YOU PERFORM BABBYYYYYY,
2346,nmfsaj,t2_ca3k2f5n,1622144667,/r/wallstreetbets/comments/nmfsaj/amc_who_is_still_holding_with_me/,1,AMC WHO IS STILL HOLDING WITH ME ,
2347,nmfsd3,t2_8vzidtlz,1622144672,/r/wallstreetbets/comments/nmfsd3/amc_to_the_moon/,1, AMC TO THE MOON ,
2348,nmfspb,t2_caed4c5z,1622144696,/r/wallstreetbets/comments/nmfspb/huge_naked_short_on_reconnaissance_energy_report/,1,HUGE naked short on Reconnaissance Energy report,New Oilprice article looking into the massive naked short in RECO You have to read this and share https oilprice com Energy Crude Oil Is There A Huge Undisclosed Short In Oil Explorer Reconnaissance Energy Africa html https oilprice com Energy Crude Oil Is There A Huge Undisclosed Short In Oil Explorer Reconnaissance Energy Africa html 
2349,nmfsz7,t2_c5mdtwps,1622144714,/r/wallstreetbets/comments/nmfsz7/i_miss_when_this_community_was_more_than_amc_and/,1,I miss when this community was more than AMC and GameStop ,I made a lot of money because of you guys but let s make some more 
2350,nmftc9,t2_a22z576z,1622144741,/r/wallstreetbets/comments/nmftc9/them_hedgies_must_be_feeling_some_type_of_way/,1,Them hedgies must be feeling some type of way They don t like us yo but we re gonna be on TV again and i wish i could see their face AMC fam we finish strong ,
2351,nmftcf,t2_7bwtu2lf,1622144741,/r/wallstreetbets/comments/nmftcf/gme_investors_on_etoro_platform_might_be_able_to/,1,GME investors on ETORO platform might be able to vote ,Got information from an insider to check my mail regarding the voting issue I complained that not being able to vote makes me want to stop investing via their platform and to consider switching to IBKR They could not disclose more information regarding the mail but I m hoping we will be able to vote before the annual meeting amp x200B TLDR Check your inbox tomorrow if you own GME shares on ETORO
2352,nmfteq,t2_271z0gd9,1622144746,/r/wallstreetbets/comments/nmfteq/shorting_ftse100250who_gives_a_fuck/,1,Shorting FTSE100 250 who gives a fuck,I have a really smooth brain so my m22 girlfriends F19 boyfriend M36 told me about you fellow apes and this GME thing I hop on and I m waiting for lift off when I see some posts about a crash n shit Now I can hardly put my socks on in the morning but if GME goes to the moon when Hedgies fail causing a crash then why arent we shorting the market as well Sorry for the question I just need to be told what to do
2353,nmftug,t2_a237km4m,1622144778,/r/wallstreetbets/comments/nmftug/love_you_guys/,2,LOVE YOU GUYS,
2354,nmfu0d,t2_wxqcy,1622144790,/r/wallstreetbets/comments/nmfu0d/you_crazy_bastards_came_back_for_me/,1,You crazy bastards came back for me ,
2355,nmfuh7,t2_7uo945on,1622144823,/r/wallstreetbets/comments/nmfuh7/in_case_you_missed_the_amc_rocket_ship/,1,In case you missed the AMC rocket ship, removed 
2356,nmfupv,t2_afywwgii,1622144839,/r/wallstreetbets/comments/nmfupv/lowball_offer_on_my_car_notselling/,1,Low ball offer on my car NOTSELLING,
2357,nmfur6,t2_7ybb03o2,1622144842,/r/wallstreetbets/comments/nmfur6/did_hedgies_take_over_this_sub_wheres_the_amc_love/,1,Did hedgies take over this sub Where s the AMC love , removed 
2358,nmfurp,t2_a0wn9462,1622144843,/r/wallstreetbets/comments/nmfurp/welcome_aboard_spce_cadets_lets_discuss_spce/,1,Welcome aboard SPCE cadets Let s discuss SPCE There must be folks ready for take off What should we bring on the trip SPCE the final frontier These are the voyagers of the SPCE stonk endeavor Calling all SPCE cadets to discuss ,
2359,nmfuuz,t2_zlzrz,1622144850,/r/wallstreetbets/comments/nmfuuz/amc/,1, AMC,
2360,nmfv2v,t2_9zuvi56g,1622144867,/r/wallstreetbets/comments/nmfv2v/zillow/,1,Zillow,Should we be concerned when the CFO and CMO just sold over 2M in shares of their own company this week Anyone have some possible intel here Z
2361,nmfv31,t2_4vfw8d9p,1622144867,/r/wallstreetbets/comments/nmfv31/buy_1_share_of_amc/,1,Buy 1 share of amc ,It will help Keep it going 
2362,nmfv4v,t2_7ujzm8of,1622144871,/r/wallstreetbets/comments/nmfv4v/did_my_part_voting/,1,Did my part voting ,
2363,nmfve6,t2_5hcur6x6,1622144890,/r/wallstreetbets/comments/nmfve6/just_yolod_my_life_savings_into_amc/,1,Just YOLO d my life savings into AMC,
2364,nmfvu5,t2_cbfa6,1622144923,/r/wallstreetbets/comments/nmfvu5/small_investment_from_february_finally_paying_off/,1,Small investment from February finally paying off ,
2365,nmfvz2,t2_51lo4j0d,1622144933,/r/wallstreetbets/comments/nmfvz2/you_bstards_this_is_like_4_minutes_later/,1,you b stards this is like 4 minutes later ,
2366,nmfw0f,t2_6cnejuja,1622144936,/r/wallstreetbets/comments/nmfw0f/amc_due_to_follow_gme_trend/,1,AMC due to follow GME trend ,Looking at GME squeeze the price doubled by the day then tripled This is only the beginning APE WORLD HOLD STRONG
2367,nmfwbq,t2_cd6qcavx,1622144959,/r/wallstreetbets/comments/nmfwbq/amc_hold_today_to_the_moon_tomorrow/,1,AMC HOLD Today TO THE MOON TOMORROW ,
2368,nmfwf8,t2_4uow79z5,1622144967,/r/wallstreetbets/comments/nmfwf8/y/,1,y,i cant believe i had paper hands in the beginning i could have so much more but its okay cause the numbers i have are too big for me to understand so ill just leave it alone 
2369,nmfxid,t2_7lsu56tt,1622145042,/r/wallstreetbets/comments/nmfxid/sell_or_exercise/,1,Sell or exercise ,
2370,nmfxp9,t2_a1gng9h8,1622145058,/r/wallstreetbets/comments/nmfxp9/its_time_for_big_daddy_waking_up_shoot_so_quick/,1,It s time for big daddy waking up Shoot so quick in end ,
2371,nmfxy4,t2_9zjfa4k4,1622145077,/r/wallstreetbets/comments/nmfxy4/huge_109m_27_put_on_amc_expiring_tomorrow_this/,1,Huge 10 9M 27 PUT on AMC Expiring tomorrow This just came in now ,
2372,nmfy8x,t2_6kbprx33,1622145098,/r/wallstreetbets/comments/nmfy8x/clov_49_short_interest_last_time_i_checked_going/,1, CLOV 49 short interest last time I checked Going in ,
2373,nmfyeu,t2_amu8h74n,1622145112,/r/wallstreetbets/comments/nmfyeu/a_very_important_topic_which_is_that_the_arrow_of/,1,A very important topic which is that the arrow of game stop 252 last updated today for you this number is there a strong increase above the number mentioned,
2374,nmfyop,t2_n4wblwy,1622145133,/r/wallstreetbets/comments/nmfyop/how_it_feel_owning_amc_and_gme_right_now/,1,how it feel owning AMC and GME right now,
2375,nmfzb9,t2_8teesoj1,1622145179,/r/wallstreetbets/comments/nmfzb9/when_gme_hits_1_million_a_share_i_will_get_a/,1,When GME hits 1 million a share I will get a tattoo on my ass decided by WSB,Post ideas in the comment section Ape artists welcome to draw me up something good 
2376,nmfzdb,t2_aq1h9,1622145183,/r/wallstreetbets/comments/nmfzdb/me_irl_when_i_think_a_stonk_is_gonna/,1,Me IRL when I think a stonk is gonna ,
2377,nmfze9,t2_7bwtu2lf,1622145185,/r/wallstreetbets/comments/nmfze9/gme_shareholders_on_etoro_might_be_able_to_vote/,1,GME shareholders on Etoro might be able to vote before the annual meeting ,Got information to check my email tomorrow regarding the voting issue I complained that not being able to vote makes me want to stop investing via their platform and to consider switching to IBKR They could not disclose more information regarding the mail but I m hoping we will be able to vote before the annual meeting amp x200B TLDR Check your inbox tomorrow if you own GME shares on ETORO
2378,nmfzmn,t2_9xfzeqlx,1622145206,/r/wallstreetbets/comments/nmfzmn/these_daily_trades_are_going_crazy_tomorrow_is/,1,These daily trades are going crazy Tomorrow is round 2 ,
2379,nmfzpc,t2_a1ur6uk3,1622145212,/r/wallstreetbets/comments/nmfzpc/if_i_delete_rh_i_wont_owe_anything_right_amc_loss/,1,If I delete RH I won t owe anything right AMC Loss Porn,
2380,nmfzpr,t2_a0ph24il,1622145213,/r/wallstreetbets/comments/nmfzpr/spce_to_the_moon_literally/,1,SPCE to the moon LITERALLY,With the recent successful launch SPCE is competing with elon for recreational space travel This stock has been severely shorted and has potential to take off to the moon literally Kathy woods was also in on this stock and bailed before the successful launch Dont take advice from me though im just an ape Do your own research 
2381,nmfzv5,t2_5k0e8ce3,1622145223,/r/wallstreetbets/comments/nmfzv5/wsb_theme_wrapping_paper_for_my_wifes_boyfriends/,1,WSB theme wrapping paper for my wife s boyfriend s presents ,I LOVE IT Thanks to AMC I m gonna wrap all of my wife s boyfriend s Christmas presents with this shit LOL https preview redd it ekriymn9vp171 jpg width 1079 amp format pjpg amp auto webp amp s 2d99cf29acff3ce1917d1e5c2f7e674ac21bc885
2382,nmfzys,t2_aaty3nzt,1622145231,/r/wallstreetbets/comments/nmfzys/amc_to_100_tomorrow/,1,AMC TO 100 TOMORROW ,Yes Best DD EVER
2383,nmg03r,t2_2ufk0swk,1622145241,/r/wallstreetbets/comments/nmg03r/amc_is_a_distraction/,1,AMC IS A DISTRACTION,
2384,nmg0kv,t2_43y3er8,1622145277,/r/wallstreetbets/comments/nmg0kv/amc_short_squeeze_is_different_than_gamestop/,1,AMC Short Squeeze is Different than Gamestop Hedge Funds are buying too ,Don t you feel that hedge funds are playing both sides this time I believe there are a ton of hedge funds that are creating the buying pressure as well Hedge funds are master manipulators of price and know how to take advantage of market inefficiencies I believe they create posts on this reddit too They know how to pull the rug out on both sides When Gamestop Squeeze occurred they got caught with over 100 of the float shorted here with AMC there is only about 20 to 30 of the float short Also with GME wallstreet and hedgefunds didn t see it coming and even if they caught wind of it they scoffed at it and did not believe it would amount to anything at all This time around though they know that WSB has the ammo and enough retail investors on board to create some real havoc for hedge funds I guarantee you multiple people at hedge funds have eyes on the reddit boards at all times I believe some of them create posts here too Which is fine if they are on the side of the retail investor and are making trades in alignment with us However we all know they are masters of manipulation and can easily pull the rug out when we least expect it What do you believe the percentage of retail buyers vs hedge fund buyers is in the past week I would guess it s close to 50 retail investors 50 hedge funds We have to remember that although most retail investors are here to HODL hedge funds are here to take the rug out from under us and make as much profit as they can We should continue the ride to the moon but be aware that hedgefunds are passengers alongside of us agree or disagree https youtu be 3IEPISKl KM https youtu be 3IEPISKl KM 
2385,nmg128,t2_7yicxutu,1622145314,/r/wallstreetbets/comments/nmg128/this_is_awesome_nfts_never_hurt_nobody/,1,This is awesome NFTs never hurt nobody ,
2386,nmg19y,t2_a0upi39c,1622145331,/r/wallstreetbets/comments/nmg19y/my_small_gains_im_in_awe_of_the_apes_210_isnt_bad/,1,My small gains I m in awe of the apes 210 isn t bad Will it get to 2000 is the ,
2387,nmg1ih,t2_75cfzpjp,1622145350,/r/wallstreetbets/comments/nmg1ih/is_anyone_still_in_nokia_and_wants_to_make/,1,Is anyone still in Nokia and wants to make history with me ,
2388,nmg1kz,t2_a0tlm8e9,1622145356,/r/wallstreetbets/comments/nmg1kz/sndl_friday_lets_goooooooooooooooo/,1, SNDL FRIDAY LETS GOOOOOOOOOOOOOOOO,
2389,nmg1u4,t2_iaxow,1622145375,/r/wallstreetbets/comments/nmg1u4/massive_amc_selloff_tomorrow_morning_incoming/,1,massive amc sell off tomorrow morning incoming,dont be scared friends
2390,nmg1xu,t2_a4tlw0k2,1622145382,/r/wallstreetbets/comments/nmg1xu/go_spce_go/,1,Go SPCE GO ,
2391,nmg22g,t2_hhqdx,1622145392,/r/wallstreetbets/comments/nmg22g/been_buying_bits_and_pieces_of_amc_since_it_was/,1,Been buying bits and pieces of AMC since it was at 8 just yolo d all my digital monies into it at 28 To the Moon ,
2392,nmg23h,t2_9ym9ty0m,1622145394,/r/wallstreetbets/comments/nmg23h/my_posts_keep_getting_deleted_and_idk_why_just/,1,My posts keep getting deleted and IDK why Just trying to post something real and quite serious that I discovered and understood about volatility This can really take out hedge funds,
2393,nmg2dd,t2_21hkythw,1622145412,/r/wallstreetbets/comments/nmg2dd/short_sellers_of_bynd_are_still_not_worried_today/,1,Short sellers of BYND are still not worried today short percentage went up from 24 to 25 fellas I think you know what to do TRADE TEAM ASSEMBLE To WARRR Ahhhhh Charge ,
2394,nmg2jv,t2_7msj9y9h,1622145427,/r/wallstreetbets/comments/nmg2jv/ignore_this_cue_ball_we_all_know_he_is_working/,1,IGNORE THIS CUE BALL We all know he is working for the hedgies and is trying to take us off our goal AMC and GME to fucking Pluto and beyond ,
2395,nmg2pg,t2_4e8mgh6r,1622145437,/r/wallstreetbets/comments/nmg2pg/we_are_in_the_process_of_mooning_art_i_did_for/,1,We are in the process of mooning Art I did for the occasion AMC GME,
2396,nmg2rx,t2_43r35eha,1622145442,/r/wallstreetbets/comments/nmg2rx/wsb_discussion_today/,1,WSB discussion today,
2397,nmg32m,t2_557dlknj,1622145465,/r/wallstreetbets/comments/nmg32m/long_way_drop_when_you_get_bored_with_amc/,1,long way drop when you get bored with AMC,
2398,nmg37s,t2_2qivz3c1,1622145476,/r/wallstreetbets/comments/nmg37s/yolo_my_roth_ira_like_a_true_autist_45k_gain_from/,1,YOLO my Roth IRA like a true autist 45k gain from SPCE,
2399,nmg3d5,t2_xq9lx,1622145487,/r/wallstreetbets/comments/nmg3d5/if_you_give_enough_retarded_apes_keyboards/,1,If you give enough retarded apes keyboards,Most of them will buy gme and amc Then fling their keyboards at the wall so they can no longer sell 
2400,nmg3d5,t2_xq9lx,1622145487,/r/wallstreetbets/comments/nmg3d5/if_you_give_enough_retarded_apes_keyboards/,1,If you give enough retarded apes keyboards,Most of them will buy gme and amc Then fling their keyboards at the wall so they can no longer sell 
2401,nmg3f5,t2_3z2xkfnl,1622145491,/r/wallstreetbets/comments/nmg3f5/elon_musk_weed/,1,Elon Musk Weed,
2402,nmg3pa,t2_1b3bref,1622145511,/r/wallstreetbets/comments/nmg3pa/are_you_ready_boys/,1,Are you ready boys ,
2403,nmg3ve,t2_8131m7es,1622145525,/r/wallstreetbets/comments/nmg3ve/any_similar_programs_like_cfa_investment/,1,Any similar programs like CFA Investment Foundation ,Hey guys First time poster I have completed my bachelor s in humanities However I decided to pursue an MBA Right after the first few classes my inclination shifted towards finance I find it very interesting and practical I currently do not have the resources both time and money to pursue a CFA program But I want to build up my resume to show my interest in finance to potential recruiters I ve come across the CFA investment foundation program which was free of cost and really helpful during my initial journey My question is are their any similar programs available online that are free certified and credible that can help me learn and add more weight to my resume Once I m done with my MBA I will gradually put in efforts to complete the CFA program as soon as possible I want to enter into core Finance Any other tips would also be very helpful Thanks in advance 
2404,nmg3w9,t2_b9vgksz8,1622145527,/r/wallstreetbets/comments/nmg3w9/nokia_to_the_moon_next/,1,Nokia to the moon next ,
2405,nmg3xt,t2_8k8hrjak,1622145530,/r/wallstreetbets/comments/nmg3xt/anyone_know_why_tesla_just_spiked_tsla/,1,Anyone know why Tesla just spiked TSLA ,It went straight up moments ago anyone know why I already checked Twitter Elon didn t comment or tweet anything
2406,nmg40k,t2_4g4n4qx4,1622145536,/r/wallstreetbets/comments/nmg40k/i_like_the_stonk/,1,I Like The Stonk ,
2407,nmg4av,t2_a70pv924,1622145557,/r/wallstreetbets/comments/nmg4av/my_opinion/,1,My opinion ,
2408,nmg4c4,t2_5eh48gzr,1622145560,/r/wallstreetbets/comments/nmg4c4/hioxex_exchange/,1,HIOXEX exchange,Hello everybody Hope you re all fine Does anybody of you know anything about a chinese trading app called hioxex exchange It is kind of strange since I couldn t find anything about them online Did someone of you use the app in the past I downloaded it and it seems professional but also kind of shady because you can t find it on the app or play store They have a working help desk but they won t answer every question I have about them I m not sure if it is safe to trade or to put money on my wallet there Maybe someone of you did already work with that app I m really curious about the origin of that trading platform Any info would be helpful 
2409,nmg52h,t2_a1ndkltj,1622145609,/r/wallstreetbets/comments/nmg52h/amc/,1,AMC,
2410,nmg557,t2_80r9q3nw,1622145613,/r/wallstreetbets/comments/nmg557/amc_trendies/,1,AMC trendies, removed 
2411,nmg57b,t2_bd6q5,1622145616,/r/wallstreetbets/comments/nmg57b/what_are_your_moves_tomorrow_may_28_2021/,1,What Are Your Moves Tomorrow May 28 2021,Your daily trading discussion thread Please keep the shitposting to a minimum Navigate WSB We recommend best daily DD DD All https reddit com r wallstreetbets search sort new amp restrict sr on amp q flair 3ADD Best Daily https www reddit com r wallstreetbets search sort top amp q flair 3ADD amp restrict sr on amp t day Best Weekly https www reddit com r wallstreetbets search sort top amp q flair 3ADD amp restrict sr on amp t week Discussion All https reddit com r wallstreetbets search sort new amp restrict sr on amp q flair 3ADiscussion Best Daily https www reddit com r wallstreetbets search sort top amp q flair 3ADiscussion amp restrict sr on amp t day Best Weekly https www reddit com r wallstreetbets search sort top amp q flair 3ADiscussion amp restrict sr on amp t week YOLO All https reddit com r wallstreetbets search sort new amp restrict sr on amp q flair 3AYOLO Best Daily https www reddit com r wallstreetbets search sort top amp q flair 3AYOLO amp restrict sr on amp t day Best Weekly https www reddit com r wallstreetbets search sort top amp q flair 3AYOLO amp restrict sr on amp t week Gain All https reddit com r wallstreetbets search sort new amp restrict sr on amp q flair 3AGain Best Daily https www reddit com r wallstreetbets search sort top amp q flair 3AGain amp restrict sr on amp t day Best Weekly https www reddit com r wallstreetbets search sort top amp q flair 3AGain amp restrict sr on amp t week Loss All https reddit com r wallstreetbets search sort new amp restrict sr on amp q flair 3ALoss Best Daily https www reddit com r wallstreetbets search sort top amp q flair 3ALoss amp restrict sr on amp t day Best Weekly https www reddit com r wallstreetbets search sort top amp q flair 3ALoss amp restrict sr on amp t week Weekly Earnings Discussion Thread https www reddit com r wallstreetbets search sort new amp restrict sr on amp q flair 3A 22Earnings 20Thread 22 Read the rules https www reddit com r wallstreetbets wiki contentguide and make sure other people follow them Try No Meme Mode https www reddit com r wallstreetbets search q flair 3AMeme 20 flair 3ASatire 20 flair 3AShitpost amp restrict sr 1 amp t day amp sort hot also accessible through the top bar Follow Official WSB https twitter com Official WSB on Twitter all other accounts are impersonators 
2412,nmg5oa,t2_6cnejuja,1622145645,/r/wallstreetbets/comments/nmg5oa/amc_shorted_10_from_highs/,1,AMC shorted 10 from highs , removed 
2413,nmg5uk,t2_7ofa7hr2,1622145659,/r/wallstreetbets/comments/nmg5uk/leroyyyyyy_jenkinsssss_gme_250/,1,LEROYYYYYY JENKINSSSSS GME 250,Stop deliberating and just buy Gamma squeeze and beyond 
2414,nmg5vs,t2_a34w9lh4,1622145662,/r/wallstreetbets/comments/nmg5vs/amc_us_now/,1,AMC us now ,We are for placings on AMC How are things looking 
2415,nmg5z5,t2_a0q3947d,1622145668,/r/wallstreetbets/comments/nmg5z5/smaller_account_only_had_calls_on_space_but_still/,1,Smaller account only had calls on space but still big value for me still holding ,
2416,nmg60d,t2_c026yjcx,1622145670,/r/wallstreetbets/comments/nmg60d/amc_to_the_moon100/,1,AMC to the Moon 100 ,
2417,nmg6hv,t2_9zuvi56g,1622145704,/r/wallstreetbets/comments/nmg6hv/zillow/,1,Zillow, removed 
2418,nmg6pt,t2_75cfzpjp,1622145719,/r/wallstreetbets/comments/nmg6pt/nok_to_the_moon/,1,NOK to the moon,GME gt AMC gt BB gt NOK see you on the moon lets make history
2419,nmg6sk,t2_a30zip0l,1622145725,/r/wallstreetbets/comments/nmg6sk/on_closing_bell/,1,On Closing Bell ,
2420,nmg6t8,t2_a70pv924,1622145726,/r/wallstreetbets/comments/nmg6t8/my_thoughts_of_todays_price/,1,My thoughts of today s price , https preview redd it cjrar3f9yp171 png width 300 amp format png amp auto webp amp s d52504db124ff79d5dbc8a36cd792fc9080f914e
2421,nmg6ti,t2_7ofa7hr2,1622145727,/r/wallstreetbets/comments/nmg6ti/leroyyyyyy_jenkinsssss_gme_250_gamma_squeeze_and/,1,LEROYYYYYY JENKINSSSSS GME 250 Gamma squeeze and beyond ,
2422,nmg6u2,t2_7wg9exft,1622145729,/r/wallstreetbets/comments/nmg6u2/it_aint_much_but_its_honest_work/,1,It ain t much but it s honest work,
2423,nmg72o,t2_at463ym3,1622145745,/r/wallstreetbets/comments/nmg72o/undercover_stock_to_squeeze_after_gme_maybe_recaf/,1,Undercover Stock to squeeze after GME maybe RECAF,https oilprice com Energy Crude Oil Is There A Huge Undisclosed Short In Oil Explorer Reconnaissance Energy Africa html The numbers above however report that 57 16 of trading in the company s shares is short selling As a result that would mean that only 42 67 is divided amongst the other 3 trade identifiers If you divide this by 3 it appears only 16 is covering every day Only 16 is buying and only 16 is selling If only 16 is covering every day then there is 3 5 times more short selling than covering We called Tom Ronk of Buyins net after the report came out to dig deeper into the numbers He told us this could be one of the larger short positions as a of total volume he has come across in his experience recently He believes the total undisclosed short position in ReconAfrica s shares across Canada and the U S could be in the tens of millions of shares 
2424,nmg767,t2_9koklqi4,1622145752,/r/wallstreetbets/comments/nmg767/nept_to_neptune/,1, NEPT to NEPTUNE ,Neptune Wellness Solutions is working becoming a premium consumer packed goods company like Procter and Gamble but focused on Cannabis products The company is small and trades at 1x sales and really has massive potential to skyrocket Its traded on NASDAQ so not OTC although its a small company There are some real legs behind this one The CEO is a FUCKEN GENIUS and got into Costco without anyone knowing his name It wont be long before you start seeing NEPT s products in every large retailer and we all blast off puff puff with the stock Diamond hands this bitch FUCK YEAH https preview redd it bvn30y0zup171 jpg width 375 amp format pjpg amp auto webp amp s eb69a676fdf5cf7de9fd417ce9c57e92f8402132 
2425,nmg7bb,t2_9hi3ogjg,1622145762,/r/wallstreetbets/comments/nmg7bb/amc_500k/,2,AMC 500K ,
2426,nmg7ma,t2_2qivz3c1,1622145782,/r/wallstreetbets/comments/nmg7ma/spce_yolo_my_roth_ira_like_a_true_autist_is_this/,1,SPCE yolo my Roth IRA like a true autist Is this the way to retirement ,
2427,nmg7ol,t2_apo60,1622145787,/r/wallstreetbets/comments/nmg7ol/cotinue_to_flip_figs_ipo_screw_rh/,1, Cotinue to flip FIGS IPO Screw RH ,
2428,nmg7u0,t2_90wjmfvf,1622145798,/r/wallstreetbets/comments/nmg7u0/2677_at_close_they_were_trying_to_keep_it_under/,1, 26 77 at close they were trying to keep it under 27 for almost 11mil puts AMC,
2429,nmg86f,t2_3y1i53lg,1622145822,/r/wallstreetbets/comments/nmg86f/squeeze_my_nuts_cramer/,1,Squeeze my nuts Cramer,
