,postid,author,created_utc,permalink,score,title,selftext
1570,nmcmv7,t2_a0r6punb,1622136431,/r/wallstreetbets/comments/nmcmv7/gtc_orders_they_keep_you_missing_a_big_move_but/,1,GTC orders they keep you missing a big move BUT you have to remember that ll you put in a 19 sell when AMC was 11 I still made good but , removed 
1571,nmcmwp,t2_btbspny9,1622136433,/r/wallstreetbets/comments/nmcmwp/my_karma_is_tooo_low/,1,My Karma is tooo low ,
1572,nmcmxi,t2_akmiqwk4,1622136435,/r/wallstreetbets/comments/nmcmxi/hodl_for/,1,HODL for ,
1573,nmcmzt,t2_78nfb,1622136440,/r/wallstreetbets/comments/nmcmzt/found_someone_in_the_pltr_comments_on_webull_who/,1,Found someone in the PLTR comments on Webull who went through all the stages of grief since February,
1574,nmcn09,t2_16nwie,1622136441,/r/wallstreetbets/comments/nmcn09/held_through_the_first_squeeze_months_ago_liking/,1,Held through the first squeeze months ago Liking the stock now,
1575,nmcn4c,t2_2xe9r1rt,1622136449,/r/wallstreetbets/comments/nmcn4c/iinx/,1, IINX,
1576,nmcn5x,t2_747m51tn,1622136452,/r/wallstreetbets/comments/nmcn5x/i_am_minutes_away_from_life_changing_miracle/,1,I am minutes away from life changing miracle please I am 100k in debt from college all I can ask for is a simple 20 cent push please someone save my life ,
1577,nmcn7g,t2_7al655n1,1622136456,/r/wallstreetbets/comments/nmcn7g/buy_senseonics/,1,Buy Senseonics,Guys let s all rally together behind senseonics 
1578,nmcng5,t2_9ynzr6x3,1622136473,/r/wallstreetbets/comments/nmcng5/i_love_you_guys_i_lost_everything_in_2008_this_is/,1,I love you guys I lost everything in 2008 this is pay back Let s goooo sitting at 8 85 average and will never sell ,
1579,nmcnkq,t2_1z31dvho,1622136483,/r/wallstreetbets/comments/nmcnkq/first_time_yolo/,1,First Time YOLO,
1580,nmcnoz,t2_9slcqn01,1622136491,/r/wallstreetbets/comments/nmcnoz/sos_insane/,1, SOS INSANE ,
1581,nmco44,t2_cd97zgk0,1622136521,/r/wallstreetbets/comments/nmco44/hi_im_noob/,1,hi im noob,wanna buy ferrari and big house how about inverting in silver and gold
1582,nmcoh3,t2_1m6qgzew,1622136546,/r/wallstreetbets/comments/nmcoh3/my_brother_just_discovered_wallstreetbets_and_amc/,1,My brother just discovered Wallstreetbets and AMC especially Not a stakeholder myself but he literally just bought me a PS5 after this so Do him proud guys ,
1583,nmcon6,t2_vwrxuqm,1622136561,/r/wallstreetbets/comments/nmcon6/first_time_in_the_stock_market_but_im_holding_my/,1,First time in the stock market but I m holding my almost 3 shares you apes If I could get more I would ,
1584,nmcowk,t2_d01cg,1622136582,/r/wallstreetbets/comments/nmcowk/gotta_keep_that_gme_price_down_ken/,1,Gotta keep that GME price down Ken,
1585,nmcp7u,t2_myiw7,1622136604,/r/wallstreetbets/comments/nmcp7u/kobe/,1,KOBE ,
1586,nmcphq,t2_15xkvslr,1622136624,/r/wallstreetbets/comments/nmcphq/where_were_headed/,1,where we re headed,
1587,nmcpi5,t2_h8qxz,1622136625,/r/wallstreetbets/comments/nmcpi5/yolo_update_using_180k_was_100k_of_margin_to_buy/,1,YOLO update using 180K was 100K of margin to buy Palantir and Apple Still no margin call ,
1588,nmcpqk,t2_3z7ffdic,1622136641,/r/wallstreetbets/comments/nmcpqk/monday_i_yolod_all_i_had_left_after_3_months_of/,1,Monday I YOLO d all i had left after 3 months of red 3 days later I m 420 AMC,
1589,nmcpql,t2_s8zsxdt,1622136642,/r/wallstreetbets/comments/nmcpql/this_is_just_the_beginning/,1,THIS IS JUST THE BEGINNING,
1590,nmcpsf,t2_a1vz4z61,1622136646,/r/wallstreetbets/comments/nmcpsf/we_need_to_help_the_guys_in_rkt/,2,We need to help the guys in RKT,
1591,nmcpur,t2_a24nslpf,1622136651,/r/wallstreetbets/comments/nmcpur/more_fuel_needed/,1,More Fuel Needed,
1592,nmcq36,t2_7poxvre1,1622136669,/r/wallstreetbets/comments/nmcq36/weedmaps_merger_vote_set_for_june_10th_hitting/,1,Weedmaps merger vote set for June 10th Hitting the NASDAQ from SSPK into MAPS,
1593,nmcq67,,1622136675,/r/wallstreetbets/comments/nmcq67/yolo/,1,Yolo, deleted 
1594,nmcq7o,t2_an1kpj06,1622136678,/r/wallstreetbets/comments/nmcq7o/im_just_amazed/,1,I m just amazed,Full disclosure No facades no fronts I m newer here a guy who joined WSB after I missed out on the first squeeze and didn t want to miss out again I have never seen camaraderie like this before Everyone holding and refusing to sell for everyone s benefit The guys up 600k who are saying they won t sell so that the little guys with 32 shares like me can make big money too it s just amazing to me No one is selling and so many people have RIDICULOUS amounts of unrealized gains I have never seen anything like this and I am just honored to be a part of this movement Are we looking at the greatest exchange of wealth in history I think so amp x200B Stronger Together 
1595,nmcqgz,t2_a0a050eu,1622136698,/r/wallstreetbets/comments/nmcqgz/amc_still_holding/,1,AMC still holding , amp x200B Processing img jlslgz5m7p171 
1596,nmcqwf,t2_aiaz8szb,1622136730,/r/wallstreetbets/comments/nmcqwf/amc_should_accept_coin_as_payment_who_agrees/,1,AMC SHOULD ACCEPT coin AS PAYMENT WHO AGREES ,Imagine this This lovely stock could propel coin back on it s bull run and with that bring the entirety of coin investors to invest in AMC Win win situation Please share this idea so AMC can see this and get this going With that being said hold on tight for the ride to the moon apes 
1597,nmcqx1,t2_8caemvgj,1622136731,/r/wallstreetbets/comments/nmcqx1/amc/,1,AMC ,
1598,nmcr97,t2_9shu3iyn,1622136756,/r/wallstreetbets/comments/nmcr97/ok_tards_this_is_what_amc_ape_was_waiting_for/,1,Ok tards this is what AMC Ape was waiting for, removed 
1599,nmcrcv,t2_6ju79be7,1622136763,/r/wallstreetbets/comments/nmcrcv/hodor/,1,Hodor ,Hodor 
1600,nmcrcv,t2_6ju79be7,1622136763,/r/wallstreetbets/comments/nmcrcv/hodor/,1,Hodor ,Hodor 
1601,nmcrfo,t2_9y6mglf2,1622136768,/r/wallstreetbets/comments/nmcrfo/did_i_do_this_right/,1,Did I do this right ,
1602,nmcri2,t2_2a5kjkr,1622136773,/r/wallstreetbets/comments/nmcri2/all_aboard_the_black_berry_train/,1,All aboard the Black Berry train ,
1603,nmcrp8,t2_48qbug4q,1622136788,/r/wallstreetbets/comments/nmcrp8/yolo/,1,YOLO ,
1604,nmcrqt,t2_bmashld1,1622136792,/r/wallstreetbets/comments/nmcrqt/insider_innd_finally_filled_for_current_going_to/,1,Insider Innd finally filled for current going to pink and exploring to international business From here 0 015 to 0 70 in the next 1 month to come Mark my word innd,
1605,nmcrta,t2_vn1e50g,1622136797,/r/wallstreetbets/comments/nmcrta/congrats_to_the_amc_apes/,1,Congrats to the AMC Apes,I bitched out and sold at 24 45 doubled my money It hit 25 afterwards I hope you glorious apes the best and hopefully pump up gme more
1606,nmcry4,t2_7ndfexdk,1622136807,/r/wallstreetbets/comments/nmcry4/the_actual_reason_amc_soared_i_made_you_all/,1,The actual reason AMC soared I made you all millions Please just cover my loss,
1607,nmcryj,t2_a1vz4z61,1622136807,/r/wallstreetbets/comments/nmcryj/we_need_to_help_the_guys_in_rkt_there_is_to_much/,1,We need to help the guys in RKT There is to much short ratio it must go to the moon It have the name it have everything we need Come on guys lets to it,
1608,nmcs2a,t2_5ek6ftkl,1622136815,/r/wallstreetbets/comments/nmcs2a/internet_computer_backed_could_this_send_the_coin/,1,Internet computer backed Could this send the coin to moon ,
1609,nmcs3z,t2_69ghol4v,1622136818,/r/wallstreetbets/comments/nmcs3z/spce_gains_and_holdinggg/,1,SPCE GAINS AND HOLDINGGG,
1610,nmcsxe,t2_a0w9p77o,1622136877,/r/wallstreetbets/comments/nmcsxe/is_wish_a_possible_short_squeeze/,1,is WISH a possible short squeeze ,
1611,nmcsxx,t2_a0zs6ls1,1622136878,/r/wallstreetbets/comments/nmcsxx/amc_to_the_moon/,2,Amc to the moon ,
1612,nmct1q,t2_a0aohpzh,1622136887,/r/wallstreetbets/comments/nmct1q/thats_a_solid_percentage_gain/,1,That s a solid percentage gain ,
1613,nmct3d,t2_llp1b,1622136890,/r/wallstreetbets/comments/nmct3d/got_out_of_vaxart_and_figured_why_not_need_to/,1,Got out of vaxart and figured why not Need to make up a 600 loss but here we go ,
1614,nmct5s,t2_a28m0i7k,1622136894,/r/wallstreetbets/comments/nmct5s/magic_average_cost_69xx/,1,Magic average cost 69 xx,
1615,nmctak,t2_a1h3ln94,1622136904,/r/wallstreetbets/comments/nmctak/amc/,1,AMC ,How long is this Short squeeze gonna take on Is there a day maybe tomorrow 
1616,nmctf9,t2_954zszrl,1622136912,/r/wallstreetbets/comments/nmctf9/not_selling_hold_the_line/,1,Not selling Hold The Line ,
1617,nmctll,t2_a0a050eu,1622136923,/r/wallstreetbets/comments/nmctll/thats_what_an_amc_rocket_looks_like/,1,Thats what an AMC rocket looks like,Still holding https preview redd it aplkxgec8p171 png width 982 amp format png amp auto webp amp s f3a44952383ba2da14a6b5ca016f2cc6bf3edc44
1618,nmctqo,t2_9m6cen2u,1622136934,/r/wallstreetbets/comments/nmctqo/capc_ready_to_ship_new_smart_mirror_looks_ready/,1,CAPC Ready to ship new Smart Mirror looks ready to shock the tech world , Capstone Companies brings an affordable Smart Mirror with ease of ordering and minimal lead times kids brushing teeth women doing makeup men at the barber shop you might start seeing this technology become more and more popularized Smart Mirror Product Action Shot https imgur com a ZNJri3r CAPC is a debt free penny stock exempt company currently trading on the higher tier OTCQB markets with audited financials and fully SEC reporting During last week s conference call CEO confirmed that Smart Mirrors will begin shipping in June on Capstone s website and will be available on Amazon The company confirmed that the Smart Mirror will be in big box retailers in second half of 2021 Capstone products currently sell in major retailers like Costco Home Depot Walmart Target and more It s amazon reviews for it s previous products are 5 stars They know how to build a quality product that sells Tweet from Capstone Companies Inc https imgur com a ur3npx5 The number of outstanding shares is just under 50M with the company directors owning nearly half of the shares leaving a float of 24M Directors have never sold a share over company s history zero dilution In fact they added 400K worth of shares in the last couple of months in the open market with plans to buy another 750K shares through August This company believes in the product 750k Shares bought in open market 750K more to be bought https imgur com a VcBVhHD Form 5 Directors Buying Shares https www otcmarkets com filing html id 14861233 amp guid geqnUaiFu4E Kth This will easily appreciate in value once revenues from Smart Mirror are realized This company is primed for growth and the corporation is already preparing for possible uplisting to NASDAQ Establishment of Auditing Commitee https imgur com a BccWiwL Beyond this the Smart Mirrors are just cool people want them and the price point for CAPC mirrors is huge for what it offers Only 699 starting price means it is affordable for the average person and you can mirror your phone and engage with the mirror just like you would a tablet or touch screen PC I think this product blows LULU mirror out of the water as far as functionality and price point Connor McGregor enjoys his smart mirror in his luxury hotel room https video twimg com ext tw video 1396830634677469185 pu vid 720x722 rUK4qd5ZsPKEg8tC mp4 CAPC should have no problem selling Smart Mirrors direct to consumers but also in acquiring contracts with hospitality providers restaurant bathrooms and high end developments
1619,nmcu3h,t2_6dh6qngt,1622136961,/r/wallstreetbets/comments/nmcu3h/charge_point_due_dilligence/,1,Charge Point Due Dilligence,Position 576 24 02 DESCRIPTION Charge Point is an electric infrastructure company that designs develops amp manufactures hardware amp software solutions for electric vehicles at large It offers a portfolio of hardware software amp services for corporate public amp residential customers Company was founded in 2007 and operates in 14 countries History In June 2017 CHPT took over 9 800 electric vehicle charging spots from GE Prior to that point CHPT managed 34 900 charging stations across Mexico Australia Canada and the United States The current CEO and president as of 2018 is Pasquale Romano On November 28 2018 CHPT raised 240 million At the time CHPT maintained 57 000 charging spots In 2019 VW s Electrify America https en wikipedia org wiki Electrify America and CHPT agreed to provide common access to their US customers Company reached 100 000 chargers in September 2019 while adding more than 2 000 charging locations per month Currently CHPT offers 132k charging station network Which accounts for 72 market share of total level 2 charging in North America New entity was formed from Legacy Charge Point combined with Switchback late Feb 2021 What is the business model of CHPT Charge Point sells hardware amp software equipment amp network subscriptions to property owners The company doesn t own the majority of stations It doesn t monetize energy It only monetizes the driver thus capital light business model BUSINESS OVERVIEW Market Cap 7bn Shares Float 299mln Institutional ownership 13 2 Year CAGR Revenue Growth 65 65 5 Year 60 TAM 190bn Newly formed entity has no Debt Cash amp Cash Equivalents 650m Exponential Revenue growth amp estimated profitability in 2024 with 41 Gross Margin Source https switchback energy com wp content uploads 2020 09 ChargePoint New Investor Deck 23 Sept 2020 8K pdf https switchback energy com wp content uploads 2020 09 ChargePoint New Investor Deck 23 Sept 2020 8K pdf CHPT enjoys the largest share https investors chargepoint com why invest default aspx of Level 2 chargers in the US Data from AFDC https afdc energy gov fuels electricity locations html analyze fuel ELEC shows that CHPT wields the largest market share at 42 8K L2 chargers out of 92 8K total of which 11 5K are non networked carving 53 market share of networked chargers No 2 competitor is Tesla with 16 8K No3 largest is SemaCharge Network at 5 2K followed by Blink with 3 1k which is 4th In terms of L3 Superchargers where Tesla leads the way with 10 7k of 19 6k units CHPT is competitive with 1 5k with only Electrify America coming in higher at 2 5k Superchargers account for 22 of the market pie L2 75 and L1 3 of market share People keep reiterating that L3 is the future and no one should bother with L1 amp L2 Well that s wrong L3 is obviously the option for the highways commercial and service transportation Even larger segment though is found at parking lots restaurants cinemas sports arenas malls corporate offices and other mass conglomerations This is where L2 comes to play much cheaper than L3 to install but with longer charging times perfect fit Products Comprehensive Hardware Portfolio Delivers Solutions for every use case all vehicle types and brands High efficiency in power and footprint Modular scalable secure architecture designed for serviceability Unparalleled quality advanced testing vehicle functional climate environment for long term reliability Options for site hosts to use custom branding Software Enables Control of who can use stations and when All vehicles to get charged on time Multiple vehicles to share power Drivers to get in line when ports are occupied Roaming integrations with other charging networks Challengers VLTA Claims to go beyond just charging EVs their chargers are used for ads and their charger placement is based on data analytics in collaboration with PLTR When company compares itself to the competition they do it all they own the gear they sell the electricity they provide software and networks they do fancy data things they do advertising The things they don t do are manufacture and sell the chargers They cherry pick a bunch of stats to show that their chargers have better engagement but given they only have 1 7k Level 2s amp 6 L3 It s like chargers as billboards selected to prime locations Anyone can replicate it if it provides substantial revenue boost competitors will emulate it SemmaConnect Company boasts 3rd largest market share of L2 chargers SemmaConnect also manufactures chargers and sell software SemaConnect chargers are OCPP compliant Sema appears not to have a L3 offering nor do they appear to offer sales to individuals single family residential EVGO EVgo claims to have made the first 150kW and 350kW L3 chargers and base their business largely on L3 chargers AFDC data says they only have 403 L2s but 1 4k L3 which garners 4th market share Company also offers drivers a membership for reduced charging rates 0 04 min assuming you spend 7 99 month and they have integrated Tesla connectors on their newer L3 EVgo also has a nationwide infrastructure roll out deal with GM and are entirely powered by renewables What differentiates the company is the L3 focus BLNK Overhyped POP stock Blink sells L2 and L3 chargers to business and individuals Claims to operate on an owner operator model From EC The Company made continued progress with its owner operator strategy the number of commercial Blink owned charging stations contracted or deployed during the quarter grew by 51 in the fourth quarter compared to the prior year period VWAGY Subsidiary Electrify America L3 focused company it enjoys 2 5k L3 chargers EM also sells a L2 for the home EM offers an app membership for drivers with a monthly fee that gets you a good discount on their charging costs The membership and cost to charge suggests that they own their chargers EM also have an electric vehicle subscription service and have some relationships with Jeep and Hyundai All its reports seem to be released to the California Air Resources Board Company doesn t appear to build their own chargers instead relying on procurement using third party hardware and software Near Term Catalysts In relation to upcoming US government infrastructure bill AlixPartners estimates 300 billion will be needed to build out a global charging network to accommodate the expected growth of EVs by 2030 including 50 billion in the U S alone It s not too late to make bets on upcoming infrastructure bill Yes you can dabble into construction firms and commodity plays but you don t know which companies will win lucrative contracts and sizes of those contracts Well the biggest companies you might say It s not that clear cut What is clear cut is that the focal point of this infrastructure bill is transition to renewable energy and overhaul of pivotal infrastructure CHPT has the most experienced 14yrs company with largest manufacturing capacity technical know how and ability to take on large scale projects like building hundreds of thousands of charging stations across all states 500k by 2030 Oh yeah one more thing former CHPT board member is in current administration That s only US CHPT operates infrastructure in the hub of world s renewable energy aka Europe Also Canada Australia UK Mexico among other places You find yourself at the erection of the infrastructure that you and your kids will be utilizing down the road Just like railways roads telcoms and internet Long Term Catalysts Fossil fuel bans Transit electrification dates Incentive programs All major auto OEM brands committed to electric Further EV cost reductions with advances in battery technology CHPT Growth Directly Proportional to EV Penetration CHPT Estimated 1B Revenue at 3 EV Penetration Miscellaneous CHPT Apple Store rating 4 6 CHPT also has the 1 bestselling home charging station on Amazon with hundreds of 5 star reviews CHPT offers access to hundreds of thousands of places to charge with one account via proprietary app In collaborations with Daimler Toyota BMW Siemens etc No1 choice for Fortune 500 companies Customers include Google Target IKEA NASA GM Pepsico Disney McDonalds FedEx Stanford etc Shareholders lock up period ends on September 1st MOAT First Mover Advantage With 14 years of experience in a nascent industry this is where big contracts will go Asset light business model Selective ownership of charge stations outsources maintenance amp responsibilities to the owner Economies of Scale CHPT has largest manufacturing capacity Network Effect 75 of charging network market share amp operations in 14 countries CONCLUSION All in all CHPT stock is a pure EV exposure with light CapEx business model Company is the ecosystem player with defensible MOATs recurring revenue streams and visibility CHPT finds itself in eco friendly category and attracts premium valuation due to penetrance in multiple domains EV Ecosystem Hardware Software Powered Solutions and Energy Technology Yes most of its network is L2 chargers but it s where most of the money is to be made As users go to restaurants malls sports events concerts office cinema universities or just a Parking Lot There will be L2 charger not L3 due to Charger Cost Basis Time Parked Pretty straightforward formula Why am I interested in CHPT Because it s an entrenched leader with tremendous experience in a nascent industry Because it s a clever business model based on light assets which will subsequently offer high margins 5 years from now And is literally replacement of GAS stations no matter what happens And is a home GAS station Because EVs are the future and I am catching the momentum and inevitable supremacy and prevalence of charging stations A small market cap in the market that will explode no matter what This is really well rounded company with superb fundamentals amp 13 institutional ownership what s going to happen to the stock when institutions commence adoption of it Let me use a technical term you ll understand the valuation will go bananas Average target price 38 21
1620,nmcu5n,t2_6ndvjnr8,1622136966,/r/wallstreetbets/comments/nmcu5n/whos_behind_this/,1,Who s behind this ,Y all behind RKT also 
1621,nmcu65,t2_j5lue,1622136967,/r/wallstreetbets/comments/nmcu65/spce_to_the_moon_back_with_gme_and_amc_in_the/,1,SPCE to the MOON amp Back with GME and AMC in the cargo bay ,Hi ape folks I m semi new here but not new to investing and managing money I have a decent understanding of the ugly games and criminal behavior that happens all day long on WS SPCE GME and AMC are our way to punch these bastards where it counts They ONLY care about returns and many will do almost anything to generate solid returns amp x200B I own all the above stocks but I m leaning a little more towards SPCE at the moment 60 20 20 and this is why amp x200B Great news over the weekend 52 million shares short largest of all 3 Steady incoming news over the coming weeks RB is now prepping for high flight and that should happen this summer Beautiful chart that is just getting warmed up Few options for investment in space exploration Getting listed on Russian exchange this Monday I don t know how much this will add fuel Short added to their positions over the past few days amp x200B Most importantly I absolutely hate the disgusting things that happen under the radar on WS Many sell their souls to they devil in the name of making a profit at any cost They would gladly F us over all day long and celebrate They need to get crushed again in all 3 names and they will SPCE now has significantly more shares short vs January and we all know what happened Good luck folks and it s our time NO MERCY 
1622,nmcux7,t2_60cp23i7,1622137021,/r/wallstreetbets/comments/nmcux7/sdc_smile_or_nah/,1,SDC Smile or nah ,Anybody got opinions on SDC I thought it would do better than it has Thanks 
1623,nmcv45,t2_8s22bbg0,1622137035,/r/wallstreetbets/comments/nmcv45/amc_diamond_hands_i_do_like_the_stock_long_term_i/,1, AMC Diamond hands I do like the stock long term I think I m going to go see a few movies Mask mandate lifted everybody starting to get out there New movies with original release in 2020 now scheduled this year with even MORE movies ,
1624,nmcv4c,t2_5qaimvmd,1622137035,/r/wallstreetbets/comments/nmcv4c/buy_high_never_sell_amc/,1,Buy high never sell AMC,
1625,nmcvw9,t2_7fidkyvb,1622137090,/r/wallstreetbets/comments/nmcvw9/dumped_all_my_savings_on_uwmc_retard_investment/,1,Dumped all my savings on UWMC retard investment but YOLO ,
1626,nmcvwq,t2_79xxenx7,1622137091,/r/wallstreetbets/comments/nmcvwq/how_the_hedies_r_feeling_about_now/,1,How the Hedies r feeling about now,
1627,nmcwlq,t2_2o6m7hml,1622137147,/r/wallstreetbets/comments/nmcwlq/im_going_to_need_popcorn_for_this_moon_exploration/,1,I m going to need popcorn for this Moon Exploration,
1628,nmcwmg,t2_a0schp0q,1622137148,/r/wallstreetbets/comments/nmcwmg/should_i_put_a_options_gain_on_amc_or_did_i_miss/,1,Should I put a options gain on AMC Or did I miss it ,
1629,nmcx0b,t2_9zn9e79h,1622137176,/r/wallstreetbets/comments/nmcx0b/jim_rn/,1,Jim rn,
1630,nmcx1l,t2_82gxojxz,1622137178,/r/wallstreetbets/comments/nmcx1l/just_went_all_in_on_uwmc_have_a_feeling_that_this/,1,Just went all in on UWMC have a feeling that this rocket you don t want to miss , UWMC all the way 18 eom 
1631,nmcxcu,t2_13uy5yl1,1622137201,/r/wallstreetbets/comments/nmcxcu/bonding_with_my_mother_i_just_want_to_show_her_i/,1,Bonding with my mother I just want to show her I can peel bananas all on my own,
1632,nmcxeb,t2_7u3mf674,1622137203,/r/wallstreetbets/comments/nmcxeb/lets_go_had_to_jump_on_in_with_you_guys_and_tried/,1,Let s go Had to jump on in with you guys and tried to help out a bit ,
1633,nmcxev,t2_3zeha0nq,1622137203,/r/wallstreetbets/comments/nmcxev/amc/,2,AMC ,AMC YOLO
1634,nmcy2w,t2_a6v3u3pq,1622137250,/r/wallstreetbets/comments/nmcy2w/amc/,1,AMC, removed 
1635,nmcy8y,t2_426299tq,1622137263,/r/wallstreetbets/comments/nmcy8y/amc_is_popping_off_rn/,1, AMC is popping OFF RN,
1636,nmcybf,t2_9ul37pza,1622137268,/r/wallstreetbets/comments/nmcybf/back_in_january_i_invested_damn_near_18k_loss/,1,Back in January I invested damn near 18k loss about 13k when they cheated Dropped almost 6 bands this morning looking for revenge apesquad,
1637,nmcyc9,t2_cbc51cb1,1622137270,/r/wallstreetbets/comments/nmcyc9/i_will_not_let_theta_anal_rape_me_anymore/,1,I WILL NOT LET THETA ANAL RAPE ME ANYMORE ,
