,postid,author,created_utc,permalink,score,title,selftext
759,nm6tp3,t2_17aiek,1622120170,/r/wallstreetbets/comments/nm6tp3/i_spy_527_read/,1, I SPY 5 27 Read ,SPY Bullish Neutral Market Data https preview redd it bvwe7vvrrn171 png width 1914 amp format png amp auto webp amp s 2fc124fe19a473b7bce0ee0d33e1a27371aaa927 SPY SG Gamma Index Increased to 0 05 low volatility Vol Trigger Unchanged Abs Gamma Strike Unchanged Gamma Notional Increased to 224 A large positive gamma position infers lower volatility in the underlying Put Wall Support Unchanged Call Wall Strike Unchanged Gamma Tilt Increased to 1 07 If the ratio increases it s considered a bullish signal Net Delta Decreased to 190 49 9 positive delta position infers options market makers have a net long hedge 25d risk reversal Increased to 0 07 slight increase in put demand Topp Abs Gamma Strikes 425 420 418 415 https preview redd it dztckgs0tn171 png width 2390 amp format png amp auto webp amp s e697a68c93e8841b535505fc82f1c894c33d5a59 TA Notes Yesterday s price still hold for today If 420 73 breaks look for bullish 422 43 423 81 425 15 If 417 25 breaks look for bearish 416 415 414 13 412 74 411 26 410 Please not that if we push below 415 we could see downwards pressure to 405 https preview redd it 9hte2frctn171 png width 3400 amp format png amp auto webp amp s 187b6db6bbab781f0d4904271226f5fe78665a81 SPY v VIX Bulls need lt 19 Bears need gt 20 Processing img pff67xnstn171 15min RSI Bulls need 63 40 70 77 53 87 99 Bears need 41 5 37 2 22 9 16 08 Processing img i23l02w0un171 From I SPY 5 26 Recap and 5 27 Outlook https www reddit com r wallstreetbets comments nlsx4z i spy 526 recap and 527 outlook https preview redd it cdgsbj6fun171 png width 2374 amp format png amp auto webp amp s 80f33701d04821058fc40f0cf053bb57e1f96304 Thanks for reading NightMan
760,nm6ug3,t2_65gtz,1622120234,/r/wallstreetbets/comments/nm6ug3/well_miss_you_umemetron9000/,1,We ll miss you u Memetron9000,
761,nm6vg7,t2_c2424mdp,1622120328,/r/wallstreetbets/comments/nm6vg7/mvis_dd/,1,MVIS DD,Just thinking out loud here no advice found in this tread What a day yesterday but as expected per my last DD The question now is since MVIS is sub 15 will the downward movement continue or will the stock stagnate around 15 for awhile Looking at the usual metrics the only thing that can significantly answer this question is the placement of options for now This is because https preview redd it 61qdor9stn171 png width 2228 amp format png amp auto webp amp s 01556f96df70c1f4293f70b4f707763e2594640d There is reasonable protection from dealer gamma but this can be a double edged sword if it rises too quickly too much But in this case a marginal decrease with a significant price drop is a relatively good sign The price despite its drop ended about where it was expected to at the lower band of expectation amp x200B https preview redd it 7oiku922un171 png width 2192 amp format png amp auto webp amp s 72d134ddb771c880e75591ac8beab90417ac896a https preview redd it u3elpj34un171 png width 2120 amp format png amp auto webp amp s df325eb5f5650313c6dac91446c37681c21f333c https preview redd it xxfkrp55un171 png width 2168 amp format png amp auto webp amp s 280b23f69b58e948fb500e0da0877a5e9677137a The options landscape hasn t changed that much relatively speaking The price moved down below the largest chunk of calls at 15 again as expected So in attempting to divine the future one must ask are there any forces at play that are more significant than the others The answer currently no but the cliff is near Take a peak at these metrics https preview redd it 022b4ildun171 png width 694 amp format png amp auto webp amp s 3895f4fb62252b9f4e3b9a2a9949f025598675fe These are the number of shares assuming all dealer intermediary that must be bought or sold per combination of price IV increase MVIS is in the uncomfortable position where any increase in IV will result in selling This is unusual and slightly unhealthy So MVIS seems entirely contingent currently on liquidity if it remains low then it will probably waiver around 15 until big upstream moves are made If IV begins to rise than a cycle of selling could be initiated Per the options if this happens the only floor of sorts would be around 10 with the 18k Puts Keep an eye on volatility 
762,nm6vrf,t2_8l6libu,1622120356,/r/wallstreetbets/comments/nm6vrf/amc_down_5_after_hours_time_to_watch_carefully/,1,Amc down 5 after hours Time to watch carefully , removed 
763,nm6w31,t2_4q8ugs57,1622120386,/r/wallstreetbets/comments/nm6w31/32_up/,1,32 up ,
764,nm6w6c,t2_89u81ogg,1622120394,/r/wallstreetbets/comments/nm6w6c/short_squeeze_ttcf/,1,Short Squeeze TTCF,
765,nm6x0y,t2_9zrhi2w0,1622120449,/r/wallstreetbets/comments/nm6x0y/visualizing_my_everyday_struggle/,1,Visualizing my everyday struggle ,
766,nm6x1e,t2_y8i2s,1622120451,/r/wallstreetbets/comments/nm6x1e/6t_budget_for_fy2022_2t_in_deficits_forever_82t/,1, 6T budget for FY2022 2T in deficits FOREVER 8 2T budget expected by 2030 , removed 
767,nm6x4t,t2_afi36uus,1622120458,/r/wallstreetbets/comments/nm6x4t/telegram_channel_group_chat_linked_for_apes_who/,1,Telegram channel group chat linked for apes who like to telegram notfinancialadvise, removed 
768,nm6xwf,t2_4q8ugs57,1622120523,/r/wallstreetbets/comments/nm6xwf/32_gain_and_climbing/,1,32 gain and climbing ,
769,nm6yzx,t2_a7h32hzb,1622120615,/r/wallstreetbets/comments/nm6yzx/polygons_nailwal_wants_elon_musk_to_back_his/,1,Polygon s Nailwal wants Elon Musk to back his blockchain platform after Mark Cuban comes on board,
770,nm6z26,t2_a0etc2hb,1622120621,/r/wallstreetbets/comments/nm6z26/cant_argue_with_the_stairmaster_500k_floor/,1,Can t argue with the stairmaster 500K FLOOR ,
771,nm6zdu,t2_a2g2b6vk,1622120646,/r/wallstreetbets/comments/nm6zdu/tell_run_that_up/,1, Tell run that up,
772,nm6zn5,t2_aaugvclw,1622120667,/r/wallstreetbets/comments/nm6zn5/kdmn_over_25_short_on_itcould_it_be_the_next_play/,1,KDMN over 25 short on it could it be the next play ,
773,nm6zzr,t2_93xga3d,1622120697,/r/wallstreetbets/comments/nm6zzr/update_1tellurian_and_gunvor_sign_10year_lng/,1,UPDATE 1 Tellurian and Gunvor sign 10 year LNG agreement,
774,nm70dy,t2_a0etc2hb,1622120728,/r/wallstreetbets/comments/nm70dy/when_the_hedgefucks_think_ill_sell_before_100k/,1,When the hedgefucks think I ll sell before 100k ,
775,nm70fn,t2_5slw6nla,1622120732,/r/wallstreetbets/comments/nm70fn/boxl/,1,BOXL ,Any thoughts on this company Their a low float low cost stock They won a few awards and I believe Microsoft is working with them Anyone have any feedback on this company 
776,nm70j0,t2_a30udu7i,1622120740,/r/wallstreetbets/comments/nm70j0/amc_current_price_is_way_high_for_what_amc_is/,1,AMC current price is way high for what AMC is worth people will not go back to movie theatres any time soon if all AMC is the next kodak stay away from this and invest your hard earned money in growth stocks like apple google tesla and intel Be careful apes,
777,nm71eo,t2_9tomz21g,1622120814,/r/wallstreetbets/comments/nm71eo/lizi_dd_one_of_the_most_volatile_stocks_yesterday/,1,LIZI DD One of the most volatile stocks yesterday, removed 
778,nm71g1,t2_a135lhjc,1622120818,/r/wallstreetbets/comments/nm71g1/control_number/,1,Control number ,Can anyone tell me where to find the control number for robinhood 
779,nm71sd,t2_9zjfa4k4,1622120848,/r/wallstreetbets/comments/nm71sd/huge_call_and_put_expiring_tomorrow_for_gme/,1,Huge CALL and PUT expiring tomorrow for GME,
780,nm71vy,t2_4yl66v77,1622120856,/r/wallstreetbets/comments/nm71vy/dd_linkedin_may_never_go_public_but_you_can_still/,1,DD LinkedIn May Never Go Public But You Can Still Buy Them,I feel like most of these DDs are 10 paragraphs with numbers and pretty graphics and shit Luckily for you retards I m too lazy for that amp x200B LinkedIn is the biggest and baddest in the social networking professional space Too bad MSFT saw this years ago and decided to buy them so knowing the true value is pretty hard That being said they re not the only fish in the sea and yesterday one of those fish went public amp x200B ZipRecruiting ZIP IPOd yesterday and unlike COIN didn t immediately shit the bed It actually went up weird right Anyways everyone and their dog is going to be looking for jobs now that covid is over and the stimulus checks dry up so calls on ZIP as their revenue shoots to the mooooooonnnn especially after you all lose your ass on GME and AMC and even wendys wont hire you so youll need to use these guys to find a job amp x200B TLDR buy ZIP because no options yet
781,nm72jw,t2_a4cj2h98,1622120913,/r/wallstreetbets/comments/nm72jw/gme_2_return_of_the_apes_remastered/,1,GME 2 Return of the Apes remastered ,
782,nm72u9,t2_9zjfa4k4,1622120940,/r/wallstreetbets/comments/nm72u9/huge_call_puts_placed_yesterday_on_gme_expiring/,1,Huge CALL amp PUTS placed yesterday on GME expiring tomorrow,
783,nm72xy,t2_13pvee,1622120950,/r/wallstreetbets/comments/nm72xy/expect_meme_stock_tanking_dont_panic_remove_stop/,1,Expect meme stock tanking don t panic remove stop losses HODL Expect fuckery today tomorrow ,Some of the FUD seems to want to make us believe that the squeeze squoze but it didn t Remember that Expect a large drop in price likely from hedgefuckery The tactic is to pump up the stock then ladder it down sharply to trigger stop losses or trick apes into selling for small profits by making them panic Don t fall for it Do not worry about missing the squeeze It will last for a day several days If the DD is even remotely correct the shorts will have to cover the float multiple times before the price will start to lower again If he s still in I m still in We like the stock Can t stop Won t stop 
784,nm731d,t2_a135lhjc,1622120959,/r/wallstreetbets/comments/nm731d/assistance_needed/,1,Assistance needed ,Mornin apes I ve voted with Fidelity for GameStop but I can t find my control number for Robinhood Can anyone help out with this 
785,nm734w,t2_a44a2dfb,1622120968,/r/wallstreetbets/comments/nm734w/amc/,1,AMC ,
786,nm73bq,t2_a1ea2pk4,1622120983,/r/wallstreetbets/comments/nm73bq/edreams_my_best_reopening_play/,1,eDreams my best re opening play, removed 
787,nm73r5,t2_a12ax9qt,1622121021,/r/wallstreetbets/comments/nm73r5/kramer_was_talking_about_the_wsb_crowd_being/,1,Kramer was talking about the WSB crowd being focused mostly on GME and AMC He thought a short squeeze on BYND Beyond Meat my be the next play He says the WSB group doesn t like him I don t see much about BYND on WSB What do you all say is BYND a play ,
788,nm73r6,t2_9zjfa4k4,1622121021,/r/wallstreetbets/comments/nm73r6/huge_call_put_placed_yesterday_on_gme_expiring/,1,Huge CALL amp PUT placed yesterday on GME expiring tomorrow ,
789,nm74do,t2_7530b3pr,1622121073,/r/wallstreetbets/comments/nm74do/get_free_stocks_upto_200_by_using_my_referral/,1,Get free stocks upto 200 by using my referral ,
790,nm74je,t2_a1ht6xzp,1622121087,/r/wallstreetbets/comments/nm74je/hello_retards_hi_kenny_hi_jimmy_shill/,1,Hello Retards Hi Kenny hi Jimmy shill , removed 
791,nm74vt,t2_71tyguau,1622121119,/r/wallstreetbets/comments/nm74vt/position_open_for_a_tesla_call_at_635/,1,Position open for a Tesla call at 635,
792,nm750s,t2_3899j,1622121131,/r/wallstreetbets/comments/nm750s/gme_could_issue_a_digital_divided_security_token/,1,GME could issue a digital divided security token,The TLDR GME issues a dividend of a security that short sellers cant issue and therefore have to buy back all short positions https wccftech com gamestop gme can eviscerate shorts and dramatically boost the profile of its nft push by buying back shares using a blockchain based native security token https wccftech com gamestop gme can eviscerate shorts and dramatically boost the profile of its nft push by buying back shares using a blockchain based native security token Instead of issuing a dividend why wouldn t they just change all outstanding shares to a security token If you own GME you can trade in your Class A shares common Stock for Class B shares Security Tokens Then short sellers are forced to buy back all shares when users cash in Overstock OSTK did this with some success with OSTKO
793,nm757v,t2_9zk58xgv,1622121150,/r/wallstreetbets/comments/nm757v/retard_in_need_of_help/,1,RETARD IN NEED OF HELP,boys a brother needs some good plays for the day I need to hit big soon so I can start my own food truck Hit we with some stocks so I can do some quick DD When I make it drinks on me gents b
794,nm75oq,t2_7pot5ft5,1622121188,/r/wallstreetbets/comments/nm75oq/i_heard_that_blackberry_was_up_10_yesterday_so_i/,1,I heard that Blackberry was up 10 yesterday So I hurried to the store and bought a couple boxes for a store of value Do you guys think this was a wise financial decision Will blackberry see another 10 today ,
795,nm76te,t2_9319bsob,1622121284,/r/wallstreetbets/comments/nm76te/buy_ford_new_electric_truck/,1,Buy Ford New electric truck , removed 
796,nm7771,t2_30uraji6,1622121318,/r/wallstreetbets/comments/nm7771/media_spills_fake_news_again_this_time_it_is_bynd/,1,Media Spills Fake News again This Time it is BYND,
797,nm786a,t2_7pot5ft5,1622121400,/r/wallstreetbets/comments/nm786a/i_heard_that_blackberry_was_up_10_yesterday_so_i/,1,I heard that Blackberry was up 10 yesterday So I hurried to the store and bought a couple boxes I did this for a store of value If the price of Blackberry continues to go up I will make money of these Do you guys think this was a wise financial decision Will blackberry see another 10 today ,
798,nm787g,t2_yntnzim,1622121404,/r/wallstreetbets/comments/nm787g/what_gme_calls_should_i_make/,1,What GME calls should I make ,
799,nm78g9,t2_3tzuvg25,1622121423,/r/wallstreetbets/comments/nm78g9/_/,1, ,
800,nm78g9,t2_3tzuvg25,1622121423,/r/wallstreetbets/comments/nm78g9/_/,1, ,
801,nm78qv,t2_7pot5ft5,1622121448,/r/wallstreetbets/comments/nm78qv/i_heard_that_blackberry_was_up_10_yesterday_so_i/,1,I heard that Blackberry was up 10 yesterday So I hurried to the store and bought a couple boxes I did this for a store of value If the price of Blackberry continues to go up I will make money of these Do you guys think this was a wise financial decision Will blackberry see another 10 today ,
802,nm78vt,t2_30uraji6,1622121459,/r/wallstreetbets/comments/nm78vt/seeking_alpha_bac_doing_the_fake_news_thing_again/,1,Seeking Alpha amp BAC Doing The Fake News Thing Again BYND, removed 
803,nm7937,t2_7pot5ft5,1622121474,/r/wallstreetbets/comments/nm7937/i_heard_that_blackberry_was_up_10_yesterday_so_i/,1,I heard that Blackberry was up 10 yesterday So I hurried to the store and bought a couple boxes I did this for a store of value If the price of Blackberry continues to go up I will make money of these Do you guys think this was a wise financial decision Will blackberry see another 10 today ,
804,nm79k8,t2_9tomz21g,1622121511,/r/wallstreetbets/comments/nm79k8/dd_lizi/,1,DD LIZI, removed 
805,nm79ks,t2_1ouumzx4,1622121512,/r/wallstreetbets/comments/nm79ks/what_is_going_on_with_sndl_sundial_growers/,1,What is going on with SNDL Sundial Growers ,
806,nm7aai,t2_30uraji6,1622121573,/r/wallstreetbets/comments/nm7aai/fake_news_again_apparently_there_is_a_new_meme/,1,Fake News Again Apparently There Is a New Meme Stock in Town BYND,
807,nm7ael,t2_cd2t71o2,1622121583,/r/wallstreetbets/comments/nm7ael/1_hour_candle_today_for_dow_jones_and_sp_500this/,1,1 hour candle today for Dow jones and S amp P 500 this is my analysis,
808,nm7amf,t2_7pot5ft5,1622121601,/r/wallstreetbets/comments/nm7amf/i_heard_that_blackberry_was_up_10_yesterday_so_i/,1,I heard that Blackberry was up 10 yesterday So I hurried to the store and bought a couple boxes I did this for a store of value If the price of Blackberry continues to go up I will make money of these Do you guys think this was a wise financial decision Will blackberry see another 10 today ,
809,nm7b0b,t2_cbozkw7p,1622121634,/r/wallstreetbets/comments/nm7b0b/spce_yolo/,1,SPCE YOLO ,
810,nm7brb,t2_7pot5ft5,1622121698,/r/wallstreetbets/comments/nm7brb/i_heard_that_blackberry_was_up_10_yesterday_so_i/,1,I heard that Blackberry was up 10 yesterday So I hurried to the store and bought a couple boxes I did this for a store of value If the price of Blackberry continues to go up I will make money of these Do you guys think this was a wise financial decision Will blackberry see another 10 today ,
811,nm7cbu,t2_2er0mph5,1622121748,/r/wallstreetbets/comments/nm7cbu/nice/,1,Nice,
812,nm7cig,t2_b2g4q5l7,1622121764,/r/wallstreetbets/comments/nm7cig/anyone_think_ether_has_gotten_too_expensive/,1,Anyone think Ether has gotten too expensive ,I say let s make B I t c o I n cheap again What do you all think 
813,nm7cz4,t2_4rv6vle5,1622121802,/r/wallstreetbets/comments/nm7cz4/stanley_druckenmiller_the_key_lesson_in/,1,Stanley Druckenmiller The key lesson in investing figure out what makes a stock go up and down,
814,nm7dau,t2_9tomz21g,1622121826,/r/wallstreetbets/comments/nm7dau/dd_lizi/,1,DD LIZI, removed 
815,nm7djd,t2_9zvmtcj8,1622121847,/r/wallstreetbets/comments/nm7djd/clvs_seemed_to_have_bottomed_out_and_its_ready_to/,1,Clvs seemed to have Bottomed out and it s ready to pop It has it a huge short position , removed 
816,nm7ebx,t2_9zmnc8y8,1622121913,/r/wallstreetbets/comments/nm7ebx/theyre_off/,1, amp They re Off,Its GME leading the field with AMC amp BB hot on her heels and oh my Processing img 4uu8dstkzn171 
817,nm7eo7,t2_a3527ulk,1622121941,/r/wallstreetbets/comments/nm7eo7/dumb_ass_old_ape_has_a_hypothetical_question/,1,Dumb Ass Old Ape has a hypothetical question , removed 
818,nm7f5t,t2_9xvljxee,1622121982,/r/wallstreetbets/comments/nm7f5t/bb_now_before_its_too_late/,1,BB now before it s too late, removed 
819,nm7f7p,t2_9zrbwlen,1622121987,/r/wallstreetbets/comments/nm7f7p/workhorse_short_interest_4193_candidate_for_a/,1,Workhorse short interest 41 93 candidate for a huge short squeeze who is buying ,
820,nm7guk,t2_6mvp5fgv,1622122130,/r/wallstreetbets/comments/nm7guk/sndl/,1,SNDL, removed 
821,nm7h5j,t2_4bo1gv1j,1622122159,/r/wallstreetbets/comments/nm7h5j/is_anyone_else_buying_sundial_besides_the_money/,1,Is anyone else buying Sundial besides the money mangers , removed 
822,nm7hfh,t2_aj4vnfnj,1622122186,/r/wallstreetbets/comments/nm7hfh/i_made_a_lil_meme_for_amc/,1,I made a lil meme for amc,
823,nm7ief,t2_7oh3g8b,1622122263,/r/wallstreetbets/comments/nm7ief/yesterday_made_50k_gme_bet_300340_call_spread/,1,Yesterday made 50k GME bet 300 340 call spread ,
824,nm7igj,t2_9krvkk3g,1622122269,/r/wallstreetbets/comments/nm7igj/please_amc_we_have_lift_off/,1, please AMC we have lift off , removed 
825,nm7j4g,t2_41slvc31,1622122323,/r/wallstreetbets/comments/nm7j4g/why_do_brokerages_get_away_with_shorting/,1,Why do brokerages get away with shorting companies that are trying to do good in the world TetraBio Pharma TBP has a painkiller for those undergoing cancer treatment yet they get shorted WTF , removed 
826,nm7ja9,t2_7oh3g8b,1622122336,/r/wallstreetbets/comments/nm7ja9/yesterday_made_50k_gme_bet_300340_call_spread/,1,Yesterday made 50k GME bet 300 340 call spread ,
827,nm7jbr,t2_7oguj,1622122340,/r/wallstreetbets/comments/nm7jbr/lets_go_inflation/,1,Let s go Inflation ,
828,nm7jqh,t2_4bo1gv1j,1622122376,/r/wallstreetbets/comments/nm7jqh/anyone_else_buying_sundial_besides_the_money/,1,Anyone else buying Sundial besides the Money Managers , removed 
829,nm7kdx,t2_49dn71ua,1622122431,/r/wallstreetbets/comments/nm7kdx/zsan_on_the_rise_post_data_for_migraine_medicine/,1,ZSAN on the rise post data for Migraine Medicine, removed 
830,nm7kox,t2_a1om9r96,1622122456,/r/wallstreetbets/comments/nm7kox/amc_lets_goo_baby/,1, AMC let s goo Baby ,
831,nm7kri,t2_9fvyk4jw,1622122462,/r/wallstreetbets/comments/nm7kri/spce/,1, spce,Its time to put all you have on SPCE its time to make shorts suffer
832,nm7l2e,t2_b9e5y5x8,1622122487,/r/wallstreetbets/comments/nm7l2e/gamble_it_amc/,1,Gamble it amc,Im down to bett 14k amc wont close above 22 tdy any takers and yes ill show proof im down lol
833,nm7lh0,t2_8l1ffpcc,1622122524,/r/wallstreetbets/comments/nm7lh0/hopes_are_to_the_moon/,1,Hopes are to the moon ,
834,nm7ll6,t2_9y0o696w,1622122533,/r/wallstreetbets/comments/nm7ll6/petition_to_bring_back_gme_megathread_on_this/,1,PETITION TO BRING BACK GME MEGATHREAD ON THIS SUBREDDIT , removed 
835,nm7muv,t2_7v2xrz,1622122635,/r/wallstreetbets/comments/nm7muv/peak_into_the_future_with_draftkings/,1,Peak into the future with Draftkings, Morning everyone This post is by no way detailed with statistics or a deep dive into the company this is just something I have been watching over the past 6 months as a very active social media user Draftkings has 3 4 active Twitter accounts The main one of coarse being simply Draftkings with 320K folowers Fanduel only has 254k but who is keeping score Anyway as Draftkings rolls out new programs like Sports Betting DKSportsbook or Casino DKCasino and you can get a pretty good idea of what the company will be doing or acting like by simply scrolling down their feed Well if you have a minute I suggest you scroll down the Twitter feed of DKCasino They only have 200 posts or so since they are relatively new but you can see that when they started posting late last year and literally only being live in a handful of states they had free money promotions with almost no interaction But now especially the past month or so you will notice every one of their tweets is now 1 a direct advertisement of one of their games that you can currently play 2 a sign up promotion 3 interactions with a player who has won money 4 starting to have 30 comments on every tweet I think 3 is the key to the future When investing in Draftkings everyone including myself constantly thinks Sports betting which we can all agree is a young mans woman s game Very few including myself have realized that Draftkings will be using all its power of brand name player connection and social media to delivery a full LEGAL casino to your iPhone The last sentence is simply fact as I stated Draftkings twitter account has 320K followers the DKCasino only has 2607 followers YUP thats IT only TWO THOUSAND followers so far I think this is a huge reason institutional investors like Blackrock or ARK are going in head first They are buying a fully legal casino delivered to your door You know those busses they run out of retirement homes into Casinos and back 3 times a week Well why on earth would those old people spend hours on busses when the future of Casinos is a Draftkings app on a 24 inch Ipad screen in their rooms Now you say Hey buddy what does Draftkings know about casinos when they will be competing with PENN or MGM or WYNN And in a sense you are right But for a second lets look at that retirement home scenario Draftkings has NO brick and mortar casinos Unlike PENN or MGM Who benefits more from your grandmother NOT taking the free shuttle bus to the brick Casino PENN MGM who make money either way or Draftkings who spends 0 0 on storefronts employees and every penny that Grandma spends playing in her room is 100 PURE profit taken away from PENN or MGM Everyone keeps focusing on the amount of money Draftkings has spent on customer acquisition lately That is the reason the stock price is down Well if you think of them acquiring future Casino customers that they are taking away from PENN MGM and WYNN It makes more sense of why they are spending so hard 
836,nm7mvk,t2_af5myvo2,1622122637,/r/wallstreetbets/comments/nm7mvk/amc_on_discount/,1,AMC on discount,Let s make these hedge funds remember our name Buying every dip 100 shares 18 50 Will be 1000 more shares at 16 18 if it continues to dip
837,nm7nde,t2_3a23lxrl,1622122677,/r/wallstreetbets/comments/nm7nde/2_am_in_nz_all_hyped_up_with_coffee_lets_go_to/,1,2 am in NZ all hyped up with coffee Lets go to the moon ,
838,nm7nhk,t2_1ouumzx4,1622122688,/r/wallstreetbets/comments/nm7nhk/whats_going_on_with_sndl_sundial_growers/,1,What s going on with SNDL Sundial Growers ,I see a sudden spike It was trending at 70 for a while and now a spike Was there a major announcement 
839,nm7ogr,t2_9rswbmmw,1622122769,/r/wallstreetbets/comments/nm7ogr/im_unloading_my_covid_recovery_stocks_this/,1,I m unloading my COVID Recovery stocks this morning thoughts ,Mostly consists of airlines malls etc Probably still has time to run up but I think it s time and I m worried about people realizing that airlines are actually crap investments etc So I m out of those Now here s the touchy part in this group of companies I considered AMC one of them a recovery stock and with the current cost it s really hard to not at least sell some of the shares Thoughts of why I should continue to hold Why should it be valued over 20 Thanks for your thoughts I want to keep holding but my GME AMC brain is conflicting with my conservative side GME I think is a different story and I ll continue to HODL that but AMC is a true recovery stock in the next few years they aren t going to actually do anything different where as GME has a new board can pivot to online sales etc 
840,nm7op3,t2_7supgtef,1622122790,/r/wallstreetbets/comments/nm7op3/ocgn_making_a_comeback_hard_325/,1, OCGN making a comeback HARD 3 25 ,
841,nm7pcr,t2_wzrae,1622122845,/r/wallstreetbets/comments/nm7pcr/gme_house_of_cards_2_3_released/,1,GME House of Cards 2 amp 3 released, removed 
842,nm7q93,t2_6kr3xtp9,1622122919,/r/wallstreetbets/comments/nm7q93/first_time_buying_options_dont_know_what_im_doing/,1,First time buying options don t know what I m doing but threw 1000 bucks at it wish me luck Not all of us are whales and apes ,
843,nm7qdd,t2_9w3ezr3r,1622122929,/r/wallstreetbets/comments/nm7qdd/anterix_nokia_announce_agreement_to_offer_private/,1,Anterix Nokia Announce Agreement to Offer Private LTE Over Low band Dedicated Spectrum,
844,nm7qht,t2_a446qvui,1622122938,/r/wallstreetbets/comments/nm7qht/aht_in_one_week_still_going_vroom/,1,AHT in one week Still going vroom ,
