,postid,author,created_utc,permalink,score,title,selftext
0,nlv946,t2_13i3ls,1622074363,/r/wallstreetbets/comments/nlv946/impossible_to_post_on_here/,1,Impossible to post on here,Ill be surprised if this makes it past the mods
1,nlvagg,t2_a0i2ssvz,1622074484,/r/wallstreetbets/comments/nlvagg/me_and_fellow_hodlers_stand_by_our_investment/,1,Me and fellow Hodlers stand by our investment,
2,nlvaht,t2_38p75l11,1622074488,/r/wallstreetbets/comments/nlvaht/why_the_fuck_are_the_mods_deleting_my_bb_posts/,1,Why the fuck are the mods deleting my BB posts ,Seriously guys 3 in a row 
3,nlvamr,t2_9tr2fgh7,1622074499,/r/wallstreetbets/comments/nlvamr/jim_cramer_insulting_us/,1,Jim Cramer insulting us,Cramer says I am shocked there was one person who thought i did a good job tonight in my mentions column I think that they are just upset because they only know 2 stocks I want them to know more But that requires so much bandwidth for these fine folks 
4,nlvarh,t2_6l6686re,1622074509,/r/wallstreetbets/comments/nlvarh/viac_viacomcbs_update/,1,VIAC ViacomCBS Update,
5,nlvay0,t2_af5xbkki,1622074526,/r/wallstreetbets/comments/nlvay0/after_3_years_of_learning_investment_my_5_tips/,1,After 3 years of learning investment my 5 tips for those who just started,I had my fair share of losing money trading capital drawdowns busting my own trading capital many times before finally learning from past mistakes to become a better trader and stop do stuff like it s a mf casino I don t want to share with you something that you all heard so many times yep I haven t lost my fate in humanity like avoid margin trading or invest in mutual funds I believe I have some wisdom I wish I had from the beginning 1 Trading is just 5 theory and 95 about emotional control risk and money management overcoming one s greed having strict stoploss and targets predefined before taking a trade 2 Don t follow advice from forums blindly Build your own map of the world Each of us learn to trade at our own pace and don t get discouraged if you find that after a few years you re still struggling to master the money game You can keep in mind different advice for experienced players e g I recommend this qooore app and it s discord community but it s vital for the final decision to be yours 3 Accept losses and do not make investment decisions based on emotion Especially greed fear or panic Yep you didn t buy Betcoin lol couldn t resist at 3 000 because you didn t know back than what direction the price would take No regrets Keep yourself focused on here and now move ahead 4 Know yourself What is your current financial situation Why you are investing For what purpose the investment is being made This will automatically answers questions such as how long you are investing for The other important aspect is how much risk you would normally want to take Keeping both in mind assess your risk carefully 5 Never forget that for investing time is your best friend and greed is your worst enemy Patience is a requirement in stock trading There are no short cuts or holy grail when it comes to stock And you only need to have couple of strategies but those should be well tested and made perfect over the period of time To me trading is a skill that requires 3Ls Life Long Learning Stay humble be honest and willing to admit your mistakes in trading and don t try to rationalise and explain mistakes away and always remain teachable and never think you ve arrived 
6,nlvcbd,t2_vzcb6,1622074648,/r/wallstreetbets/comments/nlvcbd/alright_which_one_of_you_guys_made_this_trade_of/,1,Alright which one of you guys made this trade of the highest order,
7,nlvcio,t2_aoe6vuxk,1622074663,/r/wallstreetbets/comments/nlvcio/help/,1,Help, removed 
8,nlvcu2,t2_87k97zaa,1622074691,/r/wallstreetbets/comments/nlvcu2/cramers_wifes_boyfriend_agrees/,1,Cramer s wife s boyfriend agrees ,
9,nlvdiu,t2_a0ff3v6z,1622074752,/r/wallstreetbets/comments/nlvdiu/spce/,1,Sp ce ,
10,nlvdpi,t2_3jwn2j6s,1622074770,/r/wallstreetbets/comments/nlvdpi/weird_bb_call_options_on_618_only_day_to_go_past/,1,Weird BB Call Options on 6 18 Only day to go past 15 options ,
11,nlve4y,t2_128tgw,1622074805,/r/wallstreetbets/comments/nlve4y/let_me_take_you_to_the_movies/,1,Let me take you to the movies ,
12,nlve8e,t2_7at3bt90,1622074813,/r/wallstreetbets/comments/nlve8e/how_to_buy_citadels_building/,1,How To Buy Citadels Building,Today apes we will show you how to buy the citadel building and make it the WSB HQ Step1 Figure out how much money we will need to buy the building It won t be a problem since their gonna go bankrupt so it ll cost wayyy less Step 2 How do we make Citadel bankrupt Keep making them loose money We buy all the stocks their shorting and keep buying so that they loose money Step 3 We buy the citadel building and name it WSB HQ Stay safe and keep buying TheAntiH3r0
13,nlvefe,t2_15omu9,1622074831,/r/wallstreetbets/comments/nlvefe/im_finally_not_gonna_be_amc_broke_thanks_to_you/,1,I m finally not gonna be AMC broke thanks to you boyfriend wife diamond apes I like the numbers I like the stock Make a wish ,
14,nlvemw,t2_a0ff3v6z,1622074852,/r/wallstreetbets/comments/nlvemw/spce_they_shorting_it_real_hard/,1,Sp c e they shorting it real hard,
15,nlveue,t2_a11iiu0e,1622074871,/r/wallstreetbets/comments/nlveue/power_to_the_people_now_let_them_know_100k_amc_is/,1,Power to the people Now let them know 100k amc is the floor ,
16,nlveun,t2_9tr2fgh7,1622074872,/r/wallstreetbets/comments/nlveun/cramer_just_tweeted_basically_insulting_us/,1,Cramer just tweeted basically insulting us ,i am shocked there was one person who thought i did a good job tonight in my mentions column I think that they are just upset because they only know 2 stocks I want them to know more But that requires so much bandwidth for these fine folks 
17,nlvexi,t2_am59x20q,1622074879,/r/wallstreetbets/comments/nlvexi/big_short_squeeze_opportunity_with_et/,1,Big Short Squeeze opportunity with ET,A friend with decades of experience trading in oil brought my attention to Energy Transfer ET Basically with commodities going up oil companies are not capturing the profits because they owe so much money to people like Warren Buffet With oil price firmly over 60 there is 50 percent upside at least with normalization This pipeline company is doing extremely well made 2 4 billion last quarter and now it s off to the races There are 73 million short This stock ATH 30 If we get a little help from gamma it can pump back up The calls are super cheap 2 to 4 a contract GS owns 74 7 million shares JPM owns 27 8 million Nomura is short 1 7 million My friend made 2 k risking 2k this week on the options Im going to position in 500 tomorrow With help from the WSB army we can put blood in the water and see this thing to new highs 
18,nlvfbz,t2_5gw80879,1622074915,/r/wallstreetbets/comments/nlvfbz/100000_sndl_options_were_bought_today_expiring_at/,1,100 000 SNDL options were bought today expiring at 1 on Friday Some retail shorts about to have their face ripped off ,So this is a legitimate stat Whoever was selling 1 strike options expiring this Friday for a penny you are so greedy and there s a good chance you re about to get your face ripped off Retail shorts have hopped on the bandwagon and when stocks move they tend to over shoot the upside on the downside Sundial has over 1 billion in cash no debt positive operating profit and many valuable passive investments The manipulation that the stock received was absolutely insane Institutional ownership was less than 2 when SNDL made it s run in Feb and the big boys didn t want to miss the party and they paid motley fool to write bash articles while they accumulate their position This is just my assumption which is never a good thing when valuing stocks but as a former stock analyst I would bet that institutional ownership will be over 5 very soon and then 10 SNDL is breaking out with insane call volume bought today expiring Friday This company has the fundamentals to back it up and very good things could be coming Not to mention it s a prime acquisition target with its super strong balance sheet 
19,nlvg0d,t2_a0x79v1m,1622074979,/r/wallstreetbets/comments/nlvg0d/i_want_want_to_give_a_huge_shout_out_to_all_you/,1,I want want to give a huge shout out to all you apes this is unreal how stupid can you be to short gme and amc again Can I please get an invit for the next round I want to board the ,
20,nlvhy1,t2_4nt8n8x,1622075157,/r/wallstreetbets/comments/nlvhy1/alright_alright_alright_nice_its_a_sign/,1,Alright alright alright nice ITS A SIGN ,
21,nlvjeh,t2_bvql6bov,1622075291,/r/wallstreetbets/comments/nlvjeh/she_said_buy_the_dip_before_its_too_late/,1,She said Buy the dip before its too late, removed 
22,nlvjx8,t2_88h0alvh,1622075340,/r/wallstreetbets/comments/nlvjx8/db_cannabis_yolo_if_the_financials_are_good/,1,DB Cannabis Yolo If the financials are good tomorrow I m telling my wife s boyfriend he can sleep on the couch,
23,nlvk9u,t2_1sbnizw,1622075373,/r/wallstreetbets/comments/nlvk9u/cramer_says_investors_who_are_short_gamestop_and/,1,Cramer says investors who are short GameStop and AMC are out of their mind CNBC,
24,nlvkby,t2_6pcmthll,1622075379,/r/wallstreetbets/comments/nlvkby/man_shoves_a_banana_up_his_ass_for_losing_a_gme/,1,Man shoves a banana up his ass for losing a GME bet,
25,nlvkr6,t2_ccrc4cfr,1622075416,/r/wallstreetbets/comments/nlvkr6/amc/,1,Amc, removed 
26,nlvl86,t2_ah7lhni5,1622075458,/r/wallstreetbets/comments/nlvl86/fuk_the_bots_or_hedgies_that_be_saying_that_they/,1,Fuk the bots or hedgies that be saying that they gonna sel at 40 50 and that is the squueze DONT LISTEN TO THEM SHITHEADS CUZ THEYRE TRYNA MAKE YOU SEL AND LOSE YEO GAINZ Hodl until at least 1000 ,
27,nlvlh9,t2_5tkja4w3,1622075480,/r/wallstreetbets/comments/nlvlh9/bb_about_to_go_absolutely_parabolic_in_the_coming/,1,BB about to go absolutely parabolic in the coming weeks ,
28,nlvljk,t2_35jcm5d9,1622075488,/r/wallstreetbets/comments/nlvljk/amc/,1,AMC,Should I really buy some of this now 
29,nlvmnb,t2_5qcvuxps,1622075584,/r/wallstreetbets/comments/nlvmnb/brokerage_sell_limits/,1,Brokerage Sell Limits, removed 
30,nlvmoj,t2_6pcmthll,1622075588,/r/wallstreetbets/comments/nlvmoj/ape_honors_his_gme_bet_with_a_banana_nsfw/,1,Ape honors his GME bet with a banana NSFW,
31,nlvmom,t2_7qkcvqs9,1622075588,/r/wallstreetbets/comments/nlvmom/ive_been_seeing_a_lot_of_people_saying_to_sell/,1,I ve been seeing a lot of people saying to sell AMC on Friday because it will peak What is everyone s take on this and should people hold ,
32,nlvn11,t2_nwspm,1622075619,/r/wallstreetbets/comments/nlvn11/guys_i_think_gamestop_is_the_first_company_to_be/,1,Guys I think GameStop is the first company to be up 5 500 YOY and still has 0 analyst buy rating on Robinhood It s almost like they don t want people to make money , removed 
33,nlvnlt,t2_a15xef8m,1622075672,/r/wallstreetbets/comments/nlvnlt/cramer_on_amc_and_gme/,1,Cramer on AMC and GME,https www google com amp s www cnbc com amp 2021 05 26 jim cramer investors who are short gamestop amc are out of their mind html
34,nlvno8,t2_35jcm5d9,1622075677,/r/wallstreetbets/comments/nlvno8/amc/,1,AMC,Hey everyone I am fairly new to buying stocks and what not I keep hearing to buy some AMC now should I 
35,nlvnxv,t2_5tkja4w3,1622075700,/r/wallstreetbets/comments/nlvnxv/bb_will_go_absolutely_parabolic_and_become_the/,1,BB will go absolutely parabolic and become the ULTIMATE meme stock ,Lots of investors are buying neme stocks with no substance but overlook the fact BlackBerry has only a 6B dollar market cap and should be trading 2 3x higher MINIMUM based on its potential with Amazon and the EV market We passed 10 00 today after hours on Pete Najarian saying he s holding calls until next Friday expiration LOTS OF INTEREST If the meme stocks keep squeezing this will have no problem exceeding its prior highs Keep this undervalued gem on HIGH alert 
36,nlvp8g,t2_7j2c15n7,1622075816,/r/wallstreetbets/comments/nlvp8g/my_options_expire_fridaywhat_shoul_i_do/,1,my options expire Friday what shoul I do, removed 
37,nlvpz4,t2_a6tao4wu,1622075882,/r/wallstreetbets/comments/nlvpz4/even_jim_cramer_knows_it/,1,Even Jim Cramer knows it ,
38,nlvq7f,t2_e8go41t,1622075903,/r/wallstreetbets/comments/nlvq7f/kenny_g_darkpool_appreciation_post/,1,Kenny G Darkpool Appreciation Post,
39,nlvqb0,t2_bzsj8ikd,1622075913,/r/wallstreetbets/comments/nlvqb0/cd_projekt_red_ticker_otgly_lets_get_this_one/,1,CD Projekt Red ticker OTGLY let s get this one moving up Creators of Cyberpunk 2077 and the Witcher games So beaten down after Cyberpunk 2077 s launch ,
40,nlvqd7,t2_buxf8flh,1622075919,/r/wallstreetbets/comments/nlvqd7/is_binance_giving_the_staked_coins_to_short/,1,Is Binance giving the staked coins to short sellers , removed 
41,nlvqhz,t2_a3ifhryn,1622075929,/r/wallstreetbets/comments/nlvqhz/cramer_gives_momentum_to_amc_and_gme/,1,CRAMER GIVES MOMENTUM TO AMC AND GME, Investors who are still trying to short GameStop and AMC Entertainment are out of their mind CNBC s Jim Cramer said Wednesday WallStreetBets is too powerful and trying to bet against them right now is just giving them more ammo the Mad Money host said 
42,nlvqtt,t2_ax9jkcga,1622075961,/r/wallstreetbets/comments/nlvqtt/himx_thoughts_like_to_see_where_others_think_on/,1, HIMX thoughts Like to see where others think on chip stonk, removed 
43,nlvr8k,t2_5iqae8hm,1622076000,/r/wallstreetbets/comments/nlvr8k/ryan_is_the_messiah/,1,Ryan is the Messiah ,
44,nlvs7n,t2_7j2c15n7,1622076087,/r/wallstreetbets/comments/nlvs7n/what_to_do_with_my_options_expiring_on_friday_i/,1,What to do with my options expiring on Friday I am 100 HODLing my shares just not sure how to convert my options in a smooth manner , removed 
45,nlvsta,t2_axoj9d8f,1622076143,/r/wallstreetbets/comments/nlvsta/singing_a_new_tune/,1,Singing a new tune ,
46,nlvu60,t2_6io3kv6c,1622076279,/r/wallstreetbets/comments/nlvu60/gamestop_nft_platform_in_the_works_stonked_about/,1,GameStop NFT Platform in the Works Stonked About this one ,
47,nlvu78,t2_5m2xuf0v,1622076282,/r/wallstreetbets/comments/nlvu78/gme_gains_sold_all_my_shares_back_in_march_only/,1,GME GAINS sold all my shares back in March only to buy back in I like the stock Also traded in and out of options P L since January ,
48,nlvu9s,t2_9zqfx41n,1622076290,/r/wallstreetbets/comments/nlvu9s/confirmation_bias/,1,CONFIRMATION BIAS ,
49,nlvus7,t2_bjw3q9q8,1622076339,/r/wallstreetbets/comments/nlvus7/attention_fellow_retards_fk_u_buy_options_21/,1,Attention fellow Retards F k U Buy Options 21 short interest can t go tits up with all the catalyst for Q2 and beyond Also broke the descending wedge ,
50,nlvuzd,t2_a2tqivt4,1622076358,/r/wallstreetbets/comments/nlvuzd/cramer_tells_hedgie_to_throw_in_the_towel/,1,Cramer tells hedgie to throw in the towel https youtube com watch v aIeWY3JWYl8 amp feature share,
51,nlvv12,t2_bp4w7ni2,1622076363,/r/wallstreetbets/comments/nlvv12/thoughts_on_pton/,1,Thoughts on PTON ,
52,nlvv9m,t2_9319bsob,1622076386,/r/wallstreetbets/comments/nlvv9m/bb_to_the_moon_just_bought_200k/,1, BB to the MOON just bought 200k,BB to the MOON 
53,nlvvi8,t2_a8pv9rsd,1622076413,/r/wallstreetbets/comments/nlvvi8/evfm_has_been_short_so_much_down_from_12_to_80/,1, evfm has been short so much Down from 12 to 80 cents Great potential for bounce back,
54,nlvvlm,t2_7a2mhhfd,1622076423,/r/wallstreetbets/comments/nlvvlm/elmo_knows_where_you_live/,1,Elmo knows where you live,
55,nlvvzn,t2_a0fxecpt,1622076461,/r/wallstreetbets/comments/nlvvzn/cathy_woods_paper_hands/,1,Cathy Woods Paper Hands, removed 
56,nlvw20,t2_fhsrz,1622076468,/r/wallstreetbets/comments/nlvw20/gme_short_sellers_65_billion_loss/,1,GME short sellers 6 5 billion loss,
57,nlvwi8,t2_9zv4favd,1622076512,/r/wallstreetbets/comments/nlvwi8/apes_holding_amc_to_the_moon_be_like/,1,Apes holding AMC to the moon be like ,
58,nlvwjk,t2_6io3kv6c,1622076515,/r/wallstreetbets/comments/nlvwjk/gamestop_nft_platform_is_in_the_works/,1,GameStop NFT Platform is in the Works,
59,nlvwm6,t2_ccrc4cfr,1622076522,/r/wallstreetbets/comments/nlvwm6/amc/,1,Amc,Is 20 too late to get in on amc Could afford 25 shares but 50 sounds better I m new to trading what s a realistic ceiling I ve heard at least a 100 maybe upwards of 3 5 What s your opinions 
60,nlvwpt,t2_a31mwosz,1622076533,/r/wallstreetbets/comments/nlvwpt/all_on_amc_all_in_hopping_for_the_best/,1,All on amc all in Hopping for the best ,
61,nlvwqw,t2_5m2xuf0v,1622076536,/r/wallstreetbets/comments/nlvwqw/gme_sold_all_my_shares_back_in_march_only_to_buy/,1, GME sold all my shares back in March only to buy back in This stock is like crack Check out the profit amp losses of my options play since January,
62,nlvx8j,t2_3cihbhpf,1622076584,/r/wallstreetbets/comments/nlvx8j/honest_price_of_amc_stock/,1,Honest price of amc stock ,So 100k is pretty unrealistic even though I d love that to happen anyone know what I should be looking for 
63,nlvyr3,t2_3fmyhyjx,1622076721,/r/wallstreetbets/comments/nlvyr3/they_dont_know/,1,They don t know,
64,nlvyuf,t2_a8jrv0n6,1622076729,/r/wallstreetbets/comments/nlvyuf/whos_pumping_lol/,1,Who s pumping Lol,
65,nlvyyd,t2_a3tu202q,1622076740,/r/wallstreetbets/comments/nlvyyd/sndl_getting_my_todays_gain_after_so_long_time/,1,SNDL Getting my today s gain after so long time ,
66,nlvzbb,t2_3cihbhpf,1622076774,/r/wallstreetbets/comments/nlvzbb/realistic_amc_stock_price/,1,Realistic AMC stock price ,So I was just wondering at what the 100 percent realistic share price of the squeeze is gonna be I would love it to be 100k but it seems so unrealistic to me I d love it if you wiser apes cut the bullshit with me and gave me some of your wisdom so I don t miss out I m xxx shares in amc from UK
67,nlvzyo,t2_a132rkcc,1622076837,/r/wallstreetbets/comments/nlvzyo/can_we_bring_this_back_after_tendie_town_fuc_the/,1,Can we bring this back after tendie town Fuc the hedgies amc ,
68,nlw09c,t2_17aiek,1622076864,/r/wallstreetbets/comments/nlw09c/viva_la_tsla/,1,Viva La TSLA, TSLA GAMMA READ 24 88 of total gamma will expire on 5 28 When a large amount of gamma expires generally gt 25 then the underlying stock may shift away from current prices Upper hedge band has increased to 1 000 from 900 on 5 20 Call total has decreased to 2 6m from 2 9m on 5 20 Put total has decreased to 2 7m from 2 8m on 5 20 Bulls need gt 400M total gamma Bears need lt 300M total gamma Darkpool indicator has increased from 40 5 to 54 8 MMs are buying the dip https preview redd it uz41m0it2k171 png width 3126 amp format png amp auto webp amp s 0dcd099146dc40cfb15e1bf1b21227c9d68294f6 TA NOTES Found support at 600 hedge wall 600 547 2 support needs to hold for upward movement to resistance 662 53 691 28 Bulls need to break resistance 691 28 for bullish Bullish 731 09 764 26 782 69 800 38 823 23 Bears need to break 547 2 ish for bearish Bearish 462 7 442 8 408 95 https preview redd it 4o92cs0o2k171 png width 2998 amp format png amp auto webp amp s 3f6756372ac27c1d1fe32507396ed909c40bc89f 1D RSI Under 50 but bounced nicely 30 Bulls need 60 92 70 79 20 85 Bears need 30 23 26 20 36 https preview redd it k1byoo9f7k171 png width 2998 amp format png amp auto webp amp s 0ac25d242517c33b124dd7aa7e9b6fb808ec2d12 OBV Bulls need to break 4 947B Bullish 5 054B 5 195B 5 435B Bears need to break 4 851B Bearish 4 677B 4 215B https preview redd it 78yzc87e8k171 png width 2998 amp format png amp auto webp amp s 0f564bf8d857a64bfc1c6ae5336422b3774eba30 MACD Crossed but like to see it seperate some more https preview redd it 3nxcg46c9k171 png width 2998 amp format png amp auto webp amp s 30f358949663f8c064a6af6045301c9809c71309 Thanks for reading NightMan
69,nlw0y3,t2_a0fxecpt,1622076928,/r/wallstreetbets/comments/nlw0y3/richard_branson_diamond_hands/,1,Richard Branson Diamond Hands,
70,nlw17u,t2_a132rkcc,1622076955,/r/wallstreetbets/comments/nlw17u/20_mark_for_amc/,1, 20 mark for AmC, removed 
71,nlw1t7,t2_a0fxecpt,1622077013,/r/wallstreetbets/comments/nlw1t7/richard_branson_diamond_hands/,1,Richard Branson Diamond hands,
72,nlw216,t2_a0vbdvb4,1622077035,/r/wallstreetbets/comments/nlw216/sndltlry/,1, SNDL TLRY ,I think I can see the moon through the haze 
73,nlw2ni,t2_a132rkcc,1622077096,/r/wallstreetbets/comments/nlw2ni/20_mark_for_amc/,1, 20 mark for amc,The hedgies do not want us to make a clean break over 20 they will sh their pants when we do if we break past 20 and then 27 clean I think it will cause the hf to start covering which will be the beggining of the end for them 
74,nlw2un,t2_7y8yh3rw,1622077117,/r/wallstreetbets/comments/nlw2un/figs/,1,FIGS, removed 
75,nlw3ek,t2_9t9yj,1622077170,/r/wallstreetbets/comments/nlw3ek/how_i_felt_watching_my_gme_and_amc_holdings_today/,1,How I felt watching my GME and AMC holdings today,
