,postid,author,created_utc,permalink,score,title,selftext
1038,oaadrb,t2_agex1teb,1624979934,/r/wallstreetbets/comments/oaadrb/play_giant_bull_flag/,1,PLAY giant bull flag,I like dave and busters Smells like Mary Jane every time I step into one Maybe it s just Colorado I never seen a bull flag this big that s what she said If my calculations are right doubt it when this bull flag breaks out it will reach 68 dollars reaching an all time high last all time high was in 2018 67 Finviz does say it has a 19 short interest and it only has a 47 million shares outstanding The schills say the price target is 52 It s been hugging the channel 39 47 amp x200B Start a position at 39 s or long calls quarterly results have been up trending and with summer I believe the bull flag may erectify all our senses Currently holding over 2000 shares around 40 cost basis doing weekly out the money covered calls on while waiting for the volume to pick up We will see if it follows this bull flag through amp x200B https preview redd it klbwryle18871 png width 457 amp format png amp auto webp amp s 8d5ecf5aa4595e581cd4320512f83143b75fadc7
1039,oaaehf,t2_860rv,1624979995,/r/wallstreetbets/comments/oaaehf/new_zealand_checking_in_realised_my_bb_profits/,1,New Zealand checking in Realised my BB profits WKHS YOLO ,
1040,oaaen5,t2_11gkgz,1624980007,/r/wallstreetbets/comments/oaaen5/question_about_options/,1,Question about Options,I have a quick ques Here s an example situation to understand it better Let s say I have 100 Apple shares The current price is let s say is 135 each Say I bought at 131 and I m willing to sell at 136 for 600 profit Now is there a reason I shouldn t do this Sell a call for 136 with date of far ahead say September which will give me a premium of 400 I was anyway willing to sell at 136 Might as well get a premium on top of it Downside 1 The share price doesn t reach 136 and I m bounded not to sell my shares for months even if it dips I m fine with it 2 The share price shoots a lot more and I missed making more gains Well I was anyway willing to let go at 136 Gotta draw a line somewhere So this is ok as well amp x200B Am I missing something else amp x200B P S Sorry if such posts do not belong in this forum And thank you 
1041,oaaeyt,t2_a0q1075j,1624980032,/r/wallstreetbets/comments/oaaeyt/short_squeeze_is_sweet_and_the_long_is_even/,1,Short squeeze is sweet and the Long is even sweeter,
1042,oaafah,t2_a0wx1o0d,1624980057,/r/wallstreetbets/comments/oaafah/mrin/,1,MRIN, removed 
1043,oaafkl,t2_49njnqnv,1624980080,/r/wallstreetbets/comments/oaafkl/osw_help_me_out_here_i_cant_find_where_anyone_is/,1, OSW Help me out here I can t find where anyone is talking about this stock Any thoughts ,
1044,oaafkr,t2_908nzpzm,1624980081,/r/wallstreetbets/comments/oaafkr/wish_go_for_it_i_will_invest_100000/,1, WISH go for it I will invest 100 000 , removed 
1045,oaagdd,t2_c4l1dgz5,1624980144,/r/wallstreetbets/comments/oaagdd/clov_short_info_629_ortex_ctb_min_2923_avg_26302/,1,CLOV short info 6 29 Ortex CTB min 29 23 avg 263 02 max 324 56 Fintel 800 short shares available borrow fee rate 91 56 Iborrowdesk 300 short shares available borrow fee rate 91 6 , removed 
1046,oaaghd,t2_daw42,1624980152,/r/wallstreetbets/comments/oaaghd/sofi_short_interest_currently_at_148/,1,SOFI short interest currently at 148 ,
1047,oaagtz,t2_55ing,1624980181,/r/wallstreetbets/comments/oaagtz/why_is_no_one_talking_about_mrin/,1,Why is no one talking about MRIN , removed 
1048,oaah2f,t2_9nw4v,1624980199,/r/wallstreetbets/comments/oaah2f/clov_is_looking_juicy_as_shorts_borrow_fee/,1, CLOV Is Looking Juicy as shorts borrow fee Skyrocketed to 91 ONLY 300 shares left to short Its time for liftoff ,
1049,oaah4s,t2_49njnqnv,1624980205,/r/wallstreetbets/comments/oaah4s/osw_help_me_out_here_i_cant_find_where_anyone_is/,1, OSW Help me out here I can t find where anyone is talking about this stock Thoughts Is it garbage ,
1050,oaahbd,t2_17tqq91d,1624980220,/r/wallstreetbets/comments/oaahbd/amc_word_on_the_street_meme_not_financial_advice/,1,A M C Word on the street MEME Not financial advice I eat crayons Mainly I like the green crayons ,
1051,oaahpj,t2_b68kvv7d,1624980252,/r/wallstreetbets/comments/oaahpj/spce/,1, SPCE , removed 
1052,oaai09,t2_2dvsy9,1624980277,/r/wallstreetbets/comments/oaai09/am_i_the_only_one_who_hates_money_and_loves_pain/,1,Am I the only one who hates money and loves pain ,
1053,oaai0a,t2_add6ryqr,1624980277,/r/wallstreetbets/comments/oaai0a/ge_what_happens/,1, ge what happens , removed 
1054,oaaib4,t2_a0td16z1,1624980303,/r/wallstreetbets/comments/oaaib4/buy_xela/,1,buy XELA , removed 
1055,oaaif5,t2_a10h86nl,1624980312,/r/wallstreetbets/comments/oaaif5/yesterdays_loss_porn_long_on_jets/,1,YESTERDAY S LOSS PORN LONG ON JETS,
1056,oaaih0,t2_an552h23,1624980317,/r/wallstreetbets/comments/oaaih0/marin_software_up_up_it_goes/,1,Marin Software up up it goes ,
1057,oaaisy,t2_ay8fuqqb,1624980345,/r/wallstreetbets/comments/oaaisy/duolingo_has_announced_it_is_going_public_apes/,1,Duolingo has announced it is going public Apes ASSEMBLE , removed 
1058,oaaitw,t2_6atrl1v5,1624980346,/r/wallstreetbets/comments/oaaitw/nice_mstr_turnaround_after_having_sellers_remorse/,1,Nice MSTR turnaround after having sellers remorse,
1059,oaaj0q,t2_2eczyrml,1624980363,/r/wallstreetbets/comments/oaaj0q/all_im_saying_is_auud_had_been_doing_nicely/,1,All I m saying is AUUD had been doing nicely ,
1060,oaajcx,t2_hm1lr,1624980394,/r/wallstreetbets/comments/oaajcx/sofi_bark_they_are_trying_to_short_usignore_us/,1, SOFI amp BARK They are trying to short us Ignore us , SOFI The battle is on They are trying to short us into oblivion It s unreal Look at the chart Look at the short interest This has been written many times before so I won t repeat it but as this is gaining traction on Twitter Reddit this is going to explode The short interest rate long as well as daily is ridiculous The volume is also coming in now which is the best sign Long 6900 nice shares of SOFI amp x200B BARK Woof Woof Bring on the volume Keep an eye on recent price targets We have received 3 now and the first two were smaller firms Jefferies amp Canaccord Genuitym both with 14 PT s but yesterday we got Citigroup with a 16 price target Citigroup is the real deal and a big boy Immediately after thatPT came out yesterday a massive selloff took place Check it out Word is spreading and the new markets Bark is getting into will drive increased revenue and market share They also just recently expanded into Australia amp x200B Long 4k shares of BARK and 60x 10 puts for July I sold these puts aka I m Bullish 
1061,oaajex,t2_c4l1dgz5,1624980398,/r/wallstreetbets/comments/oaajex/clov_short_info_629_ortex_ctb_min_2923_avg_26302/,1,CLOV short info 6 29 Ortex CTB min 29 23 avg 263 02 max 324 56 Fintel 800 short shares available borrow fee rate 91 56 Iborrowdesk 300 short shares available borrow fee rate 91 6 , removed 
1062,oaajxo,t2_22u9yaed,1624980441,/r/wallstreetbets/comments/oaajxo/clov_support_held_rocket_ship_fueled_break_of/,1, CLOV Support held rocket ship fueled break of upper level resistance incoming,
1063,oaak0u,t2_959fny9c,1624980450,/r/wallstreetbets/comments/oaak0u/sos_70_short_interest/,1, SOS 70 Short Interest,
1064,oaak8g,t2_n2lxq,1624980467,/r/wallstreetbets/comments/oaak8g/hey_wsbteam_250300_fomo_a_bit_of/,1,Hey WSB Team 250 300 FOMO a bit of proof confirmation bias to keep your daily GME thread for longer than a month this time ,
1065,oaakb7,t2_6atrl1v5,1624980473,/r/wallstreetbets/comments/oaakb7/nice_single_day_turnaround_after_having_sellers/,1,Nice single day turnaround after having sellers remorse on MSTR,
1066,oaako5,t2_129u8h,1624980500,/r/wallstreetbets/comments/oaako5/not_much_for_most_people_on_this_sub_but_went_all/,1,Not much for most people on this sub but went all in on WISH a couple weeks ago Thank you WSB ,
1067,oaakqj,t2_ay8fuqqb,1624980506,/r/wallstreetbets/comments/oaakqj/duolingo_has_announced_it_is_going_public_apes/,1,Duolingo has announced it is going public Apes ASSEMBLE , removed 
1068,oaakva,t2_a1rurcgr,1624980516,/r/wallstreetbets/comments/oaakva/cpng_whats_going_on_here_13/,1, CPNG What s going on here 13 , removed 
1069,oaaky6,t2_ay8fuqqb,1624980524,/r/wallstreetbets/comments/oaaky6/duolingo_has_announced_it_is_going_public_apes/,1,Duolingo has announced it is going public Apes ASSEMBLE , removed 
1070,oaalfv,t2_ztqpe,1624980565,/r/wallstreetbets/comments/oaalfv/lvs_looks_good/,1,LVS looks good, removed 
1071,oaalut,t2_8g5bmo8n,1624980600,/r/wallstreetbets/comments/oaalut/motley_tool_vs_the_apes/,1,Motley Tool vs The Apes,I ve read three articles in two days by Motley Tool each of which was focused on bashing the WSB Apes as market manipulators Seriously WE RE the manipulators While I ve always considered Motley Tool to be a self serving manipulative investment site masquerading as a friend to the common investor it s rare to see them come out so blatantly as the greedy self righteous self serving service they actually are I encourage everyone to ban them and to call them out whenever you see them teaming against us with their lies and misdirection APES UNITE 
1072,oaalxk,t2_a144yyty,1624980606,/r/wallstreetbets/comments/oaalxk/amc_stock_could_this_be_your_ticket_to_becoming_a/,1,AMC STOCK Could This Be Your Ticket to Becoming A Millionaire ,
1073,oaam8m,t2_31qv3vsv,1624980626,/r/wallstreetbets/comments/oaam8m/wish_stock/,1,Wish stock, removed 
1074,oaamml,t2_8je963fv,1624980655,/r/wallstreetbets/comments/oaamml/woof_massive_short_squeeze_potential/,1,WOOF Massive Short Squeeze Potential, removed 
1075,oaamwc,t2_860rv,1624980677,/r/wallstreetbets/comments/oaamwc/new_zealand_checking_in_realised_my_bb_gains_and/,1,New Zealand checking in Realised my BB gains and bought a horse WKHS YOLO ,
1076,oaamz6,t2_cokfrt50,1624980682,/r/wallstreetbets/comments/oaamz6/breaking_news_halo_collective_kommt_jetzt_das/,1,Breaking News Halo Collective Kommt jetzt das NASDAQ IPO ,
1077,oaanbd,t2_31qv3vsv,1624980711,/r/wallstreetbets/comments/oaanbd/wish_stock/,1,Wish stock,Wish stock could be the next GME and AMC It has so much potential we could make this the new amazon stock guys say the word BUY WISH 
1078,oaanpg,t2_959fny9c,1624980741,/r/wallstreetbets/comments/oaanpg/sos_70_short_interest/,1, SOS 70 Short Interest, removed 
1079,oaanqy,t2_1s9iwp51,1624980744,/r/wallstreetbets/comments/oaanqy/120000_on_sofi_i_can_get_behind_this_one/,1,120 000 on SOFI I can get behind this one ,Thanks to u rabecharles I can get behind the SOFI movement amp x200B amp x200B https preview redd it 32yvxnaa48871 png width 1255 amp format png amp auto webp amp s 6b54454a81c8058b171701b1b099dbf0fde292b0
1080,oaant9,t2_zx14z,1624980750,/r/wallstreetbets/comments/oaant9/pre_gme_squeeze_pic_amc_can_do_it_too/,1,Pre gme squeeze pic amc can do it too ,
1081,oaao9j,t2_chp3nj7u,1624980789,/r/wallstreetbets/comments/oaao9j/major_short_chance_for_cpng_coupang/,1,Major Short Chance for CPNG Coupang ,Major Warehouse burned down just recently Customers leaving banning the company due to increasing mistreatment of own employees and also customers Major deficit on all quarters especially the recent one 1Q 2021 Yet stocks are up 13 Go figure 
1082,oaaof9,t2_14bagk,1624980801,/r/wallstreetbets/comments/oaaof9/clf_is_green_in_a_read_of_sea/,1, CLF is green in a read of sea , CLF keeps going strong steel prices keep going up Russia s putting taxes on steel exports and so on To the moon 
1083,oaaoqw,t2_4e2ebwki,1624980831,/r/wallstreetbets/comments/oaaoqw/why_is_clov_going_up/,1,Why is clov going up,
1084,oaap7q,t2_959fny9c,1624980869,/r/wallstreetbets/comments/oaap7q/sos_nearly_70_short_interestsqueeze_on_the_way/,1, SOS Nearly 70 short interest Squeeze on the way , removed 
1085,oaaqk8,t2_cbqzqt1g,1624980986,/r/wallstreetbets/comments/oaaqk8/yolo_531k_ngca_a_virgins_tale_to_orbit/,1,Yolo 531k NGCA A Virgins Tale to Orbit , removed 
1086,oaaqzu,t2_9zp32pwk,1624981020,/r/wallstreetbets/comments/oaaqzu/clov_availability_borrow_fee_916/,1,CLOV Availability amp Borrow Fee 91 6 ,
1087,oaarc7,t2_5q02y80,1624981048,/r/wallstreetbets/comments/oaarc7/the_government_of_india_has_issued_a_registration/,1,The government of India has issued a registration certificate and a permission to import Moderna s COVID 19 vaccine for restricted use in an emergency situation ,
1088,oaarhd,t2_2mkqn2nc,1624981059,/r/wallstreetbets/comments/oaarhd/what_is_up_with_teva_this_stock_is_routinely_bent/,1,What is up with TEVA This stock is routinely bent over without the decency of being asked if it would like lube first They are dealing with a bunch of court cases pertaining to the opioid epidemic but what major drug company didn t have their hand in that cookie jar at the time , removed 
1089,oaarld,t2_658turi9,1624981068,/r/wallstreetbets/comments/oaarld/what_are_your_plays_for_clov/,1,What are your plays for CLOV, removed 
1090,oaarsg,t2_4fp7husf,1624981084,/r/wallstreetbets/comments/oaarsg/is_this_a_p_and_d_mrin/,1,Is this a p and d MRIN , removed 
1091,oaas3s,t2_a29axyv6,1624981110,/r/wallstreetbets/comments/oaas3s/a_roboadvisor_app_with_1_proprietary_risk/,1,A robo advisor app with 1 proprietary risk management tool for investors and 2 Robo investing process to support cause themes more diversified and access to various asset classes that are not always accessible for most investors pursuing patent Interesting or Boring for diamond hands ,We are in the alpha stage of developing A robo advisor app with proprietary risk management tool for investors The main differential factors between us and other Fintech companies such Wealthfront Robinhood Betterment etc is that we have a proprietary risk management tool dashboards incorporated into the app so investors are more informed about the market and their decision Besides investing to support causes themes via our robo advising process help investors gain access to various asset classes that are not always accessible for most of investors and protect our clients from speculative behaviors and enjoys a long term diversified portfolio to achieve their goals Please fell free to discuss and reach out to me if you think you have brilliant thoughts 
1092,oaas9d,t2_73esh5nb,1624981124,/r/wallstreetbets/comments/oaas9d/tqqq_to_the_moon_part_2/,1,TQQQ to the moon part 2 ,About a 45 days ago I made a post you can view here https www reddit com r wallstreetbets comments ni1ghe tqqq utm medium android app amp utm source share I just wanted to point out I was absolutely right TQQQ is going to the fucking moon and you can join me in the race to become the world s first trillionaire or you can mumble buzzwords like volatility drag and time decay as you push your stolen 3 wheeled shopping cart full of cans back to your cardboard box behind the Wendy s dumpster I ll tell you a secret no one in a position of power gives a damn if AMC or GME go bankrupt If however the NASDAQ starts to fall the federal government will burn the country down to keep that baby warm This is one of the safest bets you can make I don t care if you make it or not just know when there s some random guy paying a billion dollars for a blow job behind the Wendy s it s most likely me 
1093,oaasfa,t2_9wjq82,1624981139,/r/wallstreetbets/comments/oaasfa/american_airlines_play/,1,American Airlines play ,
1094,oaasv8,t2_5kl5xyz6,1624981178,/r/wallstreetbets/comments/oaasv8/bsqr_yolo_sqeeze_is_starting/,1,Bsqr yolo sqeeze is starting ,
1095,oaat1n,t2_cduhbyld,1624981193,/r/wallstreetbets/comments/oaat1n/whats_going_on_with_wish/,1,What s going on with wish , removed 
1096,oaat1y,t2_7cl0sfnr,1624981194,/r/wallstreetbets/comments/oaat1y/me_test_driving_my_new_plane/,1,Me test driving my new plane,
1097,oaat3q,t2_8yvt4kie,1624981198,/r/wallstreetbets/comments/oaat3q/69k_invested_in_sofi/,1,69k invested in Sofi,
1098,oaat5l,t2_6blh681p,1624981204,/r/wallstreetbets/comments/oaat5l/grom/,1, GROM,Hey first post here Don t really post anywhere but nobody is talking about this and I think it s a really good opportunity GROM social enterprises is a child entertainment media company looking to create a safer experience for kids using online sources of media for entertainment This is huge I m not sure how many of you guys have kids but the of entertainment children consume through iPads tablets on YouTube is insane Compared to when I was younger I watched cartoons on TV and played Super Nintendo Everything is just user created content and I ve for sure had to block some creators when content is a little out there got me interested but here s why I really like it Super low float about 5 million Just completed offering on the 21st of June at 4 15 per share selling 10million worth Over 2 million warrants expire end of June at 4 565 I don t pay for the data but can assume they were exercised Offering means they are good on cash until 2023 9 5 mill cash on hand In April they have also entered into an agreement with ink media plans to acquire them before end of 2021 which would help them expand on creating their own content Not much to go on for technicals as it was listed on nasdaq on June 21 but I ve been watching since 2 90 didn t think it was gunna run so hard so quick Bought in yesterday scaling in at 3 80 3 74 and some more at 3 90 cuz it got away from me 5k shares total I think I have to put my position in if I remember rules correctly Let me know what you guys think maybe wait for a pullback it s up to 4 30 but if it comes back down I m getting more for sure
1099,oaatj2,t2_9nlf6c1d,1624981235,/r/wallstreetbets/comments/oaatj2/dogestock/,1,Dogestock, removed 
1100,oaatj2,t2_9nlf6c1d,1624981235,/r/wallstreetbets/comments/oaatj2/dogestock/,1,Dogestock, removed 
1101,oaatke,t2_hgtko7i,1624981238,/r/wallstreetbets/comments/oaatke/45k_ttcf_options_yolo/,1,45K TTCF OPTIONS YOLO ,
1102,oaatx8,t2_o1jhy,1624981269,/r/wallstreetbets/comments/oaatx8/what_about_sdc/,1,What about SDC ,Like the title says if this board is always screaming short squeeze and other things along those lines don t they see the short interest on this cat I mean aside from the fact that it s actually decent at what it does The stock is being kicked while they re down by HF and shorts Typically apes together strong on things like this I m sure there are others out there with legitimate deep dive DD but on the surface this one seems valid 
1103,oaatxh,t2_a15hfbvu,1624981269,/r/wallstreetbets/comments/oaatxh/vtnr_potential_squeeze_discussion/,1,VTNR potential squeeze Discussion,Hi everyone what you think about VTNR potential squeeze or not For the moment i win 1000 on it but i think we can up more Please let commentaries about it
1104,oaau6m,t2_9r5vz8on,1624981289,/r/wallstreetbets/comments/oaau6m/niobf_discussions/,1, NIOBF Discussions,This is a place to talk NIOBF and all its glory Come one come all if you don t know you must to some DD Let this be home 
1105,oaaudj,t2_9wjq82,1624981304,/r/wallstreetbets/comments/oaaudj/american_airline_play/,1,American airline play ,
1106,oaauw5,t2_5kl5xyz6,1624981345,/r/wallstreetbets/comments/oaauw5/sqeeze_finally_started_yolo_loss_looking_better/,1,Sqeeze finally started yolo loss looking better still a loss,
1107,oaauzi,t2_ayx5t0br,1624981353,/r/wallstreetbets/comments/oaauzi/when_are_we_pulling_another_stunt_to_make_money/,1,When are we pulling another stunt to make money, removed 
1108,oaavhz,t2_2g6veasf,1624981398,/r/wallstreetbets/comments/oaavhz/cant_wait_for_this/,1,Can t wait for this,
1109,oaavma,t2_9683iiak,1624981409,/r/wallstreetbets/comments/oaavma/wish_rocket_ready_for_takeoff/,1, WISH rocket ready for takeoff ,
1110,oaavr5,t2_8nj900be,1624981419,/r/wallstreetbets/comments/oaavr5/social_media_platforms_are_the_best/,1,Social Media Platforms are the best ,
1111,oaavyu,t2_b2wfz7t1,1624981438,/r/wallstreetbets/comments/oaavyu/336k_sofi_1917_trusting_the_apes_to_make_this_one/,1,336k SOFI 19 17 Trusting the apes to make this one fly , removed 
1112,oaawj1,t2_wg5njd1,1624981485,/r/wallstreetbets/comments/oaawj1/sofi_1111_shares_make_a_wish/,1,SoFi 1111 shares Make a wish ,
1113,oaax1m,t2_2g6veasf,1624981529,/r/wallstreetbets/comments/oaax1m/yall_better_get_ready/,1,Y all better get ready,
1114,oaaxya,t2_ckjfmuio,1624981605,/r/wallstreetbets/comments/oaaxya/sofi/,1,Sofi ,
1115,oaayya,t2_646p3,1624981691,/r/wallstreetbets/comments/oaayya/cpng_yolo_update_trimmed_716_holding_820/,1,CPNG Yolo Update Trimmed 7 16 holding 8 20,
1116,oaayz8,t2_ckjfmuio,1624981693,/r/wallstreetbets/comments/oaayz8/clne/,1,Clne ,
1117,oaaz43,t2_2mkqn2nc,1624981704,/r/wallstreetbets/comments/oaaz43/whats_up_with_teva/,1,What s up with TEVA,TEVA is routinely bent over without the consideration of being asked it would like some lube first They are currently dealing with some court cases in regards to the opioid crisis but what major drug company didn t have their hand in that cookie jar at the time J amp J for example Yet TEVA still gets dragged through the Mud They have also had some shady price fixing issues in the past just settled one of those cases but what company hasn t tried any means possible to still have the competitive advantage if you ain t cheating you ain t trying In the pharmaceutical industry TEVA is everywhere why does the man continually bend it over 
1118,oaazeu,t2_fr9ag,1624981728,/r/wallstreetbets/comments/oaazeu/aso_undervalued_sporting_giant/,1, ASO Undervalued Sporting Giant,Unlike a lot of the other random tickers being pushed on this sub recently Academy Sports and Outdoors is a company that actually does well Undervalued in its booming industry compared to competitors see data below Solid financials and growth ASO does almost half of its market cap in revenue per quarter alone Net income profit margins and EPS have been growing quarterly for the past year High short interest at 21 57 of free float as of last report Extremely low volume at low market cap currently less than 1M in volume traded today with absolutely TINY buys and sells moving the stock by insane amounts ROCK BOTTOM IV on options currently at 1 percentile on its 52wk IV range You literally cannot have gotten in lower in the past year https preview redd it ud71gsdg58871 png width 316 amp format png amp auto webp amp s ab0131ce55dcbf5857944a82b8d6860aa21ac351 Like I cannot make this shit up Look at this shit Comparison to DKS Dicks Sporting Goods So retail is booming and sporting goods in particular are completing blowing out analyst expectations across the board DKS is largest and likely most well known player in the market with a 9 11B market cap compared to ASO s 3 77B Let s take a look at DKS and ASO s last earnings DKS reported 2021 Q1 earnings on May 25th and had a conservative consensus estimated EPS of 1 04 DKS reported EPS of 3 79 and overnight went from a stock price of 84 17 to 98 40 a 17 increase ASO reported Q1 earnings a couple of weeks later on June 8th and by this time analysts had come to realize that this was retail s market and posted a consensus EPS estimate of 0 96 Academy said fuck your estimate and posted an EPS of 1 89 Stock price Went from 37 78 to 39 65 a 5 increase Since then the stock s price has peaked at 42 75 as of last Friday and is currently trading at around 40 90 At this current price ASO is fundamentally still undervalued with a lot of room to run And after yesterday s consolidation ASO is primed to sprint its way to 45 in the very near future Valuations and Price Target After their most recent earnings 4 analysts upgraded ASO to an average price target of 45 25 https preview redd it 65vv8knc28871 png width 1360 amp format png amp auto webp amp s baed5832509857bd7ddd96551178b3a8c26b8b15 https preview redd it nsy07z4738871 png width 650 amp format png amp auto webp amp s abe42a29b79c5cd8cab96d9ff0997ca73d103dcc https preview redd it adzv18w738871 png width 807 amp format png amp auto webp amp s 36ebd04648ee20115522e524900ecd2df6b538f3 Although we might not like to admit it the pros are probably a little better at the whole trading thing than we are And all signals are furiously pointing at a strong buy 
1119,oaazio,t2_b2wfz7t1,1624981739,/r/wallstreetbets/comments/oaazio/336k_in_sofi_1917/,1,336k in SOFI 19 17 ,This subreddit has made me some damn good money and I appreciate all the great information you guys post about the hows and why s these stock make great buys I m hoping this one doubles as well Best of luck to all of you us in making this one fly too 
1120,oab0av,t2_9trg9m3h,1624981803,/r/wallstreetbets/comments/oab0av/sofi_not_so_much_but_hey_its_honest_work/,1,SOFI not so much but hey It s honest work , removed 
1121,oab0b5,t2_8gag6a56,1624981804,/r/wallstreetbets/comments/oab0b5/play_yolo/,1, PLAY YOLO,
1122,oab0d5,t2_140aqi,1624981808,/r/wallstreetbets/comments/oab0d5/new_retard_signing_in/,1,New Retard Signing In ,
1123,oab0vo,t2_a27yrv45,1624981849,/r/wallstreetbets/comments/oab0vo/wish_lets_go/,1,Wish let s go,
1124,oab16x,t2_clv12eer,1624981876,/r/wallstreetbets/comments/oab16x/here_it_goes_gsat_to_the/,1,Here it goes GSAT to the , removed 
1125,oab1e1,t2_k1g6o6n,1624981894,/r/wallstreetbets/comments/oab1e1/clov_taking_off/,1, CLOV taking off ,
1126,oab1my,t2_9trg9m3h,1624981915,/r/wallstreetbets/comments/oab1my/sofinot_so_much_of_a_huge_position_but_hey_honest/,1,SOFI not so much of a huge position but hey Honest work, removed 
1127,oab1r2,t2_7smmc4by,1624981924,/r/wallstreetbets/comments/oab1r2/sofi_to_the_moooon_not_much_because_im_broke_but/,1,SoFi to the moooon not much because I m broke but ALLLLL in wish me luck ,
1128,oab24a,t2_8jwjrza7,1624981952,/r/wallstreetbets/comments/oab24a/keep_an_eye_out_for_the_good_luck/,1,Keep an eye out for the good luck , removed 
1129,oab25z,t2_al2sujgx,1624981957,/r/wallstreetbets/comments/oab25z/10094_fee_rate_clov/,1,100 94 fee rate CLOV ,
1130,oab2e4,t2_clv12eer,1624981974,/r/wallstreetbets/comments/oab2e4/here_goes_gsat/,1,Here goes gsat , removed 
