,postid,author,created_utc,permalink,score,title,selftext
0,o9wr9p,t2_9pg7inx2,1624925238,/r/wallstreetbets/comments/o9wr9p/yolod_the_life_savings_on_psfe_immediately_lost_a/,1,YOLO d the life savings on PSFE immediately lost a few hundred Guys I could cry I feel like I truly belong now ,
1,o9wrfg,t2_a8we9mbs,1624925253,/r/wallstreetbets/comments/o9wrfg/good_day_for_amc_lets_go/,1,Good day for AMC Let s go ,
2,o9wrj3,t2_8hnyjsd9,1624925262,/r/wallstreetbets/comments/o9wrj3/amc_yolo_this_is_money_i_can_afford_to_lose/,1, AMC YOLO This is money i can afford to lose ,
3,o9ws1h,t2_2jnt6yo2,1624925312,/r/wallstreetbets/comments/o9ws1h/there_are_too_many_different_stocks_being_talked/,1,There are too many different stocks being talked about on WSB, removed 
4,o9wspz,t2_8pwwvny5,1624925383,/r/wallstreetbets/comments/o9wspz/what_michael_burry_has_been_talking_about_these/,1,What Michael Burry has been talking about these last few days ,Can anyone explain what he is tweeting talking about these last few days I read a bunch of article that were more click baits than information Do you think he is just dropping bombs or there are fundaments on what he s talking about 
5,o9wsqj,t2_a35cjqc1,1624925385,/r/wallstreetbets/comments/o9wsqj/lets_pump_nio_nio_to_the_moon/,1,LET S PU MP NIO NIO TO THE MOON, removed 
6,o9wstm,t2_83dizm8,1624925394,/r/wallstreetbets/comments/o9wstm/bb_blackberry_230k_yolo_june_2021_update/,1, BB Blackberry 230K YOLO June 2021 Update,
7,o9wta1,t2_b9wt3qaq,1624925439,/r/wallstreetbets/comments/o9wta1/hiti_earning_wow/,1,HITI earning WOW , removed 
8,o9wtr9,t2_86nvnsvf,1624925486,/r/wallstreetbets/comments/o9wtr9/69k_and_only_yolo_ever_to_wish_and_i_manage_2/,1,69k and only YOLO ever to WISH And I manage 2 other accounts all 3 accounts still accruing shares through upcoming weeks Does that make me 3 times the retard I know a good set up when I see one ,
9,o9wtvj,t2_93twipsd,1624925498,/r/wallstreetbets/comments/o9wtvj/wkey/,1, WKEY, removed 
10,o9wuao,t2_b9wt3qaq,1624925539,/r/wallstreetbets/comments/o9wuao/thoughts_on_hiti_earnings_today/,1,Thoughts on HITI earnings today, removed 
11,o9wuii,t2_7sh78lsr,1624925558,/r/wallstreetbets/comments/o9wuii/wmt_news_announces_14b_investments_great_news_for/,1, WMT news announces 14B investments great news for shareholders DD,
12,o9wvkc,t2_a0hfciib,1624925665,/r/wallstreetbets/comments/o9wvkc/my_portfolio_taking_hits_like/,1,My portfolio taking hits like , amp x200B video 8202aukok3871 
13,o9wvkt,t2_564x5o5z,1624925666,/r/wallstreetbets/comments/o9wvkt/not_financial_advise/,1,Not FINANCIAL ADVISE ,
14,o9wvtb,t2_cmf45r8z,1624925692,/r/wallstreetbets/comments/o9wvtb/hook_pharma/,1,HOOK pharma,I m not an expert at all and kinda new but HOOK is in a massive drop rn and looks like a decent company that might shoot help pls no mean comments
15,o9wvw9,t2_ymea0,1624925701,/r/wallstreetbets/comments/o9wvw9/me_today_tomorrow_probably_too/,1,Me today tomorrow probably too,
16,o9ww23,t2_b9wt3qaq,1624925716,/r/wallstreetbets/comments/o9ww23/hiti_earnings_released_wow/,1,HITI earnings released WOW ,
17,o9wwrz,t2_cowby80j,1624925789,/r/wallstreetbets/comments/o9wwrz/sklz_all_in_today_1960_shares/,1, sklz all in today 1960 shares, removed 
18,o9wx2q,t2_a0p2psxf,1624925818,/r/wallstreetbets/comments/o9wx2q/indi/,1,INDI , removed 
19,o9wx7b,t2_3ywpkg37,1624925831,/r/wallstreetbets/comments/o9wx7b/trying_my_best/,1,Trying my best ,
20,o9wxh7,t2_a2t7fvzh,1624925856,/r/wallstreetbets/comments/o9wxh7/lets_go_wkhs_to_the_fucking_moon/,1,Let s go WKHS TO THE FUCKING MOON , removed 
21,o9wxl0,t2_a2prcm8r,1624925867,/r/wallstreetbets/comments/o9wxl0/frx_now_body_is_the_moon_possible_what_do_the/,1,FRX now BODY is the moon possible What do the Apes say ,
22,o9wxna,t2_8nygpsj2,1624925874,/r/wallstreetbets/comments/o9wxna/vlo_volume_before_the_bell_100_calls_at_80156/,1, VLO volume before the bell 100 calls at 80 1 56 strike Trying to follow the momentum is hard when you work 9 5,
23,o9wy4u,t2_b11wrbmz,1624925917,/r/wallstreetbets/comments/o9wy4u/discord_server/,1,Discord server,Well the Wallstreets Discord server went crazy and Elon musk on Discord makes it even more crazy but we don t know if that is the Real elon or not 
24,o9wy5j,t2_c45c3dbn,1624925918,/r/wallstreetbets/comments/o9wy5j/cybnclxpf_next_big_thing_up_over_70_in_a_week/,1,CYBN CLXPF NEXT BIG THING UP OVER 70 in a week, CLXPF CYBN is the next big thing it s it has bin going up almost 10 a day for a last month or so just think if u invest in the first cannabis stock 5 years ago you have made over 20 thousand dollars from a simple 1 thousand dollar investment so don t be dumb and buy some cybn if Canadian or clxpf if u are in the US I am telling you it will double your money within a month Just my opinion from doing lots of research on this company do as you want but if your a smart ape I d buy CLXPF is US and CYBN if Canadian
25,o9wyiy,t2_a0p2psxf,1624925955,/r/wallstreetbets/comments/o9wyiy/indi_yolo/,1,INDI YOLO, removed 
26,o9wzd4,t2_8knj2jji,1624926036,/r/wallstreetbets/comments/o9wzd4/all_off_of_dogeecoin_and_amc_lol/,1,All off of dogeecoin and AMC lol,
27,o9wzt4,t2_a0hfciib,1624926079,/r/wallstreetbets/comments/o9wzt4/visual_of_my_portfolio_the_last_few_months/,1,Visual of my portfolio the last few months ,
28,o9x007,t2_a0p2psxf,1624926098,/r/wallstreetbets/comments/o9x007/indi_trending_yolo/,1,INDI TRENDING YOLO , removed 
29,o9x10e,t2_a0p2psxf,1624926201,/r/wallstreetbets/comments/o9x10e/tomorrow_it_begins_indi/,1,Tomorrow it begins INDI , removed 
30,o9x2bn,t2_7u1kqfw5,1624926332,/r/wallstreetbets/comments/o9x2bn/tilray_analysis/,1,Tilray Analysis, Tilray Tiray is a global researcher cultivator processor and distributor of cannabis products founded in 2013 by Brendan Kennedy Micheal Blue and Christian Groh It is headquartered in Nanaimo Canada but has operations throughout North and South America Europe Australia and New Zealand and South Africa Irwin Simon Irwin Simon graduated from Saint Mary s University with a Bachelor of Arts degree in 1979 and worked many sales and marketing positions with food companies He then acquired Hain Celestial Group a natural food business becoming Chairman and CEO Under his leadership Hain is now the largest natural food business in the U S A having over 200 million in sales revenue and control over 18 health food companies He became Chairman and CEO of Aphria a Canadian based cannabis company in December of 2018 Irwin Simon became Chairman and CEO of Tilray in May 2021 after the merger between Aphria and Tilray Financials money in thousands Revenue 2016 12 644 2017 20 538 2018 43 130 2019 166 979 2020 210 482 Cost of Sales 2016 9 974 2017 9 161 2018 28 855 2019 190 475 2020 185 827 Gross Profit 2016 2 670 2017 11 377 2018 14 275 2019 23 496 2020 24 655 Financials show steady year over year growth for Tilray excluding 2019 and much more is expected in 2021 due to the merger between Aphria and Tilray Opportunity Historically cannabis has been a product that was illegal and unbranded However governments recently began legalizing the trade and use of cannabis in many different countries The cannabis market will further develop as a result of this increase in demand and will provide opportunity for companies such as Tilray to dominate this market because it is relatively new Tilray is positioned to take advantage of this market because of their wide reach from operations in 17 countries as well as its diverse multitude of products Merger Tilray became the world s largest cannabis company after the merger between Aphria and Tilray on May 3 2021 Before the merger Tilray was a much smaller company compared to Aphria with Tilray having a market cap of 3 3 billion and Aphria having a market cap of 4 9 billion However Tilray had a market cap of 6 1 soon after the merger resulting in more influence for the company Due to the larger market cap of Aphria before the merger they have more authority over Tilray with their shareholders owning 62 of the company Stock Price Tilray s stock price is undervalued compared to its competitors As of June 27 2021 the market cap of Tilray is 5 63 billion CAD however competitors such as Canopy Growth 11 60 or Curaleaf 12 55 have a higher market cap but do not justify it with higher revenue The stock price of Tilray is about 40 lower than the highs after the merger between Aphria and Tilray even though the fundamentals of the company have only been getting better As a result of this Tilray is not only undervalued compared to its competitors but also compared to its previous stock price Sentiment among retail traders momentum in stock price and potential legalization of cannabis products could cause a short term increase in the stock price 
31,o9x2er,t2_a3tv1tcj,1624926340,/r/wallstreetbets/comments/o9x2er/all_about_the_tellurian_train_lets_make_this/,1,All about the tellurian train Let s make this happen ,
32,o9x3bv,t2_a2prcm8r,1624926433,/r/wallstreetbets/comments/o9x3bv/frx_now_body_thoughts/,1,FRX now BODY thoughts , removed 
33,o9x4nr,t2_184h1qgj,1624926584,/r/wallstreetbets/comments/o9x4nr/to_clov_or_not_to_clov_more_that_is_the_question/,1,To CLOV or not to CLOV more that is the question ,On the fence about investing a lot more in Clover Health tomorrow and decided to do a pros and cons for my first WSBets post Pros Market cap is low compared to competition Revenue growth is mind boggling 60 000 boomers turn 65 everyday 18 percent of the US GDP is going to healthcare United Healthcare biggest Medicare Advantage player market cap is pushing 400 billion Google is an early investor Short interest is enormous best bet to short squeeze a la GME AMC and screw a bunch of hedge funds Big hitters on the board including a Clinton Cons I don t have enough shares 
34,o9x4q1,t2_9a2rgjh6,1624926591,/r/wallstreetbets/comments/o9x4q1/what_do_you_think_about_vdhi/,1,What do you think about VDHI, removed 
35,o9x56q,t2_c18c5tnd,1624926635,/r/wallstreetbets/comments/o9x56q/polyearn/,1,POLYEARN, removed 
36,o9x58p,t2_a0p2psxf,1624926640,/r/wallstreetbets/comments/o9x58p/indi_tomorrow_it_begins_indie_semiconductor_will/,1,INDI Tomorrow it begins Indie Semiconductor will soon be in every EV as the future of autonomous vehicles starts to take stride This is the ground floor that you can get in now before it rips Come with me if you want to YOLO , removed 
37,o9x5fo,t2_a0p2psxf,1624926660,/r/wallstreetbets/comments/o9x5fo/indi_tomorrow_it_begins_indie_semiconductor_will/,1,INDI Tomorrow it begins Indie Semiconductor will soon be in every EV as the future of autonomous vehicles starts to take stride This is the ground floor that you can get in now before it rips Come with me if you want to YOLO , removed 
38,o9x5mj,t2_c18c5tnd,1624926679,/r/wallstreetbets/comments/o9x5mj/polyearn_launch_presale/,1,POLYEARN launch presale,
39,o9x64o,t2_a0p2psxf,1624926729,/r/wallstreetbets/comments/o9x64o/indi_tomorrow_it_begins_indie_semiconductor_will/,1,INDI Tomorrow it begins Indie Semiconductor will soon be in every EV as the future of autonomous vehicles starts to take stride This is the ground floor that you can get in now before it rips Come with me if you want to YOLO , removed 
40,o9x65m,t2_a0qd0bvb,1624926731,/r/wallstreetbets/comments/o9x65m/which_one_of_you_apes_is_out_here_wilding_and/,1,Which one of you apes is out here wilding and Tipping 434 ,
41,o9x744,t2_7tggjlg4,1624926832,/r/wallstreetbets/comments/o9x744/stocktwits_is_going_crazy_for_sofi_tonight/,1,Stocktwits is going crazy for SoFi tonight,
42,o9x77h,t2_2mwsmec9,1624926840,/r/wallstreetbets/comments/o9x77h/psfe_lets_go_and_pay_safe/,1, PSFE Let s go and pay safe ,
43,o9x7jv,t2_ckwggtap,1624926877,/r/wallstreetbets/comments/o9x7jv/potential_shorts_nightmare/,1,Potential Shorts Nightmare,I m new to this board I just figured I d share a couple of can t miss stocks that would be a nightmare for shorts One is QDEL It s way undervalued Got beaten down badly by shorts but appears to be breaking out now According to Yahoo the estimated return is like 125 It accumulated billions from coronavirus test kits it s P E ratio is ridiculously low And it is a versatile company Lyme disease is up this year and they sell test kits for that They do test kits for the flu drug screenings etc It s owned at least 80 by institutional investors It was beaten down to shake retail investors out of their shares so they could accumulate more The other stock is VRTX Another one that is near its lowest point in like a year or two It was probably manipulated to come down Estimated return is 75 If anyone with influence wants to do a minimum effort of due diligence and get something going feel free to check em out and spread the word I m in on these already so i have incentive skin in the game They would be super low risk and high reward potential Shorts don t want to F with companies that make billions and have little debt Links to Yahoo finance https finance yahoo com quote QDEL p QDEL amp tsrc fin srch https finance yahoo com quote VRTX p VRTX amp tsrc fin srch PS i was already in on VUZI Like that you caught on to that Good luck gents Oh and i sold 500 worth of AMC for avg share price of 2 and change in December Live amp learn Patience 
44,o9x7r2,t2_a0hfciib,1624926896,/r/wallstreetbets/comments/o9x7r2/when_i_get_word_of_a_new_stock_on_wsb/,1,When I get word of a new stock on WSB,
45,o9x853,t2_9a2rgjh6,1624926933,/r/wallstreetbets/comments/o9x853/thoughts_on_vdhi/,1,Thoughts on VDHI,I m new to this community but would love some insight into what you all think of VDHI Verde Bio Hldgs Inc Com Does anyone think this could be a solid long term investment for my children or too risky based on the industry I appreciate all the time taken to gain better insight to my approach 
46,o9x8a9,t2_amxvy330,1624926946,/r/wallstreetbets/comments/o9x8a9/wsb_is_dying_yeah_right_i_like_it_better_now_that/,1,WSB is dying Yeah right I like it better now that paper hands have left,
47,o9x8nv,t2_7tggjlg4,1624926983,/r/wallstreetbets/comments/o9x8nv/stocktwits_going_crazy_for_sofi_tonight/,1,Stocktwits going crazy for SoFi tonight https stocktwits com dskusa message 350078625, removed 
48,o9x9d1,t2_c9n1uv15,1624927051,/r/wallstreetbets/comments/o9x9d1/bb_sold_my_other_meme_stock_and_double_my/,1,BB sold my other meme stock and Double my position on BB like a true retard ,
49,o9x9kd,t2_7tggjlg4,1624927072,/r/wallstreetbets/comments/o9x9kd/stocktwits_going_crazy_for_sofi_tonight/,1,StockTwits going crazy for SoFi tonight https stocktwits com dskusa message 350078625,
50,o9x9si,t2_43cwegs8,1624927095,/r/wallstreetbets/comments/o9x9si/blackberry_is_among_4_best_tech_stocks_to_buy/,1,Blackberry is among 4 Best Tech Stocks to Buy This Week According to NASFAQ COM,Blackberry was named by NASDAQ com as one of 4 Best Tech stocks to own this week Virgin Galactic Holdings Apple Inc Nvidia Corporation and Blackberry Ltd Blackberry is an innovation icon They created the smart phone and were first to market Today they are pioneering the smart car technology with the futuristic AWS BB IVY Intelligent Car Platform In collaboration with IVY advisory council including GEICO TELUS HERE AWS CERENCE
51,o9x9we,t2_e8s84,1624927108,/r/wallstreetbets/comments/o9x9we/astronova_alot_living_up_to_its_name_and_going/,1,AstroNova ALOT living up to its name and going MOONSHOT,Major bull signal Spent a good amount of time researching today lower cap stocks 10 20 range with bullish engulfing patterns I ve been doing a ton of research on candlestick chart technical trading and already made some good calls on RLLCF 30 in two days and a solid NFLX multiday rally Really liking what I m seeing from ALOT Great reversal signal on a flattening downward trend Stochastics in the oversold with an internsection between fast and slow on the day Flattening downward makes more lower risk of dropoff Gonna go in on this one tomorrow AM apes 
52,o9xa6v,t2_7tggjlg4,1624927139,/r/wallstreetbets/comments/o9xa6v/stocktwits_going_crazy_for_sofi_tonight/,1,StockTwits going crazy for SoFi tonight https stocktwits com dskusa message 350078625,
53,o9xab0,t2_a8zzqtg7,1624927150,/r/wallstreetbets/comments/o9xab0/discount_of_the_century_gme_is_available_to/,1,Discount of the century GME is available to purchase on reverse margin with reverse leverage For a 213 investment you get 25 000 000 asset NO RISK broker is subject to requirements and Market Maker is subject to Margin Call Offer available for a limited time THE PRICE IS WRONG B1TCH ,I wanted to call this the THANK KEN Megathread It s clear to me that KG drank too much whiskey and indulged in too much mayo the evening before he dreamed this little beauty up This may in all likelihood become the worst decision ever made in the history of the stock market I believe the hype I bought X GME I saw u deepfuckingvalue briefing the senators that price was wrong I ve read the DD I trust RC amp co I like the stock I am a happy ape with Diamond Hands An ape who is happy to wait for a rocket to the moon I have gained wisdom from sh1tposts and laughed out loud while reading DD about SI Finally all that s left for me to do is to thank Ken Griffin for making a play that was so fantastically bad that I will never work another day in my life Thanks Ken I m planning to retire to a banana plantation just south of the equator I ll spend my free time barbecuing tendies and sharpening crayons for all the 4 amp 5 year old children of the world so they can learn maths better than your interns ever did We set the floor The 3 commas rule is official xx xxx xxx xxx TDLR Hegies r fuk 1 2 3 everybody Thanks Ken 
54,o9xagd,t2_a0p2psxf,1624927165,/r/wallstreetbets/comments/o9xagd/indi_tomorrow_it_begins_indie_semiconductor_will/,1,INDI Tomorrow it begins Indie Semiconductor will soon be in every EV as the future of autonomous vehicles starts to take stride This is the ground floor that you can get in on now before it rips higher Come with us if you want to YOLO ,
55,o9xd3w,t2_6wkimtem,1624927436,/r/wallstreetbets/comments/o9xd3w/those_of_us_tards_who_missed_out_on_amc/,1,Those of us tards who missed out on AMC ,
56,o9xe4d,t2_a0p2psxf,1624927539,/r/wallstreetbets/comments/o9xe4d/indi_lets_get_this_party_started_indie/,1,INDI Let s get this party started indie semiconductor to ring in opening bell tomorrow on Nasdaq This is your chance to get in while it s still cheap considering on where this will be very soon You heard it here first Come with us if you want to YOLO ,
57,o9xeia,t2_5pp3q2qr,1624927579,/r/wallstreetbets/comments/o9xeia/tlry_squeeze_beginning/,1,TLRY squeeze beginning, tlry this could be the start for the run to 30 company is well positioned and charts are setting up for a major move
58,o9xeqs,t2_5vw3a6ce,1624927603,/r/wallstreetbets/comments/o9xeqs/all_in_clov_clov_is_the_ultimate_short_squeeze/,1,All in CLOV CLOV is the ultimate short squeeze CLOV to 100 Not financial advice ,
59,o9xesu,t2_a0p2psxf,1624927610,/r/wallstreetbets/comments/o9xesu/indi_lets_get_this_party_started_indie/,1,INDI Let s get this party started indie semiconductor to ring in opening bell tomorrow on Nasdaq This is your chance to get in while it s still cheap considering on where this will be very soon You heard it here first Come with us if you want to YOLO , removed 
60,o9xfvw,t2_a0uosfwu,1624927717,/r/wallstreetbets/comments/o9xfvw/wish_100_yolo/,1,WISH 100 yolo,
61,o9xgeh,t2_60fglqr9,1624927771,/r/wallstreetbets/comments/o9xgeh/justice_clarence_thomas_says_federal_laws_against/,1,Justice Clarence Thomas says federal laws against marijuana may no longer be necessary,
62,o9xgiw,t2_a1rwf37h,1624927782,/r/wallstreetbets/comments/o9xgiw/xela_stock_bigger_than_paypal_20000_employees/,1,XELA Stock Bigger Than PayPal 20 000 Employees Globally Held by 31 Institutions 1 Billion in Sales Revenue Yearly and Gappin Up in the After Hours 20 Volume Coming in Hot , Exela Technologies Inc is a Global Business Process Automation Company XELA has about the same amount of employees as PayPal Approx 20 000 Given enough time this company could be a Unicorn Top Institutional Holders Armistice Capital Vanguard and Goldman Sachs and 28 more institutions This company automates damn near everything for companies of all sorts such as finance hospitals payments analytics tracking the list goes on and on Watch the due diligence video on YouTube Titled XELA Stock Bigger Than PayPal https emojipedia org rocket 
63,o9xgwf,t2_17hott,1624927818,/r/wallstreetbets/comments/o9xgwf/just_waiting_on_the_rocket/,1,Just waiting on the rocket ,
64,o9xh52,t2_60fglqr9,1624927840,/r/wallstreetbets/comments/o9xh52/mexico_top_court_decriminalizes_recreational/,1,Mexico top court decriminalizes recreational marijuana use,
65,o9xhea,t2_6e9nva9w,1624927865,/r/wallstreetbets/comments/o9xhea/when_main_st_becomes_wall_st_gme/,1,When Main St becomes Wall St GME ,
66,o9xhx6,t2_a1eji86x,1624927921,/r/wallstreetbets/comments/o9xhx6/bb_and_wkhs/,1,BB and WKHS, removed 
67,o9xiq5,t2_8lbxf636,1624928005,/r/wallstreetbets/comments/o9xiq5/makerdao_speaker_series_1_senior_vp_of_st_louis/,1,MakerDAO Speaker Series 1 Senior VP of St Louis Federal Reserve David Andolfatto,
68,o9xj0x,t2_a1rwf37h,1624928036,/r/wallstreetbets/comments/o9xj0x/xela_stock_do_diligence/,1,XELA Stock Do Diligence, removed 
69,o9xjby,t2_ntrswsf,1624928066,/r/wallstreetbets/comments/o9xjby/the_fintech_disrupter_that_everyone_is_talking/,1,The FinTech Disrupter that everyone is talking about today none other than Social Finance Inc aka SOFI,I have been saying for about 2 3 weeks that I would do a DD on SoFi and figured with the increased volume and mentions today it is time lay out my own bull thesis SoFi was founded in 2011 by Mike Cagney Dan Macklin James Finnigan and Ian Brady four students who met at the Stanford Graduate School of Business The founders hoped SoFi could provide more affordable options for those taking on debt to fund their education https en wikipedia org wiki SoFi text SoFi 20was 20founded 20in 202011 debt 20to 20fund 20their 20education I am just a big believer in bringing personal finances to the masses and to teach people about personal finance and how to accumulate and build wealth most parents and schools don t teach shit on the subject matter I absolutely love SoFi s statements mantras Our number one goal is helping our members get their money right SoFi s mission is to help people reach financial independence to realize their ambitions Let s go over some s SoFi has been around and growing as a private company for some time now and has seen seven consecutive quarters of YoY growth w Q1 2021 producing 110 growth and ending w 2 281M members This is exponential to say the very least I will be linking the data and numbers but that is all readily available for all the see and find The adjusted Net Revenue and EBITDA are increasing and trending in the right direction with 151 and 70 growth YoY respectively The biggest factors to me are they are scaling and accumulating data These 2 things are what are going to set companies apart to not only produce growth but obtain profitability to the bottom line The goal of SoFi is to be the one stop shop for everything a person would need for finance Checking savings accounts personal loans home loans student loans car loans budgeting investing in the markets and on and on The total products used by members has grown by 121 YoY and financial products has grown 273 YoY It appears to this layman that they are figuring out to how grow members as well as total products used by member https www nasdaq com articles sofis q1 earnings beat managements guidance as company prepares to trade on nasdaq 2021 05 SoFi acquired Golden Pacific Bancorp Inc in its quest to get a federal bank charter which is cumbersome and tedious process This would be an upcoming catalyst for sure if when this happens https www spglobal com marketintelligence en news insights latest news headlines sofi s bank buy presents blueprint for more fintech bank deals 63129976 The Galileo acquisition was a game changer and covered well by u havocs2 in his DD I would just add that this has seen 130 YoY everything seems to be growing triple digits growth as well https www reddit com r wallstreetbets comments o9l9x6 why sofi will be sofly my 78000 yolo into sofi SoFi was brought to market under the SPAC model and coverage of the stonk has just began Coverage was initiated by Oppenheimer w an outperform and was also initiated by Rosenblatt w a buy TipRanks has it rated as moderate buy and a price target of 27 50 about a 40 premium to today s closing price https www tipranks com stocks sofi forecast I am not a bot nor am I a shill I am very active to fucking active to be honest in the daily and I post almost all my plays in real time Check my post history and you can see that I have been in this play for some time and believe in the company Current positions 5 12 50 2023 LEAPS 2 20 00 2023 LEAPS and 155 shares and no intention of dumping or selling short term Is there a high SI is the borrow rate high Was this targeted because it was a Chamath SPAC Probably i don t know for sure and honestly don t give 2 shits if it is or it is not I like the company and the stonk and think it is undervalued and will only grow in the future That is what the hell I think To be a FinTech disrupter you obviously need an app and great user friendly UI and SoFi has a 4 8 rating w over 48K reviews on the AAPL app store TL DR There is no industry s that need more disruption than banks and brokerages For far too long the poors and working class have been hit w hidden fees outrageous fees shit even made up accounts SoFi is the just the company to do this disrupting all in one beautiful app Shout out to u OSRSkarma as he kept pushing to post this 
70,o9xjjc,t2_a2s95swl,1624928085,/r/wallstreetbets/comments/o9xjjc/auud_auddia_price_target_volume_increase/,1,AUUD auddia price target Volume increase ,
