,postid,author,created_utc,permalink,score,title,selftext
1591,oaf0gq,t2_9596pecc,1624993681,/r/wallstreetbets/comments/oaf0gq/hyliion_holdings_hyln/,1,Hyliion Holdings HYLN,Trying to make a case for a stock with massive upside potential Doing my best to deliver here for you a virgin DD Shaken not stirred Anyway hear me out for https finance yahoo com quote HYLN p HYLN https finance yahoo com quote HYLN p HYLN CEO Thomas Healy Bright Down to earth under promise over deliverer type A solid company headquartered in Austin Texas 110M outstanding shares and about 20 short At this moment 7 7 fee and only 10 000 shares available https iborrowdesk com report HYLN info from https iborrowdesk com report HYLN https iborrowdesk com report HYLN They came to the market with a big hype behind it like all EV related stocks At one point it touched 58 ever since the bottom was at about 7 9 about 6 weeks ago Currently it s hanging in the 11 12 range There is some sort of consolidation at this point Outlook and curve looks bullish as our technical s continue to improve and we attract more interest Here you can find a good overview presentation from last year with their timelines and goals https www hyliion com wp content uploads 2020 06 Hyliion Tortoise Overview Presentation pdf https www hyliion com wp content uploads 2020 06 Hyliion Tortoise Overview Presentation pdf They are on track I d say MORE than on track to reach their goals but the stock price does not reflect it at this given moment Yes hence my case for the upside potential share price of 100 200 in 5 years is not far fetched Actually 2024 revenue projection is 2B at ONLY 2 market share A valuation of 10 times revenue which would be reasonable for a company growing that fast would produce a market cap of 20 Billion Current market cap is 2 Billion Shares would have to go up 10x to have a 20 Billion market cap to 120 share 2024 is only 3 years away In 5 years we ll likely be much higher capturing even more market share 10 percent market share would put us at 600 share Anyhow They just started expanding their headquarters and they are hiring like mad https investors hyliion com news news details 2021 Hyliion Accelerates Growth Begins Expansion of Its Austin Texas Headquarters default aspx https investors hyliion com news news details 2021 Hyliion Accelerates Growth Begins Expansion of Its Austin Texas Headquarters default aspx https investors hyliion com news news details 2021 Hyliion Accelerates Growth Begins Expansion of Its Austin Texas Headquarters default aspx Additional office space and amenities will accommodate growing team of up to 500 employees Redesign will more than double powertrain installation capacity and triple battery development space Hyliion welcomes industry veteran Richelle Frank as Vice President of Operations Frank to oversee the company s facility redesign and further advance broader manufacturing strategy towards commercialization What do they do They basically design develop and sell electric powertrains solutions that are being added on existing Class 8 Semi Trucks With the goal of transforming the commercial transportation industry s environmental impact at scale and reducing the total cost of ownership See presentation page 9 it s about 35 compared to diesel trucks They leverage advanced software algorithms and data analytics capabilities and maximise the output power thus torc of the fitted trucks Basically Their efficient system decreases fuel consumption lowers the operating expenses plus it provides extra power Class 8 trucks you apes might ask Yes Class 8 the backbone of the USA economy https www fueloyal com class 8 trucks important part usa economy https www fueloyal com class 8 trucks important part usa economy https www fueloyal com class 8 trucks important part usa economy soo much in demand that at this point they have more demand than supply https www truckinginfo com 10144905 class 8 truck orders backlogged until 2022 https www truckinginfo com 10144905 class 8 truck orders backlogged until 2022 Catalyst wise Just joined Russell 3000 and Russell 2000 Indexes They are on the brink of releasing their hybrid v2 and fully electric EXR truck Government incentives and more importantly government mandates will be in HYLN favour the coming years since the trend overall is green They have the best battery tech added to the trucks meaning they can charge up faster by far than the competition and their added weight is small compared to the competition their solutions https www businesswire com news home 20210211005805 en Hyliion Introduces Next Generation Battery Module to Improve Performance and Efficiency https www businesswire com news home 20210211005805 en Hyliion Introduces Next Generation Battery Module to Improve Performance and Efficiency They have a ton of patents https patents justia com assignee hyliion inc https patents justia com assignee hyliion inc What more can one ask for I stepped in and added to my positions today Good luck all and godspeed 
1592,oaf0lf,t2_9q6jr37q,1624993692,/r/wallstreetbets/comments/oaf0lf/clne/,1,CLNE ,All I ll say is huge short squeeze even without the squeeze it is clean energy so it s bound to go up with the new economy BUY NOW 
1593,oaf0lu,t2_12vm6g,1624993693,/r/wallstreetbets/comments/oaf0lu/uk_regulator_approves_amds_xilinx_acquisition/,1,UK Regulator Approves AMD s Xilinx Acquisition, https www tomshardware com news uk regulator approves amd xilinx deal https www tomshardware com news uk regulator approves amd xilinx deal The UK Competition and Markets Authority CMA today announced its approval of AMD s plan to acquire Xilinx in an all stock transaction worth roughly 35 billion The CMA didn t offer many details about its decision at time of writing The CMA has cleared the anticipated acquisition by Advanced Micro Devices Inc of Xilinx Inc it said https www gov uk cma cases advanced micro devices inc slash xilinx inc merger inquiry s 09 in today s update The full text of the decision will be available shortly AMD announced its plans https www tomshardware com news amd to buy xilinx for dollar35 billion to acquire Xilinx in October 2020 The deal would give AMD shareholders a 74 stake in the combined company Xilinx shareholders would own the other 26 Both companies boards of directors unanimously approved the deal The companies then announced in April https www tomshardware com news amd xilinx shareholders overwhelmingly approve acquisition that their shareholders overwhelmingly approved of the deal and AMD said it expected regulators to clear the acquisition by the end of the year The CMA s decision brings that expectation closer to reality AMD has said the combined company would invest over 2 7 billion in R amp D annually to continue development of CPUs GPUs FPGAs SoCs and other technologies with more obscure initialisms Xilinx s experience with deep learning on which the companies have collaborated https www tomshardware com news amd xilinx machine learning inference record 37885 html in the past is likely vital to AMD s plans for the future 
1594,oaf0xp,t2_d0fngxfi,1624993720,/r/wallstreetbets/comments/oaf0xp/finally_got_my_degenerate_family_and_myself_to/,1,Finally got my degenerate family and myself to XXXX status ,
1595,oaf14f,t2_58mgbpzz,1624993734,/r/wallstreetbets/comments/oaf14f/auto_mod_gonna_auto_mod_me_probably/,1,Auto mod gonna auto mod me probably,
1596,oaf1lc,t2_akr6a5uh,1624993773,/r/wallstreetbets/comments/oaf1lc/i_wish_people_could_just_learn_to_hold/,1,I WISH people could just learn to hold , Saw another redditors post so let s look at this Expected revenue for 2021 3 25 billion Cash on balance sheet approx 2 billion Revenue increased 75 compared to last year WISH is also most downloaded e commerce app in the world for last 3 years In 2015 Amazon had offered 10 billion in cash but WISH walked away Current Enterprise Value 6 billion Market cap Cash 2 billion 4 billion Currently trading at 1 23 times expected 2021 revenues Wish is one of the largest and fastest growing global ecommerce platforms and should be trading at least 5 6 times revenue i e 16 to 20 billion and stock price between 25 30 With economies reopening it will be easy to facilitate shipping and will favourably impact WISH In addition low income group which were adversely impacted will be back As you can see there are lot of tail winds for this stock and it can easily muti bagger at this dirt cheap price You don t make money without patience Just buy and hold and let compounding do it s magic WISH went through several rounds of raising capital through equity financing with company valuation way north of 10 billion As a result early investors are not going to sell at this price level Short sellers will be rudely awaken next week if they think that stock lock up expiration if going to give them an opportunity to buy back the stocks cheaply in order to cover their short position 
1597,oaf1vg,t2_9q6jr37q,1624993799,/r/wallstreetbets/comments/oaf1vg/clne/,1,CLNE , removed 
1598,oaf1xw,t2_12vm6g,1624993805,/r/wallstreetbets/comments/oaf1xw/uk_regulator_approves_amds_xilinx_acquisition/,1,UK Regulator Approves AMD s Xilinx Acquisition, removed 
1599,oaf21w,t2_a1m75u47,1624993814,/r/wallstreetbets/comments/oaf21w/wish/,1, WISH, removed 
1600,oaf21w,t2_a1m75u47,1624993814,/r/wallstreetbets/comments/oaf21w/wish/,1, WISH, removed 
1601,oaf271,t2_mcjqpmn,1624993827,/r/wallstreetbets/comments/oaf271/looks_like_the_shorts_are_attacking_the_cruise/,1,Looks like the shorts are attacking the cruise stocks Big spike in Short Volume ,
1602,oaf2jc,t2_a0dgyxob,1624993855,/r/wallstreetbets/comments/oaf2jc/mcoa_subsidiary_cdistro_signs_distribution/,1,MCOA Subsidiary cDistro Signs Distribution Agreement with Silo Wellness and Marley One Functional Mushrooms,I think this is big for this company to have the backing of the Bob Marley Family for a product line and on top of the growth MCOA seen over the past year
1603,oaf2oo,t2_4zwzrobz,1624993866,/r/wallstreetbets/comments/oaf2oo/jd_is_a_good_long_term_stock_to_hold/,1,JD is a good long term stock to hold ,Hey Guys my first DD on a stock Most of you have heard about JD It provides online retail online marketplace and marketing services in China and serves as the main competitor for Alibaba Much like other stocks during the tech selloff https investorplace com 2021 05 7 cathie wood stocks to buy despite the recent tech selloff JD Com suffered massive blows Its current PE ratio is 14 which is unheard in the common e commerce space Also JD stock has come down in anticipation of anti trust crackdown of chinese tech companies by chinese government As we all know this started because Jack Ma could not keep his mouth shut and publicly said that China rules are not every conducive for growth As a result Government decided to make an example of tech companies and imposed them with fines and maximum was imposed on BABA 4 No fines were levied on JD JD got penalized with other stocks Also JD com s 618 June 18th sales event is going very well after selling 136 billion worth of goods last year helped fuel the growth rally 618 is JD com s response to Alibaba s November Singles Day event A strong 618 event should be good for Walmart which owns 5 39 of the company and has historically promoted its goods on 618 In the first quarter the Beijing based company reported net revenue of 203 2 billion yuan in the quarter ended March 31 an increase of 39 year on year Excluding items JD com posted a profit of 2 47 yuan per American depository share ADS beating analysts expectations of 2 26 yuan by 9 2 This is not new territory for the company On Mar 11 JD com reported its fourth quarter and full year 2020 earnings In that earnings release the company highlighted that it grew its active user base by nearly one third in a single year and increased revenue and EPS by 31 4 and 187 5 respectively Despite this awesome performance the company is trading at a steep discount to its 52 week high Overall I am very positive on the stock and its trading at good discount I am long on the stock I am not financial advisor Please do your own research too I am just an APE with a dream 
1604,oaf2yx,t2_93vh2rok,1624993889,/r/wallstreetbets/comments/oaf2yx/carv_at_68_short_interest_40m_market_cap_easy/,1, CARV at 68 short interest 40M Market Cap Easy Squeeze ,Who s down to squeeze CARV to the Moon Should be a fast and easy deal at 40M market cap and 68 short interest CARV can only fly Vote up if you are down Buying 10 shares vote and will provide proof Lets get CARV up and going https preview redd it v1h166yh79871 png width 1280 amp format png amp auto webp amp s 31f995f3d87b86a2346f5bd2c2d25b6f7b9f3fa3
1605,oaf384,t2_12vm6g,1624993920,/r/wallstreetbets/comments/oaf384/uk_regulator_approves_amds_xilinx_acquisition/,1,UK Regulator Approves AMD s Xilinx Acquisition, https www tomshardware com news uk regulator approves amd xilinx deal https www tomshardware com news uk regulator approves amd xilinx deal 
1606,oaf3ft,t2_9q6jr37q,1624993947,/r/wallstreetbets/comments/oaf3ft/clne/,1,CLNE ,All I m saying is we have space for a huge pump buy all in and it s a clean gas company promoting other to also buy in the coming years if you look at what s been happening with other energy stocks like this you will know this is We can make this the next GameStop get in now to get rich or else you ll be saying the gme thing all over again 
1607,oaf3h7,t2_4zwzrobz,1624993952,/r/wallstreetbets/comments/oaf3h7/jd_is_good_long_term_stock/,1,JD is good long term stock,Hey Guys my first DD on a stock Most of you have heard about JD It provides online retail online marketplace and marketing services in China and serves as the main competitor for Alibaba Much like other stocks during tech sell off JD Com suffered massive blows Its current PE ratio is 14 which is unheard in the common e commerce space Also JD stock has come down in anticipation of anti trust crackdown of chinese tech companies by chinese government As we all know this started because Jack Ma could not keep his mouth shut and publicly said that China rules are not every conducive for growth As a result Government decided to make an example of tech companies and imposed them with fines and maximum was imposed on BABA 4 No fines were levied on JD JD got penalized with other stocks Also JD com s 618 June 18th sales event is going very well after selling 136 billion worth of goods last year helped fuel the growth rally 618 is JD com s response to Alibaba s November Singles Day event A strong 618 event should be good for Walmart which owns 5 39 of the company and has historically promoted its goods on 618 In the first quarter the Beijing based company reported net revenue of 203 2 billion yuan in the quarter ended March 31 an increase of 39 year on year Excluding items JD com posted a profit of 2 47 yuan per American depository share ADS beating analysts expectations of 2 26 yuan by 9 2 This is not new territory for the company On Mar 11 JD com reported its fourth quarter and full year 2020 earnings In that earnings release the company highlighted that it grew its active user base by nearly one third in a single year and increased revenue and EPS by 31 4 and 187 5 respectively Despite this awesome performance the company is trading at a steep discount to its 52 week high Overall I am very positive on the stock and its trading at good discount I am long on the stock I am not financial advisor Please do your own research too I am just an APE with a dream 
1608,oaf3h8,t2_a94kei43,1624993952,/r/wallstreetbets/comments/oaf3h8/germany/,1,Germany ,
1609,oaf3qn,t2_cltjqizw,1624993989,/r/wallstreetbets/comments/oaf3qn/wprt/,1,WPRT, appears to be a good play in the RNG LNG sector and still very cheap They have contract to build engines and components for Amazon They reported 76M revenue and a loss of just 2 cents in the most recent quarter Looks to be very cheap trading 5 Any insight would be appreciated Thanks 
1610,oaf48p,t2_9q6jr37q,1624994057,/r/wallstreetbets/comments/oaf48p/clne/,1,CLNE,All I m saying is we have space for a huge pump buy all in and it s a clean gas company promoting other to also buy in the coming years if you look at what s been happening with other energy stocks like this you will know this is We can make this the next GameStop get in now to get rich or else you ll be saying the gme thing all over again All I m saying is we have space for a huge pump buy all in and it s a clean gas company promoting other to also buy in the coming years if you look at what s been happening with other energy stocks like this you will know this is We can make this the next GameStop get in now to get rich or else you ll be saying the gme thing all over again CLNE CLNE CLNE CLNE CLNE CLNE CLNE CLNE CLNE CLNE CLNE CLNE CLNE CLNE CLNE CLNE CLNE CLNE CLNE CLNE CLNE CLNE CLNE CLNE CLNE CLNE CLNE CLNE CLNE CLNE CLNE CLNE CLNE CLNE CLNE CLNE CLNE CLNE CLNE CLNE
1611,oaf494,t2_5no4d56h,1624994058,/r/wallstreetbets/comments/oaf494/cdxc_moon_signals/,1,CDXC moon signals,Hi fellow apes I was eating tendies holding green numbers I found this company CDXC has a huge chance sending us moon Main Fuels here 29 short volume ratio less than 700M market Cap Massive open interest only on Aug calls Not just that ChromaDex Corp NASDAQ CDXC recently launched its flagship consumer product Tru Niagen in Walmart Inc available in 3 800 stores across the U S TLDR Massive open interest on call options 29 short volume ratio on a penny stock I m about to go all in this gamma squeeze rich opportunity Source https fintel io ss us cdxc https www nasdaq com market activity stocks cdxc option chain https investors chromadex com news news details 2021 New Phase 3 Clinical Study Finds Nutritional Protocol Including Nicotinamide Riboside Accelerates Recovery in Mild to Moderate COVID 19 Patients default aspx
1612,oaf4pr,t2_12vm6g,1624994113,/r/wallstreetbets/comments/oaf4pr/uk_regulator_approves_amds_xilinx_acquisition/,1,UK Regulator Approves AMD s Xilinx Acquisition, removed 
1613,oaf60p,t2_cz9bnw42,1624994228,/r/wallstreetbets/comments/oaf60p/whats_up_with_this_dinosaur_cei_camber_energy/,1,What s up with this dinosaur CEI Camber Energy ,
1614,oaf622,t2_a0zaysu9,1624994230,/r/wallstreetbets/comments/oaf622/anyone_in_on_gsat_where_do_you_think_the_price/,1,Anyone in on GSAT Where do you think the price will go , removed 
1615,oaf62p,t2_2pr83ri9,1624994231,/r/wallstreetbets/comments/oaf62p/wish_yolo_update/,1, WISH YOLO UPDATE ,
1616,oaf63v,t2_9596pecc,1624994232,/r/wallstreetbets/comments/oaf63v/hyliion_holdings_hyln/,1,Hyliion Holdings HYLN, removed 
1617,oaf6g1,t2_ca6rbmiq,1624994248,/r/wallstreetbets/comments/oaf6g1/bought_some_more_shares_lets_go/,1,Bought some more shares let s go ,
1618,oaf6mw,t2_a3130i6v,1624994256,/r/wallstreetbets/comments/oaf6mw/body_yoloworkout_at_home_is_here_to_stay/,1,BODY YOLO Workout at home is here to stay ,
1619,oaf7hm,t2_a0emkszs,1624994323,/r/wallstreetbets/comments/oaf7hm/xela_ready_to_run_225/,1,XELA ready to run 2 25,
1620,oaf7vb,t2_cvx52rnp,1624994375,/r/wallstreetbets/comments/oaf7vb/dock_to_tha/,1,DOCK TO THA ,YOOO APES DOCK has an event july 7th so it will naturally pump LETS GET FUCKING RICH OOOO AAA AAA DOCK 
1621,oaf7vu,t2_8di8oz1b,1624994377,/r/wallstreetbets/comments/oaf7vu/body_is_under_attack/,1, BODY IS UNDER ATTACK ,
1622,oaf8jv,t2_417fpjme,1624994459,/r/wallstreetbets/comments/oaf8jv/did_i_sell_like_an_idiot/,1,Did I sell like an idiot ,I ve been with SPCE for over a year now and was psyched to see it jump last week but thought it wouldn t hold After looking up some options trading I decided to take my first crack at it and bought a put at 46 expiring 7 2 I sold it yesterday after losing 50 thinking I made a huge mistake Was the mistake selling it I m still new at options trading so I m trying to figure out what would have happened if it does break 46 Thanks 
1623,oaf956,t2_bu7g2jlw,1624994531,/r/wallstreetbets/comments/oaf956/pltr_tlry_and_clov_all_in/,1,Pltr tlry and clov all in , removed 
1624,oaf9lr,t2_c3nusno5,1624994591,/r/wallstreetbets/comments/oaf9lr/forecast_of_digp_stock/,1,Forecast of DIGP stock, removed 
1625,oaf9xe,t2_8di8oz1b,1624994632,/r/wallstreetbets/comments/oaf9xe/body_is_under_attack/,1, BODY IS UNDER ATTACK , removed 
1626,oaf9yk,t2_9596pecc,1624994636,/r/wallstreetbets/comments/oaf9yk/hyliion_holdings_hyln/,1,Hyliion Holdings HYLN, Trying to make a case for a stock with massive upside potential Doing my best to deliver here for you a virgin DD Shaken not stirred Anyway hear me out for https finance yahoo com quote HYLN p HYLN https finance yahoo com quote HYLN p HYLN CEO Thomas Healy Bright Down to earth under promise over deliverer type A solid company headquartered in Austin Texas 110M outstanding shares and about 20 short At this moment 7 7 fee and only 10 000 shares available info from https iborrowdesk com report HYLN https iborrowdesk com report HYLN They came to the market with a big hype behind it like all EV related stocks At one point it touched 58 ever since the bottom was at about 7 9 about 6 weeks ago Currently it s hanging in the 11 12 range There is some sort of consolidation at this point Outlook and curve looks bullish as our technical s continue to improve and we attract more interest Here you can find a good overview presentation from last year with their timelines and goals https www hyliion com wp content uploads 2020 06 Hyliion Tortoise Overview Presentation pdf https www hyliion com wp content uploads 2020 06 Hyliion Tortoise Overview Presentation pdf They are on track I d say MORE than on track to reach their goals but the stock price does not reflect it at this given moment Yes hence my case for the upside potential share price of 100 200 in 5 years is not far fetched Actually 2024 revenue projection is 2B at ONLY 2 market share A valuation of 10 times revenue which would be reasonable for a company growing that fast would produce a market cap of 20 Billion Current market cap is 2 Billion Shares would have to go up 10x to have a 20 Billion market cap to 120 share 2024 is only 3 years away In 5 years we ll likely be much higher capturing even more market share 10 percent market share would put us at 600 share Anyhow They just started expanding their headquarters and they are hiring like mad https investors hyliion com news news details 2021 Hyliion Accelerates Growth Begins Expansion of Its Austin Texas Headquarters default aspx https investors hyliion com news news details 2021 Hyliion Accelerates Growth Begins Expansion of Its Austin Texas Headquarters default aspx Additional office space and amenities will accommodate growing team of up to 500 employees Redesign will more than double powertrain installation capacity and triple battery development space Hyliion welcomes industry veteran Richelle Frank as Vice President of Operations Frank to oversee the company s facility redesign and further advance broader manufacturing strategy towards commercialization What do they do They basically design develop and sell electric powertrains solutions that are being added on existing Class 8 Semi Trucks With the goal of transforming the commercial transportation industry s environmental impact at scale and reducing the total cost of ownership See presentation page 9 it s about 35 compared to diesel trucks They leverage advanced software algorithms and data analytics capabilities and maximise the output power thus torc of the fitted trucks Basically Their efficient system decreases fuel consumption lowers the operating expenses plus it provides extra power Class 8 trucks you apes might ask Yes Class 8 the backbone of the USA economy https www fueloyal com class 8 trucks important part usa economy https www fueloyal com class 8 trucks important part usa economy soo much in demand that at this point they have more demand than supply https www truckinginfo com 10144905 class 8 truck orders backlogged until 2022 https www truckinginfo com 10144905 class 8 truck orders backlogged until 2022 Catalyst wise Just joined Russell 3000 and Russell 2000 Indexes They are on the brink of releasing their hybrid v2 and fully electric EXR truck Government incentives and more importantly government mandates will be in HYLN favour the coming years since the trend overall is green They have the best battery tech added to the trucks meaning they can charge up faster by far than the competition and their added weight is small compared to the competition their solutions https www businesswire com news home 20210211005805 en Hyliion Introduces Next Generation Battery Module to Improve Performance and Efficiency https www businesswire com news home 20210211005805 en Hyliion Introduces Next Generation Battery Module to Improve Performance and Efficiency They have a ton of patents https patents justia com assignee hyliion inc https patents justia com assignee hyliion inc What more can one ask for I stepped in and added to my positions today Good luck all and godspeed 
1627,oaf9z9,t2_ciaqua0b,1624994639,/r/wallstreetbets/comments/oaf9z9/should_we_bu_small_company_with_a_limited_amounts/,1,Should we bu small company with a limited amounts of shares a ailable like TTOO ,
1628,oafamj,t2_5gkz7ioy,1624994713,/r/wallstreetbets/comments/oafamj/can_amd_go_on_a_rally_like_nvidia_and_hit_alltime/,1, Can AMD Go on a Rally Like Nvidia and Hit All Time Highs ,
1629,oafax2,t2_ckjfmuio,1624994731,/r/wallstreetbets/comments/oafax2/777_just_wait_till_tomorrow/,1,777 just wait till tomorrow,
1630,oafb7q,t2_49qk1jf4,1624994745,/r/wallstreetbets/comments/oafb7q/wish_yolo/,1, WISH YOLO,
1631,oafbjs,t2_50zrfvc9,1624994760,/r/wallstreetbets/comments/oafbjs/novavax_finally_heading_correct_direction_hey_its/,1,Novavax finally heading correct direction hey it s only a Covid Vaccine that has been approved Bought 50 shares and hoping it continues upward trend, removed 
