,postid,author,created_utc,permalink,score,title,selftext
534,oa5gzs,t2_5knlyyg6,1624962151,/r/wallstreetbets/comments/oa5gzs/how_to_ddanalyse_a_stock/,1,How to DD Analyse a Stock, Aight blokes gather around If youre sick of getting Motley Fooled give this a crack This is how I DD a stock so hopefully new investors won t get fooled into pump and dumps There s obviously a lot of ways to do your due diligence on a stock I think the most important thing is having a process and not relying on trash articles or your mates tips My Stock DD Checklist Summary Are you sick of getting Fooled into terrible stocks Stock DD or Due Diligence is probs the most important step in investing So do your DD and don t COP a Pump and Dump Step One Identify the Stonk The first step to a stock DD is obviously finding a stonk to DD This could be a recommendation from your dodge mate or maybe you got Motley Fooled The important thing to note here is the intent of the source that is mentioning the stock Do they have a vested interest Are they tryna pull a Jordan Belford on ya What is their motive behind mentioning the stock For these reasons it may be a good idea to identify your own stock Have a think about companies that you interact with and see if they are publicly traded Or browse through the listings Although these strategies are honestly slow and probs trash you can be sure there s no altera motive Step Two Understand the Company Know the Stonk This is an extension on the phrase don t invest in something you don t understand The same goes for individual stocks it s probably not a good idea to invest in a company if you don t even know what they do PROBABLY 1 Search the Businesses About Us Section Pretty much all listed companies will have a webpage with an about us section browsing this and their website can be a good starting point to understanding their business and a good start to a stock DD See if their website is trash while ur there 2 Use Simply wall st and Read the Company Profile SWS is decent for listed stocks it has a Company Overview section for every stock which gives a quick synopsis Synopsis a bRiEf suMmaRy oR gEneRal SurVEy Of SoMEThinG about the business and what they do How Much Do I Need To know Peter Lynch Never invest in an idea you can t illustrate with a crayon As a starting point you should be able to answer at least these four questions and probs be able to use a crayon 1 What sector is the company in 2 What does the company do 3 How does the company make money 4 How long has the company been around Step Three What is their Market Cap A company s market capitalization or Market Cap if you didn t know is how much the stock market determines a company is worth it is calculated by the total market value of all outstanding shares These are Large mid and small cap Each category can be a good investment strategy it s just important to note that each group has different companies at varying levels of maturity You shouldn t buy a micro cap and be surprised if it gets delisted instead of paying dividends Likewise you probably shouldn t buy a Bluechip and hope they go to the moon Step Four Screening Software for Stock Analysis There are a lot of websites and tools available to screen the selected stocks Here s what i use Trading View great Yahoo Finance ehhh Simply Wall St decent lots of nice Pics if u cant read What are we looking for After picking some of these tools that works well for you perform a basic fundamental analysis on the stock Looking for any red flags Earnings Per Share EPS Positive Growing over time Earning Price to Earnings Ratio PE PE 0 NA The company has no earnings PE 1 14 The company is undervalued has low investor sentiment regarding growth PE 15 20 Average PE 20 The company is overvalued has high investor sentiment regarding growth Book Value The book value is the net assets of a business divided by the number of shares on issue Debt A company should have more assets than liabilities to avoid bankruptcy We like companies with low to no debt If a company has debt ensure it is well covered by assets and earnings Return on Equity ROE Higher ROE The better the company are at making money from equity and vice versa We like companies with consistently higher ROE over 10 A low ROE means low growth potential Past Performance We all know past performance is not indicative of future returns but it can pay to have a quick look at the stock chart If its going up that means money Step Five Financials find the companies latest Yearly or Half Yearly report Analyse its Income Statement Balance Sheet and Cash flow statement Step Six Cap Raise Dilution Therse nothing more frustrating than seeing your share getting hit with Cap Raise after Cap Raise and seeing your shares diluted to nothing We all had that feeling when they halt and release another supplementary prospectus FML One easy sign that a company is constantly raising capital is through looking at it s share price and number of shares on issue IF SP is rly low and number of shares is rly high then they re probs cap raising 24 7 We can also use the financials we read before to try and predict if the company is adequately capitalised A capital raise is not necessarily a red flag but be wary and sucks to see all those trading haults Step Seven Buy Sell Ratios and Volume See if there are a healthy number of buyers and sellers and decent trading volumes The best way to do this is using your trading platforms If you re wanting to sell there s got to be someone to buy the trash off you Step Eight Prospects When examining a company for your stock DD we should consider its macro and microeconomic factors Notably regulation and future industry outlook and disruption Are they gonna be the NExt Blockbuster Is the gov gonna screw u over Step Nine Competition compare the stock to it s direct competitors To do this we are going to go back to step four and compare the company s fundamentals against its competitors If the competitors are better then why not buy them instead Do they have an economic moat There are five types of generally accepted economic moat s 1 Low cost production Companies that can keep their prices low can maintain market share and discourage competition 2 High switching costs Customers and suppliers might be less likely to change companies or providers if the move will incur monetary costs time delays or extra effort e g banks and power providers 3 Network effects network effect happens when the value of a good or service grows as its used by existing and new customers e g Amazon is an excellent example 4 Intangible assets Brand identity patents and government licenses are examples of intangible assets e g think Nike or Coca Cola as an excellent brand and think of the government regulation surrounding gamble and the moat this creates for gambling companies 5 Efficient scale Companies that have a natural monopoly or operate in markets or industries where there are few rivals One thing to consider about an economic moat is they re largely priced into a stock share price as they often relate to profits For example Coca Cola has an excellent brand and due to that sells more products and creates more profits As such these factors will often be indirectly accounted for in Quantitate Analysis but it can be helpful to identify businesses with and without these moats Step Ten Insider Ownership and Management Insider Ownership We generally like companies with large insider ownership This is big for small cap companies Skin in the game helps ensure the management s motives are in line with ours U can use Simple wall St Swear i dont work witt them just like their stuff which shows Insider Ownership and Trading easily We like small cap stocks with 30 insider ownership and history of owners buying on market For large cap companies insider ownership will be lower 3 5 would be decent in this case It wont be much for large caps u clearly wont see Bill G coppin 30 of Micros any time soon Are management buying or selling large amounts of shares Sudden large selling by management for no apparent reason may hint that management believes the company is overvalued or peaked at that point in time Management Experience Consider educational and professional backgrounds One of the most important factors is their experience in the industry Their reputation is also key What goals has the management set out for the company Have the leaders had successful projects in the past or did they fail One case study of management is the affect that Elon Musk has had on tesla Bonus Step Speccies are Sentiment and Hype After going through every step and doing a thorough DD it s important to mention that the market is unpredictable trash Even with the most advanced analyses speccies are just sentiment and hype By every stretch of fundamental analysis they are trash stonks that doesn t mean you can t make money off them Just be ready for the pump and dump reposted w a bit more info Also had to remove all the links to the SWS and trading and stuff bc the subreredit didnt like I got nothign to do with them I just like their stuff Cheers for reading blokes Hoepfully this saves at least someone from getting Motely Fooled into trash
535,oa5hdj,t2_cxtghko1,1624962199,/r/wallstreetbets/comments/oa5hdj/long_gang/,1,LONG GANG ,
536,oa5hvb,t2_5f1p9jan,1624962260,/r/wallstreetbets/comments/oa5hvb/anyone_else_long_on_drv/,1,Anyone else LONG on DRV ,
537,oa5iqg,t2_czyonmpz,1624962362,/r/wallstreetbets/comments/oa5iqg/sofi/,1,SOFI, removed 
538,oa5iu0,t2_5f1p9jan,1624962374,/r/wallstreetbets/comments/oa5iu0/anyone_long_on_drv/,1,Anyone LONG on DRV ,
539,oa5kkq,t2_6nyt4,1624962595,/r/wallstreetbets/comments/oa5kkq/looks_like_retard_bots_have_infiltrated_and_they/,1,Looks like retard bots have infiltrated and they like PLAY,Seems to be the case You know what to do We like the stock diamond hands PLAY YOLO FD calls to the moon for sentiment analysis 
540,oa5ncf,t2_cpvgaqdo,1624962946,/r/wallstreetbets/comments/oa5ncf/online_islamic_education/,1,Online Islamic education,
541,oa5nt3,t2_87d1xcdl,1624963004,/r/wallstreetbets/comments/oa5nt3/saferiser_presale_now_live_1000_incentive_reward/,1, SAFERISER Pre sale now live 1000 incentive reward to every single presale investor, removed 
542,oa5o4p,t2_xcl7g,1624963047,/r/wallstreetbets/comments/oa5o4p/gme_p_and_l_ratios/,1, GME P and L ratios,
543,oa5o6p,t2_am32jnog,1624963056,/r/wallstreetbets/comments/oa5o6p/wall_d/,1,Wall D,
544,oa5qnv,t2_6nyt4,1624963372,/r/wallstreetbets/comments/oa5qnv/play_to_the_fucking_mooooon/,1,PLAY to the fucking mooooon,Alright retards some weird stuff has been going on in the positive PLAY posts the past few days smells like bots Could be hedgies or PLAY or other I m posting as an informal test below is some text to engage with sentiment analysis PLAY is about to fucking take off to the moon People are looking to get out of their houses and socialize for the first time in a year On top of that those stimmie checks have every sweaty retard flush with cash to waste on arcade games and shitty beer Plus my wife s boyfriend was there last Wednesday and not only was it packed waiters are giving handies to every 7th customer Line down the block just to get inside Huge patronage Tons of cash They re going to have a blow out quarter and easy double by August Get in while you can I am not a financial advisor and this is definitely not financial advice 
545,oa5qvf,t2_b3tmn4jw,1624963399,/r/wallstreetbets/comments/oa5qvf/what_do_you_think_about_powertrap_hydrogen_capital/,1,What do you think about Powertrap Hydrogen Capital , removed 
546,oa5r7h,t2_bcfbpo8r,1624963445,/r/wallstreetbets/comments/oa5r7h/morgan_stanley_announces_100_increase_of_its/,1,Morgan Stanley announces 100 increase of its quarterly dividend from 0 35 to 0 70 per share,
547,oa5rkg,t2_a23kzde3,1624963491,/r/wallstreetbets/comments/oa5rkg/att_tho/,1,AT amp T tho , removed 
548,oa5s15,t2_ck4wudwp,1624963552,/r/wallstreetbets/comments/oa5s15/clean_energy_fuels_stock_is_waking_up_clne/,1,Clean Energy Fuels Stock is Waking Up CLNE,
549,oa5szv,t2_ckuak1d7,1624963679,/r/wallstreetbets/comments/oa5szv/amc_is_being_pushed_hard_now_you_have_the_power/,1,AMC IS BEING PUSHED HARD NOW YOU HAVE THE POWER Do not agree to 212 s terms or they will loan your shares to the hedge funds ,
550,oa5ty3,t2_a13s8fm8,1624963796,/r/wallstreetbets/comments/oa5ty3/fubo_10_contracts_of_fubo_call_debit_spread_6590/,1,FUBO 10 contracts of FUBO Call debit spread 65 90 for August 20th can pay out 25k, removed 
551,oa5ubp,t2_a0frgxx1,1624963843,/r/wallstreetbets/comments/oa5ubp/whenever_you_guys_are_ready/,1,Whenever you guys are ready ,
552,oa5uly,t2_a13s8fm8,1624963878,/r/wallstreetbets/comments/oa5uly/fubo_10_contracts_of_fubo_call_debit_spread_6590/,1,FUBO 10 contracts of FUBO Call debit spread 65 90 for August 20th can pay out 25k LETS MAKE THIS HAPPEN , removed 
553,oa5v9a,t2_bomqgpcw,1624963961,/r/wallstreetbets/comments/oa5v9a/need_a_little_advice_from_the_pros/,1,Need a little advice from the pros,I built a portfolio through wells trader and have around 13 000 in stocks but i havent been making the money that i used to and realize i have alot to learn and want to learn options and all that Aside from wells trader i have a little over 109 k with edward jones which they invest mAinly in bonds amd it does very well I ask them to sell some to use in my wells fargo
554,oa5vb8,t2_9q833,1624963969,/r/wallstreetbets/comments/oa5vb8/looks_like_i_made_a_very_poor_decision/,1,Looks like I made a very poor decision ,
555,oa5whr,t2_65tyy3wk,1624964128,/r/wallstreetbets/comments/oa5whr/me_when_money_go_bye_bye/,1,me when money go bye bye,
556,oa5wqx,t2_bomqgpcw,1624964165,/r/wallstreetbets/comments/oa5wqx/advice/,1,Advice ,
557,oa5xbj,t2_65tyy3wk,1624964240,/r/wallstreetbets/comments/oa5xbj/me_when_money_go_bye_bye/,1,me when money go bye bye,
558,oa5xey,t2_5ypz6f8b,1624964251,/r/wallstreetbets/comments/oa5xey/lets_give_amd_a_little_love/,1,Lets give AMD a little love, removed 
559,oa5xzb,t2_4j6pfsva,1624964332,/r/wallstreetbets/comments/oa5xzb/fuck_it_im_joining_the_train_yoloing_the_paycheck/,1,Fuck it I m joining the train Yoloing the paycheck on SOFI Watch this 10x in the next few months as they introduce options trading and margin,
560,oa5y3l,t2_5xarovq4,1624964348,/r/wallstreetbets/comments/oa5y3l/i_just_want_a_god_damn_real_gme_share/,1,I just want a god damn real GME share,
561,oa5zn9,t2_21gvreab,1624964509,/r/wallstreetbets/comments/oa5zn9/ipo_dingdong_ltd_potential_to_be_the_next_meme/,1,IPO DingDong Ltd potential to be the next meme, removed 
562,oa6047,t2_21gvreab,1624964567,/r/wallstreetbets/comments/oa6047/dingdong_ltd_next_meme_in_the_making/,1,DingDong Ltd next meme in the making, removed 
563,oa609f,t2_20uqoy10,1624964587,/r/wallstreetbets/comments/oa609f/rep_pat_fallon_of_texas_failed_to_properly/,1,Rep Pat Fallon of Texas failed to properly disclose as much as 17 53 million in stock trades Business Insider,
564,oa60jt,t2_21gvreab,1624964616,/r/wallstreetbets/comments/oa60jt/dingdong_next_meme_stock/,1,DingDong next meme stock, removed 
565,oa60ph,t2_5q02y80,1624964639,/r/wallstreetbets/comments/oa60ph/moderna_generated_194_billion_in_revenue_during/,1,Moderna Generated 1 94 Billion in Revenue During the First Quarter with 1 73 Billion Coming from Its COVID 19 Shot,
566,oa60r5,t2_5l4na8r0,1624964645,/r/wallstreetbets/comments/oa60r5/all_in_on_sklz/,1,All in on SKLZ ,SKLZ is up 13 in the last week and looks like it could break out and make a run back towards February highs around 43 I have 1900 shares at an average cost of 20 88 SKLZ garnering support on Seeking Alpha as well Thoughts 
567,oa61bp,t2_2oop5apy,1624964717,/r/wallstreetbets/comments/oa61bp/if_i_could_read_id_be_very_upset/,1,If I could read I d be very upset,
568,oa61l7,t2_b3tmn4jw,1624964751,/r/wallstreetbets/comments/oa61l7/clean_energy_is_going_up_at_the_moment_what_do/,1,Clean Energy is going up at the Moment what do you think about Powertap Hydrogen Capital Clean Power Capital ,The Peak was 3 Dollars in January Its growing up nearly of 0 50 Cent to now over 0 89 Cent in three days The short sale volume percent not short interest for stock ticker MOTNF is 57 19 on Jun 28 2021 The short sale volume is 69 050 The total volume is 120 737 Clean Pwr Cap Corp Ordinary Sh MOTNF Short Squeeze Ranking View Daily Short Sale Volume View Short Interest Ratio Days To Cover 0 8 Short Percent of Float Short Increase Decrease 3 337 Short Interest Current Shares Short 216 500 Shares Float Short Interest Prior Shares Short 6 300 From 52 Wk High 0 00 0 From 50 Day MA 0 00 0 From 200 Day MA 0 00 0 From 52 Wk Low 0 00 0 52 Week Performance 0 Trading Volume Today vs Avg 0 00 Trading Volume Today Trading Volume Average 259 700 Market Cap Owned by Insiders Owned by Institutions Exchange NBB Record Date 2021 JunB
569,oa62ts,t2_5q02y80,1624964910,/r/wallstreetbets/comments/oa62ts/united_airlines_orders_200_more_boeing_737_max/,1,United Airlines Orders 200 More Boeing 737 MAX Jets,
570,oa62z1,t2_a41izh0x,1624964929,/r/wallstreetbets/comments/oa62z1/long_bb/,1,Long BB,
571,oa6372,t2_4owj8jqg,1624964957,/r/wallstreetbets/comments/oa6372/why_i_think_we_should_not_sell_any_meme_stock/,1,Why I think we should not sell any meme stock during a market correction,So first of all why do I even assume that a market correction will occur shortly So usually when the overall market creates new ATHs we can expect a pullback also known as a correction and in the present weeks we had a very bullish market so we can expect a bearish market soon I want to first clear up what a short squeeze is A squeeze occurs when a stock goes so high that hedge funds that are short on the stock lose so much money that the total equity in their account goes negative also known as a margin call this requires them to either deposit more money or otherwise all of there positions will be closed Which forces them to buy back the shorted shares and this causes the price to go up This causes the stock price to go up And this causes a chain reaction where other hedge funds are also being margin called because the stock price went up And when the market corrects itself the hedge funds have less money in their account because their investments went down in value so they can be margin called more easily and therefore we do not have to achieve a very high stock price to begin the squeeze But this only works if no one sells because if we start selling other apes will also start selling which will cause the meme stocks to go down in a very short amount of time 
572,oa63gx,t2_a1eupyw8,1624964991,/r/wallstreetbets/comments/oa63gx/its_too_late_they_still_dont_get_it_i_just_like/,1, Its Too Late They still dont get it I just like the stonk BB,
573,oa63rc,t2_bx0s814u,1624965029,/r/wallstreetbets/comments/oa63rc/_/,1, ,
574,oa649b,t2_35b1q6kh,1624965084,/r/wallstreetbets/comments/oa649b/viac_just_starting_the_journey_to_pluto/,1,VIAC just starting the journey to Pluto ,
575,oa64s4,t2_21gvreab,1624965153,/r/wallstreetbets/comments/oa64s4/next_meme_dingdong_ltd/,1,Next meme DingDong Ltd, removed 
576,oa657p,t2_21gvreab,1624965207,/r/wallstreetbets/comments/oa657p/next_company_to_moon_is_dingdong_ltd/,1,Next company to moon is DingDong Ltd, removed 
577,oa664p,t2_7nupyxlx,1624965318,/r/wallstreetbets/comments/oa664p/can_someone_explain_how_i_get_my_money_out_of/,1,Can someone explain how I get my money out of FCASH The bar got my account in the negative and not getting paid till Thursday ,
578,oa66ww,t2_83vdk1h2,1624965408,/r/wallstreetbets/comments/oa66ww/eu_betting_on_coinbase_moon/,1,EU betting on Coinbase Moon ,
579,oa679x,t2_5xq9bq3z,1624965449,/r/wallstreetbets/comments/oa679x/what_to_look_for_in_a_broker/,1,What to look for in a broker,I m looking to get into trading and have seen a lot recently about brokers adding sneaky clauses in their t amp c s that doesn t sit well with me I was with 212 but I m looking to go with FreeTrade just wondering what advice anyone has
580,oa685n,t2_21gvreab,1624965546,/r/wallstreetbets/comments/oa685n/spicy_stock_dingdong_going_public/,1,Spicy stock DingDong going public, removed 
581,oa68ir,t2_8efyzdj1,1624965587,/r/wallstreetbets/comments/oa68ir/lots_of_potential_for_our_favorites_clov_sofi_and/,1,Lots of potential for our favorites CLOV SOFI and TLRY, removed 
582,oa68k4,t2_c2v4wux3,1624965592,/r/wallstreetbets/comments/oa68k4/prepare_yourself_before_watching_you_have_been/,1,Prepare yourself before watching You have been warned ,
583,oa68r9,t2_4i4w3n4b,1624965618,/r/wallstreetbets/comments/oa68r9/umwc_its_hilarious_that_they_have_been_primed_to/,1,UMWC it s hilarious that they have been primed to take off past the moon for weeks but all you silly apes just want to hold bags on these other tickers that really don t have much left in them UWMC with tendies a very nice float plus the Russell inclusion who wants easy , removed 
584,oa6acf,t2_a2adyukl,1624965796,/r/wallstreetbets/comments/oa6acf/unless_youre_buying_more/,1, Unless you re buying more,
585,oa6agu,t2_9lh5sjxj,1624965812,/r/wallstreetbets/comments/oa6agu/ford_needs_a_boost/,1,Ford needs a boost, removed 
586,oa6arm,t2_5yd8cs8k,1624965850,/r/wallstreetbets/comments/oa6arm/tlry_news/,1, TLRY NEWS,This is great news for TLRY There is practically a guarantee that we will not see an offering before July 29th on TLRY because of the shareholder meeting If you get nervous about offerings SPCE has a 1 billion shelf it has not used yet Yes a 1 billion dollar offering The CEO said they will use the extra shares if approved to continue grow the company I wonder what market he is going to focus on the United States of course What did I tell you all in prior posts TLRY is getting ready for a big move Remember I am not a financial advisor I do not recommend to buy or sell just trying to help my fellow APES make stimulus check money ApesStrongTogether Here is the article https finance yahoo com news tilray asks stockholders support key 110000405 html
587,oa6b0s,t2_9ie6ikp9,1624965881,/r/wallstreetbets/comments/oa6b0s/hims_hers_buys_dermatology_business_hims_will/,1,Hims amp Hers buys dermatology business hims will eventually stay up ,
588,oa6by6,t2_4i4w3n4b,1624965984,/r/wallstreetbets/comments/oa6by6/silly_apes_holding_bags_meanwhile_uwmc_sitting/,1,Silly Apes holding bags meanwhile UWMC sitting with potential to go past the MOON ,UMWC it s hilarious that they have been primed to take off past the moon for weeks but all you silly apes just want to hold bags on these other tickers that really don t have much left in them UWMC with tendies a very nice float plus the Russell inclusion This should be twice as big as AMC amp GME but y all apparently you Apes don t like money so the ship will just stay on the ground and misses out on THOUSANDS Have fun getting burned on holding them bags on tickers that have already taken off and have nowhere to go but back down 
589,oa6ccz,t2_a217ohli,1624966033,/r/wallstreetbets/comments/oa6ccz/another_great_move_by_psfe/,1,Another great move by PSFE, removed 
590,oa6ch4,t2_lbpx7,1624966048,/r/wallstreetbets/comments/oa6ch4/wallstreetbets_slang_and_memes_by_investopedia/,1, WallStreetBets Slang and Memes by Investopedia,
591,oa6ck8,t2_a13fvznw,1624966058,/r/wallstreetbets/comments/oa6ck8/lets_squeeze/,1,Let s squeeze ,
592,oa6dcp,t2_9lh5sjxj,1624966151,/r/wallstreetbets/comments/oa6dcp/ford_needs_a_boost/,1,Ford needs a boost , removed 
593,oa6dvj,t2_9cmv3xv6,1624966210,/r/wallstreetbets/comments/oa6dvj/googleparent_alphabet_now_total_over_66_trillion/,1,Google parent Alphabet now total over 6 6 trillion or about 17 of the S amp P 500 ,Google parent Alphabet now total over 6 6 trillion or about 17 of the S amp P 500 Who fucked up the fund allocation WTF 
594,oa6dym,t2_ch4r9d84,1624966217,/r/wallstreetbets/comments/oa6dym/httpswwwredditcomrclnecommentsoa5qkmclean_energy/,1,https www reddit com r CLNE comments oa5qkm clean energy fuels stock is waking up utm source share amp utm medium ios app amp utm name iossmf, removed 
595,oa6eiu,t2_3j0bf,1624966275,/r/wallstreetbets/comments/oa6eiu/looking_for_an_old_docu_on_wall_st_corruption/,1,Looking for an old docu on Wall St corruption,I am trying to find a documentary about wall st corruption a while back think it was the late 80 s early 90 s where a few different people from different walks of life all end up being tied up in what I think is a massive naked short scandal and they were dubbed something like the hateful 8 obviously not that as its known for something else but i CANNOT find the documentary ANYWHERE I am certain it was linked in this sub a few months ago at the peak of GME hype Can anyone remember it and link it One guy in the docu would always circle a building in wall street with a plaque and try to highlight the problem with naked shorting The other was a CEO of one of the shorted stocks another was an investigative journalist iirc Ring any bells It is driving me mad i cannot find it
596,oa6eni,t2_ch4r9d84,1624966289,/r/wallstreetbets/comments/oa6eni/clean_energy_fuels_stock_is_waking_up/,1,Clean Energy Fuels Stock is Waking Up,
597,oa6g1k,t2_2dvsy9,1624966450,/r/wallstreetbets/comments/oa6g1k/layeth_the_smacketh_down/,1,Layeth The Smacketh Down,
598,oa6gyj,t2_4y52gwfk,1624966554,/r/wallstreetbets/comments/oa6gyj/why_you_need_to_max_out_espp_i_didnt_know_nothin/,1,Why you need to max out ESPP I didn t know nothin about stonks when I bought in at companies i worked for,
