,postid,author,created_utc,permalink,score,title,selftext
0,ol56n1,t2_9hc0jz1i,1626393755,/r/wallstreetbets/comments/ol56n1/23andme_share_borrowed_interest_now_19i_am_not/,1,23andME Share borrowed interest now 19 I am not selling Ape Army ,
1,ol57h4,t2_5woggu8e,1626393833,/r/wallstreetbets/comments/ol57h4/okay_guys_roast_me_or_whatnot/,1,Okay guys roast me or whatnot ,
2,ol57me,t2_a0qoc362,1626393846,/r/wallstreetbets/comments/ol57me/hodl/,1,HODL ,
3,ol57mo,t2_16k9bl,1626393847,/r/wallstreetbets/comments/ol57mo/is_this_how_you_do_it/,1,Is this how you do it ,
4,ol58gd,t2_j95z7,1626393919,/r/wallstreetbets/comments/ol58gd/grab_ipo_thoughts/,1,GRAB IPO thoughts ,
5,ol5905,t2_2mjz03w4,1626393973,/r/wallstreetbets/comments/ol5905/thoughts_on_nvda_dip/,1,Thoughts on NVDA dip , removed 
6,ol599g,t2_8om9hr29,1626393996,/r/wallstreetbets/comments/ol599g/should_i_sell_bb_i_think_about_selling_bb_and_buy/,1,Should I sell BB I think about selling BB and buy more AMC I need your thoughts, removed 
7,ol59dn,t2_2pzd4g1k,1626394009,/r/wallstreetbets/comments/ol59dn/this_guy_clearly_understands_how_the_stock_market/,1,This guy clearly understands how the stock market works,
8,ol59sj,t2_8om9hr29,1626394050,/r/wallstreetbets/comments/ol59sj/what_do_you_think_should_i_still_hold_bb/,1,What do you think should I still hold BB , removed 
9,ol5bgj,t2_8om9hr29,1626394215,/r/wallstreetbets/comments/ol5bgj/yo_guys_i_thinking_about_not_holding_longer_bb_my/,1,Yo guys I thinking about not holding longer BB My loss is about 40 Is there anyone who still believe this will go up , removed 
10,ol5cmr,t2_55rkxfar,1626394329,/r/wallstreetbets/comments/ol5cmr/10_random_stocks_a_week_since_feb/,1,10 Random stocks a week since Feb,
11,ol5dw6,t2_26u59mn8,1626394453,/r/wallstreetbets/comments/ol5dw6/intel_in_talks_to_buy_globalfoundries_for_about/,1,Intel in talks to buy GlobalFoundries for about 30 billion WSJ,
12,ol5e5y,t2_9qp894h7,1626394478,/r/wallstreetbets/comments/ol5e5y/is_this_bullish_or_bearish/,1,Is this bullish or bearish ,
13,ol5evb,t2_a35kixdb,1626394551,/r/wallstreetbets/comments/ol5evb/in_thinkorswim_platform_what_search_criteria_to/,1,In thinkorswim platform what search criteria to use to pick the best stock which gives 2X best return in a year,what search criteria to use to pick the best stock which gives 2X best return in a year Company Fundamentals like MarketCap less than 10B EBITA greater than X RSI indicator oversold Bollinger Band Gross Margin greater than 70 and YOY revenue growth gt than 50 etc
14,ol5f67,t2_38ledmkx,1626394579,/r/wallstreetbets/comments/ol5f67/who_the_fuck_drinks_coffee_at_the_movies_amc_are/,1,Who the Fuck Drinks Coffee at the movies AMC are cheap bastards that could care less about us apes We need to hold and squeeze them for everything penny they have To the Moon ,
15,ol5fhk,t2_16k9bl,1626394610,/r/wallstreetbets/comments/ol5fhk/am_i_doing_this_right/,1,Am I doing this right ,
16,ol5fs1,t2_abtkq8ty,1626394638,/r/wallstreetbets/comments/ol5fs1/crdtlook_at_this_stock_market_cap_4115m_shares/,1, CRDT LOOK AT THIS STOCK MARKET CAP 41 15M SHARES OUTSTANDING 11m short interest 51 ,This stock can RUN it just needs volume do your own research but WOW Last day of a bloody week this could change everything 
17,ol5gns,t2_a12arkmh,1626394731,/r/wallstreetbets/comments/ol5gns/new_novel_on_blowing_up_trading_very_cool/,1,New novel on blowing up trading very cool,
18,ol5hgj,t2_d2tlpo90,1626394812,/r/wallstreetbets/comments/ol5hgj/blrx_is_ready_for_takeoff/,1,BLRX is ready for takeoff , removed 
19,ol5i08,t2_ed84zot,1626394865,/r/wallstreetbets/comments/ol5i08/anyone_have_some_ky_for_my_butthole_this_week/,1,Anyone have some KY for my butthole this week ,
20,ol5ifn,t2_1upbsela,1626394909,/r/wallstreetbets/comments/ol5ifn/keep_grinding_yall_heres_24_of_my_portfolios/,1,Keep grinding ya ll Here s 2 4 of my portfolios,
21,ol5in0,t2_2mjz03w4,1626394929,/r/wallstreetbets/comments/ol5in0/nvda_dip_thoughts/,1,NVDA Dip Thoughts ,Here s what the news is saying about NVDA Price targets WSJ with median of 740 High of 1000 Many aiming for 900 https www wsj com market data quotes NVDA research ratings https finance yahoo com news zacks analyst blog highlights nvidia 130001333 html Price today dipped to 750 from 800 Seems like potential opportunity to buy tomorrow since dip is nearing median price target NVDA has soo much going for it Video game playing increasing with the increase in AI 3D 4D Technology Unreal Engine etc NVDAs deal with Arm Coin mining Which has slowed But we all know it s here to stay Not to mention getting more sophisticated as it evolves Covid variant strains causing a huge uptick in COVID cases Which very well may lead to further lockdowns Many cities in US already recommending re masking as of today Hospitals are seeing surges Let me know your guys thoughts Buy the dip Or dump that as fast as possible 
22,ol5ioi,t2_55rkxfar,1626394933,/r/wallstreetbets/comments/ol5ioi/pharaoh_is_not_a_financial_advisor/,1,Pharaoh is not a financial advisor,
23,ol5jzt,t2_167nnfhy,1626395061,/r/wallstreetbets/comments/ol5jzt/wish_is_the_next_amc/,1, WISH is the next AMC,
24,ol5kmx,t2_1hxkkf6h,1626395123,/r/wallstreetbets/comments/ol5kmx/aapl_one_analyst_has_it_right/,1,AAPL One Analyst Has It Right,New Street Research analyst Pierre Ferragu with a 90 price target is the only man with balls on Wall Street He clearly knows Apple can t sell enough iPhones to generate enough revenue to exceed all the iPad and MacBook sales during the pandemic The valuation isn t just stretched it s gaping like a hookers asshole after rough anal Combine this with the fact the vast majority of passive retirement funds etf mutual funds have massive stakes in Apple enabling it to be a high yields savings account while you leverage the living tits out of it using margin I m out That s my DD Short Tech Short Apple P S Dems also will go hard after Apple for monopolistic and anti competitive practices 
25,ol5l5g,t2_8wpqvy3p,1626395172,/r/wallstreetbets/comments/ol5l5g/gonna_go_have_myself_a_lovely_shark_interaction/,1,Gonna go have myself a lovely shark interaction if CCL continues to tank ,
26,ol5l8t,t2_428thdyh,1626395182,/r/wallstreetbets/comments/ol5l8t/grad_student_seeking_ape_input/,1,Grad Student Seeking Ape Input,I m a grad student working on an entrepreneurial idea that you degens might like If you wouldn t mind answering some hypothetical questions DM me please To be clear this is for a class not a product or start up yet 
27,ol5m99,t2_275abc9x,1626395282,/r/wallstreetbets/comments/ol5m99/i_made_420_usd_american_dollars_greenest_day_and/,1,I made 420 USD American Dollars Greenest day and a sign of the green to come ,
28,ol5n73,t2_a75zj2po,1626395375,/r/wallstreetbets/comments/ol5n73/lets_go_in_shiba_inu/,1,Let s go in shiba inu, removed 
29,ol5nac,t2_abtkq8ty,1626395385,/r/wallstreetbets/comments/ol5nac/look_at_this_stockcrtd_marketcap_4115m/,1,LOOK AT THIS STOCK CRTD MARKETCAP 41 15M Outstanding shares 11 77 M short interest 52 ,Look into this this does not take that much to make this stock move and it s very cheap right now this thing can run to the moon and a very short amount of time just needs a lot of volume do some research look into this but this thing can take off very quick after a bloody week this could be a very good money maker for a Friday 
30,ol5o4v,t2_55rkxfar,1626395462,/r/wallstreetbets/comments/ol5o4v/pharaoh_is_not_a_financial_advisor_repost_due_to/,1,Pharaoh is not a financial advisor Repost due to sound bugging out ,
31,ol5roo,t2_14tckw,1626395817,/r/wallstreetbets/comments/ol5roo/so_youre_telling_me_theres_a_chance/,1,So you re telling me there s a chance ,
32,ol5s5t,t2_w4vc37v,1626395865,/r/wallstreetbets/comments/ol5s5t/down_on_vldr_calls_want_to_roll_down/,1,Down on VLDR Calls want to roll down ,I m down quite a bit 10 calls expire August 20 Want to lower cost basis but have never rolled options before is it worth it or should I just take the L 
33,ol5swd,t2_5woggu8e,1626395937,/r/wallstreetbets/comments/ol5swd/okay_guys_i_just_want_to_know_what_i_could_do_to/,1,Okay guys I just want to know what I could do to better my portfolio Maybe take some stocks out Any books that I should read about the stock market ,
34,ol5t5c,t2_abtkq8ty,1626395961,/r/wallstreetbets/comments/ol5t5c/look/,1,LOOK,
35,ol5tdl,t2_5aexxzol,1626395985,/r/wallstreetbets/comments/ol5tdl/counter_argument_for_lobster_futures/,1,Counter Argument For Lobster Futures,I recently read u Tempura Daddy post about lobster futures and it seems brilliant except for one fatal flaw Julian left Sunnyvale Trailer Park and took up lobster fishing Now our fellow retard may or may not be correct with the number of licensed lobster fishermen on the decline I m a bit too drunk to actually look it up But I m watching old episodes of Trailer Park Boys and letting the liquor do the thinking when I had a sudden realization Julian has a massive corner on the lobster market Now hear me out In season 11 we come to discover our beloved degenerate has been living down at the bay in a shipping crate with a brand new jeep and a boat and he bought it all cash with lobster profits When we think about his business expenses we know that Julian is a one man team and so therefore he is not splitting profit with anyone but himself he doesn t pay for bait or for traps because he steals his competitors traps and takes the lobster out and tosses the trap back in the water to fool them into thinking they didn t get anything This is genius because not only does he increase his profit margins he s actually DECREASING his competitors profit margins Now throughout the season we hear Julian making several deals with his associates and business partners and the payment is in crates of lobster What this tells me is that Julian has been able to leverage his lobster in a way that he no longer has any use for the Canadian Dollar Now I believe our wise autistic friend is on the right track but I feel like he s no match for Julian and his corner on the lobster market Im a firm believer in the phrase if you can t beat them join them so I propose weekly calls on his more legal business Freedom 45 a brewing company which I believe was funded by his black market lobster business TL DR I m sober enough to know what I m doing but I m drunk enough to really enjoy doing it and I m betting on Julians success Source https www swearnet com shows trailer park boys seasons 14
36,ol5tg5,t2_zh5ie,1626395993,/r/wallstreetbets/comments/ol5tg5/what_about_acbi_yolo_on_this_one/,1,What about ACBI YOLO on this one ,24 73 USD per share 500m market cap Quarter earning release on 23rd July https www globenewswire com news release 2021 07 14 2263038 0 en Atlantic Capital Bancshares Inc ACBI Announces 2nd Quarter 2021 Earnings Release and Conference Call html
37,ol5tu8,t2_5gtc1wn5,1626396028,/r/wallstreetbets/comments/ol5tu8/spy_getting_clapped_like/,1,Spy getting clapped like ,
38,ol5uik,t2_5gtc1wn5,1626396096,/r/wallstreetbets/comments/ol5uik/spy_getting_clapped_like/,1,Spy getting clapped like ,
39,ol5vaz,t2_2p4gt0yy,1626396176,/r/wallstreetbets/comments/ol5vaz/anyone_want_to_talk_about_why_ib_junior_analysts/,1,Anyone want to talk about why IB junior analysts are so in demand ,Why are their skills so in demand right now I m hearing the job market for them is the busiest its been in 10 years from recruiters financial firms even tech companies are trying to poach IB analysts left and right Why And do new analysts even want lifetime careers in investment banking anymore Or is it use the name of the financial firm to their advantage get the next best offer and run 
40,ol5vug,t2_8kacmdge,1626396233,/r/wallstreetbets/comments/ol5vug/had_26k_yesterday_nvda_raped_me_for_the_second/,1,Had 26k yesterday nvda raped me for the second time in a year Goodbye ,
41,ol5vz4,t2_8adcyy9a,1626396245,/r/wallstreetbets/comments/ol5vz4/sp500_winners_and_losers_7152021/,1,SP500 Winners and Losers 7 15 2021, Note No winners on the energy sector for third consecutive day Winners Winner of the day by sector SP500 Sector Company Ticker Price Change 1 Industrials Honeywell International Inc HON 2 21 2 Health Care Danaher Corporation DHR 1 75 3 Information Technology Jack Henry amp Associates Inc JKHY 1 38 4 Communication Services AT amp T Inc T 0 60 5 Consumer Discretionary Best Buy Co Inc BBY 1 98 6 Utilities Eversource Energy ES 2 46 7 Financials American International Group Inc AIG 3 58 8 Materials Albemarle Corporation ALB 1 82 9 Real Estate Healthpeak Properties Inc PEAK 0 89 10 Consumer Staples Conagra Brands Inc CAG 2 33 11 Energy No Winners Losers Loser of the day by sector SP500 Sector Company Ticker Price Change 1 Industrials Cintas Corporation CTAS 2 59 2 Health Care Teleflex Incorporated TFX 9 84 3 Information Technology NXP Semiconductors NV NXPI 4 49 4 Communication Services Twitter Inc TWTR 3 13 5 Consumer Discretionary Gap Inc GPS 4 10 6 Utilities AES Corp AES 1 48 7 Financials Progressive Corp PGR 2 57 8 Materials International Paper Co IP 2 52 9 Real Estate Host Hotels and Resorts Inc HST 1 21 10 Consumer Staples Walgreens Boots Alliance Inc WBA 1 34 11 Energy EOG Resources Inc EOG 4 37 
42,ol5whv,t2_8adcyy9a,1626396301,/r/wallstreetbets/comments/ol5whv/etfs_with_investments_in_sp500_winners_of_7152021/,1,ETFs with Investments in SP500 Winners of 7 15 2021,Three ETF s per winner when available ETF Ticker invested in Winner ETF Full Name Industrials ETFs investing in Honeywell International Inc PPA 5 20 Invesco Aerospace amp Defense ETF XLI 5 00 Industrial Select Sector SPDR Fund DIA 4 22 SPDR Dow Jones Industrial Average ETF Trust Health Care ETFs investing in Danaher Corporation IHI 10 25 iShares U S Medical Devices ETF PIO 8 43 Invesco Global Water ETF PHO 8 35 Invesco Water Resources ETF Information Technology ETFs investing in Jack Henry amp Associates Inc USMF 1 15 WisdomTree US Multifactor Fund Communication Services ETFs investing in AT amp T Inc FDL 9 91 First Trust Morningstar Dividend Leaders Index Fund NVQ 7 27 QRAFT AI Enhanced US Next Value ETF VLUE 7 17 iShares MSCI USA Value Factor ETF Consumer Discretionary ETFs investing in Best Buy Co Inc WBIF 4 49 WBI BullBear Value 3000 ETF JHMC 2 15 John Hancock Multifactor Consumer Discretionary ETF ESGS 1 39 Columbia Sustainable US Equity Income ETF Utilities ETFs investing in Eversource Energy RYU 3 70 Invesco S amp P 500 Equal Weight Utilities ETF XLU 3 16 Utilities Select Sector SPDR Fund JHMU 3 12 John Hancock Multifactor Utilities ETF Financials ETFs investing in American International Group Inc KBWP 7 33 Invesco KBW Property amp Casualty Insurance ETF IAK 5 90 iShares U S Insurance ETF DVLU 2 68 First Trust Dorsey Wright Momentum amp Value ETF Materials ETFs investing in Albemarle Corporation LIT 11 86 Global X Lithium amp Battery Tech ETF QCLN 6 94 First Trust NASDAQ Clean Edge Green Energy Index Fund RTM 4 02 Invesco S amp P 500 Equal Weight Materials ETF Real Estate ETFs investing in Healthpeak Properties Inc OLD 10 10 Janus Henderson Long Term Care ETF REZ 4 36 iShares Residential and Multisector Real Estate ETF SPHD 2 21 Invesco S amp P 500 High Dividend Low Volatility ETF Consumer Staples ETFs investing in Conagra Brands Inc AMER 4 00 Emles Made in America ETF FXG 3 96 First Trust Consumer Staples AlphaDEX Fund FTXG 3 79 First Trust Nasdaq Food amp Beverage ETF Energy No Winners N A Happy investing 
43,ol5wu2,t2_8kacmdge,1626396333,/r/wallstreetbets/comments/ol5wu2/had_26k_yesterday_rip_nvda_raped_me_for_the_2nd/,1,Had 26k yesterday rip nvda raped me for the 2nd time in a year Goodbye ,
44,ol5x7d,t2_2mjz03w4,1626396373,/r/wallstreetbets/comments/ol5x7d/this_stock_is_definitely_gonna/,1,THIS Stock is Definitely Gonna , removed 
45,ol5xdy,t2_zh5ie,1626396393,/r/wallstreetbets/comments/ol5xdy/what_about_acbi_potential_for_a_push/,1,What about ACBI Potential for a push ,24 73 USD per share 500m market cap Quarter earning release on 23rd July https www globenewswire com news release 2021 07 14 2263038 0 en Atlantic Capital Bancshares Inc ACBI Announces 2nd Quarter 2021 Earnings Release and Conference Call html
46,ol5xh5,t2_9g13lhv7,1626396402,/r/wallstreetbets/comments/ol5xh5/fintel_3_for_short_squeeze_right_now_its_cheap/,1,Fintel 3 for short squeeze Right now it s cheap cheap if you read the potential and the DD ,
47,ol5yd0,t2_9g13lhv7,1626396495,/r/wallstreetbets/comments/ol5yd0/ready_to_pop_i_already_have_1k_shares/,1,Ready to pop I already have 1k shares,
48,ol5ytp,t2_7ym0nin,1626396545,/r/wallstreetbets/comments/ol5ytp/the_finest_bit_of_financial_journalism_the_motley/,1,The finest bit of financial journalism The Motley FOUL ,
49,ol60ud,t2_crjbqhxs,1626396752,/r/wallstreetbets/comments/ol60ud/inflation/,1,Inflation, removed 
50,ol6159,t2_bwo3ply,1626396780,/r/wallstreetbets/comments/ol6159/alright_i_know_you_belong_to_this_sub/,1,alright i know you belong to this sub,
51,ol61bc,t2_crjbqhxs,1626396798,/r/wallstreetbets/comments/ol61bc/inflation_it_isnt_real_ape_on/,1,Inflation It isn t real Ape on, removed 
52,ol62wz,t2_5i8jt3m6,1626396954,/r/wallstreetbets/comments/ol62wz/just_me/,1,Just me , removed 
53,ol63vg,t2_45dsldk8,1626397054,/r/wallstreetbets/comments/ol63vg/no_stonk_pics_just_a_call_to_fellow_apes_to_go/,1,No stonk pics just a call to fellow apes to go strong tomorrow in whatever you hold,
54,ol63z2,t2_cmoet0sw,1626397063,/r/wallstreetbets/comments/ol63z2/cbdd/,1,CBDD, removed 
55,ol64jp,t2_cmoet0sw,1626397120,/r/wallstreetbets/comments/ol64jp/cbdd/,1,CBDD, removed 
56,ol64sa,t2_9523m1g3,1626397145,/r/wallstreetbets/comments/ol64sa/negrodamus_on_gme_warehouse_plans/,1,Negrodamus on GME warehouse plans,
57,ol658z,t2_9x5tyym1,1626397191,/r/wallstreetbets/comments/ol658z/lesl/,1,Lesl, removed 
58,ol66nd,t2_bqw51yaj,1626397312,/r/wallstreetbets/comments/ol66nd/this_is_the_one/,1,THIS IS THE ONE ,Everyone has to check out INTZ It s incredibly low float vs high short The short interest is over 50 Any moves on this send it through the roof and it s primed for a take off Take a look let me know 
59,ol67ri,t2_a8a1e132,1626397420,/r/wallstreetbets/comments/ol67ri/whats_everyone_buying_with_their_amc_post_squeeze/,1,What s Everyone Buying With their AMC POST SQUEEZE CASH , removed 
60,ol6843,t2_ddnsymm,1626397457,/r/wallstreetbets/comments/ol6843/clov_dd/,1,CLOV DD, removed 
61,ol690e,t2_2mjz03w4,1626397548,/r/wallstreetbets/comments/ol690e/nvda_to_the/,1,NVDA to the ,
62,ol6943,t2_4p03d3ui,1626397557,/r/wallstreetbets/comments/ol6943/can_we_get_an_update_from_the_short_the_whole/,1,Can we get an update from the Short the whole country of south africa guy,u The Crazed Crusader gives us an update Did you go through with your plan I love seeing a macro thesis play out like this did I hope you made some money https www reddit com r wallstreetbets comments lkzviy i am going to short the whole country of south utm source share amp utm medium web2x amp context 3
63,ol696q,t2_ddnsymm,1626397563,/r/wallstreetbets/comments/ol696q/clov_dd/,1, CLOV DD,
64,ol69nw,t2_1upbsela,1626397608,/r/wallstreetbets/comments/ol69nw/me_vs_nasdaq_in_my_20s/,1,Me vs NASDAQ in my 20 s,
65,ol6c07,t2_js5fr,1626397830,/r/wallstreetbets/comments/ol6c07/wtf_is_this/,1,WTF is this ,
66,ol6d09,t2_js5fr,1626397934,/r/wallstreetbets/comments/ol6d09/wtf/,1,WTF ,
67,ol6dgo,t2_7dcoo5wl,1626397980,/r/wallstreetbets/comments/ol6dgo/check_out_nrz/,1,Check out NRZ,This stock was at 17 18 pre pandemic They have made some changes and decided to go with mortgage holdings We all know at some point rates are going up This also has a chance of being split and getting ownership into a new branch of NRZ in the near future This stock is also heavily shorted Time Since Last Change Timestamp UTC US NRZ Short Shares Availability 07 13 2021 07 13 09 48 49 979 10 000 000 The stock is currently trading under 10 bucks and pays a dividend of 20 per quarter while you wait to get paid This isnt a fly by pump and dump I feel NRZ has a good chance to make some money in the short and long term 
68,ol6ds7,t2_95rearwz,1626398012,/r/wallstreetbets/comments/ol6ds7/i_am_starting_to_get_into_stock_market/,1,I am starting to get into stock market,
69,ol6dvt,t2_lx65i,1626398021,/r/wallstreetbets/comments/ol6dvt/f_dd_abc_123/,1, F DD ABC 123 , Greetings my fellow gambling addict and other substances activities degenerates I have been observing the Auto industry the past several quarters and noticed F Ford s gain in the overall market so I thought I would post some DD for you wrinkled brain Apes amp x200B I drew some lines https preview redd it qr911k5uzgb71 png width 1296 amp format png amp auto webp amp s 4c52376ab423aa713e90fab7f93f2c34835d9a03 Ford popped back in May from news of the Lightning pick up It has has been consolidating and looking to test support moving forward This may present a good entry point in the next coming days for some of you apes looking for a smooth brain up setup to buy some undervalued stock Bull Case They have been beating ER since the pandemic when car sales slumped Ford has been beating ER for 4 consecutive quarters https preview redd it dg89q0840hb71 png width 942 amp format png amp auto webp amp s cb0fcf65e120fcfd62a3e5d7949f81a9cb6fd11b Even while car sales slumped across the board Ford still managed to crank out a profit for shareholders and poised to position itself for more growth going forward Example Look at the new Ford Maverick truck many can argue whether its a truck or not I will leave that to the r Trucks bois but interest in this smaller pickup is through the roof Some say it may be Ford s next hit For 20k I know I ordered one PE Ratio is so low compared to Tesla amp x200B Tesla s PE is in the range of 550 1400 https preview redd it 1qpicfpv0hb71 png width 374 amp format png amp auto webp amp s 94b4da084923dcb174979270f3d09681215259f3 Tesla Bulls have long argued that the technology factor justifies it s PE Ratio being so off the charts Ford has been building its tech in the background to catch up to Tesla Ford s Co Pilot360 is comparable to Tesla s FSD V1 in features and is working to produce a newer versions of this to compete in the market Chip shortage What shortage As the chip shortage has tested the supply distribution chains of the gaint auto makers Ford looks to have come out ahead of the pack as they have secured their chips for the time being Ford secures chip supply https www autoblog com 2021 07 09 ford f150 chip supply The car market is insane right now Value for used cars has never been higher https preview redd it s293b1gx2hb71 png width 960 amp format png amp auto webp amp s 8602ef067b3b4f6dd99d4fe1ad8a2ec8a723ea2a It all started with the chip shortage then lumber then gas etc The value of used cars has risen so much it is driving up inflation Source Wholesale Used Vehicle Prices Peak https www coxautoinc com news wholesale used vehicle prices peak according to latest manheim data Source2 used car prices up 34 3 YOY https finance yahoo com news used cars stopped getting more expensive in june morning brief 091144467 html Source3 The Market Is Insane Cars Are Sold Even Before They Hit the Lot https www nytimes com 2021 07 15 business car sales chip shortage html The Maverick is going to be HUGE trump voice amp x200B Look at this sexy ass truck https preview redd it 1j2i0dij5hb71 png width 1920 amp format png amp auto webp amp s 8f98d35b64c59058c67b74731a51aef2a7fba5d0 A few months back Ford announced the release of the Maverick a smaller truck aimed at millennials It packs 40mpg city with a hybrid engine has a customizable bed system filled to the brim with goodies and starts at 20k Check out r FordMaverickTruck as people are already lined up waiting to buy this truck Unlike the Cybertruck production starts this week and first orders will be delivered in September This truck will sell like hot cakes and will Ford s next hit 2022 Ford Maverick Already Has 36 000 Reservations https www motor1 com news 514758 2022 ford maverick reservation numbers TL DR Ford go up buy Positions 1200 Shares at 11 21 100x F 12 17 15C
70,ol6e7j,t2_d14vd77a,1626398054,/r/wallstreetbets/comments/ol6e7j/crtd/,1,CRTD,This is a huge opportunity to make some money Super low float and high short interest It s pretty cheap now and ready to run Trust me this is gonna go 
71,ol6eay,t2_bqw51yaj,1626398065,/r/wallstreetbets/comments/ol6eay/check_out_intz/,1,CHECK OUT INTZ ,This stock is ready for a REDDIT INVASION SUPER low float of only 10 5 million shares Short interest has been OVER 50 with the short volume ratio averaging over 25 since this short attack began June 29th The slightest volume sends this thing as volatile as a volcano With the REDDIT Army this would be EPIC 
72,ol6fby,t2_cxotutfa,1626398165,/r/wallstreetbets/comments/ol6fby/buy_utsi_143_do_not_miss_the_party/,1,Buy UTSI 1 43 do not miss the party , removed 
73,ol6fcn,t2_chu7wnk0,1626398167,/r/wallstreetbets/comments/ol6fcn/sponf/,1,Sponf, removed 
74,ol6fhj,t2_9whmr2g7,1626398179,/r/wallstreetbets/comments/ol6fhj/for_all_my_gme_fans_a_closer_look_at_gamma/,1,For all my GME fans A closer look at Gamma Exposure,I agree that GME is getting close for a rip From a TA perspective its trading in a high volume area Since Options dictate a lot of moves I like to take look at how MM s are positioned We are currently in neg gamma territory and under a put wall at 170 If we cant close above this tomorrow we could see 150 imo the next high neg gamma area which I believe should provide good support Processing img aj7f4zp67hb71 
75,ol6h6b,t2_burqd7y,1626398356,/r/wallstreetbets/comments/ol6h6b/everytime/,1,Everytime,
76,ol6h85,t2_chu7wnk0,1626398362,/r/wallstreetbets/comments/ol6h85/sponf/,1,SPONf,
77,ol6hkg,t2_1gah0jgr,1626398393,/r/wallstreetbets/comments/ol6hkg/win_stragety_for_amc_and_gme/,1,WIN STRAGETY FOR AMC and GME, removed 
