,postid,author,created_utc,permalink,score,title,selftext
0,olu4ez,t2_5r521sqn,1626483216,/r/wallstreetbets/comments/olu4ez/rite_aid_is_a_roller_coaster_ive_been_long_on_rad/,1,Rite Aid is a roller coaster I ve been long on RAD for a few years now and have grown to have great disdain for the short side of the house They easily manipulate the price down without any news amp make their money back the same day With a 22 float I m having to reach for the heartburn medicine, removed 
1,olu4u8,t2_a15ewojc,1626483258,/r/wallstreetbets/comments/olu4u8/yolo_716_amc_shares_for_33k_we_going_to_the_moon/,1,Yolo 716 AMC shares for 33k we going to the moon baby down already 6380 and just don t give a monkeys balls ,
2,olu5r2,t2_4fq6kh4g,1626483357,/r/wallstreetbets/comments/olu5r2/just_looking_for_opinions/,1,Just looking for opinions,Been messing with a roth Ira for a few years trying to 0lay with house money as I call it while still trying to build a income long story short bag holder for life for not selling but I like the stocks What I m lookin for is long term growth no memes please lol but like dividend base stocks or where to find a good source of information aside from reddit
3,olu5ve,t2_chvz5azr,1626483368,/r/wallstreetbets/comments/olu5ve/hodl_hodl_hodl/,1,HODL HODL HODL ,
4,olu5wy,t2_9hzchrdi,1626483372,/r/wallstreetbets/comments/olu5wy/not_major_but_my_account_is_small_i_must_hold/,1,Not major but my account is small I must hold , removed 
5,olu6x8,t2_7upibdp8,1626483478,/r/wallstreetbets/comments/olu6x8/first_ones_free_easy_come_easy_go/,1,First One s Free Easy Come Easy Go,
6,olu769,t2_7gm5zzch,1626483508,/r/wallstreetbets/comments/olu769/dfv_knows_the_way_gme/,1,DFV KNOWS THE WAY GME ,
7,olu7qi,t2_7478472n,1626483572,/r/wallstreetbets/comments/olu7qi/retarded_paper_handed_ape_who_missed_out_on_200k/,1,Retarded paper handed ape who missed out on 200k gains ends up with 20k loss,
8,olu85v,t2_5yos4tz9,1626483617,/r/wallstreetbets/comments/olu85v/remember_who_we_are_and_why_we_started_we_just/,1,Remember who we are and why we started We just like the stock ,
9,olu8nu,t2_a1rvhi9p,1626483661,/r/wallstreetbets/comments/olu8nu/apes_with_a_cause/,1,Apes with a cause ,
10,olubx1,t2_nftqw,1626484014,/r/wallstreetbets/comments/olubx1/went_to_one_today_no_difference/,1,Went to one today no difference ,
11,oluc9k,t2_15qj3o,1626484052,/r/wallstreetbets/comments/oluc9k/crct_bet_im_retarded/,1,CRCT bet I m retarded,
12,olucql,t2_9rbb0q88,1626484104,/r/wallstreetbets/comments/olucql/this_is_us_watch_this_and_you_will_relate_if_we/,1,This is us Watch this and you will relate If we do this no one absolutely no one has shit on us Fuck the shills amp the noise ,
13,olui1d,t2_b030p8r4,1626484674,/r/wallstreetbets/comments/olui1d/first_own_of_these_i_made_so_please_enjoywhen/,1,First own of these I made so please enjoy when your portfolio starts tanking ,
14,oluity,t2_2lth04ky,1626484756,/r/wallstreetbets/comments/oluity/baby_losses_still_hurt/,1,Baby Losses still hurt,
15,oluiwu,t2_8icjcx0v,1626484766,/r/wallstreetbets/comments/oluiwu/nwbo/,1,NWBO,Hey Was wondering what everyones thoughts are on NWBO I head only good things but not sure about it yet 
16,oluj5u,t2_17xa9vqe,1626484792,/r/wallstreetbets/comments/oluj5u/stock_went_down_but_option_went_up_2200_can/,1,Stock went down but option went up 2200 can anyone explain the technicals of this happening ,
17,olujx1,t2_a304j05l,1626484868,/r/wallstreetbets/comments/olujx1/yall_know_the_process_buy_and_hold_and_repeat/,1,Y all know the process Buy and Hold and repeat until Moass ,
18,olukfz,t2_9y27avs1,1626484925,/r/wallstreetbets/comments/olukfz/fow_fog_of_war_know_your_enemy/,1,F O W Fog of War amp Know Your Enemy,Two combat terms Apes need to become familiar with if we plan on winning this battle and winning BIG Fog of War The chaos and uncertainty of war time Know your enemy Know who you are fighting Know their strengths weaknesses tendencies know what their Center of Gravity COG is This is a battle Apes a real war and we need to have a wartime mentality Wartime can be very confusing In our current battle the fog of war is the FUD it s the lies in the media it s the misinformation and it s the communication challenges within the Ape community The fog of war is something that exists in every battle and the ONLY way to overcome it is through training Military personnel train both mentally and physically but our battle is almost all mental so we have to train mentally We have to remember what the mission is and what our assignments are We have to mentally prepare ourselves for dirty manipulative attacks and realize that no one is coming to our rescue i e the SEC Lucky for us our mission and assignment is simple and clear TAKE DOWN A CURRPT FINANCIAL SYSTEM BY BUYING AND HODLING The second term know your enemy is critical to winning all wars In fact if you don t know your enemy victory is nearly impossible One of the most critical pieces of information is knowing what gets under the enemy s skin If we can accomplish that and I believe we have we can follow this strategy to use their agitation with us to our advantage The steps are 1 Get our enemy riled up and angry We ve done a good job at that Hedgies have lost billions at the hands of the Apes over the past 7 months and they are pissed We are like a mosquito that keeps buzzing in your ear while sleeping They want to swat us and swat us hard 2 Once angered back off to give the sense of victory This often causes arrogance and poor judgement as the enemy congratulates themselves and how smart they are 3 Let them believe we are no longer a threat I believe we are here now The price drop from 70 to low 30 s definitely makes them think we are not that big of a threat They think we re weak They see us grumbling at one another and sometimes even bashing one another hard They have the price down Apes are scrambling and they are getting ready to go in for the kill So what do we do now 4 STRIKE BACK HARDER Apes ASSEMBLE All Apes EVERYWHERE We need Apes their grandmas their friends their dogs to join this fight We need to show them that we are not weak that we know our mission and that we have resources ready to be called in We have to focus on communicating one message and one message only BUY AND HODL and talk everyone we know into joining the war with us We need unshakeable will dedication determination and unity We are not just fighting for financial freedom we are fighting for freedom in general We CANNOT lose this battle there will never be another chance to change things 
19,olum1u,t2_4r2yncgq,1626485089,/r/wallstreetbets/comments/olum1u/i_need_mooniez/,1,I need mooniez,Hello lads I am broke 19 yo and I have 500 in robinhood It s been sitting and I m getting impatient and want some gains what do I invest in
20,oluodo,t2_9xsi44bl,1626485341,/r/wallstreetbets/comments/oluodo/any_chance_aurora_or_fsd_pharma_will_be_the_next/,1,Any chance Aurora or Fsd pharma will be the next GameStop , removed 
21,olup8p,t2_10yxcg,1626485430,/r/wallstreetbets/comments/olup8p/no_love_for_mmat/,1,No love for MMAT , removed 
22,olursc,t2_a1qixjrz,1626485698,/r/wallstreetbets/comments/olursc/mma_is_going_to_the_moon_take_a_look_dd/,1,MMA is going to the moon take a look DD , removed 
23,olus4i,t2_a1fn3f7k,1626485734,/r/wallstreetbets/comments/olus4i/losses_becoming_and_everyday_thing/,1,Losses becoming and everyday thing,
24,oluspj,t2_7xjile5u,1626485800,/r/wallstreetbets/comments/oluspj/wkhs_is_the_best_2021_play_it_will_rocket_crazy/,1,WKHS is the best 2021 play It will rocket crazy by December and is on sales now 11 6 trade don t miss out apes With much love ,
25,olusvn,t2_75ewmdi5,1626485817,/r/wallstreetbets/comments/olusvn/mrna_puts_270/,1,MRNA puts 270, removed 
26,olutc0,t2_a1fn3f7k,1626485869,/r/wallstreetbets/comments/olutc0/shit_month/,1,Shit month,
27,olutz4,t2_75ewmdi5,1626485938,/r/wallstreetbets/comments/olutz4/mrna_puts/,1,MRNA puts,Bought 270 7 30 puts and then realized the hype is due to S amp P inclusion What are the chances MRNA goes south in the next 2 weeks or should I take the loss and call it quits at this point 
28,oluuai,t2_a1fn3f7k,1626485976,/r/wallstreetbets/comments/oluuai/monthly_loss/,1,Monthly Loss,
29,oluuil,t2_9ci0u42k,1626486000,/r/wallstreetbets/comments/oluuil/28k_gme_options_loss_porn_am_i_doing_it_right/,1, 28k GME OPTIONS LOSS PORN AM I DOING IT RIGHT ,
30,oluvfs,t2_a1waa4e4,1626486098,/r/wallstreetbets/comments/oluvfs/sale_prices/,1,Sale prices,
31,oluvhp,t2_a1fn3f7k,1626486105,/r/wallstreetbets/comments/oluvhp/trading_options/,1,Trading Options,Anybody have a clue as to how to get robinhood to deem me Eligible to trade options on there platform I ve tried 10 15 times and they say I m not eligible 
32,olux8h,t2_dcl5izlg,1626486297,/r/wallstreetbets/comments/olux8h/i_no_smart/,1, I no smart,
33,oluxhn,t2_73y8c,1626486326,/r/wallstreetbets/comments/oluxhn/idgaf_im_riding_edit_to_the_motherfucking_moon/,1,IDGAF I m riding EDIT to the motherfucking moon,
34,oluy1t,t2_4r2yncgq,1626486391,/r/wallstreetbets/comments/oluy1t/i_need_mooniez/,1,I need mooniez,Hello lads I am a 19yo bloke with 500 in robinhood I ve had this money sitting in here for a couple of months with the intentions of investing but can t find anything good Any advice would be greatly appreciated
35,oluy8m,t2_a1waa4e4,1626486413,/r/wallstreetbets/comments/oluy8m/hodl_team/,1,Hodl team,
36,oluza0,t2_a1qixjrz,1626486526,/r/wallstreetbets/comments/oluza0/to_the_moon/,1,To the moon ,
37,oluznv,t2_73y8c,1626486572,/r/wallstreetbets/comments/oluznv/idgaf_im_riding_edit_to_the_motherfucking_moon/,1,IDGAF I m riding EDIT to the motherfucking moon,
38,olv0x2,t2_a1qixjrz,1626486704,/r/wallstreetbets/comments/olv0x2/httpsmarketingsentinelcom20210716metamaterialsincn/,1,https marketingsentinel com 2021 07 16 meta materials inc nasdaq mmat stocks rise 170 71 ytd what next for it , removed 
39,olv1af,t2_af4pr8cv,1626486745,/r/wallstreetbets/comments/olv1af/today_was_looking_so_good_hedge_funds_will_short/,1,Today was looking so good Hedge funds will short anything ,
40,olv1b4,t2_9z45d4y5,1626486747,/r/wallstreetbets/comments/olv1b4/auph_buyout_target_with_an_over_200_capital_gain/,1,AUPH buyout target with an over 200 capital gain candidate, removed 
41,olv2lh,t2_a1qixjrz,1626486889,/r/wallstreetbets/comments/olv2lh/mmat/,1,Mmat https marketingsentinel com 2021 07 16 meta materials inc nasdaq mmat stocks rise 170 71 ytd what next for it , removed 
42,olv2w1,t2_a1qixjrz,1626486922,/r/wallstreetbets/comments/olv2w1/httpsmarketingsentinelcom20210716metamaterialsincn/,1,https marketingsentinel com 2021 07 16 meta materials inc nasdaq mmat stocks rise 170 71 ytd what next for it https marketingsentinel com 2021 07 16 meta materials inc nasdaq mmat stocks rise 170 71 ytd what next for it , removed 
43,olv38q,t2_a1qixjrz,1626486964,/r/wallstreetbets/comments/olv38q/httpsmarketingsentinelcom20210716metamaterialsincn/,1,https marketingsentinel com 2021 07 16 meta materials inc nasdaq mmat stocks rise 170 71 ytd what next for it https marketingsentinel com 2021 07 16 meta materials inc nasdaq mmat stocks rise 170 71 ytd what next for it https marketingsentinel com 2021 07 16 meta materials inc nasdaq mmat , removed 
44,olv47b,t2_a1t5u9kl,1626487070,/r/wallstreetbets/comments/olv47b/this_is_the_lambo_i_want/,1,This is the Lambo I want ,
45,olv4ea,t2_cb8pem3g,1626487091,/r/wallstreetbets/comments/olv4ea/can_my_name_get_karma_itself/,1,Can my name get karma itself , removed 
46,olv4sa,t2_cb8pem3g,1626487136,/r/wallstreetbets/comments/olv4sa/i_cant_believe_i_landed_this_u_can_i_get_some/,1,I can t believe I landed this u Can I get some good karma for that , removed 
47,olv4sd,t2_13t76l,1626487136,/r/wallstreetbets/comments/olv4sd/mu_is_extremely_undervalued_and_set_for_a_big_year/,1, MU is extremely undervalued and set for a big year,Never done a DD before so this will def be shit Looking for someone to tell me why I m retarded Micron Technology Inc is an American producer of computer memory and computer data storage including DRAM flash memory and USB flash drives It is headquartered in Boise Idaho Its consumer products are marketed under the brands Crucial and Ballistix Current share price 74 8 Market Cap 88 Billion Basically they make ram sticks and hard drives for computers They have roughly 17 7 of the market share for memory main competitors Samsung Electronics Co and SK Hynix Inc as main competitors What the three companies have in memory has been described as an oligopoly The type of memory they make is used in almost every data intensive computing environment Their memory chips are inside RTX 3080 s and 90 s data centers and a shit ton of cars The more AI is used the more dRam memory is needed These are the only companies that sell it Income and recent history Because of its commodity status Microns revenue has always been tied to pricing in memory amp x200B https preview redd it 0v8ks2legob71 png width 1023 amp format png amp auto webp amp s 3b596cedf4bccf3628ba9ce00625e8f4178df5bf https preview redd it h7xdsmdggob71 png width 1024 amp format png amp auto webp amp s 806573a9a0fe808ab58cb72c6e91918a0c6cd926 From 2016 to 2018 Micron had explosive revenue growth and in 2019 this fell back down as memory prices fell While the memory business has had cyclicality over the years it is on an always upward baseline where the new lowest years equate with what used to be mid level years and the high years setting record revenues The company s products have a very high margin so profits are very sensitive to total revenue The company has improved its balance sheet substantially in the last couple years which will allow for smoother down years and better growth years When the price of memory dropped in previous years micron would have slightly negative earnings on the year In the most recent down period 2020 the company still had an EPS of 2 37 compared with last downturn where it was negative The memory cycle bottomed out in 2020 and expected sales are expected to BOOM in 2021 Average revenue estimate is 36 9 billion High estimates go up to 43 billion Look at what earnings when revenue was at 30 if it got to 40 billion their EPS would be FAT Balance Sheet Microns balance sheet is fucking clean They have 54 Billion in total assets 17 current and 13 Billion in liabilities 5 4 current In 2017 they reduced long term debt from 9 billion to 3 billion and since then has reduced interest from around 500 million a year around 2016 and 2017 to about 200 million a year now This is despite having increased assets by 27 billion in the same time frame If Micron closed up shop today and just fucking scrapped everything and sold its assets and factories it would be worth nearly half its share price This number is probably UNDERSTATED considering there is a lot of written off depreciation on their factories and there is no way in hell their newer factories are worth less than it cost to build Book value doesn t matter that much but that is an insane price to book in comparison to any other growing company in this environment Micron s products aren t nearly as flashy or interesting but they are NEEDED Future Almost all AI driving smart phones and data centers require dRam The overall demand should increase substantially for the foreseeable future Micron will use cashflow for share buybacks and they are going to have a shit ton of it this year Next two years are projected to be boom years for memory Another thing going for Micron is its U S based status With chip shortage around the world the U S has taken a strategic position that the country needs domestic chip manufacturers Both of Microns competitors are foreign entities They may be eligible for stimulus or government assistance if they build domestically but Micron is the best positioned for Biden Bucks Other shit that is promising Some big hedge fund managers have retardedly large bets on Micron Monish Pabrai 50 of portfolio Li Lu 51 7 of portfolio David Tepper 9 of portfolio It is the largest investment in all of their portfolios Last reported share price they were holding at was 88 or 16 higher than today s price I m pretty sure not all of them are retarded Short Interest You re retarded for even looking at this What is wrong with you Its not very high though you d need a very smooth brain to short this stock Positions Missionary Only adding up shares and itm leaps as I ride out the current downtrend but this shit is way undervalued Especially in this market They re being priced like a boomer stock that s slowly dying instead of a growing company with a shit ton of money with huge profits that makes a product EVERYONE needs If they hit revenue targets this year they would be trading at only 6x forward earnings Dumb Should be 110 right now and that would be cheap 
48,olv52j,t2_a1t5u9kl,1626487166,/r/wallstreetbets/comments/olv52j/this_is_the_lambo_i_want/,1,This is the lambo I want ,
49,olv8tp,t2_9d75ejsj,1626487549,/r/wallstreetbets/comments/olv8tp/i_believe_spce_is_a_buy/,1,I believe SPCE is a buy , removed 
50,olv9fw,t2_d25jndfj,1626487616,/r/wallstreetbets/comments/olv9fw/i_pretty_much_own_the_company_at_this_point_vrme/,1,I pretty much own the company at this point VRME,
51,olv9ho,t2_9z45d4y5,1626487622,/r/wallstreetbets/comments/olv9ho/auph_buyout_target_stock_has_about_a_250_capital/,1,AUPH Buyout Target Stock Has About a 250 Capital Gain Potential, Aurinia Pharmaceuticals AUPH News July 17 2021 AUPH announced today after the markets closed the voluntarily delisting of its common shares on the Toronto Stock Exchange TSX effective July 30 2021 The stock will continue to trade on Nasdaq The company noted that Nasdaq has accounted for approximately 94 of its daily trading volume over the past 12 months and it believes the trading volume of its shares on the TSX no longer justifies the expense of a dual listing Generally companies voluntarily delist their stock from multiple exchanges for a buyout merger amalgamation or non performance if the business enterprise no longer meets the requirements to be listed on an exchange AUPH was in compliance with the TSX s listing requirements Press Release https www businesswire com news home 20210716005457 en In May the London Times reported that there are whispers that AZN and GSK are sniffing around AUPH to buy out the upstart biotech company because of its breakthrough drug Voclosporin Shortly thereafter OptiFinancial writer Brad Mitchell wrote a column titled The potential suitors of Aurinia Pharmaceuticals OptiFinancial Article https www optifinancialnews com post the potential suitors of aurinia pharmacueticals I believe biotech buyout of this magnitude could obtain about a 250 capital gain for those who own the stock before the company halts trading of the security and then announces the deal I believe WallStreetBets members should consider this trade opportunity with the apparent likelihood that a deal is announced in the not too distant future 
52,olv9z6,t2_akzwaf32,1626487674,/r/wallstreetbets/comments/olv9z6/mmat_potential_bounce_in_price/,1,MMAT Potential Bounce in Price , removed 
53,olva28,t2_613yjmi0,1626487685,/r/wallstreetbets/comments/olva28/what_is_a_wsb_retard_where_are_tendies_how_can_we/,1,What is a WSB retard Where are tendies How can we get them Please listen to the most inspired motivational speech ever from the Retard of The Year at the annual WSB Retard Award ,
54,olvahh,t2_a1mfse1g,1626487728,/r/wallstreetbets/comments/olvahh/do_not_go_to_apefest/,1,DO NOT GO TO APEFEST, removed 
55,olvbbk,t2_9d75ejsj,1626487814,/r/wallstreetbets/comments/olvbbk/i_think_spce_is_a_buy/,1,I Think SPCE Is a Buy , If you see the chart below you can see there are 3 support line at around 30 a share if you see last time SPCE hit the 200 MA it popped now i don t think it will hit highs next week or even next month but i do think we could see a 5 plus pop off the 200 MA come join our free live trading group we can talk more about this trade the and option we bought and many others trade ideas please let me know what you think
56,olvbr3,t2_ca7v73rf,1626487862,/r/wallstreetbets/comments/olvbr3/eminemmusic/,1,EminemMusic,
57,olvbv7,t2_4dh9j23z,1626487873,/r/wallstreetbets/comments/olvbv7/one_year_with_you_degenerates/,1,One year with you degenerates , removed 
58,olvcpu,t2_9d75ejsj,1626487964,/r/wallstreetbets/comments/olvcpu/i_think_spce_is_a_buy/,1,I Think SPCE Is A BUY , If you see the chart below you can see there are 3 support line at around 30 a share if you see last time SPCE hit the 200 MA it popped now i don t think it will hit highs next week or even next month but i do think we could see a 5 plus pop off the 200 MA come join our free live trading group we can talk more about this trade the and option we bought and many others trade ideas please let me know what you think and we live trade all week come join us and join the discord amp x200B https preview redd it h9nj6yx6mob71 png width 1113 amp format png amp auto webp amp s 3fa7d2e93d9531720075492ac092c7a03fad455c
59,olvcq2,t2_a2twa63i,1626487965,/r/wallstreetbets/comments/olvcq2/cidm/,1,CIDM ,Cinedigm what the hell is going up with this stock Hedge Funds shortened over 3 million share and growing Are you guys looking at this next potentially short squeeze
60,olveh6,t2_8iirud4c,1626488141,/r/wallstreetbets/comments/olveh6/the_number_1_habit_of_successful_business_leaders/,1,The Number 1 Habit of Successful Business Leaders, removed 
61,olvehe,t2_76zimapu,1626488141,/r/wallstreetbets/comments/olvehe/dad_asking_why_im_not_winning_yet/,1,Dad asking why I m not winning yet ,
62,olvfjj,t2_tj8fp,1626488254,/r/wallstreetbets/comments/olvfjj/all_i_see_is_emergency_powell_plunges_and_new_low/,1,All I see is Emergency Powell Plunges and New Low That means sell right ,
63,olvgh6,t2_a1mfse1g,1626488350,/r/wallstreetbets/comments/olvgh6/do_not_go_to_apefest/,1,DO NOT GO TO APEFEST, removed 
64,olvgio,t2_613yjmi0,1626488355,/r/wallstreetbets/comments/olvgio/what_is_a_wsb_retard_where_are_tendies_how_can_we/,1,What is a WSB retard Where are tendies How can we get them Please listen to the most inspired motivational speech ever from the Retard of The Year at the annual WSB Retard Award ,
65,olvgr5,t2_3jsa53vj,1626488384,/r/wallstreetbets/comments/olvgr5/4_minute_work_day_have_a_good_weekend/,1,4 Minute work day Have a good weekend ,
66,olvhgk,t2_cuqkba3b,1626488458,/r/wallstreetbets/comments/olvhgk/aal_caution/,1,AAL caution, removed 
67,olviko,t2_cuqkba3b,1626488576,/r/wallstreetbets/comments/olviko/aal_caution/,1,AAL Caution, removed 
68,olvj48,t2_tj8fp,1626488634,/r/wallstreetbets/comments/olvj48/news_headline_has_emergency_dangerous_powell/,1,News headline has Emergency Dangerous Powell Plunges and New Low in a single sentence, removed 
69,olvkpl,t2_9jiaqgir,1626488811,/r/wallstreetbets/comments/olvkpl/for_all_of_the_robinhood_slander_seems_like_every/,1,For all of the robinhood slander Seems like every loss gains post is on robinhood , removed 
70,olvlk9,t2_89uphc7m,1626488908,/r/wallstreetbets/comments/olvlk9/there_goes_my_first_stim_check/,1,There goes my first stim check,
71,olvm73,t2_tj8fp,1626488982,/r/wallstreetbets/comments/olvm73/news_headline_has_emergency_dangerous_powell/,1,News headline has Emergency Dangerous Powell Plunges and New Low in a single sentence,https imgur com xv4x2sU If the water levels fall below 3 525 feet in Lake Powell and the agreement falls apart it could potentially lead to seven state litigation which we ve never seen before on the Colorado River Amy Ostdiek deputy section chief of the federal interstate and water information section of the Colorado Water Conservation Board told Colorado Public Radio Which would create a lot of uncertainty It would probably be a very long drawn out process Liquidity low long term uncertainty got it 
72,olvmt4,t2_6jjx2qx4,1626489041,/r/wallstreetbets/comments/olvmt4/keep_buying_dont_get_scared_afford_cool_shit_when/,1,Keep buying don t get scared afford cool shit when you re old,You know it might feel wrong buying in at all time highes But what if we didn t buy at all time highes in 2015 We would have missed huge gains Just buy while it goes up and buy more when it comes down When you re old you ll be able to buy the better dentures and a faster walker than Larry could ever afford 
73,olvn28,t2_ac57unig,1626489069,/r/wallstreetbets/comments/olvn28/time_to_buy_clover/,1,Time to buy CLOVER , removed 
74,olvo9y,t2_2mwcb3ws,1626489206,/r/wallstreetbets/comments/olvo9y/lets_send_these_stocks_to_the_moon/,1,Let s send these stocks to the moon , removed 
75,olvqdw,t2_a2j2sxqi,1626489436,/r/wallstreetbets/comments/olvqdw/invest_in_things_that_matter_not_digital_funny/,1,Invest in things that matter not Digital funny Money,
76,olvrv0,t2_ldv7hpn,1626489597,/r/wallstreetbets/comments/olvrv0/lvt_stock_rlvt_stock_the_first_full_psychedelic/,1,LVT Stock r LVT Stock the first full psychedelic company going public Join to get updates ,
77,olvuqz,t2_cfq4k,1626489915,/r/wallstreetbets/comments/olvuqz/arrival_picked_up_more_contracts_possibly_on_the/,1,Arrival picked up more contracts possibly on the rise ,Arrival seems to have a huge amount of contracts they picked up recently and their stock price seems really low and they have insane short interests on them some reason They keep getting new contracts constantly https www businessgreen com news 4034516 arrival leaseplan rev electric van partnership
78,olvvpa,t2_4gr80d04,1626490024,/r/wallstreetbets/comments/olvvpa/can_this_stop_yet/,1,Can this stop yet ,
79,olvwa2,t2_cfq4k,1626490093,/r/wallstreetbets/comments/olvwa2/tsmc_amd_stocks_huge_gain_soon/,1,TSMC amp AMD stocks huge gain soon , removed 
