,postid,author,created_utc,permalink,score,title,selftext
53,ok2ded,t2_940tzque,1626261984,/r/wallstreetbets/comments/ok2ded/serious_question/,1,Serious question,If Stonks only go up then why not buy an at the money 3 year leap on spy and do that every 3 years It seems like free money to me but I figured if no one does it it s probably not I d appreciate if someone explained 
54,ok2eqm,t2_a4rlzh7y,1626262144,/r/wallstreetbets/comments/ok2eqm/irbt_yolo_70_of_portfolio/,1,IRBT Yolo 70 of Portfolio, removed 
55,ok2f01,t2_a22u0czv,1626262174,/r/wallstreetbets/comments/ok2f01/dont_forget_what_we_hold/,1,Don t forget what we HOLD ,
56,ok2fdc,t2_a1rwf37h,1626262214,/r/wallstreetbets/comments/ok2fdc/srev_a_lowkey_gem/,1,SREV a Lowkey Gem ,Due Diligence on SREV ServiceSource is a global outsourced go to market services provider that accelerates B2B digital sales and customer success transformation They have over 3 000 employees and 50 000 followers on LinkedIn 52 week high 2 18 52 week low 1 12 Investors Sun Microsystems Housatonic Partners Hitachi Data Systems General Atlantic CA Technologies Benchmark and AT amp T Institutions holding SREV Edenbrook Capital LLC PRIMECAP Management Co Archon Capital Management LLC BlackRock Fund Advisors Cannell Capital LLC HCSF Management LLC The Vanguard Group Inc Renaissance Technologies LLC Kennedy Capital Management Inc J Goldman amp Co LP Shares Outstanding 97 35 M Free Float 95 03 M Institutions have been loading up on this over the past few months 
57,ok2fhk,t2_4kb9scgp,1626262223,/r/wallstreetbets/comments/ok2fhk/evgo_and_recargo_join_forces_to_accelerate_ev/,1,EVgo and Recargo Join Forces to Accelerate EV Market Growth,
58,ok2fwo,t2_bi3jhgxd,1626262272,/r/wallstreetbets/comments/ok2fwo/wondering_what_the_day_holds/,1,Wondering what the day holds ,
59,ok2g38,t2_4kb9scgp,1626262294,/r/wallstreetbets/comments/ok2g38/samsara_partners_with_evgo_to_accelerate_the/,1,Samsara Partners with EVgo to Accelerate the Transition to Electric Vehicles,
60,ok2k57,t2_a3y9igiy,1626262746,/r/wallstreetbets/comments/ok2k57/wish_me_luck_guys_srga/,1,Wish me luck guys SRGA ,
61,ok2l3q,t2_8wuxxrjx,1626262863,/r/wallstreetbets/comments/ok2l3q/uxin_yolo_update_after_william_li_ceo_of_nio/,1,Uxin yolo update after William Li CEO of Nio joins Uxin s board of directors ,
62,ok2lxe,t2_7a29z31w,1626262948,/r/wallstreetbets/comments/ok2lxe/i_feel_targeted/,1,I feel targeted,
63,ok2mkf,t2_7a29z31w,1626263026,/r/wallstreetbets/comments/ok2mkf/im_being_microaggressed/,1,I m being microaggressed,
64,ok2nvq,t2_18q1svgx,1626263189,/r/wallstreetbets/comments/ok2nvq/cciv_we_need_your_help/,1, CCIV We need your help,CCIV is a stock that is getting heavily shorted and screwing a lot of retail investors Can we get the support of WSB leading up to the merger on July 22 
65,ok2o1c,t2_aptob9wg,1626263207,/r/wallstreetbets/comments/ok2o1c/amc_lets_ask_aron_adam_to_move_the_stock_to_otc/,1, AMC Let s ask Aron Adam to move the stock to OTC ,Woukdn t a move to OTC force shorts to cover They will also not be able to short us there via the ETFs and they cant use high frequency Trading or algos there would this work Remember we own the float and can vote on whatever we want 
66,ok2qrf,t2_bymvjtnb,1626263519,/r/wallstreetbets/comments/ok2qrf/remember_all_to_turn_off_your_stock/,1,Remember all to turn off your stock lending sharing on any platform you use for trading , removed 
67,ok2too,t2_a3ahr89l,1626263846,/r/wallstreetbets/comments/ok2too/our_move_today_1407/,1,Our move today 14 07, removed 
68,ok2tw1,t2_77iqtfm8,1626263870,/r/wallstreetbets/comments/ok2tw1/by/,1, by ,
69,ok2tzl,t2_aptob9wg,1626263883,/r/wallstreetbets/comments/ok2tzl/amc_lets_ask_aron_adam_to_move_the_stock_to_otc/,1, AMC Let s ask Aron Adam to move the stock to OTC ,If we do that then shorts won t be able to short us via the ETFs AMC is currently part of nor to use their algos and high frequency trading I m also not sure if they can use dark pool trades on OTC Also moving to another exchange might require them to cover first Remember we own this company and we can request and vote whatever we want Any more wrinkled apes know if we do this it will force shorts to cover If yes then it might be the easiest way for us to achieve that and we only depend on our votes let s dig deeper into this idea and see if it s workable diamond hands forever Apes together strong 
70,ok2unm,t2_a3ahr89l,1626263958,/r/wallstreetbets/comments/ok2unm/our_move_today_1407_amc_clne_bb_clov_2_the_moon/,1,Our move today 14 07 AMC CLNE BB CLOV 2 the moon Buy and hold , removed 
71,ok2vny,t2_15imub,1626264042,/r/wallstreetbets/comments/ok2vny/prepare_for_shroom_boom/,1, Prepare for shroom boom ,What up guys I really like shrooms so I invest in companies that make shrooms Red light Holland Corp is one of the companies that does so IMO this is a untapped industry and we all know a shroomboom is about to happen Investing now would be similar to buying weed stocks in 2017 I chose this company over mind medicine because they literally are already selling these kits in the Netherlands With cannabis legalization coming to the USA and less retarded opinions are formed on the criminalization of shrooms I think we are in for a legalization in the near future At the very least applicable for clinics The guys over at red light Holland are buying shroom companies like you guys are buying retarded options Since I m eurofag I can only buy shares Tickers CSE TRIP OTC TRUFF FSE 4YX TL dr 
72,ok2wwh,t2_cmk4a9fy,1626264173,/r/wallstreetbets/comments/ok2wwh/my_rh_account_has_never_seen_a_green_day_thanks_dc/,1,My rh Account has never seen a Green Day Thanks dc ,
73,ok2z5h,t2_7u7drf6u,1626264415,/r/wallstreetbets/comments/ok2z5h/notice_for_all_robinhood_users/,1,Notice for all Robinhood users,
74,ok2znz,t2_d70yvcwr,1626264472,/r/wallstreetbets/comments/ok2znz/at_least_somethingsomeone_is_going_to_the_moon/,1,At least something someone is going to the moon ,
75,ok2zv8,t2_b5t2bps0,1626264493,/r/wallstreetbets/comments/ok2zv8/xela/,1,XELA, removed 
76,ok3055,t2_2kugw0j0,1626264525,/r/wallstreetbets/comments/ok3055/thank_you_shitadel/,1,Thank you shitadel ,For giving me the ability to buy more golden tickets to the chocolate factory I wanna meet the the fucking oompa loompas 
77,ok30im,t2_a7h4sxhp,1626264567,/r/wallstreetbets/comments/ok30im/its_been_a_tough_last_2_weeks_for_my_options_moon/,1,It s been a tough last 2 weeks for my options MOON BABY MOON Whatever your rocking with let s get these tendies ,
78,ok31au,t2_a7h4sxhp,1626264660,/r/wallstreetbets/comments/ok31au/its_been_a_tough_couple_weeks_in_the_market_its_a/,1,It s been a tough couple weeks in the market It s a new day let s get this bread ,
79,ok31zb,t2_65gtz,1626264731,/r/wallstreetbets/comments/ok31zb/sometimes_its_best_not_to_overthink_investing/,1,Sometimes it s best not to overthink investing,
80,ok32kz,t2_8s0u66i0,1626264804,/r/wallstreetbets/comments/ok32kz/buy_psth/,1,Buy PSTH, removed 
81,ok32tx,t2_8s0u66i0,1626264832,/r/wallstreetbets/comments/ok32tx/buy_p5th/,1,BUY P5TH, removed 
82,ok33r8,t2_akgxu8j6,1626264931,/r/wallstreetbets/comments/ok33r8/beautiful_art/,1,Beautiful Art,
83,ok340h,t2_4bo03oku,1626264963,/r/wallstreetbets/comments/ok340h/this_is_why_the_daily_thread_is_my_number_1/,1,This is why the daily thread is my number 1 trusted news source,
84,ok3499,t2_7y81fqwh,1626264991,/r/wallstreetbets/comments/ok3499/rnaz_looks_cheap_this_morning_i_think_it_may_get/,1,RNAZ looks cheap this morning I think it may get an early bump for a quick profit , removed 
85,ok34yx,t2_4cb2suxr,1626265068,/r/wallstreetbets/comments/ok34yx/crsp_evaluation_question/,1,CRSP evaluation question,Anyone think CRSP stock is going to be the next Amazon in the biotech industry I feel the next bubble is in the gene editing technology looking for advice 
86,ok35f2,t2_avvgjr7o,1626265115,/r/wallstreetbets/comments/ok35f2/xela/,1,XELA, removed 
87,ok36k7,t2_bw3gvt0k,1626265235,/r/wallstreetbets/comments/ok36k7/earnings/,1,Earnings, removed 
88,ok38bc,t2_60qa1zrr,1626265412,/r/wallstreetbets/comments/ok38bc/i_think_it_is_time/,1,I think It is Time,It is time for VISL to come out from its shell and enter the atmosphere and travel to the moon on ape fuel It has been a sitting duck for ages And its now or never VISL to the moon get in early while you can amp x200B amp x200B https preview redd it nvnyrlig86b71 png width 168 amp format png amp auto webp amp s e7afe7765b8fcdbf2ce5abaeb756b4afcbf6b961
89,ok395u,t2_4zk81ccg,1626265497,/r/wallstreetbets/comments/ok395u/sndl_to_the_moon/,1,sndl To the moon, removed 
90,ok39dk,t2_bw3gvt0k,1626265519,/r/wallstreetbets/comments/ok39dk/q2_earnings/,1,Q2 Earnings, removed 
91,ok3b1j,t2_7tz0nweb,1626265690,/r/wallstreetbets/comments/ok3b1j/supply_chains_and_inflation/,1,Supply Chains and Inflation, removed 
92,ok3bsl,t2_7tz0nweb,1626265775,/r/wallstreetbets/comments/ok3bsl/supply_chains_and_inflation/,1,Supply Chains and Inflation,
93,ok3c00,t2_9izldg1f,1626265797,/r/wallstreetbets/comments/ok3c00/copper_yolo_50k_who_wins_the_ev_race_tsla_nio_gm/,1,Copper YOLO 50k Who wins the EV race TSLA NIO GM or someone else Frankly I don t care I just know they will need heck of a lot of Copper ,
94,ok3cjj,t2_7tz0nweb,1626265851,/r/wallstreetbets/comments/ok3cjj/the_future_of_the_us_economy_w_regards_to/,1,The Future of the US Economy w Regards to Inflation,
95,ok3clh,t2_avvgjr7o,1626265856,/r/wallstreetbets/comments/ok3clh/xela_taking_off/,1,XELA taking off,Am I the only one who feels like XELA is going to launch today Over 25 gain yesterday and already up 12 in today s pre market 
96,ok3d9l,t2_ngns4,1626265927,/r/wallstreetbets/comments/ok3d9l/alibaba_tencent_mull_over_opening_up_services_to/,1,Alibaba Tencent mull over opening up services to each other WSJ,
97,ok3dhd,t2_57cdztrp,1626265948,/r/wallstreetbets/comments/ok3dhd/lets_goooooo_there/,1,Let s goooooo there ,
98,ok3diw,t2_10xsu1,1626265953,/r/wallstreetbets/comments/ok3diw/fud_alertyou_could_lose_everything_investing_in/,1,FUD ALERT You could lose everything investing in meme stocks Franklin Templeton CEO,
99,ok3dm7,t2_ck7p5,1626265963,/r/wallstreetbets/comments/ok3dm7/you_too_can_help_f_cancer_with_sesn/,1,You too can help f amp cancer with SESN,This company Sesen Bio has had a drug Vicineum in trails for quite some time now and by all accounts everything has gone swimmingly Trial results peg Vicineum as being far more effective than the next best drug on the market Keytruda in treating non muscle invasive bladder cancer NMIBC And these two are only two of four drugs ever developed to treat this type of cancer Basically this drug gives extra time to those that have serious cases of bladder cancer 75 across three trial cohorts were estimated to remain cystectomy free at 3 years 90 were estimated to remain progression free for 2 years or more 29 were estimated to remain event free at 1 year and 96 were estimated to have an overall survival of 2 years or more All good news especially if you have NIMBC Earlier the FDA has granted priority review to the drug SESN then started it s climb to over 4 They re scheduled to make their final decision on it next month August 18th 2021 In that meantime SESN has been gearing up their distribution network submitting the drug for review in several countries and securing local distributors across the world This morning they announced notes from one of their final meetings with the FDA prior to their decision next month In it they noted that no advisory committee meeting is planned at this time no confirmatory trial will be required at this time and all things point to next month s review taking place on time and being positive Decent PM activity on that news and would expect it swing at least 0 20 if not more today This is not financial advice Do your own DD on the company and the results of the trails Just wanted to alert you guys to this The next month will probably the cheapest and least traded you ll see this stock for a while if not forever Buy this dip and hold FULL DISCLOSURE I m long 4000 shares 3 I ve been not bag holding this one for a long time apes and this is a good company doing great things with a solid money pricing machine on their hands 
0,ok3dm7,t2_ck7p5,1626265963,/r/wallstreetbets/comments/ok3dm7/you_too_can_help_f_cancer_with_sesn/,1,You too can help f amp cancer with SESN,This company Sesen Bio has had a drug Vicineum in trails for quite some time now and by all accounts everything has gone swimmingly Trial results peg Vicineum as being far more effective than the next best drug on the market Keytruda in treating non muscle invasive bladder cancer NMIBC And these two are only two of four drugs ever developed to treat this type of cancer Basically this drug gives extra time to those that have serious cases of bladder cancer 75 across three trial cohorts were estimated to remain cystectomy free at 3 years 90 were estimated to remain progression free for 2 years or more 29 were estimated to remain event free at 1 year and 96 were estimated to have an overall survival of 2 years or more All good news especially if you have NIMBC Earlier the FDA has granted priority review to the drug SESN then started it s climb to over 4 They re scheduled to make their final decision on it next month August 18th 2021 In that meantime SESN has been gearing up their distribution network submitting the drug for review in several countries and securing local distributors across the world This morning they announced notes from one of their final meetings with the FDA prior to their decision next month In it they noted that no advisory committee meeting is planned at this time no confirmatory trial will be required at this time and all things point to next month s review taking place on time and being positive Decent PM activity on that news and would expect it swing at least 0 20 if not more today This is not financial advice Do your own DD on the company and the results of the trails Just wanted to alert you guys to this The next month will probably the cheapest and least traded you ll see this stock for a while if not forever Buy this dip and hold FULL DISCLOSURE I m long 4000 shares 3 I ve been not bag holding this one for a long time apes and this is a good company doing great things with a solid money pricing machine on their hands 
1,ok3dx9,t2_16dwil,1626265993,/r/wallstreetbets/comments/ok3dx9/5_french_stocks_to_consider_for_bastille_day/,1,5 French Stocks To Consider For Bastille Day,
2,ok3ey5,t2_cnzmdq21,1626266097,/r/wallstreetbets/comments/ok3ey5/wish_20_easy/,1, wish 20 Easy , removed 
3,ok3gri,t2_b9966sbe,1626266279,/r/wallstreetbets/comments/ok3gri/svenska_aerogel_aerost/,1,Svenska aerogel AERO ST ,Has anyone invested in aerogel Its very impressive material that has been used by NASA in space rockets because of its extremely good qualities Svenska Aerogel have developed quartzene which have these special qualities Quartzene properties an overview Extremely light weight has a bulk density of around 0 1 kg dm3 Very high porosity solid material about 5 the rest is air Meso porous i e the majority of the pore size is in the range 2 50 nm Very low thermal conductivity Lambda 25 31 mW m K High thermal resistance Hydrophilic quality can withstand 900 C without changing properties Doesn t burn Large internal surface up to 700 m2 g Svenska Aerogel is trying to commercialise quartzene which have previously been too expensive to make They managed to drop costs to make quartzene significantly The more I read about this the more I think the benefits and possible areas of use are endless Example its outstanding insulator cause it can resist heat and its lightweight Im wondering if this is the material of the future It should be great insulator for example hydrogen tanks Here is more info https www aerogel se en quartzene https www aerogel se en quartzene Feel free to comment 
4,ok3gxd,t2_ciwmx1ej,1626266294,/r/wallstreetbets/comments/ok3gxd/blast_from_the_past_nok/,1,Blast from the past NOK ,
5,ok3hqi,t2_5x90v5mj,1626266378,/r/wallstreetbets/comments/ok3hqi/space_the_new_frontier/,1,Space The New Frontier, Bulls know what you own VG began a new era of space tourism see ya at triple digits https preview redd it 4i8th061b6b71 jpg width 1073 amp format pjpg amp auto webp amp s 7aa7b3fc91fc80da68cdd2810068844c0453c29d
6,ok3hsp,t2_cbpuuwzg,1626266384,/r/wallstreetbets/comments/ok3hsp/waiting_in_the_weeds/,1,Waiting in the weeds,Watching ANPC It spiked in June July November amp December 2020 Then on Feb March April May amp June of this year It s prime to spike again soon Wait for it Wait for it 
7,ok3hvm,t2_8wuxxrjx,1626266393,/r/wallstreetbets/comments/ok3hvm/uxin_yolo_update_after_william_li_ceo_of_nio/,1,Uxin yolo update after William Li CEO of Nio joins Uxin s board Cost basis on right ,
8,ok3imx,t2_clnrlpkz,1626266468,/r/wallstreetbets/comments/ok3imx/xela_is_exploding_board_the_rocket/,1,XELA IS EXPLODING BOARD THE ROCKET , removed 
9,ok3jei,t2_clnrlpkz,1626266545,/r/wallstreetbets/comments/ok3jei/xela_is_exploding_guys_board_the_rocket_and_send/,1,XELA IS EXPLODING GUYS Board the rocket and send it to the moon This is the next meme stock and the time is NOW , removed 
10,ok3l3m,t2_23ygb5ms,1626266715,/r/wallstreetbets/comments/ok3l3m/some_loss_porn_for_yall_mainly_to_blame_spy_over/,1,Some loss porn for y all mainly to blame SPY over night puts and trading options with paper hands,
11,ok3llk,t2_74siv6ft,1626266764,/r/wallstreetbets/comments/ok3llk/hedgies_really_deserve/,1,Hedgies really deserve ,More green then red on both Fidelity and Webull yet the price is falling HF and MM really deserive whats coming to them Keep Buying the dips and HOLD 
12,ok3n30,t2_9m9ifl8o,1626266904,/r/wallstreetbets/comments/ok3n30/nokia_663_my_first_smartphone_lets_get_me_663/,1,NOKIA 663 MY FIRST SMARTPHONE LETS GET ME 66 3, removed 
13,ok3n9o,t2_98w0eui5,1626266924,/r/wallstreetbets/comments/ok3n9o/the_end_of_federal_prohibition_on_marijuana/,1,The end of federal prohibition on marijuana,
14,ok3pe3,t2_a0g2saze,1626267139,/r/wallstreetbets/comments/ok3pe3/gme_lets_fucking_go/,1,GME let s fucking go , removed 
15,ok3q6f,t2_98w0eui5,1626267218,/r/wallstreetbets/comments/ok3q6f/chuck_schumer_on_twitter/,1,Chuck Schumer on Twitter,The end on federal marijuana prohibition amazon lobbying supreme court backing it up cannabis stonks heavily shorted We ve got everything in our favor guys bullish on TLRY KSHB CGC CURA SNDL
16,ok3r8l,t2_98w0eui5,1626267327,/r/wallstreetbets/comments/ok3r8l/the_end_the_federal_prohibition_on_marijuana/,1,The end the federal prohibition on marijuana,
17,ok3rzi,t2_a1hozb2a,1626267399,/r/wallstreetbets/comments/ok3rzi/exela_technologies_for_the_win/,1,Exela Technologies for the win ,I won t use the ticker as it does not seem to go through on WSB unfortunately even though this morning the share price will hit 5 and it crossed it yesterday but this is the next by play in my book and autistic view Apes are lining this one up and it is moving up Solid premarket again and we got the attention of short sellers that are doubling down Docusign has a share price in the triple digits and X E L A is a direct competitor 1 2B in annual revenues Small share float 18 000 employees Short squeeze imminent Best of both worlds Legit company undervalued based on fundamentals in technologies Recently ranked 1 by Fintel for the short squeeze ranking My ducks are in line Look it up as they did raise significant cashflow and capital with consistent share price increase the debt issue will be less of a concern if not taken care of The P E ratio is so low that there is plenty of room to run Oh yes the volume has been crazy shorts started naked shorting and the premarket as we speak is 15 No pump and dump given the depth of the company and strong fundamentals That s my 2 cents I want to make it 2 Or 200 Or why not 2000 
18,ok3say,t2_8e7pqu2l,1626267428,/r/wallstreetbets/comments/ok3say/its_my_birthday/,1,it s my birthday, removed 
19,ok3tnv,t2_9p2e1b2b,1626267561,/r/wallstreetbets/comments/ok3tnv/trusting_in_you_heavy_on_this_meme_train/,1,Trusting in you Heavy on this meme train,
20,ok3tr5,t2_d1t46niu,1626267570,/r/wallstreetbets/comments/ok3tr5/exela_where_is_the_end/,1,Exela Where is the end , removed 
21,ok3tri,t2_a4v7ntsq,1626267572,/r/wallstreetbets/comments/ok3tri/jagx_yolo/,1, JAGX YOLO, removed 
22,ok3v47,t2_uh4l1u5,1626267677,/r/wallstreetbets/comments/ok3v47/some_research_done_here_on_citadels_involvement/,1,Some research done here on Citadels involvement in the AMC short squeeze ,
23,ok3voi,t2_6ggbu0js,1626267727,/r/wallstreetbets/comments/ok3voi/the_case_for_ipwr/,1,The case for IPWR,Ideal power ticker IPWR scope pumped a few months back initial buyers got in on promise of pipeline and customer addressable base Prince was chased during the pump and shorting started immediately Currently heavily shorted Company has great potential and is at the start of its commercialization journey 3 6 month swing trade Play Currently moving sideways with heavy volumes of shorting coming in Buy between 11 70 and 12 20 to sell above 20 With a small float my theory is that shorters will try to take this to 10 hoping for a quick flush to 6 Buyers have shown up consistently around the 11 mark and might push for a reversal at any given time of positive news Expected end of July early August Pioneering the development of its broadly patented bi directional power switches creating highly efficient and ecofriendly energy control solutions for electric vehicle electric vehicle charging renewable energy energy storage UPS data center and other industrial and military applications The Company is focused on its patented Bi directional Bi polar Junction Transistor B TRAN semiconductor technology B TRAN is a unique double sided bi directional AC switch able to deliver substantial performance improvements over today s conventional power semiconductors Ideal Power Inc was the target of a significant increase in short interest during the month of June As of June 15th there was short interest totaling 329 600 shares an increase of 42 7 from the May 31st total of 231 000 shares 
24,ok402q,t2_97pf5h2c,1626268149,/r/wallstreetbets/comments/ok402q/turning_35_into_143_k_by_the_end_of_the_year/,1,Turning 35 into 143 K by the end of the year ,06 28 2021 Bought CRTD 48 short interest as of 06 25 2021 worth of 35 3 33 sold at 6 73 67 30 07 13 2021 Bought CLNN 57 04 short interest as of 06 30 2021 worth of 70 14 02 sold at holding until next short interest list is posted on MarketWatch due 08 10 2021 
25,ok407n,t2_96nkfzeu,1626268163,/r/wallstreetbets/comments/ok407n/big_news_on_marijuana_watch_today_this_morning/,1,Big news on marijuana Watch Today this morning ,
26,ok41d3,t2_9js0dd4x,1626268270,/r/wallstreetbets/comments/ok41d3/dr_phil_meets_a_wsb_prodigy/,1,Dr Phil meets a WSB prodigy,
27,ok41hr,t2_96nkfzeu,1626268281,/r/wallstreetbets/comments/ok41hr/marijuana_news_rolling_out_im_ready_to_smoke_some/,1,Marijuana news rolling out I m ready to smoke some legal weed around the nationa,
28,ok41pa,t2_97pf5h2c,1626268299,/r/wallstreetbets/comments/ok41pa/turning_35_into_143_k_by_the_end_of_the_year/,1,Turning 35 into 143 K by the end of the year ,Turning 35 into 143 K by the end of the year 06 28 2021 Bought CRTD 48 short interest as of 06 25 2021 worth of 35 3 33 sold at 6 73 67 30 07 13 2021 Bought CLNN 57 04 short interest as of 06 30 2021 worth of 70 14 02 sold at holding until next short interest list is posted on MarketWatch due 08 10 2021 
29,ok41sy,t2_9z1amiqh,1626268308,/r/wallstreetbets/comments/ok41sy/in_a_milestone_schumer_will_propose_federal/,1,In a Milestone Schumer Will Propose Federal Decriminalization of Marijuana,
30,ok42sp,t2_97pf5h2c,1626268406,/r/wallstreetbets/comments/ok42sp/turning_35_into_143_k_by_the_end_of_the_year/,1,Turning 35 into 143 K by the end of the year , 06 28 2021 Bought CRTD 48 short interest as of 06 25 2021 worth of 35 3 33 sold at 6 73 67 30 07 13 2021 Bought CLNN 57 04 short interest as of 06 30 2021 worth of 70 14 02 sold at holding until next short interest list is posted on MarketWatch due 08 10 2021 
31,ok43vx,t2_97pf5h2c,1626268507,/r/wallstreetbets/comments/ok43vx/turning_35_into_143_k_by_the_end_of_the_year/,1,Turning 35 into 143 K by the end of the year , 06 28 2021 Bought CRTD 48 short interest as of 06 25 2021 worth of 35 3 33 sold at 6 73 67 30 07 13 2021 Bought CLNN 57 04 short interest as of 06 30 2021 worth of 70 14 02 sold at holding until next short interest list is posted on MarketWatch due 08 10 2021 
32,ok443o,t2_b52588j9,1626268528,/r/wallstreetbets/comments/ok443o/diamond_stock_pattern/,1,Diamond Stock Pattern, Diamond Bullish https preview redd it sggc1nllh6b71 png width 272 amp format png amp auto webp amp s 0071803a76495811996545edc3a8257208daed18 Diamond Bearish https preview redd it 4kmwhuknh6b71 png width 261 amp format png amp auto webp amp s 1aa9100a993294212218b3214d350e7acb3b0744 amp x200B Diamond This reversal pattern is one of the most uncommon patterns you will see The diamond pattern looks similar to a head and shoulder or double top pattern This pattern is formed by connecting the highs and lows of trendlines To calculate the price target add the difference between the highest peak and lowest peak to the breakout point It is important to note that diamond patterns don t often form a perfect diamond Most of the time the diamond is slanted Make sure to check in tomorrow for our next Pattern of the Day 
33,ok449s,t2_cenp15yj,1626268544,/r/wallstreetbets/comments/ok449s/wells_fargo_earnings_were_a_shitshow_double_digit/,1,Wells Fargo earnings were a shitshow Double digit declines in commercial and consumer loans The earnings rise was purely tied to loan reserves being released The only thing management is good at is maintaining plausible deniability,
