,postid,author,created_utc,permalink,score,title,selftext
72,olnalg,t2_b3x7gj0n,1626461291,/r/wallstreetbets/comments/olnalg/anyone_use_wsb_to_fire/,1,Anyone use WSB to FIRE ,There might be some overlap here making a few good plays to get the account balance up a lot accelerating traditional investments for early retirement Anyone made it happen using strategies here 
73,olnaot,t2_6y8njzm7,1626461299,/r/wallstreetbets/comments/olnaot/thats_what_i_get_for_using_rh/,1,That s What I Get For Using RH,
74,olnb42,t2_h1h4n,1626461334,/r/wallstreetbets/comments/olnb42/kdmn_trading_halted_as_fda_grants_full_approval/,1, KDMN TRADING HALTED AS FDA GRANTS FULL APPROVAL OF REZUROCK 40 million shares short, removed 
75,olnbs7,t2_ad9fm4wi,1626461396,/r/wallstreetbets/comments/olnbs7/crsr_round_2_ta_nice_setup_for_the_next_bounceup/,1, CRSR Round 2 TA Nice set up for the next bounce up ,Just took a new long position on CRSR added 650 new shares Set up looks primed for lift off again Consolidation around 29 50 support Wedge forming MACD and Eliot Waves showing reversal is in play as well amp x200B https preview redd it rtejgczjemb71 png width 1353 amp format png amp auto webp amp s d50eec40ced2eabb1c62635194ee20a91ef82355 amp x200B amp x200B Looking at financials the company is a solid value buy With P E 19 10 and the MRQ Enterprise value 3 5B below the market cap 2 7B For you smooth brains out there it means that based on the most recent filings the value that is on the books for the company is more than what the market is pricing them at With a solid revenue stream huge cash store on hand and low short term debt financials look amazing Meaning Market is irrationally pricing this there is value in the company to be unlocked stock will eventually move up to meet exceed the enterprise value amp x200B TL DR Amazing company and solid financials MRQ Enterprise Value gt Market Cap value opportunity Wedge forming again TA looking solid for this company 
76,olnc1m,t2_2sjb9u,1626461420,/r/wallstreetbets/comments/olnc1m/am_i_doing_this_right/,1,Am I doing this right ,
77,olncnz,t2_a0dhmxgl,1626461473,/r/wallstreetbets/comments/olncnz/sgoc_has_shorts_trapped_125_short_interest_vwap/,1, SGOC has shorts trapped 125 short interest Vwap break turning into support at 12 08 If you like volatility With high upside Let s get it Loaded heavy at 12 10 on the break and confirm I want you all to make money Let s do this Super low float Easy movement , removed 
78,olnd3q,t2_a0dhmxgl,1626461509,/r/wallstreetbets/comments/olnd3q/sgoc_squeeze_ah_runner/,1, SGOC squeeze AH runner, SGOC has shorts trapped 125 short interest Vwap break turning into support at 12 08 If you like volatility With high upside Let s get it Loaded heavy at 12 10 on the break and confirm I want you all to make money Let s do this Super low float Easy movement 
79,olne1u,t2_5c0qql1u,1626461593,/r/wallstreetbets/comments/olne1u/buying_every_wish_dip_until_it_hits_to_zero_i/,2,Buying EVERY WISH dip until it hits to ZERO I REFUSE to sell Taking my shares to the grave They can manipulate but I know God got me ,
80,olnekk,t2_a0dhmxgl,1626461636,/r/wallstreetbets/comments/olnekk/sgoc_squeeze_and_after_hours_runner/,1, SGOC squeeze and after hours runner, SGOC has shorts trapped 125 short interest Vwap break turning into support at 12 08 If you like volatility With high upside Let s get it Loaded heavy at 12 10 on the break and confirm I want you all to make money Let s do this Super low float Easy movement Buy and hold for 15 
81,olnete,t2_u8co5,1626461657,/r/wallstreetbets/comments/olnete/advice_for_a_low_income_beginner/,1,Advice for a low income beginner,I m currently on 90 a week at 18 and still live with parents I am interested in low risk index investment and crowdsourcing real estate Are these suitable investments for someone with low money 
82,olnf8j,t2_dcdnzfew,1626461694,/r/wallstreetbets/comments/olnf8j/stop_trying_to_squueze_silver_maybe_go_for_gdxj/,1,Stop Trying to Squueze Silver maybe go for GDXJ, removed 
83,olnfch,t2_dbrv7j2z,1626461702,/r/wallstreetbets/comments/olnfch/lost_100k_in_qs_hopefully_this_stock_will_come/,1,Lost 100K in QS Hopefully this stock will come back again and now it is looking positive with result in July 27th and confirmation from VW Germany testing of cells ,
84,olnfqj,t2_a0dhmxgl,1626461736,/r/wallstreetbets/comments/olnfqj/sgoc_has_shorts_trapped_125_short_interest_vwap/,1, SGOC has shorts trapped 125 short interest Vwap break turning into support at 12 08 If you like volatility With high upside Let s get it Loaded heavy at 12 10 on the break and confirm I want you all to make money Let s do this Super low float Easy movement , SGOC has shorts trapped 125 short interest Vwap break turning into support at 12 08 If you like volatility With high upside Let s get it Loaded heavy at 12 10 on the break and confirm I want you all to make money Let s do this Super low float Easy movement If you diamond handed apes want to bank Let s go Still early We save 29 last week It will easily go up 16 I still own all AMC This will make more tendies for amc 
85,olnh2w,t2_5c0qql1u,1626461854,/r/wallstreetbets/comments/olnh2w/buying_every_wish_dip_until_it_hits_zero_i_refuse/,1,Buying EVERY WISH dip until it hits ZERO I REFUSE to sell Taking my shares to the grave if I need to They can manipulate all they want I know God got me ,
86,olnhla,t2_43vh3v61,1626461897,/r/wallstreetbets/comments/olnhla/watching_my_portfolio_fly_away/,1,Watching my portfolio fly away ,
87,olnjnx,t2_5rzxhvzf,1626462052,/r/wallstreetbets/comments/olnjnx/snap_earnings_0722_dd/,1,SNAP earnings 07 22 DD, This is a bull thesis on Snapchat SNAP Background Snapchat is a tech company best known for enabling you to send and receive self deleting nude pics that you re definitely not gonna screenshot But the company is so much more The growing social media giant is a way to communicate across the globe zoom in on specific areas of the world with the lens feature supplant your shitty life with augmented reality get your fix of jerk off fuel YesJulz watch Snapchat original series don t actually and hide your busted ass face from future tinder dates using filters Big nose Becca Why does this matter Because it s gonna fuckin print bitch Look at what I m telling you This company is Pumping up users it s PUmping up content it s PUMping up revenue and its PUMPing up my cock Let s get serious Snapchat produces nearly all revenue by offering advertising products on a fixed fee over time or by impressions delivered Pretty simple business model You open our ap you click the shit and we blast your frontal cortex with digital xenoestrogen that convinces you to buy overpriced shit made for twinks and teeny boppers Since its exciting IPO in 2017 SNAP has failed to turn a positive proft The stock traded sideways until Q3 of 2020 when substantial growth in daily active users revenue and promising product innovation lifted the stock to a new ATH The first year of positive free cash flow in Q1 2021 earnings lifted it even higher Technical Analysis Then SNAP traded within a 67 48 channel for about four months before a double top on 07 07 2021 The price has settled out to STRONG support around the 59 price range If it holds here this presents an excellent entry for a run and rip through earnings amp x200B Figure 1 SNAP 20D 1H https preview redd it mqrwmvzwfmb71 png width 388 amp format png amp auto webp amp s 23b9138e4e08eefac6ca2a68f2b14efa7d4cef47 Path to profitability What makes me so sure SNAP is going to beat earnings First SNAP Has exceeded 5 consecutive earnings estimates and six is my lucky number Second there are noticeably more ads and for longer periods of time Don t forget that shit is how they make their money Consequently revenues increased 66 revenue per user increased 36 and a whopping 2 835 increased free cash flow YOY in Q1 2021 earnings The effects of the increased ads and new platform products are to be seen in this Q2 The whisper number is 844m in revenue a nearly 100 increase in revenue YOY What are some of those new platform products First sponsored Lens with American Eagle Fit Solutions a sizing tech company Gucci sponsored AR Lens and camera kit integration with Moj the TikTok of India You can find all that shit here https s25 q4cdn com 442043304 files doc financials 2021 q1 Q1 21 Earnings Slides Final 4 22 21 pdf in their Q1 2021 Earnings Report What s got my bullcock so turgid though SNAP has increased their daily active users from 229m in Q1 2020 to 280m in 2021 This rise in daily active users is not entirely attributable to COVID lockdowns either The user base has been increasing steadily since 2018 in America Europe and the rest of the world Mind you rest of the world is not coded language for small shithole countries Rest of the world includes INDIA which accounts for 17 7 of the world s population and the second largest population of daily active users This is the fucking Mesopotamia of active users SNAP is proving to be a rich hunting ground for retailers How does SNAP attract retail advertisers Premium content The D amelio sisters Charli and Dixie are TiTok stars with 171m followers between the two of them Their most recent advertising campaign on TikTok has raked in the raked in the fucking dough https www tubefilter com 2020 07 22 charli dixie hollister jeans lab campaign for clothing retailers like Hollister The sisters proved that they are highly effective brand ambassadors They are going to do it again on SNAP These two are now featured in a new line of original shows https variety com 2021 digital news snapchat megan thee stallion charli dixie damelio 1234966360 on SNAP This content presents a clear avenue for retailers hoping to advertise their merchandise and a path for SNAP to increase monetization of its platform Counter A bear may reasonably say that relative to other tech peers there is no multiple that aligns with the current share price First ber are fuk Second they would be correct in saying that Third the future growth in user monetization available to SNAP far outscales its current earnings figure 2 Additionally the CEO of SNAP pretty much said we don t need an army of punjabis https www cnbc com 2021 03 03 snap ceo evan spiegel 50percent growth without new users or engagement html to pump our active users up to turn a 50 YOY gain on revenue all we need to do is turn the fuckin ads on And the ads are on my friend amp x200B Figure 2 SNAP revenue per use relative to peers https preview redd it w45ts5zyfmb71 png width 624 amp format png amp auto webp amp s f5d8dd46ad0597494d74e21bb74571d4da93338a Closing Q1 2020 SNAP guidance estimates Q2 revenue between 820 840m up from 454m in Q2 2020 The increased monetization of the platform in conjunction with a rapidly rising user base presents the real possibility of a supercharged green dildo Due to report earnings at market close on July 22 Positions 07 23 21 60C 07 23 21 65C 07 23 21 70C 01 21 22 70C
88,olnkbv,t2_87a6aerq,1626462101,/r/wallstreetbets/comments/olnkbv/i_got_ahold_of_1500_dollars_and_i_have_big_hopes/,1,I got ahold of 1500 dollars and I have big hopes,So my grandpa recently rolled over thankfully and I was left with a pos boat that needed a lot of work Anyways I was to lazy to fix it up so I decided to sell it to the first degenerate interested I got 1500 for it So I have all this money and no knowledge of the stock market but I have big dreams of sinking all of it into whatever you guys tell me to I didn t earn this money so if I lose it all it won t bother me to bad Please give me recommendations and I will post a follow up
89,olnkux,t2_a1n1oetz,1626462144,/r/wallstreetbets/comments/olnkux/what_is_thisscam/,1,What is this Scam ,
90,olnlml,t2_5mi6c8zz,1626462206,/r/wallstreetbets/comments/olnlml/maps/,1, MAPS, removed 
91,olnm21,t2_9j4p6odo,1626462245,/r/wallstreetbets/comments/olnm21/sofi_not_looking_so_hot/,1,SOFI not looking so hot,
92,olnni8,t2_8v9icovy,1626462360,/r/wallstreetbets/comments/olnni8/virgin_galactic_spce_just_hit_200_ema_option_yolo/,1,Virgin Galactic SPCE Just hit 200 EMA OPTION YOLO ,
93,olnnig,t2_8d2g7koi,1626462360,/r/wallstreetbets/comments/olnnig/imagine_panic_selling_future_tech_stocks_right/,1,Imagine panic selling future tech stocks right now instead of panic buying lmao,FOMO buying space at 40 and and panic selling now is hilarious Imagine buying EV stocks at 20 a year ago thinking the drop was done only to panic sell them for 12 bucks to liquidate and stick your money into more trendy bullshit 90 of you are failed day traders who d greatly benefit from holding but that is not the way of the ape Cutting your losses is a failing strategy that only yields tax breaks as a consolation prize Sell your futures I ll gobble em up 
94,olnphy,t2_63fyh7cz,1626462498,/r/wallstreetbets/comments/olnphy/clf_cleveland_cliffs/,1,CLF Cleveland Cliffs,Apes need help Shorts are driving CLF down It s down big in last two days with earnings due on July 22nd Let s make them cover and pay the pipper 
95,olnpix,t2_a45ix41f,1626462499,/r/wallstreetbets/comments/olnpix/wish_when_is_the_bleeding_over/,1,WISH when is the bleeding over , removed 
96,olnqxs,t2_a1erslb5,1626462626,/r/wallstreetbets/comments/olnqxs/in_clov_you_cant_even_post_on_the_page_every_post/,1,In Clov you can t even post on the page Every post is positive and about holding and buying more Looks like a HF controlled group If you try to post something different you get attack by everyone, removed 
97,olnr4x,t2_a1llg4ck,1626462641,/r/wallstreetbets/comments/olnr4x/clov_yolo/,1, CLOV yolo,
98,olnr9l,t2_txq4w,1626462650,/r/wallstreetbets/comments/olnr9l/hey_atleast_they_arent_options/,1,hey atleast they arent options,
99,olnrbp,t2_yrovj,1626462655,/r/wallstreetbets/comments/olnrbp/to_the_guys_on_here_that_said_uwm_to_the_moon_up/,1,To the guys on here that said UWM to the moon Up yours ,
0,olnrbp,t2_yrovj,1626462655,/r/wallstreetbets/comments/olnrbp/to_the_guys_on_here_that_said_uwm_to_the_moon_up/,1,To the guys on here that said UWM to the moon Up yours ,
1,olnrqf,t2_3fo3px9c,1626462686,/r/wallstreetbets/comments/olnrqf/kdmn_short_squeeze_will_happen_now_that_fda/,1,KDMN short squeeze will happen now that FDA approve,FDA Approved kdmn https investors kadmon com news releases news release details us fda grants full approval rezurocktm belumosudil treatment
2,olns3e,t2_ci1mbnp3,1626462714,/r/wallstreetbets/comments/olns3e/buy_and_hold/,1,Buy and hold ,
3,olnsmz,t2_a1erslb5,1626462757,/r/wallstreetbets/comments/olnsmz/on_clov_group_you_cant_even_post_anymore_and/,1,On Clov group you can t even post anymore and every post is positive not realistic Is all about holding and buying more Looks like HF controlled group If you try to post something different you get attacked ,
4,olnsp1,t2_cgagzlip,1626462764,/r/wallstreetbets/comments/olnsp1/long_calls_on_junior_silver_miner_fsm/,1,Long calls on Junior Silver Miner FSM,
5,olnu34,t2_5rzxhvzf,1626462886,/r/wallstreetbets/comments/olnu34/snap_earnings_play_0722/,1, SNAP Earnings Play 07 22,This is a bull thesis on Snapchat SNAP Background Snapchat is a tech company best known for enabling you to send and receive self deleting nude pics that you re definitely not gonna screenshot But the company is so much more The growing social media giant is a way to communicate across the globe zoom in on specific areas of the world with the lens feature supplant your shitty life with AR get your fix of jerk off fuel YesJulz watch Snapchat original series don t actually and hide your busted ass face from future tinder dates using filters Big nose Becca Why does this matter Because it s gonna fuckin print bitch Look at what I m telling you This company is Pumping up users it s PUmping up content it s PUMping up revenue and its PUMPing up my cock Let s get serious Snapchat produces nearly all revenue by offering advertising products on a fixed fee over time or by impressions delivered Pretty simple business model You open our ap you click the shit and we blast your frontal cortex with digital xenoestrogen that convinces you to buy overpriced shit made for twinks and teeny boppers Since its exciting IPO in 2017 SNAP has failed to turn a positive proft The stock traded sideways until Q3 of 2020 when substantial growth in daily active users revenue and promising product innovation lifted the stock to a new ATH The first year of positive free cash flow in Q1 2021 earnings lifted it even higher Technical Analysis Then SNAP traded within a 67 48 channel for about four months before a double top on 07 07 2021 The price has settled out to STRONG support around the 59 price range If it holds here this presents an excellent entry for a run and rip through earnings Figure 1 SNAP 20D 1H amp x200B https preview redd it 39lqd66njmb71 png width 587 amp format png amp auto webp amp s 19f6381bb8cec66a1c9796798b7a0bc18e628fb6 Path to profitability What makes me so sure SNAP is going to beat earnings First SNAP Has exceeded 5 consecutive earnings estimates and six is my lucky number Second there are noticeably more ads and for longer periods of time Don t forget that shit is how they make their money Consequently revenues increased 66 revenue per user increased 36 and a whopping 2 835 increased free cash flow YOY in Q1 2021 earnings The effects of the increased ads and new platform products are to be seen in this Q2 The earnings whisper number is 844m a nearly 100 increase in revenue YOY What are some of those new platform products First sponsored Lens with American Eagle Fit Solutions a sizing tech company Gucci sponsored AR Lens and camera kit integration with Moj the TikTok of India You can find all that shit here https s25 q4cdn com 442043304 files doc financials 2021 q1 Q1 21 Earnings Slides Final 4 22 21 pdf in their Q1 2021 Earnings Report What s got my bullcock so turgid though SNAP has increased their daily active users from 229m in Q1 2020 to 280m in 2021 This rise in daily active users is not entirely attributable to COVID lockdowns either The userbase has been increasing steadily since 2018 in America Europe and the rest of the world Mind you rest of the world is not coded language for small shithole countries Rest of the world includes INDIA which accounts for 17 7 of the world s population and the second largest population of daily active users This is the fucking Mesopotamia of active users SNAP is proving to be a rich hunting ground for retailers How does SNAP attract retail advertisers Premium content The D amelio sisters Charli and Dixie are TiTok stars with 171m followers between the two of them Their most recent advertising campaign on TikTok has raked in the raked in the fucking dough https www tubefilter com 2020 07 22 charli dixie hollister jeans lab campaign for clothing retailers like Hollister The sisters proved that they are highly effective brand ambassadors They are going to do it again on SNAP These two are now featured in original shows https variety com 2021 digital news snapchat megan thee stallion charli dixie damelio 1234966360 on SNAP This content presents a clear avenue for retailers hoping to advertise their merchandise and a path for SNAP to increase monetization of its platform A bear may reasonably say that relative to other tech peers there is no multiple that aligns with the current share price First ber are fuk Second they would be correct in saying that Third the future growth in user monetization available to SNAP far outscales its current earnings figure 2 Additionally the CEO of SNAP pretty much said we don t need an army of punjabis https www cnbc com 2021 03 03 snap ceo evan spiegel 50percent growth without new users or engagement html to pump our active users up to turn a 50 YOY gain on revenue all we need to do is turn the fuckin ads on And the ads are on my friend Figure 2 SNAP revenue per user relative to peers amp x200B https preview redd it joso9stnjmb71 png width 624 amp format png amp auto webp amp s 1f495ea5b128941eee5b55379d642d3975e9ff0f Q1 2020 SNAP guidance estimates Q2 revenue between 820 840m up from 454m in Q2 2020 The increased monetization of the platform in conjunction with a rapidly rising userbase presents the real possibility of a supercharged green dildo Due to report earnings at market close on July 22 Positions 07 23 21 60C 07 23 21 65C 07 23 21 70C 01 21 22 70C
6,olnux8,t2_5c0qql1u,1626462954,/r/wallstreetbets/comments/olnux8/just_know_im_buying_every_single_dip/,1,Just know I m buying EVERY SINGLE dip ,
7,olnv09,t2_a9gjlcq8,1626462961,/r/wallstreetbets/comments/olnv09/amc_explained_in_one_meme/,1,AMC explained in one meme,
8,olny6h,t2_eac64,1626463229,/r/wallstreetbets/comments/olny6h/xela_being_held_down/,1, XELA being held down, removed 
9,olnzaz,t2_4jgbc537,1626463323,/r/wallstreetbets/comments/olnzaz/pick_your_retard/,1,Pick your retard,
10,olo0h5,t2_p1ltd,1626463427,/r/wallstreetbets/comments/olo0h5/bye_bye_miss_american_spy/,1, Bye Bye Miss American SPY ,
11,olo1i0,t2_35mk37an,1626463512,/r/wallstreetbets/comments/olo1i0/about_time_to_give_it_to_the_weed_shorts/,1,About time to give it to the weed shorts , removed 
12,olo2ek,t2_a0xhd8qp,1626463570,/r/wallstreetbets/comments/olo2ek/vino/,1, VINO, removed 
13,olo3bh,t2_56flc4cc,1626463636,/r/wallstreetbets/comments/olo3bh/short_sellers_on_cineworld_cinel_the_british_amc/,1,Short sellers on Cineworld CINE L the British AMC could be squeezed Cineworld owns Regal cinema chain ,
14,olo51l,t2_c0xa4ule,1626463779,/r/wallstreetbets/comments/olo51l/converting_10k_portfolio_into_low_risk_option/,1,Converting 10k portfolio into low risk option spreads , removed 
15,olo5jr,t2_1fsvfm6o,1626463819,/r/wallstreetbets/comments/olo5jr/buy_all_the_dips_they_saidcant_stop_wont_stopdont/,1,Buy all the dips they said can t stop won t stop don t know how ,
16,olo5v5,t2_a0u79c8e,1626463839,/r/wallstreetbets/comments/olo5v5/yolo_clover/,1,Yolo clover,
17,olo7es,t2_cd6domk6,1626463952,/r/wallstreetbets/comments/olo7es/anyone_watching_cydy_cytodine_anyone_believe_it/,1,Anyone watching CYDY Cytodine Anyone believe it is undervalued , removed 
18,olo8br,t2_6vdtn,1626464032,/r/wallstreetbets/comments/olo8br/true_fds_0mte/,1,True FD s 0mTE, removed 
19,oloak5,t2_3d03ngvx,1626464228,/r/wallstreetbets/comments/oloak5/learning_photography_graphing_my_ape_stocks_at/,1,Learning Photography Graphing my Ape stocks at same time ,
20,oloasm,t2_a7qcada2,1626464249,/r/wallstreetbets/comments/oloasm/usmj_sndl_weed_stocks_hows_it_looking_chuckie/,1,USMJ SNDL Weed stocks how s it looking Chuckie Schuu ,I m a hopeful romantic for cannabis stocks The Schu man in Congress is trying to federally legalize it I can t decide I ve been too busy to do my own DD and analysis whether to throw my 6yo s college tuition at USMJ or TLRY or frankly any cannabis stock or wait for more hype SNDL is a hopeful long term with or without hype and it s honestly hard to do cannabis stock assessments while sampling the products too I usually get distracted with hits blunt why some co Ticket symbols are so different than their names Anyways for now I ll YOLO my left arm and somebody s money into these moneymakers Thoughts 
21,olobmh,t2_cd6domk6,1626464325,/r/wallstreetbets/comments/olobmh/cydy_cytodyne/,1,CYDY Cytodyne,I have been investing in this stock since April 2020 they have a COVID vaccine rolling out and their bread and butter is AIDS related medicine and treatments Anyone have any insight into how this stock has not gained traction during the pandemic 
22,olobnq,t2_bpwlu6o3,1626464329,/r/wallstreetbets/comments/olobnq/spce_4k_loss_it_burned_me_to_the_ground_today_0716/,1,SPCE 4K loss It burned me to the ground today 07 16,
23,olobpw,t2_dbaf60rp,1626464335,/r/wallstreetbets/comments/olobpw/amc_newbie_question/,1,AMC Newbie Question , removed 
24,oloc3v,t2_627gyice,1626464369,/r/wallstreetbets/comments/oloc3v/scranton_joe_biden_mr_president_i_thought_you/,1, SCRANTON JOE BIDEN MR PRESIDENT I THOUGHT YOU LOOKED OUT FOR US LITTLE GUYS 10 MILLION VOTERS HERE AND THE WORLD WATCHING THIS BLANTANT CORRUPTION ON WALLSTREET WHAT ARE YOU DOING ABOUT IT ,Mr President we are watching you Are you protecting the rich It sure looks like it Your actions or lack of will be remembered 
25,olocan,t2_7ybwf44a,1626464386,/r/wallstreetbets/comments/olocan/my_most_degenerate_possible_upcoming_yolo/,1,My most degenerate possible upcoming YOLO ,So this is sort of a question post but also a play yolo post Ok so let s get right into the Bidnesssss So everyone here is balls deep in the inflation hype cuz we are all degenerates But I am not seeing UDN UUP or USDU talked about much So I think that if we go full on The Revenant BEAR mode on the Leonardo DiCaprio dollar and the dollar sinks like the titanic You see what I m getting at here The options for these things is soooo cheap So if the fed doesn t do anything till sometime in 2022 and inflation keeps rising like we see it has been and we get lucky then we have mucho money Now some might say nerdy things like ohhhhh blah blah math numbers there is a reason people aren t doing this blah blah To them I say well then it s the perfect time to get in on the trade When no one else wants it it is the perfect time These nerds use numbers to find a good trade I use the few brain cells that still somehow sorta work in my head ALSO so China and the US are in a battle for economic supremacy ATM so China is going to be attempting to devalue the US dollar the only question is will devaluations the dollar lead to these other currencies in these ETFs being devalued as well So pls tell me I m smart and am gonna be the next WARREN fucking BURRY 
26,olodgi,t2_3mvoq3ae,1626464488,/r/wallstreetbets/comments/olodgi/not_as_far_as_you_think/,1,Not as far as you think,
27,olody2,t2_a1vekfbe,1626464532,/r/wallstreetbets/comments/olody2/lcid_dreams/,1, LCID Dreams ,
