,postid,author,created_utc,permalink,score,title,selftext
0,of8vrz,t2_a0s7jdfj,1625621505,/r/wallstreetbets/comments/of8vrz/yolo/,1,YOLO,
1,of8vsy,t2_cmi9cg44,1625621508,/r/wallstreetbets/comments/of8vsy/llit_now_negg/,1, LLIT now NEGG ,
2,of8xgj,t2_a318e7xs,1625621682,/r/wallstreetbets/comments/of8xgj/jmia_buy_or_sell/,1,JMIA BUY OR SELL ,How do you guys feel about JMIA stock It s been very up and down the last year How do you guys feel about it Does anyone believe it can be the Amazon of Africa in 5 10 years 
3,of8xjg,t2_9cuzb0w6,1625621691,/r/wallstreetbets/comments/of8xjg/july_29th_the_fda_will_approve_or_deny_tenanapor/,1,July 29th the FDA will approve or deny Tenanapor Nasdaq ARDX , Nasdaq ARDX Facts about Tenanapor heading into 7 29 PDUFA Already approved for IBS C making safety profile a non concern Drug already in production making manufacturing inspection a non concern No AdCom Panel Very bullish sign Phase 3 met ALL endpoints Phase 4 already underway this is traditionally done after approval Novel drug to treat Hyperphosphatemia in CKD EVERY patient with CKD will develop Hyperphosphatemia at some point Company has hired a and is training a full sales force This shows great expense and strong conviction towards approval July 29th the FDA will approve or deny the above mentioned drug 
4,of8y52,t2_8adcyy9a,1625621746,/r/wallstreetbets/comments/of8y52/etfs_that_invest_in_sp500_winners_of_762021/,1,ETF s that invest in SP500 winners of 7 6 2021, ETFs with Investments in Today s SP500 Winners Three ETF s per winner when available ETF Ticker invested in Winner Link Top 15 Holdings Industrials ETFs investing in Generac Holdings Inc VSL 3 91 https etfdb com etf VSL holdings https etfdb com etf VSL holdings PRN 3 44 https etfdb com etf PRN holdings https etfdb com etf PRN holdings AIRR 3 38 https etfdb com etf AIRR holdings https etfdb com etf AIRR holdings Health Care ETFs investing in ABIOMED Inc N A Information Technology ETFs investing in Arista Networks Inc IGN 8 48 https etfdb com etf IGN holdings https etfdb com etf IGN holdings IYZ 4 58 https etfdb com etf IYZ holdings https etfdb com etf IYZ holdings SKYY 3 64 https etfdb com etf SKYY holdings https etfdb com etf SKYY holdings Communication Services ETFs investing in Twitter Inc FNGS 12 89 https etfdb com etf FNGS holdings https etfdb com etf FNGS holdings SOCL 5 95 https etfdb com etf SOCL holdings https etfdb com etf SOCL holdings PBS 5 58 https etfdb com etf PBS holdings https etfdb com etf PBS holdings Consumer Discretionary ETFs investing in Amazon com Inc ONLN 24 33 https etfdb com etf ONLN holdings https etfdb com etf ONLN holdings XLY 22 73 https etfdb com etf XLY holdings https etfdb com etf XLY holdings FDIS 22 57 https etfdb com etf FDIS holdings https etfdb com etf FDIS holdings Utilities ETFs investing in American Water Works Company Inc CGW 9 58 https etfdb com etf CGW holdings https etfdb com etf CGW holdings PHO 7 91 https etfdb com etf PHO holdings https etfdb com etf PHO holdings EBLU 7 41 https etfdb com etf EBLU holdings https etfdb com etf EBLU holdings Financials ETFs investing in MarketAxess Holdings Inc IAI 4 76 https etfdb com etf IAI holdings https etfdb com etf IAI holdings KCE 1 77 https etfdb com etf KCE holdings https etfdb com etf KCE holdings SPGP 1 67 https etfdb com etf SPGP holdings https etfdb com etf SPGP holdings Materials ETFs investing in Newmont Corporation RING 21 68 https etfdb com etf RING holdings https etfdb com etf RING holdings GDX 15 35 https etfdb com etf GDX holdings https etfdb com etf GDX holdings SGDM 12 20 https etfdb com etf SGDM holdings https etfdb com etf SGDM holdings Real Estate ETFs investing in Extra Space Storage Inc NURE 5 28 https etfdb com etf NURE holdings https etfdb com etf NURE holdings REZ 4 86 https etfdb com etf REZ holdings https etfdb com etf REZ holdings EWRE 3 70 https etfdb com etf EWRE holdings https etfdb com etf EWRE holdings Consumer Staples ETFs investing in Clorox Co AMER 3 67 https etfdb com etf AMER holdings https etfdb com etf AMER holdings RHS 3 25 https etfdb com etf RHS holdings https etfdb com etf RHS holdings JHMS 2 17 https etfdb com etf JHMS holdings https etfdb com etf JHMS holdings Energy No Winners N A 
5,of8yd0,t2_3xnrf3ie,1625621770,/r/wallstreetbets/comments/of8yd0/pl_help/,1,P amp L Help, Can you pls help figure out below p amp l Thanks in advance On March 1 2021 the fair market value of XYZ Co s assets held at its Citi account is 10 200 000 On March 15 2021 XYZ Co uses 1 000 000 cash held at Citi to buy shares that the company then holds in Citi On March 25 2021 XYZ Co transfers 1 750 000 from the bank to Citi and transfers 6 500 000 worth of options from its Citi account into its account at Mizuho Broker fees for the month of March were 500 000 all paid out of the Citi account in March On March 31 2021 the fair market value of XYZ Co s assets held at Citi is 5 000 000 Assuming no other deposits or withdrawals to HSBC that month what is the March 2021 Trading PnL at Citi 
6,of8yyi,t2_a1gti57n,1625621832,/r/wallstreetbets/comments/of8yyi/rite_aid_rad_new_business_modelim_buying_and_hodl/,1,RITE AID RAD NEW BUSINESS MODEL IM BUYING AND HODL ,
7,of8z6l,t2_2gjggebn,1625621857,/r/wallstreetbets/comments/of8z6l/went_from_300_to_10k_in_4_days_now_down_50_from/,1,Went from 300 to 10k in 4 days now down 50 from yesterday to 5k with this meme coin ,
8,of8z6y,t2_cnt8qud5,1625621858,/r/wallstreetbets/comments/of8z6y/missed_out_on_a_3k_day_while_drivingsmh/,1,Missed out on a 3k day while driving smh ,
9,of902i,t2_8qzdt0v7,1625621948,/r/wallstreetbets/comments/of902i/biotech_4x_opportunity_blrx/,1,BIOTECH 4x Opportunity BLRX,Soldiers we need to build an army ASAP for this bio tech on the verge of buyout by big pharma and or positive results in the pipeline BLRX has been up last 3 sessions and popped to 4 pre market this morning only to be taken down by hedges Need to pump it up tomorrow again before news hits Then it could go parabolic PT 20 
10,of90vy,t2_sy6k9,1625622031,/r/wallstreetbets/comments/of90vy/140k_all_in_twtr_leaps_update_762021/,1,140k All in TWTR Leaps Update 7 6 2021,
11,of91m0,t2_52jtj,1625622107,/r/wallstreetbets/comments/of91m0/uavs_way_oversold/,1,UAVS way oversold, removed 
12,of91y2,t2_a0rubcn5,1625622145,/r/wallstreetbets/comments/of91y2/im_bought_a_elephant_ton_shit_of_sprt_where_the/,1,Im bought a elephant ton shit of SPRT WHERE THE DICK ARE YOUR BUDDIES AT ,We have been getting the beer ready but you morons are still fucking each others over some CLAV barbie doll bullassshit GET YOUR ASS IN THE VAN TOMORROW 
13,of926b,t2_a0gjmebi,1625622171,/r/wallstreetbets/comments/of926b/bottom_play_lotto_ticket_nsav/,1,Bottom play lotto ticket NSAV,
14,of926d,t2_cxjcxq61,1625622171,/r/wallstreetbets/comments/of926d/thought_on_tattooed_chef/,1,Thought on Tattooed Chef , removed 
15,of92mt,t2_sy6k9,1625622219,/r/wallstreetbets/comments/of92mt/140k_all_in_twtr_update_762021/,1,140k All in TWTR Update 7 6 2021,
16,of941s,t2_7cpfplw8,1625622364,/r/wallstreetbets/comments/of941s/spacexgsat_dd_request/,1,SpaceX GSAT DD Request,Someone confirm 7 6 21 GSAT and SpaceX relationship via OSAT News report today woodlandreport com 2021 07 orbsat osat rises on partnership with spacexs starlink https woodlandreport com 2021 07 orbsat osat rises on partnership with spacexs starlink Can anyone confirm the DD on this please It was posted a while back here formal PR apparently Please help trying to research but having issues finding detailed info 
17,of9463,t2_a0gjmebi,1625622375,/r/wallstreetbets/comments/of9463/nsav_yolo/,1,NSAV yolo,
18,of9592,t2_71yftnfq,1625622488,/r/wallstreetbets/comments/of9592/ride_details_it_is_gold/,1, RIDE Details It is Gold ,All taken from PR distributed directly from the company and SEC filings As far as specifications go we know that the four in wheel hub motors produce a total of 600 HP 608 HP enough for a 0 60 mph 0 96 km h sprint of 5 5 seconds and a governed top speed of 80 mph 128 km h The 80 mile per hour limit is a standard set based on feedback from fleet managers The true story is that customers and fleet managers can remove the governor 100 There are three brand new stamping presses that are worth about 24M If we were to replace even one of our stamping lines it would cost over 30M each The factory is comprised of over 6M square feet and fully owned by Lordstown Motors The hub motors will be validated for 100 000 miles and require little maintenance Post said during the tour The hub motor itself will never need service He then said the motor doesn t break explaining There s no oil there s no pistons and those are lifetime bearings for the vehicle We are completely confident for the hub motor manufacturing readiness Hub motor assembly This area covers 400 000 square feet and has annual capacity for 240 000 hub motors all of our manufacturing equipment has been built validated and has been shipped We will be starting our installation and commissioning process in the next two weeks We will be ready to continue producing hub motors now in house Restated June 25 2021 Endurance Production is September with conservative 20 000 units being delivered by May 2022 They ve been clear that the ATVM Loan or asset backed financing will speed up the production ramp up to double The van prototype is being completed and will be displayed by the end of summer Military prototypes were onsite and driven during Lordstown Week General assembly from when we first receive the cab until when we can drive the endurance off the end of the line is eight hours Our system is flexible enough that we can change some gapping and line speed reducing down to as low as four hours We can build 30 jobs per hour in the body shop There are 900 robots just in the body shop Our battery packs are warrantied for 8 years 100 000 miles We do not expect any degredation prior to the warranty expiration Level 2 charging maximum AMP is about 45 amps using 11KW charger We do have high speed DC charging which is 470 amps using 150KW charger Battery Pack protected perfectly Cooling is built in The battery shop is led by 25 year experience engineer that came from Tesla There are eight color pallets electric white grit grey titanium silver and nightshift black Premium color Forest Service Green Municipal Yellow Petrol Blue Metallic and Town Red extremely flexible platform that will be the foundation of all future models Seasoned experienced management with more coming on board Solid orders for two years 85 retooled and 60 000 capacity by September During the zoom call with Automotive Press Association on Tuesday June 15th 2021 Lordstown President Rich Schmidt said We will sell and deliver at least 20 000 vehicles by May 2022 These are confirmed firm orders Former GM Director Global Retail amp Sales Technology John R Whitcomb joins Lordstown as Vice President Global Commercial Operations To Lead Company s Go To Market Strategy Mr Whitcomb has over 30 years of diverse global automotive experience leveraging his broad expertise in strategy business development process design operational execution and information technology to address complex transformative challenges within the auto industry Most recently he served as a Managing Director Global Automotive and Mobility at Ernst amp Young LLP where he supported global OEM client innovation and transformation initiatives and previously at General Motors as Director Global Retail amp Sales Technology where he was responsible for establishing common best practice business processes and the supporting technology for GM s global sales operations distribution network planning and analysis and retail execution areas Received FMVSS Penetration Requirements exceeded Final certification test will be early fourth quarter LORDSTOWN EXECS CONFIRM We ve never seen a broken hub motor You will break a wheel before you break a motor 
19,of95bv,t2_a0gjmebi,1625622496,/r/wallstreetbets/comments/of95bv/hopeful_nsav/,1,Hopeful NSAV,
20,of95kk,t2_9i5lnaw2,1625622519,/r/wallstreetbets/comments/of95kk/my_19k_nvda_yolo/,1,My 19k NVDA YOLO ,
21,of95lm,t2_7vz1uhvf,1625622522,/r/wallstreetbets/comments/of95lm/a_brilliant_idea_amc/,1,A Brilliant Idea AMC,I REALLY think AMC should start playing tv shows in the theaters weekly They would make bank Imagine going once a week to watch a new episode of your favorite show lounging back with popcorn and an Icee next to your boo thang AMC would pay Hulu Amazon Netflix a portion of profit for the showing rights Maybe bring back shows people would love seeing on a big screen GOT I think it would actually grow a sustainable community where people became familiar faces and looked forward to the camaraderie every week I d seriously pay a subscription or weekly admission to do this Anyhoo been dreaming of this for sometime and since no memes in AMC just idea sharing Come on AA listen up 
22,of95ru,t2_i70qd,1625622539,/r/wallstreetbets/comments/of95ru/apes_at_the_200_original_by_uanysloths/,1,Apes at the 200 original by u AnySLoths,
23,of97xk,t2_4nr702sv,1625622758,/r/wallstreetbets/comments/of97xk/how_should_i_start_investing_in_the_stock_market/,1,How should I start investing in the stock market ,I have never invested in the stock market before and I don t really know much about how to do it as well however I am super interested I just thought that this was the subreddit to ask 
24,of98z8,t2_a1b9f92f,1625622869,/r/wallstreetbets/comments/of98z8/my_yolo_amc_picks_from_months_back_still_printing/,1,My YOLO AMC picks from months back still printing Hoping to go to the moon very soon saxo trader app from Hong Kong ,
25,of998v,t2_84r4nzpq,1625622897,/r/wallstreetbets/comments/of998v/watchlist_for_772021_capitalize_off_the_pullback/,1,Watchlist For 7 7 2021 Capitalize Off The Pullback Remember Buy Low Sell High,
26,of9a5v,t2_vkbh3,1625622994,/r/wallstreetbets/comments/of9a5v/do_you_retards_have_any_other_hobbies_to_keep_you/,1,Do you retards have any other hobbies to keep you occupied when the market is closed ,My fiancee s boyfriend says she ll consider coming back to me if I Do something other than trade and jerk off all day I tried video games but they pale in comparison to the rush I get when pressing buy on Schwab fuck you Robinhood 
27,of9bfx,t2_84r4nzpq,1625623128,/r/wallstreetbets/comments/of9bfx/watchlist_for_772021_capitalize_off_the_pullback/,1,Watchlist For 7 7 2021 Capitalize Off The Pullback Remember Buy Low Sell High,
28,of9bln,t2_aa8h5lmz,1625623144,/r/wallstreetbets/comments/of9bln/i_dont_know_art_but_i_know_what_i_like/,1,I dont know art but i know what i like ,
29,of9c4g,t2_9tkdx9yr,1625623197,/r/wallstreetbets/comments/of9c4g/options_spreads/,1,Options spreads,Anybody have any good books that will cover all the ins and out of options spreads credit debit iron condor etc 
30,of9cq6,t2_fnvzb,1625623242,/r/wallstreetbets/comments/of9cq6/discoverys_david_zaslav_promises_more_media/,1,Discovery s David Zaslav promises more media merger mania at Sun Valley,
31,of9dw1,t2_7l2g4ufm,1625623354,/r/wallstreetbets/comments/of9dw1/join_to_the_new_and_growing_group/,1,Join to the new and growing Group facebook com groups stonkscartel,
32,of9elq,t2_a1gti57n,1625623429,/r/wallstreetbets/comments/of9elq/rite_aid_rad_will_join_the_party_soon_enough/,1,RITE AID RAD WILL JOIN THE PARTY SOON ENOUGH ,
33,of9fxw,t2_cobe9fxw,1625623567,/r/wallstreetbets/comments/of9fxw/gain/,1,Gain ,
34,of9gcx,t2_52jtj,1625623611,/r/wallstreetbets/comments/of9gcx/uavs/,1,UAVS,After trading this for almost a year I finally can bring it to you H O T and R E A D Y This son of a bitch left a bad taste in so many retards mouths you d think it was an elmer s glue stick Some broad related to the companies CEO at the time orchestrated the fucking pump and dump of the centuries on you dumbasses at the height of covid investors swarming into the market with their first stimmy check and promptly donating it to someone smarter After the initial pump and dump it had a few hot bullshit PRs and continued to be a fun stick to swing and day trade But during the height of the GME mess when all the support bag holders apes built during the initial pump were selling off someone established a YUGE short position Enter stage left Bonitas Research This hedge fund came in and snuck a cool sucker punch on UAVS by stating that the initial pump and dump was just that a pump and dump I m not here to debate the legitimacy of this company I m here to tell you a few pieces of a puzzle I ve put together The Bonitas research article sparked a bunch of class action suits on behalf of retards that lost money during the initial p amp d The company UAVS came out and directly stated that they plan to fight these claims in court and that gives me pause as most companies choose to keep quiet about controversial issues until fully litigated but this is a direct refutal of the claims through PR channels During the barrage of new class action suits the company acquired 2 of their suppliers and appointed a board sitting FAA Drone Regulation representative as their CEO All this to say that they have been on the NYSE s Threshold Securities list every day since June 29th indicating a substantial naked short position has been established That combined with the small float makes this a prime candidate for an A P E I N V A S I O N Do with this what you will 
35,of9gpx,t2_vo3140f,1625623651,/r/wallstreetbets/comments/of9gpx/so_glad_to_be_finally_recognized_im_in_tears/,1,so glad to be finally recognized I m in tears,
36,of9gxc,t2_8dier1wh,1625623672,/r/wallstreetbets/comments/of9gxc/50k_gain_porn_on_amc_no_im_not_selling/,1,50K Gain porn on AMC no I m not selling,
37,of9h8o,t2_xa6s5,1625623701,/r/wallstreetbets/comments/of9h8o/sofi_why_now_is_finally_time_to_buy/,1,SOFI Why now is Finally time to buy ,SOFI seems to have hit a bottom around 17 25 today and with PIPE selling exhausted is ready to move much higher and what little selling may occur from employees is a drop in the ocean compared to retail buyers considering SOFI has less than 1000 employees Cramer just included SoFI as 1 of the post merger SPACs to buy now SOFI has all buy ratings from analysts with an initial 30 price target SoFI also has one of the highest short float at around 45 which meaning many Millions of shares have to he bought to cover those short positions And with a market cap under 14B SOFI is extremely undervalued consider Robinhood going public later this summer around 40B likely to be 60B after 1st day of trading Buying SOFI anywhere near current prices will definitely be a winner going forward and if SOFI gets several days of sustained volume it is very likely to have a big run squeeze combo in the immediate future But its a definite big winner either way Not to mention a 2 for 1 deal as Galileo will be worth just as much as SOFI and an option to spin off in the Future similar to EBay amp Paypal Summary of SOFI Becoming a Fintech Behemoth Fintech is becoming the next big disruptor and Sofi is being positioned to be the real leader in this category and currently the dinosaur banks have market caps of 300B 450B etc Not only is SOFI the only internet bank with the full slate of financial products they also have Galileo for the platform Software fintech play just look at the top quality leadership team SOFI is attracting Anthony Noto as CEO CFO came from Uber person in charge of Galileo from Google etc Overview of Business SoFi acquisition of Golden Pacific will make it a national bank like JPMorgan Chase This will allow SOFI to take direct deposits amp make loans based on those deposits rather than acting as a re seller Sofi also offers Credit Cards amp recently announced it deal to offer auto loans Also theres SoFi brokerage which competes with Robinhood Then add to the mix Galileo a payments processor ie Stripe Square it bought for 1 2B Galileo dominates the Banking as a Service BaaS ecosystem Galileo offers banking platform for over 90 of all digital banks in North America Over 70 of Top100 Fintechs globally are clients including Chime and Robinhood 
38,of9ifc,t2_7ftcybr6,1625623818,/r/wallstreetbets/comments/of9ifc/clov_38_short_medicare_isnt_going_away/,1,CLOV 38 short Medicare isn t going away,I think we get her into the Russells look govt has gotten bigger the last 30nl years despite what the GOP says People are living longer and the demand for more govt Healthcare services will increase CLOV is going thru some pains right now but I believe like majority companies they re decent and trying to provide a service Let s help them out to right this ship Whether ur GOP or Dem people have paid into their Medicare and will demand it just like SS CLOV is in a great position 
39,of9j0c,t2_6mvp5fgv,1625623875,/r/wallstreetbets/comments/of9j0c/its_because_i_charged_my_phone_last_night/,1,It s because I charged my phone last night ,
40,of9j7j,t2_5b4vddp,1625623898,/r/wallstreetbets/comments/of9j7j/165k_long_capital_gains_tax/,1, 165k long capital gains tax,Was being a smooth brain and one of my covered calls got assigned I just realized 165k gains on this long position I also just realized I m going to get raped by Uncle Sam I almost forgot about the IRS underpayment fee plus interest I tried reading on the IRS site on what I need to do to minimize the penalty but again my smooth brain gave up and threw my phone against the wall Anyone have some tool or site that can help me with the next steps Like actually calculating and telling me if I should send a lump payment for 24 75k I m a moron Thanks 
41,of9kne,t2_a6kemez9,1625624042,/r/wallstreetbets/comments/of9kne/wkhs_gained_1840_but_did_not_sell_holding_until/,1,WKHS gained 1840 but did not sell Holding until next year ,
42,of9kx9,t2_98sw6058,1625624070,/r/wallstreetbets/comments/of9kx9/nvidia_today_officially_launched_cambridge1_the/,1,NVIDIA today officially launched Cambridge 1 the United Kingdoms most powerful supercomputer ,
43,of9ly5,t2_6mvp5fgv,1625624174,/r/wallstreetbets/comments/of9ly5/robinhood_problem/,1,Robinhood problem , removed 
44,of9px4,t2_40g1b9dv,1625624572,/r/wallstreetbets/comments/of9px4/sndl_stock_is_poised_for_a_rally_unrelated_to_its/,1,SNDL Stock Is Poised for a Rally Unrelated to Its Meme Status ,
45,of9rz5,t2_cxjcxq61,1625624777,/r/wallstreetbets/comments/of9rz5/tattoed_chef_now_available_on_amazon_yes_people/,1,Tattoed Chef now available on Amazon Yes people its true TTCF has 5 sku on Amazon I did check on Amazon within the last month and there was nothing My local Target had 2 windows filled with Amys 2 months later Tattoed Chef took one door from them Wake up Wallstreet ttcf is slapping you ,
46,of9s3h,t2_40g1b9dv,1625624790,/r/wallstreetbets/comments/of9s3h/sndl_stock_is_poised_for_a_rally_unrelated_to_its/,1,SNDL Stock Is Poised for a Rally Unrelated to Its Meme Status ,
47,of9s3k,t2_3mvuh5qo,1625624790,/r/wallstreetbets/comments/of9s3k/i_outdid_myself_today/,1,I out did myself today,
48,of9srk,t2_i70qd,1625624856,/r/wallstreetbets/comments/of9srk/gme_apes_at_the_200_door_credit_uanysloths/,1,GME Apes at the 200 door Credit u AnySLoths,
49,of9tba,t2_6q3a2bhf,1625624912,/r/wallstreetbets/comments/of9tba/all_aboard/,1,All aboard, removed 
50,of9vju,t2_cxujoq20,1625625138,/r/wallstreetbets/comments/of9vju/invest_now_one_of_one_michael_jordan_card/,1,INVEST NOW One Of One Michael Jordan card,
51,ofa0oe,t2_d4sjkkac,1625625666,/r/wallstreetbets/comments/ofa0oe/check_out_xela_any_thoughts_about_this_good_long/,1,Check out XELA Any thoughts about this Good long or short term and explain why ,
52,ofa11c,t2_5hu7862c,1625625703,/r/wallstreetbets/comments/ofa11c/someone_talk_me_out_of_buying_17500_worth_of_riot/,1,Someone talk me out of buying 17 500 worth of Riot and selling covered calls,Thinking im gonna buy 500 shares of Riot and sell weekly covered calls with strikes about 2 3 above current price which would net be about 750 a week in premium Thoughts 
53,ofa1g4,t2_4i6drp7s,1625625748,/r/wallstreetbets/comments/ofa1g4/take_notes_apes/,1,Take notes apes ,
54,ofa1vo,t2_d4c4w3wr,1625625792,/r/wallstreetbets/comments/ofa1vo/_/,1, ,
55,ofa2ax,t2_clx0kufw,1625625839,/r/wallstreetbets/comments/ofa2ax/sofi_diamond_s/,1,SOFI Diamond s,
56,ofa2fx,t2_5f3mr7y6,1625625854,/r/wallstreetbets/comments/ofa2fx/clne_sure_did_me_hard/,1, CLNE sure did me hard,
57,ofa6ao,t2_5hu7862c,1625626264,/r/wallstreetbets/comments/ofa6ao/someone_talk_me_out_of_buying_17500_worth_of_riot/,1,Someone talk me out of buying 17 500 worth of Riot,Thinking im gonna buy 500 shares of Riot and sell 5 weekly covered calls with strikes about 2 3 above current price which would net be around 750 a week in premium Don t care of i get assigned to sell my shares and the company has some solid price targets along with it being in a steady uptrend recently Thoughts 
58,ofa6rt,t2_45cuf8p5,1625626315,/r/wallstreetbets/comments/ofa6rt/yelly_mcbaldman_deserves_all_the_praise_for_didi/,1,Yelly McBaldman deserves all the praise for DIDI BS but what about GSxsballs and Mrgn does Stanley ,These guys promoted an IPO made 90M in fees while a dickwad Gov claims they told them not to do it Why the hell is everyone so stupid
59,ofa71t,t2_9169v3oa,1625626346,/r/wallstreetbets/comments/ofa71t/all_in_sofi_let_the_squeeze_begin/,1,ALL IN SOFI let the squeeze begin ,
60,ofa7vx,t2_5hu7862c,1625626426,/r/wallstreetbets/comments/ofa7vx/someone_talk_me_out_of_buying_17500_worth_of_riot/,1,Someone talk me out of buying 17 500 worth of Riot,Thinking im gonna buy 500 shares of Riot and sell weekly covered calls with strikes about 2 3 above current price which would net be around 750 a week in premium Don t care if i get assigned to sell my shares and the company has some solid price targets along with it being in a steady uptrend recently Thoughts 
61,ofa92i,t2_9zxf4bh3,1625626545,/r/wallstreetbets/comments/ofa92i/xela_short_squeeze_started/,1,XELA short squeeze STARTED,
