,postid,author,created_utc,permalink,score,title,selftext
69,ok8253,t2_22o0l4zg,1626280378,/r/wallstreetbets/comments/ok8253/cciv_post_merger_dip/,1, CCIV post merger dip,CCIV is expected to become LCID on July 23rd It may run up a little before that date but once it actually happens a sell off is likely Lucid is a strong company and buying the dip could be a good long term play 
70,ok82km,t2_daqcc136,1626280411,/r/wallstreetbets/comments/ok82km/sales_slip_for_purchase_this_morning/,1,Sales slip for purchase this morning ,
71,ok82kq,t2_9dgcrutm,1626280411,/r/wallstreetbets/comments/ok82kq/i_wish_i_wish/,1,I WISH I WISH,
72,ok82ma,t2_a05b7zj2,1626280414,/r/wallstreetbets/comments/ok82ma/ccl_at_2223/,1,CCL at 22 23 ,CCL was over 30 two weeks ago At 22 23 it looks like an excellent buying opportunity They have begun sailing domestically making increasing revenues and are vaccine only cruises With it s past trading range cycles once it has support it blasts off 5 10 in 2 3 weeks look at its history It is OVERSOLD 
73,ok83ds,t2_5sp3j,1626280476,/r/wallstreetbets/comments/ok83ds/truly_a_modern_day_robin_hood/,1,Truly a modern day Robin Hood ,
74,ok83fj,t2_a142rcss,1626280480,/r/wallstreetbets/comments/ok83fj/live_look_in_at_ne/,1,Live look in at ne,
75,ok83nw,t2_b4a1rxb0,1626280502,/r/wallstreetbets/comments/ok83nw/whats_the_plan_for_wish_now/,1,What s the plan for WISH now , removed 
76,ok83vf,t2_d37x7p5j,1626280520,/r/wallstreetbets/comments/ok83vf/i_am_just_very_new_to_the_topic_of_gme_i_saw_that/,1,I am just very new to the topic of GME I saw that the stock were oversold in January with more than 140 But today i saw that the Short Float is only at 14 Do you still believe that there will be a MOASS starting on this friday https finviz com quote ashx t GME,
77,ok847p,t2_6fxu1izh,1626280545,/r/wallstreetbets/comments/ok847p/the_redder_the_blackberry_the_sweeter_the_juice/,1,The redder the blackberry the sweeter the juice,Am I the only one Cost averaging down on BB Do we still like Blackberry Not financial advice I m not sure how it would be 
78,ok84bk,t2_5qoyif7x,1626280553,/r/wallstreetbets/comments/ok84bk/hal_earnings_july_20th/,1,Hal earnings July 20th,HAL Oil prices rising and should definitely see some recognition soon They ve beat the last two quarters And travel and demand has been up HAL just took a nice dip 21 50c option for the 23rd with low iv Earnings the 20th and they gotta be better from quarter before and year over year with all the shutdowns I m thinking easy money Should see a decent Run up coming within the next week or so Should be a solid play Tell me what you guys think TLDR 15x 21 50c July 23 also 150 shares at 21 60 https www google com amp s finance yahoo com amphtml news halliburton hal earnings expected grow 190007270 html
79,ok84lb,t2_a0t3uz0v,1626280574,/r/wallstreetbets/comments/ok84lb/all_in_nio/,1,All in NIO, removed 
80,ok84zs,t2_a0t3uz0v,1626280604,/r/wallstreetbets/comments/ok84zs/time_for_all_in_nio/,1,Time for all in NIO, removed 
81,ok85u5,t2_7x84kl6t,1626280674,/r/wallstreetbets/comments/ok85u5/ac_stocks_falling_with_boarders_opening_july_23rd/,1,Ac stocks falling with boarders opening july 23rd , removed 
82,ok86ol,t2_7x84kl6t,1626280742,/r/wallstreetbets/comments/ok86ol/ac_stocks_falling_boarders_for_usa_opening_july/,1,Ac stocks falling Boarders for usa opening july 23rd lets get this stock to the moon , removed 
83,ok86yy,t2_22o0l4zg,1626280767,/r/wallstreetbets/comments/ok86yy/cciv_postmerger_dip/,1,CCIV Post Merger Dip, CCIV is expected to become LCID on July 23rd It may run up a little before that date but once it actually happens a sell off is likely Lucid is a strong company and buying the dip could be a good long term play Their prototypes are in the very late stages and they re saying they ll start delivering as soon as next summer They re the first Tesla competitor that has a real chance NIO is cheaply made Chinese dogshit and WKHS has a stupid name and ugly cars Currently in CCIV 10 15 40c Idk how long a post has to be to not get deleted for being too short but my last one did so ima just add a little more text at the bottom
84,ok87cc,t2_ak3y7q2m,1626280800,/r/wallstreetbets/comments/ok87cc/im_so_happy_maxine_waters_is_commenting_on/,1,I m so happy Maxine Waters is commenting on economic policy it gives me confidence in the world ,
85,ok886n,t2_wnqdu,1626280866,/r/wallstreetbets/comments/ok886n/guh/,1,GUH,
86,ok88bj,t2_22o0l4zg,1626280876,/r/wallstreetbets/comments/ok88bj/churchill_capital_postmerger_dip/,1,Churchill Capital Post Merger Dip, Churchill Capital is expected to become LCID on July 23rd It may run up a little before that date but once it actually happens a sell off is likely Lucid is a strong company and buying the dip could be a good long term play Their prototypes are in the very late stages and they re saying they ll start delivering as soon as next summer They re the first Tesla competitor that has a real chance NIO is cheaply made Chinese dogshit and WKHS has a stupid name and ugly cars Currently in 10 15 40c Idk how long a post has to be to not get deleted for being too short but my last one did so ima just add a little more text at the bottom
87,ok89dd,t2_a1w3x5v9,1626280957,/r/wallstreetbets/comments/ok89dd/amc_panic_attack/,1,AMC panic attack, removed 
88,ok89h5,t2_wnqdu,1626280967,/r/wallstreetbets/comments/ok89h5/guh/,1,GUH,
89,ok8a3u,t2_86nn2izd,1626281019,/r/wallstreetbets/comments/ok8a3u/amc_has_taken_a_drastic_drop_looks_like_a_great/,1,AMC has taken a drastic drop Looks like a great opportunity to buy more Who is with me , removed 
90,ok8aet,t2_9dgcrutm,1626281042,/r/wallstreetbets/comments/ok8aet/i_wish_i_wish_with_all_my_heart/,1,I WISH I WISH WITH ALL MY HEART,
91,ok8ajz,t2_a1hw8372,1626281053,/r/wallstreetbets/comments/ok8ajz/dragon_on_fly/,1,Dragon on fly,
92,ok8aua,t2_cl5h4b1n,1626281076,/r/wallstreetbets/comments/ok8aua/tell_me_youre_dumb_without_telling_me_youre_dumb/,1,tell me youre dumb without telling me youre dumb,
93,ok8awz,t2_6q1gb,1626281081,/r/wallstreetbets/comments/ok8awz/companies_invested_in_desalination_tech/,1,Companies invested in desalination tech ,With so many areas increasingly facing fresh water shortages I was wonder which publicly traded companies are investing in desalination technology https en wikipedia org wiki Desalination
94,ok8caj,t2_1zl5jlg5,1626281195,/r/wallstreetbets/comments/ok8caj/nok_no_dd_no_plan_just_an_ape_going_back_to/,1, NOK No DD No plan Just an ape going back to simpler times I like the stock,
95,ok8ddt,t2_cenp15yj,1626281288,/r/wallstreetbets/comments/ok8ddt/oatly_accused_of_overstating_revenue_and/,1,Oatly accused of overstating revenue and greenwashing by activist short Spruce Point,
96,ok8e7x,t2_mf4m4,1626281359,/r/wallstreetbets/comments/ok8e7x/not_to_mention_the_bunch_of_feces_throwing_banana/,1,Not to mention the bunch of feces throwing banana inserting friends you made along the way ,
97,ok8e8p,t2_cenp15yj,1626281361,/r/wallstreetbets/comments/ok8e8p/oatly_accused_of_overstating_revenue_and/,1,Oatly accused of overstating revenue and greenwashing by activist short Spruce Point,
98,ok8emx,t2_a1613se9,1626281393,/r/wallstreetbets/comments/ok8emx/chad_move_incoming/,1,chad move incoming,
99,ok8fny,t2_8ov1x65q,1626281475,/r/wallstreetbets/comments/ok8fny/mm_just_destroy_small_traders/,1,MM just destroy small traders ,
0,ok8fny,t2_8ov1x65q,1626281475,/r/wallstreetbets/comments/ok8fny/mm_just_destroy_small_traders/,1,MM just destroy small traders ,
1,ok8g2b,t2_bi4xl00r,1626281508,/r/wallstreetbets/comments/ok8g2b/roadmap_for_wish_buckle_up_after_july_16_we_fly/,1,Roadmap for Wish buckle up after July 16 we fly,
2,ok8gkr,t2_7qkr5atu,1626281551,/r/wallstreetbets/comments/ok8gkr/whats_going_on_with_amd_up_400_in_a_week_unusual/,1,What s going on with AMD Up 4 00 in a week Unusual options activity putting it sub 90 00 by the 16th ,How do these wizards know AMD is suddenly going down Record breaking profits earnings soon But it s going back below 90 00 by the 16th Why does this smell funny 
3,ok8gsi,t2_bi4xl00r,1626281568,/r/wallstreetbets/comments/ok8gsi/roadmap_for_wish_using_elliot_wave_ta_after_july/,1,Roadmap for Wish using Elliot wave TA after July 16 we fly,
4,ok8hge,t2_a1zpk4jo,1626281619,/r/wallstreetbets/comments/ok8hge/yolo_sos_clov_to_the_moon_strong_hodl/,1,Yolo Sos clov to the moon Strong hodl,
5,ok8hl0,t2_a2hoe5h8,1626281628,/r/wallstreetbets/comments/ok8hl0/take_this_hegies_my_life_is_shit_anyway/,1,Take this hegies My life is shit anyway ,
6,ok8ipi,t2_7anhnosh,1626281723,/r/wallstreetbets/comments/ok8ipi/in_june_advance_energy_share_price_increased_by/,1,In June Advance Energy share price increased by 11 With a higher demand on power delivery despite pandemic constraints the fundamentals are there to make this a value buy and hold company ,
7,ok8jy2,t2_6hyx16re,1626281831,/r/wallstreetbets/comments/ok8jy2/am_i_a_silverback/,1,Am I a silverback ,To answer you may need the quick backstory In May my 24 year old son alerted me to an investment opportunity I being the fifty something older wiser investor had one eyebrow lifted as I checked out yet another hot stock tip from my occasionally impulsive son I usually do some quick research and say no thanks but AMC grabbed my attention What is this Apes diamond hands MOASS I was learning all kinds of new terms and I ve been in the game a while The more I read the DD s laughed at the Meme wars and learned how to watch out for shills new to me too I got more interested It took me about 48 hrs to get interested enough to throw some of my retirement money on the table In that time the stock had nearly doubled Still my investment quadrupled at it s peak over the next month and I can t believe it s been less than two months total for me what a rollercoaster ride I now laugh at the FUD as I ve seen two significant drops in that short time frame From my perspective the AMC support community is incredible and a game changer I m not na ve enough to think that apes are just a bunch of philanthropists trying to support brick and mortar theaters Nope Apes want to make money I just see the cohesion the passion and the commitment to hold the hedgies to account for their negativity and short game That s the kind of resolve that can make things happen and affect change real change And hey if we all make a few bucks along the way even better I haven s sold and I ve actually been buying the dips I m trying to earn my diamond hands https preview redd it svixif00l7b71 jpg width 300 amp format pjpg amp auto webp amp s f80012e468454ac594dbb0fbb216cc2876c6330f So back to my original question am I a silverback maybe a rookie silverback My argument is that I m now in the ape community and what hair that s left on my head is mostly silver that s it Whatever I m called I m enjoying this bridging of the generations in the age of meme stocks and this quest for the MOASS Keep spreading the word don t give into your own fears and go recruit some new silverbacks We have plenty of bananas to contribute to the cause I m off to buy some crayons and probably a few more shares today 
8,ok8kuy,t2_a155wsib,1626281911,/r/wallstreetbets/comments/ok8kuy/no_one_is_selling_but_thank_you_for_letting_us/,1,No one is Selling but thank you for letting us know snakes ,
9,ok8l0l,t2_yf7qiz,1626281923,/r/wallstreetbets/comments/ok8l0l/its_ok_tlry/,1,It s ok TLRY ,
10,ok8l8y,t2_cm1rllng,1626281944,/r/wallstreetbets/comments/ok8l8y/scr/,1,SCR , removed 
11,ok8lq1,t2_aum3pokz,1626281985,/r/wallstreetbets/comments/ok8lq1/verb/,1,VERB , removed 
12,ok8m6u,t2_cm1rllng,1626282019,/r/wallstreetbets/comments/ok8m6u/scr/,1,SCR , removed 
13,ok8msc,t2_110l4z,1626282059,/r/wallstreetbets/comments/ok8msc/snow_is_rocket_all_in_baby/,1,SNOW is rocket All in baby,So snow just went on a recent downturn meaning we can just do what we always do and push everything inside 
14,ok8mzg,t2_amzw3xbw,1626282075,/r/wallstreetbets/comments/ok8mzg/bots_much/,1,BOTs Much , removed 
15,ok8nqi,t2_amzw3xbw,1626282131,/r/wallstreetbets/comments/ok8nqi/bots_much/,2,BOTS Much ,
16,ok8oiq,t2_n24njx3,1626282194,/r/wallstreetbets/comments/ok8oiq/found_something_today/,1,Found something today,
17,ok8ol0,t2_9rskdbav,1626282199,/r/wallstreetbets/comments/ok8ol0/clov/,1, CLOV ,
18,ok8ou1,t2_27cznvx5,1626282219,/r/wallstreetbets/comments/ok8ou1/verb/,1,VERB , removed 
19,ok8pa7,t2_amzw3xbw,1626282253,/r/wallstreetbets/comments/ok8pa7/bots_much/,1,BOTS Much ,
20,ok8q4f,t2_13xsx1my,1626282318,/r/wallstreetbets/comments/ok8q4f/gme_how_some_people_choose_investments_with_their/,1,GME How some people choose investments with their emotions instead of their brain, Reddit 3 month old 3 Month ago I made a comment on a GME post I am a specialist in technical analysis and already weathered through 3 financial bubbles just to underline how old I am At that time I was sincerely concerned for so many redditors invested in GME that I decided to warn of the serious financial risk for those holding or still purchasing GME stock From an economical point of view and especially the technical picture which is my speciality the stock was not reflecting reality price was way too overstated and still is I listed the arguments in favor of my opinion and unfortunately I was down voted 55 times and eventually received some negative comments Which I do not care at all but was sad that no one picked how serious I was The reason I make this post is to warn again about the risks because the price is still way to high according to the balance sheet But again most importantly the technical picture is worsening because the price closed below major support on Weekly daily and 4 hours chart This condition is rare and screams for attention professional traders and technicians will jump on the opportunity because there is no other major support until 110 3 Please read my old post post https www reddit com r wallstreetbets comments mq0c0d gme megathread for april 13 2021 gudczsh utm medium android app amp utm source share amp context 3 
21,ok8qdw,t2_appwxf31,1626282336,/r/wallstreetbets/comments/ok8qdw/making_on_amc_stock/,1, making on amc stock, removed 
22,ok8qfn,t2_58zwiarp,1626282340,/r/wallstreetbets/comments/ok8qfn/1_week_update_amd_90k_yolo_still_selling_calls/,1,1 WEEK UPDATE AMD 90K YOLO Still selling calls against the shares to collect premium because AMD is trading sideways ,
23,ok8r98,t2_10w02k,1626282406,/r/wallstreetbets/comments/ok8r98/youre_welcome_everyone_i_sold_some_amc_and/,1,You re welcome everyone I sold some AMC and triggered the run up ,Sold 20 of my position at basically the bottom today and within 15 minutes this run up began Typical 
24,ok8rre,t2_8g6fnb4k,1626282447,/r/wallstreetbets/comments/ok8rre/spce_short_sellers_alert/,1,SPCE Short Sellers alert,SPCE has been gaining a lot of attention on wall st as shorts increase their positions on this marvelous company How dare they do that when Virgin Galactic recently made history for mankind by sending SRB to space Let s punish these greedy people To SPCE 
25,ok8s1x,t2_a1ucggay,1626282473,/r/wallstreetbets/comments/ok8s1x/spce_to_1500_strap_up_bransons_slap_to_his_share/,1,SPCE To 15 00 Strap up Branson s slap to his share holders was the last straw You bought the news still time to get a refund ,
26,ok8sb4,t2_a4coehlf,1626282494,/r/wallstreetbets/comments/ok8sb4/blackberrys_goals_they_want_to_connect_entire/,1,Blackberry s goals they want to connect entire cities as they show in this pic ,
27,ok8t77,t2_a4coehlf,1626282563,/r/wallstreetbets/comments/ok8t77/blackberry_goal_to_connect_entire_cities_this_is/,1,blackberry goal to connect entire cities this is gonna be huge ,
28,ok8tdi,t2_a43wt6d1,1626282577,/r/wallstreetbets/comments/ok8tdi/flgt_tanking_for_no_reason_and_probably_the_best/,1,FLGT Tanking for no reason and probably the best stock with a purpose for the entire world ,This stock should be up crazy today and for the months and quarters to come It s probably the best stock that serves the purpose of the country and the world for that matter Forget politics What they do is save lives in a big way We all should be investing in them and proud to do it It s a relative little guy with a big purpose The shorts are dominating today We need to change that and show them that a company like this deserves our attention Let s do it 
29,ok8uyk,t2_a05b7zj2,1626282706,/r/wallstreetbets/comments/ok8uyk/time_to_consider_ccl/,1,Time to consider CCL ,
30,ok8uzv,t2_avq65so3,1626282709,/r/wallstreetbets/comments/ok8uzv/sold_my_entire_spce_position_at_4613_at_a_2485/,1,Sold my entire SPCE position at 46 13 at a 24 85 average,
31,ok8v6f,t2_a47ld4ft,1626282725,/r/wallstreetbets/comments/ok8v6f/the_new_york_times_in_a_milestone_schumer_will/,1,The New York Times In a milestone Schumer will propose federal marijuana legalization ,
32,ok8vbo,t2_8umw0zdj,1626282736,/r/wallstreetbets/comments/ok8vbo/stop_trading_meme_stocks_they_said_aim_for_slow/,1,Stop trading meme stocks they said aim for slow steady growth they said ,
33,ok8vfw,t2_cwe2w47s,1626282746,/r/wallstreetbets/comments/ok8vfw/cruise_lines_still_way_down_below_pre_covid19/,1,Cruise lines Still way down below pre COVID 19 levels,
34,ok8vhz,t2_gb8r3,1626282750,/r/wallstreetbets/comments/ok8vhz/coca_cola_fds/,1,Coca Cola FDs,
35,ok8vpf,t2_4bkij3un,1626282768,/r/wallstreetbets/comments/ok8vpf/join_me_for_our_weekly_reunion_at_ba_bagholders/,1,Join me for our weekly reunion at BA Bagholders Anonymous , removed 
36,ok8w67,t2_cnuz7xnd,1626282805,/r/wallstreetbets/comments/ok8w67/let_us_hit_xela_to_the_fcking_moon/,1,Let us hit XELA to the fcking moon , removed 
37,ok8wk6,t2_4qd4j33l,1626282838,/r/wallstreetbets/comments/ok8wk6/amc_im_confident_if_we_recount_all_the_shares/,1, AMC I m confident if we recount all the shares again Tomorrow we will have more than 85 from 80 Free float after today s discount We are even stronger than ever before Apes together , removed 
