,postid,author,created_utc,permalink,score,title,selftext
80,ofq642,t2_8h64kflu,1625686076,/r/wallstreetbets/comments/ofq642/rkt_you_potassium_deficient_apes/,1, RKT You potassium deficient apes ,I haven t gotten laid in three days so I m not in the mood of anyone s bullshit With that out of the way let s get down to business I m in no way a hater of meme stocks and I happen to own plenty of Clover Sofi etc because I believe in the companies that I m investing in What pisses me off is the utter neglect of RKT while you apes are loading up on complete bullshit companies like Wish cow farts etc There s plenty of good DD on here if you ape brains are able to find the search bar but allow me to give you a couple of highlights 1 Q1 2021 4 6B in revenue 236 YOY increase 2 90 customer retention rate 3 RKT enjoys approx 10 of a 3 5T consumer lending market 4 Recently launched Rocket homes Rocket Auto etc Both of these have massive potential Zillow anyone Now let s get into the bullshit FUD that has been keeping this stock near its IPO price Housing bubble blah blah you ve been watching too many YouTube videos Yes housing prices have been going up but you have to look deeper and you ll see that s its because of the pandemic and more people are working remotely making this a opportune time to move to the suburbs etc The 2008 housing crisis was a direct result of subprime mortgages but there s none of that these days Speak to anyone applying for a mortgage and they ll tell you that banks are very strict these days and qualifying for a mortgage has never been more tedious Housing market is cooling off but May s pending home sales were up 8 vs a negative number expected Rockets CEO projected lower gain on sale margins on the conference call because he believed at the time that the yield on treasuries will rise in Q2 due to all the inflation talk but that hasn t happened If you are lazy to check the yield on the 10 year is 1 32 which is far lower than anyone expected Bottom line is you have a company that is severely undervalued and this stock will be 60 in the not so distant future and you ll be kicking yourself for not pulling the trigger below 20 Oh did I mention anything about the 1B pending stock buy back Position 15x 25 89C 1 21 22 Tldr RKT CEO is not a little bitch unlike the other mortgage provider Obligatory Not financial advice I m certified retarded 
81,ofq6a6,t2_5aebjkeg,1625686090,/r/wallstreetbets/comments/ofq6a6/negg_pt_2_babyy/,1, NEGG PT 2 BABYY,
82,ofq6fq,t2_b3756bny,1625686101,/r/wallstreetbets/comments/ofq6fq/negg_yolo_closed_position/,1, NEGG yolo closed position,
83,ofq6qu,t2_cpvp47j4,1625686128,/r/wallstreetbets/comments/ofq6qu/well_wlyyf_healthcare_is_going_remote_and_well_is/,1, WELL WLYYF Healthcare is going remote and WELL is ready to step in and build a winner , removed 
84,ofq71m,t2_aglolmp9,1625686155,/r/wallstreetbets/comments/ofq71m/hold/,1,Hold , removed 
85,ofq7rq,t2_aglolmp9,1625686212,/r/wallstreetbets/comments/ofq7rq/holdddddd/,1,HOLDDDDDD, removed 
86,ofq82h,t2_5rvcquzb,1625686236,/r/wallstreetbets/comments/ofq82h/my_stonks_to_watch_after_reading_wsb_for_a_week/,1,My stonks to watch after reading wsb for a week why is yolo not goin up errbody is in em,
87,ofq8om,t2_3ydyh3ey,1625686291,/r/wallstreetbets/comments/ofq8om/160k_into_c3ai_someone_pray_for_me/,1,160k into C3AI Someone pray for me ,
88,ofq8u2,t2_8feufh2t,1625686303,/r/wallstreetbets/comments/ofq8u2/i_declare_bankruptcy/,1,I DECLARE BANKRUPTCY ,
89,ofq8zm,t2_c3yma,1625686316,/r/wallstreetbets/comments/ofq8zm/i_cant_be_the_only_one_this_happens_to/,1,I can t be the only one this happens to,
90,ofq8zz,t2_9ecbp0ni,1625686317,/r/wallstreetbets/comments/ofq8zz/can_we_all_buy_500_shares_of_sndl_and_see_what/,1,Can we all buy 500 shares of sndl and see what happens Maybe it will go up Maybe it won t , removed 
91,ofqatl,t2_86da3zik,1625686476,/r/wallstreetbets/comments/ofqatl/where_are_you_trading_options/,1,Where are you trading options ,
92,ofqbrd,t2_at8l7wzs,1625686553,/r/wallstreetbets/comments/ofqbrd/hodl/,1,Hodl,What we say to the sell button Not today 
93,ofqbwq,t2_6o49rbt9,1625686565,/r/wallstreetbets/comments/ofqbwq/wtf/,1,WTF ,
94,ofqbzb,t2_a2satf39,1625686572,/r/wallstreetbets/comments/ofqbzb/dfv_is_going_short_on_another_good_company/,1,DFV is going short on another good company,Nel ASA a company from Norway is another poor company where DFV is aiming for Helikon Investment and Capital actually have a huge amount in short WSB should squeeze them 
95,ofqcct,t2_4m1y2gxx,1625686601,/r/wallstreetbets/comments/ofqcct/aight_stock_market_0_wallstreetbets_1_gamestop/,1,Aight Stock Market 0 wallstreetbets 1 GameStop was just the first on the roster that I know of What s Reddit gonna crash now ,
96,ofqczu,t2_9itlf2w7,1625686655,/r/wallstreetbets/comments/ofqczu/q_since_enabling_margin_trading_i_keep/,1,Q Since enabling margin trading I keep accidentally paying interest How can I show a cash balance AND a margin balance at the same time ,
97,ofqdf3,t2_4msipsra,1625686689,/r/wallstreetbets/comments/ofqdf3/vmnt_have_done_enough_dd_to_now_be_fully/,1, VMNT Have done enough DD to now be fully convinced in the future of this company Launching the only fully auditable and regulated stablecoin very soon And there s so much more in the works Let s see how far she goes ,
98,ofqdg0,t2_16fpc1,1625686691,/r/wallstreetbets/comments/ofqdg0/well_wlyyf_healthcare_is_going_remote_and_well_is/,1, WELL WLYYF Healthcare is going remote and WELL is ready to step in and build a winner ,Was looking through some medical stocks a while ago and stumbled upon what looks like a serious gem Had to put this together to share with the rest of you gamblers The pandemic made doctors and patients alike realize that a significant portion of their diagnostic appointments could be done remotely saving time and money for everyone Did some more reading and it looks like WELL is already becoming an empire in their industry They re the largest clinic provider in Canada and they re a top 2 telehealth provider Along with their expansion in Canada they ve been buying up companies like crazy to break into the US and they re getting ready for a NASDAQ IPO in Q4 with one of the biggest names in Wall Street legal firms Fenwick amp West How are they doing financially They re pulling up on 500M in Revenue and 100M in EBITDA and they ve got half a billion in rock solid credit lines which they ve put towards their aggressive acquisitions and expansions What blows my mind as well is that their recent cap raises all happened above the current stock price at 9 80 so they re well positioned to buy back at a profit if they have to but they won t because this stock is not gonna be this cheap for long Oh and for the real junkies out there it s also sitting on 20 short interest This article sums it up better than I can If you want a serious long term growth opportunity you have to take a look at this https www fool ca 2021 07 06 well health vs cloudmd which tsx growth stock should you buy right now 
99,ofqdu7,t2_aa03bh87,1625686725,/r/wallstreetbets/comments/ofqdu7/can_we_all_just_get_back_to_the_basics_and_plug/,1,Can we all just get back to the basics and plug GME and AMC and WISH lol, removed 
0,ofqdu7,t2_aa03bh87,1625686725,/r/wallstreetbets/comments/ofqdu7/can_we_all_just_get_back_to_the_basics_and_plug/,1,Can we all just get back to the basics and plug GME and AMC and WISH lol, removed 
1,ofqf50,t2_6f8b93dc,1625686835,/r/wallstreetbets/comments/ofqf50/negg_to_the_moon/,1,Negg to the moon, removed 
2,ofqfvi,t2_3az2vjt1,1625686896,/r/wallstreetbets/comments/ofqfvi/webull_just_sold_off_a_bunch_of_my_positions/,1,Webull just sold off a bunch of my positions without authorization ,
3,ofqh34,t2_9ztmk9da,1625687000,/r/wallstreetbets/comments/ofqh34/why_is_palantir_being_manipulated_so_much/,1,Why is palantir being manipulated so much ,So palantir has been around for 17yrs or so and there litterally has been no negative news but has dropped from 45 down to 18 xx then back up to 27 38 now dropping like a rock on no news What s the deal Why is it being manipulated so much It s really not a meme stock It s a legit rapidly growing business Anyone know what s up I m in it for the next 7 10yrs so I am sure I m going to be just fine on the investment but seriously WTF 
4,ofqheb,t2_2acukggw,1625687029,/r/wallstreetbets/comments/ofqheb/was_looking_at_this_was_wondering_what_news/,1,Was looking at this was wondering what news dropped about it Is it gonna be worth it in the long haul ,
5,ofqhhw,t2_a0xl4y0n,1625687039,/r/wallstreetbets/comments/ofqhhw/down_big_on_options_trading_im_definitely_doing/,1,Down big on options trading I m definitely doing it wrong ,
6,ofqhlr,t2_8yi679j5,1625687048,/r/wallstreetbets/comments/ofqhlr/lets_all_come_together_not_like_that_weirdo/,1,Let s all come together not like that weirdo ,We need to come together and choose one stock to get shorts Theres 10mil people here and y all just pushing buttons like damn monkeys Be the apes you re destined to be One stock at a time and just wreck it We did it with gamestop half assed it on amc now what Someone needs to find a beauty and stick it in I m not talking about blabbing about whatever stock your down in to try get a pump We need to find and agree on the next on and ride that shit till the wheels fall off NASA put a monkey in space now we need reddit to take apes to the moon 
7,ofqi6r,t2_11ss36,1625687098,/r/wallstreetbets/comments/ofqi6r/this_is_the_look_your_old_ladies_gunna_give_me/,1,This is the look your old ladies gunna give me when BB hits 70 Every women loves a BBC and I have 1000s of BlackBerry Calls ready to skeet ,
8,ofqjp1,t2_fu1rg,1625687228,/r/wallstreetbets/comments/ofqjp1/gme_dipped_bcuz_profit_taking/,1, GME DipPeD bCuz pRoFiT tAkiNg ,
9,ofqjqg,t2_a0tmwpyg,1625687231,/r/wallstreetbets/comments/ofqjqg/btzi/,1,BTZI, removed 
10,ofqkaq,t2_548shwad,1625687278,/r/wallstreetbets/comments/ofqkaq/sndl_about_to_pull_a_negg_i_put_my_money_where_my/,1, SNDL about to pull a NEGG I put my money where my mouth is ,
11,ofqkhe,t2_8f6rqvzd,1625687292,/r/wallstreetbets/comments/ofqkhe/listen_i_like_the_stock_ok/,1,LISTEN I LIKE THE STOCK OK,
12,ofqkyr,t2_d5vlq4cp,1625687334,/r/wallstreetbets/comments/ofqkyr/ive_got_40k_to_yolowhat_all_wanna_see/,1,I ve got 40k to YOLO what all wanna see , removed 
13,ofql9c,t2_5rt57ux9,1625687359,/r/wallstreetbets/comments/ofql9c/gttn_needs_the_support_gme_was_given/,1,GTTN needs the support GME was given , removed 
14,ofqln7,t2_3az2vjt1,1625687391,/r/wallstreetbets/comments/ofqln7/webull_just_sold_off_some_of_my_positions_without/,1,Webull just sold off some of my positions without authorization,
15,ofqlrr,t2_hp06j,1625687403,/r/wallstreetbets/comments/ofqlrr/turned_101_into_2600_by_going_all_in_on_spy/,1,Turned 101 into 2600 by going all in on SPY dailies and weeklies several times over the last week ,
16,ofqm77,t2_6n8yz74h,1625687439,/r/wallstreetbets/comments/ofqm77/gbox_grennbox_pos_to_the_moon/,1,GBOX GrennBox POS to the MOON, removed 
17,ofqnhy,t2_8f6rqvzd,1625687544,/r/wallstreetbets/comments/ofqnhy/its_not_a_loss_if_i_dont_sell_clov/,1,IT S NOT A LOSS IF I DON T SELL CLOV ,
18,ofqnuo,t2_97wdn,1625687571,/r/wallstreetbets/comments/ofqnuo/is_it_ironic_that_the_weed_stock_is_about_the/,1,Is it ironic that the weed stock is about the only green in my portfolio ,
19,ofqo8a,t2_mpfx3,1625687604,/r/wallstreetbets/comments/ofqo8a/ipw_ipower_the_hydroponic_stock_no_one_knows/,1,IPW iPower the Hydroponic stock no one knows about up 30 today,iPower is a hydroponic equipment selling company that is currently up 30 today It is in the same industry as GRWG and AGFY both companies that have done fairly well with the boom in hydroponics IPW is already profitable and looks like its well positioned to increase their revenue and profits I would check this and AGFY out as they are both strong companies that are in the hydroponic industry 
20,ofqp1g,t2_8k3xidy7,1625687675,/r/wallstreetbets/comments/ofqp1g/cant_believe_i_bought_wish_at_nearly_14_was/,1,Cant believe I bought WISH at nearly 14 Was planning on selling 20 Welp patiently waiting on the rise ,
21,ofqp8g,t2_5rt57ux9,1625687690,/r/wallstreetbets/comments/ofqp8g/gttn_is_a_company_in_need_of_support_like_gme_was/,1,GTTN is a company in need of support like GME was given ,This company is a strong one fell behind on some paper work stuff and now the employees themselves will be out of bonds and shares empty handed I feel if the support that was given to GME could be given here it would be a great financial decision for a lot of people Back in 2018 trading for around 68 now it s less than 1 I know penny stocks are not ok here but this company I feel just needs a boost in morale from the good guys 
22,ofqp9w,t2_a5r20i7d,1625687693,/r/wallstreetbets/comments/ofqp9w/a_tesla_bull_says_lidar_stocks_are_ready_to_rally/,1,A Tesla Bull Says Lidar Stocks Are Ready to Rally lazr,
23,ofqpjt,t2_7xtq7q8w,1625687717,/r/wallstreetbets/comments/ofqpjt/wish_is_it_dead_sitting_on_large_loss_thoughts/,1,WISH is it dead Sitting on large loss Thoughts , removed 
24,ofqpkx,t2_60skn8yp,1625687719,/r/wallstreetbets/comments/ofqpkx/the_look_of_determination/,1,The look of determination ,
25,ofqq49,t2_a0tmwpyg,1625687765,/r/wallstreetbets/comments/ofqq49/btzi/,1,BTZI,Does anybody know about this stock Looking for some opinions seems to have gained some legs today with its news 
26,ofqqfh,t2_5w0x7flj,1625687793,/r/wallstreetbets/comments/ofqqfh/china_number_1/,1,China number 1,
27,ofqqhn,t2_mpfx3,1625687798,/r/wallstreetbets/comments/ofqqhn/ipw_ipower_the_hydroponic_stock_no_one_knows/,1,IPW iPower the Hydroponic stock no one knows about up 30 today,iPower is a hydroponic equipment selling company that is currently up 30 today It is in the same industry as GRWG and AGFY both companies that have done fairly well with the boom in hydroponics IPW is already profitable and looks like its well positioned to increase their revenue and profits I would check this and AGFY out as they are both strong companies that are in the hydroponic industry The company sells multiple products to enable customers to grow vegetables fruits flowers and other things such as CANNABIS It also sells its products at amazon walmart and ebay 
28,ofqr99,t2_cp8fzykr,1625687866,/r/wallstreetbets/comments/ofqr99/energy_fuels_uuuu_this_could_come_back_from_the/,1,Energy Fuels UUUU This could come back from the bottom of the rare earth has a significant impact on the marketplace ,
29,ofqre9,t2_5rt57ux9,1625687876,/r/wallstreetbets/comments/ofqre9/gttn_just_needs_a_little_support_like_gme/,1,GTTN just needs a little support like GME,This company is a strong one fell behind on some paper work stuff and now the employees themselves will be out of bonds and shares empty handed I feel if the support that was given to GME could be given here it would be a great financial decision for a lot of people Back in 2018 trading for around 68 now it s less than 1 I know penny stocks are not ok here but this company I feel just needs a boost in morale from the good guys Don t let the hedgies ruin these peoples lives Don t let them win we can beat these ugly bastards and help a company push through a hard time and away from the egde of the cliff 
30,ofqrh4,t2_cqwpjmqs,1625687883,/r/wallstreetbets/comments/ofqrh4/viac_looks_promising/,1,VIAC looks promising, removed 
31,ofqrv9,t2_axssaxrd,1625687914,/r/wallstreetbets/comments/ofqrv9/everyone_seems_to_be_sleeping_on_fuv_the_short/,1,Everyone seems to be sleeping on FUV The Short borrowing rate is above 35 ,
32,ofqsnx,t2_69vnt3m0,1625687986,/r/wallstreetbets/comments/ofqsnx/everybody_xela_is_the_next_big_stock_invest_while/,1,EVERYBODY XELA IS THE NEXT BIG STOCK INVEST WHILE YOU STILL CAN,
33,ofqt00,t2_bd6q5,1625688011,/r/wallstreetbets/comments/ofqt00/what_are_your_moves_tomorrow_july_08_2021/,1,What Are Your Moves Tomorrow July 08 2021,Your daily trading discussion thread Please keep the shitposting to a minimum Navigate WSB We recommend best daily DD DD All https reddit com r wallstreetbets search sort new amp restrict sr on amp q flair 3ADD Best Daily https www reddit com r wallstreetbets search sort top amp q flair 3ADD amp restrict sr on amp t day Best Weekly https www reddit com r wallstreetbets search sort top amp q flair 3ADD amp restrict sr on amp t week Discussion All https reddit com r wallstreetbets search sort new amp restrict sr on amp q flair 3ADiscussion Best Daily https www reddit com r wallstreetbets search sort top amp q flair 3ADiscussion amp restrict sr on amp t day Best Weekly https www reddit com r wallstreetbets search sort top amp q flair 3ADiscussion amp restrict sr on amp t week YOLO All https reddit com r wallstreetbets search sort new amp restrict sr on amp q flair 3AYOLO Best Daily https www reddit com r wallstreetbets search sort top amp q flair 3AYOLO amp restrict sr on amp t day Best Weekly https www reddit com r wallstreetbets search sort top amp q flair 3AYOLO amp restrict sr on amp t week Gain All https reddit com r wallstreetbets search sort new amp restrict sr on amp q flair 3AGain Best Daily https www reddit com r wallstreetbets search sort top amp q flair 3AGain amp restrict sr on amp t day Best Weekly https www reddit com r wallstreetbets search sort top amp q flair 3AGain amp restrict sr on amp t week Loss All https reddit com r wallstreetbets search sort new amp restrict sr on amp q flair 3ALoss Best Daily https www reddit com r wallstreetbets search sort top amp q flair 3ALoss amp restrict sr on amp t day Best Weekly https www reddit com r wallstreetbets search sort top amp q flair 3ALoss amp restrict sr on amp t week Weekly Earnings Discussion Thread https www reddit com r wallstreetbets search sort new amp restrict sr on amp q flair 3A 22Earnings 20Thread 22 Read the rules https www reddit com r wallstreetbets wiki contentguide and make sure other people follow them Try No Meme Mode https www reddit com r wallstreetbets search q flair 3AMeme 20 flair 3ASatire 20 flair 3AShitpost amp restrict sr 1 amp t day amp sort hot also accessible through the top bar Follow Official WSB https twitter com Official WSB on Twitter all other accounts are impersonators Check out our Discord https discord gg wallstreetbets 
34,ofqt1d,t2_a3ryiupi,1625688011,/r/wallstreetbets/comments/ofqt1d/negg_played_very_well/,1, Negg played very well,
35,ofqt72,,1625688020,/r/wallstreetbets/comments/ofqt72/still_ramen_for_dinner_because_wish_not_in_the/,1,Still Ramen for dinner because WISH not in the moon yet , deleted 
36,ofqts2,t2_ab3fecmn,1625688069,/r/wallstreetbets/comments/ofqts2/this_is_such_a_joke_the_momentum_and_enthusiasm/,1,This is such a joke The momentum and enthusiasm is fading Says who ,
37,ofqts3,t2_ck586jij,1625688069,/r/wallstreetbets/comments/ofqts3/still_ramen_for_dinner_because_wish_not_on_the/,1,Still Ramen for dinner because WISH not on the moon yet ,
38,ofqu0o,t2_a1gtsxvk,1625688089,/r/wallstreetbets/comments/ofqu0o/ocgn_is_38_shorted_great_time_to_make_them_pay/,1, OCGN is 38 shorted great time to make them pay especially on a stock that saves lives ,
39,ofquc4,t2_69vnt3m0,1625688114,/r/wallstreetbets/comments/ofquc4/xela_is_going_to_be_the_next_big_stock_yall/,1,XELA IS GOING TO BE THE NEXT BIG STOCK YALL INVEST WHILE YOU STILL CAN,
40,ofqv4u,t2_cqwpjmqs,1625688180,/r/wallstreetbets/comments/ofqv4u/viac_looks_promising_yolo_small_account/,1,VIAC looks promising YOLO small account,
41,ofqvcv,t2_1cfutd0m,1625688200,/r/wallstreetbets/comments/ofqvcv/example_of_fud_statements_being_propped_up_left/,1,Example of FUD statements being propped up left and right in the media No context required ,
42,ofqvl0,t2_b6jaoykv,1625688219,/r/wallstreetbets/comments/ofqvl0/now_is_the_time/,1,NOW IS THE TIME ,
43,ofqvra,t2_69vnt3m0,1625688234,/r/wallstreetbets/comments/ofqvra/xela_is_the_next_big_stock_invest_while_you_still/,1,XELA IS THE NEXT BIG STOCK INVEST WHILE YOU STILL CAN THIS STOCK HAD A 2 DOLLAR GAIN IN ONE DAY EVERYBODY LISTEN TO ME THIS STOCK IS GOING TO MAKE YOU ALOT OF MOOOLLLAAA, removed 
44,ofqw24,t2_axssaxrd,1625688257,/r/wallstreetbets/comments/ofqw24/a_reddit_thread_on_fuv_and_the_ath_35_short/,1,A reddit thread on FUV and the ATH 35 Short Borrowing Rate ,
45,ofqwgt,t2_1cfutd0m,1625688287,/r/wallstreetbets/comments/ofqwgt/example_of_fud_statements_being_propped_up_left/,1,Example of FUD statements being propped up left and right in the media No context required ,
46,ofqx1n,t2_d5zwsopq,1625688332,/r/wallstreetbets/comments/ofqx1n/next_green_wave_tickers_ngwcn_and_nxgwf_due/,1,Next Green Wave tickers NGW CN and NXGWF Due Diligence THE RARE GEM, removed 
47,ofqxlb,t2_mcr7g6z,1625688375,/r/wallstreetbets/comments/ofqxlb/coal_prices_hit_13_year_high_and_how_im_playing/,1,Coal prices hit 13 year high and how I m playing it screen shot inside,
48,ofqxo2,t2_548shwad,1625688379,/r/wallstreetbets/comments/ofqxo2/sndl_about_to_like_negg/,1, SNDL about to like NEGG,
49,ofqybo,t2_12i3mr,1625688433,/r/wallstreetbets/comments/ofqybo/im_not_crying_you_are/,1,I m not crying you are,
50,ofqz2d,t2_a3709q1j,1625688494,/r/wallstreetbets/comments/ofqz2d/xela/,1,XELA, removed 
51,ofqz3p,t2_cdb78g5u,1625688497,/r/wallstreetbets/comments/ofqz3p/negg_my_lucky_egg/,1,NEGG my lucky Egg ,
52,ofqz4z,t2_c7d9x5rd,1625688499,/r/wallstreetbets/comments/ofqz4z/the_relationship_between_intrinsic_value_factors/,1,The relationship between intrinsic value factors and market price, The following is a slightly edited excerpt from the book Security Analysis The passage was written in 1934 and it is amazing how valid it is today In security analysis there are two general attitudes that go into determining the market price of securities They are investment attitudes and speculative attitudes Speculative attitudes include the following Market factors Technical factors Manipulative factors Psychological factors Speculative and investment attitudes may share the following attitudes Future value factors Management Competitive conditions Possible and probably changes in volume price and costs Investment attitudes are distinct from speculative attitudes in that they asses objective intrinsic value factors Intrinsic value factors Earnings Dividends Assets Capital and Debt Structure Terms of the issue Other metrics that are considered fact All of these factors together form the attitude of the public towards the issue causing them to present bids and asks at the price they deem appropriate to exchanges that in turn forms the current market price Of course there have been many new developments since this was written but big banks scalping for a few cents per share on each trade doesn t change the facts above It seems like good practice to think about all of these before making a purchase or sale to form a final opinion on if the transaction is an investment or a speculation and even to think about what the person on the opposite side of the transaction is thinking Also goes to show that if efficient market theory really does exist then the value of equities may be extremely disjoint with what its financial intrinsic value is The purpose of this post is not to enrage or start an argument like how some people tend to interpret posts but rather to create some discussion points and hopefully add to all of our knowledge base or at least make you take a second and think about it 
53,ofr088,t2_a3vy1sz8,1625688591,/r/wallstreetbets/comments/ofr088/heres_to_all_the_retards_that_did_the_same_as_me/,1,Here s to all the retards that did the same as me ,
54,ofr0qd,t2_8c79acpe,1625688635,/r/wallstreetbets/comments/ofr0qd/cvs_lets_gooo_bought_back_in/,1,CVS let s gooo Bought back in,
55,ofr107,t2_5f92onkg,1625688659,/r/wallstreetbets/comments/ofr107/i_was_promised_fuck_you_money/,1,I Was Promised Fuck You Money ,
56,ofr1ak,t2_8f6rqvzd,1625688684,/r/wallstreetbets/comments/ofr1ak/its_not_a_loss_if_i_dont_sell_clov/,1,IT S NOT A LOSS IF I DONT SELL CLOV ,
57,ofr1kj,t2_8x9v6wp9,1625688706,/r/wallstreetbets/comments/ofr1kj/ocgn_paper_hand_heaven/,1,Ocgn paper hand heaven, removed 
58,ofr2u1,t2_5uvxex91,1625688812,/r/wallstreetbets/comments/ofr2u1/amc_apes_together_expr_hedges_want_us_to_short/,1,AMC apes together EXPR Hedges want us to short squeeze them They didn t learn the first time ,Now they continue with there crimes trying to bring us down The more capital we have holding the more they will scram for a bailout All these over shorted companies are amazing companies Come with a open mind is all I m asking and Do you DD 
59,ofr2x1,t2_86hutjug,1625688819,/r/wallstreetbets/comments/ofr2x1/beyond_the_deserved_but_rode_hard_and_hung_up_wet/,1,Beyond the deserved but rode hard and hung up wet options on RH Shitty SNDL etc would someone please explain what this big disparity in means Like I m 8 Shukran Habibi,
60,ofr3q1,t2_aay0ie7u,1625688888,/r/wallstreetbets/comments/ofr3q1/anybody_have_any_info_on_clear_securities_inc/,1,Anybody have any info on Clear Securities INC ,Bought some shares in CLEAR and it has done pretty well but have not seen any discussion on here about it Just wondering what the thoughts of the group are 
61,ofr46v,t2_a3709q1j,1625688928,/r/wallstreetbets/comments/ofr46v/xela_to_the_moon/,1,XELA to the Moon, removed 
62,ofr46x,t2_9h54jra0,1625688928,/r/wallstreetbets/comments/ofr46x/this_sub_is_dogshit_now/,1,this sub is dogshit now,ever since gme came into the sights of everyone so many idiots came onto this sub thinking they knew how the stock market works when in reality they know fuck all And now there s just absolute retard culture not WSB retard I mean legit retard in this sub that has taken it towards absolute disaster The memes aren t even as funny anymore This shit sucks 
63,ofr499,t2_8f6rqvzd,1625688933,/r/wallstreetbets/comments/ofr499/not_a_loss_if_i_dont_sell_clov/,1,Not a loss if I don t sell CLOV ,
