,postid,author,created_utc,permalink,score,title,selftext
95,om6q1p,t2_4cl8pd5a,1626536782,/r/wallstreetbets/comments/om6q1p/my_fist_1_year_experience_in_stock_market_lessons/,1,My fist 1 year experience in stock market Lessons Learned, I m summarizing some rules that I ve learned in a hard way for last 1 year of stock market My experience applies to all high momentum growth stocks reddit plays blue chips stocks etfs This is not an advice rather share discussion and learning post Hope some of the new guys will get benefitted from my post who are less than 1 year in stock market and will learn a lot definitely from comment section if anyone share their experience Here are from my experience 1 Always 30 Cash on hand gt Very important while everything is going down and I can t buy because I got no money 2 Maximum 20 allocation on any stock 3 When I think about Should I get out is the right time to get out 4 Get out when you have achieved your target and take re entry after 4 weeks minimum gt Locking profits 5 Don t buy in rush Observe and then take entry at good price Stocks always gives a chance Buy in 2 different stage 50 50 6 Don t buy any stock that I will not hold for long Buy 50 of allocated capital 20 when I buy and it goes deep down buy the rest 50 7 Don t fall in love with a stock 8 Don t panic sell Never ever if you have high conviction on your stock selection don t sell in panic You can sell when you feel good but not in pain Those always came back and went even higher 9 Once account gets bigger buy 50 index fund 30 cash and 20 risky stocks for high growth 10 Down trend Cycles in 2020 September 3rd 2 5 weeks before election Oct 2nd from 2nd week of December Cycles in 2021 Sell February 20th to re entry March 8th Sell March 16th to Re entry March 25th sell April 6th to re entry April 20th Sell April 28th to re entry May 13 Sell June 17 to re entry July 16th So you see there are lot of clear re entry point It is hard to time the sell but need to sell when I ve a descent profit and have a feeling time is getting bad 11 Long term secured big gains are possible only from blue stocks established growth stocks and index funds ETFs Risky stocks are not for long term secured gains So follow 80 20 rule 12 NO SHORT CUT 13 Payoff margin as soon as you have gains and can afford paying off 14 Look at trading plan on regular interval and always follow if you break blame yourself onlyyyyyyyyyyyy gt So Never break Very Important Let me know if you have anything to add from your experience that you ve learned Would like to Learn 
96,om6q7y,t2_3a8wuu5b,1626536793,/r/wallstreetbets/comments/om6q7y/celu_world_leader_in_cellular_therapy/,1, CELU World Leader in Cellular Therapy, A clinical stage cellular medicine company developing off the shelf allogeneic therapies derived from the postpartum human placenta Target Cancer Degenerative and Infectious diseases such as COVID 19 Board pipeline of drugs with Catalyst rich 24 months ahead On 19 July 2021 CYNK 001 the company s lead product candidate received orphan drug status by FDA and got positive recommendations with no evidence of toxicities or inflammation In March 2021 CYN 001 also received Fast Track Designation from FDA Already Built the manufacturing facilities for commercial and scalable purposes The treatment has multiple advantages such as lower COGs reduce wait time for patients readily expandable Partnered with Palantir Technologies introducing artificial intelligence into its pursuit of cancer treatments with patented cellular medicine Partnered with Maxcyte a leading provider of cell engineering platform technologies for next generation cell based therapies This strategic relationship provides Celularity with access to MaxCyte s unique electroporation technology platform representing an important enabling step in allogeneic cell therapy In July 2021 entered into an exclusive partnership with Arthrex Inc to distribute and commercialize Celularity s biomaterial products for orthopedic surgery and sports medicine Got a BUY rating at BTIG with a target price of 16 In March 2021 The company is valued at only 1 6 billion It is expected to have a total of 141 million shares outstanding with only 3 4 million public floats LOW FLOAT Moved up by 27 on Friday Maybe a short squeeze possibility that can give a parabolic move Shorted heavily by Citadel 
97,om6qnx,t2_a03m7qau,1626536832,/r/wallstreetbets/comments/om6qnx/a_message_to_citadel/,1,A message to Citadel,
98,om6qsr,t2_1d2g4twy,1626536844,/r/wallstreetbets/comments/om6qsr/tesla_releases_full_fsd_subscriptions/,1, TESLA Releases FULL FSD Subscriptions , Alright boys the moment we ve all been waiting for RECURRING HIGH MARGIN PROFIIIIIIIIIIT Sadly it s available only for available to eligible vehicles in the United States amp x200B Source https www thestreet com tesla news tesla releases full self driving subscription https preview redd it 9jx838tjnsb71 png width 2482 amp format png amp auto webp amp s ec9b47da9e3d17a911d2decc0de4a9563351d532 
99,om6qxo,t2_cjais2iu,1626536858,/r/wallstreetbets/comments/om6qxo/the_top_10_crypt0_blogs_and_personalities_to/,1,The Top 10 Crypt0 Blogs and Personalities to Follow,
0,om6qxo,t2_cjais2iu,1626536858,/r/wallstreetbets/comments/om6qxo/the_top_10_crypt0_blogs_and_personalities_to/,1,The Top 10 Crypt0 Blogs and Personalities to Follow,
1,om6rgp,t2_1d2g4twy,1626536905,/r/wallstreetbets/comments/om6rgp/tesla_releases_full_fsd_subscriptions/,1, TESLA Releases FULL FSD Subscriptions , amp x200B https www thestreet com tesla news tesla releases full self driving subscription https preview redd it rbnwvj8rnsb71 png width 2482 amp format png amp auto webp amp s 3470eea5cb9ad541064dbdc89f2d97d8721307da 
2,om6s2i,t2_a30zjkkh,1626536963,/r/wallstreetbets/comments/om6s2i/mmat/,1,MMAT, removed 
3,om6sao,t2_98wpgt9p,1626536986,/r/wallstreetbets/comments/om6sao/double_diamond_ski_slope_down_for_cpop_possible/,1,Double Diamond Ski Slope Down for CPOP Possible at the End,Pretty remarkable couple of weeks for this Chinese hip hop promoter Don t think we are going to see reports on short interest until probably a week from Monday based on FINRA rules but with IPO at 6 and retail market opened just over 12 suspect selling is starting to get exhausted Could be a flat out fraud but if manipulation probably close to running its course Will be super interesting to see how much of a bounce might be possible once actual sellers lose steam Not a lot left for any new shorts here so at some point it will at least just start going sideways However like all parabolic moves up or down once the momentum is exhausted the reversals can be abrupt and severe I have no idea what will happen and anyone who claims to know is simply blowing smoke but history does suggest that if there is a bit of a push in the implied order book to the other side you could get a quick double even if it later fell back Cheers https preview redd it rgz7ifg0osb71 png width 2142 amp format png amp auto webp amp s 09f1f8943959e8d16c848a34c61757549d36f216
4,om6tu7,t2_cnbe57yz,1626537133,/r/wallstreetbets/comments/om6tu7/tilray_is_it_time_to_buy_this_stock_it_has_come/,1,Tilray is it time to buy this stock It has come down over the past few days The new legalization Bill will boost the marijuana stocks as soon as it s approved , removed 
5,om6tvp,t2_1d2g4twy,1626537137,/r/wallstreetbets/comments/om6tvp/breaking_tesla_releases_full_selfdriving/,1,Breaking Tesla Releases Full Self Driving Subscription, removed 
6,om6uie,,1626537200,/r/wallstreetbets/comments/om6uie/tesla_releases_full_selfdriving_subscription/,1,Tesla Releases Full Self Driving Subscription, deleted 
7,om6utc,t2_1d2g4twy,1626537229,/r/wallstreetbets/comments/om6utc/tesla_releases_full_selfdriving_subscription/,1,Tesla Releases Full Self Driving Subscription, https www thestreet com tesla news tesla releases full self driving subscription https www thestreet com tesla news tesla releases full self driving subscription 
8,om6v6h,t2_9m4v3cjf,1626537265,/r/wallstreetbets/comments/om6v6h/nokia_2_da_moon/,1,NOKIA 2 DA MOON , removed 
9,om6ww9,t2_a3ectrpl,1626537401,/r/wallstreetbets/comments/om6ww9/question_for_apes_who_where_in_the_amc_rampup_to/,1,Question for Apes who where in the AMC Ramp up to Peak,First I was in the GME squeeze didn t learn too much just knew about SI took profit tied up with home improvements keep wife happy keep BF away so skipped AMC bummer and now stupidly dove into CLOV Yes I am relatively new to active investing With the CLOV drama I learned about 1 Darkpool Exchange stuff keep seeing around 60 of total volume of shares exchanged in the screen captures 2 Hedgy pattern to sake or exit a sort dump shares buy back and repeat For example on 7 15 20 36m shares were borrowed and 20 1m shares were returned On 7 16 saw on twitter at 10 35am there were 5 5m sorted and total volume was 5 8m I see folks claiming volume was low which implied only sorters selling and most retail holding This now leads to my questions on the AMC ramp up 1 Did a similar pattern emerge dump shares buy back and repeat 2 Was there a time where the volume went low implying only sorters selling so there were enough retail just holding and buying the dip I wonder if there was a point of inflection in time you saw where enough held that the tactic just failed and price goes up And of course is there something I am missing or not seeing with the AMC ramp up Thanks from an Ape trying to master Stonking 
10,om6xt6,t2_9m4v3cjf,1626537486,/r/wallstreetbets/comments/om6xt6/nokia_up_next/,1,NOKIA UP NEXT , removed 
11,om6y9j,t2_c0x7o36r,1626537531,/r/wallstreetbets/comments/om6y9j/george_is_very_heavy/,1,George is very heavy ,
12,om6yap,t2_394o1o5,1626537534,/r/wallstreetbets/comments/om6yap/just_when_i_start_to_think_i_see_a_trend_and_yolo/,1,Just when I start to think I see a trend and yolo my pension,
13,om6yl2,t2_1kod8x9y,1626537560,/r/wallstreetbets/comments/om6yl2/found_this_in_the_wild/,1,Found this in the wild,
14,om6yu2,t2_1r3s8dk9,1626537584,/r/wallstreetbets/comments/om6yu2/fucking_legos/,1,Fucking legos,Sup retards I have a goal to turn 5 into 350 by August 1st so I can buy myself a majestic lego gunship Am I a child Yes Fuck you I m gonna do it Join me 
15,om6z2s,t2_ajhn8m0d,1626537604,/r/wallstreetbets/comments/om6z2s/help/,1,HELP ,
16,om6zxl,t2_ajhn8m0d,1626537652,/r/wallstreetbets/comments/om6zxl/help/,1,Help ,
17,om7044,t2_1r3s8dk9,1626537668,/r/wallstreetbets/comments/om7044/fucking_legos/,1,Fucking legos,Sup retards I have a goal to turn 5 into 350 by August 1st so I can buy myself a majestic lego gunship Am I a child Yes Fuck you I m gonna do it Join me 
18,om735r,t2_c0x7o36r,1626537951,/r/wallstreetbets/comments/om735r/george_knows_how_to_short/,1,George knows how to short ,
19,om77zq,t2_c0x7o36r,1626538408,/r/wallstreetbets/comments/om77zq/george_knows_how_to_short/,1,George knows how to short ,
20,om78it,t2_9md2ysrq,1626538455,/r/wallstreetbets/comments/om78it/mrin_no_1_on_short_squeeze_potential/,1,MRIN No 1 on short squeeze potential ,
21,om792z,t2_ichip,1626538509,/r/wallstreetbets/comments/om792z/spotted_in_nashville_tn/,1,Spotted in Nashville TN,
22,om79td,t2_98wpgt9p,1626538566,/r/wallstreetbets/comments/om79td/theres_no_inflation_or_not/,1,There s No Inflation Or Not ,Just got updated homeowner s insurance renewal quote for 2022 from agent Up 28 You have to be kidding me Over the last 15 years zero claims Guess insurance companies are starting to realize that replacement costs are growing at a rate that may or may not fit Powell s definition of transitory 
23,om7bw3,t2_41g6s,1626538759,/r/wallstreetbets/comments/om7bw3/woof_woof_pay_me_mother_fuckers/,1,WOOF WOOF PAY ME MOTHER FUCKERS,WOOF Is Was being short attacked The only time Scooby and The Gang have released shares to the market have been IPO 55 200 000 shares and between 06 01 and 06 14 46 058 622 According to SEC filings they sold a batch of 22 000 000 at once and the only time volume has been that high 06 14 where it reached 28 a share Each time they release shares they are gobbled up That makes a total of 101 258 622 shares out to the market Conservative estimates from WhaleWisom say hedge funds own 19 000 000 and Institutions own 52 000 000 GOTTA SUBTRACT CANADA PENSION PLAN INVESTMENT BOARD CURRNT OWNERSHIP OF 59 765 368 FROM THAT I SEE YOU BAE https ir petco com static files c6bee5e4 d09a 4583 b730 d1540ce56e59 So that means 30 000 000 shares are floating around NASDAQ has short share interest as of 06 30 of 16 000 000 Ever since 07 01 WOOF has been in a free fall Conservative estimates from fintel io say that 4 000 000 shares have been shorted since 07 01 I CANT SEE 07 01 SO I ROUNDED UP So that would make the short interest at 20 000 000 shares as of 07 15 or approximately 66 1 out of every 3 shares bought the last 11 trading days belongs to someone else or they are fake Just look who owns puts and calls hint OHH KENNY BOY I could be stupid I don t know They haven t had a lot of SEC filing so its pretty easy to follow Its probably worth 25 a share This is not financial advice I am a dog 
24,om7em1,t2_8v6a8wgd,1626538979,/r/wallstreetbets/comments/om7em1/azn_options_get_it_now_not_financial_advice_i/,1,AZN options Get it now Not financial advice I just like the stock That is all Have a great weekend , removed 
25,om7gzo,t2_c42txsnj,1626539173,/r/wallstreetbets/comments/om7gzo/this_is_not_investment_advice_life_of_a_retail/,1,This Is Not Investment Advice Life of a Retail Investor,Growing up I was always in awe of the Devils Casino No not Foxwoods The New York Stock Exchange It always had this mythology to me It was this wonder that made participants rich Wealth was to be found Moneys were to be made I figured out by the age of about ten that the Stock Market was similar to pulling the lever at the slot machines How did I figure this out at such a young age All my dad had to do was explain how stocks worked You see if you think a stock is going to do well you put money into that stock Then you hope that the price of that stock goes up and not down My dad explained Well Uncle Bobby puts money on the Patriots and everyone says that is illegal Is gambling stocks illegal I asked rather genuinely My dad told me to get outside and play basketball with the neighborhood kids I never cared much again about the market until I was about 13 years old and this kid on my baseball team started talking about his stock picks Yeah I invest in stocks like my dad He reads the Wall Street Journal My teammate said loud and proud The Wall Street Journal My parents got the local paper from the closest Shaws My parents didn t care about stocks They cared about how Guy Fiarri went to the hotdog joint down the street and it was on Diners Drive Ins and Dives But I was hooked My brother was a Finance Major at a University close to home so he would visit home quiet a bit He often left his very own copy of the Wall Street Journal on his desk in his room One day I decided to sneak into his room and lay my eyes on the holy print of Wall Street Alas I will have access to the greatest source of investment knowledge on planet earth I picked it up My head began to spin into infinity Interest rates price to earnings yield curves dividends leverage payouts monetary policy What on earth does this stuff mean I tried to read through it all but none of it made sense I then stumbled across an article about the Iraq War in the World section and that was an incredibly well written article Nevertheless the mystery of it all just added to the mythology of Wall Street It was like unlocking the worlds secrets right before my eyes In my head the little kid in me always felt that if I only learned these secrets I would be able to gain my edge on everyone else Somehow I failed to acknowledge that I had no reasonable means to invest in stocks to begin with I had no trading platform to use and secondly I had no money because I was thirteen That would all change though when I turned 14 and started working my first minimum wage paying job Oh the glory of 6 an hour My financial empire was right around the corner Soon I would join the Wall Street bulls and ride on to my endless wealth Then 2008 happened I remember in the early days of the Great Recession I would hear about how a bunch of assholes made a bunch of people poor and were getting away with it but I had no idea what they meant It was something about the housing market crashing and basically everyone got screwed I also remember how people said Barrack Obama or maybe George W Bush planned the whole thing But that s really all I deciphered from all of it at the time I was 14 I cared about sports and chicken tendies I didn t know what a Recession was I was just happy I didn t lose my Wendy s job I went to College and studied economics Studied is a loose term I definitely came out dumber than I did when I started But that was okay I learned how to open a brokerage account and put all my money in the corporate Goliath PZOO A company which at the time was doing something related to lab growing weed or something I m not sure I received all these letters from them saying they were reverse splitting there stock That really pissed me off because I was losing all my shares They started to specialize in nutrition so I sold all my shares because they ditched their original business model Fast forward a few years from then I opened a Robinhood account and started buying put options on Beyond Meat a little bit after its IPO Who wants to eat fake meat What a dumb idea for a company I lost thousands on that trade though because apparently people were bullish on meatless meat Then I turned on the news last spring to find all these morons on Reddit were buying GameStop stock and somehow made money doing that I realized I wasn t alone in my endeavor of perpetually throwing money at the stock market to hopefully one day hit the jackpot Seriously good for you guys Because of this Reddit page I bought CLOV and am already down 30 I should be down more but my brokerage account won t let me buy or sell options I m still waiting for customer service to tell me why I can t throw my money at them Note I am not an investment advisor If you got this far you did not learn anything Do not make trades based on anything you read above If you decided to ignore this note that is your fault Also if you decided to ignore this note you are probably like me which means you will absolutely never make money in the market That s okay as long as you enjoy Chili s for the rest of your life 
26,om7hn3,t2_12vxwn0g,1626539231,/r/wallstreetbets/comments/om7hn3/diamon_hands/,1,DIAMON HANDS,
27,om7lt2,t2_7plmkejf,1626539609,/r/wallstreetbets/comments/om7lt2/body/,1,BODY,
28,om7m40,t2_92d0gkr5,1626539637,/r/wallstreetbets/comments/om7m40/amc_stocks/,1,AMC stocks,I see everyone losing money to amc stock but isn t there an opportunity to buy put options and make a lot of money Or am I missing something 
29,om7obn,t2_6hebk2ho,1626539843,/r/wallstreetbets/comments/om7obn/top_10_canadian_base_metal_and_uranium_explorers/,1,Top 10 Canadian base metal and uranium explorers and developers https www mining com top 10 canadian base metal and uranium explorers and developers , removed 
30,om7ppe,t2_2wa0ct5w,1626539972,/r/wallstreetbets/comments/om7ppe/lol_i_did_that_in_a_week/,1,Lol i did that in a week,
31,om7ps9,t2_5durpz5x,1626539979,/r/wallstreetbets/comments/om7ps9/when_your_stack_protects_itself_jk_just_some_new/,1,When your stack protects itself jk Just some new and old pours,
32,om7rd9,t2_93gem8gj,1626540094,/r/wallstreetbets/comments/om7rd9/what_it_feels_like_to_hold_space_right_now/,1,What it feels like to hold space right now,
33,om7rud,t2_a8ww4og3,1626540135,/r/wallstreetbets/comments/om7rud/when_the_odds_are_against_us_and_when_the_chips/,1,When the odds are against us and when the chips are stacked against us APES HODL ,
34,om7sus,t2_93gem8gj,1626540221,/r/wallstreetbets/comments/om7sus/what_its_like_to_hold_spce_right_now/,1,What it s like to hold spce right now ,
35,om7v5c,t2_a15iy8wn,1626540401,/r/wallstreetbets/comments/om7v5c/buy_aht/,1,Buy AHT, removed 
36,om7vzk,t2_9w6p6enb,1626540468,/r/wallstreetbets/comments/om7vzk/amc_does_not_have_30_mil_ftds_only_at_most_5mil/,1,AMC DOES NOT HAVE 30 MIL FTDS ONLY AT MOST 5MIL,Do I really have to make a DD for this Or can I just leave it at this and hopefully you all will do your own research
37,om7w66,t2_11b209,1626540486,/r/wallstreetbets/comments/om7w66/any_portfolio_management_softwares_which_are/,1,Any portfolio management softwares which are compatible with Indian markets ,Please dont suggest mprofit I didn t like the UI and their backup and restore option is a nightmare I have to contact support everytime I have to restore my backup 
38,om7zai,t2_3y2x9zip,1626540789,/r/wallstreetbets/comments/om7zai/leverage_x2_twice_more_profit_easy/,1,Leverage x2 twice more profit Easy,
39,om7zw5,t2_491nltq2,1626540845,/r/wallstreetbets/comments/om7zw5/relatable_autist_moment/,1,relatable autist moment,
40,om829e,t2_829c4hak,1626541053,/r/wallstreetbets/comments/om829e/apes_unite_or_risk_losing_all/,1,Apes unite or risk losing all ,GME AMC CLNE SPCE and what have you having been going south or side way for a month or two This has to stop I repeat STOP To make money price has to go up to get it up we have to buy more of what we are holding Problem is where do we get the money Right Solution is to write cover call that s right write cover call You then have money to buy more and those who bought cover call are encourage to buy the stock to drive the price up With price up you get additional margin to buy more stocks and issue more cover call Since price up more people will buy stocks or margin calls and cycle repeat This is no joke require coordinate effort don t just sit on your ass get up and do it This is your calling Post your purchase on the reply We apes are with you 
41,om82c8,t2_491nltq2,1626541061,/r/wallstreetbets/comments/om82c8/relatable_autist_moment/,1,relatable autist moment,
42,om82n2,t2_65nukprw,1626541088,/r/wallstreetbets/comments/om82n2/wheels_up_perfect_ticker_to_shoot_to_the_moon/,1,Wheels Up perfect ticker to shoot to the moon NYSE UP ,Alright guys first time out here but long time retail investor This stock caught my eye since it went public last week through a SPAC I know I know The company owns leases and manages a large fleet of private business jets It also acts as a booking agent for UHNW jet owners who want to lease out their jets when they are not using them I think this stock has a lot of potential and is currently riding a huge tail wind in the aftermath of COVID as the rich would rather shell out more cash to fly private than hang with us I think wheels up gives us a chance to profit off of the elites crazy spending instead of them profiting off of us for a change Valuation a little rich for the space especially if you consider that airlines are trading at less than 10x forward EBITDA The counter argument is that revenues are growing at 40 60 annualized quarter over quarter and this justifies their 20x 2 year out EBITDA They also want to be seen as the UBER of the skies which would be nice for UP shareholders as it would translate to 7x revenues The challenge they need to figure out how to avoid dead weight Flying a jet with no passengers is really expensive and unfortunately that s a common issue in private aviation as you typically have to fly to a specific location to pick a customer up with no passengers Ideally they find a way to grow their network and reduce this Last thing the ticker is just perfect for a moonshot NYSE UP I can just picture a CNBC headline saying UP to the moon Feel free to leave your thoughts 
