,postid,author,created_utc,permalink,score,title,selftext
85,ol90xa,t2_9cj1dl3c,1626407823,/r/wallstreetbets/comments/ol90xa/the_future_of_plastics_potential_100_bagger/,1,The Future of Plastic s Potential 100 Bagger, Origin Materials Origin s decarbonizing technology addresses a 1 trillion market opportunity and is anticipated to revolutionize the production of a wide range of end products including clothing textiles plastics packaging car parts tires carpeting toys and more Origin now has partnerships with Nestle Danone and Pepsico who are some of the largest plastic users in the world Match that with their connections from their board they have the chops to make this work and scale Origin Materials have developed technology out of UC Davis which creates plastics out of scraps of organic material 1 wood pulp 2 rice hulls 3 sugar cane stalks etc This process ends up capturing the carbon that would reenter the atmosphere when the scrap material decays into plastics making it an incredibly effective way to capture carbon Deloitte did some independent analysis and showed it captures 300 of the carbon used in the manufacturing process making it one of the first carbon negative production processes Not only that but since they are using scrap material the production costs are not tied to inflation or any other material such as oil In fact they estimate producing these bioplastics at a cost which will be competitive with current oil based plastics and that doesn t even include any carbon credit incentives Origin is currently building the Origin 1 plant due EOY 2022 which will be their testbed plant that is focused on refining and optimizing their full scale production for both current and future materials From there EOY 2024 will mark the completion of their Origin 2 plant which will be a full production scale facility and also create a positive EBITDA From there they plan for 5 more plants estimating a 2 3bln EBITDA by 2030 This company has the potential to absolutely boom Leadership These folks know their chemistry Lots of names out of UC Davis where this tech was developed so this isn t just some pipe dream MBA bullshit They also have lots of leadership out of the chemicals production space from the likes of Dow Chemicals So that s great on that level but how do we know they will actually be able to execute 1 Board Chair Karen Richardson who is also a board member of BP 2 Boon Sim Leader for both Credit Suisse and Temasek Holdings aka the sovereign wealth fund of Singapore which is known for being one of the most sophisticated funds in the world 3 Along with that execs from Clorox Dupont and P amp G So tons of experience and connections with huge players I was on the fence until I saw who was on the board now I m stoked Insider Buying and Investment 1 Just before merger Charles Drucker bought an additional 650k shares bringing his total ownership to 18 862 500 shares 2 On top of that Apollo Funds invested 30m in Origin furthering my confidence in the company 3 On June 25th Lior I Amram and Evergreen InvestCo bought 10m shares furthering the large long term investments in the company Ridiculously Tiny FloatSo due to the above the current available float is sitting at 29m but wait there s Less With the buying mentioned above this is reduced to only 18 23m shares That is tiny We are only starting to get a sense for institutional ownership There just aren t that many shares available right now so that means the price will be heavily affected by even a small increase in demand More volatile Yes but also will make a runup in price all the more likely Market The market is currently pegged at 1tln of potential so there is tons of room for expansion But let s take a look at Danimer Scientific who was another company which merged last year and also looks to produce bioplastics If you look at their investor presentation you can see they are further along but their maximum production after all their facilities are built is just a little above what one of the 6 production plants of Origin And on top of that they have to use vegetable oils so are prone to crop inflation Right now they are valued at 25 which according to their data puts them at a 14x multiple of their future EBITDA and a 15 discount rate The same comparison would put Origin up over 40 a share today Origin is primed to cash in on the current boom in ESG focus Their current projects look to double in EBITDA when forecasting for the potential of carbon capture premiums and other environmental opportunities They can also license their technology to other companies since there is a huge market which one company can never fill When looking at the demand they have already gotten 1bln in offtake commitments and while they could have more they have chosen to reserve capacity for higher margin items On top of all that Origin now has partnerships with Nestle Danone and Pepsico who are some of the largest plastic users in the world Match that with their connections from their board they have the chops to make this work and scale And to go along with that the merger with warrants will provide them with enough funding to get to their EBITDA positive timeframe with another 250mln in buffer So there is very little risk of dilution via share issuance Beyond their factories they are also looking at licensing hte technology for another revenue stream to further accelerate growth none of my calculations take this into account The potential for additional revenue is just absolutely massive since there is a 1 TRILLION addressable market opportunity Once in a lifetime opportunity Competitors Origin doesn t have any direct competitors but it does have some analogs PureCycle is one but their focus is on biodegradable plastics They use canola oil as their feedstock so their price is tied to the price of the commodity and even at relatively low costs today they still cost 1 lb vs 0 29 lb for Origin Also there are a ton of products that shouldn t be biodegradable car parts for example shouldn t be degrading Danimer Scientific is another analogue but has the same issues as Purecycle In the end there is no other company that is looking to make carbon negative plastics Elephant in the Room Plastics are an environmental problem There are microplastics that are increasing in concentration in the ocean and in ocean life specifically and they have become a disease on the planet Why am I okay with this personally for Origin Well simply it is a step in the right direction There are a large number of applications which require non biodegradability but ultimately this begins to get market penetration with zero modification for carbon reduction It s a trade off for sure but it s only the start Things start to look much better with net zero fuel pellets and water filters carbon black and agricultural applications which aside from the fuel are all carbon negative In the end this is an insanely huge step towards reducing our carbon footprint and right now that takes priority for me Risks They currently have no revenue and are building their first plant Origin 1 This plant is still just a testing plant and they are quite far away from revenue positive The plant was also delayed a year likely due to COVID but they now have the equipment on site Overall There is a huge push for countries and companies to reduce their carbon footprint and this company is set to not only make a very profitable and sustainable product but to also capture a shitton of carbon doing it In the long run this company is likely going to explode in value as they have the talent experience and in demand product There are real risks here but the upside is enormous as this is a true potential unicorn I m looking at a potential return of 10 30x Disclosure Long Origin in LEAPS and Shares Disclaimer I am not a financial advisor nor is this financial advise I have attached some references I used in my analysis and recommend you do your own due diligence Craig Hallum Initiates Coverage On Origin Materials with Buy Rating Announces Price Target of 22 Origin Materials CURRENTLY TRADES AT 7 43 
86,ol91k6,t2_98f81y03,1626407896,/r/wallstreetbets/comments/ol91k6/theyll_manage/,1,They ll manage ,
87,ol91si,t2_8qf9h5e3,1626407922,/r/wallstreetbets/comments/ol91si/all_aboard/,1,All aboard,
88,ol92fg,t2_9cj1dl3c,1626407995,/r/wallstreetbets/comments/ol92fg/the_future_of_plastics_potential_100_bagger/,1,The Future of Plastic s Potential 100 Bagger, Origin Materials Origin s decarbonizing technology addresses a 1 trillion market opportunity and is anticipated to revolutionize the production of a wide range of end products including clothing textiles plastics packaging car parts tires carpeting toys and more Origin now has partnerships with Nestle Danone and Pepsico who are some of the largest plastic users in the world Match that with their connections from their board they have the chops to make this work and scale Origin Materials have developed technology out of UC Davis which creates plastics out of scraps of organic material 1 wood pulp 2 rice hulls 3 sugar cane stalks etc This process ends up capturing the carbon that would reenter the atmosphere when the scrap material decays into plastics making it an incredibly effective way to capture carbon Deloitte did some independent analysis and showed it captures 300 of the carbon used in the manufacturing process making it one of the first carbon negative production processes Not only that but since they are using scrap material the production costs are not tied to inflation or any other material such as oil In fact they estimate producing these bioplastics at a cost which will be competitive with current oil based plastics and that doesn t even include any carbon credit incentives Origin is currently building the Origin 1 plant due EOY 2022 which will be their testbed plant that is focused on refining and optimizing their full scale production for both current and future materials From there EOY 2024 will mark the completion of their Origin 2 plant which will be a full production scale facility and also create a positive EBITDA From there they plan for 5 more plants estimating a 2 3bln EBITDA by 2030 This company has the potential to absolutely boom Leadership These folks know their chemistry Lots of names out of UC Davis where this tech was developed so this isn t just some pipe dream MBA bullshit They also have lots of leadership out of the chemicals production space from the likes of Dow Chemicals So that s great on that level but how do we know they will actually be able to execute 1 Board Chair Karen Richardson who is also a board member of BP 2 Boon Sim Leader for both Credit Suisse and Temasek Holdings aka the sovereign wealth fund of Singapore which is known for being one of the most sophisticated funds in the world 3 Along with that execs from Clorox Dupont and P amp G So tons of experience and connections with huge players I was on the fence until I saw who was on the board now I m stoked Insider Buying and Investment 1 Just before merger Charles Drucker bought an additional 650k shares bringing his total ownership to 18 862 500 shares 2 On top of that Apollo Funds invested 30m in Origin furthering my confidence in the company 3 On June 25th Lior I Amram and Evergreen InvestCo bought 10m shares furthering the large long term investments in the company Ridiculously Tiny FloatSo due to the above the current available float is sitting at 29m but wait there s Less With the buying mentioned above this is reduced to only 18 23m shares That is tiny We are only starting to get a sense for institutional ownership There just aren t that many shares available right now so that means the price will be heavily affected by even a small increase in demand More volatile Yes but also will make a runup in price all the more likely Market The market is currently pegged at 1tln of potential so there is tons of room for expansion But let s take a look at Danimer Scientific who was another company which merged last year and also looks to produce bioplastics If you look at their investor presentation you can see they are further along but their maximum production after all their facilities are built is just a little above what one of the 6 production plants of Origin And on top of that they have to use vegetable oils so are prone to crop inflation Right now they are valued at 25 which according to their data puts them at a 14x multiple of their future EBITDA and a 15 discount rate The same comparison would put Origin up over 40 a share today Origin is primed to cash in on the current boom Their current projects look to double in EBITDA when forecasting for the potential of carbon capture premiums and other environmental opportunities They can also license their technology to other companies since there is a huge market which one company can never fill When looking at the demand they have already gotten 1bln in offtake commitments and while they could have more they have chosen to reserve capacity for higher margin items On top of all that Origin now has partnerships with Nestle Danone and Pepsico who are some of the largest plastic users in the world Match that with their connections from their board they have the chops to make this work and scale And to go along with that the merger with warrants will provide them with enough funding to get to their EBITDA positive timeframe with another 250mln in buffer So there is very little risk of dilution via share issuance Beyond their factories they are also looking at licensing hte technology for another revenue stream to further accelerate growth none of my calculations take this into account The potential for additional revenue is just absolutely massive since there is a 1 TRILLION addressable market opportunity Once in a lifetime opportunity Competitors Origin doesn t have any direct competitors but it does have some analogs PureCycle is one but their focus is on biodegradable plastics They use canola oil as their feedstock so their price is tied to the price of the commodity and even at relatively low costs today they still cost 1 lb vs 0 29 lb for Origin Also there are a ton of products that shouldn t be biodegradable car parts for example shouldn t be degrading Danimer Scientific is another analogue but has the same issues as Purecycle In the end there is no other company that is looking to make carbon negative plastics Elephant in the Room Plastics are an environmental problem There are microplastics that are increasing in concentration in the ocean and in ocean life specifically and they have become a disease on the planet Why am I okay with this personally for Origin Well simply it is a step in the right direction There are a large number of applications which require non biodegradability but ultimately this begins to get market penetration with zero modification for carbon reduction It s a trade off for sure but it s only the start Things start to look much better with net zero fuel pellets and water filters carbon black and agricultural applications which aside from the fuel are all carbon negative In the end this is an insanely huge step towards reducing our carbon footprint and right now that takes priority for me Risks They currently have no revenue and are building their first plant Origin 1 This plant is still just a testing plant and they are quite far away from revenue positive The plant was also delayed a year likely due to COVID but they now have the equipment on site Overall There is a huge push for countries and companies to reduce their carbon footprint and this company is set to not only make a very profitable and sustainable product but to also capture a shitton of carbon doing it In the long run this company is likely going to explode in value as they have the talent experience and in demand product There are real risks here but the upside is enormous as this is a true potential unicorn I m looking at a potential return of 10 30x Disclosure Long Origin in LEAPS and Shares Disclaimer I am not a financial advisor nor is this financial advise I have attached some references I used in my analysis and recommend you do your own due diligence Craig Hallum Initiates Coverage On Origin Materials with Buy Rating Announces Price Target of 22 Origin Materials CURRENTLY TRADES AT 7 43 
89,ol9391,t2_a2fn4v4e,1626408059,/r/wallstreetbets/comments/ol9391/was_it_a_good_decision_wish_yolo/,1,Was it a good decision WISH YOLO ,
90,ol93kr,t2_8ch6fs9f,1626408088,/r/wallstreetbets/comments/ol93kr/need_to_eat_crayons_with_tou/,1,Need to eat crayons with tou,Man I d really like to comment on the diamond hand geniuses and the crayon eating retards They just won t let me yet bc of karma or something Pumpers need to help me out here every time I try to post something it tells me it s too short Every time I try to comment it tells me I have low karma What gives I want to be a diamond hand genius like you
91,ol93wz,t2_9m700rl2,1626408123,/r/wallstreetbets/comments/ol93wz/accessory_to_corruption/,1,Accessory to corruption ,Can individuals getting or groups paid by hedgefunds to hel manipulate the market through social media and news outlets be a accessory to the corruption case 
92,ol957j,t2_5s49gjq7,1626408259,/r/wallstreetbets/comments/ol957j/getting_started/,1,Getting started,Can anyone be so kind to give a newly divorced person who now has to worry about finance and the stock market like a quick 3 bullet points as to how to start trading on Robin Hood I don t need to get fancy but want to check with the experts
93,ol97h8,t2_dbyxedrh,1626408505,/r/wallstreetbets/comments/ol97h8/2021_for_july/,1,2021 for July, removed 
94,ol9814,t2_3a1i1odo,1626408565,/r/wallstreetbets/comments/ol9814/nft_competition_totemfi_my_entry_is_1_need_a/,1,NFT competition TotemFi my entry is 1 need a boost fam, removed 
95,ol9bo9,t2_adegeis3,1626408952,/r/wallstreetbets/comments/ol9bo9/opportunity_for_students_interested_in_investing/,1,Opportunity for Students Interested in Investing ,If you are a high school or college student who is eager to expand and hone their Investing skills and knowledge I encourage you to join the Young Investors Network Here we bring together like minded students around the globe to acquire the skills to lead financially free lives One of the many ways we do this is by hosting speaker events with industry professionals from all around the world 
96,ol9dlk,t2_adegeis3,1626409161,/r/wallstreetbets/comments/ol9dlk/opportunity_for_students_interested_in_investing/,1,Opportunity for Students Interested in Investing ,If you are a high school or college student who is eager to expand and hone their Investing skills and knowledge I encourage you to join the Young Investors Network Here we bring together like minded students around the globe to acquire the skills to lead financially free lives One of the many ways we do this is by hosting speaker events with industry professionals from all around the world https www younginvestorsnetwork org home https www younginvestorsnetwork org home 
97,ol9eio,t2_97a1mqs2,1626409259,/r/wallstreetbets/comments/ol9eio/the_end_is_near_and_institutions_know_it/,1,THE END IS NEAR And institutions know it,And by the end I mean a slight pullback in the market The hedgies are buying millions of dollars worth of puts and shorting a fuckton of SPY shares while you idiots are blowing your allowances on WISH and CLOV weeklies Look at this a bunch of SPY got shorted today Red means bad Dark pool Prints mean the big guys were doing this under the table or something like that Now look at all these puts on QQQ Suits dropped 9M on December puts in a single order so you can spare the 4 that your fatass spends at Wendys and instead drop it on some OTM puts Positions One QQQ put expiring tomorrow No I don t know the strike https preview redd it 0htrhsdc3ib71 png width 680 amp format png amp auto webp amp s 435bb39f1021ce257ca0797ed9b081727923a26a https preview redd it i1wkw0pp3ib71 png width 2192 amp format png amp auto webp amp s 8812fde566895aa9b287a772d20587fe8151536f
98,ol9gwb,t2_3kvx42q6,1626409524,/r/wallstreetbets/comments/ol9gwb/sad_bro/,1,Sad bro,
99,ol9hql,t2_42qeoiy0,1626409613,/r/wallstreetbets/comments/ol9hql/am_i_winning_yet/,1,Am I winning yet ,
0,ol9hql,t2_42qeoiy0,1626409613,/r/wallstreetbets/comments/ol9hql/am_i_winning_yet/,1,Am I winning yet ,
1,ol9ird,t2_9ur6oz53,1626409728,/r/wallstreetbets/comments/ol9ird/portfolio_setup/,1,Portfolio Setup,I m relatively new to investing I ve made a couple hundred thanks to lucky timing I d like to have better growth any advice on what my portfolio should look like 
2,ol9k6t,t2_2jejb2bg,1626409880,/r/wallstreetbets/comments/ol9k6t/i_think_im_finally_worthy_of_posting_here/,1,I think I m finally worthy of posting here ,
3,ol9lx3,t2_6icd0gt6,1626410069,/r/wallstreetbets/comments/ol9lx3/semiconductor_expected_earnings_dates/,1,Semiconductor Expected Earnings Dates,Semiconductor Expected Earnings Dates If you are investing in semiconductor stocks it s always nice to see how other stocks perform in the same sector before earnings If I m missing any or mistaken the dates please let me know and I will correct them Enjoy 07 15PM TSM Taiwan Semiconductor NYSE TSM Q2 GAAP EPS of 0 93 beats by 0 02 Revenue of 13 29B 28 0 Y Y misses by 20M 07 21PM ASML 07 21AH TXN 07 22AH INTC 07 26AH CDNS 07 27AH AMD 07 27AH TER 07 28PM UMC 07 28AH QCOM 07 28AH LRCX 07 28AH XLNX 07 29AH SWKS 08 02AH NXPI 08 03AH MCHP 08 03AH LSCC 08 05PM HIMX 08 09PM ON 08 10PM VSH Hidden Value Growth Surprise Play 08 10PM IMOS 08 10AH INDI 08 18PM ADI 08 18AH NVDA 08 17AH CREE 08 18AH SNPS 08 19AH AMAT 08 19AH KEYS 08 29AH KLAC 09 02AH AVGO 09 29AH MU
4,ol9pyy,t2_aixqel6o,1626410528,/r/wallstreetbets/comments/ol9pyy/not_a_trader_just_need_a_dose_ape_memes/,1,Not a trader just need a dose ape memes , removed 
5,ol9r7p,t2_d265g034,1626410665,/r/wallstreetbets/comments/ol9r7p/mutuals/,1,Mutuals, removed 
6,ol9rvz,t2_a15yuw10,1626410744,/r/wallstreetbets/comments/ol9rvz/apes_i_know_we_are_used_to_getting_beaten_like/,1,Apes I know we are used to getting beaten like this but I think it still have to be said Great job this week Even with all the FUDS and uneventful date we stood high and proud Now with a heavy heart I have to greet you all Happy Friday Monday cant come soon enough Nothing changed We hold ,
7,ol9suu,t2_a0edmx2c,1626410851,/r/wallstreetbets/comments/ol9suu/what_should_i_buy_i_have_15k_saved_up_for_market/,1,What should i buy i have 15k saved up for market Any suggestions, removed 
8,ol9t4w,t2_63x9t50y,1626410881,/r/wallstreetbets/comments/ol9t4w/xela_and_rsls_this_will_be_fun_tomorrow/,1,XELA and RSLS This will be fun tomorrow , XELA and RSLS This will be fun tomorrow Potential Squeeze XELA PT 20 RSLA PT 50 my own personal opinion do your own dd please to the moon edit want some dd on RSLS credit goes out to u Rex1995 https www reddit com u Rex1995 for this wonderful one https www reddit com r Shortsqueeze comments ol3sil rsls small float high si and massive potential https www reddit com r Shortsqueeze comments ol3sil rsls small float high si and massive potential not financial advice
9,ol9tyj,t2_119swv,1626410972,/r/wallstreetbets/comments/ol9tyj/anyone_know_wtf_moxian_moxc_is/,1,Anyone know wtf Moxian MOXC is ,Hong Kong based company I ve never heard of before that has some insane gains in the past year According to Robinhood it s some kind of automated consulting platform for online to offline styled businesses I m guessing their customers are mainly mom amp pop b amp m stores If I had to guess even though there s a shit ton of franchises in China I m sure there s still a good amount of these smaller guys around trying to do their best and grow their business I honestly had to focus kinda hard and read it twice to be able to understand what the fuck the description of the company meant so that all may have just been talking out of my ass but idk feel like I m at least close enough Just look at the one year graph Not saying it s a good play right now but damn 2 541 in the past 365 days is tempting 
10,ol9uy5,t2_a1soijsp,1626411075,/r/wallstreetbets/comments/ol9uy5/sold_my_free_go_pro_stock_for_an_amc_at_13_bucks/,1,Sold my free go pro stock for an amc at 13 bucks free money ,
11,ol9w2u,t2_6nyz1ewo,1626411206,/r/wallstreetbets/comments/ol9w2u/150_tomorrow_please/,1,150 tomorrow please ,
12,ol9wfm,t2_8was8p85,1626411248,/r/wallstreetbets/comments/ol9wfm/at_market_open_i_started_playing_scatman/,1,At market open I started playing Scatman ski ba bop ba dop bop I shit you not the louder I played this song the better my options started to look By eod I was playing this so loud that pieces of my popcorn ceiling were breaking up and falling all over me and my room AMC vs Scanman connection ,
13,ol9wla,t2_6ox3sxkv,1626411266,/r/wallstreetbets/comments/ol9wla/we_are_going_to_the_moon_right/,1,We are going to the moon right ,
14,ol9xjk,t2_a0edmx2c,1626411376,/r/wallstreetbets/comments/ol9xjk/im_a_hardworking_fellow_worked_my_whole_life_now/,1,I m a hard working fellow Worked my whole life now I m ready for this market I have 15 20 K in my account I m willing to take risk where should I invest my money Get fast result I need to buy house for my parents and i dont have enough to support them , removed 
