,postid,author,created_utc,permalink,score,title,selftext
3,om2i0g,t2_kcm8w,1626521520,/r/wallstreetbets/comments/om2i0g/spce_soft_ta_when_will_the_pain_end/,1,SPCE Soft TA When Will the Pain End , What s up fellow retards I am applying my strategy as a day trader to see what our long term resistance and support levels are I m simply a day trader of three years that has consistently used standard deviations RVI and volume on a 6month and 1year time frame to determine my buy sell areas on stocks no matter whether I am swing trading or trading intraday My current trading accuracy is 81 Easy Breakdown of Statistical Standard deviations 68 of a stock s price range over a given time frame is within 1 statistical standard deviation 2 blue lines of it s average regression trend middle line 95 within two deviations first upper and lower purple lines and 99 7 within 3 deviations upper and lower purple lines known as the 68 95 99 7 rule Most importantly these deviations also function as true support and resistance levels with deviations once crossed becoming either the new resistance or new support level See my Previous SOFI and AMC and AMZN NVDA etc TA s if you want examples of how this strategy works AMC https www reddit com r wallstreetbets comments ogu9cv amc july 9 soft technical analysis https www reddit com r wallstreetbets comments ogu9cv amc july 9 soft technical analysis SOFI https www reddit com r wallstreetbets comments ogu9cv amc july 9 soft technical analysis https www reddit com r wallstreetbets comments ogu9cv amc july 9 soft technical analysis AMZN NVDA https www reddit com r wallstreetbets comments ogaq6o zts fb amzn nvda technical analysis https www reddit com r wallstreetbets comments ogaq6o zts fb amzn nvda technical analysis NOW LET S GET INTO SOME CHART PORN FOR SPCE Here are our One Year and 6 Month Deviation Support and Resistance lines for SPCE This week was rough SPCE broke through its One Year and 6 Month 1 Deviation support then broke through its long term regression mean trend line middle line and has seemed to want to cross some minor support around 5 deviations dotted line on 6 month chart in the immediate future So where should you be looking to add positions The most important and nearest support deviation trend line available to us at this point is 1 deviations bottom blue line on both the one year and 6 month chart at around 26 and 25 This is where we will encounter some serious long term trending support levels and will likely see bulls try to bounce the price off these two price levels as less selling pressure comes in as our relative volatility index is around 25 on the one year chart and on the 6 month we can see what s known as a divergence forming on RVI as the price continues to drop yet relative volatility is slowly rising and is around 43 right now Should we cross 1 deviations our next nearest support levels are at 14 16 price levels of 2 deviations on one year and the 6 month chart however given the strong fundamentals of the company we will likely see some strong support forming at our 1 deviation support levels and hopefully a break out to the upside regression trend of 35 37 in the coming weeks once we bottom out It should be noted that we have some slight support around 30 at 5 deviations white dotted line on the 6month chart but it seems like the price is already making its move down to our next deviation support levels Good luck to everyone out there buy that dip if we can hit support in the next week Peace 
4,om2kq6,t2_kcm8w,1626521830,/r/wallstreetbets/comments/om2kq6/spce_soft_ta_when_will_the_pain_end/,1,SPCE Soft TA When Will the Pain End , What s up fellow retards I am applying my strategy as a day trader to see what our long term resistance and support levels are I m simply a day trader of three years that has consistently used standard deviations relative volatility index and volume on a 6month and 1year time frame to determine my buy sell areas on stocks no matter whether I am swing trading or trading intraday My current trading accuracy is 81 Easy Breakdown of Statistical Standard deviations 68 of a stock s price range over a given time frame is within 1 statistical standard deviation 2 blue lines of it s average regression trend middle line 95 within two deviations first upper and lower purple lines and 99 7 within 3 deviations upper and lower purple lines known as the 68 95 99 7 rule Most importantly these deviations also function as true support and resistance levels with deviations once crossed becoming either the new resistance or new support level See my Previous SOFI and AMC and AMZN NVDA etc TA s if you want examples of how this strategy works AMC https www reddit com r wallstreetbets comments ogu9cv amc july 9 soft technical analysis https www reddit com r wallstreetbets comments ogu9cv amc july 9 soft technical analysis SOFI https www reddit com r wallstreetbets comments ogu9cv amc july 9 soft technical analysis https www reddit com r wallstreetbets comments ogu9cv amc july 9 soft technical analysis AMZN NVDA https www reddit com r wallstreetbets comments ogaq6o zts fb amzn nvda technical analysis https www reddit com r wallstreetbets comments ogaq6o zts fb amzn nvda technical analysis NOW LET S GET INTO SOME CHART PORN FOR SPCE Here are our One Year and 6 Month Deviation Support and Resistance lines for SPCE This week was rough SPCE broke through its One Year and 6 Month 1 Deviation support then broke through its long term regression mean trend line middle line and has seemed to want to cross some minor support around 5 deviations dotted line on 6 month chart in the immediate future So where should you be looking to add positions The most important and nearest support deviation trend line available to us at this point is 1 deviations bottom blue line on both the one year and 6 month chart at around 26 and 25 This is where we will encounter some serious long term trending support levels and will likely see bulls try to bounce the price off these two price levels as less selling pressure comes in as our relative volatility index is around 25 on the one year chart and on the 6 month we can see what s known as a divergence forming on as the price continues to drop yet is slowly rising and is around 43 right now Should we cross 1 deviations our next nearest support levels are at 14 16 price levels of 2 deviations on one year and the 6 month chart however given the strong fundamentals of the company we will likely see some strong support forming at our 1 deviation support levels and hopefully a break out to the upside regression trend of 35 37 in the coming weeks once we bottom out It should be noted that we have some slight support around 30 at 5 deviations white dotted line on the 6month chart but it seems like the price is already making its move down to our next deviation support levels Good luck to everyone out there buy that dip if we can hit support in the next week Peace 
5,om2lkc,t2_9qejvion,1626521939,/r/wallstreetbets/comments/om2lkc/thoughts_on_wfg/,1,Thoughts on WFG , removed 
6,om2mfc,t2_9qejvion,1626522041,/r/wallstreetbets/comments/om2mfc/thoughts_on_wfg_stock_forecast_looks_great_but_id/,1,Thoughts on WFG Stock forecast looks great but I d like the opinion of you 19 year old gamers , removed 
7,om2mz8,t2_7tj9fjg2,1626522095,/r/wallstreetbets/comments/om2mz8/best_stocks_to_buy_right_now/,1,Best stocks to buy RIGHT NOW ,yo all i have been looking a lot around finding out some of the best stocks out there right now any suggestions 
8,om2o5r,t2_5f3jdwop,1626522234,/r/wallstreetbets/comments/om2o5r/amcaudit_buy_fractional_shares_slap_the_asskwhen/,1, AMCaudit BUY Fractional shares amp SLAP the ASSK When you see buying pressure PILE ON Use brokers like FIDELITY to BUY new SHARES they don t participate in PFOF Thats how they get our order too the DARK POOL I wouldn t transfer though that creates what the market algo thinks is selling ,
9,om2pgy,t2_d3p100on,1626522391,/r/wallstreetbets/comments/om2pgy/amc_stock_to_the_moon_could_this_be_the_week/,1,AMC Stock To The Moon Could This Be The Week ,
10,om2qm7,t2_74lndk8l,1626522539,/r/wallstreetbets/comments/om2qm7/paper_hands_on_the_steering_wheel_to_my/,1,Paper hands on the steering wheel to my Lamborfeeti,
11,om2ryj,t2_c3acmd2z,1626522714,/r/wallstreetbets/comments/om2ryj/website_hosting_meaning_in_hindi_and_complete/,1,Website Hosting Meaning in Hindi and Complete Guide,
12,om2s61,t2_dausy2ic,1626522742,/r/wallstreetbets/comments/om2s61/viva_vvos_worlds_only_osa_cure/,1,VIVA VVOS WORLDS ONLY OSA CURE , removed 
13,om2uos,t2_c3yma,1626523054,/r/wallstreetbets/comments/om2uos/how_it_feels_to_finally_get_flair/,1,How it feels to finally get flair,
14,om2zi5,t2_4javs,1626523569,/r/wallstreetbets/comments/om2zi5/the_near_future_for_those_with_the_smoothest/,1,The near future for those with the smoothest brains and the diamond est hands ,
15,om31a2,t2_a3zgno0m,1626523800,/r/wallstreetbets/comments/om31a2/amarinvascepa_only_100pure_epa/,1,AMARIN VASCEPA only 100 pure EPA ,
16,om32h2,t2_cw2hcjj1,1626523941,/r/wallstreetbets/comments/om32h2/jeff_going_to_space_soon_so_i_bought_some/,1,Jeff going to space soon So I bought some JEFFINSPACE ,
17,om34ms,t2_a16iye0c,1626524183,/r/wallstreetbets/comments/om34ms/wish/,1,Wish, removed 
18,om35cf,t2_a16iye0c,1626524260,/r/wallstreetbets/comments/om35cf/wish_is_killing_me_i_wish_never_knew_this_stock/,1,Wish is killing me I wish never knew this stock,
19,om36ff,t2_a16iye0c,1626524395,/r/wallstreetbets/comments/om36ff/what_should_i_do_im_sick_of_wish/,1,What should I do I m sick of wish,
20,om3bo4,t2_8kobn6ls,1626524982,/r/wallstreetbets/comments/om3bo4/clov_lost_porn_im_still_not_fucking_leaving/,1,Clov lost porn IM STILL NOT FUCKING LEAVING ,
21,om3bsz,t2_aixgetpa,1626525001,/r/wallstreetbets/comments/om3bsz/cnbc_knows_we_about_to_get_paid/,1,CNBC knows we about to get paid ,
22,om3ejb,t2_8kobn6ls,1626525334,/r/wallstreetbets/comments/om3ejb/clov_lost_porn_still_not_fucking_leaving_the_show/,1,CLOV LOST PORN STILL NOT FUCKING LEAVING THE SHOW GOES ON ,
23,om3fpy,t2_7wf8i7zv,1626525449,/r/wallstreetbets/comments/om3fpy/wish_is_a_hoax/,1,WISH is a HOAX,WISH made me lose 2K yesterday I hope the 2 idiots that created that shitty website get raped by Jason Momoa Fuck them and fuck all their family tree Motherfuckers manipulated the number of active users on their IPO to steal from investors The feature product on WISH is a fucking fidget spinner What the fuck was I thinking The stock market is a dangerous place if the SEC allows fraud by IPOs IPOs should be strongly regulated Investros are getting raped these days by shitty IPOs The SEC behaves like a 4th world country agency Fuck WISH and fuck all the motherfuckers that work in that hoax of a company 
24,om3gdl,t2_5f3jdwop,1626525531,/r/wallstreetbets/comments/om3gdl/buy_fractional_shares_slap_the_asskwhen_you_see/,1,BUY Fractional shares amp SLAP the ASSK When you see buying pressure PILE ON Use brokers like FIDELITY to BUY new SHARES they don t participate in PFOF Thats how they get our order too the DARK POOL I wouldn t transfer though that would create what the algo thinks is selling pressure ,
25,om3htt,t2_cnbe57yz,1626525675,/r/wallstreetbets/comments/om3htt/tilray/,1,Tilray, removed 
26,om3ksc,t2_9vyvsjtn,1626525989,/r/wallstreetbets/comments/om3ksc/7_minute_trade_explained/,1,7 minute trade explained,
27,om3n0w,t2_4s6oi1ce,1626526247,/r/wallstreetbets/comments/om3n0w/the_excitement_of_theta_gang/,1,The Excitement of Theta Gang,
28,om3p83,t2_5y7rnokb,1626526503,/r/wallstreetbets/comments/om3p83/fundraiser_by_andrew_biehler_jackie_biehler_fund/,1,Fundraiser by Andrew Biehler Jackie Biehler fund raiser,
29,om3qmj,t2_9u0lfvf1,1626526628,/r/wallstreetbets/comments/om3qmj/sklz_long_term_investment_thoughts_on_this/,1,SKLZ Long term investment Thoughts on this , removed 
30,om3qwd,t2_a99k8,1626526657,/r/wallstreetbets/comments/om3qwd/dupont_is_the_next_mover/,1,DuPont is the next mover,We are headed into a horribly hot summer DuPont is a lead manufacturer in refrigerant for air conditioners We are going to see people who have held off on an AC start buying Do you need any more DD 
31,om3rak,t2_7bm2njqk,1626526706,/r/wallstreetbets/comments/om3rak/bb_728_moon/,1,Bb 7 28 moon ,I ll keep this short Fireside chat on the 21 unless they release patent sale details or start a new ir campaign about ivy partners I expect chop or dump Fb earnings on the 28th possible patent sale and or partnership announcement announcement Positions 8 6 12C x 50 8 6 20C x 39 Bunch of 2023 contracts and 400 shares
32,om3s2j,t2_a1ij2z6y,1626526797,/r/wallstreetbets/comments/om3s2j/i_found_some_rocket_love_here_in_brazil/,1,I found some rocket love here in Brazil ,
33,om3tyh,t2_9vyvsjtn,1626526932,/r/wallstreetbets/comments/om3tyh/same_day_trades_explained_7_min_trade/,1,Same day trades explained 7 min trade ,
34,om3uwq,t2_7zp0b9s2,1626527028,/r/wallstreetbets/comments/om3uwq/where_to_now/,1,Where to now ,
35,om3vdo,t2_dcizl48b,1626527078,/r/wallstreetbets/comments/om3vdo/the_financial_benefits_of_a_green_state/,1,The Financial Benefits of A Green State, removed 
36,om40w6,t2_7bm2njqk,1626527666,/r/wallstreetbets/comments/om40w6/bb_728_catalyst/,1,Bb 7 28 catalyst,Bb 7 28 moon I ll keep this short Bb has been riding the wave from amc and gme since the start Possible catalysts for a new moon to new highs on her own meme steam Most likely my ctatalyst positions will expire worthless but there s a chance she hits the rockets Fireside chat on the 21 unless they release patent sale details or start a new ir campaign about ivy partners I expect chop or dump Fb earnings on the 28th possible patent sale and or partnership announcement announcement Positions 8 6 12C x 50 8 6 20C x 39 Bunch of 2023 contracts and 400 shares
37,om41ba,t2_dcv37zv0,1626527708,/r/wallstreetbets/comments/om41ba/celu_world_leader_in_cellular_medicine/,1, CELU World leader in cellular medicine, removed 
38,om43m7,t2_dcv37zv0,1626527927,/r/wallstreetbets/comments/om43m7/celu_world_leader_in_cellular_therapy/,1, CELU World Leader in Cellular Therapy, removed 
39,om44hz,t2_c3e2qkw7,1626528029,/r/wallstreetbets/comments/om44hz/what_is_happening_here_to_meoh/,1,What is happening here to MEOH ,
40,om46yv,,1626528264,/r/wallstreetbets/comments/om46yv/return_to_the_origins/,1,Return to the origins, deleted 
41,om48rd,t2_8wpqvy3p,1626528438,/r/wallstreetbets/comments/om48rd/if_you_dont_think_doing_a_short_squeeze_on_ccl/,1,If you don t think doing a short squeeze on CCL that s tanking because this new delta covid strain and calling it Delta Squeeze isn t the most WSBs most meme worthy shit ever then why are you even here ,
42,om49b1,t2_8wpqvy3p,1626528499,/r/wallstreetbets/comments/om49b1/if_you_dont_think_doing_a_short_squeeze_on_ccl/,1,If you don t think doing a short squeeze on CCL that s tanking because this new delta covid strain and calling it Delta Squeeze isn t the most WSBs most meme worthy shit ever then why are you even here ,
43,om4cxb,t2_cm7ck71w,1626528897,/r/wallstreetbets/comments/om4cxb/tal_ticket/,1,TAL Ticket, removed 
44,om4dcg,t2_5ah7xvia,1626528934,/r/wallstreetbets/comments/om4dcg/pm_patent_infringement_failures_bodes_well_for/,1, PM patent infringement failures bodes well for HCMC trial outcome and possible bounce ,
45,om4ey3,t2_cte98paa,1626529101,/r/wallstreetbets/comments/om4ey3/what_do_think_about_sq_short_and_long_term/,1,What do think about SQ short and long term ,
46,om4hik,t2_cm7ck71w,1626529329,/r/wallstreetbets/comments/om4hik/ticket_tal_china/,1,Ticket TAL China,Hello China promotion ticket TAL U turn Now it will go up The price is very sweet buy before it s too late and earn money See what volumes are going to buy The USB fund has already bought and has a 13 stake in TAL 
47,om4mu8,t2_60razbpu,1626529866,/r/wallstreetbets/comments/om4mu8/cine_most_shorted_stock_in_britain_rn_up_10_today/,1,CINE most shorted stock in Britain rn up 10 today, removed 
48,om4oz7,t2_a2jknrax,1626530088,/r/wallstreetbets/comments/om4oz7/a_storm_is_coming/,1,A Storm is Coming, removed 
49,om4u29,t2_9ie6lg46,1626530540,/r/wallstreetbets/comments/om4u29/palantir_partners_with_scuderia_ferrari_pltr/,1,Palantir Partners With Scuderia Ferrari PLTR, removed 
50,om4un7,t2_213a2kft,1626530582,/r/wallstreetbets/comments/om4un7/biib_lost_fda_approval_back_to_277/,1,BIIB lost FDA approval back to 277,
51,om4wcv,t2_64gj2k24,1626530753,/r/wallstreetbets/comments/om4wcv/the_current_status_of_my_spy_calls/,1,The current status of my spy calls ,
52,om4yd8,t2_aww9rnq1,1626530957,/r/wallstreetbets/comments/om4yd8/help_me_invest/,1,Help me invest,I missed the opportunity to buy AMC before June because I was too scared to lose money Is there another stock like AMC GME that is about to skyrocket 
53,om4zru,t2_a155sgkt,1626531101,/r/wallstreetbets/comments/om4zru/without_all_of_your_support_i_never_could_of_gone/,1,Without all of your support I never could of gone from 110 000 to 11 000 Thankyou to all who helped make this happen Winning at losing is still a win right , removed 
54,om50ft,t2_4p8czndn,1626531170,/r/wallstreetbets/comments/om50ft/well_to_all_the_apes_saying_i_could_make_my_money/,1,Well to all the apes saying I could make my money back thanks for the encouraging words It s now really over ,
55,om51e6,t2_a6evqi7l,1626531266,/r/wallstreetbets/comments/om51e6/8k_loss_in_2_daysi_guess_i_belong_here_now/,1,8k loss in 2 days I guess I belong here now ,
56,om51qo,t2_ha183,1626531299,/r/wallstreetbets/comments/om51qo/ill_take_my_tendies_delivered_please/,1,I ll take my tendies delivered please,
57,om54d9,t2_8gkjkt5x,1626531524,/r/wallstreetbets/comments/om54d9/wsb_wall_street_bets_this_is_our_market_now/,1,WSB Wall Street Bets This Is Our Market Now Essential,
58,om561n,t2_z90bq,1626531691,/r/wallstreetbets/comments/om561n/who_is_the_real_papa_from_wsb_jerome_powell_or/,1,Who is the real papa from WSB Jerome Powell or Elon Musk , removed 
59,om562q,t2_3lmawy7q,1626531693,/r/wallstreetbets/comments/om562q/never_had_sex_in_my_life/,1,Never had sex in my life,
60,om5767,t2_a0ipk2cx,1626531775,/r/wallstreetbets/comments/om5767/lol/,1,LOL,
61,om57ek,t2_92zgh3c9,1626531793,/r/wallstreetbets/comments/om57ek/__/,1, , removed 
62,om59c1,t2_a0pttjjd,1626531982,/r/wallstreetbets/comments/om59c1/sofi_soxl_wishdid_i_win/,1,SOFI SOXL WISH did I win ,
63,om59qk,t2_86s90,1626532023,/r/wallstreetbets/comments/om59qk/i_need_a_crazy_idea_how_to_make_my_100k_back/,1,I need a crazy idea how to make my 100k back ,So i ve noticed a lot of people posting loss porn and it gives me a little solace knowing i m not the only retard who lost 90 or more of everything in just a couple weeks I have about 5k left and need to remake my 100k whats the quickest way to go about this Serious answers only Plan A take some time off the market wait until markets tank because they probably will the bullshit that happened from march until end of May then buy some cheap calls on some meme stock like Wish or Clov if they re in the sub 8 area I honestly think this is a fool proof idea 
64,om5awi,t2_dcx2cems,1626532140,/r/wallstreetbets/comments/om5awi/hi/,1,Hi, removed 
65,om5du8,t2_ack6kz1s,1626532427,/r/wallstreetbets/comments/om5du8/uranium_looks_good_right_now_ura/,1,Uranium looks good right now URA,
66,om5dub,t2_dcwrpe05,1626532427,/r/wallstreetbets/comments/om5dub/thinking_of_nok/,1,Thinking of NOK , removed 
67,om5eco,t2_a1hcbs4m,1626532477,/r/wallstreetbets/comments/om5eco/regulatory_notice_2119_please_comment_with_finra/,1,Regulatory Notice 21 19 Please comment with FINRA it is our chance to be heard ,
68,om5gm7,t2_ar0dtukp,1626532681,/r/wallstreetbets/comments/om5gm7/this_wont_help_amc_the_bad_news_just_keeps_coming/,1,This won t help AMC The bad news just keeps coming ,Well multiple lawsuits and several twists and turns later AMC has now agreed to pay a 200 million settlement to Darabont over his dispute which claimed the network had used shady accounting to short them on profits according to the Hollywood Reporter 
69,om5k9e,t2_cl70qc4u,1626532987,/r/wallstreetbets/comments/om5k9e/tilray_special_meeting_a_farse/,1,TILRAY SPECIAL MEETING A FARSE , WILL SOMEONE PLEASE TELL ME WHY THIS APPEARS AS A PLOY TO HIDE POOR MANAGEMENT AND HIDE THE SQUANDERING OF ASSETS TO WHICH THEY HAVE BEEN ENTRUSTED ON THE BEHALF OF ALL STOCKHOLDERS THIS SHOULD BE A STOCK THAT IS A WINNER WITH ALL THE NEGITIVE ACTIONS THIS SPECIAL MEETING IS TRYING TO SKATE BY WITH THE MANAGMENT IS TRYING TO BE ACCOUNTABLE TO NO ONE BUT THEMSELVES PROPOSAL NUMBERS 2 3 amp 5 IF THESE PASS THEY ALONE WILL BE IN CONTROL OF A COMPANY THAT IS HEADED TWARD BEING A PENNY STOCK OR WORST REVERSE SPLITS THEN BANKRUPTCY THESE ACTIONS THAT ARE BEING PROPOSED ARE IN MY OPINION AS WITH MANY OTHER STOCKHOLDERS A DIRECT BREACH OF FIDUCIARY DUTIES THEY HAVE DONE NOTHING WITH ALL THE MERGERS THAT SHOULD HAVE INCREASED THE OVERALL VALUE A STOCK THAT SHOULD BE TRADING IN THE 40 TO 50 RANGE IS SINKING LIKE THE TITANIC THIS IS NOT AT ALL EXCEPTABLE I FOR ONE DO NOT WANT LOOSE CANNONS RUNNING MY INVESTMENTS INTO THE GROUND THEY ARE ALL ACTING AS TROJAN HORSES PROPOSAL NUMBER 1 BY ADDING MORE STOCK WE DECRESE THE VALUES EXPODENTUALY UNFORTUNATLY I HAVE SEEN THESE ACTIONS BRING MANY CORPORATIONS TO THE POINT OF NO RETURN PROPOSAL NUMBER 4 HAVING A SUDDEN INTREST IN PREFERED STOCK AS WELL AS COMMON STOCK DIRECTLY TELLS ME AGAIN THE LITTLE GUY IS BEING LEFT IN THE TRENCHES OF THE VALUELESS ABISS WHO WILL HOLD MOST OF THESE PREFERED CERTIFICATES M ANAGEMENT THE ONES WITH THE D EEPEST P OCKETS THIS IS NOT A BERKSHIRE HATHAWAY TYPE OF CORPORATION WITH THE ELIMINATIONS PROPOSED IN NUMBER 4 RECOMENDATIONS BY THE MANAGEMENT ALLOWS THEM AGAIN TO BE UNBRIDLED TO RUN AMUCK TO DO AS THEY PLEASE IF YOU DO NOT AGREE WITH THE HIGHERARCEY YOU CAN EASILY BE EJECTED FROM YOUR POST THE ONES THAT REVERANCE THEIR CHARGE TO PROTECT WE THE LOWLY STOCKHOLDERS NOT THEIR OWN P OCKETS ARE OUT THE DOOR THEN THERE IS PROPOSAL NUMBER 6 PLAY BY MY RULES OR I AM TAKING MY BALL HOME LACK OE INTEREST MEANS NO DO WHAT I SAY THEN WE WILL BRING IT BACK TO PLAY ARE WE IN KINDERGARDEN THANKYOU FOR READING AND POSTING THIS
70,om5n8x,t2_86n1sueh,1626533280,/r/wallstreetbets/comments/om5n8x/south_africa_riots_spiraling_out_of_control_gold/,1,South Africa riots spiraling out of control Gold to the moon ,SA is the world s top producer of gold chromium and other metals With unrest people are also moving their money to assets gold and dare i say coin GLD 180 calls for September 
71,om5o33,t2_82wiubyj,1626533364,/r/wallstreetbets/comments/om5o33/cineworld/,1,Cineworld, removed 
72,om5o6p,t2_7kb4suod,1626533373,/r/wallstreetbets/comments/om5o6p/uvxy_hard_to_borrowno_shares_to_short/,1, UVXY hard to borrow no shares to short,Time for the mother of all VIX squeezes no shares available of this leveraged VIX etf right as market is rolling over post opex Add Delta variant FUD and US fiscal cliff deadline end of July and we have the perfect storm brewing for a WSB gamma squeeze https www shortablestocks com UVXY
73,om5oja,t2_bnm21y0i,1626533409,/r/wallstreetbets/comments/om5oja/50_etoro_referral_bonus_if_you_sign_up_through_my/,1, 50 eToro referral bonus if you sign up through my link https etoro tw 3sRfesZ Code 3sRfesZ Limited to 10 people ,
74,om5pfx,t2_5dpd5b20,1626533496,/r/wallstreetbets/comments/om5pfx/another_5k_to_invest_wish_clov_or_wkhs/,1,Another 5k to invest WISH CLOV or WKHS , removed 
75,om5pj4,t2_a34r0j8c,1626533505,/r/wallstreetbets/comments/om5pj4/what_trading_platform_do_you_guys_recommend/,2,What trading platform do you guys recommend ,I m currently using Charles Schwab and I m not sure it s the platform I want I want a platform that will show me a break even price after purchase Any suggestions 
76,om5pnm,t2_7kb4suod,1626533518,/r/wallstreetbets/comments/om5pnm/uvxy_hard_to_borrowgamma_squeeze_vix_time/,1,UVXY hard to borrow gamma squeeze Vix time, removed 
77,om5qty,t2_7kb4suod,1626533628,/r/wallstreetbets/comments/om5qty/uvxy_hard_to_borrowgamma_squeeze_time/,1,UVXY hard to borrow gamma squeeze time,Time for the mother of all VIX squeezes no shares available of this leveraged VIX etf right as market is rolling over post opex Add Delta variant FUD and US fiscal cliff deadline end of July and we have the perfect storm brewing for a WSB gamma squeeze https www shortablestocks com UVXY
78,om5sml,t2_b7vzwrho,1626533777,/r/wallstreetbets/comments/om5sml/the_loss_wave/,1,the loss wave,I see so many people talking about their loss in wsb rn I think we are on a loss wave thing We need to overcome that then well be back going right to the moon I personally made 14 minus with BB and 7 with WISH acually not too bad I will hold until im down 50 cause I belive in the moon fly Which will be there in a few days Whats your biggest loss rn and how long are you willing to hold 
79,om5wrh,t2_aoskxlq5,1626534115,/r/wallstreetbets/comments/om5wrh/still_hodling/,1,Still hodling,
