,postid,author,created_utc,permalink,score,title,selftext
5,olgqgc,t2_8tcbs56g,1626441632,/r/wallstreetbets/comments/olgqgc/hims_releases_new_product_bundles_as_it_focuses/,1, HIMS releases New Product Bundles as it Focuses More on Sexual Health expands into sex toys and dating apps Really big things coming ,
6,olgr0k,t2_ccn8lat5,1626441686,/r/wallstreetbets/comments/olgr0k/branson_vs_bezos_now_that_the_emotions_have/,1,Branson vs Bezos Now that the emotions have passed a bit let s compare the different metrics of Branson s SpaceShipTwo Virgin Galactic and Bezos s New Shepard Blue Origin ,Branson vs Bezos Now that the emotions have passed a bit let s compare the different metrics of Branson s SpaceShipTwo Virgin Galactic and Bezos s New Shepard Blue Origin 1 Purpose The goals of both are suborbit space tourism Therefore it is not entirely correct to call Mask a competitor Musk is not known for space tourism now His SpaxeX WTF CrewDragon aims to take cargo WTF satellites into orbit and astronauts and cargo on ISS which is at an altitude of 408 km In general it is incomparable about the other 2 So who will fly into space Well here s a question of the interpretation of what is considered outer space NASA and the US Air Force consider the conditional line to be 80 kilometers many other countries consider the Karman line or 100 kilometers But the line is conditional hence conditional Gagarin flew into orbit at an altitude of 302 this is a completely different topic SpaceShipTwo has climbed 85 kilometers space by NASA standards New Shepard will rise to 105 kilometers on test flights it reached more than 100 km 3 What is the essential difference between SpaceShipTwo and New Shepard New Shepard the principle of the classic launch vehicle and capsule on the principle of and SpaceX Start vertically from the cosmodrome then the capsule is separated from the reusable carrier and lands with the help of parachutes Virgin Galactic is the first to take off from a launch altitude of approximately 20 km using a WhiteKnight2 aircraft 4 And the duration The entire process for SS2 takes about 2 hours due to the slower reaching the suborbit and descent the NS reaches and returns in 10 minutes At the same time the time in zero gravity is approximately the same 4 minutes 5 Got it What about the price SS2 tickets cost approximately 250 000 but booked 17 years in advance NS price is still unknown but speculated about 500 000 5 By the way where does the name come from SpaceShipTwo is just a SpaceShip2 New Shepard is named after the first American astronaut to fly suborbital Alan Shepard 
7,olgrm4,t2_yvq3hb8,1626441743,/r/wallstreetbets/comments/olgrm4/are_you_ready_for_the_4th_industrial_revolution/,1,Are you ready for the 4th industrial revolution This interview with Cryptokang could help you in your quest ,
8,olgtju,t2_a2modka1,1626441920,/r/wallstreetbets/comments/olgtju/th_flames_getting_higher/,1,Th flames getting higher ,
9,olgu6j,t2_a0ct110s,1626441980,/r/wallstreetbets/comments/olgu6j/f45_to_45/,1,F45 to 45 , removed 
10,olgucv,t2_7jwyb4xd,1626441998,/r/wallstreetbets/comments/olgucv/crsr_reasons_why_it_will_go_up_and_touch_the_moon/,1,CRSR Reasons why it will go up and touch the moon Elgato , Elgato the goose that lays golden eggs for CRSR Elgato is a Corsair subsidiary selling streaming equipment Elgato contributed for 33 2 of total net revenue in Q1 2021 175 9M compared with 24 6 in Q1 2020 75 9M In my opinion it will soon be 50 of the total net revenue of CRSR considering the high rate of growth of this industry and its leading position in this booming market Elgato also contributed 43 of total gross profit in Q1 2021 68 9M compared with 28 2 in Q1 2020 22 1M Streaming products have higher margin due probably to the brand awareness and the leading position of Elgato in the streaming market There is no direct competitor proposing a WHOLE plug and play streaming setup Elgato just released new dope products yesterday July 15th including a Camera The Facecam is a new product that they did not sell before and that was very highly anticipated In my opinion it will sell like hot cakes The other new products also provide all the parts that were missing to have a complete streaming setup Wave XLR and Wave Mic Arm and they also release a Mk 2 of their Stream Deck their flagship product With all these new products they are all set for a whole year at least and they are establishing their leadership in the streaming gear market once and for all All the streamers influencers will be talking about that in the next days The two main reasons why the stock tanks spoiler it s not EagleTree The lack of guidance for S2 2021 and after At the time of the Q1 2021 earnings call transcript we were still in the covid period and it was difficult even for the CEO to predict if the gaming trend will continue in the same vein for S2 2021 This lack of guidance does not encourage institutional investors to buy more for the moment in my heart I feel that we are on a strong and long term trend Q2 earning and commentary coming out on August 3rd will be decisive The global chip shortage I think we are all aware of this problem We don t really know when it will end but to mitigate a little the CEO said in the last earnings call that Corsair was not as impacted as we can imagine by this shortage due to its mix of products Eagle Tree just a reminder Eagle Tree is a private equity firm that helped Corsair grow substantially since 2017 They sold 2 287 511 shares on Monday 14th and 432 989 shares on Tuesday 15th they still have 54 179 559 shares which is equivalent to 58 5 of ownership They helped CRSR make good acquisitions Elgato SCUF Origin PC and they are taking some profit So thank you Eagle Tree for your good job Whether it is Eagle Tree or anyone else who sells the only thing that matters is the price Institutional investors will buy at those prices if they have more visibility I think that the next results will bring this visibility At that time even if Eagle Tree want to sell all their shares they will be swallowed up by the buyers Earnings August 3rd coming soon I expect a strong beat for Q2 earnings but the more important thing will be the commentary about guidance In my opinion you will want to be in the rocket for this date not a financial advice Logitech earnings release is on July 26th this will give an idea of the general market trend My position 400 shares at 35 60 Some CRSR numbers market cap 2 8B Revenue 1 92B TTM Gross Income 540M TTM Net Income 149M TTM Conclusion TL DR It will moon sooner or later so Buy shares don t sell calls no need to cover anything this is obviously not a financial advice Source Corsair Gaming Inc CRSR Q1 2021 Earnings Call Transcript
11,olgud6,t2_a3h5sc6v,1626441999,/r/wallstreetbets/comments/olgud6/scam_this_so_called_broker_is_a_thief_and_a/,1,Scam This so called broker is a thief and a scamer Thomas Ealey Lost 6000 when I asked for withdraw he don t answer anymore FXtoall ,
12,olgvmn,t2_9oj5246w,1626442140,/r/wallstreetbets/comments/olgvmn/sung_gnus_and_it_sounds_so_sweet/,1,SUNG GNUS and it sounds so sweet, removed 
13,olgwxe,t2_a0wepahv,1626442273,/r/wallstreetbets/comments/olgwxe/i_like_what_im_seeing_in_the_wayfair_w_charts_and/,0,I like what I m seeing in the Wayfair W charts and short interest I m going in and here is my plan entry and exit positions included , removed 
14,olgwxi,t2_cji90q1v,1626442273,/r/wallstreetbets/comments/olgwxi/sorry_chris_fernandez/,1,Sorry Chris Fernandez ,
15,olgx2w,,1626442291,/r/wallstreetbets/comments/olgx2w/hims_unveils_new_product_bundles_as_it_focuses/,1, HIMS Unveils New Product Bundles as it Focuses More on Sexual Health and expands into Sex Toys and Dating apps Big things to come , deleted 
16,olgycx,t2_a0jj4jdb,1626442430,/r/wallstreetbets/comments/olgycx/i_think_im_doing_this_right_wen_moon/,0,I think I m doing this right wen moon ,
17,olgz2d,t2_9k18nfcn,1626442503,/r/wallstreetbets/comments/olgz2d/short_sellers_openly_attacking_oatly/,1,Short sellers openly attacking Oatly, This one seems pretty simple https www cnn com 2021 07 15 business oatly stock short seller spruce point index html Who are you going to believe Some scummy NYC based short selling fund with a website from the early 2000s https www sprucepointcap com about us Or a well respected Swedish company giving us an alternative to drinking a cow s bodily fluids https www oatly com int stop plant based censorship No position yet still lobbying my wife s boyfriends for some cash to invest 
18,olgz7d,t2_clt6z9t6,1626442516,/r/wallstreetbets/comments/olgz7d/kempharm_short_squeeze_but_good_company_long_term/,1,Kempharm Short squeeze but good company long term, removed 
19,olgzn0,t2_90uf0glk,1626442554,/r/wallstreetbets/comments/olgzn0/when_bb_gonna_go_to_the_moon/,1,When BB gonna go to the moon , removed 
20,olgzt6,t2_a0rubp3u,1626442573,/r/wallstreetbets/comments/olgzt6/challenge_accepted/,1, challenge accepted,
21,olgzzk,t2_17ky1qyb,1626442589,/r/wallstreetbets/comments/olgzzk/nintendo_is_about_to_get_turbofucked/,1,Nintendo is about to get turbofucked,The new console from Valve is a HUGE threat to the switch It looks very promising in terms of hardware specs not to mention the PC gaming freedoms it provides Nintendo has been coasting on low tier hardware because 1 They re the only show in town and 2 The own mario and zelda With that first reason gone the switch s dominance is going to fade especially with the OLED switch letdown Combine all this with the growing resentment and spite piracy in their fanbase due to tone deaf lawsuits against fan projects and Nintendo is on shaky ground in the current gaming market Not investment advice btw
22,olh05g,t2_a3d3jsak,1626442605,/r/wallstreetbets/comments/olh05g/goo_spce/,1,Goo SPCE ,We ve got your back Virgin Atlantic You deserve to go to the moon Double bottom at 31 4 Options expired today so a lot of repositioning and gamma squeeze Opening with 3 6m shares and green for the first time this week 
23,olh1yl,t2_a0wepahv,1626442785,/r/wallstreetbets/comments/olh1yl/i_like_what_im_seeing_in_the_wayfair_w_charts_im/,1,I like what I m seeing in the Wayfair W charts I m going in and here is my plan entry and exit positions included ,Good Morning Apes Happy Friday I hope you have stopped the bleeding from all the red this week I know I haven t In analyzing charts last night I came across W which I think looks like a great trade that I entered into positions this morning at the open 4 shares and 3 Contracts W Jul 30 2021 300 Calls Short Interest The short interest has been increasing each quarter and is currently sitting at it s all time high of 4 8B amp x200B https preview redd it x73pkkamvkb71 png width 877 amp format png amp auto webp amp s cc874b4db37e8e8b2a0bb672dbe98929130f60f1 Next the short interest is currently at 21 2 with short interest volume currently 15x the average volume amp x200B https preview redd it tpjfb9covkb71 png width 886 amp format png amp auto webp amp s 3dd56241abf0920117440852797e1ae1ec4f68b8 Charts W is currently sitting at the 250 day support level blue line of 286 72 with room to run up to the resistance level green line of 307 09 easily You will see on the right new price targets of 355 and 400 which will help be short term catalyst for the stock I have a stop loss price at the purple line of 272 74 amp x200B https preview redd it 4isc26cpvkb71 png width 1793 amp format png amp auto webp amp s 5453904745771a33b4d816a37b61748802b5d4f4 With the short interest so high and short term news catalysts for the stock to run higher I think W is a great trade Safe flying Apes I hope this helps make some money for you all after a rough week 
24,olh35j,t2_cb29n,1626442908,/r/wallstreetbets/comments/olh35j/weekly_options_with_a_30_correction_the_single/,1,Weekly options with a 30 correction The single greatest transfer of wealth in history ,I came across a fintwit post today that showed monthly options are at an ATH average of 580bn a month The majority of them concentrated in weekly expirations It got me thinking about how much money is needed to payout the shorts should there be a week when the market decides to take another 20 30 crash Quick maths with tons of assumptions Let s say there s 250bn in weekly puts Let s say they re all bought ATM Let s say the market crashes quickly and results in back to back limit downs so most people aren t even able to sell and the majority of them are held to pretty decent gains If the markets drop 30 from say 360 QQQ that s 252 A weekly ATM put bought on Monday probably costs about 2 200 Assuming you held to full drop that s 108 intrinsic value and 106 profit Or 10 600 Or 5 300 gain per contract This is just considering ATM puts There s a good that would be a few strokes lower and return something like 10 000 15 000 In a week Now let s take those returns and apply them to the 250bn in puts floating around each month 250bn 6 000 gain 15 trillion dollars Just in ATM weeklies Yes this is napkin math and wildly speculative and blah blah I m illustrating a point When you consider all the short positions long term dates puts etc the cost of a 30 weekly correction is probably in the 100 TRILLION transfer of wealth to investors who are short American markets There s SO much money waiting to be paid out to shorts that I honestly don t think the governments could possibly allow it because it s such a large chunk of money that it would completely distort the entire global economy The market is never going to go UP 30 in a week It s too large and there s no catalyst for such a thing to ever happen So they can afford to payout calls overtime as they have slower but steadier gains However I honestly think the government namely the Fed sees how much money is at stake if they allow the market to correct and I don t think they can foot the bill Especially when you consider the lost 30 in market cap it would be the single greatest wealth transfer in history Tl dr there so much in leveraged short positions that a 20 30 crash in a week would be the largest transfer of wealth in history and possibly cost over 100 trillion in pay outs to bears 
25,olh3mf,t2_4ssqtwaf,1626442952,/r/wallstreetbets/comments/olh3mf/i_put_100k_on_cnk_am_down_like_20_in_a_week_and/,1,I put 100k on CNK am down like 20 in a week and don t know why,Obviously stock price changes are super emotional and often irrational but go with me on hypothesizing why this stock is down like 20 since I bought thousands of shares on Friday Reflecting I ve seen zero news articles on anything related to CNKs business dealings Zero Nothing seems to have fundamentally changed in the space Black Widow made a lot on streaming but it made more in ticket sales at live theaters My local theaters played sold out shows More people are going to movies the world opens back up The market overall isn t tanking So what are factors you all might contribute to the stock falling so quickly to n e lows Thanks for the insight Please avoid judgements or whatever in ur responses Looking for factual interesting thoughts or insights 
26,olh3wk,t2_6cypdxlc,1626442978,/r/wallstreetbets/comments/olh3wk/was_hoping_for_a_win_on_my_fist_options_trade/,1,was hoping for a win on my fist options trade help me out a little can everyone one buy 1 share ,
27,olh4kk,t2_pu7h3,1626443040,/r/wallstreetbets/comments/olh4kk/apes_in_a_nutshell/,1,Apes in a nutshell,
28,olh5cu,t2_clbnhr50,1626443115,/r/wallstreetbets/comments/olh5cu/blin_and_osat/,1,BLIN and OSAT, removed 
29,olh6ce,t2_a2jme1sa,1626443217,/r/wallstreetbets/comments/olh6ce/gatz_is_103_institutional_held_with_high_float/,1,Gatz is 103 institutional held with high float This is a good opportunity,
30,olh7er,t2_t9h9htt,1626443320,/r/wallstreetbets/comments/olh7er/yolo/,1,YOLO,
31,olh83n,t2_9bjjj7kx,1626443386,/r/wallstreetbets/comments/olh83n/nok_growing_at_a_steady_pace_lately_great_long/,1,NOK growing at a steady pace lately great long term option Maybe ,
32,olh84f,t2_9zldkrul,1626443387,/r/wallstreetbets/comments/olh84f/aal/,1,AAL,Expected to go up because of it s more flights and lot of good news 25 near term What do you think 
33,olh86o,t2_4ssqtwaf,1626443393,/r/wallstreetbets/comments/olh86o/i_put_100k_on_cnk_friday_am_down_15k_and_dont/,1,I put 100k on CNK Friday am down 15k and don t know why,
34,olh8k7,t2_1tsbmref,1626443428,/r/wallstreetbets/comments/olh8k7/lost_it_all/,1,Lost it all ,
35,olh92k,t2_73d8kxxx,1626443476,/r/wallstreetbets/comments/olh92k/i_can_see_it_coming_from_a_mile_away/,1,I can see it coming from a mile away ,
36,olh9g4,t2_gf16136,1626443513,/r/wallstreetbets/comments/olh9g4/federal_marijuana_reform_plan_is_a_new_beginning/,1,Federal marijuana reform plan is a new beginning OTC MJNA ,
37,olh9pm,t2_a1hgkn9j,1626443537,/r/wallstreetbets/comments/olh9pm/amc_to_the_moon/,1,AMC to the MOON, removed 
38,olha8u,t2_b8yjw,1626443588,/r/wallstreetbets/comments/olha8u/my_fellow_apes/,1,My Fellow Apes ,
39,olhbaq,t2_a1hgkn9j,1626443684,/r/wallstreetbets/comments/olhbaq/amc_to_the_moon/,1,AMC to the MOON , removed 
40,olhboc,t2_1qgm9vfs,1626443721,/r/wallstreetbets/comments/olhboc/upst_great_fundamentals_now_at_a_good_price/,1, UPST great fundamentals now at a good price,Longtime lurker here really believe in this one see comments for proof and wanted to share some thoughts Tech UPST is a tech company at its core operating within and disrupting the finance industry Their product is cutting edge AI underwriting that evaluates risk better than financial institutions and other fintechs are able to Their credit models can be applied to many different verticals see TAM TAM Already huge with personal lending and they ve just begun expanding into auto lending including an acquisition of Prodigy online platform which partners with dealerships nationwide to offer auto financing UPST is also ripe for expansion into credit cards student loans mortgages retail loans etc given that their credit models are their bread amp butter Leadership well known ex Google execs Thiel Fellow Investors include former Google CEO Eric Schmidt as well as Mark Cuban amp Marc Benioff They ve built a team of top tier Silicon Valley data scientists amp engineers Financials amp Execution Both reported earnings have significantly beat expectations with strong revenue growth loan count growth and conversion rate improvements Next earnings will be reported on 8 10 This has all been accomplished with a modest number of bank partners and they ve closed acquisitions and partnerships since IPO Prodigy NXTsoft which will help accelerate this growth in the coming quarters Holdings CEO still owns 15 of the stock and a huge number of shares are still held by insiders despite the lock up expiring about a month ago Signals confidence in company and conviction that stock is undervalued Price Up 450 since IPO and hit an all time high of 190 a few months ago but down over the last several weeks and at current price of 110 sounds like a bargain 
41,olhbzo,t2_9e7r4p5d,1626443749,/r/wallstreetbets/comments/olhbzo/it_happened_for_gme_amc_twice_it_can_happen_for/,1,It happened for GME amp AMC twice it can happen for TKAT Is TKAT eligible for that run YES NFT revolution for digital art Make it happen again , removed 
42,olhck9,t2_5mwyffgm,1626443806,/r/wallstreetbets/comments/olhck9/analyst_coverage_is_starting/,1,Analyst coverage is starting,
43,olhdlo,t2_14282y,1626443901,/r/wallstreetbets/comments/olhdlo/can_anybody_explain_this_i_bought_xx_shares_at_25/,1,Can anybody explain this I bought xx shares at 25 and xx at 28 the next day But E TRADE s average paid price is 34 , removed 
44,olhdv9,t2_5b1cy66p,1626443924,/r/wallstreetbets/comments/olhdv9/tsla_is_being_manipulated_every_single_day_by_the/,1, tsla is being manipulated every single day by the shorts We need to squeeze their greedy pimple heads Help Army , removed 
45,olhdwu,t2_a0wepahv,1626443929,/r/wallstreetbets/comments/olhdwu/i_like_what_im_seeing_with_wayfair_w_chart/,1,I like what I m seeing with Wayfair W Chart included I m going in and here is my plan entry and exit positions included , Good Morning Apes Happy Friday I hope you have stopped the bleeding from all the red this week I know I haven t In analyzing charts last night I came across W which I think looks like a great trade that I entered into positions this morning at the open 4 shares and 3 Contracts W Jul 30 2021 300 Calls Interest The interest has been increasing each quarter and is currently sitting at it s all time high of 4 8B amp x200B https preview redd it 2zi9s5pgxkb71 png width 877 amp format png amp auto webp amp s 1f23bd4461e08d96fa7331d8ba8e0a9e4254baec Next the interest is currently at 21 2 with interest volume currently 15x the average volume amp x200B https preview redd it z0ie55aixkb71 png width 886 amp format png amp auto webp amp s 9406000078b4ab7b0bf53d10d88e2d8a162c5535 Charts W is currently sitting at the 250 day support level blue line of 286 72 with room to run up to the resistance level green line of 307 09 easily You will see on the right new price targets of 355 and 400 which will help be immediate term catalyst for the stock I have a stop loss price at the purple line of 272 74 amp x200B https preview redd it rmqreo4jxkb71 png width 1793 amp format png amp auto webp amp s 9dc89f0a47c7f0a52ca258976f0f6985a8bcfa82 With the interest so high and immediate term news catalysts for the stock to run higher I think W is a great trade Safe flying Apes I hope this helps make some money for you all after a rough week 
46,olhe2k,t2_4pit6px6,1626443945,/r/wallstreetbets/comments/olhe2k/am_i_an_ape_yet_started_investing_in_january_made/,1,Am I an Ape yet Started investing in January Made 11k then lost 13k ,
47,olhe5k,t2_81gt3ebo,1626443952,/r/wallstreetbets/comments/olhe5k/volume_so_far_is_25m_but_over_6m_shares_have_been/,1,Volume so far is 2 5M but over 6M shares have been borrowed today CLOV CLOV,
48,olheba,t2_a1xdqt01,1626443967,/r/wallstreetbets/comments/olheba/gxgx_short_squeeze/,1, GXGX Short Squeeze, removed 
49,olhgcs,t2_o90ui,1626444125,/r/wallstreetbets/comments/olhgcs/why_otis_worldwide_shares_should_elevate/,1,Why Otis Worldwide Shares Should Elevate, Otis which makes elevators and escalators has operationally underperformed peers in the past decade due to a weaker exposure to a booming China underinvestment and the unwinding of previous overearning With the Chinese market stabilizing and Otis capital expenditures rising to levels more in line with peers its relative underperformance will decline Indeed its organic growth shortfall versus peers has already been halved since 2016 Similarly margins now appear sustainable Moving forward Otis is likely to remain a slightly slower growth company than its competitors Kone and Schindler but thanks to its larger service exposure it should earn higher margins and return on common equity We derive our 95 price target using a discounted cash flow analysis with an upward adjustment reflecting the likelihood of greater than expected capital returns 
50,olhgif,t2_cs6fcw00,1626444140,/r/wallstreetbets/comments/olhgif/long_on_gold_beginning_of_a_new_gold_rally/,1,Long on Gold Beginning of a new gold rally ,Is this just the beginning of a new gold rally The gold price has fallen quite a bit lately Recently however it is slowly moving up again Probably fueled by the increasingly pressing issues such as inflation negative interest rates etc This could be the beginning of a new gold rally The good thing is that the price is currently still well below past peaks That means there is just a lot of potential upside and an entry could pay off I myself am now long with an open end turbo I see there short to medium term a strong potential which can be well exploited with the leverage in my opinion Knockout I would set somewhere below 1700 in order not to drive too risky The leverage is nevertheless quite high What do you think Do your own DD I am not a financial advisor and this is not financial advice 
51,olhgmn,t2_btqdpb70,1626444150,/r/wallstreetbets/comments/olhgmn/thank_you_facebook_nvda_biogen/,1,Thank you Facebook NVDA Biogen,
52,olhgsj,t2_5b1cy66p,1626444162,/r/wallstreetbets/comments/olhgsj/tslabeing_squeezed_every_single_day_tsla_army_you/,1, tsla being squeezed every single day tsla army you are needed , removed 
53,olhh58,t2_a0pzzpkb,1626444195,/r/wallstreetbets/comments/olhh58/yolo_gamestop_playing_chess_with_my_brand_new/,1,YOLO GameStop Playing chess with my brand new student loan 18k May the retard force be with me ,
54,olhha5,t2_14282y,1626444206,/r/wallstreetbets/comments/olhha5/can_anyone_explain_this_i_bought_xx_shares_of_a/,1,Can anyone explain this I bought xx shares of a stock I had 0 shares of at the time at 25 and then the next day bought xx 28 but E TRADE s average price paid column says 34 how does that make sense I checked the transactions and it says xx successfully executed at 25 and 28 , removed 
55,olhhdg,t2_4pit6px6,1626444214,/r/wallstreetbets/comments/olhhdg/am_i_an_ape_yet_started_investing_in_january_made/,1,Am I an Ape yet Started investing in January made 11k then lost 13k in a month ,
56,olhi7g,t2_5b1cy66p,1626444286,/r/wallstreetbets/comments/olhi7g/tsla/,1, tsla, removed 
57,olhi9d,t2_60t72,1626444291,/r/wallstreetbets/comments/olhi9d/thank_you_wsb_this_sub_is_so_much_better_now/,1,Thank you wsb this sub is so much better now,I think this is outside the realm of proper discussion but thanks mods the sub is so much better now and closer to what it once was
58,olhji2,t2_chvh3qkw,1626444406,/r/wallstreetbets/comments/olhji2/am_i_doing_this_right/,1,Am I doing this right ,
59,olhjj3,t2_5khmcerc,1626444409,/r/wallstreetbets/comments/olhjj3/negg/,1,NEGG, removed 
