,postid,author,created_utc,permalink,score,title,selftext
39,ofi7lr,t2_955smt3z,1625662033,/r/wallstreetbets/comments/ofi7lr/shen_maybe_not_the_free_lunch_that_it_looks_like/,1,SHEN Maybe not the free lunch that it looks like ,I am not a financial advisor I do not have a crystal ball I am a random ape who spent more time writing this up than researching the facts There seems to be a lot of misinformation likely for pump purposes or lazy research out there If you re just riding the pump or are doing a covered call play god speed You may not care about this post For anyone actually planning on holding through August 3 2021 especially those trading on RH please consider the following Shen sold their telecommunication business to T Mobile T for 1 94 Billion I ll refer to this as TA 936 6 million to shareholders via special divided of 18 75 684 is going to be used to pay down debt The rest towards taxes I believe After the sale of the telecommunication business Shen will shift its focus to it s broadband and tower business I ll refer to Shen post sale of their telecom business as ShenP PE and Earnings Moving Forward The EPS for TA for 2020 was 2 48 and 0 97 last quarter this is very solid The EPS for ShenP was 0 05 in 2020 and a solid 0 06 last quarter 2022 forecasted EPS of 0 29 The revenues for ShenP were 220 78M and are forecasted to grow 10 6 for 2021 244 2M and 2022 270M Google and yahoo give you a PE of 18 59 I ve seen this same number in posts but ShenP s PE for last Q s earning is closer to 254 and the forecast for 2022 is a PE of 210 These are based on 61 per share Let s say you re still comfortable dealing with share price of 42 25 61 18 75 because you get that juicy dividend the PE is still very high at 176 I ve also seen a lot of information and spamming of don t worry about your shares there will be a buyback after August 3 2021 The buyback is about 20 million dollars This is not worth talking about Insignificant Just being used as pump fodder Haven t see anything else related to a buyback Insiders didn t hold many shares but they have been dumping this thing and now hold less that 1 of shares sales as recent as June 10 2021 for 50 43 To those of you without premarket capabilities you are far more likely to get stuck hold bags during the eventual sell off So what s a company with 220 78M revenue and a forward guided EPS of 0 29 worth to you If you buy it at 61 and are stuck holding the bag at 42 25 the special dividend premium was eaten up by your loss you re saying that company is worth 2 1 Billion dollars You re paying 160M more than T Mobile paid it s acquisition but the company you own has 16x less earnings For transparency I hold puts many many puts I am not trying to create FUD or telling you to sell I just want people to know what they are buying I decided to use forward guidance and last Q which was solid for ShenP instead of 2020 numbers to try to be as fair as possible If any of this looks inaccurate please let me know 
40,ofi843,t2_csmpedqa,1625662083,/r/wallstreetbets/comments/ofi843/nokia_apes/,1,Nokia apes ,From Telecom TV 07 07 2021 Nokia Huawei and VMware were the three leading suppliers of Network Automation Software NAS to CSPs communications service providers in 2020 according to a new report from Appledore Research Nokia was the market leader with a 17 share of the 4 36 billion sector which Appledore has broken down into six categories of software products Domain Management the largest tranche worth 2 billion last year Distributed Cloud Infrastructure Management AIOps Service Orchestration Network Data Management and Lifecycle Management The Appledore team notes that the telecom support software sector landscape has been transformed and that automation is now the dominant driver of CSP spend on software That VMware is the third largest supplier with a market share of 9 in what is a very fragmented market is an indicator of the structural transformation in the sector For further details check out the Appledore website 
41,ofi894,t2_a0ofx6ut,1625662099,/r/wallstreetbets/comments/ofi894/heres_a_stock_to_invest_in/,1,Here s a stock to invest in,
42,ofi8ji,t2_a1e05aba,1625662130,/r/wallstreetbets/comments/ofi8ji/xela_yolo/,1,Xela yolo,
43,ofi9t0,t2_cw3y6lw4,1625662267,/r/wallstreetbets/comments/ofi9t0/singularitynet_agix_immediately_watch_this_video/,1,SingularityNet AGIX Immediately Watch this Video , removed 
44,ofi9u9,t2_7glv9cjl,1625662271,/r/wallstreetbets/comments/ofi9u9/kinda_want_to_sellmy_money_is_just_stagnant_in/,1,Kinda want to sell my money is just stagnant in AMC and i just down see this MOAS happening thoughts , removed 
45,ofi9v7,t2_a1gk9d7d,1625662274,/r/wallstreetbets/comments/ofi9v7/gr8apenation_on_twitter/,1,GR8APENATION on Twitter,
46,ofib2u,t2_b3c5vnpo,1625662398,/r/wallstreetbets/comments/ofib2u/negg/,1, negg, removed 
47,ofibcv,t2_18vpmrhr,1625662427,/r/wallstreetbets/comments/ofibcv/how_azz_play_could_fund_your_yacht/,1,How AZZ play could fund your yacht,AZZ isn t just a piece of meat for you degenerates to gawk at it s the perfect storm of a good company with good earnings that s poised to benefit from infrastructure growth and it s about to fly They recently repurchased 1 2 mil shares in FY 2021 https www azz com wp content uploads 2021 02 AZZ Inc Investor Presentation v2021 05 03 15 36FInal pdf Consistent earnings for years amp recently announced a 17 shr dividend OI is low w some strikes having zero open interest amp an extremely low float which means potential for delta hedging to send the price of AZZ This company is also a great infrastructure play They had slightly lower earnings last quarter due to slowdowns amp supply chain interruptions during covid but the future outlook is great and with Buyden s infrastructure bill being passed there will be even more money available to go into AZZ s pocket over the coming months amp years I m also personally a big fan of Blackrock amp Vanguard who happen to be the 2 largest institutional owners of AZZ https www nasdaq com market activity stocks azz institutional holdings over 90 of their shrs outstanding are held by institutions While competitors like ROLL amp VMI are sitting 54 amp 32 p e respectively a modest valuation of 25x p e x 2 53 expected trailing eps after Friday s earnings report would put AZZ a valuation of 63 25 shr which is my low end projection for post earnings but could easily be 30 p e or 75 share TLDR Huge upside potential at earnings this Friday for AZZ an established co with consistent earnings that will see benefits from infrastructure Current positions Several 8 20 60c amp a few 7 16 55c amp picking up more each day leading up to earnings 
48,ofibzz,t2_8yfwnkd,1625662497,/r/wallstreetbets/comments/ofibzz/is_the_mitq_ipo_an_amc_play/,1,Is the MITQ IPO an AMC play ,Moving iMage Technologies aka MiT will debut on the NASDAQ with an IPO on July 8th 2021 under the ticker MITQ an ultra low float debut with just 2 3M shares They sell digital movie projectors and supporting tech along with theater seats and those drink caddies that go between the seats One of their main customers is AMC https www tipranks com news article mit ipo to hit the market on july 8 all you need to know https www tipranks com news article mit ipo to hit the market on july 8 all you need to know These low float IPOs have been pretty crazy especially IPOs with Boustead Securities as the underwriter If you re looking for a possible quick buck buy MITQ off the debut and expect an immediate halt upwards possibly multiple halts This is a pretty speculative play but worth consideration depending on your risk tolerance Good luck 
49,ofic20,t2_7kebqnu4,1625662505,/r/wallstreetbets/comments/ofic20/tilrays_aphria_rx_gmbh_subsidiary_completes_first/,1,Tilray s Aphria RX GmbH Subsidiary Completes First Successful Harvest and Delivery of Medical Cannabis Grown in Germany,
50,oficvi,t2_c3yma,1625662592,/r/wallstreetbets/comments/oficvi/gme_is_the_number_one_meme_stock/,1,GME is the number one meme stock,
51,ofieg9,t2_71uaaias,1625662758,/r/wallstreetbets/comments/ofieg9/why_cei_a_penny_oil_stock_will_run_with_crude_oil/,1,Why CEI a penny oil stock will run with crude oil prices ,OPEC has not been able to come to a deal yet regarding oil supply therefore they are still only producing the amount of oil required during the pandemic With this summer s huge increase in oil demand and limited supply the Brent and WTI crude oil prices have reached all time highs Camber Energy CEI has shown the ability to move with the crude oil price as we saw last Thursday 7 1 21 It is a bottomed out play with a recent history of running over 200 in a matter of days I encourage you to check it OPEC has no meeting to discuss increasing supply which tells us that an oil price war is coming This is good for us and the oilers bad for the local college student filling up on gas every week However money always wins in the end and they know how to make money in the Middle East Bet on oil 
52,ofifmx,t2_9xw3drhd,1625662852,/r/wallstreetbets/comments/ofifmx/conversation_on_daily_trades_we_need_some/,1,conversation on daily trades we need some ,
53,ofighu,t2_6cvwo,1625662939,/r/wallstreetbets/comments/ofighu/stockpile_the_first_brokerage_to_offer_free/,1,Stockpile The first brokerage to offer free trading and zero commissions,
54,ofigo1,t2_a0ofx6ut,1625662956,/r/wallstreetbets/comments/ofigo1/rising_metal_prices_trigger_little_investor/,1,Rising metal prices trigger little investor interest so far in stalled N B mine,
55,ofihcz,t2_7b71rszy,1625663026,/r/wallstreetbets/comments/ofihcz/sftw_about_to_break_out_ticker_change_soon/,1,Sftw about to break out ticker change soon,Sftw is black sky no one has touch stock in a while but they have a price target of 20 and sitting at 10 options super cheap
56,ofiikj,t2_crtu41p4,1625663145,/r/wallstreetbets/comments/ofiikj/is_walmart_the_new_amc/,1,Is Walmart the new AMC, removed 
57,ofijaw,t2_970dylq1,1625663224,/r/wallstreetbets/comments/ofijaw/what_do_you_think_about_halo/,1,what do you think about halo , removed 
58,ofijir,t2_ntwk2,1625663246,/r/wallstreetbets/comments/ofijir/avepoint_dd_yolo/,1,Avepoint DD YOLO, removed 
59,ofik0e,t2_2z5wsv4l,1625663293,/r/wallstreetbets/comments/ofik0e/smile_and_hold/,1,Smile And Hold,
60,ofikwq,t2_15uew8fk,1625663389,/r/wallstreetbets/comments/ofikwq/virgin_tsla_vs_chad_astr/,1,Virgin TSLA vs Chad ASTR,
61,ofikxk,t2_702bowbv,1625663392,/r/wallstreetbets/comments/ofikxk/motley_fools/,1,Motley Fools, removed 
62,ofil3m,t2_6cvwo,1625663410,/r/wallstreetbets/comments/ofil3m/stockpile_the_first_brokerage_to_allow_free/,1,Stockpile The first brokerage to allow free trades and no commissions,
63,ofil9j,t2_a3vab7dr,1625663427,/r/wallstreetbets/comments/ofil9j/basic_attention_token_to_the_moon/,1,Basic Attention Token to the moon , removed 
64,ofiln5,t2_897objay,1625663464,/r/wallstreetbets/comments/ofiln5/enzc/,1,ENZC, removed 
65,ofim6w,t2_3yne92t3,1625663518,/r/wallstreetbets/comments/ofim6w/gotta_get_an_et_run_going_boys_and_gals/,1,Gotta get an ET run going boys and gals , removed 
66,ofim7j,t2_9u9onul5,1625663519,/r/wallstreetbets/comments/ofim7j/welcome_me_to_the_ape_world/,1,Welcome me to the ape world,After GME short squeeze I started intermittent fasting and saved 5 a day by skipping breakfast since feb 1st now brought 100 shares of CLOV Lost 20 pounds gained 100 CLOV 
67,ofim9y,t2_a0s7jdfj,1625663527,/r/wallstreetbets/comments/ofim9y/amcgme/,1,AMC GME, removed 
68,ofimbm,t2_897objay,1625663532,/r/wallstreetbets/comments/ofimbm/enzc/,1, ENZC, removed 
69,ofimgk,t2_ntwk2,1625663546,/r/wallstreetbets/comments/ofimgk/avepoint_dd_yolo/,1,Avepoint DD YOLO, AVPT MARKET CAP IS gt 2B SOURCE https techcrunch com 2020 11 23 avepoint to go public via spac valued at 2b BROKERAGES HAVEN T UPDATED TO THE CORRECT MCAP BECAUSE AVPT JUST WENT PUBLIC THROUGH A SPAC LAST WEEK THE MCAP DISPLAYED IS THE SPACS MCAP WHICH IS NO LONGER RELEVANT AND INCORRECT Read first thank me later AvePoint ticker AVPT the Largest Microsoft 365 Data Management Solutions Provider was just listed publicly on Nasdaq last week About AvePoint AvePoint is the largest data management solutions provider for the Microsoft cloud with over 1 300 employees in 29 global offices Key takeaway AvePoint was founded in 2001 as a company to help ease the complexity of SharePoint installations which at the time were all on premise Today it has adapted to the shift to the cloud as a SaaS tool and primarily acts as a policy layer enabling companies to make sure employees are using these tools in a compliant way amp x200B https preview redd it 51f1k5snis971 png width 2336 amp format png amp auto webp amp s f5a21e74013bb932021191f36d7d167184d39454 Company s Footprint Huge diversified blue chip client base 7 million members as of Sep 30 2020 with 16k accounts and 25 of Fortune 500 using the company s services 7M users represent 3 or 250M Microsoft 365 client base with an estimated addressable market of 33 billion by 2022 according to IDC The Company sells directly to large and mid market enterprises and its solutions are also available to managed services providers on more than 100 cloud marketplaces globally Regarding Microsoft the company Bridges the Gap Between What Microsoft Cloud Offers and What the Enterprise Requires amp x200B https preview redd it 3p82gi5pis971 png width 1876 amp format png amp auto webp amp s 5429d323037fa70921f7902f8b448ef6010f5cd1 Blue Chip Client Base Compared to other recent SPAC deals and business combinations we just saw AvePoint has indeed a great track record Expected 2020 revenues USD 148M a 26 YoY increase 78 recurring revenues There are 212 public software companies and AvePoint is one of 5 that is growing at a rate of more than 25 revenue while maintaining a 14 EBIT margin and 30 ARR growth The company is projecting significant growth for the next two years with revenue estimates of 257 million and ARR of 220 million by the end of 2022 amp x200B https preview redd it fvpgk90qis971 png width 2676 amp format png amp auto webp amp s 4b6b1c748ffd873fdb964aa7277554f1fee3ab9c Strong Financials Great market trends Explosive data growth increasing data regulations shifts to the cloud hyper growth of Microsoft Teams were all trends that fuelled the growth prior to the pandemic The impacts of COVID 19 have greatly accelerated these trends amp x200B https preview redd it baz704zqis971 png width 2704 amp format png amp auto webp amp s 0cf0051f8c0df868094798f6e75e6baac806bb6a Current and Future Potential The company raised 200 million in January this year led by Sixth Street Partners formerly TPG Sixth Street Partners with additional participation from prior investor Goldman Sachs The company has raised a total of 294 million in capital before the reverse merger announcement About Apex Tech that merged with Avepoint Outstanding management led by Oracle CFO Jeff Epstein cough didn t kill himself cough and former Goldman Sachs Head of Technology Investment Banking Brad Koenig Their combined experience includes more than 100 technology IPOs Served on 20 boards and advisory boards and saw mergers involving companies such as Microsoft Oracle Ebay Dell Yahoo and Twilio Apex s balance of 352 million plus a 140 million additional private investment will be handed over to AvePoint Once transaction fees and other considerations are paid for AvePoint is expected to have 252 million on its balance sheet Existing AvePoint shareholders will own approximately 72 of the combined entity with the balance held by the Apex SPAC and the private investment owners Implied enterprise value of 9 0x 2021E revenue with very attractive valuation multiples compared to peers amp x200B https preview redd it x6avvwqris971 png width 2782 amp format png amp auto webp amp s 6b8a23afaed0c97de0f65b77936cfb952a3a1b98 Transaction Details Advisors Evercore Group L L C Citigroup Global Markets Inc Goldman Sachs amp Co LLC Evercore and Cowen In Sources SEC Release https www sec gov Archives edgar data 0001794322 000179432219000001 xslFormDX01 primary doc xml FOX Interview https www youtube com watch v ssAORfNyQyg amp ab channel BlueCollarFinance TD Interview https www youtube com watch v HzPc tTcObY amp ab channel TDAmeritradeNetwork Investors Pres https cdn avepoint com pdfs en Apex AvePoint 20Investor 20Presentation Webcast Final 20 11 23 2020 pdf Bloomberg Interview https www youtube com watch v xD33VLw9ZOI amp ab channel BloombergTechnology TL DR Bottom line AvePoint is a Market leading SaaS company with powerful tailwinds for Microsoft Cloud a high quality and diversified customer base and compelling historical amp expected financial results business model and valuation Compared to competitors like JAMF FASTLY CLOUDFLARE etc AVPT is trading at 2 3X discount based on earnings to market cap valuation Avepoint s earnings are coming up in August which should be followed by price targets from key analysts that will push the price up to tendy land Disclaimer all images should be credited to AvePoint or the above mentioned sources This does not constitute and has not to be intended as a financial advice or solicitation of any kind I hold a long position in AVPT 85 000 shares 150 options 
70,ofimv3,t2_4z4mbygf,1625663584,/r/wallstreetbets/comments/ofimv3/srne_short_squeeze_today_shortsqueeze/,0, SRNE short squeeze today shortsqueeze srneisthenewamc,Buy the volume is coming in even from some hedge funds according to SEC 3402 DATA FROM TODAY 8 30 am 4 NEW YORK HEDGE FUNDS NOT CITADEL will buy 75 million shares in next few days including Blackrock short squeeze rank is 84 which is great and shorts are already starting to cover go sorrento go sorrento 15 by Friday
71,ofimwo,t2_a0s7jdfj,1625663589,/r/wallstreetbets/comments/ofimwo/amcgme_big_juicy_dips/,1,AMC GME big juicy dips ,
72,ofinng,t2_aaa9mph1,1625663668,/r/wallstreetbets/comments/ofinng/buying_more_weed/,1,Buying more weed,I will be buying mor ACAN today after monster quarter Once legal this is a 20 bagger overnight 
73,ofintg,t2_897objay,1625663684,/r/wallstreetbets/comments/ofintg/looks_like_aids_is_back_on_the_menu_boys_enzc/,1,Looks like AIDS is back on the menu boys ENZC,
74,ofiojt,t2_a204urvp,1625663758,/r/wallstreetbets/comments/ofiojt/amc/,1,AMC,
75,ofiom6,t2_10fz61,1625663764,/r/wallstreetbets/comments/ofiom6/why_i_am_holding_clov/,1,Why I am holding CLOV, removed 
76,ofiozn,t2_3yefgeo,1625663799,/r/wallstreetbets/comments/ofiozn/whats_your_honest_prediction_for_didi_ticker_out/,1,What s your honest prediction for DIDI ticker out there What is the worst possible scenario here ,I YOLO ed aprox 5 5k at 15 4 ouch and now I am highly considering of taking my losses because I am afraid that it will gets delisted and I ll lose it all Is it possible What is the actual worst case scenario All the info will be highly appreciated Thanks
77,ofip5g,t2_a3vab7dr,1625663815,/r/wallstreetbets/comments/ofip5g/basic_attention_token_to_the_moon/,1,Basic Attention Token to the moon ,Does anyone have a view on how BAT is likely to perform going forward From what I have read it applies token tech to a very serious problem within a potentially huge market it essentially provides a token verified method of enabling advertisement consumers to monetise their time while guaranteeing advertisers reach their market completely i e full advertisement is watched all within the Brave browser To me it seems like a really valuable application with a huge upside which addresses a really critical issue with modern search engines So my question is can anyone explain to me why this is not likely to go to the moon in the coming months 
78,ofipz9,t2_4bo03oku,1625663897,/r/wallstreetbets/comments/ofipz9/i_give_you_the_average_clov_shill/,1,I give you the average CLOV shill,
79,ofiqlx,t2_7oaifi28,1625663966,/r/wallstreetbets/comments/ofiqlx/for_mankindshort_squeeze_cvm/,1,For Mankind Short Squeeze CVM,The data is out and clearly the drug Multikine will receive FDA approval Lying deceiving short sellers are muddling the picture Lets squeeze these godless MFers 
80,ofirkl,t2_ueokg,1625664066,/r/wallstreetbets/comments/ofirkl/here_are_4_reasons_the_west_is_heading_for_very/,1,Here are 4 reasons the West is heading for Very Drastic Crisis says economist, https www marketwatch com story here are four reasons the west is headed for a very drastic crisis according to a veteran economist 11625655832 mod bnbh https www marketwatch com story here are four reasons the west is headed for a very drastic crisis according to a veteran economist 11625655832 mod bnbh 
81,ofit1z,t2_ap55dafr,1625664218,/r/wallstreetbets/comments/ofit1z/vxrt_vaxart_is_back_in_the_news_super_cheap_stock/,1,VXRT Vaxart is back in the news Super cheap stock DD below, removed 
82,ofithp,t2_4bo03oku,1625664260,/r/wallstreetbets/comments/ofithp/gentlemen_i_give_you_the_average_clov_shill/,1,Gentlemen I give you the average CLOV shill,
83,ofitvd,t2_6e3q1ze6,1625664297,/r/wallstreetbets/comments/ofitvd/ape_style_cool_funny_tees_facemasks_drink_bottles/,1,APE STYLE COOL FUNNY Tees Facemasks Drink bottles and more, removed 
84,ofiu2n,t2_a2061lhi,1625664316,/r/wallstreetbets/comments/ofiu2n/whats_going_on/,1,Whats going on ,This is a little wierd Some famous stock market youtubers stoped posting any videos Threads are slow as if everyones been bought out to not talk at all Fill me in 
85,ofiuye,t2_d2u5w770,1625664400,/r/wallstreetbets/comments/ofiuye/24_hours_til_shorts_have_to_pay_up_gammasqueeze/,1,24 hours til shorts have to pay up gammasqueeze https franknez com its true the threshold security could change the game amc , removed 
86,ofiway,t2_178cnc1r,1625664531,/r/wallstreetbets/comments/ofiway/me_when_my_parents_ask_how_i_got_a_lambo/,1,Me when my parents ask how I got a lambo ,
87,ofiwr4,t2_apu770y7,1625664572,/r/wallstreetbets/comments/ofiwr4/gourmet_provisions_international_corp_gmpr/,1,Gourmet Provisions International Corp GMPR Announces Pizza Fusion to Make Their Pittsburgh Debut, The Vegan Pizza Pittsburgh Pennsylvania July 07 2021 GLOBE NEWSWIRE Gourmet Provisions International Corporation OTC Pink GMPR today announced their Wholly Owned Subsidiary Pizza Fusion Saving the Earth One Pizza at a Time will makes its Gluten Free Frozen Pizza debut in Community Markets grocery stores in the Pittsburgh area Over the past few weeks Pizza Fusion s sales team has met with and done product demonstrations for many Pittsburgh based grocery stores and distributors GMPR is very happy to announce that every grocery store amp distributor that the sales team has demoed for has excitingly agreed to carry all 3 Pizza Fusion Pizzas and many of their other wholly owned subsidiaries Jose Madrid Salsas The Community Market grocery stores will be the first locations to carry the pizzas with an anticipated shelf date for mid July James Vowler President amp CEO of Gourmet Provisions International Corp stated Our sales team had many meetings in late June in anticipation of the first delivery of our Gourmet Pizza Fusion Frozen Pizzas to our cold storage in Pittsburgh We knew that our three gluten free pizzas were of a superior quality and taste to any of the other frozen pizzas in the marketplace But receiving resounding yeses from every store amp distributor we met with took us slightly by surprise Over this past year Covid has changed the way many families enjoy their meals with restaurant amp delivery options constantly changing many people found themselves reevaluating their food options The basic issue is everyone wants to eat delicious healthy food but not everyone is a great chef or knows how to cook good tasting and healthy meals Our Pizza Fusion Gluten Free pizzas featuring a gluten free Vegan pizza on a Beets Crust bring that wonderful chef quality healthy pizza to the frozen section of your local grocery store https finance yahoo com news gourmet provisions international corp gmpr 131500285 html soc src social sh amp soc trk tw amp tsrc twtr https finance yahoo com news gourmet provisions international corp gmpr 131500285 html soc src social sh amp soc trk tw amp tsrc twtr 
88,ofixwc,t2_4z4mbygf,1625664679,/r/wallstreetbets/comments/ofixwc/sorrento_therapeutics_looks_poised_to_squeeze/,1, sorrento therapeutics looks poised to squeeze shortsqueeze,Buy right away apes the very strong volume is coming in right as we speak even from the big most prominent hedge funds according to SEC 3402 DATA FROM TODAY 8 30 am 4 NEW YORK HEDGE FUNDS NOT CITADEL will buy 75 million shares in next few days including Blackrock which is a very big and profitable hedge fund i mean this has nowhere to go but up and it dosent stop there trending right now on Stocktwits for first time in about 4 months since January we are seeing increasingly high insider buying and retail interest check it out on stocktwits too WALL STREET BETS GROUP GREATEST FRIENDS ARE THERE NVM THE FACT THAt we cooled off from the last few months amazing rallies over the past few days and now we are ready to rock and roll short squeeze rank is 84 which is great 25 out of 5342 stocks and shorts are already starting to cover go sorrento go sorrento 15 by Friday lets not be weak on those shorts 
89,ofiy7r,t2_5h55k6wo,1625664708,/r/wallstreetbets/comments/ofiy7r/they_hate_us_cause_they_anus_thanks_negg_and_to/,1,They hate us cause they anus Thanks NEGG and to those that followed my play congrats for swallowing your pride and getting in early ,
90,ofiych,t2_jewwf,1625664722,/r/wallstreetbets/comments/ofiych/locl_trade_vol_question/,1,LOCL trade vol question,Disclaimer I am a crayon eater and work at LOCL and own some stocks since its IPO I bought in early and bought the dip However I can t currently buy more due to the low volume of trades Question what can cause trade volume to be low 
