,postid,author,created_utc,permalink,score,title,selftext
13,okcvv8,t2_c0efqsvx,1626294444,/r/wallstreetbets/comments/okcvv8/mdia_is_on_fire/,1,MDIA IS ON FIRE,Guys I know this is not the place but giving you guys a heads up there is a short squeeze going on with MDIA and people should take advantage of that I made 3k 2 days ago and 1k today morning Very volatile Chances are there but need to be care when to go in and take profits Good luck
14,okcwpk,t2_s9z9v,1626294513,/r/wallstreetbets/comments/okcwpk/11k_yolo_into_amc_on_todays_sale/,1,11k YOLO into AMC on today s sale ,
15,okcxov,t2_7391ktmp,1626294594,/r/wallstreetbets/comments/okcxov/please_share_loss_porn_we_all_got_annihilated/,1,Please share loss porn we all got annihilated this week , You know you got owned don t lie Be a bro and share the porn so we have some good wank material this weekend AMC took a massive dookie Richard Branson used investors as a piggie bank Clovis limp dicked Weed stocks got it in the stinker Wish has been taking a nosedive for the past 2 weeks CLNE and CLOV killed themselves and my depression is at an all time high I feel your pain my bros I lost over 100k in month some time in April after making 120k between January and March on GME calls 1 upvote one amen 1 share one hallelujah
16,okcy53,t2_92rcfnfl,1626294627,/r/wallstreetbets/comments/okcy53/bleeding_red/,1,Bleeding red, removed 
17,okcyc8,t2_36cui9hs,1626294643,/r/wallstreetbets/comments/okcyc8/federal_reserve_repo_operations_in_effect_is_it/,1,Federal Reserve Repo Operations In Effect Is it corruption Who s Buying DISCUSS,
18,okcyug,t2_5i9tzrd5,1626294686,/r/wallstreetbets/comments/okcyug/im_glad_to_announce_a_new_revolutionary/,1,I m glad to announce a new Revolutionary cyptoCurrency SheKa Token Join subreddit below for more information, removed 
19,okd1cy,t2_5i9tzrd5,1626294887,/r/wallstreetbets/comments/okd1cy/glad_to_announce_a_new_revolutionary/,1,Glad To announce a new revolutionary CryptoCurrency SheKa Token Join subreddit below for more information,https www reddit com r ShekaTokenn the New revolutionary Token that will take the world by storm in the coming moments You don t want to miss out 
20,okd1f1,t2_4iqvq3mj,1626294892,/r/wallstreetbets/comments/okd1f1/sounds_like_a_bargain_to_me_boys/,1,Sounds like a BARGAIN to me Boys ,
21,okd2zy,t2_2zu7kpbd,1626295017,/r/wallstreetbets/comments/okd2zy/acv_auctions_tons_of_upside_likely_to_be/,1,ACV Auctions tons of upside Likely to be purchased by KAR or CoX automotive ,They have completely changed the wholesale auto market Everything is done on the dealer lot with no need to transport vehicles to auction Revenue up 64 YOY While physical auctions dry up Just entered the independent dealer flooring sector Acquired max digital Hedgies are buying it up My only concern is the lockup period expiration 9 20 Long 500 shares
22,okd4c0,t2_a24pjnhq,1626295119,/r/wallstreetbets/comments/okd4c0/editing_my_amc_loss_porn_post/,1,Editing my AMC loss porn post ,
23,okd4qd,t2_10qq51,1626295153,/r/wallstreetbets/comments/okd4qd/press_f_to_pay_respects_to_all_the_apes_who_are/,1,Press F to pay respects to all the apes who are getting wrecked this week They will not be missed ,
24,okd55j,t2_ozhm9w5,1626295186,/r/wallstreetbets/comments/okd55j/reddit_meme_stock_pain/,1,Reddit Meme Stock Pain ,
25,okd5wh,t2_4iqvq3mj,1626295243,/r/wallstreetbets/comments/okd5wh/amc_gamestop_shares_fall_to_half_of_their_june/,1, AMC GameStop shares fall to half of their June peaks Time to Buy ,What do you think apes Been waiting months for the right time to buy 50 down means it can go up 100 I see no reason AMC and GME can hit highs one time and not again a second time JPow is still printing money Inflation through the roof Stock market at all time highs I think the time is now But more importantly what do you think 
26,okd679,t2_6mpq4bwb,1626295269,/r/wallstreetbets/comments/okd679/went_shopping_shorts_think_they_have_us_both_mmat/,1,Went Shopping shorts think they have us Both MMAT and ARVL were over 20 bucks under a month ago Yah I put my YOLO chips in Short interest give me enough for a PS5 ,
27,okd67d,t2_6884fmib,1626295269,/r/wallstreetbets/comments/okd67d/dogewatch_now_i_have_seen_everything/,1,DogeWatch Now I have seen everything ,
28,okd6rx,t2_9cp6bovh,1626295311,/r/wallstreetbets/comments/okd6rx/i_wish_my_butthole_wasnt_ripped_open/,1,I WISH my butthole wasn t ripped open ,
29,okd6yd,t2_alo0l5ot,1626295325,/r/wallstreetbets/comments/okd6yd/apes_this_stonk_moon_soon_money_printer_go_brrrrr/,1,Apes This Stonk moon soon Money printer go brrrrr,
30,okd71g,t2_2dvsy9,1626295331,/r/wallstreetbets/comments/okd71g/how_to_keep_wsb_retards_busy/,1,How to keep WSB retards busy,
31,okd72v,t2_8u3v3rjx,1626295335,/r/wallstreetbets/comments/okd72v/cineworld_uks_version_of_amc_the_most_shorted/,1,Cineworld UK s version of AMC the most shorted stock in UK plummets,I like this stock its the most shorted stock in the UK Looks like this very much loved franchise is going through a very hard time with the shorters right now 
32,okd7wg,t2_90thuldr,1626295399,/r/wallstreetbets/comments/okd7wg/form_424b3_auddia_inc/,1,Form 424B3 AUDDIA INC , removed 
33,okd8dh,t2_quaxgma,1626295437,/r/wallstreetbets/comments/okd8dh/tlry_yolo_on_red_day/,1,TLRY yolo on red day,
34,okd8fi,t2_pxic8,1626295442,/r/wallstreetbets/comments/okd8fi/tik_tok_hedgies/,1,Tik tok hedgies,
35,okd8km,t2_1mjrwlcr,1626295452,/r/wallstreetbets/comments/okd8km/hungarian_vizsla_inu_hvi/,1,Hungarian Vizsla Inu HVI ,I just found on their website there are actually places in Hungary where you can pay with these coins Is it a cap or it is really possible If it is this coin really has a future and can be daaamn a fuckin hella mella smth https coinmarketcap com currencies hungarian vizsla inu 
36,okd90o,t2_3o38vfhd,1626295485,/r/wallstreetbets/comments/okd90o/wtf_anchor/,1,WTF Anchor ,Why the fuck This is long Tl dr why the fuck is Anchor holding my AMC winnings for over 2 weeks I earned a modest 200 on AMC last month bought low and held So on Monday June 28 I initiated transfer to Chase Said it d clear by Thursday July 1 During those days I transferred around some non stock currency with money already in the system not part of what I was withdrawing Anchor sometimes gives you currencies from companies for taking quizzes and that s all the money I have invested for that type of gig nothing mine It has almost nothing to do with this issue I m having July 2nd Friday my withdraw from AMC was canceled by them My message Why was my transfer to my bank account canceled It was supposed to be in my account yesterday I m level 3 verified Reply it s a lengthy bs response about changing requirements We have marked your withdrawal as canceled and returned funds to your account balance due to the migration that we recently had from our trust partner to a new banking partner I also wanted to give you an update on the process for bank withdrawals Due to updated regulatory guidance our banking partner is mandating enhanced verification procedures for all future bank transactions If you have already provided both the front and back of your ID it is likely that no further action is needed from you at this time we will reach out if there was an issue validating the images However if you previously only provided the front of your photo ID during verification you would need to upload it again now with front and back due to the new requirements We are in the process of rolling out updates to our mobile applications to allow providing front and back of ID In the meantime you can utilize our website portal https dashboard anchorusd com register image We understand that this comes amid an unacceptable bank withdrawal delay that has affected you as we have worked through this updated guidance Please understand that we take this incredibly seriously and have been working around the clock to address it both with our current partner and by bringing onboard backup providers for funds processing Once you have submitted the front and back of your photo ID your bank withdrawal will process in accordance with the standard 2 3 business day processing time So that was July 2 As I d mentioned in my first email I m level 3 verified which requires front and back of my ID so none of this should even apply to me Not only that but if they didn t have the back of the card they clearly stated in this email that they d reach out to me if there were any issues There didn t They also put in their first reply something about pending currenct shit that has already been cleared and both sent to USDC per THEIR suggestion so I could transfer USDC to coinbase and cash out that way effectively forcing me to use their crip options So last night I tried moving my USDC wallet to coinbase and got the red warning of crips haven t cleared yet you need at least 15 79 remaining in account to transfer I ll take this time to share that on July 2 I WAS able to move 40 to my other wallet I haven t TOUCHED the app since June 28 for either stonks or currencies so this will clear up without more bullshit Last night I tried moving 160 over that way I m covered for supposed pending currencies and got the red warning you can only transfer 5 due to pending transactions WHAT PENDING TRANSACTIONS I HAVEN T TOUCHED A THING I email last night I have been trying for almost 3 weeks to get funds from my account to my bank The message says i have things pending so i can t move my money I have nothing pending You re holding my money hostage over nothing Their reply Thank you for reaching out I understand that you may be having issues with moving your funds crip around due to the pending deposits 2021 06 29 15 00 for 3 9575 ANT which has not cleared and made since the 17th of June Just to give you an update we are still working on resolving this issue and I will reach out using this ticket number once we have an update I apologize for the inconvenience this has caused you To be clear here the ANT transfer was free currency for quizzes taken and sent to USDC on 6 29 with my AMC wins A second crip was submitted at the same time and wasn t mentioned in this email so it must have cleared Regardless I resubmitted my ID today despite having done so last month and not receiving any messages about resubmitting
37,okd9io,,1626295524,/r/wallstreetbets/comments/okd9io/how_to_keep_a_retard_busy_a_surefire_way_to_make/,1,How to keep a retard busy a sure fire way to make money, deleted 
38,okd9kj,t2_5i9tzrd5,1626295528,/r/wallstreetbets/comments/okd9kj/i_am_honored_to_announce_that_theres_a_new/,1,I am Honored to announce that there s a new cryptocurrency in circulation SHEKA TOKEN join subreddit For More ,https www reddit com r ShekaTokenn the New revolutionary Token that will take the world by storm in the coming moments You don t want to miss out 
39,okdafa,t2_a01dtoxn,1626295598,/r/wallstreetbets/comments/okdafa/poor_street_bets/,1,poor street bets , removed 
40,okdaqe,t2_c0efqsvx,1626295624,/r/wallstreetbets/comments/okdaqe/mdia_is_on_fire/,1,MDIA IS ON FIRE,https investorplace com 2021 07 mdia stock 6 things to know about red hot mediaco Hey guys there is a short squeeze play with MDIA If you want to make some money get in in this action It moves very rapidly so be careful and Goodluck with taking gains 
41,okdayz,t2_peml6,1626295643,/r/wallstreetbets/comments/okdayz/mmat_time/,1,MMAT TIME,
42,okdb2f,t2_a2ep2bfh,1626295651,/r/wallstreetbets/comments/okdb2f/virgin_galatic/,1,Virgin Galatic,
43,okdb6r,t2_quaxgma,1626295661,/r/wallstreetbets/comments/okdb6r/tlry_big_swing_tomorrow/,1,TLRY big swing tomorrow ,
44,okdbfa,t2_4iqvq3mj,1626295679,/r/wallstreetbets/comments/okdbfa/amc_gamestop_shares_fall_to_half_of_their_june/,1, AMC GameStop shares fall to half of their June peaks Time to Buy ,What do you think apes Been waiting months for the right time to buy 50 down means it can go up 100 I see no reason AMC and GME can hit highs one time and not again a second time Why are we so certain June was the peak Why not end of July or August I m sure these stocks have been shorted aggressively on the way down AMC announced it wasn t increasing share count meaning there s now a limited supply When GME shot up in February I had the biggest FOMO ever I had weeks to add shares at a lower price and kept waiting for the right time WSB is SILENT right now No more daily discussions on AMC GME Could hear a pin drop I want to bring back that magic and excitement What s a few shares between friends JPow is still printing money Inflation through the roof Oil hitting 5 year highs Stock market at all time highs People starting to go out and about again What s stopping a MEME rally I think we ve all gotten too focused on dozens of random stocks newegg clne etc and we forgot about our blue chips GME and AMC When in doubt got to rotate back to the winners I think the time is now But more importantly what do you think 
45,okdbi5,t2_2uk5ekfb,1626295685,/r/wallstreetbets/comments/okdbi5/apes_who_bought_in_above_200_looking_at_other/,1,Apes who bought in above 200 looking at other apes like ,
46,okdc9u,t2_5i9tzrd5,1626295748,/r/wallstreetbets/comments/okdc9u/new_cryptocurrency_sheka_token/,0,New CryptoCurrency SheKa Token ,I m honored to announce that there s a new cryptocurrency in circulation SheKa Tokenn Ensure that you don t miss out and join subreddit For More https www reddit com r ShekaTokenn the New revolutionary Token that will take the world by storm in the coming moments You don t want to miss out 
47,okdcf8,t2_ce64onsr,1626295760,/r/wallstreetbets/comments/okdcf8/was_there_anything_in_green_today_amc_killing_me/,1,Was there anything in green today amc killing me still holding suggestions on xela the next , removed 
48,okdcww,t2_4skzf3wj,1626295797,/r/wallstreetbets/comments/okdcww/bb/,1,BB, removed 
49,okdd5m,t2_2uk5ekfb,1626295817,/r/wallstreetbets/comments/okdd5m/apes_who_bought_in_above_200_looking_at_other/,1,Apes who bought in above 200 looking at other apes like , amp x200B https i redd it kn99s0utq8b71 gif
50,okdds6,t2_5nmrvy6p,1626295866,/r/wallstreetbets/comments/okdds6/tetra/,1,Tetra, TTI Tetra technologies is set for a nice spike 
51,okddvi,t2_a0eltoky,1626295873,/r/wallstreetbets/comments/okddvi/wish_i_had_more_money_to_yolo/,1,Wish i had more money to yolo,
52,okdem9,t2_db1igxmh,1626295932,/r/wallstreetbets/comments/okdem9/xela/,1, XELA ,
53,okdep7,t2_ce64onsr,1626295939,/r/wallstreetbets/comments/okdep7/was_there_anything_in_green_todayamc_killing_me/,1,Was there anything in green today amc killing me still holding Suggestion on xela or more loss ,
54,okdepi,t2_2dvsy9,1626295940,/r/wallstreetbets/comments/okdepi/how_to_keep_the_newbies_busy/,1,How to keep the newbies busy ,
55,okdeq9,t2_bsqwat44,1626295941,/r/wallstreetbets/comments/okdeq9/nvidia_call/,1, NVIDIA CALL,
56,okdfqo,t2_5nmrvy6p,1626296031,/r/wallstreetbets/comments/okdfqo/tetra_technologies_tti/,1,Tetra technologies tti,Tetra technologies has been looking into lithium for some time now They have risen from the dollar range over the 4 range and now we re at 3 56 tti is definitely ready for a nice Spike No reason why they can t get over 5 Any apes want to take a ride with me 
57,okdhhi,t2_p50ra,1626296181,/r/wallstreetbets/comments/okdhhi/4005_million_in_sales_expected_for_marathon/,1, 40 05 Million in Sales Expected for Marathon Digital Holdings Inc NASDAQ MARA This Quarter,
58,okdhud,t2_88kq862h,1626296211,/r/wallstreetbets/comments/okdhud/aapl_loss_porn_sold_these_for_a_7k_loss_from_day/,1,AAPL LOSS PORN sold these for a 7k loss from day trading would ve turned 16k to 86 200 but i paper handed it,
59,okdidl,t2_p50ra,1626296255,/r/wallstreetbets/comments/okdidl/apples_market_cap_nearing_25_trillion_as_analysts/,1,Apple s Market Cap Nearing 2 5 Trillion as Analysts Turn Bullish on Earnings,
60,okdift,t2_61qs1ok2,1626296260,/r/wallstreetbets/comments/okdift/playboy_dd_plby_a_becky_play/,1,Playboy DD PLBY a Becky play, removed 
61,okdigd,t2_9hxnfht3,1626296261,/r/wallstreetbets/comments/okdigd/sofi_announces_q2_earnings_call_datetime/,1,SOFI Announces Q2 Earnings Call Date Time, removed 
62,okdipf,t2_1up9izio,1626296285,/r/wallstreetbets/comments/okdipf/wish_loss_porn_holding_till_earnings_for_sure_27b/,1, WISH Loss porn Holding till earnings for sure 2 7B in cash I am sure they have something solid to announce during earnings,
63,okdked,t2_304aqk4,1626296417,/r/wallstreetbets/comments/okdked/gme_ill_see_you_in_valhalla/,1,GME I ll see you in Valhalla,
64,okdkxw,t2_2mt49zpv,1626296459,/r/wallstreetbets/comments/okdkxw/hedgies_can_we_have_your_shares/,1,Hedgies Can we have your shares ,
65,okdlg5,t2_6z7l3tba,1626296501,/r/wallstreetbets/comments/okdlg5/innovacorp_buys_4399_of_mmat/,1,Innovacorp buys 4 399 of MMAT,I think this is a good thing for MMAT thoughts Is there a way to see what was the purchase price of 12 Million shares of MMAT stock Anyone know anything about Innovacorp SC 13G A Form Amend Statement of acquisition of beneficial ownership by individuals META MATERIALS INC 0001431959 Subject newsfilter io https newsfilter io a 1965ba771b76c786e29e12267d571305 amp x200B 9 AGGREGATE AMOUNT BENEFICIALLY OWNED BY EACH REPORTING PERSON 12 496 580 10 CHECK IF THE AGGREGATE AMOUNT IN ROW 9 EXCLUDES CERTAIN SHARES SEE INSTRUCTIONS 11 PERCENT OF CLASS REPRESENTED BY AMOUNT IN ROW 9 4 399 
66,okdlpi,t2_7c9tndpy,1626296521,/r/wallstreetbets/comments/okdlpi/talk_about_an_ass_kicking_wish/,1,Talk about an ass kicking wish,
67,okdn04,t2_9mmmucaq,1626296623,/r/wallstreetbets/comments/okdn04/bfly_making_bank_for_shorters/,1,BFLY making bank for shorters,I ve been watching this stock for the past three months or so and despite a complete lack of bad news about this company its stock has been getting pounded especially recently Is this where those firms go to make up for the big losses they took on meme stocks 
68,okdnix,t2_92pgl2uc,1626296667,/r/wallstreetbets/comments/okdnix/welcome_to_our_fight_club_ken_now_take_this_banana/,1,Welcome to our fight club Ken now take this banana,
69,okdo7d,t2_a3ry5a0k,1626296723,/r/wallstreetbets/comments/okdo7d/option_call_mmat_a/,1,Option call MMAT A, removed 
70,okdoak,t2_9uapsw82,1626296731,/r/wallstreetbets/comments/okdoak/how_can_i_eliminate_getting_this_message_in_my/,1,How can I eliminate getting this message in my inbox Or how to get enough Karma ,
71,okdopa,t2_9lq8z2n9,1626296765,/r/wallstreetbets/comments/okdopa/plxp_plx_pharma_incs_vazalore_to_launch_in_over/,1, PLXP PLx Pharma Inc s VAZALORE to Launch in over 4 500 Walmart Stores Nationwide in August ,PLx Pharma Inc NASDAQ PLXP PLx or the Company a specialty pharmaceutical company focused on its clinically validated and patent protected PLxGuard drug delivery platform to provide more effective and safer products with its lead products VAZALORE 325 mg and VAZALORE 81 mg referred to together as VAZALORE today announced that three stock keeping units SKUs of VAZALORE the first and only U S Food and Drug Administration FDA approved liquid filled aspirin capsules will be available in over 4 500 Walmart stores across the United States in mid August The three SKUs include VAZALORE 81 mg 12 count VAZALORE 81 mg 30 count and VAZALORE 325 mg 30 count Walmart one of the largest retailers in the world has already inserted placeholders to reserve space on shelves and alert customers that VAZALORE is coming soon We are so excited that Walmart has committed to Coming Soon shelf placeholders for the next few weeks in anticipation of the stocking of all three SKUs of VAZALORE With Walmart s broad reach and millions of customers patients will have easy access to VAZALORE in most of their stores nationwide stated Natasha Giordano Chief Executive Officer of PLx Walmart s commitment is a real tribute to their recognition of VAZALORE as an innovative aspirin therapy 
72,okdouz,t2_bi4xl00r,1626296777,/r/wallstreetbets/comments/okdouz/elliot_wave_roadmap_for_wish_relax_this_is_almost/,1,Elliot Wave roadmap for Wish Relax this is almost over ,
73,okdoy2,t2_cldmp4rr,1626296784,/r/wallstreetbets/comments/okdoy2/rsls_it_does_look_like_the_macd_is_about_to_turn/,1,RSLS It does look like the MACD is about to turn positive on this stock Large buyers are here as well It s maybe a great time to invest Opinions ,
74,okdq0x,t2_jmfm0,1626296874,/r/wallstreetbets/comments/okdq0x/best_resources_to_learn_options_and_become_a/,1,Best resources to learn options and become a degenerate like y all ,No loss or yolo or whatever y all call it these days porn here I do have some long term investments that I ll ride until I die or at least can t work anymore but I want to learn more about the options crap y all do So what are some places I could go to find decent resources about options trading Thanks in advance 
75,okdqe6,t2_9uapsw82,1626296903,/r/wallstreetbets/comments/okdqe6/haw_can_i_get_karma_so_that_i_can_post_comments/,1,Haw can I get Karma so that I can post comments and be a part of the conversation , removed 
76,okdqsu,t2_yjk2b,1626296933,/r/wallstreetbets/comments/okdqsu/i_wish_id_never_heard_of_this_stock/,1,I WISH I d never heard of this stock,
77,okdrb8,t2_9c62vjf0,1626296976,/r/wallstreetbets/comments/okdrb8/cramer_admits_to_manipulation/,1,Cramer admits to manipulation, removed 
78,okds0w,t2_4da16x16,1626297033,/r/wallstreetbets/comments/okds0w/see_you_in_valhalla_boys/,2,See you in Valhalla boys,
79,okds22,t2_9lq8z2n9,1626297036,/r/wallstreetbets/comments/okds22/plxp_plx_pharma_incs_vazalore_to_launch_in_over/,1,PLXP PLx Pharma Inc s VAZALORE to Launch in over 4 500 Walmart Stores Nationwide in August,This is a huge catalyst for this tiny company https finance yahoo com news plx pharma inc vazalore launch 203000801 html https finance yahoo com news plx pharma inc vazalore launch 203000801 html 
80,okdsij,t2_6056yozu,1626297074,/r/wallstreetbets/comments/okdsij/value_growth/,1,Value growth, removed 
81,okdst7,,1626297098,/r/wallstreetbets/comments/okdst7/apple_at_alltime_highs_raises_iphone_production/,1,Apple at all time highs raises iPhone production by 20 this year, deleted 
82,okdt1p,t2_9uapsw82,1626297117,/r/wallstreetbets/comments/okdt1p/haw_can_i_get_karma_so_that_i_can_post_comments/,1,Haw can I get Karma so that I can post comments and be a part of the conversation ,I am new to the Reddit and whenever I do comments or wants to be part of the discussion I can t and I instantly get messages saying that I don t have enough KARMA as a new user I am confused is there anything I am missing What is it actually and how can I get it enough to be able to post 
83,okdt7y,t2_a86mxtk9,1626297131,/r/wallstreetbets/comments/okdt7y/black_month_for_amc_meme_stock_it_lost_almost/,1,Black month for AMC meme stock it lost almost half of its value in July,
84,okdu0y,t2_a0vga5sr,1626297196,/r/wallstreetbets/comments/okdu0y/the_time_is_over/,1,The time is over ,
85,okdu9y,t2_178mzd,1626297218,/r/wallstreetbets/comments/okdu9y/hedges_calling_amc_shareholders_convincing_them/,1,Hedges Calling AMC Shareholders Convincing Them To Sell,
86,okdulk,t2_9uapsw82,1626297247,/r/wallstreetbets/comments/okdulk/any_idea/,1,Any idea ,
87,okdvml,t2_d7d5z051,1626297336,/r/wallstreetbets/comments/okdvml/buy_didi_here/,1,Buy DIDI here, removed 
88,okdw2f,t2_a9i1nxzw,1626297374,/r/wallstreetbets/comments/okdw2f/this/,1,This,
89,okdwit,t2_94wip24s,1626297414,/r/wallstreetbets/comments/okdwit/lossporn_so_relatable_and_incredibly_funny_6k/,1, LossPorn So relatable and incredibly funny 6k yesterday sold off my penny less OTC stocks at losses was reprimanded on Robinhood for pattern day trading so am stuck with tit less stocks and then solid loss porn compliments of E TRADE Thank you all for commiserating misery loves company ,
90,okdwve,t2_a1mar6l2,1626297442,/r/wallstreetbets/comments/okdwve/i_have_no_sell_button_on_my_phone_sry/,1,I have no sell Button on my Phone sry ,
91,okdxab,t2_c3c372nd,1626297474,/r/wallstreetbets/comments/okdxab/anyone_got_any_thoughts_of_that_grapefruit_coin/,1,Anyone got any thoughts of that grapefruit coin , removed 
92,okdxky,t2_aoa8t2bi,1626297500,/r/wallstreetbets/comments/okdxky/bb_when_will_my_fellow_apes_come_back_for_me_send/,1, BB When will my fellow apes come back for me Send help ,
93,okdxlg,t2_9lq8z2n9,1626297502,/r/wallstreetbets/comments/okdxlg/huge_catalyst_on_plxp_plx_pharma_incs_vazalore_to/,1,Huge Catalyst on PLXP PLx Pharma Inc s VAZALORE to Launch in over 4 500 Walmart Stores Nationwide in August,
94,okdxlz,t2_153u07,1626297503,/r/wallstreetbets/comments/okdxlz/softcore_smallfry_loss_porn_21_uwmc_949_30_bb_1452/,1,Softcore Small Fry Loss Porn 21 UWMC 9 49 30 BB 14 52 ,
95,okdxm6,t2_6cy83kbl,1626297503,/r/wallstreetbets/comments/okdxm6/impact_of_wsb_sub_going_private/,1,IMPACT OF WSB SUB GOING PRIVATE,Since WSB going private all Meme stocks have massively decreased all the average Joe s who look to the sub for advise were cut got scared as they had no where to find sound advise so sold what are you re thoughts 
96,okdy4i,t2_d7d5z051,1626297548,/r/wallstreetbets/comments/okdy4i/go_all_in_on_didi/,1,Go all in on DIDI, removed 
97,okdyor,t2_98tv4ip2,1626297593,/r/wallstreetbets/comments/okdyor/feeling_alone/,1,Feeling alone, removed 
