,postid,author,created_utc,permalink,score,title,selftext
0,ojt0gx,t2_3moytewa,1626223235,/r/wallstreetbets/comments/ojt0gx/checked_bank_acc_to_see_if_could_invest_in_more/,1, checked bank Acc to see if could invest in more amc and I m somehow negative,
1,ojt0h2,t2_4f9ygo9t,1626223235,/r/wallstreetbets/comments/ojt0h2/fixing_your_fellow_apes_dd/,1,Fixing your fellow apes DD ,
2,ojt0tw,t2_9fp91b7h,1626223270,/r/wallstreetbets/comments/ojt0tw/nio_and_uxin_partner/,1,NIO and UXIN partner,
3,ojt2ny,t2_55rkxfar,1626223445,/r/wallstreetbets/comments/ojt2ny/gme_ancient_knowledge/,1, GME Ancient Knowledge,
4,ojt4kw,t2_a1rucqli,1626223634,/r/wallstreetbets/comments/ojt4kw/wkhs_still_heading_to_moon/,1,WKHS still heading to moon ,
5,ojt4l0,t2_wl91u,1626223634,/r/wallstreetbets/comments/ojt4l0/when_you_dont_understand_graphs_but_you_feeling_a/,1,When you don t understand graphs but you feeling a YOLO NOK NOKIA LEGGO LULS, removed 
6,ojt555,t2_wl91u,1626223684,/r/wallstreetbets/comments/ojt555/nok_feeling_a_breakout/,1, NOK FEELING A BREAKOUT, removed 
7,ojt617,t2_wl91u,1626223770,/r/wallstreetbets/comments/ojt617/any_thoughts_on_nok_nokia/,1,ANY THOUGHTS ON NOK NOKIA , removed 
8,ojt7fv,t2_2b9z0qxd,1626223905,/r/wallstreetbets/comments/ojt7fv/spce_theory_about_the_recent_drop/,1, SPCE Theory About The Recent Drop,I would argue that now Virgin Galactic has a proof of concept large investors may be ready to invest in them That being said I feel like the stock is possibly being manipulated to allow them to get in at a lower cost and profit off swaying the options derivatives market as well The recent movements after the SRB test flight have been odd to say the least I think most long term investors would agree that the share offering is necessary for growth and will be good long term but the timing of the announcement was terrible I think the most recent downward trend is gross overreaction a sign it was overvalued pre test flight and or it is being manipulated by large market players I am buying the dip because I believe in the long term vision and growth prospects of this company Virgin Galactic has always been a risky investment Be wise and safe with your money Only invest what you can afford to lose This will hopefully only be a momentary blip on the lifetime chart Long live SPCE Full Disclosure I am day 1 investor I have not sold a single share and I have never traded options on SPCE 
9,ojt7of,t2_5xd8v9c3,1626223927,/r/wallstreetbets/comments/ojt7of/help_a_new_ape/,1,Help a new ape ,Hello fellow humanoids I see that AMC stock is a little bit cheaper now I know nothing about stocks I know nothing about anything but I m a firm believer in other monkeys I ve got a phone a computer and internet access How do I buy shares Please explain like I m stupid I am 
10,ojt836,t2_wl91u,1626223966,/r/wallstreetbets/comments/ojt836/nok_nokia_when_the_graphs_make_no_sense_ms_paint/,1, NOK NOKIA When the graphs make no sense MS PAINT YOLO,ARE are you feeling a bullish run for Nokia I am doubling down for a long play on this What are your thoughts I do not understand graphs but it s speaking to me I see that volume spike and going to ride it out Anyone has any real technicals on NOK Nokia amp x200B amp x200B https preview redd it vvmpxy19t2b71 png width 2378 amp format png amp auto webp amp s ae6fafb20133243ec81d2eb0a00cd8571b5cecfc
11,ojt8ic,t2_90li9,1626224010,/r/wallstreetbets/comments/ojt8ic/bag_holder/,1,Bag Holder,
12,ojt8z2,,1626224054,/r/wallstreetbets/comments/ojt8z2/thoughts_on_nokia/,1,Thoughts on NOKIA ,
13,ojt9ns,,1626224121,/r/wallstreetbets/comments/ojt9ns/when_graphs_make_no_sense_but_ms_paint_yolo/,1,When graphs make no sense but MS PAINT YOLO INSPIRATION NOK FTW,
14,ojt9rk,t2_bbkvfsmz,1626224132,/r/wallstreetbets/comments/ojt9rk/sorry/,1,Sorry ,
15,ojt9zw,t2_9hncmmk9,1626224154,/r/wallstreetbets/comments/ojt9zw/aht_ashford_hospitality_trust/,1,Aht ashford hospitality trust, removed 
16,ojtak7,t2_12ya2m,1626224209,/r/wallstreetbets/comments/ojtak7/what_autism_looks_like/,1,What autism looks like ,
17,ojtbib,t2_a1hshnvt,1626224304,/r/wallstreetbets/comments/ojtbib/amc_new_to_it_correct_thread_wud_be_ramcstock/,1,AMC New to it Correct thread wud be r AMCSTOCK, removed 
18,ojtccd,t2_5z064qlo,1626224385,/r/wallstreetbets/comments/ojtccd/im_in_no_way_rich_and_i_have_no_idea_where_this/,1,I m in no way rich and I have no idea where this will go but if them trying to push a bill will even gain me 1 I ll be happy Time to join you buttholes in the red YOLO,
19,ojtcui,t2_12ya2m,1626224423,/r/wallstreetbets/comments/ojtcui/what_autism_looks_like/,1,What autism looks like ,
20,ojtdnh,t2_5z064qlo,1626224500,/r/wallstreetbets/comments/ojtdnh/im_in_no_way_rich_but_i_hope_to_gain_at_least_1/,1,I m in no way rich but I hope to gain at least 1 or be in the red with you buttholes ,
21,ojtfnz,t2_9yhwz99j,1626224695,/r/wallstreetbets/comments/ojtfnz/sofi_all_in/,1,SOFI all in,
22,ojthey,t2_6anjo,1626224866,/r/wallstreetbets/comments/ojthey/too_broke_to_average_down/,1,Too broke to average down ,
23,ojthh7,t2_90li9,1626224873,/r/wallstreetbets/comments/ojthh7/bag_holder/,1,Bag Holder,
24,ojthrp,t2_5ollbhli,1626224901,/r/wallstreetbets/comments/ojthrp/can_someone_explain_what_is_going_on_with/,1,Can someone explain what is going on with beachbody ,
25,ojtjcx,t2_bullvwyt,1626225053,/r/wallstreetbets/comments/ojtjcx/i_remember_when_there_was_just_one_meme_stock/,1,I remember when there was just one meme stock target on WSB Now I don t know what to choose what are you favorite meme stock today , removed 
26,ojtkgi,t2_8g3xhm1l,1626225154,/r/wallstreetbets/comments/ojtkgi/srpt_50_drop_short_interest_848/,1,SRPT 50 drop short interest 8 48 ,Sarepta SRPT Some odd price movement on this stock lately with other biotechs doing very well They had a bad report which sent the stock down 50 earlier this year but recently followed it up with some good data and reports from people in their trials are that their gene therapy produces results They will never cure anything but for kids with muscular distrophy just keeping them from getting worse is as good as a cure Cathy Wood took a position and exited it fairly quickly before the most recent good data If they can retrace even half of the move down from earlier this year it would be a big gain I think the CEO is universally disliked and should have looked to be an acquisition target a long time ago by one of the big players but instead was making deals and trying to just do collaborations It seems like traders hate this stock and short sellers move the price on a daily basis Anyone have an opinion on it 
27,ojtkn1,t2_a1sok0ew,1626225171,/r/wallstreetbets/comments/ojtkn1/mj_stock_comparison_spreadsheet_godspeed_smooth/,1,MJ Stock Comparison Spreadsheet Godspeed Smooth Brains ,https docs google com spreadsheets u 0 d 1vRq2t5vabqyqwCBFAIVTq7255V4Yl6U OQJw8CtS5C0 htmlview I also like to use the Simply Wall St app for financial comparisons and analysis Personally I get rock hard when I see the comparison between US cannabis companies and Canadian companies I m all in on the US operators both individually and through MSOS Good luck to everyone in the cannabis space tomorrow 
28,ojtpdr,t2_76njr9v0,1626225619,/r/wallstreetbets/comments/ojtpdr/can_we_do_that_thing_again/,1,Can we do that thing again ,
29,ojtrqu,t2_a7k1t93o,1626225833,/r/wallstreetbets/comments/ojtrqu/i_dont_think_i_am_doing_this_right/,1,I don t think I am doing this right ,
30,ojts5p,t2_4dlpltyd,1626225872,/r/wallstreetbets/comments/ojts5p/million_token_is_doing_numbers/,1,Million token is doing numbers, removed 
31,ojtu06,t2_57uwmtrs,1626226051,/r/wallstreetbets/comments/ojtu06/holding_bags_or_bars_of_gold_overnight_80k_mmat/,1,Holding bags or bars of gold overnight 80k MMAT,
32,ojtu72,t2_a6u2j2ig,1626226070,/r/wallstreetbets/comments/ojtu72/wkhs/,1,WKHS, removed 
33,ojtvc3,t2_akzwaf32,1626226183,/r/wallstreetbets/comments/ojtvc3/mmat_it_may_not_be_that_much_but_im_still_holding/,1, MMAT It may not be that much but I m still holding ,
34,ojtvdh,t2_7ez57c67,1626226186,/r/wallstreetbets/comments/ojtvdh/tlry_is_what_im_feeling_picked_up_300_shares/,1, TLRY is what Im feeling Picked up 300 shares today on my TD And 225 shares on my RH Legalization News Possible Tomorrow Up next Weed,
35,ojtvra,t2_a1oy90c9,1626226221,/r/wallstreetbets/comments/ojtvra/amc_diamond_hands_on_twitter/,1,AMC Diamond Hands on Twitter,
36,ojtx7r,t2_99oszlna,1626226367,/r/wallstreetbets/comments/ojtx7r/i_just_wanted_to_revisit_a_post_here_that_i_made/,1,I just wanted to revisit a post here that I made in the year of our lord Jerome 2020 and demonstrate that retail traders like myself CAN succeed at anything we put our minds to Thank you Webull for reminding me of all the great decisions I ve made ,
37,ojtz5i,t2_3s814x5n,1626226555,/r/wallstreetbets/comments/ojtz5i/guys_my_diamond_hands_are_feeling_heavy_pls/,1,Guys my diamond hands are feeling heavy Pls reaffirm my confirmation bias that the squeeze will squoze , removed 
38,ojtzbk,t2_cfioy3sz,1626226574,/r/wallstreetbets/comments/ojtzbk/crtd_looking_hot_who_agrees/,1, CRTD LOOKING HOT Who agrees , removed 
39,ojtzq4,t2_99oszlna,1626226613,/r/wallstreetbets/comments/ojtzq4/i_felt_this_was_worth_sharing_in_the_new_year/,1,I felt this was worth sharing in the new year retail traders like me can accomplish anything we set our minds to In the year of our lord Jerome 2020 I learned about options and boy does it show But of a throw back to the OG WSB when is was less Stocktwit trashy SPY calls and puts galore ,
40,oju29x,t2_a0k058a0,1626226860,/r/wallstreetbets/comments/oju29x/bctx_shortsqueeze/,1, BCTX shortsqueeze,
41,oju3d3,t2_7epq20t5,1626226964,/r/wallstreetbets/comments/oju3d3/wimi/,1,WIMI,What s y all s opinion on Chinese stock WIMI I ve been holding for a few months and thinking about exiting
42,oju3mj,t2_16swab,1626226991,/r/wallstreetbets/comments/oju3mj/advice_need_on_sdc_smile_direct_club/,1,Advice Need On SDC Smile Direct Club,I know there s now a whole subreddit for this stock And there have been a couple due diligence posts But I would like some fresh raw feedback on the company before they post earnings next month 
43,oju3pq,t2_bric4mva,1626227000,/r/wallstreetbets/comments/oju3pq/unmissable_presale_opportunity/,1, Unmissable Presale Opportunity , removed 
44,oju4lf,t2_857tku49,1626227085,/r/wallstreetbets/comments/oju4lf/on_sofi_you_can_share_and_see_other_peoples/,1,On SOFI you can share and see other people s investment portfolio allocation Gonna go absolutely crazy imo It s the Facebook of investing Shared mine on my personal page ,
45,oju4v1,t2_csrjfutv,1626227112,/r/wallstreetbets/comments/oju4v1/hmy_harmony_gold/,1, HMY Harmony Gold,
46,oju5bs,t2_5d36ewka,1626227156,/r/wallstreetbets/comments/oju5bs/35_trillion_reconciliation_bill_gonna_rip_my_bear/,1, 3 5 Trillion Reconciliation Bill gonna rip my bear call spreads to max loss,
47,oju5uw,t2_6a4hh33d,1626227209,/r/wallstreetbets/comments/oju5uw/token_with_only_10k_supply/,1,Token with only 10k supply ,
48,oju6dg,t2_h61wd8z,1626227263,/r/wallstreetbets/comments/oju6dg/its_been_a_rollercoaster_the_last_few_months/,1,It s been a rollercoaster the last few months,
49,oju6dq,t2_8l6tnk1p,1626227264,/r/wallstreetbets/comments/oju6dq/just_wanted_to_post_my_chanel_diamonds_are/,1,Just wanted to post my Chanel Diamonds Are Forever Bag,
50,oju8dn,t2_857tku49,1626227457,/r/wallstreetbets/comments/oju8dn/on_sofi_you_can_share_and_see_other_peoples/,1,On SOFI you can share and see other people s investment portfolio allocation amp what has been doing well for them , removed 
51,oju8p2,t2_5zzellz9,1626227491,/r/wallstreetbets/comments/oju8p2/hey_im_gonna_short_south_africa_guy_things_are/,1,Hey I m Gonna Short South Africa Guy things are heating up down there how s your position , removed 
52,oju9kp,t2_akzwaf32,1626227579,/r/wallstreetbets/comments/oju9kp/mmat_regaining_momentum/,1, MMAT Regaining Momentum ,MMAT stock has been running up these passed 6 months from around 1 50 to a high of about 20 From there the stock came crashing down in price and the stock price is currently sitting at about 3 80 of course with upward momentum lowering as well I am a firm believer in this stock and I believe they have many upcoming catalysts Since I got into this stock I ve been slowly watching it bleed in price but I m not worried My average cost is around 15 and I m still holding 
53,ojub81,t2_81gt3ebo,1626227750,/r/wallstreetbets/comments/ojub81/clov_senate_democrats_agree_to_35_trillion_tax/,1,CLOV Senate Democrats Agree to 3 5 Trillion Tax Spending Bill,Senate Democrats Agree to 3 5 Trillion Tax Spending Bill BY ERIK WASSON July 13 2021 9 24 PM Agreement is a legislative boon for Biden s domestic agendaSanders abandons original design for 6 trillion measure Senate Democrats on the Budget Committee agreed to set a 3 5 trillion top line spending level for a bill to carry most of President Joe Biden s economic agenda into law without Republican support Democrats on the committee had been divided about the size and scope of the package with Chairman Bernie Sanders initially pushing a 6 trillion measure that added an expansion of Medicare immigration reform more generous childcare benefits and more to Biden s proposal The Budget Committee agreement includes the Medicare expansion marking a significant win for Sanders Senator Mark Warner of Virginia a moderate said the bill will https news bloomberglaw com pharma and life sciences senate democrats agree to 3 5 trillion tax spending bill https twitter com elwasson status 1415116716678524929 s 19 https twitter com FinancialJuice status 1415116813839515648 s 19
54,ojubib,t2_a14fjl5u,1626227777,/r/wallstreetbets/comments/ojubib/thats_a_lot_of_red/,1,That s a lot of red , removed 
55,ojuc10,t2_a1m3p8qi,1626227829,/r/wallstreetbets/comments/ojuc10/i_love_it_stocks_are_down_let_the_sales/,1,I love it stocks are down let the sales beginnnnnnnnnn we are not scared Let s go xela put my life savings let s gooooooo, removed 
56,ojucso,t2_ay1eluzz,1626227909,/r/wallstreetbets/comments/ojucso/tech_time/,1,Tech Time,Need advice on long tech Apple and Amazon Should I just keep dollar cost averaging over time Currently have 500 a week to invest 
57,ojucv2,t2_81gt3ebo,1626227915,/r/wallstreetbets/comments/ojucv2/breaking_clov_medicare_expansion_news_senate/,1,BREAKING CLOV Medicare expansion News Senate Democrats agree on 3 5 trillion budget reconciliation bill including Medicare expansion,BREAKING Senate Democrats agree on 3 5 trillion budget reconciliation bill including Medicare expansion https news bloomberglaw com pharma and life sciences senate democrats agree to 3 5 trillion tax spending bill
58,ojudak,t2_lw7q0xh,1626227963,/r/wallstreetbets/comments/ojudak/mmat_will_most_likely_moon_very_soon/,1,MMAT Will Most Likely Moon Very Soon , removed 
59,ojuftp,t2_81gt3ebo,1626228202,/r/wallstreetbets/comments/ojuftp/bloomberg_article_on_medicare_expansion_just_out/,1,Bloomberg article on Medicare Expansion Just Out Text version Bypass Subscripton Clover Health To Benefit ,Senate Democrats on the Budget Committee agreed to set a 3 5 trillion top line spending level for a bill to carry most of President Joe Biden s economic agenda into law without Republican support Democrats on the committee had been divided about the size and scope of the package with Chairman Bernie Sanders initially pushing a 6 trillion measure that added an expansion of Medicare immigration reform more generous childcare benefits and more to Biden s proposal The Budget Committee agreement includes the Medicare expansion marking a significant win for Sanders Senator Mark Warner of Virginia a moderate said the bill will be fully paid for We are very proud of this plan Majority Leader Chuck Schumer a New York Democrat said late Tuesday Schumer said it would include dental hearing and vision benefits for Medicare recipients but didn t detail whether a proposal to lower the eligibility age will be included or if a separate proposal to lower prescription drug prices is in the plan Biden plans to travel to Capitol Hill on Wednesday to discuss the plan The agreement will allow Democrats to send a budget resolution to the Senate floor containing instructions for a later tax and spending bill that would require just 50 Democratic caucus votes plus Vice President Kamala Harris s tie breaker to pass The draft budget proposal does not yet have the support of all 50 members of the caucus and could be changed further once moderates and progressives weigh in House Democrats are coordinating with Sanders committee but have not yet announced whether they support the new agreement Democrats plan to pay for their proposals through large business and individual tax increases the details of which the tax writing committees will decide Biden is pursuing a two track approach to his domestic agenda a 579 billion bipartisan bill focused on physical infrastructure and a partisan bill that addresses eldercare childcare education paid family leave and other social spending using the budget process Schumer wants to send both the bipartisan infrastructure bill and budget resolution to the floor this month with votes on the follow up partisan bill enabled by the budget resolution in the fall 
60,ojugh6,t2_2svqgu8f,1626228268,/r/wallstreetbets/comments/ojugh6/can_somebody_with_at_least_a_bit_of_knowledge/,1,Can somebody with at least a bit of knowledge explain what s going on with AMC besides hitadel feeling like I rather lose it all then some if that makes sense ,
61,ojuh7f,t2_486oidkc,1626228340,/r/wallstreetbets/comments/ojuh7f/opinions_on_zom/,1,Opinions on ZOM ,This is my first post on WSB though I ve been here since GME blew up Anyway I m also fairly new to the stock market unemployed student looking to make a few extra dollars during quarantine and was recommended ZOM I ve heard promising things and it did deliver I bought at like a dollar and sold around two and bought the dip I keep getting told long game it s going to bounce back to 10 What I m asking is do you think there s any potential or am I just bag holding 
62,ojuhck,t2_bq42kzy6,1626228355,/r/wallstreetbets/comments/ojuhck/reeds_ginger_beer_is_my_fav/,1,Reeds Ginger Beer is my fav, removed 
63,ojuhqn,t2_7qhmgwwp,1626228395,/r/wallstreetbets/comments/ojuhqn/watching_my_portfolio_today_like/,1,Watching my portfolio today like , removed 
64,ojui42,t2_6fu19qfd,1626228430,/r/wallstreetbets/comments/ojui42/its_clear_inflation_is_rampant_whats_the_play_to/,1,It s clear inflation is rampant What s the play to capitalize , removed 
65,ojuizd,t2_6qj5juyo,1626228517,/r/wallstreetbets/comments/ojuizd/amc/,1,Amc, removed 
66,ojukwd,t2_772i57t,1626228714,/r/wallstreetbets/comments/ojukwd/my_repub_boomer_baptist_father_in_law_worked/,1,My repub boomer baptist father in law worked until the day he died of pancreatic cancer to make sure his family didn t have to worry I committed a fed offense and opened my mother in laws mail for DD TDA is doing her dirty AF The man lived his whole life doing things the right way ,
67,ojulzm,t2_n8qaax6,1626228822,/r/wallstreetbets/comments/ojulzm/the_money_printer_cant_be_stopped/,1,The money printer can t be stopped,
68,ojuncl,t2_5mzbg275,1626228955,/r/wallstreetbets/comments/ojuncl/wsb_debut_in_a_movie/,1,WSB debut in a movie,
69,ojuntu,t2_cdzsxb21,1626228998,/r/wallstreetbets/comments/ojuntu/wkhs_to_moon/,1,WKHS to moon , removed 
70,ojuop5,t2_9qorzsnh,1626229081,/r/wallstreetbets/comments/ojuop5/am_i_doing_this_right/,1,Am I doing this right,
71,ojuovm,t2_avua4p8i,1626229097,/r/wallstreetbets/comments/ojuovm/unironically/,1,Unironically, If Biitcoin doesn t immediately go up massively right after a large inflation report that everyone knew was coming it s not an inflation hedge People with big followings on Twitter are actually typing this unironically 
72,ojup40,t2_35lpjzqy,1626229118,/r/wallstreetbets/comments/ojup40/me_and_the_boys_in_2069_after_the_squeeze_has/,1,Me and the Boys in 2069 after the squeeze has been squoze,
73,ojup57,t2_7gm5zzch,1626229121,/r/wallstreetbets/comments/ojup57/gme_till_the_end/,1,GME till the end ,
74,ojurlw,t2_7ddxn5vi,1626229359,/r/wallstreetbets/comments/ojurlw/last_hope_4_bulls/,1,Last Hope 4 Bulls,
75,ojussw,t2_cfjfqwhx,1626229478,/r/wallstreetbets/comments/ojussw/time_to_sign_for_change/,1,Time to sign for change ,
76,ojutcv,t2_4fr3ejvu,1626229531,/r/wallstreetbets/comments/ojutcv/can_we_support_didi_it_is_extremely_undervalued/,1,can we support DIDI it is extremely undervalued 100k in DIDI Stock, removed 
77,ojuu3a,t2_65gtz,1626229606,/r/wallstreetbets/comments/ojuu3a/when_you_dont_get_called_out_in_the_wsb_meme_war/,1,When you don t get called out in the WSB meme war,
78,ojuxxv,t2_3cjclguv,1626230002,/r/wallstreetbets/comments/ojuxxv/breaking_huge_35_trillion_medicare_expansion_clov/,1,Breaking Huge 3 5 trillion Medicare expansion CLOV to the moon ,
79,ojuy0f,t2_20uqoy10,1626230008,/r/wallstreetbets/comments/ojuy0f/senate_democrats_agree_to_35_trillion_tax/,1,Senate Democrats Agree to 3 5 Trillion Tax Spending Plan Bloomberg,
80,ojuywu,t2_5t2n947s,1626230095,/r/wallstreetbets/comments/ojuywu/when_you_tell_your_parents_that_you_lost/,1,When you tell your parents that you lost everything on a WallStreetBets play,
81,ojv0oz,t2_4yflngyb,1626230272,/r/wallstreetbets/comments/ojv0oz/body_120_short_float_a_real_long_term_company/,1, BODY 120 short float a real long term company , removed 
82,ojv2xa,t2_ylpio5,1626230504,/r/wallstreetbets/comments/ojv2xa/fidelity_is_the_real_mvp_refunded_outrageous_30/,1,Fidelity is the real MVP refunded outrageous 30 ATM fee from strip club, removed 
83,ojv30w,t2_8x3nemzd,1626230513,/r/wallstreetbets/comments/ojv30w/robinson_is_splitting_up_250k/,1,Robinson is splitting up 250k, removed 
84,ojv7yu,t2_bwg36jge,1626231017,/r/wallstreetbets/comments/ojv7yu/amc_theory_dont_claim_to_be_the_smartest_cookie/,1,AMC Theory don t claim to be the smartest cookie But I like this theory Disprove me if you need too I don t have a problem with it at all ,Theory need help from apes to farther or disprove it New theory boys Lou Vs WallStreet YouTube Channel is the spokesperson for some very powerful people good people amc positive people Let me explain Lou s apart of Wall Street that s how he made his millions until he got in trouble for scamming people BUT what does every shoe company Nike adidas UA have A fall guy A guy that the pay a wholeeee lot of money but when they get caught paying a college player that guy takes the fall not the company We ll fast forward to now Lou still knows all his big time Wall Street buddies Perfect guy to be the spokesperson for a amc pro hedge fund maybe And on top of all that Lou NEVER asks for money Never runs ads on YouTube Even on his LouTV website No ads nothing money getting BUT you know what there is What do you have to do before entering his site ACCEPT COOKIES anyone wanna guess what cookies are A way to TRACK DATA TRACK DATA of each individual that comes to the site WTF does Lou need data for He don t but high up PRO AMC people do hedge funds on the LONG side of amc need data and help too just as much as the SHORTS do Tell me I m fucking wrong Just wanted to do my DD I don t claim to know it all I could even be completely wrong But do what we do Apes Dig and let s father this argument theory or disprove it Either or is positive New information only leads to us growing stronger 
85,ojv8xk,t2_9wwcgcug,1626231118,/r/wallstreetbets/comments/ojv8xk/hi_super_noob_here_what_say_the_wsb_fam_about_clf/,1,Hi super noob here what say the wsb fam about CLF Muchas danke for your not financial advice ,
86,ojv9tg,t2_a1hozb2a,1626231213,/r/wallstreetbets/comments/ojv9tg/exela_technologies/,1,Exela Technologies , removed 
87,ojva0u,t2_28yabylu,1626231234,/r/wallstreetbets/comments/ojva0u/lottodoge_bot_get_in_while_you_can_and_win_by/,1,LottoDoge Bot get in while you can and win by sharing,
88,ojva1f,t2_blp1abqf,1626231235,/r/wallstreetbets/comments/ojva1f/break_even_on_call_option_is_less_than_current/,1,Break even on call option is less than current market price ,Let me preface by saying I m new to options I see this call option that has a break even of 10 03 but the current market price is 10 18 Am I missing something or couldn t I just buy the option and then exercise it immediately 
89,ojva6m,t2_9vdtfa1e,1626231251,/r/wallstreetbets/comments/ojva6m/stocks_and_bonds_the_differences_between_the_two/,1,stocks and bonds the differences between the two,
90,ojval3,t2_yhnxcgv,1626231292,/r/wallstreetbets/comments/ojval3/nok_and_atao/,1,NOK and ATAO,Hey guys I m wondering if we going to be the next place to go For getting to the moon I believe we need to go to NOK and ATAO stocks next because we need to be able to talk with each other when we get there 
91,ojvb8m,t2_96tu0ym2,1626231357,/r/wallstreetbets/comments/ojvb8m/fuk/,1,Fuk,
92,ojvbgy,t2_9v8pe5k,1626231378,/r/wallstreetbets/comments/ojvbgy/we_still_buying_dog_coin/,1,We still buying Dog coin , removed 
93,ojvbqq,t2_a1hozb2a,1626231405,/r/wallstreetbets/comments/ojvbqq/exela_technologies_for_the_win/,1,Exela Technologies for the win ,Apes are lining this one up and it is moving up Docusign has a share price in the triple digits and XELA is a direct competitor 1 2B in annual revenues Small share float 18 000 employees Short squeeze imminent Best of both worlds Legit company undervalued based on fundamentals Ranked 1 by Fintel for the short squeeze ranking My ducks are in line 
