,postid,author,created_utc,permalink,score,title,selftext
85,ofmhq8,t2_9klhlccg,1625675474,/r/wallstreetbets/comments/ofmhq8/did_i_do_the_thing_right/,1,Did I do the thing right ,
86,ofmid6,t2_a0bgqz33,1625675523,/r/wallstreetbets/comments/ofmid6/lets_make_these_bfly_fly/,1,Let s make these BFLY fly ,I am an ape and I invested in Butterfly BFLY Lost a few bags full of tendies A promising company already shorted pretty heavily The stock is 12 55 today I got BLFY in my stomach Let s make them fly 
87,ofmjjw,t2_55o93yqe,1625675616,/r/wallstreetbets/comments/ofmjjw/rip_my_portfolio/,1,Rip my portfolio,
88,ofmkrd,t2_7d54qm1n,1625675709,/r/wallstreetbets/comments/ofmkrd/i_just_liked_the_stock/,1,I just liked the stock,
89,ofmnkv,t2_8p3pduop,1625675938,/r/wallstreetbets/comments/ofmnkv/short_put_butterfly/,1,Short Put Butterfly,I am a beginner so I would be obliged if you can bestow your expertise What happens at expiration when all the legs are ITM at expiration Do you get to keep all the premium received since the price is far below both strikes Are the ITM legs get exercised If so what is the cost Does it impact my account balance If you could kindly advise me I would truly appreciate it 
90,ofmnqn,t2_au42usth,1625675951,/r/wallstreetbets/comments/ofmnqn/negg_someone_be_proud_of_me_plz_set_my_limit_sell/,1, NEGG someone be proud of me plz Set my limit sell at 69 for the sake of meme Staying true to form ,
91,ofmo94,t2_9vev932u,1625675993,/r/wallstreetbets/comments/ofmo94/xela_is_cooking_with_crisco/,1, XELA is cooking with Crisco ,
92,ofmodo,t2_a27yrv45,1625676003,/r/wallstreetbets/comments/ofmodo/wish/,1,Wish ,
93,ofmoo9,t2_a0bgqz33,1625676031,/r/wallstreetbets/comments/ofmoo9/lets_make_these_bfly_fly/,1, Let s make these BFLY fly ,I am an ape and I invested in Butterfly BFLY Lost a few bags full of tendies A promising company already shorted pretty heavily The stock is 12 55 today I got BLFY in my stomach Let s make them fly 
94,ofmorn,t2_3gfwderh,1625676039,/r/wallstreetbets/comments/ofmorn/im_18/,1,I m 18 ,
95,ofmoux,t2_a1j01hdb,1625676045,/r/wallstreetbets/comments/ofmoux/btu_all_the_way/,1,BTU ALL THE WAY , removed 
96,ofmq9j,t2_8c0k6jc2,1625676164,/r/wallstreetbets/comments/ofmq9j/lessons_from_a_retard_to_another_retard/,1,Lessons from a Retard to another Retard,Alright retards there seems to be some confusion going around on the internet I see alotta activity going on out there in the wild It is time for some lessons that are not financial advice Why would you take financial advice from a retard amp x200B Lesson 1 bers r fuk Lesson 2 Stocks go up Lesson 3 Spamming is for poor people Lesson 4 I Lesson 2 still Lesson 0 like Lesson 6 the Lesson 9 stock amp x200B Seriously though look at this greasy bastard amp x200B wtf https preview redd it d3qyom5gjt971 jpg width 1156 amp format pjpg amp auto webp amp s d96bc7a3ebf3449f1b0614e64977c58b1ab46b27 amp x200B Yea I don t think so that s fucking gross We all know that Bulls are the only way amp x200B wen moon https preview redd it kz9wrxt3kt971 png width 1161 amp format png amp auto webp amp s 213bb87ea5785b35c7ef07b6372066e858f8f8c8 amp x200B Now that is more like it Godspeed retards 
97,ofmqiq,t2_a1j01hdb,1625676182,/r/wallstreetbets/comments/ofmqiq/btu_to_the_moon/,1, BTU TO THE MOON,People are shorting the living shit out of BTU so it s rising get it now before it s on the moon BTU TO THE MOON 
98,ofmqmt,t2_xb881,1625676190,/r/wallstreetbets/comments/ofmqmt/this_retard_doesnt_negotiate_gme_is_my_play/,1,This retard doesn t negotiate GME is my play ,
99,ofmr5h,t2_6fp5howz,1625676233,/r/wallstreetbets/comments/ofmr5h/how_about_to_push_halo_collective_inc/,1,How about to push HALO COLLECTIVE INC , removed 
0,ofmr5h,t2_6fp5howz,1625676233,/r/wallstreetbets/comments/ofmr5h/how_about_to_push_halo_collective_inc/,1,How about to push HALO COLLECTIVE INC , removed 
1,ofmt4g,t2_6fp5howz,1625676395,/r/wallstreetbets/comments/ofmt4g/how_about_to_push_halo_collective_inc/,1,How about to push HALO COLLECTIVE INC , removed 
2,ofmtaq,t2_awpmtx1u,1625676409,/r/wallstreetbets/comments/ofmtaq/install_cryptotab_browser_and_get_real_bitcoins/,1,Install CryptoTab browser and get real Bitcoins for using it Your earnings will keep growing as long as you re watching YouTube reading news and using your social network accounts daily ,
3,ofmthy,t2_5kghsti4,1625676428,/r/wallstreetbets/comments/ofmthy/ladies_and_gentleman_let_me_introduce_weird_gyno/,1,Ladies and gentleman let me introduce weird gyno fetish CLOV porn ,
4,ofmtj4,t2_4e5w3kui,1625676430,/r/wallstreetbets/comments/ofmtj4/baby_space_floki_bsf/,1, Baby Space Floki BSF , removed 
5,ofmtzo,t2_a0bgqz33,1625676467,/r/wallstreetbets/comments/ofmtzo/lets_make_these_bfly_fly/,1, Let s make these BFLY fly ,I am an ape and I invested in Butterfly BFLY in February Lost a few bags full of tendies A promising company already shorted pretty heavily The stock is 12 55 today I need more apes to help me get my tendies back and populate the moon with BLFY There are no butterflies on the moon at this time as far as I know I fell for it and now I I got BLFY in my stomach Let s make them fly 
6,ofmue1,t2_60wri60y,1625676501,/r/wallstreetbets/comments/ofmue1/wow_ipw_running_hard_today/,1,wow IPW running hard today,and not even on news anyone know whats up why its up 20 and volume is surging Id love to know if anyone has any thoughts on it
7,ofmv3k,t2_3j71j8l,1625676567,/r/wallstreetbets/comments/ofmv3k/yolo_on_newegg/,1,Yolo on Newegg ,
8,ofmw2c,t2_5acwitd3,1625676641,/r/wallstreetbets/comments/ofmw2c/where_do_new_chicken_tendies_come_from_newegg/,1,Where do new chicken tendies come from NewEgg ,
9,ofmwfu,t2_cyh5esg,1625676672,/r/wallstreetbets/comments/ofmwfu/lets_go_maken_a_quick_buck_on_carv/,1,LETS GO MAKEN A QUICK BUCK ON CARV ,
10,ofmwjx,t2_nud9fh1,1625676681,/r/wallstreetbets/comments/ofmwjx/paycheck_came_in_ill_let_the_people_choose_where/,1,Paycheck came in I ll let the people choose where my trendies will from,
11,ofmwk7,t2_bi9win5y,1625676681,/r/wallstreetbets/comments/ofmwk7/get_ready/,1,Get ready,Mayor crisis coming soon to much money flowing around housing prices going crazy let s bet inflation
12,ofmwmk,t2_a69klgh0,1625676686,/r/wallstreetbets/comments/ofmwmk/any_wsb_wisdom_on_the_wise_ipo_today/,1,Any wsb wisdom on the wise ipo today ,I have been a user of wise since the beginning and can vouch for their product I wonder what the common wisdom around here thinks about this They started very high and skipped the usual IPO proceedings by getting rid of middlemen https www reuters com business wise shares indicated open 10 bln valuation auction 2021 07 07 
13,ofmwpz,t2_a4tzvx5h,1625676693,/r/wallstreetbets/comments/ofmwpz/any_one_into_this_phun_looks_as_if_chatter_is/,1,Any one into this PHUN Looks as if chatter is starting could this be the next potential runner ,
14,ofmwvp,t2_1lcn4m05,1625676707,/r/wallstreetbets/comments/ofmwvp/10k_shares_of_clov_for_valhalla_i/,1,10K Shares of CLOV for Valhalla i,Added 10K Shares of CLOV on the dip valhalla or valhalla amp x200B https preview redd it 4u9mw8smlt971 png width 696 amp format png amp auto webp amp s 2710ba9796f73f173e435dd564e5537db0474d59
15,ofmwx8,t2_8rvrwlgq,1625676711,/r/wallstreetbets/comments/ofmwx8/wen_green/,1,Wen green ,
16,ofmx7d,t2_nud9fh1,1625676733,/r/wallstreetbets/comments/ofmx7d/my_paycheck_came_in_a_sea_of_red_ill_let_the/,1,My paycheck came in a sea of red I ll let the people choose where my trendies come from,
17,ofmx9i,t2_527s6p5y,1625676737,/r/wallstreetbets/comments/ofmx9i/virginity_taken/,1,Virginity taken ,
18,ofmyj6,t2_d5ypkrw5,1625676839,/r/wallstreetbets/comments/ofmyj6/amc_we_are_family/,1,AMC WE ARE FAMILY,
19,ofmylt,t2_w35iyw9,1625676846,/r/wallstreetbets/comments/ofmylt/some_negg_net_gain_porn_from_my_earlier_yolo_post/,1,Some NEGG net Gain Porn from my earlier yolo post,
20,ofn0jm,t2_1lcn4m05,1625677006,/r/wallstreetbets/comments/ofn0jm/100k_yolo_into_clov/,1,100K YOLO into CLOV,I bought over 100K of CLOV shares on this dip valhalla or valhalla amp x200B https preview redd it a9l6xsltmt971 png width 688 amp format png amp auto webp amp s ffa2621592204e6c141a95a5c2eb7b7f0e748772
21,ofn1au,t2_anptjuzi,1625677064,/r/wallstreetbets/comments/ofn1au/xela_short_squeeze_is_here/,1,XELA Short Squeeze is here , removed 
22,ofn1hp,t2_cvq24x3j,1625677081,/r/wallstreetbets/comments/ofn1hp/use_mchp_now/,1,USE MCHP NOW , removed 
23,ofn2pe,t2_4levvfrr,1625677177,/r/wallstreetbets/comments/ofn2pe/metacorn_hdl/,1,META CORN HDL ,
24,ofn2u9,t2_d5yswsoh,1625677187,/r/wallstreetbets/comments/ofn2u9/pennystocks_stockpicks_stockstobuy_otc/,1, PENNYSTOCKS Stockpicks stockstobuy otc ShortSqueeze amc gme BUY TICKER PHIL only under a penny will hit 1 00 then shoot up to 3 50 Target price , removed 
25,ofn3wl,t2_3f83kevm,1625677254,/r/wallstreetbets/comments/ofn3wl/first_stonk_purchase_in_3_years_sold_off_my_401k/,1,First stonk purchase in 3 years Sold off my 401k to open my own pharmacy 2M in sales since opening 1 5 months ago Joining the apes finally ,
26,ofn402,t2_60wri60y,1625677262,/r/wallstreetbets/comments/ofn402/ipw_is_surging_20/,1,IPW is surging 20 ,Any one know why this is surging today its volume is growing and growing market cap up to 194mil and free float is about 8 million a very low float I might add if anyone know why this is surging because i couldn t find any news on it although the financials are fab on this company and I cant believe its even under 10 wow a new ipo that seems like no one is touching until now i got in so I am happy thinking of jumping out but I got fomo now 
27,ofn40n,t2_7rayj,1625677263,/r/wallstreetbets/comments/ofn40n/oops/,1,Oops,
28,ofn4bt,t2_7ldnw4i4,1625677287,/r/wallstreetbets/comments/ofn4bt/pathetic_seeing_these_articles/,1,Pathetic seeing these articles,
29,ofn4cy,t2_d5yswsoh,1625677290,/r/wallstreetbets/comments/ofn4cy/pennystocks_stockpicks_stockstobuy_otc/,1, PENNYSTOCKS Stockpicks stockstobuy otc ShortSqueeze amc gme BUY TICKER PHIL only under a penny will hit 1 00 then shoot up to 3 50 Target price , removed 
30,ofn4mu,t2_1lcn4m05,1625677310,/r/wallstreetbets/comments/ofn4mu/100k_yolo_into_clov/,1,100K YOLO into CLOV,
31,ofn5mv,t2_9ebfrp2m,1625677388,/r/wallstreetbets/comments/ofn5mv/if_gme_reaches_1k_by_the_end_of_next_week_i_will/,1,If gme reaches 1k by the end of next week I will shove a whole thing of bananas up my ass and put it on pornhub, removed 
32,ofn6ir,t2_awcuilca,1625677454,/r/wallstreetbets/comments/ofn6ir/wish_apes_together/,1, WISH Apes together ,
33,ofn6s1,t2_1jwbhabk,1625677474,/r/wallstreetbets/comments/ofn6s1/were_offering_the_binance_community_2m_in_prizes/,1,We re offering the Binance community 2M in prizes leading up to our BinanceTurns4 concert as a way of saying thank you for sharing your Digital Currency journey with us FULL LINEUP Disclosure NIKI BLOND ISH MORE ATTRACTIONS CZ AMA DJ set with lil bubble Giveaways amp more ,
34,ofn6ug,t2_4levvfrr,1625677478,/r/wallstreetbets/comments/ofn6ug/loss_porn_metacorn_yolo/,1,LOSS PORN META CORN YOLO ,
35,ofn6zk,t2_a14ooles,1625677489,/r/wallstreetbets/comments/ofn6zk/what_a_red_day_am_i_doing_it_right/,1,What a red day Am I doing it right ForgotToIncludeAMC,
36,ofn72l,t2_58pflyvm,1625677494,/r/wallstreetbets/comments/ofn72l/vizcwhats_with_all_the_volume_today_cant_find/,1,Vizc whats with all the volume today Cant find anything new on it ,
37,ofn7g3,t2_9hh7ud88,1625677520,/r/wallstreetbets/comments/ofn7g3/crsr_dd/,1, CRSR DD,The gaming peripherals brand Corsair ticket symbol CRSR is extremely undervalued for reasons i will list in this DD 1 To begin with Corsair is part of the gaming industry which is set to at least double in size by 2030 Corsair has one of the biggest market shares of gaming peripherals and they have consistently sustained the high competition of this industry 2 Corsair innovates year after year by releasing new products that are immediately loved by consumers Their latest headset is a great example of this They managed to merge a gaming headset with a casual and easy to use design making it the perfect headset for gamers on the regular basis 3 Corsair has solid financials Their P E ratio is only 20 THAT IS RIDICULOUSLY LOW especially considering their very high growth rate 4 Their balance sheet is great and their debt is rather low compared to their cash meaning they won t go bankrupt anytime soon and can use cash to fuel their future growth To sum up CRSR is an insane opportunity so hop on the Corsair train and get those profits 
38,ofn7hp,t2_7gm5zzch,1625677524,/r/wallstreetbets/comments/ofn7hp/gme/,1,GME ,
39,ofn7q8,t2_3ly1doa,1625677542,/r/wallstreetbets/comments/ofn7q8/wish/,1,WISH,
40,ofn7tl,t2_a1qrvfcz,1625677550,/r/wallstreetbets/comments/ofn7tl/65k_sharesoptions_yolo/,1,65k Shares Options YOLO,
41,ofn7to,t2_anptjuzi,1625677550,/r/wallstreetbets/comments/ofn7to/xela_short_squeeze_is_here/,1,XELA Short Squeeze is here ,
42,ofn8rx,t2_9ebfrp2m,1625677631,/r/wallstreetbets/comments/ofn8rx/bananas_in_my_ass_if_gme_hits_1k_by_the_end_of/,1,Bananas in my ass if gme hits 1k by the end of next week, removed 
43,ofn8xl,t2_ceg7bmi7,1625677643,/r/wallstreetbets/comments/ofn8xl/tech_lead_jailed_due_to_rug_pull/,1,Tech Lead Jailed due to RUG PULL , https www youtube com watch v oMif2tJs5q8 https www youtube com watch v oMif2tJs5q8 https preview redd it 2wm8ni9kot971 png width 965 amp format png amp auto webp amp s c39626aecf14c4a210d1119657e6a49a676afeb5
44,ofn9we,t2_ceg7bmi7,1625677718,/r/wallstreetbets/comments/ofn9we/tech_lead_jailed/,1,Tech Lead Jailed, https www reddit com r wallstreetbets comments ofn8xl tech lead jailed due to rug pull https www reddit com r wallstreetbets comments ofn8xl tech lead jailed due to rug pull 
45,ofna0d,t2_3ly1doa,1625677726,/r/wallstreetbets/comments/ofna0d/wish_me_luck/,1, WISH Me Luck,
46,ofna7l,t2_4is32agr,1625677744,/r/wallstreetbets/comments/ofna7l/wish_every_day_earnings_soon_get_in/,1, WISH every day EARNINGS SOON Get in, removed 
47,ofnado,t2_7qu38mai,1625677758,/r/wallstreetbets/comments/ofnado/consolidation/,1,consolidation, removed 
48,ofnau3,t2_5568pdc0,1625677790,/r/wallstreetbets/comments/ofnau3/re_oracle_5_day_run_up/,1,RE ORACLE 5 day run up,Many of you who took my DD took larger gains than this amp x200B https www reddit com r wallstreetbets comments ob0ryx oracle i see the future because the past said so https www reddit com r wallstreetbets comments ob0ryx oracle i see the future because the past said so https preview redd it xzeekc7rot971 png width 949 amp format png amp auto webp amp s 9406bad1e808cc4a10f5f2ddcb0c67719edad728
49,ofnc7n,t2_cldmp4rr,1625677895,/r/wallstreetbets/comments/ofnc7n/in_moments_like_this_you_glad_you_didnt_quit_your/,1,In moments like this you glad you didn t quit your job to dedicate yourself to stocks only ,
50,ofnd6q,t2_2rwibupp,1625677969,/r/wallstreetbets/comments/ofnd6q/is_ivr_being_shorted_currently_also_is_it_a_good/,1,Is IVR being shorted currently Also is it a good longterm buy , removed 
51,ofndv2,t2_4qfe80fr,1625678018,/r/wallstreetbets/comments/ofndv2/bb_ford_news_on_sales_for_electric_vehicles/,1,BB Ford news on sales for electric vehicles demonstrated by the Mach E currently running on BB QNX, Strong Electric Vehicle Sales Growth Leads Ford s Recovery cleantechnica com https cleantechnica com 2021 07 07 ford electrified vehicle sales grow 117 in june mustang mach e sales up 27 month over month 
52,ofne6h,t2_176rew,1625678044,/r/wallstreetbets/comments/ofne6h/i_guess_this_is_a_solid_sign_that_brkb_is_going/,1,I guess this is a solid sign that BRK B is going to 7 million We got new garbage containers in my city and this is what one of the codes said on one of them as you can see ,
53,ofnee0,t2_ayiefoj,1625678060,/r/wallstreetbets/comments/ofnee0/does_this_qualify_as_tendies/,1,Does this qualify as tendies ,
54,ofnee6,t2_bpce2fwy,1625678060,/r/wallstreetbets/comments/ofnee6/xela_to_follow_gme/,1, XELA to follow GME ,
55,ofnfam,t2_ci8r4mtm,1625678132,/r/wallstreetbets/comments/ofnfam/an_overlooked_chinese_pearl_that_is_definitely/,1,An overlooked Chinese pearl that is definitely worth seeing , Title Qudian Inc QD Focus Online consumer finance experience Financials for checking the pinned data below Simplified overview https www investing com equities qudian inc financial summary https www investing com equities qudian inc financial summary Full report Q1 2021 https ir qudian com news releases news release details qudian inc reports first quarter 2021 unaudited financial https ir qudian com news releases news release details qudian inc reports first quarter 2021 unaudited financial The most important When you take the assets debt you get number ca 3 4 x bigger then the current market cap just this fact alone should reasonably support a price to about 7 instead of the current 2 1 And we don t end here almost half of assets is pure cash they have even more cash per square after deducing liabilities then the current market price without even counting the other assets And the tendency of company is pretty awesome too almost constantly decreasing debt and increasing cash and assets overall making huge profits per so cheap square it seems like it could be approx 1 1 dollars for 2021 for 2 1 dollar share that s incredibly f cking lot To sum up 3 4 x undervalued making new money NOT bleeding seems like it could be approx half of price of the share just for this single year plenty of cash nice financial politics extremely low debt to equity ratio 
56,ofnfm0,t2_cvq24x3j,1625678157,/r/wallstreetbets/comments/ofnfm0/there_was_a_sale_so_i_bought/,1,There was a sale so I bought ,
57,ofnfr3,t2_3j71j8l,1625678169,/r/wallstreetbets/comments/ofnfr3/newegg/,1, NEWEGG,What is the current short float This stock blew up like crazy over night 
58,ofnft9,t2_8wev3dbo,1625678174,/r/wallstreetbets/comments/ofnft9/whats_up_with_sndl_short_coming/,1,Whats up with sndl Short coming ,
59,ofnfx5,t2_176rew,1625678180,/r/wallstreetbets/comments/ofnfx5/i_guess_this_is_a_solid_sign_that_brkb_is_going/,1,I guess this is a solid sign that BRK B is going to 7 million We got new garbage containers in my city and this is what one of the codes said on one of them as you can see ,
60,ofngsx,t2_csxrskvu,1625678250,/r/wallstreetbets/comments/ofngsx/amc/,1, AMC,Good Morning Ladies and retards this is your captain speaking I would like to welcome you to Moon Airline This is flight number 5582 heading to the MOON we will be in the air for a total time of 13 hours and 35 minutes Please be sure you are seated and your seatbelt is fastened Get ready for takeoff 
61,ofnhat,t2_cu3tcm0f,1625678287,/r/wallstreetbets/comments/ofnhat/acb_to_the_moon/,1,ACB to the moon ,
62,ofnhdg,t2_1adol80,1625678294,/r/wallstreetbets/comments/ofnhdg/found_the_source_boys/,1,Found the source boys ,
63,ofnhl1,t2_a47ld4ft,1625678312,/r/wallstreetbets/comments/ofnhl1/bnn_us_pot_stocks_a_generational_wealth/,1,BNN US pot stocks a generational wealth opportunity ,
64,ofnhyw,t2_cg8in8ja,1625678345,/r/wallstreetbets/comments/ofnhyw/why_dont_we_all_join_forces_and_go_in_on_one_stock/,1,WHY DONT WE ALL JOIN FORCES AND GO IN ON ONE STOCK , removed 
65,ofni1o,t2_304zayge,1625678351,/r/wallstreetbets/comments/ofni1o/no_one_is_selling/,1,NO ONE IS SELLING ,
66,ofnj1f,t2_csxrskvu,1625678429,/r/wallstreetbets/comments/ofnj1f/amc/,1, AMC,Good Afternoon Autists and Retards this is your captain speaking I would like to welcome you to Moon Airlines This is flight number 5582 heading to the Moon we will be in the air for a total time of 13 hours and 35 minutes Please be sure you are seated and your seatbelt is fastened Get ready for takeoff 
67,ofnjrs,t2_csxrskvu,1625678485,/r/wallstreetbets/comments/ofnjrs/amc/,1, AMC,Good Afternoon Autists and Retards this is your captain speaking I would like to welcome you to Moon Airlines This is flight number 5582 heading to the Moon we will be in the air for a total time of 13 hours and 35 minutes Please be sure you are seated and your seatbelt is fastened Get ready for takeoff Good Afternoon Autists and Retards this is your captain speaking I would like to welcome you to Moon Airlines This is flight number 5582 heading to the Moon we will be in the air for a total time of 13 hours and 35 minutes Please be sure you are seated and your seatbelt is fastened Get ready for takeoff 
68,ofnl46,t2_aju7q36z,1625678594,/r/wallstreetbets/comments/ofnl46/down_on_cybl/,1,down on CYBL,CHECK THIS CYBL is a sub penny and im been in since 0038 if she hits 10 ill be a 100 thousandaire hhha
69,ofnlai,t2_4gtfmy6g,1625678608,/r/wallstreetbets/comments/ofnlai/best_counter_arguments_agains_superstonk_dd_and/,1,Best counter arguments agains Super Stonk DD and Game Stop Stock , removed 
70,ofnm48,t2_p76ywqg,1625678672,/r/wallstreetbets/comments/ofnm48/lost_500k_on_stonks/,1,Lost 500k on stonks, removed 
71,ofnmhl,t2_701i2was,1625678700,/r/wallstreetbets/comments/ofnmhl/neggster/,1,NEGGster, removed 
72,ofnmo0,t2_9u04xqrl,1625678714,/r/wallstreetbets/comments/ofnmo0/aht_yolod_my_life_savings_to_average_down_lets_go/,1, AHT YOLO d my life savings to average down let s go ,
73,ofnn04,t2_a57m4qho,1625678738,/r/wallstreetbets/comments/ofnn04/clov_stock_the_news_that_should_have_clover/,1,CLOV Stock The News That Should Have Clover Health Fans Cheering,
74,ofnnti,t2_au42usth,1625678800,/r/wallstreetbets/comments/ofnnti/negg_sold_at_69_staying_true_to_form_now_to_buy_a/,1, NEGG sold at 69 staying true to form Now to buy a new GPU ,
75,ofnoet,t2_a2qv8fuf,1625678846,/r/wallstreetbets/comments/ofnoet/ocugen_36_being_shorted/,1,Ocugen 36 being shorted ,Opinions I believe in their vaccine it s proven more efficient with backed data than other vaccines but they still haven t gone for approval although they did just announce they were ready to submit for it What s your move 
76,ofnoko,t2_3vau67qs,1625678858,/r/wallstreetbets/comments/ofnoko/psfe_supply_and_demand_analyses/,1,PSFE Supply and Demand Analyses,Hi Everyone I was doing some digging into the supply and demand mechanics around the stock PSFE because there were so many bullish analyst ratings on the stock So based on the 13 F filings PSFE Total float is 723 710 000 shares Hedge funds have bought up 399 214 640 which means there s 324 495 360 being traded in the market from a value standpoint that s worth 3 6 billion in shares left floating around amp x200B By comparison GME retail owns about 11 2 billion in shares AMC retail owns about 19 2 billion in shares SPCE retail owns about 10 56 Billion in shares What this tells me is that retail hasn t come in on PSFE in a big way yet Which means there s a lot of room for the stock to grow provided demand in the stock moves up with retail interest Disclaimer I entered a long position on PSFE last week at 12 20 because the daily RSI was over sold and it looked like it bottomed out I added to my position today and yesterday I ll probably continue to add as long as the price doesn t move up quickly 
77,ofnp3s,t2_8rnek1d8,1625678898,/r/wallstreetbets/comments/ofnp3s/hodling_the_dip_sofi_sens/,1,Hodling the dip SOFI SENS ,
78,ofnq68,t2_78kgrna2,1625678982,/r/wallstreetbets/comments/ofnq68/gme_short_trap_as_well_im_betting_it_will_go_to/,1, GME short trap as well I m betting it will go to 400,Ok Thank you for all your comments opinion sarcasm jokes on my AMC post I m also long GME options strike price 400 by end of July I also attached my position in case you wanted to ban me for not proving my case Also see how much money funds poured into GME GME price also bounced from support very nicely If the trend line hold there is a high chance it will go to 400 Back in 2008 when VW got the real short squeeze its market cap once was more than 343 billion And its short interest was only 12 8 of outstanding shares the reason is because Porsche bought a big stake and reduced the number of float shares Therefore the seemingly small 12 8 was in fact a large multiple of available shares to buy back I think the big guys going to attempt such a stunt on either GME or AMC https preview redd it jw238m9qrt971 png width 1549 amp format png amp auto webp amp s ba61442b2b56e606e32c9bdc0251bb19bd21b9b8 https preview redd it 2kboubbkrt971 png width 1299 amp format png amp auto webp amp s 80c672f9ba7fc200f329c80258a22ace3a986044 amp x200B https preview redd it d6yhhum7rt971 png width 938 amp format png amp auto webp amp s 1eee37357498ec174724b5792c8ecaf21828b767
79,ofnqqa,t2_rsp2k,1625679021,/r/wallstreetbets/comments/ofnqqa/any_love_for_xela/,1,Any love for XELA ,I think it has big potential for a run along the lines of MRIN over the next few weeks even if to a lesser extent Decent earnings announcement earlier as well https finance yahoo com news exela technologies reports significant boost 110000995 html https finance yahoo com news exela technologies reports significant boost 110000995 html 
80,ofnqsf,t2_a243hk1d,1625679025,/r/wallstreetbets/comments/ofnqsf/how_im_getting_railed_by_the_market_right_now/,1,How I m getting railed by the market right now ,
81,ofnri9,t2_9lq8z2n9,1625679084,/r/wallstreetbets/comments/ofnri9/crsr_here_around_support_yolo_elgato_catalyst_on/,1, CRSR here around support YOLO Elgato catalyst on July 15th,Elgato Corsair subsidiary has something big news coming out on July 15th CRSR has been hovering around support I am in large on Aug 40 calls
82,ofnrj0,t2_57fz080o,1625679085,/r/wallstreetbets/comments/ofnrj0/podcast_request/,1,Podcast request, removed 
83,ofnrry,t2_cmoecty3,1625679105,/r/wallstreetbets/comments/ofnrry/cel_sci_gata/,1,Cel sci gata,
84,ofnsju,t2_cg2va5v6,1625679173,/r/wallstreetbets/comments/ofnsju/200k_aapl_yolo/,1,200K AAPL YOLO,
85,ofnthc,t2_8fby9nof,1625679249,/r/wallstreetbets/comments/ofnthc/robinhood/,1,Robinhood, removed 
