,postid,author,created_utc,permalink,score,title,selftext
43,ombdnw,t2_1rkmnkt6,1626551477,/r/wallstreetbets/comments/ombdnw/the_york_water_company_yorw_value_analysis/,1,The York Water Company YORW value analysis discussion, First post btw Hello I am a 15 investor getting into value investing and have been researching investing in general for a year or so keep that in mind if I say some pointless stuff As of July 17 I have seen many insiders of YORW purchase this stock on the last day If you go here https www dataroma com m ins ins php t y2 amp am 0 amp sym YORW amp o fd amp d d amp L 4 and see how many insiders amongst them CEO amp President HINES JEFFREY R Chief Operating Officer HAND JOSEPH THOMAS and many more have been making huge purchases over the last few days This normally is a sign to buy a company Here is where I get to the part where is use the little I know of valuing a company and value investing in general In general the EV EBITDA has been way lower than the industry average for other water utility companies who have an average of 23 74 and YORW was at 22 on 12 Jul and is now at a 23 This is not a huge undervaluing but it is positive since at least it is not undervalued In conclusion what do you think about this stock and what are some other advanced tools resources you use to see if a company is under or overvalued I would love to other tools like EV EBITDA I can use for value investing 
44,ombe8o,t2_d06au7pu,1626551533,/r/wallstreetbets/comments/ombe8o/the_so_called_expert_talk_last_year/,1,The so called expert talk last year ,
45,ombhh6,t2_9zwnpi5l,1626551815,/r/wallstreetbets/comments/ombhh6/am_i_doing_this_right/,1,Am I doing this right ,
46,ombira,t2_7oyebpzu,1626551936,/r/wallstreetbets/comments/ombira/i_started_trading_on_huobi_not_long_ago/,1,I started trading on Huobi not long ago,
47,omblf5,t2_2lem0ang,1626552141,/r/wallstreetbets/comments/omblf5/which_one_of_you_apes_is_this/,1,Which one of you apes is this ,
48,omblip,t2_9zwnpi5l,1626552151,/r/wallstreetbets/comments/omblip/am_i_doing_this_right/,1,Am I doing this right ,
49,ombo3v,t2_6aae2k5f,1626552376,/r/wallstreetbets/comments/ombo3v/what_quantitative_easing_actually_is_for_retards/,1,What Quantitative Easing actually is For Retards ,I ve seen a lot of people spreading misinformation about how the Fed actually works and misrepresenting what Quantitative Easing actually means Now for those who don t want to work their brain too much here is a good video from Ted Ed with pictures as well https youtu be GFTKKyYSCKs Now moving on I m going to try summarise Quantitative Easing in as short a fashion as possible Quantitative Easing When America and other countries and their banks fuck up QE is the new money printing Don t be fooled though money isn t usually printed with QE and this is the main misinformation surrounding QE When the Fed lowers rates banks have to hold less money overnight This allows them to loan money If rates were to go negative banks get paid to loan money But you won t get paid they ll usually net the profits and offer 0 rates Now when rates are at 0 and shit isn t happening that s when the Fed begin buying bonds This gives more money to the government which gets you your stimmy check In return bond yields fall and bond investors are forced to look towards riskier investments such as the stock market or corporate bonds to make their money It is this that brings the economy back to life Now is money being given to the government for free No obviously not These bonds the Fed buy have to be paid back with interest This will be paid back in higher taxes tax cuts through the budget deficit printing money or other debt repayment options in the unlikely scenario that the US government begins having trouble paying its debt 
50,omboo4,t2_1xu3v82m,1626552430,/r/wallstreetbets/comments/omboo4/trade_like_a_retard_retard_trading_guide_the_24k/,1,Trade Like a Retard Retard Trading Guide The 2 4K to 63k Story, Introduction Let me just preface this by saying this post is for those who are retarded who harbor real hopes of their YOLO s going to the moon This post is going to be short and it is going to demand you lower your IQ by 50 points before you attempt to emulate But that work will be worth the effort I recommend you learn to read first but if not there will be pictures If your are just here looking for entertainment and gambling that is fine you are in the right place Four weeks ago I began my conversion from a gay bear to a degenerate WSB regular option trader I began this with the hopes that my YOLO s would land on the moon and to prove several points that are often in contention 1 That it can be done 2 That Yolo s do land on the moon 3 That Retard s dreams do become reality Here are my results from the FIRST MONTH AND A HALF of that challenge amp x200B amp x200B 63k in 47 days https preview redd it q22nlkqovtb71 png width 1125 amp format png amp auto webp amp s c893f022d0a520102797c96faa0ce180c1f335aa The question you should be asking yourself is How did i find so many sudden big winners in a single month an a half I will teach you exactly how below First I need to flex the peak of my gains before SPCE bent me over amp x200B SPCE bending me over https preview redd it tvn6gry2wtb71 png width 1125 amp format png amp auto webp amp s 1b599eeec06d9fc9f3f9f0e6a0d280f4343867ba 1 Chase stupid memes and hot stocks Meme stock are the only way and have been my biggest wins BB MVIS CLOV Each time buying only deep OTM option YOLO s The biggest losses were SPCE and WOOF 2 Only gamble with options We are either sleeping in a LAMBO or under a bridge there is no in between and there shouldn t be for you either Do you want to make 400 or thousands always ask yourself can i be more retarded and if the answer is not clearly no then you make the right trade FEAR NO MARGIN CALL This is my starting point https preview redd it azi9aubdxtb71 png width 1125 amp format png amp auto webp amp s c9edf0f28dedadfea9934c1191f5cb8d57adc2e0 That is the full guide retards that you for reading now GO OUT AND DO YOUR THING The number is negative because i have withdrawn 
51,ombpg0,t2_a50grcqw,1626552506,/r/wallstreetbets/comments/ombpg0/sold_gains_to_add_on_to_mmat_before_it_explodes/,1,Sold gains to add on to MMAT before it explodes when shorts have to cover after T 21 sometimes next week ,
52,ombpx4,t2_a2drp795,1626552551,/r/wallstreetbets/comments/ombpx4/vista_lyonscapitalcommx/,1,vista lyonscapital com mx,
53,ombrtq,t2_a50grcqw,1626552734,/r/wallstreetbets/comments/ombrtq/mmat_price_prediction_after_t21_next_week_as_well/,1,MMAT price prediction after T 21 next week as well as by before end of year , removed 
54,ombtyz,t2_9lz9mnei,1626552931,/r/wallstreetbets/comments/ombtyz/the_state_of_the_nonmemes_a_ta_of_all_your/,1,The State of the Non Memes a TA of all your favorite can t possibly fail but are definitely not memes investments SPCE RKT WISH CLNE WKHS CRSR SOFI WOOF ,Did you come to Wallstreetbets today to read an amateurish technical analysis from a guy who only knows how to draw horizontal lines Well my friend you ve come to the right post This time featuring all the non meme stocks that have you seething with regret pumped for the future Featuring bad jokes that won t land along with charts that have no real meaning amp x200B Table of Contents Part 1 To Meme or Not to Meme Part 2 Charts of Happiness 1 SPCE 2 RKT 3 WISH 4 CLNE 5 WKHS 6 CRSR 7 SOFI 8 WOOF Part 3 Meme Necromancy Part 4 The Week Ahead amp x200B Part 1 To Meme or Not to Meme I wrote out definition of a meme stock that I m using in more detail in this post https www reddit com r wallstreetbets comments oib6l8 the state of the meme a ta of all your favorite But since ain t nobody got time to go read more shit here is a very simple summary Meme DDs get made amp price goes up gt Options Wizards buy options amp thing happens gt idiots FOMO in at terrible prices then diamond hand gt diamond hands result in higher low gt repeat for next leg up All of the tickers in this post either never fit this pattern or failed out of it after the first price spike I know There s no pattern There never was a pattern It was all just random Got it Look I m just a simple man that wears his intentions on his trucker hat but it looks like there at least was some pattern to these moves It might be dead after these past few weeks of bludgeoning but other than RKT nothing in here really fit it anyway amp x200B Part 2 Charts of Happiness First up what is the State of the Non memes In short even more fucked than the so called memes amp x200B Starting off with Big balls Branson the true rocketman SPCE Looks just like a flight to space https preview redd it txvjroscdtb71 png width 1570 amp format png amp auto webp amp s d65112ac096aa8b2c23ad1f74edc48556052dcef So on Monday we found out the true purpose of Sir Branson s flight to space to drop 500 million in shares on his devoted retail investors from maximum altitude Last weekend I called out a retrace to 40 based on my expert line drawing skills I was right for the wrong reasons but who cares about that right is right I also want to congratulate the folks who bought puts on the chance he got vaporized but ended up making gains without the ethical concerns Cbass s call for SPCE we re going to 27 50 where there ll be a pause and a fake rally then a breakdown all the way to 16 At that point this is a ligit good long term investment emphasis on long The underlying company will eventually make money Reason I want to go to space amp x200B Next not rocketman RKT read in voice of Vader Now your failure is complete https preview redd it m7snqjsqetb71 png width 1570 amp format png amp auto webp amp s b23168e852f5b7e297b09253acb9785fc4ffd738 Of the non memes on this list this was one that was an actual meme for a few brief glorious moments Now it s completely failed 1 It broke back down all the way to all time lows and then put in a new all time low 2 Rallying off the bottom it then got rejected by the previous breakout level 3 That rejection was so hard that it went back down to all time lows again Cbass s call for RKT we re going to put in another new all time low best case we trade between my lines before crawling back out of the basement Like SPCE the underlying company is not actual dogshit Indeed buying a house with your phone looks to be one of the last frontiers for convenience There is almost nothing else that you can t purchase over the internet This is the direction we are heading so it is inevitable that soon enough you ll be able to purchase a home as easily as you order your fleshlights HOWEVER Zillow is probably the better bet in this space Still this will crawl back up eventually amp x200B WISH upon Jesus cause you need Him We got Amazon on the ropes guys https preview redd it 8d9f7agwgtb71 png width 1570 amp format png amp auto webp amp s 16818c8b9f65716c98a68a7f2222aeaba76ac08e Apparently this company is a shittier version of Amazon Which makes it the next Amazon This chart looks a lot more like a P amp D than a meme chart But I tried to put the lines on it anyway Following Cbass s Second Law of TA I just drew a lower line so that you could feel better about your investment decision Cbass s call for WISH 5 share buyout from Amazon Seriously though the underlying company needs to at least have something going for it It can be hopimum fueled bullshit wrapped up in Cathie Woodisms disruptive innovative future tech game changer next TSLA etc But if your pitch is they do what Amazon already does but somehow better Well the chart is giving you the answer amp x200B Hope you CLNE d your assholes 4 here we come https preview redd it do9byny5jtb71 png width 1570 amp format png amp auto webp amp s f1e14deb624fb233ce095ac84fe3f644e6bf5f80 The thesis underlying this company isn t as shit as WISH but it s not great Cow farts Is the process even actually carbon neutral I suspect it isn t but I just glanced at this and thought one nuclear power plant will produce more energy in a year than this company could in a decade I didn t do any math so maybe I m missing the secret sauce here but I suspect the secret is just in the labeling gt spoilers it s soy sauce lt Cbass s call for CLNE breakdown to 5 If enough of you retards distinguished investors actually bought into this you should prevent a return to 2 but the company is going to have to actually produce results before you get any upside amp x200B Deadhorse WKHS Stop already it s dead https preview redd it 26nro0ppktb71 png width 1570 amp format png amp auto webp amp s 7fc3e06ed1dc1195f8e69f6aee629f2fb7540b77 This chart should end up in textbooks under the heading Scam PAC Was that USPS contract even that great Ask Ford As for meme status I put in a breakout line for fun and we are right at that level Are you saying we have a chance One in a million Cbass s call for WKHS we hold the 11 32 line for the next week people declare it s back on leading to a fake rally followed by a breakdown to 7 What do I think of the underlying company not much Drones Have you seen Amazon s Drone Mothership EV trucks TLSA Ford GM literally everyone else I smell a buyout on the distant horizon amp x200B Peripherals for the gaming rig you ll never finish because there are no graphics cards and never will be CRSR Can I get a D with that P https preview redd it hp6mf8v3mtb71 png width 1570 amp format png amp auto webp amp s f89dc4c53a57bc36fb3413be3fb8504ded878887 This is a P amp D straight up It appeared on the sub shot up and then immediately retreat back to the channel Cbass s call for CRSR sideways in the channel for weeks to come It s tempting to call another breakdown here but I don t want to lose all my karma The underlying company is not bad They can charge a premium on their stuff and it has a decent quality to it I m typing this out on an overpriced Corsair keyboard with all the RGB vomit My mouse is Corsair too and I like how they all sync up It ll never be a true meme though amp x200B I don t know what this company is SOFI But I m interested in buying it anyway https preview redd it m5wt5894ntb71 png width 1570 amp format png amp auto webp amp s 5c172193fe387cff2e3d95d02858bff172e739bd Just kidding I d never buy this above 12 No meme action here just a run up after the WSB pump The dump is upon us and will continue There is something about this ticker that I don t like Maybe it was held by someone that burned me back in the day Don t know but I don t like it Cbass s call on SOFI it will wipe out the entire gains made by the Giant Green Dildo on Jan 7 This is based entirely on a gut feeling amp x200B Actual dogshit WOOF I recommend turning the chart upside down https preview redd it gya9w300otb71 png width 1570 amp format png amp auto webp amp s 60072f9e5209b0f68a4e7e4f26af95c408a551f1 Another P amp D I mentioned this one on last week s post It s gotten worse since then The beatings will continue until moral improves evaporates Cbass s call on WOOF a new all time low The underlying company is not terrible but it s pet food Can you really charge that much of a premium for pet food You can for human food Go to Whole Paycheck and see for yourself But while there is a slice of rich people and crazy animal lovers that will pay crazy prices for pet food the majority will not They are doing in house vet services but that will just be used by the poors while said rich people go to a real vet I don t see bankruptcy or anything crazy like that but this is never getting to the moon amp x200B Part 3 Meme Necromancy Given the giant turd upon the face of all of you poor bastards holding these tickers the operative question should be Can we regain the magic The answer is of course you can but a copy pasta low effort DD that just repeats talking points taken from the investor page of the company s website is absolutely not fucking good enough The Cathie Woodisms only work with the support of the price action You can screech innovative and disruptor to the sky until you pass out and nobody is going to give a shit because they see your anus bleeding It s my hypothesis that once a ticker gets to the point where it s fallen out of favor you need actual good news to revive it Look at SPCE for a good example The launch approval was a huge catalyst This is basic ass shit I know but a lot of people are laboring under the impression that one good DD is all they need to get the train back on the tracks They are wrong but what do I really know I m just a friendly faced diner patron amp x200B Part 4 The Week Ahead All of Memelandia got wrecked again this week My only hope for next week is that with the options lying worthless on the road behind maybe we can get some wind in our proverbial sails But given the fact that I joined WSB and bought into this bullshit we re probably all fucked My nickname for myself is always wrong for a reason I have a thesis regarding retail capital exhaustion that I desperately hope is wrong But if it s right the Defenders of Memelandia are actually running out of money All those worthless options and those heavy bags means that there is nothing left to buy the dip Further the proliferation of new tickers post GME spread everyone out into a bunch of plays and there s no exit ramp for the vast majority of them right now Dark days are upon us for certain Cbass is always wrong though Take solace in that amp x200B Good luck and may the lambos be with you amp x200B Positions or ban AKA the Portfolio of Destiny CLOV amp F so good together the SEC should require they be bought as a pair https preview redd it nr2x2c33vtb71 jpg width 1923 amp format pjpg amp auto webp amp s e12eac34481ffba764e9ed49cfa1519136e28eda 
55,ombvj3,t2_a11cq5ro,1626553073,/r/wallstreetbets/comments/ombvj3/aei_lets_keep_mining_green_httpsyoutubekvboqwvswg0/,1, aei let s keep mining green https youtu be kVBoQWVSwg0, removed 
56,ombx2e,t2_a11cq5ro,1626553211,/r/wallstreetbets/comments/ombx2e/aei_see_below_boyz_and_galz/,1, aei see below boyz and galz,
57,ombyyb,t2_blsz1ecw,1626553380,/r/wallstreetbets/comments/ombyyb/after_making_fun_wrinkle_brain_advise_needed/,1,After Making fun Wrinkle brain advise needed TELL TILRAY BB MMAT, removed 
58,omc597,t2_84723trn,1626553902,/r/wallstreetbets/comments/omc597/what_does_democracy_mean/,1,What does democracy mean ,
59,omc80d,t2_cm2bgjuc,1626554165,/r/wallstreetbets/comments/omc80d/will_evgo_moon/,1,Will EVGO moon ,
60,omc81i,,1626554168,/r/wallstreetbets/comments/omc81i/buy_low_sell_low/,1,Buy low sell low , deleted 
61,omc8zg,t2_j10z9,1626554264,/r/wallstreetbets/comments/omc8zg/buy_low_sell_low/,1,Buy Low sell low ,
62,omca95,t2_a2a9k9r1,1626554391,/r/wallstreetbets/comments/omca95/found_lambo_guy_must_have_had_calls_on_amc/,1,Found lambo Guy must have had calls on AMC ,
63,omcfr3,t2_da04f2hh,1626554889,/r/wallstreetbets/comments/omcfr3/longmoon_is_next_safemoon_or_meme_coin/,1,LongMoon is Next SafeMoon or meme coin ,
64,omch5v,t2_a0i6vxsi,1626555023,/r/wallstreetbets/comments/omch5v/clov_holding_strong/,1,CLOV holding strong,Amazing Fridays low volume and held against low resistance trapped upper resistance 8 9 strikes Strong buy from all my analyst friends why 1 growth growth growth 5x PE seems expensive for a Healthcare insurance stock It s not It s a tech platform healthcare disruptor Offering service to 100 counties in US There are over 3000 counties Growth gurus now added to the team to supercharge new signup brokerages They expect 68 72k patients covered I bet they blow this away and we see 100k in January doubling foot print I love this model 2 Clov How about their tech Expected revenue from tech platform which improves patient care reminds physicians important questions to ask i am a doctor this simplifies medicine and will improve quality of care 3 Member benefits home health partnerships drug partnerships even direct Rx mailing grocery partnerships I ll be doing some Strong buying this week at these levels and holding as this is a major growth player
65,omcht3,t2_67o1tg1p,1626555074,/r/wallstreetbets/comments/omcht3/any_speculation_on_ally_financials_earnings/,1,Any speculation on Ally Financial s earnings ,Curious of your thoughts They ve just increased their dividend payout and have had a stellar year on returns Thinking the auto market and used car sales might have an impact on their revenue as they are a top player for auto financing 
66,omchvu,t2_55rkxfar,1626555079,/r/wallstreetbets/comments/omchvu/i_just_cant_resist_the_fds/,1,I just cant resist the fd s,
67,omci0k,t2_aphshoxk,1626555087,/r/wallstreetbets/comments/omci0k/fyre_fest_scam_vibes/,1,FYRE FEST SCAM VIBES,
68,omcisc,t2_aphshoxk,1626555145,/r/wallstreetbets/comments/omcisc/fyre_fest_scam_vibes/,1,FYRE FEST SCAM VIBES,
69,omcjbe,t2_2hag8wzt,1626555196,/r/wallstreetbets/comments/omcjbe/how_to_buy_options_with_scotia_itrade/,1,How to buy options with Scotia itrade ,Any of you fellows or ladies have a scotia itrade account Just starting to get into options and I opened a margin and cash account through Scotiabank so I can get me some option tendies Trouble is it says this account does not allow for option trading What account type do I need to buy options so I can lose all my money 
70,omcl6b,t2_5ymm7kyx,1626555371,/r/wallstreetbets/comments/omcl6b/this_is_so_stupid_i_wanna_exercise_my_calls_and/,1,This is so stupid I wanna exercise my calls and buy 300 shares for 800 each but it s telling me i m not allowed to Anyone here retarded enough to help me out ,
71,omcnyi,t2_85omxes4,1626555626,/r/wallstreetbets/comments/omcnyi/in_the_end_it_is_a_zerosum_game/,1,In the end it is a Zero Sum Game , removed 
72,omco48,t2_5ymm7kyx,1626555642,/r/wallstreetbets/comments/omco48/this_is_so_stupid_i_wanna_exercise_my_calls_and/,1,This is so stupid I wanna exercise my calls and buy 300 shares for 800 each but it s telling me i m not allowed to Anyone here retarded enough to help me out ,
73,omco59,t2_bvf8jrv9,1626555644,/r/wallstreetbets/comments/omco59/saucy_play_ketchup_kraft_heinz_khc/,1,Saucy play Ketchup Kraft Heinz KHC, Disclaimer This is my first DD and probably terrible enough to be flared as a shitpost CONTEXT why all the ketchup talk gt The ketchup thing all started when I posted an image of my Pizza with ketchup on it to the weekend thread only to be bombarded with people telling that ketchup on pizza is fucking psycho I then confessed to using ketchup on curry which only made the situation worse for me This led to a wonderful idea invest in ketchup specifically Kraft Heinz NASDAQ KHC Kraft Heinz amp x200B https preview redd it vk7wafqzytb71 jpg width 2400 amp format pjpg amp auto webp amp s 8b5ae9f757fb1447eb90291362aa736dd2894677 I m sure we re all pretty familiar with Kraft Heinz they manufacture and market food and beverages products internationally Here s a long list of the kind of products cuz why the fuck not Condiments and sauces cheese and dairy meals meats and seafood frozen and chilled foods packaged drinking pouches appetizers nuts and salted snacks refreshment beverages coffee infant and nutrition products and other grocery products as well as desserts dressings toppings and baking The company offers its products under the Kraft Oscar Mayer Heinz Philadelphia Velveeta Lunchables Planters Maxwell House Capri Sun Ore Ida Kool Aid Jell O ABC Master Golden Circle Quero Plasmon Wattie s Pudliszki Classico TGI Fridays and Taco Bell Home Originals brand names amp x200B KHC currently has a market cap of 48 07 billion with a share price of 39 30 For you short enthusiasts there are 20 47 million shares short which is 3 09 of the float 674 28 million Income Statement Revenue 26 42B Revenue per share 21 60 Quarterly revenue growth yoy 3 80 Gross profit 9 17B EBITDA 7 15B Quarterly earnings growth yoy 48 90 amp x200B KETCHUP SHORTAGE After enduring a year of closures apparently some virus was going around dunno if you d heard many American restaurants are facing a nationwide ketchup shortage Also packet prices are up 13 since January 2020 Long John Silver s LLC a chain with almost 700 units had to seek ketchup from secondary suppliers because of the increase in demand The demand is due to the industry s shift to packets which has obviously pushed up prices Everyone out there is grabbing for ketchup Chief Marketing Officer Stephanie Mattingly amp x200B Ketchup is the most consumed table sauce at U S restaurants with approximately 300 000 tons sold to last year according to research firm Euromonitor Even more is eaten at home and the pandemic helped push retail ketchup sales in the US over 1 billion in 2020 around 15 higher than 2019 amp x200B WHY HEINZ THO Heinz is the king of ketchup and has been around for over 150 years They own nearly 70 of America s ketchup market share To keep up with the demand Steve Cornell Kraft Heinz s President of Enhancers Speciality and Away from Home Business Unit said the company plans to open new manufacturing lines increasing production by 25 12 BILLION packets per year amp x200B PRICE TARGET FUTURE Analysists estimate a fair value of 83 80 which is a 100 increase from the current price of 39 30 I believe the future is bright with restaurants reopening more people travelling and generally people going out Wherever you go if there s a place to buy food there s most likely the option of Heinz Ketchup amp x200B I currently don t have a position in this stock to be fair the idea only came up today and it s the fucking weekend Perhaps this could be a reopening play which hasn t had its time to shine yet 
