,postid,author,created_utc,permalink,score,title,selftext
571,kvu6kf,t2_9hhdrsfz,1610466672,/r/wallstreetbets/comments/kvu6kf/yall_sleeping_on_niu/,1,Yall sleeping on Niu, removed 
572,kvu6xl,t2_7r4lz9tc,1610466707,/r/wallstreetbets/comments/kvu6xl/genomics_stocks/,1,Genomics stocks , removed 
573,kvu821,t2_14lc2t,1610466805,/r/wallstreetbets/comments/kvu821/alibaba_driver_sets_himself_on_fire_over_unpaid/,1,Alibaba driver sets himself on fire over unpaid wages, removed 
574,kvu83f,t2_5jzgop0o,1610466809,/r/wallstreetbets/comments/kvu83f/to_the_moon/,5,To the moon ,
575,kvu8b0,,1610466823,/r/wallstreetbets/comments/kvu8b0/mommmmaaa/,0,Mommmmaaa, deleted 
576,kvu8ls,,1610466851,/r/wallstreetbets/comments/kvu8ls/profited_big_off_of_mvis_calls_and_didnt_sell_at/,0,Profited big off of MVIS calls and didn t sell at the peak Sold calls bought shares of MVIS and NAKD NAKD continues to rise MVIS continues to fall What should I yeet my 5k in MVIS into , deleted 
577,kvu8x8,,1610466881,/r/wallstreetbets/comments/kvu8x8/lets_retweet_until_sensei_musk_sees_it_and_zinc8/,1,Lets retweet until Sensei Musk sees it and Zinc8 goes Buy Zinc8 before retweet, deleted 
578,kvu91m,t2_845oem6r,1610466890,/r/wallstreetbets/comments/kvu91m/clean_energy_politics_dd_icln_and_more/,5,Clean Energy Politics DD ICLN and more,tl dr buy ACES TAN and ICLN July calls at any strike and or buy shares Dem trifecta will force these up bigly These tickers have nothing to do with clean energy the underlying technologies or companies and everything to do with political situation in the US https preview redd it k9z54wmj9xa61 png width 868 amp format png amp auto webp amp s 5b05e63aae5750ba75bd9485d58ad49135f337d8 If we take a look at ICLN s historical chart it appears to have peaked in 2008 But how is this possible I thought clean energy was invented in 2015 you say You see in June of 2008 the a barrel of West Texas Intermediate https imgur com a jIggkVb WTI spiked up to 147 and then down to 32 in December 2008 amp x200B WTI barrel not adjusted for inflation https preview redd it dhcusfsl9xa61 png width 1692 amp format png amp auto webp amp s b035d7440b567a06b2c5e2385c63eb7e1ccaa81b The Oil Crisis of 2008 Someone could do a whole write up on that topic but basically oil supply and demand curves are highly inelastic If oil supplier A is blown up in a terrorist attack or nationalized in a socialist revolution oil supplier B can t just drill a new well immediately That s basically what happened in 2008 due to the political situations in several different countries in a short time period oil production was severely disrupted and with increasing demand this caused the spot price to soar Coincidentally BlackRock offered ICLN to the public for the first time in June of 2008 at the peak of the oil spike at 50 share With the spot price of oil at insane levels talk of peak oil in the zeitgeist democrats talking about addressing climate change head on with a cap and trade bill investors suddenly were dreaming of the post oil future There was a lot of interest in investing in green energy companies Who wouldn t want to buy shares in Chevron in 1897 right Well unfortunately for the retards that gobbled up whatever BlackRock was peddling June 2008 was a bad time to go long on any security as Lehman Brothers would file for bankruptcy in September which would create a global recession and swift fall in oil prices as demand plummets during recessions With a barrel of oil cheaper once again cheaper than a keg of bud lite green energy stocks plummeted Climate Change In case you were eating crayons in grade school you see carbon emissions are heating up the planet and it s creating an increase in extreme weather events such as droughts wildfires severe snowstorms tropical storms and the like Even if you don t give a shit the polar bears or Australia s tourism industry or Florida the extreme weather events are not ideal So let s solve climate change then There is a big problem though Actually solving climate change has this unfortunate effect of reducing the viability of companies in the O amp G sector which means if passed O amp G workers will lose their jobs Doubly unfortunate for the democrats O amp G workers are concentrated in a bunch of swing states like Pennsylvania Ohio and Texas etc These states have entire cities where the local economy is entirely dependent on O amp G companies Your average democratic primary voter though does not live in one of those cities Their general attitude can be somewhat unfairly boiled down to we have to do this thing that s morally important to me and we have to make some sacrifices and you will have to lose your job and I will keep mine but we have to make sacrifices or the world will LITERALLY end by 2040 The cap and trade bill of 2009 There is a quite straightforward solution to climate change cap and trade The idea is that every year government will offer permits to emit X tons of CO2 and sell these to the highest bidder These will then be tradable assets So it s a market based system where the price of the permits directly reduce the competitiveness of fossil fuels when zero carbon energy is also available So in 2009 Obama admin with Senate democrats came out with this plan to fix climate change known as the Cap and Trade Bill https en wikipedia org wiki American Clean Energy and Security Act Cap and Trade was immediately unpopular among Americans republicans and blue dog democrats seized on the opportunity to shit on Obama for his job killing tree hugging agenda with hilarious ads such as this https www youtube com watch t 20 amp v xIJORBRpOPM amp feature youtu be https www youtube com watch t 20 amp v xIJORBRpOPM amp feature youtu be As you can see in the ad Joe Manchin eventually killed the cap and trade bill and West Virginia s coal industry was revived no it wasn t because coal isn t competitive with O amp G anymore From here on out a rift emerged amongst democrats and republicans because the liberal democratic party primary voters DEMAND action on climate change while the electoral college and the senate punish action on climate change So the issue these days is more polarized than abortion actually Biden s Energy plan Now the environment amp healthcare were and continue to be the top issues for the democratic base including its most active voices Biden may have lost some of these voters in the primary but he brought them into his coalition in the general and won the white house Basically Biden needs to throw some red meat vegan burger patties at the base Now Green New Deal doesn t include any mention of a carbon tax or cap and trade I assume because socialists hate market based solutions that actually work Instead it asks for a 100T in infrastructure spending With Joe Manchin still in the Senate locked amp loaded ready to shoot cap and trade again that s not happening anyway But as it happens this green infrastructure spending isn t such a bad idea Because infrastructure spending is popular across the aisle It creates jobs and does not directly destroy O amp G jobs As we saw this year the treasury can just sell trillions of bonds with no downside and JPOW will happily exchange them for real dollars And the end goal of Democrats is to try to use that money to get a bunch of people in the Sunbelt and Texas employed in green energy as an electoral counterweight to everyone employed in O amp G Conclusion So Biden s plan will not include a carbon tax or cap and trade bill or at least won t focus on it Instead it will involve pumping trillions into green energy infrastructure with the goal of getting Americans across the Sunbelt amp Texas employed in Green Energy as an electoral counterweight to all those employed in O amp G Getting people dependent on green energy in swing states is the only path forward for democrats In other words Biden will order Mama Yellen to sell trillions and trillions of Treasury bonds which JPOW will happily exchange for real dollars which will then be used to give fat government contracts to ICLN s holdings and beyond How to monetize this ICLN s holdings are only 34 US based Which is less than ideal because Biden s platform includes Buy American and one of their political goals is to employ as many Americans as possible in green energy so I expect them to prioritize American companies when handing out contracts Though of course if Biden is pumping a million trillion into solar I can t imagine South Korean solar panel producers don t also get some of that ACES another clean energy ETF is 80 US and 20 Canadian and TAN solar focused is 50 US ACES is lower volume though and has fewer strikes so it s up to you I think it s getting slept on here Additionally if you don t already have enough exposure to TSLA through stock options and ARKK QCLN is another option similar to ICLN Positions 50 shares each of TAN ACES 100 shares of ICLN 5x TAN 4 16 125c 5x ICLN 7 16 31c 4x ACES 6 18 96c
579,kvua55,t2_nzgab,1610466992,/r/wallstreetbets/comments/kvua55/solo_a_true_retard_stock/,3, SOLO A True Retard Stock,EV stock you won t find on Robinhood s Electric Vehicle search You have to actually look for it cause they re hiding it True retard stock negative cash flows a ton of financing etc This is a true gamble potentially once in a lifetime Up 7 today so far I loaded up on some SOLO 1 15 12C Goodluck retards
580,kvua7e,t2_162ikst2,1610466998,/r/wallstreetbets/comments/kvua7e/scrto_sports_betting_north_of_the_border/,1, SCR TO Sports Betting North of the Border , removed 
581,kvuads,t2_9m2cfx5,1610467010,/r/wallstreetbets/comments/kvuads/sigl_use_signal_but_not_that_one/,1, SIGL Use Signal But not that one , removed 
582,kvuaq2,t2_7dbuccro,1610467040,/r/wallstreetbets/comments/kvuaq2/profited_big_off_of_calls_and_didnt_sell_at_the/,1,Profited big off of calls and didn t sell at the peak Sold calls bought shares of same stock and another stock The latter stock continues to rise while the first continues to fall What should I yeet my 5k from the first stock into ,
583,kvub5z,t2_960nvstt,1610467076,/r/wallstreetbets/comments/kvub5z/robinhood_is_trash_and_its_time_to_take_it_out/,1,Robinhood is trash and it s time to take it out , removed 
584,kvubpr,t2_povt59j,1610467124,/r/wallstreetbets/comments/kvubpr/it_aint_much_but_its_honest_400_to_10k_or_ban/,1,It ain t much but it s honest 400 to 10k or ban,
585,kvubq4,t2_912xhvve,1610467125,/r/wallstreetbets/comments/kvubq4/gsat_too_the_moon/,1,GSAT too the moon , removed 
586,kvuc11,,1610467152,/r/wallstreetbets/comments/kvuc11/intc_firing_bob_swan_dick_and_balls_bull_flag/,1, INTC firing Bob Swan Dick and Balls Bull Flag, deleted 
587,kvuc3f,t2_gjx8r,1610467157,/r/wallstreetbets/comments/kvuc3f/what_does_wsb_think_of_penny_stocks/,0,What does WSB think of Penny Stocks , removed 
588,kvucla,,1610467198,/r/wallstreetbets/comments/kvucla/fyi_account_deposit_1192020_and_first_investment/,1,FYI account deposit 11 9 2020 and first investment was 24 9 2020, deleted 
589,kvud9g,,1610467243,/r/wallstreetbets/comments/kvud9g/when_youre_family_knows_youre_the_stocks_guy_i/,1, When you re family knows you re the stocks guy I think my brother is one of you guys , deleted 
590,kvudgr,t2_6kr8jq65,1610467261,/r/wallstreetbets/comments/kvudgr/me_to_my_friends_who_dont_buy_otm_options/,5,Me to my friends who don t buy OTM options,
591,kvuebw,t2_5kgnk616,1610467335,/r/wallstreetbets/comments/kvuebw/so_who_bought_the_tesla_dip_yesterday_free_tendies/,6,So who bought the Tesla dip yesterday Free tendies ,
592,kvueta,,1610467370,/r/wallstreetbets/comments/kvueta/there_you_go_autists/,0,There you go autists, deleted 
593,kvuev6,t2_32dvlqzk,1610467374,/r/wallstreetbets/comments/kvuev6/why_plug_is_a_selfperpetuating_fantasy_that/,12,Why PLUG is a self perpetuating fantasy that cannot last forever ,Ok let me explain I briefly worked as an intern in the Hydrogen fuel industry in 2019 This in turn led me to invest a good sum of my earnings in Tesla as I had thought I had a good understanding of the EV industry First let me explain what solution Hydrogen is the answer to I firmly believe it is not the answer to energy production but possibly one day for storage Hydrogen is not found naturally on Earth It requires loads of energy typically through hydrolysis remember high school chemistry in order to isolate H2 Second Fuel Cell technology is years and years behind battery technology in recent years Check out how daddy elon https www cnbc com 2019 02 21 musk calls hydrogen fuel cells stupid but tech may threaten tesla html feels about them There are many additional factors that affect fuel cell functionality such as air quality and temperature These limitations are much less severe for batteries Also look at the state of development of the two technologies EVs are becoming more and more popular every year Honda and Hyundai each have Hydrogen fuel cells on the market but you never hear of or see them Ever see a hydrogen gas refill station Nope They barely exist outside of Cali Now I understand much of the idea behind Hydrogen Technology is what s in store for the future but what about batteries In what world will we suddenly ditch these very successful batteries that work extremely efficiently today for fuel cells that run on hydrogen that may work well in 20 years Previously I said Hydrogen is not the answer for energy production but maybe one day storage Though storage is difficult and a pain in the ass Hydrogen energy can be stored and shipped in tanks One day if we eventually as a country have so much excess energy that we can simply perform hydrolysis on water and store the excess hydrogen in a vat then hydrogen may be the answer Until then I see no answer whether scientific or economic that would explain further returns for PLUG Sorry if this post wasn t autistic enough for this sub I m kinda new here EDIT Why is it self perpetuating Investors see people getting great returns in the hydrogen fuel industry People speculate and say things like it s the fuel of the future without really understanding or knowing much about the industry and since so many financial institutions end up following this mantra it in turn attracts more and more people to invest Regardless of profits today and regardless of decent understanding of the tech Also hydrogen tech peaked around 2000 in part via comments made by the Bush admin about investing in hydrogen tech Plug reached 1k in 2000 and since dropped to lt 100 Doesn t sound great 
594,kvuf06,t2_35asy62h,1610467387,/r/wallstreetbets/comments/kvuf06/tlry_news/,1,TLRY NEWS, removed 
595,kvuf0l,t2_5lq7i4iw,1610467388,/r/wallstreetbets/comments/kvuf0l/some_retard_told_me_to_buy_zom_yesterday_thank/,1,Some retard told me to buy ZOM yesterday Thank you retard ,
596,kvuf6j,t2_p52u9hq,1610467401,/r/wallstreetbets/comments/kvuf6j/when_your_family_knows_youre_the_stocks_guy_i/,1, when your family knows you re the stocks guy I think my brother is one of you guys ,
597,kvufbw,,1610467414,/r/wallstreetbets/comments/kvufbw/confused_investors/,1,Confused investors, deleted 
598,kvuh4v,t2_znx48vx,1610467562,/r/wallstreetbets/comments/kvuh4v/ridewithryan_gme/,1, RideWithRyan GME,
599,kvuhub,t2_1owzek8n,1610467624,/r/wallstreetbets/comments/kvuhub/advice/,1,Advice, removed 
600,kvuhub,t2_1owzek8n,1610467624,/r/wallstreetbets/comments/kvuhub/advice/,1,Advice, removed 
601,kvui4p,t2_4stkvfq,1610467646,/r/wallstreetbets/comments/kvui4p/pingu_vs_the_theta_gang_feat_j_powel/,12,Pingu vs the Theta gang Feat J Powel ,
602,kvuie4,t2_6rma6,1610467670,/r/wallstreetbets/comments/kvuie4/plug_my_butt/,1,Plug my butt,
603,kvujei,t2_2hz7s6gz,1610467753,/r/wallstreetbets/comments/kvujei/biontech_news_great_news_for_ms_patients/,1,BioNTech News Great news for MS patients , removed 
604,kvujf2,t2_fxp2h3m,1610467755,/r/wallstreetbets/comments/kvujf2/good_thing_there_are_no_confused_investors_here/,1,Good thing there are no confused investors here,
605,kvukmj,,1610467859,/r/wallstreetbets/comments/kvukmj/ridewithryan/,1, RideWithRyan,
606,kvuldu,,1610467925,/r/wallstreetbets/comments/kvuldu/to_all_the_fools_who_laughed_at_me_and_downvoted/,1,To all the fools who laughed at me and downvoted Or ignored my advice as a shut post cheers to everyone who got in fubo last week when I posted, deleted 
607,kvulhi,t2_bpcr4,1610467934,/r/wallstreetbets/comments/kvulhi/dr_patel_on_value_investing/,1,Dr Patel on Value Investing,
608,kvuli1,t2_7y3kfjyo,1610467935,/r/wallstreetbets/comments/kvuli1/i_was_just_approved_for_level_3_options_now_what/,1,I was just approved for level 3 options now what , removed 
609,kvulrv,t2_7x5esr2p,1610467959,/r/wallstreetbets/comments/kvulrv/thoughts_on_gevo_theyre_working_on_zero_emission/,1,Thoughts on GEVO They re working on zero emission fuel might be super valuable under the new U S Administration,
610,kvulsn,t2_9mpwsxh,1610467961,/r/wallstreetbets/comments/kvulsn/ibio_soaring_21_this_week_up_this_month/,1,IBio soaring 21 this week up this month,
611,kvumq7,t2_4xnze1st,1610468043,/r/wallstreetbets/comments/kvumq7/steel_gang_listen_up_steel_tendies_is_coming_soon/,0,STEEL GANG LISTEN UP STEEL TENDIES IS COMING SOON , removed 
612,kvumtb,t2_376iw34i,1610468051,/r/wallstreetbets/comments/kvumtb/srpt/,2,SRPT,Sarepta Therapautics dropped about 50 on Friday so naturally I bought the dip because I believe it was an over reaction to a failed trial As did the ARK fund who bought about 700k shares when it dipped which could be a good sign obviously do your own DD but definitely look into it could be a nice prospect positions x2 shares x1 90 call 1 15
613,kvumv6,t2_4avoinxb,1610468056,/r/wallstreetbets/comments/kvumv6/to_all_the_fools_who_laughed_downvoted_or_ignored/,3,To all the fools who laughed downvoted or ignored when I said to get in FUBO last week And to everyone who got in on time cheers,
614,kvunbn,t2_2vpt7a0h,1610468093,/r/wallstreetbets/comments/kvunbn/what_is_up_with_doordash/,1,What is up with doordash , removed 
615,kvunxa,t2_9qvxmbht,1610468140,/r/wallstreetbets/comments/kvunxa/can_someone_please_help/,1,Can someone please help, removed 
616,kvuo8r,,1610468168,/r/wallstreetbets/comments/kvuo8r/use_signal_not_sigl/,1,Use SIGNAL not SIGL,
617,kvuoyh,t2_52b4istx,1610468224,/r/wallstreetbets/comments/kvuoyh/confirmed_gme_is_the_next_tesla/,1,Confirmed GME is the next TESLA,
618,kvup3l,t2_92lcu80y,1610468237,/r/wallstreetbets/comments/kvup3l/who_wouldnt_buy_on_that_news/,2,Who wouldn t buy on that news,
619,kvuph1,t2_9mxeu,1610468268,/r/wallstreetbets/comments/kvuph1/when_you_try_to_help_some_autists_cash_in/,1,When You Try To Help Some Autists Cash In,
620,kvuqi2,t2_i3pok,1610468354,/r/wallstreetbets/comments/kvuqi2/confirmed_gme_is_the_next_tesla/,8,Confirmed GME is the next TESLA,
621,kvuqmi,t2_6hkwsezi,1610468364,/r/wallstreetbets/comments/kvuqmi/want_a_bubbleless_ev_play_nvda_to_the_moon/,1,Want a bubble less EV play NVDA to the moon , removed 
622,kvuqog,t2_lifqn,1610468368,/r/wallstreetbets/comments/kvuqog/from_the_guy_who_first_brought_you_pltr_i_now/,13,From the guy who first brought you PLTR I now present CCIV ,So I was the guy who told you to buy PLTR over two months ago BEFORE IT WAS A MEME see link below and those of you that listened were rewarded I NOW PRESENT TO YOU CCIV and agree with u BarmeIo Xanthony in his recent post detailing the excitement over Lucid Motors CCIV LINK https www reddit com r wallstreetbets comments jp9cgz pltr is the way utm source share amp utm medium web2x amp context 3 https www reddit com r wallstreetbets comments jp9cgz pltr is the way utm source share amp utm medium web2x amp context 3 REASONS TO BUY 1 I told you to 2 MICHAEL KLIEN AKA THE RAINMAKER https www detroitnews com story business autos 2021 01 11 lucid motors talks list via michael klein spac 6630277002 https www detroitnews com story business autos 2021 01 11 lucid motors talks list via michael klein spac 6630277002 3 Lucid Motors has the Research Team that can actually make a vehicle people want You thought the 100 000 pre orders of Lordstown was a lot this shit will be so much bigger https www greencarreports com news 1130897 lordstown confirms 100 000 orders for endurance electric pickup september production start https www greencarreports com news 1130897 lordstown confirms 100 000 orders for endurance electric pickup september production start 4 But its up so much it cant go higher Well yes yes it can The general public wants this vehicle and it is showing in their preorder numbers amp x200B Good luck fellas and dont miss the ride Position or Ban https imgur com 50kSDym
623,kvuqsp,t2_4ntfmgoi,1610468379,/r/wallstreetbets/comments/kvuqsp/ttoo/,1,TTOO, removed 
624,kvur8h,t2_95iqzphj,1610468415,/r/wallstreetbets/comments/kvur8h/why_isnt_g_i_k_mooning_like_ever/,2,Why isn t G I K mooning like ever ,Why isn t this spac mooning and will it eventually moon They are merging with eLightning Motors a company that makes EVs out of petrolium cars for big companies They are set to merge in the first half of 2021 So with all the EV hype why don t I geg a 100 gain on my position Hahaha Position 600 shares 12 sold 600 yesterday 14 50 
625,kvurpl,t2_myze8,1610468458,/r/wallstreetbets/comments/kvurpl/bought_plug_calls_before_closed_woke_up_and_sold/,12,Bought PLUG calls before closed Woke up and sold,
626,kvurs4,t2_22y5ph1c,1610468463,/r/wallstreetbets/comments/kvurs4/why_arent_there_more_posts_on_here_about_weed/,1,Why aren t there more posts on here about weed stocks , removed 
627,kvurz7,t2_oh8g4nf,1610468479,/r/wallstreetbets/comments/kvurz7/rode_this_baby_to_the_moooooon/,1,Rode this baby to the moooooon,
628,kvus0t,t2_63nsybmk,1610468482,/r/wallstreetbets/comments/kvus0t/from_an_outsider_how_is_the_situation_in_usa_at/,1,From an outsider how is the situation in usa at this moment , removed 
629,kvus0x,t2_1phuddm9,1610468482,/r/wallstreetbets/comments/kvus0x/late_new_year_gifts_to_my_american_neighbors/,1,Late New Year Gifts to my American Neighbors, removed 
630,kvut5f,t2_nh7oz,1610468574,/r/wallstreetbets/comments/kvut5f/just_wish_i_had_bigger_balls_on_the_initial_buy/,23,Just wish I had bigger balls on the initial buy ,
631,kvut8z,t2_3fqz8z0n,1610468584,/r/wallstreetbets/comments/kvut8z/wsb_is_the_only_place_where_i_can_literally_earn/,1,WSB is the only place where I can literally earn 1k a week and still be pissed off cuz there are other retards out in the world who make 100x more than me At least my shit ain t red,
632,kvuu1b,,1610468645,/r/wallstreetbets/comments/kvuu1b/crypto_mara_magic_for_2021/,1,CRYPTO MARA MAGIC for 2021,
633,kvuuhp,t2_4gdlxpe1,1610468683,/r/wallstreetbets/comments/kvuuhp/earnings_calls_on_ammunition_companies_set_to/,2,Earnings calls on ammunition companies set to blast through the moon to Mars with Daddy Musk, https www youtube com watch v KIgvoJKovIg https www youtube com watch v KIgvoJKovIg Not going to pretend this is God tier DD but when the executives have to release videos stating that they ve been manufacturing at capacity for months on end and there are conspiracy theories on why ammo is out of stock because it s selling like crack you know you re gonna have a good tendie dinner Positions Few thousand on VSTO 30c Feb 19th for the the Feb 4th earnings call Stocks on OLN RGR and maybe a banned ticker or two 
634,kvuuml,t2_9qclxp30,1610468695,/r/wallstreetbets/comments/kvuuml/aqms_meeting/,1,AQMS meeting, removed 
635,kvuw9l,t2_9fqn9ax5,1610468832,/r/wallstreetbets/comments/kvuw9l/crsr_to_the_moon/,1,CRSR to the moon ,
636,kvuws0,t2_1qaexo1,1610468873,/r/wallstreetbets/comments/kvuws0/elon_musk_sharp_on_the_dd/,1,Elon Musk sharp on the DD,
637,kvuxmf,,1610468943,/r/wallstreetbets/comments/kvuxmf/changing_from_red_to_maroon_makes_red_days_feel/,1,Changing from red to maroon makes red days feel not as bad, deleted 
638,kvuy7f,t2_369zqut4,1610468988,/r/wallstreetbets/comments/kvuy7f/plug_my_hole/,2,Plug my hole,
639,kvuysi,,1610469037,/r/wallstreetbets/comments/kvuysi/microsoft_calls_where_just_too_juicy_i_couldnt/,1,Microsoft calls where just too juicy I couldn t resist to dabble in them, deleted 
640,kvv07n,t2_7ftcybr6,1610469153,/r/wallstreetbets/comments/kvv07n/zom_compliments_chewy/,1, ZOM compliments Chewy, removed 
641,kvv2rx,t2_92cj5p4e,1610469363,/r/wallstreetbets/comments/kvv2rx/mt_not_supported_on_robinhood_anymore_apparently/,1,Mt not supported on Robinhood anymore apparently Wtf ,
642,kvv2ty,t2_xgxh1,1610469368,/r/wallstreetbets/comments/kvv2ty/your_idol_worship_him/,1,Your idol Worship him ,
643,kvv35z,t2_3t2o6sm7,1610469394,/r/wallstreetbets/comments/kvv35z/tsla_twist/,1,TSLA twist ,
644,kvv3ax,t2_wa8ns,1610469406,/r/wallstreetbets/comments/kvv3ax/i_think_im_just_going_to_sit_on_it/,2,I think I m just going to sit on it ,
645,kvv4lq,t2_5dhu6ubz,1610469515,/r/wallstreetbets/comments/kvv4lq/stepping_back/,24,Stepping Back,Hi folks If you ever feel like you are having a hard time controlling yourself when it comes to stocks take a step back Lately I ve recognized myself loosing focus and having a hard time trying to concentrate on anything except for the market Severe cases of FOMO and FT future thinking have made me unable to do work and basic needs like eating and sleeping If you have these troubles I encourage you to delete whatever app or program you are using and call a hotline The national problem gambling phone number is 1 800 522 4700 It s ok to recognize these these things and is the first step to getting help Best of luck to you who will continue and for those seeking help 
646,kvv52b,,1610469553,/r/wallstreetbets/comments/kvv52b/even_the_memes_which_meme_about_wsb_is_in_on_pltr/,1,Even the memes which meme about WSB is in on PLTR , deleted 
647,kvv57r,,1610469564,/r/wallstreetbets/comments/kvv57r/115_calls_on_x_for_daddy_elon/,3,1 15 calls on X for Daddy Elon, deleted 
648,kvv6mu,,1610469684,/r/wallstreetbets/comments/kvv6mu/pltr_breakout_is_happening_get_in_here/,1,PLTR breakout is happening Get in here , deleted 
