,postid,author,created_utc,permalink,score,title,selftext
220,kov8u5,t2_rd7o46b,1609582690,/r/wallstreetbets/comments/kov8u5/just_letting_you_know_the_bullshit_behind_clean/,1,Just letting you know the bullshit behind clean energy be long on big oil, DISCALIMER If you want to learn about this in more depth and want to verify my claims this is a link of a TED conference from a seasoned enviromentalist who explains these issues in details https www youtube com watch v N yALPEpV4w https www youtube com watch v N yALPEpV4w but for the purpose of wsb I will keep this post nice and short and focus on what really matters money Also english is not my native language so forgive any errors In the last few years there s been a lot of speculation around the shift to renewables A lot of people are bullish on solar wind an EVs and are very bearish on big oil companies I m going to explain to you why the government s shift to clean energy and the recent oil crisis is actually very bullish for big oil in the medium to long term Renewables cannot exist without oil Basically as it turns out current tech for solar and wind sucks big time and it probably will for decades to come Not only they are nowhere near as enviromentally sustainable as nuclear power because they need lots of terrain use 20x more resources than nuclear fission power plants and there are recycling issues but most importantly these green plants depend on the sun shining and the wind blowing so they can only run and produce energy about 30 of the time The key here is that there is no real efficient way no pumping and dumping water is not efficient to have these plants running without coupling them with fossil fuel burning regular plants beacuse otherwise the electric power grid would be a mess So the real reason that all these oil companies are fine with the government shifting to green energy is that to run this utopia of solar panels wind turbines and EVs you ll still need their oil In fact these companies are the ones that are lobbying politicians in particular democrats in the US case persuading it to pursue this green bullshit instead of going with real less harmful choice which is regular old nuclear energy The 2020 oil price shock benefits BIG oil companies in the long run The oil price disaster in march might cause a short term problem with oil companies but BIG oil companies rubbed their hands Maybe the small oil companies or the ones with lots of debt can face problems and go out of business but the GIANT with a healthy balance sheet can survive the crisis and have even more market share You have to think about this as if oil companies were coffee shops During corona many closed and never opened again becaus eof bankrupcty so the ones that had lots of cash available before the big hit the big players like Starbucks will benefit when there is full or partail reopening of the economy Oil demand will not shrink that much If people knew that oil is not just used for powering engines they probably wouldn t have such a negative outlook on oil demand Guys oil is fucking used to build anything that is made out of plastic Even to make some medications you need stuff that comes from oil To get all the useless shit that the west buys from India and China you ll still need oil to power container ships that sail the ocean Once this corona shit is over people will still buy plane tickets to go on vacation Sure maybe business trips will take a permanent hit and there be slightly less demand due to the transition to green BUT as we said earlier green still needs it and we are still not adressing the elephant in the room there are massive emerging markets economies growing in the worild today a lot of second and third world countries that will still rely on oil for their initial growth for decades These countries will offset the loss of demand from developed nations Shit general commodities prices have been skyrocketing recently You wanna jump on steel gang and not on oil gang The only way oil prices fall from here is if OPEC shits the bed The play As long as this obsession for and complete ignorance and denial on how to solve climate change continues and as long as the goverments of the west are corrupt and cannot see that they need to boost nuclear power and public transportation instead of solar wind and EVs big oil companies with a heathy balance sheet will be fine in the next decade Many oil companies are trading at or below book value with massive dividend yields it won t stay like this forever Do yourself a favour and be long on RDS XOM BP TOT CVX and maybe even the italian E Saw a lot of hedge funds buying OXY in the past few months for some reason Either buy shares and if you are a brave man use leverage I wouldn t advise options on this one since we don t know when the catalyst for the rally will come and one of the main points of the play is to get that juicy dividend If you just need to use options use LEAPS for the love of god I expect a return of AT LEAST 20 on teh shares alone maybe even a lot more TLDR shift to solar and wind will actually benefit supermassive oil companies with healthy balance sheets that can weather the current crisis 
221,kovb88,t2_8la4fz1k,1609583043,/r/wallstreetbets/comments/kovb88/which_5_penny_stock_should_i_put_my_5k/,1,Which 5 penny stock should i put my 5k, removed 
222,kovdo9,t2_4m570gnx,1609583413,/r/wallstreetbets/comments/kovdo9/pltr_is_undervalued_for_each_penny_drop_buy_one/,1,PLTR is undervalued for each penny drop buy one share,Following the latest news about Thiel s backed MITHRIL to purchase thousands of PLTR stocks I estimate that PALANTIR is undervalued we scratched the bottom of the barrel and I soon expect a reasonable value of 45 to 50 It is thus an opportunity to buy more PLTR stocks Close your ears to any comments from banks anal ysts and other afflicted organizations If PLTR falls a penny buy one share also when it rises do not hesitate and buy one more Share with your friends and friends of their friends to shake the market next week 
223,koveut,t2_6nrq7jf6,1609583606,/r/wallstreetbets/comments/koveut/i_am_going_all_the_way_into_bitcoin_cash_any_way/,1,I am going all the way into Bitcoin Cash any way to make a loan from Robinhood ,
224,kovfn1,t2_57sm9pzx,1609583729,/r/wallstreetbets/comments/kovfn1/i_heard_yall_are_rich_as_fuck_can_i_get_a_ternion/,1,I heard y all are rich as fuck Can I get a ternion for no fucking reason whatsoever Hell I don t even give a shit about it coz I already have premium Would be pretty funny though , removed 
225,kovhrb,t2_6a0zqvpf,1609584047,/r/wallstreetbets/comments/kovhrb/im_just_another_regard_plummeting_down_the_core/,1,I m just another regard plummeting down the core of the earth,
226,koviju,t2_6a0zqvpf,1609584165,/r/wallstreetbets/comments/koviju/just_another_retard_plummeting_down_the_core_of/,1,Just another retard plummeting down the core of the earth,
227,kovimp,t2_228lsjz,1609584179,/r/wallstreetbets/comments/kovimp/does_anybody_know_what_this_is_it_happened_on/,1,Does anybody know what this is It happened on December 4th 2020 ,
228,kovj49,t2_228lsjz,1609584250,/r/wallstreetbets/comments/kovj49/does_anybody_know_what_this_is_it_happened_on/,1,Does anybody know what this is It happened on December 4th 2020 ,
229,kovjxc,t2_3zdtr8jw,1609584371,/r/wallstreetbets/comments/kovjxc/black_mirror_index/,1, Black Mirror Index ,Tracking stonks which enable a future as depicted in various seasons of Black Mirror Got any additions U powering the metaverse PLTR government surveillance FB social scoring PTON cycle for energy SNAP glasses powering a digital diary Hyndai motor group robotics through Boston Dynamics subsidiary GOOG general AI via Deepmind subsidiary IAC social comparability through various dating matching platforms Neuralink once Papa Elon gets on with it What else
230,kovqz8,t2_8drqa,1609585402,/r/wallstreetbets/comments/kovqz8/2021_ten_bagger/,1,2021 Ten Bagger, removed 
231,kovsqj,t2_359z09q4,1609585653,/r/wallstreetbets/comments/kovsqj/gme_gang_daily_threads_got_me_holding_out_for_the/,1,GME Gang daily threads got me holding out for the biiiig stuff ,
232,kovu2z,t2_9cwdhwdp,1609585838,/r/wallstreetbets/comments/kovu2z/in_preparation_of_lost_decade_or_few_how_do_we/,1, In preparation of LOST DECADE or few how do we NOT LOSE everything , removed 
233,kovuym,t2_359z09q4,1609585971,/r/wallstreetbets/comments/kovuym/gme_gang_daily_threads_got_me_holding_out_for_the/,1,GME Gang daily threads got me holding out for the biiiig stuff ,
234,kovwcr,t2_359z09q4,1609586169,/r/wallstreetbets/comments/kovwcr/gme_gang_daily_threads_got_me_holding_out_for_the/,1,GME Gang daily threads got me holding out for the biiiig stuff ,
235,kovxwk,t2_94e47u3p,1609586402,/r/wallstreetbets/comments/kovxwk/i_can_finally_post_my_loss_of_20k_i_been_trying/,1,I can finally post my loss of 20k I been trying the past month but my account was too new to post so I couldn t take any autists advice and here I waited till I could post and held my OTM GME calls of 55 expired last week ,
236,kow4og,t2_62qntqsm,1609587420,/r/wallstreetbets/comments/kow4og/what_would_the_white_girl_index_in_2021_look_like/,1,what would the white girl index in 2021 look like ,the original post on is now over 2 years old https www reddit com r investing comments 9n31xf introducing the white girl index https www reddit com r investing comments 9n31xf introducing the white girl index most of those stocks have performed really well in that time however trends come and go how would you modify the index to stay up to date 
237,kow549,t2_94e47u3p,1609587482,/r/wallstreetbets/comments/kow549/i_want_autist_advice/,1,I want Autist Advice,I really really wanna buy TSLA calls with my last 10k life savings so I can make up my 20k recent loss check my post history and I been watching for two months ass we all know it will have a massive pull back I am worried if I buy 10k worth of calls it will crash massively I want this post to serve as a proof that my worst fears came true and as soon as I bought the direction changed 
238,kow6gs,t2_68e0tseg,1609587670,/r/wallstreetbets/comments/kow6gs/gme_price_targets_for_2021_according_to_the_short/,1,GME Price Targets for 2021 According to the Short Float Data , GME GANG CHECKING IN Dear GME gang I wanted to share my Price Targets PT for GME but no BS here I give you my PT according to actual facts Let s take a look at the table and check when the short of free float went from a high point 160 at around February 2020 to a low point 140 which by the way are in absolute terms both huge numbers Processing img zojf6rxwnw861 The stock went up 94 BUT most of the gain took place at 2 key moments at the recovery of the market crash and then in late August which shows that ing is key to capture most of the gains Why do I say this Because when holding the stock you could feel like you bled when you watch the stats Positive daily returns 49 3 Negative daily returns 50 7 BUT IT WAS IN FACT THE SHORT SELLERS WHO BLED HARD CHECK THIS OUT Best daily return 23 0 Worst daily return 13 7 Imagine you sold GME when the 13 7 happened You would not have captured the 94 returns So just and let those shorts go bankrupt Okay here I showed FACTS Stuff that actually happened Here is my opinion about a reasonable price target now according to the data I think we could easily hit 80 returns over the next 6 months when the short of free float will return to 140 it makes a lower bound PT of 34 without a short squeeze But this doesn t even account for the fact that some short positions could not be able to hold from here Keep in mind that some short sellers have a triple digit drawdown already Conclusion Price targets for the 6 12 next months according to the data from 2019 2020 Conservative 34 without a short squeeze 80 Likely to happen 50 without a short squeeze 180 Optimist 70 without a short squeeze 372 Note that these are price targets if the short of free float go down to 140 the price could go up substantially more AND I didn t even account for the fact that Ryan Cohen s stake is now at 12 9 I will be honest here with a short squeeze I have actually no idea where this could go but again very easily 100 I WILL PUBLISH THE ULTIMATE DD ON GME TOMORROW BE SURE TO CHECK THIS OUT NO BS IN HERE Positions a lot of shares 
239,kowb1h,t2_13kxbx,1609588366,/r/wallstreetbets/comments/kowb1h/i_never_thought_i_would_hate_the_weekend/,1,I never thought I would hate the week end ,
240,kowj87,t2_9cy86k18,1609589500,/r/wallstreetbets/comments/kowj87/a_sense_awakening_experience/,1,A sense awakening experience, removed 
241,kowon3,t2_444uql36,1609590269,/r/wallstreetbets/comments/kowon3/bitcoin_just_hit_30k_any_of_you_smart_retards/,1,Bitcoin just hit 30k any of you smart retards know wtf is going on , removed 
242,kowqjj,t2_6q0z4o1,1609590544,/r/wallstreetbets/comments/kowqjj/solid_dd_on_wish/,1,Solid DD on wish, removed 
243,kowwdf,t2_wmhml,1609591359,/r/wallstreetbets/comments/kowwdf/you_okay_robinhood_is_this_technically_loss_porn/,1, You okay Robinhood Is this technically loss porn ,
244,kowx0u,t2_2uxc8uzv,1609591454,/r/wallstreetbets/comments/kowx0u/stocks_in_motion_2020_in_60_seconds_bubble_chart/,1,Stocks in Motion 2020 in 60 Seconds Bubble Chart ,
245,kowzuy,t2_8qy1bbtz,1609591858,/r/wallstreetbets/comments/kowzuy/exchangetraded_autists/,1,Exchange Traded Autists,
246,kox3fs,t2_sba5yid,1609592340,/r/wallstreetbets/comments/kox3fs/any_actually_experiences_at_a_gamestop_location/,1,Any actually experiences at a Gamestop location recently ,Everyone is all over GME in this sub lately including my self BB But with that being said has anyone actually been to a gamestop store recently I cant really read or do actual dd so I decided to do my own retarded evaluation by spending dat 600 stimulus check at a gamestop store today to get my own in person evaluation and let me tell you it was amazing It s been a rainy boring dystopia lately and this morning I saw my stimulus check hitting my account I ve always wanted a Nintendo switch so I could play zelda and Mario games again so naturally I drove to the nearest Gamestop to immediately spend all of my money Upon arrival i saw a sign on the door stating that they had a new trade in system and they would buy any games or gaming system from you I have an old PS4 I use to play while my girlfriend was away hanging out with her other guy friends I asked the employee what they would give for a PS4 and he told me they would give me 100 dollars cash or 150 dollars in store credit The old gamestop probably would have given me 5 bucks and a stick of gum but the new one gamestop is looking out for you I bought my switch and the games and signed up for a pro account because someone on here told me to do that and I follow you guys blindly because I m stupid All in all it was a lovely experience and when the next quarter reports are disclosed note that 450 dollars of there earnings are from my stimmy money Positions 4 16 30c And of course 
247,kox65u,t2_5z0m1j91,1609592678,/r/wallstreetbets/comments/kox65u/how_to_succeed_the_next_decade_100st00pid_proof/,1,How to succeed the next decade 100 st00pid proof, removed 
248,kox7bl,t2_isq6c,1609592835,/r/wallstreetbets/comments/kox7bl/how_do_make_moneys/,1,How do make moneys, removed 
249,kox9le,t2_929roy40,1609593142,/r/wallstreetbets/comments/kox9le/low_effort_stonks_meme_dot_jaypeg/,1,low effort stonks meme dot jaypeg, removed 
250,koxb13,t2_7msjhb1j,1609593321,/r/wallstreetbets/comments/koxb13/some_spac_ideas_what_do_you_think/,1,Some SPAC ideas what do you think , removed 
251,koxbta,t2_128baj,1609593426,/r/wallstreetbets/comments/koxbta/space_exploration_stocks_to_infinity_and_beyond/,1,Space exploration stocks to infinity and beyond in 2021 ,Hear me out you degenerate fucks there has been more and more information coming out in regards to intelligent life outside of our solar system a former israeli director of space programs has recently claimed there is a galactic federation of aliens and the U S FUCKIN A is in contact with them THE CIA HAS EVEN BEEN LIKE HEY GUYS LOOK THESE ARE REAL UFO S HAHA ANYWAY HERES A VIRUS FORGET ABOUT THIS and now the timing of the introduction of the fucking SPACE FORCE seems a little more unsettling now When this becomes more common knowledge there will be a severe increase unlike we ve seen in investing in space exploration and it will be one of the top things we as people will be interested in as it is so much bigger than ourselves Anyhoo i m ready to make the bet of a lifetime into Virgin Galactics SPCE and taking out a loan when SpaceX goes public to buy calls Honestly you don t even have to get in now you can wait months and the outcome will be the same i m ready to retire by 27 
252,koxbuj,t2_7msjhb1j,1609593431,/r/wallstreetbets/comments/koxbuj/barkbox_hims_and_hers_and_butterfly/,1,Barkbox Hims and Hers and Butterfly,I m a big believer in Barkbox STIC since it s a growing consumer subscription based stock for pets easy to see it used in the future for a long term play with nice margins Also big believer in Hims and Hers OAC great margins again great stay at home tele health product Both also project to have a great YoY growth too What do you guys think Also what are your thoughts on LGVW big fan of the tech and its future Would love to get feedback on these 3 SPACs and others that I have missed too Disclaimer I own some other SPACs but did not want a TLDR situation lol 
253,koxdgl,t2_15d2hl,1609593646,/r/wallstreetbets/comments/koxdgl/why_edit_is_going_to_be_a_unique_monster_stcock/,1,Why EDIT is going to be a unique monster st co ck , removed 
254,koxdw5,t2_3ikb4vde,1609593702,/r/wallstreetbets/comments/koxdw5/gamestop_is_a_bad_idea/,1,Gamestop is a bad idea,Common guys wake up GME was a bad investment the company has no future I mean they sell PHYSICAL video games wich you often can get much cheaper on G2A or other keysellers the thing that is mainly still keeping them afloat are the pop figurines and the merch but not everyone is buying their merchandise and therefore its the lesser part of their profit Many prefer just to play the games wich you also can buy online cheaper and also there are games you can just buy online so there is not really a future for them something that manifests in their willingness to sell you subscriptions The company might retain their business in some places but will probably decline and so will the share price They also have an overall bad reputation in the gaming community from badly refurbished consoles to aggressive subscription selling to screwing over the customer They just sell mainly triple A titles that you can get cheaper on the internet They need to maintain their stores wich a keyseller must not and they are vulnerable to covid lockdowns So do yourselves a favor and sell the shares at the next time they go up And if you look for something where you will get much money from buy Games Workshop shares because they have a functional online store a business model and a fan community that will buy whatever overpriced stuff they put out they also have a product that just they can sell and according to their shareholder conference big expansion plans 
255,koxk1r,t2_6yg22khu,1609594503,/r/wallstreetbets/comments/koxk1r/this_sub_really_is_retarded_so_i_contribute_with/,1,This sub really is retarded so i contribute with this ,
256,koxpak,t2_6yqnorbi,1609595140,/r/wallstreetbets/comments/koxpak/wish_most_undervalued_ipo_2020/,1,WISH most undervalued IPO 2020,
257,koxpgy,t2_9gfqbmcj,1609595163,/r/wallstreetbets/comments/koxpgy/in_case_it_wasnt_already_obvious_yolo_btc_to_the/,1,In case it wasn t already obvious YOLO BTC TO THE MOON,
258,koxpul,t2_93548db5,1609595211,/r/wallstreetbets/comments/koxpul/mommy_daddys_money/,1,MOMMY amp DADDY S MONEY,
259,koxq96,t2_5ouisxls,1609595256,/r/wallstreetbets/comments/koxq96/in_case_it_wasnt_already_obvious_yolo_btc_to_the/,1,In case it wasn t already obvious YOLO BTC TO THE MOON ,
260,koxr0d,t2_3zddavvr,1609595347,/r/wallstreetbets/comments/koxr0d/no_bad_for_a_shit_for_brains/,1,No bad for a shit for brains,
261,koxrt1,t2_93548db5,1609595448,/r/wallstreetbets/comments/koxrt1/mommy_daddys_money/,1,MOMMY amp DADDY S MONEY,
262,koxu1n,t2_4bjl094t,1609595722,/r/wallstreetbets/comments/koxu1n/im_13yo_i_started_investing_around_september_i/,1,I m 13yo I started investing around September I had a few stocks of ETH and TSL I had a bit of money so I decided to try investing Here is my 500 profit ,
263,koxunm,t2_10i0710,1609595798,/r/wallstreetbets/comments/koxunm/we_did_it_id_like_to_thank_the_academy_including/,1,We did it I d like to thank the Academy including all the worthless expired FDs IronyMan The Gecko jPow Papa Musk Pee Martini Drinkers Jelq ers and all the other equally retarded but not yet famous,
264,koxvr3,t2_jr2ea,1609595938,/r/wallstreetbets/comments/koxvr3/people_on_twitter_legit_think_dr_is_chamaths/,1,People on twitter legit think Dr is Chamaths father,
265,koxy4v,t2_2mxfzrgi,1609596189,/r/wallstreetbets/comments/koxy4v/dont_sleep_on_nndm/,1,Don t sleep on NNDM, removed 
266,koxyj1,t2_2ten4e71,1609596234,/r/wallstreetbets/comments/koxyj1/short_poker_case_for_long_gme/,1,Short poker case for long GME, GME my short case for long gme 1 Huge EV risk that is largely uncorrelated to market risk short squeeze Even low probability of outcome makes more effort and capital worth it Piling on the trade actually increases its likelihood 2 Fundamentals and activist investor Cohen give at minimum a plausible semi bluff on turnaround May make errors but error will not be Blockbuster one 3 Chart technicals are incredible 5x move but still largely invisible except to wsb 1 35B market cap gives face validity to 10x return even with move that already happened 4 Perception of silliness and dismissal around threat have made short sellers prone to errors and more likely to pay off big For poker folks it reminds me of holding a big flush draw It may not come through but the possibility allows us to bet aggressively and potentially take the pot even without the hand If it hits we can potentially entice our opponent to pay off big later Plus our opponent doesn t take us seriously increasing their chance of overvaluing their ability to bluff us out 
267,koxztz,t2_ynvumxo,1609596377,/r/wallstreetbets/comments/koxztz/curious_question_are_cryptorelated_stock_posts/,1,Curious Question Are Crypto related stock posts allowed , removed 
268,koy1wx,t2_604al7b2,1609596624,/r/wallstreetbets/comments/koy1wx/are_any_of_you_autists_canadian/,1,Are any of you autists Canadian , removed 
269,koy3uc,t2_90ehfn04,1609596858,/r/wallstreetbets/comments/koy3uc/woke_up_to_the_news_that_bitcoin_is_all_time_high/,1,Woke up to the news that Bitcoin is all time high Bought it in October and completely forgot about it Stonks,
270,koy40k,t2_90ehfn04,1609596875,/r/wallstreetbets/comments/koy40k/woke_up_to_the_news_that_bitcoin_is_all_time_high/,1,Woke up to the news that Bitcoin is all time high Bought it in October and completely forgot about it Stonks,
271,koy4sd,t2_8m5h9mka,1609596964,/r/wallstreetbets/comments/koy4sd/2020_trading_went_a_lot_better_than_2019/,1,2020 Trading went a lot better than 2019 estimated tax paid same day got stimulus ,
272,koy5bm,t2_7p0bqy0y,1609597022,/r/wallstreetbets/comments/koy5bm/waiting_for_stock_market_to_open_during_looooong/,1,Waiting for stock market to open during looooong weekend ,
273,koy5ij,t2_a6cchdx,1609597042,/r/wallstreetbets/comments/koy5ij/you_cant_trust_anyone_except_me/,1, You can t trust anyone except me ,
274,koy7gu,t2_2akxhx2i,1609597277,/r/wallstreetbets/comments/koy7gu/gme_gang/,1, GME Gang, removed 
275,koy858,t2_6yqnorbi,1609597349,/r/wallstreetbets/comments/koy858/wish_most_undervalued_ipo_of_2020/,1,WISH most undervalued IPO of 2020,WISH will run like PLTR Calling all PLTR bulls Started a position in WISH today Ignored IPO just like PLTR Chart looks like it s bottomed and beginning to curl Pros 2 5B in rev in 2020 and 30 YOY growth Currently trading at 10B market cap and very undervalued given it trading at 4x valuation Currently in 18 stops are 17 40
276,koy9jb,t2_9cjauxfd,1609597512,/r/wallstreetbets/comments/koy9jb/international_game_technology_for_2021_year/,1,International game technology for 2021 year , removed 
277,koya5h,t2_4a3n5k7b,1609597584,/r/wallstreetbets/comments/koya5h/brrrrr/,1,Brrrrr,
278,koyaau,t2_iuy1f,1609597600,/r/wallstreetbets/comments/koyaau/can_someone_explain_meme_stocks_and_pltr/,1,Can someone explain meme stocks and PLTR,I ve only been investing for a few years now and I would say I m more traditional What exactly is a meme stock Is it an artificially inflated stock caused by groups on the internet like WSB Also what is the allure of PLTR Is there actually something being sold or is it a meme stock I looked at their website and it was pretty vague on what they are producing do 
279,koyckz,t2_13kxbx,1609597865,/r/wallstreetbets/comments/koyckz/how_it_feels_waiting_for_the_market_to_open_on/,1,How it feels waiting for the market to open on the weekends ,
280,koycpm,t2_8unk1lhw,1609597880,/r/wallstreetbets/comments/koycpm/crisprtherapeutics_the_next_100x_what_do_you/,1,CrisprTherapeutics The next 100x What do you think CRSP,
281,koycv8,t2_rw6ut,1609597895,/r/wallstreetbets/comments/koycv8/2020_tax_free_savings_gains_all_shares/,1,2020 Tax Free Savings Gains all shares ,
282,koydb4,t2_5z9pp7dl,1609597949,/r/wallstreetbets/comments/koydb4/dogecoin_rise/,1,DogeCoin Rise ,
283,koydl3,t2_5lq7i4iw,1609597983,/r/wallstreetbets/comments/koydl3/the_btc_is_providing_good_yields_for_my_auto/,1,The BTC is providing good yields for my auto trading bot Woke up to over 100 in profit over night Lets go ,
284,koyfch,t2_11rmyl,1609598179,/r/wallstreetbets/comments/koyfch/lets_save_the_world_and_get_rich/,1,Let s save the world and get rich, removed 
