,postid,author,created_utc,permalink,score,title,selftext
342,kvpjp5,t2_7t9omjgq,1610449047,/r/wallstreetbets/comments/kvpjp5/avita_medical_ltd/,1,Avita medical ltd , Hello fellow autististst It is me my bestfried s girlfried s husband Since many lately burned their hands they might need to get these wounds healed income Avita fucking Medical i m not allowed to post their ticker but they re not a penny stock These fuckers just had their quarterly reports and man their product fucks big time They produce skin healing products for mostly focusing on burning wounds but their product just basically helps the destroyed Skin reproduce to normal levels basically leaving the person without scartissue Here s the newest info from todays JP Morgan Healthconference these fuckers are legit https ir avitamedical com static files 9c691f28 2b18 45ed bf70 654f85788c9f The stock already jumped 17 on this news alone and their very low Q4 earnings Price targets getting upped etc imagine what will happen when they re able to roll this fucker out globally with increasing wildfires through US Austria fuck the alps and others So if you want to profit even more from third degree burn victims and If you re still reading this stop pretending like you can actually read That seems like an innocent little niche market BUT This product has a fuckton of potential outside of what they re doing rn think about skincare and wrinkle care etc That alone has a market of more than 16bio per year in the us through beauty surgical shit AND They don t just do that alone they re also developing breathalysers and other regenerating medical shit SO Sadly I not to sure as to sudden price spikes in the near future and options BUT since GME and PLTR I thiught this sub might be ready to sometimes be a boomer with shares so I though about sharing TL DR 
343,kvpl02,t2_6l4z3,1610449213,/r/wallstreetbets/comments/kvpl02/daily_discussion_thread_for_january_12_2021/,1,Daily Discussion Thread for January 12 2021,Your daily trading discussion thread Please keep the shitposting to a minimum Navigate WSB We recommend best daily DD DD All https reddit com r wallstreetbets search sort new amp restrict sr on amp q flair 3ADD Best Daily https www reddit com r wallstreetbets search sort top amp q flair 3ADD amp restrict sr on amp t day Best Weekly https www reddit com r wallstreetbets search sort top amp q flair 3ADD amp restrict sr on amp t week Discussion All https reddit com r wallstreetbets search sort new amp restrict sr on amp q flair 3ADiscussion Best Daily https www reddit com r wallstreetbets search sort top amp q flair 3ADiscussion amp restrict sr on amp t day Best Weekly https www reddit com r wallstreetbets search sort top amp q flair 3ADiscussion amp restrict sr on amp t week YOLO All https reddit com r wallstreetbets search sort new amp restrict sr on amp q flair 3AYOLO Best Daily https www reddit com r wallstreetbets search sort top amp q flair 3AYOLO amp restrict sr on amp t day Best Weekly https www reddit com r wallstreetbets search sort top amp q flair 3AYOLO amp restrict sr on amp t week Gain All https reddit com r wallstreetbets search sort new amp restrict sr on amp q flair 3AGain Best Daily https www reddit com r wallstreetbets search sort top amp q flair 3AGain amp restrict sr on amp t day Best Weekly https www reddit com r wallstreetbets search sort top amp q flair 3AGain amp restrict sr on amp t week Loss All https reddit com r wallstreetbets search sort new amp restrict sr on amp q flair 3ALoss Best Daily https www reddit com r wallstreetbets search sort top amp q flair 3ALoss amp restrict sr on amp t day Best Weekly https www reddit com r wallstreetbets search sort top amp q flair 3ALoss amp restrict sr on amp t week Weekly Earnings Discussion Thread https www reddit com r wallstreetbets search sort new amp restrict sr on amp q flair 3A 22Earnings 20Thread 22 Read the rules https www reddit com r wallstreetbets wiki contentguide and consider using WSBVoteBot https www reddit com r wallstreetbets wiki votebot to help us enforce them in new submissions https www reddit com r wallstreetbets new and keep WSB great Try No Meme Mode https www reddit com r wallstreetbets search q flair 3AMeme 20 flair 3ASatire 20 flair 3AShitpost amp restrict sr 1 amp t day amp sort hot also accessible through the top bar 
344,kvpl3x,t2_6l4z3,1610449216,/r/wallstreetbets/comments/kvpl3x/daily_discussion_thread_for_january_12_2021/,1,Daily Discussion Thread for January 12 2021,Your daily trading discussion thread Please keep the shitposting to a minimum Navigate WSB We recommend best daily DD DD All https reddit com r wallstreetbets search sort new amp restrict sr on amp q flair 3ADD Best Daily https www reddit com r wallstreetbets search sort top amp q flair 3ADD amp restrict sr on amp t day Best Weekly https www reddit com r wallstreetbets search sort top amp q flair 3ADD amp restrict sr on amp t week Discussion All https reddit com r wallstreetbets search sort new amp restrict sr on amp q flair 3ADiscussion Best Daily https www reddit com r wallstreetbets search sort top amp q flair 3ADiscussion amp restrict sr on amp t day Best Weekly https www reddit com r wallstreetbets search sort top amp q flair 3ADiscussion amp restrict sr on amp t week YOLO All https reddit com r wallstreetbets search sort new amp restrict sr on amp q flair 3AYOLO Best Daily https www reddit com r wallstreetbets search sort top amp q flair 3AYOLO amp restrict sr on amp t day Best Weekly https www reddit com r wallstreetbets search sort top amp q flair 3AYOLO amp restrict sr on amp t week Gain All https reddit com r wallstreetbets search sort new amp restrict sr on amp q flair 3AGain Best Daily https www reddit com r wallstreetbets search sort top amp q flair 3AGain amp restrict sr on amp t day Best Weekly https www reddit com r wallstreetbets search sort top amp q flair 3AGain amp restrict sr on amp t week Loss All https reddit com r wallstreetbets search sort new amp restrict sr on amp q flair 3ALoss Best Daily https www reddit com r wallstreetbets search sort top amp q flair 3ALoss amp restrict sr on amp t day Best Weekly https www reddit com r wallstreetbets search sort top amp q flair 3ALoss amp restrict sr on amp t week Weekly Earnings Discussion Thread https www reddit com r wallstreetbets search sort new amp restrict sr on amp q flair 3A 22Earnings 20Thread 22 Read the rules https www reddit com r wallstreetbets wiki contentguide and consider using WSBVoteBot https www reddit com r wallstreetbets wiki votebot to help us enforce them in new submissions https www reddit com r wallstreetbets new and keep WSB great Try No Meme Mode https www reddit com r wallstreetbets search q flair 3AMeme 20 flair 3ASatire 20 flair 3AShitpost amp restrict sr 1 amp t day amp sort hot also accessible through the top bar 
345,kvpm55,t2_5eb4w0m5,1610449350,/r/wallstreetbets/comments/kvpm55/delete_your_social_media_and_short_them_on_the/,1,Delete your social media and short them on the way down Papa Elon hinted at this ,Big tech has made us all a killing but they honestly are smug assholes and fuck them If we all delete our facebook instagram WhatsApp and switch to new alternatives the markets are due to panic Everyone feels big tech is overpriced Just short them or load up on puts it would be awesome honestly All we have to do is get the ball rolling white chicks on instagram will soon follow Also people like jake paul and big booty instagram hoe 4 have the most to lose from this HEADLINE Millions of users delete their social media accounts protesting free speech FB 27 03 Bonus The more sensible leaders in Europe are already vocal about not liking the direction lizard man Zuckerberg and twitters Dorsey boy
346,kvpptq,t2_50vl7kjr,1610449800,/r/wallstreetbets/comments/kvpptq/august_2021/,1,August 2021 ,Its Monday 2nd August 2021 PLTR has hit 19 after trading in the low teens for months while TSLA is now 3000 and steel companies have hit new ATHs You ve lost half your account on TSLA puts and PLTR calls You don t have any steel stocks because the other half is in GME shares bought at 20 50 since Ryan Cohen and his best buds joined the board of directors But apart from news of GME pulling out of ICR there hasn t been any news from GME since January and its now trading at 12 bucks a share You hear a noise behind and and turn around to see your wife and her boyfriend pointing and laughing at you before they go into her bedroom and close the door Dejected you sell your GME shares and head over to r investing https www reddit com r investing to find some boomer stock that pays you 5 bucks a year in dividends While browsing you get a notification about a new tweet from Ryan the man himself Its a singular rocket emoji with a link to GameStop s website Curious you click the link Gamestop is now pleased to announce that it is now the sole and official distributor of Corsair products NVIDIA cards and AMD CPUs We have also partnered with Sony Microsoft and Nintendo to be the only distributor of their games and consoles We have developed technology to stop bots from scalping new hardware With these new partnerships GameStop will be the world s first and only company dedicated solely to gamers Also we are the only official North American dealer for Nio You check RobinHood GME has now exploded to 10 000 a share Ryan Cohen has surpassed Elon Musk as the richest man on Earth and Mars and you get a message from your dad apologizing for doubting you and how he can t wait to tell the family at Christmas 
347,kvpr84,t2_1unaq8tv,1610449978,/r/wallstreetbets/comments/kvpr84/where_can_i_do_leaps_in_the_uk/,1,Where can I do Leaps in the Uk, removed 
348,kvprkt,t2_8ce95sbk,1610450029,/r/wallstreetbets/comments/kvprkt/amzn_is_about_to_explode/,1,AMZN is about to explode , removed 
349,kvpshn,t2_2bji7v1b,1610450150,/r/wallstreetbets/comments/kvpshn/daddy_cohen_should_introduce_gme_shareholder/,1,Daddy Cohen should introduce GME shareholder benefits to fuel these ,A fellow autist alerted me to the fact that companies like CCL https www carnivalcorp com static files 50351a91 4dc0 4f6b bfec 684647e6129f have shareholder benefits They basically give you store credit for holding a hundred shares or more Daddy Cohen is all about customer service as we know But what about autist shareholders like myself I want to be serviced too If Cohen introduced GME shareholder benefits say if you have 100 GME shares you get a 20 GME coupon to spend online or in store every quarter it d be fucking brilliant Think about it it would Encourage retail investors to buy and hold rather than being bitches Drive up e commerce and in store sales for GME Fuel these fucking Now you could say that all I ve basically proposed are GME dividends but that s boomer thinking and fuck you
350,kvptgz,t2_69dr5wt,1610450283,/r/wallstreetbets/comments/kvptgz/welp_that_happened/,1,Welp that happened,
351,kvpubf,t2_696iny1n,1610450395,/r/wallstreetbets/comments/kvpubf/please_daddy_elon/,1,Please daddy elon,
352,kvputj,t2_73yd5odg,1610450459,/r/wallstreetbets/comments/kvputj/nikola_huge_buying_opportunity/,1,Nikola huge buying opportunity ,I have read some mixed opinions about NKLA recently but I think it might be the best time to jump in It hasn t mooned as much as Tesla yet although they are both US EV manufacturers I also read that it s possible that institutions are holding their price down so they can scare retail investors and get bigger positions in NKLA Currently NKLA is rapidly building a huge factory to scale up their production further Also the price of NKLA per share is 50 time smaller than TSLA so there is a huge potential to increase investments exponentially And even further Nikola is not only an EV company they are also future oriented as they are heavily investing in R amp D for hydrogen usage and seem to have working prototypes that could in fact disrupt entire EV sector 
353,kvpvd2,t2_b71rxdp,1610450529,/r/wallstreetbets/comments/kvpvd2/yall_autist_pumped_the_signal_stocks_wtf/,1,Ya ll autist pumped the signal stocks wtf , removed 
354,kvpve9,t2_5x52ugt1,1610450534,/r/wallstreetbets/comments/kvpve9/welp_that_happened/,1,Welp that happened ,
355,kvpw0g,t2_nnft3fj,1610450617,/r/wallstreetbets/comments/kvpw0g/nel_asa_long_term_investment_dd_my_thoughts/,1,NEL ASA Long term investment DD amp my thoughts, NEL ASA ISIN NO0010081235 NEL Oslo Exchange NOK 34 57 D7G Frankfurt Exchange EUR 3 31 NLLSF OTCM USD 4 14 Long term price target 20 25 next 3 6 years NOTE HOLDING 2950 SHARES 1 60 average What is NEL ASA Nel is a global dedicated hydrogen company delivering optimal solutions to produce store and distribute hydrogen from renewable energy We serve industries energy and gas companies with leading hydrogen technology Our roots date back to 1927 and since then we have had a proud history of development and continuous improvement of hydrogen technologies Today our hydrogen solutions cover the entire value chain from hydrogen production technologies to hydrogen fuelling stations enabling industries to transition to green hydrogen and providing all fuel cell electric vehicles with the same fast fuelling and long range as fossil fuelled vehicles without the emissions Why am I interested 2020 has been an accelerant to the move into greener more sustainable energy EU wants to be carbon neutral by 2050 China by 2060 and soon the US once Biden is in power will also want to be carbon neutral by 2050 Biden s 2 trillion infrastructure and renewable energy plan Most people believe that battery power is the future In my opinion it is but not on its own Current battery tech is limited often in range we are in the works of inventing new types of battery Look at Quantumscope however before they are commercially available on large scale cost efficient is still years away Hydrogen is nothing new Hydrogen is one of the most abundant elements on planet earth meaning access to this type of renewable energy is basically infinite By using electrolysis Hydrogen can be produced from water and renewable energy However green hydrogen is becoming more and more affordable to produce meaning that start to finish no CO2 is emitted and we are nearing in this decade large scale green hydrogen production Multiple projects have been started in the EU over the last two years and I believe this trend will continue on also in line with carbon neutral plans of at least two large nations in the world Applications for hydrogen are very broad Industrial use Examples oil refining ammonia production steel production Transportation Limited low carbon fuel available as present Hydrogen opportunity Fuel cell costs also important Buildings replacing natural gas direct use for boilers or fuel cells Power generation leading for storing renewable energy can be used to increase power system flexibility ammonia can be applied in coal power plants to reduce emission Why Nel ASA Q3 Highlights amp x200B Processing img 89nnizguxva61 World s largest electrolyser company 242 million cash enough to cover R amp D and burn rate Excellent group management with experts from varied industries 3 Yr revenue growth 74 05 5 yr 112 19 Revenue has improved YoY since 2014 not yet profitable but close too Entered MoU with Iberdrola to develop green hydrogen plant in spain Capacity 200MW Operational 2023 It is not necessarily a play which seems safe at the moment as financials are not positive yet however are improving I am holding this stock till at least 2025 They also have enough cash to cover operations In the annual report they do mention that once they are in a position to pay dividend they will however that is not the play here I have been vested in this company for over a year and I strongly believe in it The company is growing steady more and more projects in the backlog awarded multiple government grants over the last 6 months It is a renewable energy play for the coming decade imo amp x200B Most Recent Contract EverFuel Contract for Fredericia Hydrogen project 20MW electrolyser to be delivered in 2021 and fully operational mid 2022 Value 7 2 million This is a long term play I believe in a hydrogen future Not just for transport but power and storage as well amp x200B Disclaimer I am not a licensed financial analyst and I am not giving any financial advice I am sharing my idea about a company and it is up to the individual to make any investment decisions I am not liable for any financial losses amp x200B Hydrogen Market Some statistics relating to the growth of the hydrogen Green Hydrogen market expected to be worth 2 28 billion by 2027 CAGR 14 27 Hydrogen generation to grow 4 32 CAGR Revenue based until 2027 amp x200B https preview redd it 14mer2hfyva61 png width 602 amp format png amp auto webp amp s dfc98f0999028ad6627ee3271dbc5122968fdfc0 amp x200B amp x200B I read the rules and I believe that this met all standards This is my first time posting here hope it meets all requiremens and I understood them correctly The US listing is a OTCM however both the Frankfurt and oslo are on actual exchanges so I think that should be ok 
356,kvpwh9,t2_khlt4,1610450684,/r/wallstreetbets/comments/kvpwh9/august_2021/,1,August 2021 ,
357,kvpx27,t2_51dyiq4x,1610450760,/r/wallstreetbets/comments/kvpx27/first_yoloadvice/,1,First Yolo advice,Hello fellow autist I wanna just do it and dive into my first yolo As it is supported here I don t have any experience with options and barely know the Greeks lol I wanna buy weekly calls betting on AMD hittin 100 by end of the week Any advice before I hit buy AMD gt Moon but just to stop by 
358,kvpxmq,t2_sc05c,1610450839,/r/wallstreetbets/comments/kvpxmq/one_of_us_one_of_us/,1,One of us One of us ,
359,kvpz9z,t2_es132,1610451054,/r/wallstreetbets/comments/kvpz9z/im_depressed/,1,I m depressed, removed 
360,kvq0mf,t2_tfrnq,1610451232,/r/wallstreetbets/comments/kvq0mf/hold_you_coins_tight_were_hitting_decillion_in_no/,1,Hold you coins tight we re hitting decillion in no time ,
361,kvq1l8,t2_5r8d7ad6,1610451364,/r/wallstreetbets/comments/kvq1l8/whats_happen_if_stock_merger_ipoe/,1,What s happen if stock merger IPOE , removed 
362,kvq2dp,t2_1140ny,1610451474,/r/wallstreetbets/comments/kvq2dp/elon_predicts_dis_to_the_moon/,1,ELON PREDICTS DIS TO THE MOON ,
363,kvq2yo,t2_8vd81zms,1610451549,/r/wallstreetbets/comments/kvq2yo/heres_a_one_true_yolo_for_someone_whos_braver/,1,Here s a one true YOLO for someone who s braver than me ,
364,kvq5ck,t2_8zamdpw7,1610451860,/r/wallstreetbets/comments/kvq5ck/wallstreet_bets_funny_investing_american_flag/,1,Wallstreet Bets Funny Investing american flag Classic,
365,kvq5yp,t2_8zamdpw7,1610451941,/r/wallstreetbets/comments/kvq5yp/wallstreet_bets_funny_investing_american_flag/,1,Wallstreet Bets Funny Investing american flag Classic,
366,kvq7cu,t2_2zpujtzo,1610452125,/r/wallstreetbets/comments/kvq7cu/china_ccp_to_nationalize_jack_mas_alibaba_and_ant/,1,China CCP to Nationalize Jack Ma s Alibaba and Ant Group , removed 
367,kvq8ks,t2_91ygt2y3,1610452290,/r/wallstreetbets/comments/kvq8ks/palantir_big_news/,1,Palantir big news ,
368,kvqbdm,t2_7802gl65,1610452652,/r/wallstreetbets/comments/kvqbdm/elons_next_side_hustle_oran/,1,Elon s next side hustle ORAN ,TLDR www etymology com has a picture of an orange European banking company Orange ORAN to the moon Lots to unpack here Elon replied to a Twitter post that talked about the pain you feel when a side project doesn t pan out and referenced etymology com Link Elon s etymology com https twitter com Elonmusk status 1348955549128396800 s 21 Etymology is the study of the origin of words and the way in which their meanings have changed throughout history You go to that site and it s an emoji of an Orange Clearly Elon s weird tweets always deal with stock market this may be a code and ORAN fits the bill Although etymology deals with words Elon is clearly talking about the origins of numbers and specifically dollar bills have changed through history Positions none yet he just tweeted Buying some ORAN 15c Aug 21 at market open 
369,kvqbgv,t2_74v2xtb7,1610452665,/r/wallstreetbets/comments/kvqbgv/clean_power_capital/,1,CLEAN POWER CAPITAL, removed 
370,kvqc14,t2_8dqr7379,1610452739,/r/wallstreetbets/comments/kvqc14/lucid_motors/,1,Lucid Motors, removed 
371,kvqch4,t2_5hmysn13,1610452795,/r/wallstreetbets/comments/kvqch4/some_oc_for_the_gme_gang_no_paper_hands_allowed/,1,Some OC for the GME gang no paper hands allowed,
372,kvqdkg,t2_ov15d56,1610452905,/r/wallstreetbets/comments/kvqdkg/if_anyone_fancies_a_decent_short_btbt/,1,If anyone fancies a decent short BTBT, BTBTSAN https stocktwits com symbol BTBTSAN FRANCISCO Jan 11 2021 PRNewswire Hagens Berman notifies investors in Bit Digital Inc NASDAQ BTBT of the firm s investigation into possible securities law violations Certain investors with losses may have valuable claims and are encouraged to submit their losses now The firm also encourages persons who may be able to assist the investigation to contact the firm hbsslaw com practices inves http hbsslaw com investor fraud and the report is here https www jcapitalresearch com uploads 2 0 0 3 20032477 2021 01 11 btbt pdf https www jcapitalresearch com uploads 2 0 0 3 20032477 2021 01 11 btbt pdf 
373,kvqgjh,t2_2mo2pa2y,1610453248,/r/wallstreetbets/comments/kvqgjh/best_vegan_stock/,1,Best vegan stock , removed 
374,kvqi5y,t2_3co8idir,1610453451,/r/wallstreetbets/comments/kvqi5y/what_the_fuck_have_you_guys_done/,1,What the fuck have you guys done ,
375,kvqimm,t2_93akssnk,1610453509,/r/wallstreetbets/comments/kvqimm/true_retards_lose_in_the_game_but_win_with_the/,1,True retards lose in the game but win with the stock CEO just announced break even next year ,
376,kvqip3,t2_cejx9,1610453518,/r/wallstreetbets/comments/kvqip3/new_dd_on_alibaba_baba_based_on_financial_times/,1, NEW DD on Alibaba BABA based on Financial Times reporting,Alright guys We all know that ever since the fire sale of BABA because Winnie sold Jacks organs it s been one constant stream of bad press totally legit not manipulated at all My guess is that boomers are so senile these days that they need to be reminded every 5 seconds to sell their shares to an institution And today what can I say except Ma Ma Mia here we go again This morning I read in the Financial Times https www ft com content d6189ee8 9aea 41dd a412 b8daba9cacf2 an article saying Alibaba will be on fire My reading comprehension is not the best but I think this means BABA will be lit and very soon too hot to handle TLDR Position BABA210618C00290000 for 7 75 Easier to print with than with a xerox
377,kvqjmx,t2_6louk93x,1610453643,/r/wallstreetbets/comments/kvqjmx/a_different_play_on_bitcoin/,1,A Different Play On Bitcoin, removed 
378,kvqlwa,t2_15rspa,1610453913,/r/wallstreetbets/comments/kvqlwa/crash_imminent/,1,Crash imminent ,
379,kvqmwl,t2_55spqg7u,1610454035,/r/wallstreetbets/comments/kvqmwl/my_pick_an_actual_value_stock_on_here_for_once/,1,My pick an actual value stock on here for once ADES Unknown stock still at market bottom since 4 20 expect 15 within 1 3 months once they decide it s safe to resume dividends Some estimates like the one below are even more generous More info and proof in comments ,
380,kvqoan,t2_1bv5x7y6,1610454208,/r/wallstreetbets/comments/kvqoan/market_cap_matches_the_revenue_what_other/,1,Market cap matches the revenue what other recommendation do you need ,
381,kvqpk3,t2_itoda,1610454359,/r/wallstreetbets/comments/kvqpk3/guys_thoughts/,1,Guys thoughts ,
382,kvqqov,t2_5hcjz5vh,1610454491,/r/wallstreetbets/comments/kvqqov/vale_19_call_219_4_mil_sweeper_two_days_107_your/,1,VALE 19 Call 2 19 4 Mil Sweeper Two Days 1 07 Your welcome Cucks, removed 
383,kvqsau,t2_55spqg7u,1610454681,/r/wallstreetbets/comments/kvqsau/ades_an_actual_value_stock_on_here_for_once/,1,ADES an actual value stock on here for once, removed 
384,kvqt35,t2_7a86dis1,1610454767,/r/wallstreetbets/comments/kvqt35/loan_depot_from_a_consumer_perspective_what_are/,1,Loan Depot from a consumer perspective what are they like ,Loan Depot is going public Who has used Loan Depot for a purchase or refinance and how did it go I refi d once through Quicken and it was a shitshow up until the last minute I went to a 15yr with UWM and it was smooth as silk I write mortgages and I ve heard Loan Depot is a dumpster fire Looking at loan estimates Quicken is charging huge fees for high rates how does Loan Depot compare I ve only seen two of their estimates and they were kind of like Quicken higher fees than I would have to charge and a higher rate than I could offer Is that a recipe for success or disaster 
385,kvqwk3,t2_83zmyy26,1610455173,/r/wallstreetbets/comments/kvqwk3/ipoe_merges_in_q1_right/,1,IPOE MERGES in Q1 right , removed 
386,kvqx5g,t2_7x3rwwam,1610455243,/r/wallstreetbets/comments/kvqx5g/learning_about_candlestick_charts_and_how_the/,1,Learning about candlestick charts and how the right type of tails can indicate a possible massive swing Then I found this what ya ll think PLUG and PLTR to the moon today ,
387,kvqy5l,t2_55spqg7u,1610455366,/r/wallstreetbets/comments/kvqy5l/my_pick_an_actual_value_stock_on_here_for_once/,1,My pick an actual value stock on here for once, removed 
388,kvr08l,t2_9532ta0j,1610455604,/r/wallstreetbets/comments/kvr08l/trading212_scam_i_lost_366_in_2_seconds_shorting/,1,Trading212 Scam I lost 366 in 2 seconds shorting Jupiter Wellness position was auto closed Can anyone please help with explaining what happened and if this is a mistake glitch Thanks ,
389,kvr2a5,t2_55spqg7u,1610455847,/r/wallstreetbets/comments/kvr2a5/my_pick_an_actual_value_stock_on_here_for_once/,1,My pick an actual value stock on here for once, removed 
390,kvr2n9,t2_267p71sp,1610455892,/r/wallstreetbets/comments/kvr2n9/i_did_a_thing_bought_signal_stock_right_after/,1,I did a thing Bought Signal stock right after Elon tweet , removed 
391,kvr3xw,t2_4kenos0z,1610456032,/r/wallstreetbets/comments/kvr3xw/lite/,1, LITE, removed 
