,postid,author,created_utc,permalink,score,title,selftext
365,kp0oja,t2_300l2rsn,1609605930,/r/wallstreetbets/comments/kp0oja/christmas_gift_for_all_my_degenerates/,1,Christmas gift for all my degenerates , Long time lurker first time poster This prediction is for overstock OSTK Overstock is currently trading at a strong resistance level as well as it s 200 day SMA and well below its 10 20 50 and 100 day SMAs All these make a bounce likely this week Now if you look at the 2hr chart for OSTK you will notice that on that chart it is also trading well below its major SMAs For the past 3 months the price has been trending down moving sinusoidally with the high prices bouncing off the 200SMA and low prices bottoming out at roughly 80 200SMA OSTK is currently trading at 2 standard deviations below its 50SMA and when looking at the MACD relative to price between 12 29 and 12 31 there is a divergence These 3 factors lead me to believe a price reversal is eminent Moral of this post OSTK is trading at 48 right now The 200SMA 2hr chart is 61 I predict over the next month and probably sooner OSTK will go back up to 60 Opinions of this analysis is greatly appreciated Happy hunting gentlemen 12 years experience working as a data analyst at a major hedge fund 
366,kp0qzd,t2_140vlnjw,1609606152,/r/wallstreetbets/comments/kp0qzd/alternatives_to_bloomberg_live_or_cnn/,1,Alternatives to Bloomberg Live or CNN,I don t know if any of you feel the same way but I feel like the Bloomberg Live stream or CNN are really only useful for when the markets open for the first 20 mins and then the it gets switched to all boomer programming with interviews Is there any alternatives that that report strictly numbers price movements or sectors that are on the move without the fluff Also TSLA 
367,kp0sy6,t2_57ycbgk8,1609606331,/r/wallstreetbets/comments/kp0sy6/dogecoin_to_mars/,1,DOGECOIN TO MARS ,
368,kp0tcp,t2_ysc83zl,1609606368,/r/wallstreetbets/comments/kp0tcp/threw_some_extra_cash_in_doge_coin_didnt_expect_a/,1,Threw some extra cash in DOGE Coin Didn t expect a near 100 return in about a week Probably should ve put some more in ,
369,kp0tcw,t2_3i5z3bfi,1609606369,/r/wallstreetbets/comments/kp0tcw/you_all_know_the_paradigm/,1,You all know the paradigm ,
370,kp0uoz,t2_9lgeva1l,1609606488,/r/wallstreetbets/comments/kp0uoz/flir_systems_inc_a_company_for_the_decades/,1,Flir Systems Inc a company for the decades , removed 
371,kp0vek,t2_9eo46i8p,1609606550,/r/wallstreetbets/comments/kp0vek/psth_is_acquiring_either_bloomberg_or_stripe/,1,PSTH is acquiring either Bloomberg or Stripe HERE s why , removed 
372,kp0yni,t2_5007v8yy,1609606830,/r/wallstreetbets/comments/kp0yni/this_has_to_be_the_peak_right_max_lvl_autism/,1,This has to be the peak right Max lvl autism,
373,kp10aa,t2_10mq06,1609606968,/r/wallstreetbets/comments/kp10aa/remembering_this/,1,Remembering this,
374,kp10rr,t2_72jkfo9c,1609607008,/r/wallstreetbets/comments/kp10rr/retard_research/,1,Retard research,I ve been watching the market for a year now I put in 900 it went up to about 5k then I lost it all This year I want to put some more research into what I invest in Could anyone give me some advice on how they conduct research What do you look for in a stock option What variables do you have to consider And anything else that helps you make a decision 
375,kp1113,t2_68y6fhb6,1609607030,/r/wallstreetbets/comments/kp1113/melvin_capital_this_week_when_gme_squeezes/,1,Melvin Capital this week when GME squeezes,
376,kp13nr,t2_5xkqyi99,1609607250,/r/wallstreetbets/comments/kp13nr/2021_will_be_the_year_of_cryptocurrency_wsb/,1,2021 will be the year of cryptocurrency WSB should allow crypto related tickers for discussion , removed 
377,kp16tk,t2_668z14cz,1609607514,/r/wallstreetbets/comments/kp16tk/close_but_no_cigar_qs_1231_75p/,1,Close but no cigar QS 12 31 75p,
378,kp17dh,t2_862ayab9,1609607555,/r/wallstreetbets/comments/kp17dh/1k_sun_run/,1,1K Sun Run, removed 
379,kp17fx,t2_9mc128th,1609607561,/r/wallstreetbets/comments/kp17fx/market_moving_events_for_next_week/,1,Market Moving Events for Next Week,
380,kp17uw,t2_8qnoe3zu,1609607600,/r/wallstreetbets/comments/kp17uw/what_stocks_are_we_pumping/,1,What stocks are we pumping , removed 
381,kp1890,t2_813nb88f,1609607639,/r/wallstreetbets/comments/kp1890/be_careful_guys_and_warn_your_loved_ones/,1,Be careful guys and warn your loved ones,
382,kp1908,t2_3hlnymi9,1609607703,/r/wallstreetbets/comments/kp1908/put_my_free_stock_from_robinhood_into_doge_coin_a/,1,Put my free stock from Robinhood into Doge coin a few months back Woke up to this ,
383,kp194t,t2_6s1q2,1609607713,/r/wallstreetbets/comments/kp194t/gme_buyer_beware/,1,GME Buyer Beware ,
384,kp1ars,t2_668z14cz,1609607855,/r/wallstreetbets/comments/kp1ars/dont_fight_the_fed/,1,Don t fight the fed,
385,kp1awp,t2_68hedgx6,1609607868,/r/wallstreetbets/comments/kp1awp/is_ttcf_a_buy_2021_price_prediction_58_bull/,1,Is TTCF a buy 2021 price prediction 58 bull thesis associated risks,
386,kp1bic,t2_5xypo,1609607924,/r/wallstreetbets/comments/kp1bic/nothing_like_the_retards_seen_on_this_sub_but/,1,Nothing like the retards seen on this sub But gains are gains,
387,kp1bld,t2_4avk31ql,1609607932,/r/wallstreetbets/comments/kp1bld/listen_i_know_your_crypto_rules_on_this_site_but/,1,Listen I know your crypto rules on this site but fuck it if I can t say this DogeCoin is almost at a fucking cent now I feel like one of you retards now I might just dump my entire savings , removed 
388,kp1dkk,t2_6s1q2,1609608118,/r/wallstreetbets/comments/kp1dkk/gme_buyer_beware/,1,GME Buyer Beware ,
389,kp1eb3,t2_145c3x,1609608187,/r/wallstreetbets/comments/kp1eb3/dogecoin_to_the_moon/,1,Dogecoin TO THE MOON ,
390,kp1fga,t2_4bj5i6,1609608285,/r/wallstreetbets/comments/kp1fga/what_are_your_current_positions_and_expectations/,1,What are your current positions and expectations for them ,I know everyone is already holding GME and PLTR until they lands on the moon but maybe we can find out what new tickers everyone is holding why and what are their expectations Here is a list of my current positions 70 shares of BABA at an average of 245 with a price target of 265 where I ll liquidate unless the political environment gets better COVID proof Solid financials much more liquid than Amazon China is bound to become the largest economy Political uncertainties are exaggerated 70 shares of CRM at 221 with a price target of 230 Have made this same play quite a few times in the last 2 months COVID proof A solid company run by a solid CEO with good growth and financials Slack was purchased for 28b but the market has wiped 26 of its market cap off which is more than 50b so at the very least the overreaction is extended by at least 22b a 10 increase in market cap from current levels Short term PT of 230 but have no doubt this can break above 275 in 2021 A 24 upside 24 shares of FB at 273 with a price target of 280 Have also done this multiple times during the last few months COVID proof Earnings coming up near the end of January Zuck might be a lizard but those IG influencers you follow from your fake account so your girlfriend doesn t find out will only keep luring you back in Political risks surrounding breakup are exaggerated and seem to be an optic play to gain public confidence Even if this is not the case the first hearing is years away Has the potential to breach 325 during 2021 An upside of 20 4 shares of AMZN at 3250 with a price target of 3350 at least Have made a bit over 5k only trading swings between 3000 and 3350 COVID proof Earnings coming up near the end of January Possible to reach ATH which is around 3500 near earnings Possible to breach 4000 during the year providing an upside of 23 275 shares of PFE at average 38 62 with a price target of 41 42 not sure how this will go Have made this play once before when I cashed out at 42 75 just a few weeks ago Only speculative play in my portfolio Not a hold in the long run as this stock is as limp as they come but a reasonable dividend yield So not really worried about losing money Pretty boring shit no GME or PLTR here but looking forward to seeing what other tickers the community is holding on to 
391,kp1fm1,t2_145c3x,1609608296,/r/wallstreetbets/comments/kp1fm1/dogecoin_to_the_moon/,1,DOGECOIN TO THE MOON ,
392,kp1iwe,t2_4k8ogrgy,1609608591,/r/wallstreetbets/comments/kp1iwe/is_this_investment_move_a_great_idea_or_a_foolish/,1,Is this investment move a great idea or a foolish one ,So amongst other stocks and shares I m based in the UK I invested 40 of my portfolio wealth into into Lloyds Bank in November when it dropped slightly I ve now researched into some great investing opportunities but foolishly because I invested so highly into Lloyds I do not have enough collateral to make a substantial profit Do I pull out of Lloyds having lost under 3 with the hopes of making this back and more or do I hold fast and wait for it to enter the green before selling later in the year 
393,kp1k07,t2_4qvg5,1609608667,/r/wallstreetbets/comments/kp1k07/first_post_please_be_nice/,1,First post please be nice ,
394,kp1k5v,t2_aebjz,1609608681,/r/wallstreetbets/comments/kp1k5v/i_dont_even_know_what_im_doing/,1,I don t even know what I m doing, removed 
395,kp1luk,t2_4qvg5,1609608832,/r/wallstreetbets/comments/kp1luk/first_post_please_be_nice/,1,First post please be nice,
396,kp1lyk,t2_7p0bqy0y,1609608841,/r/wallstreetbets/comments/kp1lyk/wsb_autist_after_receiving_their_stimulus_check/,1,Wsb autist after receiving their stimulus check ,
397,kp1m96,t2_4uk2h46r,1609608869,/r/wallstreetbets/comments/kp1m96/doge_coin_to_the/,1,Doge coin to the , removed 
398,kp1mce,t2_7b8udvsy,1609608877,/r/wallstreetbets/comments/kp1mce/btc_market_manipulationstop_hunting_images/,1,BTC Market Manipulation Stop Hunting Images Included, removed 
399,kp1n8s,t2_69t4gpfg,1609608962,/r/wallstreetbets/comments/kp1n8s/mommy_and_daddy/,1,mommy and daddy ,
400,kp1n8s,t2_69t4gpfg,1609608962,/r/wallstreetbets/comments/kp1n8s/mommy_and_daddy/,1,mommy and daddy ,
401,kp1ot8,,1609609098,/r/wallstreetbets/comments/kp1ot8/btc_market_manipulationstop_hunting_images/,1,BTC Market Manipulation Stop Hunting Images Included,
402,kp1qmp,t2_7b8udvsy,1609609267,/r/wallstreetbets/comments/kp1qmp/btc_stop_hunting_images_included/,1,BTC Stop Hunting Images Included, removed 
403,kp1rgk,t2_7yelfuii,1609609347,/r/wallstreetbets/comments/kp1rgk/if_the_pltr_dip_was_a_store/,1,If the PLTR dip was a store,
404,kp1rv2,t2_78m73ckm,1609609384,/r/wallstreetbets/comments/kp1rv2/how_my_unicorn_advisor_made_me_rich/,1,How my Unicorn Advisor made me rich, removed 
405,kp1sqc,t2_kjet3,1609609457,/r/wallstreetbets/comments/kp1sqc/doge_moon/,1,DOGE MOON, removed 
406,kp1uw3,t2_3wp7ihv8,1609609631,/r/wallstreetbets/comments/kp1uw3/doge/,1,DOGE, removed 
407,kp1vft,t2_detsi,1609609681,/r/wallstreetbets/comments/kp1vft/as_btc_so_clsk_shall/,1,As BTC so CLSK shall , removed 
408,kp1vmf,t2_3xaftw0d,1609609698,/r/wallstreetbets/comments/kp1vmf/when_the_bull_began_its_run/,1,When The Bull Began Its Run, removed 
409,kp1w4b,t2_5yogj2fn,1609609743,/r/wallstreetbets/comments/kp1w4b/rate_my_portfolio/,1,Rate my portfolio, removed 
410,kp1wnu,t2_3xaftw0d,1609609792,/r/wallstreetbets/comments/kp1wnu/the_run_of_the_bullgbtc_to_moon/,1,The Run of the Bull GBTC to Moon ,
411,kp1y91,t2_3xaftw0d,1609609907,/r/wallstreetbets/comments/kp1y91/the_greatest_run_to_the_moon_gbtc/,1,The Greatest Run to the Moon GBTC,
412,kp1yxr,t2_3vmjw3tz,1609609968,/r/wallstreetbets/comments/kp1yxr/best_free_online_courses_for_long_term_trading/,1,Best free online courses for long term trading, removed 
413,kp24vq,t2_kor8izz,1609610463,/r/wallstreetbets/comments/kp24vq/everyone_who_gets_bored_during_the_weekend_and/,1,Everyone who gets bored during the weekend and can t wait until Monday for the market to open is chemically addicted to trading , removed 
414,kp2573,t2_qp72w,1609610489,/r/wallstreetbets/comments/kp2573/final_yolo_with_pt_of_41/,1,Final YOLO with PT of 41,
415,kp25dr,t2_5ppe13es,1609610502,/r/wallstreetbets/comments/kp25dr/market_moving_events_for_the_first_week_of_2021/,1,Market Moving Events for the First week of 2021,
416,kp26fg,t2_4vdo38s2,1609610592,/r/wallstreetbets/comments/kp26fg/any_hot_moves_for_monday_calls/,1,any hot moves for monday calls ,give me some good bets 
417,kp27ax,t2_48va2udw,1609610666,/r/wallstreetbets/comments/kp27ax/new_fed_monetary_policy_stocks_to_the_moon_monday/,1,New Fed monetary policy Stocks to the moon Monday ,
418,kp29vl,t2_854idxjh,1609610891,/r/wallstreetbets/comments/kp29vl/thinking_adtran_stock_is_well_positioned_to_go_up/,1,Thinking Adtran stock is well positioned to go up as 5g develops Any thoughts ,
419,kp2a2o,t2_68hedgx6,1609610907,/r/wallstreetbets/comments/kp2a2o/anyone_investing_ttcf_my_thesis_below_of_price/,1,Anyone investing TTCF My thesis below of price prediction and catalysts for 2021 interested to hear bullish bearish sides,From my research any price around the levels is good entry point if you want to start a long position Disclaimer I m in with 600 shares The most important factors for them going into 2021 Can they pull off their marketing campaign Will the plant based movement continue IMO yes its spreading like wildfire in the US huge demand for it in the UK Gen Z and Millenials driving the plant based movement They re very connected with social medias can help spread the name in a massive way Trend will continue to grow stronger 55B market they re targeting aggressively to take market share of next year Don t underestimate the power of brand awareness this can snowball and be a huge driver for them Can argue brand awareness is what will impact the fundamentals and sp the most Just scratching the surface of their distribution potential Now apparently selling in the UK Costco s already US wide expansion aswell as Mexico Tons of pictures of empty shelves and their products being sold out on social medias https skyhighcapitalinvestments com the most exciting food company for the next decade and beyond This time of year January people tend to eat healthier the Q1 report should reflect this boost in sales on top of the benefits of their marketing Veganuary NitroC advertising company Vertically integrated Meaing they produce everything in their products right from the source They grow their own vegetables and ingredients Manuafacture the final product themselves They innovate rapidly and design their own products aswell This is essential to keep ahead of competitors in the food space Catalyst s Marketing campaign massive buzz around the brand higher revenue higher sales Biggest catalyst for the history of this company A lot of positive reviews on social medias like IG and YT Effect of Marketing campaign really be seen in Q1 earnings Undervalued institutional investors will be loading up on this The hype from the SPAC alone has been free advertising 90m in cash from merger Cash will be 320m if they call the warrants May be exercised next year at some point companies in their growth stage and attacking a major opportunity Price prediction Profitability is not and should not be their main concern which is why I am using Price to sales to compare their valuations TTCF have been profitable every quarter also to mention except Q3 because of one off merger expenses Based on P S ratio 2021 sp 45 conservative sp 56 very possible with 3 8B market cap Q4 potential YOY rev I have 45 On their analyst day presentation says 39 conservative With them selling out crazy fast in the stores I can t see why they won t smash their Q4 earnings Currently SKU s 21 products Will have 38 products in 2021 This aggressive expansion more sales higher revenue Addressable market is about 50B growing at at 17 CAGR for that market Their revenue has been about 40 50m quarterly WITHOUT ANY MARKETING AT ALL Should be crazy growth once the marketing campaign starts in Jan They should be able to maintain and grow these numbers for years to come innovation is key here and they have the scope to do it And the capacity as they ve double their facility size already and plan to scale up again in 2021 doubling facilities again RISKS Risks Of course marketing is costly and possibility of it not being successful But TTCF seem to have a very loyal customer base already and their products actually taste good Other alternative type products don t taste that great just loaded with salt Overall very excited for their next earnings report There are 20M warrants outstanding If they call the warrants that would be an 85M shares outstanding So TTCF is 85M shares outstanding and 320M in the bank accounting for the warrant excercise What does this mean for the stock price it can cause dilution if the warrants are exercised because the underlying company ie TTCF will have to issue new shares when there s more shares the price is diluted by the extra amount of shares created However in the overall long term picture for TTCF this will be minor Conclusion In my opinion this a trend that will continue to be strong in 2021 just like what we ve seen in the EV space From the start of next year TTCF will be spending aggresively on marketing Could mean we ll see some very attractive results in their next Q4 Q1 and onwards earnings reports Solid long term hold I want to get in early before it takes off 
420,kp2bc8,t2_7kqli8rf,1609611017,/r/wallstreetbets/comments/kp2bc8/bitcoin_to_the_moon/,1,Bitcoin to the moon, removed 
421,kp2bdm,t2_mo312fw,1609611020,/r/wallstreetbets/comments/kp2bdm/positive_vibe_tsla_will_go_up_on_monday/,1,Positive Vibe TSLA will go up on Monday,It will shake off initial pull backs and will go up Just sit back and watch 
422,kp2cph,t2_7x3oy97,1609611104,/r/wallstreetbets/comments/kp2cph/its_not_much_but_its_honest_gains/,1,It s not much but it s honest gains ,
423,kp2cpr,t2_7b8udvsy,1609611105,/r/wallstreetbets/comments/kp2cpr/btc_market_manipulationstop_hunting_images/,1,BTC Market Manipulation Stop Hunting Images Included, removed 
424,kp2dbr,t2_ms3h7gg,1609611159,/r/wallstreetbets/comments/kp2dbr/rlounge_doesnt_accept_people_like_us_in_there/,1,r lounge doesn t accept people like us in there,
425,kp2dv4,t2_i3pok,1609611203,/r/wallstreetbets/comments/kp2dv4/bears_vs_bulls_an_in_depth_stock_market_analysis/,1,Bears vs Bulls An in depth stock market analysis,
426,kp2dvu,t2_4zi6q53h,1609611204,/r/wallstreetbets/comments/kp2dvu/penny_stocks_2021/,1,Penny Stocks 2021,I know penny stocks referring to lt 5 are basically gambling but I was just wondering if anyone here is particularly high on a penny stock s for 2021 and why 
427,kp2esh,t2_50y56qtt,1609611283,/r/wallstreetbets/comments/kp2esh/papa_elon_can_never_be_wrong/,1,Papa Elon can never be wrong,
428,kp2f4k,t2_5fg99ttd,1609611313,/r/wallstreetbets/comments/kp2f4k/28k_mtch_yolo_used_up_all_my_savings_im_either/,1,28k MTCH YOLO Used up all my savings I m either going to or ,
429,kp2gdu,t2_jv5mv,1609611423,/r/wallstreetbets/comments/kp2gdu/this_year_im_gonna_invest_big_in_snake_skin/,1,This year I m gonna invest big in snake skin, removed 
430,kp2hkg,t2_5ppe13es,1609611534,/r/wallstreetbets/comments/kp2hkg/market_moving_events_for_the_first_week_of_2021/,1,Market Moving Events for the First week of 2021,
431,kp2hr4,t2_8onqy,1609611552,/r/wallstreetbets/comments/kp2hr4/naysayers_and_bears_and_ignorami_have_no_excuses/,1,Naysayers and bears and ignorami have no excuses anymore ,
432,kp2hym,t2_6mon9ecy,1609611571,/r/wallstreetbets/comments/kp2hym/hinge_dd_all_in_on_bby_weeklies_at_open/,1,Hinge DD All in on BBY weeklies at open ,
433,kp2in2,t2_6916x3m9,1609611625,/r/wallstreetbets/comments/kp2in2/doge/,1, DOGE, removed 
434,kp2is5,t2_9inyl,1609611638,/r/wallstreetbets/comments/kp2is5/who_needs_meme_stocks_when_you_have_the_power_of/,1,WHO NEEDS MEME STOCKS WHEN YOU HAVE THE POWER OF DOGE ,
435,kp2jgc,t2_82f26ljp,1609611700,/r/wallstreetbets/comments/kp2jgc/where_are_you_on_the_spectrum/,1,Where are you on the spectrum ,
436,kp2mbb,t2_91urn7c1,1609611952,/r/wallstreetbets/comments/kp2mbb/wake_up_in_2021_i_am_finally_even_in_my_account/,1,Wake up in 2021 I am finally even in my account 60 one week gain in BABA calls and BTC I know it s insignificant but I am so excited for this year Happy new year y all ,
437,kp2n2p,t2_zr8pmgj,1609612020,/r/wallstreetbets/comments/kp2n2p/when_you_want_2000_tendies_vs_600_tendies/,1,When you want 2000 tendies vs 600 tendies,
438,kp2otc,t2_90lr1jzh,1609612179,/r/wallstreetbets/comments/kp2otc/im_gettin_these_tendies_bois_just_bought_so_i_can/,1,I M GETTIN THESE TENDIES BOIS JUST BOUGHT SO I CAN SELL LOW,
439,kp2oxc,t2_4yyvnegd,1609612189,/r/wallstreetbets/comments/kp2oxc/alibaba_is_undervalued/,1,Alibaba is UNDERVALUED ,One after another negative catalysts have been annihilating Alibaba s share price First it was the ANT IPO fiasco https imgur com kDpBPlg and then it was CCP regulatory concerns Do you really think the CCP is on a warpath to meaningfully hinder one of their most profitable companies If so then stop reading here This is literally a gift from the CCP and here is why First lets start off with some fundamental boomer valuation metrics According to Nasdaq com here s a comparison of the two largest e commerce companies ALIBABA Forward P E 2021 30 2022 23 2023 17 12 month Forward PEG ratio 1 46 AMAZON Forward P E 2021 73 2022 52 2023 no estimates 12 month Forward PEG ratio 3 22 As you can see Alibaba is CRITICALLY undervalued compared to Amazon When PEG is taken into account with P E it can justify a currently high P E IF AND ONLY IF said company is expected to grow earnings fast enough YOY According to Zack s the E commerce industry as a whole has a PEG ratio of about 2 56 which would indicate that Alibaba is undervalued in comparison to not only Amazon but most if not all of its peers as well Lets also not forget that Alibaba recently increased their share buyback program from 6 billion to 10 bilion https www marketwatch com story alibaba raises stock buyback plan to 10 billion but stock continues to sink 11609124627 That s an increase of over 66 Even Alibaba themselves thinks their shares are undervalued and wants to take advantage of the recent sell off Secondly lets check out the technical side of things Here is a weekly chart https imgur com 5ffIMmO that shows a very attractive uptrending pattern for the last few years It also shows that Alibaba was overextended and needed a healthy pullback Now it s oversold and in prime territory for a true dip buy opportunity An opportunity this large has presented itself just 4 times in a little over 2 years The huge green candle tells me that after the sell off Alibaba bulls were lying in wait for a moment like this to scoop up more shares Lastly lets break it down in WSB valuation metrics Daniel Zhang YOLOd his way into an empire and his wife s boyfriend The CCP has noticed that he is incredibly profitable and doesn t seem to be slowing down anytime soon The wife s boyfriend is starting to fear for his top position in the house This is why the wif es boyfriend wants to regulate the little autist so that he can maintain power over both his wife and the autist That said the wife s boyfriend doesn t want to kick the autist out He still wants to keep the little autist around because he generates money for him while he hangs out with his wife TLDR The CCP wants to make sure it stays in position as the wife s boyfriend Alibaba is undervalued and presents an opportunity if you believe the CCP regulatory concerns are just smoke and mirrors 
440,kp2rmg,t2_6x4dnrai,1609612419,/r/wallstreetbets/comments/kp2rmg/riot_blockchain_to_the_moon_or_something/,1,Riot blockchain to the moon Or something , removed 
441,kp2rph,t2_43pxhu2b,1609612427,/r/wallstreetbets/comments/kp2rph/come_join_the_train/,1,come join the train, amp x200B https preview redd it 2ao480hkqy861 jpg width 218 amp format pjpg amp auto webp amp s 4aae0865f7a15680dad6643b4008f26d5071f15b
442,kp2srq,t2_73bcogen,1609612514,/r/wallstreetbets/comments/kp2srq/i_know_you_fuckers_are_tired_of_the_weekends_well/,1,I know you fuckers are tired of the weekends Well instead of scrolling through WSB the whole damn day why don t you make your self some tendies over DOGECOIN ,
443,kp2uvi,t2_5hlk5,1609612671,/r/wallstreetbets/comments/kp2uvi/anyone_feeling_an_amc_rally/,1,Anyone feeling an AMC rally , removed 
444,kp2v9z,t2_8ulvaidi,1609612705,/r/wallstreetbets/comments/kp2v9z/the_greatest_trick_wsb_ever_pulled_was_convincing/,1,The Greatest Trick WSB Ever Pulled Was Convincing The World It Was Autistic Its Actually Retarded,
445,kp2x7z,t2_6a6b05jv,1609612858,/r/wallstreetbets/comments/kp2x7z/my_sister_bought_dogecoin_with_her_stim_check/,1,My sister bought dogecoin with her stim check ,
446,kp2xjm,t2_10wrhg,1609612888,/r/wallstreetbets/comments/kp2xjm/events_only_happening_in_the_placebo_arm/,1, events only happening in the placebo arm ,
447,kp2xxi,t2_80q4obfq,1609612923,/r/wallstreetbets/comments/kp2xxi/2021_my_sons_new_winter_hat/,1,2021 My son s new winter hat ,
448,kp2yar,t2_8z8znyso,1609612951,/r/wallstreetbets/comments/kp2yar/dogecoin_to_the_moon/,1,Dogecoin to the moon,
449,kp2zb9,t2_3rgizd1f,1609613043,/r/wallstreetbets/comments/kp2zb9/one_word/,1,ONE WORD , removed 
450,kp2zsq,t2_limvgo5,1609613083,/r/wallstreetbets/comments/kp2zsq/what_platform_do_you_use_in_canada/,1,What platform do you use in Canada , removed 
451,kp31wg,t2_3yu92bj0,1609613270,/r/wallstreetbets/comments/kp31wg/im_from_europe_could_someone_please_explain_put/,1,I m from Europe Could someone please explain PUT and CALL, removed 
452,kp31yj,t2_fy9e8,1609613276,/r/wallstreetbets/comments/kp31yj/rstocks_poster_located/,1,r stocks poster located,
