,postid,author,created_utc,permalink,score,title,selftext
0,komeqw,t2_9ihou9o9,1609545992,/r/wallstreetbets/comments/komeqw/some_sage_wisdom/,1,Some sage wisdom,
1,komfm6,t2_70w9d877,1609546075,/r/wallstreetbets/comments/komfm6/pltr_shill_post_fighting_child_exploitation/,1,PLTR Shill Post Fighting Child Exploitation,
2,komg14,t2_6cbbhi3e,1609546113,/r/wallstreetbets/comments/komg14/mommy_is_here_brrrrrrrrrrrrrrrrr/,1,Mommy is here Brrrrrrrrrrrrrrrrr,
3,komh2f,t2_hah11,1609546213,/r/wallstreetbets/comments/komh2f/yahoo_finances_take_of_this_sub_waging_a_kind_of/,1,Yahoo Finances take of this sub waging a kind of guerrilla warfare in the markets ,
4,komk8y,t2_8eco5h12,1609546504,/r/wallstreetbets/comments/komk8y/this_is_the_type_of_energy_i_expect_to_see_more/,1,This is the type of energy I expect to see more of as the stimulus checks start rolling out next week,
5,komlf9,t2_67rxtl5s,1609546613,/r/wallstreetbets/comments/komlf9/seems_like_a_solid_bull_flag/,1,Seems like a solid bull flag,
6,komm9t,t2_5xvgpw1s,1609546694,/r/wallstreetbets/comments/komm9t/my_portfolio_this_entire_week/,1,My portfolio this entire week ,
7,komnla,t2_6nuw0i04,1609546822,/r/wallstreetbets/comments/komnla/nio_day/,1,NIO DAY , removed 
8,kompnb,t2_dq5znkz,1609547027,/r/wallstreetbets/comments/kompnb/you_retards_gave_4463_to_this_post_asking_to_stop/,1,You retards gave 4463 to this post asking to stop wasting your money on those awards and buy more GME shares To put it into context total amount of coin spent 2 340 420 at a min cost of 5709 in max 199 package or 300 GME shares Well done This doesn t include the comments awards ,
9,komr6u,t2_67fi0jeu,1609547170,/r/wallstreetbets/comments/komr6u/who_wants_to_do_a_line_off_my_spread_sheets/,1,Who wants to do a line off my spread sheets , removed 
10,koms5q,t2_4aa2ai2h,1609547264,/r/wallstreetbets/comments/koms5q/e2open_p_c_p_l_will_be_a_510_bagger_in_2021/,1,E2open P C P L will be a 5 10 bagger in 2021, removed 
11,koms7k,t2_93cuxjo9,1609547271,/r/wallstreetbets/comments/koms7k/acam/,1, ACAM ,
12,komvem,t2_4tc9xira,1609547584,/r/wallstreetbets/comments/komvem/my_dd_for_qs/,1,My DD for QS ,
13,komw1i,t2_5zkp6hoj,1609547643,/r/wallstreetbets/comments/komw1i/drpp_strikes_again_lesson_on_pe_ratios/,1,Dr PP Strikes again Lesson on P E Ratios,
14,komwuk,t2_5zkp6hoj,1609547715,/r/wallstreetbets/comments/komwuk/dr_pp_strikes_again_valuable_lesson_on_pe_ratios/,1,Dr PP Strikes again Valuable Lesson on P E Ratios, removed 
15,komxj9,t2_6jgbnm9i,1609547783,/r/wallstreetbets/comments/komxj9/potential_in_coming_real_estate_dip_in_2021_are/,1,Potential in coming real estate dip in 2021 Are there any non idiots among us that work in this space and want to share their thoughts ,TLDR I have no fucking clue what I am talking about It looks like the housing market is ready to decline in late 2021 maybe as soon as the spring I am considering selling my rental house soon obviously so I can yolo more into GME PLTR and SPCE I can t help myself and I don t want help If this happens REITs might dip further making for a nice entry point amp x200B Home prices have been steadily rising the last five or so years to the point we are seeing a spike in the inflation adjusted housing costs It looks like we are at the 07 08 highs again amp x200B https preview redd it r6on75066t861 png width 739 amp format png amp auto webp amp s 9bac32713ff598bab5431b52ae7d8e45332340ba I have been following the forbearance rates since covid started and it looks like many of the national lenders have forbearance rates in the 3 6 range still Historically these are under 1 for all lenders If these eventually turn into delinquencies after the forbearance period expires and covid eviction protections expire I am worried we might see a surge in foreclosures and thus a flood of cheap real estate hitting the market thus drastically reducing home prices in the second half of 2021 I ll walk you through the timing I am seeing The majority of forbearance requests were made in March June the MBA has been publishing this data These periods usually last 180 days based on historical forbearance periods And I believe these periods can be extended for up to one year which is also part of covid relief The national average number of delinquent payments on a mortgage before foreclosure is about four For those with 180 day forbearance periods started in March June of 2020 it looks like this 6 months forbearance 4 months delinquency 10 months which puts these foreclosures on the market in February 2021 May 2021 For those with 365 day forbearance periods started in March June of 2020 it looks like this 12 months forbearance 4 months delinquency 16 months which puts these foreclosures on the market in July 2021 October 2021 Finally for those who were delinquent prior to covid and would have been evicted during covid the eviction protection has prevented banks from foreclosing so these homes will hit the market in February 2021 after the eviction protections expire on January 31st 2021 Foreclosures are down 80 this year because of this amp x200B If we check FRED and look at delinquent payment on real estate over the last 20 years we can see about 10 of homes and real estate were in delinquency by 2010 below If all the current forbearances turn into delinquent payments which turn into foreclosures we could see a 2 6 spike by the end of the summer or a 2 6x increase in foreclosure based real estate hitting the market Plus we need to add in the 80 of foreclosures that will hit post eviction moratorium That would be about 2 3s the delinquency rate we saw post financial crisis which would could cause quite a dip in home prices amp x200B Processing img 5rr035o96t861 The current market is also further magnified buy the shortage of homes for sale in part due to the lack of foreclosures due to the eviction moratorium You can see below the US is at an all time low for monthly supply of houses dating back to 1960 amp x200B https preview redd it 4136uv3c6t861 png width 1174 amp format png amp auto webp amp s 859c31a721b63b5c01f787d6cfec5ae387a8700e When you combine a low supply with a relatively high demand see housing sales the last two years below this creates a pretty expensive market based on supply and demand Also interest rates are low so people can afford more so housing prices are higher as a result amp x200B https preview redd it abfzz0he6t861 png width 1179 amp format png amp auto webp amp s dd698a8aefca84c6318c3c74da02ec2293b7aa19 In agreement with this home prices are the highest in history as well below even when adjusted for inflation first figure of the post amp x200B Processing img nhdsp7bh6t861 amp x200B This could easily turn into a serious situation in which a sudden spike in foreclosures and cheap real estate could cascade into a pretty swift crash and significantly reduce the value of real estate around the country by a huge margin Does anyone here have any real expertise on this matter I am a complete newb and idiot I don t know what I am doing I am just speculating I would greatly appreciate an expert s opinion on the matter amp x200B Related positions 1 rental house I am considering selling The only positions you care about I own GME PLTR and SPCE Lots of blue chip leaps 
16,komy8u,t2_173x7k,1609547847,/r/wallstreetbets/comments/komy8u/where_do_degenerates_fall_on_this_spectrum/,1,Where do degenerates fall on this spectrum ,
17,komykp,t2_64itpwxt,1609547878,/r/wallstreetbets/comments/komykp/was_taylor_swift_a_bear/,1,Was Taylor Swift a Bear ,
18,kon4gq,t2_3olicx8j,1609548447,/r/wallstreetbets/comments/kon4gq/dd_digital_marketing/,1,DD Digital Marketing,Ladies Gentleman s and random OnlyFans hoes I see on here always begging for money here is my first attempt at DD in this god forsaken sub Unfortunately I left my TA crayons at home so I ll try to indent and tab over my walls of text as much as possible so that you Zoomers can pay attention to at least 1 4 of it amp x200B I do want to clarify that some of the timing of iOS 14 changes could get changed and Facebook could push back against certain parts of the change I did my best to explain the basics of what I think is going on but it is possible that I miscommunicated or misunderstood some parts of the iOS 14 update so digital marketers feel free to let me know in the comments and I ll edit accordingly TL DR Apple s iOS 14 Get Zucked Zuckerberg Said Tim Cook For reasons that will be explained below it is possible that Google and Facebook will begin seeing their duopoly slowly diminish over the next several years probably gt 7 years based on how fast Turtle Mitch is able to get anything done I do believe that Google and Facebook will continue to be the top two players in the game for the foreseeable future SO I AM NOT RECOMMENDING SHORTING THESE AT ALL YOU NOOBS The core problems that these companies will soon face especially Facebook is anti trust law suits from the FTC https www ftc gov news events press releases 2020 12 ftc sues facebook illegal monopolization more distrust of their platform due to the most recent election censorship across both platforms a complete failure of Facebook to properly address the negative side effects of social media on the youth and actually do something about it and most importantly Apple upgrading to iOS 14 explained more later The Anti Trust Law Suit from the FTC https www ftc gov news events press releases 2020 12 ftc sues facebook illegal monopolization talks about Facebook becoming a monopoly and buying all the competition such as Instagram and WhatsApp instead of competing against them iOS 14 https www forbes com sites kateoflahertyuk 2020 08 30 ios 14 facebooks apple nightmare keeps getting worse sh 3029be574cfe update will roll out early 2021 This will hinder the collection of iPhone identifiers for advertisers IDFA https www appsflyer com mobile attribution glossary idfa one of the primary things used to track users online Primary Issues For Facebook From The iOS 14 Update 1 gt Bidding Issues lt As I stated above Facebook is going to lose more and more data points as time goes on making it so that they aren t able to bid appropriately on someone like Johnny Bravo when he is scrolling through his insta feed What does this mean Insta may look at Johnny Bravo as a Joe Schmo and decide that he s not worth bidding up on so Johnny Bravo will never see those ads of Playboy and Whey Protein that he would have bought if he got an ad for it Example for this with the iOS14 update Facebook loses its data points to Johnny Bravo s workout apps so they had no way of knowing he would have been more likely to convert 2 gt Creating Audiences lt Facebook is going to lose thousands of data points on its users effectively making it harder to match these audiences into their appropriate buckets Before if someone had several golf apps on their phone you could assume they were a golf lover more easily Without being able to use that app data sharing it will be much harder to know they like golf unless they follow several golfing pros shows in Facebook With the expectation that Facebook will become less efficient as time goes on and that certain lawsuits could negatively affect the company many advertisers are looking for other viable options to put their ad dollars There have been several social media competitors working to monetize their app and become the third wheel of digital marketing Some of these companies include PINS Pinterest SNAP Snapchat TWTR Twitter Twitch Owned by Amazon aka AMZN LNKD LinkedIn Owned by Microsoft aka MSFT Hulu Ads Owned by Disney aka DIS TikTok Not sure if correct but you may be able to get shares here https www ig com en shares ipos bytedance tiktok ipo ticker tbd but pretty sure it will be ZOOMR The name of the game is trying figuring out which of these new channels will be the next to gain 5 10 more market share of ad spend from clients and which will be nothing more than moneyless pits since they do a terrible job at monetizing their app and creating engaging ads that lead to conversions for clients looking at you SNAP and TikTok MY RECENT BACKGROUND aka why should you even bother listening to this autist Worked in digital marketing and finance for the last 5 years also took on several side jobs doing digital marketing for companies I managed gt 10 million in ad spend across various digital marketing channels Google Bing Facebook Shopping over the last 30 days and over gt 40 million in ad spend over the last year I work with a team of Managers and Directors at my agency to help talk about new opportunities and keep up with digital marketing trends across all channels Using our gt 300 clients data our company is able to look at macro trends at a faster rate so we can quickly identify which new channels to focus our efforts in Pinterest TikTok Snap Twitch etc This was highlighted over the last year or year and a half when we noticed a huge spike in companies using Pinterest as a primary channel for digital marketing Only more and more companies are going to join into the race this is just the beginning Any of these stocks or multiple could improve throughout the following years but my money is on PINS Even with PINS recent run up in stock price I think there is still plenty of time to buy this stock now Our clients are continuing to spend more and more on the Pinterest ad platform and it is returning better performance metrics ROAS ROI than most of the other mentioned channels Pinterest also relies on on targeting people based on boards they visit follow create combined with using a search query method for ads somewhat similar to Google s This means they don t have to rely as much on pixel data like Facebook does to create their audience targeting amp x200B I think the safest way to make money on PINS is to buy stocks for the long term but I know that doesn t get some of your little schlongs hard enough Their next earnings are on 2 4 21 after hours and I fully expect them to smash expectations just like McConnell s dad smashed that turtle to give birth to Mitch Look at PINS options that make sense to you for a little after earnings preferably not 2 5 literally the day after earnings But you do you boo Love Kitties N Titties
19,kon4qq,t2_4w6twu8,1609548476,/r/wallstreetbets/comments/kon4qq/autist_or_boomer/,1,Autist or Boomer ,
20,kon55m,t2_9lz5uf9h,1609548517,/r/wallstreetbets/comments/kon55m/an_australian_company_says_it_can_repair_dna_what/,1,An Australian company says it can repair DNA what do you reckon that market would be worth , removed 
21,kon5db,t2_1h95i8zy,1609548539,/r/wallstreetbets/comments/kon5db/you_retards_know_that_all_reddit_awards_expire/,1,You retards know that all Reddit awards expire worthless right ,I ve done the calculations here imgur com 9UKx5fJ and for every single Reddit award bought the person who bought the award never sees a single cent of profit In fact every single award returns a 100 loss while Reddit laughs their asses off for getting you autists to buy into their dopamine fueled trap Science doesn t lie bitch and if you actually spend money on these awards you simply hate money or are retarded there s no other way to put it Yes the first one is technically free but they do that to lure you in because they know that all of you degenerates here have gambling problems Don t tell me I didn t warn you besides it s much more fun to lose money options trading anyways TLDR Reddit awards are useless pixels and a proven waste of money instead buy GME shares calls BBBY shares calls THC shares NIO shares calls and buy the PLTR dip At the very least you re helping to defeat the s and have at least a chance of making money that way instead of literally donating your money to the greedy assholes who run this stupid app 
22,kon8iu,t2_1700lb,1609548846,/r/wallstreetbets/comments/kon8iu/ark_how_to_get_notifications_of_when_they_buy_and/,1,ARK how to get notifications of when they buy and sell stocks, removed 
23,kon8pn,t2_64jgtcxr,1609548863,/r/wallstreetbets/comments/kon8pn/gold_gang_sold_at_100_and_rolled_winnings_into/,1,Gold gang Sold at 100 and rolled winnings into JNUG 126 50C 8 01 Gold going up big next week imo,
24,kon99i,t2_769dv0ao,1609548920,/r/wallstreetbets/comments/kon99i/retards_i_found_the_ultimate_valhalla_play/,1,RETARDS I FOUND THE ULTIMATE VALHALLA PLAY, removed 
25,konbz8,t2_64jgtcxr,1609549183,/r/wallstreetbets/comments/konbz8/gold_gang_sold_when_it_hit_100_and_rolled_profits/,1,Gold gang Sold when it hit 100 and rolled profits into JNUG 126 50C 08 01 Let s go gold miners ,
26,konjkw,t2_bo2xl,1609549888,/r/wallstreetbets/comments/konjkw/the_wolf_of_wallstreets_granddaughter_is_brandi/,1,The Wolf of Wallstreet s granddaughter is Brandi Love ,
27,konjwm,t2_1nrnzakf,1609549922,/r/wallstreetbets/comments/konjwm/loses_all_his_money_on_puts_one_of_us/,1,Loses all his money on puts One of us ,
28,konm30,t2_11hlua,1609550131,/r/wallstreetbets/comments/konm30/reddit_awards_give_you_a_sense_of_pride_and/,1,Reddit awards give you a sense of pride and accomplishment DD inside,You guys keep spouting that giving out Reddit awards are a waste or give nothing to anyone other than Reddit I m here to prove you wrong Helping the Community By choosing specific awards you actually help donate coins to the subreddit you love For example The Golden Fuckboy Award Gives r wallstreetbets 4 000 coins With 4K coins the r wallstreetbets mods can run community contests and award you the heart and soul of this sub with more coins Help your community help you Keep this sub wealthy and healthy Purchase Community awards today Helping the poors When you award a fellow redditor certain awards they can enjoy a lavish lifestyle in the prestigious r lounge But that s just a stepping stone to a secret society of lounges If you award someone inside the lounge you open up a portal to an underground society of lounges only few have seen Seek enlightenment and prosperity Purchase a Gold award today Earn a Trophy for yourself Lastly why not show off your philanthropic nature and earn award giving trophies The more Gold Platinum Argentium and TAPA awards you give the higher your gild trophy levels get Take it from me I m not just the harbinger of awards I m also a member Gilding Level VII
29,konnyk,t2_691ob,1609550319,/r/wallstreetbets/comments/konnyk/anyone_else_tired_of_buying_dips_yet_pltr_to_420/,1,Anyone else tired of buying dips yet PLTR to 420 EOY ,
30,konpob,t2_19br5ydc,1609550487,/r/wallstreetbets/comments/konpob/when_its_the_long_weekend_and_i_have_to_wait/,1,When it s the long weekend and I have to wait until Monday to lose my life savings,
31,konr0f,t2_uc75u,1609550619,/r/wallstreetbets/comments/konr0f/theyll_give_you_store_credit_for_your_shares/,1,They ll give you store credit for your shares ,
32,kont8x,t2_8cea5dxm,1609550841,/r/wallstreetbets/comments/kont8x/who_doesnt_like_some_pltr_tragedies/,1,Who doesn t like some PLTR Tragedies ,
33,kontlo,t2_5wg74r54,1609550873,/r/wallstreetbets/comments/kontlo/warren_buffett_is_just_like_us/,1,Warren Buffett is just like us,
34,kontmn,t2_2mxsd39v,1609550877,/r/wallstreetbets/comments/kontmn/dippin/,1,Dippin,
35,kontq7,t2_mjj99,1609550886,/r/wallstreetbets/comments/kontq7/2021_playcat_stocks/,1,2021 Play Cat Stocks ,
36,konuww,t2_92cj5p4e,1609551001,/r/wallstreetbets/comments/konuww/_/,1, ,
37,konuyt,t2_874k0ebl,1609551007,/r/wallstreetbets/comments/konuyt/confirmed_gme_to_the_moon/,1,CONFIRMED GME TO THE MOON,
38,konwnv,t2_7w4yjm4f,1609551175,/r/wallstreetbets/comments/konwnv/im_18_and_my_first_brokerage_account_is_in_your/,1,I m 18 and my first brokerage account is in your hands 10 shares at 19 50,
39,kony4e,t2_668z14cz,1609551317,/r/wallstreetbets/comments/kony4e/imagine_betting_against_the_fed_in_2020/,1,Imagine betting against The Fed in 2020,
40,konyzy,t2_35jxgtpr,1609551405,/r/wallstreetbets/comments/konyzy/and_they_said_2021_would_be_better/,1,And they said 2021 would be better,
41,koo1pr,t2_8huvxh4e,1609551679,/r/wallstreetbets/comments/koo1pr/stimulus_checks/,1,STIMULUS CHECKS, removed 
42,koo1w1,t2_6mon9ecy,1609551697,/r/wallstreetbets/comments/koo1w1/bby_to_the_moon_according_to_a_hinge_profile/,1, BBY to the moon according to a hinge profile,
43,koo4za,t2_59onyqsd,1609552009,/r/wallstreetbets/comments/koo4za/earnings_date_longs_ideas/,1,Earnings Date Longs Ideas,Here are some earnings dates coming up totally random bunch amp x200B FCEL 1 08 1 14 Blackrock LGI 1 19 AMD 1 28 MA 1 28 AMZN 1 29 AAPL 1 29 CAT 1 29 humana 2 03 cern 2 0 seneca 2 03 CRSR 2 03 F 2 04 DIS 2 04 TWLO 2 04 SONOS 2 04 SNAP 2 04 PTON 2 04 STVI 2 05 TRNO 2 05 TWTR 2 09 CME 2 10 THS 2 10 CHGG 2 1 LYFT 2 10 NVDA 2 11 ROKU 2 12 UA 2 12 CRES 2 12 SHOP 2 12 SHAK 2 12 YETI 2 12 LSI 2 17 amp x200B r wsb had all this shit done by october but which of your contracts are paying out say position and s
44,koo4zh,t2_691ob,1609552009,/r/wallstreetbets/comments/koo4zh/i_mean_at_least_i_got_to_load_up_pltr_42069_eoy/,1,I mean at least I got to load up PLTR 420 69 EOY ,
45,koo7cf,t2_789if379,1609552243,/r/wallstreetbets/comments/koo7cf/why_gme_will_moon_in_2021_tons_of_cyberpunk_2077/,1,Why GME will moon in 2021 Tons of Cyberpunk 2077 trade ins since it flopped and vaccinations offered in store,
46,koo81j,t2_92cj5p4e,1609552315,/r/wallstreetbets/comments/koo81j/fuck_citron_all_me_homies_hate_citron/,1,Fuck Citron all me homies hate Citron,
47,koobt6,t2_9lzq37g5,1609552691,/r/wallstreetbets/comments/koobt6/join_our_discord/,1,Join our discord, removed 
48,kood9p,t2_2654s8w,1609552826,/r/wallstreetbets/comments/kood9p/gme_gang_gamestopcom_4q20_model_update/,1,GME Gang GameStop com 4Q20 Model Update,Happy New Year once again GME Gang Okay since you know that I m obsessed and literally Can t Stop Won t Stop GameStop Here s a 4Q20 model update to kick off 2021 as we start to gather up our popcorn for the ICR Conference festivities in just 10 days https www reddit com r wallstreetbets comments kknuk6 gme icr conference words matter https www reddit com r wallstreetbets comments kknuk6 gme icr conference words matter For those that have big brains and have been following along here s the most recent one https www reddit com r wallstreetbets comments kh9na8 gme 4q20 financial model https www reddit com r wallstreetbets comments kh9na8 gme 4q20 financial model I have ticked almost every metric down with the largest reduction being a 4k trim to daily order rate as January post Christmas has started off rather weak It s irrefutable that supply whether through managerial operational failings or lost market share or outside their control due to Covid is weighing on sales Whenever there s been console supply especially the uptick in sales is notable and somewhat durable in the order rate data many thanks once again GME Gang for the steady influx of GameStop com https GameStop com order s You retarded motherfuckers are going to singlehandedly pump the PowerUp Rewards loyalty numbers https www reddit com r wallstreetbets comments km26gn gamestop dd and potential profits https www reddit com r wallstreetbets comments km26gn gamestop dd and potential profits With two full months of the quarter gone by I would note no one should have ever put their belief solely into one quarter making breaking their thesis in isolation unless you re talking about a biotech or some crazy shit But this is a goddamn GameStop com https GameStop com FKA GameStop we re talking about here The bears will vociferously argue otherwise I look forward to hearing the gnashing of teeth of the dying animal that is Melvin Capital amp co Let s make em bleed boys https preview redd it 4m5k6mrdtt861 png width 1626 amp format png amp auto webp amp s f20255a60716b8160832b675b64d820a6e7df5a3 My base case sits at 2 share and will likely come down a touch more barring incremental console supply in January in base case Feedback REEEEEEE noises and retarded amounts of awards always appreciated in the comments 
49,kooftz,t2_hkv2h,1609553067,/r/wallstreetbets/comments/kooftz/found_this_sob_in_the_wild_today/,1,Found this SOB in the wild today ,
50,koojcs,t2_8efj3m7z,1609553408,/r/wallstreetbets/comments/koojcs/cannabis_solar_and_metal_stocks_to_moon_on_jan/,1,Cannabis Solar and Metal stocks to moon on Jan 5th Dems will win Senate ,
51,koojxs,t2_3axcc5l4,1609553469,/r/wallstreetbets/comments/koojxs/aint_that_the_truth/,1,Ain t that the truth ,
52,kookuq,t2_52tld00p,1609553576,/r/wallstreetbets/comments/kookuq/gme_the_true_analysis/,1,GME the true analysis, removed 
53,kookwd,t2_nkled,1609553580,/r/wallstreetbets/comments/kookwd/custom_community_award_weighted_blanket/,1,Custom Community Award Weighted Blanket, removed 
54,kool15,t2_15lgqf,1609553593,/r/wallstreetbets/comments/kool15/stupid_people_that_bought_at_the_top_of_green_line/,1,Stupid people that bought at the top of green line,
55,kool5l,t2_7jhgjadx,1609553603,/r/wallstreetbets/comments/kool5l/casper_cspr_going_to_moon_this_quarter/,1,Casper CSPR Going to Moon this Quarter, removed 
56,koon8d,t2_6y5f18av,1609553812,/r/wallstreetbets/comments/koon8d/turn_the_rh_app_upside_down_today/,1,Turn the RH app upside down today, removed 
