,postid,author,created_utc,permalink,score,title,selftext
936,kvzet8,t2_6pt73,1610481745,/r/wallstreetbets/comments/kvzet8/short_alert_trump_planning_on_banning_americans/,8,Short Alert Trump planning on banning Americans from investing in BABA on way out, Analysis The trillion dollar weapon in the U S China tech stock war BY Reuters 10 07 AM ET 01 12 2021 By Marc Jones LONDON Reuters The threat of a 1 trillion U S sanctions hit on the Chinese internet giants that have led emerging market stocks to their first record high since 2007 is overshadowing the rally just as increased scrutiny from Beijing itself squeezes valuations U S Sino tensions ratcheted up in recent days as outgoing President Donald Trump s administration pushed through a ban on Americans investing in 35 firms it considers to be linked to China s military Sources in Washington last week said Trump was considering adding Alibaba BABA https snapshot fidelity com fidresearch snapshot landing jhtml symbol BABA research and Tencent worth a combined 1 3 trillion the second and third biggest EM stocks in the world and held by almost every major U S investment fund to the list of banned firms Targeting China s two most valuable companies would be the most dramatic step yet against the country s firms as Trump seeks to cement his hardline policy against Beijing during his final days in office Goldman Sachs estimates that U S investors hold roughly 1 trillion of Chinese internet and tech stocks or have U S listings known as American Depositary Receipts ADRs that Washington has also been clamping down on To unwind 1 trillion of investment if Alibaba BABA https snapshot fidelity com fidresearch snapshot landing jhtml symbol BABA research and Tencent were removed is a lot said Vivian Lin Thurston a portfolio manager and Chinese equity analyst at William Blair Investment Management It would be unprecedented she added It hasn t happened before in any global market Swiss bank UBS calculates that just over a third of Alibaba s BABA https snapshot fidelity com fidresearch snapshot landing jhtml symbol BABA research 616 billion market cap is held by U S investors while 12 of Tencent s 35 billion value is The two firms also account for almost 11 of MSCI s 7 trillion Emerging Market index which they respectively joined in 2015 and 2008 Chinese firms now make up 40 of the index up from just 17 a decade ago Graphic China s growing dominance of MSCI s emerging market index https graphics reuters com EMERGING MARKETS jznvnqwjdpl chart png THE BIG UNWIND Global index providers such as MSCI S amp P Dow Jones and FTSE Russell as well as the New York Stock Exchange have been forced to eject high profile firms on Trump s list like China Mobile China Telecom CHA https snapshot fidelity com fidresearch snapshot landing jhtml symbol CHA research and semiconductor giant SMIC from their top benchmarks William Blair s Lin Thurston explained how those removals then trigger a wave of selling by investment funds that passively track the indexes As soon as it is delisted bang it s gone she said referring to the need to shed the stocks While incoming President Joe Biden could reverse the ban analysts at UBS say the new administration may not want to appear soft on China Neither Biden nor his team have commented on the matter but a reversal still wouldn t undo the billions of dollars of disruption already caused Chinese investors have swooped in to buy up some of the offloaded shares but may struggle to absorb everything if things snowball Goldman Sachs estimates there would be a 28 billion selloff if every international fund tracking MSCI s main global emerging market or Asia indexes were to liquidate holdings of the 42 Chinese firms its views as at risk not including Tencent or Alibaba BABA https snapshot fidelity com fidresearch snapshot landing jhtml symbol BABA research It and fellow Wall Street banks JPMorgan and Morgan Stanley have also said they will withdraw as many as 500 Hong Kong listed structured products they had issued linked to the Chinese firms Graphic Chinese firms with biggest U S investor base as percentage share https fingfx thomsonreuters com gfx mkt jbyprbzxzpe Pasted 20image 201610382815788 png ANT PROBLEMS The Trump administration has had both Tencent and Alibaba s BABA https snapshot fidelity com fidresearch snapshot landing jhtml symbol BABA research financial technology affiliate Ant Group in its crosshairs for some time Just last week Trump signed an executive order banning U S transactions with Alibaba s BABA https snapshot fidelity com fidresearch snapshot landing jhtml symbol BABA research Alipay mobile payment app and Tencent s WeChat and QQ Wallet over concerns they could be used to track the locations of federal employees and build dossiers of personal information China s foreign ministry responded saying the U S was abusing its power and unreasonably suppressing foreign firms with the measures Tencent and Alibaba BABA https snapshot fidelity com fidresearch snapshot landing jhtml symbol BABA research have declined to comment In early November it was Beijing itself though that rattled investors after the surprise suspension of Ant Group s 37 billion public listing set to be the world s largest stock market debut with just days to go Alibaba BABA https snapshot fidelity com fidresearch snapshot landing jhtml symbol BABA research which owns about a third of Ant has seen its market value shrink by more than a quarter since the IPO was shelved and regulators zeroed in on its business model although it is still among the biggest 10 companies globally with a valuation of more than 600 billion Some fund managers considered Beijing s move a sensible one as Ant a major online lender lacked adequate capital buffers But others like Aviva Investors Head of Global Emerging Market Equities Alistair Way are concerned We have become rather more nervous about the regulatory climate in China and the seeming desire to reduce competitive dominance of big e commerce players such as Alibaba BABA https snapshot fidelity com fidresearch snapshot landing jhtml symbol BABA research he said In aggregate we have been reducing exposure to Chinese internet firms Standard Life Aberdeen senior investment director Nick Robinson is also unsure It feels unlikely at the moment that they Alibaba BABA https snapshot fidelity com fidresearch snapshot landing jhtml symbol BABA research and Tencent will be added to the blacklist but so far it hasn t been right to bet on a de escalation So could it happen Absolutely And if it does happen it could be quite significant Graphic Mixed fortunes for Chinese firms thrust onto U S blacklist https fingfx thomsonreuters com gfx mkt rlgvdqrqwpo Pasted 20image 201610391915814 png Additional reporting by Alun John in Hong Kong Editing by Kirsten Donovan 
937,kvzf1q,,1610481763,/r/wallstreetbets/comments/kvzf1q/patience/,1,Patience, deleted 
938,kvzgjk,t2_52wdwy7l,1610481884,/r/wallstreetbets/comments/kvzgjk/once_jpow_and_the_boys_stop_printing_im_all_in/,1,Once jpow and the boys stop printing im all in nndm, removed 
939,kvzh7u,,1610481941,/r/wallstreetbets/comments/kvzh7u/og_autists_stuffing_into_lockers_almost_100_years/,1,OG Autists stuffing into lockers almost 100 years ago,
940,kvzhni,,1610481975,/r/wallstreetbets/comments/kvzhni/patience/,1,Patience, deleted 
941,kvzjr9,,1610482134,/r/wallstreetbets/comments/kvzjr9/obsolete_business_model_vs_growing_biz_with/,1,Obsolete business model vs growing biz with amazon deal Going all in on which one , deleted 
942,kvzl1o,,1610482237,/r/wallstreetbets/comments/kvzl1o/today_at_330_est_ipo_edge_to_host_churchill/,1,Today at 330 EST IPO Edge to Host Churchill Capital CEO Klein in Fireside Chat for ICR Conference, deleted 
943,kvzm8e,t2_9sh5xq0h,1610482335,/r/wallstreetbets/comments/kvzm8e/uber_zoom_and_zillow_top_picks_for_2021/,1,Uber Zoom and Zillow top picks for 2021,
944,kvzn0k,,1610482402,/r/wallstreetbets/comments/kvzn0k/today_at_330_est_ipo_edge_to_host_churchill/,1,Today at 330 EST IPO Edge to Host Churchill Capital CEO Klein in Fireside Chat for ICR Conference, deleted 
945,kvznf0,t2_56i71lo6,1610482434,/r/wallstreetbets/comments/kvznf0/infinite_money_glitch/,1,Infinite money glitch ,
946,kvznhl,t2_kodc0,1610482439,/r/wallstreetbets/comments/kvznhl/spy_futures/,0,SPY Futures,
947,kvzodk,,1610482507,/r/wallstreetbets/comments/kvzodk/today_at_330_est_ipo_edge_to_host_churchill/,0,Today at 330 EST IPO Edge to Host Churchill Capital CEO Klein in Fireside Chat for ICR Conference, deleted 
948,kvzofp,t2_13kxbx,1610482512,/r/wallstreetbets/comments/kvzofp/this_sub_saving_the_planet_right_now/,1,This sub saving the planet right now ,
949,kvzorm,t2_11df2v,1610482542,/r/wallstreetbets/comments/kvzorm/presidentelect_joe_biden_to_name_gary_gensler_as/,6,President elect Joe Biden to name Gary Gensler as U S SEC chair GOOD OR BAD FOR MY STONKS ty ,
950,kvzot8,,1610482545,/r/wallstreetbets/comments/kvzot8/do_you_think_these_will_print/,3,Do you think these will print , deleted 
951,kvzq2s,t2_gp9r5,1610482644,/r/wallstreetbets/comments/kvzq2s/plug_100_by_end_of_our_deployment_and_my_friend/,1,Plug 100 by end of our deployment and my friend gets a tattoo 3 months,
952,kvzqak,t2_5348mpei,1610482661,/r/wallstreetbets/comments/kvzqak/half_of_the_retards/,3,Half of the retards ,
953,kvzrc1,t2_5lrma,1610482743,/r/wallstreetbets/comments/kvzrc1/we_think_people_are_being_misled_regarding_ev/,6, We think people are being misled regarding EV bubble NIO TSLA,
954,kvzrgu,t2_8hs6984h,1610482754,/r/wallstreetbets/comments/kvzrgu/my_first_yolo_how_fucked_am_i/,2,My first yolo how fucked am I ,
955,kvzrma,t2_pmw6,1610482764,/r/wallstreetbets/comments/kvzrma/bynd_the_impossible_sept_150c/,7,BYND the Impossible Sept 150C, TL DR BYND Sept 17 150C BYND Sept 17 180C BYND Sept 17 240C If you look through my history you ll see that I ve generally been a perma bull on BYND https www reddit com r wallstreetbets comments iletz9 bynd leaps 180 heres why It s a great company and has pretty stellar product https www reddit com r veganrecipes comments fnomtt beyond meatballs beyond incredible They re not as meaty as Impossible but they re meaty AND not greasy but really filling think of it as a different burger category altogether like the Yin to the Impossible Yang Together they bolster the entire plant based protein market amp x200B 180 Short Term 150 Mid Term 240 Longer Term https preview redd it 7l87gcalkya61 png width 1144 amp format png amp auto webp amp s 84ef8ee49c0cb52193331dc25bb6c3a236022f5f Thesis here is that BYND has hit a number of support levels Of course it could break below but I feel more confident that BYND has already seen its short term and mid term drops See the RSI On the 1 Year above chart it s oversold However if you drill into the 6 month and 3 month though it s overbought which scares me The FUNdamentals As an industry plant based proteins are booming with vegetarians flexitarians and traditional meat eaters alike Plant based meat category today is reminiscent of the plant based milk category when it was in its early stages of rapid growth amp x200B From GFI https preview redd it tzp3lb2dlya61 png width 829 amp format png amp auto webp amp s d96ea38e02096c9a0c099d2f270e2e147768e103 Financially this company is VERY well funded and stable What matters in the plant based world is of course a solid product but now more than ever is ability to scale production and scale distribution BYND has the capital to make this happen amp x200B 5 66 Quick Ratio Hot Diggity https preview redd it 7v9xcyfilya61 png width 396 amp format png amp auto webp amp s 01d3d1040674f0ba34be141e7dbee23c7da4f8a0 amp x200B Stable Cash https preview redd it 8hqmhl7llya61 png width 817 amp format png amp auto webp amp s c247aff0fe24d5965ed22d4e0a2968c2a57002a6 Here s something else year over year even despite the pandemic and restaurants shutting down Q3 2020 still showed growth compared to Q3 2019 Should expect to see the same amp x200B FU COVID https preview redd it tiocq4mmlya61 png width 832 amp format png amp auto webp amp s 5937f52721177f1bcea34ac298f2b83a95b41582 The hearts mark exit points 
956,kvzrum,t2_646zk1q6,1610482783,/r/wallstreetbets/comments/kvzrum/you_chose_to_go_to_the_moon_or_stay_right_here/,1,You chose to go to the moon or stay right here NGA vs GME hint one of them is obsolete,
957,kvzs0o,t2_xvaok,1610482797,/r/wallstreetbets/comments/kvzs0o/og_autists_stuffing_into_lockers_almost_100_years/,1,OG Autists stuffing into lockers almost 100 years ago,
958,kvzs6w,t2_5i0cyfl7,1610482810,/r/wallstreetbets/comments/kvzs6w/nice_gain_on_plug_currently_7k_now/,10,Nice gain on PLUG currently 7k now ,
959,kvzs9g,,1610482815,/r/wallstreetbets/comments/kvzs9g/get_in_here_for_money/,1,Get in here for money, deleted 
960,kvzsu1,,1610482862,/r/wallstreetbets/comments/kvzsu1/you_get_the_bag_and_fumble_it_i_get_the_bag_and/,1,You get the bag and fumble it I get the bag and flip it and Tumble it Small gains from the dip lets pop , deleted 
961,kvzton,,1610482929,/r/wallstreetbets/comments/kvzton/you_chose_to_go_to_the_moon_or_stay_right_here/,1,You chose to go to the moon or stay right here NGA vs GME hint one of them is obsolete, deleted 
962,kvztvj,t2_22hypiy6,1610482944,/r/wallstreetbets/comments/kvztvj/naked_options_or_covered_trades/,1,Naked options or covered trades , removed 
963,kvztzn,,1610482955,/r/wallstreetbets/comments/kvztzn/you_chose_to_go_to_the_moon_or_stay_right_here/,1,You chose to go to the moon or stay right here NGA vs GME hint one of them is obsolete, deleted 
964,kvzube,,1610482982,/r/wallstreetbets/comments/kvzube/you_chose_to_go_to_the_moon_or_stay_right_here/,1,You chose to go to the moon or stay right here NGA vs GME hint one of them is obsolete, deleted 
965,kvzugg,t2_8yx7c,1610482993,/r/wallstreetbets/comments/kvzugg/this_is_your_sure_thing/,1,This is your sure thing ,
966,kvzuo3,,1610483010,/r/wallstreetbets/comments/kvzuo3/you_chose_to_go_to_the_moon_or_stay_right_here/,1,You chose to go to the moon or stay right here NGA vs GME hint one of them is obsolete, deleted 
967,kvzutc,t2_6nkjvryq,1610483022,/r/wallstreetbets/comments/kvzutc/get_in_here_for_free_money/,11,Get in here for free money,Sup Are you too poor to buy longer dated options Of course you are this is WSB As part of my made up mandated community service I m here to help you pick a sure fire stonk to throw your pennies at ZNGA That s right everyone s least favorite game developer that made popular hits such as FarmVille Words with Friends and many more timeless classics Here s the actual DD I got an inside man that I call Woofy with access to FlowAlgo He tells me that someone has been buying millions of dollars of ZNGA lately 08JAN2021 ZNGA 356 000 9 96 4M 08JAN2021 ZNGA 356 000 9 98 4M 08JAN2021 ZNGA 195 000 9 95 2M 08JAN2021 ZNGA 788 000 10 00 8M 08JAN2021 ZNGA 175 000 9 99 2M 11JAN2021 ZNGA 1 400 000 9 61 13M 11JAN2021 ZNGA 997 000 9 65 10M 11JAN2021 ZNGA 500 000 9 72 5M Bullish Why else would someone throw millions at a stock that s been flat all year amp x200B Crayons https preview redd it apbtxhs8nya61 png width 830 amp format png amp auto webp amp s 3c31b24329256054dee3562ef8afd8364abc0138 Now for you folk that prefer technical anal ysis aren t as savvy with numbers This is the daily chart for ZNGA You see that magenta line in the chart Us pros call it the EMA 20 line All you really need to know is that there is a 100 good chance that it will bounce off of that line Can t fail I even drew an arrow for the candles to follow You can take the day off random stock market guy that is in charge of making ZNGA s chart https preview redd it yckxrg9bnya61 png width 741 amp format png amp auto webp amp s 798440ae1bcfdcd6b8bf11fe2b1c78dd45d3b018 The last piece of confirmation bias that I have for you comes from a whale This big blue mammal threw 65k at ZNGA If you want to save the ocean you should follow along Let s recap Confirmation bias from FlowAlgo someone s been buying millions daily Confirmation bias from TA chart says stonk bounce soon Confirmation bias from the ocean whale buy now gt whele buy now gt well buy now gt we ll buy now LITERALLY TH REEEE PIECES OF HARD EVIDENCE THAT CONFIRMS ZNGA WILL SOON GET IN THESE CONTRACTS NOW IT S A CHEAP AF WEEKLY SO I KNOW YALL CAN BUY IT this is not financial advice TL DR ZNGA 10 5 10C 1 22 21 lt look here edited for more 
968,kvzv2z,,1610483039,/r/wallstreetbets/comments/kvzv2z/you_chose_to_go_to_the_moon_or_stay_right_here/,1,You chose to go to the moon or stay right here NGA vs GME hint one of them is obsolete, deleted 
969,kvzv5n,t2_p9y3hes,1610483046,/r/wallstreetbets/comments/kvzv5n/is_it_too_late_to_invest_in_renewable_energy/,1,Is it too late to invest in renewable energy stocks , removed 
970,kvzvf0,t2_98nxwgah,1610483068,/r/wallstreetbets/comments/kvzvf0/update_most_trending_reddit_stocks_dashboard/,1,Update Most Trending Reddit Stocks Dashboard , removed 
971,kvzxyh,t2_5kq2d5c2,1610483276,/r/wallstreetbets/comments/kvzxyh/why_is_nobody_paying_attention_to_amc/,1,Why is NOBODY paying attention to AMC , removed 
972,kvzyia,,1610483323,/r/wallstreetbets/comments/kvzyia/i_love_shorting_antiamerican_ps_someone_get_ipoc/,1,I love shorting Anti American P S someone get IPOC a fucking wheelchair , deleted 
973,kw002i,t2_5kq2d5c2,1610483449,/r/wallstreetbets/comments/kw002i/dont_miss_the_eyyy_emm_see_moon_mission/,0,Don t miss the EYYY EMM SEE MOON MISSION ,Everyone is too obsessed with GME and TSLA Don t get me wrong I ve made good off both but you retards are too close sighted Remember when GME was trading at 2 57 I know you wish you bought then Well guess fucking what eyyy em see bottomed out at 1 97 last week and has been in a consistent uptrend since Looking at the technicals there is VERY strong support at 1 91 with MACD curling on the daily Same scenario for the weekly and monthly charts see weekly attached On top of that institutions like MORGAN STANLEY are now in on it Smart money bought the bottom Don t miss this easy reversal Positions only shares in at 2 27 just buy shares you retards and thank me in a few months amp x200B fyi eyyy emm see is a banned ticker so had to beat the system Edit in terms of the bankruptcy argument they would have filed already Recent offering and ceo buying millions of worth of shares disproves this theory Any news will send this fucker to Mars Edit 2 are you really this incompetent EYY EM SEE Sound it out There s your ticker Edit 3 MOVIE THEATERS FOR FUCKS SAKE SOUND IT OUT
974,kw00iu,t2_83sg2pu2,1610483485,/r/wallstreetbets/comments/kw00iu/i_love_shorting_antiamerican_ps_someone_get_clov/,12,I love shorting Anti American P S someone get CLOV a fucking wheelchair ,
975,kw00lb,t2_wl2nx,1610483490,/r/wallstreetbets/comments/kw00lb/all_aboard_lion_electric_why_nga_is_a_distant_1/,8,All aboard Lion Electric Why NGA is a distant 1 in its market UPDATE Up 30 since last post,Was reading a day Now week old post about NGA that talked about some pretty bland stuff and realized nobody understands the company and why it s in a better position than its competitors One thing and the largest thing the OP failed to mention and the reason I bought into this stock with a good of my portfolio is that Amazon purchased a good bit of LION and reserved a of lions capacity for its bus order to AMZN through the next couple years You might think ok well it s just Amazon seeing if they can poach another good company in its infancy but not really This is a strategic cost savings plan for them that allows them to purchase a company and expense that money later Think integration Why Look into Amazon s bus contracts in major cities Almost nobody knows that Amazon spends 8 figures a year in many of the cities it operates in to bus its employees to and from its FCs at no cost to the employees Sometimes they do it because it s agreed to for tax exemptions other times because they re nice and rich like that By purchasing EVs they ll get sooo many more benefits though With equity in the company they re buying from a of profit flows back to them Emissions credits to offset their FC costs and they can expense all the bus purchases and operating coats to offset FC income effectively enabling them to offset the purchase of the equity in LION through FC expense Not to mention the major capital injection to an early moving EV company once cities see these Lion busses everywhere they ll be like hey great idea and now because Lion is already producing at scale to support the AMZN order their busses are competitively priced and they can break even or make money on the product while other companies are operating at a loss They also make some real nice lookin automated garbage trucks you ll see popping up in all those big liberal cities trying to go net zero in 10 years It s a brilliant deal for them when you consider everything And it enables LION to scale up risk free TLDR buy NGA for zero risk tendies 
976,kw00rj,,1610483506,/r/wallstreetbets/comments/kw00rj/my_stepfather_told_me_yesterday_he_had_amzn_at_14/,1,My stepfather told me yesterday he had AMZN at 14 and sold it in 2002, deleted 
977,kw023n,t2_f5v00,1610483614,/r/wallstreetbets/comments/kw023n/options_not_available/,1,Options not available, removed 
978,kw035k,,1610483699,/r/wallstreetbets/comments/kw035k/mainly_uber_and_that_one_fubo_call_going_for_25k/,3,Mainly Uber and that one FUBO call Going for 25k cuz I just got PDT restricted yesterday YOLO, deleted 
979,kw055v,t2_52nx86d1,1610483864,/r/wallstreetbets/comments/kw055v/fuck_marry_kill_stonks_edition/,1,Fuck Marry Kill Stonks Edition, removed 
980,kw05nf,t2_99ndwy4i,1610483903,/r/wallstreetbets/comments/kw05nf/ballard_power_to_the_fking_moon/,1,Ballard Power to the fking moon ,
981,kw05rz,t2_12hfd5,1610483914,/r/wallstreetbets/comments/kw05rz/melvin_capital_gme_put_positions/,9,Melvin Capital GME Put Positions,Grabbed this data as part of my review and thought I d throw it here for easy digestion This is showing Melvin Capital s put positions against GME logged on their 13F over time To be clear this is not showing their short position as that is not required to be filled in the 13F amp x200B https preview redd it omlrjtrjpya61 png width 249 amp format png amp auto webp amp s ef8a865941eb819f965cff06cdc614064641f4a8
982,kw05tp,t2_8pfoigjk,1610483918,/r/wallstreetbets/comments/kw05tp/the_elephant_in_the_room_cciv/,1,The elephant in the room CCIV , removed 
983,kw06mq,t2_8l10fz0d,1610483982,/r/wallstreetbets/comments/kw06mq/doordash_puts/,8,Doordash Puts,This is the perfect time to buy doordash puts It s at an all time high because of rumors it ll go to Japan Like I give a flying fuck of a shit fuck It s way overvalued and that s an expensive endeavor for a company who isn t making shit for money BUY THE PUTS AND THANK ME LATER if you need DD for this go to the ROPE Positions 10 160P 2 26 2 190P 2 5 I didn t know what flair to give this post cuz shitpost isn t there so I named it a DD close enough 
984,kw06og,t2_2ruspovn,1610483987,/r/wallstreetbets/comments/kw06og/tempted_to_exercise_this_in_february_and_ride_plug/,8,Tempted to exercise this in February and ride PLUG ,
985,kw06t6,t2_176s1z,1610483998,/r/wallstreetbets/comments/kw06t6/amd_keynote_in_a_nutshell/,1,AMD Keynote in a nutshell, removed 
986,kw07pk,,1610484073,/r/wallstreetbets/comments/kw07pk/when_to_buy_tesla_only_buy_when_it_starts_to_look/,1,When to buy Tesla only buy when it starts to look like a Bear You re welcome, deleted 
987,kw081u,t2_eukjv,1610484100,/r/wallstreetbets/comments/kw081u/yolod_on_uber_yesterday_bought_more_today_10k_on/,8,YOLO d on UBER yesterday Bought more today 10K on the day ,
988,kw09bi,t2_16vepyp,1610484204,/r/wallstreetbets/comments/kw09bi/woof_petco_ipo_this_thurs_114_opening_at_14_17/,1,WOOF Petco IPO this Thurs 1 14 Opening at 14 17, removed 
989,kw0as0,t2_8q0mmlkg,1610484327,/r/wallstreetbets/comments/kw0as0/when_to_buy_tesla_when_it_starts_to_look_like_a/,1,When to buy Tesla when it starts to look like a dancing Bear You re welcome,
990,kw0bar,t2_2dt8avyg,1610484372,/r/wallstreetbets/comments/kw0bar/shorting_twtr/,3,shorting TWTR,
991,kw0bny,t2_48vv0y9k,1610484404,/r/wallstreetbets/comments/kw0bny/vet_vermilion_energy/,1, VET Vermilion Energy, removed 
992,kw0bvl,,1610484422,/r/wallstreetbets/comments/kw0bvl/every_single_stock_i_own_is_in_the_green_but_dont/,1,Every single stock I own is in the green but don t worry with my supreme retardation I am still in the red EOD , deleted 
993,kw0cea,,1610484466,/r/wallstreetbets/comments/kw0cea/gme_float_questions/,1,GME Float Questions, deleted 
994,kw0cm9,t2_6g69n9y7,1610484484,/r/wallstreetbets/comments/kw0cm9/medallia_mdla_under_the_radar_tech_unicorn/,4,Medallia MDLA Under The Radar Tech Unicorn,I have been using Medallia through my work for survey analytics I asked my boss if it s ok to invest in them because I am aware of our existing contracts He said technically it s information that can be accessed via Medallia s website so there are no issues The tech behind them is very solid I know they have contracts locked in at a bunch of companies for the next several years and they will probably grow at a steady pace They went IPO back in 2019 at a ridiculous price while they were not profitable and thus it was snapped back into reality Now their EPS is basically at break even and they are trading at 37 with a 5B valuation I personally am not keen on investing in unprofitable tech companies so I like that they are not hemorrhaging money I might wait for a dip to buy in They have had a really good week so far and will probably correct a few dollars before going back up again Positions Shares at 32 54 cost basis and selling MDLA 50c 1 21 22 
995,kw0d1h,t2_pwduj,1610484519,/r/wallstreetbets/comments/kw0d1h/ipo_edge_icr_chat_cciv_churchill_capital_qa_live/,1,IPO Edge amp ICR chat CCIV Churchill Capital Q amp A live thread, removed 
