,postid,author,created_utc,permalink,score,title,selftext
0,kvfmgj,t2_99cwflic,1610409648,/r/wallstreetbets/comments/kvfmgj/peix/,1, PEIX, removed 
1,kvfn3a,t2_26k75u4f,1610409701,/r/wallstreetbets/comments/kvfn3a/wsbvotebot_log_for_jan_12_2021/,1,WSBVoteBot Log for Jan 12 2021,Every time a new submission is posted to wallstreetbets u wsbvotebot posts a comment that allows you to click and vote to remove that submission This is the log of volunteer moderators actions which you can vote to reverse Check the leaderboard https www reddit com r wallstreetbets wiki leaderboard to see who is doing the most to keep r wallstreetbets great User commentary as replies to the messages below are encouraged Report bugs to u zjz 
2,kvfo1s,t2_9s09fap8,1610409783,/r/wallstreetbets/comments/kvfo1s/xom_call/,1,XOM CALL, removed 
3,kvfpgl,t2_12o7k5kq,1610409906,/r/wallstreetbets/comments/kvfpgl/musk_what_a_retard/,1,Musk What a retard,
4,kvfpts,t2_1z2kijig,1610409941,/r/wallstreetbets/comments/kvfpts/this_sub_is_one_thing_only/,1,This sub is one thing only,
5,kvfpvv,t2_4z98yejd,1610409947,/r/wallstreetbets/comments/kvfpvv/pltr_price_target_raised_to_47_by_seeking_alpha/,1, PLTR price target raised to 47 by Seeking Alpha , removed 
6,kvfqs5,t2_282xav7c,1610410027,/r/wallstreetbets/comments/kvfqs5/its_the_best_i_could_do_this_year_boys/,1,It s the best I could do this year boys ,
7,kvfrnq,t2_36v97wgo,1610410103,/r/wallstreetbets/comments/kvfrnq/the_goat_is_streaming_right_meow_gme/,1,The GOAT is streaming right Meow GME , removed 
8,kvfsfh,t2_3u7yfmek,1610410171,/r/wallstreetbets/comments/kvfsfh/tesla_ai_day/,1,Tesla AI Day ,
9,kvfssl,t2_7eum7sxi,1610410205,/r/wallstreetbets/comments/kvfssl/dont_fuck_with_the_ccp/,1,Don t fuck with the CCP,
10,kvft3x,t2_62ph1q5q,1610410228,/r/wallstreetbets/comments/kvft3x/people_who_are_pro_tesla_upvote_and_others/,0,People who are pro tesla upvote and others downvote , removed 
11,kvftqm,t2_5xvdh7ug,1610410290,/r/wallstreetbets/comments/kvftqm/its_official_google_hates_chamath_palihapitiya/,1,It s Official Google hates Chamath Palihapitiya Serious IPOE DD inside ,Greetings As you are aware by now Chamwow has announced that his spac IPOE is set to merge with SoFi sometime in q1 sending shares to above 20 last week Today the IPOE s4 came out click here for the IPOE S 4 from today if you dare https www sec gov Archives edgar data 1818874 000110465921002757 tm211402 1 s4 htm From the filing the official address of IPOE is listed as 317 university avenue 200 in Palo Alto California While doing some DD today I did a google maps search to take a look at the official offices listed What I found is that the IPO E offices are what most our offices are An alleyway dumpster click here for google maps street view of 317 university avenue 200 https www google com maps place 317 University Ave 23200 Palo Alto CA 94301 37 4464512 122 1617424 3a 75y 128 08h 68 96t data 3m7 1e1 3m5 1sjIUjtqb baIutYeegesmjA 2e0 6s 2F 2Fgeo2 ggpht com 2Fmaps 2Fphotothumb 2Ffd 2Fv1 3Fbpb 3DChEKD3NlYXJjaC5nd3MtcHJvZBJKCjwJhZTluTm7j4ARxup9qnP4lIsaKAsQ04W4QhofGh0KFgoUChIJhZTluTm7j4ARfRa8E3hymqkSAzIwMAwqCg0AAAAAFQAAAAAaBAhWEFY 26gl 3DUS 7i13312 8i6656 4m13 1m7 3m6 1s0x808fbb39b9e59485 0x8b94f873aa7deac6 2s317 University Ave 23200 Palo Alto CA 94301 3b1 8m2 3d37 4463727 4d 122 1615529 3m4 1s0x808fbb39b9e59485 0x8b94f873aa7deac6 8m2 3d37 4463727 4d 122 1615529 amp x200B Processing img c8gv3emqmsa61 What this means is ALWAYS INVERSE GOOGLE AND BUY IPOE LEAPS JAN 22 IPOE LEAP CALLS 
12,kvfubc,t2_2gkczw62,1610410343,/r/wallstreetbets/comments/kvfubc/am_i_right/,1,Am I right ,
13,kvfwdx,t2_5xitxhic,1610410535,/r/wallstreetbets/comments/kvfwdx/not_really_a_yolo_but_seems_i_have_company_for/,1,Not really a YOLO but seems I have company for good or bad on taking a risk we have a nice quick strong uptick fingers crossed for all in similar position,
14,kvfxra,t2_36is2h39,1610410656,/r/wallstreetbets/comments/kvfxra/dont_fuck_with_the_ccp/,1,Don t fuck with the CCP,
15,kvfz0d,t2_36is2h39,1610410775,/r/wallstreetbets/comments/kvfz0d/dont_fuc_with_the_ccp/,1,Don t fuc with the CCP,
16,kvg00f,t2_36is2h39,1610410870,/r/wallstreetbets/comments/kvg00f/dont_fuc_with_the_ccp/,1,Don t fuc with the CCP,
17,kvg0uy,t2_36is2h39,1610410948,/r/wallstreetbets/comments/kvg0uy/dont_fuc_with_the_ccp/,1,Don t fuc with the CCP,
18,kvg16l,t2_36is2h39,1610410978,/r/wallstreetbets/comments/kvg16l/dont_fuc_with_the_ccp/,1,Don t fuc with the CCP,
19,kvg1l3,t2_4zk70orr,1610411010,/r/wallstreetbets/comments/kvg1l3/i_call_upon_my_fellow_brethren_to_look_into_esgc/,1,I call upon my fellow brethren to look into ESGC back story , removed 
20,kvg1m0,t2_36is2h39,1610411013,/r/wallstreetbets/comments/kvg1m0/dont_fuc_with_the_ccp/,1,Don t fuc with the CCP,
21,kvg1xk,t2_6yjs5cg4,1610411042,/r/wallstreetbets/comments/kvg1xk/now_theyre_just_belittling_us_long_avocados_tho/,1,Now they re just belittling us long avocados tho ,
22,kvg2bu,t2_36is2h39,1610411081,/r/wallstreetbets/comments/kvg2bu/dont_fuc_with_the_ccp/,1,Don t fuc with the CCP,
23,kvg2k6,t2_72z8yt57,1610411104,/r/wallstreetbets/comments/kvg2k6/two_options_with_the_same_price/,1,Two options with the same price , removed 
24,kvg2ml,t2_36is2h39,1610411111,/r/wallstreetbets/comments/kvg2ml/dont_fuc_with_the_ccp/,1,Don t fuc with the CCP,
25,kvg39o,t2_dc861,1610411173,/r/wallstreetbets/comments/kvg39o/did_anyone_else_buy_the_tesla_dip/,1,Did anyone else buy the TESLA dip , TESLA longs https i imgur com XfHwbNO jpg I shorted this bitch on Friday and feel like that s a decent move down enough to entice some buyer s to take it back up 850 Previous gains from SHORTS monday closes https i imgur com U0mwGaZ jpg monday closes cont https i imgur com ZbYdqhH jpg monday closes cont 3 https i imgur com IjkIWUm jpg Last week s closing trades were bullish LONGS last week s closes https i imgur com rviOs3p png Take care and happy trading everyone 
26,kvg5hx,t2_8l0cb,1610411385,/r/wallstreetbets/comments/kvg5hx/whats_going_on_with_mt_on_rh_not_supported/,1,What s going on with MT on RH Not supported , removed 
27,kvg60p,t2_sn0jf,1610411429,/r/wallstreetbets/comments/kvg60p/mt_no_longer_available_on_robinhood/,1,MT no longer available on Robinhood ,
28,kvg75b,t2_12o7k5kq,1610411535,/r/wallstreetbets/comments/kvg75b/the_great_capitol_riot_dip_of_2021_colorized/,1,The great Capitol riot dip of 2021 colorized ,
29,kvg8cd,t2_36is2h39,1610411648,/r/wallstreetbets/comments/kvg8cd/dont_fuk_with_the_ccp/,1,Don t fu k with the CCP,
30,kvg8ks,t2_36is2h39,1610411666,/r/wallstreetbets/comments/kvg8ks/dont_fuk_with_the_ccp/,1,Don t fu k with the CCP,
31,kvg93t,t2_7kcvzufk,1610411711,/r/wallstreetbets/comments/kvg93t/buy_alibaba/,1,Buy Alibaba,It was a buy at 300 it s a steal at 230 Only reason it s down is political bs though China would never let it die The 1 thing I look for in a company is monopolistic business practices and it doesn t get much better than baba Set to explode with China s massive population Africa Asia and Europe If you don t want to lose money but also want to put it in something before the great inflation then BABA or FB at the 25X level is that something 
32,kvg99y,t2_38tyf6r6,1610411726,/r/wallstreetbets/comments/kvg99y/i_do_stocks_top_is_in/,1, I do Stocks Top is in , amp x200B Processing video wjwmype8rsa61 
33,kvg9dp,t2_67yzmwes,1610411736,/r/wallstreetbets/comments/kvg9dp/signal_to_the_moon/,1,Signal to the moon,I can imagine that Signal will be implemented into the tesla company This stock is still cheap with its 280 Million market cap What is 280 Million Nothing I can see this going up to 10 20bn when elon buys the company This company uses this unique signal technology and this is perfect for tesla network on autonomous driving This company is gold and their technology can be used for several products Acoustic Sound Vibration Distance Displacement Flow Navigation Speed Acceleration Radiation Subatomic Particles Angle Rotation Electrical Electro Magnetic Level Density Position Pressure Force Photoelectric Sensors Thermal Temperature Heat Chemical Environment Weather Magnetic Radio Optical Light Imaging Proximity Presence This stock will truly go to the moon 
34,kvg9sk,t2_9n6c5htd,1610411776,/r/wallstreetbets/comments/kvg9sk/35_monthsseems_sustainable/,1,3 5 months seems sustainable ,
35,kvg9xg,t2_7q4d4qc4,1610411789,/r/wallstreetbets/comments/kvg9xg/down_with_the_man/,1,Down with the man,
36,kvgb3y,t2_4ptj87oc,1610411899,/r/wallstreetbets/comments/kvgb3y/its_rigged_its_all_rigged_always_has_been/,1,It s rigged It s all rigged Always has been ,
37,kvgb5p,t2_quaxgma,1610411903,/r/wallstreetbets/comments/kvgb5p/amzn_115_3150c_129_3200c/,1,AMZN 1 15 3150c 1 29 3200c,
38,kvgdlc,t2_4ptj87oc,1610412132,/r/wallstreetbets/comments/kvgdlc/its_rigged_its_all_rigged_always_has_been/,1,It s rigged It s all rigged Always has been ,
39,kvgdsm,t2_7sh78lsr,1610412151,/r/wallstreetbets/comments/kvgdsm/spy_options_almost_got_me_out_the_hole_and_some/,1,SPY options almost got me out the HOLE and some good Penny Stocks still in a hole sec pic down,
40,kvgehh,t2_uhae2iq,1610412215,/r/wallstreetbets/comments/kvgehh/sigl_rose_over_400_today/,1,SIGL rose over 400 today ,
41,kvgenj,t2_10x7vki9,1610412230,/r/wallstreetbets/comments/kvgenj/kmi_2021s_logistic_play_on_commodities_natural/,1, KMI 2021 s logistic play on commodities Natural Gas Crude Oil Coking Coal and STEEL MT NUE SCHN CLF X VALE F amp TSLA and the list goes on , removed 
42,kvgf1g,t2_9gyx51g9,1610412268,/r/wallstreetbets/comments/kvgf1g/should_i_yolo_on_margin/,1,Should I Yolo on margin ,
43,kvgf4y,t2_uhae2iq,1610412276,/r/wallstreetbets/comments/kvgf4y/sigl_rose_over_400_today/,1,SIGL rose over 400 today ,
44,kvgggv,t2_cdigt,1610412401,/r/wallstreetbets/comments/kvgggv/petition_to_rebrand_robinhood_logo/,1,Petition to rebrand Robinhood logo,
45,kvggrv,t2_6mersu69,1610412429,/r/wallstreetbets/comments/kvggrv/work_slack_to_become_ucaas_platform_competing/,1, WORK Slack to become UCaaS platform competing with zoom I ve earned my username ,
46,kvgis0,t2_7u4bn,1610412616,/r/wallstreetbets/comments/kvgis0/if_youre_still_on_the_fence_with_crypto_this/,1,If you re still on the fence with crypto this really helped explain everything for me Hope it helps ,
47,kvgisr,,1610412617,/r/wallstreetbets/comments/kvgisr/buy_the_top_bro_dont_miss_the_wave/,1,Buy the top bro Don t miss the wave , deleted 
48,kvgj63,t2_16bvg2,1610412653,/r/wallstreetbets/comments/kvgj63/new_to_investing_i_have_100_tendies_what_should_i/,1,New to investing I have 100 tendies What should I invest in , removed 
49,kvgjt0,t2_x72m2,1610412715,/r/wallstreetbets/comments/kvgjt0/buy_the_top_bro_dont_be_a_dunce/,1,Buy the top bro Don t be a dunce ,
50,kvglhk,t2_7uqii3qu,1610412868,/r/wallstreetbets/comments/kvglhk/new_employee_death_at_pinduoduo_prompts_calls_for/,1,New employee death at Pinduoduo prompts calls for boycott,
51,kvgngp,t2_kfn7u,1610413045,/r/wallstreetbets/comments/kvgngp/my_son_6_keeps_seeing_on_my_screen_you_autists_so/,1,My son 6 keeps seeing on my screen you AUTISTS so he made me this Should I buy him TSLA stock as a reward for being a GUD BOI,
52,kvgoz7,t2_z6ium,1610413190,/r/wallstreetbets/comments/kvgoz7/can_someone_make_a_correlation_of_the_amount_of/,1,Can someone make a correlation of the amount of times WSB circle jerks a stock about going to the moon compared to where those stocks are at today ,It would be interesting to see how often the retard instincts in this sub are correct Id love to see a correlation of when the circle jerk began to where the stock is 365 days later It would make my decision making that much easier if I had some evidence to back up the idea that if WSB is willing to slut themselves out over this stock I should do the same 
53,kvgpfj,t2_jqstpmc,1610413221,/r/wallstreetbets/comments/kvgpfj/projection_view_what_do_you_think_of_vygr/,1, Projection view What do you think of VYGR , removed 
54,kvgrc4,t2_3k1q3ogk,1610413394,/r/wallstreetbets/comments/kvgrc4/i_got_tsla_calls_today/,1,I GOT TSLA CALLS TODAY ,
55,kvgs5u,t2_6lwatnml,1610413468,/r/wallstreetbets/comments/kvgs5u/you_degenerates_are_poosies/,1,You degenerates are poosies ,You cucks wanna play on stonks and options on stonks but evidently your wife s boyfriend must have your balls Don t you fuckem fools even know about futures No PDT rules better tax treatment for all the big brain autists trying to keep creepy uncle sam from touching your tendies and futures usually have options on them if you want to yolo your mom s saving A ES contract currently has a value of 190 000 and day trade margin on es depending on the brokerages you use can be around 500 that means 5 contracts using 2500 in margin and you a little under 1 million worth of futures in your filthy cuckold hands They even have mini and micro futures for those with little dick accounts who can t afford to be big baller shot callers habibi Tastyworks and IBRK and a few more brokerages even have something called the small exchange futures which are even smaller contracts yooooo So what are you poosies waiting for Come down to tendie town with your boi a pimp named 
56,kvgsea,t2_o4hx2,1610413491,/r/wallstreetbets/comments/kvgsea/it_aint_much_but_its_honest_work/,1,It ain t much but it s honest work,
57,kvgtxy,t2_5ofkn6bc,1610413637,/r/wallstreetbets/comments/kvgtxy/setting_limit_orders_for_potential_big_gainers/,1,Setting Limit Orders For Potential Big Gainers Fidelity ,I have a bunch of SPACs units and warrants in Fidelity at decent prices Units at lt 12 I want to put in Sell Limit Orders to make sure I catch any big spikes up in the Units e g Sell Limit at 18 When I try this on Fidelity I get an error message Limit price can be no more than 50 away from the last trade These SPACS are in my Fidelity 401 k Brokerage Link account so unfortunately I cannot transfer to another broker It seems like Spot Limit won t work for my case and Trailing Stop Limits kinda work but also isn t optimal I guess the best thing is to set a ToS alert and hope I can enter in a trade quickly enough My main non retirement account is on Ameritrade and the lovely people at Ameritrade have no issue with whatever limit price I want TSLA 100 000 
58,kvgucd,t2_5ui5uyr6,1610413675,/r/wallstreetbets/comments/kvgucd/college_football_playoff_national_championship/,1,COLLEGE FOOTBALL PLAYOFF NATIONAL CHAMPIONSHIP GAME LIVE STREAM,COLLEGE FOOTBALL PLAYOFF NATIONAL CHAMPIONSHIP GAME LIVE STREAM COLLEGE FOOTBALL PLAYOFF NATIONAL CHAMPIONSHIP GAME LIVE STREAM COLLEGE FOOTBALL PLAYOFF NATIONAL CHAMPIONSHIP GAME LIVE STREAM COLLEGE FOOTBALL PLAYOFF NATIONAL CHAMPIONSHIP GAME LIVE STREAM COLLEGE FOOTBALL PLAYOFF NATIONAL CHAMPIONSHIP GAME LIVE STREAM
59,kvgv0x,t2_94x2viin,1610413734,/r/wallstreetbets/comments/kvgv0x/always_follow_the_darkpool_buying_up_vale_calls/,1,Always follow the DarkPool buying up Vale calls ,
60,kvgw54,t2_8bj9txg4,1610413841,/r/wallstreetbets/comments/kvgw54/nio/,1,NIO, removed 
61,kvgx4s,t2_5zesd4h3,1610413942,/r/wallstreetbets/comments/kvgx4s/should_be_a_good_week_for_these_babies_tried_to/,1,Should be a good week for these babies Tried to tell you retards since 1 4 CRON ,
62,kvgx7q,t2_9s1cidxx,1610413948,/r/wallstreetbets/comments/kvgx7q/first_options_trade/,1,First options trade , removed 
63,kvgxiy,t2_3u6dzxum,1610413975,/r/wallstreetbets/comments/kvgxiy/with_a_whole_bunch_of_big_stocks_falling_today/,1,With a whole bunch of big stocks falling today if when would you buy into Tesla ,
64,kvgzoh,t2_12gcbf,1610414181,/r/wallstreetbets/comments/kvgzoh/acb_upgrade_by_vivien_azer_pt_1600/,1, ACB upgrade by Vivien Azer PT 16 00,
65,kvgzqq,t2_4rlhtpbz,1610414188,/r/wallstreetbets/comments/kvgzqq/some_baby_loss_porn_for_you_all/,1,Some Baby Loss Porn for you all,
66,kvh0x2,t2_12gcbf,1610414301,/r/wallstreetbets/comments/kvh0x2/acb_upgrade_by_vivien_azer_pt_1600/,1, ACB upgrade by Vivien Azer PT 16 00, amp x200B https preview redd it 5pr3retyysa61 jpg width 1286 amp format pjpg amp auto webp amp s 9d0ffd1bbcdd371ee0beabf584e33a5069f31ce6
67,kvh18s,t2_4uqqvoyi,1610414332,/r/wallstreetbets/comments/kvh18s/i_felt_personally_attacked_when_i_opened_up/,1,i felt personally attacked when i opened up robinhood today,
68,kvh1s1,t2_elyn6,1610414383,/r/wallstreetbets/comments/kvh1s1/hi_i_want_to_be_a_degenerate_and_spend_all_my/,1,Hi I want to be a degenerate and spend all my student loans on Mind Medicine but I dont know where how to buy since it s not on robinhood , removed 
69,kvh3g9,t2_3ld7cnef,1610414536,/r/wallstreetbets/comments/kvh3g9/hey/,1,Hey, removed 
70,kvh3k7,t2_8hsitns3,1610414546,/r/wallstreetbets/comments/kvh3k7/sign_from_the_pltr_gods/,1,Sign from the PLTR gods ,
71,kvh4j7,t2_734hhpsn,1610414639,/r/wallstreetbets/comments/kvh4j7/how_will_this_steelers_pack_affect_the_stock/,1,How will this Steelers pack affect the stock market and economy I m new to this so idk, removed 
72,kvh5c2,t2_6lo8rl9x,1610414720,/r/wallstreetbets/comments/kvh5c2/for_the_slow_retards_time_to_ask_your_wifes/,1,For the slow retards time to ask your wife s boyfriend access to your life savings and hop on the PLTR spaceship before we take off ,
73,kvh680,t2_87buwj2p,1610414807,/r/wallstreetbets/comments/kvh680/ryan_cohen_pulling_out_from_gme_icr_was_brilliant/,1,Ryan Cohen pulling out from GME ICR was brilliant, removed 
74,kvh6he,t2_1f6vgouj,1610414834,/r/wallstreetbets/comments/kvh6he/missed_out_on_some_pussy_but_she_dont_know_we/,1,Missed out on some pussy but she don t know we gonna be GME millionaires soon ,
75,kvh6pk,t2_49nf8rko,1610414855,/r/wallstreetbets/comments/kvh6pk/so_if_chinese_tariffs_are_lifted_by_the_biden/,1,So if Chinese tariffs are lifted by the Biden administration what do you invest in immediately , removed 
76,kvh8lg,t2_5hjl6l5b,1610415035,/r/wallstreetbets/comments/kvh8lg/uso/,1,USO , removed 
77,kvh91t,t2_7nkdqzi9,1610415083,/r/wallstreetbets/comments/kvh91t/dont_shoot_the_messenger_if_you_had_big_gains_in/,1,Don t shoot the messenger If you had big gains in 2002 you must pay estimate taxes to Uncle Sam to avoid penalties Check if you had to do this,
78,kvh9qt,t2_4rwoe,1610415151,/r/wallstreetbets/comments/kvh9qt/gme_fuckery_cant_place_a_limit_order_graphic/,1,GME Fuckery Can t place a limit order Graphic Content Warning RH account ,
79,kvhadr,t2_7nkdqzi9,1610415216,/r/wallstreetbets/comments/kvhadr/dont_shoot_the_messenger_if_you_had_big_gains_in/,1,Don t shoot the messenger If you had big gains in 2002 you must pay estimate taxes to Uncle Sam to avoid penalties Check if you had to do this,
80,kvhav9,t2_6j4g54hr,1610415256,/r/wallstreetbets/comments/kvhav9/recap_of_jpows_actions_in_2020/,1,Recap of JPow s Actions in 2020,
81,kvhbvk,t2_7x12u8jd,1610415355,/r/wallstreetbets/comments/kvhbvk/top_stocks_team_into_2021/,1,Top stocks team into 2021, removed 
82,kvhc46,t2_2wt9opyj,1610415376,/r/wallstreetbets/comments/kvhc46/ufo_gang/,1,UFO Gang , removed 
83,kvhcv3,t2_2wt9opyj,1610415444,/r/wallstreetbets/comments/kvhcv3/ufo_gang/,1,UFO Gang , removed 
84,kvhcvj,t2_9bg8boam,1610415445,/r/wallstreetbets/comments/kvhcvj/anybody_loading_up_on_cciv_with_the_spac/,1,Anybody loading up on cciv with the spac conversion to lucid motors , removed 
85,kvhdmp,t2_1hucfzkp,1610415512,/r/wallstreetbets/comments/kvhdmp/im_putting_10k_on_gme_wish_me_luck/,1,I m putting 10k on GME Wish me luck , removed 
86,kvhed6,t2_2wt9opyj,1610415588,/r/wallstreetbets/comments/kvhed6/ufo_gang/,1,UFO Gang , removed 
87,kvheo5,t2_7478472n,1610415618,/r/wallstreetbets/comments/kvheo5/will_this_print_all_in_on_mrna_vaccine_paper_hands/,1,Will this print All in on mrna vaccine Paper hands , removed 
88,kvhgcv,t2_7j7o2muv,1610415782,/r/wallstreetbets/comments/kvhgcv/help/,1,Help , removed 
89,kvhhef,t2_1691lm,1610415880,/r/wallstreetbets/comments/kvhhef/lucid_motors_looking_to_go_public_via_spac/,1,Lucid Motors looking to go public via SPAC, removed 
90,kvhhos,t2_98hyfwhj,1610415910,/r/wallstreetbets/comments/kvhhos/january_27_840_tsla_calls/,1,January 27 840 TSLA Calls , removed 
91,kvhi9s,t2_1f6vgouj,1610415966,/r/wallstreetbets/comments/kvhi9s/gme_kfc_chicken_tender_basket30_eow/,1,GME KFC chicken tender basket 30 EOW,I just went to my local GameStop I noticed they give long receipts see I noticed something because I went to kfc earlier and I kept the receipt from the chicken tender basket I ordered After looking around my house I found a ruler and measured the length and width of the receipts and found they were exactly the same size which only leads me to believe is that GameStop and kfc work together to give us chicken tender baskets and for us to get more chicken tenders we need to buy more GME TLDR chicken tender basket from kfc GME 11 19 30C 563 shares
92,kvhid5,t2_7o58z,1610415976,/r/wallstreetbets/comments/kvhid5/me_im_a_swing_trader/,1,Me I m a swing trader ,
93,kvhizc,t2_8sqry731,1610416036,/r/wallstreetbets/comments/kvhizc/can_someone_please_explain_to_me_what_happened_to/,1,Can someone please explain to me what happened to SPXS yesterday I think I have more than autism, removed 
94,kvhkq8,t2_5r8d7ad6,1610416204,/r/wallstreetbets/comments/kvhkq8/whats_happen_with_nvidia_though_i_just_bought_it/,1,What s happen with Nvidia though I just bought it 2 days ago LoL Currently in vacation Nvidia gave me a surprise LoL,
95,kvhl6y,t2_36is2h39,1610416250,/r/wallstreetbets/comments/kvhl6y/dont_fuk_with_the_ccp/,1,Don t fuk with the CCP,
96,kvhmn5,t2_5oxf1y8w,1610416393,/r/wallstreetbets/comments/kvhmn5/are_we_clowns_do_we_amuse_them/,1,Are we clowns do we amuse them ,
97,kvhmqg,t2_7a86dis1,1610416401,/r/wallstreetbets/comments/kvhmqg/i_nominate_josh_brown/,1,I nominate Josh Brown ,TLDR I want to see more of Josh Brown on CNBC he might not like us or agree with us but recognizes we are a valid economical unit Anybody watching CNBC has undoubtedly picked up on the not so thinly veiled animosity toward young traders that comes from a few well mostly one that isn t so chill about it of the hosts Sometimes it can be subtle like when my niece rolls her eyes and I just wish my sister would reach out to quickly smack her More often than not though it s a little more antagonistic derogatory and inflammatory Now it s tv and we all know how entirely scripted phony and manipulative it is but still I need something on to escape the minutia That said do I want to feel that derision Do I want to watch a channel that clearly thinks I am part of some lesser group Do I want to support their advertisers No no and no I watch about 9 hours per day during work but lately I switch channels at the insults I d rather watch Comedy Central than get pissed at some host who thinks I m a joke Enter Downtown Josh Brown He was in studio today and spoke like he wanted to keep the seat Personally I m not young but if I were choosing a group it would be this group of young traders recklessly chasing 10x gains He spoke with more respect than others Like he might not like us or agree with us but he recognizes the collective force we have become I like the way he talks and I want him on my screen more frequently while I m working It wasn t just today either he s good 
98,kvhn6j,t2_5985ggb,1610416446,/r/wallstreetbets/comments/kvhn6j/you_only_get_a_couple_chances_to_be_epic/,1,You only get a couple chances to be epic ,
99,kvhnsl,t2_6j4g54hr,1610416507,/r/wallstreetbets/comments/kvhnsl/recap_of_jpows_heroic_actions_during_2020/,1,Recap of JPow s Heroic Actions during 2020,
100,kvhnsl,t2_6j4g54hr,1610416507,/r/wallstreetbets/comments/kvhnsl/recap_of_jpows_heroic_actions_during_2020/,1,Recap of JPow s Heroic Actions during 2020,
101,kvhntp,t2_7cmn4,1610416510,/r/wallstreetbets/comments/kvhntp/steel_tariffs_and_clf/,1,Steel tariffs and CLF,AISI and other steel interest groups are calling for renewed tariffs Some worry about the elimination of Tariffs and there s an Interesting history of CLF share price during the Bush tariffs of 3 2002 12 03 CLF wasn t yet a steel producer just a huge part of the supply chain who had mills as customers Look at Yahoo Finance historical prices for CLF during that period Note the amount of speculation about oversupply as Bush lifted the tariffs Then look at how CLF performed once they were eliminated Turned out to be the start of a multi year and parabolic run Look at X STLD NUE and other producers to see how they did during that period History has demonstrated that tariffs and US steel related equity prices don t have a negative correlation 
102,kvho1q,t2_4k0lo371,1610416533,/r/wallstreetbets/comments/kvho1q/is_the_meteoric_rise_of_nio_just_the_beginning/,1,Is the Meteoric Rise of NIO Just the beginning , removed 
103,kvhpd3,t2_6h6z7iam,1610416662,/r/wallstreetbets/comments/kvhpd3/whichever_ticker_symbol_elon_musk_tweets_we_must/,1,WHICHEVER TICKER SYMBOL ELON MUSK TWEETS WE MUST BUY IT , removed 
104,kvhqky,t2_9tnyt,1610416782,/r/wallstreetbets/comments/kvhqky/which_one_of_you_shitbirds_did_this/,1,Which one of you shitbirds did this ,
105,kvhqx3,t2_5akqkcz5,1610416814,/r/wallstreetbets/comments/kvhqx3/2012_blackout_4_loko_srpt/,1,2012 blackout 4 Loko SRPT,
106,kvhsb1,t2_7uqii3qu,1610416943,/r/wallstreetbets/comments/kvhsb1/paypal_becomes_chinas_first_thirdparty_payment/,1,PayPal Becomes China s First Third Party Payment Platform With 100 Foreign Ownership,
107,kvhtrs,t2_21xkrl2w,1610417081,/r/wallstreetbets/comments/kvhtrs/elon_musk_is_now_worth_208_billion_you_want_to/,1,Elon Musk is now worth 208 billion You want to know how he did it He skipped 34 67 billion lattes It s that easy Also please pray for me this week Papa Musk we need you ,
