,postid,author,created_utc,permalink,score,title,selftext
87,kopmz9,t2_47gs650v,1609557465,/r/wallstreetbets/comments/kopmz9/broke_shortseller_tesla_is_no_longer_a_growth/,1,Broke Short Seller Tesla is no longer a growth story it s a nearly profitless stock promotion for idiots , https www valuewalk com teslas figure for q4 deliveries isnt production constrained https www valuewalk com teslas figure for q4 deliveries isnt production constrained gt 1 Tesla has no moat of any kind i e nothing meaningfully proprietary in terms of electric car technology while existing automakers unlike Tesla have a decades long experience moat of knowing how to mass produce distribute and service high quality cars consistently and profitably as well as the ability to subsidize losses on electric cars with profits from their conventional cars gt gt 2 Excluding sunsetting emission credit sales and adjusted for its fraudulently low warranty reserve see below in 2020 Tesla will again lose money as it has every year in its 17 year existence gt gt 3 Unit demand for Tesla s cars is only increasing via continual price cutting gt gt 4 Elon Musk is a pathological liar who under the terms of his SEC settlement cannot deny having committed securities fraud https www plainsite org realitycheck tsla pdf amp x200B gt Nothing is more amusing than seeing this giant stock promotion of a company try to perpetuate the illusion of being supply constrained by continuing to add capacity expanding its Chinese factory while breaking ground on new factories in Texas and Germany in order to desperately try to maintain an image of limitless demand while it continually slashes prices just to utilize far less than its existing capacity Tesla s plan is now obvious keep slashing prices to move as much volume as possible while using the world s most illicitly creative accounting to maintain razor thin profitability But what s the end game If Tesla stops cutting prices volume will collapse Tesla is no longer a growth story it s a nearly profitless stock promotion for idiots Wooo that s one man man who lost probably hundreds of thousands to millions betting against the inflated stock market supported by the printer powell and Tesla S amp P inclusion hype before it got in He should have invested in literal Tesla shorts and sold them back on the online market he would have at least be in the green with some profit lol I mean I suppose he s correct about the bubble but the injections aren t going to end until around 2022 when the zero interest rate suddenly improves for banks bonds and such so sadly for him the riding keeps tiding Those idiots he speaks of like it or not made 100x more money than most people in the market including people on this sub 
88,kopn17,t2_85owgjli,1609557472,/r/wallstreetbets/comments/kopn17/palantir_inc_mentioned_in_wsj_article_two_hours/,1,Palantir Inc mentioned in WSJ Article two hours ago,I hope this lifts your spirits it s a very positive portent Avril Haines Mr Biden s selection for director of national intelligence has an extensive r sum that includes consulting work with national security data analysis company Palantir Technologies https www wsj com market data quotes PLTR Inc https www wsj com articles bidens pick for secretary of state took up consulting venture capital during trump administration disclosures show 11609458326 https www wsj com articles bidens pick for secretary of state took up consulting venture capital during trump administration disclosures show 11609458326 amp x200B Happy New Year Guys we will get through this 
89,kopn61,t2_3jnwrd3f,1609557486,/r/wallstreetbets/comments/kopn61/half_my_portfolio_red_like_rocket_pltr_these_are/,1,Half my portfolio red like rocket PLTR These are fine right Riiight ,
90,kopozn,t2_58a7sgnj,1609557686,/r/wallstreetbets/comments/kopozn/be_nice_lol/,1,Be nice lol, removed 
91,koppww,t2_5buq0599,1609557781,/r/wallstreetbets/comments/koppww/stimmy_has_been_delivered_happy_new_year/,1,Stimmy has been delivered Happy New year ,
92,kopqby,t2_5hrml4f1,1609557823,/r/wallstreetbets/comments/kopqby/funny_how_that_works/,1,Funny how that works,
93,kopr64,t2_69rgu8w2,1609557916,/r/wallstreetbets/comments/kopr64/hyliion_is_poised_to_take_the_reins_of_trucking/,1,Hyliion is poised to take the reins of trucking , removed 
94,kopthu,t2_13kxbx,1609558162,/r/wallstreetbets/comments/kopthu/important_question_about_dividends/,1,Important question about Dividends,Is it possible to invest in dividends and not be gay Ahahahahahha Dividends
95,kopw0h,t2_9ewd0lqm,1609558418,/r/wallstreetbets/comments/kopw0h/still_in_gme_but_dont_forget_about_doge/,1,Still in GME but don t forget about DOGE,
96,kopw6p,t2_2p1b50yr,1609558437,/r/wallstreetbets/comments/kopw6p/from_meme_to_dream_doge/,1,From meme to dream DOGE,
97,kopx4w,t2_42krbnmm,1609558536,/r/wallstreetbets/comments/kopx4w/retarded_gains_on_tsla_weeklies_sold_at_320_gain/,1,Retarded gains on TSLA weeklies Sold at 320 gain And then I bought some 1 8 720c I am a retarded gambler ,
98,kopxh8,t2_12o7k5kq,1609558572,/r/wallstreetbets/comments/kopxh8/pltr_at_a_40b_market_cap_is_a_steal/,1,PLTR at a 40B market cap is a steal,Most on here are trying to time a breakout with FD s Wait for momentum then buy some slightly OTM calls 4 6 weeks out preferably longer but I know that s against the rules here Or you can buy TSLA calls at 670B and 1400 P E not hating it ll probably go higher Let me know what you think 
99,kopxzi,t2_3b9a8k9k,1609558624,/r/wallstreetbets/comments/kopxzi/happy_new_year_my_fellow_degens/,1,Happy New Year my fellow degens,
100,kopxzi,t2_3b9a8k9k,1609558624,/r/wallstreetbets/comments/kopxzi/happy_new_year_my_fellow_degens/,1,Happy New Year my fellow degens,
101,kopysk,t2_59onyqsd,1609558706,/r/wallstreetbets/comments/kopysk/earnings_season_option_longs/,1,Earnings Season Option Longs,Here are some random tickers I know r wsb had their longs out since october What were they and how are they looking going into earnings amp x200B Here are some earnings dates coming up totally random bunch FCEL 1 08 1 14 Blackrock AMD 1 28 MA 1 28 AMZN 1 29 AAPL 1 29 CAT 1 29 humana 2 03 cern 2 0 seneca 2 03 CRSR 2 03 F 2 04 DIS 2 04 TWLO 2 04 SONOS 2 04 SNAP 2 04 PTON 2 04 STVI 2 05 TRNO 2 05 TWTR 2 09 CME 2 10 THS 2 10 CHGG 2 1 LYFT 2 10 NVDA 2 11 ROKU 2 12 UA 2 12 CRES 2 12 SHOP 2 12 SHAK 2 12 YETI 2 12 LSI 2 17 r wsb https www reddit com r wsb had all this shit done by october but which of your contracts are paying out say position and s
102,kopz5a,t2_3y3ei0jz,1609558744,/r/wallstreetbets/comments/kopz5a/dogecoin/,1,Dogecoin, removed 
103,kopzd8,t2_90ksuy9o,1609558764,/r/wallstreetbets/comments/kopzd8/all_in/,1,All in,
104,koq1gg,t2_1v6vlh2l,1609558985,/r/wallstreetbets/comments/koq1gg/awards_bad/,1,Awards bad , removed 
105,koq3ov,t2_1vpnmb6g,1609559212,/r/wallstreetbets/comments/koq3ov/2020_recap_total_gain_and_top_20_winning_and/,1,2020 re cap total gain and top 20 winning and losing trades ,
106,koq46n,t2_1g5bz2j9,1609559261,/r/wallstreetbets/comments/koq46n/calls_on_wmt/,1,Calls on WMT ,
107,koq5i6,t2_1vpnmb6g,1609559398,/r/wallstreetbets/comments/koq5i6/2020_recap_total_gains_and_top_20_winning_and/,1,2020 recap total gains and top 20 winning and losing trades Hope y all ended the year on the winning side ,
108,koq6k5,t2_z17bd,1609559508,/r/wallstreetbets/comments/koq6k5/dogecoin_to_mars/,1,DOGECOIN TO MARS,
109,koq8q7,t2_z17bd,1609559746,/r/wallstreetbets/comments/koq8q7/dogecoin_to_mars/,1,DOGECOIN TO MARS,
110,koq9ym,t2_509s5,1609559890,/r/wallstreetbets/comments/koq9ym/i_won_the_mega_millions_jackpot/,1,I won the Mega Millions jackpot ,Ya right it hasn t even gone off yet tonight How would you turn treehundymil into a u yungbillionaire I had a dream that i won tonight but it was nineteen ninety eight when the undertaker threw mankind off h ll in a cell and plummeted sixteen feet through an announcer s table calling u shittymorph WSB keeps it going 
111,koqafx,t2_2wb9etp4,1609559938,/r/wallstreetbets/comments/koqafx/my_first_tendies_of_2021_just_wanted_to_share/,1,My first tendies of 2021 just wanted to share them with you guys ,
112,koqchs,t2_4ehk8814,1609560145,/r/wallstreetbets/comments/koqchs/yolo_ideas/,1,YOLO IDEAS ,Hello fellow retards for the past couple months or so I ve invested in some boomer stocks and have been relatively safe fucking stupid however I did buy into some of that good shit like Palantir and Tesla pre split early on so I m not too angry about it I ve saved up earned a bit and now I have some cash I m well prepared to lose if shit goes down give me some good fucking yolo plays amp x200B Thank you in advance to WSB and those contributing to this forum this shit is so entertaining and tbh educational at times 
113,koqdbf,t2_10omqw,1609560226,/r/wallstreetbets/comments/koqdbf/my_gme_position_if_this_gets_awarded_to_oblivion/,1,My GME position If this gets awarded to oblivion then GME hits 100,
114,koqhxt,t2_43pxhu2b,1609560732,/r/wallstreetbets/comments/koqhxt/doge_to_the_moon/,1,DOGE TO THE MOON , removed 
115,koqidp,t2_6gjg0it7,1609560775,/r/wallstreetbets/comments/koqidp/i_sell_it_then_buy_more_if_it/,1,I sell it then buy more if it,
116,koqieb,t2_f5e367f,1609560777,/r/wallstreetbets/comments/koqieb/something_to_feed_your_confirmation_bias_on_nio/,1,Something to feed your confirmation bias on Nio,Nio s expansion to Europe has been discussed a lot Many expressed doubts that Europeans would buy a Chinese car given all the negative stereotypes From 2021 Germany introduced a CO2 tax 7c per liter and till 2025 they give 9000 Euros for purchasing a EV My main problem with German EVs is that they have an abysmal range VW promises something up to 220km I drove BMW i3 and whatever they promise there the truth is that it s around 170 km and the charging takes like 9 hours Why the hell do I need a car with such a range Nio offers a range up to 900 km Wow That s something to consider But what about the Chinese quality and as a potential German customer who got screwed over by the government s CO2 tax right on the New Year s day I decided to google what German reviews say on Nio ADAC praises Nio quality and price specifying that 70 of materials are from renowned producers like Bosch https www adac de rund ums fahrzeug autokatalog marken modelle auto nio es6 Another very positive review stating that it has some problems with being adjusted to the European standards and market but in general it s a good car for German roads and is much cheaper than a comparable Audi https www auto motor und sport de fahrbericht nio es6 guenstiger elektro suv Another generally positive review They point out that the battery is not suitable for a speed of over 120km h which is a big problem for Germany s autobahn as 120 km h is the annoying grandma speed here However other European countries have a speed limit so it might be less of a problem https www autobild de artikel nio es6 performance 2022 test preis deutschland reichweite technische daten elekrtro suv 17098037 html Tl dr German reviewers praise Nio for its price quality and driving experience The main disadvantage is that it is not fulfilling for some Europe specific demands However if Nio adapts to those requirements it will be a recommendable car Tl dr for retards Nio at the European market 
117,koqkcx,t2_4pjtnj3z,1609560991,/r/wallstreetbets/comments/koqkcx/dogecoin_to_the_moon/,1,Dogecoin to the moon,
118,koql2e,t2_3g46uset,1609561066,/r/wallstreetbets/comments/koql2e/buy_the/,1,Buy the,
119,koqlaq,t2_kben3co,1609561089,/r/wallstreetbets/comments/koqlaq/ah_yes_astrology_the_new_stock_market_strat_maren/,1,Ah yes Astrology the new stock market strat MAREN on TikTok,
120,koqoak,t2_9k52gghy,1609561416,/r/wallstreetbets/comments/koqoak/too_busy/,1,Too Busy , removed 
121,koqopk,t2_wsqhu,1609561459,/r/wallstreetbets/comments/koqopk/thanks_for_the_news_article_robinhood_definitely/,1,Thanks for the news article Robinhood Definitely going to help with my trading ,
122,koqp2o,t2_7t6p1y48,1609561502,/r/wallstreetbets/comments/koqp2o/i_dont_give_a_f/,1,I DON T GIVE A F ,
123,koqpwp,t2_wsqhu,1609561599,/r/wallstreetbets/comments/koqpwp/thanks_for_the_news_robinhood_definitely_going_to/,1,Thanks for the news Robinhood Definitely going to help with my trading ,
124,koqrb6,t2_7j38ttoi,1609561755,/r/wallstreetbets/comments/koqrb6/tsla_1200c_15_jan_2021/,1, TSLA 1200c 15 jan 2021 ,
125,koqrdu,t2_4uck7s4c,1609561763,/r/wallstreetbets/comments/koqrdu/i_think_my_wine_is_trying_to_tell_me_my_next_yolo/,1,I think my wine is trying to tell me my next YOLO on VDK,
126,koqrme,t2_3hcxqetw,1609561789,/r/wallstreetbets/comments/koqrme/which_one_are_you/,1,Which one are you ,
127,koqst1,t2_c68wj2d,1609561918,/r/wallstreetbets/comments/koqst1/me_seeing_dogecoin_trending_on_twitter/,0,Me seeing Dogecoin trending on Twitter,
128,koqtey,t2_2tlvuv7r,1609561985,/r/wallstreetbets/comments/koqtey/time_for_1_deutche_wienershnitzel_bank_puts/,1,TIME FOR 1 DEUTCHE WIENERSHNITZEL BANK PUTS 1 15 2021,
129,koqv3b,t2_12o7k5kq,1609562160,/r/wallstreetbets/comments/koqv3b/tiktokers_are_doing_the_doge_thing_again_should/,1,TikTokers are doing the DOGE thing again should end the same way as last time with bags ,
130,koqw9e,t2_wsqhu,1609562288,/r/wallstreetbets/comments/koqw9e/sound_investing_article_thank_you_robinhood/,1,Sound investing article Thank you Robinhood ,
131,koqzhq,t2_4fif2a1z,1609562636,/r/wallstreetbets/comments/koqzhq/promising_investments_in_the_renewable_energy/,1,Promising investments in the renewable energy space , removed 
132,kor11j,t2_12o7k5kq,1609562804,/r/wallstreetbets/comments/kor11j/tiktok_thots_can_pump_doge_70_in_a_day_and_we/,1,TikTok thots can pump DOGE 70 in a day and we can t even get PLTR to 30 I m disappointed fellow retards ,
133,kor1ps,t2_b17e7,1609562879,/r/wallstreetbets/comments/kor1ps/stonks/,1,Stonks ,
134,kor2ci,t2_aq5ns,1609562947,/r/wallstreetbets/comments/kor2ci/gme_in_a_nutshell_from_2020_to_2022/,1,GME in a nutshell from 2020 to 2022,
135,kor37w,t2_eodwxq7,1609563040,/r/wallstreetbets/comments/kor37w/doge_coin_to_the_moon_fuckers/,1,DOGE COIN TO THE MOON FUCKERS ,
136,kor3sf,t2_o83sgjg,1609563103,/r/wallstreetbets/comments/kor3sf/dogecoin_to_the_mooonnnnn/,1,dogecoin to the mooonnnnn,
137,kor4qa,t2_83ydgibv,1609563205,/r/wallstreetbets/comments/kor4qa/im_speechless_literally_im_gonna_cry_at_this_shit/,1,I m speechless Literally I m gonna cry at this shit Who the fuck messages someone saying such messed up shit This is by far revolting and disgusting Being a female doesn t mean you have to endure this stuff ,
138,kor4sa,t2_iyz4ftw,1609563211,/r/wallstreetbets/comments/kor4sa/dogecoin_out_chere_making_astronauts/,0,Dogecoin out chere making Astronauts ,
139,kor4w8,t2_8mus9,1609563223,/r/wallstreetbets/comments/kor4w8/how_i_feel_buying_gme_shares/,1,How I feel buying GME shares,Position 20 000 GME shares
140,kor6tl,t2_4aa2ai2h,1609563442,/r/wallstreetbets/comments/kor6tl/etwo_will_510x_in_2021/,1,ETWO will 5 10x in 2021, removed 
141,kor7l3,t2_12o7k5kq,1609563528,/r/wallstreetbets/comments/kor7l3/do_not_buy_doge/,1,DO NOT BUY DOGE, removed 
142,kor7sp,t2_80pt7zyy,1609563556,/r/wallstreetbets/comments/kor7sp/hi_citron_you_said_20_eoy_guess_you_were_wrong/,1,Hi citron you said 20 EOY Guess you were wrong, removed 
143,kor9x9,t2_eaak0,1609563777,/r/wallstreetbets/comments/kor9x9/most_anticipated_earnings_releases_for_the_week/,1,Most Anticipated Earnings Releases for the week beginning January 4th 2021,
144,korbat,t2_eaak0,1609563923,/r/wallstreetbets/comments/korbat/most_anticipated_earnings_releases_for_the_week/,1,Most Anticipated Earnings Releases for the week beginning January 4th 2021,
145,kordtt,t2_8ad3atpm,1609564202,/r/wallstreetbets/comments/kordtt/hes_at_it_again/,1,He s at it again ,
146,korhy1,t2_84fwoaf7,1609564671,/r/wallstreetbets/comments/korhy1/this_scene_from_boiler_room_feels_like_gme_gang/,1,This scene from Boiler Room feels like GME gang ,
147,korid4,t2_12zk6n,1609564719,/r/wallstreetbets/comments/korid4/gme_closing_stores_is_bullish/,1,GME closing stores is Bullish ,
148,korkg1,t2_849qkbof,1609564967,/r/wallstreetbets/comments/korkg1/thoughts_on_investing_stimulus_check_into_ticker/,1,Thoughts on investing stimulus check into Ticker PSTH for the upcoming week Is it risky any opinions would help , removed 
149,kort0r,t2_12ix57,1609565962,/r/wallstreetbets/comments/kort0r/doge_coin_is_mooning/,1,Doge coin is mooning, removed 
150,kort68,t2_d634z,1609565981,/r/wallstreetbets/comments/kort68/taylor_swift_posted_her_position_on_twitter/,1,Taylor Swift posted her position on Twitter ,
151,kort87,t2_5203rn2o,1609565989,/r/wallstreetbets/comments/kort87/is_ovtz_the_next/,1,Is OVTZ the next , removed 
152,korve7,t2_8adpl7vb,1609566242,/r/wallstreetbets/comments/korve7/upvote_if_you_agree_if_citron_is_if_gay_bears_and/,1,Upvote if you agree if Citron is if gay bears and boomers had a baby , removed 
153,korzbx,t2_84589pds,1609566694,/r/wallstreetbets/comments/korzbx/whos_pumping_doge/,1,Who s pumping Doge , removed 
154,korznf,t2_2scvsqxf,1609566734,/r/wallstreetbets/comments/korznf/ok_if_this_gets_10_awards_i_will_buy_gme/,1,Ok if this gets 10 awards I will buy GME, removed 
155,kos1gd,t2_lajrn,1609566947,/r/wallstreetbets/comments/kos1gd/_/,1, ,
156,kos275,t2_6gmbrw1w,1609567034,/r/wallstreetbets/comments/kos275/yahoo_has_worse_dd_than_wsb_but_bb/,1,Yahoo has worse DD than wsb but BB ,
157,kos9pe,t2_8apc0bm5,1609567899,/r/wallstreetbets/comments/kos9pe/the_peoples_portfolio_experiment_wsb/,1,The People s Portfolio Experiment WSB ,I want to do a fun experiment I will buy at least 10k of the stock gets the most votes from any comment I will buy the winner on Monday Then I ll poll weekly if hold sell and which other to buy I am curious as to how the portfolio driven by WSB comments would do vs the market I will report back on the portfolio holdings and performance 
