,postid,author,created_utc,permalink,score,title,selftext
424,n5z9bf,t2_bqqittn5,1620275832,/r/wallstreetbets/comments/n5z9bf/gme_billboards_confirmed/,1,GME Billboards confirmed,
425,n5z9c4,t2_2i1s8yt9,1620275834,/r/wallstreetbets/comments/n5z9c4/i_found_this_lost_image_of_cramer_from_the_dark/,1,I found this lost image of Cramer from the dark days of 2008 Still relevant today ,
426,n5z9tw,t2_32yo5gd0,1620275884,/r/wallstreetbets/comments/n5z9tw/plug_power_is_the_red_pill/,1,PLUG POWER IS THE RED PILL,
427,n5z9uk,t2_aokjr,1620275885,/r/wallstreetbets/comments/n5z9uk/we_like_the_stock/,1,We like the stock,
428,n5z9vy,t2_5l78m,1620275890,/r/wallstreetbets/comments/n5z9vy/coach_kitty_our_greatest_fears/,1,Coach Kitty Our Greatest Fears,
429,n5za6x,t2_4jnr56g0,1620275924,/r/wallstreetbets/comments/n5za6x/im_trying_to_learn_but_im_tarded/,1,I m trying to learn but I m tarded,Hello fellow retarded apes I was using my light box with buttons that I touch today and found some weird stonks that don t seem to be real companies but you can buy shares SPAC or sum shit but please help my pea brain understand what a blank check company is and who is blowing this bubble that s gonna burst or whatever idk 
430,n5zahq,t2_12woz1ly,1620275959,/r/wallstreetbets/comments/n5zahq/we_do_indeed_like_the_stonk/,1,We do indeed like the stonk ,
431,n5zalq,t2_a0spckr3,1620275972,/r/wallstreetbets/comments/n5zalq/announcement_to_shareholders_knowledge_is_power/,1, Announcement to Shareholders Knowledge is Power repost of daisydomergue8 , As a Shareholder of a company no matter how large or small you have an incentive to share knowledge of the company you own We have a very unique opportunity with this subreddit to share ideas and become more knowledgeable collectively as a group We ve nearly doubled in size the past week and we have a lot of new members who need to be caught up to speed on what this company TRULY is I think it s very important that all members here understand the fact that SOS Limited is not just a Bcoin mining company SOS is a technology healthcare marketing insurance and financial conglomerate with MANY existing and emerging streams of revenue It ALSO just happens to own one of the largest cryt mining operations of any publicly traded company in the world I am currently working on a DD post that will take a deeper dive into each of these revenue streams as well as the background and future of SOS Limited but that will take some time I ve recently opened conversations with Bull amp Bear Trading from Seeking Alpha and have joined his private Trader s Idea Flow There he has shared many many of his thoughts on SOS to that small group of subscribers I don t think he would mind if I shared one of those thoughts with everyone here I think the last sentence of this paragraph sums up my post pretty well Early investors into a very young growth stock like us may not be accustomed to the pace of developments and PR from the company News may be announced when we least expect it or it may be included as a bundle of key items on the upcoming ER date Until the stock gains some overall market support from a few new institutional investors and widens the scope of its retail interest it will be vulnerable Also it is important for us to grow the narrative on SOS beyond being just a cryt miner 70 of 2021 revenues are being delivered by the more stable data mining blockchain innovation being delivered by SOS for large Chinese corporations in the real estate healthcare and insurance industries This business has a huge upside potential Think of the revenue streams that FB and GOOG generate from a similar line of business in the U S Now apply that same model to this emerging small cap in a nation with a population of 1 4B people The upside is almost limitless That is the narrative that we want to grow along with the sharply increasing revenues from cryt mining An estimated 70 of 2021 revenues may come from the core business of data mining blockchain It is in shareholder s interests to begin sharing this very significant fact with the market Being identified as just a miner only tells 30 of the 2021 story for SOS Again I am a believer that SOS will deliver innovations in blockchain and De Fi that will give them a leadership position in this global greenfield opportunity Management has discussed their pioneering work in this space and the header on the SOS website s home page is Blockchain Innovators Serving The World I believe that the 400 revenue growth in 2020 and again in 2021 an estimated 400 growth once again this may be the tip of the iceberg for revenue growth at SOS The blockchain De Fi space presents nearly a limitless upside with the development of a few patents achieved by SOS there is likely to be a steady influx of new capital into this stock in 2021 Candidly we want to benefit from the upward trend in cryt and we also want to expand the narrative to include the bigger opportunity in blockchain De Fi The selling points for SOS are the 3 emerging revenue streams in blockchain innovation cryp mining and the coming De Fi compared to other peers of SOS RIOT and MARA who are just miners If we want to see the marketplace for SOS grow and we do want to see this positive event occur then we must communicate more broadly on this stock beyond just crypt mining 70 of 2021 revenues demand that we do so Please help me and the other mods spread the word about what this company TRULY is As a shareholder of this company it is in your best interest to do so Good luck to all DD
432,n5zame,t2_aokjr,1620275974,/r/wallstreetbets/comments/n5zame/we_like_the_stock/,1,We like the stock,
433,n5zavn,t2_b5uy5fva,1620276002,/r/wallstreetbets/comments/n5zavn/would_apes_short_a_company_if_it_was_fradulent/,1,WOULD APES SHORT A COMPANY IF IT WAS FRADULENT,This question is addressed to all what would be your response to this even though shorts are despised what would be the appropriate call to action 
434,n5zayl,t2_a0952pky,1620276012,/r/wallstreetbets/comments/n5zayl/can_we_wait_for_kenny_boy/,1,Can we wait for kenny boy , removed 
435,n5zb3q,t2_77yqj,1620276027,/r/wallstreetbets/comments/n5zb3q/anyone_need_a_lift_to_the_moon/,1,Anyone need a lift to the moon ,
436,n5zbbz,t2_87xjrk0w,1620276054,/r/wallstreetbets/comments/n5zbbz/are_you_diamond/,1,Are You Diamond ,
437,n5zbfa,t2_bl9wvgk2,1620276065,/r/wallstreetbets/comments/n5zbfa/am_i_doing_it_right/,1,Am I doing it right ,
438,n5zbnt,t2_63k3smdd,1620276091,/r/wallstreetbets/comments/n5zbnt/wtf_is_going_on_with_this_sub/,1,Wtf is going on with this sub ,Thought it was supposed to be good but all I see is a ton of drama and corruption 
439,n5zbyt,t2_a0pq6yia,1620276126,/r/wallstreetbets/comments/n5zbyt/freedom/,1,Freedom, removed 
440,n5zc81,t2_7qyeeo8z,1620276148,/r/wallstreetbets/comments/n5zc81/join_group_chat_on_discord/,1,Join group chat on discord,
441,n5zcqy,t2_qyige6k,1620276203,/r/wallstreetbets/comments/n5zcqy/seen_on_a_trash_can_in_front_of_my_apartment_in/,1,Seen on a trash can in front of my apartment in downtown Chicago Citadel is that you ,
442,n5zd6e,t2_6bx3hpn8,1620276247,/r/wallstreetbets/comments/n5zd6e/electric_car_company_to_the_moon/,1,Electric Car Company to the Moon ,
443,n5zdjv,t2_a0gzyeci,1620276288,/r/wallstreetbets/comments/n5zdjv/i_know_a_lot_of_you_are_still_holding_gamecube/,1,I know a lot of you are still holding GameCube but I m hearing less and less about it since our run to the 400s I still have all my shares but would like hear some opinions on the outlook Gme to the mooon still ,My post is my title Thanks 
444,n5zdsp,t2_bdltqnfl,1620276315,/r/wallstreetbets/comments/n5zdsp/atari_next_show_me_stock_80_cents/,1,Atari Next show me stock 80 cents,I m in for 200k shares
445,n5ze8l,t2_9zrh8kh1,1620276368,/r/wallstreetbets/comments/n5ze8l/nothing_but_lies_and_propaganda_uncovering_the/,1,Nothing but lies and propaganda Uncovering the truth about India s alleged Covid Crisis , Nothing but lies and propaganda Uncovering the truth about India s alleged Covid Crisis BY THE DAILY EXPOSE https dailyexpose co uk author jonnywalkersb ON MAY 5 2021 https dailyexpose co uk 2021 05 05 nothing but lies and propaganda uncovering the truth about indias alleged covid crisis https dailyexpose co uk 2021 05 05 nothing but lies and propaganda uncovering the truth about indias alleged covid crisis https dailyexpose co uk 2021 05 05 nothing but lies and propaganda uncovering the truth about indias alleged covid crisis 
446,n5zeqa,t2_a3vqdqnt,1620276420,/r/wallstreetbets/comments/n5zeqa/paya_nasdaqpaya_now_covered_by_analysts_at_credit/,1,Paya NASDAQ PAYA Now Covered by Analysts at Credit Suisse Group,
447,n5zet9,t2_27xg8geb,1620276430,/r/wallstreetbets/comments/n5zet9/dont_quit_because_i_only_had_1000_at_one_point/,1,Don t quit because I only had 1 000 at one point ,
448,n5zex5,t2_5l78m,1620276441,/r/wallstreetbets/comments/n5zex5/coach_kitty_our_deepest_fears/,1,Coach Kitty Our Deepest Fears, amp x200B video ris62gb2kfx61 
449,n5zf2t,t2_a93s9fos,1620276456,/r/wallstreetbets/comments/n5zf2t/what_about_posting_regards_to_agtc_is_it_allowed/,1,What about posting regards to agtc is it allowed ,
450,n5zfe5,t2_a0dhtqmk,1620276487,/r/wallstreetbets/comments/n5zfe5/sos_hype_is_realll/,1,Sos hype is realll,First of stop Deleting my posts Secondly im moroccan and not indian fucking racists All you people getting frustrated on the sos posts Remember the beginning of gme nobody understood it until money started flowing I know some hedgie moderators here are frusttated and spamming the board about inversion and shit but hey Think about it If WALLSTREETBETS can get run over by SOS retail investors What does that mean Theres money in it Why the fuck are people panicking here and calling SOS A shitty stock You morons made a bankrupt company go to 400 bux and save 2 companies from filing chapter eleven and sevens Was gme not called a shitty company What about amc its time to make a new hype and as you can see THE SOS CROWD IS READY
451,n5zfpd,t2_ak3c6y2i,1620276519,/r/wallstreetbets/comments/n5zfpd/bittorrent_do_not_support/,1,BitTorrent DO NOT SUPPORT,I know that this is not on subject but this needs to get out there This is how Josh Duggar was able to access his images of under age children 12 years to 18 months No one should be supporting a coin that will allow this to happen 
452,n5zge9,t2_byoqfsba,1620276593,/r/wallstreetbets/comments/n5zge9/whats_some_good_stocks_to_buy/,1,What s some good stocks to buy,Good stocks
453,n5zgtb,t2_2sgxzdkn,1620276637,/r/wallstreetbets/comments/n5zgtb/wow_cum_gang_here_such_a_good_stock_wow_cum_to/,1,WOW CUM GANG HERE SUCH A GOOD STOCK WOW CUM TO THE MOON NO BETTER STOCK HERE S WHY CUM DD , removed 
454,n5zhez,,1620276709,/r/wallstreetbets/comments/n5zhez/cum_the_play_of_the_future_cum_gang/,1, CUM THE PLAY OF THE FUTURE CUM GANG ,
455,n5zhlr,t2_a0spckr3,1620276734,/r/wallstreetbets/comments/n5zhlr/sos_building_a_super_computer_heres_the_news/,1,Sos building a super computer here s the news article,https www prnewswire com news releases sos announces entry into a joint venture agreement with ronghes affiliate aiming to establish a supercomputing center in qingdao 301257409 html
456,n5zhtm,,1620276758,/r/wallstreetbets/comments/n5zhtm/cum_best_stock/,1, CUM BEST STOCK ,
457,n5zhw5,t2_a12ynxrt,1620276765,/r/wallstreetbets/comments/n5zhw5/and_this_is_why_i_have_trust_issues_with_the_media/,1,And this is why I have trust issues with the media ,
458,n5zi0m,t2_azanppbv,1620276777,/r/wallstreetbets/comments/n5zi0m/sos/,1,SOS, removed 
459,n5zi61,t2_ka4v66v,1620276794,/r/wallstreetbets/comments/n5zi61/sub_sucks_ikr/,1,Sub sucks Ikr, removed 
460,n5zi9w,t2_8x68kqyr,1620276808,/r/wallstreetbets/comments/n5zi9w/to_the_moon/,1,to the moon ,
461,n5zibv,t2_9c08ty1n,1620276814,/r/wallstreetbets/comments/n5zibv/brand_new_to_trading_and_now_sos_is_shoved_down/,1,Brand new to trading and now SOS is shoved down my throat ,I just put my first 200 bucks into TD Ameritrade today and can t wait to do some investing tomorrow I came to WSB to see what I could learn but I see so much SOS Is this what happened to GME before it went up Should I just stick my 200 there and see where it takes me 
462,n5zie6,t2_920unenq,1620276821,/r/wallstreetbets/comments/n5zie6/sounds_like_a_cool_store/,1,Sounds like a cool store,
463,n5zihk,t2_8m9s2ez8,1620276829,/r/wallstreetbets/comments/n5zihk/sirc_will_be_spotlighted_on_newsmax_and_fox/,1,SIRC Will be spotlighted on Newsmax and Fox Business this Sunday and Monday Very high short interest Profitable solar play ,SIRC Solar Stock with meaningful revenue 100 million 2021 rate uplisting to Nasdaq Media blitz of stock this Sunday and Monday on Newsmax and Fox Business HUGE short interest Solar Integrated Roofing Corp currently priced at 51 They are a national brand and are currently expanding their EV charging portion of their portfolio 3 more acquisitions lined up Here is an article from last month https www einnews com pr news 537861830 esg stock news solar integrated roofing otc sirc discusses acquisition upcoming uplist with the stock day podcast
464,n5zire,t2_a2ikftcf,1620276856,/r/wallstreetbets/comments/n5zire/talos_energy_talo_just_reported_successful/,1,TALOS ENERGY TALO just reported Successful drilling record production and EBITDA of 185M and FREE CASH FLOW of 31 3M in one quarter alone,Talos is ready to rock and roll Should be a big night tonight after they present this earnings deck More information at r talosenergy
465,n5zixo,t2_b73a47cp,1620276877,/r/wallstreetbets/comments/n5zixo/this_sos_baby_is_really_good_company/,1,This SOS baby is really good company https service sosyun com sos en news center html ,
466,n5ziye,t2_byoqfsba,1620276879,/r/wallstreetbets/comments/n5ziye/is_safemoon_a_good_stock/,1,Is safemoon a good stock, removed 
467,n5ziyv,t2_8x1hifs4,1620276881,/r/wallstreetbets/comments/n5ziyv/thanks_buffet/,1,Thanks Buffet,
468,n5zj0x,t2_a1p16nbt,1620276889,/r/wallstreetbets/comments/n5zj0x/good_investments_for_my_itty_bitty_700_to_make_me/,1,Good investments for my itty bitty 700 to make me a multi billionaire with a yacht ,I want the reward with no risk LOL no really what are some good investments 
469,n5zj1o,t2_a2n45gd0,1620276891,/r/wallstreetbets/comments/n5zj1o/arb_arbkf/,1, ARB ARBKF ,
470,n5zj5a,t2_9cuuo6f5,1620276902,/r/wallstreetbets/comments/n5zj5a/someone_said_repost_this_sos_ass/,1,Someone said repost this SOS ass,
471,n5zjb9,t2_9y89gug2,1620276921,/r/wallstreetbets/comments/n5zjb9/weneedhelpcidm/,1,WE NEED HELP CIDM,This Manipulator whoever he is This bot keeps manipulating CIDM stock I feel like a kid getting help with my mom lol Advance Happy Moms day to all the moms out there 
472,n5zje1,t2_5gqfxksf,1620276928,/r/wallstreetbets/comments/n5zje1/kneof_is_a_solid_play_just_sold_units_to_new_york/,1, KNEOF is a solid play Just sold units to New York school system,Education will continue to get funding in the infrastructure plan Get in at the ground floor 
473,n5zjen,t2_adpvfpi1,1620276929,/r/wallstreetbets/comments/n5zjen/btt_on_voyager/,1,BTT on voyager ,Does btt have potential to seems very cheap Am just an ape trying to collect its bananas 
474,n5zjk4,t2_5l78m,1620276946,/r/wallstreetbets/comments/n5zjk4/coach_kitty_our_deepest_fears/,1,Coach Kitty Our Deepest Fears,
475,n5zjni,t2_6np2jea6,1620276957,/r/wallstreetbets/comments/n5zjni/can_we_make_another_stock_blow_up_just_for_fun/,1,Can we make another stock blow up just for fun ,
476,n5zjxp,t2_b73a47cp,1620276990,/r/wallstreetbets/comments/n5zjxp/perfect_news/,1,Perfect news,
477,n5zl63,t2_byoqfsba,1620277127,/r/wallstreetbets/comments/n5zl63/once_i_get_rich_from_the_market_what_should_i_do/,1,Once I get rich from the market what should I do , 
478,n5zln2,t2_byoqfsba,1620277185,/r/wallstreetbets/comments/n5zln2/once_i_buy_a_stock_do_i_tell_other_people_to_buy/,1,Once I buy a stock do I tell other people to buy it , 
479,n5zlsn,t2_a160vr0n,1620277202,/r/wallstreetbets/comments/n5zlsn/atnx_tomorrow/,1, ATNX tomorrow,
480,n5zmjx,t2_6mpq4bwb,1620277274,/r/wallstreetbets/comments/n5zmjx/sirc_sos_sklz_pton_rkt/,1,SIRC SOS SKLZ PTON RKT,Seems like we are seeing many new stocks being discussed on WSB I m enjoying it Screw the shorts 
481,n5zmqk,t2_byoqfsba,1620277294,/r/wallstreetbets/comments/n5zmqk/who_has_heard_of_safemoon_i_just_bought_a_lot/,1,Who has heard of safemoon I just bought a lot what do I do now , removed 
482,n5zojl,t2_a0spckr3,1620277482,/r/wallstreetbets/comments/n5zojl/the_best_sos_posted_out_of_all_of_the_people/,1,The best SOS posted out of all of the people who ve posted Reposting their post ,https www reddit com r wallstreetbets comments n5ydj4 10x to 100x multibagger sos price targets share utm source share amp utm medium ios app amp utm name iossmf
483,n5zoxe,t2_bbrt11zi,1620277522,/r/wallstreetbets/comments/n5zoxe/clov_lawsuit_hoax/,1,CLOV Lawsuit Hoax ,So I have been checking up with Twitter and came across this https mobile twitter com trdgcollective status 1390101652485586945 It appears that the law suit against CLOV is possibly a hoax What does everyone make of this 
484,n5zp7f,t2_3b57c7a8,1620277554,/r/wallstreetbets/comments/n5zp7f/an_interesting_investment_human_being_mike_merrill/,1,An Interesting Investment Human being Mike Merrill , Not financial advice Wanted to share this here first with all the wsb people In all of the craziness right now I feel like we all are looking for the next big interesting thing to put out money into here s my prompt INVESTING IN PEOPLE possibly a resurgence here hasn t really been touched since 2013 I threw in my 100 why not https kmikeym com offers https kmikeym com offers Easy to deposit system untapped market exponential potential that just makes sense I like the person what can I say 
485,n5zpa9,t2_qcgqb,1620277563,/r/wallstreetbets/comments/n5zpa9/breaking_vlad/,1,BREAKING VLAD ,
486,n5zpkt,t2_6o6z2zuz,1620277597,/r/wallstreetbets/comments/n5zpkt/what_the_fuck_is_going_on/,1,What the fuck is going on ,What s up with the holy war happeninf on the subreddit 
487,n5zpvj,t2_6kvf3ch3,1620277632,/r/wallstreetbets/comments/n5zpvj/the_reason_behind_the_insane_amount_of_sos_posts/,1,The reason behind the insane amount of SOS posts PLEASE READ I m not a pledge ,Since the beginning of time SOS was not allowed to be posted about in WSB because it was crypt0 related and because it was under 5 This company has been burned hard by a short and distort move and it has been pretty clear that the company is undervalued bad right now The SOS community while not nearly as large as WSB is no less passionate about this company I ve personally been following SOS for nearly a year SOS diamond hands are such true autist they actually paid people on fivvr to go to each of the companies buildings and spy on operations in China because the confusion from the spamming of short and distort lawsuits was so intense we couldn t tell the floor from the ceiling They went to the US power plants in the LOI and recorded SOS representatives arriving for talks Anyone that has followed SOS enough to know enough about what has been happening with the stock the last few months literally cam in their pants twice today One when earnings came out as a 100 surprise And again when suddenly WSB starting allowing SOS posts So PLEASE PLEASE DON T DISCOUNT SOS Let the pledges get their shit posts in These kids are so damn excited to just be here let alone finally getting SOS DD in front of the right audience However these pledges need a little hazing They still have manners they use proper English they don t use nearly enough rocket emojis shit they haven t even offended anyone yet they haven t even made their first 100k to lose everything yet Let s make these kids question their life a bit make em cry But I m sticking behind the thought Buy SOS Burn these fucking shorts and let the bears get rekt 
488,n5zpx7,t2_9thp8va5,1620277635,/r/wallstreetbets/comments/n5zpx7/so_i_can_say_anything_i_want_on_wsb_right_now/,1,So I can say anything I want on WSB right now ,Well then fuck you WSB you done shit the bed and you re still trying to get me to lay down in it You used to be alright but shit hit the fan and you sold your soul So fuck you See you tomorrow 
489,n5zpyi,t2_1d2uf1g8,1620277641,/r/wallstreetbets/comments/n5zpyi/i_know_there_is_a_lot_of_sos_spam_here_right_now/,1,I know there is a lot of SOS spam here right now but since it s being allowed here is a 16 page DD on SOS This stock is massively undervalued and it was proven more so with earnings today ,https www dropbox com s p2vndwo7vk30quy sos 20analysis 202021 20march pdf dl 0
490,n5zq5u,t2_bsdpse78,1620277665,/r/wallstreetbets/comments/n5zq5u/gamestop_shanty_wall_street_bets/,1,GameStop Shanty Wall Street Bets,
491,n5zq61,t2_qcgqb,1620277666,/r/wallstreetbets/comments/n5zq61/breaking_vlad/,1,BREAKING VLAD ,
492,n5zqb6,t2_9yogk39v,1620277681,/r/wallstreetbets/comments/n5zqb6/sos_dd_repost/,1, sos dd repost,
493,n5zqcw,t2_hn0ywso,1620277688,/r/wallstreetbets/comments/n5zqcw/cant_stop_wont_stop_gstop/,1,Can t stop Won t stop G stop ,
494,n5zqju,t2_byrurf76,1620277710,/r/wallstreetbets/comments/n5zqju/great_ama_join_the_swissborg_community_app_use_my/,1,Great AMA Join the Swissborg Community App Use my referral to get 3000 starting points LQNOSMY Read up on it and get in before the summer Guess the price and get 250 CHSB in reward for completing all badges CHSB ,
495,n5zre1,t2_byoqfsba,1620277796,/r/wallstreetbets/comments/n5zre1/i_have_20000_saved_up_and_im_gonna_try_to_put_it/,1,I have 20 000 saved up and I m gonna try to put it on one stock which one should I do, 
496,n5zrnx,t2_5qaiaw6y,1620277828,/r/wallstreetbets/comments/n5zrnx/robinhood_says_rocket_is_down_13_in_the_premarket/,1,Robinhood says rocket is down 13 in the premarket ,Is this accurate How does this kind of thing happen 
497,n5zsbg,t2_832zjva1,1620277899,/r/wallstreetbets/comments/n5zsbg/the_real_reason_why_these_gme_amc_clov_sos_cucks/,1,The real reason why these GME AMC CLOV SOS cucks insist on staying here effectively ruining the sub, removed 
498,n5ztnt,t2_a1jt7kff,1620278039,/r/wallstreetbets/comments/n5ztnt/buy_goev_join_us_in_bankruptcy_or_valhalla_get/,1,Buy GOEV join us in bankruptcy or Valhalla GET FUCKED,This is not financial advice It is possible that I may be hearing from schwab re collections 
499,n5ztwg,t2_byoqfsba,1620278066,/r/wallstreetbets/comments/n5ztwg/who_is_the_easiest_person_to_ask_for_money_i_lost/,1,Who is the easiest person to ask for money I lost my money trading but if I get a second chance I know I can do it right, removed 
500,n5ztwg,t2_byoqfsba,1620278066,/r/wallstreetbets/comments/n5ztwg/who_is_the_easiest_person_to_ask_for_money_i_lost/,1,Who is the easiest person to ask for money I lost my money trading but if I get a second chance I know I can do it right, removed 
501,n5zuwh,t2_m0oho,1620278181,/r/wallstreetbets/comments/n5zuwh/hodl_plz/,1,HODL PLZ,
502,n5zv5z,t2_6102u5x2,1620278209,/r/wallstreetbets/comments/n5zv5z/whats_forgotten_but_will_soon_explode/,1,What s forgotten but will soon explode , Source NYMEX Coaldesk https preview redd it vdf3pmrfpfx61 png width 1600 amp format png amp auto webp amp s fc11a990f268091d1933c3ab4eecdb1cd8e77466 We at TrackRecord have been extremely bullish on Natural Gas since 2020 and that trend is well entrenched as Nat Gas prices have risen meaningfully since then Our stock expression of the theme has produced gains of more than 200 since we got involved in this theme At this point in the cycle we believe that another bull market is brewing in the traditional energy space and that is in Thermal Coal yes you read it right The out of favour commodity is essential for baseload energy production around the world and will be for decades to come and we suspect now is the time to get in As natural gas hits its stride and gets more expensive energy producers will switch more allocation to Thermal Coal as a source With reference to the chart above we can see that Coal s share of energy generation increases by approximately 1 for every 0 25 mmBtu increase in natural gas price We remain bullish on global growth infrastructure build outs and economies supporting their middle class with unlimited fiscal budgets As the world recovers and pent up demand is unleashed we expect a boom in energy demand and the acute problem of energy deficit will be brought to the fore with asymmetric consequences in the price of ESG Untouchables like coal in fact coal companies are innovating around Co2 emissions and have good carbon capture technologies in the pipeline This is the elephant in the room that no one wants to address as governments and the media have already sown so much divergent narrative from coal that it seems impossible to backtrack The outcome may be positively idiosyncratic when people realize 
503,n5zvto,t2_akmiqwk4,1620278278,/r/wallstreetbets/comments/n5zvto/beginner_ape_dd_smile/,1,Beginner APE DD smile ,It s okay y all I did same amazing beginner Apetastic DD and came up with HODL your junk s all the way Not financial advice Ape no talk strategy Ape HODL and scoop dips when I swing I like my stonks There my bananas Part of the XXXX club 
504,n5zw1q,t2_azanppbv,1620278304,/r/wallstreetbets/comments/n5zw1q/sos_unite/,1,SOS UNITE, removed 
505,n5zw1t,t2_a54q2vds,1620278304,/r/wallstreetbets/comments/n5zw1t/is_this_true/,1,Is this true ,
506,n5zwdr,t2_rpfj6,1620278340,/r/wallstreetbets/comments/n5zwdr/mobiepay_is_something_worth_looking_into_if_you/,1,MobiePay is something worth looking into if you value the future of payments To be accepted anywhere GooglePay is accepted major partners strong leadership ,
