,postid,author,created_utc,permalink,score,title,selftext
1794,n6c84j,t2_xqjjj,1620321012,/r/wallstreetbets/comments/n6c84j/jpow_transitory_inflation_steel_gains_nue/,1,JPOW transitory inflation steel gains NUE , amp x200B Mostly buying call spreads https preview redd it 7qnq4lln8jx61 png width 1730 amp format png amp auto webp amp s 79cabcc74af4b0dd19ff7a1e8a1058841814b9dd 
1795,n6c86m,t2_bohlduv4,1620321017,/r/wallstreetbets/comments/n6c86m/goev_to_the_moon/,1,GOEV to the moon ,
1796,n6c88u,t2_wjbic,1620321022,/r/wallstreetbets/comments/n6c88u/government_debt_refinancing/,1,Government debt refinancing ,I don t consider myself bearish on things in general currently but the us government debt is certainly something worrying long term As long as interest rates are low as fuck who cares but at some point I imagine the debts will be refinanced and that may bite the government in the ass So I m wondering if there s some resources on seeing like what percent of and when government debt is refinanced to see if trying to make some plays on times of major refinancing could be possible Course I assume this is a totally retarded idea but I ve come here to see what others think 
1797,n6c88w,t2_amb79u9p,1620321022,/r/wallstreetbets/comments/n6c88w/how_does_lexx_look/,1,How Does LEXX look ,I have a few extra bucks lying around that I want to put into a couple good looking stocks for the short term and a friend of mine recommended LEXX Anyone have any opinions one way or the other on it I ve literally never heard of them before today 
1798,n6c8aa,t2_9sdbg3sl,1620321024,/r/wallstreetbets/comments/n6c8aa/rkt_come_back_baby/,1,RKT come back baby ,Picked up 200 shares at 19 05 hope selloff is short lived 
1799,n6c8jm,t2_36rerjrs,1620321043,/r/wallstreetbets/comments/n6c8jm/us_sec_chair_pledges_trading_rules_review_in/,1,U S SEC chair pledges trading rules review in first Congressional hearing,
1800,n6c8jm,t2_36rerjrs,1620321043,/r/wallstreetbets/comments/n6c8jm/us_sec_chair_pledges_trading_rules_review_in/,1,U S SEC chair pledges trading rules review in first Congressional hearing,
1801,n6c8o0,t2_a1mz5irf,1620321052,/r/wallstreetbets/comments/n6c8o0/analysis_question_for_smart_apes_is_this_stock/,1,Analysis question for smart Apes Is this stock being shorted MGC Pharmaceuticals Limited MGC ,They done positive deals but yet their share price is plummeting Can any Wrinkled enlighten please https www proactiveinvestors co uk companies news 948384 mgc pharmaceuticals shares rise in london as swiss distributor orders more covid 19 recovery support supplements 948384 html
1802,n6c8oy,t2_8d2g7koi,1620321055,/r/wallstreetbets/comments/n6c8oy/if_you_havent_figured_it_out_yet_buying_in/,1,If you haven t figured it out yet buying in anticipation of earnings call s is a pseudo P amp D scheme ,You re welcome Anytime there s a set time involved its very likely a scam The stock is gonna get dumped as that set time passes no matter what it is or what it s outlook is because the scammer knows people are gonna pump in anticipation of the set time which in this case are earnings calls And you re all doing it Hell you ve been doing it for a few weeks now And you re selling stocks at a loss to obtain the capital to do it Stop losing money like this apes 
1803,n6c8ra,t2_4x5iogxj,1620321060,/r/wallstreetbets/comments/n6c8ra/have_been_off_reddit_for_few_months_anything_new/,1,Have been off Reddit for few months Anything new ,
1804,n6c8s2,t2_be9vfs6g,1620321061,/r/wallstreetbets/comments/n6c8s2/longtime_watcher_first_time_buyer/,1,Longtime Watcher First Time Buyer,Am I going to lose my childhood savings act over SNDL 
1805,n6c8sv,t2_clqv7,1620321063,/r/wallstreetbets/comments/n6c8sv/the_old_new_and_everything_inbetween_testament_of/,1,The old new and everything inbetween testament of GME,
1806,n6c90y,t2_3i38uwos,1620321079,/r/wallstreetbets/comments/n6c90y/otgly_cd_projekt_red/,1,OTGLY CD projekt red,an someone explain me what is happening with this stock It has record earnings and still falling I just cant understand my brain small
1807,n6c94d,t2_ay58j7je,1620321088,/r/wallstreetbets/comments/n6c94d/voyager_digital_the_most_shorted_stock_40/,1,Voyager Digital The Most Shorted Stock 40 ,Voyager Digital is one of the most shorted stocks on Wall Street with a short of nearly 50 They are the Robinhood of CryptoCurrencies and just reported nearly 60M in revenue for the month of April Not only that but their fundamentals make them 2 3X cheaper than Coinbase https youtu be nJNLH0b ziI https youtu be nJNLH0b ziI https youtu be G9jXt05B5n4 https youtu be G9jXt05B5n4 
1808,n6c9ic,t2_blogoxb9,1620321118,/r/wallstreetbets/comments/n6c9ic/when_moon/,1,When MOON, removed 
1809,n6c9z6,t2_9k204fzq,1620321153,/r/wallstreetbets/comments/n6c9z6/rycey/,1,RYCEY,Any Rolls Royce holders in here ready for the rocket to take off in June
1810,n6c9zu,t2_pv1yl,1620321154,/r/wallstreetbets/comments/n6c9zu/explain_please/,1,Explain please,
1811,n6ca9a,t2_xqjjj,1620321173,/r/wallstreetbets/comments/n6ca9a/nue_gains_thanks_to_jpows_transitory_inflation_in/,1, NUE Gains Thanks to JPOW s transitory inflation in steel prices, amp x200B https preview redd it j1gybtz19jx61 png width 2312 amp format png amp auto webp amp s 7ffebe6040e5331315ccfe1db80ab12e59aa356f
1812,n6cam3,t2_1rx8aic5,1620321199,/r/wallstreetbets/comments/n6cam3/milk_tokens/,1,MILK TOKENS,Just got on these coins let s see what happens 
1813,n6cbet,t2_6jmvb8ks,1620321258,/r/wallstreetbets/comments/n6cbet/can_i_join_the_degenerates_club/,1,Can I join the degenerates club ,
1814,n6cbza,t2_aaokwwv4,1620321300,/r/wallstreetbets/comments/n6cbza/the_meme_stonk_index_is_down_500_points/,1,The meme stonk index is down 500 points ,
1815,n6cd1z,t2_bprdunoe,1620321381,/r/wallstreetbets/comments/n6cd1z/mito/,1, MITO,Do u guys think MITO will run up again today 
1816,n6cdnb,t2_4vmnoj1b,1620321429,/r/wallstreetbets/comments/n6cdnb/wsb_has_taught_me_so_much/,1,WSB has taught me so much, removed 
1817,n6cdut,t2_9v2gh7xx,1620321445,/r/wallstreetbets/comments/n6cdut/no_news_can_help_blackberry_stockexcept/,1,no news can help blackberry stock except,for the patent sale that s larger than 3billion we had over 15 positive news in recent months but NOT a single one moved the stock and kept it up Even AWS and IVY news didn t move the stock Even 70 of EV cars using blackberry qnx move the stock This is because failure of John Chen CEO to produce any revenue We had many news PR for last 7 years but they all failed to produce any growth in revenue amp x200B Chen is now selling off the patents as last resort to prop up the revenue Lets hope he doesn t give it away for cheap The patent should sell for more than 3 billion for stock to move few dollars AND STAY THERE 
1818,n6ced6,t2_8xneaagu,1620321481,/r/wallstreetbets/comments/n6ced6/cant_go_broke_off_profits/,1,Cant go broke off profits ,
1819,n6cemn,t2_bprdunoe,1620321501,/r/wallstreetbets/comments/n6cemn/mito/,1, MITO,Do u guys think MITO will run up again today 
1820,n6cfd9,t2_5q0jn,1620321557,/r/wallstreetbets/comments/n6cfd9/market_behavior_dd/,1,Market Behavior DD,Alright you fucks I m going to give a short but sweet guide to the Markets behavior For you simpletons I ll sum it up in one easy sentence Any good news causes the stock to take a massive shit Yes you heard it here Any news that would otherwise cause a stocks value to rise actually makes it take a huge dump Tilray acquired Aphira prospects to be the worlds number one weed supplier look great Stock drops 4 bucks and stays there MVIS currently the only company with a working and best in industry Lidar and has prosect to either get massive contracts or even be bought out by Microsoft Plummets like 15 fuckin bucks and hasn t gone anywhere since GME Hired top E Commerce figures and booted their old dusty ass Board Poised to be an industry leader in online sales and paid off their debt Shit dropped from like 250 275 to 150 180 and has struggled to get anywhere since But what s that you say Bad news should make the stock rise then Fuck you for even thinking it Tonix pharma rejected trials failed formulas Shit was once 4 grand a piece and now it s struggling to hit 1 20 Apple and others suffering from Chip shortages fell from 140s to 111 So whatever you re invested in if you are expecting to hear ANY news about it coming up wether earnings announcements on product trials or if the CEO was caught at the boarder with drugs prepare for a kick in the balls Exception Alibaba Massive law suit CEO disappears for weeks suspected killed by China s Gov for calling them out shit skyrockets None of this is advice for anything least of all investment or financial 
1821,n6cfp9,t2_76ja6k0d,1620321583,/r/wallstreetbets/comments/n6cfp9/scamath/,1,Scamath,Any idea where this snake oil salesman got off to Man hasn t even been posting on Twitter for over a week Spacloses
1822,n6cfpm,t2_b45ba6oy,1620321584,/r/wallstreetbets/comments/n6cfpm/me_watching_a_movie_at_amc_thinking_about_my/,1,Me watching a movie at AMC thinking about my money in the stock market ,
1823,n6cfqf,t2_7hbgc,1620321585,/r/wallstreetbets/comments/n6cfqf/50k_yolo_into_mnmd/,1,50k YOLO into MNMD,
1824,n6cgdt,t2_a1ayqdzx,1620321632,/r/wallstreetbets/comments/n6cgdt/watch_live/,1,Watch live,
1825,n6ch9x,t2_6jmvb8ks,1620321697,/r/wallstreetbets/comments/n6ch9x/35k_last_may_5_to_420k_in_feb_to_115k_today_am_i/,1,3 5k last May 5 to 420k in Feb to 11 5k today Am I a DEGENERATE yet ,
1826,n6cil3,t2_buxq4c2j,1620321796,/r/wallstreetbets/comments/n6cil3/easy_way_to_make_money_and_be_better/,1,Easy way to make money and be better, removed 
1827,n6cimt,t2_a9p3ha2k,1620321799,/r/wallstreetbets/comments/n6cimt/apple_divitendies/,1,Apple divitendies,Buying atm calls before the dividend and buying atm puts after When is the deadline to buy the stock to get the dividend I bought 28c 5 7 this morning My first bagger 
1828,n6ciwc,t2_5tpisapu,1620321815,/r/wallstreetbets/comments/n6ciwc/fuck_you_hedge_funds_youll_be_forced_to_buy_those/,1,Fuck you hedge funds you ll be forced to buy those asks soon enough ,
1829,n6cj3x,t2_4bfeam4y,1620321830,/r/wallstreetbets/comments/n6cj3x/ibio/,1,IBIO,Ibio i a cool company
1830,n6cjcp,t2_50iq8lty,1620321848,/r/wallstreetbets/comments/n6cjcp/aso_guh/,1,ASO GUH,
1831,n6cjpc,t2_byemtio4,1620321873,/r/wallstreetbets/comments/n6cjpc/workhorse_to_the_moon_wkhs/,1,WORKHORSE TO THE MOON WKHS,Quick shit
1832,n6cjsr,t2_94bp53mr,1620321879,/r/wallstreetbets/comments/n6cjsr/rkt_after_this_interview_not_worried_cnbc/,1,RKT After this interview not worried CNBC blatantly trying to get Jay and bringing up retail squeezing the shorts IDK after seeing CNBC during the GME saga this feels like they have an agenda Jay handled it perfectly RKT TO THE MOON,
1833,n6ckda,t2_2oxxz5u5,1620321920,/r/wallstreetbets/comments/n6ckda/riot/,1,Riot,What s everyone s thoughts on RIOT Seems to be going down everyday even though indexes are up I have to say it s just being shorted into oblivion I digress I m just bag holding hard 
1834,n6ckes,t2_9jercb6q,1620321923,/r/wallstreetbets/comments/n6ckes/should_i_buy_an_inverse_etf_longterm/,1,Should I buy an inverse ETF long term ,I m looking to put some money into shorting the US stock market over the next couple years Is an inverse ETF a good way to do that 
1835,n6ckff,t2_4dwyt1vf,1620321924,/r/wallstreetbets/comments/n6ckff/shit/,1,shit,
1836,n6ckuz,t2_j6rrl,1620321960,/r/wallstreetbets/comments/n6ckuz/140_dollars_in_my_webull_account_whats_a_good/,1,140 dollars in my Webull account What s a good long term stock to get ,I know it s not much but I have 140 dollars randomly sitting in my Webull account Any ideas for a good stock or two to get Thanks 
1837,n6clgd,t2_35h1202u,1620322006,/r/wallstreetbets/comments/n6clgd/pltr_says_hes_about_ready_to_wake_up/,1,PLTR says he s about ready to wake up ,
1838,n6cli6,t2_zy7k5,1620322010,/r/wallstreetbets/comments/n6cli6/f_wsb_ive_done_nothing_but_lose_money_messing/,1,F WSB I ve done nothing but lose money messing with you ghost hedge funds hiding behind Reddit accounts,
1839,n6cliz,t2_83411l0a,1620322012,/r/wallstreetbets/comments/n6cliz/gme_symmetrical_triangle_pattern_formation/,1, GME Symmetrical Triangle Pattern formation apparent ,
1840,n6cm5h,t2_68ap4tjg,1620322061,/r/wallstreetbets/comments/n6cm5h/mito/,1,MITO,Go invest into MITO and Stealth BioTherapeutics Corp It s a cheap stock that needs to rise 
1841,n6cm9v,t2_awnquh62,1620322071,/r/wallstreetbets/comments/n6cm9v/young_people_lets_continue_to_give_a_middle/,1,Young people Let s continue to give a middle finger to the system Who let the DOGES out ,
1842,n6cmc2,t2_91mjonvd,1620322077,/r/wallstreetbets/comments/n6cmc2/took_out_4k_in_student_loans_last_may_and_dropped/,1,Took out 4k in student loans last May and dropped out of college Used that money to buy BA and TSLA shares Sold those for a loss Bought 1 year AAPL puts last May My college wants 5k from me lol,
1843,n6cmej,t2_4dwyt1vf,1620322083,/r/wallstreetbets/comments/n6cmej/hold_you_damn_degenerates/,1,Hold you damn degenerates,
1844,n6cmg6,t2_a0z8x8pn,1620322086,/r/wallstreetbets/comments/n6cmg6/still_lost_3k_total_on_callsshares_but_this_1000/,1,Still lost 3k total on calls shares but this 1000 return was a life saver,
1845,n6cmiu,t2_byfcbo9w,1620322091,/r/wallstreetbets/comments/n6cmiu/gopro_stock/,1,GoPro Stock,I m very new to to this community and trading Im just wondering why GoPro has taken such a tumble Any thoughts Any answers Like I said I m very very green to all of this Constructive criticism is welcome as well Just be gentle on this ol man 
1846,n6cmsr,t2_a3vybaej,1620322108,/r/wallstreetbets/comments/n6cmsr/trend_analysis_trend_patterns/,1,Trend Analysis Trend patterns,
1847,n6cmu1,t2_94bp53mr,1620322111,/r/wallstreetbets/comments/n6cmu1/rkt_cnbc_tries_to_get_jay_he_handled_it_perfectly/,1,RKT CNBC tries to get Jay he handled it perfectly My Faith in RKT has not wavered ,
1848,n6cmuj,t2_32bp8cw2,1620322112,/r/wallstreetbets/comments/n6cmuj/fastly_fsly/,1,FASTLY FSLY ,Anyone picking positions on FASTLY FSLY hope it picks up 
1849,n6cmvn,t2_an9mnwan,1620322115,/r/wallstreetbets/comments/n6cmvn/bull_run_incoming_more_stimmys_on_the_way/,1,Bull run incoming More stimmys on the way,
1850,n6cndg,t2_boqiiu5k,1620322156,/r/wallstreetbets/comments/n6cndg/this_is_a_old_video_of_sndl_ceo_zach_looking/,1,This is a old video of SNDL ceo Zach looking bullish Right now their products are selling out ,
1851,n6cnx6,t2_byemtio4,1620322196,/r/wallstreetbets/comments/n6cnx6/truly_think_they_can_bounce_back_sharp_increase/,1,Truly think they can bounce back sharp increase The company doing good despite missing deal,
1852,n6coea,t2_8i6bnkgm,1620322233,/r/wallstreetbets/comments/n6coea/for_all_you_matress_lovers/,1,FOR ALL YOU matress lovers, removed 
1853,n6couj,t2_5tkxw1fa,1620322267,/r/wallstreetbets/comments/n6couj/stampscom/,1,Stamps com , removed 
1854,n6cp3i,t2_7wxvjeq4,1620322286,/r/wallstreetbets/comments/n6cp3i/awesome_xxii/,1,Awesome XXII,
1855,n6cp6x,t2_91mjonvd,1620322294,/r/wallstreetbets/comments/n6cp6x/took_out_4k_in_student_loans_last_may_and_dropped/,1,Took out 4k in student loans last May and dropped out of college Used that money to buy BA and TSLA shares Sold those for a loss Bought 1 year AAPL puts last May My college wants 5k from me lol,
1856,n6cpam,t2_an9mnwan,1620322300,/r/wallstreetbets/comments/n6cpam/bull_run_incoming_new_round_of_stimmys_to_push/,1,Bull run incoming New round of stimmys to push the market up ,
1857,n6cpcm,t2_2af1kas,1620322305,/r/wallstreetbets/comments/n6cpcm/now_you_seeos/,1,Now you seEos ,
1858,n6cphp,t2_5nkg9hb5,1620322316,/r/wallstreetbets/comments/n6cphp/the_next_amc/,1,The next AMC,Retractable Technologies RVP this stock has tremendous upside as well as being traded below NAV Government contracted and playing an interval role in the vaccinations Q2 earning are coming in mid May don t miss out before it has a day Cheers
1859,n6cpuv,t2_a2how8oy,1620322345,/r/wallstreetbets/comments/n6cpuv/blrx_fckcancer_fckhedges/,1,BLRX f ckcancer f ckhedges,Who the hell shorts a company BLRX who comes out with strikingly positive Phase 3 clinical trials for cancer treatment Hedges thats who Moral capacity 0
1860,n6cqb1,t2_986jm,1620322376,/r/wallstreetbets/comments/n6cqb1/please_be_careful_of_scams/,1,Please Be Careful Of Scams ,
1861,n6cqjl,t2_a28ppvym,1620322395,/r/wallstreetbets/comments/n6cqjl/just_caught_the_sec_chair_gary_gensler_testifying/,1,Just caught the SEC Chair Gary Gensler Testifying to the House, removed 
1862,n6cqnl,t2_buj1j0ij,1620322403,/r/wallstreetbets/comments/n6cqnl/stonks/,1,Stonks,
1863,n6cr30,t2_7wu0o910,1620322435,/r/wallstreetbets/comments/n6cr30/ggii/,1,GGII,GGII I M CURRENTLY UP 1100 AND STILL NO REAL NEWS ABOUT THIS HIDDEN GEM WHAT GIVES 
1864,n6cr6h,t2_a1mz5irf,1620322442,/r/wallstreetbets/comments/n6cr6h/a_sprinkle_of_sugar_for_gme_s_the_hf_and_rh_fkry/,1,A sprinkle of sugar for GME s The HF and RH f kry is getting noticed Let s hope there are more actions than words ,https uk finance yahoo com news sec chief signals rules could 181609039 html
1865,n6crbn,t2_a141zr90,1620322453,/r/wallstreetbets/comments/n6crbn/still_using_robinhood_disable_sharing_your_data/,1, Still using Robinhood Disable sharing your data with third party websites ,
1866,n6crdt,t2_batgeu7r,1620322459,/r/wallstreetbets/comments/n6crdt/lets_boost_ecp/,1,Let s boost ecp ,
1867,n6crrk,t2_8khck6z6,1620322483,/r/wallstreetbets/comments/n6crrk/good_days_for_the_silver_buyers_silversqueeze/,1,Good days for the SILVER BUYERS SILVERSQUEEZE,
1868,n6cs0g,t2_96qvdi1h,1620322501,/r/wallstreetbets/comments/n6cs0g/sneaky_sneaky/,1,Sneaky sneaky ,What are we pumping up next 
1869,n6cshs,t2_6pmlsrxi,1620322533,/r/wallstreetbets/comments/n6cshs/rkt_loss_porn/,1,RKT LOSS PORN,
1870,n6csms,t2_e0s1you,1620322543,/r/wallstreetbets/comments/n6csms/us_congress_on_todays_gamestop_hearing_weve/,1,US Congress on today s GameStop hearing We ve learned that Reddit is powerful We ve learned that Roaring Kitty DFV is INDEED NOT A CAT ,
1871,n6csub,t2_afg7hyp7,1620322558,/r/wallstreetbets/comments/n6csub/rookie_needs_help/,1,rookie needs help,is it too late to invest in dog e i see the stock has risen dramatically in the last week and wonder if there s still time to make a profit to be fair idk much about stocks or c rypto but am trying to get into it 
1872,n6csyj,t2_9zotb,1620322567,/r/wallstreetbets/comments/n6csyj/ill_take_10_please/,1,I ll take 10 please,
1873,n6ct04,t2_8khck6z6,1620322570,/r/wallstreetbets/comments/n6ct04/goodtimes_for_the_silverbuyers_stack_silver/,1,GOODTIMES FOR THE SILVERBUYERS STACK SILVER, amp x200B https preview redd it 8zpt7uqadjx61 png width 990 amp format png amp auto webp amp s 3d9ace989051a4e4b4d58ceb2870f8bc4e480226
1874,n6ct4s,t2_91mjonvd,1620322579,/r/wallstreetbets/comments/n6ct4s/took_out_4k_in_student_loans_last_may_and_dropped/,1,Took out 4k in student loans last May and dropped out of college Used that money to buy BA and TSLA shares Sold those for a loss Bought 1 year AAPL puts last May My college wants 5k from me lol I also bought GME at 383 each,
1875,n6ct8t,t2_a0d9n9hv,1620322586,/r/wallstreetbets/comments/n6ct8t/criminal_short_volume_lets_roll/,1,Criminal short volume let s roll,Everyone needs to go look at xers The short volume it through the roof Shorted from all time high at 27 down to 3 yet sales and EPs are going way up It s time to let them know about WSB
1876,n6ctan,t2_8kyc2qpr,1620322590,/r/wallstreetbets/comments/n6ctan/easy_there_i_cant_handel_so_much_info_at_the_same/,1,Easy there I can t handel so much info at the same time I am a retard remember ,
1877,n6cu94,t2_bz0buxil,1620322659,/r/wallstreetbets/comments/n6cu94/dnmr/,1,Dnmr,Buy Dnmr
1878,n6cua2,t2_488xglqk,1620322661,/r/wallstreetbets/comments/n6cua2/petition_to_investigate_sabby_a_market_manipulator/,1,Petition to investigate SABBY a market manipulator , https www change org p phil murphy investigation into sabby management llc original footer petition id 21555735 amp algorithm promoted amp source location petition footer amp grid position 11 amp pt AVBldGl0aW9uAEXhTQEAAAAAYAmt8Npbu7MzOTJmZmFiZQ 3D 3D https www change org p phil murphy investigation into sabby management llc original footer petition id 21555735 amp algorithm promoted amp source location petition footer amp grid position 11 amp pt AVBldGl0aW9uAEXhTQEAAAAAYAmt8Npbu7MzOTJmZmFiZQ 3D 3D 
1879,n6cuqr,t2_986xq9hs,1620322696,/r/wallstreetbets/comments/n6cuqr/im_trying_to_figure_it_out_i_really_am/,1,I m trying to figure it out I really am,
1880,n6cvek,t2_zr8g2,1620322743,/r/wallstreetbets/comments/n6cvek/root_because_short_gamma_squeeze_low_float_and_of/,1, Root because Short gamma squeeze low float and of shares outstanding tendies Feel the Bern,
1881,n6cvg4,t2_8vxj2jlq,1620322747,/r/wallstreetbets/comments/n6cvg4/dear_wsb_can_i_get_a_ban_to_show_off_on/,1,Dear WSB CAN I GET A BAN TO SHOW OFF ON R SUPERSTOONK,Hello my dearest hedgie fuks Lately ive been seeing all my bestestest apes being banned and I would like to request a permanent ban because I m feeling left out of the bettererde subreddits Looking forward to hearing your response Thanks in advance you fuckers 
1882,n6cvk6,t2_8khck6z6,1620322754,/r/wallstreetbets/comments/n6cvk6/silver_price_is_going_up_what_do_you_guys_think/,1,SILVER PRICE IS GOING UP What do you guys think ,
1883,n6cvqu,t2_13jn57,1620322766,/r/wallstreetbets/comments/n6cvqu/3_earnings_trades_for_tonight_all_to_the_downside/,1,3 Earnings trades for tonight all to the downside , These are risky but the best I could find GRPN 45p 1 20 EXPE 160p 2 27 BYND 115p 4 75 All 5 7 expiry all long puts
1884,n6cwez,t2_16ne1oxo,1620322817,/r/wallstreetbets/comments/n6cwez/top_notch_dd/,1,Top Notch DD ,
1885,n6cwp3,t2_bd7ai,1620322837,/r/wallstreetbets/comments/n6cwp3/a_simple_post_about_pltr/,1,A simple post about PLTR, removed 
1886,n6cx08,t2_7faruo5v,1620322862,/r/wallstreetbets/comments/n6cx08/cxw/,1,CXW ,Biden put me in Core Civic jail is is time to cut my hand cuffs off 
1887,n6cxj5,t2_986jm,1620322899,/r/wallstreetbets/comments/n6cxj5/scammers_look_to_be_back_at_it_again/,1,Scammers look to be back at it again ,This is the same thing that WSB telegram started doing and the telegram referred to this channel before it scammed all of those people and closed the group I believe this person is in bed with that person or it can be the same person I saw an article saying that person got away with 2 000 000 of folk money and that was from only one wallet I took pictures of the wallets they posted and I hope people don t fall for this stuff The account on Telegram is called Bltcoin Crypt0 Signals Nicole with over 1 000 000 members It s doing exactly what that WallStreetBets telegram was doing Listing wallets telling folks to send money to them for a presale and to message a bot I m just trying to help members here not get scammed amp x200B Please Be Safe Out Here 
1888,n6cxmm,t2_8vxj2jlq,1620322906,/r/wallstreetbets/comments/n6cxmm/ban_me_you_fucks/,1,BAN ME YOU FUCKS,CANB I GET A BAN YOU RETARDED FUCKS PLS
1889,n6cy11,t2_a4o3knfs,1620322934,/r/wallstreetbets/comments/n6cy11/wallstreetbets_telegram_group_issues/,1,WallStreetBets Telegram group issues,Dear mods of the Telegram group This has been banned from the channel Help a fellow ape with out and let me back in I did not talk about kryptos or spam or use profanities Yours truly Ps I ll give you one of these if you let me back in 
1890,n6cyhn,t2_5lqdvycl,1620322966,/r/wallstreetbets/comments/n6cyhn/thanks_but_no_thanks_for_the_advice_you_wsb/,1,Thanks but no thanks for the advice you WSB infiltrating HF shills , amp x200B https preview redd it 7itndlxcejx61 jpg width 500 amp format pjpg amp auto webp amp s e135069c4eae862a0aae21d58874bab620cd9838
1891,n6cyj4,t2_8vxj2jlq,1620322969,/r/wallstreetbets/comments/n6cyj4/attempt_3_ban_me_you_hedgie_fucks/,1,ATTEMPT 3 BAN ME YOU HEDGIE FUCKS,CAN YOU LIKE BAN ME I NEED TO SHOW OFF ON THE BETTER SUBS
1892,n6cz2h,t2_1548pe,1620323004,/r/wallstreetbets/comments/n6cz2h/a_lot_of_shorts_on_tilray/,1,A lot of Shorts on Tilray,40 of the stock are being shorted by the same hedge funds that were on GameStop Are we retards going to let that stand 
1893,n6cz51,t2_933teiq4,1620323010,/r/wallstreetbets/comments/n6cz51/inflation_economy_market_crash/,1,Inflation Economy Market Crash,Let s start with this it isn t an if it s a when we are going to see this market crash Yeah with everything at hand we see it coming but it s screaming for help right in front of our eyes All of this money being pumped out by the feds this past year has done more than we thought as well as the people receiving these funds Now there is way more money in the loop of the economy but somethings missing the money going to the people isn t going back into the economy it s either getting thrown into savings or pouring into shit coins stonks etc So now we have all this money pouring into those and not our actually economy and back in the business hands what does that mean INFLATED none of the money is being brought back into the economy causing those prices to be very inflated Bottom line here people is we have an absolute blood bath on the market Source Market Insider
1894,n6czco,t2_8vxj2jlq,1620323025,/r/wallstreetbets/comments/n6czco/attempt_4_of_trying_to_get_banned/,1,ATTEMPT 4 OF TRYING TO GET BANNED,
1895,n6czrx,t2_ad0o088f,1620323059,/r/wallstreetbets/comments/n6czrx/wank_wank_not_selling/,1,Wank wank not selling,
1896,n6d00v,t2_ad0o088f,1620323077,/r/wallstreetbets/comments/n6d00v/wank_wank_not_selling/,1,Wank wank not selling,
1897,n6d02s,t2_nifwjf5,1620323081,/r/wallstreetbets/comments/n6d02s/winter_is_coming/,1,Winter is coming,Brace yourselves RKT loser posts are coming 
