,postid,author,created_utc,permalink,score,title,selftext
1065,n65k8l,t2_11r98fes,1620302223,/r/wallstreetbets/comments/n65k8l/stan_lee/,1,Stan Lee,Who s a fan of Stan Lee There s a company being heavily shorted that needs superheroes It doesn t take a GeNiUS to guess the company s ticker I can t totally mention it here because it s not a billion dollars but the company has a short volume of over 55 for like three months straight Stan Lee is a creation of one of their projects and the voiceover work is done by Arnold Schwarzenegger They have a deal with Marvel studios and Shaquille O Neil has a show coming out this fall called Shaq s Garage Huge potential but shorters love it because of the float 
1066,n65kfw,t2_bpcl2lmt,1620302251,/r/wallstreetbets/comments/n65kfw/what_are_your_guys_thoughts_on_this_the_picture/,1,What are your guys thoughts on this The picture on the left is from the 4th and the one on the right is from yesterday and the volume shot up to 60mil and 40mil shorted shares ,
1067,n65kxk,t2_9w3ezr3r,1620302295,/r/wallstreetbets/comments/n65kxk/nokia_will_make_3_for_every_5g_smartphone_sold/,1,Nokia will make 3 for every 5G smartphone sold Engadget,
1068,n65l3f,t2_9wfw9d3l,1620302309,/r/wallstreetbets/comments/n65l3f/anyone_on_yolo_bsc/,1,Anyone On YOLO bsc ,
1069,n65msc,t2_7rhgmic3,1620302450,/r/wallstreetbets/comments/n65msc/tony_benns_five_questions_for_the_powerful/,1,Tony Benn s five questions for the powerful , removed 
1070,n65mte,t2_4k8qvu06,1620302452,/r/wallstreetbets/comments/n65mte/melvin_please_save_wsb_and_short_gme_into/,1,Melvin please save WSB and short GME into bankruptcy ,Seriously Fuck GME and fuck every single ape in their eye sockets 
1071,n65n5m,t2_byye2n3j,1620302482,/r/wallstreetbets/comments/n65n5m/for_science_why_do_you_make_such_retarded_trades/,1,For science Why do you make such retarded trades ,I have followed wsb since 2016 and made some nice gains with AMD Naturally I chose to analyze why we make such utterly irrational investment decisions on here for my master thesis amp x200B I would really appreciate it if you could help a brother out and fill out my survey https hhs qualtrics com jfe form SV d1l2B8IcZIa4wu2 https hhs qualtrics com jfe form SV d1l2B8IcZIa4wu2 It takes about 6min and contains some questions about your personality and investment behavior amp x200B Thank you 
1072,n65nc9,t2_61jhsj63,1620302500,/r/wallstreetbets/comments/n65nc9/wsb_test_fu_hedgies_gme_to_the_moon_hodl_apes/,1,WSB Test Fu Hedgies GME to the moon Hodl apes together strong ,No financial advice or advise for any advize 
1073,n65nxy,t2_bcvygafq,1620302554,/r/wallstreetbets/comments/n65nxy/the_gym_rat/,1,The gym rat,Killed ETN s aliked 
1074,n65o9q,t2_8x1hifs4,1620302584,/r/wallstreetbets/comments/n65o9q/robinhood_and_friends_at_the_zoo/,1,RobinHood and Friends at the Zoo,
1075,n65ol9,t2_6cse89j5,1620302603,/r/wallstreetbets/comments/n65ol9/reply_from_sec/,1, Reply from SEC ,
1076,n65p1m,t2_blw430n7,1620302646,/r/wallstreetbets/comments/n65p1m/ankr_wolf_the_ankr_super_hero/,1,Ankr wolf the Ankr super hero,
1077,n65pif,t2_57a9kifw,1620302694,/r/wallstreetbets/comments/n65pif/stock_cronos_cron/,1,Stock Cronos CRON,Helllo guys whats your opininon about Cronos Friday earnings i am kinda scared but i am already invested pretty hard D
1078,n65pj3,t2_a1kcuyff,1620302696,/r/wallstreetbets/comments/n65pj3/get_your_shib_before_the_dex_launches/,1,Get your SHIB before the DEX launches ,
1079,n65pq6,t2_3ommc9jb,1620302714,/r/wallstreetbets/comments/n65pq6/mods_are_sleeping_bots_as_well/,1,Mods are sleeping Bots as well, removed 
1080,n65pt6,t2_9eo21phe,1620302720,/r/wallstreetbets/comments/n65pt6/forget_gme_here_is_the_real_short_squeeze/,1,Forget GME here is the real short squeeze littlemenwithbigmouths lol,
1081,n65q8b,t2_8ueoy1xc,1620302758,/r/wallstreetbets/comments/n65q8b/gme/,1,GME,OMG did you guys see how GME is going to the moon today I am not talking about a one day squeeze but a fresh gallon of lemon juice I don t want to say I told you so but I told you so 
1082,n65q9f,t2_7xam2fui,1620302762,/r/wallstreetbets/comments/n65q9f/the_next_big_one/,1,The next big one,Guys massive potential in dogecoin2 org massive go to r dogecoin2 point 0 and read the thesis See u on the moon
1083,n65qst,t2_72q995qi,1620302817,/r/wallstreetbets/comments/n65qst/cant_go_tits_up/,1,Can t go tits up,
1084,n65qut,t2_ax9spe9b,1620302822,/r/wallstreetbets/comments/n65qut/dscr_discovery_minerals_selects_alt_5_sigma_for/,1, DSCR Discovery Minerals Selects Alt 5 Sigma for the Development of its Discovery Coin and Payment Gateway, removed 
1085,n65qxa,t2_8k1d7buh,1620302830,/r/wallstreetbets/comments/n65qxa/expi/,1,Expi,Whats your take on expi and its high short interest Do you guys think its prices is going to recover 
1086,n65r62,t2_blw430n7,1620302853,/r/wallstreetbets/comments/n65r62/i_am_ankr_wolf_and_im_saying_im_here_to_stay/,1,I am Ankr wolf and I m saying I m here to stay ,
1087,n65rl9,t2_a5r4wfcd,1620302895,/r/wallstreetbets/comments/n65rl9/mods_sold_wsb_ownership_to_a_hedgeprove_me_wrong/,1,Mods sold WSB ownership to a hedge prove me wrong ,I mean if you got offered a few hundred grand to turn over everything wouldn t you 
1088,n65rvh,t2_9zmfdr2i,1620302923,/r/wallstreetbets/comments/n65rvh/tick_tock_tick_tock_sos/,1,Tick tock tick tock SOS ,
1089,n65s30,t2_a1vr40kh,1620302943,/r/wallstreetbets/comments/n65s30/are_you_the_one_who_slaps_or_get_slapped/,1,Are you the one who slaps or get slapped ,
1090,n65s3e,t2_573lvn8w,1620302943,/r/wallstreetbets/comments/n65s3e/mods_are_asleep_fuck_the_griffin/,1,Mods are asleep Fuck the griffin ,
1091,n65t19,t2_bbxb92b6,1620303036,/r/wallstreetbets/comments/n65t19/you_morons_better_show_your_rkt_loss_porn/,1,You morons better show your RKT loss porn,I want to see that shit at market open I need some release 
1092,n65t28,t2_blw430n7,1620303039,/r/wallstreetbets/comments/n65t28/_/,1, ,
1093,n65ukx,t2_yfvym2q,1620303184,/r/wallstreetbets/comments/n65ukx/explanation_the_power_of_operating_leverage_in/,1,EXPLANATION the power of operating leverage in the 2021 recovery,Absolutely the best explanation and infographics that explain the power of operating leverage in exploding earnings 5 10X after recessions https meanwhileinmarkets substack com p the power of operating leverageand https meanwhileinmarkets substack com p the power of operating leverageand 
1094,n65uy3,t2_a0sa8qan,1620303222,/r/wallstreetbets/comments/n65uy3/bngo_train_is_about_to_depart_again_its_been/,1,BNGO Train is about to Depart again It s been squeezed like a lemon time to make it juicy again ,Looking to bring the heat to BNGO Running to to some walls keeping it from moving forward Figured what better way the to fire the Train back up and make a run out of it All Aborad Who s In
1095,n65v28,t2_scis3,1620303234,/r/wallstreetbets/comments/n65v28/wsb_is_just_a_piump_and_diump_now_trust_gme_only/,1,WSB IS JUST A PiUMP AND DiUMP NOW TRUST GME ONLY ,WSB has turned into one massive pump and dump sham Fuck you WSB GME TO THE MOON 
1096,n65vsz,t2_vj2bbws,1620303297,/r/wallstreetbets/comments/n65vsz/go_proxy_vote_gme/,1,Go Proxy Vote GME ,Go Proxy Vote GME 
1097,n65yrs,t2_7a29z31w,1620303578,/r/wallstreetbets/comments/n65yrs/uranium_dd/,1,Uranium DD,TL DR Supply and demand fundamentals require the price of uranium to go up or the lights will go out The nature of the uranium market security of supply means that when price insensitive utilities see prices rising they get squeezed This is not priced in and when this sector runs it has historically provided 20x returns Background Nuclear provides 20 of the electricity for the United States and 50 of its clean energy Greta Thornberry probably gets steamy enough thinking about Uranium to run her own reactor The market cap of all uranium miners is roughly 20 billion For reference with 20 billion you could buy all of the companies that provide fuel for over 50 of the US clean energy and 11 of electricity generated worldwide or you could buy 1 of the following 3 of tesla all of Quantumscape half of Palantir 1 5 of Zoom or 1 3 of the market cap of the unsayable barking corn These could all disappear tomorrow and it wouldn t have too drastic of an impact but you cant just get rid of 11 of electricity worldwide without drastic consequences Nuclear isn t going anywhere anytime soon in fact it looks like it is heating up China and India are making investments into nuclear China is building 11 reactors India 7 the EU is looking to change its taxonomy to include nuclear as ESG friendly America under Trump recently formed the Nuclear Fuel Working group to build up reserves of Uranium and Biden looks set to continue the path being the first democrat in 40 years to support nuclear Carbon neutral cant happen without nuclear solar and wind have Capacity Factors of roughly 20 30 while nuclear has a 90 CF It is beginning to show with many countries extending the licenses to operate of nuclear plants by 20 30 years Sleepy s green new plan talks about advanced reactors likely Small Modular Reactors SMR s that could be very standardized reducing the risk of problems for educational purposes nuclear reactors don t explode they operate with high pressure temperature water that creates hydrogen via hydrolysis which can create a Hindenburg like explosion The Uranium is 3 5 enriched enough to keep the fission process moving but not enough to create a real explosion All of the waste ever generated via uranium would fit on a football field stacked about 10ft tall Nuclear is built into the infrastructure of today and currently there is no substitute for Uranium Talk of thorium tokamaks and fast breeders only 3 out of 444 current nuclear reactors is all well and good but it is not where we are today and for the next decade as building these things is no fast matter the average build time of a reactor is 109 months You all might be retarded but you re not dumb I don t want to see any talk about how nuclear is bad for the environment in the comments amp x200B Excerpt from American Jobs Plan Fact Sheet https preview redd it n5hbubp077x61 png width 800 amp format png amp auto webp amp s 0596fa173950ea5c272d21bd0abe24d863f73467 amp x200B Processing img qjfmhda277x61 Structural supply deficit We use roughly 180m lbs of uranium per year and we mine around 130m lbs per year For the innumerate among us that s a 50m lb year deficit that needs to come from somewhere Where does this come from After Fukushima in 2011 Japan started to shut down nuclear reactors and had lots of inventory that they needed to sell flooding the market We can also re enrich the tail assays of spent fuel rather than storing and disposing of it With excess capacity on the market the opportunity cost of underfeeding is lowered and more enrichers started to do this enrichers have caps on the amount of enriching they can do As mining and enriching of natural uranium increases more enrichers will have to switch their facilities over and underfeeding will decrease Utilities also contracted many years in advance at high prices that made sense for the miners during the previous bull cycle these contracts are beginning to expire These and more factors caused uranium prices to plummet to the current level of 30 lb on the spot market At these levels it does not make sense for many mines to operate and thus the 50m lb year deficit Obviously this cannot continue indefinitely or the lights will go out At some point the cost of uranium must go up to incentivize miners to begin mining again The average incremental price to mine uranium is around 60 lb so it is safe to assume that they will not begin mining again until they get contracts for around this price depending on the mine and the Capex necessary to get it out of care and maintenance Uranium cannot be procured immediately and is done years in advance During the last bull cycle many utilities signed contracts for 5 years These contracts are beginning to fall off leaving a lot of uncovered demand for utilities in the future They have not been worried about it thus far carry traders have been buying in the spot and selling over the next year or two to these utilities who are happy not signing long term contracts while the price has been falling When the tide turns you can expect fuel buyers to again begin signing long term contracts to ensure security of supply Once prices start rising the stampede of fuel buyers looking to sign long term contracts to secure supply will begin It is human nature in addition to the fact that it is a fireable offense to not be able to procure Uranium for your reactor while it is not a fireable offense to grossly overpay as long as others are doing the same Security of supply is very important in this industry China recently paid almost half a billion dollars for a 49 equity stake in a Kazakhistan based miner They will still have to pay the market price for the Uranium but they get first dibs on almost half of the Uranium mined The utilities are highly price insensitive it is much more costly to have a multi billion dollar nuclear reactor go offline than pay higher prices for Uranium which make up about 3 of the cost to run the reactor to put it into perspective When the first utilities begin signing these contracts the others will quickly follow suit The price of uranium went from 10 lb in 2003 to over 130 lb in 2008 Over the next several years as uncovered demand begins to start showing up the utilities will realize that almost a decade of underpaying for Uranium is now going to come knocking 60 lb is the floor price capital markets could easily propel the price way higher https preview redd it fnpyafs577x61 png width 708 amp format png amp auto webp amp s 0d4852f8b8347c666df779887cdcd8bf6c4e527a Catalysts So when will excess inventories be drawn down Brandon Munro of Bannerman had the following to say about uranium major Kazatomprom s purchases from the spot market to fulfill obligations what is interesting about Kazatomprom s news is not that they need to buy from spot but rather that they have started purchasing so early Other Uranium miners are purchasing from the spot market as well If miners thought there was plenty of supply they would run down their inventories and repurchase at a later date This is not the case and is very revealing Denison recently purchased 2 5m lbs of uranium that required 17 different contracts with 12 counterparties not very indicative of the oversupply we have had in prior years I and all the experts I have been listening to believe that the spot market is getting thin This is crucial when fuel buyers start to see the spot market as thin is when the feedback loop begins But no one wants to be the first mouse to eat the cheese Vimy Resources CEO sums up his conversations with fuel buyers by saying We d rather be the last guy in at 65 than the first guy in at 50 no one wants to be the price maker the first guy going in at above the odds But no one minds being the last guy because You re the hero you secured the supply We are playing a game of musical chairs the music is gonna stop and everyone is just going to grab a chair and pay what they have to Mike Alkin says paraphrasing again They don t get rewarded if they save the rate payers money and they don t get penalized if they have to pay up as long as the peers are doing it They just have different incentives The supply will propel it to 50 lb to continue production 60 lb to undertake new exploration production and capital markets can take it much higher A capital market vessel is that could also act as a catalyst is Sprott Asset Management Sprott is entering into an agreement with Uranium Participation Corp to form the Sprott Physical Uranium Trust It is expected to begin trading on American markets in the second half of 2021 currently there is the Uranium Participation Corp which does this poorly and not on American markets The fund will begin buying and holding physical Uranium similar to GLD holding gold putting further pressure on supply levels Remember how Denison had to have 17 different transactions to purchase 2 5m lbs Sprotts gold trust is 4 6b and its silver trust is 2 4b It will market to all of its commodities holders even a market cap of 1 10 or 1 5 of these funds could be a serious catalyst towards causing utilities to sign long term contracts This happens right around the time that the uranium contracting cycle begins When hedge funds sense blood in the water they will join the frenzy as well there is speculation that the funds are already building their positions Commodities are a good place to be during times of inflation and it appears as though inflation is coming as Jpow keeps the money printer running and lets inflation heat up This could be a good hedge against high growth tech stocks amp x200B https preview redd it 0a6bd57777x61 png width 852 amp format png amp auto webp amp s 0235bf3757b9c2d755fbb440c66e5b4b5b224289 amp x200B https preview redd it o367pia877x61 png width 687 amp format png amp auto webp amp s b23fa8b2bc7b2ee3e7221d985cbde925ec1fc48f Conclusion Uranium miners have begun to move upwards indicating the sentiment shifting that the cycle is turning I don t have a stock to sell you there are only around 40 on the market and I chose a few to begin building my position with rather than taking the risk on one Below is a chart with some information about different mines to help you get started There is much more that could should be added but for the sake of brevity I will limit it to this It is now time to wait for the price discovery in this small opaque market to begin stated in layman terms this is not priced in amp x200B Summary of Mines https preview redd it k0zhu3l977x61 png width 1497 amp format png amp auto webp amp s c02887e19a096d19d1774290d5dcdad0abeac022 
1098,n65yt2,t2_j23iy,1620303582,/r/wallstreetbets/comments/n65yt2/cant_trade_etc_right_now_why/,1,Can t trade ETC right now why ,Why is it a standard practice to halt trading on coins that are experiencing big gains First Robinhood with and now Webull with EtC I can t buy it right now Is it experiencing THAT MUCH GROWTH 
1099,n65zls,t2_bamb2icy,1620303654,/r/wallstreetbets/comments/n65zls/i_have_yolod_85000_into_sos_hodling_almost_17000/,1,I have YOLO d 85 000 into SOS HODLing almost 17 000 shares now albeit across several accounts HSA s IRAs individual accounts In comparison to RIOT and MARA significantly undervalued They have a noncrypto business that makes money They are releasing a digital wallet and exchange soon ,
1100,n65zls,t2_bamb2icy,1620303654,/r/wallstreetbets/comments/n65zls/i_have_yolod_85000_into_sos_hodling_almost_17000/,1,I have YOLO d 85 000 into SOS HODLing almost 17 000 shares now albeit across several accounts HSA s IRAs individual accounts In comparison to RIOT and MARA significantly undervalued They have a noncrypto business that makes money They are releasing a digital wallet and exchange soon ,
1101,n65zti,t2_boqiiu5k,1620303673,/r/wallstreetbets/comments/n65zti/i_need_to_go_to_sleep_because_tomorrow_im/,1,I need to go to sleep because tomorrow I m ,
1102,n65zzx,t2_blw430n7,1620303689,/r/wallstreetbets/comments/n65zzx/_/,1, ,
1103,n66035,t2_4vdz3iqh,1620303697,/r/wallstreetbets/comments/n66035/i_need_a_moonshot/,1,I need a moonshot,What s going up a lot today I had to pay money to fix some plumbing issues and now I turn to to help me recover my expenses I need serious DD 
1104,n660dh,t2_35fwmtul,1620303728,/r/wallstreetbets/comments/n660dh/_/,1, ,
1105,n660ij,t2_a1kcuyff,1620303740,/r/wallstreetbets/comments/n660ij/shiba_inu_is_launching_its_own_dex/,1,SHIBA INU is launching its own DEX ,
1106,n660ny,t2_68jds4xa,1620303754,/r/wallstreetbets/comments/n660ny/all_gme_hodlers_please_seek_refuge_in_r_super/,1,All GME HODLers please seek refuge in r super stonk, removed 
1107,n660o3,t2_80q7ew26,1620303754,/r/wallstreetbets/comments/n660o3/michael_crawford_on_linkedin_nfts_featuring/,1,Michael Crawford on LinkedIn NFTs Featuring Celebrated College and Pro Football Star Tim Brown,
1108,n660yd,t2_9fmls4l,1620303781,/r/wallstreetbets/comments/n660yd/lol_i_sold_it_all_because_wsb_convinced_me_now/,1,Lol I sold it all because WSB convinced me Now that I have your attention Also this You ban apes Hope you don t sleep at night You are the problem with the world ,
1109,n660z0,t2_blw430n7,1620303782,/r/wallstreetbets/comments/n660z0/_/,1, ,
1110,n661h8,t2_6kon460y,1620303828,/r/wallstreetbets/comments/n661h8/mods/,1,Mods , oge to the MOOOOON
1111,n661kf,t2_u8rl3,1620303835,/r/wallstreetbets/comments/n661kf/gme/,1,gme,It s a stock Does anyone like it 
1112,n661ri,t2_4lx0jajl,1620303853,/r/wallstreetbets/comments/n661ri/ape_buy_more_sndl_great_for_ape/,1,Ape buy more SNDL GREAT for ape, SNDL looking delicious 
1113,n661rl,t2_6qh9pp8e,1620303853,/r/wallstreetbets/comments/n661rl/yes_we_are_landing_the_moon_on_july_3_apollo11/,1,Yes we are landing the Moon on July 3 Apollo11, https ap11 org https ap11 org amp x200B https preview redd it 3i3dtrnothx61 png width 1252 amp format png amp auto webp amp s d72a1d541daca184fcf1ae1cabffa41b8ea67b10
1114,n663s7,t2_b4jlwoj6,1620304048,/r/wallstreetbets/comments/n663s7/if_we_want_the_squeeze_lets_make_sure_our_shares/,1,If we want the Squeeze Let s make sure our shares aren t going on loan to our enemies hegies called your financial institution and check it won t cost you anything In webull you must opt out,
1115,n663v0,t2_byw57vlw,1620304054,/r/wallstreetbets/comments/n663v0/going_up_buying_more/,1,Going up buying more,
1116,n663yi,t2_5m7irmef,1620304062,/r/wallstreetbets/comments/n663yi/fast_premarket_screener/,1,fast pre market screener,
1117,n663z1,t2_a2y77ogn,1620304064,/r/wallstreetbets/comments/n663z1/wsb_my_first_home/,1,WSB My First Home,People keep saying fuck WSB and maybe your right there are to many termites in the house to fix it now This place will never be what is was before GME but it still led millions of us to entirely different world and for that I will always love this place This place was the Alamo its where we made out stand for months We were attacked misguided bombarded with lies and false narratives Thankyou WSB The bots will die off and hopefully we can recover WSB one day 
1118,n6647u,t2_1omu78w,1620304086,/r/wallstreetbets/comments/n6647u/mito/,1, MITO ,soon come
1119,n664a4,t2_a0zlzc96,1620304092,/r/wallstreetbets/comments/n664a4/anyone_getting_nakd/,1,Anyone getting NAKD,Get NAKD
1120,n664wf,t2_65kk7hfz,1620304152,/r/wallstreetbets/comments/n664wf/robinhood_vs_webull_vs_otheres/,1,ROBINHOOD vs WEBULL vs OTHERES,Which investing app should I use 
1121,n664xm,t2_ax9spe9b,1620304155,/r/wallstreetbets/comments/n664xm/bbig_vinco_ventures_subsidiary_evnt_platform/,1, BBIG Vinco Ventures subsidiary EVNT Platform disrupts NFT Technology with launch of E NFT s, removed 
1122,n665dx,t2_bwkwc2cg,1620304196,/r/wallstreetbets/comments/n665dx/is_there_any_one_holding_coin_will_it_reach_1/,1,Is there any one holding coin will it reach 1 Just curious,
1123,n665la,t2_a1hp49kt,1620304212,/r/wallstreetbets/comments/n665la/i_need_your_help_evil_funds_are_taking_over/,1,I need your help Evil Funds are taking over Bacanora Lithium,It s a company I ve invested in and Ganfeng are making a takeover offer 4 5 times below it s true value Can people please tweet Elon4Bacca and BlockGanfeng I m going to lose all my trendies in this dodgy deal 
1124,n665p0,t2_a1ej9ajf,1620304221,/r/wallstreetbets/comments/n665p0/bacanora_lithium/,1,Bacanora Lithium, blockgangfeng elonforbaca
1125,n665r7,t2_8x1hifs4,1620304227,/r/wallstreetbets/comments/n665r7/a_visit_to_the_wsb_zoo/,1,A Visit To The WSB ZOO,
1126,n6669o,t2_9exhwnar,1620304276,/r/wallstreetbets/comments/n6669o/3819_of_the_sos_free_float_is_short_hedgies_are/,1,38 19 of the SOS free float is SHORT Hedgies are all in Time For A Squeeze,I m going to keep it short and sweet for you fellow autists Posting pictures cuz like me I know you have trouble reading SOS has been under a relentless short attack for 2 3 months now This is a 50 stock all day and primed for a squeeze They have 4 times the revenue of RIOT which based on market cap sells 4X higher Per the SEC earnings release yesterday they are PROFITABLE 
1127,n666fk,t2_a046raw4,1620304292,/r/wallstreetbets/comments/n666fk/lordstown_motors_ride_earnings_report/,1,Lordstown Motors RIDE Earnings Report,I have been following RIDE since the beginning of December 2020 I am very confident in Lordstown Motors enough so that I sold all of my shares of everything and bought only 20 October 15th calls I am not asking anybody to invest in RIDE now Just put it on your calendars to watch it on Monday May 17th Earnings report comes out before the market opens 
1128,n666qd,t2_a1kcuyff,1620304319,/r/wallstreetbets/comments/n666qd/buy_now_thank_later_shiba_inu/,1,buy now thank later SHIBA INU,
1129,n666ts,t2_613x6zhg,1620304328,/r/wallstreetbets/comments/n666ts/greetings_from_across_the_pond/,1,Greetings from across the pond ,
1130,n667ln,t2_blw430n7,1620304393,/r/wallstreetbets/comments/n667ln/_/,1, ,
1131,n667zp,t2_3oi5mf5z,1620304432,/r/wallstreetbets/comments/n667zp/has_uanalfarmer2_ever_resurfaced/,1,Has u Analfarmer2 ever resurfaced ,It s been a while To no surprise this board remains a bunch of retards who have somehow defied the laws of impossibility and became even more retarded I never stopped wondering if AnalFarmer ever resurface Update anyone Mods Gay 
1132,n66825,t2_9wwmqjwl,1620304439,/r/wallstreetbets/comments/n66825/where_is_wsb_gain_porn_for_meme_stocks_does_any/,1,Where is WSB gain porn for meme stocks Does any exist ,
1133,n66901,t2_a1kcuyff,1620304518,/r/wallstreetbets/comments/n66901/buy_now_thank_later_shiba_inu/,1,buy now thank later SHIBA INU,
