,postid,author,created_utc,permalink,score,title,selftext
0,n5ugy6,t2_bnyg0pht,1620259636,/r/wallstreetbets/comments/n5ugy6/adc_therapeutics_zynlonta_loncastuximab/,1,ADC Therapeutics ZYNLONTA loncastuximab tesirine lpyl Added to National Comprehensive Cancer Network Clinical Practice Guidelines in Oncology for B cell Lymphomas Business Wire,
1,n5uhrx,t2_6gu6ldw6,1620259707,/r/wallstreetbets/comments/n5uhrx/im_really_tryna_help_my_family_and_im_asking_for/,1,I m really tryna help my family and I m asking for wsb help how do I learn these stocks so i can help them is there sb willing to give knowledge out of Courtesy,
2,n5ui27,t2_66u2jcba,1620259730,/r/wallstreetbets/comments/n5ui27/its_not_much_but_its_honest_work/,1,It s not much but it s honest work,
3,n5uj8y,t2_a26yagui,1620259832,/r/wallstreetbets/comments/n5uj8y/can_i_recover_from_this_iq_13_call_options/,1,Can I recover from this IQ 13 call options expiring 5 14,
4,n5ujjp,t2_ydxhe,1620259858,/r/wallstreetbets/comments/n5ujjp/which_one_of_you_retards_is_responsible_for/,1,Which one of you retards is responsible for current lumber prices And where do I throw my ,
5,n5uk1u,t2_3k96r0jq,1620259901,/r/wallstreetbets/comments/n5uk1u/setting_limit_sell_with_a_server_crash/,1,Setting limit sell with a Server crash,So I was thinking about the Robinhood server crash If you had limit buy or sell or a stop order in place And it reached its prices during a time when Robinhood was not letting people buy or sell would your limit or stop still execute 
6,n5uk1z,t2_aa0lnp8p,1620259901,/r/wallstreetbets/comments/n5uk1z/ctxrjust_sayin/,1,CTXR JUSt SAYIN ,
7,n5ul49,t2_8wow3qax,1620259998,/r/wallstreetbets/comments/n5ul49/join_pi_refcode_eazyecport/,1,Join Pi ref code eazyecport ,
8,n5ule1,t2_aa0lnp8p,1620260025,/r/wallstreetbets/comments/n5ule1/ctxrjust_sayin/,1,CTXR JUST SAYIN ,
9,n5um3q,t2_a1g8srsk,1620260092,/r/wallstreetbets/comments/n5um3q/oil_oil_oil/,1,Oil oil oil,
10,n5umlg,t2_3w8pia6h,1620260139,/r/wallstreetbets/comments/n5umlg/ill_take_my_ban_as_a_badge_of_honor/,1,Ill take my ban as a badge of honor,
11,n5umz0,t2_9y49bnpw,1620260177,/r/wallstreetbets/comments/n5umz0/weed_investment/,1,Weed investment ,Is Tilray a good company to invest in 
12,n5un1l,t2_ax28djzy,1620260183,/r/wallstreetbets/comments/n5un1l/psfe_shorts/,1,psfe shorts ,
13,n5untg,t2_8z3p1gjr,1620260246,/r/wallstreetbets/comments/n5untg/honest_question_what_are_your_strategiesfeelings/,1,Honest question What are your strategies feelings for averaging up And don t say buy the fucking dip ,I know buying the dip is obvious however what bullish indicators or reasoning do you use DD is obviously the follow up answer Elaborate Trying to work on my thought process Concerned I average up too much rather than just holding strong and taking profit I end up either losing everything or just a good chunk of my money Being a compulsive gambler and a shitty trader doesn t help but am trying to learn 
14,n5uolv,t2_8khck6z6,1620260314,/r/wallstreetbets/comments/n5uolv/hmmmm_something_looks_very_wrong_with_silver_price/,1,Hmmmm Something looks very wrong with silver price ,
15,n5uotv,t2_bynmvsat,1620260332,/r/wallstreetbets/comments/n5uotv/putting_all_3_stimulus_checks_into_doggy/,1,Putting all 3 stimulus checks into doggy,
16,n5upfx,t2_1kodmxf1,1620260391,/r/wallstreetbets/comments/n5upfx/new_to_this_need_some_advice/,1,New to this need some advice,Hi everyone I m new to trading and have just downloaded etoro wanted some advice on if it s worth investing in cryptocurrency such as XRP Would love any info and advice thank you 
17,n5uqi5,t2_4nk8lm9m,1620260483,/r/wallstreetbets/comments/n5uqi5/sabby_just_destroyed_myt_we_need_reinforcements/,1,Sabby just destroyed MYT We need reinforcements ,
18,n5uqz5,t2_a2fwvssn,1620260525,/r/wallstreetbets/comments/n5uqz5/what_the_word_on_gme/,1,What the word on GME ,Just wondering what the word is Any new DD Anything I should be looking 4 or hoping 4 
19,n5ur30,t2_82iglf46,1620260535,/r/wallstreetbets/comments/n5ur30/whats_with_the_dip/,1,Whats with the dip,Just bought etc Whats with the dip 
20,n5us17,t2_5160pawu,1620260619,/r/wallstreetbets/comments/n5us17/tesla_has_anyone_seen_this/,1,TESLA HAS ANYONE SEEN THIS ,
21,n5us8w,t2_aaak6ofj,1620260639,/r/wallstreetbets/comments/n5us8w/hertz_stock/,1,Hertz stock,So is anyone investing in hertz right now the stocks looking pretty tasty
22,n5uso8,t2_byn7sitz,1620260673,/r/wallstreetbets/comments/n5uso8/ozsc_crybf/,1, OZSC CRYBF, OZSC CRYBF
23,n5utc8,t2_ipr9l,1620260728,/r/wallstreetbets/comments/n5utc8/the_mother_of_all_wedges_an_endgame_dd_technical/,1,THE MOTHER OF ALL WEDGES AN ENDGAME DD Technical and Fundamental Analysis with Warden, removed 
24,n5uty7,t2_9zr5ny05,1620260781,/r/wallstreetbets/comments/n5uty7/why_mx_magnachip_price_kept_going_down_despite_a/,1,Why MX magnachip price kept going down despite a take over deal ,I own this stock but have yet to receive the notification to vote The price down could be due to 1 Share holder reject the deal 2 Korea gov intervene 3 Coming Mon result surprises What s your view 
25,n5uu39,t2_54tw3187,1620260793,/r/wallstreetbets/comments/n5uu39/went_full_on_wsb_retard_over_the_last_month/,1,Went full on WSB retard over the last month ,
26,n5uv90,t2_a1sf4i4i,1620260905,/r/wallstreetbets/comments/n5uv90/vyne_ready_to_take_off/,1,VYNE ready to take off,Stock Price Forecast The 7 analysts offering 12 month price forecasts for Vyne Therapeutics Inc have a median target of 19 75 with a high estimate of 40 00 and a low estimate of 15 00 The median estimate represents a 225 21 increase from the last price of 4 50
27,n5uvre,t2_byn9fcck,1620260948,/r/wallstreetbets/comments/n5uvre/cciv_lucid_motors_testing_their_full_self_driving/,1, CCIV Lucid motors testing their Full Self Driving tech on the freeways in Fremont CA ,
28,n5uvyz,t2_8by3h2qk,1620260968,/r/wallstreetbets/comments/n5uvyz/cnbc_angry_man_valid/,1,cnbc angry man valid ,cram mer angery man from stock channel cnbc amp x200B valid do he spit do he preach tho 
29,n5uy2x,t2_5r172oe2,1620261151,/r/wallstreetbets/comments/n5uy2x/bring_me_to_the_moon_boys/,1,Bring me to the moon boys ,
30,n5uyjn,t2_56x2lvsz,1620261195,/r/wallstreetbets/comments/n5uyjn/new_to_this/,1,New to this,What are the best stocks to start with 
31,n5uysf,t2_y989k,1620261216,/r/wallstreetbets/comments/n5uysf/okay_boys_im_gonna_say_the_n_word/,1,Okay boys i m gonna say the n word,mods are asleep quickly send nude photography
32,n5uyzm,t2_a5vxtnuq,1620261236,/r/wallstreetbets/comments/n5uyzm/novovaxwhat_do_you_think/,1,Novovax what do you think ,
33,n5uz0d,t2_9ups3rmh,1620261238,/r/wallstreetbets/comments/n5uz0d/hmpq/,1,HMPQ,Let s talk about HMPQ currently holding 150k shares long term investment millionaire
34,n5uz77,t2_41a7cc27,1620261257,/r/wallstreetbets/comments/n5uz77/hnst_went_public/,1,Hnst went public,Jessica Alba s the honest company went public it s up to 22 per share atm after the IPO of 17 Worthy investment Should we avoid Trying to learn the ropes 
35,n5uz7p,t2_a1k5rdax,1620261258,/r/wallstreetbets/comments/n5uz7p/how_hedgies_are_trying_to_beat_wsb/,1,How hedgies are trying to beat WSB ,In january the world was shown the power of apes coming together for a cause Since then there has been ladder attacks We buy more Fud left and right we post DD that has been praised by the top analysts Attempts to redirect towards other stocks and get off our stocks we hodl and buy more So is it that surprising that most of our portfolios are bleeding red By driving all of our stocks down that we support they are trying to make the world believe that you would have to be a fool to invest 
36,n5uzfp,t2_1i5pmo,1620261281,/r/wallstreetbets/comments/n5uzfp/next_stop_mars/,1,Next stop Mars ,
37,n5uzq0,t2_a5o3vafw,1620261306,/r/wallstreetbets/comments/n5uzq0/rise/,1,RISE ,
38,n5v0ko,t2_16hpvr,1620261382,/r/wallstreetbets/comments/n5v0ko/did_anyone_else_try_to_buy_jessica_albas/,1,Did anyone else try to buy Jessica Alba s affection thru HNST stock ,
39,n5v0tm,t2_22h9r4ik,1620261406,/r/wallstreetbets/comments/n5v0tm/honda/,1,Honda ,Would investing into honda be a smart decision im new to investing dont have all that much money to spend but im thinking of putting 30 into honda
40,n5v1rr,t2_a11zr20i,1620261495,/r/wallstreetbets/comments/n5v1rr/gensler_raises_concern_about_market_influence_of/,1,Gensler raises concern about market influence of Citadel Securities,
41,n5v2xe,t2_mxmcf,1620261603,/r/wallstreetbets/comments/n5v2xe/candlelight_dinner/,1,Candlelight dinner,https imgur com wCs5qOi
42,n5v4id,t2_bd85o3cq,1620261741,/r/wallstreetbets/comments/n5v4id/moonmars/,1,Moon Mars ,
43,n5v4ip,t2_54ellj72,1620261742,/r/wallstreetbets/comments/n5v4ip/when_will_tech_go_back_up/,1,When will tech go back up ,Someone please Help I can t bear to watch this misery I was an idiot and put all my money into tech last year rode the bubble never sold Saw all my gains shrivel away When will this travesty end 
44,n5v50k,t2_9xplxeue,1620261787,/r/wallstreetbets/comments/n5v50k/dont_be_like_me_could_have_made_60k_from_900_and/,1,Dont be like me Could have made 60K from 900 and completely changed my life paid off debts but i sold like a bitch for 850 profit ,
45,n5v5ef,t2_9dvt7hf8,1620261821,/r/wallstreetbets/comments/n5v5ef/dont_worry_boys_just_your_quartly_reddit_page/,1,Dont worry boys just your quartly reddit page heist WSB will be fine dont stress ,
46,n5v5gk,t2_y8bnt,1620261826,/r/wallstreetbets/comments/n5v5gk/rkt_after_hours_is_making_me_a_little_nervous/,1,RKT after hours is making me a little nervous,I m just sayin
47,n5v5of,t2_iqi58,1620261847,/r/wallstreetbets/comments/n5v5of/so_reddit_appears_to_be_a_phishing_site/,1,So reddit appears to be a phishing site, amp x200B https preview redd it dzzci14dcex61 png width 1711 amp format png amp auto webp amp s 003987835b0972bfe54c05dae855bf248c809ae2
48,n5v6xm,t2_6njtpnl3,1620261969,/r/wallstreetbets/comments/n5v6xm/when_the_bears_get_around_to_covering_their/,1,When the bears get around to covering their shorts this is what it will look like HODL 4 LIFE XP KEAN DYSSO X Gabidulin MY DRUG Music Video SOMNIOHM GhettoRecords,
49,n5v73n,t2_a0g8pzl5,1620261984,/r/wallstreetbets/comments/n5v73n/i_voted/,1,I VOTED,
50,n5v7d3,t2_a8htt8vl,1620262009,/r/wallstreetbets/comments/n5v7d3/how_did_yall_vote_for_gme/,1,How did ya ll vote for GME ,Did ya ll vote all For 
51,n5v7vw,t2_pi6d9,1620262058,/r/wallstreetbets/comments/n5v7vw/found_the_next_g_a_m_e_s_t_o_p/,1,Found the next G A M E S T O P,
52,n5v7vz,t2_a1lmlmj7,1620262058,/r/wallstreetbets/comments/n5v7vz/is_it_true_they_are_trying_to_short_cciv/,1,Is it true they are trying to short cciv,
53,n5v8x8,t2_4s0x7u1p,1620262156,/r/wallstreetbets/comments/n5v8x8/petition_to_attend_gamestop_annual_shareholder/,1,Petition To Attend GameStop Annual Shareholder Meeting 6 9 21,I am here to present you your itinerary for attending the GameStop Shareholders meeting hosted on June 9 2021 In order to show our dedication for the company In the vast amounts of loyal fans gamers and shareholders we have the power in numbers One of the greatest President s of all time President Roosevelt once said speak softly carry a big stick you will go far We have a chance to make history and represent the 1 of the population who will stand for freedom in our financial markets and stand against the unjust nature that is taking place before us We are not a mob we are not a cult we are not a group of individuals who are seeking anything but integrity and trust in the ones who control the greatest financial system in the world And most importantly we are not cats Below I have included a calendar overview of the month of June flights from all three major cities including Los Angeles Chicago and New York to Dallas in the days around June 9 2021 I have also included a group of hotels that are in and around the Dallas area Dallas is an eclectic and vibrant city in which many other attractions can be visited while attending the meeting It s not opportunity for us to take a vacation take a few days off from work and truly make history amp x200B https preview redd it io1mpudadex61 png width 1324 amp format png amp auto webp amp s 851a2b3e44f011ff50ddeb172f20cae04881b8d9 GameStop Distance from DFW https preview redd it jfyvopxbdex61 png width 704 amp format png amp auto webp amp s 73092a9fac2a823aa37354fa85a131efbe7f6a38 Calendar overview for the month of June https preview redd it z3j2zlzddex61 png width 1142 amp format png amp auto webp amp s a76572ce6c5b1dde09dba7476a05c6948111c0ad Flights from all three cities across the United States https preview redd it jsxm7rnfdex61 png width 806 amp format png amp auto webp amp s 6f6a9814238f55d57c3f63e8541fc688752964ba Processing img 9rvx5iofdex61 https preview redd it 9a304vnfdex61 png width 588 amp format png amp auto webp amp s dc9ae163001e58c9dec554aa6b2ad9cd9fb2abbe Hotel information for the Dallas area amp x200B https preview redd it fhale5ridex61 png width 662 amp format png amp auto webp amp s c097dacbc06a061478d5d9867b8f57426ecf7703 69 great deal https preview redd it 44pmm4ridex61 png width 602 amp format png amp auto webp amp s 8da209008c1c1084dab8af719eb3980967faf845 Visibility and presence is our strongest strength that we have together They re hoping that we will go away forget about it and move on to something else They would never forget the day that thousands of gamers fans and shareholders came to attend the most important and hyped shareholders meeting in the history of the stock market 
54,n5v94s,t2_bsw5rfad,1620262175,/r/wallstreetbets/comments/n5v94s/i_did_a_little_more_studying_and_i_can_almost/,1,I did a little more studying and I can almost GUARANTEE there ll be massive profit put tomorrow Please take my word for it if you want a quick mini double I ll post the profit tomorrow ,
55,n5v9o7,t2_aikjbzgp,1620262221,/r/wallstreetbets/comments/n5v9o7/can_someone_explain_to_me_what_i_lost/,1,Can someone explain to me what I lost,
56,n5v9tq,t2_dhjpidb,1620262235,/r/wallstreetbets/comments/n5v9tq/just_got_rped_650_to_596_still_holding/,1,Just got r ped 650 to 596 Still holding ,
57,n5vaaj,t2_byn7sitz,1620262281,/r/wallstreetbets/comments/n5vaaj/ozsc_crybf/,1, OZSC CRYBF, OZSC CRYBF
58,n5vabm,t2_ak5e70ri,1620262284,/r/wallstreetbets/comments/n5vabm/hcmc_to_the_moon/,1,HCMC to the Moon,Let s take HCMC to the moon 
59,n5vak2,t2_a8svq8o2,1620262307,/r/wallstreetbets/comments/n5vak2/i_did_a_little_more_studying_and_i_can_almost/,1,I did a little more studying and I can almost GUARANTEE there ll be massive profit put tomorrow Please take my word for it if you want a quick mini double I ll post the profit tomorrow ,
60,n5vb5l,t2_bynpjmmn,1620262363,/r/wallstreetbets/comments/n5vb5l/hertz_stock_invest_now/,1,Hertz Stock Invest now ,Hertz stock will go to the moon GME is a false prophet put all your money into hertz the gains will be immeasurable 
61,n5vblt,t2_88sezxqz,1620262400,/r/wallstreetbets/comments/n5vblt/question_im_a_newbie/,1,Question im a newbie ,I heard that u can see the portfolio of guys like bill gates for example Why doesnt just everybody copy that It seems like a very safe strategy cuz guys like him seem to have the biggest insider knowledge ok thanks for answering 
62,n5vbm9,t2_7xc9ldq0,1620262401,/r/wallstreetbets/comments/n5vbm9/rkt_call_holders_right_now/,1,RKT call holders right now ,
63,n5vcdy,t2_e2w80,1620262467,/r/wallstreetbets/comments/n5vcdy/been_saving_this_one_for_the_right_time/,1,Been saving this one for the right time Apparently that time is when bots aren t removing shitposts,
64,n5vdi8,t2_a1inpzw6,1620262569,/r/wallstreetbets/comments/n5vdi8/whats_the_word_on_the_street/,1,What s the word on the street,I hear MNMD is the next stock that will produce millionaires what are some other stocks you folks love besides GME 
65,n5veax,t2_au57348c,1620262642,/r/wallstreetbets/comments/n5veax/hodl_amc/,1,HODL AMC ,APES HODL IM NOT GIVING IN Not a financial advisor
66,n5vegd,t2_9h2clm51,1620262656,/r/wallstreetbets/comments/n5vegd/xrp_question/,1,XRP Question,I have like 110 XRP tokens on Coinbase and just set up a wallet on XRPWALLET today I tried to follow the directions to transfer from CB to my wallet but was afraid cuz it said if the address wasn t correct then I would lose my tokens Any advice or direction on how to do this would be much appreciated Thanks 
67,n5veyg,t2_a3i7tnbn,1620262699,/r/wallstreetbets/comments/n5veyg/amc/,1,AMC,
68,n5vfgb,t2_a3i7tnbn,1620262747,/r/wallstreetbets/comments/n5vfgb/amc_forever/,1,AMC FOREVER,
69,n5vfo5,t2_ah7985or,1620262768,/r/wallstreetbets/comments/n5vfo5/bill_gates/,1,Bill gates ,
70,n5vfre,t2_69yczxm2,1620262776,/r/wallstreetbets/comments/n5vfre/have_they_turned_off_the_fucking_automod/,1,Have they turned off the fucking automod , removed 
71,n5vftl,t2_a3i7tnbn,1620262781,/r/wallstreetbets/comments/n5vftl/amc_forever/,1,AMC FOREVER,
72,n5vgxg,t2_57dl24nr,1620262873,/r/wallstreetbets/comments/n5vgxg/that_jpow_guy_hes_pretty_cool/,1,that jpow guy he s pretty cool,
73,n5vgya,t2_a5w8aavl,1620262874,/r/wallstreetbets/comments/n5vgya/well_this_is_gonna_hurt_in_the_morning_not_as_bad/,1,Well this is gonna hurt in the morning Not as bad as the rest of you retards though ,
74,n5vhcb,t2_bymresp8,1620262910,/r/wallstreetbets/comments/n5vhcb/robinthehood/,1, ROBINTHEHOOD ,
75,n5vhv3,t2_a1ms2o13,1620262958,/r/wallstreetbets/comments/n5vhv3/rolls_royce/,1,Rolls Royce,Next gme 
76,n5vhvf,t2_72b762rq,1620262959,/r/wallstreetbets/comments/n5vhvf/clov/,1,clov,honestly can someone who has clov shares boost my confidence cus its so low i might sell and break even
77,n5vi4n,t2_76zu2w8z,1620262982,/r/wallstreetbets/comments/n5vi4n/dooooge/,1,DOOOOGE,
78,n5vii0,t2_syzmpmc,1620263014,/r/wallstreetbets/comments/n5vii0/flipping_since_day_1_paperhands/,1,Flipping since day 1 paperhands,
79,n5vju6,t2_8wkazlb9,1620263127,/r/wallstreetbets/comments/n5vju6/a_company_im_invested_just_bought_kirobo_it_looks/,1,A Company I m invested just Bought Kirobo it looks like this is Too good to be True am I missing something Positive and negative opinions appreciated ,
80,n5vk11,t2_wxqf254,1620263144,/r/wallstreetbets/comments/n5vk11/ricky_bobby_was_wrong/,1,Ricky Bobby was wrong,
81,n5vk3w,t2_4vs8jyy5,1620263151,/r/wallstreetbets/comments/n5vk3w/prpo_low_float_18_mil_gamma_squeeze/,1,PRPO low float 18 mil gamma squeeze ,This stock has been shorted into oblivion It caught absolutely no ones attention until Monday Let s talk about that Monday we saw a 300 pop with the news of the company selling a Covid antibody test through Amazon Then the shorts doubled down Tuesday and Wednesday after another quick run up on Tuesday premarket with insane short volume of 60 or higher with 300 200 million volume on a stock with 18 million float Short borrow fee rate is over 50 with almost no shares available Could this be gamma squeeze candidate Seems like there may be some shorts to cover Earnings also coming up next week 
82,n5vkr5,t2_14t8fa,1620263205,/r/wallstreetbets/comments/n5vkr5/my_amazon_alexa_no_longer_gives_gme_or_amc_stock/,1,My Amazon Alexa no longer gives GME or AMC stock prices ,As the title says Alexa stopped giving me GME and AMC stock prices when I asked her for them She will happily give me Walmart Tesla and other stocks But when I ask her for those she only replies Hmm I don t know that one To clarify she used to give GME and AMC prices all the time a week or so ago I wonder what happened 
83,n5vldf,t2_5syqfl4h,1620263260,/r/wallstreetbets/comments/n5vldf/holdgme/,1,HOLDGME,
84,n5vlsj,t2_69yczxm2,1620263299,/r/wallstreetbets/comments/n5vlsj/this_might_sound_stupid_but_has_anyone_done_the/,1,This might sound stupid but has anyone done the DFV parody and just randomly based some letters in as a ticker to see what comes up and check the charts ,Tbh I might start doing this because investing based on fundamentals DD positive earnings growth outlooks and forward planning have cost me about 4000 in 3 months I just went to a website that is a random letter generator and it gave me RSM which on the Yahoo ticker is RSMDF Excellent I ve been given a stock which has a daily volume of just 26 shares Honestly fuck my life 
85,n5vmhh,t2_a36xn745,1620263360,/r/wallstreetbets/comments/n5vmhh/vtho_im_surprised_this_hasnt_gotten_more/,1,VTHO I m surprised this hasn t gotten more attention The technology is really extraordinary Could be a huge earner later on,
86,n5vmpg,t2_9jo9cty9,1620263380,/r/wallstreetbets/comments/n5vmpg/i_dont_know_anything_about_stocks_noob/,1,I dont know anything about stocks noob ,Hey guys Anyone want to trade bulls i think this has some sort of lable but whos going to say it 
87,n5vn29,t2_bymresp8,1620263411,/r/wallstreetbets/comments/n5vn29/robinthehood/,1, ROBINTHEHOOD ,
88,n5vnx9,t2_5069o3o8,1620263484,/r/wallstreetbets/comments/n5vnx9/stock_market_hard_mode/,1,Stock Market Hard Mode,In case you apes didn t already know The reason you apes are losing tendies is because the suits have turned on Hard Mode The meme and hot stocks have all lost 2 3 to 1 2 from their ATH This goes for almost every industry expect for mega caps and the s amp p 500 where the suits are sheltering their tendies That s the reason all the p amp d are dominating reddit so the suits can take all your hard earned tendies Don t be a sheep make your own investment decisions Bc for now the suits have to make money from the retail umm I mean apes TDLR If you like making money make your own investment decisions or just keep giving the multimillionaires your money 
89,n5vogv,t2_9yqp650m,1620263532,/r/wallstreetbets/comments/n5vogv/new_investors_after_losing_all_their_allowance/,1,New investors after losing all their allowance money on memestocks this week,
90,n5vouw,t2_izuag7p,1620263569,/r/wallstreetbets/comments/n5vouw/ohio_sports_betting_bill_tomorrow_56_ready_to/,1,OHIO SPORTS BETTING BILL TOMORROW 5 6 READY TO FUCKING LAUNCH ,
91,n5voy7,t2_a0fs52vj,1620263579,/r/wallstreetbets/comments/n5voy7/just_call_them_etps_wallstreetbets_founder_jaime/,1,Just Call Them ETPs WallStreetBets Founder Jaime Rogozinski Launching Blockchain Powered Exchange Traded Portfolios Benzinga,
