,postid,author,created_utc,permalink,score,title,selftext
1832,o7u431,t2_45tkzgqm,1624647577,/r/wallstreetbets/comments/o7u431/love_no_meme_mode_lets_talk_real_investor_stocks/,1,Love no meme mode Lets talk real investor stocks like CRCT,Cricut Inc has a fanatic following of crafters Just go to Youtube Pinterest or Etsy and you ll be shocked Once the Cricut fanbase figures out they can buy more Cricut stuff with their stock gains it s over Bought 50k WISH Looking to lock in some profits on a swing to buy more CRCT Some recent catalysts Massive insider buying over a week long span New Cutting Machines 13G filled This is a signal that the stock won t be cheap for long Upcoming Aug 16 2021 Earnings Date Cricut is growing in China the U K Australia New Zealand as well as Europe and South America Might as well add it to the S amp P now My current positions are spread across a few accounts amp x200B Account 1 https preview redd it lr7zireflg771 jpg width 893 amp format pjpg amp auto webp amp s 3d2c9e2388a9a5cc0d78932f75a509fddff32dbc AND amp x200B Account 2 https preview redd it wfr4vyxmlg771 jpg width 628 amp format pjpg amp auto webp amp s e7488b19e8c16f455daa63650d0de595d56457d4 And I m not leaving 
1833,o7u5f1,t2_a0jt6m15,1624647670,/r/wallstreetbets/comments/o7u5f1/yolo_psfe/,1,YOLO psfe , removed 
1834,o7u5li,t2_52bblnjj,1624647684,/r/wallstreetbets/comments/o7u5li/alls_they_have_is_a_canoo_to_float_on_goev_gme/,1,All s they have is a Canoo to float on GOEV GME Sitting in a Tree , Hello again fellow degenerates I m back from the deep end again with some far out GOEV DD for you all to comment on Just in time for the weekend and Russell Inclusion Disclaimer This can t be financial advice because I know nothing of finance Please come to your own conclusions and Eat Crayons Further much of this research was completed by u lsjsl https www reddit com u lsjsl so props to him for putting in the time on the maths I don t know shit about fuck but the trend lines look juicy to me and I like to make lemonade Positions Long 2k shares 100s of rolling weekly and long OTMs also long on GameLand The following is a potential comparison between GME and its MOASS and GOEV compiled by some light digging If you can t follow it just TL DR and GOEV is potentially a Canoo full of black powder waiting to be an explosion that could set off the MOASS Per below link Canoo shares were heavily borrowed beginning sometime in March Coincidently the borrow fee has almost doubled this morning to 45 8 from 27 6 expensive to short Some sources report even higher borrow fees at differing brokers Source iBorrowDesk search GOEV Second source Fintel search GOEV As you can see in the below chart GME and GOEV prices prior to March moved in separate and unrelated directions After March GOEV shares were heavily shorted mid line of chart and now the price movement is somewhat similar Bullish AF Clearly Orange GME Blue GOEV 1 hr chart 6 month view https preview redd it o4pjvtn8lg771 jpg width 719 amp format pjpg amp auto webp amp s 3d2a092a66cf59c78216947f720a6e170d16e3e3 amp x200B 1 hr chart last month https preview redd it wlldofgalg771 jpg width 590 amp format pjpg amp auto webp amp s 1c555808b7b1b0577af1a35aba13295efc4331c6 Overlapping hedge funds that have surfaced so far CITADEL SUSQUEHANNA POINT72 position closed per last quarter reporting source Whale Wisdom search GOEV We have seen few posts regarding GME impacting the entire market especially stocks that are heavily shorted These comparisons to me are clearly examples of similar short positions being taken out on other tickers in attempts to clean up messes elsewhere Canoo Powderkeg Island If you don t like the analysis well fuck it then go read about Cow Farts or some shit I also like to use all my crayons before vaporizing them with my friends so I added more colors applied Fibonacci Time Zone using point 1 and point 2 as reference and holy smokes Batman this looks like math or some shit Remaining time zones are auto traced per Fibonacci tool This results to new time zone starting today to coincide with Russell 3000 inclusion and new SEC rule everyone seems to be referencing for GME Ripe for gamma action and more Stay tuned for more DD on GOEV Orange GME Blue GOEV https preview redd it wbj3ly4glg771 jpg width 543 amp format pjpg amp auto webp amp s 500be139c5cd67c883dae434a49cdc74298c8a12 Finally please remember that while Canoo is heavily shorted and MOASS is cool Canoo is positioned to be a captain of the EV industry within the next few years Their product is noteworthy exceptionally marketable and competitively priced Squeeze or not Canoo could be a huge deep value play TL DR Russell Inclusion Today Shorts r in 2 deep price action correlating with GameLand 
1835,o7u5uk,t2_avfz8qt,1624647703,/r/wallstreetbets/comments/o7u5uk/mirae_asset_global_investments_co_ltd_etf_list/,1,Mirae Asset Global Investments Co Ltd ETF List,i just stumbled upon this ETF firm while doing research on etfs how come i have never heard of this company i saw they have themed funds on all different kind of subjects like a founder run companys etf battery etf AI etf social media etf fucking uranium etf gaming etf weed etf and all the good stuff so many like 100 different all i ever hear about is AARK here AARK there CATHIE the goddess printing your tendies anyone have experience with some etfs by this firm i thinking on putting some money in some of these sweet themed etfs and might be in need of some confimation bias
1836,o7u644,t2_3aov9o0l,1624647726,/r/wallstreetbets/comments/o7u644/the_ceos_of_two_of_the_biggest_us_cannabis/,1,The CEOs Of Two Of The Biggest US Cannabis Companies Break Down The Future Of The Industry To An Exclusive Audience Of Wall Street s Most Powerful Investors,
1837,o7u6tp,t2_57xj2v2k,1624647785,/r/wallstreetbets/comments/o7u6tp/cciv_merger_coming_within_the_next_month_lucid/,1, CCIV merger coming within the next month Lucid Motors Twitter The SEC has declared effective the S 4 Registration Statement for the Churchill Capital Corp IV and Lucid merger with a 7 22 CCIV stockholder meeting Anticipated closing is 7 23 expecting to trade under LCID on Nasdaq ,
1838,o7u6x3,t2_20uqoy10,1624647795,/r/wallstreetbets/comments/o7u6x3/bb_is_set_to_fly/,1, BB is set to FLY ,
1839,o7u6xn,t2_8nygpsj2,1624647796,/r/wallstreetbets/comments/o7u6xn/amd_boom_lets_go_itm_1000_calls_at_86130_strike/,1, AMD BOOM Let s go ITM 1000 calls at 86 1 30 strike ,
1840,o7u79j,t2_7wkjzbbh,1624647824,/r/wallstreetbets/comments/o7u79j/pltrrd_party_next_stop_30/,1, PLTRrd Party Next stop 30 ,
1841,o7u7es,t2_11clwb,1624647837,/r/wallstreetbets/comments/o7u7es/superbull_case_for_air_conditioning_stocks/,1,Superbull case for air conditioning stocks,Yeah it s summer it s hot but making a stock market play based on that alone would be level one poker I m not Captain Obvious BLACK SWAN EVENT ALERT This week it s going to be 105 degrees in Oregon and Washington for the entire week and maybe then some But 2 3 of homes in this region don t have A C That s because this heat wave is expected to be unprecedented in recorded history They don t have A C because they never needed it before These tens of thousands of homeowners having been singed by the new potential for local temperatures to soar that high are going to want to install central air immediately They have lots of home equity in the current bloated housing market that could pay the cost of retrofitting their homes Not financial advice 
1842,o7u7il,t2_1vf4am3d,1624647847,/r/wallstreetbets/comments/o7u7il/load_your_puts_guys_the_uap_report_is_set_to/,1,Load your puts guys the UAP report is set to release today and it s about to be a blood bath ,For those who are not familiar with the UAP report the U S intelligence community in conjunction with the Pentagon is due today to submit a report to Congress on the subject of unidentified aerial phenomena a fancy word for UFOs The Pentagon in recent years has released or confirmed the authenticity of video from naval aviators showing enigmatic aircraft exhibiting speed and maneuverability exceeding known aviation technologies Rumor has it that the report will disclose that these sightings of UAPs are not human technology Guys this is a civilization altering bombshell I don t know about you but I m expecting the worse 
1843,o7u7j5,t2_217ylna9,1624647848,/r/wallstreetbets/comments/o7u7j5/not_much_but_its_honest_work/,1,Not much but it s honest work,
1844,o7u7m8,t2_a0jt6m15,1624647855,/r/wallstreetbets/comments/o7u7m8/yolo_option_calls_paysafe_psfe_100_buy_rating_by/,1,YOLO option calls paysafe psfe 100 buy rating by analysts on robinhood Lets run it up, removed 
1845,o7u7t9,t2_9p8e8ucp,1624647872,/r/wallstreetbets/comments/o7u7t9/ptra_magic_electric_shortbus_for_retards/,1,PTRA Magic Electric Shortbus for Retards, removed 
1846,o7u9n9,t2_3wkyga00,1624648032,/r/wallstreetbets/comments/o7u9n9/power_hour_for_wih/,1,POWER HOUR FOR WI H, removed 
1847,o7u9sm,t2_8so46euy,1624648044,/r/wallstreetbets/comments/o7u9sm/can_canaan_fpwm_make_comebacks/,1,CAN Canaan amp FPWM make comebacks , removed 
1848,o7u9z1,t2_9y35gvrk,1624648060,/r/wallstreetbets/comments/o7u9z1/nio_and_sndl_futures_of_planet_and_fellow_ape/,1,Nio and sndl futures of planet and fellow ape please listen good stocks is shit stocks Nio success fuck Tesla , removed 
1849,o7uaes,t2_61honlo8,1624648097,/r/wallstreetbets/comments/o7uaes/cvgrcn_is_a_stock_to_watch_it_has_a_huge_upside/,1,CVGR CN is a stock to watch it has a huge upside they recently acquired 2 legal cannabis dispensaries and have a line of edibles IMO it s very bullish and a percent tome to buy the dip , removed 
1850,o7uasv,t2_a10d79cy,1624648130,/r/wallstreetbets/comments/o7uasv/spce_volatility_is_at_an_extreme_right_now_with/,1, SPCE volatility is at an extreme right now with over 200 million in volume ,
1851,o7uawi,t2_6c7vf7s9,1624648139,/r/wallstreetbets/comments/o7uawi/been_averaging_down_since_february_happy_daysonly/,1,Been averaging down since February Happy days only down 1 000 Good things ahead Patience is sometimes your best friend ,
1852,o7uaxt,t2_9gexdv6i,1624648143,/r/wallstreetbets/comments/o7uaxt/been_waiting_for_this_moment_5_long_months/,1,Been waiting for this moment 5 long months ,
1853,o7ub1p,t2_135lcd,1624648152,/r/wallstreetbets/comments/o7ub1p/front_page_of_bloomberg_businessweek_theyre/,1,Front page of Bloomberg Businessweek They re taunting us,
1854,o7ub63,t2_57xj2v2k,1624648162,/r/wallstreetbets/comments/o7ub63/lcid_coming_to_nasdaq_soon_lucid_motors_twitter/,1, LCID coming to NASDAQ soon Lucid Motors Twitter The SEC has declared effective the S 4 Registration Statement for the Churchill Capital Corp IV and Lucid merger with a 7 22 stockholder meeting Anticipated closing is 7 23 expecting to trade under LCID on Nasdaq ,
1855,o7ubdg,t2_82ggfg0i,1624648179,/r/wallstreetbets/comments/o7ubdg/some_loss_porn_for_ya_bought_calls_at_the/,1,Some loss porn for ya Bought calls at the absolute top Full retard mode,
1856,o7ubtd,t2_cm241z44,1624648217,/r/wallstreetbets/comments/o7ubtd/now_boarding_apes_for_aht/,1,Now boarding Apes for AHT , removed 
1857,o7uc2j,t2_98904vlz,1624648237,/r/wallstreetbets/comments/o7uc2j/wish_fudmedia_manipulation_has_surpassed_the/,1, WISH FUD Media manipulation has surpassed the anti GME campaign Something is up ,
1858,o7uchf,t2_ac3jcrcp,1624648273,/r/wallstreetbets/comments/o7uchf/dkmr_ready_for_summer_destination_moon/,1,DKMR Ready For Summer Destination MOON ,
1859,o7uchs,t2_bizb30zl,1624648274,/r/wallstreetbets/comments/o7uchs/need_guidance_on_uco/,1,Need guidance on UCO,Relatively new to investing and found myself at leveraged ETFs UCO looks like a great option but it s told to be highly volatile and unfit for holding Why is it like this if it s just USO but amp d up I have like 23 shares in UCO rn 
1860,o7uchx,t2_atncm6w2,1624648274,/r/wallstreetbets/comments/o7uchx/yeeeet/,1,Yeeeet, removed 
1861,o7ucsh,t2_hjd5gu,1624648300,/r/wallstreetbets/comments/o7ucsh/i_too_have_become_and_ape_this_is_my_first_time/,1,I too have become and Ape this is my first time treading such waters I purchased Monday WISHing to the moon ,
1862,o7ue9s,t2_5yjyxsns,1624648435,/r/wallstreetbets/comments/o7ue9s/lets_see_what_were_made_of_goev/,1,Let s see what we re made of GOEV,Good afternoon degenerates here I present you a link I have found https marketrealist com p canoo goev stock reddit wallstreetbets This link stating that we are going to take GOEV to the moon They will be added to the Russell 3000 today which means millions upon millions of shares will be bought Short interest has been rising everyday and is sitting currently at around 35 40 which is INSANE They are trying to keep the price below 10 and by doing so their borrowing fee is now up from 27 6 to 45 8 Reason being millions of shares are to be bought and they want to keep the price low as possible This stock will more than likely be trading around 13 15 next week due to institutions also buying in This is not financial advice I am really just a retard who likes the stock Good luck to all 
1863,o7uf2d,t2_a2ai5dli,1624648502,/r/wallstreetbets/comments/o7uf2d/thats_called_a_space_wad/,1,That s called a Space Wad,
1864,o7uftc,t2_98904vlz,1624648570,/r/wallstreetbets/comments/o7uftc/wish_blatant_media_manipulation_tens_of_articles/,1, WISH Blatant media manipulation Tens of articles everyday about a 3 month old lawsuit Literally nothing new happened ,
1865,o7ufua,t2_abm61cwh,1624648572,/r/wallstreetbets/comments/o7ufua/i_dnt_like_aa_tweets_lately/,1,I dnt like AA tweets lately, removed 
1866,o7ug9f,t2_a0semkud,1624648607,/r/wallstreetbets/comments/o7ug9f/go_oxy_go/,1,Go OXY Go , Hot stock Occidental Petroleum surges as gas prices climb https finance yahoo com news hot stock occidental petroleum surges 151338997 html
1867,o7ugag,t2_3cfmwcwe,1624648610,/r/wallstreetbets/comments/o7ugag/amc/,1,AMC ,
1868,o7ugdf,t2_61honlo8,1624648618,/r/wallstreetbets/comments/o7ugdf/city_view_green_cvgrcn_has_a_huge_upside_imo_they/,1,City View Green CVGR CN has a huge upside IMO They recently acquired to legal cannabis dispensaries and have a line of edibles If you like buying dips it s definitely one to watch If you like cannabis stocks with potential definitely put this one on your radar , removed 
1869,o7ugdu,t2_a1jp1e8r,1624648619,/r/wallstreetbets/comments/o7ugdu/apparently_i_didnt_qualify_for_yolo_so_yolo_250/,1,Apparently I didn t qualify for yolo so YOLO 250 more shares ,
1870,o7ugix,t2_cm5ihawq,1624648632,/r/wallstreetbets/comments/o7ugix/sharing_a_wealth_of_information/,1,Sharing a wealth of information,Luokung Technology LKCO is a company that was shut down from trading in the U S stock market because the Trump Administration believed it was sharing its information with the chinese government Luokung works on mapping GPS and recently was the company chosen to work on autonomous driving smart highway project in the jiangxi province of China The company won a court ruling and has been taken off an entity list set up by U S Dept of defense and can now be traded in the stock market This company is on the rise as a short term or long term play Everybody look into it a buy a slice before it takes off My first post here Trading since Feb Regardless take a bet with this wallstreet It s on a dip today 
1871,o7ugmr,t2_9tv15uwo,1624648640,/r/wallstreetbets/comments/o7ugmr/amc_shirt_interest_spiking_strap_in_for_another/,1, AMC shirt interest spiking strap in for another ride , removed 
1872,o7ugpw,t2_9yc1czhq,1624648646,/r/wallstreetbets/comments/o7ugpw/the_prefect_covered_call/,1,The Prefect Covered Call, amp x200B Behold the Perfect Call Spread Upside 7K profit on July 9th downside 0 ZERO loss potential can only win Don t worry boys girls I have other SPCE positions just having fun with this day trade https preview redd it j72we3i9og771 png width 1647 amp format png amp auto webp amp s 1673ec39762ec2d52a3cae136d1ba2c509b83b65 
1873,o7uhd3,t2_fsb6jbe,1624648702,/r/wallstreetbets/comments/o7uhd3/mint_condition_8ft_x_16in_gamestop_sign_gme/,1,Mint Condition 8ft x 16in GameStop Sign GME TOTHEMOON,
1874,o7uhkn,t2_82ggfg0i,1624648722,/r/wallstreetbets/comments/o7uhkn/bought_at_the_absolute_top_call_me_seor_retardo/,1,Bought at the absolute top Call me se or retardo,
1875,o7uhoc,t2_g6wd6,1624648731,/r/wallstreetbets/comments/o7uhoc/bb_puts_500_625_85_p_contracts_havent_even_hit_yet/,1,BB puts 500 6 25 8 5 p contracts haven t even hit yet ,
1876,o7ui5m,t2_9p8e8ucp,1624648774,/r/wallstreetbets/comments/o7ui5m/ptra_the_electric_short_bus/,1,PTRA the electric short bus,
1877,o7ui92,t2_vdbde,1624648784,/r/wallstreetbets/comments/o7ui92/gamestop_livestream_on_twitch/,1,Gamestop Livestream on Twitch, removed 
1878,o7uiba,t2_965ufldl,1624648789,/r/wallstreetbets/comments/o7uiba/trade_volume/,1,Trade Volume ,Seems like the Trade Volume has been super low for AMC this week Seems like some shit is about to hit the fan 
1879,o7uime,t2_3i9puku,1624648814,/r/wallstreetbets/comments/o7uime/atos_the_next_gamma_storm/,1, ATOS The Next Gamma Storm, removed 
1880,o7ujka,t2_cu1qg8xh,1624648889,/r/wallstreetbets/comments/o7ujka/amtx_buy_the_dip/,1,AMTX BUY THE DIP , removed 
1881,o7ukng,t2_9atzwv7o,1624648984,/r/wallstreetbets/comments/o7ukng/sofi_expiration_date_monday_could_we_see_a_short/,1,SOFI expiration date monday could we see a short squeeze after today 10 return , removed 
1882,o7uksk,t2_5yoyqdx2,1624648996,/r/wallstreetbets/comments/o7uksk/trch_shorts_need_to_cover_soon/,1, TRCH SHORTS NEED TO COVER SOON ,
1883,o7ukzd,t2_547rncs3,1624649012,/r/wallstreetbets/comments/o7ukzd/umm_delta_9_thc_as_schedule_3_sauce_in_comments/,1,Umm delta 9 thc as schedule 3 Sauce in comments,
1884,o7ul0y,t2_45vu5f0v,1624649016,/r/wallstreetbets/comments/o7ul0y/spce/,1,SPCE, removed 
1885,o7ul1v,t2_a290sxgt,1624649019,/r/wallstreetbets/comments/o7ul1v/time_to_pay_the_piper_hedgies_this_is_huge_xs/,1,Time to Pay the piper hedgies This is Huge X s , removed 
1886,o7ultw,t2_5yoyqdx2,1624649088,/r/wallstreetbets/comments/o7ultw/trch_shorts_need_to_cover_soon/,1, TRCH SHORTS NEED TO COVER SOON ,
1887,o7um7v,t2_cfapp2j2,1624649120,/r/wallstreetbets/comments/o7um7v/if_you_guys_are_into_destroying_shorting_hedgie/,1,If you guys are into destroying shorting hedgie bastards GERN is your next GME,
1888,o7um9z,t2_abu7g7pg,1624649125,/r/wallstreetbets/comments/o7um9z/spce_to_the_moon/,1,SPCE to the moon , removed 
1889,o7un06,t2_a2hwgoci,1624649189,/r/wallstreetbets/comments/o7un06/has_anyone_been_screwed_by_geico_insurance/,1,Has anyone been screwed by GEICO insurance Refusing to pay a claim Agreeing to pay 50 The big companies are taking advantage of the little guys , removed 
1890,o7unmo,t2_9zn1j3kq,1624649247,/r/wallstreetbets/comments/o7unmo/iknx_to_the_moon/,1,IKNX to the moon , removed 
1891,o7uo29,t2_9kf9rhpt,1624649285,/r/wallstreetbets/comments/o7uo29/wish_with_options_for_sideways_gains/,1, WISH with options for sideways gains , removed 
1892,o7uo2k,t2_cb9umn6p,1624649285,/r/wallstreetbets/comments/o7uo2k/who_has_extra_ethers/,1,Who has extra ethers , removed 
1893,o7uogx,t2_yyhdw8,1624649321,/r/wallstreetbets/comments/o7uogx/all_in_vuzi_greetings_from_germany/,1,All in VUZI Greetings from Germany ,
1894,o7uoio,t2_8gclzshe,1624649325,/r/wallstreetbets/comments/o7uoio/whats_happening_with_amc/,1,What s happening with AMC , removed 
1895,o7uoom,t2_9j4p6odo,1624649339,/r/wallstreetbets/comments/o7uoom/yolo_gme/,1,YOLO GME,
1896,o7upgl,t2_15c6uug,1624649407,/r/wallstreetbets/comments/o7upgl/20_yrs_old_everything_i_have_is_in_pltr_get_rich/,1,20 yrs old everything I have is in PLTR Get rich or go broke tryin 10 yr hold,
1897,o7upom,t2_a5yt50om,1624649420,/r/wallstreetbets/comments/o7upom/bb_after_the_bell_to_the/,1, BB after the BELL TO THE , removed 
1898,o7uqao,t2_9j4p6odo,1624649467,/r/wallstreetbets/comments/o7uqao/yolo_gme_30k/,1,YOLO GME 30K,
1899,o7uqdl,t2_cwfa35a,1624649475,/r/wallstreetbets/comments/o7uqdl/lets_go_apes_wish_to_the_moon/,1,Let s go apes WISH to the moon ,
1900,o7uqdl,t2_cwfa35a,1624649475,/r/wallstreetbets/comments/o7uqdl/lets_go_apes_wish_to_the_moon/,1,Let s go apes WISH to the moon ,
1901,o7uqqf,t2_aeglcndp,1624649505,/r/wallstreetbets/comments/o7uqqf/some_porn_gain_on_oxy/,1,Some porn gain on OXY,
1902,o7ur87,t2_aglyq4y3,1624649545,/r/wallstreetbets/comments/o7ur87/wkhs_1300_shares_high_expectations_for_this_stock/,1, WKHS 1 300 shares High expectations for this stock even more now with passing of the Infrastructure bill The extent of my DD is based on thinking they have a cool company name and the worst 4 letter word of them all hope ,
1903,o7ur9e,t2_bq4wi,1624649548,/r/wallstreetbets/comments/o7ur9e/us_economy_grows_64_in_q1_and_its_likely_just_the/,1,US economy grows 6 4 in Q1 and it s likely just the start,
1904,o7us27,t2_a1oaxb7d,1624649617,/r/wallstreetbets/comments/o7us27/acn_post_earnings/,1,ACN post earnings, removed 
1905,o7usao,t2_4ekktysi,1624649639,/r/wallstreetbets/comments/o7usao/entrepreneurcom_featured_well_wlyyf/,1,Entrepreneur com featured WELL WLYYF,Saw this in Entrepreneur com http entrepreneur com this morning and recognized the stock from here https www entrepreneur com article 374887 https www entrepreneur com article 374887 CEO Hamed Shahbazi looks like a total powerhouse sold his last company to Paypal for 304M in 2017 and is now completely revolutionizing healthcare with WELL Feels like a new Chamath on the block 
1906,o7utb7,t2_3j8x82d4,1624649731,/r/wallstreetbets/comments/o7utb7/can_you_tell_when_i_found_out_about_meme_stock/,1,Can you tell when I found out about meme stock options Worked once not twice,
1907,o7utzo,t2_c8pg52ov,1624649790,/r/wallstreetbets/comments/o7utzo/rycey/,1,RYCEY , removed 
1908,o7uu2s,t2_xk6u2,1624649799,/r/wallstreetbets/comments/o7uu2s/almost_80000_yolo_into_sofi_lets_see_how_high/,1,Almost 80 000 YOLO into SOFI let s see how high SOFI can SOFLY,
1909,o7uuau,t2_7txv8,1624649817,/r/wallstreetbets/comments/o7uuau/crsr_is_a_millionaire_maker_stock_monday_is_going/,1,CRSR is a Millionaire Maker Stock Monday is going to be big,
1910,o7uv0x,t2_4un5f,1624649885,/r/wallstreetbets/comments/o7uv0x/so_like_uhh_the_krispy_kreme_ipo_is_imminent/,1,So like uhh the Krispy Kreme IPO is imminent ,
1911,o7uvbi,t2_alvm0h0c,1624649910,/r/wallstreetbets/comments/o7uvbi/come_on_wish_make_my_weekend/,1,Come on WISH make my weekend , removed 
1912,o7uvip,t2_965ufldl,1624649928,/r/wallstreetbets/comments/o7uvip/trade_volume/,1,Trade Volume , removed 
1913,o7uvlc,t2_4ekktysi,1624649937,/r/wallstreetbets/comments/o7uvlc/entrepreneurcom_featured_well_wlyyf/,1,Entrepreneur com featured WELL WLYYF,Saw this in Entrepreneur com http entrepreneur com this morning and recognized the stock from here https www entrepreneur com article 374887 https www entrepreneur com article 374887 CEO Hamed Shahbazi looks like a total powerhouse sold his last company to Paypal for 304M in 2017 and is now completely revolutionizing healthcare with WELL Feels like a new Chamath on the block The company looks like the best healthcare play I have seen so far Approaching 500M in revenue and 100M in ebitda Backed by billionaires including the 29th richest man on the planet Just raised 305M from said billionaires and have been on an aggressive M amp A expansion route into the US NASDAQ IPO planned for Q4 20 short volume Checks all my boxes and then some 
1914,o7uvm5,t2_a0hwbmwy,1624649939,/r/wallstreetbets/comments/o7uvm5/palantir_set_to_launch_should_see_30_next_week/,1,Palantir set to launch Should see 30 next week ,
1915,o7uvqo,t2_10yije,1624649952,/r/wallstreetbets/comments/o7uvqo/my_tiny_wkhs_gamble_after_losing_all_my_money/,1,My tiny WKHS gamble after losing all my money ,
1916,o7uw0b,t2_12s81v,1624649976,/r/wallstreetbets/comments/o7uw0b/not_the_biggest_loss_ever_but_i_thought_it_was/,1,Not the biggest loss ever but I thought it was nice ,
1917,o7uwyu,t2_a0yx2y3x,1624650057,/r/wallstreetbets/comments/o7uwyu/wish_gooooo_friends_strong_buy_share/,1,WISH GOOOOO FRIENDS STRONG BUY SHARE,Taking into account that I bought more at USD 13 55 I had 11500 shares and now 13500 I saw the last half an hour performance as extremely bullish crossing up all the resistances that were perfored and with very high volume That gave me confident about the future of Wish So next resistance is USD 15 and once we break can go to16 60 16 80 Off course we will experience some volatility between 14 50 15 so if you are a trader I think those are good levels to watch For a middle term trade just focus on 15 And for a long term investment dont read this post because is a lost of time Conclusion I m still very very bullish on WISH and I m even more confident that we will reach USD 20 in the short term For the middle term i m still seeing USD 30 as a very potential level I know a lot of you are talking about USD 50 69 or 100 But remember step by step This is a marathon and we run every days 
1918,o7ux6u,t2_a6jayaoz,1624650077,/r/wallstreetbets/comments/o7ux6u/yoloing_my_rent_payment_this_company_isnt_worth/,1,Yolo ing my rent payment This company isnt worth 15B ,
1919,o7ux88,t2_b5uy5fva,1624650080,/r/wallstreetbets/comments/o7ux88/wpp_wins_industrys_most_creative_company_at/,1,WPP wins industry s most creative company at Cannes Lions,
