,postid,author,created_utc,permalink,score,title,selftext
560,o7krah,t2_85yxbyv6,1624615725,/r/wallstreetbets/comments/o7krah/yolo_cancer_atos_dr_quay/,1,YOLO CANCER ATOS DR QUAY, removed 
561,o7ksm7,t2_acmew9gs,1624615918,/r/wallstreetbets/comments/o7ksm7/people_asking_why_this_being_shilled_now_will/,1,People asking wHy ThIs bEiNg shIlLeD nOw will never know the true story of Big Fucking Tendies let s go PSFE ,
562,o7ksvz,t2_a8qr8t0r,1624615957,/r/wallstreetbets/comments/o7ksvz/hedge_funds_rethink_tactics_after_12bn_hit_from/,1,Hedge funds rethink tactics after 12bn hit from meme stock army,
563,o7kuf0,t2_3ul9yyj7,1624616163,/r/wallstreetbets/comments/o7kuf0/the_more_i_see_this_bs_journalism_the_less_i/,1,The more I see this bs journalism the less I intend to sell lol Sorry maggots but we re Apes u can only dream of shaking these hands ,
564,o7kuzf,t2_2vq6wgxr,1624616244,/r/wallstreetbets/comments/o7kuzf/got_few_bucks_left_help_out_with_the_trch_squeeze/,1,Got few bucks left Help out with the TRCH squeeze , removed 
565,o7kwbe,t2_orq5mf5,1624616417,/r/wallstreetbets/comments/o7kwbe/xfls_pink_current_xfls_security_details_share/,1,XFLS pink current XFLS SECURITY DETAILS Share Structure Market Cap 32 374 130 06 24 2021 Authorized Shares 1 500 000 000 05 31 2021 Outstanding Shares 385 406 312 05 31 2021 Restricted 109 947 000 05 31 2021 Unrestricted 275 459 312 05 31 2021 Held at DTC 253 224 351 05 31 2021,
566,o7kwty,t2_8sqcl0m4,1624616484,/r/wallstreetbets/comments/o7kwty/buy_lambo/,1,Buy Lambo ,
567,o7kx7t,t2_a3dde6jo,1624616535,/r/wallstreetbets/comments/o7kx7t/nice_pop_yesterday_srne_yall_retards_could_be/,1,Nice pop yesterday SRNE Y all retards could be part of it ,
568,o7kye5,t2_a8pltibp,1624616688,/r/wallstreetbets/comments/o7kye5/bbby_gooooo_people_gogogoogo_up/,1,BBBY GOOOOO PEOPLE GOGOGOOGO UP , removed 
569,o7kyzg,t2_kne225b,1624616768,/r/wallstreetbets/comments/o7kyzg/we_need_to_organize_behind_just_a_few_stocks/,1,We need to organize behind JUST a few stocks Power in numbers , removed 
570,o7kzem,t2_avxw1cs1,1624616820,/r/wallstreetbets/comments/o7kzem/american_psycho_2021/,1,American Psycho 2021,
571,o7kzfw,t2_5q1c4hsx,1624616824,/r/wallstreetbets/comments/o7kzfw/john_mcafee_final_statement_on_meme_coins_its/,1,John McAfee final statement on meme coins It s worth 0 Be careful my gorillas ,
572,o7kzog,t2_a3banqjm,1624616854,/r/wallstreetbets/comments/o7kzog/tlry/,1,TLRY, removed 
573,o7kzv4,t2_7mo8yqyc,1624616880,/r/wallstreetbets/comments/o7kzv4/did_anyone_here_participate_is_occupy_wall_st_is/,1,Did anyone here participate is occupy Wall St Is squeezing HFS the new way for activists , removed 
574,o7kzwh,t2_812gmwa1,1624616885,/r/wallstreetbets/comments/o7kzwh/ptra_infrastructure_ev_play_with_massive/,1,PTRA Infrastructure EV Play with Massive short term and long term Upside, amp x200B No foreplay Quick and to the point Proterra PTRA you know know them the electric bus company The bipartisan infrastructure bill s framework https www whitehouse gov briefing room statements releases 2021 06 24 fact sheet president biden announces support for the bipartisan infrastructure framework agreed upon in Washington yesterday explicitly lays aside 7 5b for Electric busses scroll 2 3 way down to see the allocation table PTRA is not some 2025 until revenue company They re building and selling electric busses all over the country right now Miami https finance yahoo com news proterra miami dade county announce 120000467 html Maryland https content govdelivery com accounts MDPGC bulletins 2a5ae3d 1000 busses through 2020 https www proterra com press release proterra celebrates 1000 buses sold before many catalysts occurring this year Backing from Washington The Secretary of Energy Jennifer Granholm was previously on the board of directors of Proterra before surrendering the position to take her position in the administration Before the reverse merger on the board of Arclight https arclightclean com our team was the co founder of lobbyist Clean Energy for Biden now Clean Energy for America Audrey Lee Here s Biden taking a virtual tour https www youtube com watch v x lCHaPSW7s of the factory Bullish options chain showing potential for gamma ramp to 30 and some recent unusual options activity ATM Short Interest is hard to tell from Ortex https www ortex com symbol Nasdaq PTRA short interest this early in the new ticker s life but 99 80 utilization iborrowdesk com https iborrowdesk com report PTRA shows a measly 1 000 shares available to borrow at 86 8 cost to borrow Lenders want serious interest on something they feel is at risk to squeeze Mark to Market losses for short sellers this week during its climb from 16 gt 18 For you crayon eaters it s about to cross MACD on the 3M chart https preview redd it ykeaaydm1e771 png width 953 amp format png amp auto webp amp s 0671bd2cb5ee8015425d0c6eca6bde205d287cf6 Positions x60 11 19 20c Looking for more short dated options today https preview redd it 3eau80w32e771 png width 1196 amp format png amp auto webp amp s e0044218a7fdfe60303fbeace000e706cb60365c
575,o7kzy4,t2_9ijxa,1624616890,/r/wallstreetbets/comments/o7kzy4/theres_more_to_nano_dimension_than_reddit/,1, There s More to Nano Dimension Than Reddit ,
576,o7l0qz,t2_a3ykli9e,1624617000,/r/wallstreetbets/comments/o7l0qz/sndl/,1,SNDL, removed 
577,o7l213,t2_ztjdi,1624617170,/r/wallstreetbets/comments/o7l213/nas_norwegian_air_shuttle_taking_off_huge/,1,NAS Norwegian Air Shuttle taking off HUGE potential ,The borders have been opened in the last few days in Europe Everyone wants to GO Covid numbers are low in most Europe Norwegian is the 1 cheap flight operator for most of us And Norway is a rich country they do not let the company go bust They are running actually pretty great and funny ad campaig atm This will go high OFC this is not a financial advice I am investing in this for the long term Maybe from 14 NOK gt 5000 NOK 
578,o7l28x,t2_kne225b,1624617201,/r/wallstreetbets/comments/o7l28x/where_are_the_apes_amc_needs_just_a_little_push/,1,Where are the APES AMC needs just a little push , removed 
579,o7l29h,t2_4dgtv1o9,1624617202,/r/wallstreetbets/comments/o7l29h/i_believe_gthx_is_on_the_move/,1,I believe GTHX is on the move , removed 
580,o7l3nd,t2_7wge2b5u,1624617377,/r/wallstreetbets/comments/o7l3nd/psfe_wish_pltr_baba_gme_if_youre_asking_for_any/,1, PSFE WISH PLTR BABA GME if you re asking for any D D then you don t chew big red so fuck you , removed 
581,o7l47h,t2_c71rsppk,1624617450,/r/wallstreetbets/comments/o7l47h/psfe_is_undervalued_without_wsb_apes_itll_easier/,1, PSFE is UNDERVALUED without wsb apes it ll easier catch 19 20 by next ER , removed 
582,o7l4cy,t2_6mxffxpk,1624617471,/r/wallstreetbets/comments/o7l4cy/panasonic_sold_tesla_stake_for_36_bln/,1,Panasonic Sold Tesla stake for 3 6 bln,
583,o7l5r6,t2_cxg63ebj,1624617658,/r/wallstreetbets/comments/o7l5r6/sndl_to_the_moon_next_week/,1, SNDL to the MOON next week , removed 
584,o7l6ax,t2_8dmflksu,1624617723,/r/wallstreetbets/comments/o7l6ax/how_to_use_a_fibonacci_retracement_tool/,1,How to use a Fibonacci Retracement tool, removed 
585,o7l6lx,t2_4grwcrlv,1624617763,/r/wallstreetbets/comments/o7l6lx/the_secret_weapon_many_clov_investors_are_missing/,1,The Secret Weapon Many CLOV Investors are Missing, removed 
586,o7l7xi,t2_5g3pwjm2,1624617930,/r/wallstreetbets/comments/o7l7xi/ttcf_to_the_moon/,1, TTCF to the moon , removed 
587,o7l80v,t2_9cedij11,1624617943,/r/wallstreetbets/comments/o7l80v/daily_popular_tickers_thread_by_mentions_for_june/,1,Daily Popular Tickers Thread by mentions for June 25 2021 WISH CLOV WKHS, Really your daily hype thread F ck other shitposts Please keep the shitposting to a maximum Navigate WSB We recommend best daily DD DD All https reddit com r wallstreetbets search sort new amp restrict sr on amp q flair 3ADD Best Daily https www reddit com r wallstreetbets search sort top amp q flair 3ADD amp restrict sr on amp t day Best Weekly https www reddit com r wallstreetbets search sort top amp q flair 3ADD amp restrict sr on amp t week Discussion All https reddit com r wallstreetbets search sort new amp restrict sr on amp q flair 3ADiscussion Best Daily https www reddit com r wallstreetbets search sort top amp q flair 3ADiscussion amp restrict sr on amp t day Best Weekly https www reddit com r wallstreetbets search sort top amp q flair 3ADiscussion amp restrict sr on amp t week YOLO All https reddit com r wallstreetbets search sort new amp restrict sr on amp q flair 3AYOLO Best Daily https www reddit com r wallstreetbets search sort top amp q flair 3AYOLO amp restrict sr on amp t day Best Weekly https www reddit com r wallstreetbets search sort top amp q flair 3AYOLO amp restrict sr on amp t week Gain All https reddit com r wallstreetbets search sort new amp restrict sr on amp q flair 3AGain Best Daily https www reddit com r wallstreetbets search sort top amp q flair 3AGain amp restrict sr on amp t day Best Weekly https www reddit com r wallstreetbets search sort top amp q flair 3AGain amp restrict sr on amp t week Loss All https reddit com r wallstreetbets search sort new amp restrict sr on amp q flair 3ALoss Best Daily https www reddit com r wallstreetbets search sort top amp q flair 3ALoss amp restrict sr on amp t day Best Weekly https www reddit com r wallstreetbets search sort top amp q flair 3ALoss amp restrict sr on amp t week 
588,o7l813,t2_9w3ezr3r,1624617944,/r/wallstreetbets/comments/o7l813/nokia_nysenok_raised_to_buy_at_the_goldman_sachs/,1,Nokia NYSE NOK Raised to Buy at The Goldman Sachs Group,
589,o7l89r,t2_8dmflksu,1624617974,/r/wallstreetbets/comments/o7l89r/how_to_use_a_fibonacci_retracement_tool/,1,How to use a Fibonacci Retracement tool,https youtu be qcaL5r0Ti08 Hey guys When I was first learning to trade it took me for eeeeever to find out how to use one of these I recorded and posted this video just in case any of y all out there are wanting to know how to use the Fibonacci retracement tool It is by far my favorite tool ever This single handidly made me a decent trader A lot of other techniques just never worked for me Support and resistance etc If u don t like and subscribe I might lose my next trade Lol But for real I hope this can help y all 
590,o7l8e1,t2_fwdw1kd,1624617990,/r/wallstreetbets/comments/o7l8e1/standard/,1,Standard,
591,o7l8gg,t2_sk8c1,1624617999,/r/wallstreetbets/comments/o7l8gg/virgin_galactic_receives_approval_from_faa_for/,1,Virgin Galactic Receives Approval From FAA for Full Commercial Launch License Following Success of May Test Flight,
592,o7l92b,t2_39gfhht,1624618075,/r/wallstreetbets/comments/o7l92b/whats_up_with_david_portnoy_out_of_the_loop/,1,What s up with David Portnoy Out of the loop ,I m actively trying to understand what s going on with David Portnoy who is he what s his connection to r wallstreetbets etc I begun by searching David s name on r WSB but not much came up mainly people praising him I watched the recent David Portnoy interview on Fox you re a little bitch I d like to get inside the loop please Any resources links and info are much appreciated Thanks 
593,o7lalq,t2_4grwcrlv,1624618271,/r/wallstreetbets/comments/o7lalq/the_secret_weapon_many_clov_investors_are_missing/,1,The Secret Weapon Many CLOV Investors are Missing,Good morning Apes this is probably the most important information you will ever read in your goddamn life This post is exactly what we need to take down every single hedge fund short holding us back from CLOV reaching fucking Mars I asked my fellow autist to repost his article here but he never responded to my request so here I am doing the Lord s work for him This retard created sunlight before there was even sunlight he is a brilliant ape Now admire his work so we can bring down every single short to their knees https www reddit com r CLOV comments o7cpee the secret weapon many clov investors are missing utm source share amp utm medium ios app amp utm name iossmf
594,o7lbe1,t2_2otnt0v3,1624618372,/r/wallstreetbets/comments/o7lbe1/wish_technical_analysis_june_25th_further/,1,WISH Technical analysis June 25th Further discussion near term targets ,
595,o7lbim,t2_7wge2b5u,1624618389,/r/wallstreetbets/comments/o7lbim/psfe_wish_pltr_gme_baba/,1, PSFE WISH PLTR GME BABA, removed 
596,o7lbqn,t2_a0txdub0,1624618420,/r/wallstreetbets/comments/o7lbqn/spce_premarket/,1, SPCE pre market ,
597,o7lcmp,t2_5armrw21,1624618538,/r/wallstreetbets/comments/o7lcmp/got_my_stake_in_bngo_now_what_do_i_win/,1,Got my stake in BNGO Now what do I win ,
598,o7ld3q,t2_9akv3h6g,1624618609,/r/wallstreetbets/comments/o7ld3q/virgin_galactic_faa_licence/,1,Virgin Galactic FAA Licence ,
599,o7ld86,t2_ahpi0vb9,1624618625,/r/wallstreetbets/comments/o7ld86/dont_fall_for_the_late_tesla_news_this_happened/,1,Don t fall for the late TESLA news this happened in MARCH We are well past that now,
600,o7ld86,t2_ahpi0vb9,1624618625,/r/wallstreetbets/comments/o7ld86/dont_fall_for_the_late_tesla_news_this_happened/,1,Don t fall for the late TESLA news this happened in MARCH We are well past that now,
601,o7ldgg,t2_mjbt9,1624618657,/r/wallstreetbets/comments/o7ldgg/bb_crwd_now_you_need_to_earn_for_a_living/,1, BB gt gt gt CRWD now you need to earn for a living,https twitter com CardyTruster status 1408242035178549250 s 20 youtube com watch v 7Bs0dPdLFnw amp t 9s I Have a Message JohnChen CEO had a message today BB a Leader in AI Cloud EPP EDR Intelligent Cyber Security plus embedded Very Broad Very Deep BB was not hacked in these ransomware CRWD now you need to earn your living CNBCTechCheck
602,o7ldgi,t2_4tq4wd4i,1624618657,/r/wallstreetbets/comments/o7ldgi/trching_the_shorts_the_mega_merger_theory/,1, TRCHing the shorts the Mega Merger Theory, removed 
603,o7le25,t2_449rpeiv,1624618737,/r/wallstreetbets/comments/o7le25/varta_from_0_to_100_in_6_min/,1,Varta from 0 to 100 in 6 min ,Hey guys greetings from Germany First of all iam not a financial advisor and this is not a financial advice tldr varta is undervalued varta got strong potential in the battery business for electric cars the battery business for electric cars and the earnings are not calculated in the stock market price gt stock market price goal is minimum 260 gt he is telling that 1000 could be even passable in several years they will produce these batteries for Porsche every german car manufracturer has interests in vartas batteries there are conversations between them in the background varta got a short ratio at 30 varta is expanding varta raised their forecasts several times last year vartas quality is very good they supply the batteries for Apple air dods varta is about to calculate the overall demand to start building a plant for mass production they can start it as soon as the comversations come to an end Every information iam posting here about varta is from aktionaer de this is a german stock market magazine you can find them on Youtube spotify etc and there is a guy called maydorn He has been talking about varta since months and he predicted the business relationsship anouncement with Porsche And he also me is convinced that varta is the next big thing and Iam asking myself a lot why nobody knows how great their potential is All their videos and podcasts are in German so i tell you the facts why u should go in Let me start with a little company history Varta is a well known old company They produced batteries for normal use and for normal cars first After they sold this business they focused on microbatteries like the batteries for hearing aid bluetooth headphones in the premium segment Actually they supply Apple with the batteries for their air pods and Apple would never use batteries with a low quality Then they bought back their household batterie business so these aa aaa things you need for your gameboy gt and now comes the important stuff Varta managed to bring the technology from the microbatteries to a bigger size so they are useable for electric cars for instance gt People love varta the analysts hate varta There is actually not even one purchase recomendation from a analyst The dip in march 2020 Was not only caused by the corona pandemic it was also caused by short sellers Actually they say that their short ratio is still at about 30 The only argument the short sellers have is that the competetors from China will be able to produce these batteries at lower cost But first it didnt happen until now and second Daimler just cutted their business relations with a chinese producer because the quality was horrible and gt varta just anounced that they will produce batteries for porsches electric cars So varta is able to produce high quality batteries for electric cars Maydorn forecasted the relationsship between them months ago gt why is there no purchase recommendation The market is huge and vartas potential too But they dont value it Thats the huge thing that noone really ubderstand Alone the microbatterie and normal household batterie business is worth like 160 With the potential of the batteries for cars it should be a minimum of 260 Actual stock market price is 143 gt so the batterie business for electric cars is not reflected in the actual stock market price Its a little bit a german phenomenon that future earnings are not that considered as in USA In germany they are like oh yea theres huge potential but it could happen this and it could happen that But they raised their forecasts several times last year and their business is running very well They are expanding and building new plant what will be opened in the near future gt its the same Story as tesla Tesla was shorted heavily and analysts hated tesla because they didnt value the future potential of the company Its also because either the germans nore the americans like electric cars gt the batteries are in the epicentrum They are will be highly demanded not only for cars but also for solar plants what varta also does gt the batteries are the same size as the one tesla is using roundcells But the diffrence is that teslas batteries charges 20 min and the capacity is going from 20 to 80 Vartas batteries need 6 min to be charged from 0 to 100 gt varta is on this second talking with a lot of potential partners and definitly with all german car manufacturers about a vertical supply relationsship Imagine VW Daimler etc will buy the batteries from varta Every Single car manufracturer has interests in batteries from varta because there is a shortage of batteries especially good ones gt varta is talking to everyone and Porsche will not be the only customer for Sure gt northvolt is the supplier for batteries for volkswagen and their market capitalisation is 13 14 Bil Varta is now at 6 Bil gt Daimler was very active in Research for building batteries for their cars but they stopped it because they didnt make it because its not that easy gt could be possible that someone join company but its not likely that someone is gonna buy varta because their is one big Shareholder Mr Trojner who has got more then 50 of the shares gt the only thing that has to be done is that they have to calculate the overall demand from all their partners and build up a mass producing plant They can start it as soon as all the conversations mentioned above are comming to an end gt this market is the future and it will be supported by politics Biden will subsidize this market a lot there is a reddit post where a guy explaine why 2021 the green shares will be still the thing check it out So iam in YOLO with everything i have I would like to sell my wife to buy more shares Cheers
604,o7lev1,t2_4tq4wd4i,1624618818,/r/wallstreetbets/comments/o7lev1/trching_the_shorts_the_mega_merger_theory/,1, TRCHing the shorts the Mega Merger Theory, removed 
605,o7lf3y,t2_5w5qx0yh,1624618843,/r/wallstreetbets/comments/o7lf3y/ready_to_trade_happy_friday/,1,Ready to trade Happy Friday , removed 
606,o7lfrj,t2_eu876,1624618917,/r/wallstreetbets/comments/o7lfrj/i_just_learn_the_real_meaning_of_stonks/,1,I just learn the real meaning of stonks , removed 
607,o7lh4v,t2_69koxftc,1624619087,/r/wallstreetbets/comments/o7lh4v/600_dollars_of_wish/,1,600 dollars of WISH , removed 
608,o7lhao,t2_55b1uge6,1624619106,/r/wallstreetbets/comments/o7lhao/been_holding_psfe_since_1428_buying_1000_more/,1,Been holding PSFE since 14 28 buying 1000 more shares today and if it hits 300 I will buy a lambo and ignite it,
609,o7lht2,t2_a02sgi8w,1624619164,/r/wallstreetbets/comments/o7lht2/goals/,1,Goals,
610,o7licu,t2_bsjnu5j0,1624619226,/r/wallstreetbets/comments/o7licu/world_audience_wtf_was_that_apes_art_of_the_hodl/,1,World audience WTF was that Apes Art of the HODL ,
611,o7liyf,t2_55b1uge6,1624619301,/r/wallstreetbets/comments/o7liyf/been_holding_psfe_since_1428_rock_solid_company/,1,Been holding PSFE since 14 28 rock solid company Buying 1000 more shares today when it hits 300 I m going to buy a lambo and ignite it ,
612,o7lj58,t2_4vmux6vj,1624619327,/r/wallstreetbets/comments/o7lj58/clov_to_da_moon/,1, CLOV TO DA MOON ,I Need you guys to help me This is huge LETS TAKE CLOV TO DA MOOOOOON CLOV TO DA MOON CLOV TO DA MOON CLOV TO DA MOON CLOV TO DA MOON CLOV TO DA MOON CLOV TO DA MOON CLOV TO DA MOON CLOV TO DA MOON 
613,o7lji3,t2_a1mndlgf,1624619376,/r/wallstreetbets/comments/o7lji3/spce_receives_full_faa_appoval_for_flying/,1, SPCE receives full FAA appoval for flying customers, removed 
614,o7ljsl,t2_4kbxblbq,1624619411,/r/wallstreetbets/comments/o7ljsl/this_is_sick/,1,This is sick ,
615,o7lju4,t2_cuktj0xa,1624619417,/r/wallstreetbets/comments/o7lju4/indian_and_global_top_market_experts_join_indias/,1,Indian and Global Top Market Experts Join India s Largest Capital Markets Conference amp Expo, removed 
616,o7ljww,t2_cbryyf7q,1624619426,/r/wallstreetbets/comments/o7ljww/listen_up_retards/,1,Listen up retards, removed 
617,o7lk2b,t2_9q09y4bj,1624619445,/r/wallstreetbets/comments/o7lk2b/he_did_it_finally/,1,He did it finally ,
618,o7lk5j,t2_cd2psvl3,1624619457,/r/wallstreetbets/comments/o7lk5j/6_rules_from_6_of_the_worlds_top_investors/,1,6 Rules From 6 of the World s Top Investors ,
619,o7lkh6,t2_a1mndlgf,1624619499,/r/wallstreetbets/comments/o7lkh6/spce_receive_full_faa_approval_to_fly_customers/,1, SPCE receive full FAA approval to fly customers to space, https www marketwatch com story virgin galactic gets faa approval to fly customers to space 271624618754 https www marketwatch com story virgin galactic gets faa approval to fly customers to space 271624618754 
620,o7lkub,t2_9q09y4bj,1624619542,/r/wallstreetbets/comments/o7lkub/_/,1, ,
621,o7lkuo,t2_a10ztfqw,1624619543,/r/wallstreetbets/comments/o7lkuo/virgin_galactic_surges_after_faa_approvals/,1,Virgin Galactic Surges After FAA Approvals Commercial Space Launch License,
