,postid,author,created_utc,permalink,score,title,selftext
1272,o7q2lo,t2_4maqng7i,1624635230,/r/wallstreetbets/comments/o7q2lo/lil_vuzi_vert/,1,Lil VUZI Vert, amp x200B https preview redd it q1daqypajf771 png width 225 amp format png amp auto webp amp s cd1612de07c3c011e38111ed4be8b0d5206de435 I want to introduce you smooth brains to a company called Vuzix Vuzix is a crazy fucking eyewear company that are essentially the future of manufacturing and surgical tools Now why is this important Google tried to do this shit like 8 years ago and nobody cared right Yes that s correct There s one other thing that s correct too Google s attempt absolutely sucked and they did not pursue improving their product Vuzix remains on the leading edge of smart eyeglass technology with over 146 patents So it s too late google you already lost this one amp x200B https preview redd it czqvyeqgjf771 png width 1170 amp format png amp auto webp amp s bc7fcc46d770489304b2090036d56895d0e230d4 Anyway since I took one semester of an entry level laser course in college I m going to explain this technology to you The waveguide technology employed by vuzix deliver high quality full color images directly to your fucking eyeball Now these images are completely transparent so it allows the user to still interact with natural reality This differs from other products which deliver a useless opaque image Now how can this help with surgery Do you remember when Tony Stark goes into repair mode while in the iron man suit amp x200B https preview redd it vyrb1kyjjf771 png width 1280 amp format png amp auto webp amp s c8fcee5ffcd29dc9d6fec61a83031e0094ef534b Yeah that s what these glasses do They can provide a whole digital map of whichever part of the body they are working on That s not all They can also provide a live video stream with an augmented reality presence in order to assist surgical techs in helping their surgeon amp x200B https preview redd it yjujg42njf771 png width 1417 amp format png amp auto webp amp s 622d7f16edb9c84a3d8224121077358f89714a02 Now that I ve showed you some of Vuzix s tech lets take a look at the third graders their up against Thirdeye Gen really cool name where d they get that at Hot Topic Anyway this company doesn t hold a candle to Vuzix They aren t even attempting to use this crap in surgical applications yet but they do have some implementations in healthcare by basically doing the same thing a tablet can do This can also be said for their manufacturing applications as well Plus just look at these things amp x200B https preview redd it bh6vfbhxjf771 png width 1280 amp format png amp auto webp amp s 4ebd116fe95f02e689942efd6209343ca8fc47b0 Microvision Need I say more Vrteek Mainly just focused on virtual tours and videos That s cool stay in your fucking lane Manus VR this is actually a really cool company but their applications are more focused on digital production applications This wouldn t necessarily be a competitor at this time but since its along the same lines it should be mentioned amp x200B Time to look at some numbers for you viewers with more then 10 brain cells In 2020 Vuzix experienced very rapid growth This can be attributed to technology finally catching up to the product as well as a lot of new big orders from reputable companies In 2021 Vuzix saw sales increase 2 4 million dollars or 177 year over year Data interpreted from Vuzix website show Quarter 1 2021 results at a 49 improvement year over year Sales of their products show an improvement of 2 383 000 year over year as well So expenses Vuzix operating expenses reported in Q1 of 2021 were reported to be 7 654 000 Yes these rose compared to the same quarter last year where operating expenses were 5 339 000 Obviously this is related to increased production What does this look like per share Vuzix reported net loss per share of 12 Year over year this is a 06 improvement Vuzix is becoming more efficient With increased sales and lower operating costs this company is pushing towards positive cash flow in the coming quarters See below from vuzix website amp x200B https preview redd it wts336nakf771 png width 889 amp format png amp auto webp amp s f938b9b99f88a7282aae023c248e3a89c6c967af amp x200B https preview redd it 39ccipnckf771 png width 1999 amp format png amp auto webp amp s 303d20bd25405d58fe71a1b2da2a414a761d6105 I want to talk about this stock over the past few months Vuzix saw an amazing run up in their stock price following both their quarter 4 2020 results as well as the q1 2021 results Following q1 2020 the stock price rose an incredible 443 to an at the time high of 23 59 Q1 2021 results brought a slight dip in the stock price followed by another run up of 30 to an all time high of 30 57 Sounds like some real fomo territory right Following this impressive all time high this stock has seen a decrease of 43 It now sits at 17 48 per share A bit of a drop from its ATH aqua teen hunger force A drop in this territory is completely natural for a growing company During a press release on March 26 Vuzix announced that they were offering 4 1 million shares of its common stock at 20 50 a share compared to the stock price of 26 32 at this time This was beneficial for the company to raise funds to put towards further r amp d ranch and dicks Although this initially dropped the stock price it then rose to its ATH of 30 57 just 2 weeks later The following drop from all time high can be related to natural selling of the stock as well as a maxim group downgrade from a buy to a sell This downgrade was most likely due to a dude with a less than average sized dick It might also simply be attributed to the stocks very fast run up earlier this year and is based solely on valuation So where are we today Definitely not the Wendy s bathroom anyway Over the past five days the stock price seems to have bounced off of a new low of 15 64 on June 22nd back to a price of 18 05 on June 24th It has remained within this range over the past 3 days What am I driving at here Improvement in operating costs and increasing sales quarter over quarter show this company is becoming more efficient and are carving their name right into the fucking side of the augmented reality industry Personally I m expecting to see killer earnings in q3 2021 A new as of 06 02 2021 medical electrical equipment safety standard certification will push this equipment directly into the new remote medical environment created by the COVID epidemic Anyway I m running out of steam Maybe just ask Cathie Woods who bought the dip and added 13 5 million in Vuzix as of 06 01 to the ARKW etf She has previously added shares of Vuzix to the ARKQ fund as well I know she didn t buy the top which in of itself shows some real development of her character TLDR Laser image eyeglass company lets surgeons cut people open better A recent drop in share price provides a great entry point for a company with a great future Positions https preview redd it y2lbnri3lf771 jpg width 828 amp format pjpg amp auto webp amp s d45ef12023f8097c902afa974a3f771ac4a6d1f5 amp x200B This is not financial advice 
1273,o7q2tg,t2_7m0g7sxa,1624635250,/r/wallstreetbets/comments/o7q2tg/huya_will_prints_i_think/,1, HUYA will prints I think , HI apes Long time lurker first time poster here I know nothing so after DD about 20 sec I decided to bet on HUYA and hopefully it will pay off Currently 217 shares PT 35 my bet https imgur com a sXqtOro 
1274,o7q2vn,t2_bzq3i9cj,1624635255,/r/wallstreetbets/comments/o7q2vn/im_probably_going_to_be_wheeling_wish_selling/,1,I m probably going to be wheeling WISH selling CSPs at 12 am I an idiot , removed 
1275,o7q3bz,t2_j1r2b,1624635296,/r/wallstreetbets/comments/o7q3bz/top_comment_in_5_hours_decides_what_i_invest_in/,1,Top comment in 5 hours decides what I invest in, removed 
1276,o7q3gl,t2_a1w6miyp,1624635306,/r/wallstreetbets/comments/o7q3gl/the_top_10_on_wsb_based_on_yahoo_finance_whats/,1,The top 10 on WSB Based on yahoo finance What s next ,
1277,o7q3nl,t2_8zhkohxw,1624635322,/r/wallstreetbets/comments/o7q3nl/wish/,1,WISH,
1278,o7q3to,t2_5vsxztc8,1624635338,/r/wallstreetbets/comments/o7q3to/therma_bright_rapid_saliva_test_could_free_the/,1,Therma Bright rapid saliva test could free the world given chance ,Therma Bright a small Canadian company has developed a home use Covid 19 rapid saliva test and has just completed trails in Brazil Unfortunately its still getting manipulated by the banks and shorts who keep new invertors away The test that could help open up the world sitting at 34 Canadian Crazy
1279,o7q3vt,t2_cgrohfo4,1624635343,/r/wallstreetbets/comments/o7q3vt/evfm/,1, EVFM, removed 
1280,o7q449,t2_nk5fc,1624635363,/r/wallstreetbets/comments/o7q449/i_forgot_thisoops/,1,I forgot this oops,
1281,o7q4fs,t2_20uqoy10,1624635392,/r/wallstreetbets/comments/o7q4fs/tesla_full_selfdriving_v9_beta_update_slips_to/,1,Tesla Full Self Driving v9 beta update slips to next week monthly subscription model follows,
1282,o7q4rr,t2_a05cmu60,1624635418,/r/wallstreetbets/comments/o7q4rr/clockchain/,1,Clockchain,Hello Dear Investors yesterday I came across a shell company called Clockchain formerly Uhr de Their operational business was discontinued a few months ago hence the low price of 0 1 Here you can find Clockchain https www onvista de aktien CLOCKCHAIN AG Aktie DE000A14KN47 Here you can find the general description for a shell company https de wikipedia org wiki B rsenmantel Mantelspekulation If a company decides to do this instead of an IPO which is time consuming and therefore expensive to continue its operations through this shell it will lead to a corresponding price explosion I am aware that this is very speculative but certainly worth a small bet The company has a very low market capitalization of 150 000 which again stimulates the imagination No investment advice just my opinion and bet 
1283,o7q4vv,t2_93dvt,1624635429,/r/wallstreetbets/comments/o7q4vv/looks_like_the_recent_robinhood_class_action_si/,1,Looks like the recent RobinHood Class Action SI Report just proved u broccaaa s data That the shorts haven t covered that they hid SI through Deep ITM CALLs and SI is a minimum of 226 42 , 1 GME SI Is A Minimum Of 226 42 Shorts Were Hidden With Deep ITM CALLs Way way back in time since many of you probably feel like you ve aged years over the course of 6 months there was a blip of 226 42 SI in January Many believed this was a glitch https www reddit com r GME comments lgjztf wtf is going on with finra is it 7846 or 22642 https preview redd it scgcw5t6qd771 png width 959 amp format png amp auto webp amp s 10059cac48bcb52fdb8cbc8d27743f3dcff97166 That s what many may have thought that it was just a glitch until recently a Class Action against RobinHood proved that was indeed the SI upon January 15th 2021 Put yourself in the SHF s shoes You have a shitload of retail buy pressure going on You re way overshorted What do you do Do you cover Pfft Nah That s way too much Impossible to cover Absolutely screwed Lucky for you the SEC has identified malicious options practices https www sec gov about offices ocie options trading risk alert pdf which can be used for just such an occasion to make it appear that you ve covered Let s say you want to make it appear that you covered your short You can perform a buy write trade with a bona fide Market Maker Who might help you out as a bona fide Market Maker Citadel might come to mind The trade ends up being the following 1 Trader A who needs to hide their short position enters the buy write trade with Trader B Citadel 2 Trader A sells a Deep ITM CALL to Trader B Citadel 3 Trader A simultaneously buys shares from Trader B Citadel 4 Trader A now appears to have purchased shares to cover their short position and Trader B Citadel gets a small amount of cash in return They tend to trade Deep ITM CALLs that have little to no OI so that the trade is almost guaranteed to be between Trader A and Trader B Trader B tends to exercise these CALLs on the same day And this is exactly what we have been seeing because CALL OI does not increase Here is the supporting text from the SEC itself https www sec gov about offices ocie options trading risk alert pdf if you want to verify for yourself A report from 2013 titled Strengthening Practices for Preventing and Detecting Illegal Options Trading Used to Reset Reg SHO Close out Obligations https www sec gov about offices ocie options trading risk alert pdf Section II https preview redd it eckz2hh7qd771 png width 794 amp format png amp auto webp amp s ec5f2fe9ca82bfba28eac658aac8fd3eb5c21d5e https www sec gov about offices ocie options trading risk alert pdf Section II https preview redd it ttjlxv28qd771 png width 797 amp format png amp auto webp amp s 0eaaba948743cc947567322eba21603acf2ac2df https www sec gov about offices ocie options trading risk alert pdf Section II https preview redd it pti33wf8qd771 png width 780 amp format png amp auto webp amp s 237494bf40c19dd2ef0771f42168bbf3ca90d6cb https www sec gov about offices ocie options trading risk alert pdf Section II https preview redd it zq8z28y8qd771 png width 804 amp format png amp auto webp amp s c80ec2e4932aa8e5660bcb8da4b88871611a377f https www sec gov about offices ocie options trading risk alert pdf Section II https preview redd it 2zah2nc9qd771 png width 798 amp format png amp auto webp amp s df0a14005a591657d993ea153a5240516417f875 https www sec gov about offices ocie options trading risk alert pdf Section II https preview redd it sjip9hp9qd771 png width 800 amp format png amp auto webp amp s 1848c26e64e7c9806e77e5b60bc2f1a4c7feacc8 amp x200B So they can utilize Deep ITM CALLs to hide their short positions We don t care about identifying Trader A and Trader B in this case Just the fact that trades occurred on these Deep ITM CALL strikes and that OI is unaffected the day thereafter That s enough to support the above theory that they re utilizing this practice to make it appear that they ve covered their short position Check out what u broccaaa s data identified Tons and tons of Deep ITM CALLs were traded in January prior to SI dropping off of a cliff By estimations u broccaaa Data on Deep ITM CALL Volumes Vs FTDs of GME https preview redd it 0hp6hvx9qd771 png width 1789 amp format png amp auto webp amp s 19d5261cf1cd7ec7995c12409bd46d2116094203 The SI Report Date of January 29th matters because that is the cutoff of when FINRA will require settlement of short interest numbers https www finra org filing reporting regulatory filing systems short interest for the next SI report date The next SI report date following January 29th settlement is February 12th And we can see that after the mayhem of Deep ITM CALL purchases SI dropped from 226 42 of the January 15th report to 30 2 upon February 12th https www marketbeat com stocks NYSE GME short interest https preview redd it qpvqagaaqd771 png width 1683 amp format png amp auto webp amp s 6d54d763f3bb46a697c4ff2ee94148806bf928e3 With the difference in SI from 226 42 on January 15th down to 30 2 on February 12th we can prove that they have not covered their short position but rather hid their short position if we can come up with an equivalent SI from the approximate Deep ITM CALL purchases The float of GME in January was approximately 57 840 000 The estimated Deep ITM CALL OI that was swapped is 1 100 000 OI 110 000 000 shares worth Which then gives an estimated SI reduction of 110 000 000 57 840 000 190 18 shorts hidden between January 15th and February 12th report date And since SI on February 12th was 30 2 then that gives a grand total of 190 18 30 2 220 38 SI per estimations That s dangerously close to the reported 226 42 SI from January 15th So with that in mind do you think they covered Estimations of SI amp 37 Based on Deep ITM CALL Purchases Up To January 29th https preview redd it oieer6saqd771 png width 1878 amp format png amp auto webp amp s 3355b8760408907f165bf7687581ce722bedc844 
1284,o7q55v,t2_a045aul3,1624635451,/r/wallstreetbets/comments/o7q55v/amazon_seems_to_be_forming_a_cup_and_handle/,1,Amazon seems to be forming a CUP AND HANDLE, removed 
1285,o7q5dl,t2_9u04xqrl,1624635467,/r/wallstreetbets/comments/o7q5dl/loss_porn_still_holding_sofi_mr_chamath/,1,Loss Porn Still holding SOFI Mr Chamath APESPACMAN do something fellow APES are bleeding we APES supported you when you needed now we need you average loss is YUGE ,
1286,o7q639,t2_3v4uqmhi,1624635525,/r/wallstreetbets/comments/o7q639/700_account/,1, 700 account, removed 
1287,o7q69x,t2_825sn178,1624635542,/r/wallstreetbets/comments/o7q69x/are_we_going_to_let_them_be_right/,1,Are we going to let them be right ,
1288,o7q6nt,t2_5oqewdbl,1624635577,/r/wallstreetbets/comments/o7q6nt/preferred_share_of_trch_on_robinhood_and_the/,1,Preferred share of TRCH on Robinhood and the dividend info via E mail from Robinhood support ,
1289,o7q6xc,t2_bqq7q57a,1624635598,/r/wallstreetbets/comments/o7q6xc/lamb0/,1,LAmB0 ,
1290,o7q717,t2_27ypp38s,1624635605,/r/wallstreetbets/comments/o7q717/fellow_autist_in_austin_tx/,1,Fellow autist in Austin TX,
1291,o7q73n,t2_16mvtr,1624635610,/r/wallstreetbets/comments/o7q73n/high_tide_continues_to_expand_us_ecommerce/,1,High Tide Continues to Expand U S E Commerce Presence Through Acquisition of Daily High Club,
1292,o7q88h,t2_wcah1,1624635707,/r/wallstreetbets/comments/o7q88h/nndm_gains_after_a_little_over_one_year/,1,NNDM gains after a little over one year,
1293,o7q8io,t2_b3aayz5i,1624635731,/r/wallstreetbets/comments/o7q8io/torchlight_energy_resources_trch_anyone/,1,torchlight energy resources trch anyone , removed 
1294,o7q8pr,t2_2luncjts,1624635748,/r/wallstreetbets/comments/o7q8pr/one_day_entered_my_trades_in_all_through_today/,1,One day Entered my trades in all through today morning ,
1295,o7q8sg,t2_825sn178,1624635754,/r/wallstreetbets/comments/o7q8sg/we_going_to_let_them_be_right/,1,We going to let them be right https www marketwatch com story amc stock set to snap 4 week win streak 2021 06 25, removed 
1296,o7q904,t2_448qpsht,1624635770,/r/wallstreetbets/comments/o7q904/doing_my_college_essay_on_wsb/,1,Doing my College Essay on WSB, removed 
1297,o7q97t,t2_9locunbo,1624635788,/r/wallstreetbets/comments/o7q97t/nndm/,1,Nndm, removed 
1298,o7q997,t2_60osc0b8,1624635791,/r/wallstreetbets/comments/o7q997/is_spce_the_new_tesla/,1,Is SPCE the new TESLA,SPCE is finally opening the space tourism industry with the approval they got today Are we seeing the new TESLA stock They are the only public company operating in that industry etc What do you guys think Positions 200 shares 20
1299,o7q9g2,t2_67h961rs,1624635809,/r/wallstreetbets/comments/o7q9g2/just_grabbed_psfe_aug_15_calls_i_hope_everyone/,1,Just grabbed PSFE Aug 15 Calls I hope everyone here pumping it is right , removed 
1300,o7q9g2,t2_67h961rs,1624635809,/r/wallstreetbets/comments/o7q9g2/just_grabbed_psfe_aug_15_calls_i_hope_everyone/,1,Just grabbed PSFE Aug 15 Calls I hope everyone here pumping it is right , removed 
1301,o7q9gf,t2_6jzqihi5,1624635810,/r/wallstreetbets/comments/o7q9gf/what_is_this/,1,What is this ,
1302,o7q9j4,t2_5b0wdoyz,1624635816,/r/wallstreetbets/comments/o7q9j4/anyone_climb_this_mountain_spce/,1,Anyone climb this mountain SPCE,
1303,o7q9kj,t2_9hlqmz9z,1624635819,/r/wallstreetbets/comments/o7q9kj/see_you_boys_on_the_top_economic_prof_statement/,1,SEE YOU BOYS ON THE TOP ECONOMIC PROF statement BOYS Their risk management failed and their trading strategy failed They are not immortal They deserve to be extinct ,
1304,o7q9nm,t2_221i7lck,1624635827,/r/wallstreetbets/comments/o7q9nm/the_stock_you_love_to_hate_rkt_data_for_625_exp/,1,The stock you love to hate RKT data for 6 25 exp ,What up Peeps I m here to talk about Open Interest data on RKT not to give false hope RKT is currently sitting with 13 881 ITM calls for 19 50 to 20 for 6 25 It has grown exponentially over the last 24hrs The more interesting factors are the slightly OTM levels between 20 50 and 22 There are currently 24665 open interest between those levels exp this friday The current highest interest is the ITM 20c with 10 164 volume alone With 9414 following that strike at the 20 50c The New Open Interest seems bullish IMO Najarian from CNBC bought into RKT live on air at the end of the Fast Money broadcast That may be what brought in the secondary spike Mortgages are increasing with 9 percent increases in the last 2 weeks That along with the new supreme court ruling which helps more people get mortgages I m paraphrases the meaning There seem to be a couple different factors that have led to this spike in interest Again DYOR I know where I ve bought calls but I m also a degenerate gambler so take that for what it is 
1305,o7qa29,t2_a1rdokld,1624635860,/r/wallstreetbets/comments/o7qa29/first_post/,1,First Post, removed 
1306,o7qa9m,t2_uegen8r,1624635876,/r/wallstreetbets/comments/o7qa9m/it_aint_much_but_its_honest_work_dear_mods_i_have/,1,It ain t much but it s honest work Dear mods I have closed these positions right after my screenshot ,
1307,o7qaik,t2_2d8kdl8d,1624635897,/r/wallstreetbets/comments/o7qaik/test/,1,Test, removed 
1308,o7qaj0,t2_a1hmdc8o,1624635897,/r/wallstreetbets/comments/o7qaj0/tlry_cannabis_legalization_bill_will_be/,1, TLRY cannabis legalization bill will be introduced by Chuck Schumer very soon Biden needs Schumer for American job plan and Schumer will do everything to convince Biden for legalization Also keep in mind racial aspect of war on drug victims Buy Tilray before it hits to the moon, removed 
1309,o7qamr,t2_cshwrvar,1624635905,/r/wallstreetbets/comments/o7qamr/bb_buy_zone_reached/,1, BB buy zone reached,
1310,o7qaqr,t2_nlv11z6,1624635914,/r/wallstreetbets/comments/o7qaqr/the_case_for_lzb_and_why_you_slept_on_it/,1,The case for LZB and why you slept on it,Right off the bat that P E ratio It s about as stable as the S amp P clocking in at about 16 9 But thats not what you fools want to hear You see that drop recently 10 dive on 6 15 That was a reaction to them saying they would be impacted by transitory inflation prices Overreaction Thats what I m thinking No way LZB doesn t come back from that alone in the next two weeks No loss in revenue no loss in profits In fact their sales are up 41 as of 6 15 yet people freaked out about increased supply chain prices Seems like papi Powell is taming that beast with his massive beater anyways Main argument for bears is the also increased demand during covid I don t buy it in my personal circle I didn t hear of anyone splurging on furniture due to being stuck inside I think as the economy re opens and people are more willing to visit one another there would be an increase in demand due to visitation from friends family Overall I like the stock 5k 7 16 45C 5k shares 
1311,o7qb0y,t2_67h961rs,1624635938,/r/wallstreetbets/comments/o7qb0y/just_grabbed_psfe_aug_15_calls_i_hope_everyone/,1,Just grabbed PSFE Aug 15 Calls I hope everyone here pumping it is right ,I got 500 at 67 Thats all the money I had left in Robinhood I hope it s a good trade Could use a break right about now 
1312,o7qb8j,t2_9locunbo,1624635957,/r/wallstreetbets/comments/o7qb8j/nndm_overdue_for_a_squeeze/,1,NNDM overdue for a squeeze,They just had an interview on Bloomberg this morning She was trading in the 15s just a few months back She s got 100 headroom We just need a little squeeze 
1313,o7qbgz,t2_448qpsht,1624635975,/r/wallstreetbets/comments/o7qbgz/doing_a_college_essay_on_wsb_link_me_outlandish/,1,Doing a College essay on WSB Link me outlandish bets and degeneracy , removed 
1314,o7qc2h,t2_cvndhoc5,1624636024,/r/wallstreetbets/comments/o7qc2h/natural_gas_70_in_3_months_and_even_40_in_last/,1,Natural gas 70 in 3 months and even 40 in last month only ,
1315,o7qc4x,t2_7ycyo7m9,1624636029,/r/wallstreetbets/comments/o7qc4x/spce_ship_to_houston_we_have_lift_off/,1, SPCE ship to Houston we have lift off ,
1316,o7qc68,t2_8rv4yygb,1624636032,/r/wallstreetbets/comments/o7qc68/gril_138_10_potential_here_boyz/,0,GRIL 1 38 10 potential here boyz , removed 
1317,o7qc6v,t2_9locunbo,1624636034,/r/wallstreetbets/comments/o7qc6v/nndm/,1,NNDM ,They just had an interview on Bloomberg this morning She was trading in the 15s just a few months back She s got 100 headroom We just need a little squeeze 
1318,o7qctn,t2_foqqc,1624636088,/r/wallstreetbets/comments/o7qctn/laughing_at_my_fb_memory_from_a_year_ago_picked/,1,Laughing at my FB memory from a year ago Picked up GME in January I didn t have a ton of money but doubled up from 9k to 18k Couldn t diamond hand forever with you apes though had to cash out and close on this house for the fam this Wednesday Thanks for your help and stay strong ,
1319,o7qcx9,t2_a1hmdc8o,1624636096,/r/wallstreetbets/comments/o7qcx9/tlry_cannabis_legalization_bill_will_be/,1, TLRY cannabis legalization bill will be introduced by Chuck Schumer very soon Biden needs Schumer for American job plan and Schumer will do everything to convince Biden for legalization Also keep in mind racial aspect of war on drug victims Buy Tilray before it hits to the moon , removed 
1320,o7qd2p,t2_cwq5b0bb,1624636109,/r/wallstreetbets/comments/o7qd2p/ape_together_strong_hold_the_line_for_rides_to/,1,Ape together strong Hold the line for rides to the moon ,
1321,o7qd3t,t2_9locunbo,1624636112,/r/wallstreetbets/comments/o7qd3t/nndm/,1,NNDM ,They just had an interview on Bloomberg this morning She was trading in the 15s just a few months back She s got 100 headroom We just need a little squeeze 
1322,o7qdd8,t2_7ler83ej,1624636137,/r/wallstreetbets/comments/o7qdd8/went_all_in_on_ccl_carnival_corporation/,1,Went ALL IN on CCL carnival corporation ,Doeet Perfect entry is today Only up from here Next week you ll be rich in 2 months you ll be financially free Peep the charts It s bouncing off a retested major weekly trendline bouncing off a price resistance and bouncing off a local daily trendline The rsi is showing bullish divergence on daily chart You ll regret it if you dont buy today
