,postid,author,created_utc,permalink,score,title,selftext
0,o7caqn,t2_483rra78,1624579703,/r/wallstreetbets/comments/o7caqn/clov_ortex_just_updated_on_20210624_195754/,1, CLOV Ortex just updated on 2021 06 24 19 57 54 Eastern Time Just released Jun 15 settlement data almost same Shares Short and Short of Freefloat Days To Cover reduced to 1 today s Average Cost to Borrow 46 72 and trending up 100 utilization Volume steady I see Tendies in the cooking ,
1,o7cb0z,t2_58xgqr19,1624579732,/r/wallstreetbets/comments/o7cb0z/what_is_the_secret_behind_keeping_the_chart_going/,1,What is the secret behind keeping the chart going up like this I ll take this everyday ,
2,o7cb34,t2_b1bw6zm9,1624579737,/r/wallstreetbets/comments/o7cb34/hofv/,1, HOFV,I called BTX 2 weeks ago at 14 and it squeezed NEXT play is HOFV tomorrow with inclusion of Russell 3000 and partnership announcement June 30th 400m market cap possible halting TKAT OPRH style run Don t miss out again I keep proving all the haters wrong and I have the thank you messages Cheers 
3,o7cbfq,t2_cknrmbs0,1624579773,/r/wallstreetbets/comments/o7cbfq/how_do_apes_sell_covered_calls/,1,How do apes sell covered calls ,Question how is my potential loss infinite Using this example bought own 100 shares of a stock at 10 it dipped to 5 and I SOLD a call option for 0 50 premium with 20 strike price 30 day expiration My understanding is 1 if the stock never breaks the 20 dollar mark by the strike date the buyer wouldn t execute the option and I would pocket the 50 premium and I get my shares back at the price of the stock when the option expires 2 If the stock breaks the 20 strike price anytime before the strike date the buyer will execute the option and buy the 100 shares from me at 20 each meaning I profit 50 premium 100 20 10 for a total profit of 1050 The only loss would be opportunity loss right Or If I didn t own the shares to begin with I d have to pay the 2000 value out of pocket I just don t understand the limitless loss potential
4,o7cbsu,t2_1z888qjo,1624579809,/r/wallstreetbets/comments/o7cbsu/yolo_oxy_to_the_moon/,1,YOLO OXY TO THE MOON , removed 
5,o7cc46,t2_a1w6miyp,1624579840,/r/wallstreetbets/comments/o7cc46/started_a_thread_earlier_and_perhaps_it_may_have/,1,Started a thread earlier and perhaps it may have been too conservative for this group So if I may I d like to ask people their best bets for July front the S amp P 500 To be fair I ll start the discuss with my picks LUV TMUS PYPL NFLX and FB , removed 
6,o7ccg4,t2_2ji6dd4e,1624579875,/r/wallstreetbets/comments/o7ccg4/hes_one_of_us_saw_him_at_my_local_target_had_to/,1,He s one of us Saw him at my local target had to post ,
7,o7cd96,t2_2k2hpgmb,1624579952,/r/wallstreetbets/comments/o7cd96/im_gunna_need_yall_to_cooperate/,1,I m gunna need y all to cooperate , removed 
8,o7ce81,t2_cv6rjir,1624580050,/r/wallstreetbets/comments/o7ce81/we_all_want_dnut_lets_go/,1,we all want D NUT Let s Go , removed 
9,o7cf15,t2_3nqndao2,1624580133,/r/wallstreetbets/comments/o7cf15/most_actives_yahoo_finance/,1,Most Actives Yahoo Finance ,
10,o7cf7n,t2_cbge3c5i,1624580152,/r/wallstreetbets/comments/o7cf7n/charles_payne_just_called_david_paper_hands/,1,Charles Payne just called David paper hands Portnoy a little bitch on live TV,
11,o7cfcp,t2_2tj801l0,1624580164,/r/wallstreetbets/comments/o7cfcp/wall_st_cheat_sheet/,1,Wall St Cheat Sheet,
12,o7cfme,t2_cx5avhnt,1624580190,/r/wallstreetbets/comments/o7cfme/aht_is_going_to_20_hold_the_line/,1, AHT IS GOING TO 20 HOLD THE LINE , removed 
13,o7cfxf,t2_a6xbd8lm,1624580219,/r/wallstreetbets/comments/o7cfxf/eamc2_amc_to_the_stars_the_moon_is_just_the_first/,1,E AMC2 AMC to the Stars The moon is just the first step AMC ,
14,o7cfxj,t2_17k10y,1624580220,/r/wallstreetbets/comments/o7cfxj/esta_looks_prime_to_short_what_do_you_guys_think/,1, ESTA looks prime to short what do you guys think ,Just a gut feeling but it looks like they re pumping the price to sell the company without selling their stock to raise capital Negative income 
15,o7cg26,t2_3nqndao2,1624580230,/r/wallstreetbets/comments/o7cg26/most_active_stocks_today/,1,Most Active Stocks Today,
16,o7cgq1,t2_483rra78,1624580298,/r/wallstreetbets/comments/o7cgq1/clov_ortex_just_updated_on_20210624_195754/,1, CLOV Ortex just updated on 2021 06 24 19 57 54 Eastern Time Just released Jun 15 settlement data almost same Shares Short and Short of Freefloat Days To Cover reduced to 1 today s Average Cost to Borrow 46 72 and trending up 100 utilization Volume steady I see Tendies in the cooking ,
17,o7cgqn,t2_cbge3c5i,1624580300,/r/wallstreetbets/comments/o7cgqn/charles_payne_just_called_david_paper_hands/,1,Charles Payne just called David paper hands Portnoy a little bitch on live TV,
18,o7ch84,t2_13sgw5,1624580346,/r/wallstreetbets/comments/o7ch84/no_i_dont_think_i_will/,1,No I don t think I will ,
19,o7ch8m,t2_a0bu1fdq,1624580348,/r/wallstreetbets/comments/o7ch8m/httpsenglobescoilenarticleniocarsarrivinginisraelf/,1,https en globes co il en article nio cars arriving in israel for mobileye robotaxi trials 1001375762, removed 
20,o7ci8m,t2_a1jp1e8r,1624580438,/r/wallstreetbets/comments/o7ci8m/yolo_lets_go_full_retard/,1,Yolo Let s go full retard ,
21,o7ciq8,t2_2fyol2b5,1624580484,/r/wallstreetbets/comments/o7ciq8/jumped_back_into_clov_averaged_up_from_9_contract/,1,Jumped back into CLOV averaged up from 9 Contract was when clov was at 19 ,
22,o7cj59,t2_a1jp1e8r,1624580524,/r/wallstreetbets/comments/o7cj59/yolo_full_retard_mode_for_my_apes/,1,Yolo Full retard mode for my apes ,
23,o7cjza,t2_a1jp1e8r,1624580601,/r/wallstreetbets/comments/o7cjza/yolo_to_all_my_savings/,1,Yolo to all my savings ,
24,o7cl2x,t2_a07cgbjv,1624580710,/r/wallstreetbets/comments/o7cl2x/hnst_locked_loaded/,1,HNST LOCKED amp LOADED ,
25,o7clig,t2_a1w6miyp,1624580753,/r/wallstreetbets/comments/o7clig/will_beyondmeat_make_it_big_the_chart_cant_decide/,1,Will beyondmeat make it big The chart can t decide Can we ,
26,o7cm1q,t2_aload90k,1624580803,/r/wallstreetbets/comments/o7cm1q/you_anyone_know_anything_on_this_ipo_its_value_is/,1, YOU anyone know anything on this IPO it s value is around 2 2 billion lmk your guy s thoughts,
27,o7cmt1,t2_a3n6igl7,1624580878,/r/wallstreetbets/comments/o7cmt1/new_pi_cryptocurrency/,1,New Pi Cryptocurrency, removed 
28,o7cn4q,t2_cwawjzc2,1624580912,/r/wallstreetbets/comments/o7cn4q/vuzi/,1,VUZI, removed 
29,o7cno5,t2_a03p0qqo,1624580967,/r/wallstreetbets/comments/o7cno5/why_dont_we_just_blast_the_company_marin_which/,1,Why don t we just blast the company Marin which rose 100 today only 30M MCap we can bounce it to 3 billion just for fun MRIN, removed 
30,o7covv,t2_ckjfmuio,1624581089,/r/wallstreetbets/comments/o7covv/update_i_aint_no_little_bitch_portnoy/,1, update I ain t no little bitch portnoy,
31,o7cowt,t2_57h294vh,1624581092,/r/wallstreetbets/comments/o7cowt/dbx_buybacks_moon/,1,DBX Buybacks Moon, removed 
32,o7cpc3,t2_cx5avhnt,1624581136,/r/wallstreetbets/comments/o7cpc3/aht_is_going_to_20_hold_the_line/,1, AHT IS GOING TO 20 HOLD THE LINE , removed 
33,o7cpma,t2_bbqzy,1624581162,/r/wallstreetbets/comments/o7cpma/updated_nasdaq_short_interest_wish_clov_wkhs/,1,Updated Nasdaq Short Interest WISH CLOV WKHS 06 15 2021 Settlement released Today ,
34,o7cqtl,t2_a03p0qqo,1624581283,/r/wallstreetbets/comments/o7cqtl/why_dont_we_just_blast_the_company_marin_which/,1,Why don t we just blast the company Marin which rose 100 today only 30M MCap we can bounce it to 3 billion just for fun MRIN, removed 
35,o7crml,t2_57gblh7d,1624581371,/r/wallstreetbets/comments/o7crml/ttd_gave_me_6x_morning_wood_and_no_it_wasnt_picks/,1, TTD gave me 6X morning Wood and no it wasn t picks of Aunt Cathie,
36,o7crqs,t2_7r0do9f5,1624581381,/r/wallstreetbets/comments/o7crqs/new_in_town/,1,New in Town,Hey guys Just joined this group of Mad Lads and am beginning to invest First time investing and I have 60 in Bit and 20 in the doggy coin y all know what I m saying I m using Coinbase for the online money stuff but want to get into other stock What should I start with Also are these good apps I know Coinbase charges and it feels sus but I am totally open to suggestions on how to get going and what to use Thanks guys 
37,o7csji,t2_9i1nrvny,1624581460,/r/wallstreetbets/comments/o7csji/clov/,1, CLOV,Im just curious Is that matter I m thinking about buying more CLOV Do you consider a politician connections as a good or bad sign I live in east Europe and its obvious here how about US Chelsea Clinton has served as a member of Clover s board of directors since February 2017 Since March 2013 Ms Clinton has served as Vice Chair of the Clinton Foundation where her work emphasizes improving global and domestic health creating service opportunities and empowering the next generation of leaders 
38,o7ctad,t2_a6xbd8lm,1624581535,/r/wallstreetbets/comments/o7ctad/kulr_looks_promising_some_side_trade_action_while/,1, KULR looks promising Some side trade action while holding and buying more AMC , removed 
39,o7ctyi,t2_cx62z1z9,1624581599,/r/wallstreetbets/comments/o7ctyi/trch_hey_hedgies_next_week_were_comin_for_ya/,1, TRCH Hey hedgies next week we re comin for ya ,
40,o7cusg,t2_29oxf1kp,1624581680,/r/wallstreetbets/comments/o7cusg/ipo_lists_for_the_month_of_june_2021/,1,IPO lists for the month of June 2021, removed 
41,o7cv9s,t2_6pex4y27,1624581731,/r/wallstreetbets/comments/o7cv9s/gaymf_its_a_real_stock_symbol_look_it_up_should/,1,GAYMF It s a real stock symbol look it up should we blow this up next , removed 
42,o7cva5,t2_blunb286,1624581731,/r/wallstreetbets/comments/o7cva5/wish_made_all_my_money_back_from_loosing_on_psfe/,1, WISH Made all my money back from loosing on PSFE Wish69, removed 
43,o7cvvc,t2_bf9xq3ba,1624581785,/r/wallstreetbets/comments/o7cvvc/i_just_want_to_make_this_clear_to_any_potentially/,1,I just want to make this clear to any potentially new AMC share holders, removed 
44,o7cw7v,t2_3papo9bz,1624581817,/r/wallstreetbets/comments/o7cw7v/smol_ape_reporting_for_doody/,1,Smol Ape reporting for doody,
45,o7cw8y,t2_abbovfgf,1624581820,/r/wallstreetbets/comments/o7cw8y/ortex_is_indicating_that_shares_are_being/,1,ORTEX is indicating that shares are being borrowed and never shorted We see them returned and we assume they were shorts returned so buy orders were made but that s not the case Something fishy is going on my fellow apes ,
46,o7cwgd,t2_tibhd,1624581840,/r/wallstreetbets/comments/o7cwgd/psfe_please_save_my_calls/,1, PSFE PLease Save My Calls ,
47,o7cwxk,t2_cx6bzjrp,1624581882,/r/wallstreetbets/comments/o7cwxk/srne_high_short_interest_for_a_reason/,1, SRNE HIGH SHORT INTEREST FOR A REASON , removed 
48,o7cx1x,t2_8c25olg9,1624581894,/r/wallstreetbets/comments/o7cx1x/atom/,1,ATOM,Potential short squeeze ATOM 23M share float at least 20 short interest With a float that low anyone think this can moon 
49,o7cy27,t2_b63sv,1624581989,/r/wallstreetbets/comments/o7cy27/do_any_of_you_retards_know_what_this_option/,1,Do any of you retards know what this option strategy is called ,So I had this idea while I was messing around with different ideas for options spreads and would like to learn more about this strategy I m going to use SNDL for the example here just because I happened to be looking at it when I was fiddling around but I think I might have found an actually worthwhile SNDL play Also I get that the options market is closed right now so the totals won t be exact if I were to chose to open this Short leg 1 STO 7 2 2 50P credit 1 59 Short leg 2 STO 7 9 1C credit 0 11 Long Leg BTO 1 20 23 0 50C debit 0 72 Collateral put up 250 Credit collected 98 Effective cost average per share 1 52 So my idea is that the first short leg is all but guaranteed to get assigned At that point I would essentially have 100 shares and a PMCC I could then use the second short leg to wheel the shares weekly at 1 until assignment for a credit roughly between 05 10 and then open another short leg monthly at either 1 50 or 1 for an avg credit between 05 10 If anytime in the next two years SNDL turns their shit around for example if they manage to make headway in the emerging US markets then I ll have the 0 50 LEAP in my port which I essentially got for nothing as it had paid for itself through the play The way I see it assuming assignment the first week then the play would have a return of 42 while still having a PMCC on the LEAP in the market I could either continue to play monthly PMCCs on the LEAP or simply sell it at any time The PMCCs would make the the return on the play a net profit in 4 months or I could close the LEAP for a 12 total ROI The benefit I see in this play is that it has the potential to have a long life span that could adjust based on the underlying Currently SNDL is trading at roughly 1 but the play wouldn t become unprofitable if it returned back to the 70 range or lower I would simply have to roll out the short leg enough times to generate 42 to break even I would think even in the worst case something like STO 90DTE calls 4 times would be manage to do it Again I don t really want to hear opinions on the underlying moreso the strategy Does this have a name Am I missing something that makes this a terrible idea Let me know 
50,o7cz80,t2_7wxcc4am,1624582097,/r/wallstreetbets/comments/o7cz80/trch_we_need_your_help/,1,TRCH we need your help, removed 
51,o7czu4,t2_a4hikpxt,1624582158,/r/wallstreetbets/comments/o7czu4/vsto_vista_outdoor_inc/,1, VSTO VISTA OUTDOOR INC, removed 
52,o7d0mc,t2_b63sv,1624582241,/r/wallstreetbets/comments/o7d0mc/do_any_of_you_know_what_this_option_strategy_is/,1,Do any of you know what this option strategy is called ,So I had this idea while I was messing around with different ideas for options spreads and would like to learn more about this strategy I m going to use SNDL for the example here just because I happened to be looking at it when I was fiddling around but I think I might have found an actually worthwhile SNDL play Also I get that the options market is closed right now so the totals won t be exact if I were to chose to open this Short leg 1 Sell to Open 7 2 2 50P credit 1 59 Short leg 2 Sell to Open 7 9 1C credit 0 11 Long Leg Buy to open1 20 23 0 50C debit 0 72 Collateral put up 250 Credit collected 98 Effective cost average per share 1 52 So my idea is that the first short leg is all but guaranteed to get assigned At that point I would essentially have 100 shares and a PMCC I could then use the second short leg to wheel the shares weekly at 1 until assignment for a credit roughly between 05 10 and then open another short leg monthly at either 1 50 or 1 for an avg credit between 05 10 If anytime in the next two years SNDL turns their shit around for example if they manage to make headway in the emerging US markets then I ll have the 0 50 LEAP in my port which I essentially got for nothing as it had paid for itself through the play The way I see it assuming assignment the first week then the play would have a return of 42 while still having a PMCC on the LEAP in the market I could either continue to play monthly PMCCs on the LEAP or simply sell it at any time The PMCCs would make the the return on the play a net profit in 4 months or I could close the LEAP for a 12 total ROI The benefit I see in this play is that it has the potential to have a long life span that could adjust based on the underlying Currently SNDL is trading at roughly 1 but the play wouldn t become unprofitable if it returned back to the 70 range or lower I would simply have to roll out the short leg enough times to generate 42 to break even I would think even in the worst case something like STO 90DTE calls 4 times would be manage to do it Again I don t really want to hear opinions on the underlying moreso the strategy Does this have a name Am I missing something that makes this a terrible idea Let me know 
53,o7d0p8,t2_qpxhp,1624582249,/r/wallstreetbets/comments/o7d0p8/down_15k_ytd_but_fortune_cookie_gets_my_back/,1,Down 15k YTD but Fortune cookie gets my back,
54,o7d12l,t2_7wxcc4am,1624582289,/r/wallstreetbets/comments/o7d12l/trch_i_copied_this_from_someones_post/,1,Trch I copied this from someone s post, removed 
55,o7d1fk,t2_a0ek1ws1,1624582328,/r/wallstreetbets/comments/o7d1fk/bbby/,1,BBBY, removed 
56,o7d1m6,t2_5u2ddc3p,1624582349,/r/wallstreetbets/comments/o7d1m6/if_amc_hits_100_next_week_i_will_spend_1000_on/,1,If AMC hits 100 next week I will spend 1 000 on hookers in Vegas on July 4th, removed 
57,o7d2nv,t2_29oxf1kp,1624582459,/r/wallstreetbets/comments/o7d2nv/ipo_lists_for_the_month_of_june_2021/,1,IPO lists for the month of June 2021 ,I have been browsing the net to search for the lists of IPO coming in for the month of June 2021 but all I can get is an AD that needs a subscription Can anyone posts a link that can be followed if ever there is a new IPO that could be a prospect for investment 
58,o7d33f,t2_1lc3lecf,1624582501,/r/wallstreetbets/comments/o7d33f/blue_bird_corporation_winner_of_infrastructure_ev/,1,Blue Bird Corporation Winner of Infrastructure EV Bill Funding ,Any WSB insight into Blue Bird Corporation for the remainder of 2021 amp 2022 TAM looks to be 2 3b wil blbd owning 60 of market share Could double revenue and triple EPS Tweaked Infrastructure Plan Keeps Funds For Biden s EV Chargers Trains Clean Buses Forbes Article 6 24 21 https www forbes com sites alanohnsman 2021 06 24 tweaked infrastructure plan keeps funds for bidens ev chargers Disclaimer I ve held a position in BLBD for a few months Debating growing the position 
59,o7d347,t2_anmlu4uy,1624582503,/r/wallstreetbets/comments/o7d347/my_buddy_doesnt_use_reddit_but_yolod_on_wish/,1,My buddy doesn t use reddit but YOLO d on WISH anyways,
60,o7d3g1,t2_9zsph4cj,1624582539,/r/wallstreetbets/comments/o7d3g1/thats_all_we_need_to_do_is_open_the_64_door_lets/,1,That s all we need to do is open the 64 door let s break that shit we just need to buy more hold more and break that damn door ,
61,o7d3on,t2_chsomavr,1624582563,/r/wallstreetbets/comments/o7d3on/fizzled_out_meme_stock_trend/,1,Fizzled out meme Stock trend,Seems to me this meme Stock craze is and was nothing but a trend that has now fizzeled out No coordination no collaboration no organization 
62,o7d3ox,t2_5u2ddc3p,1624582565,/r/wallstreetbets/comments/o7d3ox/if_amc_hits_100_next_week_i_will_get_a_hooker/,1,If AMC hits 100 next week I will get a hooker , removed 
63,o7d443,t2_59qwi907,1624582609,/r/wallstreetbets/comments/o7d443/come_to_squeeze_eh_the_future_stock_the_world/,1,Come to squeeze EH the future stock the world first listed company for drone ,The new short interest is 6 26M around 37 of 16 77M share float This stock can rise to 1000 finally EHang Holdings Limited ADS EH Short Interest Nasdaq https www nasdaq com zh market activity stocks eh short interest EH EHang Holdings Limited Stock Quote finviz com https finviz com quote ashx t EH 
64,o7d53c,t2_cx5laq95,1624582709,/r/wallstreetbets/comments/o7d53c/community_of_106_million_people_can_help_make/,1,Community Of 10 6 Million people can help make themselves money for STOCKS , removed 
65,o7d578,t2_468d2lao,1624582720,/r/wallstreetbets/comments/o7d578/what_happens_to_any_trch_stocks_purchased_after/,1,What happens to any TRCH stocks purchased after dividend deadline of 6 22 if I bought shares today , removed 
66,o7d5l3,t2_8fgc2,1624582759,/r/wallstreetbets/comments/o7d5l3/wherere_their_witty_retorts_now/,1,Where re their witty retorts now ,
67,o7d5qi,t2_91foaf4r,1624582773,/r/wallstreetbets/comments/o7d5qi/clov_borrow_fee_is_45_as_of_now_see_the_borrow/,1,CLOV borrow fee is 45 as of now See the borrow fee of GME before the moon and you will see My dear fellow Apes LFG ,
68,o7d6ek,t2_a10a9w72,1624582828,/r/wallstreetbets/comments/o7d6ek/whos_holdin/,1,Who s Holdin , removed 
69,o7d6qb,t2_8unymy9z,1624582860,/r/wallstreetbets/comments/o7d6qb/buy_hodl/,1,Buy amp HODL,
70,o7d6r7,t2_15f3z4,1624582863,/r/wallstreetbets/comments/o7d6r7/valve_just_confirming_what_i_already_knew/,1,Valve just confirming what I already knew,
71,o7d7zr,t2_91foaf4r,1624583001,/r/wallstreetbets/comments/o7d7zr/clov_borrow_fee_is_45_as_of_now_look_at_the/,1,CLOV borrow fee is 45 as of now Look at the borrow fee of GME before the moon and you will see LFG ,
72,o7d8k2,t2_b52z3gce,1624583067,/r/wallstreetbets/comments/o7d8k2/hmbl/,1,HMBL , removed 
73,o7d8zo,t2_a0hxfzi6,1624583117,/r/wallstreetbets/comments/o7d8zo/pandemic_rebound/,1,Pandemic Rebound,As many people saw in the past year there was a lot of money to be made on stocks just because of the dip that they made because of the pandemic and not for any true business related practices It was possible to have 100 gains Luckily these gains are not all lost There are certain foreign stocks traded on US stock exchanges that haven t rebounded from Coronavirus in the same way but still have the near future upside of rebounding from coronavirus and having big gains These stocks are still undervalued and as these other economies open back up should see big gains One of these stocks that gets a lot of attention is Alibaba for good reason but there is also big upside other places The main place that this upside and HUGE returns is available is Brazil South America was one of the places hardest hit by coronavirus and is still struggling but as it recovers from coronavirus there will be big gains I see the biggest gains in some of the biggest companies in and around Brazil especially banking The tickers of these undervalued stocks that are and will continue rising are as people see them as undervalued are SBS CBD BSBR BRF CIB VIV These companies have large Market shares and are down because of the pandemic problems They should still have that large market share after the pandemic It s just a wait until these countries get coronavirus more under control and there will be big gains It s all about finding undervalued companies and these are just a few of many foreign companies that are undervalued right now as they get back on track after COVID 19 It is also not limited to South America These gains are also available other places in stocks like RYCEY If you missed out on the pandemic stock surge it s still not too late You can make the gains by putting your money into foreign companies 
74,o7d9a3,t2_5yp8ovbl,1624583150,/r/wallstreetbets/comments/o7d9a3/todays_cookie_announcement_puts_spcm_in_a_bind_i/,1,Today s cookie announcement puts SPCM in a bind I for one will be cashing in on their awful YOLO,It s quite audacious how hard Sprucepoint Capital Management went at MGNI in this investor report https www sprucepointcap com reports mgni research thesis 1 7 2021 pdf I have no idea how big their short position is but it s big enough to make this whole ass dumb report I am not a financial advisor and this is not financial advice but I read a report like this and I am going to yolo all the allowance money I have saved since I was 13 buying OTM long calls on MGNI 
75,o7d9ng,t2_91foaf4r,1624583185,/r/wallstreetbets/comments/o7d9ng/clov_borrow_fee_is_45_now_gme_or_amc_before_its/,1,CLOV borrow fee is 45 now GME or AMC before its mooning also had a high borrow fee You know what I mean my fellow apes ,
76,o7d9uz,t2_a3ndm5mc,1624583210,/r/wallstreetbets/comments/o7d9uz/too_early_or_wrong/,1,Too early or wrong ,
77,o7d9yk,t2_13lkg2,1624583221,/r/wallstreetbets/comments/o7d9yk/another_ape_spotted_in_the_wild/,1,Another Ape spotted in the wild ,Alameda Ca Target Parking lot about 2pm local time today you know the drill raise that grubby little monkey paw of yours https preview redd it 4onh2xqgab771 jpg width 768 amp format pjpg amp auto webp amp s 5a0c58568624e91b74226a8d1df90daf00ebca04
78,o7da0k,t2_8t4n84h3,1624583227,/r/wallstreetbets/comments/o7da0k/forget_amc_and_gamestop_10_new_stocks_reddits/,1,Forget AMC and Gamestop 10 New Stocks Reddit s WallStreetBets Is Buying HAHAHAHAHA,
79,o7daax,t2_cm9rcrda,1624583259,/r/wallstreetbets/comments/o7daax/nok/,1, NOK, removed 
80,o7dbbt,t2_a0tm2cte,1624583363,/r/wallstreetbets/comments/o7dbbt/i_have_50k_in_student_debt_i_missed_on_gme_i/,1,I have 50k in student debt I missed on GME I missed on AMC This time I am going in all with the apes Putting my whole pay check in wish Apes together strong ,
81,o7dcd4,t2_7upibdp8,1624583482,/r/wallstreetbets/comments/o7dcd4/call_spreads/,1,Call spreads,
82,o7dcmy,t2_4xfndgvd,1624583515,/r/wallstreetbets/comments/o7dcmy/vrt/,1,VRT, removed 
83,o7dd6p,t2_bxqc9my4,1624583574,/r/wallstreetbets/comments/o7dd6p/yolo_to_the_moon_amc_ge/,1,YOLO to the moon AMC GE ,
84,o7dd8v,t2_3ni1356k,1624583581,/r/wallstreetbets/comments/o7dd8v/awesome_swing_trade_gains/,1,Awesome swing trade gains ,
85,o7ddrx,t2_5jid1hyw,1624583642,/r/wallstreetbets/comments/o7ddrx/mdxg_game_changing_regenerative_medicine_company/,1, MDXG Game Changing Regenerative Medicine Company Joins the Russell Index ,Already the new standard of care in advanced wound treatment Patients nationwide have healed diabetic foot wounds and avoided amputation Poised for expansion into Australia and Japan Blockbuster treatments in plantar fasciitis and knee osteoarthritis are succeeding in trials Game changing patient care will send this company into the stratosphere Check it out yourself 
86,o7ddsv,t2_8ixy19k5,1624583645,/r/wallstreetbets/comments/o7ddsv/need_tickets_for_universal_studios_orlando_fl/,1,Need tickets for Universal Studios Orlando FL,Guys I m planning a trip to Orlando Universal Studios a family of 5 trying to get cheap tickets for the parks for 2 days for my Birthday on July 24 2021 July 25 Anybody has recommendation to obtain a discount 
87,o7ddvl,t2_bxqc9my4,1624583654,/r/wallstreetbets/comments/o7ddvl/yolo_to_the_moon_amc_ge/,1,YOLO to the moon AMC GE ,
