,postid,author,created_utc,permalink,score,title,selftext
0,ose690,t2_55vnz7s4,1627353421,/r/wallstreetbets/comments/ose690/osat_tomorrow/,1,OSAT Tomorrow,
1,ose8pv,t2_725rxb3m,1627353671,/r/wallstreetbets/comments/ose8pv/bb_yolo_except_im_kinda_broke/,1, BB YOLO Except I m Kinda Broke,
2,osea16,t2_dii2tuv2,1627353801,/r/wallstreetbets/comments/osea16/soaring_eagle_spac_merger_with_promising/,1,Soaring Eagle SPAC Merger With Promising Synthetic Biology Specialist Ginkgo Bioworks,
3,osea70,t2_67zs6p65,1627353820,/r/wallstreetbets/comments/osea70/what_would_you_do_nke/,1,What would you do NKE,
4,oseb2l,t2_cl0au6qk,1627353916,/r/wallstreetbets/comments/oseb2l/hungama_2_2021_hindi_full_movie_watch_online_hd/,1,Hungama 2 2021 Hindi Full Movie Watch Online HD Free Download,
5,osec3x,t2_7vz1uhvf,1627354022,/r/wallstreetbets/comments/osec3x/watching_with_lust_and_waiting_for_the_1st/,1,Watching with lust and waiting for the 1st ,
6,osec7m,t2_5wgdgzie,1627354033,/r/wallstreetbets/comments/osec7m/jeff_youre_rocket_was_cute_but_11min_thats_it_you/,1,Jeff you re rocket was cute but 11min That s it You know we have a Tesla in orbit right ,
7,oseg8b,t2_a56xdlae,1627354451,/r/wallstreetbets/comments/oseg8b/join_httpsredditcomrcontrivancestocks_to_discuss/,1,Join https reddit com r Contrivancestocks to discuss opportunities in the stock market ,Join https reddit com r Contrivancestocks https reddit com r Contrivancestocks to discuss opportunities in the stock market 
8,osehb7,t2_9whmr2g7,1627354565,/r/wallstreetbets/comments/osehb7/good_post_detailing_gamma_exposure/,1,Good post detailing Gamma Exposure, https www reddit com r bemusedThoughtBank comments fr4ur3 gex and you how market gamma exposure influences utm source share amp utm medium web2x amp context 3 https www reddit com r bemusedThoughtBank comments fr4ur3 gex and you how market gamma exposure influences utm source share amp utm medium web2x amp context 3 
9,osehg9,t2_a47ld4ft,1627354580,/r/wallstreetbets/comments/osehg9/china_stocks_in_us_suffer_biggest_2day_loss_since/,1,China stocks in US suffer biggest 2 day loss since 2008 ,
10,oseknq,t2_93km4apw,1627354901,/r/wallstreetbets/comments/oseknq/money/,1,Money, removed 
11,oselko,t2_8671a1b5,1627354993,/r/wallstreetbets/comments/oselko/pattern_day_trading_question_robinhood/,1,Pattern Day Trading Question Robinhood,Hello I recently got flagged as a pattern day trader after being reset after some unfortunate circumstances One of my stock options started going down pre market and I panicked and sold another stock to buy option puts to cover my losses So essentially I did my 4th day trade and I desperately need to make a huge options PUT call tomorrow and sell the day of The email that warned me I got flagged says If you continue to day trade and do not meet the 25 000 requirement by market close you ll be restricted from placing new buy orders for 90 days Does this mean I can have one more day trade before being restricted cause if so I will be confident in executing this options trade Thanks for any help 
12,oselob,t2_cl0au6qk,1627355004,/r/wallstreetbets/comments/oselob/trollhunters_rise_of_the_titans_2021_hindi_dubbed/,1,Trollhunters Rise of the Titans 2021 Hindi Dubbed Full Movie Watch Online HD Free Download,
13,oselp8,t2_8iirud4c,1627355006,/r/wallstreetbets/comments/oselp8/business_founders_and_visionaries_think_big/,1,Business Founders and Visionaries Think Big, removed 
14,oselxg,t2_aaabowfv,1627355029,/r/wallstreetbets/comments/oselxg/down_more_than_100k_guys_good_news_is_i_still/,1,Down more than 100K guys Good news is I still have more than 140K to go bc i m f k ready to go to the end of the earth with those mtfk shitadel ,
15,osenkv,t2_cr3oc7ok,1627355205,/r/wallstreetbets/comments/osenkv/wkhs/,1,WKHS,
16,osepao,t2_2nvbpvej,1627355385,/r/wallstreetbets/comments/osepao/full_blown_downs_thanks_atlas_trading/,1,Full blown downs Thanks Atlas Trading ,
17,oseq92,t2_djeu4360,1627355484,/r/wallstreetbets/comments/oseq92/thoughts_to_carnival_corp/,1,Thoughts to Carnival Corp , removed 
18,oseshi,t2_djeu4360,1627355728,/r/wallstreetbets/comments/oseshi/thoughts_to_carnival_corp/,1,Thoughts to Carnival Corp , removed 
19,osetni,t2_7n49u5cc,1627355847,/r/wallstreetbets/comments/osetni/follow_up_366k_worth_of_gme_716_800_calls/,1,Follow up 366k worth of GME 7 16 800 calls,haha holy shit I ended up with gains on this one because I finally learned you don t diamond hand OTM calls I went in and out of the positions multiple times nice so for the simple people and to save me taking another 80 screen shots I ll give you the summary and the biggest moves in out 427K in PROFIT primarily due to huge price and volatility swings leading up to earnings 6 9 Most of the options bought early were between 9 and 10 each the majority of the profit was made selling them the day before earnings although I did hang on to 100 of them for earnings and lost over 100K by holding them I sold the rest after momentum died and then loaded up on Nov 800 and Jan 950 because THIS IS WALLSTREETBETS IS IT NOT A little delayed on posting this but got called out by u notwinterson so I finally sat down and added it all up amp x200B Tried day trading somewhat successfully until it wasn t https preview redd it 4jsrfq928od71 png width 581 amp format png amp auto webp amp s 5cdb9ae4915d6fd0cb7b8785c0fe96f0454242af PROOF of transactions etc mods please look here Largest sell lot SOLD 49 calls 29 50 on 6 8 https preview redd it 8rhxe9f78od71 png width 1782 amp format png amp auto webp amp s 54078454a4720fa70d3b14bffd8ee035cb918f5f amp x200B Next largest sell lot SOLD 45 28 50 on 6 8 https preview redd it fp5isowh8od71 png width 1766 amp format png amp auto webp amp s 1d3a0d579528f91daf1ba5a7d4257c2d6a31795c amp x200B Some of the sell lots on 6 8 the 45 contract sale is one of the detail shots above https preview redd it rc8mesoo8od71 png width 1786 amp format png amp auto webp amp s 773a4ad3742a8412061acc85df3f807c5805371c amp x200B More of the sell lots on 6 8 the 49 contract circled is the one I posted detail of above https preview redd it c3ys2o4r8od71 png width 1762 amp format png amp auto webp amp s 514b740420adc6a8208308546947f066578fbc07 amp x200B For the unfamiliar I started the YOLO into these options with an average cost of 9 19 in April https preview redd it w5dgqbfw8od71 png width 1736 amp format png amp auto webp amp s 6c14f5acfe136636e399324150eafbb65a172a9a Initial 366K yolo on 4 28 https www reddit com r wallstreetbets comments n0ql77 i heard you like gme july 800 calls 366k ought to Added more money to the yolo 6 4 https www reddit com r wallstreetbets comments nsi9wv added 165k more to the gme july 800s yolo 646k at Abandoned ship 6 22 https www reddit com user irishdud1 comments o5uwco switching from guns long range I like the January 950s the best right now extra crispy https www reddit com r wallstreetbets comments oj0eri im done with 800 gme calls they have 950 ones now 
20,osexsd,t2_djaqx52v,1627356292,/r/wallstreetbets/comments/osexsd/time_to_buy_sears/,1,Time to Buy Sears, removed 
21,osey3p,t2_8m72amk0,1627356324,/r/wallstreetbets/comments/osey3p/ridethe_mother_of_all_short_squeezes/,1, RIDE THE MOTHER OF ALL SHORT SQUEEZES ,
22,osey6m,t2_cl0au6qk,1627356331,/r/wallstreetbets/comments/osey6m/paglet_part_2_2021_s01_complete_kooku_app_hindi/,1,Paglet Part 2 2021 S01 Complete Kooku App Hindi Watch Online HD Free Download,
23,osey78,t2_ci7762a9,1627356333,/r/wallstreetbets/comments/osey78/thoughts_of_sndl_stay_in_or_get_out/,1,Thoughts of SNDL Stay in or get out , removed 
24,oseyuk,t2_ci7762a9,1627356403,/r/wallstreetbets/comments/oseyuk/thoughts_on_sndl_im_new_to_stocks_and_am_not_sure/,1,Thoughts on SNDL I m new to stocks and am not sure if I should hold or get out Any suggestions , removed 
25,osez2q,t2_a32fvu89,1627356428,/r/wallstreetbets/comments/osez2q/next_moves/,1,Next moves,I feel great that we are saving GME and AMC but I m still heartbroken we couldn t save Toys R US in time Guess with my Friday paycheck I ll buy more AMC and CLOV with a smidgen of GME just can t let my wife or her boyfriend know 
26,osezvt,t2_tq7b5,1627356520,/r/wallstreetbets/comments/osezvt/tesla_makes_record_profit_despite_china_headwind/,1,Tesla makes record profit despite China headwind and chip crunch,
27,osf00r,t2_ci7762a9,1627356535,/r/wallstreetbets/comments/osf00r/thoughts_on_sndl_i_am_new_to_the_stock_market_and/,1,Thoughts on SNDL I am new to the stock market and am wondering if I should hold or sell my shares I saw someone on here discussing it so I decided to invest I would like to hear other people s thoughts on this stock and if they think it has potential , removed 
28,osf0yq,t2_8m72amk0,1627356639,/r/wallstreetbets/comments/osf0yq/started_from_the_top_now_im_here/,1,Started from the top now I m here ,
29,osf145,t2_tq7b5,1627356654,/r/wallstreetbets/comments/osf145/tesla_surpasses_1b_profit_for_first_time/,1,Tesla surpasses 1B profit for first time,
30,osf20t,t2_atuhu53i,1627356745,/r/wallstreetbets/comments/osf20t/lmao_lcid_motors_is_the_new_pnd_smfh/,1,Lmao LCID motors is the new PnD SMFH ,Barely ever seen it mentioned Now there are 5 6 front page DD Yolo posts at the top Holy shit the pump and dumpage seems very obvious Anyone buying LCID prepare to post your loss porn But seriously can this sub step it up I d rather not invest in trash 
31,osf2ou,t2_5ik5j8tr,1627356823,/r/wallstreetbets/comments/osf2ou/3_reasons_why_i_am_all_in_gme/,1,3 Reasons Why I am All in GME, removed 
32,osf2yn,t2_1mz38uk,1627356852,/r/wallstreetbets/comments/osf2yn/is_this_how_you_do_it/,1,Is this how you do it ,
33,osf3d6,t2_p50ra,1627356896,/r/wallstreetbets/comments/osf3d6/this_dip_in_pltr_stock_is_a_perfect_opportunity/,1,This Dip in PLTR Stock Is a Perfect Opportunity to Buy More,
34,osf3ie,t2_aa0lnp8p,1627356911,/r/wallstreetbets/comments/osf3ie/ctxr_short_squeeze_possible/,1,CTXR SHORT SQUEEZE POSSIBLE , removed 
35,osf3kw,t2_8m72amk0,1627356918,/r/wallstreetbets/comments/osf3kw/started_from_the_top_now_im_here/,1,Started from the top now I m here ,
36,osf486,t2_91euetm4,1627356981,/r/wallstreetbets/comments/osf486/what_i_imagine_some_of_you_on_here_do_after_you/,1,What I imagine some of you on here do after you make your first 50 on a trade,
37,osf5fx,t2_8m72amk0,1627357107,/r/wallstreetbets/comments/osf5fx/started_from_the_top_now_im_here/,1,Started from the top now I m here ,
38,osf5ka,t2_1mz38uk,1627357121,/r/wallstreetbets/comments/osf5ka/is_this_how_you_do_it/,1,Is this how you do it ,
39,osf663,t2_7m9xn4ny,1627357187,/r/wallstreetbets/comments/osf663/spotted_phx_bar_womens_room/,1,Spotted Phx bar women s room,
40,osf6t4,t2_8m72amk0,1627357254,/r/wallstreetbets/comments/osf6t4/started_from_the_top_now_im_here/,1,Started from the top now I m here ,
41,osf75y,t2_1mz38uk,1627357293,/r/wallstreetbets/comments/osf75y/is_this_how_u_do_it/,1,is this how u do it ,
42,osf8mp,t2_cl0au6qk,1627357450,/r/wallstreetbets/comments/osf8mp/hostel_daze_23rd_july_2021_hindi_watch_online_hd/,1,Hostel Daze 23rd July 2021 Hindi Watch Online HD Free Download,
43,osf90p,t2_aa0lnp8p,1627357493,/r/wallstreetbets/comments/osf90p/ctxr_short_squeeze_possible/,1,CTXR SHORT SQUEEZE POSSIBLE ,
44,osf92o,t2_1mz38uk,1627357499,/r/wallstreetbets/comments/osf92o/is_this_how_u_do_it/,1,Is this how u do it ,
45,osf9gi,t2_8m72amk0,1627357543,/r/wallstreetbets/comments/osf9gi/started_from_the_top_now_im_here/,1,Started from the top now I m here ,
46,osfc58,t2_8m72amk0,1627357843,/r/wallstreetbets/comments/osfc58/stop_deleting_my_loss/,1,Stop deleting my loss ,
47,osfcjs,t2_4bo03oku,1627357881,/r/wallstreetbets/comments/osfcjs/which_one_of_you_idiots/,1,Which one of you idiots ,
48,osfckz,t2_p50ra,1627357886,/r/wallstreetbets/comments/osfckz/motus_gi_holdings_inc_nasdaq_mots_has_advanced/,1,Motus GI Holdings Inc NASDAQ MOTS Has Advanced 21 24 In 2021 Is The Share Price Attractive Enough At 2 50 ,
49,osfcs8,t2_1mz38uk,1627357906,/r/wallstreetbets/comments/osfcs8/if_i_delete_app_will_losses_go_away/,1,if i delete app will losses go away,
50,osfcyk,t2_7xgi0cn6,1627357924,/r/wallstreetbets/comments/osfcyk/short_audusd_expect_50100_pip_drop_next_couple/,1,Short AUD USD Expect 50 100 pip drop next couple days,
51,osfder,t2_p50ra,1627357972,/r/wallstreetbets/comments/osfder/a_deep_value_stock_you_should_be_considering/,1,A Deep Value Stock You Should Be Considering Barrick Gold Corporation GOLD ,
52,osfdua,t2_54moy68i,1627358017,/r/wallstreetbets/comments/osfdua/elon_bezo/,1,Elon gt bezo, removed 
53,osffbo,t2_54moy68i,1627358182,/r/wallstreetbets/comments/osffbo/elon_bezo/,1,Elon gt bezo,
54,osffla,t2_7yyvpqj,1627358207,/r/wallstreetbets/comments/osffla/atip_physical_therapy_spac_in_the_4s_price_target/,1,ATIP physical therapy spac in the 4s price target 14 dollars Overreaction to poor future guidance Physical therapist labor market will normalize ,
55,osffqj,t2_11zn8f,1627358223,/r/wallstreetbets/comments/osffqj/baba_to_the_moon/,1, BABA to the moon ,
56,osfg98,t2_5ddnu8vp,1627358280,/r/wallstreetbets/comments/osfg98/dear_chinese_regulators/,1,Dear Chinese Regulators,I will personally give every Chinese regulator the sloppiest top they have ever experience in their life if they said they won t fuck with JD
57,osfhrn,t2_a58ucy43,1627358429,/r/wallstreetbets/comments/osfhrn/gold_and_silver_news/,1,Gold and silver News, removed 
58,osfifp,t2_cl0au6qk,1627358495,/r/wallstreetbets/comments/osfifp/sky_rojo_23rd_july_2021_season_2_complete_hindi/,1,Sky Rojo 23rd July 2021 Season 2 Complete Hindi Dubbed,
59,osflse,t2_38a5zu5a,1627358872,/r/wallstreetbets/comments/osflse/42k_yolo_lcid/,1,42k YOLO LCID,
60,osfom5,t2_qhbbs,1627359181,/r/wallstreetbets/comments/osfom5/btu_you_are_not_late_to_the_party/,1, BTU you are not late to the party,Just a big fyi best preforming stock on the Russel nobody here even talks bout I was making noise about the company at 5 5 8 now stock is at 12 My target is a 6 billion dollar company for the largest coal reserves in the world I think FCF is going to be about 1 2 B with some debt BHP acquisition If you have any questions just ask below and I can elaborate
61,osfou0,t2_9k7xcqvw,1627359206,/r/wallstreetbets/comments/osfou0/what_to_go_in_tomorrow_july_27th/,1,what to go in tomorrow July 27th , removed 
62,osfph8,t2_a034bq8g,1627359284,/r/wallstreetbets/comments/osfph8/robinhood_hood_valuation_analysis/,1,Robinhood HOOD Valuation amp Analysis,
63,osfqbs,t2_a8ciieq4,1627359377,/r/wallstreetbets/comments/osfqbs/edu_tal/,1,EDU amp TAL, removed 
64,osfqpl,t2_wea11,1627359419,/r/wallstreetbets/comments/osfqpl/buy_the_china_dip_bet/,1,Buy the China dip Bet,I m increasing my position in all Chinese stocks because this month s activity shows Chinese antitrust regulators are doing what regulators in other jurisdictions should be doing reining in tech unicorns to protect user and consumer interests You bet this is just as much making billionaires kiss SAMR State Administration for Market Regulation s ring as it is ensuring a fair market This includes breaking up Tencent s music licenses fining 2 7 billion on BABA or investigating DIDI for breaching Chinese data laws these publicly listed champions But US analysts are getting Chinese antitrust and capital markets activity all wrong This is good news for the long term viability of China s internet industry just like the DOJ antitrust hit on Microsoft US v Microsoft Corp 1998 Netscape case in the 90 s was good for the long term viability of the nascent internet industry then Short term good for these individual companies Who knows Microsoft kept going way up after the 1998 investigation up until the dotcom bubble burst and then it went sideways after it was ordered to change its practices in the 2001 settlement Long term Either individually or as a part of a Chinese internet ETF the giants losses are the rivals gains This month will vindicate broad exposure to the Chinese internet sector at the expense of investors looking for CCP darlings or favourites that never need to innovate thanks to government coddling 
65,osfrsh,t2_6nyos832,1627359538,/r/wallstreetbets/comments/osfrsh/short_percentage_on_open_opendoor_stock/,1,short percentage on OPEN OPENDOOR stock,ownership stock ownership for opendoor is sitting at 143 it pisses me off why hedge funds are after this OPEN WSB u wallstreetbets https www reddit com u wallstreetbets 15 30 58 51 69 08 142 89 negative short float of 43 https finance yahoo com quote OPEN holders p OPEN https finance yahoo com quote OPEN holders p OPEN 
66,osfses,t2_519u1puz,1627359606,/r/wallstreetbets/comments/osfses/levelheaded_lurker_shedding_some_comfort_on_my/,1,Level headed Lurker shedding some comfort on my fellow Palantards amp Skeptics,Alright Listen up retards Idk that seems to always get your attention Here s a disclaimer for those of us who may have had to learn how to read will all those margin call notices in the mail lately Nothing that follows is really of any specific or quality DD I ve got no real news for you You will learn nothing But if your deep in PLTR your ass is feeling chapped and you just want some comfort well I ve got a warm moist toilette just for you Multiple posts surrounding today s SeekingBetacuck s article below have popped up on PLTR subs It should be noted that the Author s of this article is are Bears of Wallstreet who has had a particularly bad record when it comes to explosive stocks ie GME AMC SPCE sees paparazzi grabs a handful Dat ass is boutta be a Private Function https preview redd it v4yrj1oqcod71 png width 700 amp format png amp auto webp amp s ca75a34331618106a6d823b95f4f4e71da17319e Future Growth is NOT Priced In And obviously this article is preying upon the minds of those too inexperienced to know better than to trust SeekingAnus or any of its dirtbag friends I m looking at you Motley Zachs amp Benzinga But its worth mentioning that There are 4 types of people in this world 1 The knowledgeless haphazard PLTR bulls 2 The knowledgeable and slightly more realistic PLTR bulls 3 The people who cant understand the product feel fear spread doubt and ultimately take an ignorant https emojipedia org bear position 4 People who dont enjoy losing money Because neither do I https preview redd it fkl4fyw3bod71 jpg width 500 amp format pjpg amp auto webp amp s 71380ded2644c204bad286925e606bc0cdeeece8 And for every tech developer hyped ass reddit investor with varying optimistic price targets and time frames there is a Cramer fellating sludge fund with a much larger wallet beating the shit out of you Here s some soft core Hopium In the long term the fair price will fall near the average between radical Bulls and radical Bears like the author of this article This stock will make you rich but it will likely have the same investment horizon as if you were trying to get rich off the S amp P500 Not only was PLTR handing out free trials of their software like crack to halfway house but they ve also extended their price point to promising start ups We groom em while they re young thats how this works You want a Consultancy Go to the Barbershop https preview redd it 6yssvv7ylod71 jpg width 529 amp format pjpg amp auto webp amp s 88963ec424cccf81c28c58dd968593e3a70a2a0f Ya know people like to talk shit suck drugs do pussy and say that PLTR is a blackbox And I get that But to those people I say Someday PLTR will be able to tell every company in the Free World about all your sick little vices for a nominal fee and WISH can sell you your electric titty tassels before you even knew you were into that sort of thing And those highvoltage titty tassels will only be able to safely and efficiently exit the third world country from whence they came due to PLTR Gotham s superior data aggregating platforms deep US military security clearances and overwhelming charisma keeping the goddamn world in check And then the guy at the AirTraffic Control desk can use PLTR s AirBus to track the FedEx plane and make sure your DC adaptable titty tassels haven t blown the plane out of the sky yet so as to better allocate resources adjust other shipment schedules and instruct proceeding flight patterns Same with the guy at the truck driving company s desk And then both of them can continue to provide you with your filth without you ever having to call a phone rep to inquire about the estimated arrival of your 20 car battery titty tassels that everyone knows about now 
67,osfsnq,t2_ch5zr4mg,1627359636,/r/wallstreetbets/comments/osfsnq/10000_in_options_tell_me_which/,1, 10 000 in options Tell me which ,If I wanted to sell off some stocks and put 10 000 into one option which would you suggest Which exact option and why To be serious this is legit money I need But I tend to like riskier plays Give it to me 
68,osftig,t2_6nyos832,1627359733,/r/wallstreetbets/comments/osftig/short_percentage_on_open_opendoor/,1,short percentage on OPEN OPENDOOR,ownership stock ownership for opendoor is 143 it pisses me off why hedge funds are after this OPEN WSB u wallstreetbets https www reddit com u wallstreetbets 15 30 58 51 69 08 142 89 negative short float of 43 https finance yahoo com quote OPEN holders p OPEN https finance yahoo com quote OPEN holders p OPEN 
69,osfv41,t2_dbyj8x6a,1627359910,/r/wallstreetbets/comments/osfv41/bank_of_america/,1,Bank of America , removed 
70,osfy5z,t2_cl0au6qk,1627360269,/r/wallstreetbets/comments/osfy5z/jolt_2021_english_full_movie_watch_online_hd_free/,1,Jolt 2021 English Full Movie Watch Online HD Free Download,
71,osfym4,t2_13gbyj,1627360318,/r/wallstreetbets/comments/osfym4/average_wsb_user/,1,Average wsb user,
72,osfyxj,t2_9pefjeop,1627360355,/r/wallstreetbets/comments/osfyxj/i_commissioned_pricasso_for_a_painting_and_i_just/,1,I commissioned Pricasso for a painting and I just got it in the mail It is an absolute beautiful piece of artwork ,
73,osfz95,t2_bcfbpo8r,1627360393,/r/wallstreetbets/comments/osfz95/analysis5g_underdog_nokia_firmly_back_in_game/,1,Analysis 5G Underdog Nokia Firmly Back in Game After Lundmark s Shakeup,
74,osfzu4,t2_a113rz2l,1627360465,/r/wallstreetbets/comments/osfzu4/about_sofi_bank_licence/,1,About SOFI bank licence, removed 
75,osg0gj,t2_de5hof3,1627360539,/r/wallstreetbets/comments/osg0gj/why_did_aon_stock_trade_higher_by_8/,1,Why did AON stock trade higher by 8 ,I m new to the scene and I don t understand why AON would trade higher while Willis would trade lower after canceling the merger Is the merger not a benefit for both companies Why would AON benefit from canceling the merger 
76,osg3ge,t2_hkrh6,1627360899,/r/wallstreetbets/comments/osg3ge/oui/,1,Oui ,
77,osg4jx,t2_akmg0h2y,1627361032,/r/wallstreetbets/comments/osg4jx/amc/,1,AMC , removed 
78,osg95l,t2_a113rz2l,1627361602,/r/wallstreetbets/comments/osg95l/about_sofi_banking_license_reposting_by_removing/,1,About SOFI banking license reposting by removing unwanted link ,Came across the below link about SOFI bank license preliminary approval I am sure many of you must have read about this however I have a query about the timing of the final approval based on the below https www occ gov news issuances news releases 2020 nr occ 2020 141a pdf https www occ gov news issuances news releases 2020 nr occ 2020 141a pdf Quoted from the link above If the capital transactions for the Bank are not completed as described within 12 months or if the Bank is not opened for business within 18 months from the preliminary conditional approval date this approval expires I am trying to understand Does this mean that the final approval for the banking license can be expected this year and I may be totally wrong here hence looking for some clarification amp x200B Below are links to recent articles in the news that are expecting the Banking license by November 2021 SoFi Technologies A Next Generation Banking Disruptor https seeking alpha com article 4441446 sofi technologies a banking disruptor In October last year the OCC already issued preliminary conditional approval of their application to be chartered as a de novo national bank As an alternative route to securing a national bank charter SOFI also entered an agreement to acquire Golden Pacific Bancorp Their preliminary conditional approval to be chartered as a de novo national bank in October last year may help them to hasten the process of approval for the acquisition and increase the odds of approval but we will have to see the results in November this year amp x200B https moneymorning com 2021 07 26 sofi stock buy or sell now https moneymorning com 2021 07 26 sofi stock buy or sell now SoFi is in the process of applying for a bank charter Gaining a bank charter that allows it to offer FDIC insured accounts to its customers will increase that advantage The decision on its application is expected in November of this year I would like to hear about your views research 
79,osga0y,t2_ci589zr5,1627361716,/r/wallstreetbets/comments/osga0y/tsla/,1, TSLA, removed 
