,postid,author,created_utc,permalink,score,title,selftext
19,oow4uo,t2_6jifz7vp,1626892813,/r/wallstreetbets/comments/oow4uo/bodybeachbody_a_deep_value_digital_and_connected/,1, BODY Beachbody A Deep Value Digital and Connected Fitness Play,Alright folks I don t know where you live but COVID restrictions are picking back up again in certain states and the UK is complete mess Euro Cup aside The rush back to physical gyms isn t exactly going to be flying at a high rate at this point Peloton is seeing a resurgence in trading sentiment since June most likely due to this environmental change Here s why Beachbody is a deep value play to trade alongside Peloton Core businesses in digital content growing digital revenue in fitness content growing 56 YOY as of last quarter 2 7M digital subscriptions as last reported Primarily available in North America and the UK right now but they re rapidly expanding to other countries this year and next year From https www forbes com sites giacomotognini 2021 07 09 scott watterson ifit war to bring down peloton sh 19ceedae4953 https preview redd it bzgk67hs1mc71 png width 830 amp format png amp auto webp amp s 56265a3739543ebc8cbb6594b3a33fa36d256a1e Fundamentally In 2020 digital accounted for 334 8M of their 893M in revenue Digital and connected fitness are going to hugely contribute to CAGR growth going forward Added Myx into the mix which is growing at 126 7 YOY run rate for 2021 LTV to CAC is gt 4x according to this retard at Baird https baird bluematrix com links2 doc pdf bc20f14b a565 424a ae7b b8625da37634 id OjQ who s in the top echelon of analysts https www tipranks com analysts jonathan komp which basically means more advertising more profits Technical analysis BODY is undergoing a recovery back to upwards momentum MACD yet to crossover on the daily RSI 50 on the daily Indicates headway up https preview redd it 8kk4x3sw1mc71 png width 744 amp format png amp auto webp amp s 171164231b25b0c41cdb6f3335cf2e2604001776 Macro 10 yr bond rates at 1 287 is bullish for growth stocks Short data Constantly low shares available to short 50 000 now borrow rate is high at 51 days to cover 3 2 Ortex Shares on loan around 8 36M estimated by Ortex Free float from the SPAC is not 100 clear because of redemptions PIPE and insider lockup gt but the SPAC shares remaining would be around 30 1M shares 8 4M share redeemed 21 7M shares free SPAC float Most other shares are locked up until around 2022 so the possible short floated is north of 38 https preview redd it jnzn5ggq1mc71 png width 2087 amp format png amp auto webp amp s d9438a7d6a3f47bf9cb02e2180addac3b2e7f85c https preview redd it vhv5kjez1mc71 png width 904 amp format png amp auto webp amp s c3e42f53e3491e7c0320324014312a4f369badb5 https preview redd it kgzsh0e02mc71 png width 899 amp format png amp auto webp amp s 5fdc6e970eaff9197dde1ca99c2d9c1c9bff2800 COVID delta UK COVID cases are continuing to spike back to ATH US is beginning to inflect upwards as well The delta variant appears to spread like wildfire easier than past variants Gyms are likely not going to be back in full swing again until all variants are gone Beachbody offers Beachbody on Demand OpenFit Myx and Myx ii the bikes Myx ii launching in September BODi interactive training releasing in September https preview redd it 38k5o6v12mc71 png width 743 amp format png amp auto webp amp s ca7097db4c0ef60185fbff7e2d6995bc96d5ecb3 Catalysts COVID delta trends re closing trade BODi launching in September https www beachbodyondemand com blog beachbody on demand interactive new Myx ii bike launching in September https www youtube com watch v SSA8Esb5XyU other partnerships like the recent one with Concierge Health https www businesswire com news home 20210609005208 en Openfit and Concierge Health Announce At Home Exercise Incentives earnings in mid August most likely with eyes on their digital fitness growth was 56 YOY in Q1 Comps to Peloton PTON digital subscriptions 3M BODY digital subscriptions 2 7M PTON PB 20x BODY PB 5x PTON EV GP 32x BODY EV GP 4x PTON Revenue 2020 1826M BODY Revenue 2020 893M PTON EV 35 2B BODY EV 2 6B SPAC insider lockups 180 days after merger closed closed June 28 IMO this has been unfairly beaten down due to the SPAC cycle but this has major room to run due to valuation catalysts technicals etc For crying out FXLV IPO ed at 1 5B market cap with only 82M in 2020 sales declining 10 from 2019 and on pace to do the same for 2021 Beachbody had 893M in 2020 sales and grew revenues but the market cap is currently at 3B The market is retarded Take advantage Disclaimer I have a retarded amount of BODY and BODY WS https body ws in my portfolio at around 80 portfolio diversity 
20,oow5j2,t2_5bnz2zhl,1626892873,/r/wallstreetbets/comments/oow5j2/io_whole_team_loading_including_atlas_wbs_oil/,1, IO WHOLE TEAM LOADING INCLUDING ATLAS amp WBS oil rebounding and this one has high interest with potential 10 squeeze with Oil climbing LOAD THE BOAT AND LETS SQUEEZE THESE SHORTS YOLO SHORTSQUEEZE WALLSTREETBETS, removed 
21,oow6b8,t2_5bnz2zhl,1626892936,/r/wallstreetbets/comments/oow6b8/io_whole_team_loading_including_atlas_wbs_oil/,1, IO WHOLE TEAM LOADING INCLUDING ATLAS amp WBS oil rebounding and this one has high interest with potential 10 squeeze with Oil climbing LOAD THE BOAT AND LETS SQUEEZE THESE SHORTS YOLO SHORTSQUEEZE WALLSTREETBETS let s effen crush these shorts , removed 
22,oow7f9,t2_5bnz2zhl,1626893030,/r/wallstreetbets/comments/oow7f9/io_whole_team_loading_including_atlas_wbs_oil/,1, IO WHOLE TEAM LOADING INCLUDING ATLAS amp WBS oil rebounding and this one has high interest with potential 10 squeeze with Oil climbing Also has amazing future guidance and can explode with team workkkk LOAD THE BOAT AND LETS SQUEEZE THESE SHORTS YOLO SHORTSQUEEZE WALLSTREETBETS, removed 
23,oow8pg,t2_5bnz2zhl,1626893143,/r/wallstreetbets/comments/oow8pg/io/,1, IO, IO WHOLE TEAM LOADING INCLUDING ATLAS amp WBS oil rebounding and this one has high interest with potential 10 squeeze with Oil climbing LOAD THE BOAT AND LETS SQUEEZE THESE SHORTS YOLO SHORTSQUEEZE WALLSTREETBETS
24,oowa1d,t2_cy3hm4kp,1626893251,/r/wallstreetbets/comments/oowa1d/wish_if_youre_not_buying_and_holding_youre_losing/,1, WISH if you re not buying and holding you re losing sooner or later Even if you re not Aping this stock up it s worth looking into this quality stock Don t get left behind with these bears who will be forced to hibernate soon Ape Up AMZN AMC GME,
25,oowbcb,t2_2btaw142,1626893363,/r/wallstreetbets/comments/oowbcb/the_3_autist_all_gathered_together/,1,The 3 autist all gathered together,
26,oowckg,t2_2btaw142,1626893468,/r/wallstreetbets/comments/oowckg/the_3_autist_all_gathered_together_to_discuss/,1,The 3 autist all gathered together to discuss Bitcorn,
27,oowcx6,t2_cao2q7dr,1626893496,/r/wallstreetbets/comments/oowcx6/from_35k_to_1k_next_yolo_2022_leap_calls_lmfao/,1,From 35k to 1k Next Yolo 2022 Leap Calls lmfao,
28,oowejw,t2_a0z610vw,1626893628,/r/wallstreetbets/comments/oowejw/lets_see_how_this_one_will_play_out_lol_aal/,1,Let s see how this one will play out lol AAL,
29,oowfsw,t2_yy34sa,1626893736,/r/wallstreetbets/comments/oowfsw/trade_app_recommendations_for_an_irishman/,1,Trade App recommendations for an Irishman,So a few months ago I got involved in the whole Meme Stock thing traded my best red Crayons for AMC amp GME stonks and have been holding since My problem is I m trading on Revolut it s not really a problem in a sense but basically I want to get involved more with calls etc and Revolut is quite restricted could have made some extra cash if they listed WISH and the likes Anyway as I m in Ireland I can t access some of the stuff you guys can so I m asking if anyone can recommend a European App or site I can use please 
30,oowfzi,t2_ceilo,1626893753,/r/wallstreetbets/comments/oowfzi/house_seeks_hedge_fund_regulation_after_robinhood/,1,House seeks hedge fund regulation after Robinhood debacle,
31,oowgyf,t2_9p0efg7e,1626893833,/r/wallstreetbets/comments/oowgyf/robinhood_ipo_hood/,1,Robinhood IPO HOOD,Hi WSB Robinhood is gonna file for an IPO soon and I want to know whether or not you guys are planning to buy 
32,oowi55,t2_d1t46niu,1626893935,/r/wallstreetbets/comments/oowi55/how_long_is_netlist_pushing_up/,1,How Long is netlist pushing up ,Sie haben gegen Google gewonnen und haben noch ein paar Gerichtsverfahren am Laufen wegen den patentverletzungen Bekommen Sie mir eine Gutschrift Oder generiere Sie nun dauerhaft Cash Was sind die n chsten Steps f r das Unternehmen Viel finde ich nicht im Internet 
33,oowijz,t2_7xqdzexq,1626893969,/r/wallstreetbets/comments/oowijz/if_you_search_cant_stop_wont_stop_gamestop_this/,1,If you search Can t Stop Won t Stop GameStop this is one of the first hits posted on Oct 9 2020 I need to know if u nacliamsi continued to buy contracts and where he currently is storing his spaceship,
34,oowkxa,t2_5bnz2zhl,1626894141,/r/wallstreetbets/comments/oowkxa/io_whole_team_loading_including_atlas_wbs_oil/,1, IO WHOLE TEAM LOADING INCLUDING ATLAS amp WBS oil rebounding and this one has high interest with potential 10 squeeze with Oil climbing company has raised it quarter guidance LOAD THE BOAT AND LETS SQUEEZE THESE SHORTS YOLO SHORTSQUEEZE WALLSTREETBETS, removed 
35,oowl01,t2_d5hs9wbj,1626894146,/r/wallstreetbets/comments/oowl01/gold_miner_manipulation/,1,Gold Miner Manipulation, removed 
36,oowmko,t2_d5hs9wbj,1626894282,/r/wallstreetbets/comments/oowmko/gold_miner_manipulation/,1,Gold Miner Manipulation,Anyone else notice that Golf Futures are up almost 2 in the last 30 days but Gold Miners are down over 30 in the same timeframe Me thinks super sketchy manipulation is happening here Fed propping the dollar while inflation is insane 
37,oowmtb,t2_9s538xk7,1626894303,/r/wallstreetbets/comments/oowmtb/how_i_feel_when_im_cash_broke_but_everybody_else/,1,How I feel when I m cash broke but everybody else is buying more AMC,
38,oowpfg,t2_1s6zvc0z,1626894517,/r/wallstreetbets/comments/oowpfg/bombardier_bdrbf/,1,Bombardier BDRBF, removed 
39,oowpj9,t2_5z4rfa3q,1626894527,/r/wallstreetbets/comments/oowpj9/amc_if_my_calculations_are_correct/,1,AMC If my calculations are correct ,
40,oowqr0,t2_9m1gdfg,1626894628,/r/wallstreetbets/comments/oowqr0/then_hit_gas/,1,Then hit gas ,
41,oowsc2,t2_chlid2j9,1626894756,/r/wallstreetbets/comments/oowsc2/a/,1,A,
42,oowt6w,t2_1mql99ss,1626894829,/r/wallstreetbets/comments/oowt6w/mmattrch_from_55k_to_1k_w_forced_liquidation/,1,MMAT TRCH from 55k to 1k w forced liquidation,
43,oowtxe,t2_a15329zh,1626894888,/r/wallstreetbets/comments/oowtxe/the_best_move_after_the_revers_split_aht/,1,The Best Move After The Revers Split AHT, removed 
44,oowu7e,t2_ilegvay,1626894912,/r/wallstreetbets/comments/oowu7e/following_someone_elses_dd/,1,Following someone else s DD,
45,oowwo0,t2_a0sb6721,1626895114,/r/wallstreetbets/comments/oowwo0/a_local_brewery_is_run_by_apes_to_the_moon/,1,A local brewery is run by apes To the moon ,
46,oowws5,t2_6mlsf00k,1626895123,/r/wallstreetbets/comments/oowws5/what_should_i_invest_my_money_in/,1,What should I invest my money in ,I currently have 2 600 in my account majority of that I have built up because I put 100 in each week with my job I have 3 5 shares in TTWO 5 shares in NKE and 2 shares in PYPL I m kinda new to the whole stock market thing does anyone have any advice or potential buys or even recommendations on if i should sell any of my stocks to reinvest somewhere else
47,oowxs5,t2_7j95264g,1626895208,/r/wallstreetbets/comments/oowxs5/this_is_what_happens_when_you_follow_trends_but/,1,This is what happens when you follow trends but you hold because everyone says HOLD But I still think I ll make it to 1 Million in the next year ,
48,oowzpo,t2_24ku915r,1626895361,/r/wallstreetbets/comments/oowzpo/retard_retardeder/,1,Retard amp Retardeder,
49,oox00d,t2_9gzpu2v0,1626895387,/r/wallstreetbets/comments/oox00d/amc/,1,AMC, removed 
50,oox18k,t2_9gzpu2v0,1626895487,/r/wallstreetbets/comments/oox18k/amc/,1,AMC, removed 
51,oox1xd,t2_8w9aw,1626895548,/r/wallstreetbets/comments/oox1xd/uwmc_is_trying_to_break_from_a_good_sized/,1,UWMC is trying to break from a good sized downtrend thoughts on this ,
52,oox37w,t2_9zsqzws3,1626895660,/r/wallstreetbets/comments/oox37w/razer_razff_226_mld_cap_025_for_share/,1,Razer RAZFF 2 26 MLD cap 0 25 for share, removed 
53,oox568,t2_6aa5sjzu,1626895828,/r/wallstreetbets/comments/oox568/clov_preparing_for_a_moonshot/,1, CLOV Preparing for a Moonshot, CLOV has consolidated the last 3 sessions days we ve seen 3 green candles in daily chart Plus we need to filll a gap up around 11 19 I think personally 11 is coming soon 
54,oox5p6,t2_6aa5sjzu,1626895871,/r/wallstreetbets/comments/oox5p6/clov_preparing_for_a_moonshot_clov_has/,1, CLOV PREPARING FOR A MOONSHOT CLOV has consolidated the last 3 sessions days we ve seen 3 green candles in daily chart Plus we need to filll a gap up around 11 19 I think personally 11 is coming soon ,
55,oox7vm,t2_4halc0p6,1626896053,/r/wallstreetbets/comments/oox7vm/i_bought_some_clov_and_it_is_about_to_rocket/,1,I bought some Clov and it is about to rocket ,You have time to get on the clov rocketship I have 11 000 tickets you should get yours https preview redd it 1j9c851pbmc71 jpg width 362 amp format pjpg amp auto webp amp s ed47470f78494a69121dde29718d328c032971b5 https preview redd it vjz9k41pbmc71 jpg width 418 amp format pjpg amp auto webp amp s 3afba7b56280fb05928c401b157b91ffae7172bc
56,oox8rg,t2_1s6zvc0z,1626896127,/r/wallstreetbets/comments/oox8rg/bombardier_bdrbf/,1,Bombardier BDRBF,Here is a great spec play They have deleverage their assets and are now focused on jets with a portfolio of commercial aircraft in the 50 to 100 seat categories Right now private aviation is booming and is the next catalyst for the stock to take a leg up higher Easily a 20 stock in the near term Go Bombardier 
57,oox9di,t2_31asb111,1626896179,/r/wallstreetbets/comments/oox9di/nakd_whats_up_with_nakd_anyone_looking_at_this_or/,1,NAKD What s up with NAKD anyone looking at this or no , removed 
58,ooxbct,t2_46p90see,1626896345,/r/wallstreetbets/comments/ooxbct/solarwinds_is_increasing_in_value/,1,SOLARWINDS IS INCREASING IN VALUE , removed 
59,ooxbep,t2_x5e75,1626896349,/r/wallstreetbets/comments/ooxbep/spy_always_goes_up_936k_profit_options_from_yolo/,1,SPY always goes up 936k profit options from yolo Scooped some Friday Went all in Monday ,
60,ooxfjl,t2_3a1fmg25,1626896693,/r/wallstreetbets/comments/ooxfjl/if_u_remember_where_this_is_from_ur_a_legend/,1,If u remember where this is from ur a legend,
61,ooxix7,t2_4halc0p6,1626896973,/r/wallstreetbets/comments/ooxix7/clov_is_about_to_rocket/,1, clov is about to rocket ,The clov rocket ship is about to take off you have time to get your tickets I have a 11 000 tickets there are still plenty out there for you to buy too amp x200B https preview redd it dhaciy17emc71 jpg width 362 amp format pjpg amp auto webp amp s 902c782d68e4cde3cb5f693d6f552ed34368609f https preview redd it 9e4dk127emc71 jpg width 418 amp format pjpg amp auto webp amp s 7746ab738322d0c7ec6ba1cda8192ca5e1c79ce0 Since this post get pulled for being too short is is some additional information Clover Health is a new health insurance company that is using AI to try and create better health outcomes Additionally it is looking to use its information to leverage healthcare law to maximize the payments for services It is small company that IPO d in 2021 They have a growth story and somewhere between 30 and 40 short interest Even if this does not rocket to the moon it will grow over the next year with some analysts saying 20 a share is a real possibility for this stock by year I m not a advisor do your own DD TL DR buy clov if a lot of people do it will rocket and this is an early entry point 
62,ooxjje,t2_2hcw0n2w,1626897023,/r/wallstreetbets/comments/ooxjje/new_york_drug_distributors_reach_118_bln_opioid/,1,New York drug distributors reach 1 18 bln opioid settlement as national deal looms,
63,ooxkq2,t2_clcldukr,1626897119,/r/wallstreetbets/comments/ooxkq2/hold_assetsnot_liabilities/,1,Hold Assets not liabilities ,
64,ooxmpw,t2_a0bugysr,1626897286,/r/wallstreetbets/comments/ooxmpw/was_fucked_by_sqqq/,1,Was fucked by SQQQ,
65,ooxp34,t2_3jpsqcn2,1626897492,/r/wallstreetbets/comments/ooxp34/abml_american_battery_metals_corp_anyone_have_any/,1,ABML American battery metals Corp Anyone have any insight into this company Is it worth investing In as a long term hold , removed 
66,ooxqeg,t2_5pypa17u,1626897606,/r/wallstreetbets/comments/ooxqeg/msft_leap_long_term_cap_gains/,1,MSFT LEAP long term cap gains,
67,ooxqja,t2_bd6q5,1626897614,/r/wallstreetbets/comments/ooxqja/what_are_your_moves_tomorrow_july_22_2021/,1,What Are Your Moves Tomorrow July 22 2021,Your daily trading discussion thread Please keep the shitposting to a minimum Navigate WSB We recommend best daily DD DD All https reddit com r wallstreetbets search sort new amp restrict sr on amp q flair 3ADD Best Daily https www reddit com r wallstreetbets search sort top amp q flair 3ADD amp restrict sr on amp t day Best Weekly https www reddit com r wallstreetbets search sort top amp q flair 3ADD amp restrict sr on amp t week Discussion All https reddit com r wallstreetbets search sort new amp restrict sr on amp q flair 3ADiscussion Best Daily https www reddit com r wallstreetbets search sort top amp q flair 3ADiscussion amp restrict sr on amp t day Best Weekly https www reddit com r wallstreetbets search sort top amp q flair 3ADiscussion amp restrict sr on amp t week YOLO All https reddit com r wallstreetbets search sort new amp restrict sr on amp q flair 3AYOLO Best Daily https www reddit com r wallstreetbets search sort top amp q flair 3AYOLO amp restrict sr on amp t day Best Weekly https www reddit com r wallstreetbets search sort top amp q flair 3AYOLO amp restrict sr on amp t week Gain All https reddit com r wallstreetbets search sort new amp restrict sr on amp q flair 3AGain Best Daily https www reddit com r wallstreetbets search sort top amp q flair 3AGain amp restrict sr on amp t day Best Weekly https www reddit com r wallstreetbets search sort top amp q flair 3AGain amp restrict sr on amp t week Loss All https reddit com r wallstreetbets search sort new amp restrict sr on amp q flair 3ALoss Best Daily https www reddit com r wallstreetbets search sort top amp q flair 3ALoss amp restrict sr on amp t day Best Weekly https www reddit com r wallstreetbets search sort top amp q flair 3ALoss amp restrict sr on amp t week Weekly Earnings Discussion Thread https www reddit com r wallstreetbets search sort new amp restrict sr on amp q flair 3A 22Earnings 20Thread 22 Read the rules https www reddit com r wallstreetbets wiki contentguide and make sure other people follow them Try No Meme Mode https www reddit com r wallstreetbets search q flair 3AMeme 20 flair 3ASatire 20 flair 3AShitpost amp restrict sr 1 amp t day amp sort hot also accessible through the top bar Follow Official WSB https twitter com Official WSB on Twitter all other accounts are impersonators Check out our Discord https discord gg wallstreetbets 
68,ooxqtx,t2_a2yvg51o,1626897633,/r/wallstreetbets/comments/ooxqtx/sec_thank_you_for_this_eye_opening_experience_of/,1,SEC Thank You for this Eye Opening Experience of the US Stock Market , Thank you for really opening the eyes of millions of apes how manipulated the stock market is Thank you for showing apes that rules are made for investors but not for the market makers and HF s Thank you for allowing Great companies to be shorted until they no longer exist Thank you for slapping the wrist of the bad actors of the stock market with fines that are built into the operating expenses minimal fines Thank you exposing yourselves pornhub pun intended as stock market rule makers but not rule enforcers Thank you for opening the eyes of this generation and future generations of how unfair unbalanced and corrupt the US Stock market is You SEC alone have opened the eyes of Millions of Americans and abroad as to never invest a significant amount of money into this worse than a casino of a stock market You SEC have lost future liquidity and confidence in what you have sworn to Protect Remain Fair and an Efficient US Stock Market 
69,ooxqx9,t2_7jmqv2xs,1626897640,/r/wallstreetbets/comments/ooxqx9/should_i_option_put_on_dnut/,1,Should I option put on DNUT, removed 
70,ooxrd8,t2_7jkunwat,1626897675,/r/wallstreetbets/comments/ooxrd8/atos_is_the_next_amc/,1, atos is the next AMC,Bring your diamond hands this way lads Atos is heading to the moon Now s the Time to get in on the ground floor 
71,ooxrse,t2_ckuowfm6,1626897711,/r/wallstreetbets/comments/ooxrse/clov_yolo/,1,Clov yolo, removed 
72,ooxt0p,t2_7jkunwat,1626897817,/r/wallstreetbets/comments/ooxt0p/atos_is_the_next_amc/,1, atos is the next AMC ,
73,ooxts7,t2_59pxu0dl,1626897884,/r/wallstreetbets/comments/ooxts7/up_another_145000_on_sava_today/,1,Up Another 145 000 on SAVA Today, removed 
74,ooxuoy,t2_g82ui,1626897964,/r/wallstreetbets/comments/ooxuoy/still_holding_and_adding_uwmc/,1,Still holding and adding UWMC,
75,ooxw43,t2_5pypa17u,1626898093,/r/wallstreetbets/comments/ooxw43/msft_call_gains_long_term_cap_gains/,1,MSFT call gains Long term cap gains,
76,ooxx2m,t2_5v39g4rv,1626898173,/r/wallstreetbets/comments/ooxx2m/my_new_custom_amc_popsocket/,1,My new custom AMC popsocket ,
77,ooxxgp,t2_6nviymkd,1626898204,/r/wallstreetbets/comments/ooxxgp/moneygram_mgi_draws_takeover_interest_from_stellar/,1,Moneygram MGI draws Takeover interest from Stellar,
78,ooxz1m,t2_jmuno,1626898336,/r/wallstreetbets/comments/ooxz1m/its_also_fun/,1,It s also FUN ,
79,ooxz2p,t2_3975vxj0,1626898339,/r/wallstreetbets/comments/ooxz2p/after_i_discovered_wsb_in_january/,1,After i discovered WSB in January,
80,ooy0pp,t2_20uqoy10,1626898482,/r/wallstreetbets/comments/ooy0pp/tesla_tsla_sells_back_maxwell_technologys/,1,Tesla TSLA sells back Maxwell Technology s ultracapacitor business to former executives,
81,ooy1f9,t2_779mjlje,1626898538,/r/wallstreetbets/comments/ooy1f9/any_clue_why_my_spreads_would_do_this_very_last/,1,Any clue why my spreads would do this very last second amd had a very nice green candle at close too,
82,ooy2ha,t2_a0u81wix,1626898627,/r/wallstreetbets/comments/ooy2ha/cory_booker_clarifies_he_supports_marijuana/,1,Cory Booker Clarifies He Supports Marijuana Banking Bill But Says It s A Sweetener To Pass Legalization,
