,postid,author,created_utc,permalink,score,title,selftext
0,oog9ad,t2_715iz9fq,1626832262,/r/wallstreetbets/comments/oog9ad/clov_46k_yolo/,1,CLOV 46k YOLO,
1,oog9hl,t2_a13uhqf9,1626832285,/r/wallstreetbets/comments/oog9hl/vaccine_healthcare_system_is_corrupt_idea_of_it/,1,Vaccine healthcare system is corrupt Idea of it is what is kept pure 2020 survived no shot Halfway through 2021 and questions I still don t have answers for First off the government needs to stop babying Americans It s a bluff for control Americans need to stop being babied ,Ask your doctor why I can t take the vaccine home and administer it myself The process is no different than injecting a loved ones insulin or your own Even an epi pen a bit more vigorous but you get it The doctor may not even know the answer of why they just go with it s illegal it is or may be in some cases but why People can t stick up on vaccine Y all really drank bleach You knew since a lil kid you d die America s laws are made to keep everyone safe I think they cross the line in many categories when it comes to the control over the safety of yourself 
2,oogas0,t2_a2n9pdge,1626832421,/r/wallstreetbets/comments/oogas0/need_someone_with_a_few_more_rinkles_to_help/,1,Need someone with a few more rinkles to help , What s the total amount that is fully invested in all Ccurrency right this minute What are you thoughts on Ccurrencyand why I know I know You want to know why Well I have a theory of what the future may hold Yes I m aware GME is going to the moon but I m thinking deeper Deeper than what the market is truely showing We all know about the dark pools We know about how they trade secrets like eleventeen year olds Don t get me started on how their pockets extend to the media You might think they were part of some great plan to put people business countries in bankruptcy enslave All I know is that I will do a follow on post once I aquire some more data Disclaimer this is not financial advice way too smooth I m not a financial advisor and I like crayons Blue ones 
3,oogb43,t2_c2x9vm5s,1626832458,/r/wallstreetbets/comments/oogb43/qe_margin_the_tga_and_sogu/,1,QE Margin the TGA and SOGU, removed 
4,oogb74,t2_cxbxebb7,1626832468,/r/wallstreetbets/comments/oogb74/next_big_short_observations_of_a_wendys/,1,Next Big Short Observations of a Wendy s, I went to the burger joint this weekend at a Wendy s near me 4th nicest city in America not to flex on you and I observed a few things 1 On a Saturday afternoon at 3 30 pm the parking lot was only 1 10 full 2 There was no valet at the parking lot I had to leave my car by the big menu and microphone Seemed like some cars were just as frustrated as they started honking 3 There was no one taking tickets to get into the seating area Anyone could have gotten for free 4 The restaurant had a grand total of 18 people in it Only 4 of which looked homeless 5 The Baconator and Fries were 6 25 together It s so much cheaper to kill the cow and cook the burger yourself This is a doomed business unless something drastically changes People are cooking burgers for cheaper Baconator numbers are way down maybe i don t really know I will be surprised if Wendy s is still around by 2022 I may have to apply for a job there and fix the business Apes be careful with this one Post this is in reference to is here reddit com r wallstreetbets comments ond48t observations of an amc theater 
5,oogdro,t2_houth,1626832734,/r/wallstreetbets/comments/oogdro/the_apes_are_loose_in_chicago/,1,The apes are loose in Chicago,
6,ooge5n,t2_cucw3v9r,1626832776,/r/wallstreetbets/comments/ooge5n/med_men_could_this_be_real/,1,Med Men Could this be real ,
7,oogfe8,t2_cucw3v9r,1626832882,/r/wallstreetbets/comments/oogfe8/could_this_be_real/,1,Could this be real ,
8,oogflt,t2_houth,1626832901,/r/wallstreetbets/comments/oogflt/the_apes_are_loose_in_chicago/,1,The apes are loose in Chicago,
9,oogjn8,t2_3oojlxu7,1626833309,/r/wallstreetbets/comments/oogjn8/600k_yolo_molo/,1, 600K YOLO MOLO,
10,oogk6t,t2_bw8pb8v6,1626833367,/r/wallstreetbets/comments/oogk6t/any_thoughts_on_nuro_i_bought_1020_shares_674/,1,Any thoughts on NURO I bought 1020 shares 6 74 , removed 
11,oogkm6,t2_49yh0oqg,1626833411,/r/wallstreetbets/comments/oogkm6/ive_got_to_quit_listening_to_you_guys/,1,I ve got to quit listening to you guys ,
12,oogm9j,t2_aob4ldhq,1626833581,/r/wallstreetbets/comments/oogm9j/wwwaquafoxfinancecom_presale_opened_to_the_public/,1,Www AquaFoxFinance com Pre Sale opened to the Public,
13,oogmry,t2_bw8pb8v6,1626833632,/r/wallstreetbets/comments/oogmry/any_thoughts_on_nuro_1020_shares_today_at_674/,1,Any thoughts on NURO 1020 shares today at 6 74 , removed 
14,oogn57,t2_aob4ldhq,1626833667,/r/wallstreetbets/comments/oogn57/alex_podlucky_on_tiktok/,1,Alex Podlucky on TikTok,
15,oogpk9,t2_aob4ldhq,1626833901,/r/wallstreetbets/comments/oogpk9/wwwaquafoxfinacecom_presale_on_unicrypt/,1,Www aquafoxfinace com Pre Sale on Unicrypt,
16,oogrhr,t2_6nkzia2x,1626834099,/r/wallstreetbets/comments/oogrhr/auvi_only_has_94_mill_shares_outstanding_and_412/,1,AUVI only has 9 4 mill shares outstanding and 4 12 million a float Back in February this stock made a parabolic move to 35 currently sitting at 9 with such a small float can this get Stupidly high like GME , removed 
17,oogs5h,t2_cfbbposn,1626834163,/r/wallstreetbets/comments/oogs5h/pfe_300_increase_small_account_gains/,1,PFE 300 increase Small account GAINS ,With everything going on in the world and recent news the Pfizer Moderna and J amp J were going to need FDA approval for emergency use of vaccines I decided to buy some call options on it I don t have a major account but this made my day 40 5 call options expiring 7 23 went from being up only maybe 50 to over 300 the next day At one point was over probably 400 just wasn t near my phone to sell then I ve learned to take my profits and go before losing them all which has happened before 
18,oogshi,t2_9q4rkwb2,1626834198,/r/wallstreetbets/comments/oogshi/buy_amc_dont_let_up_never_let_up/,1,BUY AMC Don t let up Never Let Up , removed 
19,oogssf,t2_9noyq5hd,1626834231,/r/wallstreetbets/comments/oogssf/yolo_on_the_devils_lettuce_sndl/,1,Yolo on the Devil s Lettuce SNDL,
20,oogud6,t2_6xa1sf19,1626834389,/r/wallstreetbets/comments/oogud6/i_joined_the_retard_army_am_i_winning_yet_father/,1,I joined the retard army am I winning yet father ,
21,oogw5z,t2_a0oxvbis,1626834577,/r/wallstreetbets/comments/oogw5z/virpax_vrpx_pharma/,1,VIRPAX VRPX PHARMA, removed 
22,oogx5s,t2_a0oxvbis,1626834677,/r/wallstreetbets/comments/oogx5s/virpax_pharma_vrpx/,1,VIRPAX PHARMA VRPX , removed 
23,oogxzy,t2_7nq5f70y,1626834764,/r/wallstreetbets/comments/oogxzy/avoiding_that_pfof/,1,Avoiding that PFOF,
24,oogypm,t2_a0oxvbis,1626834841,/r/wallstreetbets/comments/oogypm/virpax_pharma_vrpx/,1,VIRPAX PHARMA VRPX , LOOK AT THIS ONE gt TINY FLOAT 1 7 MIL SHARES WITH PUSH WILL GO THROUGH THE ROOF RECENT IPO SELLING BELOW IPO PRICE
25,oogzrs,t2_5lbgli1x,1626834948,/r/wallstreetbets/comments/oogzrs/cryptocurrency_for_land/,1,Cryptocurrency for land ,
26,ooh0ab,t2_719yz,1626835004,/r/wallstreetbets/comments/ooh0ab/all_game_purchases_need_to_go_through_gamestop/,1,All game purchases need to go through gamestop ,All steam purchases should utilize Steam gift cards purchased from Gamestop All console games should be purchased through gamestop Our goal is to funnel wealth into gamestop to drain the wealth of those that don t deserve it This is literally the time that all gamers can contribute to better humanity Purchase your ticked boys and girls Invest in GME and purchase your interactive entertainment through Gamestop They literally can t stop us As a PC gamer I never rooted for gamestop more in my life Let s keep this going retards GO GAMESTOP 
27,ooh0d6,t2_116ed6w9,1626835012,/r/wallstreetbets/comments/ooh0d6/crsrwhen_god_sent_you_a_signal/,1, CRSR When God sent you a signal ,
28,ooh0lw,t2_bbdpi8o7,1626835038,/r/wallstreetbets/comments/ooh0lw/any_day_now/,1,Any day now,
29,ooh1co,t2_730qj,1626835115,/r/wallstreetbets/comments/ooh1co/seen_in_salt_lake_city_utah_thought_this_was/,1,Seen in Salt Lake City Utah Thought this was worth posting here ,
30,ooh1ep,t2_d5mpp,1626835120,/r/wallstreetbets/comments/ooh1ep/leap_puts_on_robinhood_ipo_lets_do_this_fuck/,1,LEAP puts on Robinhood IPO let s do this Fuck everything about Robinhood, removed 
31,ooh22p,t2_116ed6w9,1626835189,/r/wallstreetbets/comments/ooh22p/crsrwhen_god_sent_you_a_signal/,1, CRSR When God sent you a signal ,
32,ooh2su,t2_6kvs5t6h,1626835265,/r/wallstreetbets/comments/ooh2su/launching_a_new_website_for_selling_phone_cases/,1,Launching a new website for selling phone cases to compete with Borja,
33,ooh32i,t2_erp6w,1626835294,/r/wallstreetbets/comments/ooh32i/psychological_warfare_class_warfare_i_hodl/,1,Psychological Warfare Class Warfare I HODL ,
34,ooh5jc,t2_cjais2iu,1626835559,/r/wallstreetbets/comments/ooh5jc/memestocks_for_the_masses_the_redistribution_of/,1,Memestocks for the Masses amp the Redistribution of Wall Street Wealth,
35,ooh5z3,t2_9w2tqca9,1626835604,/r/wallstreetbets/comments/ooh5z3/amzn_to_the_moon/,1, AMZN to the moon ,
36,ooh6fl,t2_9s07ifae,1626835649,/r/wallstreetbets/comments/ooh6fl/cgx_energy_cgxefoylv_best_oil_play_2021_please_do/,1,Cgx Energy CGXEF OYL V BEST OIL PLAY 2021 Please do DD,
37,ooh6uo,t2_erp6w,1626835693,/r/wallstreetbets/comments/ooh6uo/class_warfare_psychological_warfare_i_hodl_for_my/,1,Class Warfare Psychological Warfare I HODL for my APEs HERE Lets see 1000 share,
38,ooh77a,t2_9zl2zc0r,1626835725,/r/wallstreetbets/comments/ooh77a/gme_in_top_4_traded_stocks_on_wealthsimple_canada/,1,Gme in top 4 traded stocks on wealthsimple Canada,
39,ooh8ih,t2_1lbw9vvl,1626835858,/r/wallstreetbets/comments/ooh8ih/evergreen_colorado_autists_everywhere/,1,Evergreen Colorado Autists everywhere ,
40,oohcjv,t2_6y5j2l8f,1626836296,/r/wallstreetbets/comments/oohcjv/options_6_call_nokia/,1,options 6 call Nokia , removed 
41,oohf8i,t2_cn1fkffz,1626836564,/r/wallstreetbets/comments/oohf8i/its_over_for_the_hfs/,1,It s over for the HFs ,
42,oohhy9,t2_2lkd3i0y,1626836852,/r/wallstreetbets/comments/oohhy9/new_johnny_test_references_apes_bullish_on_meme/,1,NEW JOHNNY TEST REFERENCES APES BULLISH ON MEME STOCKS,
43,oohip3,t2_erp6w,1626836925,/r/wallstreetbets/comments/oohip3/_/,1, ,
44,oohis1,t2_4bdlp2l7,1626836933,/r/wallstreetbets/comments/oohis1/gain_porn_for_amc/,1,Gain porn for AMC ,
45,oohni8,t2_cz5mo12v,1626837427,/r/wallstreetbets/comments/oohni8/btu_hedgies_looking_for_it/,1,BTU Hedgies looking for it ,
46,oohnz3,t2_cz5mo12v,1626837480,/r/wallstreetbets/comments/oohnz3/btu_a_potential_buy/,1,BTU A POTENTIAL BUY, removed 
47,oohosf,t2_3lavob8o,1626837568,/r/wallstreetbets/comments/oohosf/tag_nuro/,1,Tag NURO, removed 
48,oohpoe,t2_3lavob8o,1626837667,/r/wallstreetbets/comments/oohpoe/tag_nuro/,1,Tag NURO,Hey guys check out this stock called NURO it s gone up 200 in a hour Might be a good one to keep yours eyes on
49,oohq3m,t2_dvg41lz,1626837714,/r/wallstreetbets/comments/oohq3m/everyone_been_stressing_shit_i_would_too_but_as/,1,Everyone been stressing shit I would too But as Elon said timing really helps However timing doesn t matter nearly as much as belief in your own strategy I personally have been living off options on AMC 25k back in the day made me 800k day trading options is the way to go you ,
50,oohqa9,t2_cphufi0k,1626837733,/r/wallstreetbets/comments/oohqa9/netflix_season_3_the_streaming_star_looks_for_a/,1,Netflix season 3 The streaming star looks for a new post pandemic storyline,
51,oohqci,t2_8ar1ehdc,1626837740,/r/wallstreetbets/comments/oohqci/reeeeeee/,1,ReEeEeEe, removed 
52,oohqy6,t2_8rheohpd,1626837806,/r/wallstreetbets/comments/oohqy6/i_was_looking_at_todays_chart_and_comparing_the/,1,I was looking at today s chart and comparing the mid day price action to the 3 month price action It looks pretty similar to me and I am very excited to see if the 3 month will mimic the rest of today s chart too ,
53,oohr8t,t2_8hqqhueh,1626837838,/r/wallstreetbets/comments/oohr8t/finally_broke_100000_movement_in_one_month_just/,1,Finally broke 100 000 movement in one month just trying to find out how to go the other way now ,
54,ooht55,t2_a0oxvbis,1626838043,/r/wallstreetbets/comments/ooht55/vrpx_virpax_pharma/,1,VRPX VIRPAX PHARMA, LOOK AT THIS ONE gt TINY FLOAT 1 7 MIL SHARES WITH PUSH WILL GO THROUGH THE ROOF RECENT IPO SELLING BELOW IPO PRICE GORILLAS GO AFTER THIS ONE 
55,oohv80,t2_dvg41lz,1626838268,/r/wallstreetbets/comments/oohv80/time_crystal_ape/,1,Time Crystal Ape,
56,oohwoq,t2_s0orq,1626838434,/r/wallstreetbets/comments/oohwoq/just_had_to_share_this_herethe_fantastic_4/,1,Just had to share this here the fantastic 4 ,
57,oohwyc,t2_3z7ffdic,1626838465,/r/wallstreetbets/comments/oohwyc/the_undisputed_retard_of_wsb_gourds_guy_is_doing/,1,The undisputed retard of WSB gourds guy is doing an AMA ,
58,oohxji,t2_a8pzmaxi,1626838526,/r/wallstreetbets/comments/oohxji/lets_crash_the_boot_economy/,1,Lets crash the boot economy, removed 
59,oohxpu,t2_s0orq,1626838546,/r/wallstreetbets/comments/oohxpu/spce_haunters/,1,SPCE haunters,
60,oohzoh,t2_65uugrt8,1626838757,/r/wallstreetbets/comments/oohzoh/amc_gains_holding/,1,AMC gains Holding ,
61,ooi084,t2_cn2o1z8q,1626838818,/r/wallstreetbets/comments/ooi084/market_cresh_cash_everything_and_buy_in_full_deep/,1,Market cresh Cash everything and buy in full deep double your portfolio , removed 
62,ooi095,t2_3z7ffdic,1626838820,/r/wallstreetbets/comments/ooi095/undisputed_retard_gourds_guy_is_doing_an_ama/,1,Undisputed retard Gourds guy is doing an AMA , Link https www reddit com r Tvlse comments oofbtn hesci theemperorofjenks cvhocefkv tos ama Show him some love or hate whatever s clever 
63,ooi0yn,t2_7w1vu1rf,1626838896,/r/wallstreetbets/comments/ooi0yn/20_daily_drop_in_future_tesla_supplier_piedmont/,1,20 daily drop in Future Tesla Supplier Piedmont Lithium PLL Presents Buying Oppertunity,North Carolina based Piedmont Lithium who is looking to be the largest US based lithium supplier dropped 20 today after five of the seven members of the county s board of commissioners who control zoning changes said they may block or delay the project because Piedmont has not told them what levels of dust noise and vibrations will occur nor how water and air quality would be affected As someone who works in permitting and zoning this threat by the commissioners has no teeth The 20 drop is a massive over reaction to this comment by the commissioners and presents a great opportunity to buy the dip Piedmont has stated that they have pushed meetings with the board several time in order to better understand the impacts of their mining operations The comment by the commissioners is likely a show of force by the board because they feel Piedmont is not taking them seriously The CEO of Piedmont has a meeting with the board tonight where I except he will pay his respects to the board to smooth the issue out I believe the stock will recover from the 20 by the end of the month Rising lithium prices compounded with the need of a US based lithium supply will help boost Piedmont and not only is this a good short term play the longterm outlook is strong as well Position https imgur com 24ZRup4
64,ooi34y,t2_3z7ffdic,1626839126,/r/wallstreetbets/comments/ooi34y/undisputed_retard_gourds_guy_is_doing_an_ama/,1,Undisputed Retard gourds guy is doing an AMA,
65,ooi62c,t2_a2bal623,1626839440,/r/wallstreetbets/comments/ooi62c/was_at_the_casino_today_eating_crayons_and_when_i/,1,Was at the casino today eating crayons and when I bought the peak of NVAX I thought the only way out would be to double down on some puts and I didn t even buy the right stock ,
66,ooi880,t2_bkse0jg4,1626839663,/r/wallstreetbets/comments/ooi880/need_a_10m_loan_dm_me_if_you_want_to_finance_this/,1,Need a 10M loan DM me if you want to finance this , removed 
67,ooicv3,t2_5nlcwhul,1626840129,/r/wallstreetbets/comments/ooicv3/looking_for_wallstreetbet_degenerate_for_podcast/,1,Looking for wallstreetbet degenerate for podcast, removed 
68,ooid1l,t2_74lndk8l,1626840148,/r/wallstreetbets/comments/ooid1l/slide_into_dm/,1,Slide into DM,Desktop Metal Inc NYSE DM Sector Technology Industry Computer Hardware Market cap 2 4B Desktop Metal is an additive manufacturing technologies company focused on producing end use parts It offers solutions in hardware software and materials and services with support for Metals Composites Polymers Ceramics Sands Biocompatible materials Wood Elastomers Solutions also range from product development to mass production and aftermarket operations and serve some of the following industries Automotive Healthcare and dental Consumer products Heavy industry Aerospace Machine design and research and development What is additive manufacturing In other words it is 3D printing A predetermined shape is either created from scratch in a software program or downloaded from a 3D library The said software is sliced with another software program before being used to print as the object will be created layer by layer This allows manufacturers to produce complex shapes using less material than traditional manufacturing methods Desktop Metal offers two 3D printer models as well as a long line of parts P 50 prints metal parts at scale for mass production It uses bi directional printing to achieve printing speeds faster than those of laser powder bed fusion technologies https preview redd it uudgj6ugsgc71 png width 494 amp format png amp auto webp amp s c33720d7f39b74285e3e064199c8bac11aaf9013 P 1 smaller than the P 50 Intended to act as the crossover between bench top development and mass production https preview redd it 4trlx49dsgc71 png width 492 amp format png amp auto webp amp s 3e50b0eba7f4ac2575ddcd52893577deab6c14ec There are many different types of 3D printing techniques but Desktop Metals specifically uses binder jetting to print objects Binder jetting utilizes two materials powder base material and a liquid binder In the build chamber powder is spread in equal layers and binder is applied through jet nozzles that glue the powder particles into the required shape After the print is finished any remaining powder is cleaned off and can be reused for future print jobs Binder jetting schematic https preview redd it hvzwg2eosgc71 png width 499 amp format png amp auto webp amp s 93f2f6ed85ba3a5a8fd7dc6a47a1d28dba1bcf83 FINANCIALS https preview redd it q29py72btgc71 png width 624 amp format png amp auto webp amp s 39cdfde4370ac20247d9d740504b3493332ac217 There was a decrease of 9 9M or 38 in revenue which was primarily due to a decrease from both products and services There were fewer products sold approximately 40 due to decrease in demand and longer sales cycles from COVID 19 Customer facility closures associated with the pandemic also resulted in delays in shipments and installation Additionally there was a decrease in utilization of the previously installed products which lead to a decrease in sales of consumable materials Total cost of sales decreased 19 3M or 38 primarily due to a decrease in product cost of sales In 2020 there was a 2 9 obsolescence inventory charge related to product redesigns implemented to reduce costs and enhance performance and functionality https preview redd it 9hkuovfctgc71 png width 624 amp format png amp auto webp amp s 05d738cccb15007c92224041a50a02be1a64b9d4 BULL ARGUMENT Desktop Metals projected revenue and earnings https preview redd it mavpcjktxgc71 png width 541 amp format png amp auto webp amp s 64f6394d3a6a8538a06095cb0ebb5d8bd1a04e48 According to a report from Acument Research and Consulting in 2019 the 3D printing market is forecasted to reach 41B by 2026 which represents a CAGR of 20 In 2020 the 3D printing market was valued at 13 78B and is expected to expand at a CAGR of 21 by 2028 Globally 2 1M units of 3D printers were shipped in 2020 and the shipments are expected to reach 15 3M units by 2028 Aerospace companies are exploring 3D printing for manufacturing various parts of their products Additionally the automotive industry is expected to show a large adoption of this technology In 2018 the United States Department of Defense included 3D printing as an important capability of the budget Desktop Metal is in the Others category https preview redd it ecgzmqc0ygc71 png width 503 amp format png amp auto webp amp s 42969de2e55e6aa4fbb920b3c686ea0ba9a1e45b As of December 31 2020 Desktop Metals has 595 4M in cash cash equivalents and short term investments It has enough cash on hand to support operations for another 3 years To help with the cash position it also completed redemption of all outstanding public warrants which contributed to 170 7M In the first quarter of 2021 Desktop Metal expanded the portfolio to over 225 materials To help with the growth it acquired Adaptive3D which is a leader in elastomers and rubber materials It also grew the employee team to over 470 from 180 in May 2020 Desktop Metal also closed its previous EnvisionTEC acquisition and began shipping two new area wide photopolymer printers Flexcera was also launched as the first major product line for dental applications which received FDA clearance Although there were revenue losses from 2019 to 2020 revenue is up 35 from fourth quarter of 2020 and up 234 from the first quarter of 2020 The outlook for the rest of 2021 is expecting over 100M in revenue for the year and exiting with an annualized revenue run rate of 160M In other words the outlook is bullish for Desktop Metal Massively undervalued https preview redd it y6g2jhipygc71 png width 503 amp format png amp auto webp amp s 32852fc9aed05f95518b1bcb259297efdf7a87b9 BEAR ARGUMENT Desktop Metals is not and has not been profitable since inception The losses are also expected to continue as there will be continued investment into commercialization and new product development It has attracted employees but the ability to train and retain an effective team will be in question As the market grows so will the demand for upgrading and maintaining information technology and the portfolio Timeliness is important in this aspect and there may be delays in the design production and launch of solutions This is due to several plans still being under development Although there is enough cash on hand to support operating costs for the next 3 years it will require additional capital to support business growth CONCLUSION I am bullish on Desktop Metal and will hold this position as the 3D printing market grows Although it has not been profitable since inception I believe the upside for it is massive relative to the risk I will plan to accumulate shares overtime especially since the price is near its 52 week low Positions or ban https preview redd it tlsimqepjhc71 png width 526 amp format png amp auto webp amp s 9f59db88e0dc4bce7aaa791b0777a8c6f73b895c I am not a financial advisor 
69,ooid50,t2_ivy3z,1626840158,/r/wallstreetbets/comments/ooid50/just_got_banned_from_rsofistock_by_a_new_mod_how/,1,Just got banned from r sofistock by a new mod How pathetic ,
70,ooidka,t2_5nlcwhul,1626840202,/r/wallstreetbets/comments/ooidka/looking_for_wallstreetbet_degenerate_for_podcast/,1,Looking for wallstreetbet degenerate for podcast, removed 
71,ooigio,t2_5nlcwhul,1626840515,/r/wallstreetbets/comments/ooigio/looking_for_wallstreetbet_degenerate_for_podcast/,1,Looking for wallstreetbet degenerate for podcast,Do you suck or rock at stocks Do you like to get high and talk I recently started to invest in stocks I don t think i m the best or the worst I ve found it interesting how through gaining and losing money is that the person who I am is changing for better and for worse I also do a podcast The High Meditation Podcast where I get smoke with people meditate for 10 min and talk about whatever this episode would be focused on stocks craziness of this thread and market how stocks affect people s psyche but not limited to If this interests you let me know I would personally describe it as an open book free discussion I can t link the podcast cause my post gets auto removed
72,ooii1m,t2_aacjowqi,1626840680,/r/wallstreetbets/comments/ooii1m/crsr_loaded_the_boat_and_ready_for_take_off_small/,1,CRSR loaded the boat and ready for take off small market cap and super undervalued Earnings come 8 3 expect them to destroy earnings like the last several, removed 
73,ooiisz,t2_4r31gmfp,1626840765,/r/wallstreetbets/comments/ooiisz/dying_at_this_might_be_time_to_buy_more_stocks_in/,1,Dying at this might be time to buy more stocks in dumpsters or tacos or bitscions ,
74,ooilqu,t2_9wpm5ixy,1626841086,/r/wallstreetbets/comments/ooilqu/sofi_i_still_believe_in_you/,1, SoFi I still believe in you ,
75,ooimds,t2_dfegibye,1626841155,/r/wallstreetbets/comments/ooimds/the_next_big_one/,1,The next big one, removed 
76,ooinml,t2_7gm5zzch,1626841291,/r/wallstreetbets/comments/ooinml/i_concur_tits_jacked_gme/,1,I concur tits jacked GME ,
77,ooino9,t2_jtf4tb,1626841297,/r/wallstreetbets/comments/ooino9/test/,1,Test, removed 
78,ooinqg,t2_9z1amiqh,1626841303,/r/wallstreetbets/comments/ooinqg/sndl_short_interest_is_223m_27603m_shares_shorted/,1,SNDL short interest is 223M 276 03M shares shorted 14 13 SI of Float 12 38 S3 SI Float 2 33 fee Shares shorted up 184K shs worth 149K 0 07 over the last week , removed 
79,ooiopz,t2_jtf4tb,1626841410,/r/wallstreetbets/comments/ooiopz/there_is_a_lesson_to_be_learned_somewhere_in_here/,1,There is a lesson to be learned somewhere in here ,
80,ooiri1,t2_5ro683hj,1626841711,/r/wallstreetbets/comments/ooiri1/cocktail_on_bsc_cocktail_party_starting_on_22_july/,1,COCKTAIL on BSC Cocktail party starting on 22 July,
81,ooirxk,t2_54uup6ew,1626841758,/r/wallstreetbets/comments/ooirxk/100k_loss_p0rn_im_done/,1,100k loss p0rn I m done,
82,ooirz0,t2_cpkwd1ha,1626841762,/r/wallstreetbets/comments/ooirz0/crsr_about_to_soar/,1,CRSR ABOUT TO SOAR, removed 
