,postid,author,created_utc,permalink,score,title,selftext
48,obsj0z,t2_a1zpk4jo,1625165717,/r/wallstreetbets/comments/obsj0z/clov_to_the_moon/,1,Clov to the moon , removed 
49,obsj4r,t2_cgqp2le2,1625165726,/r/wallstreetbets/comments/obsj4r/tutes_88_short_interest_20_high_borrow_fee_10x/,1,Tutes 88 Short Interest 20 High Borrow Fee 10X Potention,Never had split Most of the float owned by tutes highly shorted with high borrow fee Easy can go 10 X and more Regularly restricting the short positions obviously keeping it low in purpose till when decide to let it go Stuck in the rage 2 40 100 M market cap with billion revenue Everybody can do their DD and welcome in the comments bellow Not shilling For me its good opportunity for risk and reward Market Cap 138 M Before troubles 3 B Price 2 36 Shares Out 58 M Float 25 M Inst total about 75 80 Debt 1 8 B Infra Sale 2 B ATH 56 00 USD PT analyst 12 USD BK possible or Not Major and still currently provider SDWAN network solutions over 170 countries company fully operating at the moment Please perform your DD too and we can discuss Thank you 
50,obsj86,t2_2r5nng0i,1625165733,/r/wallstreetbets/comments/obsj86/pulsar_bank/,1,Pulsar bank ,What does Pulsar Bank mean I mean the best investment company in 2021 The highest profit the highest guarantee It is a financial fund specialized in trading digital currencies Based at 53 Fore Street London EC2Y 5EJ Company license number 13215120 Pulsar Blatform lTD The company s investment plans give a profit from 75 to 126 according to your capital and the investment plan 1 The first step STANDART 2 5 Daily Minimum Deposit 20 Maximum deposit 999 Contract duration 365 days Minimum withdrawal 1 Profit rate per month 75 2 The second plan TRADER 2 8 Daily Minimum deposit 1000 1000 Maximum deposit 2499 Contract duration 365 days Minimum withdrawal 1 Profit rate per month 84 3 The third plan PROFESSIONAL 3 2 Daily Minimum deposit 2500 2500 Maximum deposit 4999 Contract duration 365 days Minimum withdrawal 1 Profit rate per month 96 4 Fourth plan HEADLINER 3 5 Daily Minimum deposit 5000 5000 Contract duration 365 days Minimum withdrawal 1 Profit rate 105 The company s investment plans VIP 1 INFLUENCER 3 7 Daily Minimum deposit 10000 Maximum deposit 19999 Duration 365 days Monthly profit rate 111 2 AMBASSADOR 3 9 Daily Minimum Deposit 20 000 Maximum deposit 34 999999 Duration 365 days Monthly profit rate 117 3 TOP MANAGER 4 1 Daily Minimum Deposit 35 000 Maximum deposit 54 999 Duration 365 days Monthly profit rate 123 4 HEAD 4 2 Daily Minimum deposit 60 000 Maximum deposit 999999 Duration 365 days Profit rate 126 This is the link to register in the company https pulsarbank com refid 7036
51,obsjaj,t2_a1p19z63,1625165739,/r/wallstreetbets/comments/obsjaj/its_not_much_but_doing_my_part_not_selling_until/,1,It s not much but doing my part Not selling until we hit that 69 ,
52,obsjt0,t2_aos2k6i5,1625165782,/r/wallstreetbets/comments/obsjt0/prvb_has_a_cure_for_type_1_diabetes_in_the_works/,1,PRVB has a cure for type 1 diabetes in the works,
53,obsjte,t2_90musr1q,1625165782,/r/wallstreetbets/comments/obsjte/acn_accenture_closing_on_300/,1,ACN Accenture closing on 300, removed 
54,obsjx5,t2_4kf9cdlo,1625165792,/r/wallstreetbets/comments/obsjx5/who_else_is_on_the_you_rocket_up_62_since_ipo_on/,1,Who else is on the YOU rocket Up 62 since IPO on Tuesday, removed 
55,obsk8h,t2_a0tnr3yf,1625165818,/r/wallstreetbets/comments/obsk8h/robinhood_allows_customers_to_get_access_to_ipo/,1,Robinhood allows customers to get access to IPO,
56,obskhn,t2_a35dgwdl,1625165838,/r/wallstreetbets/comments/obskhn/xela_featuring_no1_shorted_stock_on_fintel/,1, Xela featuring no 1 shorted stock on Fintel,
57,obsl26,t2_a1xdiwot,1625165883,/r/wallstreetbets/comments/obsl26/for_mod_verifying_account_wish/,1,For MOD verifying account WISH,
58,obslb2,t2_a36pfhcj,1625165902,/r/wallstreetbets/comments/obslb2/didi/,1,DIDI, removed 
59,obslr3,t2_d1ve81tl,1625165940,/r/wallstreetbets/comments/obslr3/are_you_gonna_invest_in_this_company/,1,are you gonna invest in this company , removed 
60,obslrt,t2_91q53usm,1625165942,/r/wallstreetbets/comments/obslrt/great_news_dont_miss_this_chance/,1,Great news Don t miss this chance,
61,obslzf,t2_3lghmovs,1625165958,/r/wallstreetbets/comments/obslzf/i_bought_a_position_in_wish_just_so_the_auto_mods/,1,I bought a position in WISH just so the auto mods would let me post this YOLO blah blah Who are they kidding Wish sucks and we don t care about them why are they shoving it down our throats ,
62,obsmak,t2_539kfgiv,1625165980,/r/wallstreetbets/comments/obsmak/the_ticker_that_shall_not_be_named_dd_dna/,1,the ticker that shall not be named DD DNA,Idk why this ticker is banned from WSB but with all the hype going on in wall street about gene editing lately i thought it d be a great time to invest in Gingko Bioworks and if you dont know the ticker symbol just do a quick search on the company it ll be an easy find Ginkgo Bioworks is a biotech company that specializes in using genetic engineering to produce bacteria with industrial applications It is the self proclaimed Organism Company and is one of the world s largest privately held biotech companies GINGKO announced its new ticker for the NYSE will be DNA The ticker was previously used by Genentech who stopped using the ticker after they were acquired by Roche The ticker symbol alone makes my balls tickle Heres the fun part Gingko is one of the first companies in it s field and lately has been very difficult to evaluate based on the work they ve done because no other company has done it Which means they will be the first of their kind Heres just a few applications that caught my attention Gene Editing Waste Remediation Vaccines Agriculture marijuana included Robots Softwares and thats only just a few that caught my eye they have applications for almost every significant sector in the market which makes it hard to evaluate Not to mention various key partners in biotech and financial sectors TLDR im long on soon to be DNA with 50 12 5c contracts and 500 shares
63,obsn0w,t2_169wg5yw,1625166028,/r/wallstreetbets/comments/obsn0w/robinhood_ipo/,1,Robinhood IPO,Robinhood Wants You to Buy Robinhood Stock on Robinhood https www wsj com articles robinhood wants you to buy robinhood stock on robinhood 11625131801 I caution buying into the Robinhood IPO Them allocating a third of the IPO for retail is unusual and to me sticks out as a trap Retail being left to hold a large portion of the bags is an optimal outcome for the major company players NASDAQ exchange Citadel and Goldman Citi JP underwriting the deal Everyone will come out well off except the shareholders Then again I m seeing lots of calls to short it meaning it ll possibly get squeezed and then bid up so there s that 
64,obsnau,t2_1nvstwrk,1625166049,/r/wallstreetbets/comments/obsnau/do_you_guys_think_amc_will_continue_dropping/,1,Do you guys think AMC will continue dropping tomorrow , removed 
65,obsnd9,t2_9yh6rz1q,1625166054,/r/wallstreetbets/comments/obsnd9/officially_joined_the_ape_crew/,1,Officially joined the APE crew ,
66,obso79,t2_a35dgwdl,1625166114,/r/wallstreetbets/comments/obso79/xela_is_shorted_heavily_as_per_fintel_what_so_you/,1, Xela is shorted heavily as per Fintel What so you think of a squeeze ,
67,obso8x,t2_9zgdneor,1625166118,/r/wallstreetbets/comments/obso8x/clov_wow_you_guys_gonna_let_the_hedgies_win_amc/,1,CLOV wow you guys gonna let the Hedgies win AMC down CLOV down CLOV and AMC still have large Float large Shorts buy more lets get these going back up to the moon Now the time to make CLOV 50, removed 
68,obsogq,t2_6yd8omyy,1625166133,/r/wallstreetbets/comments/obsogq/robbing_hood_ipo_bois/,1,Robbing Hood IPO bois, removed 
69,obsoo4,t2_76izummh,1625166150,/r/wallstreetbets/comments/obsoo4/sorrento_expects_the_first_shipments_of_covistix/,1,Sorrento expects the first shipments of COVI STIX tests to Mexico will be made this month ,I ve never posted on here before I guess you can say the legend of WSB can be a little intimidating I mean what can a regular guy like me have to offer that a thousand other guys haven t already thought of idk if anything has really changed as far as that goes but even if a thousand or even 10 thousand people have already said what I m about to say it wouldn t be enough those who matter won t need much backstory on Sorrento Therapeutics a terrific company that for all their great ideas and programs has mostly been ignored by the market due to a lack of revenue or revenue of any consequence that is no longer the case this month they begin truly making a profit further funding the many aforementioned wonderful projects I spoke of This is what I want you all to see its time to invest in SRNE Do your own DD stocktalkforums com is a great tool for SRNE investors in addition to the company s own site of course ok I ve said my piece I hope this gets posted I believe you all could really do well to atleast take a look Good luck everyone 
70,obsoty,t2_a1p19z63,1625166162,/r/wallstreetbets/comments/obsoty/not_much_but_doing_my_part_i_like_that_69_price/,1,Not much but doing my part I like that 69 price target,
71,obsp4h,t2_275uhdfq,1625166183,/r/wallstreetbets/comments/obsp4h/welp_went_all_in_on_options_this_week_for_amc/,1,Welp went all in on options this week for amc,
72,obsp9b,t2_75ixqk7,1625166192,/r/wallstreetbets/comments/obsp9b/the_universe_told_me_amc_the_buy_is_55/,1,The Universe told me AMC the buy is 55,too tired to explain it all and as poetically as I did the first time which got deleted How s this 
73,obspak,t2_asfuorfq,1625166194,/r/wallstreetbets/comments/obspak/cpop_listed_on_the_30th_this_ride_literally_just/,1,CPOP listed on the 30th This ride literally just started the music industry is usually bullish in my view What are y all s thoughts It s up 300 in 2 days Take some gains and ride the sound waves with me ,
74,obspch,t2_626ypdqy,1625166198,/r/wallstreetbets/comments/obspch/yolo_duol/,1,YOLO DUOL , removed 
75,obspku,t2_a35dgwdl,1625166216,/r/wallstreetbets/comments/obspku/xela_is_shorted_heavily_as_per_fintel_what_so_you/,1, Xela is shorted heavily as per Fintel What so you think of a squeeze , removed 
76,obspui,t2_6a6an57v,1625166238,/r/wallstreetbets/comments/obspui/wish_stocks/,1,Wish Stocks ,look with all the wish stocks going up soon maybe wish will actually increase the quality of their items and become a good company amp x200B buy wish for the memes
77,obspw9,t2_a2nput9g,1625166242,/r/wallstreetbets/comments/obspw9/hive/,1,Hive, removed 
78,obsqnp,t2_a0vy1nc7,1625166302,/r/wallstreetbets/comments/obsqnp/shiba_have_15000000_shares_lets_make_me_a/,1,Shiba Have 15 000 000 shares Let s make me a millionaire Yolo, removed 
79,obsqxa,t2_cq2bj52n,1625166323,/r/wallstreetbets/comments/obsqxa/we_were_supposed_to_go_to_the_moon/,1,We were supposed to go to the moon ,
80,obsqxx,t2_3lghmovs,1625166324,/r/wallstreetbets/comments/obsqxx/1000_shares_of_wish_yolo_notttttt_i_just_bought/,1,1 000 shares of wish YOLO Notttttt I just bought it so I could post this cause the auto mods said 100 shares wasn t enough for a YOLO post about how much wish sucks and why they are cramming it down our throats No one cares about this shit company , removed 
81,obsrww,t2_a14wwktj,1625166401,/r/wallstreetbets/comments/obsrww/why_are_all_the_purchases_that_screen_cappost/,1,Why are all the purchases that screen cap post their purchases usually high really dollar , removed 
82,obsrys,t2_1zdgg9me,1625166404,/r/wallstreetbets/comments/obsrys/into_clov_at_12/,1,Into CLOV at 12, removed 
83,obssmo,t2_7au2tyqh,1625166458,/r/wallstreetbets/comments/obssmo/htzgq_hertz_global_holdings_inc/,1,HTZGQ Hertz Global Holdings Inc, removed 
84,obssq4,t2_1aspzlk8,1625166467,/r/wallstreetbets/comments/obssq4/new_friends_made_at_the_bowling_alley/,1,New friends made at the bowling alley,
85,obstc4,t2_7o4p9v29,1625166515,/r/wallstreetbets/comments/obstc4/introducing_amazon_stonks/,1,Introducing amazon stonks,
86,obsthh,t2_3wv778mh,1625166526,/r/wallstreetbets/comments/obsthh/amc/,1,Amc,Seems all the heavy hitters have fallen off of the AMC wagon From here on it will more than likely be those who have small amounts of shares that keep it a float while some random heavys drop in and out for the next few months 
87,obstzl,t2_a0gyzudr,1625166572,/r/wallstreetbets/comments/obstzl/24_mil_yolo_on_sorrento_therapeutics_srne/,1,2 4 Mil YOLO on Sorrento Therapeutics SRNE ,
88,obsu7a,t2_a35dgwdl,1625166589,/r/wallstreetbets/comments/obsu7a/xela_is_shorted_heavily_as_per_fintel_what_so_you/,1, Xela is shorted heavily as per Fintel What so you think of a squeeze ,Yesterday Xela rolled out new technology extending its digital mailroom solution software and 2 days ago its RBA Robotic Process Automation Both of these rollouts could send Xela to above 10 but unfortunately Xela executives decided to do an offering of 150M which put cold water on the hype of the bull run While looking deeper at Xela and its products it is for sure that it has a lot in store such as new deals and agreements It should not be forgotten that Xela has already UK gov as its costumer and more to come specially in health sector For now the hedges are trying to pressure the SP down just because of the offering but a lot of optimism from long holders about the company s future 
89,obsuqm,t2_a2ajpxip,1625166631,/r/wallstreetbets/comments/obsuqm/small_gift_for_myself/,1,Small gift for myself,Here we are With the inflation coming and and the NASDAQ at a peak I decided to loose money on small cap Nasdaq stocks I am retard crazy stupid guy my picks CYREN CYREN O gt security and information technology small cap and ready I guess for a long run AMESITE OPRT AMST O gt learning platform powered by AI and machine learning exactly I don t know what they do Codex DNA DNAY O gt a synthetic biology company DNA and exc gt I am waiting for Chatie I am not an ape but just a retarded Yes I know I am more than a retarded 
90,obsv6t,t2_bkc1i1s4,1625166669,/r/wallstreetbets/comments/obsv6t/i_am_looking_for_my_next_buy_does_anyone_have/,1,I am looking for my next buy Does anyone have suggestions for the next big buy , removed 
91,obsvfi,t2_6fm4b0f8,1625166690,/r/wallstreetbets/comments/obsvfi/clf_is_a_hidden_gem_under_steel/,1,CLF is a hidden gem under steel ,
92,obsvs3,t2_cihc8pro,1625166721,/r/wallstreetbets/comments/obsvs3/get_on_didi_while_its_fresh/,1,Get on didi while it s fresh, removed 
93,obsvse,t2_6q7fwv8d,1625166721,/r/wallstreetbets/comments/obsvse/i_thought_options_only_goes_up/,1,I thought options only goes up,
94,obsvwt,t2_yobw0bv,1625166731,/r/wallstreetbets/comments/obsvwt/a_different_kind_of_post_classic_narrative/,1,A different kind of post Classic narrative,Lately a new narrative has taken over the interwebz Instead of investing in innovation and entrepreneurship it is researching which stocks have heavy short interest and creating a movement to exploit this in order to create explosive growth The technique is clear and obvious Sometimes it works sometimes it doesn t Now onto the classic part of this post Every day I check a list of equities I don t pretend to think this is a great list or even a good list but it s my list hah I first look at Tesla I still think it is over valued but I like to see how it tracks I then look at Ride NKLA QS NKLA in my opinion being the trash of trash and a great example of how a bull market can keep anything afloat Lol Then I go to Pltr Peloton Bmbl Door Dash Uber Lyft Airbnb Snowflake Then I go to Nakd and Fold Then I check out some classics like Pfizer AT amp T Coca Cola I weirdly like to look at Moderna Then I check out Endeavour Group Holdings Coinbase Thredup Walkme Then I check out Canopy Then BB AMC GME Then SLV GLD Then Trillium CRISPR Then onto the coins Then RKT and SPCE It is a weird routine I have each and every day almost I think it provides a good exposure to a various class of equities sometimes by groups sometimes by weird segments of the investing sphere I think everything is insanely priced and way to high hah but we are in the everything bubble so that is what it is All in all the classic narrative is that it provides me a good understanding of what is happening in the various big blocks of the investing world Also through google finance I get some good recommends on companies that I don t know about that maybe I will like based on that list and then I expand it sometimes Companies like CRISPR being the things I want to invest in for a better world Despite that I am not touching any of this shit with a 10 foot poll based on the pricing and our current market What equities would you add to look at and why I d love to know what your lists are and the reasoning you like to track those particular sets of equities and such Let the shit throwing begin as I know many of you identify as apes but I still like to identify as the evolution known as human 
95,obswc5,t2_c1nlkzc4,1625166767,/r/wallstreetbets/comments/obswc5/cashapp_ready/,1,Cashapp ready,
96,obswox,t2_czogzpag,1625166794,/r/wallstreetbets/comments/obswox/i_thought_it_was_clear_like_shit_airlines_would/,1,I thought it was clear like shit Airlines would fly this by now aal,
97,obswsi,t2_a22wq8ky,1625166802,/r/wallstreetbets/comments/obswsi/12_million_mile_battery/,1,12 million mile battery, removed 
98,obswtt,t2_bkc1i1s4,1625166805,/r/wallstreetbets/comments/obswtt/i_am_looking_to_make_a_buy_does_anyone_have/,1,I am looking to make a buy Does anyone have suggestions for me I want to make a purchase and take it to the moon , removed 
99,obsxwo,t2_6g477j91,1625166891,/r/wallstreetbets/comments/obsxwo/save_the_world_2k6b/,1,Save the world 2K6B,Save the world Try to make the world a better place AND be part of this amazing community And spice it up by investing in some green stocks Fuck the big Caps which destroy our futures Moving this communist forward to saving the earth should be the main priority 
0,obsxwo,t2_6g477j91,1625166891,/r/wallstreetbets/comments/obsxwo/save_the_world_2k6b/,1,Save the world 2K6B,Save the world Try to make the world a better place AND be part of this amazing community And spice it up by investing in some green stocks Fuck the big Caps which destroy our futures Moving this communist forward to saving the earth should be the main priority 
1,obsyfa,t2_a1mdebxo,1625166934,/r/wallstreetbets/comments/obsyfa/mrin/,1,mrin ,mrin stock if all the pepole in reddit buy the dip tomarow is going to 500 marin is the best for now 
2,obsyod,t2_f58ny,1625166953,/r/wallstreetbets/comments/obsyod/wishing_to_mars/,1, WISHING to Mars,
3,obszip,t2_7lngdasn,1625167020,/r/wallstreetbets/comments/obszip/adom_whats_the_411/,1, ADOM what s the 411 , removed 
4,obszp1,t2_5y7u6gg8,1625167034,/r/wallstreetbets/comments/obszp1/imagine_if_all_of_us_bought_a_180_stock_what_do/,1,Imagine if all of us bought a 1 80 stock What do you think it s price will be next week GNUS, removed 
5,obszwe,t2_9342udav,1625167048,/r/wallstreetbets/comments/obszwe/the_70m_robinhood_fine/,1,The 70M Robinhood fine,Does that fine go to the regulators or get divided up to help the little guys with the losses they got on Robinhood 
6,obt0ip,t2_a2enmrcv,1625167100,/r/wallstreetbets/comments/obt0ip/anybody_in_fcel/,1,Anybody in FCEL , removed 
7,obt0jz,t2_auq8tg49,1625167102,/r/wallstreetbets/comments/obt0jz/really_want_to_make_money/,1,Really want to make money ,
8,obt0mq,t2_b2rvhrh8,1625167110,/r/wallstreetbets/comments/obt0mq/next_move/,1,Next move,Greetings degenerates I ll be straight to the point without wasting your time What is the next GME I have some money to invest and i would like to go all in with all of you Should we win we ll win together should we sink we ll sink together Thanks 
9,obt0wo,t2_ehzzz,1625167135,/r/wallstreetbets/comments/obt0wo/my_first_time_trading_with_options_wish90/,1,My first time trading with options WISH 90 ,
10,obt13h,t2_cluj8c1y,1625167151,/r/wallstreetbets/comments/obt13h/amc_dead/,1,amc dead , removed 
11,obt188,t2_5y7u6gg8,1625167161,/r/wallstreetbets/comments/obt188/how_high_can_you_boost_a_180_stock_through_this/,1,How high can you boost a 1 80 stock through this channel ,If we all bought 100 shares of GNUS currently trading 1 80 what would be the final price at EOW be Any guesses 
12,obt1wt,t2_9vk9yfww,1625167218,/r/wallstreetbets/comments/obt1wt/usws_interesting_set_up/,1,USWS interesting set up, removed 
13,obt20r,t2_b2rvhrh8,1625167226,/r/wallstreetbets/comments/obt20r/next_move/,1,Next move,Next move Greetings degenerates I ll be straight to the point without wasting your time What is the next GME I have some money to invest and i would like to go all in with all of you Should we win we ll win together should we sink we ll sink together Thanks 
14,obt2dz,t2_cj6fciqu,1625167255,/r/wallstreetbets/comments/obt2dz/wish/,1, WISH,
15,obt2ie,t2_4kf9cdlo,1625167266,/r/wallstreetbets/comments/obt2ie/who_else_is_on_the_you_rocket_up_62_since_ipo_on/,1,Who else is on the YOU rocket Up 62 since IPO on Tuesday 26 today Is their technology scary Yep Their facial recognition threatening to privacy Certainly Going to the moon Rocket fueling up now , removed 
16,obt305,t2_3p1wyjik,1625167309,/r/wallstreetbets/comments/obt305/check_out_where_rh_gets_most_of_their_revenue_from/,1,Check out where RH gets most of their revenue from ,
17,obt3j6,t2_5y7u6gg8,1625167357,/r/wallstreetbets/comments/obt3j6/how_high_can_you_boost_a_180_stock_through_this/,1,How high can you boost a 1 80 stock through this channel , removed 
18,obt4dw,t2_cx5kwoet,1625167423,/r/wallstreetbets/comments/obt4dw/smbzf_alert/,1,SMBZF Alert, removed 
19,obt5b1,t2_cx5kwoet,1625167501,/r/wallstreetbets/comments/obt5b1/smbzf_alert/,1,SMBZF Alert, removed 
20,obt6al,t2_9vsda4jb,1625167580,/r/wallstreetbets/comments/obt6al/to_the_moon/,1,To the Moon,
21,obt6n5,t2_86hmpyuf,1625167604,/r/wallstreetbets/comments/obt6n5/making_the_case_for_orphseriously/,1,Making the case for ORPH SERIOUSLY, removed 
22,obt6zl,t2_a08j6fsm,1625167632,/r/wallstreetbets/comments/obt6zl/amc_to_moon/,1, AMC to moon , removed 
23,obt7tu,t2_7gm5zzch,1625167701,/r/wallstreetbets/comments/obt7tu/idgaf_kenny_boy_gme/,1,IDGAF KENNY BOY GME ,
24,obt88x,t2_ca6rbmiq,1625167736,/r/wallstreetbets/comments/obt88x/gme_yolo/,1,GME Yolo,
25,obt8t8,t2_6i77t,1625167782,/r/wallstreetbets/comments/obt8t8/dd_on_didi_vs_uber/,1,DD on DIDI vs UBER,Below is a basic DD by a triple threat autistic retarded europoor Not a financial advice Do you own research First of all I read earlier DD published on this channel yesterday https www reddit com r wallstreetbets comments ob7nro dd on didi and was triggered by it so posting my first DD today Be gentle From the DD linked above gt At 14 20 DIDI sells for 3x 2021 EV Rev vs 6x 2021 EV Rev for Uber Lyft But comparing Uber s revenue to DiDi revenue is not apples to apples It s comparing revenue to a quarter of the revenue also known as autism DiDi revenues is apples to Uber and Lyft s Gross Bookings As DiDi cites all gross transactions what clients pay as revenues and put Driver payouts under cost of sales Uber s Gross Bookings includes all gross transactions While their Revenue is only the fees from B2C gross transactions Exception is their B2B transaction which are booked gross as revenue Comparing Q1 Gross Bookings DiDi 6 44 billion includes China and International etc prospectus page 20 https www sec gov Archives edgar data 1764757 000104746921001194 a2243272zf 1 htm Annualizing by 4 quarters 25 76B Uber 19 5 billion for both Rides Food and Freight Q1 results https investor uber com news events news press release details 2021 Uber Announces Results for First Quarter 2021 default aspx Annualizing by 4 quarters 78B At the time of my writing July 1st price and market caps are as follows DIDI 16 62 per share 79 73B mkt cap UBER 50 37 per share 94 28B mkt cap LYFT doesn t disclose Gross Bookings We will later compare their revenue vs Uber Now comparing annualized Gross Bookings GB multiples DIDI 79 73B mkt cap 25 76B GB 3 1x EV GB multiple UBER 94 28B mkt cap 78B GB 1 2x EV GB multiple DiDi 3 1x vs Uber 1 2x that s 2 6x difference with Uber either undervalued DiDi overvalued or both Main assumption is that as peers and same models long term they will hit similar margins and EBITDA levels Uber has also been growing GB and Revenues at faster pace than DiDi last years Revenues 2018 to 2019 DiDi 14 4 vs Uber 24 6 Comparing 2020 both are slow due to the pandemic Cash equivalents end of Q1 DIDI 3 7B filing page 23 https www sec gov Archives edgar data 1764757 000104746921001194 a2243272zf 1 htm vs Uber 6 6B Q1 filing https d18rn0p25nwr6d cloudfront net CIK 0001543151 af667a46 c7dc 4f72 8754 886d6338d2ce html Uber also literally owns 12 of DiDi now worth 8B to 9 5B Yahoo https finance yahoo com news losing china uber stake didi 205908417 html Further as Uber Lyft and DoorDash report revenue by the same principles Comparing Q1 annualized revenue DASH 58 70B mkt cap 4 3B rev 13 7x EV rev multiple Q1 report https s22 q4cdn com 280253921 files doc financials 2021 q1 Q1 2021 Financials CLEAN pdf LYFT 20 20B mkt cap 2 4B rev 8 4x EV rev multiple Q1 report https investor lyft com news and events news news details 2021 Lyft Announces First Quarter Results default aspx UBER 94 28B mkt cap 13B rev 7 2x EV rev multiple By this metric Uber again comes the most undervalued while having the best cash position most equity stakes of other players and biggest business footprint 
26,obt9fc,t2_5roy0nxj,1625167828,/r/wallstreetbets/comments/obt9fc/robinhood_fineipo/,1,Robinhood fine ipo, removed 
27,obt9sf,t2_12ojj1,1625167857,/r/wallstreetbets/comments/obt9sf/wish/,1, WISH, removed 
28,obta81,t2_yamxn,1625167890,/r/wallstreetbets/comments/obta81/robinhood_will_make_200m_this_year_on_the_backs/,1,Robinhood will make 200M this year on the backs of lending out the stocks you own how does WSB feel about that ,
