,postid,author,created_utc,permalink,score,title,selftext
61,osjwab,t2_8g7wp03z,1627379982,/r/wallstreetbets/comments/osjwab/baba_is_a_money_making_machine/,1, BABA is a money making machine ,Chinese or not BABA isn t a normally company it s a money printing machine I m hoping it will fall to the 175 mark this week and I m going to load up Will be back to 230 range by the end of 2021 and then touch 300 in Q4 2022 Anyone else loading up on these incredibly cheap prices It blows my mind how people can overlook such a profitable company because Chinese ennit The Chinese government doesn t want to see BABA fall when this FUD blows over you ll kick yourself for not picking up this monster of a company as such a cheap price 
62,osjwkg,t2_bd6q5,1627380012,/r/wallstreetbets/comments/osjwkg/daily_discussion_thread_for_july_27_2021/,1,Daily Discussion Thread for July 27 2021,Your daily trading discussion thread Please keep the shitposting to a minimum Navigate WSB We recommend best daily DD DD All https reddit com r wallstreetbets search sort new amp restrict sr on amp q flair 3ADD Best Daily https www reddit com r wallstreetbets search sort top amp q flair 3ADD amp restrict sr on amp t day Best Weekly https www reddit com r wallstreetbets search sort top amp q flair 3ADD amp restrict sr on amp t week Discussion All https reddit com r wallstreetbets search sort new amp restrict sr on amp q flair 3ADiscussion Best Daily https www reddit com r wallstreetbets search sort top amp q flair 3ADiscussion amp restrict sr on amp t day Best Weekly https www reddit com r wallstreetbets search sort top amp q flair 3ADiscussion amp restrict sr on amp t week YOLO All https reddit com r wallstreetbets search sort new amp restrict sr on amp q flair 3AYOLO Best Daily https www reddit com r wallstreetbets search sort top amp q flair 3AYOLO amp restrict sr on amp t day Best Weekly https www reddit com r wallstreetbets search sort top amp q flair 3AYOLO amp restrict sr on amp t week Gain All https reddit com r wallstreetbets search sort new amp restrict sr on amp q flair 3AGain Best Daily https www reddit com r wallstreetbets search sort top amp q flair 3AGain amp restrict sr on amp t day Best Weekly https www reddit com r wallstreetbets search sort top amp q flair 3AGain amp restrict sr on amp t week Loss All https reddit com r wallstreetbets search sort new amp restrict sr on amp q flair 3ALoss Best Daily https www reddit com r wallstreetbets search sort top amp q flair 3ALoss amp restrict sr on amp t day Best Weekly https www reddit com r wallstreetbets search sort top amp q flair 3ALoss amp restrict sr on amp t week Weekly Earnings Discussion Thread https www reddit com r wallstreetbets search sort new amp restrict sr on amp q flair 3A 22Earnings 20Thread 22 Read the rules https www reddit com r wallstreetbets wiki contentguide and make sure other people follow them Try No Meme Mode https www reddit com r wallstreetbets search q flair 3AMeme 20 flair 3ASatire 20 flair 3AShitpost amp restrict sr 1 amp t day amp sort hot also accessible through the top bar Follow Official WSB https twitter com Official WSB on Twitter all other accounts are impersonators Check out our Discord https discord gg wallstreetbets 
63,osjyl5,t2_c2p95lc4,1627380302,/r/wallstreetbets/comments/osjyl5/zynerba/,1,zynerba, removed 
64,osk020,t2_a1keqk40,1627380500,/r/wallstreetbets/comments/osk020/big_things_coming_pharm_phar_pharminggroup/,1,Big things coming pharm phar pharminggroup,
65,osk0n4,t2_u9263,1627380582,/r/wallstreetbets/comments/osk0n4/the_robinhood_ipo_is_near_excuse_gibberish/,1,The Robinhood IPO is near Excuse gibberish language ,
66,osk5cr,t2_a1g05byd,1627381217,/r/wallstreetbets/comments/osk5cr/etherum_all_in_is_win_mvis/,1, Etherum all in is win MVIS,
67,osk6su,t2_a0reryfa,1627381418,/r/wallstreetbets/comments/osk6su/trvn_vote_no_on_rs_proposal/,1, TRVN VOTE NO ON R S PROPOSAL, removed 
68,osk76c,t2_3vlrjgmj,1627381468,/r/wallstreetbets/comments/osk76c/lets_short/,1,Let s short,
69,osk8te,t2_cpm0q9a4,1627381699,/r/wallstreetbets/comments/osk8te/is_body_the_real_short_squeeze/,1,Is BODY the real short squeeze , removed 
70,oskax0,t2_5x3d5irr,1627381991,/r/wallstreetbets/comments/oskax0/for_apes_still_using_rh/,1,For Apes Still Using RH,
71,oskbhk,t2_9y1d13p8,1627382070,/r/wallstreetbets/comments/oskbhk/anyone_heard_of_ptra_do_some_dd/,1,Anyone heard of PTRA do some dd, removed 
72,oskbpn,t2_5x3d5irr,1627382104,/r/wallstreetbets/comments/oskbpn/for_my_fellow_apes_still_on_rh/,1,For My Fellow Apes Still On RH ,
73,oskcqa,t2_6o9n0ita,1627382250,/r/wallstreetbets/comments/oskcqa/is_it_friday_yet/,1,Is it Friday yet ,
74,oskdns,t2_a0reryfa,1627382384,/r/wallstreetbets/comments/oskdns/trvn_vote_no_on_rs_proposal_we_are_too_close_to/,1, TRVN VOTE NO ON R S PROPOSAL we are too close to being under 5 with a 4 1 R S We deserve news prior to 8 9 re 027 sales and other pipeline advances CEO will be fired if no R S achieved time for a change VOTE NO if you do not vote your broker will vote YES on your behalf VOTE NO TO R S , removed 
75,oskefb,t2_a0reryfa,1627382479,/r/wallstreetbets/comments/oskefb/trvn_vote_no_on_rs_proposal_we_are_too_close_to/,1, TRVN VOTE NO ON R S PROPOSAL we are too close to being under 5 with a 4 1 R S We deserve news prior to 8 9 re 027 sales and other pipeline advances CEO will be fired if no R S achieved time for a change VOTE NO if you do not vote your broker will vote YES on your behalf VOTE NO TO R S , removed 
76,oskerv,t2_39iy752h,1627382530,/r/wallstreetbets/comments/oskerv/70k_yolo_on_lcid/,1,70K YOLO on LCID,
77,oskezo,t2_a0reryfa,1627382559,/r/wallstreetbets/comments/oskezo/trvn_vote_no_on_rs_proposal_we_are_too_close_to/,1, TRVN VOTE NO ON R S PROPOSAL we are too close to being under 5 with a 4 1 R S We deserve news prior to 8 9 re 027 sales and other pipeline advances CEO will be fired if no R S achieved time for a change VOTE NO if you do not vote your broker will vote YES on your behalf VOTE NO TO R S , removed 
78,oskjkm,t2_cdhiiua9,1627383182,/r/wallstreetbets/comments/oskjkm/this_pretty_much_sums_up_my_bagholding_trading/,1,This pretty much sums up my bag holding trading account,
79,oskl2d,t2_cpm0q9a4,1627383381,/r/wallstreetbets/comments/oskl2d/is_body_the_real_squeeze/,1,Is BODY the real squeeze ,What is everyone s thoughts on BODY All my DD points to a huge upside potential but for some reason it s not very popular yet Am I just early to the party for once and my calls I bought yesterday will be my Lambo or will I be put on the bench Any thoughts welcome 
80,osklh1,t2_12r8sx,1627383438,/r/wallstreetbets/comments/osklh1/tiger_global_is_killing_it_i_was_interested_to/,1,Tiger Global is killing it I was interested to find out what does it take to join this secretive fund so I analyzed 23 profiles in their deal team covering Partners Investors and Associates,
81,osklok,t2_512rccp6,1627383465,/r/wallstreetbets/comments/osklok/microvast_mvst/,1,Microvast MVST ,Listen up retards This is a x5 play Microvast Leader in the fast charging batteries Full charge in 20minutes Solid State Battery Lithium Metal battery High Temperature Cells Sports Car Application Vertically integrated amp proprietary 1 5B contracted revenue thru 2027 100M revenue 2020 2 3B 2025E revenue 550 patents 3 8B miles with ZERO operational accidents 28K battery systems in operation in 19 countries amp 160 cities 1800 total employees 500 R amp D personnel Full Range of Energy Densities 85 265 Wh Kg Long cycle lives 2 500 20 000 Best in Class Charging Performance 10 30 mins Products for all classes of commercial vehicles passenger vehicles amp energy storage solutions Product specs vs closest competitor Range per charge 370 miles vs 300 miles Speed of charge 12 mins for 70 vs 30 mins for 60 Lifespan 3000 cycles vs 1000 cycles Lifetime Throughput Mileage 1M miles vs 270K miles 2025 Adjacent TAM 45B 55 CAGR 2020 2025E Will Support OshkoshDefense in future progress which includes the USPS Contract Microvast is light years ahead of QS QuantumScapeCo in every aspect If you want a piece of the EV Battery sector this is it luxury OEM marquee announcement due soon from the CEO mouth himself Could it be Mercedes 1 year ago Mercedes Benz s decided to build the new generation of the eSprinter electric van in Ludwigsfelde which coincidentally is the same proximity of Microvast 
82,oskmel,t2_a2oast5y,1627383563,/r/wallstreetbets/comments/oskmel/mmat/,1,MMAT , removed 
83,oskn3z,t2_agmj3w1c,1627383625,/r/wallstreetbets/comments/oskn3z/robinhood_be_like_yep_your_gme_is_completely/,1,Robinhood be like yep your GME is completely legit Your GME ,
84,oskncp,t2_88amwsze,1627383653,/r/wallstreetbets/comments/oskncp/relatable_xd/,1,Relatable XD,
85,oskpq1,t2_12r8sx,1627383962,/r/wallstreetbets/comments/oskpq1/tiger_global_is_killing_it_i_was_curious_where/,1,Tiger Global is killing it I was curious where this secretive fund recruits from so I analyzed 23 profiles in their deal team covering Partners Investors and Associates,
86,oskrcc,t2_12r8sx,1627384170,/r/wallstreetbets/comments/oskrcc/tiger_global_is_killing_it_i_was_curious_where/,1,Tiger Global is killing it I was curious where this secretive fund recruits from so I analyzed 23 profiles in their deal team covering Partners Investors and Associates https www listalpha com post where does tiger global recruit from,
87,oskrqr,t2_a8dea56l,1627384215,/r/wallstreetbets/comments/oskrqr/abra_is_a_scam/,1,ABRA is a scam ,WARNING TO ALL ABRA is a scam they don t care at all about the customer Since I can t post on their Reddit I ll do it here they will steal your money Janfromabra screw you and your staff where is my money I ve given you Blockchain data and all my account info and you steal steal my money and banned my account I will not be quiet 
88,osksc6,t2_12r8sx,1627384288,/r/wallstreetbets/comments/osksc6/where_does_tiger_global_recruit_from/,1,Where does Tiger Global recruit from , Tiger Global is killing it I was curious where this secretive fund recruits from so I analyzed 23 profiles in their deal team covering Partners Investors and Associates https preview redd it dm2vnaebnqd71 png width 731 amp format png amp auto webp amp s 7903b389000a93189427fd87860c5fea8cc5bfcc 70 of the analyzed investors came from Private Equity background with names including Apollo Blackstone Warburg Pincus KKR and others Apollo was the largest single feeder fund generating 4 of the profiles 17 of the sample Hedge funds resulted in only 4 of the profiles surprisingly with only one coming from the famed Tiger Management parent fund Consulting and Investment Banking was also underrepresented with only two profiles from BCG and Citigroup Full results at https www listalpha com post where does tiger global recruit from https www listalpha com post where does tiger global recruit from Raw data at www listalpha com https www listalpha com 
89,osksro,t2_yt34v,1627384340,/r/wallstreetbets/comments/osksro/nvdiatothemoon/,1, NVDIAtothemoon,NVDIA coming off a strong week NvDIA will look do it again this week The technology giant is one of the US s biggest companies The stock split that occurred on July 20th opened the door to new investors and new possibilities with talk that the stock could join the DOW the purchase of ARM that both companies and competition are heavily invested and a great earnings as usual for NVDIA the tech giant will have another big week The giant tends to perform as earnings of its competitors come to light today is AMD As microchip companies such as Taiwan Semiconductor released earnings NVDIA grows This is stock is in for another good week and will continue to do so at least until August 18th which is when earnings are in and NVDIA crushes all expectations once again Last week NVDIA grow more than 7 with such momentum let s see how much it grows this week Can NVDIA reach an all time high This is not financial advice
90,osku0v,t2_3zdtr8jw,1627384499,/r/wallstreetbets/comments/osku0v/finexy_new_and_shill_httpsfinexycomstocksamc/,1,Finexy New and Shill https finexy com stocks AMC,
91,oskuaq,t2_9zy202nb,1627384532,/r/wallstreetbets/comments/oskuaq/check_this_software_stock_big_long_chance/,1,Check this Software Stock Big long Chance ,
92,oskudm,t2_a1h13lr9,1627384543,/r/wallstreetbets/comments/oskudm/ipo_and_post_lockup_performance_of_selected/,1,IPO and post lockup performance of selected stocks compared to NASDAQ movement for the same period Looks like waiting till lock up period expires is better option Interesting few months ahead for PATH AFRM COIN RBLX CPNG,
93,oskwa0,t2_a1h13lr9,1627384779,/r/wallstreetbets/comments/oskwa0/ipo_and_post_lockup_performance_of_selected/,1,IPO and post lockup performance of selected stocks compared to NASDAQ movement for the same period Looks like waiting till lock up period expires is better option Interesting few months ahead for PATH AFRM RBLX CPNG,
94,oskwma,t2_psy3t5f,1627384828,/r/wallstreetbets/comments/oskwma/coinbase/,1,Coinbase , removed 
95,oskws1,t2_b9unau20,1627384849,/r/wallstreetbets/comments/oskws1/puts/,1,Puts , removed 
96,oskyk6,t2_a1h13lr9,1627385076,/r/wallstreetbets/comments/oskyk6/ipo_and_post_lockup_performance_of_selected/,1,IPO and post lockup performance of selected stocks compared to NASDAQ movement for the same period Looks like waiting till lock up period expires is better option Interesting few months ahead for PATH AFRM RBLX CPNG,
97,oskyun,t2_a0fer312,1627385112,/r/wallstreetbets/comments/oskyun/iswh_time_to_hop_on_board/,1, ISWH time to hop on board, removed 
98,oskyx8,t2_c1oospxp,1627385119,/r/wallstreetbets/comments/oskyx8/official_tshirt_of_wsb/,1,Official T shirt of WSB ,
99,osl18t,t2_b9unau20,1627385408,/r/wallstreetbets/comments/osl18t/puts_help_pls/,1,Puts help pls ,So I need some help I know how to do a put but idk exactly what to do So I m trying to do a put on a biotech stock called JAZZ I believe it s gonna get rejected on its pdufa and drop a ton I believe this based on the owners trades since he is selling a ton of his stock Can people pls give me there opinions at least cause this will be the first time I ve ever done a put so any help is great Any help on the strike price would be greatly appreciated tho so thanks in advance for any help 
0,osl18t,t2_b9unau20,1627385408,/r/wallstreetbets/comments/osl18t/puts_help_pls/,1,Puts help pls ,So I need some help I know how to do a put but idk exactly what to do So I m trying to do a put on a biotech stock called JAZZ I believe it s gonna get rejected on its pdufa and drop a ton I believe this based on the owners trades since he is selling a ton of his stock Can people pls give me there opinions at least cause this will be the first time I ve ever done a put so any help is great Any help on the strike price would be greatly appreciated tho so thanks in advance for any help 
1,osl3ou,t2_53d4xh94,1627385711,/r/wallstreetbets/comments/osl3ou/stfc_yolo_not_having_drawback/,1, STFC Yolo not having drawback ,I yolo d a small amount about 1500 on various put of STFC after the huge blow up it had in anticipation of its tanking That s hasn t happened yet and I m confused as why meanwhile I m taking a hit 
2,osl78p,t2_a1chwql1,1627386134,/r/wallstreetbets/comments/osl78p/carige_stock_is_back_crgi/,1,Carige stock is back CRGI ,Hi guys could be intrestring swing trading on carige stock IT is an italian stock come back on the italian stock exchange 
3,osl87c,t2_4qaoq,1627386255,/r/wallstreetbets/comments/osl87c/anyone_else_holding_the_stock_that_shall_not_be/,1,Anyone else holding the stock that shall not be named , removed 
4,osla8i,t2_4qaoq,1627386503,/r/wallstreetbets/comments/osla8i/anyone_else_holding_the_stock_that_shall_not_be/,1,Anyone else holding the stock that shall not be named ,
5,oslb92,t2_4qaoq,1627386615,/r/wallstreetbets/comments/oslb92/anyone_else_holding_the_stock_that_shall_not_be/,1,Anyone else holding the stock that shall not be named ,
6,oslfm9,t2_7ltijaia,1627387136,/r/wallstreetbets/comments/oslfm9/will_robinhood_let_you_preorder_the_ipo_if_your/,1,Will Robinhood let you preorder the IPO if your in the middle of a 90 day ban And is there anywhere else you can grab it before Thursday ,
7,oslfnl,t2_a16xtuuc,1627387140,/r/wallstreetbets/comments/oslfnl/whats_your_fav_app/,1,What s your fav app, removed 
8,oslgk6,t2_89jcqgaq,1627387223,/r/wallstreetbets/comments/oslgk6/last_call_to_get_on_the_amc/,1,Last call to get on the AMC , removed 
9,oslgv5,t2_6hf2z55l,1627387257,/r/wallstreetbets/comments/oslgv5/daily_popular_tickers_thread_for_july_27_2021/,1,Daily Popular Tickers Thread for July 27 2021 TSLA BABA AMC, Your daily hype thread Please keep the shitposting to a maximum Navigate WSB We recommend best daily DD DD All https reddit com r wallstreetbets search sort new amp restrict sr on amp q flair 3ADD Best Daily https www reddit com r wallstreetbets search sort top amp q flair 3ADD amp restrict sr on amp t day Best Weekly https www reddit com r wallstreetbets search sort top amp q flair 3ADD amp restrict sr on amp t week Discussion All https reddit com r wallstreetbets search sort new amp restrict sr on amp q flair 3ADiscussion Best Daily https www reddit com r wallstreetbets search sort top amp q flair 3ADiscussion amp restrict sr on amp t day Best Weekly https www reddit com r wallstreetbets search sort top amp q flair 3ADiscussion amp restrict sr on amp t week YOLO All https reddit com r wallstreetbets search sort new amp restrict sr on amp q flair 3AYOLO Best Daily https www reddit com r wallstreetbets search sort top amp q flair 3AYOLO amp restrict sr on amp t day Best Weekly https www reddit com r wallstreetbets search sort top amp q flair 3AYOLO amp restrict sr on amp t week Gain All https reddit com r wallstreetbets search sort new amp restrict sr on amp q flair 3AGain Best Daily https www reddit com r wallstreetbets search sort top amp q flair 3AGain amp restrict sr on amp t day Best Weekly https www reddit com r wallstreetbets search sort top amp q flair 3AGain amp restrict sr on amp t week Loss All https reddit com r wallstreetbets search sort new amp restrict sr on amp q flair 3ALoss Best Daily https www reddit com r wallstreetbets search sort top amp q flair 3ALoss amp restrict sr on amp t day Best Weekly https www reddit com r wallstreetbets search sort top amp q flair 3ALoss amp restrict sr on amp t week 
10,oslgzf,t2_3yxk9z0j,1627387271,/r/wallstreetbets/comments/oslgzf/this_is_my_gambling_setup_who_else_has_a_cool/,1,This is my gambling setup who else has a cool setup on their phone ,
11,oslhdc,t2_a6o62myl,1627387311,/r/wallstreetbets/comments/oslhdc/why_is_game_stop_gme_banned_on_wallstreetbets/,1,Why is GAME STOP GME banned on Wallstreetbets , removed 
12,oslia5,t2_a6o62myl,1627387412,/r/wallstreetbets/comments/oslia5/see_its_banned_the_stock_that_cannot_be_named/,1,See It s banned The stock that cannot be named,
13,oslkvr,t2_125h00,1627387714,/r/wallstreetbets/comments/oslkvr/hello_fellow_crayon_nibbler_i_tried_yelling_hold/,1,Hello fellow crayon nibbler I tried yelling hold retard at you but I guess you couldn t hear me ,
14,osln3i,t2_7ltijaia,1627387967,/r/wallstreetbets/comments/osln3i/will_robinhood_let_you_preorder_the_ipo_if_your/,1,Will Robinhood let you preorder the IPO if your halfway through a 90 day ban ,
15,oslni2,t2_tfxbi5,1627388014,/r/wallstreetbets/comments/oslni2/tsla_confirmed_to_drop_to_hell_today_good_luck_my/,1,TSLA confirmed to drop to hell today good luck my fellow retards ,
16,osloix,t2_a3r3zchb,1627388133,/r/wallstreetbets/comments/osloix/cnbc_on_shaw_satellite/,1,CNBC on Shaw Satellite, removed 
17,oslp01,t2_53d4xh94,1627388187,/r/wallstreetbets/comments/oslp01/stfc_drop_anytime_soon/,1, STFC drop anytime soon,I put down about 1500 on various puts for STFC 08 20 in anticipation of its downfall after its ridiculous blow up But of course its holding up smh any know what is keeping this afloat is it the fact they have the agreement to have shares bought at 52 making close to that the new cost per share 
18,oslpvh,t2_a6o62myl,1627388280,/r/wallstreetbets/comments/oslpvh/why_is_gme_gamestop_banned_on_wallstreetbets/,1,Why is GME GAMESTOP banned on Wallstreetbets ,July 26 2021 11 04 PM ET BZ Newswire Long Ideas Alibaba Group Holding Limited NYSE BABA has joined Tesla Inc NASDAQ TSLA Advanced Micro Devices Inc NASDAQ AMD and Apple Inc NASDAQ AAPL among the stocks seeing the highest interest on Reddit s r WallStreetBets forum as of Monday night What Happened Exchange traded fund SPDR S amp P 500 ETF Trust NYSE SPY remained the most discussed stock on the forum with 738 mentions followed by electric vehicle maker Tesla with 480 mentions during the last 24 hours data from Quiver Quantitative showed Chinese e commerce giant Alibaba and chipmaker Advanced Micro Devices are in the third and fourth positions having attracted 310 and 133 mentions on the forum respectively Apart from Apple the other stocks that are trending on the forum include movie theatre chain AMC Entertainment Holdings Inc NYSE AMC medical insurance technology company Clover Health Investments Corp NASDAQ CLOV Chinese education company TAL Education Group NYSE TAL video game retailer GameStop Corp NYSE GME and Chinese EV maker Nio Inc NYSE NIO See Also Tesla Resumes Model S Deliveries After a Weeklong Hold Why It Matters Tesla is seeing high interest from retail investors after the Elon Musk led company reported second quarter earnings results that beat analysts estimates Revenue for the quarter surged 98 year over year Apple and Advanced Micro Devices will report their quarterly earnings results on Tuesday Shares of Chinese companies including Alibaba TAL Education Group and Nio experienced unusual options activity and fell in Monday s trading after the Chinese government intensified its crackdown on the tech and for profit education sectors Price Action SPDR S amp P 500 ETF Trust shares closed almost 0 3 higher in Monday s trading at 441 02 but edged down less than 0 1 in the after hours session to 440 70 Tesla shares closed 2 2 higher in the regular trading session at 657 62 and further rose more than 1 in the after hours session to 664 30 Alibaba shares closed 7 1 lower in the regular trading session at 191 76 but rose 0 3 in the after hours session to 192 35 Read Next Rally Threatened As Amazon Denies Reports Fora
19,oslqmb,t2_11nen3,1627388365,/r/wallstreetbets/comments/oslqmb/finally_getting_out_of_robinhoodbroke_college/,1,Finally getting out of robinhood broke college student hoping fidelity will cover the fee till i get paid,
20,oslqw2,t2_9ywuebvd,1627388395,/r/wallstreetbets/comments/oslqw2/is_geo_ready_for_squeeze/,1,Is GEO ready for squeeze , removed 
21,oslrfb,t2_9ywuebvd,1627388453,/r/wallstreetbets/comments/oslrfb/is_geo_the_perfect_candidate_for_short_squeeze/,1,Is GEO the perfect candidate for short squeeze , removed 
22,oslscq,t2_9ywuebvd,1627388562,/r/wallstreetbets/comments/oslscq/is_geo_the_perfect_candidate_for_short_squeeze/,1,Is GEO the perfect candidate for short squeeze with P E of 5 and been bitten down for the last 5 years , removed 
23,oslt6n,t2_chkjlph4,1627388653,/r/wallstreetbets/comments/oslt6n/lets_go_exela/,1,Let s go EXELA ,
24,osltup,t2_54stuae7,1627388731,/r/wallstreetbets/comments/osltup/looking_for_some_advice/,1,Looking for some advice,So I m a fairly new trader and I ve been doing swing trading with my margin account because I m under the 25K equity required for day trading So I ve got a trading journal for the last month and I m generally winning about 70 of the time the problem is my wins are usually really small so any loss almost always offsets my winnings FRUSTRATING AS HELL I think it s also because I bought into some trading course which proved to be only help to a total newb like me and the guy who runs it posts his trades all the time His trades suck I don t know how the guy makes money like seriously it s bad So I just started shorting nearly everything this guy is promoting as being a good trade he s participating in and wouldn t you know it I m making money again More than I m losing too Why don t more people short the shit out of stocks I see hyped stocks that blow up with 50 growth overnight sometimes and my first thought is all the big wins are gone already why jump in when it s about to crash correct Is shorting part your typical approach I recently went all in on a couple of positions that didn t end up yielding much but I didn t lose either 
25,oslwbx,t2_a0b3itgc,1627389013,/r/wallstreetbets/comments/oslwbx/forget_baba_invest_in_a_company_like_wish/,1,Forget BABA Invest in a Company like WISH,
26,oslwl0,t2_a4gkus44,1627389038,/r/wallstreetbets/comments/oslwl0/imagine_if_keeping_a_crayon_in_your_wallet_might/,1,Imagine if keeping a crayon in your wallet might save your life what would it do to us that we are eating them everyday Probably we will get superpowers in a few years ,
27,oslxri,t2_69s9jv22,1627389167,/r/wallstreetbets/comments/oslxri/if_any_of_you_can_help_god_bless_you/,1,If Any of You Can Help God Bless You, removed 
28,oslymp,t2_8rmls,1627389268,/r/wallstreetbets/comments/oslymp/was_pleasantly_surprised_when_i_opened_my_account/,1,Was pleasantly surprised when I opened my account this morning,
29,oslzgo,t2_a0t7z2yv,1627389360,/r/wallstreetbets/comments/oslzgo/open_interest/,1,Open interest ,Do all broker show the open interest on options I used several brokers but don t know where to find it on any Do they all show it somewhere Or what broker do you use that definitely had is Tia
30,osm1e2,t2_7vz1uhvf,1627389568,/r/wallstreetbets/comments/osm1e2/fighting_the_fuckery_apecat_style/,1,Fighting the Fuckery ApeCat Style ,
31,osm2fc,t2_a1et1zhr,1627389678,/r/wallstreetbets/comments/osm2fc/lcid_lucid/,1, LCID LUCID , removed 
32,osm5lf,t2_317qxb66,1627390025,/r/wallstreetbets/comments/osm5lf/xela_high_volume/,1,XELA HIGH VOLUME, removed 
