,postid,author,created_utc,permalink,score,title,selftext
30,oong8u,t2_9f7bx7rl,1626864660,/r/wallstreetbets/comments/oong8u/wish_dd_the_sleeping_giant_and_potential_1020x/,1, WISH DD The sleeping giant and potential 10 20x multi bagger,Disclaimer I m an existing WISH app user and also a WISH investor My views may be biased and this is not financial advise in any way To start this off here are some of my favourite hate comments that I read about WISH and my thoughts 1 WISH sells cheap trash products I don t disagree with this I mean even if 2 genius level intellect professors consummate and have 10 kids one of them kids is bound to be not so bright I reckon With WISH we re now looking at over 800k merchants and hundreds of millions of products there are bound to be trashy stuff this is the same with Amazon same with Taobao 2 I don t invest in Chinese stocks Maybe this stupid ape mixed up WISH with another company We can actually Wiki this WISH is an American online e commerce platform based in San Francisco United States that facilitates transactions between sellers and buyers But they do have a very significant number of merchants from China this is the same with Amazon same with Taobao 3 WISH sells Chinese junk Similar to point 1 but will just like to bring us back to reality that made in China products are here to stay whether we like it or not I can t think of another country with a bigger population of people that works as hard fast or cheap China produce about almost everything from cars to smartphones tablets stupid plastic toys big city skyscrapers etc you name it Look around your home and you ll probably find something that s made in China Tesla cars Iphones and many more big brand names are also made in China 3 Scam You re going to wait months for something which may never come As a WISH user I m going to have to say that this is a myth WISH is not a scam and 2 5b revenues in 2020 projected 3 2b revenues in 2021 and over 100m monthly active users are facts If the product you want is not available it will be reflected as sold out When you place your purchase for an item which is available it will come from my personal experience Like most good e commerce platforms you ll be able to check your order status processed shipped arrival date etc via the WISH app If you want your items urgently you can pay more for WISH Express If you re like most WISH users that are buying not through a search query but instead from personalized browsing it s basically impulse buys and not need based you can probably wait for your items to arrive which lowers the cost base which is one of the main reasons for the impulse buys PRICE And no it won t take months WISH quotes me an estimated 2 3 weeks for my items to arrive and I usually get them before the actual projected arrival date 4 Goodluck with your imitation crap This comment reminds me of the time when I was studying as a kid my teacher used to say that copying from my classmates was wrong As an adult now I will like to share with her a quote from Oscar Wilde Imitation is the sincerest form of flattery that mediocrity can pay to greatness The next quote is from me In the business world no amount of copying is bad unless we re copying crap Why I m a happy user of WISH app For WISH users the satisfaction really comes from finding the gems which is also probably the main reason why the average time spent per user on WISH app are more than any other e commerce platforms unlike fucking a dead log it is just so much more interactive and fun shopping with WISH app Gems are basically good quality products with very cheap prices A recent gem I found from WISH was a soundbar for my gaming needs which costs 24 it s about half metre long and I m serious when I say the sound and bass is SOLID I would encourage anyone to just log into WISH app to discover the gems for yourself to truly understand what I m saying just search under WISH select and there are already tons of solid products which are cheap and good with many verified user reviews Just be warned Once you are a WISH user it all starts with WISH app prompting users to log in to the app with gamification flash sales etc And when you eventually do decide to see what they have to offer with no obligations of course The software prompts further discounts for immediate purchases adding in similar or complimentary product recommendations based on data and advanced algorithms it s like a dollar store on steroids Most users and especially existing users like myself with address payment details done make the purchases sooner rather than later and when we do we potentially buy in quantity because of the low prices In summary I strongly believe that WISH is a sleeping giant with tons of cash on hand in their balance sheet that is going to give the big boys in e commerce a good run for their money especially once they achieve the following 1 To have a fully comprehensive catalogue of products with different price ranges moving upstream to touch a wider demographic audience 2 Filling in the gaps for product categories which are lacking right now in WISH app such as grocery products that are used daily by average consumers that require routine replacement or replenishment such as food beverages and household products 3 Increased WISH user demographics that prioritize services products speed of delivery etc over savings this in turn potentially allows for rapid expansion on their logistics platform and also accelerated growth in logistics and transaction revenues 4 Establishing WISH as a global brand and in house WISH products WISH seems to be trending more than just a cool ticker it s also trending as a cool brand with items such as hoodies t shirts charging cables bags etc going for flash sales on their platform Back in the days who knew a tick mark with the word Nike would move on to become a global top selling brand Personally I love the cool simplicity of the WISH logo and their mission to bring affordable and entertaining mobile e commerce to consumers around the world including the underserved With over 300 000 WISH T shirts sold currently in my mind it hints the potentiality of what WISH might become in an internet world of social media trendings and smartphones 5 Tapping on Jacqueline Reses expertise and experience to accelerate their entry into payment and financial services which will further monetize their growing merchants and user base Imo their user base is likely to grow rapidly regardless of what haters are saying As a WISH user myself I can only say that my experience with WISH is just starting and it s worth referring my friends I believe this experience is not unique to me and that I m just one out of many users that loves my WISH app and the branding With over 100m monthly active users over 500m total WISH users over 3m of items sold daily most downloaded app globally for past 3 years we can t be getting it all wrong As the saying goes it only takes a spark to get a fire going 6 Expansion in WISH Local Merchant base WISH stores their inventory orders with WISH local merchants saving costs on storage and last mile delivery This also translates to reduction in time taken for delivery and further cost savings for consumers WISH local merchants get to increase their personal product sales through WISH inventory pick ups as it translates to increased customer footprint and potential sales opportunities Wish local Merchants can also tap on the millions of WISH users by advertising their products through the platform This business model seems underestimated and is a good alternative to Shopify It can potentially create a sustainable ecosystem and rapid revenue growth for WISH while offering a lifeline for brick and mortar retailers to succeed in an era of disruptive tech and innovation fast forwarded by the pandemic 
31,oonh5y,t2_bm6msko3,1626864770,/r/wallstreetbets/comments/oonh5y/anyone_like_nndm_or_jmia_as_short_squeeze/,1,Anyone like NNDM or JMIA as short squeeze candidates ,Prices at this range seem pretty attractive for both with ARK investments backing NNDM 3D printing tech JMIA the Amazon of Africa has been talked about as a future buy out candidate 
32,oonj93,t2_aacx4gj3,1626865033,/r/wallstreetbets/comments/oonj93/sndl_to_out_perform_rating_marijuana_stock_are/,1,SNDL to out perform rating Marijuana stock are now looking very promising for 2022 Holders and buyers of SNDL salute We are Playing Monopoly here In due time guys , removed 
33,oonjcm,t2_a61pmqfx,1626865046,/r/wallstreetbets/comments/oonjcm/push_amc/,1,Push AMC, removed 
34,oonkki,t2_gm6r3,1626865202,/r/wallstreetbets/comments/oonkki/looking_to_make_my_first_10_stocks_portfolio/,1,Looking to make my first 10 stocks portfolio without correlation with US NASDAQ ,Hey guys im looking for 10 Stocks actually 9 to make my first own stock portfolio I want to outperform my World ETF and want to get stock with no correlation with US NASDAQ because i own this as a sector ETF My first stock is a company stock i owned since 2019 KION GROUP Now im looking for 9 solid stocks Doesnt has to be a moonshot stock I just want to get different sectors and probably not US In general i wouldnt consider any meme stocks amp x200B What stocks would u recommend 
35,oonl49,t2_a61pmqfx,1626865237,/r/wallstreetbets/comments/oonl49/amc_push_who_joins/,1,AMC Push WHO joins , removed 
36,oonlrp,t2_96gmcoqj,1626865309,/r/wallstreetbets/comments/oonlrp/sofi/,1,SOFI,Cramer wants to buy at 14 but I say we don t let him hell I don t even know what Sofi does but I m balls deep They sell radiators 
37,oonm8r,t2_aapabbod,1626865369,/r/wallstreetbets/comments/oonm8r/tcan_check_out_the_link_very_promising/,1, TCAN Check out the link very promising https www newsfilecorp com release 90656 TransCanna Achieves Major Milestone Completes Phase 1 Construction at Daly Facility, removed 
38,oonn3i,t2_9we0enod,1626865476,/r/wallstreetbets/comments/oonn3i/the_ultimate_covid_play_pfe/,1,The Ultimate Covid Play PFE,Unless you re living in a bubble and only eating bananas like a good ape you should be aware that Covid is still fucking the world pretty hard Yes we don t have to wear masks in most states but the case count is rising again in the USA and Delta has really hit the rest of the world hard as well That crazy uncle of yours that keeps saying Covid is a scam is not going to get vaccinated and thus this asshole of a pandemic will continue to last and evolve So in comes Pfizer who has one of the top 2 most successful vaccines for covid and is the shot that everyone who is going to get one wants That Astra shot has a lot of problems and same with Johnson and Johnson Many countries are not using either of them U S never approved Astra Besides being one of the largest pharmaceutical companies making everything from Viagra to Lipitor they are partners with biontech in making their covid 19 vaccine Sales They sold 3 5 billion in Q1 2021 of the Covid 19 vaccine with an estimate of 26 billion for the whole year 2021 https www pharmaceutical technology com features pfizer covid 19 vaccine revenue Earnings Pfizer reports earnings in 7 28 Do you think covid has gotten better or worse since the last report Do you think it will last beyond 2021 or not Dividend For those that actually like money they just declared a dividend of 39 per share payable to those holding on July 30th So you can both gain from hopefully a good earnings report and the dividend This is not financial advice do your own research before investing But I ve gone big on PFE in for 1 000 shares amp x200B https preview redd it broqx23gsjc71 png width 1457 amp format png amp auto webp amp s fefd6ddf9522074f735ea2cce5428fe91694f2f4
39,oonnby,t2_a2hu4y79,1626865503,/r/wallstreetbets/comments/oonnby/hi_register_now_to_get_the_1288_usdc_free_trial/,1,Hi register now to get the 1288 USDC Free Trial in Matrixport Grow your wealth regardless of market volatility https invest matrixport com inviteRegister en invite code CFA997, removed 
40,oonnv8,t2_bcfbpo8r,1626865560,/r/wallstreetbets/comments/oonnv8/bit_coin_drops_below_30000_as_selloff_intensifies/,1,Bit coin drops below 30 000 as sell off intensifies dragging other cryptos down,
41,oonohp,t2_dfmawnsx,1626865640,/r/wallstreetbets/comments/oonohp/nakd/,1,NAKD, removed 
42,oonols,t2_8z4tcii1,1626865655,/r/wallstreetbets/comments/oonols/infrastructure_bill_is_in_danger/,1,Infrastructure bill is in danger ,
43,oonqbc,t2_2hkp8ck4,1626865857,/r/wallstreetbets/comments/oonqbc/if_we_live_in_the_digital_marketing_bubble/,1, IF we live in the Digital Marketing Bubble ,If online advertising is so awesome then why does Google pushes its paid YouTube subscriptions so hard Thesis Advertising doesn t work as advertised https freakonomics com podcast advertising part 1 https freakonomics com podcast advertising part 1 Digital Marketing is supposed to be an answer it s not It s worst https freakonomics com podcast advertising part 2 https freakonomics com podcast advertising part 2 TL DListen people below 60 yo don t click ads At all AI in advertising is better and better in reaching people who are already going to buy Optimizing conversions is like giving the restaurant flyers to people who are already waiting for a waiter There is reasonable evidence that advertising mostly works during the awareness phase Everybody kind of knew it but choose to ignore it because it s everybody s interest to pretend that it works analytic and advertising agencies are like rating agencies in a housing crisis their earnings are high if the budgets are high Most giant companies overpay for digital advertising and start to realize it advertising is the backbone of the free internet Once it pops most services stop being profitable Please note that this discussion is not about whether you believe it or not I subscribe to this almost 100 you don t have to Just humor me and think about it as a thought experiment This discussion is NOT about if it s true It s about how to prepare for it IF it s true I don t feel comfortable shorting FB or Alphabet I don t feel comfortable shorting anything I m mostly a passive investor But even if you put all your money in sp500 you re heavily weighted in FANG right SO the question of the day is if digital marketing and free internet collapse who will benefit from it What companies are expected to rise 
44,oonr3y,t2_tdllc,1626865954,/r/wallstreetbets/comments/oonr3y/avpt_17_pt_more_good_coverage_from_goldman_sachs/,1,AVPT 17 PT More good coverage from Goldman Sachs We re going to the moon ,
45,oonr5v,t2_dfmawnsx,1626865962,/r/wallstreetbets/comments/oonr5v/nakd/,1,NAKD , removed 
46,oonruo,t2_a61pmqfx,1626866049,/r/wallstreetbets/comments/oonruo/push_amc/,1,Push AMC, removed 
47,oonswv,t2_9xepy18h,1626866176,/r/wallstreetbets/comments/oonswv/hi_does_anyone_know_if_free_trade_25k_trade_limit/,1,Hi does anyone know if free trade 25k trade limit has been removed Or is that I m still in place , removed 
48,oont5k,t2_a2bbuj6b,1626866206,/r/wallstreetbets/comments/oont5k/if_amc_stock_isnt_worth_40_then_why_are_so_many/,1,If AMC stock isn t worth 40 then why are so many buying in at 45 50 Some of these you tubers saying price could hit 5000 a share , removed 
49,oontc6,t2_a1q2v0bh,1626866229,/r/wallstreetbets/comments/oontc6/qs_jp_morgan_initiates_coverage_on_quantumscape/,1, QS JP Morgan Initiates Coverage On QuantumScape with Neutral Rating Announces Price Target of 35,
50,oontkz,t2_sqg2z85,1626866254,/r/wallstreetbets/comments/oontkz/gme_perfect_cup_and_handle_we_are_ready_for_lift/,1, GME Perfect cup and handle We are ready for lift off ,
51,oontvt,t2_2ve5s69u,1626866287,/r/wallstreetbets/comments/oontvt/looks_like_the_turntables/,1,Looks like the turntables ,
52,oonuco,t2_9xepy18h,1626866343,/r/wallstreetbets/comments/oonuco/hi_does_anyone_know_if_free_trade_25k_trade_limit/,1,Hi does anyone know if free trade 25k trade limit has been removed Or is that I m still in place ,I ll be posting this on multiple communities to try and get an answer as this is an issue that could affect many UK apes I saw that the issue was brought about months ago but was I don t know if it ever got resolved and if it s still in place I would like some advice on what to do 
53,oonvxu,t2_9xepy18h,1626866529,/r/wallstreetbets/comments/oonvxu/does_anyone_know_if_the_25k_sell_limit_is_still/,1,Does anyone know if the 25k sell limit is still in place on free trade , removed 
54,oonwb5,t2_a1q2v0bh,1626866573,/r/wallstreetbets/comments/oonwb5/qs_jp_morgan_initiates_coverage_on_quantumscape/,1, QS JP Morgan Initiates Coverage On QuantumScape with Neutral Rating Announces Price Target of 35,
55,oonwi1,t2_9xepy18h,1626866594,/r/wallstreetbets/comments/oonwi1/hi_does_anyone_know_if_free_trade_25k_trade_limit/,1,Hi does anyone know if free trade 25k trade limit has been removed Or is that I m still in place , removed 
56,oonwxn,t2_a0etkk6m,1626866643,/r/wallstreetbets/comments/oonwxn/yolo/,1,YOLO,
57,oonxzl,t2_a0rfvsyl,1626866769,/r/wallstreetbets/comments/oonxzl/qubt/,1,QUBT, removed 
58,oonyb5,t2_939dnpcf,1626866806,/r/wallstreetbets/comments/oonyb5/news/,1,News,
59,ooo1fb,t2_37pjlpnv,1626867178,/r/wallstreetbets/comments/ooo1fb/amc_order_book/,1,AMC order book,So anyone else notice the sudden shift in the order book it keeps dropping From 44 to 42 something sus going on 
60,ooo2un,t2_a9zbes5s,1626867345,/r/wallstreetbets/comments/ooo2un/a_penny_stock_was_elected_meme_stock_voting_closed/,1, A PENNY STOCK WAS ELECTED MEME STOCK VOTING CLOSED , removed 
61,ooo3kg,t2_4wmyq5ei,1626867421,/r/wallstreetbets/comments/ooo3kg/thoughts_on_amc_advice/,1,Thoughts on AMC Advice, removed 
62,ooo443,t2_8ynofjzu,1626867485,/r/wallstreetbets/comments/ooo443/slv_time_to_teach_big_lesson_to/,1,SLV Time to TEACH BIG lesson to ,If you we all really want to make a STATEMENT buy SLV non stop We will be then in a different league as BANKS are heavily short in SLV 
63,ooo49q,t2_a7cpetnk,1626867505,/r/wallstreetbets/comments/ooo49q/bp_for_a_long_term_gain/,1,BP for a long term gain,Bp is down about 10 over the last month Still down about 40 since corona virus They pay a good dividend And they haven t even spilled any oil in the ocean for a while I don t think it s one that will sky rocket over night but I anticipate a 50 gain over the next year or two especially as high as oil is right now Not financial advise just an observation from someone with no clue how to invest 
64,ooo4bo,t2_14o6e7,1626867511,/r/wallstreetbets/comments/ooo4bo/gamblingcom_ipo_today/,1,Gambling com IPO Today, removed 
65,ooo5sv,t2_18vpmrhr,1626867685,/r/wallstreetbets/comments/ooo5sv/azz_play_vmi/,1, AZZ play amp VMI,VMI amp AZZ are in essentially the same space AZZ jumped from 52 to 57 at earnings a couple wks ago after AZZ crushed earnings https www nasdaq com articles azz q1 earnings revenues beat estimates fy22 eps view up 2021 07 12 amp has floated back down since I m expecting VMI to have equally good earnings amp outlook giving both VMI amp AZZ a boost tomorrow A little more about AZZ can be found in my original AZZ post https www reddit com r wallstreetbets comments ofibcv how azz play could fund your yacht TLDR Calls on VMI amp AZZ
66,ooo5zw,t2_dez3pdc4,1626867708,/r/wallstreetbets/comments/ooo5zw/interview_for_new_survey/,1,Interview for new survey, removed 
67,ooo6nt,t2_13c96aus,1626867787,/r/wallstreetbets/comments/ooo6nt/after_deep_analysis_i_have_found_the_breakdown/,1,After deep analysis I have found the breakdown for when the market will completely turn upside down Ignore me if you want but the I told you so is coming ,
68,ooo7q1,t2_bwb7hiyd,1626867910,/r/wallstreetbets/comments/ooo7q1/how_i_follow_my_120_amc_investment/,1,How I follow my 120 AMC investment ,
69,ooo8br,t2_tdllc,1626867979,/r/wallstreetbets/comments/ooo8br/avpt_17_pt_more_good_coverage_from_goldman_sachs/,1,AVPT 17 PT More good coverage from Goldman Sachs,
70,ooo8ct,t2_bw7kynik,1626867981,/r/wallstreetbets/comments/ooo8ct/its_good_to_laugh_sometimes_especially_at_the/,1,It s good to laugh sometimes especially at the market ,
71,ooo9bx,t2_a3ar0vz8,1626868095,/r/wallstreetbets/comments/ooo9bx/goooooo_amc/,1,Goooooo amc,
72,ooo9e7,t2_5vpchsgh,1626868103,/r/wallstreetbets/comments/ooo9e7/vienna_australia/,1,Vienna Australia ,
73,oooa7v,t2_1zbiqeym,1626868198,/r/wallstreetbets/comments/oooa7v/hey_im_a_tard/,1,Hey I m a tard, removed 
74,oooalk,t2_2chj84dc,1626868239,/r/wallstreetbets/comments/oooalk/avpts_jeff_epstein_jeff_bezos/,1,AVPT s Jeff Epstein gt Jeff Bezos,
75,oooanw,t2_bm3quzzw,1626868248,/r/wallstreetbets/comments/oooanw/beaten_down_i_realize_this_is_nothing_to_many/,1,Beaten down I realize this is nothing to many people To me it is the last of my hope,
76,oooazr,t2_101hi3m2,1626868284,/r/wallstreetbets/comments/oooazr/coo_likes_the_stonk/,1,COO likes the stonk ,
77,ooof19,t2_ntwk2,1626868744,/r/wallstreetbets/comments/ooof19/goldman_sachs_initiates_coverage_today_on/,1,Goldman Sachs Initiates Coverage Today On AvePoint Price Target of 17 ,
78,ooofav,t2_a12xv8e8,1626868777,/r/wallstreetbets/comments/ooofav/is_it_time_for_gamestop_to_change_its_name/,1,Is it time for Gamestop to change its name ,When I was a teen I would stop there to buy games and so the name was very descriptive of its co However I probably play more games now and I ve not been there in years Now you have nflx jumping into gaming and pton even doing some exercise gaming If gme is going to survive is gaming even the way Maybe change it to Playing Cards and Trinkets If your not holding 100 or more gain are you just incredibly embarrassed that you hold gme lol 
79,oooh7i,t2_a1ms4lae,1626868969,/r/wallstreetbets/comments/oooh7i/gtt_communications_gttn_tendies_magnet_or_going/,1,GTT Communications GTTN Tendies Magnet or Going to Zero ,Hey all Have had GTTN on the Small Caps list before it was on OTC some of the metrics look good whilst others are alarming But you cannot ignore that decline it s gone from 40 in 19 to 70c Is there Value here Or a whole bunch of Short Sellers Hedgies waiting for it to hit zero There s HIGH SHORT INTEREST 54M Total Shares outstanding 9 5M Short 18 20 Short Interest Let s see what s been going on Who are they GTT We are a global network provider that serves thousands of multinational and national enterprise government and carrier customers with a portfolio of advanced connectivity and security services Our leading SD WAN solutions enable digital business and help optimise the performance of SaaS and cloud based applications for business users across the world Predominately they service Banking and Healthcare clients two industries that are laggards when it comes to changing providers carriers of their sensitive traffic Company is still making money however there is substantial Debt amp apparently the former CEO was a monkey and hired fellow apes The famous Lynch amp Buffett quote comes to mind you want a business that s so simple it can be run by a monkey because one day it might be Sentiments from an Ex Employee Anyone that has worked with or for this company knew this was going to happen The former CEO was a pretentious ego centric joker as is much of the current leadership Their plan to grow through acquisition while doing NOTHING to create a homogenous company culture or looking for real synergies could not had any other outcome Shareholders Normally not in favor of lawsuits but this company needs to be sued 100 for what it did to shareholders last 2 weeks We have allowed the shares of the company to be delisted from the NYSE the share price to fall over 99 from the all time high and have used our omnipotent powers over all media sources to intentionally withhold any positive news about the future of the remaining business after the sale of infraco to continually drive the share price down Said no management team BoD ever Well it s too late to sell now might as well hold If it hits zero it hits zero This company is currently on the verge of Bankruptcy but some of the Board of Directors are holding that up and looking for a sale all the while the Short Interest is building Any thoughts from the community on GTTN Value Buy or Falling Knife 
80,ooohh1,t2_1zbiqeym,1626868998,/r/wallstreetbets/comments/ooohh1/9_grand_in_the_hole/,1,9 grand in the hole, removed 
81,ooohj4,t2_2mfi3p81,1626869003,/r/wallstreetbets/comments/ooohj4/ford_and_argo_ai_to_launch_selfdriving_cars_with/,1,Ford and Argo AI to launch self driving cars with Lyft by the end of the year,
82,ooolle,t2_69hjxkxv,1626869448,/r/wallstreetbets/comments/ooolle/ford_im_telling_you_ford_easily_making_it_to_15/,1,FORD IM TELLING YOU FORD Easily making it to 15 at some point this yea ,
83,ooongx,t2_ilegvay,1626869649,/r/wallstreetbets/comments/ooongx/after_i_lose_all_my_savings_on_fds_that_expired/,1,After I lose all my savings on FDs that expired worthless,
84,oooqcq,t2_7vast,1626869943,/r/wallstreetbets/comments/oooqcq/goldman_sachs_gives_avepoint_avpt_a_buy_rating/,1,Goldman Sachs Gives AvePoint AVPT a Buy Rating Price Target 17 Upside Potential of 70 ,
85,ooosdc,t2_jbi19,1626870161,/r/wallstreetbets/comments/ooosdc/amcs_adam_aron_retains_his_position_as_ceo_along/,1,AMC s Adam Aron retains his position as CEO along with newly being named Chairman of the Board Ambassador Philip Lader becomes Lead Director of the AMC Entertainment Board ,
86,oootc1,t2_dfknnorg,1626870262,/r/wallstreetbets/comments/oootc1/newbie_to_board/,1,Newbie to Board, removed 
87,ooov54,t2_ddvilhrk,1626870462,/r/wallstreetbets/comments/ooov54/ben/,1,Ben, removed 
88,ooowtq,t2_c3yma,1626870640,/r/wallstreetbets/comments/ooowtq/welcome_to_wsb/,1,Welcome to WSB,
