,postid,author,created_utc,permalink,score,title,selftext
0,ob9tso,t2_a555xa8q,1625097669,/r/wallstreetbets/comments/ob9tso/sos_short_interest/,1, sos short interest ,
1,ob9tws,t2_391roram,1625097680,/r/wallstreetbets/comments/ob9tws/is_20_price_pop_on_wish_unrealistic/,1,Is 20 price pop on WISH unrealistic , removed 
2,ob9u0q,t2_8adcyy9a,1625097690,/r/wallstreetbets/comments/ob9u0q/sp500_winners_and_losers_6302021/,1,SP500 Winners and Losers 6 30 2021, Winners Winner of the day by sector SP500 Sector Company Ticker Price Change 1 Industrials General Electric Company GE 2 79 2 Health Care Vertex Pharmaceuticals Incorporated VRTX 2 46 3 Information Technology Advanced Micro Devices Inc AMD 4 93 4 Communication Services Interpublic Group of Companies Inc IPG 2 23 5 Consumer Discretionary Gap Inc GPS 3 28 6 Utilities NRG Energy Inc NRG 1 40 7 Financials Goldman Sachs Group Inc GS 1 86 8 Materials CF Industries Holdings Inc CF 4 57 9 Real Estate Host Hotels and Resorts Inc HST 1 00 10 Consumer Staples SYSCO Corporation SYY 2 78 11 Energy Cabot Oil amp Gas Corporation COG 7 25 Losers Loser of the day by sector SP500 Sector Company Ticker Price Change 1 Industrials W W Grainger Inc GWW 2 30 2 Health Care Hologic Inc HOLX 3 09 3 Information Technology Paycom Software Inc PAYC 2 80 4 Communication Services Facebook Inc Common Stock FB 1 19 5 Consumer Discretionary PulteGroup Inc PHM 1 75 6 Utilities AES Corp AES 1 14 7 Financials MarketAxess Holdings Inc MKTX 1 81 8 Materials Ecolab Inc ECL 1 02 9 Real Estate Realty Income Corp O 1 77 10 Consumer Staples Molson Coors Beverage Co Class B TAP 1 41 11 Energy Occidental Petroleum Corporation OXY 0 10 
3,ob9u15,t2_a0hjlw4s,1625097691,/r/wallstreetbets/comments/ob9u15/husn_will_be_20_by_the_end_of_the_year/,1, HUSN will be 20 by the end of the year,
4,ob9u2p,t2_5b2hm5wq,1625097695,/r/wallstreetbets/comments/ob9u2p/dumb/,1,Dumb ,
5,ob9v7x,t2_1n4zxf8,1625097795,/r/wallstreetbets/comments/ob9v7x/uwm_book_value/,1,UWM book value, removed 
6,ob9vp6,t2_a555xa8q,1625097840,/r/wallstreetbets/comments/ob9vp6/sos_short_interest/,1, sos short interest ,
7,ob9vzl,t2_hfnoj,1625097866,/r/wallstreetbets/comments/ob9vzl/small_amd_scalp/,1,Small AMD scalp,
8,ob9w16,t2_c2zeqd7i,1625097870,/r/wallstreetbets/comments/ob9w16/robinhood_is_fined_70_million_over_misleading/,1,Rob in hood is fined 70 million over misleading customers and system outages ,
9,ob9w6d,t2_1n4zxf8,1625097884,/r/wallstreetbets/comments/ob9w6d/uwm_book_value_per_share/,1,UWM book value per share,Does anyone know why UWM s book value per share has tanked Last I checked it was around 20 and it s now barely 0 10 Since the bots told me my post couldn t be discussed due to a short post I ll ask it again Does anyone know why UWM s book value per share has tanked Last I checked it was around 20 and it s now barely 0 10 
10,ob9wk4,t2_4ia6aikw,1625097918,/r/wallstreetbets/comments/ob9wk4/some_apes_be_like/,1,Some apes be like ,
11,ob9wpw,t2_5b2hm5wq,1625097933,/r/wallstreetbets/comments/ob9wpw/dumb/,1,Dumb ,
12,ob9wuh,t2_1n4zxf8,1625097946,/r/wallstreetbets/comments/ob9wuh/uwm_book_value_per_share_drop/,1,UWM book value per share drop, removed 
13,ob9wyz,t2_11f4m0,1625097956,/r/wallstreetbets/comments/ob9wyz/i_tried_to_take_you_all_to_the_moon_with_me_but/,1,I tried to take you all to the moon with me but it was strictly a day for loss porn apparently ,
14,ob9xbs,t2_5ufu6wqh,1625097990,/r/wallstreetbets/comments/ob9xbs/this_is_not_a_full_dd_this_is_a_post_saying_do/,1,This is not a full DD This is a post saying do not ing buy Krispy Kreme stock this is a sunken ship ,It was taken private in 2016 at a valuation of 1 35Bil Tomorrow at IPO they are pricing shares at 17 for a valuation of 2 72 billion Really It s doubled in a 5 year period No It hasn t this is JAB holdings realizing they bought something they probably shouldn t have milked it for all it s worth and trying to scrap it for more then it paid for What are some RED FLAGS you might ask Take a look at the S 1 Of the last three fiscal years it s only lost money in the last three Said otherwise 100 of the time of the required amount they need to show they have lost money FY19 FY20 Organic revenue growth of 1 2 That won t even beat inflation On the bright side bottom line was negative They went from only losing 37 million in 2019 to losing 64 million in 2020 I didn t look to much more in depth at the S 1 to see the valuation even though below the 21 24 they initially were trying to get amp x200B Don t be a fool don t buy Krispy Kreme The fresh donuts are delicious but the stock is a no go amp x200B S 1 filing on SEC GOV https SEC GOV https www sec gov Archives edgar data 0001857154 000119312521177720 d107564ds1 htm rom107564 10 https www sec gov Archives edgar data 0001857154 000119312521177720 d107564ds1 htm rom107564 10 
15,ob9y8y,t2_a0hjlw4s,1625098081,/r/wallstreetbets/comments/ob9y8y/go_sofi_50_or_more/,1,Go SOFI 50 or more,
16,ob9z0a,t2_1n4zxf8,1625098155,/r/wallstreetbets/comments/ob9z0a/uwmc_dropped_book_value/,1,UWMC dropped book value, removed 
17,ob9z99,t2_cf4xm0my,1625098179,/r/wallstreetbets/comments/ob9z99/dont_sell_at_a_loss_or_break_even/,1,Don t sell at a loss or break even ,I ve seen this with Amc I entered Amc before they halted trading and I noticed many things throughout the 4 months it took to finally squeeze Hedgefunds know the total profited shares proportion the average entry that investors entered the trade Only 16 5 of holders are in the positive The average holder is at 18 4 Majority of holders are in at 20 DO NOT SELL You will notice huge rejections once s these targets get reached 15 18 22 If we just HOLD the pullback will not be as significant and it will encourage more retail investors to join Once we push passed 22 28 will be the next target This is JUST the beginning It might double top and drop to discourage people This is their tactics No one can truly give you a price target because no one knows what the future holds Amc had a market cap of 5bil in February Now it s 28bil If you add the same market cap to Clov which is very realistic and Clov share price is over 250 The upside is HUGE I invested 120k I m all in and truly convicted in this stock and the potential it truly has Goodluck to everyone I ll see y all on the moon
18,ob9zkd,t2_9yyda596,1625098210,/r/wallstreetbets/comments/ob9zkd/when_will_these_rise/,1,When will these rise ,
19,oba0mv,t2_a0hjlw4s,1625098314,/r/wallstreetbets/comments/oba0mv/wynn_time_to_take_off_gogogo/,1, WYNN time to take off gogogo,
20,oba0tm,t2_1n4zxf8,1625098334,/r/wallstreetbets/comments/oba0tm/uwmc_book_value_dropped/,1,UWMC book value dropped, removed 
21,oba1au,t2_12s2tt,1625098382,/r/wallstreetbets/comments/oba1au/dr_diamond_hands_is_still_holding_wish/,1,Dr diamond hands is still holding WISH,
22,oba1i5,t2_a28gsumy,1625098403,/r/wallstreetbets/comments/oba1i5/sos_to_the_moon/,1,SOS to the moon , removed 
23,oba1vt,t2_7t8xz2f6,1625098444,/r/wallstreetbets/comments/oba1vt/caturi/,1, CAT URI, removed 
24,oba21y,t2_1n4zxf8,1625098461,/r/wallstreetbets/comments/oba21y/uwm_shit_book_value_per_share/,1,UWM shit book value per share,Does anyone know why UWM s book value per share has tanked Last I checked it was around 20 and it s now barely 0 10 I m no guru so I m hoping someone can shed some light on this for me Also is anyone else investing in UWM Off Google UWM Holdings s current price is 9 17 Its book value per share for the quarter that ended in Mar 2021 was 0 07 Hence today s PB Ratio of UWM Holdings is 129 15 
25,oba2rw,t2_a28gsumy,1625098534,/r/wallstreetbets/comments/oba2rw/sos_to_the_moon_this_is_the_next_meme_stock_to/,1,SOS to the moon This is the next meme stock to invest in learned that this blockchain stock is going to have all big data on blockchain and is a great company , removed 
26,oba2to,t2_3et7tgh9,1625098538,/r/wallstreetbets/comments/oba2to/blanket_of_pestilence/,1,Blanket Of Pestilence,If this is your first time reading up on the STAR https finance yahoo com quote STAR p STAR position you can locate the original DD post HERE https www reddit com r wallstreetbets comments nwm1oe star constructive feedback appreciated No update on Friday I have some plumbing for my sisters place to do The next update will be Sunday night Hopefully before 8pm Only so many blankets to be had We are starting to see this action this week though it s not showing in the the price action yet STAR is still finding its support and has started to consolidate around 20 40 20 60 this week amp x200B Financial Disclosure I purchased an additional 50 July 16 20 calls during Monday dip Source Barchart com https preview redd it 7pd92zy4rh871 png width 1045 amp format png amp auto webp amp s a966d1defef4eab51e47e9b7136c641b06349313 amp x200B On Monday Ortex data showed a net 253k new shorts added into the market However on Tuesday we saw a net 133k shorts covered You can see the data below amp x200B amp x200B Source Ortex com https preview redd it 2tpjy91crh871 png width 1010 amp format png amp auto webp amp s 0ed051bd70d1a733f9fbb51005f9fa51e089513a The data for Wednesday is still neutral overall However not all data has been submitted as of this moment Source Ortex com Preliminary Data https preview redd it u2cdi2aerh871 png width 387 amp format png amp auto webp amp s e57b95e5657eba84bb3912aa9dde1787ae6bc218 amp x200B Source Ortex com https preview redd it ngw08e1krh871 png width 434 amp format png amp auto webp amp s c4c0256c4daaf122195790ce00d6f61fe816480d amp x200B The most interesting thing that happened this week thus far was Tuesday after market As you can see in the screengrab below There was a single purchase of 950k shares Now this could be a large cover of a short position or an investment firm increasing or starting their position on STAR We should find out by end of week from the data if nearly 1 million shares are returned amp x200B amp x200B Source nasdaq com https preview redd it lc7rwvjdsh871 png width 801 amp format png amp auto webp amp s b60b00de3d744224d9f08f9d222673ebfe981139 Today marks the end of the 2nd quarter for Mutual Funds Now they generally submit data within 30 days to regulators However their websites get updates even before I will be keeping an eye on them for updates to gain insight on how much they have increased their holdings 
27,oba3ag,t2_a4shgwoi,1625098587,/r/wallstreetbets/comments/oba3ag/the_true_apes/,1,The True Apes,
28,oba3vv,t2_2v4d8jlw,1625098649,/r/wallstreetbets/comments/oba3vv/evgo_clii_merger_approved_current_short_volume/,1,EVGO CLII merger approved Current short volume ratio 40 Ready for breakout regards To the ,
29,oba49e,t2_d0b8uez8,1625098686,/r/wallstreetbets/comments/oba49e/dont_misunderstand_didi_as_ddl/,1,Don t misunderstand DIDI as DDL, removed 
30,oba52t,t2_2v4d8jlw,1625098772,/r/wallstreetbets/comments/oba52t/evgo_clii_short_volume_ratio_over_40_ready_for/,1,EVGO CLII short volume ratio over 40 Ready for Yolo retards To the ,
31,oba5vf,t2_y3lbu,1625098842,/r/wallstreetbets/comments/oba5vf/repost_kushco_kshb_apparently_michael_burry_is/,1,Repost Kushco KSHB Apparently Michael Burry is pumping a cannabis penny stock with coded tweets , removed 
32,oba5x1,t2_cntd9fcc,1625098845,/r/wallstreetbets/comments/oba5x1/a_new_kinda_faang_penis/,1,A New kinda FAANG PENIS,We are probably all aware now that FAANG is the holy grail for all the retards who don t want to do any DD and just make money off a bunch of cute letters FAANG this FAANG that Yeah yeah yeah For the noobs and or people who inhabit a basement in Pawtucket RI FAANG simply stands for Facebook Apple Amazon Netflix Google aka lots of gains if you were an alpha brain and invested in these a long time ago https www etftrends com advisor solutions channel 5k faang 5 years ago worth today https www etftrends com advisor solutions channel 5k faang 5 years ago worth today But Apple is super boomer boring same with amazon same with google same with netflix FB kinda fucks though idk Anyways this shit is kinda pass I think it s time for a new catchy 5 stock bucket buzzword bingo One that gets you hard One that drips with excitement One that s smaller than the rest Introducing PENIS Penis it s a new kinda FAANG If this joint catches on we might see the biggest FAANG shill Cramer shrieking about it on Mad Money amp x200B https i redd it 5zuoyefm3h871 gif Meat and Potatoes So PENIS what is it It s quite simple P PLTR Palantir E ETSY Etsy N NVDA Nvidia I INTU Intuit S SE Sea Limited amp x200B Quick DD P Palantir see below The Big data hot shots Peter Thiel is the puppet master Cathie lovey dovey with it kinda i think she sold some E Etsy Le Grand Hipster hotel Where am I supposed to get my ornamental gourds that blend with my rugged chic carpet from Without them I am lost N Nvidia An AI play Dr Leather BDSM man Jensen Huang piloting the ship Kinda high price but so is alotta nice shiny stuff I Intuit Honestly just wanted to get an I in here but INTU is kinda legit Without Intuit its just PENS but we want Cramer to say PENIS one day so we gotta get that I in Was thinking about putting IZEA here but that shit is cringe so take Intuit or leave it S Sea Limited Big Singaporean e comm joint Shit just goes up I been following it since its debut and haven t been disappointed once amp x200B Depending on your style you can throw in PTON PINS SQ for the P and S Lots of options here to play with amp x200B The jizzt er gist of the 5 plays here is founder led firms That s kinda it Founder led PENIS firms Spread your legs and put 20 20 20 20 20 into PENIS Won t dissapoint 
33,oba6th,t2_a0xrmdcn,1625098936,/r/wallstreetbets/comments/oba6th/faca_sharecare_ipo_on_friday_remark_holding_owns/,1,Faca sharecare ipo on friday remark holding owns 4 5 stake of sharecare lets go guys Take this to the moon , removed 
34,oba78m,t2_a15shhu5,1625098977,/r/wallstreetbets/comments/oba78m/spce_after_been_12k_gain_monday_i_chose_to_keep/,1,SPCE after been 12k gain Monday I chose to keep the options until expiration day Today s news after market closed tells me I did the right thing ,
35,oba7qg,t2_3oiszjw1,1625099025,/r/wallstreetbets/comments/oba7qg/krispy_kreme_dnut_ipo_dd_in_rap_form_for_you/,1,Krispy Kreme DNUT IPO DD in rap form for you smooth brain apes,
36,oba7yh,t2_a0hjlw4s,1625099047,/r/wallstreetbets/comments/oba7yh/wkhs_at_least_30_target_at_50/,1, WKHS at least 30 target at 50,
37,oba875,t2_a0e4lle7,1625099071,/r/wallstreetbets/comments/oba875/deep_breaths_built_it_with_lucky_decisions_so_far/,1,Deep Breaths built it with lucky decisions so far let s hope Diamond hands get me Lambo wheels ,
38,oba8m1,t2_2v4d8jlw,1625099111,/r/wallstreetbets/comments/oba8m1/evgo_clii_short_volume_ratio_over_40_merger/,1,EVGO CLII short volume ratio over 40 Merger approved Ticker change on Friday Ready for breakout To the ,
39,oba9sj,t2_5drc2a7e,1625099228,/r/wallstreetbets/comments/oba9sj/lovely_day_at_the_casino_wish/,1,lovely day at the casino WISH,
40,obaa08,t2_6z6ngfxn,1625099250,/r/wallstreetbets/comments/obaa08/grove_can_someone_say_something_on_this_i_mean_it/,1,Grove Can someone say something on this I mean it should be 9 76 right now at least What happened , removed 
41,obaa5d,t2_cntd9fcc,1625099267,/r/wallstreetbets/comments/obaa5d/a_new_kind_of_faang_penis/,1,A new kind of FAANG PENIS, We are probably all aware now that FAANG is the holy grail for all the retards who don t want to do any DD and just make money off a bunch of cute letters FAANG this FAANG that Yeah yeah yeah For the noobs and or people who inhabit a basement in Pawtucket RI FAANG simply stands for Facebook Apple Amazon Netflix Google aka lots of gains if you were an alpha brain and invested in these a long time ago https www etftrends com advisor solutions channel 5k faang 5 years ago worth today https www etftrends com advisor solutions channel 5k faang 5 years ago worth today But Apple is super boomer boring same with amazon same with google same with netflix FB kinda fucks though idk Anyways this shit is kinda pass I think it s time for a new catchy 5 stock bucket buzzword bingo One that gets you hard One that drips with excitement One that s smaller than the rest Introducing PENIS Penis it s a new kinda FAANG If this joint catches on we might see the biggest FAANG shill Cramer shrieking about it on Mad Money amp x200B https i redd it 39k7z58wwh871 gif Meat and Potatoes So PENIS what is it It s quite simple P PLTR Palantir E ETSY Etsy N NVDA Nvidia I INTU Intuit S SE Sea Limited Quick DD P Palantir see below The Big data hot shots Peter Thiel is the puppet master Cathie lovey dovey with it kinda i think she sold some E Etsy Le Grand Hipster hotel Where am I supposed to get my ornamental gourds that blend with my rugged chic carpet from Without them I am lost N Nvidia An AI play Dr Leather BDSM man Jensen Huang piloting the ship Kinda high price but so is alotta nice shiny stuff I Intuit Honestly just wanted to get an I in here but INTU is kinda legit Without Intuit its just PENS but we want Cramer to say PENIS one day so we gotta get that I in Was thinking about putting TikTok shit stok here but that shit is cringe so take Intuit or leave it S Sea Limited Big Singaporean e comm joint Shit just goes up I been following it since its debut and haven t been disappointed once Depending on your style you can throw in PTON PINS SQ for the P and S Lots of options here to play with The jizzt er gist of the 5 plays here is founder led firms That s kinda it Founder led PENIS firms Spread your legs and put 20 20 20 20 20 into PENIS Won t dissapoint 
42,obaa9m,t2_9zrhmxhm,1625099280,/r/wallstreetbets/comments/obaa9m/what_happens_with_amc/,1,What happens with AMC , removed 
43,obaaya,t2_7aztuylt,1625099350,/r/wallstreetbets/comments/obaaya/grom/,1,GROM, removed 
44,obac6b,t2_cnjb5dyz,1625099471,/r/wallstreetbets/comments/obac6b/ummmmwe_are_in_july_now_tax_returns_are_already/,1,Ummmm we are in July now Tax returns are already delayed I m getting stimulus before returns Something is wrong ,
45,obacnr,t2_a0xrmdcn,1625099522,/r/wallstreetbets/comments/obacnr/sharecare_ipo_is_coming_out_this_friday_still_a/,1,Sharecare ipo is coming out this friday still a good buy at 9 50 fcac Remark holding own 4 5 stake of the company still a great entry at 1 85 Im not a financial advisor just like the stock Lets go apes ,
46,obacrc,t2_cntd9fcc,1625099534,/r/wallstreetbets/comments/obacrc/a_new_kind_of_faang_penis/,1,A new kind of FAANG PENIS, Foreward Hey mods Grow a sack People are sick of fucking squeeze stonks you fucking morons Let this ride People love PENIS We are probably all aware now that FAANG is the holy grail for all the retards who don t want to do any DD and just make money off a bunch of cute letters FAANG this FAANG that Yeah yeah yeah For the noobs and or people who inhabit a basement in Pawtucket RI FAANG simply stands for Facebook Apple Amazon Netflix Google aka lots of gains if you were an alpha brain and invested in these a long time ago https www etftrends com advisor solutions channel 5k faang 5 years ago worth today https www etftrends com advisor solutions channel 5k faang 5 years ago worth today But Apple is super boomer boring same with amazon same with google same with netflix FB kinda fucks though idk Anyways this shit is kinda pass I think it s time for a new catchy 5 stock bucket buzzword bingo One that gets you hard One that drips with excitement One that s smaller than the rest Introducing PENIS Penis it s a new kinda FAANG If this joint catches on we might see the biggest FAANG shill Cramer shrieking about it on Mad Money amp x200B https i redd it vizebyxnxh871 gif Meat and Potatoes So PENIS what is it It s quite simple P PLTR Palantir E ETSY Etsy N NVDA Nvidia I INTU Intuit S SE Sea Limited Quick DD P Palantir see below The Big data hot shots Peter Thiel is the puppet master Cathie lovey dovey with it kinda i think she sold some E Etsy Le Grand Hipster hotel Where am I supposed to get my ornamental gourds that blend with my rugged chic carpet from Without them I am lost N Nvidia An AI play Dr Leather BDSM man Jensen Huang piloting the ship Kinda high price but so is alotta nice shiny stuff I Intuit Honestly just wanted to get an I in here but INTU is kinda legit Without Intuit its just PENS but we want Cramer to say PENIS one day so we gotta get that I in Was thinking about putting TikTok shit stok here but that shit is cringe so take Intuit or leave it S Sea Limited Big Singaporean e comm joint Shit just goes up I been following it since its debut and haven t been disappointed once Depending on your style you can throw in PTON PINS SQ for the P and S Lots of options here to play with The jizzt er gist of the 5 plays here is founder led firms That s kinda it Founder led PENIS firms Spread your legs and put 20 20 20 20 20 into PENIS Won t dissapoint 
47,obaeci,t2_sfmn7vh,1625099693,/r/wallstreetbets/comments/obaeci/cmon_just_a_few_shares_man/,1,Cmon just a few shares man ,
48,obaef8,t2_bfcdgs48,1625099702,/r/wallstreetbets/comments/obaef8/my_name_is_creamychickencock_and_i_yolo_at_peaks/,1,My name is CreamyChickenCock and I yolo at peaks,
49,obaepv,t2_a1nlo4ew,1625099732,/r/wallstreetbets/comments/obaepv/i_dont_know_who_needs_to_here_this_but_stop/,1,I don t know who needs to here this but stop buying IPOs,Look I get it when a company goes public that you really like or want to invest in you think to yourself I must buy right away as this is going to moon Reality it never does IPO typically come out with absurd evaluations use COIN or the now talked about Krispy Kream as an example I don t have all of the data I m sure an ape has provided that here at some point but stop buying into fucking IPOs and losing your money Personal advice you like a stock that s about to go public Wait a couple weeks or even months before you make an investment to see where the floor is because you know it ll tank Unless the IPO that s going public has just cured aids or cancer and is FDA approved or some shit stop buying IPOs when they first go public I don t know this is just how I feel about IPOs what about you eaters 
50,obaeuk,t2_a35q4kfa,1625099745,/r/wallstreetbets/comments/obaeuk/nio_to_600/,1,NIO to 600, removed 
51,obafr9,t2_tj8fp,1625099833,/r/wallstreetbets/comments/obafr9/its_always_priced_in/,1,It s always priced in ,
52,obafud,t2_9snyobm5,1625099842,/r/wallstreetbets/comments/obafud/robinhood_to_pay_70_million_for_outages_and/,1,Robinhood to pay 70 million for outages and misleading customers the largest ever FINRA penalty, https www cnbc com 2021 06 30 robinhood to pay 70 million for misleading customers and outages the largest finra penalty ever html https www cnbc com 2021 06 30 robinhood to pay 70 million for misleading customers and outages the largest finra penalty ever html 
53,obagiv,t2_3zjfxaag,1625099916,/r/wallstreetbets/comments/obagiv/bb/,1, BB ,I ve been buying BB dips for cheaper and cheaper for about a week so far Those who laughed at my AMC and GME buys are asking me how to invest now I wasn t wrong yet so hopefully I m not wrong now Thoughs 
54,obahpm,t2_9snyobm5,1625100039,/r/wallstreetbets/comments/obahpm/robinhood_will_have_to_pay_70m_for_misleading/,1,Robinhood will have to pay 70M for misleading customers during March outages, removed 
55,obahxv,t2_aqv8v8js,1625100063,/r/wallstreetbets/comments/obahxv/happiness_biotech_enters_the_electric_car_markets/,1,Happiness biotech enters the electric car markets,
56,obahz1,t2_cntd9fcc,1625100065,/r/wallstreetbets/comments/obahz1/a_new_kind_of_faang_penis/,1,A New Kind of FAANG PENIS, We are all aware now that FAANG is the holy grail for all the retards who don t want to do any DD It s truly retard DD for those who wanna just make money off a bunch of cute letters FAANG this FAANG that Yeah yeah yeah THE OG DD For those noobs and or people who inhabit a basement in Pawtucket RI FAANG stands for Facebook Apple Amazon Netflix Google aka lots of gains if you were an alpha brain and invested in these a long time ago https www etftrends com advisor solutions channel 5k faang 5 years ago worth today https www etftrends com advisor solutions channel 5k faang 5 years ago worth today Bleh Apple is super boomer boring sidewise flat shit same with amazon same with google same with netflix FB kinda zuckfucks sometimes though tbh but STILL this shit is kinda pass and for the birds I think it s time for a new catchy 5 stock bucket buzzword bingo game One that gets you hard One that drips with excitement One that s smaller than the rest Introducing PENIS Penis it s a new kinda FAANG If this joint catches on we might see the biggest FAANG shill Cramer shrieking about it on Mad Money Meat and Potatoes So PENIS what is it It s quite simple P PLTR Palantir E ETSY Etsy N NVDA Nvidia I INTU Intuit S SE Sea Limited Quick DD P Palantir see below The Big data hot shots Peter Thiel is the puppet master Cathie lovey dovey with it kinda i think she sold some E Etsy Le Grand Hipster hotel Where am I supposed to get my ornamental gourds that blend with my rugged chic carpet from Without them I am lost N Nvidia An AI play Dr Leather BDSM man Jensen Huang piloting the ship Kinda high price but so is alotta nice shiny stuff I Intuit Honestly just wanted to get an I in here but INTU is kinda legit Without Intuit its just PENS but we want Cramer to say PENIS one day so we gotta get that I in Was thinking about putting TikTok shit stok here but that shit is cringe so take Intuit or leave it S Sea Limited Big Singaporean e comm joint Shit just goes up I been following it since its debut and haven t been disappointed once Depending on your style you can throw in PTON PINS SQ for the P and S Lots of options here to play with The jizzt er gist of the 5 plays here is founder led firms That s kinda it Founder led PENIS firms Spread your legs and put 20 20 20 20 20 into PENIS Won t dissapoint 
