,postid,author,created_utc,permalink,score,title,selftext
92,octac6,t2_1zn5jf9,1625297129,/r/wallstreetbets/comments/octac6/gray_easy_pictures_dd_massive_potential_small/,1, GRAY easy pictures DD Massive potential Small float amp insiders buying Almost as much cash on balance sheet as the current value of the equity Enough cash till 22,
93,octb18,t2_tgigcz0,1625297225,/r/wallstreetbets/comments/octb18/ah/,1,Ah ,
94,octb1s,t2_d2ybx8ww,1625297227,/r/wallstreetbets/comments/octb1s/buy_duolingo/,1,Buy Duolingo, removed 
95,octbc6,t2_1zn5jf9,1625297269,/r/wallstreetbets/comments/octbc6/gray_potential_small_float_insiders_buying_at/,1, GRAY potential Small float Insiders buying at current levels Enough cash on hand till 22 Cash on hand is close to the value of the current equity,
96,octbxt,t2_a1mjku5s,1625297354,/r/wallstreetbets/comments/octbxt/varta_kick_off_57_12_uhr_6_am/,1,Varta Kick Off 5 7 12 Uhr 6 am,
97,octcaa,t2_8mjo38ns,1625297401,/r/wallstreetbets/comments/octcaa/wisdom/,1,Wisdom,
98,octe11,t2_77lopzva,1625297646,/r/wallstreetbets/comments/octe11/just_launched_micro_cap_gem_legion_lp_locked_200/,1,Just Launched Micro Cap Gem LEGION LP Locked 200 Months Dev Active in Telegram 120 Market Cap Let s Goooooo, removed 
99,octeor,t2_c5v1jdrj,1625297741,/r/wallstreetbets/comments/octeor/spce/,1,SPCE,Hello There Virgin Galactic SPCE will launch Richard Branson to space on July 11 aiming to beat Jeff Bezos For those who don t know Richard Branson is the Virgin Galactic s founder and the famous business magnate He is the main competitor of Jeff Bezos the ex CEO of Amazon the founder of another space company Blue Origin Both men are trying to be the one who will fly to space first If Virgin Galactic wins this race its stock price will skyrocket Why should you buy SPCE Virgin Galactic SPCE is probably one of those companies that have a huge potential to grow Some analysts believe it may increase its current value 10 times Why The company is engaged in one of the most promising industries of the future space tourism Investing in space stocks today is the same thing as investing in internet stocks back in the 1990s Think about it On June 25 Virgin Galactic claimed that the Federal Aviation Administration gave the company a license to fly passengers on future spaceflights and Virgin will start sending paying passengers to the space starting from 2022 Virgin Galactic has dropped below 44 00 after hitting the high of 57 50 However don t be misguided the news came out when the stock market was closed It will open at 16 30 GMT 3 Thus the price is likely to open with a gap up The breakout above 50 00 will push the stock to the next round number of 55 00 and then to 60 00 However today the volatility will be quite high and the prices may go back and forth The company has a waiting list over 800 customer and Branson will announce some big news on 11 July to make the Space open for everyone I literally think this is the next TSLA and we are going to control the space travel industry So come and join us Source of stock information and analysis is FBS 
0,octeor,t2_c5v1jdrj,1625297741,/r/wallstreetbets/comments/octeor/spce/,1,SPCE,Hello There Virgin Galactic SPCE will launch Richard Branson to space on July 11 aiming to beat Jeff Bezos For those who don t know Richard Branson is the Virgin Galactic s founder and the famous business magnate He is the main competitor of Jeff Bezos the ex CEO of Amazon the founder of another space company Blue Origin Both men are trying to be the one who will fly to space first If Virgin Galactic wins this race its stock price will skyrocket Why should you buy SPCE Virgin Galactic SPCE is probably one of those companies that have a huge potential to grow Some analysts believe it may increase its current value 10 times Why The company is engaged in one of the most promising industries of the future space tourism Investing in space stocks today is the same thing as investing in internet stocks back in the 1990s Think about it On June 25 Virgin Galactic claimed that the Federal Aviation Administration gave the company a license to fly passengers on future spaceflights and Virgin will start sending paying passengers to the space starting from 2022 Virgin Galactic has dropped below 44 00 after hitting the high of 57 50 However don t be misguided the news came out when the stock market was closed It will open at 16 30 GMT 3 Thus the price is likely to open with a gap up The breakout above 50 00 will push the stock to the next round number of 55 00 and then to 60 00 However today the volatility will be quite high and the prices may go back and forth The company has a waiting list over 800 customer and Branson will announce some big news on 11 July to make the Space open for everyone I literally think this is the next TSLA and we are going to control the space travel industry So come and join us Source of stock information and analysis is FBS 
1,octg2n,t2_c1ta74rg,1625297931,/r/wallstreetbets/comments/octg2n/if_all_the_worlds_billionaires_are_on_one_side/,1,If all the world s billionaires are on one side and all the retail investors on other who would lose more money , removed 
2,octlp9,t2_1tdtx4mv,1625298733,/r/wallstreetbets/comments/octlp9/raconafrica_short_sellers_put_out_false_dd/,1,RACONAFRICA SHORT SELLERS PUT OUT FALSE DD , amp x200B This will look familiar to you apes Short sellers killing a decent company Now my brain is very smooth and I eat crayons all day I am also the laziest ape on here so I m posting this link to the article in the hope that an ape with at least one wrinkle will do some DD on this ots small market cap company so WSB could fuck these hedgies good I think The link https www energyvoice com oilandgas africa ep africa 333889 viceroy short reconafrica investors utm source Sailthru amp utm medium email amp utm campaign EV 20Saturday 20Personalised 20Round 20Up 202021 07 03 amp utm term Energy 20Voice 20 20Newsletter https www energyvoice com oilandgas africa ep africa 333889 viceroy short reconafrica investors utm source Sailthru amp utm medium email amp utm campaign EV 20Saturday 20Personalised 20Round 20Up 202021 07 03 amp utm term Energy 20Voice 20 20Newsletter IM JUST A LAZY CRAYON EATING RETARD 
3,octqv5,t2_5uepgv3x,1625299437,/r/wallstreetbets/comments/octqv5/sentinel_one/,1,Sentinel One, removed 
4,octrw0,t2_4hbq7v1f,1625299581,/r/wallstreetbets/comments/octrw0/created_designs_for_investors/,1,Created Designs for Investors,
5,octylw,t2_1qmqbdcs,1625300468,/r/wallstreetbets/comments/octylw/bruh/,1,Bruh,
6,octywt,t2_88tr7db6,1625300510,/r/wallstreetbets/comments/octywt/how_do_you_find_where_the_short_squeez_started_on/,1,How do you find where the short squeez started on wallstreetbets ,Hey everyone I m new here I will put it simple 23rd of June MARIN SOFTARE MRIN started its path to the moon apparently thanks to chats on this subreddit Now I m curious about the first messages someone posted on the subreddit about MRIN but I can not find anything from those dates between 23rd june and 25th for example I would I find the first key thread were someone said something about this so that it went to the moon afterwards Thanks everybody 
7,ocu15c,t2_43cwegs8,1625300807,/r/wallstreetbets/comments/ocu15c/facebook_and_blackberry_may_be_negotiating_a_2/,1,Facebook and Blackberry may be negotiating a 2 billion patent sale and a partnership WhatsApp Messenger Blackberry Secure SecuSmart enabled for Enterprise ,Blackberry filed a lawsuit against Facebook for Patent Infringement Technology in WhatsApp Messenger appearntly is Blackberry s tech and Facebook wasn t paying any licensing fees to Blackberry Both parties settled out of count Blackberry got a judgement against Facebook and a judge in Germany ordered a hault on WhatsApp use of BB technology which could have affected nearly 80 million users Only the patent settlement Facebook and Blackberry reached out of court recently turned into a patent sale With a large upfront payment and 7 years of IP licensing tail John Chen CEO said in March that BB is entered into patent sale negotiation with North America based tech co and can t disclose more I strongly believe that BB and FB age negotiating not only patent sale but also a partnership agreement Blackberry will secure WhatsApp Messenger for Enterprise Blackberry gets free advertising on FB Instagram Patent payout upfront 600 million plus 1 4 billion over seven years in IP licensing Facebook wants to get in on the action and partner with Blackberry After all it s Blackberry who invented the smart phone and the instant messenger Judges lawyers and political figures were using Secure Messenger BNM well before anyone else They were first to market in smart phones and BBM Mark Zuckerberg was living in the college dorm even Blackberry enterprise customers were already using BBM and it s only fair that Blackberry finally gets fair compensation for their innovative technology John Chen when asked about three patent sale he said stay tuned He meant there is very good news coming soon Don t sell your shares Hold
8,ocu3fu,t2_cd2psvl3,1625301116,/r/wallstreetbets/comments/ocu3fu/reliance_to_build_megacity_in_mumbai_region_with/,1,Reliance to build megacity in Mumbai region with 75 billion investment,
9,ocu4qp,t2_4j1w1zgh,1625301291,/r/wallstreetbets/comments/ocu4qp/logistics_transportation_and_shipping_the_next/,1,Logistics transportation and shipping The next sector with potential ,With the short supply and growing demand the shipping and transportation channels are somewhat limited due to logistics Once those channels open up and all back orders begin to be filled I have to think this sector will do quite well I don t think it s price in yet I have my eye on a couple stocks including CHRW CVLG MATX ARCB HUNB I don t have time to do a full DD but just wanted to bring this sector up for discussion and hear some different perspectives Are you watching this sector and do you also think there is massive potential for growth beginning now and going for quite some timers Note I am not holding any of the stocks mentioned 
10,ocu4uh,t2_a1w5usdr,1625301304,/r/wallstreetbets/comments/ocu4uh/the_best_part_of_my_amc_stock_journey/,1,The best part of my AMC stock journey,
11,ocu5ky,t2_1yzg8j0w,1625301404,/r/wallstreetbets/comments/ocu5ky/isee_is_worth_way_more_in_the_short_term_then/,1,ISEE is worth way more in the short term then long term ,If we are talking about the forecast The max is 15 00 But the insane growth now indicates that thousands upon thousands of people have seen and are now contemplating to buy isee I m thinking some where between 15 and 20 dollars then a sharp decline to around 10 to 9 dollars and maybe another sharp uptick in a couple months it happens to a lot of meme stocks Does some one know a soft ware which allows the user to pick up analytical data on stocks mentioned across the internet What do you guys think I would really like to hear some input 
12,ocu87r,t2_a1tl0l8k,1625301763,/r/wallstreetbets/comments/ocu87r/gme_80k_yolo_hodling_strong_in_australia_see_2nd/,1,GME 80K YOLO HODLING STRONG IN AUSTRALIA see 2nd screenshot,
13,ocuc4s,t2_7kzgxd42,1625302309,/r/wallstreetbets/comments/ocuc4s/i_sure_know_how_to_pick_them_fk_yolo_threads/,1,I sure know how to pick them F k yolo threads,
14,ocufd9,t2_c77zf1vr,1625302773,/r/wallstreetbets/comments/ocufd9/for_making_online_journey_easy_join_hostinger/,1,For making online journey easy join hostinger,
15,ocufr5,t2_6hf2z55l,1625302813,/r/wallstreetbets/comments/ocufr5/fraternal_association_of_gambling_gentlemen_and/,1,Fraternal Association of Gambling Gentlemen and Yacht Degenerates for July 03 2021,Hopefully the bot fills this in Act like you didn t see it Check out our Discord https discord gg wallstreetbets 
16,oculuh,t2_a03ybs87,1625303639,/r/wallstreetbets/comments/oculuh/strong_earnings_create_squeezes/,1,Strong Earnings create Squeezes,Watch a movie at AMC and buy something at GameStop After an increase in earnings the stock rockets and a Squeeze occurs Look at past Earnings history 
17,ocunvo,t2_ade5g,1625303901,/r/wallstreetbets/comments/ocunvo/we_have_all_done_this_before/,1,We Have All Done This Before, removed 
18,ocupao,t2_ade5g,1625304094,/r/wallstreetbets/comments/ocupao/we_have_all_done_this_before_havent_we/,1,We Have All Done This Before Haven t We ,
19,ocurov,t2_a7xm05io,1625304424,/r/wallstreetbets/comments/ocurov/to_the_moon_in_dog_years/,1,To the MOON in dog years ,
20,ocurwi,t2_434mkf8q,1625304452,/r/wallstreetbets/comments/ocurwi/clf_all_in_hope_to_get_a_flair/,1, CLF All In Hope to get a flair ,
21,ocuugz,t2_434mkf8q,1625304793,/r/wallstreetbets/comments/ocuugz/clf_all_in_hope_to_get_a_flair_not_sure_why_this/,1, CLF All In Hope to get a flair Not sure why this isn t going through,
22,ocuuj3,t2_a09d56ax,1625304803,/r/wallstreetbets/comments/ocuuj3/yolo_sofi_400k_shares/,1,YOLO SOFI 400k shares,
23,ocv5p3,t2_axvstgi2,1625306387,/r/wallstreetbets/comments/ocv5p3/if_its_green_its_good_right/,1,If its green its good Right ,
24,ocv6sn,t2_c5v1jdrj,1625306495,/r/wallstreetbets/comments/ocv6sn/spce_to_the_moon/,1,SPCE TO THE MOON ,
25,ocv7xt,t2_oeyjv,1625306644,/r/wallstreetbets/comments/ocv7xt/at_this_point_i_cant_even_tell_anymore_if_people/,1,At this point I can t even tell anymore if people are memeing or serious,
26,ocv8d3,t2_cnotjd3n,1625306702,/r/wallstreetbets/comments/ocv8d3/dgly_body_worn_camera_stock_for_police_to_wear/,1, DGLY BODY WORN CAMERA STOCK FOR POLICE TO WEAR THIS COULD BLOW UP, removed 
27,ocv8nv,t2_1tdtx4mv,1625306743,/r/wallstreetbets/comments/ocv8nv/hedgies_target_renaissance_energy_africa/,1,Hedgies Target Renaissance Energy Africa, removed 
28,ocva0i,t2_34bewrna,1625306939,/r/wallstreetbets/comments/ocva0i/what_you_guys_think_about_this/,1,What you guys think about this,
29,ocva7k,t2_bkc1i1s4,1625306967,/r/wallstreetbets/comments/ocva7k/clov_i_am_making_a_buy_on_tuesday_yolo/,1,CLOV I am making a buy on Tuesday YOLO , removed 
30,ocvavi,t2_eaak0,1625307051,/r/wallstreetbets/comments/ocvavi/most_anticipated_earnings_releases_for_the_week/,1,Most Anticipated Earnings Releases for the week beginning July 5th 2021,
31,ocvbrn,t2_g423f93,1625307174,/r/wallstreetbets/comments/ocvbrn/us_cannabis_yolo_3_july_2021/,1,US Cannabis YOLO 3 July 2021,
32,ocvdb9,t2_cgxg4dxz,1625307387,/r/wallstreetbets/comments/ocvdb9/xela_next_in_line_and_heavily_shorted_technology/,1,XELA Next in line and heavily shorted Technology company guys Lets Squeeze it , removed 
33,ocvdh3,t2_abbovfgf,1625307404,/r/wallstreetbets/comments/ocvdh3/amc_stock_shorts_are_playing_with_fire_iceberg/,1,AMC Stock Shorts Are Playing With Fire Iceberg Research has publicly assumed a short position on AMC which could be dragging the stock s performance on July 2 HODL NOT FINANCIAL ADVICE JUST APE TALK ,
34,ocvdw0,t2_oeyjv,1625307461,/r/wallstreetbets/comments/ocvdw0/critical_thinking_need_not_apply/,1,Critical thinking need not apply,
35,ocvfah,t2_2og4gcl4,1625307644,/r/wallstreetbets/comments/ocvfah/was_talking_about_amc_with_my_friend_just_as_this/,1,Was talking about AMC with my friend just as this van drove past ,
36,ocvh7z,t2_87quf771,1625307906,/r/wallstreetbets/comments/ocvh7z/i_love_yolo_on_pornuhub_stock/,1,I love yolo on pornuhub stock, removed 
37,ocvhdy,t2_a4kofjb0,1625307928,/r/wallstreetbets/comments/ocvhdy/any_thoughts_on_ccl/,1,Any thoughts on CCL , removed 
38,ocviqb,t2_a23eff3j,1625308106,/r/wallstreetbets/comments/ocviqb/72k_yolo_amc/,1,72k YOLO AMC ,
39,ocvkro,t2_434mkf8q,1625308374,/r/wallstreetbets/comments/ocvkro/clf_all_in/,1, CLF All In ,
40,ocvlcx,t2_a7lkyo6b,1625308452,/r/wallstreetbets/comments/ocvlcx/aht_stay_far_from_this_stock/,1, AHT stay far from this stock,Unfortunately the ceo Rob is unfair by posting elon musk hotel to the moon hurricane of reverse split 10 1 I suggest to not buy anymore if you are in dont try to buy more because risk is very high Possible delisting and bankruptcy is near Dont forget the chairman BENNETT and family are extremely dangerous unfortunately I realized after About zack morris I never follow but is another person part of the dirty game 
41,ocvlij,t2_ck8hijfu,1625308477,/r/wallstreetbets/comments/ocvlij/disappointing_policy/,1,disappointing policy ,i recently joined reddit and wallstreetbets due to the astonishing success with gme and amc i understand restrictive policy is necessary with millions of members in a subreddit BUT there are some other stocks also worth the discussion here why not giving a try to these maybe in a strictly separated subsub thread just not to miss occasions tho 
42,ocvmc2,t2_a7lkyo6b,1625308590,/r/wallstreetbets/comments/ocvmc2/aht_keep_far/,1, AHT keep far,
43,ocvoqo,t2_97fwr6f1,1625308917,/r/wallstreetbets/comments/ocvoqo/dont_lose_hope_apes_invest_yourself_and_your/,1,Don t lose hope Apes Invest yourself and your freaking pennies Yes Lots of Fake copper No not your Dog Coins ,
44,ocvp95,t2_ul139,1625308988,/r/wallstreetbets/comments/ocvp95/status_of_dge_coin_worth_investing/,1,Status of Dge coin Worth investing , removed 
45,ocvp9g,t2_36l61z94,1625308989,/r/wallstreetbets/comments/ocvp9g/nas_to_the_moon/,1,NAS TO THE MOON , removed 
46,ocvq2d,t2_36l61z94,1625309096,/r/wallstreetbets/comments/ocvq2d/nas_to_the_moon/,1,NAS TO THE MOON , removed 
47,ocvrz1,t2_36l61z94,1625309364,/r/wallstreetbets/comments/ocvrz1/nas_to_the_moon/,1,NAS TO THE MOON ,Norwegian Air Shuttle is currently at an all time low and very soon traveling restrictions will fade to exist and their profits will skyrocket The only thing it needs is a little push from the amazing community that is r WallStreetBets and it will quicker than ever rise to see the light of day again
48,ocvs2b,t2_8n6heyn,1625309378,/r/wallstreetbets/comments/ocvs2b/ortx_data_for_clov_still_looking_good/,1,Ortx data for CLOV still looking good ,
49,ocvubx,t2_jw22c,1625309687,/r/wallstreetbets/comments/ocvubx/rwallstreetbets_member_social_development_tip/,1,r wallstreetbets Member Social Development Tip,Just some advice to the more than 80 of people in this sub who have never met a person with a mental disability or disorder most of the developed world is past using words like retard and autist to describe people in a way to be funny and show stupidity You do the math on how it could be offensive to certain people 
50,ocvuri,t2_a52dsvrm,1625309747,/r/wallstreetbets/comments/ocvuri/would_you_guys_help/,1,Would you guys help , removed 
51,ocvxir,t2_c9bplqmh,1625310087,/r/wallstreetbets/comments/ocvxir/sklz/,1,SKLZ, removed 
52,ocw0hq,t2_8w2drbzr,1625310459,/r/wallstreetbets/comments/ocw0hq/who_dares_to_short_sofi/,1,Who dares to short SOFI , removed 
53,ocw2x2,t2_a0kbsljp,1625310777,/r/wallstreetbets/comments/ocw2x2/where_to_go_full_retard_guys_i_have_11k_to_splash/,1,Where to go full retard Guys I have 11k to splash any picks , removed 
54,ocw3x2,t2_7xa3l523,1625310895,/r/wallstreetbets/comments/ocw3x2/hear_please_i_bought_this_stock_a_while_ago_and/,1,HEAR please I bought this stock a while ago and it did really good and kept going up so I didn t sell but now it is going down and I lost a ton of money Bought at 26 ,
55,ocw533,t2_7xa3l523,1625311039,/r/wallstreetbets/comments/ocw533/i_bought_this_stock_a_while_ago_and_it_did_really/,1,I bought this stock a while ago and it did really good and kept going up so I didn t sell but now it is going down and I lost a ton of money Bought at 26 ,
56,ocw719,t2_a1auayng,1625311280,/r/wallstreetbets/comments/ocw719/this_picture_should_say_enough_game_stop_to_the/,1,This picture should say enough Game stop to the f cking moon ,
57,ocwaau,t2_cbz7z8a3,1625311674,/r/wallstreetbets/comments/ocwaau/at_what_point_does_the_sofi_short_interest_not/,1,At what point does the SOFI short interest not make any logical sense 148 short Smh,
58,ocwbd2,t2_9v2gh7xx,1625311811,/r/wallstreetbets/comments/ocwbd2/volvo_uses_blackberry_qnx/,1,Volvo uses blackberry qnx ,Lot of people think Volvo car does not use qnx that only their trucks do that s wrong tweet from volvo https mobile twitter com volvocars status 1410253096182288387 s 1 There you have it Now stop spreading rumors that Volvo cars does not have qnx In fact the Linux and android automotive runs on qnx hypervisor because they are not safety and security certified operating system like bb qnx 
59,ocwhf1,t2_bo33q4a3,1625312550,/r/wallstreetbets/comments/ocwhf1/amc_to_the_moon_do_not_forget_ttcf_is_taking_off/,1, AMC to the moon do not forget TTCF is taking off too Let s all ride the rocket up and get our families what they need,
60,ocwl6m,t2_2x98cdwo,1625313004,/r/wallstreetbets/comments/ocwl6m/alex_karp_performs_a_magic_trick_during_an/,1,Alex Karp performs a magic trick during an interview,
61,ocwle8,t2_c3yma,1625313027,/r/wallstreetbets/comments/ocwle8/psa_dont_post_to_wsb_without_reading_the_rules/,1,PSA Don t post to WSB without reading the rules,
62,ocwlgr,t2_a20byzdi,1625313035,/r/wallstreetbets/comments/ocwlgr/atos_help_treat_breast_cancer_by_investing_in/,1,ATOS help treat breast cancer by investing in this company, removed 
63,ocwm5z,t2_3761mxv6,1625313122,/r/wallstreetbets/comments/ocwm5z/compounding_is_key_98_from_shares_and_2_options/,1,Compounding is key 98 from shares and 2 options Both from swings and day trades ,
64,ocwpai,,1625313511,/r/wallstreetbets/comments/ocwpai/biggest_yolo_ever/,1,biggest yolo ever ,
65,ocwt4a,t2_7u2w5apo,1625313932,/r/wallstreetbets/comments/ocwt4a/i_will_do_luxury_minimalist_logo_modern_design/,1,I will do luxury minimalist logo modern design for your business,
66,ocwu9y,t2_a1dvnt23,1625314062,/r/wallstreetbets/comments/ocwu9y/novan_300short_interest_increase_in_june_alone/,1,NOVAN 300 SHORT INTEREST INCREASE IN JUNE ALONE ,
67,ocwwhq,t2_8qqsdsvv,1625314329,/r/wallstreetbets/comments/ocwwhq/finally_feds_seized_robinhood_ceos_phone_in/,1,Finally Feds Seized Robinhood CEO s Phone in GameStop Trading Halt Investigation,
68,ocwwmw,t2_5zs7u6dn,1625314346,/r/wallstreetbets/comments/ocwwmw/shorting_pemex/,1,Shorting Pemex,What do y all think about shorting Pemex right now the company who s responsible for the undersea gas rupture in the Gulf Of Mexico
69,ocwz0c,t2_a20byzdi,1625314622,/r/wallstreetbets/comments/ocwz0c/atos_savetheboobies_all_in/,1,ATOS Savetheboobies All in , removed 
70,ocwzgg,t2_a1v48uhh,1625314675,/r/wallstreetbets/comments/ocwzgg/wish_as_many_worried_about_the_new_eu_import_vat/,1, WISH As many worried about the new EU import VAT rules here s how the company uses import facilitation scheme,
71,ocx137,t2_medfo,1625314867,/r/wallstreetbets/comments/ocx137/im_out/,1,I m Out,Well guys Im out I bought a condo yesterday and had to clear out everything but my rrsp Given the inevitable 500k mortgage I am not going to have any money to throw into stocks outside of my rrsp tfsa for a LONG time In five years on this subreddit my play account was down 20k That was 100 from TRST those bastards My set it and forget it accounts tfsa and rrsp are way up I think my tfsa was up about 50 Take with that information what you will While I bought a number of calls and did well especially on synthetic longs I did sell a lot of puts and covered calls and would recommend selling puts and highly dissuade anyone from selling covered calls All you do is cap gains on your winners and force you to hold your losers I guess from here on out its just mortgage payments for me Stay strong you retards you ve got this Don t gamble more than you can lose As to the condo its just over 1000 sq ft loft in Toronto 900k plus probably another 50 100k in taxes and other expenses tbd My girlfriend left me a month ago so this is going to be a sweet place for the foreseeable future It also looks out onto a Porsche dealership so you know ill be back with dollar signs in my eyes 
72,ocx16i,t2_b8dpa7jr,1625314877,/r/wallstreetbets/comments/ocx16i/rollercoin_hamster_by_rabidartwork/,1,RollerCoin Hamster by RabidArtWork,
73,ocx48o,t2_6h1losv1,1625315245,/r/wallstreetbets/comments/ocx48o/stonk_market_futures_on_this_day_in_the_year_2024/,1,Stonk market futures on this day in the year 2024 ,
74,ocx6cy,t2_2x98cdwo,1625315482,/r/wallstreetbets/comments/ocx6cy/karp_performs_magic_during_interview_pltr_42069/,1,Karp performs magic during interview PLTR 420 69 EOY confirmed ,
75,ocx7o6,t2_a0p2psxf,1625315628,/r/wallstreetbets/comments/ocx7o6/indi/,1,INDI , removed 
76,ocx8c1,t2_a0p2psxf,1625315700,/r/wallstreetbets/comments/ocx8c1/indi/,1,INDI , removed 
77,ocx8k7,t2_ak5mdv4v,1625315722,/r/wallstreetbets/comments/ocx8k7/clover_health_woodpile_just_needs_gasoline_match/,1,CLOVER HEALTH WOODPILE JUST NEEDS GASOLINE amp MATCH ,
78,ocxai3,t2_807p5hrg,1625315935,/r/wallstreetbets/comments/ocxai3/what_a_day/,1,What a day,
79,ocxasl,t2_a1hwcbk4,1625315970,/r/wallstreetbets/comments/ocxasl/go_pro_stockwhats_up_guys_i_think_they_will_go_to/,1,GO PRO STOCK what s up guys I think they will go to the moon in 2022 , removed 
80,ocxb2g,t2_a0p2psxf,1625316003,/r/wallstreetbets/comments/ocxb2g/indi/,1,INDI ,
81,ocxc60,t2_a0p2psxf,1625316122,/r/wallstreetbets/comments/ocxc60/indi_break_out_next_week_indie_semiconductor_is/,1,INDI break out next week indie Semiconductor is making moves , removed 
82,ocxd9a,t2_5b2hm5wq,1625316235,/r/wallstreetbets/comments/ocxd9a/ocgn_high_short_interest_big_news_after_hours_as/,1,Ocgn high short interest big news after hours as well as ceo just tweeted COVID partnerships continue to deepen big gap up Tuesday ,
83,ocxe1j,t2_5b2hm5wq,1625316318,/r/wallstreetbets/comments/ocxe1j/ocgn_high_short_interest_big_news_after_hours/,1,Ocgn high short interest big news after hours Friday and ceo tweeted partnerships deepen ,
