,postid,author,created_utc,permalink,score,title,selftext
19,ostyem,t2_2ma9w5cs,1627415744,/r/wallstreetbets/comments/ostyem/225_a_future_on_td/,1,2 25 a future on td ,I was planning to day trade oil futures but I saw that its 2 25 per future Am I misunderstanding the rules because how the hell are you supposed to make day trade profits if your making 10 cents per future 
20,ostzm4,t2_98bdds2j,1627415859,/r/wallstreetbets/comments/ostzm4/any_thoughts_on_sofi/,1,Any thoughts on SOFI ,I ve been watching this for a while now It just seems to go down everyday I just bought some shares today hoping to catch the falling knife I know the short interest is high I m wondering if that is the reason it s in the red all the time or is it just a bad investment 
21,ostzrp,t2_56ew76bx,1627415874,/r/wallstreetbets/comments/ostzrp/tlry/,1,TLRY, removed 
22,osu0aq,t2_2ma9w5cs,1627415924,/r/wallstreetbets/comments/osu0aq/225_a_future_on_td/,1,2 25 a future on td , I was planning to day trade oil futures but I saw that its 2 25 per future Am I misunderstanding the rules because how the hell are you supposed to make day trade profits if your making 10 cents per future 
23,osu0cd,t2_agfkjsj4,1627415928,/r/wallstreetbets/comments/osu0cd/moon_bootz_and_rocket_thrusterz/,1,Moon bootz and rocket thrusterz,
24,osu0vc,t2_512rccp6,1627415978,/r/wallstreetbets/comments/osu0vc/microsoft_mvst/,1,Microsoft MVST ,Microvast MVST 3 Billion market cap at 10 Listen up retards This is a x5 play Microvast Leader in the fast charging batteries Full charge in 20minutes Solid State Battery Lithium Metal battery High Temperature Cells Sports Car Application Vertically integrated amp proprietary 1 5B contracted revenue thru 2027 100M revenue 2020 2 3B 2025E revenue 550 patents 3 8B miles with ZERO operational accidents 28K battery systems in operation in 19 countries amp 160 cities 1800 total employees 500 R amp D personnel Full Range of Energy Densities 85 265 Wh Kg Long cycle lives 2 500 20 000 Best in Class Charging Performance 10 30 mins Products for all classes of commercial vehicles passenger vehicles amp energy storage solutions Product specs vs closest competitor Range per charge 370 miles vs 300 miles Speed of charge 12 mins for 70 vs 30 mins for 60 Lifespan 3000 cycles vs 1000 cycles Lifetime Throughput Mileage 1M miles vs 270K miles 2025 Adjacent TAM 45B 55 CAGR 2020 2025E Will Support OshkoshDefense in future progress which includes the USPS Contract Microvast is light years ahead of QS QuantumScapeCo in every aspect If you want a piece of the EV Battery sector this is it luxury OEM marquee announcement due soon from the CEO mouth himself Could it be Mercedes 1 year ago Mercedes Benz s decided to build the new generation of the eSprinter electric van in Ludwigsfelde which coincidentally is the same proximity of Microvast EDIT These batteries are also FIRE PROOF
25,osu19k,t2_bd6q5,1627416014,/r/wallstreetbets/comments/osu19k/what_are_your_moves_tomorrow_july_28_2021/,1,What Are Your Moves Tomorrow July 28 2021,Your daily trading discussion thread Please keep the shitposting to a minimum Navigate WSB We recommend best daily DD DD All https reddit com r wallstreetbets search sort new amp restrict sr on amp q flair 3ADD Best Daily https www reddit com r wallstreetbets search sort top amp q flair 3ADD amp restrict sr on amp t day Best Weekly https www reddit com r wallstreetbets search sort top amp q flair 3ADD amp restrict sr on amp t week Discussion All https reddit com r wallstreetbets search sort new amp restrict sr on amp q flair 3ADiscussion Best Daily https www reddit com r wallstreetbets search sort top amp q flair 3ADiscussion amp restrict sr on amp t day Best Weekly https www reddit com r wallstreetbets search sort top amp q flair 3ADiscussion amp restrict sr on amp t week YOLO All https reddit com r wallstreetbets search sort new amp restrict sr on amp q flair 3AYOLO Best Daily https www reddit com r wallstreetbets search sort top amp q flair 3AYOLO amp restrict sr on amp t day Best Weekly https www reddit com r wallstreetbets search sort top amp q flair 3AYOLO amp restrict sr on amp t week Gain All https reddit com r wallstreetbets search sort new amp restrict sr on amp q flair 3AGain Best Daily https www reddit com r wallstreetbets search sort top amp q flair 3AGain amp restrict sr on amp t day Best Weekly https www reddit com r wallstreetbets search sort top amp q flair 3AGain amp restrict sr on amp t week Loss All https reddit com r wallstreetbets search sort new amp restrict sr on amp q flair 3ALoss Best Daily https www reddit com r wallstreetbets search sort top amp q flair 3ALoss amp restrict sr on amp t day Best Weekly https www reddit com r wallstreetbets search sort top amp q flair 3ALoss amp restrict sr on amp t week Weekly Earnings Discussion Thread https www reddit com r wallstreetbets search sort new amp restrict sr on amp q flair 3A 22Earnings 20Thread 22 Read the rules https www reddit com r wallstreetbets wiki contentguide and make sure other people follow them Try No Meme Mode https www reddit com r wallstreetbets search q flair 3AMeme 20 flair 3ASatire 20 flair 3AShitpost amp restrict sr 1 amp t day amp sort hot also accessible through the top bar Follow Official WSB https twitter com Official WSB on Twitter all other accounts are impersonators Check out our Discord https discord gg wallstreetbets 
26,osu1ij,t2_512rccp6,1627416031,/r/wallstreetbets/comments/osu1ij/microvast_mvst/,1,Microvast MVST,Microvast MVST 3 Billion market cap at 10 Listen up retards This is a x5 play Microvast Leader in the fast charging batteries Full charge in 20minutes Solid State Battery Lithium Metal battery High Temperature Cells Sports Car Application Vertically integrated amp proprietary 1 5B contracted revenue thru 2027 100M revenue 2020 2 3B 2025E revenue 550 patents 3 8B miles with ZERO operational accidents 28K battery systems in operation in 19 countries amp 160 cities 1800 total employees 500 R amp D personnel Full Range of Energy Densities 85 265 Wh Kg Long cycle lives 2 500 20 000 Best in Class Charging Performance 10 30 mins Products for all classes of commercial vehicles passenger vehicles amp energy storage solutions Product specs vs closest competitor Range per charge 370 miles vs 300 miles Speed of charge 12 mins for 70 vs 30 mins for 60 Lifespan 3000 cycles vs 1000 cycles Lifetime Throughput Mileage 1M miles vs 270K miles 2025 Adjacent TAM 45B 55 CAGR 2020 2025E Will Support OshkoshDefense in future progress which includes the USPS Contract Microvast is light years ahead of QS QuantumScapeCo in every aspect If you want a piece of the EV Battery sector this is it luxury OEM marquee announcement due soon from the CEO mouth himself Could it be Mercedes 1 year ago Mercedes Benz s decided to build the new generation of the eSprinter electric van in Ludwigsfelde which coincidentally is the same proximity of Microvast EDIT These batteries are also FIRE PROOF
27,osu2cg,t2_371llryg,1627416100,/r/wallstreetbets/comments/osu2cg/who_did_this/,1,Who did this ,
28,osu2dc,t2_9yow3eqy,1627416103,/r/wallstreetbets/comments/osu2dc/is_cmg_a_bubble/,1,Is CMG a bubble , removed 
29,osu2de,t2_biesj,1627416103,/r/wallstreetbets/comments/osu2de/why_is_cocain_stocks_low_mallinckrodt_mnkkq_dnd/,1,Why is cocain stocks low Mallinckrodt MNKKQ DnD needed,Hello I m mostly a passive lurker here But I thought I would post my findings here so that you can assist with the DnD for a stock I was informed earlier this week about coca cola being the single company in the world to use coca plant extract in their sodas This is quoted here https en wikipedia org wiki Stepan Company https en wikipedia org wiki Stepan Company The cocain part of the plant is sold to Mallinckrodt https en wikipedia org wiki Mallinckrodt https en wikipedia org wiki Mallinckrodt who makes commercial drugs with 90 of its market in US As I understand Mallinckrodt is involved in morphine based drugs aswell could it be that is somehow involved or if profits is placed elsewhere Short interest seem to be around 50 accourding to market beat Not sure on how credible they are https www marketbeat com stocks NYSE MNK short interest https www marketbeat com stocks NYSE MNK short interest amp x200B What can you find Stocks https finance yahoo com quote MNKKQ https finance yahoo com quote MNKKQ Mallinckrodt pute the coke in Coca cola 0 3 USD https finance yahoo com quote SCL https finance yahoo com quote SCL Stepan Company cola plant filter company 117 USD
30,osu46c,t2_8rn2toei,1627416269,/r/wallstreetbets/comments/osu46c/apollo_global_the_new_berkshire_hathaway/,1,Apollo Global the new Berkshire Hathaway ,
31,osu48i,t2_81665,1627416275,/r/wallstreetbets/comments/osu48i/public_trading_app/,1,Public trading app, removed 
32,osu4dq,t2_371llryg,1627416288,/r/wallstreetbets/comments/osu4dq/who_did_this/,1,Who did this ,
33,osu4pk,t2_13xglc,1627416319,/r/wallstreetbets/comments/osu4pk/okwhich_one_of_you_is_this/,1,Ok which one of you is this ,
34,osu628,t2_47vnd2vc,1627416449,/r/wallstreetbets/comments/osu628/kodak_any_speculations_for_another_run/,1,Kodak any speculations for another run , removed 
35,osu7it,t2_2ma9w5cs,1627416583,/r/wallstreetbets/comments/osu7it/so_225_fee_per_future/,1,So 2 25 fee per future ,I was planning to day trade oil futures CLU21 but I saw that there is a 2 25 fee per future Am I misunderstanding the rules because how the hell are you supposed to make profits day trading if your making 10 cents per future I m planning to scalp and mass buy and sell oil at 3000 and make like 10 20 an hour from it I know that these fees can be lowered but how does td expect you to buy and sell oil and make at least 2 25 dollars each Can someone please explain this to me 
36,osu9dn,t2_244g3jd4,1627416758,/r/wallstreetbets/comments/osu9dn/good_thing_i_bought_a_couple_126_sbux_calls_this/,1,Good thing I bought a couple 126 SBUX Calls this morning,
37,osua3n,t2_a1jeklrw,1627416831,/r/wallstreetbets/comments/osua3n/buying_yinn_daily_ftse_china_bull/,1,Buying YINN daily FTSE CHINA BULL , removed 
38,osubs4,t2_8sdqw8oe,1627416990,/r/wallstreetbets/comments/osubs4/ok_so_agnc_has_one_of_the_highest_dividend_yields/,1,Ok so AGNC has one of the highest dividend yields If we all buy it and never sell we can just live off of those returns , removed 
39,osucrf,t2_aey89by6,1627417083,/r/wallstreetbets/comments/osucrf/lets_go_nakd/,1,Let s go nakd, removed 
40,osucxr,t2_332jwqlh,1627417098,/r/wallstreetbets/comments/osucxr/well_well/,1,Well well ,
41,osudfi,t2_4p1gmupq,1627417144,/r/wallstreetbets/comments/osudfi/spy_0_dte_yolo_update_almost_blew_the_account_but/,1, SPY 0 DTE YOLO update almost blew the account but some day trading amp faith in the Fed salvaged a manageable 166k 44 loss,
42,osudgp,t2_3bzmsyqi,1627417147,/r/wallstreetbets/comments/osudgp/stonks_tho/,1,Stonks Tho,
43,osudsi,t2_8sdqw8oe,1627417178,/r/wallstreetbets/comments/osudsi/agnc_has_one_of_the_highest_dividend_yields_if_we/,1,AGNC has one of the highest dividend yields If we all buy and never sell we can make money off of the dividends ,I am a genius Praise me This is not advice I just love this stock so much and you should love it so much that you buy it 
44,osudu1,t2_9yow3eqy,1627417182,/r/wallstreetbets/comments/osudu1/is_cmg_a_bubble/,1,Is CMG a bubble , CMG went up 300 after so so earnings It s now 1835 while SMA10 is only 1691 and SMA20 is 1632 Up Bollinger band 20 is 1839 It looks so overstretched Time to go down 
45,osue3h,t2_59dyt,1627417207,/r/wallstreetbets/comments/osue3h/goog_earnings_thread/,1, GOOG Earnings Thread, Google Q2 Earnings Summary https abc xyz investor static pdf 2021Q2 alphabet earnings release pdf cache 0cd3d78 Revenues 61 88 B vs 56 23 B est EPS 27 26 vs 19 35 est 
46,osue46,t2_59pxu0dl,1627417209,/r/wallstreetbets/comments/osue46/my_prediction_for_sava_on_thursday/,1,My Prediction for SAVA on Thursday,
47,osuee6,t2_91i1mpyt,1627417234,/r/wallstreetbets/comments/osuee6/clov_consolidating_last_few_weeks_bears_wanna/,1, Clov consolidating last few weeks Bears wanna take this too low 7s But they are getting heavy rejections at 7 80s Loading up some calls for a swing ,
48,osuemh,t2_a1ibcokh,1627417255,/r/wallstreetbets/comments/osuemh/clov_is_now_oversold/,1,Clov is now oversold ,https www reddit com r CLOV comments osr42g nasdaqcom just now clover health investments is utm source share amp utm medium ios app amp utm name iossmf
49,osueyr,t2_4p1gmupq,1627417290,/r/wallstreetbets/comments/osueyr/spy_0_dte_yolo_update_almost_blew_the_account_but/,1, SPY 0 DTE YOLO update almost blew the account but day trading and faith in the Fed salvaged a manageable 166k 44 loss,
50,osuf6h,t2_548shwad,1627417310,/r/wallstreetbets/comments/osuf6h/sofi_im_ready_tomorrow/,1, SOFI I m ready tomorrow,
51,osufe2,t2_59dyt,1627417330,/r/wallstreetbets/comments/osufe2/goog_earnings_thread/,1, GOOG Earnings Thread, Google Q2 Earnings Summary https abc xyz investor static pdf 2021Q2 alphabet earnings release pdf cache 0cd3d78 Revenues 61 88 B vs 56 23 B est EPS 27 26 vs 19 35 est Overall GOOG beat topline estimates by 5B and is currently up 3 5 AH Interesting to see this compared to MSFT who is down right now 
52,osufgv,t2_a1ok6l98,1627417338,/r/wallstreetbets/comments/osufgv/nnvc_is_that_the_next_moderna/,1, NNVC is that the next Moderna ,Disclosure holding a small amout and thinking about adding The stock gained about 20 probably because of an article claiming that their product is probably the most efficient in the market against any kind of variant You can see it here https finance yahoo com news nanomedicine company makes nanomachines attack 122839643 html So what s the play here Does anyone understand these whole biology aspects If so please share 
53,osuhbi,t2_59dyt,1627417507,/r/wallstreetbets/comments/osuhbi/goog_earnings_thread/,1, GOOG Earnings Thread, Google Q2 Earnings Summary https abc xyz investor static pdf 2021Q2 alphabet earnings release pdf cache 0cd3d78 Revenues 61 88 B vs 56 19 B est EPS 27 26 vs 19 24 est The second quarter numbers are in for Google parent Alphabet and they are better than expected Revenue jumped 62 to 61 88 billion representing the company s largest percentage jump in quarterly sales in about 14 years Of course though the sharp year over year growth comes against year ago results that were hurt by the rise of the pandemic at the time The company reported per share earnings of 27 26 Analysts on average were expecting earnings of 19 24 a share on revenue of 56 19 billion 
54,osulvf,t2_9s6or8ey,1627417947,/r/wallstreetbets/comments/osulvf/yolo/,1,YOLO ,
55,osum11,t2_cr7fnt60,1627417961,/r/wallstreetbets/comments/osum11/i_know_half_you_fuckers_lost_money_on_tsla_why_is/,1,I know half you fuckers lost money on TSLA Why is the loss flair not booming Stop being cowards and post them ,Just this week there were 23 posts about TSLA yolo Today there were 2 loss porn posts Stop being a bitch and post them There is no way the loss gain ratio in this sub is 1 10 I know you retards lose more than you gain 
56,osuma2,t2_a47ld4ft,1627417985,/r/wallstreetbets/comments/osuma2/forbes_billionaire_charles_koch_on_why_cannabis/,1,Forbes Billionaire Charles Koch On Why Cannabis Should Be Legal ,
57,osumuw,t2_9e2ui2p2,1627418043,/r/wallstreetbets/comments/osumuw/gme_changed_us_forever/,1,GME changed us Forever ,Who else been checking Charts currently at minus whatever the fuck and no fear It shouldn t be like this We should be shitting our pants right now There s a real chance we lose it all That s when I realized how GME changed us I was an ok investor before finding out about Wsb doing etf s and dividends I m sure that I m not alone Now well now I m just a degenerate APE My instincts are all wrong I have this unfounded permanent belief that I ll eventually hit the jack pot to tendie town The truth is that we had a chance to cut our losses many a time The roulette is still spinning It s always spinning in the mind of the gambler Nothing is ever lost Gains are forever We can still cut our losses Many of us would still walk with more than what they started with Then out spake brave Horatius Captain of the Gate To every man upon this earth death cometh soon or late And how can man die better than facing fearful odds for the ashes of his fathers and the temples of his Gods Some harsh times ahead good luck 
58,osunzn,t2_244g3jd4,1627418153,/r/wallstreetbets/comments/osunzn/i_bought_3_126_sbux_calls_this_morning_how/,1,I bought 3 126 SBUX Calls this morning How screwed am I tomorrow ,
59,osuoep,t2_80pj822l,1627418192,/r/wallstreetbets/comments/osuoep/in_honor_of_gme_breaking_the_lowest_daily_volume/,1,In honor of GME breaking the lowest daily volume record for the 4th consecutive day some POV porn of our beloved kinky boi Kenny Griffin on his knees talking dirty,
60,osup1u,t2_7x9dt8zx,1627418253,/r/wallstreetbets/comments/osup1u/apple_to_the_moon/,1,Apple to the moon, removed 
61,osup7x,t2_a58978xl,1627418269,/r/wallstreetbets/comments/osup7x/am_i_doing_it_right/,1,Am I doing it right ,
62,osuqjr,t2_18iv25,1627418401,/r/wallstreetbets/comments/osuqjr/clover_health_investments_is_now_oversold_clov/,1,Clover Health Investments is Now Oversold CLOV ,
63,osuqpe,t2_1ejrl4ey,1627418416,/r/wallstreetbets/comments/osuqpe/psa_bag_holders_and_the_ape_con/,1,PSA bag holders and the ape con,To start things off you are the only one who is looking out for your portfolio and your best interest Strangers on the internet shilling apes together strong are just bag holders trying to manipulate people into buying into that stock They will burn you the second their position breaks even For example looking at GME and the 2nd increase up to 250 it wasn t hedge funds screwing you it was the original bag holders from the January and March price skyrockets They saw their red account even or green for the first time in months After they spent the last month posting I m never selling They dumped their positions onto everyone they had convinced it was a group effort to stick it to the hedgies Do not buy into these stocks on a feeling of camaraderie You shouldn t invest on emotional at all but I ve knocked a few pee martinis back so what do I know Sincerely Someone lucky and along for the ride 
64,osurp7,t2_a1pn6wm5,1627418507,/r/wallstreetbets/comments/osurp7/why_is_so_hard_to_recoup_my_money_seriously_about/,1,Why is so hard to recoup my money Seriously About 15 is from NVIDIA Thanks,
65,osusxp,t2_dd3dmv33,1627418623,/r/wallstreetbets/comments/osusxp/ocean_waiv/,1,OCEAN WAIV, removed 
66,osuun9,t2_4gsstzox,1627418783,/r/wallstreetbets/comments/osuun9/im_pretty_new_and_easily_persuaded_any_tips/,1,I m pretty new and easily persuaded any tips, removed 
67,osuw42,t2_a4akls36,1627418918,/r/wallstreetbets/comments/osuw42/life_is_a_marathon_relay_race_with_no_finish_line/,1,Life is a marathon relay race with no finish line everyone you encounter in your life is helping you get to the next stage if you don t run this race you die if you run this race you die so with knowing those facts how are you going to mentally prepare for this race already knowing the out come , Life is a marathon relay race with no finish line everyone you encounter in your life is helping you get to the next stage if you don t run this race you die if you run this race you die so with knowing those facts how are you going to mentally prepare for this race already knowing the out come In this mental preparation is where you find pourpose in The preparation is where you find life in this moment you unravel wisdom The persons who help you to move up in life is not designated to stay at that spot They can move up as well because someone will always be at that spot to help another along We re not stuck at the spot we find ourselves in we have the freedom to keep moving this is what we call growth mentally physically So what s your escape from a never ending race what s your non existent finish line your exit point DEATH This is your saviour this is the real goal to learn how to die to look forward to it this is the victory of the race with no END 
68,osuwbz,t2_a0uab9sy,1627418936,/r/wallstreetbets/comments/osuwbz/best_bet_apt_with_rising_20_today_on_rising_vol/,1,Best bet APT with rising 20 today on rising vol ,I love alpha pro tech It s a profitable business and had a high short interest going into June Now it is ripe for a massive short squeeze following CDC mask guidelines update 
69,osuwv3,t2_9wbcb58m,1627418986,/r/wallstreetbets/comments/osuwv3/does_any_body_notice_irobot_irbt_they_have_28_mil/,1,does any body notice IROBOT IRBT they have 28 MIL shares total and short 21 good chance , removed 
70,osuzd6,t2_a5ffozp9,1627419220,/r/wallstreetbets/comments/osuzd6/2000_noidea_giveaway/,1,2000 NOIDEA Giveaway , removed 
71,osv08r,t2_2ulauld,1627419303,/r/wallstreetbets/comments/osv08r/amd_q2_earnings_and_raises_guidance/,1,AMD Q2 earnings and raises guidance,
72,osv0bu,t2_6j5d8lq1,1627419311,/r/wallstreetbets/comments/osv0bu/downjones/,1,DownJones, removed 
73,osv1k3,t2_c4xlyraf,1627419431,/r/wallstreetbets/comments/osv1k3/beijing_crackdown_sparks_record_slide_in_uslisted/,1,Beijing crackdown sparks record slide in US listed China stocks,
74,osv25a,t2_j0v14,1627419485,/r/wallstreetbets/comments/osv25a/rivian_valuation_vs_lucid/,1,Rivian valuation vs Lucid,Electric truck startup Rivian Automotive Inc could target a valuation of about 70 billion in its potential public listing later this year Is this because only they are backed by Amazon and Ford Due to this the stock price at open will be 80 100 and hence it is not practically possible for most of us to buy in bulk Where as a great company like LUCID and a great car as air who wanted to raise more cash backed by PIF went through a SPAC route and hence the value of the stock is around 25 and this valuation is also deemed very high by lot of people I think so just by the fundamentals of LUCID and the cars which they have showcased I feel they should have v similar valuations Both don t have cars on the road and valuing RIVIAN so much more than LUCID is something which Doesnot make sense I have not even seen a prototype of RIVIAN but LUCID has so many showrooms roadshows which gives me confidence They ate also expanding factories Their leadership talks to the public more often than any other company and gives us a insight into what s happening with all this happening I still don t underatand the valuation of a company like RIVIAN if not shouldn t the valuation of RIVIAN been aligned to LUCID I feel if Lucid should have gone public the normal way and the share price should have been around 100 120 What do you all think 
75,osv4u6,t2_51e16zbf,1627419726,/r/wallstreetbets/comments/osv4u6/wallstreetbets_lingo_lets_create_a_dictionary/,1,WallStreetBets Lingo Let s create a dictionary, removed 
76,osv4ym,t2_1yb2mdgz,1627419738,/r/wallstreetbets/comments/osv4ym/been_a_sea_of_reds_for_months/,1,Been a sea of reds for months,
77,osv5m0,t2_a0mwso2t,1627419798,/r/wallstreetbets/comments/osv5m0/am_i_doing_this_right/,1,Am I doing this right ,
78,osv5p3,t2_d9m328hk,1627419806,/r/wallstreetbets/comments/osv5p3/everyone_should_be_all_in_on_rocket_companies_rkt/,1,Everyone Should Be ALL IN on Rocket Companies RKT, removed 
79,osv6e7,t2_8bximut2,1627419872,/r/wallstreetbets/comments/osv6e7/i_want_you_apes_to_hodl_me_like_amc/,1,I want you APES to HODL me like AMC,
80,osv7so,t2_a0vbvyym,1627419998,/r/wallstreetbets/comments/osv7so/cassava_sciences/,1,Cassava sciences,Stock symbol SAVA Stock is up over 1200 this year it is an Alzheimer drug pharmaceutical company there will be very encouraging news coming forth Thursday July 28 during the Alzheimer convention this week in Denver Colorado please check it out
81,osv81t,t2_653q8,1627420021,/r/wallstreetbets/comments/osv81t/better_than_vegas/,1,Better than vegas ,
82,osvb2g,t2_8bximut2,1627420260,/r/wallstreetbets/comments/osvb2g/i_want_you_apes_to_hodl_me_like_amc/,1,I want you APES to HODL me like AMC,
83,osvczz,t2_55jujh3y,1627420418,/r/wallstreetbets/comments/osvczz/treasury_department_announces_suspension_of_sales/,1,Treasury Department Announces Suspension of Sales of State and Local Government Series Securities JD Supra,
84,osvfux,t2_5tdx19vh,1627420650,/r/wallstreetbets/comments/osvfux/supportcom_sprt_ready_to_sqooze/,1,SUPPORT com SPRT ready to sqooze,From Yahoo Finance Mark cap 168 mill No debt Float 8 mill with 51 institution ownership SHORT INTEREST 49 Stock volatility Up Time to Buy 
85,osvg4k,t2_76dpalae,1627420672,/r/wallstreetbets/comments/osvg4k/scrutinizing_shipping_stocks/,1,Scrutinizing Shipping Stocks, I am no expert so can anyone lend their opinion or at least translate Why do they have to be so murky when putting out new info On 07 13 2021 I came across the following message news regarding TEUFF On September 28 2021 new amendments adopted by the U S Securities Exchange Commission SEC go into effect to enhance investor protection and improve issuer transparency These amendments restrict the ability of market makers to publish quotations for those companies that have not made required current financial and company information available to regulators and investors Ahead of the regulatory enforcement date we will only accept orders to liquidate positions i e no new buy orders starting August 13 2021 After the amendment officially goes into effect on September 28 2021 it may be more difficult to liquidate these securities Quoting and market liquidity may also be very limited In Summation What are they really saying Does this point to Opportunity or to Death Thanks in advance 
86,osvg87,t2_12l20b,1627420681,/r/wallstreetbets/comments/osvg87/if_you_dont_get_on_the_sava_train_i_dont_give_a/,1,If you don t get on the SAVA Train I don t give a fook Don t say I didn t tell you so The results are being released Thursday Preliminary results look good 900 per share ,
