,postid,author,created_utc,permalink,score,title,selftext
0,ospj8l,t2_wa8ns,1627401157,/r/wallstreetbets/comments/ospj8l/am_i_dumb_im_thinking_of_buying_more/,1,Am I dumb I m thinking of buying more ,
1,ospjnp,t2_59m3qv0s,1627401196,/r/wallstreetbets/comments/ospjnp/dd_wish/,1,DD WISH, removed 
2,ospjsg,t2_bll6bnpr,1627401208,/r/wallstreetbets/comments/ospjsg/whos_buying_doulingo/,1,Who s buying DOULINGO , removed 
3,ospjzc,t2_bh77nm0j,1627401225,/r/wallstreetbets/comments/ospjzc/any_beginners_in_here_trying_to_learn_how_to/,1,Any beginners in here trying to learn how to trade with signals I will gladly help I am no expert but I am still able to help for free I remember people would help and I am paying it forward If I can t help you then I will source you to something that will help you , removed 
4,ospl5q,t2_506rrcxe,1627401331,/r/wallstreetbets/comments/ospl5q/thoughts_on_nok_and_bb/,1,Thoughts on NOK and BB ,In y all s opinion are these worth a consideration or are they just old news simply worthless meme stocks They used to be very credible companies back in the day and just haven t seemed to get back to where they once were perhaps old and outdated 
5,ospmqp,t2_r2hn6,1627401471,/r/wallstreetbets/comments/ospmqp/tfw_logitech_revenue_is_up_66_but_the_stock_drops/,1,TFW Logitech revenue is up 66 but the stock drops 10 instead of rising 10 ,
6,ospnb1,t2_a3uq46vb,1627401520,/r/wallstreetbets/comments/ospnb1/china_regulations_impact/,1,China Regulations amp Impact,Uncertainty regarding regulatory policy is likely to linger through the second half of the year which could increase volatility in Chinese equities Investors may need to wait regulatory developments and other sectors and details on regulations already announced to assess the overall impact on earnings Similar to other equity markets the equity risk premium has narrowed since early 2020 reducing the margin Of safety against downside risk The modifications to private education policy as follows recent regulatory team just to Internet and digital platforms including revisions to the antimonopoly law and regulation of overseas foreign listings Furthermore in the past six months there have been a series of regulatory changes in a number of sector areas such as housing decarbonization labor rates protection healthcare cyber security data security and capital markets developments Chinese equities have sold are following the announcement of stricter than expected regulations and after school tutoring institutions While the market reaction has been the most pronounced for education related companies concerns about brought her inside a regulatory actions have hit performance and other sectors in particular Internet platforms and tech companies 
7,ospntr,t2_55jujh3y,1627401565,/r/wallstreetbets/comments/ospntr/let_me_play_the_world_smallest_violin/,1,Let me play the world smallest violin,
8,ospomc,t2_a0c5qwy8,1627401623,/r/wallstreetbets/comments/ospomc/mvst_go_big_or_go_home_all_in/,1,MVST Go Big or go home all in ,
9,ospp19,t2_u3xx1,1627401652,/r/wallstreetbets/comments/ospp19/south_florida_litigators_hit_financial_services/,1,South Florida litigators hit financial services provider Robinhood Markets Inc with a consolidated class action complaint Tuesday in Miami federal court less than two days before the company seeks a valuation of upwards of 35 billion in an initial public offering ,
10,osppak,t2_12jgiuik,1627401675,/r/wallstreetbets/comments/osppak/hey_guys_wall_street_is_playing_with_you_all_with/,1,Hey guys Wall Street is playing with you all with this Propaganda ,
11,ospq7a,t2_548pahb7,1627401752,/r/wallstreetbets/comments/ospq7a/ptra_the_play_of_a_lifetime/,1,PTRA The Play of a Lifetime,If you haven t heard of Proterra it s an EV company that actually makes vehicles looking at you Nkla Proterra makes electric buses which I know isn t the most sexy of vehicles but man are they profitable EACH bus costs around 750 000 and Proterra has sold over 1 000 of them with over 16 million miles driven on Proterra buses amp x200B Proterra went public this year and got roughly 650 million and what do you think they re putting this money towards Growth The EV Bus market is about to explode with the coming infrastructure bills The 600B bipartisan bill alone contains 7 5B for electric buses and 7 5B for EV infrastructure And who do you think the government will invest tax payer dollars in Proterra s main competition is BYD a Chinese company However Proterra is an American company and their buses are made in America Of course this money is gonna go towards Proterra any smooth brain should be able to figure that out amp x200B Let s also look at what allies Proterra has in the current administration First there s Jennifer Granholm the current Secretary of Energy She was a member of Proterra s board Then there s Biden himself who visited Proterra s factory as part of his big EV push back in April What company do you think these two are gonna pump once the infrastructure bills pass Did I forget to mention that Proterra already has over 50 of the EV Bus market share in the US amp x200B But Proterra doesn t just make the buses they also make electric powertrains and fleet level EV chargers Who would buy the powertrains and chargers How about Daimler the largest commercial vehicle maker in the world Daimler and Proterra already have a strategic partnership AND Daimler invested in Proterra back in 2018 amp x200B Frequently Asked Questions Q Wow Proterra has been selling off hard lately Whats up with that A PIPE investors Private Investment in Public Equity had their lockup period expire so they re taking profits Nothing to be scared of just a great dip to buy amp x200B Q I m a boomer and will only invest if Analysts from big banks say a stock is undervalued A Eww value investing You re still in luck Citigroup announced a price target on Proterra of 16 just two weeks ago This is the same analyst who gave Tesla a price target of 117 so if he s saying Proterra is undervalued it is REALLY undervalued at today s price of 10 60 amp x200B Q What s Proterra s market cap How high could it go A Currently Proterra s market cap is 2 32B and its price is 10 60 Compare that to its 52 week high price of 31 06 You can see what a crazy huge investment the 15B from the smaller infrastructure bill will be for Proterra 
12,ospqpe,t2_a0c5qwy8,1627401793,/r/wallstreetbets/comments/ospqpe/mvst_go_big_or_go_home/,1,MVST go big or go home ,
13,ospt63,t2_9i7esn4o,1627402008,/r/wallstreetbets/comments/ospt63/lets_short_robinhood_110_like_they_tried_with_gme/,1,Let s short Robinhood 110 like they tried with GME,
14,osptip,t2_43q4o538,1627402037,/r/wallstreetbets/comments/osptip/yolo_robinhood_instant_deposit_but_no_money_in/,1,YOLO ROBINHOOD INSTANT DEPOSIT BUT NO MONEY IN BANK,Hi So here is my story i have around 600 on coins from 3k really down right now and I don t have a job and no more money in the bank i have a chime account and i have a 25k debt because of my past life but that don t show up in my BANK account so in the past few months since SNL I bein putting money in a ROBINHOOD account and it gives me 1000 instant deposit around 2 days later they take it out my chime account anyways now i have no more money and I m YOLO i bought the GOLD on ROBINHOOD and it gave me a 5000 instant deposit instead of 1000 I tried it a while back ago before AMC rocket but it said suspicious activity on account and locked me so I slowing fixed it and now I m depositing 300 a try gives me 5 try s a day i started yesterday I m up to 1800 i will try again at 12am today I m putting it all on b coins and dogs and that lil skinny dude WISH ME LUCK YOU GUYS TO THE MOON ill UPDATE you alll when i start Getting LOCKED out
15,ospun6,t2_a0jj4jdb,1627402133,/r/wallstreetbets/comments/ospun6/wen_moon_i_have_my_tendies_in_wendys_looks_like/,1,Wen moon I have my tendies in Wendy s Looks like it s bouncing off of resistance,
16,ospvds,t2_59m3qv0s,1627402193,/r/wallstreetbets/comments/ospvds/wish_lookin_like_a_sleeper/,1,WISH lookin like a sleeper ,dear apes i like wish amp x200B Wish is the mobile e commerce play If you like e commerce over the next few years wish is my choice It s for the value consious consumer ones who are looking for something affordable Also it s like social media but for shopping so it s extremely appealing to kids these days Financials Wish is undervalued across pretty much every metric Wish has a book value of 1 07B with 6 P BV and this is so cheap compared to online retail s average of 19 The current ratio is 1 86x so it s not going bankrupt for a while Wish also has around 2 billion in cash on hand which could be used to buy back shares acquire licenses idk There s absolutely 0 long term debt nuff said If revenue increases around 25 per year to reach about 7B by 2025 which is around double of this year s revenue in line with Statista s forecast of e commerce doubling by then WISH is worth around 30 today using p revenue of 4x and discounting amp x200B People on here are complaining that Wish is a shitty company with shitty goods Shitty goods sure but this is part of the business model Wish s job is to make a marketplace for consumers that are willing to sacrifice luxury brand name for working products like knock off airpods for 5 bucks it works but it s not apple quality big deal amp x200B In conclusion online shopping go up WISH squiggly line go up 
17,ospvxk,t2_5sim0ngf,1627402241,/r/wallstreetbets/comments/ospvxk/weed_stocks/,1,Weed stocks, removed 
18,ospvzj,t2_dhjim61a,1627402245,/r/wallstreetbets/comments/ospvzj/how_i_learned_to_stop_worrying_and_buy_the/,1,How I learned to stop worrying and buy the memefish AQB, removed 
19,ospylx,t2_9iswf38y,1627402496,/r/wallstreetbets/comments/ospylx/do_you_guys_think_ffie_is_our_ideal_next_target/,1,Do you guys think FFIE is our ideal next target , removed 
20,ospyy9,t2_ae4t9,1627402528,/r/wallstreetbets/comments/ospyy9/over_at_bear_hq/,1,Over at Bear HQ,
21,ospzlw,t2_9noyq5hd,1627402594,/r/wallstreetbets/comments/ospzlw/yolo_on_the_devils_lettuce_buying_the_dip_sndl/,1,YOLO on the Devil s Lettuce Buying the Dip SNDL,
22,osq06i,t2_6ofiojzx,1627402648,/r/wallstreetbets/comments/osq06i/curaleaf_the_squeez_is_in_buy_and_hold_this_is_a/,1,Curaleaf the squeez is in Buy and hold This is a 10 bagger, removed 
23,osq1qy,t2_9iswf38y,1627402794,/r/wallstreetbets/comments/osq1qy/do_you_guys_think_ffie_is_a_ideal_next_target_new/,1,Do you guys think FFIE is a ideal next target New IPO via SPAC Falling to a good price today High short interest ratio Short squeeeeze What do you think , removed 
24,osq2c9,t2_dhjim61a,1627402848,/r/wallstreetbets/comments/osq2c9/how_i_learned_to_stop_worrying_and_buy_the/,1,How I learned to stop worrying and buy the memefish AQB ,AQB makes GMO fish Fucking MUTANT fish In ten years the ocean will be fishless and everybody s gonna be eating some gigantic Chernobyl GMO fish AQB 1 1 2022 30
25,osq2cl,t2_8a9qpr8r,1627402849,/r/wallstreetbets/comments/osq2cl/nrxp_to_the_moon/,1,NRXP TO THE MOON,Here s the pitch I like this one because COVID has been a real bugger and I ve heard those guys at Moderna are pretty happy with how things turned out NRXP to the moon To the moon 
26,osq3d7,t2_125h00,1627402946,/r/wallstreetbets/comments/osq3d7/hello_fellow_crayon_nibbler_i_tried_yelling_hold/,1,Hello fellow crayon nibbler I tried yelling hold retard at you but I guess you couldn t hear me ,
27,osq3y3,t2_a0r77nxc,1627402998,/r/wallstreetbets/comments/osq3y3/thoughts_on_dkng/,1,Thoughts on DKNG ,I have over 200 January call option with a strike of 50 Should I hold I am up 15k I have seen the price go up shortly after every earnings when looking at the 180 day chart and am thinking It will rise again not long after the upcoming ER I don t expect any lawsuit reports before the end of August and the NFL season is around the corner Current sentiment is strengthening I expect the price to hit 55 in the next 6 weeks Thoughts 
28,osq4d4,t2_c94ee5r8,1627403037,/r/wallstreetbets/comments/osq4d4/now_me_i_was_scaredbut_bull_gang_they_were_mad/,1,Now me I was scared but bull gang They were mad ,
29,osq4iy,t2_a1ibcokh,1627403051,/r/wallstreetbets/comments/osq4iy/xela_to_the_top/,1,Xela to the top ,
30,osq4wf,t2_a1md7btb,1627403086,/r/wallstreetbets/comments/osq4wf/i_may_keep_averaging_up_but_what_do_i_know_im/,1,I may keep averaging up but what do I know I m just a dumb BUY amp HODL BUY amp HODL BUY amp HODL 600 18 58 https youtu be Y2rDb4Ur2dw,
31,osq4zj,t2_7mqld3bz,1627403094,/r/wallstreetbets/comments/osq4zj/infi_is_curing_cancer/,1, INFI is curing cancer, removed 
32,osq5vn,t2_tq7b5,1627403177,/r/wallstreetbets/comments/osq5vn/binance_founder_willing_to_go_as_pressure_mounts/,1,Binance founder willing to go as pressure mounts,
33,osq5wg,t2_bpdaqzwx,1627403179,/r/wallstreetbets/comments/osq5wg/root_runs_deep/,1,ROOT runs deep,
34,osq66q,t2_137at3,1627403206,/r/wallstreetbets/comments/osq66q/any_listed_highend_escort_services_to_yolo/,1,Any listed high end escort services to YOLO ,
35,osq6wt,t2_4xov9r03,1627403268,/r/wallstreetbets/comments/osq6wt/beginners_thread/,1,Beginners Thread, removed 
36,osq7gn,t2_a0uab9sy,1627403319,/r/wallstreetbets/comments/osq7gn/best_bet_apt_rising_11_today_on_rising_vol/,1,Best bet APT rising 11 today on rising vol , removed 
37,osq7h1,t2_5jlk8bzf,1627403320,/r/wallstreetbets/comments/osq7h1/baby_mama_mama_is_the_next_1000x_play/,1,BABY MAMA MAMA is the next 1000X play, removed 
38,osq7qe,t2_6pg76l4k,1627403346,/r/wallstreetbets/comments/osq7qe/free_money_or_how_am_i_getting_fcked/,1,Free money or how am I getting f cked , amp x200B https preview redd it mrg3p1qx4sd71 png width 882 amp format png amp auto webp amp s 61c60633151e3501e49a61d0f67bbbc404af4684 I could short 100 shares go long 1 call at 10 strike and go short 1 put at 10 strike amp x200B Since the premium on the put is more than the premium I am paying for the call I am able to collect the difference no matter where the price is at expiration amp x200B The shortable fee in Interactive Brokers is 1 per year and this spac has no dividend or cash payout coming up in the horizon so what are the risks here looks too good to be true amp x200B Only risks I can think of is puts premium keep increasing making it even a better arbitrage or maybe shortable fee per year increasing to over 100 per year I have seen it happen with some stocks but not spacs lol
39,osq928,t2_7mqld3bz,1627403466,/r/wallstreetbets/comments/osq928/infi_looking_to_cure_types_of_cancers/,1,INFI looking to cure types of cancers, removed 
40,osq9pd,t2_a0uab9sy,1627403524,/r/wallstreetbets/comments/osq9pd/best_bet_apt_rising_11_today_on_rising_vol/,1,Best bet APT rising 11 today on rising vol ,I love alpha pro tech It s a profitable business and had a high short interest going into June and now ripe for a massive short squeeze following CDC mask guidelines update 
41,osqbdz,t2_a0oxu54y,1627403694,/r/wallstreetbets/comments/osqbdz/wkhs/,1,WKHS,There isn t a lot of chatter about WKHS today and I wonder if we are losing some apes Let s give them something to talk about 
42,osqe2p,t2_a3z115xg,1627403948,/r/wallstreetbets/comments/osqe2p/apple_earning_are_going_to_be_fantastic/,1,Apple Earning are going to be fantastic,Looking at App Store data from our panel of annonymized users looks like apple is going to have a fantastic quarter 
43,osqecl,t2_a866icrn,1627403975,/r/wallstreetbets/comments/osqecl/hey_come_check_out_discord_with_me/,1,hey come check out Discord with me https discord gg uUEBFN5T, removed 
44,osqg1m,t2_654y5k8k,1627404141,/r/wallstreetbets/comments/osqg1m/earnings/,1,Earnings,I m pretty new to investing so I apologize if this is a dumb question but does anyone know why sometimes after crushing expected earnings a share price will plummet Is a big sell off typical in this scenario 
45,osqg4d,t2_a3z115xg,1627404148,/r/wallstreetbets/comments/osqg4d/looking_at_apple_app_store_transactions_earnings/,1,Looking at Apple App Store transactions Earnings are going to be fantastic,
46,osqg7r,t2_ci1mbnp3,1627404158,/r/wallstreetbets/comments/osqg7r/hold_or/,1,Hold Or ,
47,osqh4a,t2_a1gu5d7s,1627404243,/r/wallstreetbets/comments/osqh4a/could_capitalism_and_stocks_be_the_solution_to/,1,Could capitalism and stocks be the solution to poverty ,Watching the news this morning cities in CA are experimenting with living wages where 500 people get 500 a month 1000 people get 1200 a month for a year I imagined what if stock manipulation was somehow eliminated on Wall Street and company stock was actually worth shares divided by MktCap If people who lost jobs because big companies made them obsolete or un feasible were given shares in these stocks If the majority of Americans invested in companies they believed in and shared in their prosperity without the manipulated fluctuations A way to create a living wage for everyone without government supplied by the private sector that s worth trillions Obviously more money would have to trickle down from the TOP just thinking out loud 
48,osqhnk,t2_155o06kq,1627404294,/r/wallstreetbets/comments/osqhnk/how_can_i_be_so_horrible_at_this/,1,How can I be so horrible at this ,
49,osqi35,t2_s42d7,1627404335,/r/wallstreetbets/comments/osqi35/spy_yolo/,1,SPY YOLO,
50,osqi4l,t2_1bqwnlzq,1627404339,/r/wallstreetbets/comments/osqi4l/shib/,1,SHIB, removed 
51,osqidy,t2_dk25lgex,1627404364,/r/wallstreetbets/comments/osqidy/the_glory_of_god_is_intelligence/,1,The glory of god is intelligence, removed 
52,osqiwx,t2_ci1mbnp3,1627404415,/r/wallstreetbets/comments/osqiwx/does_anyone_else_buy_do_you_keep/,1,does anyone else buy do you keep,
53,osqjy7,t2_ci1mbnp3,1627404514,/r/wallstreetbets/comments/osqjy7/_/,1, ,
54,osqkp2,t2_nftqw,1627404580,/r/wallstreetbets/comments/osqkp2/chinese_stock_market_crashing_down_7_so_far_today/,1,Chinese Stock Market crashing down 7 so far today ,
55,osqkvv,t2_ci1mbnp3,1627404598,/r/wallstreetbets/comments/osqkvv/hold/,1,Hold ,
56,osqnpm,t2_67ttdlbn,1627404870,/r/wallstreetbets/comments/osqnpm/how_about_some_gain_porn_on_some_puts/,1,How about some gain porn on some puts ,
57,osqnrn,t2_d2vwrool,1627404875,/r/wallstreetbets/comments/osqnrn/whether_you_hold_tesla_amc_sndl_or_any_stock_for/,1,Whether you hold TESLA AMC SNDL or any stock for that matter fake news is driving the market down with fear of covid for hedgies Fear causes panic selling Holding strong my ape friends in whatever you hold ,
58,osqp6u,t2_a7g7pqcl,1627405010,/r/wallstreetbets/comments/osqp6u/new_group_of_shiko_coin_to_invest_in_sud_america/,1,New group of SHIKO coin to invest in Sud America https t me SHIKOEXCHANGEOFFICIALSUDAMERICA, removed 
59,osqqik,t2_2978gaq,1627405131,/r/wallstreetbets/comments/osqqik/day_trading_restrictions/,1,Day Trading Restrictions,Does it bother anyone else that you are required to have 25 000 dollars in your account to day trade I have slowly been growing my account over the last couple months but I can t count the number of times I have been happy with my gains on an option and cannot sell it Today I was up 400 on a Spotify put and was more than happy with that return but because I bought it today I was unable to sell it Now it is down 100 I m at 21 000 right now so I m close but can someone explain to me why this is even a rule 
60,osqqz6,t2_dk2q3hj9,1627405174,/r/wallstreetbets/comments/osqqz6/what_is_a_good_stock_to_buy_into/,1,What is a good stock to buy into , removed 
61,osqr6t,t2_50p5iyb6,1627405194,/r/wallstreetbets/comments/osqr6t/clvs_clovis_oncology_liftoff_time/,1,CLVS Clovis Oncology Liftoff Time, CLVS is primed for a liftoff The stock is one of the most heavily shorted stocks out there and its five year chart can show you just how the company has been performing under their management But it s time for a revitalization With earnings around the corner and their Athena trial data coming out within a year this stock has so much potential to rise up Let s make it happen Clovis Oncology Let s ride 
62,osqs3k,t2_16xh3i,1627405265,/r/wallstreetbets/comments/osqs3k/bmy_to_the_moon_nothing_but_growth/,1,BMY TO THE MOON nothing but growth , removed 
63,osqs99,t2_63ev3x9g,1627405279,/r/wallstreetbets/comments/osqs99/apes_if_we_call_these_etfs_it_could_get_messy_for/,1,Apes if we call these ETFs it could get messy for the hedgies M rkets M yhem on Twitter,
64,osqsv3,t2_5ea24zo2,1627405335,/r/wallstreetbets/comments/osqsv3/nok_on_the_earning_out_on_fri_get_on_for_the_ride/,1,NOK on the earning out on Fri get on for the ride up , removed 
65,osqtdu,t2_9xc6e2wi,1627405383,/r/wallstreetbets/comments/osqtdu/amcgme_should_be_the_only_way/,1,AMC GME should be the only way,We are at such a pivotal moment in our timeline We will have so many other opportunities after MOASS but for now we should focus on the OGs for obvious reasons Remember it s not a question of if it s when I love you apes been here since the beginning and have learned so much because of you guys Now let s get rich and make the world a better place 
66,osqtuj,t2_50p5iyb6,1627405425,/r/wallstreetbets/comments/osqtuj/clvs_clovis_oncology_liftoff_time/,1,CLVS Clovis Oncology Liftoff Time, CLVS is primed for a liftoff The stock is one of the most heavily shorted stocks out there and its five year chart can show you just how the company has been performing under their management But it s time for a revitalization With earnings around the corner and their Athena trial data coming out within a year this stock has so much potential to rise up Let s make it happen Clovis Oncology Let s ride Information about Clovis Oncology from their website Clovis Oncology is on a Mission to Advance the Fight Against Cancer Founded in 2009 Clovis Oncology NASDAQ CLVS is a commercial stage biotechnology company focused on acquiring developing and commercializing cancer treatments in the United States Europe and other international markets Development Programs Are Focused on Providing the Right Drug to the Right Patient at the Right Time Clovis product development programs generally target specific subsets of cancer and the Company seeks to simultaneously develop with partners for those indications that require them diagnostic tools intended to direct a compound in development to the patients most likely to benefit from their use Through these collaborations Clovis has the flexibility to choose the most appropriate technology for each program and the expertise to gain regulatory approvals and support global commercialization that will parallel Clovis regulatory and commercialization paths Clovis believes this approach to precision medicine to deliver the right drug to the right patient at the right time represents the future of cancer therapy 
67,osqvjc,t2_a1mxohgc,1627405576,/r/wallstreetbets/comments/osqvjc/mmmmm/,1,Mmmmm,Install this app Watch and download Pacific Rim Uprising at no cost https www downloader world share2 para1 9791 amp para2 2 amp para4 135 amp para3 Pacific Rim Uprising
68,osqvtq,t2_5ea24zo2,1627405602,/r/wallstreetbets/comments/osqvtq/nok_on_the_earning_out_on_fri_get_on_for_the_ride/,1,NOK on the earning out on Fri get on for the ride up Breaking 6 is a given short term gain and possible ride up past the 52 week high of 9 79 , removed 
69,osqx0w,t2_5ea24zo2,1627405706,/r/wallstreetbets/comments/osqx0w/nok_on_the/,1,NOK on the , removed 
70,osqxm4,t2_88073sc,1627405754,/r/wallstreetbets/comments/osqxm4/apes_together_strong_worldwide/,1,Apes together strong worldwide ,
71,osqyeb,t2_9490gpxu,1627405820,/r/wallstreetbets/comments/osqyeb/chipotle_stock_to_the_moon/,1,chipotle stock to the moon , removed 
72,osqzkh,t2_dfnv7c9t,1627405932,/r/wallstreetbets/comments/osqzkh/byebye_bitcon_its_time_to_ban_cryptocurrencies/,1,Bye bye bitco n It s time to ban cryptocurrencies,
73,osqzvi,t2_5ea24zo2,1627405958,/r/wallstreetbets/comments/osqzvi/nok_to_the/,1,NOK to the ,Earnings out on Fri get on for the ride up Breaking 6 is a given short term gain and possible ride up past the 52 week high of 9 79 The earnings will beat as Ericsson continues to slide Nokia s transformation is in the right direction under the new leadership and is an attractive stock to own from current levels 
74,osqzzh,t2_a47ld4ft,1627405968,/r/wallstreetbets/comments/osqzzh/congress_to_vote_on_cannabis_psychedelics_cbd/,1,Congress to vote on cannabis psychedelics amp CBD this week,
75,osr17g,t2_5ea24zo2,1627406083,/r/wallstreetbets/comments/osr17g/nok_to_the/,1,NOK to the ,Earnings out on Fri get on for the ride up Breaking 6 is a given short term gain and possible ride up past the 52 week high of 9 79 The earnings will beat as Ericsson continues to slide Nokia s transformation is in the right direction under the new leadership and is an attractive stock to own from current levels 
76,osr1rn,t2_a35j0d9p,1627406135,/r/wallstreetbets/comments/osr1rn/either_either_im_a_bull_or_a_pig/,1,Either either I m a Bull or a Pig ,
77,osr20c,t2_6aae2k5f,1627406158,/r/wallstreetbets/comments/osr20c/would_you_want_a_news_site_that_tells_you/,1,Would you want a news site that tells you multiple reasons why the market might be moving ,Look it s no surprise that news sources are shit at finding a reason as to why markets are going up or down and most of the time they make some bullshit up like Delta fears pull market down before saying the next day Delta fears brushed off by investors Now I m tempted to make a news platform that gives multiple reasons as to why the market might be going up down but I m not bothered enough to do it if the need isn t there because I want to trade options and lose money as quick as I can and writing a daily news like that would really slow down my money losing process 
