,postid,author,created_utc,permalink,score,title,selftext
51,oczls2,t2_a03m7qau,1625324228,/r/wallstreetbets/comments/oczls2/amc_beyond_100k_per_share_investors_just_revealed/,1, AMC BEYOND 100K per share Investors just revealed a clear advantage I m not your financial adviser Please do your own DD s ,
52,oczmee,t2_6bbgnull,1625324286,/r/wallstreetbets/comments/oczmee/we_dont_see_this_often_yes_respect/,1,We don t see this often YES respect ,
53,ocznr5,t2_8qtzcpbq,1625324413,/r/wallstreetbets/comments/ocznr5/anyone_on_wsb_yoloing_on_spce/,1,Anyone on WSB YOLO ing on SPCE ,Hi Just wondering what the apes of WSB think of Virgin Galactic it s jumped twice about 30 last week And with the upcoming first space flight scheduled for 11th July I would have thought WSB would be all over it Am I missing something that you well knowledged apes could divulge to this new monkey Thanks 
54,oczouu,t2_9qn1xvli,1625324504,/r/wallstreetbets/comments/oczouu/is_cnnwf_cineworldregal_a_good_bet/,1,Is cnnwf Cineworld Regal a good bet ,This is my first post like this here so if I ve broken rules or done anything uncouth much apologies I read in the rules that companies below 1bln market cap get removed except cnnwf is 1 5bln so I hope I m okay I only joined reddit a few months ago shortly before my dog money investment went to the moon I felt like smoking a J and typing and figured id post my dd and maybe get some feedback about cnnwf stock This isn t an attempt to draw attention away from AMC I m hodling amc and gme with a 6 average Why isn t anyone talking about Cineworld Regal They are the second largest theater just behind amc with over 9000 screens worldwide I did a quick search of this sub for just the ticker cnnwf and find 2 posts with around 10 comments each and the summary of the discussion is regal is ass and to go visit r investing instead Is Regal ass If so not why whynot When I search for Cineworld itself not the ticker a handful of posts from about 150 days ago show up highlighting how it is was the 2nd most shorted company on the London stock exchange Ive noticed the daily volume on cnnwf is pretty low I placed an order a few weeks ago and it was was about 1 3 the daily volume I don t know if this means anything I just thought it was funny If Twitter followers equated to stock price AMC has 490k twitter followers and is 54 today Cineworld has 290k twitter followers and is 1 20 By those twitter metrics cineworld is undervalued Regal cinemas are all over the place in California and actually the first time I had a opportunity to visit an AMC was in Texas this spring when I was visiting my brother we saw Godzilla vs Kong and the seats were far superior to any regal I ve been to But that s besides the point really if I want to take my kid to a movie I don t have the luxury of choosing a theater chain we have no choice We have a regal unless I want to drive an extra 45 minutes Not likely This is the case for a lot of people they use the theaters available to them I would expect the same theory of AMC having a recovery after the pandemic to apply to any theater chain and cinneworld owns theaters all over the world I realize that there s a whole other level of monkey business going on with amc citadel and all the eyeballs on it except I would expect a lot of short sellers to be pilled onto cnnwf too We have no idea how many companies they have tried naked shorting into the ground right I did some reading about the CEO Mooky Greidinger he seems cool enough I haven t seen him do any interviews in his underwear yet except I read that before he bought Regal he rented a car and drove around the United States visiting regal locations to check them out personally that s legit right His family has been in the movie business since the 1930 s his grandfather founded cinema city international I watched an interview with Mooky where he was asked about finances and he mentioned that he was not concerned about losing money because he loves movies and feels like theaters need to survive The wsb community should be comfortable embracing this concept yeah I feel like theaters will eventually come roaring back and find new ways to innovate like partnering with e sports companies for regional events perhaps Mooky has worked in the cinema theater since he was a kid He sold tickets at cinema city when it belonged to his grandfather then he inherited cinema city sold it to Cineworld in 2015 then becomes the CEO of Cineworld And in 2018 cineworld bought regal for 3 6bln So why isn t anyone talking about cnnwf Before I buy a stock I do my fundamental analysis on the company then I attempt to judge sentiment surrounding the company by reading forums like these while I employ amateur technical analysis to attempt to time a proper entry I have been moderately successful so far The daily volume on cnnwf is really low like I mentioned earlier and I went to one of those short interest calculators and it said that it would take 181 days to cover for cnnwf For other tickers it was a few days I don t know if this means anything significant What s the possibility of getting some kind of squeeze Im not trying to pump I m asking It just seems weird to me that a theater chain with the same recovery story in play as AMC that could be heavily shorted would not get more attention The sentiment around the stock seems non existent With everything on the verge of reopening post pandemic stocks like cnnwf will see more publicity What do you think I mostly joined reddit for memes you guys have some good ones I just was feeling like typing and to see if anyone wanted to listen and or join me in conversation about cnnwf stock Full disclosure I hold a small position in cnnwf lt 2 of my portfolio Is Cineworld Regal stock cnnwf under the radar undervalued Is cnnwf a good bet Maybe Am I wrong Thanks 
55,oczpfl,t2_b5bz735s,1625324553,/r/wallstreetbets/comments/oczpfl/daily_reminder_to_write_off_your_losses/,1,Daily reminder to write off your losses, removed 
56,oczpxj,t2_rma7o9x,1625324600,/r/wallstreetbets/comments/oczpxj/gamestop_roundups_get_gme_spending_credits_at_a/,1,Gamestop Roundups Get GME Spending Credits at a Discount RoundlyX Blog,
57,oczq9x,t2_p0ybs,1625324629,/r/wallstreetbets/comments/oczq9x/sofi_i_believe_noto_will_bring_green/,1, SOFI I Believe NOTO Will Bring Green,
58,oczvzl,t2_8dw5fahv,1625325136,/r/wallstreetbets/comments/oczvzl/why_arent_we_all_focusing_and_pumping_up_amc/,1,Why aren t we all focusing and pumping up AMC , removed 
59,oczwn8,t2_22xqfo8y,1625325195,/r/wallstreetbets/comments/oczwn8/dpls/,1,DPLS, removed 
60,oczy41,t2_clwk9j50,1625325321,/r/wallstreetbets/comments/oczy41/wish_is_hiring_an_ma_attorney_no_need_for_an_ma/,1, wish is hiring an M amp A attorney No need for an M amp A attorney if your not looking to do some M amp A right ,
61,oczycu,t2_68hxwast,1625325345,/r/wallstreetbets/comments/oczycu/discovery_inc_disck_is_an_upward_trend/,1,Discovery Inc DISCK is an upward trend,As of today Discovery communication DISCK was 29 million shares shorted Most of the naked short positions were instituted by Goldman Sachs Morgan Stanley and Credit Suisse 6 weeks ago Discovery s short position was 58 million The CEO of Discovery sold the great American country network for an undisclosed sum of money which will increase their revenues on August 6th Like clockwork Discovery stock always moves up in July because of shark week and the added impetus they have with the exclusive rights to the Olympics in Europe Methodically Goldman Sachs and Morgan Stanley are reducing their naked short positions of Discovery The CEO of Discovery is making the right moves to increase revenue shareholder value with the merger of Warner Brothers On August 6th Discovery incorporated will exceed not only their revenue but their earnings per share In my opinion the financial institutions will have to cover their naked short positions 
62,oczz2y,t2_9xnmm5o1,1625325407,/r/wallstreetbets/comments/oczz2y/anyone_else_got_a_piece_of_that_safemoon/,1,Anyone else got a piece of that safemoon ,
63,od002v,t2_aocvz99h,1625325490,/r/wallstreetbets/comments/od002v/when_the_top_10_investors_on_sofi_have_sofi_and/,1,When the top 10 investors on SoFi have SoFi and SoFi as their headline,
64,od00ph,t2_re5pe,1625325545,/r/wallstreetbets/comments/od00ph/what_ever_happened_to_that_open_and_close/,1,What ever happened to that Open and Close calendar of the week for stock trades , removed 
65,od04p3,t2_tyb55,1625325904,/r/wallstreetbets/comments/od04p3/this_new_acorns_style_platform_lets_you_round_up/,1,This new Acorns style platform let s you round up your spare change into GME credits at a discount Pamp the retail and the stock ,
66,od07e8,t2_5xk95ih1,1625326151,/r/wallstreetbets/comments/od07e8/license_plate_theory_dd_bc_to/,1,License Plate Theory DD BC to ,Gather round autists and let s discuss my personal method of stock picks based on license plates of cars that I like So driving to my wage cage this dreary Saturday morning I was passed by a very nice 5 series BMW in a very attractive dark blue color The license plate was BC2MN the rest of which I will not reveal for obvious reasons but it clearly signifies the gains coming for Brunswick Corporation Brunswick makes fucking yachts and yacht engine parts and accessories Those yacht parties your planning will be playing right into their hands Earnings have been steadily increasing and are due end of July I expect a blow out quarter why you ask Pandemics over people are traveling again it s summer so everyone has been getting their boats ready for the season oh and there s 55 SI on the stock Ignore the license plate at your own loss 
67,od07kd,t2_621tf6sn,1625326166,/r/wallstreetbets/comments/od07kd/found_this_unexpected_confirmation_bias_before/,1,Found this unexpected confirmation bias before pushing out to enjoy the holiday weekend HODL ,
68,od0968,t2_8tqdr5m0,1625326320,/r/wallstreetbets/comments/od0968/body_shorts/,1, BODY SHORTS,
69,od09lf,t2_6dsz9e2e,1625326359,/r/wallstreetbets/comments/od09lf/ocgn_up_13_afterhours/,1,OCGN up 13 afterhours, removed 
70,od0asc,t2_2x98cdwo,1625326460,/r/wallstreetbets/comments/od0asc/alex_karp_performs_a_magic_trick_during_palantir/,1,Alex Karp performs a magic trick during Palantir interview PLTR to the moon ,
71,od0ci7,t2_a22se782,1625326610,/r/wallstreetbets/comments/od0ci7/sfax_coin_new_coin_website_wwwsafemoonmaxcom/,1,SFAX COIN New coin website www safemoonmax com Contract address 0xa4b72b56495a947e16a0e1c2186b7b9b3ff78acd Telegram group https t me joinchat 3rDVcRMME480OGUx Chart https poocoin app tokens 0xa4b72b56495a947e16a0e1c2186b7b9b3ff78acd, removed 
72,od0clk,t2_78241p89,1625326618,/r/wallstreetbets/comments/od0clk/penny_stocks/,1,Penny stocks, removed 
73,od0hpe,t2_5xid2rph,1625327072,/r/wallstreetbets/comments/od0hpe/this_sub_changed_my_life_gone_from_wack_arse_job/,1,This sub changed my life gone from wack arse job saving to spending like a killer ape Much love to the Comunity,
74,od0ir6,t2_a41ped7s,1625327166,/r/wallstreetbets/comments/od0ir6/not_much_to_say_let_us_meet_at_the_moon_and_share/,1,Not much to say Let us meet at the moon and share stories on how the weak sold Wish, removed 
75,od0koe,t2_a3u8yx2s,1625327347,/r/wallstreetbets/comments/od0koe/when_people_tell_me_to_sell_my_two_favorite_stocks/,1,When people tell me to sell my two favorite stocks ,
76,od0lf1,t2_9lakpxfg,1625327414,/r/wallstreetbets/comments/od0lf1/we_still_holding_wish_its_at_1167_right_now_i/,1,We still holding wish It s at 11 67 right now I bought at 14 and 13 might buy some more should I boys , removed 
77,od0lgo,t2_d0b39zba,1625327419,/r/wallstreetbets/comments/od0lgo/shen_1875_special_dividend_pay_in_august_2/,1,SHEN 18 75 special dividend pay in August 2, removed 
78,od0lv6,t2_88ab00y8,1625327455,/r/wallstreetbets/comments/od0lv6/when_a_59_annual_return_just_isnt_enough/,1,When a 59 Annual Return Just Isn t Enough Investors appear to be growing more and more optimistic about how their portfolios will perform in the years to come Disappointment is bound to follow,
79,od0npl,t2_2x98cdwo,1625327625,/r/wallstreetbets/comments/od0npl/alex_karp_impresses_everyone_with_his_magic_trick/,1,Alex Karp impresses everyone with his magic trick during Palantir interview PLTR to the moon ,
80,od0out,t2_4a7a7x2f,1625327728,/r/wallstreetbets/comments/od0out/body_going_international/,1, BODY going International, removed 
81,od0p1u,t2_2x98cdwo,1625327747,/r/wallstreetbets/comments/od0p1u/alex_karp_impresses_everyone_with_his_magic_trick/,1,Alex Karp impresses everyone with his magic trick during Palantir interview PLTR to the moon ,
82,od0q1w,t2_4a7a7x2f,1625327840,/r/wallstreetbets/comments/od0q1w/body/,1, BODY,
83,od0q7r,t2_2x98cdwo,1625327854,/r/wallstreetbets/comments/od0q7r/alex_karp_impresses_everyone_with_his_magic_trick/,1,Alex Karp impresses everyone with his magic trick during Palantir interview PLTR to the moon ,
84,od0qbr,t2_af8tjf8o,1625327864,/r/wallstreetbets/comments/od0qbr/whoops/,1,Whoops , removed 
85,od0tkc,t2_kiu37zl,1625328149,/r/wallstreetbets/comments/od0tkc/anyone_interested_in_indian_stocks/,1,Anyone interested in Indian stocks,There are few stocks which I am using to double but I can t take it to moon alone Anyone interested Share name Vividha BE NSE
86,od0twv,t2_aocy7ebl,1625328179,/r/wallstreetbets/comments/od0twv/ayo_wtf_i_though_u_guys_had_my_back/,1,Ayo wtf i though u guys had my back,
87,od0u3b,t2_a144yyty,1625328194,/r/wallstreetbets/comments/od0u3b/what_are_the_top_cryptocurrencies_to_invest_in/,1,What Are The Top Cryptocurrencies To Invest In 2021 ,
88,od0uv0,t2_4k9rlz73,1625328261,/r/wallstreetbets/comments/od0uv0/medici_code/,1,Medici Code,Why the Medici Etherton s can not get an news article because the Medici Etherton Trust has an Artist Colony The celebrities in the Artist Colony think they are going to be the Medici Etherton s Proof Etherton and Washington the Medici s last name has the ton in it Ton is the weight for gold Celebrities from the Artist Colony with the ton El ton John Eric Clap ton Princess Kate Middle ton Bill amp Hillary Clin ton Wayne New ton Jennifer Anis ton Charl ton Hes ton Diane Kea ton Michael Kea ton E ton Prince ton cot ton Charles ton Bos ton Washing ton The Medici s have 5 last names Medici Bergerud Washing ton Ether ton amp Bell da Vinci Code Medici Code A Princess Angela de Medici America B Bergerud Bible book bank C King Cosimo de Medici D Prince Leonardo da Vinci de Medici day date E Etherton Evergreen F Prince Franc de Medici farm G Queen gena de Medici Etherton H horn horse I Italian J Juan Etherton K King Cosimo de Medici L Prince Leonardo da Vinci de Medici lake love M Medici The M in The Last Supper the Mayflower museum medicine Medina N Prince Lorenzo de Medici number organ piano O Opera orange P Protect us pepperoni q Queen gena de Medici Etherton r ruby s Superior Lake Superior t TIME u under V Prince Leonardo da Vinci de Medici w Washington x Prince Leonardo da Vinci de Medici CodeX y Etherton Yos emit e is time backwards Z Prince Lorenzo de Medici pi zza zoo zero Pi God The Pieta pi zza hos pi tal pi pie pipe Ca pi tol Co King Cosimo de Medici co mputer co de Co de X co mpass Co lumbia ca Roman Catholic church Ca pi tol can ee Princess Etherton s coffee green ll Bell zz Prince Lorenzo de Medici gg Queen gena de Medici Etherton nugget egg tt Prince Leonardo da Vinci de Medici cc King Cosimo de Medici el Etherton el evation el ephant oo Orchestra school book zoo Peacefully Queen gena de Medici Etherton
89,od0uxq,t2_3q4pl61n,1625328267,/r/wallstreetbets/comments/od0uxq/bngo_make_me_rich_took_huge_hits_on_amcholding/,1,BNGO make me rich Took huge hits on Amc holding PLTR Wkhs sofi Loaded the boat on BNGO all we need is a nice squeeze 23 SI short over 60m shares let s make them Pay one way or another 300 PT by 2025 do your own DD on it s possible squeeze potential it s 1000 there ,
90,od0zpo,t2_6ww2z2zy,1625328688,/r/wallstreetbets/comments/od0zpo/rinse_and_repeats/,1,Rinse and repeats ,I am looking for another rinse and repeat stock If you have any suggestions please let me know Also if you would like to talk about any indicators you use I would appreciate that too I currently use time in the seat i e lessons learned stochastics for over sold over bought standard deviation channel for easy trend identification If you have any other things you use such as profitability indicators etc please let s chat All opinions welcome 
91,od0zpv,t2_6ww2z2zy,1625328688,/r/wallstreetbets/comments/od0zpv/rinse_and_repeats/,1,Rinse and repeats ,I am looking for another rinse and repeat stock If you have any suggestions please let me know Also if you would like to talk about any indicators you use I would appreciate that too I currently use time in the seat i e lessons learned stochastics for over sold over bought standard deviation channel for easy trend identification If you have any other things you use such as profitability indicators etc please let s chat All opinions welcome 
92,od111m,t2_50816h05,1625328813,/r/wallstreetbets/comments/od111m/lets_get_this_disney_cheddar/,1,Let s get this Disney cheddar,
93,od1qd4,t2_5a8ostev,1625331087,/r/wallstreetbets/comments/od1qd4/this_is_wealthsimple_anyone_know_what_the_deal_is/,1,This is wealthsimple Anyone know what the deal is with this Time for me to move my shares to another exchange ,
94,od4c8w,t2_9tyo76y1,1625339524,/r/wallstreetbets/comments/od4c8w/what_happened/,1,What Happened , removed 
95,od4da1,t2_a7rz0ap8,1625339611,/r/wallstreetbets/comments/od4da1/why_is_wsb_not_leting_me_see_it_in_my_search_an/,1,Why is wsb not leting me see it in my search an saying i can t enter , removed 
96,od4dm8,t2_wa6e3,1625339643,/r/wallstreetbets/comments/od4dm8/wsb_needs_to_know_the_truth_dinu_and_shib_to_the/,1,WSB needs to know the TRUTH DINU AND SHIB TO THE MOON,
97,od4e7r,t2_45cuf8p5,1625339698,/r/wallstreetbets/comments/od4e7r/woooootttt_welcome_back/,1,WOOOOOTTTT Welcome Back , removed 
98,od4fjv,t2_yha4yvo,1625339804,/r/wallstreetbets/comments/od4fjv/for_etoro_team_is_not_a_bug_is_how_they_count/,1,For ETORO team is not a bug is how they count performance ,
99,od4gps,t2_yha4yvo,1625339902,/r/wallstreetbets/comments/od4gps/for_etoro_is_not_a_bug_is_how_they_count/,1,For ETORO is not a bug is how they count performance ,
0,od4gps,t2_yha4yvo,1625339902,/r/wallstreetbets/comments/od4gps/for_etoro_is_not_a_bug_is_how_they_count/,1,For ETORO is not a bug is how they count performance ,
1,od4him,t2_yha4yvo,1625339972,/r/wallstreetbets/comments/od4him/for_etoro_is_not_a_bug_is_how_they_count/,1,For ETORO is not a bug is how they count performance ,
2,od4hom,t2_7s6pj,1625339985,/r/wallstreetbets/comments/od4hom/bank_of_america_in_florida_foreclosed_on_by_angry/,1,Bank of America in Florida Foreclosed On by Angry Homeowner,
3,od4hq4,t2_a7rz0ap8,1625339989,/r/wallstreetbets/comments/od4hq4/wsb_locking_me_out/,1,Wsb locking me out,So wall street bets keeps locking me out from seeing it on my search bar and not rely coming up on my post now Not rely sure whats going on with all of this its just geting to be a pain in my ass to get here to talk Does anyone know what is going on with why i keep geting locked out from here at wallstreet bets I ve herd it was happening to several people 
4,od4i03,t2_a0q1075j,1625340014,/r/wallstreetbets/comments/od4i03/jb_poindexter_co_launches_eavx_wkhs/,1,JB Poindexter amp Co Launches EAVX WKHS,
5,od4igf,t2_a0ymsoyi,1625340057,/r/wallstreetbets/comments/od4igf/you_guys_are_bitches/,1,You guys are bitches, removed 
6,od4jkh,t2_5q02y80,1625340160,/r/wallstreetbets/comments/od4jkh/reddit_trading_group_wallstreetbets_goes_private/,1,Reddit Trading Group WallStreetBets Goes Private Where Will Retail Traders Go Now ,
7,od4jzw,t2_a2wgv17q,1625340195,/r/wallstreetbets/comments/od4jzw/hi_guys_any_person_have_fresh_news_about_work/,1,Hi guys any person have fresh news about Work Horse WKH Thanks , removed 
8,od4k7d,t2_6bbgnull,1625340214,/r/wallstreetbets/comments/od4k7d/how_often_do_we_see_this_kind_of_arguing_apes/,1,How often do we see this kind of arguing Apes have dignity Yes respect Should be iconic like a meme,
9,od4l9w,t2_a0ymsoyi,1625340309,/r/wallstreetbets/comments/od4l9w/fucking_idiots/,1,Fucking idiots, removed 
10,od4m9w,t2_12lizrk3,1625340401,/r/wallstreetbets/comments/od4m9w/well_thats_a_fuck_fo_a_way_to_find_out_bofa_has/,1,Well That s a fuck fo a way to find out BofA has mutal reprocity agreements with Kuwait Finance House banking ,Thanks a lot WSB I mean that It s been great and I ve loved the memes But shit just got real Call from the landlord today that the month s rent bounced which is weird because pay goes in on Thursday before the weekend He also says there s a courier delivery for me at the front desk Make a quick call to the ol Kuwait Finance House bank easy to do with the aldhahab line and they say there s been a complete freeze on all transactions and will not discuss over the phone Already have a appointment booked for me tomorrow morning with their customer service manager and told me to bring my lawyer Now This is quite unusual because if there s one thing about Kuwait and expeically KFH being an Islamic Bank is that they are as solid as a rock their steadfast honesty with money and contracts is the one thing I never worry about here So the only thing I know as I get into the elevator to go grab my courier delivery is that some deep shit is going on Enter the courier letter Without going all legalese mostly because I don t understand it all the thing I gather from the letter is that my local Kuwaiti Fucking Bank has frozen everything accounts investments loan payments pending outcome of some judicial hearings due to some type of documents they ve received at the behest of the American Embassy here representing our old friends at BofA Whiskey Tango Foxtrot Next call was to an attorney and the first two won t have anything to due with me as soon as I said bank freeze and US Embassy Third company wanted an initial retainer worth more than three month salary but what choice do I have Glad I keep a little stashed away for a rainy day but now the kicker after several hours waiting on them I ve been advised not to travel outside the country That s the polite way of saying I cannot travel outside the country my civil ID is blacklisted for border crossings Just sitting here in a bit of a panic because I m not a lawyer my parents were married but I guess I ll find out more tomorrow This is all happening so fast As of right now Mrs InKuwait emptied our home safe and is the process of travelling back to her home in Romania Thanks love See you when the shit clears I guess So again WSB you re all I got Keep it real and I ll check in as a find out more Staying strong for you all Mod Dan inKuwait 
11,od4onl,t2_a2wgv17q,1625340622,/r/wallstreetbets/comments/od4onl/hi_guys_any_fresh_news_from_wkh/,1,Hi guys any fresh news from WKH , removed 
12,od4p41,t2_4m1dpd0t,1625340666,/r/wallstreetbets/comments/od4p41/if_theta_decay_was_an_account/,1,If Theta Decay was an Account,
13,od4qb3,t2_64uofv5o,1625340775,/r/wallstreetbets/comments/od4qb3/another_tilray_post/,1,Another Tilray post,It been a couple of weeks since I last posted on Tilray I haven t been too focused on watching the market because I ve been super busy at work Us military folks don t make a lot of money so I m on sitting on about 120 shares Been a while since I ve bought any and I was wanting some opinions is now the time to buy Or wait later because the price might drop more It s been steadily declining throughout the week and we all wait for the perfect moment if we can get it I m hoping to see TLRY get back up to around 20 after this long weekend happy 4th btw and stay around that for a while till it bounds higher again once the company s earning go back up If y all haven t bought in yet you don t want to miss out Legalization is gonna happen and it s gonna send TLRY to the moon 
14,od4snx,t2_a5grohor,1625340990,/r/wallstreetbets/comments/od4snx/follow_cryptowave93_on_twitter_if_you_are_in_to/,1,Follow cryptowave93 on Twitter if you are in to binance smart chain gems,
15,od4sxz,t2_bd8lgtlv,1625341016,/r/wallstreetbets/comments/od4sxz/together_and_organized_we_can_do_it/,1,TOGETHER and ORGANIZED we can do it, removed 
16,od4tfq,t2_3vmptw8f,1625341058,/r/wallstreetbets/comments/od4tfq/gotta_love_glitches/,1,Gotta love glitches ,
17,od4tjk,t2_i716f,1625341069,/r/wallstreetbets/comments/od4tjk/the_bofa_joke_didnt_get_me/,1,The BOFA joke didn t get me, removed 
18,od4tkq,t2_d36twmgv,1625341072,/r/wallstreetbets/comments/od4tkq/astr_headed_to_low_earth_orbit/,1, ASTR headed to low earth orbit,
19,od4tw3,t2_3hgwnaf7,1625341100,/r/wallstreetbets/comments/od4tw3/mercurity_fintech_holdings_mfh_decentralized/,1,Mercurity Fintech Holdings MFH Decentralized Stonks , removed 
20,od4v5x,t2_bd8lgtlv,1625341223,/r/wallstreetbets/comments/od4v5x/together_and_organized_we_can_do_it/,1,TOGETHER and ORGANIZED we can do it , removed 
21,od4waf,t2_i716f,1625341330,/r/wallstreetbets/comments/od4waf/guys_the_bofa_joke_totally_didnt_get_me/,1,Guys the BofA joke totally didn t get me , removed 
22,od4wdh,t2_3vmptw8f,1625341338,/r/wallstreetbets/comments/od4wdh/well_gotta_love_glitches/,1,Well gotta love glitches ,
23,od4wfu,t2_apwffep9,1625341344,/r/wallstreetbets/comments/od4wfu/gme_yolo/,1,GME yolo,
24,od4wsu,t2_cplgr6jw,1625341376,/r/wallstreetbets/comments/od4wsu/think/,1,Think ,
25,od4xo3,t2_bd8lgtlv,1625341459,/r/wallstreetbets/comments/od4xo3/together_and_organized_we_can_do_it/,1,TOGETHER and ORGANIZED we can do it, removed 
26,od4y3n,,1625341499,/r/wallstreetbets/comments/od4y3n/can_someone_explain_this_sub_to_me_i_dont_get_it/,1,Can someone explain this sub to me I don t get it,
