,postid,author,created_utc,permalink,score,title,selftext
24,obl7bk,t2_7jjadjp1,1625143971,/r/wallstreetbets/comments/obl7bk/what_can_i_do_with_an_extra_140_buying_power/,1,What can I do with an extra 140 buying power , removed 
25,obl7dk,t2_15eh8c,1625143977,/r/wallstreetbets/comments/obl7dk/amd_xlnx_acquisition/,1,AMD XLNX acquisition,If and xilinx acquisition is approved xilinx shares are converted to 1 72 AMD shares XLNX 144 64 AMD 94 94 x 1 72 161 XLNX is going up slower than AMD currently and is a bargain if approved Source https www google com url sa t amp source web amp rct j amp url https www thestreet com amp investing amd acquisition of xilinx approved by shareholders amp ved 2ahUKEwie7IuX9MHxAhWHWc0KHZaeCHkQFjAAegQIBBAC amp usg AOvVaw3i4RZQSNgPBnelAE968YoK amp ampcf 1
26,obl80w,t2_8z80e6og,1625144044,/r/wallstreetbets/comments/obl80w/deep_value_mortgage_merchant_ldi_loan_depot/,1,Deep value mortgage merchant LDI Loan Depot, So there s this loan company that s not so talked about The name is loan depot LDI If you own a home you may have been regularly harassed by their refinance team These people are ruthless at solicitation What s that tell me They secure a fuck ton of loans that s what that tells me insert big titty lady bent over lambo jpg They went public feb 11th at 14 and shot up to 40 settled around the 20 s and then guess what Got shorted to shit know why The only people that know about this company are the hedgies Retail hasn t found this deep value play yet Here s some things and stuff Revenue 5 22B Gross profit 4 36B Quarterly revenue growth 114 40 Revenue per share 41 33 Diluted earning per share 16 29 1 39B in cash on hand Short interest Short of float as of 6 15 21 is 8 66 2nd largest non bank mortgage broker in the USA Stock price currently sitting at 12 85 52 week low is 12 05 We can easily get this thing back to 39 85 and above At 12 85 the value and possibilities are huge Average volume is only 322k rookie numbers gotta pump that up Home loans through the roof Refinances through the roof Interest rates still down So home sales up bigly Just hit another record sales month If interest rates go up in the coming months sales likely slow but then profit margin increases which should balance out Loan depot bundling these mortgage bitches up and selling them I don t believe there s a short squeeze to be had at this point The shorting has gone down a lot The stock price is near the absolute bottom This is a simple value play on an undervalued stock If people buy price goes up They showed record growth and profits on may 3rd earnings release and yet the stock has sunken deeper into the value bin Home Mortgage Refinance and Home Equity Loans loanDepot LDI 12 85 0 31 on Yahoo Finance https finance yahoo com quote LDI p LDI TLDR mortgage merchant has incredible business profits and earnings but is in the deep value range because retail don t know about them much yet Position 100 shares at 12 86 because I m broke Brain to smooth for this to be financial advice 
27,obl93d,t2_ciwmx1ej,1625144147,/r/wallstreetbets/comments/obl93d/china_wont_stand_for_foreign_bullying/,1,China won t stand for foreign bullying ,
28,obl9wb,t2_amkwfuvw,1625144227,/r/wallstreetbets/comments/obl9wb/flyn_high_in_july/,1,Fly n high in July ,
29,obl9zd,t2_1bvvzlqy,1625144235,/r/wallstreetbets/comments/obl9zd/fuck_it_if_anyones_down_im_down/,1,Fuck it if anyones down i m down ,Block buster is on the verge of dying If we invest now we should be able to suffice block buster and make heaps of money Dump them bags into this stock i ll dump 30 grand MEME STOCK FTW I know you lads can do it YOLO
30,oblach,t2_clm4rb52,1625144269,/r/wallstreetbets/comments/oblach/what_are_you_currently_using_for_the_best_most/,1,What are you currently using for the best most recent company news market data ,Good Morning Fellow Apes I ve been using a couple of apps to source my news but everyone has their cons and most require a subscription Here are some that I currently use amp x200B SeekingAlpha I like this the best although I know others have mixed feelings It gives me great info on my portfolio and alerts me of any news related to my securities BUT you can only read a few articles per month before it requires you to pay for a subscription amp x200B FinWiz great for market analysis amp x200B MarketWatch ehhh it s okay A lot of digging through irrelevant news to find articles I actually care about IMO amp x200B Bloomberg just downloaded haven t used it much yet amp x200B What are your thoughts on these and what other apps would you recommend for latest news market data 
31,oblahf,t2_amkwfuvw,1625144283,/r/wallstreetbets/comments/oblahf/flyn_high_in_july/,1,Fly n high in July ,
32,oblce5,t2_aum3pokz,1625144442,/r/wallstreetbets/comments/oblce5/any_one_on_blin/,1,Any one on BLIN , removed 
33,oblcw4,t2_cr40fqa1,1625144484,/r/wallstreetbets/comments/oblcw4/sales_from_their_q1_conference_call/,1,Sales from their Q1 conference call pre post pandemic evfm,
34,obld11,t2_8wuljtih,1625144490,/r/wallstreetbets/comments/obld11/should_i_invest_in_beyond_meat/,1,Should I invest in beyond meat , removed 
35,oblehz,t2_69umy6rj,1625144623,/r/wallstreetbets/comments/oblehz/acct_was_hacked_unauthorized_transfer_out_of_my/,1,Acct was hacked unauthorized transfer out of my acct and now robinhood won t answer my emails, Anybody went through the same thing Acct was hacked unauthorized individual made significant transfer out of my acct and now robinhood won t return my emails Couple of questions 1 As soon as i realize my acct was hacked I notified robinhood Why couldnt they stop the unauthorized transfer right away It was only been one day 2 What can i do now in terms of trying to get my money back I read other horror stories but robinhood usually made the corrections But robinhood is not returning my emails now 3 Should i seek legal action Thanks everyone
36,obleic,t2_cr40fqa1,1625144624,/r/wallstreetbets/comments/obleic/take_a_look_at_the_action_in_evfm_the_insider/,1,Take a look at the action in evfm The insider buying in June says that consolidation is real look for a breakout prior to earnings ,
37,oblg85,t2_69umy6rj,1625144781,/r/wallstreetbets/comments/oblg85/acct_was_hacked_unauthorized_transfer_out_of_my/,1,Acct was hacked unauthorized transfer out of my acct and now robinhood won t answer my emails, Anybody went through the same thing Acct was hacked unauthorized individual made significant transfer out of my acct and now robinhood won t return my emails Couple of questions 1 As soon as i realize my acct was hacked I notified robinhood Why couldnt they stop the unauthorized transfer right away It was only been one day 2 What can i do now in terms of trying to get my money back I read other horror stories but robinhood usually made the corrections But robinhood is not returning my emails now 3 Should i seek legal action Thanks everyone
38,oblhvq,t2_av5ek5h5,1625144943,/r/wallstreetbets/comments/oblhvq/hive_blockchain_is_uplifting_to_nasdaq_today_only/,1,Hive Blockchain is uplifting to Nasdaq today Only Green Ether Miner HVBT,Only Green Ether miner Member of Michael Saylor North American Bit Council along with ARGO BLOCKCHAIN MARA RIOT only 8 original members Council is meeting today at 5pm to post their Green Data HVBT HIVE BLOCKCHAIN is 100 percent GREEN ENERGY ETHER and BIT miner from Canada Lists on Nasdaq today HVBT
39,obliaq,t2_26mqx3au,1625144984,/r/wallstreetbets/comments/obliaq/_/,1, ,
40,oblih3,t2_aum3pokz,1625145002,/r/wallstreetbets/comments/oblih3/yesterday_blin_just_hit_a_run_of_300_does_anyone/,1,Yesterday BLIN just hit a run of 300 does anyone knows why , removed 
41,oblik0,t2_9tblcdtp,1625145010,/r/wallstreetbets/comments/oblik0/this_was_all_i_needed/,1,This was all I needed ,
42,oblj8r,t2_3ahooo53,1625145074,/r/wallstreetbets/comments/oblj8r/gme_210_is_the_new_40/,1,GME 210 is the new 40,
43,oblj94,t2_a0rnfs3n,1625145074,/r/wallstreetbets/comments/oblj94/trade_in_mexico_recommend_me_one_app_or_plataform/,1,Trade in Mexico recommend me one App or plataform to invest in MEX Rhood is not available, removed 
44,obljfd,t2_8wuljtih,1625145091,/r/wallstreetbets/comments/obljfd/should_i_invest_in_beyond_meat/,1,Should I invest in beyond meat , removed 
45,obljnb,t2_bxmxq96b,1625145112,/r/wallstreetbets/comments/obljnb/motnf_will_be_the_next_big_thing/,1,MOTNF will be the next big thing , removed 
46,oblkms,t2_1up9izio,1625145203,/r/wallstreetbets/comments/oblkms/wish_yolo/,1,WISH YOLO ,
47,obll2b,t2_azdnmfo,1625145241,/r/wallstreetbets/comments/obll2b/where_the_autists_go/,1,Where the autists go ,
48,obllbt,t2_8z80e6og,1625145269,/r/wallstreetbets/comments/obllbt/deep_value_mortgage_merchant_ldi_loan_depot/,1,Deep value mortgage merchant LDI Loan Depot, So there s this loan company that s not so talked about The name is loan depot LDI If you own a home you may have been regularly harassed by their refinance team These people are ruthless at solicitation What s that tell me They secure a fuck ton of loans that s what that tells me insert big titty lady bent over lambo jpg They went public feb 11th at 14 and shot up to 40 settled around the 20 s and then guess what Got shorted to shit know why The only people that know about this company are the hedgies Retail hasn t found this deep value play yet Here s some things and stuff Revenue 5 22B Gross profit 4 36B Quarterly revenue growth 114 40 Revenue per share 41 33 Diluted earning per share 16 29 1 39B in cash on hand Short interest Short of float as of 6 15 21 is 8 66 2nd largest non bank mortgage broker in the USA Stock price currently sitting at 12 85 52 week low is 12 05 We can easily get this thing back to 39 85 and above At 12 85 the value and possibilities are huge Average volume is only 322k rookie numbers gotta pump that up Home loans through the roof Refinances through the roof Interest rates still down So home sales up bigly Just hit another record sales month If interest rates go up in the coming months sales likely slow but then profit margin increases which should balance out Loan depot bundling these mortgage bitches up and selling them I don t believe there s a short squeeze to be had at this point The shorting has gone down a lot The stock price is near the absolute bottom This is a simple value play on an undervalued stock If people buy price goes up They showed record growth and profits on may 3rd earnings release and yet the stock has sunken deeper into the value bin Home Mortgage Refinance and Home Equity Loans loanDepot LDI 12 85 0 31 on Yahoo Finance https finance yahoo com quote LDI p LDI TLDR mortgage merchant has incredible business profits and earnings but is in the deep value range because retail don t know about them much yet Position 100 shares at 12 86 because I m broke Brain to smooth for this to be financial advice 
49,oblm4x,t2_a5x3rcj2,1625145345,/r/wallstreetbets/comments/oblm4x/how_its_goin_to_feel_when_clov_yolo/,1,How It s goin to feel when CLOV YOLO ,
50,oblm5h,t2_av5ek5h5,1625145346,/r/wallstreetbets/comments/oblm5h/hive_blockchain_uplifting_to_nasdaq_today_hvbt/,1,HIVE BLOCKCHAIN UPLIFTING TO NASDAQ TODAY HVBT ONLY GREEN ETHER MINER HVBT, removed 
51,oblmdi,t2_aqajw0dk,1625145367,/r/wallstreetbets/comments/oblmdi/wall_street_journal_watchlist_for_today/,1,Wall Street Journal Watchlist for today,Market Movers to Watch Shares of chip maker Micron Technology slipped 2 1 premarket despite a better than expected earnings report and strong demand for memory chips Franklin Covey s shares jumped more than 8 off hours after the business consultancy reported earnings and lifted its forward guidance Is Elon Musk s sway over dogec fading The Tesla chief executive who has shifted the joke cryptocurrency s value with past statements tweeted lyrics in which he substituted Baby Shark from the Korean nursery rhyme for Baby Dog Dogec was roughly flat Thursday near 25 U S cents Other cryptocurrencies fell Thursday Bitc declined 3 from its 5 p m ET level Wednesday to trade at 33 555 92 Ether the second largest cryptocurrency by market value moved 4 8 lower CureVac s shares fell more than 10 premarket after the company released the final results for its once promising Covid 19 vaccine finding it provided less protection than the vaccines already authorized for use in the U S A nurse removed a dose of CureVac s vaccine from a refrigerator for its clinical trial Feb 8 2021 A nurse removed a dose of CureVac s vaccine from a refrigerator for its clinical trial Feb 8 2021 PHOTO H BILBAO ZUMA PRESS Shares of Atotech edged down 0 6 premarket after MKS Instruments said Thursday it had reached an agreement to acquire the chemicals technology company in a cash and stock deal with an equity value of 5 1 billion and an enterprise value of about 6 5 billion Atotech went public on the New York Stock Exchange in February Walgreens Boots Alliance shares added 2 3 premarket after the company posted stronger sales in the fiscal third quarter as the company s role in the roll out Covid 19 vaccinations coincided with improving pharmacy and retail sales Source https www google com co amp s www wsj com amp articles micron technology curevac franklin covey what to watch when the stock market opens today 11625137195
52,obln6p,t2_87stfmxb,1625145437,/r/wallstreetbets/comments/obln6p/investment_bankers_i_know_that_there_are/,1,Investment bankers I know that there are restrictions on investing personal funds in stocks but I was wondering whether investment bankers can trade options freely Specifically I am interested in covered calls , removed 
53,obln8e,t2_9tblcdtp,1625145441,/r/wallstreetbets/comments/obln8e/i_like_the_tech/,1,I like the tech,
54,oblo6h,t2_44bxrrp,1625145525,/r/wallstreetbets/comments/oblo6h/short_interest_plummets_as_short_sellers_abandon/,1,Short interest plummets as short sellers abandon GME This has to be fake right , https wccftech com gamestop short sellers flee as short interest drops by 880 million in 2 weeks https wccftech com gamestop short sellers flee as short interest drops by 880 million in 2 weeks 
55,obloai,t2_86pj1wjy,1625145538,/r/wallstreetbets/comments/obloai/dnut_lets_send_krispy_kreme_to_the_moon/,1, DNUT let s send Krispy Kreme to the moon , removed 
56,obloex,t2_a1o6e4un,1625145550,/r/wallstreetbets/comments/obloex/wish_is_officially_htb/,1,Wish is officially HTB ,
57,oblokp,t2_ci94f1ad,1625145567,/r/wallstreetbets/comments/oblokp/kmart_to_the_moon/,1,KMART TO THE MOON , removed 
