,postid,author,created_utc,permalink,score,title,selftext
0,oco50p,t2_63x9t50y,1625275405,/r/wallstreetbets/comments/oco50p/brqs_to_10/,1,BRQS to 10,The next MRIN boys and girls This 5G technology will take and blow away the world We going to take over shoot past AMC GME and everyone else 
1,oco5bu,t2_rbmg8qp,1625275440,/r/wallstreetbets/comments/oco5bu/market_only_go_uppie/,1,Market only go Uppie,
2,oco5j3,t2_5ineqhqk,1625275463,/r/wallstreetbets/comments/oco5j3/pantheon_resources_worth_a_hard_look/,1,Pantheon Resources worth a hard look , removed 
3,oco6uj,t2_9yzs777d,1625275606,/r/wallstreetbets/comments/oco6uj/remember_aabb_ready_to_explode/,1,Remember AABB ready to explode, removed 
4,oco7li,t2_5fmtj,1625275691,/r/wallstreetbets/comments/oco7li/i_finally_did_it_guys/,1,I finally did it guys ,
5,oco89d,t2_5ineqhqk,1625275763,/r/wallstreetbets/comments/oco89d/pantheon_resources_has_been_moving_10_a_day_big/,1,Pantheon Resources has been moving 10 a day Big oil discovery in Alaska Timing is now Not a lot of shares moves fast , removed 
6,oco8i1,t2_9yzs777d,1625275790,/r/wallstreetbets/comments/oco8i1/will_aabb_ever_go_up/,1,Will AABB ever go up, removed 
7,oco93o,t2_1alxqy81,1625275851,/r/wallstreetbets/comments/oco93o/lets_get_amc_and_shiba_inu_coin_together/,1,Let s get AMC and SHIBA Inu coin together ,Hey I ve setup a Change org link regarding trying to get AMC theater to start accepting SHIBA INU coin as currency I think the two entities compliment each other very well and could help each other take us all to the moon chng it bLDwPFvh Traditional movie theaters like AMC need to update and adapt or risk extinction like Blockbuster video when Netflix came around If AMC were to pair with a popular affordable cryptocurrency like SHIBA INU coin then the sky is the limit 
8,ocoats,t2_a29ismvt,1625276035,/r/wallstreetbets/comments/ocoats/fteg_load_up/,1,FTEG Load up,They are putting in 30 clinics by the years end stem cell injections amniotic fluid treatments East amp West medicine combined If it just reaches its ATH it will triple your money expect it to go even higher as they build out more clinics and generate more revenue 
9,ocob4m,t2_6o9bbxfs,1625276065,/r/wallstreetbets/comments/ocob4m/baba_shorts/,1,BABA shorts,
10,ocobrq,t2_ynkim,1625276137,/r/wallstreetbets/comments/ocobrq/explanation_aapl_jul_02_139c_1800/,1,Explanation AAPL JUL 02 139C 1 800 , removed 
11,ocobtv,t2_300rvpfc,1625276144,/r/wallstreetbets/comments/ocobtv/debit_callput_spreads_tax_report/,1,Debit call put spreads tax report,Hello everyone I started trading options last year got a little too brave and made a few debit spreads without knowing too much about it so this year when importing my tax document to turbo tax from robinhood those trades get flagged as incorrect and won t be accepted I m making this post with the hope to find someone who knows more than I do and can help me figure out how to report them I am willing to pay for the help as long as I can file my taxes as they should be thank you in advance to anyone who takes the time to help me 
12,ococa4,t2_6o9bbxfs,1625276195,/r/wallstreetbets/comments/ococa4/baba/,1,BABA ,
13,ocod0c,t2_a0hjlw4s,1625276278,/r/wallstreetbets/comments/ocod0c/loss_today_but_will_win_more_next_week_shorts/,1,Loss today but will win more next week Shorts have covered PIPE selling is over ,
14,ocodlf,t2_9iyfvv10,1625276344,/r/wallstreetbets/comments/ocodlf/hut_8_mining_up_42_this_week/,1,HUT 8 Mining up 42 this week , removed 
15,ocoe5p,t2_1xozocsk,1625276405,/r/wallstreetbets/comments/ocoe5p/pov_amc_and_me_before_the_bell_tuesday_morning/,1,POV gt AMC and me before the bell Tuesday morning spending what s left of daddy s cash buying the dip TO THE FUCKING MOON YALL ,
16,ocofc8,t2_a31sd9zc,1625276534,/r/wallstreetbets/comments/ocofc8/squeeze_body_236_short_down_20_in_3_days_and/,1,Squeeze BODY 236 short down 20 in 3 days and options volume is 5 digits on some calls ,
17,ocojaa,t2_clx191en,1625276963,/r/wallstreetbets/comments/ocojaa/stock_si/,1,Stock si,A guy called MOONROCKET42069 said he heard from a guy who lives in his moms basement ran some numbers from a fortune cookie on his commodore 64 That proves the stock is shorted 420 and they MUST cover on July 5th and we will see a minimum of 69x increase in penis size 
18,ocol3w,t2_a1tf7mdv,1625277162,/r/wallstreetbets/comments/ocol3w/srne/,1,SRNE ,
19,ocol6i,t2_a87ipcdq,1625277170,/r/wallstreetbets/comments/ocol6i/everytime_i_come_around_blin_blin_the_way_im/,1,Everytime I come around Blin Blin The way I m feeling I m not even going get mad if my wife not going give me some ass it be her lost , removed 
20,ocoll0,t2_39vyqrhv,1625277212,/r/wallstreetbets/comments/ocoll0/amc_yolo_lets_go_everything_i_have/,1, AMC YOLO LETS GO EVERYTHING I HAVE,
21,ocolpb,t2_98503hc7,1625277225,/r/wallstreetbets/comments/ocolpb/squeeze_body_has_a_236_short_and_is_down_20_in_3/,1,Squeeze BODY Has a 236 short and is down 20 in 3 days Why is no one talking about this ,
22,ocolwj,t2_12rtw8,1625277245,/r/wallstreetbets/comments/ocolwj/weekend_update/,1,Weekend update,
23,ocombl,t2_22xqfo8y,1625277293,/r/wallstreetbets/comments/ocombl/first_timer/,1,First timer, removed 
24,ocomnk,t2_6vsjc,1625277328,/r/wallstreetbets/comments/ocomnk/started_with_159_amc_put_on_62_kept_rolling_daily/,1,Started with 159 AMC put on 6 2 Kept rolling daily profit into NVDA AMD and AAPL calls 2 100 monthly return ,
25,ocon6h,t2_8f73lk3t,1625277385,/r/wallstreetbets/comments/ocon6h/love_to_see_it/,1,Love to see it,
26,ocoo6z,t2_9y35gvrk,1625277497,/r/wallstreetbets/comments/ocoo6z/baba_short_interest/,1, BABA short interest,
27,ocoo8y,t2_6o9bbxfs,1625277502,/r/wallstreetbets/comments/ocoo8y/baba/,1,BABA ,
28,ocop0o,t2_84sgvab9,1625277586,/r/wallstreetbets/comments/ocop0o/geni_hit_or_miss/,1,GENI hit or miss , removed 
29,ocops5,t2_9y35gvrk,1625277650,/r/wallstreetbets/comments/ocops5/savealibaba_alibaba_intelligence/,1, savealibaba alibaba intelligence,
30,ocoqqn,t2_a1nzb0gv,1625277745,/r/wallstreetbets/comments/ocoqqn/tsxv_emo_emerita_resources_up_550_in_the_last_3/,1,TSXV EMO Emerita Resources Up 550 in the last 3 months Significant growth potential still undervalued, removed 
31,ocoqsk,t2_9y35gvrk,1625277751,/r/wallstreetbets/comments/ocoqsk/savealibaba_alibaba_intelligence_stop_elon/,1, SaveAlibaba alibaba intelligence stop Elon,
32,ocor7x,t2_a1nzb0gv,1625277797,/r/wallstreetbets/comments/ocor7x/emerita_resources_up_549_in_the_last_3_months/,1,Emerita Resources up 549 in the last 3 months still hugely undervalued , removed 
33,ocos6r,t2_a5peulgr,1625277897,/r/wallstreetbets/comments/ocos6r/save_animal_lives/,1,save animal lives, removed 
34,ocot0n,t2_54sxr7q1,1625277981,/r/wallstreetbets/comments/ocot0n/six_flags_experiment/,1,Six flags experiment ,
35,ocou3a,t2_54sxr7q1,1625278094,/r/wallstreetbets/comments/ocou3a/experimenting/,1,Experimenting ,
36,ocoult,t2_9y35gvrk,1625278144,/r/wallstreetbets/comments/ocoult/amc_and_gamestop_vs_citadel/,1,AMC and GameStop vs citadel,
37,ocouvc,t2_27pimcui,1625278174,/r/wallstreetbets/comments/ocouvc/wsb_token/,1,WSB token ,I don t see much here on that token I know this is violating rule 4 however is this actually a Wall Street Bets endeavor or scam 
38,ocov7o,t2_54sxr7q1,1625278209,/r/wallstreetbets/comments/ocov7o/6flags_experiment/,1,6flags experiment,
39,ocowd3,t2_54sxr7q1,1625278332,/r/wallstreetbets/comments/ocowd3/6_flags_experiment_where_do_you_guys_see_this/,1,6 flags experiment Where do you guys see this going up or down ,
40,ocoxqg,t2_4g95hvn5,1625278484,/r/wallstreetbets/comments/ocoxqg/can_someone_explain_trading_options_for_a_trading/,1,Can someone explain trading options for a trading noob , removed 
41,ocoxrk,t2_9y35gvrk,1625278487,/r/wallstreetbets/comments/ocoxrk/savealibaba_stopelon_alibaba_intelligence/,1, SaveAlibaba stopElon AliBaba intelligence, removed 
42,ocozx5,t2_a87ipcdq,1625278713,/r/wallstreetbets/comments/ocozx5/every_time_i_come_around_blin_blin/,1,Every time I come around Blin Blin ,Lately my wife been annoyed by me because I spend too much time on my phone The stock market rabbit hole sucked me right up I started trading 8 months ago I m still a young grasshopper Every thing now revolves on the market From doing endless researching on different stocks from even falling into treys trades bullshit I must admit that fucking guy makes me happy on my shares so in the beginning my gullible ass ate it all up I even invested more money as long as my step kids and my wife is all good Yes I married a single mom so tf what But lately I noticed she been mad at me and I been getting lack of buttcheeks Of course thoughts of infidelity popped up in my head But there s nothing that gives any signs of wrong doing Maybe it could be my insecurities maybe so Can t blame me it been two in half years that I been with my ex wife that I spent 13 years with And boom all down the drain because she wanted to cheat on me with one of my friends Where was I at oh yeah lack of horny time I might be in the dog house now but I m doing this for our family Man it feels good devoting time on something and all you see is gains as a result Moral of the story I m not even going get mad if she not going give me some ass This adderall not going to waste its a joke don t crucify me sheesh It s her lost anyway
43,ocp07n,t2_wafbi,1625278743,/r/wallstreetbets/comments/ocp07n/still_pretty_new_but_i_think_its_fair_to_say_i/,1,Still pretty new but I think it s fair to say I have officially mastered the art of the deal ,
44,ocp0bw,t2_84sgvab9,1625278755,/r/wallstreetbets/comments/ocp0bw/geni_is_going_to_give_me_3_wishes_every_super_bowl/,1,GENI IS GOING TO GIVE ME 3 WISHES EVERY SUPER BOWL,
45,ocp0g4,t2_zsuq4,1625278768,/r/wallstreetbets/comments/ocp0g4/ivr/,1,IVR, removed 
46,ocp0x7,t2_49b2kvf,1625278815,/r/wallstreetbets/comments/ocp0x7/husband_pissed_me_off_so_i_bought_my_bf_some/,1,Husband pissed me off so I bought my bf some tendies and ice cream,
47,ocp1go,t2_84sgvab9,1625278863,/r/wallstreetbets/comments/ocp1go/sports_betting_gaining_traction_lets_see_geni/,1,SPORTS BETTING GAINING TRACTION LETS SEE GENI CALLS SUPER BOWL 2022 ,
48,ocp1i3,t2_a2n9pdge,1625278867,/r/wallstreetbets/comments/ocp1i3/drunken_rant/,1,Drunken rant,I m still holding hedgie fucks When are these people going to realize the deep shit they re standing in With the massive artificial shares massive interest owed and the main fact that retail owns their asses literally Ken s ass was online for sale about 500M just a joke dont quote me on comedy Just remember these three things and as Mr Marley once said everything going to be alright Cheers to those who started this awakening and to those that will see it to the end Peace and love to all 
49,ocp22g,t2_129x8z,1625278932,/r/wallstreetbets/comments/ocp22g/is_wave_ipo_to_risky_of_a_trade/,1,Is WAVE IPO to risky of a trade ,It had a big day today was up 73 at the end of the day You all think that it may run up again after a 3 day weekend or should I just stay away from it
50,ocp264,t2_8iirud4c,1625278942,/r/wallstreetbets/comments/ocp264/to_the_rich_play_is_work_and_work_is_play/,1,To the Rich Play is Work and Work is Play, removed 
51,ocp29c,t2_b7yq7ofn,1625278952,/r/wallstreetbets/comments/ocp29c/opinions_on_lac/,1,Opinions on LAC,Just wondering why no one here talks about it Great growth potential with lithium being the future and all is it a good dip to buy into 
52,ocp3ch,t2_76zimapu,1625279061,/r/wallstreetbets/comments/ocp3ch/dealers_choice/,1,Dealer s Choice ,
53,ocp3lo,t2_a22ujcee,1625279089,/r/wallstreetbets/comments/ocp3lo/chipotle_vs_mcdonalds/,1,Chipotle Vs McDonald s, removed 
54,ocp3ym,t2_49b2kvf,1625279126,/r/wallstreetbets/comments/ocp3ym/husband_pissed_me_off_so_bought_some_tendies_and/,1,Husband pissed me off so bought some tendies and ice cream for my bf,
55,ocp493,t2_9cwee6gd,1625279156,/r/wallstreetbets/comments/ocp493/i_dont_have_much_but_i_did_yolo_5_k_into_poai/,1,I don t have much but I did yolo 5 k into Poai fundamentals look great and there might be a catalyst soon , removed 
56,ocp4or,t2_a22ujcee,1625279204,/r/wallstreetbets/comments/ocp4or/does_anyone_know_why_chipotle_is_valued_more_1500/,1,Does anyone know why Chipotle is valued more 1500 a share vs McDonald s at 200 a share MCD is an international company and Chipotle is national How is this possible , removed 
57,ocp6kv,t2_49b2kvf,1625279401,/r/wallstreetbets/comments/ocp6kv/fucking_boys_and_bots_husband_pissed_me_off/,1,Fucking boys and bots husband pissed me off bought the bf tendies and ice cream,
58,ocp755,t2_129x8z,1625279458,/r/wallstreetbets/comments/ocp755/is_wave_ipo_to_risky_of_a_trade/,1,Is WAVE IPO to risky of a trade ,At one point today it was up over 100 after running up to 40 in the premarket and hitting a high of 30 in the regular market It slowly dropped and closed up 73 at 18 79 and continued to drop during after hours However it closed after hours on a green candle It s forming a descending wedge on the 5 minute chart and the MACD looks good Do you all think that the 3 day weekend will help it run up again Or should I stay away from it Also I m the premarket when it ran up to 40 there was 0 relative volume how is this possible Thanks 
59,ocp84j,t2_8w6cxtq9,1625279556,/r/wallstreetbets/comments/ocp84j/amc_happy_4th_of_july_weekend_to_all_you_apes/,1, AMC Happy 4th of July weekend to all you APES Your mission this long weekend is to talk to your families and friends and make 1 New APE for the fight that is AMC , removed 
60,ocp8n7,t2_c8l0vemu,1625279616,/r/wallstreetbets/comments/ocp8n7/what_happened_to_the_internet/,1,What happened to the Internet ,Once a place of creative freedom now a corporate wasteland of mainstream social media I found some timelapse videos which show how old website designs evolved since 1996 and it s heartbreaking to see what we ve lost since then https youtube com c OldSchoolOdyssey https youtube com c OldSchoolOdyssey 
61,ocpdd1,t2_a1gg8jx6,1625280133,/r/wallstreetbets/comments/ocpdd1/nio_yolo/,1,Nio Yolo,
62,ocpdfj,t2_a5a3fc6c,1625280141,/r/wallstreetbets/comments/ocpdfj/luck_me_a_lady_next_week_f_it_luck_me_a_wish_next/,1,Luck me a lady next week f it Luck me a WISH next week,
63,ocpdk4,t2_8lapgfrm,1625280154,/r/wallstreetbets/comments/ocpdk4/large_delta_equity/,1,Large Delta Equity,Hi Does anyone know where to get the large Delta Equity trades info Thx amp x200B https preview redd it 5ot301uquw871 png width 454 amp format png amp auto webp amp s 71f0fff38b371cea9ee94f21632e2340c6edf8ac
64,ocpe6q,t2_4kb9scgp,1625280226,/r/wallstreetbets/comments/ocpe6q/evgoclii_150k_warrants_yolo_next_comparable_blink/,1,EVGO CLII 150k warrants Yolo Next comparable BLink trading at 40 EVGO to the ,
65,ocpf5t,t2_xqjjj,1625280337,/r/wallstreetbets/comments/ocpf5t/how_am_i_going_to_tell_me_wife_about_my_amc_loss/,1,How am I going to tell me wife about my AMC loss, amp x200B https preview redd it xakocfxzuw871 png width 1566 amp format png amp auto webp amp s e085a4f0d269539d7e0477f679ec2d0d1a3b0878 Oh wait I have an idea My wife s BF gave me some money amp x200B https preview redd it xdvobqi9vw871 png width 1546 amp format png amp auto webp amp s b1a37ac372b755a1e2b8694f164fac409649fbfa
66,ocpfa9,t2_58dhsvrl,1625280350,/r/wallstreetbets/comments/ocpfa9/didi_is_it_a_buy_or_a_sell/,1,DIDI is it a buy or a sell, removed 
67,ocpgh9,t2_c1d9t5yb,1625280484,/r/wallstreetbets/comments/ocpgh9/does_someone_wanna_give_me_some_crypt0/,1,does someone wanna give me some crypt0 , removed 
68,ocph3t,t2_d2u77fjy,1625280551,/r/wallstreetbets/comments/ocph3t/battery_power/,1,Battery Power, removed 
69,ocphby,t2_fm9lb,1625280578,/r/wallstreetbets/comments/ocphby/possible_shell_corporation_info_regarding_iceberg/,1,POSSIBLE SHELL CORPORATION INFO REGARDING ICEBERG RESEARCH,
70,ocpi88,t2_fm9lb,1625280677,/r/wallstreetbets/comments/ocpi88/possible_shell_corporation_info_regarding_iceberg/,1,POSSIBLE SHELL CORPORATION INFO REGARDING ICEBERG RESEARCH,
71,ocpihx,t2_65gtz,1625280707,/r/wallstreetbets/comments/ocpihx/two_free_stocks/,1,Two free stocks,
72,ocpk7o,t2_88fot4hy,1625280899,/r/wallstreetbets/comments/ocpk7o/who_the_fook_is_iceberg_lettuce/,1,Who the fook is Iceberg lettuce ,
73,ocpkdm,t2_d2u77fjy,1625280918,/r/wallstreetbets/comments/ocpkdm/battery_power/,1,Battery Power, removed 
74,ocpkn2,t2_3mmnrtdk,1625280950,/r/wallstreetbets/comments/ocpkn2/taxes_after_amc_capital_gains/,1,Taxes After AMC Capital Gains,What s good WSB Fam I know our AMC capital gains are going to put us in the highest tax brackets In Louisiana that s 37 federal taxes amp 6 state taxes Paying 43 in taxes seems unreal but it s the reality many of us will face So here s the question Will using a CPA or tax attorney make a difference Even if they can knock 1 or 2 off taxes that s a big win What are y all plans or course of action for handing these capital gain taxes 
75,ocplfz,t2_5f3mr7y6,1625281038,/r/wallstreetbets/comments/ocplfz/please_kill_me/,1,Please kill me,
76,ocpljm,t2_9ywdovbu,1625281050,/r/wallstreetbets/comments/ocpljm/how_do_i_short_amc/,1,How do I short AMC , removed 
77,ocpnqr,t2_xqjjj,1625281280,/r/wallstreetbets/comments/ocpnqr/how_am_i_going_to_tell_my_wife_about_my_amc_loss/,1,How am I going to tell my wife about my AMC loss ,
78,ocpocf,t2_58dhsvrl,1625281342,/r/wallstreetbets/comments/ocpocf/lets_talk_didi/,1,LETS TALK DIDI,Okay so I am fairly new to the stock market I have been trading for about 2 years I did some research and I bought in DIDI at 14 8 I need some feedback and advice so I thought what better place to go that our very own WSB I personally have a lot of faith in this stock although it being a Chinese company does make me worry It has a massive market much bigger than that of UBER and LYFT With that being said what do we think about DIDI Like I said I think DIDI is profitable and I m wanting to hold this stonk to the moon but I need advice from my fellow pea brains here Let s hear it I AM NOT ASKING FOR FINANCIAL ADVICE NOR AM I PROVIDING FINANCIAL ADVICE 
79,ocpp1c,t2_acrgpscl,1625281420,/r/wallstreetbets/comments/ocpp1c/underrated_stock_lkncy_easily_20_next_week/,1,Underrated stock LKNCY easily 20 next week, removed 
80,ocpr0t,t2_a30xgn4f,1625281646,/r/wallstreetbets/comments/ocpr0t/bringing_people_back_to_the_movies/,1,Bringing people back to the movies,
81,ocpr73,t2_134736,1625281665,/r/wallstreetbets/comments/ocpr73/aht_opportunity/,1,AHT Opportunity, removed 
82,ocpsm0,t2_58dhsvrl,1625281812,/r/wallstreetbets/comments/ocpsm0/lets_talk_didi/,1,LETS TALK DIDI,Okay so I am fairly new to the stock market I have been trading for about 2 years I did some research and I bought in DIDI at 14 8 I wanted to see what others had to say about DIDI so I thought what better place to go than our very own WSB I personally have a lot of faith in this stock although it being a Chinese company does make me worry It has a massive market much bigger than that of UBER and LYFT I think DIDI is profitable and I m wanting to hold this stonk to the moon but I am curious about what my fellow pea brains here have to say about DIDI Let s talk I AM NOT ASKING FOR FINANCIAL ADVICE NOR AM I PROVIDING FINANCIAL ADVICE THIS IS SIMPLY A DISCUSSION THREAD 
83,ocpsty,t2_a449a5la,1625281836,/r/wallstreetbets/comments/ocpsty/mrin_squeeze_must_read_dd_attributed_to/,1,Mrin squeeze must read Dd attributed to solarpannel2001,Why mrin is potentially going to be one of the biggest pure short squeeze plays DD DISCLAIMER This is a SUPER high risk play but its worth the gamble Only play with what you can lose amp x200B amp x200B https preview redd it au969hphiu871 png width 449 amp format png amp auto webp amp s 885c97580d67a088b7f493e996b26aaa82b0bad4 Short interest Mrin short interest is estimated to be 189 from ortex 18 68 million shares shorted of which only 9 65 million shares exist in float This is GME level short interest with an even SMALLER float You may be thinking well since mrin already had its run then most of the shorts are on the top right Yes that is true majority of this SI is around 5 to 18 dollars But look at the stock price now Its trending above 20 A whale is pumping the stock to squeeze these shorts amp x200B How many shorts have covered so far At the day of this DD only a mere 204k shorts have covered and infact an additional 108k shorts have been added How screwed are they https preview redd it mujmszcmju871 png width 491 amp format png amp auto webp amp s 2bdf21d0b4ab61ab97037467c2ca834aa37b497b Cost to borrow is 172 and they have maxed out short utilization Short utilization is the amount of shorts borrowed from the total available shorts they can lend from institutions A 100 percent means at any point an institution can recall back their shares and shorts have to cover Cost to borrow being an insane number of 172 means it costs a fortune to hold these shares each day they are in the red SHORTS HAVE NO AMMUNITION LEFT any attempts to short is now EXTREMELY COSTLY amp x200B amp x200B https preview redd it 2lca2e33ku871 png width 739 amp format png amp auto webp amp s b74ec72273db591979e90b6bff28fd9bec59ef39 61 66 of the freefloat is on LOAN with only 0 33 to days to cover on LOAN If the price stabilizes above 20 and beyond these guys would be bleeding massively amp x200B https preview redd it 63r9tjanku871 png width 858 amp format png amp auto webp amp s 4cd5e28096c5ac857319f4d63ed0815358a186ad mrin has no options aswell Bad for us cause we cant gamma squeeze But shorts can t HEDGE their SHORT as effectively On top of that they can t do any option resetting of FTDS etc This is a pure short squeeze play with no options meaning no gamma squeezing and no option short hiding Example of one of mrin shorts panic covering https preview redd it rvvzaexqnu871 png width 625 amp format png amp auto webp amp s 215c78d6c7ccd3f4b4e981958a3f43ff41316883 This is an example of a mrin short covering the totality of its short position immediately when it was 10 dollars Insane fast forward up Remember this was probably the shorts at less than 5 dollars Most of MRIN shorts right now the 18 million are below 19 dollars for which they are all UNDERWATER right now and BLEEDING So whats happening now Its very likely that multiple hedgefunds are pumping the stock to squeeze the shorts themselves I barely see any retail talking about this yet every mainstream news is attributing it to reddit Yet you look left and right of reddit and you barely see anyone talking about this So we don t have an insane retail hype like GME yet we are trading GME JAN volumes Th is is entirely big moby dicks trying to squeeze amp x200B Downside risk Listen this is a lottery ticket stock This thing has the potential to go to the 40s or higher If we had options this thing would skyrocket beyond gme amp x200B However its risky territory because we don t know how fast shorts can cover with high frequency trades or if the whale that is pumping the stock decides to let go Right now everything seems to fall in line though TLDR ALL SHORTS ARE IN THE RED ABOVE 20 SHORTS HAVE RUN OUT OF AMMUNITION TO DRIVE THE PRICE DOWN 2 times of the entirety of the float has to be covered They havent even started covering yet They have no options to hedge their short They will have to pay extremely high stock loan fees to continue holding their short positions BE WARNED play what with what you can afford to lose Since we have no options here there is no gamma squeeze play This can potentially go to 40 or go to 10 whatever maybe the case it s going to be an extremely volatile stock with 18 million shorts
84,ocptoc,t2_76zimapu,1625281933,/r/wallstreetbets/comments/ocptoc/dealers_choice/,1,Dealer s Choice ,
85,ocpub3,t2_xqjjj,1625282002,/r/wallstreetbets/comments/ocpub3/aapl_amzn_tsla_in_the_crockpot_for_6_years/,1,AAPL AMZN TSLA in the crockpot for 6 years,
86,ocpvlt,t2_7ex88,1625282139,/r/wallstreetbets/comments/ocpvlt/what_brokerage_to_use/,1,What brokerage to use ,I went to the FAQ section of WSB and under free brokerages it lists Robinhood as the 1 one to use I ve since started on Robinhood but I see a lot of members swearing that Robinhood is evil and no one should use it Should I continue using Robinhood like the FAQ suggests or maybe switch to something like Fidelity i see that recommended a lot 
87,ocpweu,t2_8lycu7oq,1625282231,/r/wallstreetbets/comments/ocpweu/awww/,1,Awww,
88,ocpwrp,t2_5gmyynkw,1625282270,/r/wallstreetbets/comments/ocpwrp/astr_on/,1, ASTR on , removed 
89,ocpxgd,t2_1ubb50h,1625282344,/r/wallstreetbets/comments/ocpxgd/robinhood_extracted_95_of_its_customers_options/,1,Robinhood extracted 9 5 of its customers options portfolio for itself,Matt Levine is a fun guy and he has a fun newsletter and its a lot of fun reading that newsletter over lunch Anyway this caught my eye today gt Robinhood s main business is convincing people to trade options and then having options market makers pay to take the other side of those trades Robinhood extracted 9 5 of the value of its customers options portfolio for itself in the first quarter 197 9 million of revenue on 2 billion of assets That s a lot Btw if you ll like to read more money stuff then you can get the content for free everyday in your mail by signing up here https link mail bloombergbusiness com click 24343300 261760 aHR0cDovL2xpbmsubWFpbC5ibG9vbWJlcmdidXNpbmVzcy5jb20vam9pbi80d20vbW9uZXlzdHVmZi1zaWdudXAmaGFzaD01NDIyMzAwMWNhM2ZmY2Y0MGYyNjI5YzI1YWNlYTY3YQ 606fa2f2ab6ee578ec26bf43B2df6f5be Disclaimer This is not financial advise I am not a financial advisor I have no affiliation to Bloomberg or Mr Levine I do follow him on twitter though 
90,ocpyq3,t2_94z9s7zd,1625282482,/r/wallstreetbets/comments/ocpyq3/dogecoins_time_has_arrived/,1,DOGECOINS TIME HAS ARRIVED, removed 
91,ocpzc2,t2_1iuyu853,1625282553,/r/wallstreetbets/comments/ocpzc2/scary_green_bird_with_a_gun_wants_me_to_go_all_in/,1,Scary Green Bird with a gun wants me to go all in,
