,postid,author,created_utc,permalink,score,title,selftext
4,oosajl,t2_ao4x7sbs,1626881555,/r/wallstreetbets/comments/oosajl/stonk/,1,Stonk,Fellow apes I am writing this post to suggest an impressive stock for your portfolios Outlook Therapeutics Inc OTLK is a late clinical stage biopharmaceutical company that focuses on developing and commercializing products for retinal problems The company is looking to develop the first FDA approved ophthalmic formulation of bevacizumab vikg for use in retinal indications The reason why this stock will be a winner in my opinion is the fact that it will address an important issue for patients PRICE The two current FDA approved solutions Lucentis EYLEA for wet AMD poor vision due to old age are priced at roughly 2 000 per injection 12 injections are needed for a treatment which is simply too expensive for most patients OTLK has identified this gap and is looking to fill it through its product ONS 5010 LYTENAVA If FDA approved I believe OTLK will be in a great position to capitalize on a 12 billion USD market Efficacy results for ONS 5010 LYTENAVA will be released in Q3 2021 right around the corner two safety studies have been conducted so far with great results The efficacy study is likely to yield great results as bevacizumab vikg the main substance in OTLK s product is already used for treatment of wet amd in an off label product called AVASTIN I advise all apes to look into this stock do their dd and consider happy to hear any viewpoints on this stock 
5,oosb2j,t2_6ieqvzet,1626881599,/r/wallstreetbets/comments/oosb2j/td_ameritrade_fraud_fuck/,1,Td ameritrade fraud fuck,d ameritrade fraud Well new update on my fraud investigation so to speak been in there for 7 months all I m trying to do is get my 954 20 back somewhere along the line I got hacked someone tried to deposit a large amount money into my account and then tried to cash it out i called td about and they locked down my account I went to my bank to get the charges reversed which I was successful doing in the time span of 7 months td said MY MONEY was included in the fraud they will no longer return my 954 20 first time trader got fucked
6,oosco6,t2_mozb5,1626881732,/r/wallstreetbets/comments/oosco6/loss_porn/,1,Loss porn,
7,ooscxd,t2_9640lfgg,1626881751,/r/wallstreetbets/comments/ooscxd/serious_just_started_have_no_idea_what_im_doing/,1, serious Just started have no idea what I m doing can anyone explain what this means ,
8,oose0h,t2_1s0qmm17,1626881841,/r/wallstreetbets/comments/oose0h/oncopeptides_most_shorted_stock_in_swedish_market/,1,Oncopeptides most shorted stock in swedish market,I do not own any shares in Oncopeptides but i used to do it so thats why i still have them on my watchlist Last week the FDA stopped Onco from reqruiting new patients to their study because of big diffrences something something in all the groups What happened The stock fell 30 and the sharks began to appear Almost every day since have a existing shark increased it shorting position or a new shark has started to short Today they increased again and now Onco is the most shorted stock in all swedish market I did not make this post to make Reddit go bananas but to ventilate my frustration how they didn t learn anything last time and still pushing the market as they see fit How can this type of trade be legal I really like the company but whats the point of buying now when 7 2 of all shares are controlled by the shorters and Will try to push it down as far as possible 
9,oosek7,t2_ao4x7sbs,1626881885,/r/wallstreetbets/comments/oosek7/stock/,1,Stock,Fellow apes I am writing this post to suggest an impressive stock for your portfolios Outlook Therapeutics Inc is a late clinical stage biopharmaceutical company that focuses on developing and commercializing products for retinal problems The company is looking to develop the first FDA approved ophthalmic formulation of bevacizumab vikg for use in retinal indications The reason why this stock will be a winner in my opinion is the fact that it will address an important issue for patients PRICE The two current FDA approved solutions Lucentis EYLEA for wet AMD poor vision due to old age are priced at roughly 2 000 per injection 12 injections are needed for a treatment which is simply too expensive for most patients Outlook Therapeutics Inc has identified this gap and is looking to fill it through its product ONS 5010 LYTENAVA If FDA approved I believe the company will be in a great position to capitalize on a 12 billion USD market Efficacy results for ONS 5010 LYTENAVA will be released in Q3 2021 right around the corner two safety studies have been conducted so far with great results The efficacy study is likely to yield great results as bevacizumab vikg the main substance in Outlook s product is already used for treatment of wet amd in an off label product called AVASTIN I advise all apes to look into this stock do their dd and consider happy to hear any viewpoints on this stock 
10,oosflb,t2_ct0m3h5n,1626881969,/r/wallstreetbets/comments/oosflb/looking_for_retards_to_build_algorithms/,1,Looking for Retards to build algorithms, removed 
11,oosg3m,t2_a45xhb89,1626882012,/r/wallstreetbets/comments/oosg3m/chembio_diagnostics_inc_cemi_stock_price_news/,1,Chembio Diagnostics Inc CEMI Stock Price News Quote amp History,
12,oosg78,t2_cx1u83xn,1626882020,/r/wallstreetbets/comments/oosg78/coupang_stock_price_movementmajor_short_squeeze/,1,COUPANG STOCK PRICE MOVEMENT MAJOR SHORT SQUEEZE POTENTIAL,Hey Retards I ve kept an eye on that dumb IPO Coupang since March and this stock price movement makes no sense at all I just looked at the stats this thing is heavily shorted only 10K available today with an over the top borrow rate was as high as 29 yesterday With all of the dumb shit you guys are peddling like GME and AMC with borrow rates of less than 1 why the hell is this not getting more pub This guy s DD goes way more in depth about what is going on This is a weird situation and needs to be discussed WAY MORE even the responses to this guy s post are weird and make no sense This sub isn t about long term investing it s about exploiting these idiots trying to naked short And don t come at me about the available share float either That s been under 200 million for the longest time and suddenly all sites are reporting it s over 500 million amp x200B Read it and buy shares so we can squeeze the shit out of this thing amp x200B https www reddit com r wallstreetbets comments obxboe cpng dd koreas amazon deeply shorted 500 shares https www reddit com r wallstreetbets comments obxboe cpng dd koreas amazon deeply shorted 500 shares 
13,oosi0x,t2_a0ciudk9,1626882172,/r/wallstreetbets/comments/oosi0x/the_outside_manipulation_on_this_one_is_so/,1,The outside manipulation on this one is so blatantly obvious It s ridiculous How do we let this interfere with the APES trying to rise WISH Go dig deep into these daily charts We can t let these NON APES win Rockets baby ROCKETS , removed 
14,oosip0,t2_aeyqg1qm,1626882225,/r/wallstreetbets/comments/oosip0/are_there_any_good_ressources_to_get_stock/,1,Are there any good ressources to get stock analysis , removed 
15,oosiz1,t2_8ll299oj,1626882250,/r/wallstreetbets/comments/oosiz1/dryworld_is_a_rare_opportunity_in_otc_you_dont/,1,Dryworld is a rare opportunity in OTC you don t want to miss, removed 
16,oosjo6,t2_95d36i0c,1626882304,/r/wallstreetbets/comments/oosjo6/car_go_vroom_vroom/,1, CAR go vroom vroom , Pricing through the roof EPS gonna be WAY up Capacity was removed due to COVID and the oligopoly HTZZ CAR Enterprise got a taste of sweet sweet pricing power for the very first time Unlikely they are eager to go back to the old way of fighting on price in the trenches when only 3 big players dominate the market They likely find big profits with reduced capacity better than little profits when they used to expand fleet rapidly only to see pricing weaken No one on Wall St expects any pricing power to last which partly why the opportunity exists CAR did 112mm rental days in the Americas in 2019 3 per day in pricing increase at 100 flow through would be an additional 3 60 EPS 112mm days 3 1 25 tax rate 70mm shares Historically they have charged 50 60 per day net revenue on rentals It s hard to find vehicles around the country for less than 80 day now If you see a 15 increase per day you are looking at 112mm days 15 1 25 tax rate 70mm shares or 18 EPS increase The operating leverage to pricing is massive here CAR did almost 60mm rental days in non Americas international in 2019 The market there has not seen as much volume growth off of the bottom as the US but should once delta recedes Similar episode of pricing power should play out in Europe with diminished fleet capacity CAR Chairman Hees been buying stock 8 5mm shares short and really only 37mm float Float is smaller than appears b c SRS has 26 stake and has had for long long time CAR and HTZZ have relatively new management teams so they may be more profit driven Uber jacking rates and showing spotty availability makes rental cars more attractive COVID Delta puts lid on likelihood of capacity expansion which elongates the pricing power of this cycle Street doesn t understand that the industry went through a massive change yet amp x200B RISKS managements prioritize fleet size over profitability game theory that one will start cutting price to capture volume market share and are able to secure fleet capacity from auto OEMs Currently long but may change mind and sell at any time Target 120 
17,oosk6z,t2_dfpu6pm6,1626882344,/r/wallstreetbets/comments/oosk6z/wter_is_cheap_now_load_up/,1,WTER is cheap now load up, removed 
18,ooskcd,t2_3nn807y3,1626882357,/r/wallstreetbets/comments/ooskcd/bloomberg_reporter_looking_to_talk_to_robinhood/,1,Bloomberg reporter looking to talk to Robinhood pre IPO investors,Hi everyone I m a reporter on the investing team at Bloomberg News and as part of our coverage of the upcoming Robinhood IPO I m looking to talk to people who have requested pre IPO shares on the app We re just looking to get a sense of why people are investing general sentiment what the game plan is for post IPO stock moves etc If you re interested in talking DM me or email me at ekrebs2 bloomberg net mailto ekrebs2 bloomberg net Thanks 
19,oosky3,t2_9y4k44in,1626882404,/r/wallstreetbets/comments/oosky3/amc_yolo_25k_lets_gooooo/,1,AMC YOLO 25k LETS GOOOOO ,
20,oosl3y,t2_a6jayaoz,1626882417,/r/wallstreetbets/comments/oosl3y/the_most_expensive_dnut_i_ever_bought/,1,The most expensive DNUT i ever bought ,
21,oosl6p,t2_31asb111,1626882422,/r/wallstreetbets/comments/oosl6p/nakd_what_are_the_thoughts_on_this/,1,NAKD What are the thoughts on this , removed 
22,ooslr9,t2_8gwxjwg1,1626882472,/r/wallstreetbets/comments/ooslr9/xpeng_breakout/,1,XPENG Breakout ,This is not financial advice I m gonna come back up here later and try to add more but I ve been watching NIO and XPENG for a bit now that s a lie I took a break to get into crypt zil a bit XPENG definitely caught my interest this week with their car production numbers all over the news With a high ADR and a 16 2 5 day change and and a recent uptick with tighter ADRs it looks to me like it might be a big breakout Not to long ago it was 90 share AMC has caused all eyes on the market again with many ppl diversifying they re new found wealth and their new car is less than 25k or the TESLA s new model Y it s hard for me to see alot of negatives Of course this is a high volatile stock has alot of upcoming competition and is already past the best time to buy at below 35 I m just an ape though
23,oosmbm,t2_9y4k44in,1626882519,/r/wallstreetbets/comments/oosmbm/amc_yolo_30k/,1,AMC YOLO 30k,
24,oosmv9,t2_ao4x7sbs,1626882568,/r/wallstreetbets/comments/oosmv9/fyi/,1,FYI,Fellow apes I am writing this post to suggest an impressive stock for your portfolios Outlook Therapeutics Inc is a late clinical stage biopharmaceutical company that focuses on developing and commercializing products for retinal problems The company is looking to develop the first FDA approved ophthalmic formulation of bevacizumab vikg for use in retinal indications The reason why this stock will be a winner in my opinion is the fact that it will address an important issue for patients PRICE The two current FDA approved solutions Lucentis EYLEA for wet AMD poor vision due to old age are priced at roughly 2 000 per injection 12 injections are needed for a treatment which is simply too expensive for most patients OTLK has identified this gap and is looking to fill it through its product ONS 5010 LYTENAVA If FDA approved I believe it will be in a great position to capitalize on a 12 billion USD market Efficacy results for ONS 5010 LYTENAVA will be released in Q3 2021 right around the corner two safety studies have been conducted so far with great results The efficacy study is likely to yield great results as bevacizumab vikg the main substance in Outlook s product is already used for treatment of wet amd in an off label product called AVASTIN I advise all apes to look into this stock do their dd and consider happy to hear any viewpoints on this stock 
25,oosn2q,t2_a0r2y9t5,1626882587,/r/wallstreetbets/comments/oosn2q/maps_short_interest_is_over_250_or_am_i_reading/,1,Maps short interest is over 250 or am I reading that wrong Seems kinda high what do you all think about this ,
26,oosok5,t2_270dfely,1626882712,/r/wallstreetbets/comments/oosok5/pacific_gas_and_electric_and_their_terrible_track/,1,Pacific Gas and Electric And their terrible track record This company shouldn t exist ,Hello folks I m not a financial advisor just a smooth brained idiot who is sick of smoke PG amp E PGC over the years has been a massive problem for California residents The company continues to increase rates and only pass the money onto their stock holders Little to no maintenance has been done on their power distribution network over the years in the name of cost cutting This has reached a tipping point over the last decade where their lack of maintenance has caused MANY deadly fires and loss of life Here are some of the bigger events picked out of HUNDREDS of incidents The San Bruno Gas Explosion Poor or no maintenance caused a massive gas leak in the city of San Bruno in 2010 leading to a massive explosion The Camp Fire This one ripped through northern California devastating the town of Paradise killing 85 people Once again a completely preventable fire if maintenance was kept up This fire was an absolute monster Burning at a rate of over a football field a minute CalFire could only gain control at the edge of Chico Words cannot explain how absolutely terrifying this fire was for everyone historically bad Now currently active is the Dixie fire Instead of making repairs to the grid PG amp E wanted to make stockholders happy and keep costs low More injured more homeless more liability The power grid they maintain is getting so bad that they re forced to shut off parts of California just to prevent disasters instead of doing maintenance Power reliability in California in PG amp E s service area is getting worse and worse Imagine losing your power when its 108 out imagine grandma s oxygen machine shutting down while she chokes on the thick smoke from the fires that the same company who shut off the power caused They need to be held liable or get bought out preferably switch to a public utility plan like the Sacramento area has SMUD who has been rock solid over the years With the absolute world of hell the state is about to unleash on Pacific Gas and Electric along with thousands of independent civil suits the 9 50 price seems drastically high No good will come of this company until it gets completely restructured from the ground up I ll be grabbing a short position when the time is right what are your thoughts 
27,oospng,t2_ao4x7sbs,1626882803,/r/wallstreetbets/comments/oospng/fyi/,1,FYI,Fellow apes I am writing this post to suggest an impressive stock for your portfolios Outlook Therapeutics Inc is a late clinical stage biopharmaceutical company that focuses on developing and commercializing products for retinal problems The company is looking to develop the first FDA approved ophthalmic formulation of bevacizumab vikg for use in retinal indications The reason why this stock will be a winner in my opinion is the fact that it will address an important issue for patients PRICE The two current FDA approved solutions Lucentis EYLEA for wet AMD poor vision due to old age are priced at roughly 2 000 per injection 12 injections are needed for a treatment which is simply too expensive for most patients Outlook has identified this gap and is looking to fill it through its product ONS 5010 LYTENAVA If FDA approved I believe Outlook will be in a great position to capitalize on a 12 billion USD market Efficacy results for ONS 5010 LYTENAVA will be released in Q3 2021 right around the corner two safety studies have been conducted so far with great results The efficacy study is likely to yield great results as bevacizumab vikg the main substance in Outlook s product is already used for treatment of wet amd in an off label product called AVASTIN I advise all apes to look into this stock do their dd and consider happy to hear any viewpoints on this stock 
28,oosqdx,t2_5wgdgzie,1626882871,/r/wallstreetbets/comments/oosqdx/derek_on_tiktok/,1,Derek on TikTok,
29,oossg9,t2_6jseoaxr,1626883043,/r/wallstreetbets/comments/oossg9/royal_bank_of_canada_buys_2_million_shares_in/,1,Royal Bank of Canada Buys 2 million shares in PLTR and 1 2 million of calls , removed 
30,oossh0,t2_a0pdqkvu,1626883044,/r/wallstreetbets/comments/oossh0/etrade_pro_allows_direct_to_nyse_no_dark_pools/,1,E TRADE Pro allows direct to NYSE NO DARK POOLS Only on Desk Top DD,
31,oostf4,t2_21kty5ss,1626883122,/r/wallstreetbets/comments/oostf4/senate_finance_committee_and_gay_bear_dark_money/,1,Senate Finance Committee and Gay Bear Dark Money,On May 26th 2021 the Senate Finance Committee hosted an Executive Session to consider Sen Wyden s Clean Energy for America Act Among other things this bill offers EV incentives During this process amendments are offered by any other Senator on the committee Amendment 80 Toomey 4 motioned to change the name of Sen Wyden s bill to Further Sending Tesla s Stock Price to the Moon Act The amendment did not pass Huge opportunity missed Contact your representatives It s not too late to affix an accurate title to this legislation Gay bear lobbyists are winning this battle but bull gang can win the war Amendments can be viewed here under Master Amendment List https www finance senate gov hearings open executive session to consider an original bill entitled the clean energy for america act
32,oostpw,t2_b198b70k,1626883148,/r/wallstreetbets/comments/oostpw/dow_jones_playing_the_gaps/,1,Dow Jones playing the gaps,The Dow Jones gapped down on Monday and then rebounded to the open on Tuesday Today sees a gap above the gap and that needs to hold for further upside My hunch is it s a bull trap Processing img tp5lss029lc71 
33,oosuv0,t2_a0r2y9t5,1626883229,/r/wallstreetbets/comments/oosuv0/maps_short_interest_is_at_287_this_seems_like/,1,MAPS short interest is at 287 this seems like news not being talked about to me Or I could just be retarded but that seems high ,
34,oosve8,t2_a9axfcey,1626883270,/r/wallstreetbets/comments/oosve8/yolo/,1,YOLO, removed 
35,oosw25,t2_7szoh9nw,1626883320,/r/wallstreetbets/comments/oosw25/nvda/,1,NVDA,
36,ooswkj,t2_4y4hogyi,1626883357,/r/wallstreetbets/comments/ooswkj/oatly_the_next_short_squeeze_candidate/,1,OATLY The next short squeeze candidate ,What do y all think Should we burn Spruce Point Capital They announced a short position last week I personally love Oatly s Oatmilk yum Ticker OTLY
37,oosxyg,t2_54dxhhx7,1626883462,/r/wallstreetbets/comments/oosxyg/thcb_just_consummated_into_mvst/,1,THCB just consummated into MVST, removed 
38,oosyak,t2_a0r2y9t5,1626883487,/r/wallstreetbets/comments/oosyak/short_interest_in_maps_is_at_287_this_seems_like/,1,Short interest in MAPS is at 287 this seems like news to me but I could just be retarded , removed 
39,oosyer,t2_cidnml3d,1626883497,/r/wallstreetbets/comments/oosyer/what_are_the_perfect_conditions_for_a_squeeze/,1,What are the perfect conditions for a squeeze ,I bought a stock which I doesn t meet WSB criteria so I won t bother naming and it s up 200 one day up AH up PM and up 150 today Throughout this time period there have been multiple posts of pump and dump and blah blah blah But tons of short positions have been opened up during this time period too so wouldn t that create the required conditions for a squeeze if the price kept rising 
40,oosyxd,t2_a5r20i7d,1626883538,/r/wallstreetbets/comments/oosyxd/lazr_luminar_squeeze_time/,1, lazr Luminar squeeze time , removed 
41,ooszu7,t2_v5xmhce,1626883614,/r/wallstreetbets/comments/ooszu7/my_thermostat_knows_what_must_be_done_we_hold/,1,My Thermostat knows what must be done We Hold ,
42,oot0iy,t2_2mz39ohj,1626883672,/r/wallstreetbets/comments/oot0iy/mnmd_is_researching_mushrooms_next_millionaire/,1,MNMD is researching mushrooms next millionaire maker pick ,Huge MNMD fan here I like mushrooms a lot actually and here s why you should to A weakened morale state post Covid we are all in Sexy science people who work at MNMD figure out a way to make everyone happy with mushroom pills Depression ends no more sad people means a more productive and happy society environment etc I like these guys cause they ve had the shark tank Kevin O Leary guy swimming in the bloody waters with them All jokes aside this is a long term hold for me as I see it a long term gem starting its own sub genre if you will in bio therapeutics 
43,oot0l3,t2_4y4hogyi,1626883677,/r/wallstreetbets/comments/oot0l3/oatly_should_we_screw_over_the_shorts_and_the/,1,OATLY Should we screw over the shorts and the milk industry at the same time , What do y all think Should we burn Spruce Point Capital They announced a short position last week I personally love Oatly s Oatmilk yum Here s the news on it https www cnbc com 2021 07 14 oatly accused of overstating revenue and greenwashing by activist short spruce point html https www cnbc com 2021 07 14 oatly accused of overstating revenue and greenwashing by activist short spruce point html Maybe the Milk Industry has something to do with this Let s screw them too Ticker OTLY
44,oot1vx,t2_57etbdnb,1626883778,/r/wallstreetbets/comments/oot1vx/my_monthly_pl_looks_like_a_weiner/,1,My monthly P amp L looks like a weiner ,
45,oot20l,t2_a119fmat,1626883789,/r/wallstreetbets/comments/oot20l/interesting_article_on_srne/,1,Interesting article on SRNE ,
46,oot2l9,t2_518ioacv,1626883834,/r/wallstreetbets/comments/oot2l9/alright_boys_the_king_is_back_ive_been_away_for_a/,1,ALRIGHT BOYS THE KING IS BACK IVE BEEN AWAY FOR A WHILE WORKING UP NORTH IN THE OIL SANDS OF ALBERTA BUT IM BACK AND STRAPPED WITH TONS OF CASH I DONT GIVE A FUCK LETS TAKE THESE WALLSTREET ASSHOLES TO THE GRAVE , removed 
47,oot42u,t2_bpvv0mwq,1626883952,/r/wallstreetbets/comments/oot42u/yo/,1,yo,
48,oot5c9,t2_a5r20i7d,1626884051,/r/wallstreetbets/comments/oot5c9/lazr_luminar_hit_that_squeeze_button/,1, lazr Luminar hit that squeeze button ,
49,oot5pe,t2_5hyt7071,1626884079,/r/wallstreetbets/comments/oot5pe/how_do_i_get_started/,1,How do I get started ,Can you give me some tips on things I need to do in order to take these risks like what are some ways to go for huge gains 
50,oot6f3,t2_a0sj9hyu,1626884135,/r/wallstreetbets/comments/oot6f3/down_to_the_last_of_my_settlement_from_my/,1,Down to the last of my settlement from my motorcycle accident last year YOLO d it all on NVIDIA Let s go ,
51,oot6nd,t2_9fq3kp85,1626884154,/r/wallstreetbets/comments/oot6nd/crsr_power_play/,1,CRSR power play, removed 
