,postid,author,created_utc,permalink,score,title,selftext
27,od4ypn,t2_apwffep9,1625341557,/r/wallstreetbets/comments/od4ypn/can_someone_explain_this_sub_to_me/,1,Can someone explain this sub to me,Hi I recently found this sub and I don t fully understand what it is about and what you do in it so if someone could explain that would be helpful thanks
28,od4z50,t2_awum2rwf,1625341598,/r/wallstreetbets/comments/od4z50/rip/,1,R I P, removed 
29,od4zin,t2_bd8lgtlv,1625341636,/r/wallstreetbets/comments/od4zin/together_and_organized_we_can_do_it/,1,TOGETHER and ORGANIZED we can do it ,Hundreds of people were trapped in CLOV Time to raise the price of CLOV We have shown that TOGETHER and ORGANIZED we can do it 
30,od4zwg,t2_ceyi9tnt,1625341670,/r/wallstreetbets/comments/od4zwg/still_hodling_have_a_happy_4th_of_july_weekend/,1,Still hodling have a happy 4th of July weekend ,
31,od4zxo,t2_5q02y80,1625341673,/r/wallstreetbets/comments/od4zxo/royal_caribbean_makes_highly_anticipated_us_return/,1,Royal Caribbean Makes Highly Anticipated US Return,
32,od50zr,t2_a2zth9lj,1625341771,/r/wallstreetbets/comments/od50zr/buy_and_hold_clov_only_way_to_teach_another/,1,Buy and hold CLOV only way to teach another lesson to hedgies who are pushing a great stock down to make money out of us apes I am all in with 1 M of my portfolio who else is with me ,
33,od51ig,t2_i716f,1625341817,/r/wallstreetbets/comments/od51ig/guys_the_bofa_joke_totally_didnt_get_me/,1,Guys the BofA joke totally didn t get me,I 100 did not get tricked go on the discord and get called a White name Not a chance I knew better than to believe everything I read on the interwebs Not getting anything past this guy They don t call me 2 pump chump cause I get tricked easily Not a chance I fell for it No way no how Show of hands from anyone who was tricked and therefore waaaaaaay dumber than I am I know you re all out there please report to the dumbass line where I totally am not standing Cramer is there though and he wants to know what the next play is 
34,od521a,t2_a2zth9lj,1625341865,/r/wallstreetbets/comments/od521a/buy_and_hold_clov_only_way_to_teach_another/,1,Buy and hold CLOV only way to teach another lesson to hedgies who are pushing a great stock down to make money out of us apes I am all in with 1 M of my portfolio who else is with me, removed 
35,od5272,t2_cux76tg7,1625341881,/r/wallstreetbets/comments/od5272/codere_spanish_stock/,1,Codere spanish stock, removed 
36,od528a,t2_95nt4ukm,1625341883,/r/wallstreetbets/comments/od528a/has_anyone_seen_bofa_lately/,1,Has anyone seen BofA lately ,
37,od53ku,t2_cux76tg7,1625342018,/r/wallstreetbets/comments/od53ku/codere_spanish_stock_need_short_squeeze/,1,Codere spanish stock need short squeeze, removed 
38,od53sx,t2_cwq5b0bb,1625342041,/r/wallstreetbets/comments/od53sx/a_20000_27000_yolo_with_potential/,1,A 20 000 27 000 yolo with potential,
39,od54do,t2_11if5c,1625342096,/r/wallstreetbets/comments/od54do/found_one_of_you_retards_in_the_wild/,1,Found one of you retards in the wild ,
40,od54x5,t2_12e9jz8o,1625342147,/r/wallstreetbets/comments/od54x5/live_footage_of_wsb_mods_ruining_a_meme_sub_on_a/,1,Live footage of WSB mods ruining a meme sub on a long weekend by closing it for 2 hours,
41,od55f1,t2_7f7mrgth,1625342196,/r/wallstreetbets/comments/od55f1/negg_infographic/,1, NEGG infographic,
42,od56ah,t2_90kj5,1625342281,/r/wallstreetbets/comments/od56ah/i_have_122_gme_shares_and_will_buy_more_with/,1,I have 122 GME shares and will buy more with every paycheck from my BOfA account , removed 
43,od56ic,t2_7dnixixm,1625342303,/r/wallstreetbets/comments/od56ic/worried_about_clov_lockup/,1,Worried about Clov Lockup ,I m not I expect it to be a volatile week but even if the price drops I d expect it to rebound quickly Firstly there s no stock dilution occurring Secondly demand is extremely high All shares held in lockup aren t going to sold all at once and many shares won t be sold at all After achieving meme status I d expect that many holding those shares would be hesitant to sell at current prices If the price drops I m doubling down This is not financial advice Sometime I eat crayons The green ones tastes like vegetables 
44,od57yd,t2_11if5c,1625342430,/r/wallstreetbets/comments/od57yd/found_one_of_you_apes_in_the_wild/,1,Found one of you apes in the wild,
45,od58s3,t2_6cg2k5fc,1625342505,/r/wallstreetbets/comments/od58s3/i_need_your_help_shiba_inu_help/,1,I need your help shiba inu help, removed 
46,od599u,t2_n296r,1625342551,/r/wallstreetbets/comments/od599u/apes_are_vegans_so_lets_grow_fruits_and_veggies/,1,Apes are vegans so let s grow fruits and veggies Especially the kind that can be made into tendie sauce ,I am a substitute PE teacher who just finished googling this shit so do not take this as financial advice I m excited about this sexy fucking company though and I ll try my best to tell you why This is APPHARVEST short for Appalachian Harvest APPH has such an amazing mission that I wish I had more money to throw into it because I believe in it so much I m at just under 8k and the only other stock I have right now is 1 share of GME I ll upload proof if needed but idk if it matters Chase app doesn t let me screenshot or I would have already Put simply APPH is a vegetable farm that uses giant greenhouses to grow in weather and nutrient controlled hydroponics instead of using dirt That s kind of a big deal since soil is so depleted of minerals nowadays right now people eat more fruits and vegetables than ever in recorded history but still get less micronutrients from those fruits and vegetables than ever too APPH is based in the hills of the Appalachian mountains in the US their giant facility is capable of delivering produce to the US population faster than companies outside of the US most of tomatoes are from outside the US and tomatoes are currently what their biggest facility grows They re working on getting this tomato greenhouse running at the same time as a cucumber greenhouse and a green leafy veg greenhouse APPH doesn t use pesticides stuff to kill pests which is great because the US insect population on farms is down over 90 since the 1990 s due to these pesticides this is an absolutely insane critical issue that is being ignored by the media and public Farms make up a lot of our open land Think about your last road trip how many times did you have to wash your windshield from bugs none Yep but even in the 90 s you d need to wash at every damn gas station or you literally couldn t see It s almost like mass extinction of insects is actually mass extinction of insects crazy right Instead APPH uses bugs like lady bugs to control the pests that would eat the crops Speaking of the crops they stack these babies to save space the equivalent production to 1 800 000 acres of dirty farming is condensed down to their 60 000 acre greenhouse with 6 plants high of stacks and 5 time the amount of crop yield per plant That s 30 times the yield Plus they have year round growing since the weather is controlled it s like Central America climate without all the El Ninos and my wife s rich sexy Columbian boyfriends Not only do they require 30x less space they also use 90 less water than dirty farms because they recycle rain water for their crops so I m assuming rain generally only makes up 10 of a dirt farms water needs on average and it s 100 for APPH Maybe that s how that math works Again I have no clue what I m talking about so you should probably just ignore this entire post You know what you shouldn t ignore though They use AI robots on a rail system to pick the crops No cheap labor no unions no pay hikes no training people what to pick and what not to pick no human contamination no worries I think the company they bought in their recent merger owned the AI so now they own it Not positive what happened my brain is almost smooth as APPH s perfectly ripe tomatoes Tomatoes that are grown up in the mountains of America unlike most tomatoes why does it matter Freshness shipping costs both economical and ecological and sex appeal of course If you re going to a party identifying as a bottle of ketchup cross dressing then you want to stuff your ape bra with only the sexiest tomatoes of course Remember I said the greenhouses are weather controlled Well hopefully this isn t an imminent disaster but climate change is a bitch and it s only a matter of time the Pacific heatwave this year is probably just the start of the major issues we re bound to see in the near future Crops don t do well with extreme temperatures or sharknados so what happens when a ton of dirty crops spoil Greenhouse farming to the rescue APPH is from what I know which isn t much the biggest of these farm types Did you know that the US has been water seeding clouds since WW2 to control our crop air temperatures reduce hail and increase rain fall They ve been using silver iodide a substance that depletes the royal FUCK out of our ozone layer You know what sucks about that Everything If you eat from dirty farms you re supporting silver iodide and you re a fullturd milksop This isn t financial advice but it remains a fact that if you re not supporting APPH you re a horrible person just consider yourself a water wasting bad weather loving blanched dirt using bug hating cheap labor supporting unfresh tomato eating plant hater Another cool thing is that they have warrants available APPHW The W means warrants and for 11 50 you can turn the warrants into the real ticker What s cool about this If APPH goes up 5 that s only about 33 on the main ticker but if you re all in on APPHW then that s about 100 Now I ve read that warrants bring the average share price down because it s effectively doubling the available supply well that s supposed to mean something to me I guess but whatever because they ll expire eventually and then the stock will cum even more buckets of cucumber sauce on your tendies 
47,od5aab,t2_55ruwf3f,1625342648,/r/wallstreetbets/comments/od5aab/nio_uxin/,1,NIO UXIN ,
48,od5ad6,t2_7wpljjf1,1625342655,/r/wallstreetbets/comments/od5ad6/only_investing_i_know/,1,Only investing I know,
49,od5bzw,t2_a2ld7qgr,1625342814,/r/wallstreetbets/comments/od5bzw/workhorse_to_the_moon_hodl_if_this_gets_removed/,1,Workhorse to the moon HODL If this gets removed then it only proves my point , removed 
50,od5dpv,t2_7f7mrgth,1625342983,/r/wallstreetbets/comments/od5dpv/negg_infographic/,1, NEGG Infographic,
51,od5dvf,t2_8u0at,1625342996,/r/wallstreetbets/comments/od5dvf/explained_my_retardedness_to_get_access_after/,1,Explained my retardedness to get access after going private Heres my retardedness,
52,od5dzz,t2_a7kysylr,1625343008,/r/wallstreetbets/comments/od5dzz/im_not_invited_this_is_odd/,1,I m not invited This is odd, removed 
53,od5e9y,t2_bvf8jrv9,1625343031,/r/wallstreetbets/comments/od5e9y/bofa_ruin_everything/,1,BofA ruin everything ,
54,od5enf,t2_a148htt3,1625343066,/r/wallstreetbets/comments/od5enf/inactive_options_why_does_my_call_option_say/,1,Inactive options Why does my call option say inactive, removed 
55,od5f65,t2_a3z5qjps,1625343118,/r/wallstreetbets/comments/od5f65/baby_ass/,1,Baby Ass, removed 
56,od5gop,t2_7ut3cngp,1625343265,/r/wallstreetbets/comments/od5gop/jnj_calls_until_earnings_gg_eazy/,1,JNJ calls until earnings GG eazy,
57,od5gvr,t2_7843hs,1625343282,/r/wallstreetbets/comments/od5gvr/keep_calm_and_hodl_on/,1,Keep calm and HODL on,
58,od5i15,t2_582hqpz0,1625343389,/r/wallstreetbets/comments/od5i15/which_trading_app_is_the_best/,1,Which trading app is the best , removed 
59,od5ial,t2_9oee823v,1625343415,/r/wallstreetbets/comments/od5ial/just_returned_from_a_social_media_break_where_is/,1,Just returned from a social media break Where is all the AMC amp GME posts , removed 
60,od5ikq,t2_cw3y6lw4,1625343442,/r/wallstreetbets/comments/od5ikq/singularitynet_bulls_immediately_watch_this_video/,1,SingularityNet BULL s IMMEDIATELY watch this video , removed 
61,od5j89,t2_d73iu,1625343503,/r/wallstreetbets/comments/od5j89/breaking_vladimir_putins_recent_comments/,1, BREAKING Vladimir Putin s recent comments regarding WSB, removed 
62,od5jq7,t2_1ncwbx8v,1625343551,/r/wallstreetbets/comments/od5jq7/retard_is_a_neurodivergent_slur_stop_saying_it/,1,Retard is a neurodivergent slur Stop saying it , removed 
63,od5kge,t2_cfb1k37t,1625343618,/r/wallstreetbets/comments/od5kge/how_do_i_get_my_wife_back_from_her_boyfriend/,1,How do I get my wife back from her boyfriend,
64,od5lts,t2_2pk9pt1l,1625343749,/r/wallstreetbets/comments/od5lts/i_havent_seen_this_meme_material_being_used/,1,I haven t seen this meme material being used before let s see what we can come up with , https www youtube com watch v gLioVxi EbE amp t 922s https www youtube com watch v gLioVxi EbE amp t 922s 
65,od5m7t,t2_4yntdnjy,1625343787,/r/wallstreetbets/comments/od5m7t/unpopular_opinion_vlad_is_going_to_impale_your/,1,Unpopular Opinion Vlad is going to impale your puts and short positions with a giant green candlestick after IPO , I ve seen so much negative sentiment about the coming HOOD IPO which leads me to believe it will do the complete opposite in two different scenarios Thesis 1 Robinhood has a free money printer that will work as follows 1 When options start trading on HOOD everyone angry at Robinhood starts buying a bunch of puts ON THE ROBINHOOD APP 2 Guess who s selling writing those contracts Citadel 3 Service outage Your premium gets crushed while you sit there unable to close out your position Thesis 2 There will be enough people angry at Robinhood that will open short positions that will cause the real MOASS There is no lockup period for people who already own shares so there will be a dip at IPO which will lead more people to open short positions because they ll think it s gonna get crushed The reversal will be epic Positions Calls and Puts when available 
66,od5men,t2_6bbgnull,1625343803,/r/wallstreetbets/comments/od5men/this_is_dreamy_and_really_impressive_yes_respect/,1,This is dreamy and really impressive Yes respect Apes have dignity and will soon ,
67,od5mgw,t2_d73iu,1625343809,/r/wallstreetbets/comments/od5mgw/breaking_vladimir_putins_recent_comments/,1, BREAKING Vladimir Putin s recent comments regarding Bank of America, removed 
68,od5n3e,t2_1ncwbx8v,1625343869,/r/wallstreetbets/comments/od5n3e/this_sub_is_filled_with_neurodivergent_slurs_and/,1,This sub is filled with neurodivergent slurs and it makes me sick , removed 
69,od5nez,t2_a87ipcdq,1625343901,/r/wallstreetbets/comments/od5nez/krypto_com_changed_spelling/,1,Krypto com Changed spelling , removed 
70,od5ogs,t2_91hm84oa,1625343997,/r/wallstreetbets/comments/od5ogs/negg_new_amc/,1,Negg new amc , removed 
71,od5pb8,t2_738lehlg,1625344082,/r/wallstreetbets/comments/od5pb8/hiti/,1,HITI , removed 
72,od5pfi,,1625344093,/r/wallstreetbets/comments/od5pfi/bofa_is_everywhere/,1,BofA is everywhere , deleted 
73,od5q05,t2_a0s7jdfj,1625344150,/r/wallstreetbets/comments/od5q05/heres_how_it_all_started_for_me/,1,Here s how it all started for me ,
74,od5qu5,t2_bvf8jrv9,1625344227,/r/wallstreetbets/comments/od5qu5/bofa_is_everywhere/,1,BofA is everywhere ,
75,od5r33,t2_d36mec3j,1625344250,/r/wallstreetbets/comments/od5r33/subreddit_bofa_joke_explained/,1,Subreddit BofA joke explained,
76,od5roc,t2_9zrn9wsb,1625344307,/r/wallstreetbets/comments/od5roc/nok_yolo_been_speculating_a_spacex_connection/,1, NOK YOLO BEEN SPECULATING A SPACEX CONNECTION ,
77,od5sb2,t2_12io71q6,1625344366,/r/wallstreetbets/comments/od5sb2/bac_puts_anyone/,1, BAC puts anyone ,
78,od5syc,t2_8lyfq0py,1625344424,/r/wallstreetbets/comments/od5syc/youre_assholes/,1,You re assholes, removed 
79,od5tuz,t2_lsma20a,1625344509,/r/wallstreetbets/comments/od5tuz/is_takashikotegawacom_website_legit/,1,Is TakashiKotegawa com website legit , removed 
80,od5v5i,t2_lsma20a,1625344628,/r/wallstreetbets/comments/od5v5i/is_takashikotegawacom_website_legit/,1,Is TakashiKotegawa com website legit , I came across this website TakashiKotegawa com https takashikotegawa com and I came across the investment packages on that website Can someone please tell me whether that website is legit The investment packages on that website promise guaranteed returns every day Is that true Have any of you guys bought that package 
81,od5vc4,t2_a1p7ls78,1625344645,/r/wallstreetbets/comments/od5vc4/which_stock_do_you_think_will_be_next_one_with_a/,1,Which stock do you think will be next one with a spike ,Some of the stocks already gone up like GME AMC and some are in the queue like Wish Clov and express Marin Software about to spike high So question is which one will be next one 
82,od5xng,t2_7s6pj,1625344859,/r/wallstreetbets/comments/od5xng/can_we_make_this_our_new_mascot/,1,Can we make this our new mascot ,
83,od5xsi,t2_auo4pvnh,1625344872,/r/wallstreetbets/comments/od5xsi/leaked_injunction_against_wsb_mods_by_bofa/,1, LEAKED Injunction against WSB mods by BOFA ,
84,od5yor,t2_3i5uya5w,1625344955,/r/wallstreetbets/comments/od5yor/bac_gang_know_your_enemy/,1,BAC Gang KNOW YOUR ENEMY, removed 
85,od5zs0,t2_a139m3er,1625345057,/r/wallstreetbets/comments/od5zs0/imagine_being_this_butthurt_over_a_prank_that_you/,1,Imagine being this butthurt over a prank that you take to other subs and cry about the mods Why are people such snowflakes,
86,od5zue,t2_44jqzitq,1625345062,/r/wallstreetbets/comments/od5zue/robinhood_warns_in_ipo_filing_it_could_become_a/,1,Robinhood warns in IPO filing it could become a meme stock,
87,od60ed,t2_5y11xta1,1625345115,/r/wallstreetbets/comments/od60ed/retards_stop_with_the_bofa_crap_and_look_at_body/,1,Retards stop with the BofA crap and look at BODY options, removed 
88,od60j6,t2_clpob7fa,1625345129,/r/wallstreetbets/comments/od60j6/i_missed_you_degenerates_that_flash_crash_hit_my/,1,I missed you degenerates That flash crash hit my emotions harder than Bill Hwang , removed 
89,od612v,t2_9zrn9wsb,1625345180,/r/wallstreetbets/comments/od612v/82k_to_10k_youre_suppose_to_wait_till_expiration/,1, 82k to 10k You re suppose to wait till expiration to sell right ,
90,od619u,t2_7v80w8hd,1625345198,/r/wallstreetbets/comments/od619u/before_and_after_gbpusd/,1,Before and after gbpusd,
91,od61z8,t2_73sj63ly,1625345264,/r/wallstreetbets/comments/od61z8/the_end_of_financial_piracy/,1,The End of Financial Piracy,
92,od62a5,t2_1986seq2,1625345293,/r/wallstreetbets/comments/od62a5/tops/,1,TOPS,TOP Shipping company For years this company has been the bottom of the barrel but that could change in the next couple months For years all they did was reverse split and issue more shares Then in August of 2020 the CEO announced that they would not only be doing a share buyback within the next year but would also be shareholder friendly To date they have not done the buyback and a year is closing in A quick check of short interest shows that they re 220 shorted One drop of news could catch everyone off guard With half the float of GME and the idea that a shady company wants to be shareholder friendly has me scratching my head wondering when a pump will occur 
93,od62cd,t2_a139m3er,1625345300,/r/wallstreetbets/comments/od62cd/imagine_being_so_butthurt_by_a_joke_that_you_take/,1,Imagine being so butthurt by a joke that you take to other subs and cry about it Why does everyone have to be snowflakes,
94,od63bx,t2_a139m3er,1625345392,/r/wallstreetbets/comments/od63bx/imagine_being_this_butthurt_over_a_joke/,1,Imagine being this butthurt over a joke,
95,od63t5,t2_a1b27qe0,1625345438,/r/wallstreetbets/comments/od63t5/guys_lets_make_reddit_our_social_media_platform/,1,Guys let s make Reddit our social media platform and boycott facebook Trump also hate Facebook since he was banned So let s put our part too mark zukerberg boycott facebook , removed 
96,od63za,t2_8fxmkvyu,1625345454,/r/wallstreetbets/comments/od63za/clf_is_bussin_heres_why_dd_written_for_smooth/,1,CLF is bussin here s why DD written for smooth brains ,CLF DD Reading level 5th grade Reading time 3 minutes I hope I enjoy writing DD and as I also want to become an approved user heres some on CLF skip to bottom for summary Why not start with the people that are actual analysts Currently trading at 22 37 Ratings Blogger opinions Zacksresearch strong buy stockinvest buy Marketbeat sell yahoo finance buy motelyfool strong buy Td Ameritrade analysts These are just the one TD offers Research team hold CFRA Strong buy 5 stars The street hold Market edge buy long Ford Equity research buy 2 Average buy rating and average price target of 28 29 and high price target of 39 Now let s see some positive fundamentals Last year was an acquisitive year for the steelmaker Its purchase of AK Steel in March followed by its absorption of ArcelorMittal in December made Cleveland Cliffs the largest producer of flat rolled steel in North America giving it combined revenue of 5 35 billion in 2020 more than double the 2 billion it produced in 2019 That puts it just ahead of No 2 Nucor NYSE NUE with its 5 26 billion in annual revenue Fool Cleveland Cliffs is also the largest U S supplier of high margin steel for the automotive industry which represented 33 of first quarter revenue or 1 3 billion year over year revenue up 1 027 Net income up 175 Diluted EPS up 138 Net profit margin up 106 Operating income up 864 Net change in cash up 98 Cash on hand down 41 Cost of revenue up 956 So I think fundamentals look pretty snazzy Plus EV Autos are the steelmaker s primary focus and both internal combustion and electric vehicles EVs have incorporated steel into their development More EV charging stations and potential subsidies for EVs themselves could help increase sales allowing Cleveland Cliffs to make up even more in volume With the ever expanding EV market I am very excited So with some quick quantitative analysis this looks good On a qualitative side the CEO just won the best steel maker award So the people in the company seem pretty solid Technical analysis Looking at the 1 year chart it s an obvious buy signal Since late February CLF has been trading in increments of about 5 dollars It went from 2 25 3 31 13 17 4 21 5 11 16 5 21 5 21 6 11 18 24 4 6 18 20 2 You see the pattern here everytime the swing has gotten higher It went from 3 4 5 6 4 Who to say this one CANT be a 8 dollar swing go all the way to 28 2 That s not bad right Honestly this is a solid company with solid potential to grow even bigger and a great time to buy in Disclaimer I m holding 12 778 shares and am swing trading the stock Summary Well this is some pretty short and simple DD so if you didn t read the whole thing what the fuck you lazy shit However as promised average consensus is a strong buy rating with an average price target of 28 29 Fundamentals are strong all up up at least 100 year over year except cash on hand which is down 41 Good potential growth with the emerging EV market Technical analysis is great and my price target within the next 2 weeks is 28 2 That s about it Ok Also buy CLF
97,od648i,t2_9uozrnn7,1625345480,/r/wallstreetbets/comments/od648i/american_the_motion_picture_knows/,1,American the motion picture knows ,
98,od64m3,t2_clpob7fa,1625345515,/r/wallstreetbets/comments/od64m3/coming_back_to_wsb_after_it_went_dark_never_been/,1,Coming back to WSB after it went dark Never been so alone in my entire life You guys hit me harder than Bill Hwang or an oreo coming out to body slam the market I hate that I love you guys Congrats and fuck you degenerates ,
99,od64xf,t2_79ebwpmc,1625345545,/r/wallstreetbets/comments/od64xf/seen_in_downtown_cincinnati/,1,Seen in Downtown Cincinnati ,
0,od64xf,t2_79ebwpmc,1625345545,/r/wallstreetbets/comments/od64xf/seen_in_downtown_cincinnati/,1,Seen in Downtown Cincinnati ,
1,od6508,t2_9uozrnn7,1625345553,/r/wallstreetbets/comments/od6508/america_the_motion_picture/,1,America the motion picture ,
2,od65qz,t2_clpob7fa,1625345626,/r/wallstreetbets/comments/od65qz/coming_back_to_wsb_after_it_went_dark_never_been/,1,Coming back to WSB after it went dark Never been so alone in my entire life You guys hit me harder than Bill Hwang or an oreo coming out to body slam the market I hate that I love you guys Congrats and fuck you degenerates And fuck automod for making me post this 3 times ,
3,od67cb,t2_cctcf831,1625345779,/r/wallstreetbets/comments/od67cb/who_is_iceberg_research_and_what_is_their_real/,1,Who is Iceberg Research and what is their real agenda ,Iceberg Research who are they According to their website Iceberg Research identifies substantial earnings misrepresentation and accounting irregularities in financial statements issued by public companies They say this is what they do however they use this research to apparently drive down prices while shorting companies and reaping profits Are they our fir the better good or just their bottom line 
4,od68iy,t2_79ebwpmc,1625345892,/r/wallstreetbets/comments/od68iy/the_autists_have_infiltrated_downtown_cincinnati/,1,The autists have infiltrated Downtown Cincinnati,
5,od690h,t2_b57xlfoy,1625345940,/r/wallstreetbets/comments/od690h/one_word_darkplus_nuff_sed/,1,One word Darkplus nuff sed, removed 
6,od6apg,t2_1zn5jf9,1625346090,/r/wallstreetbets/comments/od6apg/gray_easy_pictures_dd/,1, GRAY easy pictures DD,
7,od6c5i,t2_d1z5zpsc,1625346224,/r/wallstreetbets/comments/od6c5i/arry_dd_a_23x_potential_stock/,1, ARRY DD A 2 3x Potential Stock , removed 
8,od6dfy,t2_a06wuf4d,1625346350,/r/wallstreetbets/comments/od6dfy/scyx_eyeing_600m_in_peak_sales_scynexis_preps/,1,SCYX Eyeing 600M in peak sales Scynexis preps ambitious launch for antifungal Brexafemme,
